557.11,803.82,562.09,812.67,"/F8",9.96,"3"
55.05,778.11,297.89,786.07,"/F19",8.97,"POSUERE PROIN ET PURUS TACITI CONGUE."
63.96,751.76,298.87,760.61,"/F8",9.96,"Lacinia augue odio est per. Blandit netus. Dapibus"
54.00,739.81,298.86,748.65,"/F8",9.96,"massa elit dis mi nostra nibh condimentum et. Inte-"
54.00,727.85,298.82,736.70,"/F8",9.96,"ger curae nibh ad consectetuer sollicitudin sodales primis"
54.00,715.90,76.69,724.74,"/F8",9.96,"urna."
88.88,715.90,298.82,724.74,"/F8",9.96,"Quisque felis nisi a nunc in sollicitudin cras."
54.00,703.94,298.84,712.79,"/F8",9.96,"Dapibus fusce. Sodales donec. Vivamus vitae. Pretium"
54.00,691.99,298.81,700.83,"/F8",9.96,"purus parturient ut aptent eu nam scelerisque. Dapibus"
54.00,680.03,298.82,688.88,"/F8",9.96,"donec leo purus adipiscing torquent conubia pellentesque"
54.00,668.07,298.84,676.92,"/F8",9.96,"tempor mi blandit. Integer justo. Lacinia curae quis est"
54.00,656.12,298.81,664.97,"/F8",9.96,"sagittis pretium at mi elit condimentum feugiat. Cubilia"
54.00,644.16,298.80,653.01,"/F8",9.96,"porta nec orci justo convallis sed ultricies pellentesque."
54.00,632.21,298.85,641.06,"/F8",9.96,"Aliquet lorem. Quisque morbi metus donec condimen-"
54.00,620.25,298.83,629.10,"/F8",9.96,"tum. Feugiat neque dolor cubilia placerat. Dapibus vi-"
54.00,608.30,298.83,617.14,"/F8",9.96,"tae duis nascetur dolor elit eni placerat. Sodales morbi."
54.00,596.34,298.85,605.19,"/F8",9.96,"Lacinia etiam netus ipsum leo ligula cursus vulputate"
54.00,584.39,176.60,593.23,"/F8",9.96,"lacus vel magna nec amet."
187.07,584.39,298.89,593.23,"/F8",9.96,"Sodales metus felis mat-"
54.00,572.43,298.85,581.28,"/F8",9.96,"tis. Conubia nulla. Dapibus class purus mus amet fusce"
54.00,560.48,271.33,569.32,"/F8",9.96,"ridiculus nisl dis nunc malesuada turpis etiam mi."
63.96,548.49,298.90,557.34,"/F8",9.96,"Commodo massa adipiscing. Natoque vitae. Iaculis"
54.00,536.54,298.86,545.38,"/F8",9.96,"fames. Sodales velit ve a ligula. Egestas morbi hac nunc"
54.00,524.58,298.85,533.43,"/F8",9.96,"dapibus at odio blandit. Cubilia porta ipsum erat do-"
54.00,512.63,298.85,521.47,"/F8",9.96,"lor lacus quisque netus ad ac. Iaculis curae. Aliquet"
54.00,500.67,298.87,509.52,"/F8",9.96,"purus. Posuere massa. Feugiat dolor ad mauris feugiat"
54.00,488.72,298.84,497.56,"/F8",9.96,"dapibus arcu vestibulum urna tellus malesuada senectus"
54.00,476.76,298.88,485.61,"/F8",9.96,"fames. Commodo lorem nec nisi ante class fringilla leo"
54.00,464.81,298.82,473.65,"/F8",9.96,"nisl. Quisque ipsum arcu sociosqu erat. Posuere vitae vel"
54.00,452.85,298.86,461.70,"/F8",9.96,"amet dolor condimentum faucibus duis tempus mauris"
54.00,440.90,298.87,449.74,"/F8",9.96,"sem blandit. Conubia magna etiam urna. Viverra morbi"
54.00,428.94,298.83,437.79,"/F8",9.96,"purus litora fusce blandit penatibus tempus. Vivamus"
54.00,416.99,298.84,425.83,"/F8",9.96,"fusce mi purus ullamcorper nibh ligula est at. Feugiat"
54.00,405.03,298.85,413.88,"/F8",9.96,"class. Vivamus porta duis leo felis cum duis cum. Iaculis"
54.00,393.08,298.80,401.92,"/F8",9.96,"velit. Viverra risus vel praesent fusce litora orci nisi ac."
54.00,381.12,193.81,389.97,"/F8",9.96,"Gravida magna. Quisque lorem."
140.89,348.01,212.12,355.98,"/F19",8.97,"Rhoncus netus."
63.96,321.66,298.89,330.51,"/F8",9.96,"Quisque magna vel. Natoque proin at cursus magna."
54.00,309.71,298.85,318.55,"/F8",9.96,"Laoreet donec id mattis ac quis ad ridiculus mi. Posuere"
54.00,297.75,298.86,306.60,"/F8",9.96,"fusce amet conubia blandit eros nunc rhoncus. Rhoncus"
54.00,285.80,298.84,294.64,"/F8",9.96,"purus adipiscing. Rhoncus lorem duis scelerisque feu-"
54.00,273.84,298.82,282.69,"/F8",9.96,"giat etiam cras. Pretium velit aliquet. Vivamus felis au-"
54.00,261.89,298.84,270.73,"/F8",9.96,"gue auctor fringilla dolor lorem litora mi. Aliquet donec"
54.00,249.93,298.86,258.78,"/F8",9.96,"nibh leo ad etiam mi platea cubilia eget a arcu. Feugiat"
54.00,237.98,298.84,246.82,"/F8",9.96,"velit. Vivamus lacus eu sapien curae placerat. Aliquet"
54.00,226.02,298.88,234.87,"/F8",9.96,"felis. Natoque etiam diam gravida massa fames feugiat"
54.00,214.06,298.81,222.91,"/F8",9.96,"mi. Feugiat velit adipiscing blandit cum. Blandit proin"
54.00,202.11,298.83,210.96,"/F8",9.96,"cum arcu parturient urna augue porttitor. Integer metus"
54.00,190.15,298.84,199.00,"/F8",9.96,"nisi magnis dignissim bibendum nisl sem. Euismod justo"
54.00,178.20,298.83,187.05,"/F8",9.96,"fusce neque quis nascetur sed sollicitudin massa. Blan-"
54.00,166.24,298.82,175.09,"/F8",9.96,"dit dolor egestas mattis per nibh pellentesque id vitae"
54.00,154.29,298.86,163.13,"/F8",9.96,"ornare ut sociosqu. Conubia etiam felis orci. Natoque"
54.00,142.33,298.88,151.18,"/F8",9.96,"netus urna dolor. Nonummy netus eget condimentum"
54.00,130.38,268.04,139.22,"/F8",9.96,"sodales sed. Aliquam fames sit eget pellentesque."
63.96,118.39,298.86,127.24,"/F8",9.96,"Rhoncus neque metus velit. Iaculis lorem class orci"
317.01,777.92,561.85,786.77,"/F8",9.96,"gravida. Euismod fusce integer fermentum per ante porta"
317.01,765.96,561.85,774.81,"/F8",9.96,"morbi. Aliquet fames nunc et metus ad augue scelerisque"
317.01,754.01,561.85,762.86,"/F8",9.96,"molestie fermentum facilisi purus id justo ad. Vivamus"
317.01,742.05,561.91,750.90,"/F8",9.96,"dolor amet commodo et bibendum mus odio lobortis"
317.01,730.10,561.86,738.94,"/F8",9.96,"adipiscing turpis lorem. Nonummy porta adipiscing fa-"
317.01,718.14,561.84,726.99,"/F8",9.96,"cilisi eros hac habitant. Sodales etiam elit gravida vi-"
317.01,706.19,561.85,715.03,"/F8",9.96,"vamus amet a felis dapibus aliquam imperdiet habitant."
317.01,694.23,561.88,703.08,"/F8",9.96,"Nonummy metus. Integer curae est enim dis aliquam."
317.01,682.28,561.87,691.12,"/F8",9.96,"Integer donec lorem congue curae viverra. Integer nulla"
317.01,670.32,561.84,679.17,"/F8",9.96,"lacus eget diam metus ut. Quisque felis ve enim ullamcor-"
317.01,658.37,561.87,667.21,"/F8",9.96,"per conubia suspendisse diam. Lacinia augue adipiscing"
317.01,646.41,561.85,655.26,"/F8",9.96,"eget cursus. Blandit class. Natoque massa nisi varius in."
317.01,634.46,561.84,643.30,"/F8",9.96,"Viverra ipsum per dictumst vivamus id. Blandit porta"
317.01,622.50,561.84,631.35,"/F8",9.96,"nunc condimentum blandit cum adipiscing fusce. Blandit"
317.01,610.55,561.85,619.39,"/F8",9.96,"ipsum arcu varius fames vestibulum orci nulla lacus ne-"
317.01,598.59,561.86,607.44,"/F8",9.96,"tus. Rhoncus fusce donec duis turpis et. Natoque magna."
317.01,586.64,561.88,595.48,"/F8",9.96,"Dapibus augue commodo quisque tincidunt quam eget"
317.01,574.68,559.84,583.53,"/F8",9.96,"habitasse nullam nisi. Lacinia velit id felis pellentesque."
323.52,538.83,555.45,546.80,"/F19",8.97,"Posuere morbi nisi netus mi netus in pellentesque"
352.56,528.37,526.47,536.34,"/F19",8.97,"enim viverra erat magnis elementum."
326.98,501.50,561.87,510.35,"/F8",9.96,"Posuere proin pede torquent nostra ornare vitae est"
317.01,489.55,561.83,498.40,"/F8",9.96,"fusce cum nisl. Rhoncus felis. Sodales risus felis mattis"
317.01,477.59,561.83,486.44,"/F8",9.96,"taciti convallis vehicula congue tempor fringilla. Laoreet"
317.01,465.64,561.91,474.49,"/F8",9.96,"donec lacus enim rhoncus integer ante commodo ve"
317.01,453.68,393.23,462.53,"/F8",9.96,"torquent rutrum."
403.82,453.68,513.89,462.53,"/F8",9.96,"Feugiat purus ad quam."
524.49,453.68,561.87,462.53,"/F8",9.96,"Vivamus"
317.01,441.73,561.85,450.58,"/F8",9.96,"lorem in a taciti proin rutrum euismod aptent pede con-"
317.01,429.77,561.83,438.62,"/F8",9.96,"sectetuer parturient arcu dictum ve. Viverra augue non."
317.01,417.82,444.17,426.66,"/F8",9.96,"Blandit lacus dolor rutrum."
455.77,417.82,561.87,426.66,"/F8",9.96,"Pretium curae non per"
317.01,405.86,561.88,414.71,"/F8",9.96,"sem leo ut. Rhoncus lorem sem diam mi ridiculus pu-"
317.01,393.91,561.87,402.75,"/F8",9.96,"rus platea eu pulvinar orci eni. Posuere curae. Com-"
317.01,381.95,561.82,390.80,"/F8",9.96,"modo justo ante libero imperdiet class fringilla torquent."
317.01,370.00,561.86,378.84,"/F8",9.96,"Viverra velit nibh sem commodo mi amet purus. Quisque"
317.01,358.04,561.85,366.89,"/F8",9.96,"metus nisl ultricies metus etiam ornare odio urna. Conu-"
317.01,346.09,561.85,354.93,"/F8",9.96,"bia morbi nec. Natoque morbi erat dui viverra elit. Non-"
317.01,334.13,561.83,342.98,"/F8",9.96,"ummy fusce sed urna fermentum sollicitudin per portti-"
317.01,322.18,561.81,331.02,"/F8",9.96,"tor nulla eleifend penatibus enim hendrerit. Posuere velit"
317.01,310.22,561.88,319.07,"/F8",9.96,"nunc accumsan magna velit. Sodales neque enim biben-"
317.01,298.27,561.91,307.11,"/F8",9.96,"dum non. Commodo justo pede orci feugiat nonummy"
317.01,286.31,561.84,295.16,"/F8",9.96,"ornare porta per. Dapibus etiam hac nisl risus elit justo"
317.01,274.36,511.71,283.20,"/F8",9.96,"in est at a. Lacinia vitae elit mus dolor mus."
326.98,261.85,561.90,270.70,"/F8",9.96,"Aliquam augue fames. Integer metus morbi eni eros"
317.01,249.90,561.83,258.75,"/F8",9.96,"enim augue ultricies interdum dictum. Aliquet ipsum"
317.01,237.94,561.84,246.79,"/F8",9.96,"pede tristique donec integer cras feugiat hymenaeos duis"
317.01,225.99,561.87,234.84,"/F8",9.96,"elementum id augue mattis. Lacinia lorem nisl arcu eges-"
317.01,214.03,561.90,222.88,"/F8",9.96,"tas a ullamcorper hac. Viverra curae. Rhoncus fames"
317.01,202.08,561.88,210.92,"/F8",9.96,"lorem eleifend ante egestas ac nibh ve. Nonummy donec"
317.01,190.12,561.84,198.97,"/F8",9.96,"morbi odio ante sodales ridiculus lobortis enim tellus."
317.01,178.17,561.87,187.01,"/F8",9.96,"Aliquam nulla amet a nisl netus senectus ipsum lacus"
317.01,166.21,561.84,175.06,"/F8",9.96,"cursus tristique aenean proin praesent. Posuere dolor eu"
317.01,154.26,561.86,163.10,"/F8",9.96,"dictum ac donec. Laoreet lorem leo nibh pulvinar biben-"
317.01,142.30,561.89,151.15,"/F8",9.96,"dum augue nam. Laoreet proin quam morbi ligula donec."
317.01,130.35,561.85,139.19,"/F8",9.96,"Natoque curae at libero ad. Blandit felis enim vehicula"
317.01,118.39,561.83,127.24,"/F8",9.96,"dapibus euismod turpis. Potenti class eu hendrerit. Inte-"
