557.11,803.82,562.09,812.67,"/F8",9.96,"6"
54.00,777.92,201.25,786.77,"/F8",9.96,"teger morbi justo a vivamus et."
212.31,777.92,298.87,786.77,"/F8",9.96,"Cubilia curae nunc"
54.00,765.96,298.87,774.81,"/F8",9.96,"pretium consequat aptent urna dapibus et. Commodo"
54.00,754.01,298.86,762.86,"/F8",9.96,"lacus. Egestas vitae metus massa libero pulvinar massa"
54.00,742.05,298.84,750.90,"/F8",9.96,"ac vulputate a lacus et consectetuer. Cubilia nulla non"
54.00,730.10,298.83,738.95,"/F8",9.96,"eget primis senectus eros bibendum est dictum. Euismod"
54.00,718.14,298.87,726.99,"/F8",9.96,"risus in urna bibendum. Vivamus lacus arcu hac erat"
54.00,706.19,298.87,715.03,"/F8",9.96,"nam curae conubia nisi enim. Sodales proin. Conubia"
54.00,694.23,298.82,703.08,"/F8",9.96,"felis cras sit cras ve sit convallis. Aliquam dolor. Feugiat"
54.00,682.28,298.82,691.12,"/F8",9.96,"felis. Conubia velit duis convallis. Vivamus nulla. Rhon-"
54.00,670.32,298.85,679.17,"/F8",9.96,"cus risus arcu aliquet feugiat. Euismod donec curae fau-"
54.00,658.37,298.83,667.21,"/F8",9.96,"cibus leo diam est erat ante curabitur ultrices ac. Laoreet"
54.00,646.41,298.90,655.26,"/F8",9.96,"massa et mauris justo dis magna tortor. Lacinia massa"
54.00,634.46,298.82,643.30,"/F8",9.96,"nulla nullam. Iaculis dolor lorem elit dapibus fringilla"
54.00,622.50,298.85,631.35,"/F8",9.96,"torquent primis. Conubia massa amet taciti habitant"
54.00,610.55,131.44,619.39,"/F8",9.96,"vestibulum ligula."
141.39,575.79,211.63,583.75,"/F19",8.97,"Cubilia magna."
63.96,549.12,298.92,557.97,"/F8",9.96,"Posuere massa quam. Nonummy netus quam ac sol-"
54.00,537.17,298.84,546.01,"/F8",9.96,"licitudin. Nonummy metus nam odio id tellus molestie"
54.00,525.21,298.86,534.06,"/F8",9.96,"fermentum. Aliquet curae ve nostra a potenti aenean"
54.00,513.26,298.82,522.10,"/F8",9.96,"donec lacinia orci. Pretium justo orci quam ultricies pel-"
54.00,501.30,298.79,510.15,"/F8",9.96,"lentesque vestibulum nisi ridiculus. Integer lorem vitae"
54.00,489.35,298.86,498.19,"/F8",9.96,"porta tempus pede facilisis at. Pretium augue duis a"
54.00,477.39,298.86,486.24,"/F8",9.96,"nunc class arcu nisi. Euismod purus duis commodo at eu."
54.00,465.44,298.81,474.28,"/F8",9.96,"Integer fusce ad luctus blandit viverra. Iaculis risus. Po-"
54.00,453.48,298.87,462.33,"/F8",9.96,"suere magna vel tempus ornare malesuada suscipit arcu"
54.00,441.52,298.86,450.37,"/F8",9.96,"venenatis auctor non cum consectetuer ad. Euismod cu-"
54.00,429.57,298.84,438.42,"/F8",9.96,"rae arcu sed mattis ve non quis a porta pretium eleifend."
54.00,417.61,298.85,426.46,"/F8",9.96,"Viverra massa sit netus parturient quam vitae laoreet"
54.00,405.66,298.86,414.51,"/F8",9.96,"magna elit. Iaculis etiam quis nonummy quis pharetra"
54.00,393.70,298.86,402.55,"/F8",9.96,"purus consectetuer malesuada etiam conubia ligula. Vi-"
54.00,381.75,298.87,390.60,"/F8",9.96,"vamus morbi orci a nisl neque mattis aenean. Feugiat"
54.00,369.79,298.85,378.64,"/F8",9.96,"nulla mi dolor. Feugiat lacus amet ridiculus fames. Non-"
54.00,357.84,298.84,366.68,"/F8",9.96,"ummy vitae. Potenti curae eu. Pretium purus lacus."
54.00,345.88,298.85,354.73,"/F8",9.96,"Integer risus donec erat eros euismod ac ultrices gravida"
54.00,333.93,298.81,342.77,"/F8",9.96,"pellentesque. Aliquam nulla curae sociis duis mattis sit"
54.00,321.97,226.65,330.82,"/F8",9.96,"elit nisl viverra neque diam inceptos at."
63.96,309.68,298.82,318.52,"/F8",9.96,"Feugiat netus iaculis sit at proin mi velit donec litora"
54.00,297.72,298.81,306.57,"/F8",9.96,"nibh neque mi. Quisque felis eget phasellus arcu pellen-"
54.00,285.77,298.86,294.61,"/F8",9.96,"tesque magnis lectus nulla magna. Sodales neque cras eu."
54.00,273.81,298.86,282.66,"/F8",9.96,"Conubia netus hac hendrerit mattis augue ad. Aliquam"
54.00,261.85,298.83,270.70,"/F8",9.96,"risus adipiscing pulvinar. Conubia porta erat phasellus"
54.00,249.90,298.86,258.75,"/F8",9.96,"cras per etiam orci iaculis massa hac felis urna euismod."
54.00,237.94,298.88,246.79,"/F8",9.96,"Commodo morbi eni duis netus ad semper vehicula non"
54.00,225.99,298.83,234.84,"/F8",9.96,"nibh diam laoreet ac. Aliquet purus porta diam nisl justo"
54.00,214.03,298.83,222.88,"/F8",9.96,"mi sollicitudin libero ad eros ultrices proin. Natoque"
54.00,202.08,298.83,210.93,"/F8",9.96,"justo. Aliquam fames ut pellentesque luctus dolor feu-"
54.00,190.12,298.86,198.97,"/F8",9.96,"giat nibh. Viverra donec morbi cras urna vivamus a sus-"
54.00,178.17,298.87,187.01,"/F8",9.96,"pendisse non ad. Vivamus netus nisl eros accumsan con-"
54.00,166.21,298.83,175.06,"/F8",9.96,"sectetuer mattis et curae tincidunt malesuada. Natoque"
54.00,154.26,298.86,163.10,"/F8",9.96,"lacus. Laoreet curae mi luctus hymenaeos ac hendrerit"
54.00,142.30,298.86,151.15,"/F8",9.96,"ullamcorper fermentum odio magna cubilia. Lacinia vi-"
54.00,130.35,298.83,139.19,"/F8",9.96,"tae erat suspendisse. Potenti metus. Cubilia nulla ut"
54.00,118.39,298.86,127.24,"/F8",9.96,"luctus non blandit porta et consequat augue. Laoreet"
317.01,777.92,561.88,786.77,"/F8",9.96,"donec arcu non integer sed volutpat a placerat nam ante"
317.01,765.96,561.85,774.81,"/F8",9.96,"adipiscing lectus ut. Integer fames sem vestibulum id"
317.01,754.01,561.86,762.86,"/F8",9.96,"semper nonummy quisque. Natoque donec felis. Cubilia"
317.01,742.05,412.88,750.90,"/F8",9.96,"lorem. Laoreet augue."
326.98,729.80,561.92,738.64,"/F8",9.96,"Commodo proin ipsum tempor nullam fusce ad magna"
317.01,717.84,561.86,726.69,"/F8",9.96,"pede. Feugiat magna enim natoque eu ligula. Blandit fe-"
317.01,705.89,561.82,714.73,"/F8",9.96,"lis ac. Euismod lacus. Potenti neque vitae nisl phasellus"
317.01,693.93,561.86,702.78,"/F8",9.96,"in. Sodales nulla. Viverra curae elit a eget fames phasel-"
317.01,681.98,561.82,690.82,"/F8",9.96,"lus suscipit. Lacinia metus lacus ligula sapien netus pulv-"
317.01,670.02,561.83,678.87,"/F8",9.96,"inar etiam vehicula sem nibh. Potenti porta neque lacinia"
317.01,658.07,561.83,666.91,"/F8",9.96,"eros vitae tincidunt arcu tortor et tellus malesuada. Vi-"
317.01,646.11,561.86,654.96,"/F8",9.96,"vamus purus. Cubilia purus. Conubia metus nunc est"
317.01,634.16,561.86,643.00,"/F8",9.96,"sodales metus et ad urna ipsum. Conubia porta elit lacus"
317.01,622.20,561.85,631.05,"/F8",9.96,"neque molestie adipiscing venenatis donec a tempus tin-"
317.01,610.24,561.83,619.09,"/F8",9.96,"cidunt. Gravida vitae in nullam ac eros. Pretium lorem."
317.01,598.29,561.85,607.14,"/F8",9.96,"Cubilia neque netus curae congue enim orci mus faucibus."
317.01,586.33,561.82,595.18,"/F8",9.96,"Blandit nulla arcu a morbi iaculis ridiculus ante. Aliquet"
317.01,574.38,561.84,583.23,"/F8",9.96,"morbi. Dapibus lorem eu mattis consectetuer consequat."
317.01,562.42,561.87,571.27,"/F8",9.96,"Aliquet magna sed orci leo et odio scelerisque aliquam"
317.01,550.47,561.89,559.32,"/F8",9.96,"velit donec nam ante diam. Lacinia class lacus congue"
317.01,538.51,561.86,547.36,"/F8",9.96,"nibh ve eget duis porta condimentum. Pretium donec"
317.01,526.56,435.54,535.41,"/F8",9.96,"nunc odio phasellus nostra."
406.16,492.02,472.89,499.98,"/F19",8.97,"Lacinia augue."
326.98,465.39,561.86,474.24,"/F8",9.96,"Vivamus justo. Lacinia dolor quis potenti ligula nibh"
317.01,453.44,561.92,462.28,"/F8",9.96,"cubilia. Nonummy massa ad arcu sem urna metus mo-"
317.01,441.48,561.82,450.33,"/F8",9.96,"lestie parturient. Laoreet proin. Viverra lacus adipiscing"
317.01,429.53,561.87,438.37,"/F8",9.96,"sociosqu aliquet sapien per. Blandit donec. Nonummy"
317.01,417.57,561.84,426.42,"/F8",9.96,"nulla. Blandit massa nunc ultrices et dolor eu velit mag-"
317.01,405.62,561.81,414.46,"/F8",9.96,"nis eros ac. Integer donec ve litora pellentesque tincidunt."
317.01,393.66,561.85,402.51,"/F8",9.96,"Sodales lorem. Rhoncus porta id risus scelerisque. Feu-"
317.01,381.71,561.84,390.55,"/F8",9.96,"giat nulla in auctor potenti est id nibh. Laoreet justo in"
317.01,369.75,561.83,378.60,"/F8",9.96,"penatibus. Blandit morbi nisl nostra mollis sem quis sol-"
317.01,357.80,561.84,366.64,"/F8",9.96,"licitudin. Nonummy justo amet nisl sapien integer eget."
317.01,345.84,561.84,354.69,"/F8",9.96,"Cubilia purus in tortor feugiat dignissim habitant. Po-"
317.01,333.89,561.82,342.73,"/F8",9.96,"tenti fusce. Laoreet netus in sit ut consectetuer sollici-"
317.01,321.93,561.84,330.78,"/F8",9.96,"tudin feugiat platea. Viverra porta risus. Vivamus netus"
317.01,309.98,561.84,318.82,"/F8",9.96,"amet dignissim. Cubilia vitae. Aliquet neque vel cras"
317.01,298.02,354.07,306.87,"/F8",9.96,"pretium."
326.98,285.76,561.88,294.61,"/F8",9.96,"Vivamus nulla amet venenatis eni senectus euismod"
317.01,273.81,561.81,282.66,"/F8",9.96,"imperdiet. Cubilia netus vestibulum suspendisse varius"
317.01,261.85,561.82,270.70,"/F8",9.96,"ut duis lobortis vulputate nam quis proin potenti. Blan-"
317.01,249.90,561.82,258.75,"/F8",9.96,"dit felis. Viverra morbi quis quisque at elit dolor. Ali-"
317.01,237.94,561.87,246.79,"/F8",9.96,"quet curae lacinia. Pretium metus ad nostra sem dic-"
317.01,225.99,561.83,234.84,"/F8",9.96,"tumst habitasse ornare facilisis proin a lacinia ligula orci"
317.01,214.03,561.86,222.88,"/F8",9.96,"euismod nostra ve. Blandit felis ve at elementum mi"
317.01,202.08,561.83,210.92,"/F8",9.96,"in. Quisque magna cras quam in sollicitudin feugiat felis"
317.01,190.12,561.84,198.97,"/F8",9.96,"viverra. Pretium metus hac porta primis id duis. Ali-"
317.01,178.17,561.84,187.01,"/F8",9.96,"quam netus elit dui viverra dictumst lectus amet non"
317.01,166.21,561.87,175.06,"/F8",9.96,"auctor. Vivamus netus per dictumst posuere. Conubia"
317.01,154.26,561.89,163.10,"/F8",9.96,"fusce morbi commodo amet porta dapibus rutrum duis"
317.01,142.30,561.87,151.15,"/F8",9.96,"nullam. Gravida risus mi metus ipsum libero at. Na-"
317.01,130.35,561.86,139.19,"/F8",9.96,"toque fames non sociis tempor integer nisl sociosqu lacus"
317.01,118.39,561.87,127.24,"/F8",9.96,"etiam facilisi. Integer fusce. Commodo vitae ante conse-"
