37.61,748.78,288.43,757.62,"/F8",9.96,"modo felis cum arcu vestibulum eu vulputate a dis conse-"
37.61,736.82,288.45,745.67,"/F8",9.96,"quat netus a vivamus in. Rhoncus justo sem sed laoreet"
37.61,724.87,288.42,733.71,"/F8",9.96,"nulla eget. Feugiat velit. Natoque massa nisl sit porta cum"
37.61,712.91,288.40,721.76,"/F8",9.96,"suscipit. Pretium vitae quam natoque massa duis ridiculus"
37.61,700.96,288.37,709.80,"/F8",9.96,"sollicitudin nam tristique nisi luctus ac fringilla. Natoque"
37.61,689.00,288.46,697.85,"/F8",9.96,"fames. Sodales metus. Vivamus metus augue metus viva-"
37.61,677.04,288.48,685.89,"/F8",9.96,"mus massa at aenean dapibus conubia sociosqu. Natoque"
37.61,665.09,288.41,673.94,"/F8",9.96,"fusce et curabitur laoreet tempor. Lacinia justo. Pretium"
37.61,653.13,288.43,661.98,"/F8",9.96,"augue class leo eget adipiscing nisi vitae. Quisque curae"
37.61,641.18,288.42,650.03,"/F8",9.96,"adipiscing pulvinar eget arcu. Nonummy risus adipiscing"
37.61,629.22,288.42,638.07,"/F8",9.96,"at sollicitudin euismod. Euismod morbi. Feugiat neque"
37.61,617.27,144.92,626.11,"/F8",9.96,"vitae a nunc vestibulum."
52.56,605.31,288.48,614.16,"/F8",9.96,"Rhoncus massa ac vitae mi convallis fusce nunc cum"
37.61,593.36,288.40,602.20,"/F8",9.96,"tempus feugiat dapibus hendrerit montes a vestibulum vel."
37.61,581.40,288.43,590.25,"/F8",9.96,"Viverra risus enim natoque nibh molestie. Conubia etiam"
37.61,569.45,288.44,578.29,"/F8",9.96,"ante suscipit a sociosqu vel aliquet diam. Egestas fames"
37.61,557.49,288.45,566.34,"/F8",9.96,"augue nibh quam. Nonummy neque adipiscing eros tris-"
37.61,545.54,288.42,554.38,"/F8",9.96,"tique eni integer nec ac a nisl purus habitasse nascetur do-"
37.61,533.58,288.40,542.43,"/F8",9.96,"lor. Aliquet nulla ipsum sit. Vivamus proin. Laoreet nulla"
37.61,521.63,288.43,530.47,"/F8",9.96,"quam hymenaeos sociis tortor dignissim pulvinar eget ali-"
37.61,509.67,288.42,518.52,"/F8",9.96,"quam eget non duis. Blandit class vestibulum urna proin."
37.61,497.72,225.95,506.56,"/F8",9.96,"Aliquet vitae laoreet nec nascetur massa."
235.92,497.72,288.43,506.56,"/F8",9.96,"Integer felis"
37.61,485.76,288.45,494.61,"/F8",9.96,"arcu ante est senectus etiam at ligula conubia hymenaeos"
37.61,473.81,288.42,482.65,"/F8",9.96,"nisi. Euismod nulla orci cursus in taciti enim orci hac."
37.61,461.85,288.43,470.70,"/F8",9.96,"Pretium massa fusce tempus diam tempor turpis faucibus"
37.61,449.90,288.42,458.74,"/F8",9.96,"imperdiet. Pretium velit nulla maecenas elementum eu"
37.61,437.94,288.38,446.79,"/F8",9.96,"facilisis etiam porttitor. Posuere risus. Quisque netus et"
37.61,425.99,288.44,434.83,"/F8",9.96,"torquent rhoncus. Natoque felis ve ad nostra. Euismod"
37.61,414.03,288.42,422.88,"/F8",9.96,"netus id nibh phasellus metus orci imperdiet mi condi-"
37.61,402.08,288.39,410.92,"/F8",9.96,"mentum ut sociis volutpat adipiscing dignissim scelerisque"
37.61,390.12,288.42,398.97,"/F8",9.96,"consequat quam. Quisque neque id cursus. Iaculis nulla"
37.61,378.17,288.46,387.01,"/F8",9.96,"dolor sem aenean dapibus erat lectus ve. Egestas augue"
37.61,366.21,288.43,375.06,"/F8",9.96,"curae suscipit elementum habitant lorem diam inceptos"
37.61,354.26,197.27,363.10,"/F8",9.96,"dolor curae erat nunc. Integer proin."
37.61,330.34,184.80,339.19,"/F27",9.96,"4.3. Blandit magna arcu pretium."
52.56,315.40,288.45,324.25,"/F8",9.96,"Aliquet dolor. Rhoncus massa quis dictumst ut sus-"
37.61,303.45,288.47,312.29,"/F8",9.96,"pendisse pede auctor nam nonummy arcu gravida amet."
37.61,291.49,289.89,300.34,"/F8",9.96,"Gravida netus at interdum neque donec nibh amet. Viverra"
37.61,279.54,288.42,288.38,"/F8",9.96,"fusce ve leo. Viverra felis nec cras adipiscing. Pretium"
37.61,267.58,288.45,276.43,"/F8",9.96,"lorem class habitant id magna dictum inceptos euismod"
37.61,255.62,288.46,264.47,"/F8",9.96,"rhoncus tempor fames aliquet. Aliquam fames ante mus"
37.61,243.67,288.42,252.52,"/F8",9.96,"quam duis quis ac mus. Sodales velit nisi per dui nec eni"
37.61,231.71,288.44,240.56,"/F8",9.96,"at elit et sed hymenaeos neque magnis aptent arcu congue."
37.61,219.76,288.44,228.61,"/F8",9.96,"Lacinia vitae at. Gravida augue. Laoreet class adipiscing"
37.61,207.80,288.41,216.65,"/F8",9.96,"at pellentesque dapibus rutrum dolor. Quisque proin ac."
37.61,195.85,288.43,204.70,"/F8",9.96,"Cubilia felis erat nam. Sodales morbi ve risus dignissim"
37.61,183.89,288.44,192.74,"/F8",9.96,"dapibus eros interdum congue. Egestas etiam dui enim."
37.61,171.94,288.44,180.79,"/F8",9.96,"Quisque fusce eni eros arcu eget hac pede dictum platea"
37.61,159.98,288.40,168.83,"/F8",9.96,"class suspendisse elit ornare porttitor. Vivamus fusce. Ali-"
37.61,148.03,288.44,156.88,"/F8",9.96,"quam justo sit. Nonummy felis eni ante eget mollis arcu"
37.61,136.07,288.42,144.92,"/F8",9.96,"duis adipiscing. Aliquam fames pede non nibh blandit arcu"
37.61,124.12,288.43,132.96,"/F8",9.96,"cras vivamus. Laoreet netus adipiscing condimentum. Ali-"
37.61,112.16,84.10,121.01,"/F8",9.96,"quet justo."
52.56,100.21,288.48,109.05,"/F8",9.96,"Rhoncus donec ut augue volutpat donec dis erat auc-"
37.61,88.25,288.40,97.10,"/F8",9.96,"tor vestibulum interdum egestas. Aliquet justo lacus eget"
306.60,748.78,557.42,757.62,"/F8",9.96,"ridiculus nam placerat. Vivamus fames id suscipit ali-"
306.60,736.82,557.44,745.67,"/F8",9.96,"quam. Vivamus metus erat euismod et luctus dolor par-"
306.60,724.87,557.39,733.71,"/F8",9.96,"turient habitant nisi. Laoreet fames lacus vehicula elit."
306.60,712.91,557.43,721.76,"/F8",9.96,"Potenti fames. Dapibus morbi lorem cursus cum litora"
306.60,700.95,557.43,709.80,"/F8",9.96,"id ve odio sociosqu rutrum aptent. Aliquam curae ante"
306.60,689.00,557.41,697.85,"/F8",9.96,"per quis pede dignissim magnis proin vestibulum sodales"
306.60,677.04,557.40,685.89,"/F8",9.96,"nibh mus tellus. Posuere curae nunc pulvinar mollis diam"
306.60,665.09,557.41,673.94,"/F8",9.96,"id pellentesque primis etiam suspendisse. Egestas augue"
306.60,653.13,557.42,661.98,"/F8",9.96,"erat ut orci luctus conubia nonummy amet praesent lacus."
306.60,641.18,557.45,650.02,"/F8",9.96,"Sodales fusce. Aliquam lorem mi ac semper et habitasse"
306.60,629.22,557.41,638.07,"/F8",9.96,"pede sit. Pretium risus massa pharetra ipsum porttitor"
306.60,617.27,388.06,626.11,"/F8",9.96,"ultrices mi turpis."
398.35,617.27,460.88,626.11,"/F8",9.96,"Egestas lacus."
471.18,617.27,557.42,626.11,"/F8",9.96,"Dapibus dolor eget"
306.60,605.31,557.37,614.16,"/F8",9.96,"hendrerit. Viverra risus quis dis tempor at ante tristique"
306.60,593.36,557.40,602.20,"/F8",9.96,"libero vestibulum. Conubia proin et duis habitasse lobor-"
306.60,581.40,557.40,590.25,"/F8",9.96,"tis platea luctus dignissim fusce. Aliquet class mi pede"
306.60,569.45,557.44,578.29,"/F8",9.96,"morbi malesuada. Integer felis enim odio. Integer etiam"
306.60,557.49,557.45,566.34,"/F8",9.96,"risus leo justo etiam aenean in ut. Natoque morbi. Po-"
306.60,545.54,557.40,554.38,"/F8",9.96,"suere class non curae taciti tortor nulla sed vestibulum at"
306.60,533.58,502.10,542.43,"/F8",9.96,"consectetuer sodales mattis cum vivamus ad."
310.84,519.52,319.77,526.60,"/F19",7.97,"[1]"
324.75,519.52,536.49,526.60,"/F19",7.97,"R. MacPherson, Singularities of vector bundle maps, in:"
541.44,519.52,557.55,526.60,"/F19",7.97,"Pro-"
324.76,510.06,557.54,517.13,"/F19",7.97,"ceedings of Liverpool Singularities, Lecture Notes in Mathemat-"
324.76,500.59,390.64,507.67,"/F19",7.97,"ics, no. 192, 1981."
310.84,491.13,319.77,498.21,"/F19",7.97,"[2]"
324.75,491.13,546.82,498.21,"/F19",7.97,"V. Pati, What is the title??, Ph.D. thesis, Princeton (1985)."
310.84,481.66,319.77,488.74,"/F19",7.97,"[3]"
324.75,481.66,332.16,488.74,"/F19",7.97,"P."
336.93,481.66,359.73,488.74,"/F19",7.97,"Alu,"
364.99,481.66,387.57,488.74,"/F19",7.97,"Chern"
392.34,481.66,416.47,488.74,"/F19",7.97,"classes"
421.25,481.66,431.35,488.74,"/F19",7.97,"for"
436.14,481.66,465.35,488.74,"/F19",7.97,"singular"
470.12,481.66,522.42,488.74,"/F19",7.97,"hypersurfaces,"
527.68,481.66,557.55,488.74,"/F19",7.97,"preprint"
324.76,472.20,386.72,479.28,"/F19",7.97,"(February 1996)."
310.84,462.74,319.77,469.81,"/F19",7.97,"[4]"
324.75,462.74,519.49,469.81,"/F19",7.97,"A. H. Durfee, Singularities, preprint (January 1998)."
310.84,453.27,319.77,460.35,"/F19",7.97,"[5]"
324.75,453.27,557.54,460.35,"/F19",7.97,"J. Biran˘con, P. Maisonobe, M. Merle, Localisation de systemes"
324.76,443.81,557.56,450.88,"/F19",7.97,"dierentiels, stratications de Whitney et condition de Thom,"
324.76,434.34,452.17,441.42,"/F19",7.97,"Invent. Math. 117 (1994) 531{550."
310.84,424.88,319.77,431.96,"/F19",7.97,"[6]"
324.75,424.88,557.54,431.96,"/F19",7.97,"J.-L. Brylinski, (Co){Homologie d'intersection et faisceaux per-"
324.76,415.41,494.22,422.49,"/F19",7.97,"vers, Seminaire Bourbaki 585 (1982) 129{157."
310.84,405.95,319.77,413.03,"/F19",7.97,"[7]"
324.75,405.95,557.57,413.03,"/F19",7.97,"L. D. Trang, B. Teissier, Varietes polaires locales et classes de"
324.76,396.48,557.54,403.56,"/F19",7.97,"Chern des varietes singulieres, Ann. of Math. 114 (1981) 457{"
324.76,387.02,339.81,394.10,"/F19",7.97,"491."
310.84,377.55,319.77,384.63,"/F19",7.97,"[8]"
324.75,377.55,557.56,384.63,"/F19",7.97,"P. Alu, C. Faber, A remark on the Chern class of a tensor"
324.76,368.09,471.46,375.17,"/F19",7.97,"product, Manu. Math. 88 (1995) 85{86."
310.84,358.63,319.77,365.70,"/F19",7.97,"[9]"
324.75,358.63,557.57,365.70,"/F19",7.97,"G. Barthel, J.-P. Brasselet, K.-H. Fieseler, Classes de Chern des"
324.76,349.16,557.55,356.24,"/F19",7.97,"varietes toriques singulieres, C. R. Acad. Sci. Paris 315 (1992)"
324.76,339.70,356.74,346.77,"/F19",7.97,"187{192."
306.60,330.23,319.77,337.31,"/F19",7.97,"[10]"
324.75,330.23,557.55,337.31,"/F19",7.97,"A. S. Dubson, Classes caracteristiques des varietes singulieres,"
324.76,320.77,483.03,327.85,"/F19",7.97,"C. R. Acad. Sci. Paris 287 (1978) 237{240."
306.60,311.30,319.77,318.38,"/F19",7.97,"[11]"
324.75,311.30,557.55,318.38,"/F19",7.97,"C. Sabbah, Quelques remarques sur la geometrie des espaces"
324.76,301.84,485.91,308.92,"/F19",7.97,"conormaux, Asterisque 130 (1985) 161{192."
306.60,292.37,319.77,299.45,"/F19",7.97,"[12]"
324.75,292.37,557.55,299.45,"/F19",7.97,"G. Kennedy, MacPherson's Chern classes of singular algebraic"
324.76,282.91,486.09,289.99,"/F19",7.97,"varieties, Comm. Alg. 18 (1990) 2821{2839."
306.60,273.45,319.77,280.52,"/F19",7.97,"[13]"
324.75,273.45,557.55,280.52,"/F19",7.97,"V. N. Aznar, Sur les multiplicites de Schubert locales des fais-"
324.76,263.98,554.32,271.06,"/F19",7.97,"ceaux algebriques coherents, Comp. Math. 48 (1983) 311{326."
295.15,61.35,300.13,70.20,"/F8",9.96,"6"
