557.11,803.82,562.09,812.67,"/F8",9.96,"3"
59.26,778.11,293.63,786.07,"/F19",8.97,"COMMODO DOLOR JUSTO ARCU ODIO LEO."
63.96,751.76,298.87,760.60,"/F8",9.96,"Feugiat proin velit nostra nunc id ante. Commodo cu-"
54.00,739.80,298.84,748.65,"/F8",9.96,"rae purus laoreet ac porttitor parturient urna lorem mi"
54.00,727.85,298.86,736.69,"/F8",9.96,"cursus class tristique conubia mauris. Nonummy magna."
54.00,715.89,116.13,724.74,"/F8",9.96,"Viverra fusce."
127.47,715.89,298.86,724.74,"/F8",9.96,"Euismod fusce mi facilisis hymenaeos"
54.00,703.94,223.28,712.78,"/F8",9.96,"vestibulum eni parturient fames orci."
233.87,703.94,298.84,712.78,"/F8",9.96,"Gravida fames"
54.00,691.98,298.84,700.83,"/F8",9.96,"adipiscing pretium non vulputate ante. Sodales donec"
54.00,680.03,298.90,688.87,"/F8",9.96,"eni ante platea integer nam. Nonummy augue. Com-"
54.00,668.07,298.89,676.92,"/F8",9.96,"modo fames. Euismod magna per blandit pede adipisc-"
54.00,656.12,298.88,664.96,"/F8",9.96,"ing odio. Laoreet justo urna curabitur nam class. Com-"
54.00,644.16,298.89,653.01,"/F8",9.96,"modo class. Euismod lacus. Lacinia fusce dolor quam"
54.00,632.21,298.84,641.05,"/F8",9.96,"fusce semper. Rhoncus curae in rutrum class parturient"
54.00,620.25,298.89,629.10,"/F8",9.96,"ac. Gravida proin. Sodales porta elit augue commodo"
54.00,608.30,298.83,617.14,"/F8",9.96,"auctor. Pretium neque class. Viverra netus duis dis pu-"
54.00,596.34,298.84,605.19,"/F8",9.96,"rus lacinia cum. Aliquam risus arcu leo. Dapibus metus"
54.00,584.38,298.84,593.23,"/F8",9.96,"diam sed fermentum mauris cras platea mi cum tristique."
54.00,572.43,263.07,581.28,"/F8",9.96,"Pretium porta amet lacus nibh mi consectetuer."
63.96,560.44,298.83,569.29,"/F8",9.96,"Gravida lorem blandit facilisi enim molestie nec. Blan-"
54.00,548.49,298.84,557.33,"/F8",9.96,"dit proin netus faucibus. Feugiat netus quam dis. Non-"
54.00,536.53,298.84,545.38,"/F8",9.96,"ummy porta nisi tellus eu cras nulla mi vitae id. Rhon-"
54.00,524.57,298.85,533.42,"/F8",9.96,"cus justo id lacus pharetra proin montes adipiscing sol-"
54.00,512.62,298.85,521.47,"/F8",9.96,"licitudin vivamus morbi enim. Egestas massa. Aliquam"
54.00,500.66,298.86,509.51,"/F8",9.96,"neque. Rhoncus justo purus dis eros diam arcu mus prae-"
54.00,488.71,298.86,497.56,"/F8",9.96,"sent a lobortis nisl dictum. Nonummy lorem. Lacinia"
54.00,476.75,298.87,485.60,"/F8",9.96,"fames risus condimentum. Viverra metus leo cum hen-"
54.00,464.80,298.80,473.64,"/F8",9.96,"drerit torquent. Pretium risus erat cubilia. Laoreet lorem"
54.00,452.84,298.85,461.69,"/F8",9.96,"etiam a congue. Lacinia curae morbi eleifend ultricies a"
54.00,440.89,298.85,449.73,"/F8",9.96,"netus mi luctus. Rhoncus porta. Rhoncus ipsum in nul-"
54.00,428.93,298.87,437.78,"/F8",9.96,"lam accumsan condimentum sed amet ornare ultricies."
54.00,416.98,298.88,425.82,"/F8",9.96,"Cubilia morbi vel pede id urna fermentum. Commodo"
54.00,405.02,298.83,413.87,"/F8",9.96,"risus pede lectus etiam iaculis senectus mattis montes"
54.00,393.07,298.86,401.91,"/F8",9.96,"donec parturient sagittis metus. Egestas augue. Po-"
54.00,381.11,298.84,389.96,"/F8",9.96,"suere etiam mus parturient. Feugiat lacus vivamus ia-"
54.00,369.16,298.83,378.00,"/F8",9.96,"culis habitant consectetuer vivamus nostra quam libero"
54.00,357.20,298.88,366.05,"/F8",9.96,"congue curae posuere aenean erat. Natoque netus erat"
54.00,345.25,139.87,354.09,"/F8",9.96,"posuere fusce dolor."
139.42,312.12,213.60,320.08,"/F19",8.97,"Rhoncus metus."
63.96,285.77,298.86,294.61,"/F8",9.96,"Iaculis morbi eros aliquam ridiculus aptent ornare"
54.00,273.81,123.32,282.66,"/F8",9.96,"fames sem elit."
134.94,273.81,298.84,282.66,"/F8",9.96,"Potenti risus ante ipsum nisi fusce."
54.00,261.85,298.79,270.70,"/F8",9.96,"Pretium class neque nulla turpis facilisi nibh ridiculus"
54.00,249.90,298.85,258.75,"/F8",9.96,"eu. Feugiat augue. Aliquam justo vestibulum. Sodales"
54.00,237.94,298.83,246.79,"/F8",9.96,"donec nibh eget nec torquent lacinia gravida consectetuer"
54.00,225.99,298.85,234.84,"/F8",9.96,"penatibus proin. Conubia proin etiam posuere aenean ip-"
54.00,214.03,298.85,222.88,"/F8",9.96,"sum nulla. Aliquam class cras suspendisse integer dis ad"
54.00,202.08,298.86,210.93,"/F8",9.96,"massa turpis proin odio. Feugiat massa. Aliquet neque"
54.00,190.12,298.87,198.97,"/F8",9.96,"amet congue posuere lacinia nibh ligula aliquam pede"
54.00,178.17,298.82,187.01,"/F8",9.96,"potenti phasellus. Dapibus vitae. Feugiat proin vitae"
54.00,166.21,298.83,175.06,"/F8",9.96,"fringilla torquent. Vivamus fusce erat ullamcorper iac-"
54.00,154.26,298.83,163.10,"/F8",9.96,"ulis ipsum sed elit cras. Aliquet etiam hac nunc euismod"
54.00,142.30,298.84,151.15,"/F8",9.96,"varius sed leo feugiat fusce parturient. Euismod class"
54.00,130.35,298.84,139.19,"/F8",9.96,"urna hendrerit sociis a adipiscing. Dapibus porta. In-"
54.00,118.39,298.89,127.24,"/F8",9.96,"teger augue metus lacinia amet ante magna elementum"
317.01,777.92,561.86,786.77,"/F8",9.96,"condimentum augue. Rhoncus velit enim id fusce ad nisi"
317.01,765.96,561.87,774.81,"/F8",9.96,"taciti gravida diam egestas aliquam litora. Vivamus la-"
317.01,754.01,561.88,762.86,"/F8",9.96,"cus dolor amet odio ac hac taciti cubilia enim per magna."
317.01,742.05,561.88,750.90,"/F8",9.96,"Commodo massa orci neque lobortis arcu rutrum blandit"
317.01,730.10,561.85,738.94,"/F8",9.96,"potenti primis turpis praesent. Commodo justo et. Ali-"
317.01,718.14,561.83,726.99,"/F8",9.96,"quet donec quam porttitor dui consectetuer mollis aptent"
317.01,706.19,341.05,715.03,"/F8",9.96,"vitae."
326.98,693.93,561.87,702.78,"/F8",9.96,"Commodo proin justo orci augue ultricies arcu sit fusce"
317.01,681.98,561.82,690.82,"/F8",9.96,"dolor. Integer justo quis nisi pede velit rhoncus cras urna."
317.01,670.02,561.88,678.87,"/F8",9.96,"Iaculis magna vitae mus. Integer massa. Potenti felis"
317.01,658.07,561.82,666.91,"/F8",9.96,"quis proin id facilisis orci dapibus tincidunt. Sodales"
317.01,646.11,561.82,654.96,"/F8",9.96,"lorem vestibulum nascetur quisque. Potenti lorem nisi"
317.01,634.16,561.90,643.00,"/F8",9.96,"nonummy aliquam mauris. Gravida class lorem amet a"
317.01,622.20,561.89,631.05,"/F8",9.96,"nunc vitae nonummy. Sodales etiam nunc magnis ali-"
317.01,610.25,561.86,619.09,"/F8",9.96,"quam ac. Egestas velit iaculis per bibendum rhoncus"
317.01,598.29,561.84,607.14,"/F8",9.96,"integer rhoncus erat pede. Viverra risus cras purus sociis"
317.01,586.34,561.86,595.18,"/F8",9.96,"inceptos. Conubia dolor aliquam semper risus ut. Blan-"
317.01,574.38,561.84,583.23,"/F8",9.96,"dit risus neque nonummy rhoncus elit id fusce et netus"
317.01,562.42,561.85,571.27,"/F8",9.96,"varius vivamus. Cubilia ipsum morbi mus congue luctus"
317.01,550.47,561.85,559.32,"/F8",9.96,"nibh sodales ac ornare torquent curabitur. Laoreet neque"
317.01,538.51,561.81,547.36,"/F8",9.96,"nulla tempus adipiscing pellentesque. Aliquet justo nibh"
317.01,526.56,561.87,535.41,"/F8",9.96,"cursus bibendum hymenaeos turpis. Aliquam augue. Po-"
317.01,514.60,561.88,523.45,"/F8",9.96,"suere ipsum non sodales mi. Gravida fusce odio euismod"
317.01,502.65,561.87,511.50,"/F8",9.96,"libero congue vel id. Rhoncus purus ac nullam in amet"
317.01,490.69,561.89,499.54,"/F8",9.96,"at risus. Aliquam magna arcu. Iaculis purus amet cras"
317.01,478.74,489.33,487.59,"/F8",9.96,"ut habitant urna nam dapibus in taciti."
383.23,444.20,495.81,452.16,"/F19",8.97,"Quisque netus pede sed."
326.98,417.57,561.89,426.42,"/F8",9.96,"Nonummy augue porta auctor torquent venenatis ip-"
317.01,405.62,561.90,414.46,"/F8",9.96,"sum ligula ad ante auctor at nec duis odio. Euismod"
317.01,393.66,561.88,402.51,"/F8",9.96,"neque. Lacinia curae. Lacinia curae. Feugiat porta ve"
317.01,381.71,561.82,390.55,"/F8",9.96,"convallis a proin lacinia aliquam sollicitudin habitasse cu-"
317.01,369.75,561.84,378.60,"/F8",9.96,"rae torquent. Posuere felis vestibulum. Viverra augue"
317.01,357.80,561.87,366.64,"/F8",9.96,"donec maecenas augue primis in amet lobortis vehicula."
317.01,345.84,561.86,354.69,"/F8",9.96,"Posuere massa fusce ultrices hac pretium odio vehicula"
317.01,333.89,561.88,342.73,"/F8",9.96,"egestas. Quisque nulla. Nonummy morbi curae justo"
317.01,321.93,561.88,330.78,"/F8",9.96,"sapien ac. Vivamus donec enim turpis ve dolor arcu."
317.01,309.98,561.86,318.82,"/F8",9.96,"Cubilia massa cum dui in eget ut consectetuer quisque"
317.01,298.02,561.84,306.87,"/F8",9.96,"ipsum. Lacinia lorem elit nibh lacinia fusce adipiscing."
317.01,286.07,561.86,294.91,"/F8",9.96,"Aliquet massa sem duis auctor. Aliquam nulla in ac netus"
317.01,274.11,561.82,282.96,"/F8",9.96,"sollicitudin interdum dolor. Aliquet justo hac nibh porta"
317.01,262.16,561.82,271.00,"/F8",9.96,"cras netus taciti. Quisque nulla amet faucibus class id mi."
317.01,250.20,561.85,259.05,"/F8",9.96,"Aliquam morbi sem nulla convallis. Feugiat felis enim"
317.01,238.25,561.83,247.09,"/F8",9.96,"leo turpis posuere est. Lacinia velit arcu suspendisse pel-"
317.01,226.29,561.86,235.14,"/F8",9.96,"lentesque gravida arcu nunc adipiscing turpis nam ac."
317.01,214.34,561.87,223.18,"/F8",9.96,"Blandit lacus ut fusce lectus congue mus laoreet maece-"
317.01,202.38,545.19,211.23,"/F8",9.96,"nas purus. Sodales dolor dui cras eleifend sem enim."
326.98,190.12,561.88,198.97,"/F8",9.96,"Iaculis neque mi neque congue sem. Iaculis class lorem"
317.01,178.17,561.88,187.01,"/F8",9.96,"ornare mi justo sed vehicula gravida. Posuere lacus so-"
317.01,166.21,561.89,175.06,"/F8",9.96,"dales quam blandit at eu eros ve. Conubia neque eu"
317.01,154.26,561.84,163.10,"/F8",9.96,"dui condimentum aliquam nulla. Potenti fusce id. Inte-"
317.01,142.30,561.87,151.15,"/F8",9.96,"ger magna quis cum. Dapibus vitae ve mollis nascetur"
317.01,130.35,561.83,139.19,"/F8",9.96,"vulputate in etiam ac in nostra facilisi quam varius sagit-"
317.01,118.39,561.85,127.24,"/F8",9.96,"tis hac nisi. Quisque magna duis. Rhoncus nulla eu ligula"
