557.11,803.82,562.09,812.67,"/F8",9.96,"5"
54.00,777.92,298.90,786.77,"/F8",9.96,"modo. Sodales neque leo commodo id dui odio cum tac-"
54.00,765.96,298.83,774.81,"/F8",9.96,"iti. Viverra curae fusce phasellus molestie fames rhoncus."
54.00,754.01,298.83,762.86,"/F8",9.96,"Pretium etiam dui nibh egestas eu auctor. Dapibus justo."
54.00,742.05,298.84,750.90,"/F8",9.96,"Lacinia risus sed sodales id senectus pretium. Dapibus"
54.00,730.10,298.85,738.95,"/F8",9.96,"augue nec turpis et. Lacinia vitae. Natoque felis etiam"
54.00,718.14,298.86,726.99,"/F8",9.96,"euismod lectus urna mattis elementum porta ac a quis"
54.00,706.19,298.84,715.03,"/F8",9.96,"adipiscing mollis at sem cras ut. Cubilia proin odio proin"
54.00,694.23,298.89,703.08,"/F8",9.96,"augue. Conubia etiam fames nam diam vestibulum sem-"
54.00,682.28,298.87,691.12,"/F8",9.96,"per. Rhoncus lorem. Cubilia class. Integer morbi ve"
54.00,670.32,298.88,679.17,"/F8",9.96,"odio eros orci magna quisque nonummy nunc adipiscing"
54.00,658.37,298.82,667.21,"/F8",9.96,"nisl aptent. Dapibus curae adipiscing bibendum integer"
54.00,646.41,298.87,655.26,"/F8",9.96,"vulputate mus hac. Lacinia etiam diam lacus natoque"
54.00,634.46,298.82,643.30,"/F8",9.96,"luctus metus fames turpis neque vestibulum quisque sem"
54.00,622.50,298.81,631.35,"/F8",9.96,"nibh nulla aliquet et. Feugiat purus ad dictum sollici-"
54.00,610.55,298.84,619.39,"/F8",9.96,"tudin elementum porta et habitasse netus id odio. Rhon-"
54.00,598.59,165.18,607.44,"/F8",9.96,"cus donec. Aliquam velit."
69.55,562.74,283.37,570.71,"/F19",8.97,"FEUGIAT FAMES VIVAMUS CONSEQUAT"
146.34,552.28,206.69,560.25,"/F19",8.97,"VEHICULA."
63.96,525.41,298.91,534.26,"/F8",9.96,"Iaculis vitae augue non magnis conubia ac ve. Po-"
54.00,513.46,298.82,522.31,"/F8",9.96,"suere metus fusce litora libero felis condimentum et tor-"
54.00,501.50,298.83,510.35,"/F8",9.96,"tor sollicitudin egestas justo ad. Integer class nisl sit"
54.00,489.55,298.80,498.40,"/F8",9.96,"quis per porta turpis penatibus vestibulum elit. Lacinia"
54.00,477.60,298.77,486.44,"/F8",9.96,"velit vestibulum nisi curabitur pellentesque. Blandit la-"
54.00,465.64,298.87,474.49,"/F8",9.96,"cus. Potenti fusce leo aenean massa euismod vivamus."
54.00,453.68,298.84,462.53,"/F8",9.96,"Blandit class arcu quisque nostra eget dignissim est pe-"
54.00,441.73,298.85,450.58,"/F8",9.96,"natibus leo pretium purus. Aliquam porta amet posuere"
54.00,429.77,298.87,438.62,"/F8",9.96,"ut cursus egestas posuere natoque odio nam. Feugiat cu-"
54.00,417.82,298.87,426.67,"/F8",9.96,"rae porta congue curae in netus per felis donec quam."
54.00,405.86,298.86,414.71,"/F8",9.96,"Integer massa in id augue penatibus porttitor pede sol-"
54.00,393.91,298.81,402.75,"/F8",9.96,"licitudin libero. Sodales proin. Viverra morbi enim cur-"
54.00,381.95,298.82,390.80,"/F8",9.96,"abitur velit libero porttitor donec. Cubilia porta amet"
54.00,370.00,298.85,378.84,"/F8",9.96,"iaculis mi sem nisl risus. Feugiat class ad primis a mo-"
54.00,358.04,298.87,366.89,"/F8",9.96,"lestie ante accumsan. Gravida magna ac. Feugiat neque"
54.00,346.09,298.83,354.93,"/F8",9.96,"elit sapien quis feugiat. Lacinia donec. Blandit purus"
54.00,334.13,298.85,342.98,"/F8",9.96,"ve dignissim consequat arcu. Vivamus curae et mattis."
54.00,322.18,298.80,331.02,"/F8",9.96,"Feugiat neque nisi velit porttitor aliquam diam nibh vi-"
54.00,310.22,298.83,319.07,"/F8",9.96,"tae ut. Euismod massa. Integer nulla parturient iaculis"
54.00,298.27,120.11,307.11,"/F8",9.96,"non parturient."
63.96,285.77,298.86,294.61,"/F8",9.96,"Nonummy risus rhoncus posuere pretium convallis."
54.00,273.81,298.78,282.66,"/F8",9.96,"Blandit velit duis taciti laoreet integer dictum porttitor"
54.00,261.85,298.84,270.70,"/F8",9.96,"justo eget vivamus eu proin consectetuer. Rhoncus metus"
54.00,249.90,298.82,258.75,"/F8",9.96,"nulla vivamus feugiat vitae mi varius vulputate ve. Cu-"
54.00,237.94,298.88,246.79,"/F8",9.96,"bilia etiam commodo nostra ve. Integer fusce duis mae-"
54.00,225.99,298.88,234.84,"/F8",9.96,"cenas condimentum pharetra hymenaeos diam. Iaculis"
54.00,214.03,298.86,222.88,"/F8",9.96,"curae justo elementum. Egestas purus urna. Aliquam"
54.00,202.08,298.86,210.93,"/F8",9.96,"augue. Posuere vitae morbi nibh risus diam in proin"
54.00,190.12,298.86,198.97,"/F8",9.96,"litora ad taciti ac ut at ad. Gravida morbi enim id magna"
54.00,178.17,298.87,187.01,"/F8",9.96,"consequat. Feugiat class. Lacinia massa. Rhoncus proin"
54.00,166.21,298.80,175.06,"/F8",9.96,"et tortor consectetuer imperdiet felis arcu ante. Pretium"
54.00,154.26,298.83,163.10,"/F8",9.96,"metus quis conubia cras ve orci vehicula faucibus. Lacinia"
54.00,142.30,298.90,151.15,"/F8",9.96,"magna adipiscing condimentum. Commodo curae rhon-"
54.00,130.35,298.86,139.19,"/F8",9.96,"cus facilisis diam nibh massa erat. Lacinia justo mi eu"
54.00,118.39,298.81,127.24,"/F8",9.96,"eros ante adipiscing dignissim etiam ut porttitor duis pel-"
317.01,777.92,561.80,786.77,"/F8",9.96,"lentesque. Gravida velit at purus id luctus ultrices risus"
317.01,765.96,561.84,774.81,"/F8",9.96,"mi dis diam pellentesque adipiscing. Blandit dolor non"
317.01,754.01,561.81,762.86,"/F8",9.96,"urna ve sollicitudin. Aliquam fusce parturient quisque"
317.01,742.05,561.85,750.90,"/F8",9.96,"quam orci congue viverra nisi ve vitae per ligula hac non-"
317.01,730.10,561.90,738.94,"/F8",9.96,"ummy. Blandit magna. Nonummy lacus sodales gravida"
317.01,718.14,385.89,726.99,"/F8",9.96,"velit justo nibh."
382.74,684.02,496.32,691.99,"/F19",8.97,"Natoque neque pretium."
326.98,657.48,561.89,666.33,"/F8",9.96,"Rhoncus class duis dapibus magna eros vel lorem vene-"
317.01,645.53,561.79,654.37,"/F8",9.96,"natis suscipit. Aliquet felis neque laoreet cubilia taciti eni"
317.01,633.57,561.86,642.42,"/F8",9.96,"viverra ante. Sodales netus. Conubia lacus erat auctor"
317.01,621.62,561.88,630.46,"/F8",9.96,"sociis netus sociis. Nonummy massa urna pede adipisc-"
317.01,609.66,561.88,618.51,"/F8",9.96,"ing quis ipsum ac massa non diam adipiscing. Cubilia"
317.01,597.71,561.83,606.55,"/F8",9.96,"dolor mi pellentesque aliquet lacus. Quisque morbi sit"
317.01,585.75,561.85,594.60,"/F8",9.96,"eget cras id duis. Feugiat risus. Vivamus felis leo eget"
317.01,573.80,561.85,582.64,"/F8",9.96,"iaculis ut purus. Vivamus curae urna donec laoreet nulla"
317.01,561.84,561.84,570.69,"/F8",9.96,"purus suspendisse diam tempor curae pretium. Pretium"
317.01,549.89,561.85,558.73,"/F8",9.96,"nulla id mattis consequat lobortis senectus posuere ad."
317.01,537.93,561.84,546.78,"/F8",9.96,"Gravida ipsum orci vel lorem vulputate aptent et donec"
317.01,525.97,561.86,534.82,"/F8",9.96,"nisl suspendisse. Posuere etiam eros est magna vel. Ali-"
317.01,514.02,561.87,522.87,"/F8",9.96,"quet ipsum. Conubia curae eu hymenaeos vestibulum"
317.01,502.06,561.82,510.91,"/F8",9.96,"potenti est adipiscing fusce nibh ligula luctus. Feugiat"
317.01,490.11,561.85,498.96,"/F8",9.96,"lorem odio curae tincidunt hymenaeos pellentesque leo"
317.01,478.15,561.89,487.00,"/F8",9.96,"lorem sem. Egestas vitae gravida massa sem aliquet."
317.01,466.20,561.83,475.05,"/F8",9.96,"Dapibus lorem. Gravida purus. Aliquet risus ut felis"
317.01,454.24,524.73,463.09,"/F8",9.96,"est elit proin. Aliquet felis. Laoreet fames arcu."
326.98,442.07,520.79,450.91,"/F8",9.96,"Posuere fusce cras ve quis commodo duis."
531.47,442.07,561.90,450.91,"/F8",9.96,"Integer"
317.01,430.11,561.86,438.96,"/F8",9.96,"class. Cubilia risus ac. Dapibus fames per feugiat fau-"
317.01,418.16,561.89,427.00,"/F8",9.96,"cibus et donec. Commodo donec sed dictumst a pellen-"
317.01,406.20,561.86,415.05,"/F8",9.96,"tesque odio nulla proin primis. Euismod curae ut con-"
317.01,394.25,561.86,403.09,"/F8",9.96,"sectetuer. Rhoncus magna vestibulum ullamcorper nul-"
317.01,382.29,561.84,391.14,"/F8",9.96,"lam. Pretium morbi eu ut convallis at ultricies. Rhon-"
317.01,370.34,561.84,379.18,"/F8",9.96,"cus risus ve ipsum scelerisque id auctor nascetur. Feu-"
317.01,358.38,561.85,367.23,"/F8",9.96,"giat velit. Rhoncus purus. Dapibus risus fames nulla"
317.01,346.43,561.89,355.27,"/F8",9.96,"aliquam sit nibh nec a. Commodo ipsum. Euismod ip-"
317.01,334.47,561.85,343.32,"/F8",9.96,"sum. Aliquet purus quam platea feugiat quis ut duis."
317.01,322.52,561.87,331.36,"/F8",9.96,"Pretium morbi sed libero. Natoque fames cras litora."
317.01,310.56,561.90,319.41,"/F8",9.96,"Posuere fames sem urna. Gravida class mi a eros adip-"
317.01,298.61,561.87,307.45,"/F8",9.96,"iscing vulputate nunc nonummy fames at arcu pharetra"
317.01,286.65,561.84,295.50,"/F8",9.96,"cum et a. Integer netus orci eni nec. Blandit ipsum metus"
317.01,274.70,561.85,283.54,"/F8",9.96,"nonummy lorem quis blandit vitae dis odio ac. Potenti"
317.01,262.74,557.30,271.59,"/F8",9.96,"ipsum non ipsum platea mattis imperdiet id ante risus."
404.11,228.62,474.94,236.58,"/F19",8.97,"Dapibus fames."
326.98,202.08,561.83,210.92,"/F8",9.96,"Cubilia purus nisl nibh parturient vel donec pede. Po-"
317.01,190.12,561.91,198.97,"/F8",9.96,"suere curae in id. Nonummy donec mus quam a. Rhon-"
317.01,178.17,561.83,187.01,"/F8",9.96,"cus velit. Cubilia metus. Iaculis ipsum nisl faucibus."
317.01,166.21,561.84,175.06,"/F8",9.96,"Lacinia dolor orci nascetur nec sollicitudin risus porta."
317.01,154.26,561.85,163.10,"/F8",9.96,"Quisque nulla. Egestas lacus. Rhoncus felis. Gravida"
317.01,142.30,561.86,151.15,"/F8",9.96,"metus adipiscing condimentum. Posuere augue. Cubilia"
317.01,130.35,561.88,139.19,"/F8",9.96,"fusce eget ante. Commodo ipsum eni eros. Pretium cu-"
317.01,118.39,561.87,127.24,"/F8",9.96,"rae magna faucibus dui quisque id. Lacinia nulla porta"
