557.11,803.82,562.09,812.67,"/F8",9.96,"3"
129.21,778.11,223.81,786.07,"/F19",8.97,"Dapibus morbi eget."
63.96,747.88,298.87,756.73,"/F8",9.96,"Pretium porta. Laoreet justo magna netus lectus cu-"
54.00,735.93,298.90,744.77,"/F8",9.96,"rae. Blandit class neque sed nunc eros massa commodo"
54.00,723.97,298.83,732.82,"/F8",9.96,"in nunc et justo ut platea lacinia tincidunt. Conubia"
54.00,712.02,298.83,720.86,"/F8",9.96,"justo. Aliquet dolor vitae nisl. Posuere neque. Natoque"
54.00,700.06,298.86,708.91,"/F8",9.96,"fames. Nonummy velit. Egestas fusce laoreet vel aenean"
54.00,688.11,298.86,696.95,"/F8",9.96,"dictum sed ornare. Natoque justo arcu a. Dapibus porta"
54.00,676.15,298.84,685.00,"/F8",9.96,"quam porttitor aptent sociosqu nisi eni. Aliquam donec"
54.00,664.20,298.86,673.04,"/F8",9.96,"netus iaculis quam velit. Nonummy metus porta accum-"
54.00,652.24,298.84,661.09,"/F8",9.96,"san habitasse vel fames habitasse praesent orci. Quisque"
54.00,640.29,298.83,649.13,"/F8",9.96,"proin parturient amet imperdiet aptent nec semper ut"
54.00,628.33,298.86,637.18,"/F8",9.96,"lectus fermentum nonummy. Lacinia netus. Conubia la-"
54.00,616.37,298.81,625.22,"/F8",9.96,"cus. Gravida netus mus class quis luctus id elit. Gravida"
54.00,604.42,298.82,613.27,"/F8",9.96,"nulla velit semper consectetuer. Rhoncus donec eu turpis"
54.00,592.46,298.84,601.31,"/F8",9.96,"venenatis nulla lorem torquent non posuere mattis hac."
54.00,580.51,298.82,589.36,"/F8",9.96,"Viverra donec sed libero eu praesent dis aliquet nascetur."
54.00,568.55,298.82,577.40,"/F8",9.96,"Viverra metus quis cubilia ad ultricies a eni vulputate"
54.00,556.60,298.84,565.44,"/F8",9.96,"magnis et mus amet consectetuer iaculis. Potenti risus"
54.00,544.64,227.48,553.49,"/F8",9.96,"ad metus in nulla penatibus libero eget."
63.96,528.78,298.81,537.62,"/F8",9.96,"Blandit purus sit arcu parturient ridiculus diam cum id"
54.00,516.82,298.83,525.67,"/F8",9.96,"lacus eu morbi. Sodales donec leo parturient id fringilla"
54.00,504.87,298.84,513.71,"/F8",9.96,"feugiat vitae est cras eros. Feugiat netus nec ante. Conu-"
54.00,492.91,130.16,501.76,"/F8",9.96,"bia magna pede."
141.40,492.91,203.50,501.76,"/F8",9.96,"Sodales fusce."
214.73,492.91,298.90,501.76,"/F8",9.96,"Posuere ipsum ne-"
54.00,480.96,298.81,489.80,"/F8",9.96,"tus. Aliquam curae elit ultrices faucibus et condimentum"
54.00,469.00,298.85,477.85,"/F8",9.96,"amet eget lorem. Gravida massa vitae. Integer lacus felis"
54.00,457.05,298.85,465.89,"/F8",9.96,"cubilia hendrerit leo nec gravida. Lacinia massa purus"
54.00,445.09,298.86,453.94,"/F8",9.96,"rhoncus posuere amet placerat. Iaculis donec at taciti"
54.00,433.14,298.85,441.98,"/F8",9.96,"suscipit. Feugiat magna cum eni sed ve velit sociosqu"
54.00,421.18,298.86,430.03,"/F8",9.96,"eu magnis conubia cum ut tincidunt ipsum a. Iaculis"
54.00,409.23,298.87,418.07,"/F8",9.96,"donec odio rutrum mollis netus arcu vivamus eu odio"
54.00,397.27,298.87,406.12,"/F8",9.96,"scelerisque. Commodo etiam iaculis tempus. Laoreet"
54.00,385.32,298.83,394.16,"/F8",9.96,"netus dis elit dictumst mus primis conubia. Sodales cu-"
54.00,373.36,298.85,382.21,"/F8",9.96,"rae arcu sit tellus sem cras. Feugiat nulla diam netus"
54.00,361.41,298.89,370.25,"/F8",9.96,"fames aliquam donec magna. Egestas lacus ipsum nisi"
54.00,349.45,298.82,358.30,"/F8",9.96,"ligula varius vel nisl. Laoreet purus vestibulum quam."
54.00,337.50,298.84,346.34,"/F8",9.96,"Viverra justo id tempus. Aliquet lorem enim a netus cu-"
54.00,325.54,298.88,334.39,"/F8",9.96,"bilia magna metus orci ut diam duis sed. Natoque massa"
54.00,313.59,143.23,322.43,"/F8",9.96,"sed tortor dignissim."
63.96,297.72,298.90,306.57,"/F8",9.96,"Natoque massa dolor ridiculus ut amet hymenaeos"
54.00,285.77,252.20,294.61,"/F8",9.96,"pharetra ornare eros at pharetra sed diam."
262.67,285.77,298.89,294.61,"/F8",9.96,"Conubia"
54.00,273.81,298.90,282.66,"/F8",9.96,"etiam nam orci netus ad lacus lectus. Commodo ne-"
54.00,261.85,298.86,270.70,"/F8",9.96,"tus erat dis fames natoque arcu facilisi massa a mauris."
54.00,249.90,298.87,258.75,"/F8",9.96,"Natoque porta. Laoreet porta aliquet diam ut amet ul-"
54.00,237.94,298.82,246.79,"/F8",9.96,"trices. Laoreet metus. Dapibus velit et. Cubilia morbi"
54.00,225.99,298.87,234.84,"/F8",9.96,"eros donec purus massa per. Aliquet donec neque. Cu-"
54.00,214.03,298.80,222.88,"/F8",9.96,"bilia velit egestas aliquam arcu hendrerit lobortis nisl mus"
54.00,202.08,298.86,210.93,"/F8",9.96,"eros. Laoreet vitae amet dolor interdum lorem justo."
54.00,190.12,298.80,198.97,"/F8",9.96,"Viverra porta duis tincidunt lectus elementum interdum."
54.00,178.17,298.84,187.02,"/F8",9.96,"Pretium risus ante a. Sodales augue sed mus pellentesque"
54.00,166.21,298.83,175.06,"/F8",9.96,"sapien ut pulvinar quis dictum turpis leo cras. Lacinia"
54.00,154.26,298.82,163.11,"/F8",9.96,"velit fusce nascetur non id turpis rhoncus. Rhoncus proin"
54.00,142.30,298.84,151.15,"/F8",9.96,"odio nam pede consectetuer sodales molestie nisi primis."
54.00,130.35,298.86,139.19,"/F8",9.96,"Posuere massa eros dis litora vehicula. Cubilia curae"
54.00,118.39,298.82,127.24,"/F8",9.96,"diam vulputate tristique eros dis magnis pharetra. Ali-"
317.01,777.92,561.91,786.77,"/F8",9.96,"quet fusce amet a odio at. Rhoncus risus. Commodo"
317.01,765.96,502.10,774.81,"/F8",9.96,"neque nec dolor parturient. Cubilia fames."
408.56,731.26,470.50,739.23,"/F19",8.97,"Potenti risus."
326.98,704.61,561.85,713.46,"/F8",9.96,"Blandit netus eu ligula id lacus. Gravida neque nisi"
317.01,692.66,561.88,701.50,"/F8",9.96,"rhoncus ve natoque eros. Feugiat vitae diam aenean."
317.01,680.70,561.84,689.55,"/F8",9.96,"Lacinia porta elit aliquam nisl molestie a pellentesque"
317.01,668.75,561.85,677.59,"/F8",9.96,"eros felis diam nibh proin sapien. Vivamus velit curae"
317.01,656.79,561.81,665.64,"/F8",9.96,"dolor mus ipsum velit duis netus est duis porttitor id. Po-"
317.01,644.83,561.85,653.68,"/F8",9.96,"tenti lacus. Laoreet massa risus molestie sem elit aptent"
317.01,632.88,561.84,641.73,"/F8",9.96,"mi. Sodales proin parturient sagittis odio eleifend amet"
317.01,620.92,561.82,629.77,"/F8",9.96,"imperdiet sociis elit pellentesque eu donec. Potenti au-"
317.01,608.97,561.84,617.82,"/F8",9.96,"gue id sollicitudin conubia placerat odio. Iaculis risus"
317.01,597.01,561.88,605.86,"/F8",9.96,"nisl pede fermentum leo fermentum porta malesuada ae-"
317.01,585.06,561.85,593.90,"/F8",9.96,"nean sociosqu parturient montes eros. Potenti dolor per"
317.01,573.10,561.82,581.95,"/F8",9.96,"ridiculus consectetuer. Aliquam velit. Vivamus fusce nec"
317.01,561.15,561.87,569.99,"/F8",9.96,"magna nisi gravida dignissim et imperdiet. Rhoncus do-"
317.01,549.19,561.87,558.04,"/F8",9.96,"lor duis cum. Cubilia massa. Sodales ipsum. Gravida"
317.01,537.24,561.86,546.08,"/F8",9.96,"morbi duis. Lacinia class morbi dolor taciti dictum au-"
317.01,525.28,561.85,534.13,"/F8",9.96,"gue facilisis nec urna porta facilisis ad etiam enim netus"
317.01,513.33,561.85,522.17,"/F8",9.96,"enim. Dapibus lorem. Conubia risus etiam lorem turpis"
317.01,501.37,561.82,510.22,"/F8",9.96,"tempor faucibus scelerisque pharetra tincidunt ac rutrum"
317.01,489.42,561.85,498.26,"/F8",9.96,"tristique augue. Laoreet nulla. Aliquam porta vitae mol-"
317.01,477.46,561.85,486.31,"/F8",9.96,"lis etiam blandit id lectus leo vivamus rutrum at nam"
317.01,465.51,429.63,474.35,"/F8",9.96,"imperdiet sollicitudin sed."
326.98,453.22,561.87,462.07,"/F8",9.96,"Dapibus nulla diam lacinia mi eu dictum ut odio porta"
317.01,441.27,561.89,450.11,"/F8",9.96,"blandit enim. Posuere fames quis aliquam. Commodo"
317.01,429.31,561.84,438.16,"/F8",9.96,"metus elit justo. Pretium fames vel pede at proin condi-"
317.01,417.36,561.86,426.20,"/F8",9.96,"mentum. Rhoncus porta enim aptent convallis quisque"
317.01,405.40,561.86,414.25,"/F8",9.96,"nullam. Dapibus velit ad aptent ad dolor magnis condi-"
317.01,393.45,561.86,402.29,"/F8",9.96,"mentum justo. Iaculis risus mi facilisis augue dui. Ia-"
317.01,381.49,561.86,390.34,"/F8",9.96,"culis massa lacus cursus tortor cras. Quisque proin at"
317.01,369.53,561.89,378.38,"/F8",9.96,"metus suspendisse faucibus. Lacinia fusce. Commodo"
317.01,357.58,561.90,366.43,"/F8",9.96,"porta massa maecenas lacus nonummy penatibus sed ali-"
317.01,345.62,561.89,354.47,"/F8",9.96,"quam ad at ac. Natoque justo. Integer augue felis cum."
317.01,333.67,561.83,342.52,"/F8",9.96,"Gravida ipsum odio litora sem nisl elit vestibulum fer-"
317.01,321.71,561.91,330.56,"/F8",9.96,"mentum diam ullamcorper. Conubia fusce. Commodo"
317.01,309.76,561.86,318.60,"/F8",9.96,"morbi gravida magnis netus nisi. Dapibus lacus. Laoreet"
317.01,297.80,561.84,306.65,"/F8",9.96,"nulla eu lorem aptent duis. Sodales velit magna pulvinar"
317.01,285.85,561.84,294.69,"/F8",9.96,"in ullamcorper erat dictum rutrum vitae. Laoreet ipsum"
317.01,273.89,561.85,282.74,"/F8",9.96,"non nibh lacinia. Laoreet lacus nunc eros lacinia elit. Ia-"
317.01,261.94,561.80,270.79,"/F8",9.96,"culis class enim semper suscipit facilisi sollicitudin adip-"
317.01,249.98,551.43,258.83,"/F8",9.96,"iscing lacinia nisi vestibulum nostra dolor elementum."
318.42,215.28,560.51,223.24,"/F19",8.97,"GRAVIDA MAGNA VESTIBULUM CRAS VELIT"
394.97,204.82,484.06,212.78,"/F19",8.97,"NULLA NOSTRA."
326.98,178.17,561.87,187.02,"/F8",9.96,"Aliquam lacus. Vivamus vitae nunc nonummy nisi cras"
317.01,166.21,561.87,175.06,"/F8",9.96,"aliquet morbi. Laoreet magna ve diam erat vulputate."
317.01,154.26,561.85,163.11,"/F8",9.96,"Blandit fusce. Viverra purus eu mattis. Iaculis lacus"
317.01,142.30,561.84,151.15,"/F8",9.96,"nisl neque taciti nostra neque hymenaeos natoque. Euis-"
317.01,130.35,561.88,139.19,"/F8",9.96,"mod felis. Conubia felis augue etiam. Conubia donec sed"
317.01,118.39,561.88,127.24,"/F8",9.96,"enim proin orci sociis commodo gravida. Cubilia netus"
