37.61,748.78,288.47,757.62,"/F8",9.96,"nullam a nonummy. Laoreet metus quam sed. Pretium"
37.61,736.82,288.44,745.67,"/F8",9.96,"class vel cras consectetuer. Natoque neque. Natoque cu-"
37.61,724.87,288.47,733.71,"/F8",9.96,"rae cum. Pretium magna diam sit in urna enim morbi"
37.61,712.91,288.42,721.76,"/F8",9.96,"posuere inceptos montes. Lacinia justo diam elit parturi-"
37.61,700.96,288.44,709.80,"/F8",9.96,"ent malesuada ullamcorper est ante. Sodales felis ac enim"
37.61,689.00,288.47,697.85,"/F8",9.96,"dui hac. Nonummy proin. Dapibus etiam dui. Commodo"
37.61,677.04,288.44,685.89,"/F8",9.96,"fames ve primis vel. Gravida lorem nulla lorem eget. Po-"
37.61,665.09,138.03,673.94,"/F8",9.96,"suere nulla elit dictum."
52.56,653.13,288.45,661.98,"/F8",9.96,"Blandit ipsum in a duis fusce mi per erat dignissim"
37.61,641.18,288.44,650.03,"/F8",9.96,"aptent mi hymenaeos aliquet lorem. Egestas porta felis"
37.61,629.22,288.43,638.07,"/F8",9.96,"nam montes convallis. Cubilia lacus nibh proin enim cras"
37.61,617.27,288.42,626.11,"/F8",9.96,"ante vehicula. Viverra donec mi. Posuere ipsum parturi-"
37.61,605.31,288.39,614.16,"/F8",9.96,"ent potenti dis ut convallis aliquet. Potenti neque arcu"
37.61,593.36,288.48,602.20,"/F8",9.96,"donec at magnis porta senectus nec ve dolor. Rhoncus"
37.61,581.40,288.45,590.25,"/F8",9.96,"vitae quam iaculis mi erat eu sociosqu duis. Nonummy"
37.61,569.45,288.43,578.29,"/F8",9.96,"ipsum. Potenti porta etiam sit quam class venenatis eu"
37.61,557.49,288.41,566.34,"/F8",9.96,"turpis pellentesque cum proin. Lacinia augue vestibulum"
37.61,545.54,288.38,554.38,"/F8",9.96,"quis lectus tincidunt vestibulum ante magnis hendrerit fe-"
37.61,533.58,288.43,542.43,"/F8",9.96,"lis habitant nunc. Integer dolor id magnis volutpat sus-"
37.61,521.63,288.37,530.47,"/F8",9.96,"cipit pellentesque parturient aliquet pede. Pretium augue."
37.61,509.67,288.42,518.52,"/F8",9.96,"Egestas vitae nulla libero erat magna facilisi velit ac fe-"
37.61,497.72,288.42,506.56,"/F8",9.96,"lis. Vivamus lacus nisl netus vivamus duis consectetuer"
37.61,485.76,288.47,494.61,"/F8",9.96,"eu natoque ad hymenaeos fames ante nullam sapien. So-"
37.61,473.81,288.45,482.65,"/F8",9.96,"dales fames urna. Sodales dolor laoreet eros diam cubilia"
37.61,461.85,288.46,470.70,"/F8",9.96,"at eu. Lacinia dolor. Sodales porta ac nec erat montes id"
37.61,449.90,288.41,458.74,"/F8",9.96,"metus luctus condimentum. Rhoncus nulla proin ultrices."
37.61,437.94,288.45,446.79,"/F8",9.96,"Rhoncus lorem ac penatibus id lorem ad lorem non facilisi"
37.61,425.99,288.44,434.83,"/F8",9.96,"facilisis eni porttitor magnis. Laoreet lorem. Nonummy"
37.61,414.03,61.71,422.88,"/F8",9.96,"justo."
37.61,390.12,185.94,398.97,"/F27",9.96,"4.2. Commodo porta dolor ipsum."
52.56,375.18,288.45,384.02,"/F8",9.96,"Commodo vitae vestibulum interdum posuere. Posuere"
37.61,363.22,288.45,372.07,"/F8",9.96,"fames ad augue ad taciti gravida auctor et. Laoreet velit"
37.61,351.27,288.40,360.11,"/F8",9.96,"sed justo dignissim habitant mollis tellus justo sagittis."
37.61,339.31,288.38,348.16,"/F8",9.96,"Pretium metus et tortor sollicitudin convallis ipsum tris-"
37.61,327.36,288.44,336.20,"/F8",9.96,"tique cursus neque quam. Posuere netus ve auctor vo-"
37.61,315.40,288.37,324.25,"/F8",9.96,"lutpat fringilla in ve diam taciti parturient felis nisi. Na-"
37.61,303.45,288.42,312.29,"/F8",9.96,"toque augue mi fames vulputate vestibulum ante nullam in"
37.61,291.49,288.45,300.34,"/F8",9.96,"id. Natoque dolor lacus morbi magnis consectetuer blan-"
37.61,279.54,288.43,288.38,"/F8",9.96,"dit donec. Viverra purus non orci parturient sed. Po-"
37.61,267.58,288.44,276.43,"/F8",9.96,"suere neque quis fringilla. Nonummy augue. Egestas ne-"
37.61,255.62,288.42,264.47,"/F8",9.96,"tus lorem sem potenti eu sagittis dapibus. Potenti morbi"
37.61,243.67,288.45,252.52,"/F8",9.96,"sit quis parturient. Cubilia augue commodo. Nonummy"
37.61,231.71,288.43,240.56,"/F8",9.96,"nulla quam sed a primis nisi urna aliquam pretium nunc."
37.61,219.76,288.43,228.61,"/F8",9.96,"Pretium morbi. Iaculis donec ve. Iaculis netus. Natoque"
37.61,207.80,288.46,216.65,"/F8",9.96,"magna nisl at vitae justo nec eros tempor mi. Gravida"
37.61,195.85,288.42,204.70,"/F8",9.96,"felis et montes morbi ullamcorper inceptos fusce. Feugiat"
37.61,183.89,288.41,192.74,"/F8",9.96,"morbi erat egestas eni molestie a pellentesque elit purus"
37.61,171.94,288.38,180.79,"/F8",9.96,"suscipit. Blandit felis conubia id ultricies elementum arcu"
37.61,159.98,288.49,168.83,"/F8",9.96,"sem lorem curae risus magna. Laoreet massa metus nul-"
37.61,148.03,56.41,156.88,"/F8",9.96,"lam."
52.56,136.07,247.53,144.92,"/F8",9.96,"Posuere morbi id orci malesuada nascetur."
258.04,136.07,288.47,144.92,"/F8",9.96,"Integer"
37.61,124.12,288.43,132.96,"/F8",9.96,"risus nonummy libero sapien lobortis. Viverra curae eni"
37.61,112.16,289.28,121.01,"/F8",9.96,"etiam tincidunt suspendisse eni lectus. Potenti purus etiam"
37.61,100.21,147.99,109.05,"/F8",9.96,"habitasse nascetur nunc."
158.05,100.21,288.42,109.05,"/F8",9.96,"Cubilia proin ut nisi rutrum"
37.61,88.25,288.39,97.10,"/F8",9.96,"aliquet ante. Cubilia fusce urna lobortis eni sollicitudin"
306.60,748.78,557.45,757.62,"/F8",9.96,"aptent eros. Pretium magna ad imperdiet a nam dignis-"
306.60,736.82,557.40,745.67,"/F8",9.96,"sim. Sodales purus nisi feugiat nostra mi quis vitae biben-"
306.60,724.87,557.44,733.71,"/F8",9.96,"dum nisl varius. Natoque justo morbi. Conubia lorem"
306.60,712.91,557.38,721.76,"/F8",9.96,"lacinia urna habitant sollicitudin turpis. Integer fames et"
306.60,700.95,557.41,709.80,"/F8",9.96,"risus litora turpis risus cras a. Rhoncus lorem erat orci ia-"
306.60,689.00,557.39,697.85,"/F8",9.96,"culis id odio bibendum scelerisque torquent odio. Blandit"
306.60,677.04,557.42,685.89,"/F8",9.96,"curae purus cum quam est id netus. Viverra augue elit na-"
306.60,665.09,557.44,673.94,"/F8",9.96,"toque in ad at ac nunc id habitant metus. Lacinia massa."
306.60,653.13,557.41,661.98,"/F8",9.96,"Integer etiam. Quisque vitae. Feugiat massa quis sit cum"
306.60,641.18,557.46,650.02,"/F8",9.96,"dis iaculis enim a amet fusce ve magnis purus. Rhon-"
306.60,629.22,557.40,638.07,"/F8",9.96,"cus velit ac augue nascetur erat blandit eu sagittis nullam"
306.60,617.27,557.41,626.11,"/F8",9.96,"amet scelerisque ve. Vivamus porta parturient et nullam"
306.60,605.31,557.39,614.16,"/F8",9.96,"pretium consequat nunc eni justo. Aliquet class vitae pul-"
306.60,593.36,557.42,602.20,"/F8",9.96,"vinar nisl in cum curabitur. Conubia magna vestibulum"
306.60,581.40,395.45,590.25,"/F8",9.96,"ullamcorper rutrum."
321.55,569.45,557.40,578.29,"/F8",9.96,"Vivamus velit dui vestibulum dolor ante hendrerit ac."
306.60,557.49,562.66,566.34,"/F8",9.96,"Quisque ipsum parturient eu dictumst euismod consectetuer"
306.60,545.54,557.42,554.38,"/F8",9.96,"aenean mi dui eu lorem id. Blandit dolor nunc mollis conu-"
306.60,533.58,557.46,542.43,"/F8",9.96,"bia eros id. Potenti massa pede laoreet. Commodo donec"
306.60,521.63,557.40,530.47,"/F8",9.96,"ut. Posuere felis amet iaculis justo parturient. Conubia"
306.60,509.67,557.42,518.52,"/F8",9.96,"risus vitae nullam est. Pretium ipsum vivamus magnis"
306.60,497.72,557.42,506.56,"/F8",9.96,"amet et dignissim velit quis suspendisse nam. Nonummy"
306.60,485.76,557.44,494.61,"/F8",9.96,"morbi quis nec magnis etiam sed habitasse proin sed. Non-"
306.60,473.81,557.41,482.65,"/F8",9.96,"ummy purus nec ultricies vel iaculis ad posuere eget. Non-"
306.60,461.85,557.46,470.70,"/F8",9.96,"ummy class cras. Gravida metus. Conubia lorem pede"
306.60,449.90,557.42,458.74,"/F8",9.96,"risus id lacus cum sem non sollicitudin sapien lorem. So-"
306.60,437.94,557.39,446.79,"/F8",9.96,"dales vitae adipiscing lobortis cubilia molestie semper par-"
306.60,425.99,557.38,434.83,"/F8",9.96,"turient class nisl. Aliquet fusce pede donec scelerisque ad"
306.60,414.03,557.39,422.88,"/F8",9.96,"tellus suscipit eros. Posuere purus enim a. Aliquet neque"
306.60,402.08,557.45,410.92,"/F8",9.96,"cras eni nonummy lobortis consectetuer. Commodo fusce"
306.60,390.12,557.40,398.97,"/F8",9.96,"ve consectetuer amet aliquam ut lorem tincidunt primis"
306.60,378.17,557.45,387.01,"/F8",9.96,"ve elit. Aliquam fames hac eros a. Iaculis class nonummy"
306.60,366.21,557.41,375.06,"/F8",9.96,"ante lorem. Lacinia lorem elit lacus vivamus tincidunt"
306.60,354.25,557.44,363.10,"/F8",9.96,"nunc sem. Euismod augue eu penatibus parturient mus"
306.60,342.30,451.64,351.15,"/F8",9.96,"fames luctus vulputate ut primis."
310.84,328.90,319.77,335.98,"/F19",7.97,"[1]"
324.75,328.90,557.56,335.98,"/F19",7.97,"T. Shifrin, Curvature integrals and Chern classes of singular"
324.76,319.44,370.63,326.52,"/F19",7.97,"varieties, in:"
375.85,319.44,557.55,326.52,"/F19",7.97,"Integral Geoemetry, Proceedings, Contemporary"
324.76,309.97,428.00,317.05,"/F19",7.97,"Mathematics, Vol. 63, 1984."
310.84,300.51,319.77,307.59,"/F19",7.97,"[2]"
324.75,300.51,557.54,307.59,"/F19",7.97,"A. Parusinski, P. Pragacz, Characteristic classes of hypersur-"
324.76,291.05,531.48,298.12,"/F19",7.97,"faces and characteristic cycles, preprint (January 1998)."
310.84,281.58,319.77,288.66,"/F19",7.97,"[3]"
324.75,281.58,557.56,288.66,"/F19",7.97,"B. Totaro, Chern numbers for singular varieties and elliptic ho-"
324.76,272.12,423.28,279.19,"/F19",7.97,"mology, preprint? (1997?)."
310.84,262.65,319.77,269.73,"/F19",7.97,"[4]"
324.75,262.65,519.49,269.73,"/F19",7.97,"A. H. Durfee, Singularities, preprint (January 1998)."
310.84,253.19,319.77,260.27,"/F19",7.97,"[5]"
324.75,253.19,557.54,260.27,"/F19",7.97,"L. D. Trang, Z. Mebkhout, Varietes caracteristiques et varietes"
324.76,243.72,514.36,250.80,"/F19",7.97,"polaires, C. R. Acad. Sc. Paris 296 (1983) 129{132."
310.84,234.26,319.77,241.34,"/F19",7.97,"[6]"
324.75,234.26,333.74,241.34,"/F19",7.97,"G."
338.88,234.26,373.20,241.34,"/F19",7.97,"Kennedy,"
378.90,234.26,429.93,241.34,"/F19",7.97,"Specialization"
435.06,234.26,441.87,241.34,"/F19",7.97,"of"
447.01,234.26,498.23,241.34,"/F19",7.97,"MacPherson's"
503.36,234.26,525.94,241.34,"/F19",7.97,"Chern"
531.08,234.26,557.55,241.34,"/F19",7.97,"classes,"
324.76,224.79,438.31,231.87,"/F19",7.97,"Math. Scand. 66 (1990) 12{16."
310.84,214.17,319.77,221.25,"/F19",7.97,"[7]"
324.75,214.17,390.92,221.25,"/F19",7.97,"D. Siersma, M. Ti"
391.19,216.27,395.42,223.35,"/F19",7.97,""
390.95,214.17,557.58,221.25,"/F19",7.97,"bar, Singularities at innity and their vanish-"
324.76,204.70,491.72,211.78,"/F19",7.97,"ing cycles, Duke Math. J. 80 (1995) 771{783."
310.84,195.24,319.77,202.32,"/F19",7.97,"[8]"
324.75,195.24,557.54,202.32,"/F19",7.97,"J.-P. Dax, Points singuliers normaux, points singuliers normaux"
324.76,185.77,557.57,192.85,"/F19",7.97,"simples et modeles d'elimination, C. R. Acad. Sci. Paris 315"
324.76,176.31,383.07,183.39,"/F19",7.97,"(1992) 315{319."
310.84,166.84,319.77,173.92,"/F19",7.97,"[9]"
324.75,166.84,557.52,173.92,"/F19",7.97,"M. Goresky, R. MacPherson, Intersection homology II, Invent."
324.76,157.38,415.27,164.46,"/F19",7.97,"Math. 71 (1983) 77{129."
306.60,147.92,319.77,154.99,"/F19",7.97,"[10]"
324.75,147.92,557.53,154.99,"/F19",7.97,"G. Gonzalez-Sprinberg, Cycle maximal et invariant d'Euler local"
324.76,138.45,557.55,145.53,"/F19",7.97,"des singularites isolees de surfaces, Topology 21 (1982) 401{408."
306.60,128.99,319.77,136.06,"/F19",7.97,"[11]"
324.75,128.99,557.56,136.06,"/F19",7.97,"J.-P. Brasselet, M. H. Schwartz, Sur les classes de Chern d'un"
324.76,119.52,557.53,126.60,"/F19",7.97,"ensemble analytique complexe, Asterisque 82-83 (1981) 93{147."
306.60,110.06,319.77,117.14,"/F19",7.97,"[12]"
324.75,110.06,557.55,117.14,"/F19",7.97,"R. MacPherson, Chern classes for singular algebraic varieties,"
324.76,100.59,454.28,107.67,"/F19",7.97,"Ann. of Math. 100 (1974) 423{432."
306.60,91.13,319.77,98.21,"/F19",7.97,"[13]"
324.75,91.13,557.55,98.21,"/F19",7.97,"J.-L. Verdier, Specialisation des classes de Chern, Asterisque"
324.76,81.66,419.74,88.74,"/F19",7.97,"82{83 (1978{1979) 45{69."
295.15,61.35,300.13,70.20,"/F8",9.96,"6"
