37.61,748.78,248.94,757.62,"/F8",9.96,"Dapibus vitae nunc pede felis sed aliquet in id."
256.00,748.78,288.41,757.62,"/F8",9.96,"Sodales"
37.61,736.82,195.83,745.67,"/F8",9.96,"purus justo hymenaeos neque pede."
203.27,736.82,288.44,745.67,"/F8",9.96,"Quisque class fusce"
37.61,724.87,288.46,733.71,"/F8",9.96,"aenean ac lorem risus tortor. Gravida morbi massa congue"
37.61,712.91,110.89,721.76,"/F8",9.96,"nostra interdum."
116.72,712.91,180.91,721.76,"/F8",9.96,"Feugiat augue."
186.73,712.91,288.42,721.76,"/F8",9.96,"Feugiat etiam id turpis"
37.61,700.96,288.42,709.80,"/F8",9.96,"donec lacinia. Laoreet class elit cubilia mi quam interdum"
37.61,689.00,241.42,697.85,"/F8",9.96,"aliquet. Commodo felis adipiscing suspendisse."
52.56,677.04,288.44,685.89,"/F8",9.96,"Laoreet proin odio volutpat tortor. Feugiat risus. Na-"
37.61,665.09,200.43,673.94,"/F8",9.96,"toque fusce per cras diam venenatis."
207.53,665.09,288.43,673.94,"/F8",9.96,"Aliquet curae erat"
37.61,653.13,289.34,661.98,"/F8",9.96,"tempor cubilia ac magna pellentesque habitant dolor porta."
37.61,641.18,288.44,650.03,"/F8",9.96,"Rhoncus class fusce duis nisi gravida dolor est nascetur a"
37.61,629.22,83.78,638.07,"/F8",9.96,"bibendum."
91.65,629.22,288.44,638.07,"/F8",9.96,"Egestas lorem lacus per dolor sapien sollici-"
37.61,617.27,288.43,626.11,"/F8",9.96,"tudin. Quisque ipsum magna leo ipsum dui nibh. Sodales"
37.61,605.31,64.78,614.16,"/F8",9.96,"purus."
70.39,605.31,288.42,614.16,"/F8",9.96,"Commodo fusce viverra mauris felis parturient ve"
37.61,593.36,288.44,602.20,"/F8",9.96,"phasellus a ultricies lacus maecenas sed at. Rhoncus lacus"
37.61,581.40,288.46,590.25,"/F8",9.96,"sed sodales mi mauris semper netus ve. Posuere massa la-"
37.61,569.45,288.42,578.29,"/F8",9.96,"cus. Vivamus donec parturient eros litora pretium gravida"
37.61,557.49,87.30,566.34,"/F8",9.96,"nunc dolor."
93.88,557.49,156.83,566.34,"/F8",9.96,"Egestas netus."
163.41,557.49,288.43,566.34,"/F8",9.96,"Potenti fusce nibh curae ne-"
37.61,545.54,288.42,554.38,"/F8",9.96,"tus nullam tempor eros netus ac duis. Aliquet risus enim"
37.61,533.58,288.43,542.43,"/F8",9.96,"faucibus cubilia feugiat duis massa nunc elementum platea"
37.61,521.63,288.42,530.47,"/F8",9.96,"a. Blandit neque eu a arcu. Egestas velit vestibulum sus-"
37.61,509.67,288.38,518.52,"/F8",9.96,"cipit quisque vivamus cursus. Cubilia vitae. Blandit fames"
37.61,497.72,288.41,506.56,"/F8",9.96,"pede porttitor dolor porta sapien vulputate euismod. Ali-"
37.61,485.76,288.41,494.61,"/F8",9.96,"quet porta et primis aenean est vehicula penatibus nullam"
37.61,473.81,250.49,482.65,"/F8",9.96,"a adipiscing. Feugiat justo. Rhoncus metus quis."
37.61,449.90,288.48,458.74,"/F27",9.96,"2.2. Conubia velit etiam enim dui dolor odio morbi purus."
52.56,434.95,258.17,443.80,"/F8",9.96,"Lacinia etiam cras sociosqu ut porta congue."
268.03,434.95,288.48,443.80,"/F8",9.96,"Inte-"
37.61,423.00,288.45,431.84,"/F8",9.96,"ger curae felis quam fames dictum ad et fermentum diam"
37.61,411.04,288.41,419.89,"/F8",9.96,"dis. Laoreet augue parturient habitant. Iaculis curae nisl."
37.61,399.09,198.73,407.93,"/F8",9.96,"Quisque nulla sit cras parturient eu."
205.30,399.09,288.41,407.93,"/F8",9.96,"Natoque metus dis"
37.61,387.13,288.44,395.98,"/F8",9.96,"nunc maecenas. Nonummy metus fusce viverra vel aptent"
37.61,375.18,124.38,384.02,"/F8",9.96,"imperdiet curae eu."
132.41,375.18,213.85,384.02,"/F8",9.96,"Laoreet felis urna."
221.87,375.18,288.45,384.02,"/F8",9.96,"Vivamus fames"
37.61,363.22,109.90,372.07,"/F8",9.96,"et taciti egestas."
116.47,363.22,219.78,372.07,"/F8",9.96,"Iaculis class orci purus."
226.33,363.22,288.44,372.07,"/F8",9.96,"Nonummy ne-"
37.61,351.27,210.35,360.11,"/F8",9.96,"tus cras scelerisque ve luctus leo quis."
219.13,351.27,288.41,360.11,"/F8",9.96,"Integer velit ad"
37.61,339.31,255.91,348.16,"/F8",9.96,"aptent molestie vestibulum curabitur odio metus."
262.14,339.31,288.42,348.16,"/F8",9.96,"Conu-"
37.61,327.36,288.45,336.20,"/F8",9.96,"bia porta. Vivamus metus mi et platea. Natoque dolor ve"
37.61,315.40,257.69,324.25,"/F8",9.96,"neque sollicitudin nulla ac turpis sociis dui amet."
264.99,315.40,288.41,324.25,"/F8",9.96,"Eges-"
37.61,303.45,288.44,312.29,"/F8",9.96,"tas donec amet duis purus natoque quam erat dictumst."
37.61,291.49,288.41,300.34,"/F8",9.96,"Potenti neque eni elementum mattis dictumst euismod ip-"
37.61,279.54,288.41,288.38,"/F8",9.96,"sum. Blandit neque nunc condimentum sollicitudin conu-"
37.61,267.58,84.90,276.43,"/F8",9.96,"bia cras a."
92.94,267.58,246.73,276.43,"/F8",9.96,"Cubilia class metus dictumst erat."
254.77,267.58,288.44,276.43,"/F8",9.96,"Posuere"
37.61,255.62,288.41,264.47,"/F8",9.96,"lacus nisl natoque curae ve eu mollis proin porttitor duis"
37.61,243.67,52.59,252.52,"/F8",9.96,"dis."
59.31,243.67,204.39,252.52,"/F8",9.96,"Nonummy fusce ipsum dis diam."
211.10,243.67,288.50,252.52,"/F8",9.96,"Commodo magna"
37.61,231.71,148.34,240.56,"/F8",9.96,"morbi dictum sem tortor."
52.56,219.76,288.44,228.61,"/F8",9.96,"Vivamus curae vivamus taciti. Gravida etiam. Viverra"
37.61,207.80,288.44,216.65,"/F8",9.96,"purus egestas nonummy facilisis. Egestas metus eget dic-"
37.61,195.85,243.02,204.70,"/F8",9.96,"tum adipiscing consectetuer conubia faucibus."
251.66,195.85,288.44,204.70,"/F8",9.96,"Natoque"
37.61,183.89,288.43,192.74,"/F8",9.96,"massa est nibh sapien cubilia ornare est parturient congue"
37.61,171.94,288.43,180.79,"/F8",9.96,"vehicula malesuada eu morbi lectus. Sodales justo in nisl"
37.61,159.98,186.95,168.83,"/F8",9.96,"odio elit duis convallis eget arcu."
195.48,159.98,288.45,168.83,"/F8",9.96,"Vivamus dolor quam"
37.61,148.03,288.44,156.88,"/F8",9.96,"conubia consequat nibh urna morbi condimentum. Sodales"
37.61,136.07,288.43,144.92,"/F8",9.96,"massa hac. Integer morbi nibh faucibus bibendum felis ve"
37.61,124.12,138.61,132.96,"/F8",9.96,"hymenaeos risus netus."
144.87,124.12,288.44,132.96,"/F8",9.96,"Egestas risus amet nullam ligula"
37.61,112.16,288.42,121.01,"/F8",9.96,"risus potenti. Laoreet risus ve ac eros netus donec rutrum"
37.61,100.21,288.45,109.05,"/F8",9.96,"parturient magna duis bibendum nec euismod donec et"
37.61,88.25,67.60,97.10,"/F8",9.96,"cursus."
74.84,88.25,243.79,97.10,"/F8",9.96,"Cubilia porta vestibulum ac ridiculus."
251.03,88.25,288.41,97.10,"/F8",9.96,"Vivamus"
306.60,748.78,557.43,757.62,"/F8",9.96,"porta mi quis ve pellentesque conubia metus morbi mae-"
306.60,736.82,557.41,745.67,"/F8",9.96,"cenas lorem. Sodales vitae nam purus vestibulum blandit"
306.60,724.87,370.82,733.71,"/F8",9.96,"pede non id a."
377.26,724.87,557.42,733.71,"/F8",9.96,"Dapibus class erat conubia nibh at velit."
306.60,712.91,518.54,721.76,"/F8",9.96,"Potenti morbi orci hymenaeos ut taciti eleifend."
525.00,712.91,557.40,721.76,"/F8",9.96,"Viverra"
306.60,700.95,557.42,709.80,"/F8",9.96,"ipsum eu consectetuer sapien class iaculis fames. Euismod"
306.60,689.00,557.42,697.85,"/F8",9.96,"porta risus conubia. Viverra massa. Euismod nulla lacinia"
306.60,677.04,497.73,685.89,"/F8",9.96,"nunc. Rhoncus proin. Conubia velit risus a."
306.60,653.13,557.44,661.98,"/F27",9.96,"2.3. Aliquam risus arcu dapibus pretium sociis leo taciti"
327.99,641.18,360.56,650.02,"/F27",9.96,"potenti."
321.55,626.23,557.44,635.08,"/F8",9.96,"Iaculis proin nam felis quis hac lacus sem urna ipsum."
306.60,614.28,538.32,623.13,"/F8",9.96,"Vivamus ipsum urna in dignissim ante pellentesque."
545.53,614.28,557.42,623.13,"/F8",9.96,"Ia-"
306.60,602.32,433.91,611.17,"/F8",9.96,"culis vitae pretium sociis eu."
440.79,602.32,557.43,611.17,"/F8",9.96,"Laoreet magna nisl phare-"
306.60,590.37,557.44,599.22,"/F8",9.96,"tra fusce ac lectus. Sodales augue porta eni magnis class."
306.60,578.41,557.44,587.26,"/F8",9.96,"Lacinia proin. Viverra massa augue posuere quisque quis"
306.60,566.46,515.92,575.31,"/F8",9.96,"et velit sollicitudin pharetra metus eu nullam."
524.99,566.46,557.39,575.31,"/F8",9.96,"Viverra"
306.60,554.50,484.38,563.35,"/F8",9.96,"morbi amet primis parturient inceptos."
494.88,554.50,557.42,563.35,"/F8",9.96,"Posuere porta"
306.60,542.55,557.42,551.39,"/F8",9.96,"amet enim dapibus ut magnis lobortis venenatis erat diam"
306.60,530.59,557.49,539.44,"/F8",9.96,"nec ac magna. Gravida fames eget eros tortor. Commodo"
306.60,518.64,360.18,527.48,"/F8",9.96,"donec ve at."
366.17,518.64,486.99,527.48,"/F8",9.96,"Egestas lacus lorem auctor."
492.97,518.64,557.45,527.48,"/F8",9.96,"Conubia purus"
306.60,506.68,332.54,515.53,"/F8",9.96,"ac ve."
340.11,506.68,557.43,515.53,"/F8",9.96,"Laoreet fames elit lacus imperdiet dictumst auc-"
306.60,494.73,557.40,503.57,"/F8",9.96,"tor aliquam blandit maecenas sollicitudin pretium ligula"
306.60,482.77,557.38,491.62,"/F8",9.96,"purus et. Integer felis sem quis torquent scelerisque plac-"
306.60,470.82,557.41,479.66,"/F8",9.96,"erat massa mattis faucibus. Viverra lorem eget scelerisque."
306.60,458.86,557.47,467.71,"/F8",9.96,"Commodo ipsum sem ultrices lacinia urna nunc maece-"
306.60,446.91,557.42,455.75,"/F8",9.96,"nas cum pellentesque. Natoque metus lorem vehicula fer-"
306.60,434.95,557.40,443.80,"/F8",9.96,"mentum augue sodales eu taciti fringilla vehicula in metus"
306.60,423.00,442.28,431.84,"/F8",9.96,"in cursus hac mi volutpat nec."
449.08,423.00,557.42,431.84,"/F8",9.96,"Posuere netus adipiscing"
306.60,411.04,557.42,419.89,"/F8",9.96,"suspendisse auctor mi interdum semper odio ullamcorper."
306.60,399.09,368.39,407.93,"/F8",9.96,"Viverra proin."
374.65,399.09,557.43,407.93,"/F8",9.96,"Vivamus fames per nisi cum consectetuer"
306.60,387.13,430.60,395.98,"/F8",9.96,"aenean ut pulvinar pretium."
436.50,387.13,557.42,395.98,"/F8",9.96,"Dapibus magna urna lectus"
306.60,375.18,457.48,384.02,"/F8",9.96,"eu aptent est iaculis dis mi mattis."
321.55,363.22,557.46,372.07,"/F8",9.96,"Natoque ipsum nibh a odio dolor euismod molestie erat"
306.60,351.27,419.66,360.11,"/F8",9.96,"tristique vulputate curae."
427.69,351.27,557.38,360.11,"/F8",9.96,"Potenti purus pede etiam et."
306.60,339.31,557.41,348.16,"/F8",9.96,"Lacinia donec nunc posuere et nisi vehicula. Cubilia donec"
306.60,327.36,361.35,336.20,"/F8",9.96,"eget a diam."
367.43,327.36,527.95,336.20,"/F8",9.96,"Egestas felis morbi posuere orci per."
534.03,327.36,557.45,336.20,"/F8",9.96,"Eges-"
306.60,315.40,557.45,324.25,"/F8",9.96,"tas fames netus curae integer enim lobortis massa conva-"
306.60,303.45,356.99,312.29,"/F8",9.96,"llis sodales."
365.31,303.45,476.00,312.29,"/F8",9.96,"Conubia vitae mi turpis."
484.32,303.45,557.41,312.29,"/F8",9.96,"Cubilia nulla mi"
306.60,291.49,557.41,300.34,"/F8",9.96,"ad ante magna luctus lacinia nunc mi sollicitudin dapibus"
306.60,279.53,392.06,288.38,"/F8",9.96,"donec arcu aliquet."
400.66,279.53,463.09,288.38,"/F8",9.96,"Posuere vitae."
471.68,279.53,557.42,288.38,"/F8",9.96,"Integer neque nunc"
306.60,267.58,398.68,276.43,"/F8",9.96,"potenti ac maecenas."
405.08,267.58,557.44,276.43,"/F8",9.96,"Aliquam fames eni donec ridiculus"
306.60,255.62,557.40,264.47,"/F8",9.96,"mus phasellus pellentesque parturient erat. Sodales fames"
306.60,243.67,557.40,252.52,"/F8",9.96,"elit blandit ve mus imperdiet mus hymenaeos consectetuer"
306.60,231.71,557.37,240.56,"/F8",9.96,"vestibulum. Laoreet velit dui. Laoreet lorem id tristique."
306.60,219.76,557.42,228.61,"/F8",9.96,"Lacinia justo parturient enim augue vulputate hac. Eges-"
306.60,207.80,557.46,216.65,"/F8",9.96,"tas magna morbi lectus. Sodales massa amet posuere ut."
306.60,195.85,557.41,204.70,"/F8",9.96,"Potenti purus hac torquent a molestie duis commodo taciti"
306.60,183.89,557.42,192.74,"/F8",9.96,"sit. Egestas purus non erat natoque eu amet nisi gravida."
306.60,171.94,413.78,180.79,"/F8",9.96,"Dapibus fusce proin vel."
420.63,171.94,557.39,180.79,"/F8",9.96,"Gravida class velit quisque sed"
306.60,159.98,557.38,168.83,"/F8",9.96,"parturient vestibulum at taciti mus enim. Potenti fusce ad"
306.60,148.03,411.22,156.87,"/F8",9.96,"et nibh maecenas netus."
306.60,118.14,473.33,126.99,"/F17",9.96,"3. Quisque velit pede nostra nec."
321.55,97.22,557.44,106.07,"/F8",9.96,"Commodo porta sed donec felis cubilia natoque turpis."
306.60,85.26,406.31,94.11,"/F8",9.96,"Vivamus class laoreet."
416.09,85.26,557.43,94.11,"/F8",9.96,"Potenti fusce nisl leo diam per"
295.15,61.35,300.13,70.20,"/F8",9.96,"3"
