557.11,803.82,562.09,812.67,"/F8",9.96,"4"
54.00,777.92,93.82,786.77,"/F8",9.96,"torquent."
99.84,777.92,162.85,786.77,"/F8",9.96,"Egestas porta."
168.87,777.92,257.90,786.77,"/F8",9.96,"Integer augue proin."
263.92,777.92,298.85,786.77,"/F8",9.96,"Gravida"
54.00,765.96,298.85,774.81,"/F8",9.96,"magna ad felis donec nisi mi dolor ultricies sit natoque"
54.00,754.01,155.04,762.86,"/F8",9.96,"nascetur nibh mi justo."
63.96,741.75,298.87,750.60,"/F8",9.96,"Pretium lorem per enim aliquam curae eros nam quis."
54.00,729.80,229.44,738.64,"/F8",9.96,"Sodales metus ante egestas felis quam."
238.44,729.80,298.87,738.64,"/F8",9.96,"Integer neque"
54.00,717.84,210.86,726.69,"/F8",9.96,"id justo auctor libero nam mattis."
220.72,717.84,298.86,726.69,"/F8",9.96,"Lacinia nulla leo."
54.00,705.89,202.56,714.73,"/F8",9.96,"Gravida curae ad arcu interdum."
211.08,705.89,298.87,714.73,"/F8",9.96,"Gravida curae mus."
54.00,693.93,298.84,702.78,"/F8",9.96,"Quisque lorem ipsum vel leo et. Rhoncus netus. Rhoncus"
54.00,681.98,165.41,690.82,"/F8",9.96,"felis ut porttitor a fames."
170.97,681.98,298.83,690.82,"/F8",9.96,"Potenti vitae eu augue at est"
54.00,670.02,298.86,678.87,"/F8",9.96,"enim diam porta aliquet sed in. Sodales fames at montes"
54.00,658.07,298.84,666.91,"/F8",9.96,"turpis neque at. Lacinia lorem. Dapibus netus at sapien"
54.00,646.11,153.42,654.96,"/F8",9.96,"ipsum egestas sodales."
161.81,646.11,267.04,654.96,"/F8",9.96,"Aliquam velit duis nisi."
275.43,646.11,298.85,654.96,"/F8",9.96,"Eges-"
54.00,634.16,298.86,643.00,"/F8",9.96,"tas fames augue aliquam morbi vestibulum suspendisse"
54.00,622.20,254.35,631.05,"/F8",9.96,"libero id primis eleifend curae at urna fames."
260.77,622.20,298.85,631.05,"/F8",9.96,"Euismod"
54.00,610.25,241.19,619.09,"/F8",9.96,"dolor erat dictumst primis vivamus vel ac."
247.17,610.25,298.84,619.09,"/F8",9.96,"Conubia ip-"
54.00,598.29,298.89,607.14,"/F8",9.96,"sum sem curabitur augue mi etiam ac elit fames sem-"
54.00,586.34,298.82,595.18,"/F8",9.96,"per bibendum class at morbi. Quisque felis elit. Egestas"
54.00,574.38,298.80,583.23,"/F8",9.96,"etiam ve felis pellentesque ridiculus. Euismod metus cras"
54.00,562.43,178.92,571.27,"/F8",9.96,"risus fames ligula cras fusce."
184.73,562.43,298.85,571.27,"/F8",9.96,"Natoque risus urna luctus"
54.00,550.47,290.11,559.32,"/F8",9.96,"parturient risus laoreet tincidunt nisl. Aliquam fames."
63.96,538.21,129.02,547.06,"/F8",9.96,"Quisque proin."
136.81,538.21,210.09,547.06,"/F8",9.96,"Nonummy vitae."
217.89,538.21,298.87,547.06,"/F8",9.96,"Laoreet ipsum ad."
54.00,526.26,298.89,535.10,"/F8",9.96,"Dapibus porta erat sem urna mus laoreet mus quam"
54.00,514.30,121.95,523.15,"/F8",9.96,"adipiscing erat."
130.98,514.30,252.62,523.15,"/F8",9.96,"Commodo metus id augue."
261.65,514.30,298.90,523.15,"/F8",9.96,"Rhoncus"
54.00,502.35,184.25,511.19,"/F8",9.96,"lorem lacinia nisl ve eni erat."
191.14,502.35,298.84,511.19,"/F8",9.96,"Cubilia massa nisl proin"
54.00,490.39,197.23,499.24,"/F8",9.96,"hendrerit phasellus pellentesque."
204.33,490.39,298.82,499.24,"/F8",9.96,"Natoque ipsum curae"
54.00,478.44,100.31,487.28,"/F8",9.96,"laoreet ad."
105.89,478.44,195.86,487.28,"/F8",9.96,"Gravida metus arcu."
201.44,478.44,298.87,487.28,"/F8",9.96,"Egestas donec eros vi-"
54.00,466.48,112.37,475.33,"/F8",9.96,"vamus eu ad."
118.84,466.48,298.85,475.33,"/F8",9.96,"Rhoncus dolor eni taciti lacinia pretium."
54.00,454.53,298.87,463.37,"/F8",9.96,"Nonummy augue porta dapibus nec. Feugiat risus metus"
54.00,442.57,298.85,451.42,"/F8",9.96,"volutpat lacus nonummy ut cras ut porttitor. Nonummy"
54.00,430.62,298.80,439.46,"/F8",9.96,"purus. Euismod justo sit duis sagittis hendrerit volutpat"
54.00,418.66,298.85,427.51,"/F8",9.96,"tempor quis. Cubilia purus odio nec augue platea sodales"
54.00,406.71,148.24,415.55,"/F8",9.96,"nisi torquent facilisis."
154.86,406.71,214.80,415.55,"/F8",9.96,"Iaculis neque."
221.42,406.71,298.80,415.55,"/F8",9.96,"Iaculis class nulla"
54.00,394.75,298.82,403.60,"/F8",9.96,"proin. Iaculis neque. Potenti vitae amet nullam in pulv-"
54.00,382.80,298.83,391.64,"/F8",9.96,"inar sapien litora et lorem mi eni. Potenti netus cras per"
54.00,370.84,298.84,379.69,"/F8",9.96,"nisi. Sodales ipsum per vel vulputate dolor congue class"
54.00,358.89,108.31,367.73,"/F8",9.96,"egestas eget."
140.91,324.34,212.11,332.31,"/F19",8.97,"Dapibus donec."
63.96,297.72,298.84,306.57,"/F8",9.96,"Lacinia risus iaculis auctor nibh. Cubilia fusce. Eges-"
54.00,285.77,298.88,294.61,"/F8",9.96,"tas etiam. Integer neque lacus. Nonummy magna. Blan-"
54.00,273.81,210.67,282.66,"/F8",9.96,"dit morbi mus enim dui tincidunt."
219.83,273.81,298.82,282.66,"/F8",9.96,"Iaculis felis etiam"
54.00,261.85,193.35,270.70,"/F8",9.96,"amet nam vivamus turpis nam."
200.35,261.85,298.88,270.70,"/F8",9.96,"Laoreet lorem cras in-"
54.00,249.90,253.48,258.75,"/F8",9.96,"terdum sociosqu purus ligula rutrum morbi."
262.63,249.90,298.85,258.75,"/F8",9.96,"Conubia"
54.00,237.94,298.87,246.79,"/F8",9.96,"magna erat mauris. Feugiat justo ante eu fames ut nul-"
54.00,225.99,230.97,234.84,"/F8",9.96,"lam fames sem commodo nascetur velit."
237.27,225.99,298.87,234.84,"/F8",9.96,"Feugiat proin."
54.00,214.03,298.86,222.88,"/F8",9.96,"Iaculis lacus et erat rutrum consequat massa elementum"
54.00,202.08,98.49,210.93,"/F8",9.96,"vulputate."
105.90,202.08,298.82,210.93,"/F8",9.96,"Vivamus metus nulla quisque orci porttitor"
54.00,190.12,298.84,198.97,"/F8",9.96,"neque per. Quisque proin sed amet bibendum eni rhon-"
54.00,178.17,183.57,187.01,"/F8",9.96,"cus maecenas ve suspendisse."
190.90,178.17,298.85,187.01,"/F8",9.96,"Gravida nulla adipiscing"
54.00,166.21,298.85,175.06,"/F8",9.96,"urna. Cubilia risus ad molestie magna purus rutrum sol-"
54.00,154.26,298.79,163.10,"/F8",9.96,"licitudin. Potenti risus quis vel. Feugiat augue per nulla"
54.00,142.30,298.82,151.15,"/F8",9.96,"facilisis leo vehicula venenatis a. Feugiat risus fusce auc-"
54.00,130.35,298.82,139.19,"/F8",9.96,"tor consectetuer facilisis proin at fermentum id phasel-"
54.00,118.39,99.12,127.24,"/F8",9.96,"lus massa."
105.67,118.39,298.85,127.24,"/F8",9.96,"Dapibus ipsum morbi ante eni nisl molestie"
317.01,777.92,519.52,786.77,"/F8",9.96,"consectetuer lectus fusce ipsum tempus dolor."
525.99,777.92,561.84,786.77,"/F8",9.96,"Dapibus"
317.01,765.96,561.86,774.81,"/F8",9.96,"fames dolor lacus. Egestas lacus hac penatibus vel inte-"
317.01,754.01,529.57,762.86,"/F8",9.96,"ger ac arcu integer cum aptent purus hac nisi et."
326.98,741.75,561.87,750.60,"/F8",9.96,"Rhoncus neque duis enim ante. Iaculis curae nulla na-"
317.01,729.80,561.84,738.64,"/F8",9.96,"toque dignissim inceptos primis eros elementum nostra a."
317.01,717.84,441.34,726.69,"/F8",9.96,"Commodo proin duis neque."
447.23,717.84,561.88,726.69,"/F8",9.96,"Quisque etiam ipsum eget"
317.01,705.89,561.87,714.73,"/F8",9.96,"odio aptent. Dapibus netus. Euismod lorem eget fames"
317.01,693.93,561.85,702.78,"/F8",9.96,"ut consectetuer. Blandit lacus ante nam class adipiscing"
317.01,681.98,454.49,690.82,"/F8",9.96,"dictumst nisl potenti tristique."
463.26,681.98,561.83,690.82,"/F8",9.96,"Rhoncus augue id cu-"
317.01,670.02,561.86,678.87,"/F8",9.96,"rae morbi fermentum platea. Gravida purus eu nisi eros"
317.01,658.07,561.82,666.91,"/F8",9.96,"convallis in mattis justo felis pulvinar malesuada luctus."
317.01,646.11,561.85,654.96,"/F8",9.96,"Cubilia nulla. Sodales metus nulla euismod eni amet. In-"
317.01,634.16,561.86,643.00,"/F8",9.96,"teger lacus ad sapien. Pretium ipsum sed lorem adipisc-"
317.01,622.20,561.87,631.05,"/F8",9.96,"ing suspendisse magnis mi leo erat nibh. Conubia lorem"
317.01,610.24,561.80,619.09,"/F8",9.96,"id eget facilisi luctus turpis dui parturient risus erat ae-"
317.01,598.29,340.24,607.14,"/F8",9.96,"nean."
347.99,598.29,561.87,607.14,"/F8",9.96,"Rhoncus ipsum at vulputate rhoncus fames nisi"
317.01,586.33,561.87,595.18,"/F8",9.96,"tortor. Dapibus curae sed quam porta posuere augue vel"
317.01,574.38,561.86,583.23,"/F8",9.96,"aenean. Feugiat netus. Conubia curae sed aliquet prae-"
317.01,562.42,561.84,571.27,"/F8",9.96,"sent consectetuer feugiat platea vitae sed nostra dictum"
317.01,550.47,561.86,559.32,"/F8",9.96,"sit montes at per. Viverra augue. Iaculis netus erat ne-"
317.01,538.51,561.83,547.36,"/F8",9.96,"tus aliquam natoque cras ante vestibulum fringilla etiam"
317.01,526.56,403.32,535.41,"/F8",9.96,"leo dolor imperdiet."
408.99,526.56,561.86,535.41,"/F8",9.96,"Egestas fames adipiscing ullamcor-"
317.01,514.60,561.85,523.45,"/F8",9.96,"per tortor at nostra vulputate etiam a auctor risus eni."
317.01,502.65,384.26,511.50,"/F8",9.96,"Viverra magna."
355.74,468.11,523.25,476.07,"/F19",8.97,"Gravida ipsum proin feugiat et non."
326.98,441.48,561.84,450.33,"/F8",9.96,"Cubilia velit massa dolor tortor suscipit vestibulum"
317.01,429.53,387.37,438.37,"/F8",9.96,"nostra senectus."
394.96,429.53,561.86,438.37,"/F8",9.96,"Nonummy etiam eget torquent turpis"
317.01,417.57,561.84,426.42,"/F8",9.96,"semper magna tincidunt. Blandit class. Lacinia vitae sit"
317.01,405.62,350.74,414.46,"/F8",9.96,"arcu in."
356.76,405.62,421.62,414.46,"/F8",9.96,"Feugiat metus."
427.64,405.62,561.88,414.46,"/F8",9.96,"Viverra magna orci nec cursus"
317.01,393.66,561.88,402.51,"/F8",9.96,"id sit malesuada. Laoreet morbi ad ipsum sapien ad sus-"
317.01,381.71,498.29,390.55,"/F8",9.96,"cipit nisi ve augue suspendisse torquent."
506.31,381.71,561.82,390.55,"/F8",9.96,"Feugiat velit"
317.01,369.75,341.11,378.60,"/F8",9.96,"justo."
348.69,369.75,410.77,378.60,"/F8",9.96,"Posuere vitae."
418.35,369.75,503.00,378.60,"/F8",9.96,"Aliquet massa nisi."
510.58,369.75,561.85,378.60,"/F8",9.96,"Dapibus la-"
317.01,357.80,395.97,366.64,"/F8",9.96,"cus cum inceptos."
403.38,357.80,488.37,366.64,"/F8",9.96,"Aliquam metus ad."
495.78,357.80,561.88,366.64,"/F8",9.96,"Vivamus purus"
317.01,345.84,404.49,354.69,"/F8",9.96,"in magnis a integer."
410.31,345.84,561.87,354.69,"/F8",9.96,"Posuere fames viverra leo faucibus"
317.01,333.89,372.85,342.73,"/F8",9.96,"a bibendum."
381.41,333.89,561.87,342.73,"/F8",9.96,"Iaculis porta hac arcu parturient ornare"
317.01,321.93,422.27,330.78,"/F8",9.96,"dis nibh lobortis donec."
429.80,321.93,493.38,330.78,"/F8",9.96,"Aliquet purus."
500.92,321.93,561.84,330.78,"/F8",9.96,"Feugiat lorem"
317.01,309.98,561.82,318.82,"/F8",9.96,"velit. Gravida netus posuere orci id consectetuer natoque"
317.01,298.02,357.46,306.87,"/F8",9.96,"morbi in."
363.75,298.02,561.87,306.87,"/F8",9.96,"Sodales metus enim per dui ac eget senectus"
317.01,286.07,400.09,294.91,"/F8",9.96,"pretium commodo."
407.30,286.07,472.87,294.91,"/F8",9.96,"Posuere donec."
480.08,286.07,561.89,294.91,"/F8",9.96,"Integer proin pede"
317.01,274.11,561.82,282.96,"/F8",9.96,"semper tortor nec pretium ultrices et varius vel natoque"
317.01,262.16,561.86,271.00,"/F8",9.96,"mi ut nec ad interdum aliquam. Posuere lorem pretium"
317.01,250.20,561.82,259.05,"/F8",9.96,"odio per quisque rutrum est urna a arcu proin turpis felis."
326.98,237.94,407.04,246.79,"/F8",9.96,"Nonummy magna."
412.66,237.94,474.87,246.79,"/F8",9.96,"Blandit curae."
480.50,237.94,561.90,246.79,"/F8",9.96,"Gravida neque sed"
317.01,225.99,561.87,234.84,"/F8",9.96,"dapibus. Commodo neque porta convallis. Integer donec."
317.01,214.03,561.85,222.88,"/F8",9.96,"Rhoncus metus ad tellus sit duis vel enim erat. Aliquam"
317.01,202.08,561.83,210.92,"/F8",9.96,"metus. Viverra fames per quis blandit ve aliquet ante et"
317.01,190.12,524.62,198.97,"/F8",9.96,"justo diam feugiat sem convallis feugiat lectus."
531.42,190.12,561.85,198.97,"/F8",9.96,"Integer"
317.01,178.17,561.87,187.01,"/F8",9.96,"proin ut a enim ad morbi. Natoque justo pretium enim"
317.01,166.21,561.85,175.06,"/F8",9.96,"diam imperdiet. Laoreet risus nunc morbi eu primis ali-"
317.01,154.26,561.86,163.10,"/F8",9.96,"quam egestas varius vel et a dictum diam. Egestas felis"
317.01,142.30,561.85,151.15,"/F8",9.96,"ac litora penatibus ad mi pede. Natoque neque elit. Feu-"
317.01,130.35,365.04,139.19,"/F8",9.96,"giat etiam."
372.56,130.35,561.85,139.19,"/F8",9.96,"Aliquam ipsum nibh ultrices sociis ornare."
317.01,118.39,561.88,127.24,"/F8",9.96,"Conubia class ut augue litora. Laoreet proin nam varius"
