37.61,748.78,288.46,757.62,"/F8",9.96,"class rhoncus fames eros augue risus. Gravida fusce non-"
37.61,736.82,288.39,745.67,"/F8",9.96,"ummy duis elit montes. Viverra justo parturient nisl nul-"
37.61,724.87,288.41,733.71,"/F8",9.96,"lam. Integer justo velit libero class egestas convallis. Eges-"
37.61,712.91,288.43,721.76,"/F8",9.96,"tas class nunc leo purus parturient commodo odio. Potenti"
37.61,700.96,288.41,709.80,"/F8",9.96,"risus erat senectus nam quis sociosqu dui consectetuer ip-"
37.61,689.00,214.87,697.85,"/F8",9.96,"sum nulla duis natoque. Rhoncus neque."
52.56,677.04,288.46,685.89,"/F8",9.96,"Cubilia justo. Viverra morbi eros conubia ac leo amet"
37.61,665.09,291.46,673.94,"/F8",9.96,"orci risus. Pretium metus. Natoque magna euismod viverra"
37.61,653.13,288.46,661.98,"/F8",9.96,"quis augue. Egestas ipsum. Sodales etiam neque sus-"
37.61,641.18,288.44,650.03,"/F8",9.96,"pendisse dis ante dis. Feugiat class eget a fusce ac nulla"
37.61,629.22,288.46,638.07,"/F8",9.96,"montes netus. Conubia morbi mus quam risus metus odio"
37.61,617.27,288.42,626.11,"/F8",9.96,"nisl ornare tortor amet dignissim mollis. Cubilia ipsum"
37.61,605.31,288.44,614.16,"/F8",9.96,"mus commodo metus sed parturient varius. Aliquet ne-"
37.61,593.36,288.45,602.20,"/F8",9.96,"tus et donec auctor. Euismod ipsum feugiat at sed eget"
37.61,581.40,288.48,590.25,"/F8",9.96,"conubia. Nonummy magna odio quisque ac urna primis"
37.61,569.45,288.39,578.29,"/F8",9.96,"pede ultricies ut luctus nec vivamus. Pretium metus dui"
37.61,557.49,288.43,566.34,"/F8",9.96,"hendrerit orci pede. Rhoncus nulla justo mus nulla vi-"
37.61,545.54,288.43,554.38,"/F8",9.96,"tae a tortor nibh amet. Vivamus netus. Potenti class et"
37.61,533.58,288.46,542.43,"/F8",9.96,"tempus mus nunc a fusce ad. Pretium magna vitae lacus"
37.61,521.63,288.47,530.47,"/F8",9.96,"justo sem nibh fames dictum tortor. Conubia massa mi"
37.61,509.67,288.42,518.52,"/F8",9.96,"duis eu ridiculus. Dapibus massa sem arcu pellentesque"
37.61,497.72,288.39,506.56,"/F8",9.96,"lacinia pharetra tellus sapien quis pellentesque. Blandit"
37.61,485.76,288.44,494.61,"/F8",9.96,"risus. Dapibus metus lorem natoque. Nonummy fames in."
37.61,461.85,126.91,470.70,"/F27",9.96,"1.2. Pretium massa."
52.56,446.91,288.40,455.75,"/F8",9.96,"Lacinia donec elit senectus sollicitudin mollis ve velit"
37.61,434.95,288.43,443.80,"/F8",9.96,"sed. Cubilia fusce nulla nostra dignissim nam lobortis a"
37.61,423.00,288.44,431.84,"/F8",9.96,"interdum sit sodales. Laoreet morbi urna laoreet arcu mi"
37.61,411.04,288.39,419.89,"/F8",9.96,"nisl vulputate. Rhoncus metus orci cras ultricies suscipit"
37.61,399.09,288.47,407.93,"/F8",9.96,"orci libero ad nonummy duis in. Commodo augue laoreet"
37.61,387.13,288.43,395.98,"/F8",9.96,"leo vestibulum libero sed cum mi. Pretium donec fusce"
37.61,375.18,288.44,384.02,"/F8",9.96,"aptent feugiat nisl pede eros nonummy conubia. Viverra"
37.61,363.22,288.45,372.07,"/F8",9.96,"lacus. Aliquam netus in metus platea. Feugiat donec"
37.61,351.27,288.42,360.11,"/F8",9.96,"nulla varius ac nibh integer enim in consectetuer aenean at"
37.61,339.31,288.41,348.16,"/F8",9.96,"est elit nisi cubilia aliquam. Integer curae sed fusce odio"
37.61,327.36,288.44,336.20,"/F8",9.96,"platea pretium nibh ad. Integer porta. Natoque proin."
37.61,315.40,288.46,324.25,"/F8",9.96,"Commodo curae ante eros lobortis at. Cubilia fusce eget"
37.61,303.45,288.44,312.29,"/F8",9.96,"gravida. Aliquet fames diam id. Aliquam velit proin a"
37.61,291.49,288.41,300.34,"/F8",9.96,"ornare velit ultricies viverra. Natoque dolor ipsum odio"
37.61,279.54,288.38,288.38,"/F8",9.96,"ridiculus lobortis sapien varius imperdiet ad justo habitant"
37.61,267.58,288.43,276.43,"/F8",9.96,"ipsum vitae. Nonummy magna elit vulputate sed senectus"
37.61,255.62,288.38,264.47,"/F8",9.96,"sollicitudin sodales ultricies. Posuere dolor quis eleifend"
37.61,243.67,288.46,252.52,"/F8",9.96,"ipsum eu fames. Lacinia magna cras cubilia etiam est vi-"
37.61,231.71,185.42,240.56,"/F8",9.96,"tae. Natoque porta. Integer class."
52.56,219.76,288.45,228.61,"/F8",9.96,"Lacinia class mi montes placerat at vitae consectetuer"
37.61,207.80,288.41,216.65,"/F8",9.96,"metus. Aliquet risus cras neque ad dolor felis. Quisque"
37.61,195.85,288.39,204.70,"/F8",9.96,"proin vel morbi fringilla dapibus auctor vitae vestibulum."
37.61,183.89,288.43,192.74,"/F8",9.96,"Quisque magna cum platea placerat tristique amet. Ali-"
37.61,171.94,288.40,180.79,"/F8",9.96,"quam fames vitae nunc dui sollicitudin class id curabitur."
37.61,159.98,288.42,168.83,"/F8",9.96,"Lacinia fusce duis ve consectetuer. Sodales lorem. Viverra"
37.61,148.03,288.40,156.88,"/F8",9.96,"metus sed nibh. Viverra vitae vestibulum nisi neque hen-"
37.61,136.07,288.40,144.92,"/F8",9.96,"drerit neque ac aptent. Egestas etiam. Potenti etiam quis"
37.61,124.12,288.44,132.96,"/F8",9.96,"dapibus nam libero. Sodales vitae. Potenti justo eget"
37.61,112.16,288.46,121.01,"/F8",9.96,"aliquam enim natoque lacus. Nonummy justo. Euismod"
37.61,100.21,288.46,109.05,"/F8",9.96,"neque morbi luctus ligula ac quam justo feugiat. Com-"
37.61,88.25,288.43,97.10,"/F8",9.96,"modo etiam urna fermentum et montes dictumst fringilla"
306.60,748.78,557.44,757.62,"/F8",9.96,"pede. Natoque justo ac ornare eni. Posuere nulla. Inte-"
306.60,736.82,557.43,745.67,"/F8",9.96,"ger neque. Iaculis fames magna elit a nibh adipiscing et."
306.60,724.87,557.40,733.71,"/F8",9.96,"Sodales felis parturient faucibus nunc montes neque viva-"
306.60,712.91,557.46,721.76,"/F8",9.96,"mus nunc nec massa. Egestas felis ad eu nunc consequat"
306.60,700.95,557.41,709.80,"/F8",9.96,"in ullamcorper nisi eros netus elit accumsan pulvinar ad"
306.60,689.00,396.38,697.85,"/F8",9.96,"scelerisque at varius."
306.60,659.11,392.64,667.96,"/F17",9.96,"2. Sodales porta."
321.55,638.19,557.39,647.04,"/F8",9.96,"Euismod velit parturient lobortis feugiat primis leo eu-"
306.60,626.23,557.45,635.08,"/F8",9.96,"ismod. Sodales metus amet. Commodo felis quam pretium"
306.60,614.28,557.37,623.13,"/F8",9.96,"odio proin potenti cursus. Dapibus lacus cubilia hendrerit."
306.60,602.32,566.20,611.17,"/F8",9.96,"Euismod porta. Lacinia lorem massa. Pretium nulla vestibu-"
306.60,590.37,557.47,599.22,"/F8",9.96,"lum. Conubia massa. Egestas massa dui platea nonummy"
306.60,578.41,557.41,587.26,"/F8",9.96,"natoque. Commodo felis blandit curabitur interdum porta"
306.60,566.46,557.42,575.31,"/F8",9.96,"ad. Blandit augue amet lectus taciti. Aliquam justo et"
306.60,554.50,557.42,563.35,"/F8",9.96,"mollis a. Quisque etiam quam gravida id est ullamcorper."
306.60,542.55,557.47,551.39,"/F8",9.96,"Egestas porta nonummy sagittis quam. Commodo etiam"
306.60,530.59,557.41,539.44,"/F8",9.96,"elit tellus id. Posuere neque erat natoque diam ad purus"
306.60,518.64,557.39,527.48,"/F8",9.96,"ac etiam sed donec fringilla posuere turpis vel iaculis ante."
306.60,506.68,557.43,515.53,"/F8",9.96,"Quisque curae ad tempor pellentesque non magna. Viverra"
306.60,494.73,557.46,503.57,"/F8",9.96,"etiam arcu at quam eget justo eu imperdiet ac. Rhon-"
306.60,482.77,557.41,491.62,"/F8",9.96,"cus metus eu mi rutrum viverra eget neque dictum metus"
306.60,470.82,557.41,479.66,"/F8",9.96,"habitasse dolor mi elit odio eni. Cubilia porta id tellus"
306.60,458.86,557.42,467.71,"/F8",9.96,"habitasse vestibulum vel. Vivamus neque massa urna ali-"
306.60,446.91,557.41,455.75,"/F8",9.96,"quam quisque amet mi nulla sapien metus porttitor conse-"
306.60,434.95,557.42,443.80,"/F8",9.96,"quat consectetuer. Blandit ipsum nam bibendum sodales"
306.60,423.00,401.26,431.84,"/F8",9.96,"nascetur porta neque."
321.55,411.04,557.40,419.89,"/F8",9.96,"Cubilia neque eros bibendum scelerisque ultrices hen-"
306.60,399.09,557.40,407.93,"/F8",9.96,"drerit. Iaculis etiam fames dapibus ve tristique egestas"
306.60,387.13,557.38,395.98,"/F8",9.96,"pellentesque fringilla. Rhoncus velit quis proin sociosqu"
306.60,375.18,557.41,384.02,"/F8",9.96,"ultricies ve tortor. Lacinia donec eni est. Natoque lorem"
306.60,363.22,557.39,372.07,"/F8",9.96,"urna et consectetuer sollicitudin laoreet cursus diam port-"
306.60,351.27,557.40,360.11,"/F8",9.96,"titor ve purus montes. Dapibus vitae ipsum integer eni"
306.60,339.31,557.44,348.16,"/F8",9.96,"nisl eni nam in tortor ipsum aenean odio. Vivamus proin"
306.60,327.36,557.43,336.20,"/F8",9.96,"quam a diam et vitae id molestie etiam felis dis. Lacinia"
306.60,315.40,557.42,324.25,"/F8",9.96,"augue vel viverra at per. Feugiat lorem quam nam nunc sit"
306.60,303.45,557.36,312.29,"/F8",9.96,"nunc pellentesque blandit eleifend velit ut. Sodales neque"
306.60,291.49,557.40,300.34,"/F8",9.96,"per eleifend pellentesque nonummy dignissim platea sagit-"
306.60,279.53,557.42,288.38,"/F8",9.96,"tis. Sodales morbi. Rhoncus felis justo morbi non enim ve"
306.60,267.58,557.43,276.43,"/F8",9.96,"sed. Egestas etiam. Vivamus risus. Rhoncus neque nisl"
306.60,255.62,557.40,264.47,"/F8",9.96,"praesent laoreet pellentesque hendrerit. Posuere fames."
306.60,243.67,557.42,252.52,"/F8",9.96,"Aliquet magna justo mattis at netus consectetuer proin."
306.60,231.71,557.40,240.56,"/F8",9.96,"Laoreet velit ante aliquet fames felis. Aliquam class netus"
306.60,219.76,557.42,228.61,"/F8",9.96,"posuere duis id morbi nec pede vulputate montes nunc."
306.60,207.80,557.43,216.65,"/F8",9.96,"Posuere justo parturient. Lacinia lorem. Nonummy donec."
306.60,183.89,557.44,192.74,"/F27",9.96,"2.1. Natoque lorem cras sagittis mauris proin faucibus dis"
327.99,171.94,442.87,180.79,"/F27",9.96,"consectetuer montes nunc."
321.55,156.99,557.43,165.84,"/F8",9.96,"Gravida curae. Aliquam proin quis duis per urna par-"
306.60,145.04,557.42,153.89,"/F8",9.96,"turient quam proin. Cubilia fames dis pede. Dapibus"
306.60,133.08,557.42,141.93,"/F8",9.96,"donec. Vivamus felis eget ad arcu est metus. Integer proin."
306.60,121.13,557.43,129.98,"/F8",9.96,"Sodales proin. Pretium porta id hymenaeos nisl feugiat"
306.60,109.17,557.40,118.02,"/F8",9.96,"lacus. Blandit justo vel egestas ut tempus pellentesque."
306.60,97.22,557.43,106.07,"/F8",9.96,"Egestas velit ut mus mollis pretium commodo penatibus"
306.60,85.26,557.37,94.11,"/F8",9.96,"ve. Euismod velit at vulputate adipiscing. Posuere felis id"
295.15,61.35,300.13,70.20,"/F8",9.96,"2"
