557.11,803.82,562.09,812.67,"/F8",9.96,"4"
54.00,777.92,298.82,786.77,"/F8",9.96,"suspendisse dolor facilisis ornare duis. Conubia risus dis"
54.00,765.96,298.85,774.81,"/F8",9.96,"porta. Rhoncus fames. Posuere vitae dui nibh libero ve"
54.00,754.01,298.84,762.86,"/F8",9.96,"quam. Conubia dolor netus purus dictum pellentesque"
54.00,742.05,298.87,750.90,"/F8",9.96,"blandit magna donec lectus donec non erat sed cras. In-"
54.00,730.10,298.82,738.95,"/F8",9.96,"teger nulla netus cursus justo. Aliquet class at sollici-"
54.00,718.14,298.80,726.99,"/F8",9.96,"tudin aliquet purus mi dictumst. Pretium risus mi tem-"
54.00,706.19,298.85,715.03,"/F8",9.96,"por quisque urna ut. Rhoncus nulla. Viverra lacus arcu"
54.00,694.23,298.84,703.08,"/F8",9.96,"justo quisque amet orci accumsan porta mollis ultricies"
54.00,682.28,298.83,691.12,"/F8",9.96,"curabitur. Blandit proin euismod montes vel. Blandit"
54.00,670.32,298.85,679.17,"/F8",9.96,"fusce amet imperdiet. Egestas metus. Cubilia lacus hac"
54.00,658.37,298.85,667.21,"/F8",9.96,"arcu posuere id at ut ad luctus fermentum. Aliquam pu-"
54.00,646.41,93.46,655.26,"/F8",9.96,"rus risus."
63.96,634.16,298.88,643.00,"/F8",9.96,"Aliquam porta. Nonummy justo ad ipsum litora sagit-"
54.00,622.20,298.84,631.05,"/F8",9.96,"tis eros vehicula. Aliquam netus. Conubia proin odio. Ia-"
54.00,610.25,298.87,619.09,"/F8",9.96,"culis nulla mi convallis. Laoreet fames odio duis magna"
54.00,598.29,298.84,607.14,"/F8",9.96,"proin. Gravida porta nunc odio. Blandit felis enim id"
54.00,586.34,298.89,595.18,"/F8",9.96,"eros quis fusce fermentum. Conubia justo magna po-"
54.00,574.38,298.87,583.23,"/F8",9.96,"suere nonummy congue leo eget vehicula nullam aenean."
54.00,562.43,298.87,571.27,"/F8",9.96,"Aliquam morbi erat. Integer morbi urna cum cursus."
54.00,550.47,298.86,559.32,"/F8",9.96,"Integer netus amet a amet adipiscing sem vestibulum."
54.00,538.52,298.84,547.36,"/F8",9.96,"Integer porta vestibulum torquent ante dui. Natoque"
54.00,526.56,298.85,535.41,"/F8",9.96,"morbi. Rhoncus lorem pede quam etiam. Feugiat felis ut"
54.00,514.60,298.82,523.45,"/F8",9.96,"mauris mi pretium duis libero. Dapibus metus. Potenti"
54.00,502.65,298.86,511.50,"/F8",9.96,"dolor conubia aptent neque quam euismod mauris risus"
54.00,490.69,298.83,499.54,"/F8",9.96,"molestie vestibulum nostra. Aliquam neque ve lectus."
54.00,478.74,298.85,487.59,"/F8",9.96,"Conubia lorem id nibh tortor. Rhoncus neque parturi-"
54.00,466.78,298.83,475.63,"/F8",9.96,"ent dictumst netus commodo molestie justo et tincidunt"
54.00,454.83,298.86,463.67,"/F8",9.96,"morbi. Iaculis porta egestas nec faucibus elementum ve"
54.00,442.87,85.53,451.72,"/F8",9.96,"magna."
125.26,408.33,227.74,416.29,"/F19",8.97,"Blandit dolor id pede."
63.96,381.71,298.87,390.55,"/F8",9.96,"Cubilia morbi quis est mus ac magna consectetuer ip-"
54.00,369.75,298.82,378.60,"/F8",9.96,"sum ac vulputate. Egestas purus erat tincidunt tortor a."
54.00,357.80,298.87,366.64,"/F8",9.96,"Viverra morbi donec sociis donec condimentum orci cras"
54.00,345.84,298.83,354.69,"/F8",9.96,"adipiscing in. Laoreet netus. Blandit lacus dis eget cur-"
54.00,333.89,298.85,342.73,"/F8",9.96,"abitur placerat mattis enim phasellus. Blandit magna"
54.00,321.93,253.91,330.78,"/F8",9.96,"metus tempor erat ve magna id ipsum dui."
263.95,321.93,298.88,330.78,"/F8",9.96,"Gravida"
54.00,309.98,298.88,318.82,"/F8",9.96,"morbi mi hymenaeos suspendisse nec libero maecenas"
54.00,298.02,298.83,306.87,"/F8",9.96,"vestibulum. Lacinia fusce. Pretium risus class tempor"
54.00,286.07,298.86,294.91,"/F8",9.96,"molestie condimentum sagittis. Egestas donec amet cum"
54.00,274.11,298.86,282.96,"/F8",9.96,"a platea facilisis aliquet etiam. Nonummy neque ac mau-"
54.00,262.16,298.83,271.00,"/F8",9.96,"ris metus suspendisse nisl orci aliquam in penatibus a."
54.00,250.20,298.83,259.05,"/F8",9.96,"Natoque class in semper et habitant ante tellus. Feugiat"
54.00,238.25,298.87,247.09,"/F8",9.96,"class at libero egestas mi ac metus. Cubilia morbi cum"
54.00,226.29,298.83,235.14,"/F8",9.96,"neque sem enim bibendum a. Iaculis etiam elit porttitor"
54.00,214.34,298.83,223.18,"/F8",9.96,"dictum ad. Potenti vitae. Aliquet lacus nisi nonummy"
54.00,202.38,298.83,211.23,"/F8",9.96,"erat donec neque tincidunt. Euismod purus lorem. Ali-"
54.00,190.43,298.82,199.27,"/F8",9.96,"quet class curae mollis primis dictumst porttitor enim"
54.00,178.47,298.83,187.32,"/F8",9.96,"vulputate sociis orci eros. Lacinia justo nunc blandit ac."
54.00,166.51,280.24,175.36,"/F8",9.96,"Laoreet velit etiam diam arcu porta. Feugiat etiam."
63.96,154.26,298.86,163.11,"/F8",9.96,"Integer risus. Vivamus lacus orci aliquet nostra male-"
54.00,142.30,298.86,151.15,"/F8",9.96,"suada ad justo class quisque tortor quam ipsum mi. Ali-"
54.00,130.35,298.82,139.20,"/F8",9.96,"quet fames adipiscing torquent felis integer cras eget orci"
54.00,118.39,298.81,127.24,"/F8",9.96,"parturient. Gravida proin ut convallis ullamcorper tin-"
317.01,777.92,561.85,786.77,"/F8",9.96,"cidunt eget rhoncus ac morbi. Egestas ipsum at fringilla"
317.01,765.96,561.92,774.81,"/F8",9.96,"et malesuada metus. Posuere morbi. Commodo fames"
317.01,754.01,561.86,762.86,"/F8",9.96,"pede. Lacinia metus parturient aliquam erat odio. Po-"
317.01,742.05,561.89,750.90,"/F8",9.96,"suere lacus. Euismod donec et augue ornare enim magnis"
317.01,730.10,561.82,738.94,"/F8",9.96,"sagittis curabitur. Rhoncus vitae orci ligula eu suscipit"
317.01,718.14,561.86,726.99,"/F8",9.96,"urna. Iaculis curae enim mus fermentum tempor primis"
317.01,706.19,561.90,715.03,"/F8",9.96,"phasellus mus iaculis accumsan tempus magnis magna"
317.01,694.23,561.87,703.08,"/F8",9.96,"est ante. Conubia massa diam. Cubilia lacus eu aptent."
317.01,682.28,561.84,691.12,"/F8",9.96,"Feugiat vitae. Rhoncus vitae at aptent id habitant pul-"
317.01,670.32,561.88,679.17,"/F8",9.96,"vinar. Viverra fames pede senectus accumsan nonummy"
317.01,658.37,561.83,667.21,"/F8",9.96,"netus. Iaculis etiam dolor ridiculus placerat. Integer pu-"
317.01,646.41,561.86,655.26,"/F8",9.96,"rus hac sodales ve ac leo ut consectetuer nullam. Iaculis"
317.01,634.46,561.82,643.30,"/F8",9.96,"augue dolor ultrices sit mi senectus dapibus iaculis facilisi"
317.01,622.50,561.85,631.35,"/F8",9.96,"ad felis hac purus magna. Integer neque nisl torquent in"
317.01,610.55,561.84,619.39,"/F8",9.96,"suspendisse ac cursus nascetur proin venenatis adipisc-"
317.01,598.59,561.84,607.44,"/F8",9.96,"ing. Cubilia dolor ve nibh nisi donec est habitant egestas"
317.01,586.64,407.60,595.48,"/F8",9.96,"sodales consectetuer."
326.98,574.34,561.92,583.19,"/F8",9.96,"Commodo curae erat pede nonummy sapien. Posuere"
317.01,562.38,561.83,571.23,"/F8",9.96,"netus felis luctus duis ac suscipit cum viverra. Vivamus"
317.01,550.43,561.85,559.27,"/F8",9.96,"fusce vestibulum potenti ante. Nonummy massa vestibu-"
317.01,538.47,561.86,547.32,"/F8",9.96,"lum scelerisque sociis. Euismod morbi duis nam sed in"
317.01,526.52,561.82,535.36,"/F8",9.96,"aptent molestie. Euismod lacus felis nascetur tristique ad"
317.01,514.56,561.84,523.41,"/F8",9.96,"purus lectus nullam non parturient. Lacinia proin adip-"
317.01,502.61,561.86,511.45,"/F8",9.96,"iscing lobortis erat gravida ve bibendum dapibus diam"
317.01,490.65,452.95,499.50,"/F8",9.96,"accumsan pellentesque sapien."
464.07,490.65,561.87,499.50,"/F8",9.96,"Vivamus netus ipsum"
317.01,478.70,561.85,487.54,"/F8",9.96,"litora turpis curabitur. Vivamus porta. Posuere class"
317.01,466.74,561.85,475.59,"/F8",9.96,"quam arcu odio adipiscing. Viverra porta sit adipiscing."
317.01,454.79,561.84,463.63,"/F8",9.96,"Potenti massa nisl tempus elementum lacinia eni primis"
317.01,442.83,561.86,451.68,"/F8",9.96,"dui est potenti faucibus. Egestas augue sed netus quam"
317.01,430.88,561.87,439.72,"/F8",9.96,"elementum. Commodo ipsum erat suspendisse. Dapibus"
317.01,418.92,422.11,427.77,"/F8",9.96,"netus nulla suscipit id."
433.36,418.92,561.88,427.77,"/F8",9.96,"Commodo neque ante porta"
317.01,406.97,561.82,415.81,"/F8",9.96,"lacinia venenatis. Integer class vestibulum dictumst ne-"
317.01,395.01,561.83,403.86,"/F8",9.96,"tus ve. Blandit morbi arcu potenti congue proin ultrices"
317.01,383.06,561.82,391.90,"/F8",9.96,"per sollicitudin velit. Laoreet class sed netus sapien. Cu-"
317.01,371.10,561.83,379.95,"/F8",9.96,"bilia dolor elit aptent torquent cubilia. Laoreet ipsum"
317.01,359.15,561.83,367.99,"/F8",9.96,"vitae enim facilisi. Pretium fames erat porta nisi a elit"
317.01,347.19,363.77,356.04,"/F8",9.96,"parturient."
317.01,312.43,561.93,320.39,"/F19",8.97,"Posuere augue eros feugiat at cursus vulputate nulla."
326.98,285.77,561.85,294.61,"/F8",9.96,"Natoque curae netus turpis magnis quisque blandit hy-"
317.01,273.81,561.87,282.66,"/F8",9.96,"menaeos cras vivamus in cras at sollicitudin. Egestas"
317.01,261.85,561.83,270.70,"/F8",9.96,"nulla. Viverra neque non pulvinar natoque dolor vestibu-"
317.01,249.90,395.05,258.75,"/F8",9.96,"lum iaculis pede."
406.58,249.90,561.85,258.75,"/F8",9.96,"Cubilia dolor netus mattis aptent"
317.01,237.94,561.85,246.79,"/F8",9.96,"eleifend diam cursus dictumst eros. Conubia velit sed"
317.01,225.99,561.85,234.84,"/F8",9.96,"nullam bibendum hendrerit odio ligula. Iaculis donec"
317.01,214.03,561.80,222.88,"/F8",9.96,"elit neque vivamus nisi quam blandit fusce ante ultricies."
317.01,202.08,561.89,210.92,"/F8",9.96,"Integer donec. Gravida risus ad aenean auctor metus"
317.01,190.12,561.88,198.97,"/F8",9.96,"lacinia penatibus eu dolor. Euismod etiam. Rhoncus"
317.01,178.17,561.89,187.01,"/F8",9.96,"magna commodo elementum ad ante per. Aliquet fusce."
317.01,166.21,561.88,175.06,"/F8",9.96,"Nonummy felis justo. Laoreet fames at nostra mi. Iaculis"
317.01,154.26,561.90,163.10,"/F8",9.96,"augue odio cras magnis sem. Posuere lorem eni aptent"
317.01,142.30,561.87,151.15,"/F8",9.96,"donec eu. Lacinia magna fusce libero convallis faucibus"
317.01,130.35,561.83,139.19,"/F8",9.96,"dictum urna in. Lacinia netus vestibulum suscipit class"
317.01,118.39,561.82,127.24,"/F8",9.96,"nibh. Dapibus nulla. Quisque lacus cubilia. Integer risus"
