557.11,803.82,562.09,812.67,"/F8",9.96,"2"
54.00,777.92,298.83,786.77,"/F8",9.96,"justo et ultrices quam iaculis. Laoreet vitae et lectus"
54.00,765.96,298.84,774.81,"/F8",9.96,"vehicula purus feugiat eni ve. Dapibus fusce et justo"
54.00,754.01,298.83,762.86,"/F8",9.96,"at. Cubilia augue urna porttitor placerat ligula luctus"
54.00,742.05,298.84,750.90,"/F8",9.96,"risus faucibus est pellentesque lorem neque. Natoque"
54.00,730.10,298.87,738.95,"/F8",9.96,"magna ac lorem nostra suspendisse lorem vulputate auc-"
54.00,718.14,298.86,726.99,"/F8",9.96,"tor mus natoque metus dolor a nisi. Gravida felis at"
54.00,706.19,298.86,715.03,"/F8",9.96,"tempor enim malesuada nostra habitant. Euismod risus"
54.00,694.23,298.80,703.08,"/F8",9.96,"in penatibus nulla id. Integer felis nec arcu pellentesque"
54.00,682.28,298.89,691.12,"/F8",9.96,"nonummy nascetur eu suspendisse. Aliquam magna ad"
54.00,670.32,298.84,679.17,"/F8",9.96,"ridiculus malesuada pellentesque cum augue posuere orci"
54.00,658.37,298.83,667.21,"/F8",9.96,"ad vulputate ridiculus adipiscing. Lacinia ipsum. Rhon-"
54.00,646.41,298.85,655.26,"/F8",9.96,"cus purus duis laoreet erat ad. Euismod felis pede eni"
54.00,634.46,231.44,643.30,"/F8",9.96,"sodales id venenatis a ultricies magna."
242.16,634.46,298.84,643.30,"/F8",9.96,"Blandit velit"
54.00,622.50,298.83,631.35,"/F8",9.96,"vel ligula mi interdum dapibus bibendum. Lacinia fusce"
54.00,610.55,298.83,619.39,"/F8",9.96,"adipiscing suspendisse nullam et in est ante pede volut-"
54.00,598.59,298.85,607.44,"/F8",9.96,"pat lorem. Laoreet lacus purus eni pede. Rhoncus netus."
54.00,586.64,298.86,595.48,"/F8",9.96,"Feugiat donec fusce lacinia nam lectus. Posuere dolor"
54.00,574.68,298.86,583.53,"/F8",9.96,"magna rhoncus natoque cursus. Pretium nulla ante cu-"
54.00,562.73,183.49,571.57,"/F8",9.96,"bilia neque nisi. Iaculis proin."
63.96,550.22,298.86,559.07,"/F8",9.96,"Lacinia purus netus orci pede blandit ornare enim."
54.00,538.27,298.83,547.12,"/F8",9.96,"Viverra felis risus malesuada ultrices aptent luctus."
54.00,526.31,298.82,535.16,"/F8",9.96,"Pretium porta nisl sem eget ultrices a. Potenti felis leo"
54.00,514.36,298.80,523.21,"/F8",9.96,"odio interdum nec ac tellus sollicitudin sed felis. Cubilia"
54.00,502.40,298.88,511.25,"/F8",9.96,"magna eget diam. Potenti proin nec. Integer magna urna"
54.00,490.45,298.84,499.29,"/F8",9.96,"bibendum. Nonummy vitae nisl ipsum condimentum id."
54.00,478.49,298.88,487.34,"/F8",9.96,"Egestas augue ut purus. Posuere lorem nec. Natoque"
54.00,466.54,298.85,475.38,"/F8",9.96,"velit fames mauris ad hac sociis potenti posuere aptent"
54.00,454.58,298.85,463.43,"/F8",9.96,"nunc eu consectetuer. Laoreet augue orci. Pretium curae"
54.00,442.63,298.82,451.47,"/F8",9.96,"sem nisl curabitur taciti purus consequat inceptos habi-"
54.00,430.67,298.82,439.52,"/F8",9.96,"tant velit id. Iaculis risus per duis eros sapien dapibus"
54.00,418.72,298.86,427.56,"/F8",9.96,"primis non mollis senectus nisi. Vivamus justo magna"
54.00,406.76,298.83,415.61,"/F8",9.96,"nunc et erat urna nonummy posuere quis sollicitudin par-"
54.00,394.81,298.84,403.65,"/F8",9.96,"turient nunc lacus integer. Conubia purus curae mauris"
54.00,382.85,298.83,391.70,"/F8",9.96,"aliquet blandit dictumst. Posuere porta nec laoreet id"
54.00,370.90,298.81,379.74,"/F8",9.96,"hendrerit. Integer nulla in nullam vel placerat convallis a"
54.00,358.94,298.86,367.79,"/F8",9.96,"hymenaeos curae augue. Conubia felis cras venenatis sol-"
54.00,346.99,298.82,355.83,"/F8",9.96,"licitudin parturient cras class. Feugiat magna. Pretium"
54.00,335.03,298.84,343.88,"/F8",9.96,"netus ad purus ligula enim. Posuere ipsum nibh rhoncus"
54.00,323.08,227.36,331.92,"/F8",9.96,"in amet eros sodales penatibus nec orci."
78.34,287.23,274.61,295.19,"/F19",8.97,"Nonummy dolor nibh pede ipsum non nisi"
107.60,276.77,245.40,284.73,"/F19",8.97,"consectetuer parturient enim."
63.96,249.90,298.85,258.75,"/F8",9.96,"Integer massa eu orci sagittis a sollicitudin erat. Cu-"
54.00,237.94,298.85,246.79,"/F8",9.96,"bilia proin elit commodo consequat primis a volutpat."
54.00,225.99,298.81,234.84,"/F8",9.96,"Pretium fames dis aptent. Vivamus felis velit suspendisse"
54.00,214.03,298.87,222.88,"/F8",9.96,"vehicula elementum. Conubia justo. Gravida magna at"
54.00,202.08,298.80,210.93,"/F8",9.96,"vitae nibh primis eleifend ridiculus a imperdiet velit a"
54.00,190.12,298.88,198.97,"/F8",9.96,"eget ac. Pretium class est cum ve arcu ad. Egestas cu-"
54.00,178.17,298.81,187.01,"/F8",9.96,"rae nisl turpis eni nunc placerat vestibulum rutrum sem"
54.00,166.21,298.83,175.06,"/F8",9.96,"tortor at morbi in. Potenti neque vel duis in. Nonummy"
54.00,154.26,298.83,163.10,"/F8",9.96,"metus est cursus feugiat sed dictum. Pretium neque ve"
54.00,142.30,298.82,151.15,"/F8",9.96,"cursus a parturient sem parturient. Pretium purus augue"
54.00,130.35,298.86,139.19,"/F8",9.96,"placerat cras. Vivamus purus morbi aenean ac torquent."
54.00,118.39,298.90,127.24,"/F8",9.96,"Laoreet etiam nunc commodo mauris amet erat. Inte-"
317.01,777.92,561.86,786.77,"/F8",9.96,"ger curae amet fermentum et hendrerit a. Euismod nulla"
317.01,765.96,561.85,774.81,"/F8",9.96,"parturient. Potenti vitae ut varius ac diam mollis ac"
317.01,754.01,561.84,762.86,"/F8",9.96,"sociosqu est ligula feugiat orci inceptos. Natoque felis."
317.01,742.05,561.86,750.90,"/F8",9.96,"Euismod dolor eu proin montes fringilla risus. Conubia"
317.01,730.10,561.86,738.94,"/F8",9.96,"class fames nam turpis a feugiat dictum dis. Aliquet do-"
317.01,718.14,561.85,726.99,"/F8",9.96,"lor est metus penatibus condimentum neque imperdiet"
317.01,706.19,466.27,715.03,"/F8",9.96,"viverra sollicitudin. Lacinia curae."
326.98,693.75,561.92,702.60,"/F8",9.96,"Rhoncus fames morbi nulla a arcu fames. Gravida"
317.01,681.80,561.88,690.64,"/F8",9.96,"fames. Posuere massa cum sapien faucibus convallis ante"
317.01,669.84,561.88,678.69,"/F8",9.96,"magna imperdiet. Euismod donec. Iaculis proin fames"
317.01,657.89,561.83,666.73,"/F8",9.96,"aliquet dictum est adipiscing class nisi. Euismod lacus."
317.01,645.93,561.84,654.78,"/F8",9.96,"Potenti risus dolor arcu vel vitae laoreet. Rhoncus dolor"
317.01,633.98,561.85,642.82,"/F8",9.96,"ac cursus consequat parturient eget dolor. Iaculis justo"
317.01,622.02,561.85,630.87,"/F8",9.96,"nisl ac nisi curae rutrum eros consequat ac et fringilla"
317.01,610.07,418.99,618.91,"/F8",9.96,"eget ipsum tempor et."
429.38,610.07,561.88,618.91,"/F8",9.96,"Integer purus augue praesent"
317.01,598.11,561.80,606.96,"/F8",9.96,"habitasse. Sodales proin vestibulum scelerisque turpis et."
317.01,586.15,561.88,595.00,"/F8",9.96,"Posuere risus. Potenti massa justo eget egestas morbi"
317.01,574.20,561.84,583.05,"/F8",9.96,"iaculis dignissim amet nibh. Potenti purus. Dapibus"
317.01,562.24,561.93,571.09,"/F8",9.96,"magna. Egestas magna. Quisque magna duis nam amet"
317.01,550.29,561.87,559.14,"/F8",9.96,"nec nisl. Integer justo cum amet conubia neque ipsum"
317.01,538.33,561.84,547.18,"/F8",9.96,"sed. Conubia risus cum rutrum mollis torquent elit cum"
317.01,526.38,561.85,535.23,"/F8",9.96,"dis. Quisque ipsum egestas dictum id morbi ve litora"
317.01,514.42,561.85,523.27,"/F8",9.96,"eu. Aliquam lorem amet feugiat nulla enim fringilla pel-"
317.01,502.47,561.84,511.32,"/F8",9.96,"lentesque hac tincidunt. Egestas curae at elit semper"
317.01,490.51,455.11,499.36,"/F8",9.96,"porttitor commodo vitae purus."
329.20,455.02,549.77,462.98,"/F19",8.97,"ALIQUAM NULLA IPSUM LACUS TEMPUS"
375.41,444.56,503.60,452.52,"/F19",8.97,"NULLAM NULLA CLASS."
326.98,417.75,561.88,426.60,"/F8",9.96,"Aliquam risus parturient potenti cras amet magna."
317.01,405.80,561.88,414.64,"/F8",9.96,"Iaculis proin parturient ullamcorper. Commodo augue"
317.01,393.84,561.85,402.69,"/F8",9.96,"nunc suscipit blandit in primis commodo posuere phare-"
317.01,381.89,561.86,390.73,"/F8",9.96,"tra diam et consectetuer nostra aptent lorem. Vivamus"
317.01,369.93,561.83,378.78,"/F8",9.96,"vitae sit vestibulum aenean risus vestibulum. Euismod"
317.01,357.98,561.88,366.82,"/F8",9.96,"magna dis erat nisl adipiscing cras neque sodales aenean"
317.01,346.02,561.86,354.87,"/F8",9.96,"curae iaculis. Vivamus donec sed duis ac quis facilisi"
317.01,334.07,561.85,342.91,"/F8",9.96,"aliquet. Euismod fusce mi primis dui gravida platea."
317.01,322.11,561.86,330.96,"/F8",9.96,"Gravida fusce augue dictum ullamcorper ipsum aptent"
317.01,310.16,561.80,319.00,"/F8",9.96,"ve litora convallis porttitor parturient. Quisque velit."
317.01,298.20,561.84,307.05,"/F8",9.96,"Aliquet dolor orci dui auctor aliquam aliquet orci erat."
317.01,286.25,561.86,295.09,"/F8",9.96,"Aliquam neque eros accumsan habitant eu platea sollici-"
317.01,274.29,561.88,283.14,"/F8",9.96,"tudin pretium volutpat auctor aptent. Commodo magna"
317.01,262.34,561.88,271.18,"/F8",9.96,"nisi. Rhoncus dolor enim sapien ornare nam blandit."
317.01,250.38,561.86,259.23,"/F8",9.96,"Feugiat magna mi sapien vulputate risus ut nibh at me-"
317.01,238.43,561.87,247.27,"/F8",9.96,"tus. Commodo magna. Posuere lacus nibh ultricies dis."
317.01,226.47,561.84,235.32,"/F8",9.96,"Viverra vitae amet tristique praesent aenean nisl. Ali-"
317.01,214.52,561.88,223.36,"/F8",9.96,"quam fusce. Conubia purus eu curae sociosqu penati-"
317.01,202.56,561.82,211.41,"/F8",9.96,"bus turpis lobortis dignissim nec aliquet. Natoque etiam."
317.01,190.60,561.16,199.45,"/F8",9.96,"Quisque vitae at sapien. Vivamus felis nec tellus nisi in."
326.98,178.17,561.86,187.01,"/F8",9.96,"Laoreet nulla ve. Dapibus purus et tellus justo mus"
317.01,166.21,561.85,175.06,"/F8",9.96,"parturient eu. Blandit magna elit tempor lacinia enim"
317.01,154.26,561.85,163.10,"/F8",9.96,"mi. Posuere felis in curabitur a dolor ve auctor lorem."
317.01,142.30,561.86,151.15,"/F8",9.96,"Viverra netus at malesuada vestibulum posuere nisi."
317.01,130.35,561.85,139.19,"/F8",9.96,"Gravida justo. Iaculis purus eros. Dapibus curae fusce"
317.01,118.39,561.90,127.24,"/F8",9.96,"aptent ut. Lacinia magna nunc ac nec malesuada ornare"
