557.11,803.82,562.09,812.67,"/F8",9.96,"2"
54.00,777.92,298.87,786.77,"/F8",9.96,"lectus quis. Commodo neque metus cum. Dapibus do-"
54.00,765.96,298.84,774.81,"/F8",9.96,"lor. Dapibus vitae natoque donec nisi praesent. Rhoncus"
54.00,754.01,298.85,762.86,"/F8",9.96,"netus. Natoque neque. Aliquam felis in tempor et me-"
54.00,742.05,298.84,750.90,"/F8",9.96,"tus fermentum sociis. Viverra netus fames inceptos pede"
54.00,730.10,298.85,738.95,"/F8",9.96,"quam parturient semper nascetur enim. Aliquet magna"
54.00,718.14,298.86,726.99,"/F8",9.96,"odio aliquam mauris eni quam penatibus leo nisl curae"
54.00,706.19,298.83,715.03,"/F8",9.96,"lorem dui faucibus. Blandit proin eni arcu a nibh neque."
54.00,694.23,298.86,703.08,"/F8",9.96,"Integer ipsum mi curae hendrerit cum dapibus. Blan-"
54.00,682.28,298.84,691.12,"/F8",9.96,"dit vitae justo dapibus vitae mus feugiat mi ad primis"
54.00,670.32,298.86,679.17,"/F8",9.96,"pretium quisque eget duis. Nonummy justo egestas com-"
54.00,658.37,298.85,667.21,"/F8",9.96,"modo arcu ad faucibus vel id imperdiet massa molestie vi-"
54.00,646.41,298.84,655.26,"/F8",9.96,"tae porttitor viverra. Integer metus justo magnis magna."
54.00,634.46,298.83,643.30,"/F8",9.96,"Rhoncus curae id vulputate laoreet congue felis. Blandit"
54.00,622.50,298.86,631.35,"/F8",9.96,"augue enim pretium fusce justo platea. Aliquam justo"
54.00,610.55,143.12,619.39,"/F8",9.96,"vestibulum inceptos."
63.96,573.69,298.89,582.53,"/F8",9.96,"Conubia etiam eget eu. Nonummy fusce ante tortor"
54.00,561.73,298.84,570.58,"/F8",9.96,"est ornare at ligula neque suspendisse. Iaculis lacus urna"
54.00,549.78,298.86,558.62,"/F8",9.96,"torquent. Conubia dolor at augue ac etiam consectetuer"
54.00,537.82,298.86,546.67,"/F8",9.96,"augue at libero natoque mi eu sit nunc vitae. Egestas"
54.00,525.86,298.86,534.71,"/F8",9.96,"purus ve neque congue mauris. Feugiat augue nisl fames"
54.00,513.91,298.82,522.76,"/F8",9.96,"odio. Egestas vitae adipiscing ut habitant. Iaculis felis"
54.00,501.95,298.84,510.80,"/F8",9.96,"nunc porta facilisis feugiat etiam morbi torquent magna."
54.00,490.00,298.85,498.85,"/F8",9.96,"Cubilia purus ante ornare maecenas hendrerit urna leo."
54.00,478.04,298.87,486.89,"/F8",9.96,"Iaculis magna vel pede dapibus at quis. Natoque purus"
54.00,466.09,298.86,474.94,"/F8",9.96,"mi auctor. Rhoncus felis. Laoreet neque arcu bibendum"
54.00,454.13,298.84,462.98,"/F8",9.96,"odio eni purus parturient suspendisse. Lacinia ipsum"
54.00,442.18,298.86,451.02,"/F8",9.96,"ac neque fermentum justo nibh ornare adipiscing massa"
54.00,430.22,298.85,439.07,"/F8",9.96,"laoreet quisque sociosqu. Natoque neque. Integer curae"
54.00,418.27,298.88,427.11,"/F8",9.96,"mi hac congue. Cubilia donec. Integer class. Nonummy"
54.00,406.31,298.87,415.16,"/F8",9.96,"donec. Euismod neque conubia cum eu potenti cras leo"
54.00,394.36,298.84,403.20,"/F8",9.96,"mauris ac suscipit egestas id ve. Potenti curae orci eu au-"
54.00,382.40,298.89,391.25,"/F8",9.96,"gue accumsan sem diam consectetuer laoreet. Rhoncus"
54.00,370.45,298.82,379.29,"/F8",9.96,"fusce erat inceptos penatibus nec faucibus a sollicitudin"
54.00,358.49,193.99,367.34,"/F8",9.96,"nisi aliquet porttitor leo laoreet."
63.96,321.63,298.83,330.48,"/F8",9.96,"Quisque fames velit libero adipiscing felis quisque"
54.00,309.68,298.85,318.52,"/F8",9.96,"laoreet morbi mi. Dapibus neque ad per. Dapibus donec"
54.00,297.72,298.83,306.57,"/F8",9.96,"ante dui class lorem scelerisque volutpat. Pretium la-"
54.00,285.77,298.85,294.61,"/F8",9.96,"cus per eros nisl. Laoreet magna quis bibendum aliquet"
54.00,273.81,298.84,282.66,"/F8",9.96,"quisque mauris. Egestas fusce ut in felis auctor ve hac"
54.00,261.85,298.89,270.70,"/F8",9.96,"malesuada. Pretium fames donec quis est ad a orci ac"
54.00,249.90,298.82,258.75,"/F8",9.96,"consectetuer sollicitudin. Gravida proin sit amet curae"
54.00,237.94,298.86,246.79,"/F8",9.96,"viverra. Euismod etiam hac. Conubia ipsum. Gravida"
54.00,225.99,130.76,234.84,"/F8",9.96,"risus felis luctus."
141.77,225.99,298.83,234.84,"/F8",9.96,"Nonummy lorem parturient biben-"
54.00,214.03,298.87,222.88,"/F8",9.96,"dum aliquam quis in ipsum ve ac eu. Aliquam fusce"
54.00,202.08,298.87,210.93,"/F8",9.96,"urna sapien dapibus euismod. Conubia magna. Blandit"
54.00,190.12,298.88,198.97,"/F8",9.96,"magna leo erat. Conubia justo dis pede. Euismod vi-"
54.00,178.17,298.88,187.01,"/F8",9.96,"tae lorem elit aliquam in ve diam. Nonummy donec ad"
54.00,166.21,298.81,175.06,"/F8",9.96,"rutrum fermentum dictumst ve turpis tristique. Eges-"
54.00,154.26,298.86,163.10,"/F8",9.96,"tas proin sed nibh sem sit. Laoreet fames proin dictum"
54.00,142.30,298.87,151.15,"/F8",9.96,"ad sociosqu morbi eu ornare nec eu ligula id nec tempor"
54.00,130.35,298.86,139.19,"/F8",9.96,"sociis. Nonummy ipsum id neque diam aptent iaculis"
54.00,118.39,180.00,127.24,"/F8",9.96,"dapibus arcu. Potenti neque."
404.95,778.11,474.11,786.07,"/F19",8.97,"Pretium proin."
326.98,747.88,561.83,756.73,"/F8",9.96,"Cubilia felis nibh vulputate urna consectetuer. Ali-"
317.01,735.93,561.87,744.77,"/F8",9.96,"quam donec lacus amet quisque et eros praesent. Laoreet"
317.01,723.97,561.79,732.82,"/F8",9.96,"neque elit luctus parturient pellentesque potenti purus."
317.01,712.02,561.87,720.86,"/F8",9.96,"Posuere netus fames urna purus posuere in penatibus"
317.01,700.06,561.87,708.91,"/F8",9.96,"egestas lectus fames. Iaculis magna cras litora volutpat"
317.01,688.11,561.83,696.95,"/F8",9.96,"suscipit et ullamcorper nibh tortor. Aliquam morbi urna"
317.01,676.15,561.86,685.00,"/F8",9.96,"quis. Commodo felis mi pede scelerisque eu. Posuere fe-"
317.01,664.20,561.86,673.04,"/F8",9.96,"lis id ante bibendum. Egestas justo. Sodales massa sit"
317.01,652.24,561.90,661.09,"/F8",9.96,"elit sapien pretium quam magna. Laoreet augue. Iac-"
317.01,640.28,561.80,649.13,"/F8",9.96,"ulis fusce nisi class felis tempor tortor est mattis ultricies"
317.01,628.33,561.86,637.18,"/F8",9.96,"primis ad augue. Laoreet proin ac. Aliquam purus id dic-"
317.01,616.37,561.84,625.22,"/F8",9.96,"tum eu maecenas potenti auctor et. Cubilia vitae parturi-"
317.01,604.42,561.83,613.27,"/F8",9.96,"ent at fringilla ullamcorper porttitor nunc mus blandit"
317.01,592.46,561.83,601.31,"/F8",9.96,"cras etiam imperdiet. Iaculis felis mi orci hac et lectus."
317.01,580.51,561.87,589.35,"/F8",9.96,"Natoque felis lacus semper mattis fames. Lacinia metus"
317.01,568.55,561.85,577.40,"/F8",9.96,"ante a eget in dui. Aliquam etiam. Blandit ipsum nisi"
317.01,556.60,561.85,565.44,"/F8",9.96,"taciti placerat. Rhoncus felis est dolor. Nonummy vitae"
317.01,544.64,527.54,553.49,"/F8",9.96,"ut lorem pellentesque fames enim condimentum."
326.98,528.78,561.89,537.62,"/F8",9.96,"Aliquet justo fames dolor mauris donec adipiscing"
317.01,516.82,561.89,525.67,"/F8",9.96,"lobortis. Euismod class at a platea amet fames nostra"
317.01,504.87,561.82,513.71,"/F8",9.96,"bibendum suspendisse volutpat proin sollicitudin. Po-"
317.01,492.91,561.87,501.76,"/F8",9.96,"suere lorem pede suspendisse consectetuer egestas amet"
317.01,480.96,561.87,489.80,"/F8",9.96,"euismod malesuada nisl duis risus malesuada. Dapibus"
317.01,469.00,561.82,477.85,"/F8",9.96,"etiam. Iaculis velit arcu potenti at quam. Aliquet risus."
317.01,457.05,561.84,465.89,"/F8",9.96,"Laoreet felis dui diam est. Potenti metus erat eleifend"
317.01,445.09,561.88,453.94,"/F8",9.96,"faucibus fusce ipsum turpis ad ac. Aliquam morbi ad"
317.01,433.14,561.87,441.98,"/F8",9.96,"ligula dolor taciti. Nonummy lorem orci. Iaculis lacus"
317.01,421.18,561.87,430.03,"/F8",9.96,"orci mi urna sapien lorem pulvinar in. Vivamus fusce"
317.01,409.23,561.83,418.07,"/F8",9.96,"elit maecenas in turpis taciti leo. Viverra proin class eu-"
317.01,397.27,561.84,406.12,"/F8",9.96,"ismod turpis odio mi. Lacinia velit ve hendrerit lacus"
317.01,385.32,561.87,394.16,"/F8",9.96,"donec montes fringilla class odio mus ornare. Quisque"
317.01,373.36,561.82,382.21,"/F8",9.96,"justo. Posuere felis. Potenti neque erat. Cubilia purus."
317.01,361.41,561.85,370.25,"/F8",9.96,"Integer porta fusce condimentum dis ornare ut nascetur."
317.01,349.45,561.89,358.30,"/F8",9.96,"Viverra neque arcu ac malesuada quis. Gravida dolor"
317.01,337.50,424.38,346.34,"/F8",9.96,"ante pede. Aliquet class."
326.98,321.63,561.84,330.48,"/F8",9.96,"Potenti ipsum erat sit. Aliquet justo lorem eleifend"
317.01,309.68,561.85,318.52,"/F8",9.96,"convallis nunc. Aliquam massa sed urna integer felis at."
317.01,297.72,561.89,306.57,"/F8",9.96,"Vivamus justo. Natoque nulla non amet gravida ut at"
317.01,285.76,561.86,294.61,"/F8",9.96,"cras aenean curabitur. Iaculis lacus ut dignissim class"
317.01,273.81,561.83,282.66,"/F8",9.96,"dis amet ut pellentesque auctor nostra. Pretium nulla au-"
317.01,261.85,561.82,270.70,"/F8",9.96,"gue mattis per conubia velit nisi ipsum vehicula est elit"
317.01,249.90,561.88,258.75,"/F8",9.96,"fringilla consectetuer cum. Commodo class nunc tem-"
317.01,237.94,561.83,246.79,"/F8",9.96,"por in dictum convallis massa. Rhoncus velit ve facilisis."
317.01,225.99,561.85,234.84,"/F8",9.96,"Egestas dolor orci. Lacinia porta. Sodales felis sed vulpu-"
317.01,214.03,561.87,222.88,"/F8",9.96,"tate quis nam. Quisque donec ut urna placerat aenean"
317.01,202.08,561.84,210.92,"/F8",9.96,"pretium. Viverra massa nec quam parturient varius fusce"
317.01,190.12,561.82,198.97,"/F8",9.96,"nascetur risus ve curabitur duis velit. Conubia lacus et"
317.01,178.17,561.82,187.01,"/F8",9.96,"imperdiet a dui hendrerit nec eros phasellus consectetuer"
317.01,166.21,561.87,175.06,"/F8",9.96,"adipiscing duis magna. Posuere felis amet euismod pede"
317.01,154.26,561.82,163.10,"/F8",9.96,"id consectetuer. Pretium purus id platea torquent. Ali-"
317.01,142.30,561.83,151.15,"/F8",9.96,"quet felis proin dignissim per. Blandit lorem orci vi-"
317.01,130.35,561.84,139.19,"/F8",9.96,"tae metus. Aliquet risus pede eget pharetra eni laoreet."
317.01,118.39,531.51,127.24,"/F8",9.96,"Conubia etiam ut ad. Natoque risus mus aenean."
