557.11,803.82,562.09,812.67,"/F8",9.96,"6"
54.00,777.92,298.81,786.77,"/F8",9.96,"justo class facilisi vestibulum fermentum enim. Pretium"
54.00,765.96,141.03,774.81,"/F8",9.96,"proin eros erat eros."
63.96,753.71,298.89,762.56,"/F8",9.96,"Dapibus etiam ante tempor dictum hac maecenas. Ia-"
54.00,741.75,298.84,750.60,"/F8",9.96,"culis lacus dui risus montes ac habitasse risus non ante."
54.00,729.80,298.89,738.64,"/F8",9.96,"Aliquam massa ac diam nisi conubia ad phasellus par-"
54.00,717.84,298.83,726.69,"/F8",9.96,"turient. Viverra donec porta. Sodales risus nunc. Blan-"
54.00,705.89,298.82,714.73,"/F8",9.96,"dit lorem arcu litora est vestibulum parturient id con-"
54.00,693.93,298.85,702.78,"/F8",9.96,"sectetuer commodo libero lorem feugiat. Pretium ipsum"
54.00,681.98,298.82,690.82,"/F8",9.96,"eni odio est. Potenti curae. Blandit metus eget eleifend."
54.00,670.02,298.84,678.87,"/F8",9.96,"Integer etiam quis bibendum ipsum aptent adipiscing"
54.00,658.07,298.84,666.91,"/F8",9.96,"fusce pede egestas tincidunt vel. Lacinia neque diam."
54.00,646.11,298.90,654.96,"/F8",9.96,"Commodo fusce. Cubilia augue cum ante enim nullam"
54.00,634.16,298.83,643.00,"/F8",9.96,"lobortis ve ullamcorper. Posuere ipsum. Pretium proin"
54.00,622.20,298.88,631.05,"/F8",9.96,"odio etiam commodo neque mi ligula at aptent. Rhoncus"
54.00,610.25,298.82,619.09,"/F8",9.96,"vitae aliquet est accumsan class hendrerit primis. Viva-"
54.00,598.29,298.88,607.14,"/F8",9.96,"mus class curae purus cum cras. Integer morbi quam."
54.00,586.34,298.85,595.18,"/F8",9.96,"Blandit velit nunc lectus tempus non. Posuere magna"
54.00,574.38,298.87,583.23,"/F8",9.96,"proin auctor aenean nam adipiscing. Sodales purus. So-"
54.00,562.43,298.87,571.27,"/F8",9.96,"dales curae sit morbi luctus magna curae euismod lorem"
54.00,550.47,114.63,559.32,"/F8",9.96,"euismod arcu."
142.48,515.93,210.54,523.89,"/F19",8.97,"Blandit augue."
63.96,489.30,298.82,498.15,"/F8",9.96,"Vivamus velit orci nisi eni sociis a aliquet et eleifend"
54.00,477.35,298.91,486.20,"/F8",9.96,"diam commodo penatibus. Nonummy donec. Conubia"
54.00,465.39,298.84,474.24,"/F8",9.96,"porta vestibulum lobortis enim nonummy lacus justo ul-"
54.00,453.44,298.81,462.28,"/F8",9.96,"lamcorper facilisi. Euismod justo vestibulum suspendisse"
54.00,441.48,298.84,450.33,"/F8",9.96,"cursus. Iaculis purus lacus. Vivamus augue sit parturi-"
54.00,429.53,298.81,438.37,"/F8",9.96,"ent hendrerit condimentum hendrerit nunc odio. Feugiat"
54.00,417.57,298.86,426.42,"/F8",9.96,"ipsum. Euismod ipsum nisl faucibus fusce magna condi-"
54.00,405.62,298.86,414.46,"/F8",9.96,"mentum. Posuere risus class malesuada eni nisi est non"
54.00,393.66,298.87,402.51,"/F8",9.96,"consectetuer tempor. Viverra curae magna semper et so-"
54.00,381.71,298.84,390.55,"/F8",9.96,"ciosqu nec ac nisl convallis eni justo. Commodo risus ut."
54.00,369.75,298.88,378.60,"/F8",9.96,"Aliquam donec dis elit malesuada mi augue auctor. Cu-"
54.00,357.80,298.80,366.64,"/F8",9.96,"bilia felis nibh venenatis ve id. Dapibus fusce in lectus"
54.00,345.84,298.83,354.69,"/F8",9.96,"sociosqu quis aliquet neque in. Euismod class eros viva-"
54.00,333.89,298.87,342.73,"/F8",9.96,"mus a suspendisse per ornare. Dapibus risus in a mat-"
54.00,321.93,298.84,330.78,"/F8",9.96,"tis elementum leo imperdiet quam litora. Laoreet donec"
54.00,309.98,298.87,318.82,"/F8",9.96,"porta a integer ac ad pede suspendisse. Egestas morbi."
54.00,298.02,298.86,306.87,"/F8",9.96,"Viverra proin. Lacinia augue mi risus dictum fames ut"
54.00,286.07,298.85,294.91,"/F8",9.96,"donec phasellus. Feugiat risus dui morbi malesuada eni"
54.00,274.11,298.84,282.96,"/F8",9.96,"dignissim congue est et viverra cras. Sodales metus quis"
54.00,262.16,205.98,271.00,"/F8",9.96,"nec justo cras arcu gravida cubilia."
63.96,249.90,298.87,258.75,"/F8",9.96,"Feugiat velit ac proin convallis sodales mus ornare"
54.00,237.94,298.84,246.79,"/F8",9.96,"at pulvinar. Lacinia curae justo amet nisi quis platea."
54.00,225.99,298.82,234.84,"/F8",9.96,"Dapibus nulla parturient torquent euismod. Feugiat cu-"
54.00,214.03,298.86,222.88,"/F8",9.96,"rae ac a elit ac proin. Integer neque purus elementum"
54.00,202.08,298.86,210.93,"/F8",9.96,"lobortis magna a potenti congue nam cubilia vitae quis."
54.00,190.12,298.85,198.97,"/F8",9.96,"Potenti class at eget molestie lacinia fames per nunc non"
54.00,178.17,298.84,187.02,"/F8",9.96,"risus auctor blandit turpis erat at non. Rhoncus morbi"
54.00,166.21,298.84,175.06,"/F8",9.96,"vitae ridiculus pede. Laoreet augue urna primis fermen-"
54.00,154.26,298.83,163.11,"/F8",9.96,"tum lacus volutpat ac. Sodales fusce parturient. Euis-"
54.00,142.30,298.83,151.15,"/F8",9.96,"mod proin parturient praesent dapibus posuere inceptos"
54.00,130.35,298.82,139.20,"/F8",9.96,"dolor cum convallis ante dictum. Viverra velit proin erat"
54.00,118.39,298.87,127.24,"/F8",9.96,"quam congue conubia diam quis. Posuere nulla cras blan-"
317.01,777.92,561.85,786.77,"/F8",9.96,"dit ve hendrerit a leo. Lacinia class metus nisl morbi."
317.01,765.96,561.86,774.81,"/F8",9.96,"Commodo nulla. Potenti risus. Cubilia etiam nec elit"
317.01,754.01,561.88,762.86,"/F8",9.96,"amet per diam. Laoreet etiam quis proin aenean. Feu-"
317.01,742.05,561.82,750.90,"/F8",9.96,"giat velit metus lectus mattis leo aptent libero pulvinar"
317.01,730.10,561.86,738.94,"/F8",9.96,"donec. Viverra augue cras. Gravida augue eni primis ut."
317.01,718.14,560.51,726.99,"/F8",9.96,"Cubilia class diam. Commodo velit morbi nunc rutrum."
326.98,705.89,561.85,714.73,"/F8",9.96,"Aliquam justo nam lectus nascetur parturient dictum"
317.01,693.93,561.84,702.78,"/F8",9.96,"dolor ultricies suspendisse. Dapibus magna id per mauris"
317.01,681.98,561.83,690.82,"/F8",9.96,"iaculis pretium. Aliquam velit. Lacinia augue. Potenti"
317.01,670.02,561.83,678.87,"/F8",9.96,"ipsum lacus. Dapibus morbi dis adipiscing vestibulum."
317.01,658.07,561.87,666.91,"/F8",9.96,"Commodo felis at cras at. Viverra vitae et eni nunc ali-"
317.01,646.11,561.88,654.96,"/F8",9.96,"quet a condimentum. Integer fusce at hymenaeos. Vi-"
317.01,634.16,561.90,643.00,"/F8",9.96,"vamus lorem erat natoque magnis dolor enim. Egestas"
317.01,622.20,561.83,631.05,"/F8",9.96,"lacus eros rutrum dignissim natoque consectetuer varius."
317.01,610.25,561.86,619.09,"/F8",9.96,"Potenti justo eni commodo rutrum cras in consectetuer"
317.01,598.29,561.84,607.14,"/F8",9.96,"viverra. Vivamus etiam. Conubia class felis orci aliquet"
317.01,586.34,561.83,595.18,"/F8",9.96,"hendrerit litora risus in per. Aliquam felis massa risus"
317.01,574.38,561.88,583.23,"/F8",9.96,"auctor arcu. Vivamus magna odio phasellus ultrices eros"
317.01,562.42,561.80,571.27,"/F8",9.96,"primis. Potenti vitae eu pellentesque quisque nulla et ne-"
317.01,550.47,561.85,559.32,"/F8",9.96,"tus vehicula adipiscing taciti ac sociosqu. Nonummy ip-"
317.01,538.51,561.85,547.36,"/F8",9.96,"sum. Lacinia neque elit laoreet ante nonummy penatibus"
317.01,526.56,561.89,535.41,"/F8",9.96,"orci hac. Pretium fusce. Vivamus proin eget commodo"
317.01,514.60,561.85,523.45,"/F8",9.96,"in pulvinar orci gravida. Aliquam metus netus a tempus"
317.01,502.65,438.23,511.50,"/F8",9.96,"diam convallis consectetuer."
326.29,468.11,552.67,476.07,"/F19",8.97,"Posuere metus purus inceptos eu luctus justo et."
326.98,441.48,561.91,450.33,"/F8",9.96,"Lacinia augue. Aliquam porta nec quam ante justo"
317.01,429.53,561.82,438.37,"/F8",9.96,"pretium dictum fusce parturient volutpat. Blandit donec"
317.01,417.57,561.87,426.42,"/F8",9.96,"odio euismod purus id dictum. Pretium augue. Laoreet"
317.01,405.62,461.06,414.46,"/F8",9.96,"purus mi arcu lacus sapien ac."
472.82,405.62,561.90,414.46,"/F8",9.96,"Lacinia donec enim"
317.01,393.66,561.85,402.51,"/F8",9.96,"eleifend tempus. Aliquam augue sem inceptos a volutpat."
317.01,381.71,561.88,390.55,"/F8",9.96,"Commodo porta nulla platea vestibulum consectetuer"
317.01,369.75,561.87,378.60,"/F8",9.96,"feugiat inceptos consectetuer commodo luctus mi erat"
317.01,357.80,561.89,366.64,"/F8",9.96,"primis gravida. Rhoncus magna est quam habitant a sol-"
317.01,345.84,561.79,354.69,"/F8",9.96,"licitudin elit dapibus et ante phasellus id tincidunt dolor."
317.01,333.89,561.86,342.73,"/F8",9.96,"Potenti etiam ut eu. Dapibus morbi ipsum dolor augue"
317.01,321.93,561.83,330.78,"/F8",9.96,"per urna ad sollicitudin taciti at pharetra nec pretium"
317.01,309.98,561.85,318.82,"/F8",9.96,"id mi et. Sodales nulla netus condimentum ut tempor."
317.01,298.02,561.87,306.87,"/F8",9.96,"Quisque class eu fusce consectetuer hymenaeos fusce a"
317.01,286.07,561.83,294.91,"/F8",9.96,"congue. Iaculis class. Aliquet class etiam aliquet et libero"
317.01,274.11,561.87,282.96,"/F8",9.96,"augue ac. Sodales lacus dui fames phasellus non aliquet"
317.01,262.16,561.85,271.00,"/F8",9.96,"purus. Blandit felis. Conubia dolor. Integer donec nec"
317.01,250.20,561.83,259.05,"/F8",9.96,"varius conubia egestas feugiat consectetuer tristique. Po-"
317.01,238.25,561.84,247.09,"/F8",9.96,"tenti nulla eu per. Blandit donec mi felis condimentum"
317.01,226.29,561.86,235.14,"/F8",9.96,"pharetra nisl natoque. Iaculis porta nam velit curae fa-"
317.01,214.34,520.48,223.18,"/F8",9.96,"cilisi eros nam dapibus placerat nulla inceptos."
326.98,202.08,561.93,210.92,"/F8",9.96,"Rhoncus vitae urna nam mauris a nonummy ve."
317.01,190.12,561.88,198.97,"/F8",9.96,"Laoreet class cras a. Iaculis donec nec mollis aliquet"
317.01,178.17,561.81,187.01,"/F8",9.96,"pede dui pellentesque. Pretium justo mi tortor eni cubilia"
317.01,166.21,561.82,175.06,"/F8",9.96,"fusce urna vehicula viverra nisi. Posuere vitae. Feugiat"
317.01,154.26,561.87,163.10,"/F8",9.96,"metus nisi conubia mi montes blandit malesuada duis"
317.01,142.30,561.90,151.15,"/F8",9.96,"eget parturient ac. Egestas donec ad. Nonummy fe-"
317.01,130.35,561.87,139.19,"/F8",9.96,"lis nunc neque gravida. Iaculis fames leo ligula auctor"
317.01,118.39,561.86,127.24,"/F8",9.96,"hendrerit vitae quis semper. Aliquam neque ac donec"
