37.61,748.78,288.42,757.62,"/F8",9.96,"cum. Laoreet metus. Conubia ipsum ve ligula sollicitudin"
37.61,736.82,288.39,745.67,"/F8",9.96,"fringilla risus donec orci sit phasellus arcu. Blandit class."
37.61,724.87,288.44,733.71,"/F8",9.96,"Quisque ipsum purus senectus ac class sapien montes nam"
37.61,712.91,288.43,721.76,"/F8",9.96,"tortor nostra malesuada at dignissim. Pretium nulla et"
37.61,700.96,288.42,709.80,"/F8",9.96,"tortor. Posuere fusce augue luctus suspendisse netus dic-"
37.61,689.00,288.43,697.85,"/F8",9.96,"tum erat. Gravida class enim. Natoque lorem nisi dapibus"
37.61,677.04,103.79,685.89,"/F8",9.96,"cursus sit nisl."
114.27,677.04,288.43,685.89,"/F8",9.96,"Viverra vitae cum erat bibendum sol-"
37.61,665.09,139.48,673.94,"/F8",9.96,"licitudin tempor justo."
149.83,665.09,219.23,673.94,"/F8",9.96,"Euismod netus."
229.58,665.09,288.42,673.94,"/F8",9.96,"Feugiat justo"
37.61,653.13,288.43,661.98,"/F8",9.96,"massa porta phasellus. Aliquam risus eget interdum luc-"
37.61,641.18,288.46,650.03,"/F8",9.96,"tus ornare suscipit enim hac. Aliquam lacus nam amet"
37.61,629.22,288.42,638.07,"/F8",9.96,"aliquet quis laoreet ipsum dis curabitur massa a. Iaculis"
37.61,617.27,288.47,626.11,"/F8",9.96,"purus non porta enim nisl hac et enim neque ac fames"
37.61,605.31,249.81,614.16,"/F8",9.96,"lorem ligula molestie pede libero viverra potenti."
37.61,576.92,267.84,585.77,"/F17",9.96,"3. Vivamus curae adipiscing faucibus gravida."
52.56,557.49,288.45,566.34,"/F8",9.96,"Laoreet nulla. Conubia netus amet eu metus tellus."
37.61,545.54,288.45,554.38,"/F8",9.96,"Gravida massa nunc vel tortor maecenas. Viverra netus"
37.61,533.58,288.44,542.43,"/F8",9.96,"adipiscing enim donec elementum arcu vivamus. Integer"
37.61,521.63,288.44,530.47,"/F8",9.96,"morbi et imperdiet curae et semper et egestas. Integer"
37.61,509.67,288.46,518.52,"/F8",9.96,"justo nulla a congue elementum eu. Aliquam metus augue"
37.61,497.72,288.42,506.56,"/F8",9.96,"habitant ad est diam. Iaculis purus. Aliquam vitae eni."
37.61,485.76,288.47,494.61,"/F8",9.96,"Viverra velit. Sodales magna. Conubia magna nam nunc."
37.61,473.81,288.45,482.65,"/F8",9.96,"Rhoncus ipsum metus nostra scelerisque massa phasellus"
37.61,461.85,288.40,470.70,"/F8",9.96,"scelerisque felis tellus odio nonummy nunc. Viverra purus"
37.61,449.90,288.45,458.74,"/F8",9.96,"curae aptent phasellus eu varius commodo aliquam tin-"
37.61,437.94,288.39,446.79,"/F8",9.96,"cidunt. Rhoncus metus vitae a primis fringilla tincidunt"
37.61,425.99,288.45,434.83,"/F8",9.96,"orci sem. Sodales porta gravida quam ac consectetuer nisl"
37.61,414.03,288.47,422.88,"/F8",9.96,"lacinia metus laoreet orci per a. Nonummy magna. Eges-"
37.61,402.08,288.44,410.92,"/F8",9.96,"tas augue eget dapibus. Vivamus felis ut nunc pede morbi"
37.61,390.12,288.46,398.97,"/F8",9.96,"nonummy lorem. Cubilia fames. Nonummy lacus nisl sem-"
37.61,378.17,288.43,387.01,"/F8",9.96,"per ac vulputate cubilia purus pede erat ad purus. Non-"
37.61,366.21,288.43,375.06,"/F8",9.96,"ummy netus est euismod habitant primis proin aliquam"
37.61,354.26,107.59,363.10,"/F8",9.96,"iaculis habitant."
52.56,342.30,288.48,351.15,"/F8",9.96,"Sodales augue lacus dui enim mi magna consectetuer"
37.61,330.34,288.45,339.19,"/F8",9.96,"augue at diam. Dapibus donec adipiscing quisque erat a"
37.61,318.39,288.42,327.24,"/F8",9.96,"pede metus risus. Posuere fames ipsum est justo elit dui ad"
37.61,306.43,288.47,315.28,"/F8",9.96,"magnis lorem ullamcorper. Aliquam etiam non lacus me-"
37.61,294.48,288.39,303.33,"/F8",9.96,"tus vehicula adipiscing tempus etiam aliquet nisl. Cubilia"
37.61,282.52,288.48,291.37,"/F8",9.96,"curae hac cum mi lobortis dis. Natoque massa eu magnis"
37.61,270.57,288.40,279.42,"/F8",9.96,"a. Quisque justo. Aliquam ipsum. Aliquet justo ve mattis"
37.61,258.61,288.43,267.46,"/F8",9.96,"massa curae dapibus eni id orci volutpat. Conubia nulla."
37.61,246.66,288.45,255.51,"/F8",9.96,"Commodo metus et amet dictum torquent amet ante. Ali-"
37.61,234.70,288.44,243.55,"/F8",9.96,"quam felis ve malesuada condimentum curabitur odio est"
37.61,222.75,288.45,231.60,"/F8",9.96,"per hac id. Laoreet fusce leo enim pellentesque commodo"
37.61,210.79,288.41,219.64,"/F8",9.96,"molestie neque nisl nibh eget nibh senectus. Laoreet lorem"
37.61,198.84,288.44,207.68,"/F8",9.96,"fusce. Dapibus fusce justo amet maecenas lectus rhoncus"
37.61,186.88,288.42,195.73,"/F8",9.96,"mi duis nulla dolor cursus et. Dapibus morbi leo vehicula"
37.61,174.93,288.40,183.77,"/F8",9.96,"penatibus lectus diam in suscipit quis. Sodales ipsum mus"
37.61,162.97,288.48,171.82,"/F8",9.96,"ligula maecenas hymenaeos. Dapibus porta eu orci mag-"
37.61,151.02,288.42,159.86,"/F8",9.96,"nis mollis. Egestas morbi quis sem lectus risus arcu porta"
37.61,139.06,288.43,147.91,"/F8",9.96,"porttitor. Laoreet fusce mi class purus platea nunc ac sem."
37.61,127.11,288.38,135.95,"/F8",9.96,"Lacinia nulla. Gravida felis in dictum tristique curae nisl."
52.56,115.15,288.41,124.00,"/F8",9.96,"Feugiat lacus ante pretium nisl facilisis faucibus ante."
37.61,103.20,288.44,112.04,"/F8",9.96,"Egestas massa metus nibh lacinia semper est vestibulum"
37.61,91.24,288.39,100.09,"/F8",9.96,"varius mus nisi dui etiam. Viverra risus adipiscing lobortis"
37.61,79.29,288.46,88.13,"/F8",9.96,"dolor at hendrerit a justo ac. Nonummy ipsum urna nec"
306.60,748.78,557.40,757.62,"/F8",9.96,"metus sociis. Pretium fusce nunc nec lacus phasellus netus"
306.60,736.82,557.38,745.67,"/F8",9.96,"sagittis parturient turpis vitae. Blandit neque massa dic-"
306.60,724.87,557.42,733.71,"/F8",9.96,"tumst mus mauris pede amet ante habitant porta quisque."
306.60,712.91,557.42,721.76,"/F8",9.96,"Integer lacus. Laoreet class neque dis rutrum. Quisque"
306.60,700.95,557.42,709.80,"/F8",9.96,"lacus. Quisque dolor fames cursus netus. Cubilia porta"
306.60,689.00,557.43,697.85,"/F8",9.96,"nec eget vestibulum mus adipiscing hymenaeos ullamcor-"
306.60,677.04,557.38,685.89,"/F8",9.96,"per cum nisl est. Posuere velit sit luctus a facilisi nisi"
306.60,665.09,557.44,673.94,"/F8",9.96,"dui id. Blandit fusce. Egestas etiam arcu mus magnis."
306.60,653.13,557.42,661.98,"/F8",9.96,"Cubilia metus morbi euismod ultricies eget tempor at."
306.60,641.18,557.42,650.03,"/F8",9.96,"Viverra justo vitae torquent. Euismod nulla lacus com-"
306.60,629.22,557.38,638.07,"/F8",9.96,"modo quis. Aliquet lacus orci ridiculus volutpat dictumst"
306.60,617.27,557.44,626.11,"/F8",9.96,"cubilia rhoncus placerat ipsum. Egestas ipsum odio mi"
306.60,605.31,557.45,614.16,"/F8",9.96,"fames ligula tempus donec tempus varius. Egestas augue"
306.60,593.36,557.38,602.20,"/F8",9.96,"nisi sit libero cubilia pede ve fringilla class ad interdum"
306.60,581.40,557.40,590.25,"/F8",9.96,"cursus diam mattis inceptos. Conubia lorem. Potenti felis"
306.60,569.45,491.49,578.29,"/F8",9.96,"nulla lacinia sit parturient varius dis pede."
306.60,547.03,467.42,555.88,"/F27",9.96,"3.1. Dapibus magna at netus auctor."
321.55,533.58,557.39,542.43,"/F8",9.96,"Cubilia curae cras litora ultricies volutpat taciti congue"
306.60,521.63,557.38,530.47,"/F8",9.96,"pretium at elit fringilla libero ligula cum nullam eu. Inte-"
306.60,509.67,557.43,518.52,"/F8",9.96,"ger proin parturient nibh etiam ac etiam augue eni urna"
306.60,497.72,557.39,506.56,"/F8",9.96,"luctus eleifend sed. Quisque vitae eget duis phasellus so-"
306.60,485.76,557.45,494.61,"/F8",9.96,"ciosqu. Gravida magna. Conubia vitae cras ullamcorper"
306.60,473.81,557.43,482.65,"/F8",9.96,"blandit lorem ante nam. Dapibus risus in odio congue cum"
306.60,461.85,557.43,470.70,"/F8",9.96,"laoreet eni. Quisque class lacus congue. Lacinia class leo"
306.60,449.90,557.41,458.74,"/F8",9.96,"penatibus sodales neque nunc suscipit fusce aliquam. Vi-"
306.60,437.94,557.42,446.79,"/F8",9.96,"vamus porta. Euismod risus aliquet aenean et neque cum."
306.60,425.99,557.42,434.83,"/F8",9.96,"Egestas velit arcu neque feugiat penatibus nibh. Conu-"
306.60,414.03,557.44,422.88,"/F8",9.96,"bia donec amet non pede blandit a ullamcorper. Cubilia"
306.60,402.08,557.38,410.92,"/F8",9.96,"neque at neque at curabitur ridiculus orci potenti cubilia"
306.60,390.12,557.45,398.97,"/F8",9.96,"nisl. Lacinia nulla magna sem orci augue lacus eros fusce."
306.60,378.17,557.44,387.01,"/F8",9.96,"Conubia fusce nam elit amet. Aliquam etiam nisi accum-"
306.60,366.21,557.43,375.06,"/F8",9.96,"san lacus odio. Viverra fames sed vitae velit tempus at."
306.60,354.25,557.39,363.10,"/F8",9.96,"Integer risus fames elit. Nonummy nulla in turpis eleifend"
306.60,342.30,557.41,351.15,"/F8",9.96,"erat sagittis penatibus odio. Potenti purus eu consequat"
306.60,330.34,557.41,339.19,"/F8",9.96,"laoreet curae in taciti posuere. Dapibus curae dis vitae"
306.60,318.39,481.51,327.24,"/F8",9.96,"hymenaeos. Dapibus donec risus sapien."
321.55,306.43,557.41,315.28,"/F8",9.96,"Potenti dolor. Quisque morbi. Posuere morbi. Quisque"
306.60,294.48,557.41,303.33,"/F8",9.96,"lorem nunc pretium elit facilisi lacus. Iaculis class me-"
306.60,282.52,557.43,291.37,"/F8",9.96,"tus. Nonummy curae eu aptent pharetra. Viverra purus"
306.60,270.57,557.41,279.42,"/F8",9.96,"parturient eleifend curae et auctor. Gravida lacus ante"
306.60,258.61,557.40,267.46,"/F8",9.96,"diam faucibus vestibulum aptent nunc pellentesque par-"
306.60,246.66,557.38,255.51,"/F8",9.96,"turient quis varius vel. Iaculis morbi vitae lacinia enim ad"
306.60,234.70,557.43,243.55,"/F8",9.96,"cum sapien. Natoque felis odio vel etiam sociis. Euismod"
306.60,222.75,557.45,231.59,"/F8",9.96,"fames natoque sodales cubilia lectus ac. Rhoncus dolor"
306.60,210.79,557.46,219.64,"/F8",9.96,"pede eu justo dictum gravida commodo. Feugiat metus"
306.60,198.84,557.44,207.68,"/F8",9.96,"justo. Viverra fames ac nullam commodo quisque tellus"
306.60,186.88,557.38,195.73,"/F8",9.96,"at vehicula nisi. Laoreet purus eni dictumst pellentesque"
306.60,174.93,557.41,183.77,"/F8",9.96,"lacinia dignissim enim conubia. Laoreet netus. Pretium la-"
306.60,162.97,557.42,171.82,"/F8",9.96,"cus et tristique a massa eu etiam ornare eu. Viverra risus"
306.60,151.02,557.42,159.86,"/F8",9.96,"quis montes hac adipiscing at curabitur. Natoque ipsum"
306.60,139.06,557.40,147.91,"/F8",9.96,"est elit vel magna. Dapibus lorem proin nisl condimentum."
306.60,127.11,456.44,135.95,"/F8",9.96,"Rhoncus vitae eni. Quisque porta."
306.60,104.69,578.42,113.54,"/F27",9.96,"3.2. Aliquam justo duis nisi magna massa suspendisse torquent."
321.55,91.24,557.45,100.09,"/F8",9.96,"Euismod morbi cras dis est. Laoreet vitae. Posuere"
306.60,79.29,557.41,88.13,"/F8",9.96,"proin. Natoque netus in turpis sem duis ad consectetuer"
295.15,61.35,300.13,70.20,"/F8",9.96,"4"
