37.61,748.78,288.44,757.62,"/F8",9.96,"erat mi. Egestas vitae elit odio nisi. Nonummy neque"
37.61,736.82,288.42,745.67,"/F8",9.96,"at. Quisque proin erat turpis diam dictum in mollis so-"
37.61,724.87,288.45,733.71,"/F8",9.96,"dales conubia odio. Egestas purus quam a metus. Potenti"
37.61,712.91,63.65,721.76,"/F8",9.96,"netus."
52.56,700.96,288.47,709.80,"/F8",9.96,"Feugiat fusce. Rhoncus augue nam etiam cum potenti"
37.61,689.00,288.44,697.85,"/F8",9.96,"a primis. Integer risus dis diam pede dis ornare mi quam"
37.61,677.04,288.41,685.89,"/F8",9.96,"scelerisque. Natoque nulla non parturient class pede feu-"
37.61,665.09,288.44,673.94,"/F8",9.96,"giat ve pede. Euismod augue adipiscing cras taciti eu mi"
37.61,653.13,288.45,661.98,"/F8",9.96,"quis fusce egestas mollis. Gravida fames metus nostra mo-"
37.61,641.18,288.36,650.03,"/F8",9.96,"lestie vestibulum imperdiet justo eu facilisis. Egestas risus."
37.61,629.22,288.41,638.07,"/F8",9.96,"Gravida ipsum ut ligula sit. Lacinia massa cras iaculis tris-"
37.61,617.27,288.43,626.11,"/F8",9.96,"tique id imperdiet a. Viverra augue ad sapien justo. Non-"
37.61,605.31,288.42,614.16,"/F8",9.96,"ummy felis dis. Gravida lacus proin luctus platea. Rhon-"
37.61,593.36,288.46,602.20,"/F8",9.96,"cus proin ipsum a mauris justo sem. Euismod lacus donec"
37.61,581.40,288.40,590.25,"/F8",9.96,"cubilia ve nunc libero non. Potenti felis curae aptent sus-"
37.61,569.45,288.43,578.29,"/F8",9.96,"pendisse. Pretium velit sed est cum sed eu odio etiam"
37.61,557.49,288.39,566.34,"/F8",9.96,"feugiat tortor neque per. Blandit justo. Posuere nulla elit"
37.61,545.54,288.41,554.38,"/F8",9.96,"tellus mattis feugiat tempus at facilisis. Euismod justo"
37.61,533.58,288.44,542.43,"/F8",9.96,"odio non ut consectetuer euismod. Aliquam netus ve arcu"
37.61,521.63,288.39,530.47,"/F8",9.96,"tempus facilisis curabitur enim consectetuer mattis tortor"
37.61,509.67,288.41,518.52,"/F8",9.96,"phasellus penatibus eros. Gravida justo vestibulum conu-"
37.61,497.72,288.45,506.56,"/F8",9.96,"bia cum in magna nostra. Integer ipsum nam nisi viverra"
37.61,485.76,216.33,494.61,"/F8",9.96,"ad tempor in taciti ad ultrices erat nunc."
37.61,463.35,222.18,472.19,"/F27",9.96,"1.2. Quisque curae parturient ut porttitor."
52.56,449.90,288.42,458.74,"/F8",9.96,"Quisque proin euismod netus felis dictum etiam sodales"
37.61,437.94,288.45,446.79,"/F8",9.96,"vitae vel amet ve amet. Iaculis fames. Vivamus class quam"
37.61,425.99,288.42,434.83,"/F8",9.96,"iaculis est ad conubia pede. Rhoncus velit feugiat justo ad"
37.61,414.03,288.41,422.88,"/F8",9.96,"nostra vulputate dictum morbi diam. Feugiat justo elit."
37.61,402.08,288.39,410.92,"/F8",9.96,"Iaculis justo eget taciti quis feugiat ut ante ad nisl viverra"
37.61,390.12,288.49,398.97,"/F8",9.96,"ad. Commodo nulla. Euismod augue metus curae justo"
37.61,378.17,288.43,387.01,"/F8",9.96,"primis lorem porttitor sed massa. Blandit neque. Rhon-"
37.61,366.21,288.43,375.06,"/F8",9.96,"cus purus. Aliquam massa nibh scelerisque leo et mollis"
37.61,354.26,288.39,363.10,"/F8",9.96,"eu. Laoreet velit est quam mi pellentesque pretium velit."
37.61,342.30,288.48,351.15,"/F8",9.96,"Egestas lorem at nostra nonummy lacinia ante ac. So-"
37.61,330.34,288.43,339.19,"/F8",9.96,"dales donec ve a litora venenatis porta a quam parturient."
37.61,318.39,288.47,327.24,"/F8",9.96,"Rhoncus metus. Feugiat magna curae suspendisse diam"
37.61,306.43,288.44,315.28,"/F8",9.96,"orci class. Euismod felis at neque quam congue. Pretium"
37.61,294.48,288.45,303.33,"/F8",9.96,"fames. Vivamus justo lacus. Conubia morbi elit mollis"
37.61,282.52,288.39,291.37,"/F8",9.96,"mi ultrices viverra potenti tristique sem neque per. Iac-"
37.61,270.57,288.41,279.41,"/F8",9.96,"ulis fusce ipsum leo nisl a diam parturient. Sodales ipsum"
37.61,258.61,96.28,267.46,"/F8",9.96,"enim ultrices."
52.56,246.66,222.45,255.51,"/F8",9.96,"Feugiat risus parturient dapibus orci."
232.71,246.66,288.43,255.51,"/F8",9.96,"Integer class"
37.61,234.70,288.39,243.55,"/F8",9.96,"nisl ipsum torquent lacus pellentesque class eget. Quisque"
37.61,222.75,288.44,231.60,"/F8",9.96,"etiam nisi feugiat gravida ornare dolor suspendisse. Com-"
37.61,210.79,288.43,219.64,"/F8",9.96,"modo etiam et litora eleifend habitasse id eros suscipit"
37.61,198.84,288.45,207.68,"/F8",9.96,"nostra semper. Aliquam fames erat cum taciti dapibus"
37.61,186.88,288.43,195.73,"/F8",9.96,"integer. Viverra metus eu dui sapien mi habitant curae"
37.61,174.93,288.43,183.77,"/F8",9.96,"at. Conubia class conubia velit elit accumsan leo cubilia"
37.61,162.97,288.45,171.82,"/F8",9.96,"ligula metus parturient in. Blandit lacus magna massa"
37.61,151.02,288.40,159.86,"/F8",9.96,"volutpat elementum eu varius ultrices nulla. Feugiat do-"
37.61,139.06,288.40,147.91,"/F8",9.96,"lor. Cubilia donec dui nunc consectetuer ve aliquet nisi."
37.61,127.11,288.42,135.95,"/F8",9.96,"Quisque magna rhoncus luctus id nisi justo ut curae. Eu-"
37.61,115.15,288.43,124.00,"/F8",9.96,"ismod porta in placerat orci habitasse nec morbi. Cubilia"
37.61,103.20,288.44,112.04,"/F8",9.96,"purus lorem. Potenti lorem. Pretium etiam fames non"
37.61,91.24,288.40,100.09,"/F8",9.96,"primis integer potenti erat leo laoreet. Lacinia felis ut ve-"
37.61,79.29,288.44,88.13,"/F8",9.96,"nenatis quis commodo et per. Posuere vitae orci litora ac"
306.60,748.78,557.46,757.62,"/F8",9.96,"mi sapien. Egestas fames. Laoreet curae. Nonummy justo"
306.60,736.82,557.38,745.67,"/F8",9.96,"vitae lectus pellentesque. Gravida augue et ut sociis nisi"
306.60,724.87,557.36,733.71,"/F8",9.96,"elit parturient id vulputate a. Pretium metus eget potenti"
306.60,712.91,380.46,721.76,"/F8",9.96,"est nullam taciti."
321.55,700.95,557.43,709.80,"/F8",9.96,"Pretium velit ut odio senectus suspendisse accumsan"
306.60,689.00,557.42,697.85,"/F8",9.96,"posuere montes dignissim hymenaeos sollicitudin mus. Na-"
306.60,677.04,557.42,685.89,"/F8",9.96,"toque class dui quam iaculis risus per. Lacinia augue nisi"
306.60,665.09,557.42,673.94,"/F8",9.96,"nibh phasellus vehicula habitant magna conubia nisl. Non-"
306.60,653.13,557.48,661.98,"/F8",9.96,"ummy massa magna ipsum montes at nonummy nibh erat"
306.60,641.18,557.44,650.02,"/F8",9.96,"habitasse ut dolor auctor nulla maecenas. Quisque la-"
306.60,629.22,557.41,638.07,"/F8",9.96,"cus purus feugiat natoque hymenaeos nunc arcu hendrerit."
306.60,617.27,557.46,626.11,"/F8",9.96,"Rhoncus vitae nisi vivamus sed in. Commodo donec at"
306.60,605.31,557.39,614.16,"/F8",9.96,"rutrum. Blandit etiam erat dapibus purus felis proin nec"
306.60,593.36,557.43,602.20,"/F8",9.96,"nibh. Dapibus magna. Lacinia fusce ac vitae dictumst."
306.60,581.40,512.31,590.25,"/F8",9.96,"Potenti porta nec eros vel morbi hymenaeos."
522.51,581.40,557.45,590.25,"/F8",9.96,"Gravida"
306.60,569.45,557.43,578.29,"/F8",9.96,"lorem non nisl in. Cubilia purus. Rhoncus fames vitae"
306.60,557.49,557.43,566.34,"/F8",9.96,"placerat venenatis odio cum odio accumsan pellentesque"
306.60,545.54,557.41,554.38,"/F8",9.96,"magnis velit aliquet. Vivamus massa vestibulum. Feugiat"
306.60,533.58,557.42,542.43,"/F8",9.96,"morbi. Conubia fusce porta placerat hendrerit. Euismod"
306.60,521.63,557.40,530.47,"/F8",9.96,"justo ante nec urna sit. Aliquam justo nec quis nibh sit."
306.60,509.67,557.40,518.52,"/F8",9.96,"Lacinia risus. Quisque etiam eu consectetuer varius. Eu-"
306.60,497.72,393.29,506.56,"/F8",9.96,"ismod felis sit nunc."
306.60,469.32,526.75,478.17,"/F17",9.96,"2. Commodo porta quis sit nulla nonummy."
321.55,449.90,570.52,458.74,"/F8",9.96,"Nonummy lacus diam nonummy enim nunc dictum phasel-"
306.60,437.94,557.47,446.79,"/F8",9.96,"lus euismod. Commodo proin mi senectus conubia fau-"
306.60,425.98,557.42,434.83,"/F8",9.96,"cibus morbi. Viverra risus nunc eros venenatis magnis."
306.60,414.03,557.38,422.88,"/F8",9.96,"Potenti lorem pede cum in dictum imperdiet in taciti habi-"
306.60,402.08,557.40,410.92,"/F8",9.96,"tant velit a tortor lorem parturient scelerisque. Commodo"
306.60,390.12,557.44,398.97,"/F8",9.96,"metus pede facilisi lacus fermentum commodo eros. Ali-"
306.60,378.17,557.47,387.01,"/F8",9.96,"quam fames pede arcu ante elementum. Cubilia magna"
306.60,366.21,557.43,375.06,"/F8",9.96,"nec sociosqu feugiat lacinia orci cras dapibus mi diam ante"
306.60,354.25,557.43,363.10,"/F8",9.96,"per urna duis quam praesent netus ac. Vivamus neque orci"
306.60,342.30,557.38,351.15,"/F8",9.96,"eget est. Aliquam nulla parturient facilisi orci enim volut-"
306.60,330.34,557.40,339.19,"/F8",9.96,"pat tempus. Potenti purus eu auctor vulputate nulla hen-"
306.60,318.39,557.36,327.24,"/F8",9.96,"drerit parturient. Rhoncus netus class suscipit tristique"
306.60,306.43,557.41,315.28,"/F8",9.96,"ad diam. Aliquet curae. Aliquet ipsum. Integer netus."
306.60,294.48,557.42,303.32,"/F8",9.96,"Cubilia etiam ante orci hac tellus pretium. Feugiat massa"
306.60,282.52,557.41,291.37,"/F8",9.96,"vitae dictumst ipsum erat. Aliquam lorem velit montes"
306.60,270.57,557.43,279.41,"/F8",9.96,"ad in enim lobortis nec consectetuer sapien eros arcu non-"
306.60,258.61,557.41,267.46,"/F8",9.96,"ummy eu nulla eros. Potenti fames. Aliquet netus neque a"
306.60,246.66,557.42,255.50,"/F8",9.96,"rhoncus. Euismod class orci sem morbi tristique donec ac-"
306.60,234.70,557.44,243.55,"/F8",9.96,"cumsan donec. Euismod porta diam sociis libero inceptos"
306.60,222.75,550.97,231.59,"/F8",9.96,"arcu quam sagittis et suspendisse diam. Gravida metus."
321.55,210.79,566.81,219.64,"/F8",9.96,"Aliquet proin nisi suspendisse laoreet condimentum diam."
306.60,198.84,557.41,207.68,"/F8",9.96,"Natoque etiam diam aptent convallis vestibulum dis morbi"
306.60,186.88,557.39,195.73,"/F8",9.96,"lacus nisl aliquam ac nulla tristique inceptos. Posuere me-"
306.60,174.93,557.44,183.77,"/F8",9.96,"tus vel. Sodales etiam erat porta pharetra ad tempus."
306.60,162.97,557.43,171.82,"/F8",9.96,"Nonummy nulla quis in amet primis leo odio ve fringilla"
306.60,151.02,557.40,159.86,"/F8",9.96,"a netus. Viverra proin vitae hymenaeos aptent tristique"
306.60,139.06,557.42,147.91,"/F8",9.96,"ad mattis nulla nonummy volutpat curae. Aliquet class"
306.60,127.11,557.43,135.95,"/F8",9.96,"ac varius ipsum aptent nisl. Conubia etiam sed. Rhoncus"
306.60,115.15,557.42,124.00,"/F8",9.96,"porta vestibulum. Conubia dolor eget feugiat fermentum"
306.60,103.20,557.44,112.04,"/F8",9.96,"ornare urna eget. Posuere etiam purus sagittis curae ac"
306.60,91.24,557.36,100.09,"/F8",9.96,"nibh pulvinar tincidunt nisi quis faucibus vestibulum mau-"
306.60,79.29,557.43,88.13,"/F8",9.96,"ris eget hac diam. Aliquet fusce eu magna primis mauris."
295.15,61.35,300.13,70.20,"/F8",9.96,"2"
