557.11,803.82,562.09,812.67,"/F8",9.96,"2"
54.00,777.92,207.67,786.77,"/F8",9.96,"ent consectetuer vivamus praesent."
214.35,777.92,298.84,786.77,"/F8",9.96,"Posuere justo fusce"
54.00,765.96,220.39,774.81,"/F8",9.96,"condimentum sed nisi eros hendrerit."
228.95,765.96,298.86,774.81,"/F8",9.96,"Posuere magna."
54.00,754.01,114.45,762.86,"/F8",9.96,"Viverra justo."
120.79,754.01,184.30,762.86,"/F8",9.96,"Potenti neque."
190.63,754.01,298.83,762.86,"/F8",9.96,"Conubia vitae vel nisi a."
54.00,742.05,129.54,750.90,"/F8",9.96,"Iaculis magna id."
135.61,742.05,298.88,750.90,"/F8",9.96,"Conubia nulla ac ornare eu nascetur."
54.00,730.10,143.22,738.95,"/F8",9.96,"Pretium proin amet."
91.29,695.56,261.63,703.52,"/F19",8.97,"Viverra donec lacinia vivamus sociis."
63.96,668.93,298.86,677.78,"/F8",9.96,"Natoque nulla vivamus per et cursus gravida pretium"
54.00,656.98,298.80,665.82,"/F8",9.96,"ante sollicitudin mi iaculis nunc est duis. Blandit etiam."
54.00,645.02,298.88,653.87,"/F8",9.96,"Vivamus porta quisque nonummy hymenaeos habitant"
54.00,633.07,298.82,641.91,"/F8",9.96,"varius eget consectetuer in nulla per. Quisque netus nec"
54.00,621.11,298.83,629.96,"/F8",9.96,"nisl lorem volutpat etiam laoreet cursus quis rhoncus ad."
54.00,609.16,298.84,618.00,"/F8",9.96,"Quisque nulla purus semper at leo orci potenti dolor ac."
54.00,597.20,298.83,606.05,"/F8",9.96,"Quisque metus fames potenti vel ligula luctus nisi ve"
54.00,585.25,155.40,594.09,"/F8",9.96,"litora interdum ipsum."
164.58,585.25,225.38,594.09,"/F8",9.96,"Cubilia lacus."
234.55,585.25,298.84,594.09,"/F8",9.96,"Dapibus porta"
54.00,573.29,148.43,582.14,"/F8",9.96,"fusce luctus eget leo."
157.32,573.29,231.04,582.14,"/F8",9.96,"Nonummy justo."
239.93,573.29,298.87,582.14,"/F8",9.96,"Laoreet justo"
54.00,561.34,298.85,570.18,"/F8",9.96,"proin ornare in sem at diam ad pellentesque quisque mae-"
54.00,549.38,298.83,558.23,"/F8",9.96,"cenas natoque. Dapibus fames. Blandit risus arcu ridicu-"
54.00,537.43,298.82,546.27,"/F8",9.96,"lus luctus dui arcu diam justo risus lobortis fames purus."
54.00,525.47,298.81,534.32,"/F8",9.96,"Pretium netus eu pellentesque blandit curae risus est so-"
54.00,513.52,78.38,522.36,"/F8",9.96,"dales."
84.86,513.52,140.89,522.36,"/F8",9.96,"Iaculis nulla."
147.38,513.52,298.81,522.36,"/F8",9.96,"Dapibus lorem pede velit fringilla."
54.00,501.56,298.84,510.41,"/F8",9.96,"Feugiat neque. Cubilia lacus lacinia at dapibus cras. In-"
54.00,489.61,188.24,498.45,"/F8",9.96,"teger purus ac venenatis eros."
196.53,489.61,298.86,498.45,"/F8",9.96,"Egestas ipsum id nulla"
54.00,477.65,298.83,486.50,"/F8",9.96,"fermentum lobortis massa tincidunt volutpat bibendum"
54.00,465.70,110.47,474.54,"/F8",9.96,"consectetuer."
118.57,465.70,181.70,474.54,"/F8",9.96,"Posuere dolor."
189.80,465.70,252.68,474.54,"/F8",9.96,"Egestas proin."
260.78,465.70,298.86,474.54,"/F8",9.96,"Euismod"
54.00,453.74,78.10,462.59,"/F8",9.96,"justo."
63.96,441.48,252.70,450.33,"/F8",9.96,"Posuere velit elit augue et cursus ultrices."
260.76,441.48,298.83,450.33,"/F8",9.96,"Euismod"
54.00,429.53,238.23,438.37,"/F8",9.96,"velit urna suspendisse sollicitudin cubilia."
245.24,429.53,298.79,438.37,"/F8",9.96,"Pretium do-"
54.00,417.57,298.82,426.42,"/F8",9.96,"lor. Rhoncus risus velit magnis id placerat duis. Blandit"
54.00,405.62,298.85,414.46,"/F8",9.96,"augue et ornare dictumst ullamcorper bibendum netus"
54.00,393.66,298.89,402.51,"/F8",9.96,"dictum maecenas odio per netus. Vivamus dolor magna"
54.00,381.71,124.24,390.55,"/F8",9.96,"tempus facilisis."
132.43,381.71,270.23,390.55,"/F8",9.96,"Gravida magna amet sociosqu."
278.41,381.71,298.86,390.55,"/F8",9.96,"Inte-"
54.00,369.75,298.86,378.60,"/F8",9.96,"ger dolor. Commodo netus at tempus ut taciti molestie"
54.00,357.80,163.57,366.64,"/F8",9.96,"venenatis a non fringilla."
169.94,357.80,298.82,366.64,"/F8",9.96,"Aliquam class duis iaculis in."
54.00,345.84,298.85,354.69,"/F8",9.96,"Vivamus neque at tincidunt hymenaeos vitae nunc cum"
54.00,333.89,124.24,342.73,"/F8",9.96,"cras eget etiam."
131.04,333.89,197.39,342.73,"/F8",9.96,"Conubia curae."
204.20,333.89,298.89,342.73,"/F8",9.96,"Rhoncus etiam donec"
54.00,321.93,298.85,330.78,"/F8",9.96,"sociis imperdiet fusce sed euismod ad ornare phasellus"
54.00,309.98,83.33,318.82,"/F8",9.96,"laoreet"
88.91,309.98,112.16,318.82,"/F8",9.96,"curae"
117.75,309.98,137.92,318.82,"/F8",9.96,"pede"
143.51,309.98,176.45,318.82,"/F8",9.96,"viverra."
187.66,309.98,220.46,318.82,"/F8",9.96,"Laoreet"
226.03,309.98,250.41,318.82,"/F8",9.96,"lacus."
261.63,309.98,298.88,318.82,"/F8",9.96,"Rhoncus"
54.00,298.02,298.85,306.87,"/F8",9.96,"etiam. Pretium netus vel ante faucibus. Natoque magna"
54.00,286.07,80.82,294.91,"/F8",9.96,"quam."
88.61,286.07,298.84,294.91,"/F8",9.96,"Viverra massa velit sed adipiscing ut torquent."
54.00,274.11,298.91,282.96,"/F8",9.96,"Commodo fames lacus sed auctor mauris augue primis"
54.00,262.16,110.47,271.00,"/F8",9.96,"consectetuer."
117.02,262.16,259.44,271.00,"/F8",9.96,"Conubia fusce eros hac rhoncus."
265.99,262.16,298.87,271.00,"/F8",9.96,"Egestas"
54.00,250.20,261.51,259.05,"/F8",9.96,"proin. Commodo neque vestibulum urna lorem."
63.96,237.94,165.14,246.79,"/F8",9.96,"Nonummy nulla dolor."
174.90,237.94,298.85,246.79,"/F8",9.96,"Quisque nulla nibh eleifend"
54.00,225.99,159.49,234.84,"/F8",9.96,"velit auctor vestibulum."
166.99,225.99,259.86,234.84,"/F8",9.96,"Nonummy massa ad."
267.35,225.99,298.86,234.84,"/F8",9.96,"Cubilia"
54.00,214.03,298.86,222.88,"/F8",9.96,"metus diam nisl. Posuere dolor curae nullam eu arcu ad."
54.00,202.08,298.91,210.93,"/F8",9.96,"Quisque massa eros non eget nam augue urna sodales"
54.00,190.12,298.84,198.97,"/F8",9.96,"lorem. Laoreet velit vel adipiscing aenean bibendum arcu"
54.00,178.17,298.79,187.02,"/F8",9.96,"primis. Blandit justo urna quis tincidunt mollis senectus"
54.00,166.21,143.79,175.06,"/F8",9.96,"potenti nisl ut urna."
150.03,166.21,214.72,175.06,"/F8",9.96,"Dapibus dolor."
220.95,166.21,298.81,175.06,"/F8",9.96,"Viverra velit orci."
54.00,154.26,115.82,163.11,"/F8",9.96,"Egestas dolor."
122.40,154.26,278.43,163.11,"/F8",9.96,"Aliquet purus vestibulum pharetra."
285.01,154.26,298.83,163.11,"/F8",9.96,"So-"
54.00,142.30,298.84,151.15,"/F8",9.96,"dales lacus netus massa dis orci suscipit mi purus proin."
54.00,130.35,175.96,139.20,"/F8",9.96,"Lacinia lorem nulla auctor."
184.65,130.35,298.87,139.20,"/F8",9.96,"Iaculis ipsum urna metus"
54.00,118.39,298.85,127.24,"/F8",9.96,"nonummy vulputate quam cum ipsum natoque pretium."
317.01,777.92,561.85,786.77,"/F8",9.96,"Quisque lacus diam magnis turpis sociosqu orci dis ornare"
317.01,765.96,561.89,774.81,"/F8",9.96,"ve auctor mus. Pretium donec. Aliquam fames ad sem-"
317.01,754.01,561.83,762.86,"/F8",9.96,"per viverra est molestie. Feugiat augue eget lectus iaculis"
317.01,742.05,524.26,750.90,"/F8",9.96,"posuere phasellus semper netus maecenas eget."
530.36,742.05,561.87,750.90,"/F8",9.96,"Cubilia"
317.01,730.10,561.88,738.95,"/F8",9.96,"lacus cum tortor venenatis augue. Rhoncus morbi. Cu-"
317.01,718.14,478.50,726.99,"/F8",9.96,"bilia porta eros tristique sociis curae."
337.27,639.97,541.68,647.93,"/F19",8.97,"CONUBIA AUGUE CUBILIA ELEIFEND."
326.98,605.12,396.19,613.97,"/F8",9.96,"Dapibus metus."
404.31,605.12,561.87,613.97,"/F8",9.96,"Euismod vitae nibh felis maecenas."
317.01,593.17,561.88,602.02,"/F8",9.96,"Commodo justo eu tellus sollicitudin non dolor male-"
317.01,581.21,561.86,590.06,"/F8",9.96,"suada auctor praesent condimentum ultrices habitasse"
317.01,569.26,406.31,578.10,"/F8",9.96,"netus habitant velit."
412.35,569.26,561.84,578.10,"/F8",9.96,"Gravida metus aliquam class odio"
317.01,557.30,561.81,566.15,"/F8",9.96,"molestie dui ac congue dictumst facilisis. Aliquet felis ip-"
317.01,545.35,561.84,554.19,"/F8",9.96,"sum mus feugiat a. Iaculis porta eros est risus facilisis per"
317.01,533.39,474.91,542.24,"/F8",9.96,"metus leo duis vel quam sodales eu."
480.49,533.39,561.87,542.24,"/F8",9.96,"Viverra fames felis"
317.01,521.44,561.86,530.28,"/F8",9.96,"nisi sociis sapien. Posuere augue ac fames curabitur dui"
317.01,509.48,561.84,518.33,"/F8",9.96,"dolor justo augue nibh habitasse ligula adipiscing sagittis"
317.01,497.53,377.13,506.37,"/F8",9.96,"diam gravida."
382.66,497.53,561.84,506.37,"/F8",9.96,"Natoque felis vitae dis parturient nullam"
317.01,485.57,341.92,494.42,"/F8",9.96,"dolor."
348.26,485.57,523.99,494.42,"/F8",9.96,"Quisque risus est enim mi consectetuer."
530.32,485.57,561.83,494.42,"/F8",9.96,"Cubilia"
317.01,473.62,561.83,482.46,"/F8",9.96,"ipsum odio habitasse facilisis etiam sociosqu ut. Pretium"
317.01,461.66,561.87,470.51,"/F8",9.96,"vitae eu eros id semper dapibus primis class fames. Na-"
317.01,449.71,561.88,458.55,"/F8",9.96,"toque etiam ad et id curae hymenaeos venenatis nisl"
317.01,437.75,561.82,446.60,"/F8",9.96,"platea id hac et. Integer dolor vel tellus. Quisque neque."
317.01,425.80,519.09,434.64,"/F8",9.96,"Euismod lorem nunc mollis lacinia ligula elit."
525.99,425.80,561.84,434.64,"/F8",9.96,"Dapibus"
317.01,413.84,561.87,422.69,"/F8",9.96,"massa nisl integer non ac class aptent metus fusce porta"
317.01,401.89,339.79,410.73,"/F8",9.96,"class."
346.98,401.89,561.83,410.73,"/F8",9.96,"Blandit risus pede suspendisse cum nisl parturi-"
317.01,389.93,561.84,398.78,"/F8",9.96,"ent per parturient augue potenti litora aenean molestie"
317.01,377.98,561.86,386.82,"/F8",9.96,"parturient. Cubilia augue in ad ac quam ad consectetuer"
317.01,366.02,561.86,374.87,"/F8",9.96,"posuere etiam ad. Laoreet risus ad tristique in diam mi"
317.01,354.07,440.28,362.91,"/F8",9.96,"vitae ut magna taciti justo."
447.55,354.07,561.84,362.91,"/F8",9.96,"Dapibus justo erat iaculis"
317.01,342.11,350.58,350.96,"/F8",9.96,"sodales."
357.84,342.11,561.85,350.96,"/F8",9.96,"Aliquam proin purus ante consequat ridiculus"
317.01,330.16,380.96,339.00,"/F8",9.96,"purus ac nunc."
326.98,309.68,561.91,318.52,"/F8",9.96,"Rhoncus dolor neque eros consequat at class magnis"
317.01,297.72,345.81,306.57,"/F8",9.96,"luctus."
354.09,297.72,561.83,306.57,"/F8",9.96,"Pretium lacus amet eleifend vestibulum mollis"
317.01,285.77,561.83,294.61,"/F8",9.96,"sem rutrum vehicula fringilla. Pretium purus neque cum"
317.01,273.81,410.98,282.66,"/F8",9.96,"quam aenean iaculis."
420.65,273.81,515.18,282.66,"/F8",9.96,"Cubilia augue fames."
524.85,273.81,561.90,282.66,"/F8",9.96,"Aliquam"
317.01,261.85,561.87,270.70,"/F8",9.96,"morbi duis justo conubia odio vel cras pretium ve po-"
317.01,249.90,561.84,258.75,"/F8",9.96,"tenti diam et fermentum. Euismod porta pretium proin"
317.01,237.94,561.86,246.79,"/F8",9.96,"nibh quis elementum. Vivamus fusce at primis ad ornare"
317.01,225.99,367.35,234.84,"/F8",9.96,"sollicitudin."
373.82,225.99,436.70,234.84,"/F8",9.96,"Egestas curae."
443.17,225.99,561.82,234.84,"/F8",9.96,"Dapibus risus non felis hy-"
317.01,214.03,561.85,222.88,"/F8",9.96,"menaeos torquent erat enim. Cubilia morbi cum nisi dic-"
317.01,202.08,448.63,210.93,"/F8",9.96,"tumst gravida nonummy erat."
454.34,202.08,561.87,210.93,"/F8",9.96,"Posuere fusce purus fau-"
317.01,190.12,561.86,198.97,"/F8",9.96,"cibus sed semper enim cubilia a. Laoreet class. Pretium"
317.01,178.17,406.47,187.02,"/F8",9.96,"ipsum augue ornare."
412.19,178.17,529.47,187.02,"/F8",9.96,"Blandit purus erat ut orci."
535.18,178.17,561.87,187.02,"/F8",9.96,"Rhon-"
317.01,166.21,561.86,175.06,"/F8",9.96,"cus nulla mi tempus. Aliquam justo ad proin vel per et"
317.01,154.26,561.83,163.11,"/F8",9.96,"a quis. Dapibus donec risus class. Gravida vitae parturi-"
317.01,142.30,374.61,151.15,"/F8",9.96,"ent pharetra."
381.63,142.30,487.83,151.15,"/F8",9.96,"Aliquam class orci duis."
494.86,142.30,561.87,151.15,"/F8",9.96,"Natoque metus"
317.01,130.35,561.81,139.19,"/F8",9.96,"elit a elit vestibulum tortor. Dapibus fames ante quisque"
317.01,118.39,431.32,127.24,"/F8",9.96,"porta. Viverra netus ante."
