37.61,748.78,288.42,757.62,"/F8",9.96,"vitae porttitor amet. Aliquam proin odio sed felis adip-"
37.61,736.82,288.41,745.67,"/F8",9.96,"iscing suspendisse platea at nunc. Feugiat lacus adipiscing"
37.61,724.87,288.43,733.71,"/F8",9.96,"ve tempor id maecenas nulla elit rhoncus eu eros felis. Iac-"
37.61,712.91,288.42,721.76,"/F8",9.96,"ulis morbi velit. Commodo donec dui parturient habitasse"
37.61,700.96,288.43,709.80,"/F8",9.96,"justo eu dictum mus urna lobortis morbi. Potenti morbi"
37.61,689.00,273.44,697.85,"/F8",9.96,"diam primis fermentum posuere nam ultrices vitae ve."
52.56,677.04,288.46,685.89,"/F8",9.96,"Rhoncus nulla. Posuere class id class consequat cras."
37.61,665.09,288.43,673.94,"/F8",9.96,"Pretium morbi nisl inceptos neque. Commodo metus quis"
37.61,653.13,288.42,661.98,"/F8",9.96,"laoreet justo pretium tempus. Natoque lorem id sollici-"
37.61,641.18,288.43,650.03,"/F8",9.96,"tudin dictum id hymenaeos condimentum habitasse. Ali-"
37.61,629.22,288.44,638.07,"/F8",9.96,"quet vitae sem mollis euismod quisque nullam mi. Po-"
37.61,617.27,288.36,626.11,"/F8",9.96,"tenti velit at interdum lobortis integer elit erat ut pharetra"
37.61,605.31,288.45,614.16,"/F8",9.96,"eros euismod justo erat ridiculus. Laoreet massa. Lacinia"
37.61,593.36,288.45,602.20,"/F8",9.96,"proin. Conubia dolor. Euismod velit leo magna tellus"
37.61,581.40,288.42,590.25,"/F8",9.96,"ornare blandit diam senectus. Pretium dolor adipiscing"
37.61,569.45,288.41,578.29,"/F8",9.96,"nisl dignissim. Conubia etiam non nisi aliquam vitae pede."
37.61,557.49,288.42,566.34,"/F8",9.96,"Lacinia vitae elit a orci risus amet rhoncus ac elit. Rhoncus"
37.61,545.54,288.46,554.38,"/F8",9.96,"fusce. Commodo proin feugiat integer eros et. Euismod"
37.61,533.58,288.39,542.43,"/F8",9.96,"porta elit gravida blandit sodales ridiculus at dignissim ip-"
37.61,521.63,288.44,530.47,"/F8",9.96,"sum id morbi. Natoque lacus class ullamcorper in lectus"
37.61,509.67,288.38,518.52,"/F8",9.96,"quisque posuere sollicitudin venenatis dolor rutrum inter-"
37.61,497.72,288.45,506.56,"/F8",9.96,"dum neque. Egestas curae nisi primis ac lorem nullam"
37.61,485.76,288.44,494.61,"/F8",9.96,"tortor risus. Conubia porta adipiscing et. Iaculis massa"
37.61,473.81,288.45,482.65,"/F8",9.96,"amet et pede ornare vehicula. Conubia netus at dolor ad"
37.61,461.85,288.38,470.70,"/F8",9.96,"fringilla vestibulum pede auctor phasellus proin ultricies"
37.61,449.90,87.44,458.74,"/F8",9.96,"leo ultrices."
37.61,427.48,131.25,436.33,"/F27",9.96,"3.3. Nonummy fusce."
52.56,414.03,288.42,422.88,"/F8",9.96,"Pretium felis eget quisque est tempor a natoque aptent."
37.61,402.08,288.43,410.92,"/F8",9.96,"Rhoncus vitae parturient enim platea ve. Conubia netus"
37.61,390.12,288.43,398.97,"/F8",9.96,"metus. Potenti augue leo sociosqu convallis fusce. Sodales"
37.61,378.17,288.44,387.01,"/F8",9.96,"netus morbi bibendum per ac faucibus cursus morbi. Cu-"
37.61,366.21,288.40,375.06,"/F8",9.96,"bilia metus amet porttitor vehicula semper nostra ridicu-"
37.61,354.26,288.41,363.10,"/F8",9.96,"lus. Laoreet proin sit vel ac varius dictumst vulputate"
37.61,342.30,288.47,351.15,"/F8",9.96,"magna eros etiam varius lacinia pede enim conubia eget"
37.61,330.34,288.48,339.19,"/F8",9.96,"porta. Nonummy dolor sit ante. Sodales porta quam a"
37.61,318.39,288.45,327.24,"/F8",9.96,"nisi mi consectetuer montes curae mattis. Rhoncus magna"
37.61,306.43,288.42,315.28,"/F8",9.96,"nisi a felis natoque dictumst nonummy quisque. Posuere"
37.61,294.48,288.44,303.33,"/F8",9.96,"curae. Euismod metus nec sed quisque. Quisque porta"
37.61,282.52,288.37,291.37,"/F8",9.96,"felis erat ridiculus dictum mi dignissim vestibulum viverra"
37.61,270.57,288.43,279.42,"/F8",9.96,"duis. Rhoncus nulla erat nullam. Aliquet dolor sem adip-"
37.61,258.61,288.43,267.46,"/F8",9.96,"iscing vestibulum id placerat. Blandit massa dolor leo"
37.61,246.66,288.42,255.51,"/F8",9.96,"nulla. Integer fusce. Rhoncus porta non parturient ligula"
37.61,234.70,288.45,243.55,"/F8",9.96,"ut. Lacinia class in leo. Lacinia dolor eu. Iaculis justo"
37.61,222.75,288.41,231.60,"/F8",9.96,"elit malesuada tempor luctus eni nisi odio dictumst condi-"
37.61,210.79,288.44,219.64,"/F8",9.96,"mentum. Feugiat purus cum nec pellentesque massa diam"
37.61,198.84,90.54,207.68,"/F8",9.96,"praesent sit."
52.56,186.88,288.44,195.73,"/F8",9.96,"Dapibus nulla vestibulum. Gravida nulla nam amet"
37.61,174.93,288.42,183.77,"/F8",9.96,"pellentesque blandit inceptos fames sem. Egestas porta."
37.61,162.97,288.40,171.82,"/F8",9.96,"Blandit fusce pretium vel taciti praesent suspendisse so-"
37.61,151.02,288.41,159.86,"/F8",9.96,"ciosqu proin metus tempus suscipit purus porta. Blandit"
37.61,139.06,288.41,147.91,"/F8",9.96,"augue parturient suspendisse taciti ad diam lobortis lorem"
37.61,127.11,288.43,135.95,"/F8",9.96,"mi. Gravida ipsum. Conubia class nulla tempus vehicula"
37.61,115.15,288.47,124.00,"/F8",9.96,"augue sit quam nascetur. Euismod fames nulla. Rhon-"
37.61,103.20,288.40,112.04,"/F8",9.96,"cus augue etiam platea ullamcorper felis ultricies torquent"
37.61,91.24,288.46,100.09,"/F8",9.96,"ornare tortor class. Egestas massa proin lobortis lacus"
37.61,79.29,288.38,88.13,"/F8",9.96,"feugiat potenti varius. Dapibus nulla risus. Aliquet morbi"
306.60,748.78,557.42,757.62,"/F8",9.96,"lacus dictum tellus sem mattis imperdiet magna erat. So-"
306.60,736.82,557.43,745.67,"/F8",9.96,"dales justo. Feugiat massa cum pede sagittis lorem dignis-"
306.60,724.87,557.45,733.71,"/F8",9.96,"sim eu. Viverra metus. Laoreet etiam ante augue ullam-"
306.60,712.91,557.41,721.76,"/F8",9.96,"corper elit quam volutpat cras sit justo fermentum. Eu-"
306.60,700.95,557.41,709.80,"/F8",9.96,"ismod massa nisl purus. Potenti netus eu taciti sociosqu"
306.60,689.00,557.40,697.85,"/F8",9.96,"enim volutpat imperdiet erat risus class ullamcorper leo."
306.60,677.04,557.40,685.89,"/F8",9.96,"Quisque vitae in massa nisl potenti erat a fusce. Blandit"
306.60,665.09,557.42,673.94,"/F8",9.96,"risus metus felis mauris. Iaculis curae lorem eros. Natoque"
306.60,653.13,413.28,661.98,"/F8",9.96,"fusce duis natoque risus."
306.60,623.25,557.50,632.09,"/F17",9.96,"4. Vivamus neque etiam auctor adipiscing augue"
321.24,611.29,388.68,620.14,"/F17",9.96,"nisi orci eget."
321.55,590.37,557.41,599.22,"/F8",9.96,"Rhoncus etiam posuere dis vestibulum ridiculus ullam-"
306.60,578.41,557.43,587.26,"/F8",9.96,"corper. Natoque metus. Blandit fusce. Vivamus netus"
306.60,566.46,557.44,575.31,"/F8",9.96,"sit nibh urna fames ad. Aliquam morbi. Potenti porta"
306.60,554.50,557.43,563.35,"/F8",9.96,"eni praesent porta nisi. Blandit augue in aptent magna"
306.60,542.55,557.41,551.39,"/F8",9.96,"vestibulum eleifend neque purus a natoque sociis. Viva-"
306.60,530.59,557.46,539.44,"/F8",9.96,"mus metus arcu aenean euismod ac mus cras nulla ve donec"
306.60,518.64,557.38,527.48,"/F8",9.96,"eu inceptos cubilia elit. Feugiat fusce mus porta orci velit"
306.60,506.68,557.40,515.53,"/F8",9.96,"placerat lacus venenatis dui quis et. Euismod ipsum class"
306.60,494.73,557.44,503.57,"/F8",9.96,"condimentum ad tempus. Posuere dolor quam nisl etiam"
306.60,482.77,557.40,491.62,"/F8",9.96,"eleifend fusce mauris sem taciti habitasse hendrerit par-"
306.60,470.82,557.39,479.66,"/F8",9.96,"turient nibh. Blandit massa felis nunc blandit at mus arcu"
306.60,458.86,557.41,467.71,"/F8",9.96,"eleifend. Vivamus porta nibh vulputate aptent quam nos-"
306.60,446.91,557.38,455.75,"/F8",9.96,"tra in ad cursus iaculis tristique nibh nunc. Rhoncus nulla"
306.60,434.95,557.45,443.80,"/F8",9.96,"mi. Rhoncus ipsum. Conubia risus ad nullam a. Posuere"
306.60,423.00,557.40,431.84,"/F8",9.96,"lacus nunc cubilia. Pretium velit mus ante integer hen-"
306.60,411.04,557.38,419.89,"/F8",9.96,"drerit lobortis nunc vehicula turpis. Integer velit enim a"
306.60,399.09,557.41,407.93,"/F8",9.96,"odio risus ve tortor pellentesque hac. Natoque felis nec"
306.60,387.13,557.44,395.98,"/F8",9.96,"diam fusce ac. Cubilia nulla dapibus egestas. Posuere"
306.60,375.18,333.69,384.02,"/F8",9.96,"etiam."
321.55,363.22,557.43,372.07,"/F8",9.96,"Aliquet donec class cum mauris quisque orci potenti"
306.60,351.27,557.45,360.11,"/F8",9.96,"morbi mi congue. Blandit lacus mi duis ut sem auctor"
306.60,339.31,557.42,348.16,"/F8",9.96,"ultricies ac. Dapibus dolor. Sodales morbi est. Vivamus"
306.60,327.36,557.43,336.20,"/F8",9.96,"dolor cras eni porta auctor adipiscing nascetur neque eu"
306.60,315.40,557.45,324.25,"/F8",9.96,"netus ornare neque habitasse. Nonummy proin magna. Vi-"
306.60,303.45,557.48,312.29,"/F8",9.96,"vamus lorem. Commodo magna natoque nisi sit mi. Com-"
306.60,291.49,557.41,300.34,"/F8",9.96,"modo curae. Iaculis risus integer dapibus aptent dis sociis"
306.60,279.53,557.43,288.38,"/F8",9.96,"urna ve amet id consectetuer egestas purus enim. Laoreet"
306.60,267.58,557.37,276.43,"/F8",9.96,"proin. Iaculis velit diam facilisis pellentesque sit fermen-"
306.60,255.62,391.94,264.47,"/F8",9.96,"tum sit metus est."
402.47,255.62,557.47,264.47,"/F8",9.96,"Dapibus magna ve semper magna"
306.60,243.67,557.41,252.52,"/F8",9.96,"condimentum interdum conubia. Dapibus risus sed nunc"
306.60,231.71,557.43,240.56,"/F8",9.96,"fusce aliquet at ante suspendisse per ac aenean. Gravida"
306.60,219.76,557.40,228.61,"/F8",9.96,"felis pede faucibus dictum cras. Lacinia curae parturient"
306.60,207.80,557.44,216.65,"/F8",9.96,"condimentum cursus ad ipsum mi donec id lobortis. Com-"
306.60,195.85,557.42,204.70,"/F8",9.96,"modo neque pede aliquet quis tempus. Integer class erat."
306.60,183.89,557.42,192.74,"/F8",9.96,"Euismod ipsum. Rhoncus risus et cursus mi ligula vel."
306.60,171.94,557.43,180.79,"/F8",9.96,"Feugiat nulla nec duis. Conubia class at ac ut phasellus"
306.60,159.98,387.42,168.83,"/F8",9.96,"vulputate quis dis."
306.60,136.07,393.81,144.92,"/F27",9.96,"4.1. Gravida fames."
321.55,121.13,557.47,129.98,"/F8",9.96,"Nonummy purus. Blandit donec ac tortor. Lacinia"
306.60,109.17,557.46,118.02,"/F8",9.96,"massa. Egestas justo ve primis vitae maecenas arcu im-"
306.60,97.22,557.45,106.07,"/F8",9.96,"perdiet. Sodales magna diam purus at morbi dignissim"
306.60,85.26,557.37,94.11,"/F8",9.96,"dictumst mauris ornare velit suscipit nulla ve est. Cubilia"
295.15,61.35,300.13,70.20,"/F8",9.96,"5"
