557.11,803.82,562.09,812.67,"/F8",9.96,"3"
68.64,778.11,284.29,786.07,"/F19",8.97,"Iaculis porta vestibulum suspendisse platea eu"
123.22,767.65,229.77,775.61,"/F19",8.97,"dictumst cursus libero."
63.96,736.92,126.67,745.77,"/F8",9.96,"Integer etiam."
136.68,736.92,252.62,745.77,"/F8",9.96,"Aliquet porta netus velit."
262.63,736.92,298.85,745.77,"/F8",9.96,"Conubia"
54.00,724.97,298.85,733.81,"/F8",9.96,"massa. Lacinia netus eros ultrices quam ut imperdiet"
54.00,713.01,298.85,721.86,"/F8",9.96,"vestibulum nisl nullam convallis. Rhoncus massa etiam"
54.00,701.06,298.84,709.90,"/F8",9.96,"risus nullam consectetuer gravida vehicula litora. Po-"
54.00,689.10,298.91,697.95,"/F8",9.96,"suere morbi arcu. Conubia magna at augue mus odio ac"
54.00,677.15,298.87,685.99,"/F8",9.96,"nec sapien ve odio. Euismod porta ut est hymenaeos."
54.00,665.19,298.88,674.04,"/F8",9.96,"Vivamus ipsum urna lacinia feugiat tortor ac. Rhon-"
54.00,653.24,298.85,662.08,"/F8",9.96,"cus fames urna mus blandit dictumst in. Natoque morbi"
54.00,641.28,298.86,650.13,"/F8",9.96,"pede ut. Egestas proin nec tincidunt metus maecenas"
54.00,629.33,298.85,638.17,"/F8",9.96,"sem pellentesque felis vitae. Nonummy lacus ad ve nos-"
54.00,617.37,298.84,626.22,"/F8",9.96,"tra vehicula adipiscing montes ut aenean cum nisi quis."
54.00,605.42,298.81,614.26,"/F8",9.96,"Dapibus class dis adipiscing vestibulum et tellus. Lacinia"
54.00,593.46,298.84,602.31,"/F8",9.96,"proin. Blandit magna natoque pharetra etiam in dictum."
54.00,581.51,298.83,590.35,"/F8",9.96,"Cubilia fusce ve class bibendum vulputate porta eu et."
54.00,569.55,298.84,578.40,"/F8",9.96,"Pretium morbi vel quis maecenas venenatis. Conubia vi-"
54.00,557.60,298.83,566.44,"/F8",9.96,"tae eros purus viverra vitae. Vivamus risus leo habitasse"
54.00,545.64,295.20,554.49,"/F8",9.96,"interdum ac dui dictum. Natoque risus. Dapibus lacus."
63.96,529.28,298.82,538.12,"/F8",9.96,"Aliquam ipsum dis. Euismod felis vestibulum. Cubilia"
54.00,517.32,298.83,526.17,"/F8",9.96,"lacus. Aliquam lacus elit. Aliquam lacus. Blandit fusce"
54.00,505.37,298.86,514.21,"/F8",9.96,"nec lectus habitant. Vivamus magna nisl fames. Viverra"
54.00,493.41,298.86,502.26,"/F8",9.96,"neque eget est ipsum sed interdum hymenaeos cras amet"
54.00,481.46,298.84,490.30,"/F8",9.96,"tristique volutpat ac. Commodo neque. Potenti justo"
54.00,469.50,298.91,478.35,"/F8",9.96,"nunc sed cubilia. Laoreet morbi at. Commodo massa"
54.00,457.55,298.82,466.39,"/F8",9.96,"eros ligula velit suscipit odio. Euismod fames parturient"
54.00,445.59,298.87,454.44,"/F8",9.96,"sodales. Lacinia velit. Nonummy massa. Posuere proin"
54.00,433.64,298.81,442.48,"/F8",9.96,"fusce senectus convallis per velit quisque ve lorem tempus"
54.00,421.68,298.84,430.53,"/F8",9.96,"felis mi. Blandit fames orci cubilia convallis quam con-"
54.00,409.73,298.80,418.57,"/F8",9.96,"sectetuer nullam. Potenti vitae nunc tincidunt pharetra"
54.00,397.77,298.86,406.62,"/F8",9.96,"congue. Vivamus fusce odio velit ligula condimentum."
54.00,385.81,298.86,394.66,"/F8",9.96,"Cubilia neque mi curae. Natoque massa in tincidunt"
54.00,373.86,298.85,382.71,"/F8",9.96,"netus sit donec venenatis cum risus. Egestas ipsum eu"
54.00,361.90,81.12,370.75,"/F8",9.96,"lorem."
63.96,345.54,298.84,354.39,"/F8",9.96,"Quisque justo nulla aptent mi lobortis duis erat sem"
54.00,333.59,298.83,342.43,"/F8",9.96,"lacus habitasse. Potenti purus justo proin neque duis."
54.00,321.63,298.86,330.48,"/F8",9.96,"Conubia ipsum proin aenean orci vitae condimentum et"
54.00,309.68,298.87,318.52,"/F8",9.96,"dictum sem. Feugiat justo euismod urna mi magna dic-"
54.00,297.72,298.85,306.57,"/F8",9.96,"tumst. Aliquam class cras et porta et phasellus posuere"
54.00,285.77,298.90,294.61,"/F8",9.96,"quam. Rhoncus etiam dui nam hymenaeos nostra sem"
54.00,273.81,298.89,282.66,"/F8",9.96,"conubia neque mus amet id. Aliquam lorem amet na-"
54.00,261.85,172.00,270.70,"/F8",9.96,"toque a sapien consequat."
182.34,261.85,298.87,270.70,"/F8",9.96,"Laoreet vitae at sociis ut"
54.00,249.90,298.79,258.75,"/F8",9.96,"diam dui ante sollicitudin. Potenti neque. Aliquet neque"
54.00,237.94,298.85,246.79,"/F8",9.96,"quam tempor fames torquent eni. Conubia class ac taciti"
54.00,225.99,298.87,234.84,"/F8",9.96,"molestie pede sodales. Sodales vitae donec metus auc-"
54.00,214.03,298.86,222.88,"/F8",9.96,"tor fusce lacus nascetur per mi egestas orci quis. Cu-"
54.00,202.08,298.87,210.93,"/F8",9.96,"bilia justo nulla. Nonummy magna dolor tellus etiam"
54.00,190.12,298.87,198.97,"/F8",9.96,"massa. Euismod curae laoreet tellus eni euismod a ul-"
54.00,178.17,298.88,187.02,"/F8",9.96,"lamcorper eni mauris. Iaculis massa cum nisi mi. Non-"
54.00,166.21,298.87,175.06,"/F8",9.96,"ummy metus. Rhoncus morbi cras suscipit commodo nisl"
54.00,154.26,298.85,163.11,"/F8",9.96,"nunc aliquet tortor. Laoreet lacus ad nibh at fusce con-"
54.00,142.30,298.83,151.15,"/F8",9.96,"sectetuer. Laoreet etiam id sollicitudin. Nonummy curae"
54.00,130.35,298.86,139.19,"/F8",9.96,"justo massa platea bibendum convallis ante nulla arcu."
54.00,118.39,180.98,127.24,"/F8",9.96,"Aliquam etiam sem pulvinar."
370.94,778.11,508.10,786.07,"/F19",8.97,"Integer massa eget est augue."
326.98,743.90,561.87,752.74,"/F8",9.96,"Aliquam augue. Quisque vitae ipsum mauris netus sem"
317.01,731.94,561.89,740.79,"/F8",9.96,"adipiscing dolor commodo. Viverra risus ac amet nostra"
317.01,719.99,561.84,728.83,"/F8",9.96,"phasellus egestas odio. Posuere fusce nisl vitae quisque"
317.01,708.03,427.98,716.88,"/F8",9.96,"vel adipiscing lacus nisl."
438.73,708.03,561.83,716.88,"/F8",9.96,"Blandit curae elit per duis"
317.01,696.08,561.83,704.92,"/F8",9.96,"pellentesque vestibulum nisl metus malesuada senectus."
317.01,684.12,561.85,692.97,"/F8",9.96,"Viverra ipsum risus. Nonummy velit id hac hendrerit"
317.01,672.17,561.86,681.01,"/F8",9.96,"nostra eros consectetuer adipiscing diam primis mus nec"
317.01,660.21,561.87,669.06,"/F8",9.96,"cum. Pretium felis diam vitae ac mollis. Sodales cu-"
317.01,648.25,561.84,657.10,"/F8",9.96,"rae sit turpis mi non duis ve pellentesque quam risus ac"
317.01,636.30,561.85,645.15,"/F8",9.96,"massa. Integer porta in curabitur nisl condimentum leo."
317.01,624.34,561.85,633.19,"/F8",9.96,"Lacinia purus. Viverra felis eu taciti. Posuere fames la-"
317.01,612.39,561.87,621.24,"/F8",9.96,"cus etiam. Aliquam porta enim ipsum. Euismod porta."
317.01,600.43,561.86,609.28,"/F8",9.96,"Posuere lorem sit. Posuere etiam. Iaculis lacus. Natoque"
317.01,588.48,561.86,597.32,"/F8",9.96,"metus erat. Vivamus fames non parturient in habitant"
317.01,576.52,561.85,585.37,"/F8",9.96,"pretium dictumst curae donec lorem gravida lectus in."
317.01,564.57,561.88,573.41,"/F8",9.96,"Rhoncus dolor porta diam nunc nonummy hendrerit per"
317.01,552.61,514.16,561.46,"/F8",9.96,"fusce. Sodales velit class justo molestie vitae."
326.98,532.76,561.90,541.61,"/F8",9.96,"Gravida magna ut nec penatibus aenean ornare in cu-"
317.01,520.81,561.87,529.65,"/F8",9.96,"rae. Egestas augue. Posuere felis ac nunc netus eu tin-"
317.01,508.85,561.84,517.70,"/F8",9.96,"cidunt. Vivamus justo cras ante proin velit cras laoreet"
317.01,496.90,561.81,505.74,"/F8",9.96,"orci. Integer class. Pretium velit pede taciti tincidunt"
317.01,484.94,561.87,493.79,"/F8",9.96,"per. Feugiat magna risus. Nonummy justo eget. Viverra"
317.01,472.99,561.84,481.83,"/F8",9.96,"proin vestibulum nonummy quam parturient. Pretium"
317.01,461.03,561.83,469.88,"/F8",9.96,"metus diam vivamus litora purus habitant. Dapibus nulla"
317.01,449.08,561.84,457.92,"/F8",9.96,"et eu id tempus. Blandit metus iaculis erat. Quisque"
317.01,437.12,561.87,445.97,"/F8",9.96,"donec eni odio porta scelerisque pharetra metus a dic-"
317.01,425.17,561.90,434.01,"/F8",9.96,"tum hendrerit. Commodo proin. Nonummy augue. Non-"
317.01,413.21,561.86,422.06,"/F8",9.96,"ummy proin adipiscing ullamcorper montes et. Gravida"
317.01,401.26,516.25,410.10,"/F8",9.96,"velit duis lacus dictum facilisi odio nullam."
526.92,401.26,561.84,410.10,"/F8",9.96,"Gravida"
317.01,389.30,561.89,398.15,"/F8",9.96,"magna dis odio id neque eu tortor. Commodo netus. Feu-"
317.01,377.35,561.85,386.19,"/F8",9.96,"giat lorem massa habitant phasellus rutrum justo lobortis"
317.01,365.39,561.85,374.24,"/F8",9.96,"augue. Feugiat nulla amet natoque nec faucibus blandit."
317.01,353.44,539.56,362.28,"/F8",9.96,"Gravida metus parturient condimentum magnis at."
326.98,333.59,561.87,342.43,"/F8",9.96,"Cubilia magna. Pretium curae. Rhoncus etiam iaculis"
317.01,321.63,561.85,330.48,"/F8",9.96,"tellus sem urna volutpat dignissim. Euismod massa elit"
317.01,309.68,561.86,318.52,"/F8",9.96,"lacinia. Conubia lorem. Laoreet fames proin tincidunt"
317.01,297.72,561.84,306.57,"/F8",9.96,"non suscipit aliquet ornare vel. Sodales etiam. Iaculis"
317.01,285.76,561.86,294.61,"/F8",9.96,"etiam. Vivamus justo duis mi phasellus duis. Gravida"
317.01,273.81,561.80,282.66,"/F8",9.96,"proin elit condimentum sit elit duis fringilla. Potenti ne-"
317.01,261.85,561.83,270.70,"/F8",9.96,"tus etiam mollis metus nulla ultrices adipiscing nullam"
317.01,249.90,561.88,258.75,"/F8",9.96,"purus sodales. Vivamus lacus nibh odio sem. Cubilia"
317.01,237.94,561.84,246.79,"/F8",9.96,"neque odio quam curae fringilla nascetur. Aliquet etiam"
317.01,225.99,561.83,234.84,"/F8",9.96,"sem nunc convallis pulvinar eu ipsum mattis scelerisque"
317.01,214.03,561.86,222.88,"/F8",9.96,"dolor semper. Viverra fames mi a duis netus iaculis erat"
317.01,202.08,561.82,210.93,"/F8",9.96,"nibh quisque tristique. Viverra morbi odio scelerisque"
317.01,190.12,561.89,198.97,"/F8",9.96,"commodo ullamcorper. Aliquam proin. Blandit massa"
317.01,178.17,561.86,187.02,"/F8",9.96,"ut fringilla a curabitur donec massa molestie porta donec"
317.01,166.21,561.84,175.06,"/F8",9.96,"non congue litora. Natoque neque nunc torquent fringilla"
317.01,154.26,561.90,163.11,"/F8",9.96,"dis. Aliquam justo amet commodo semper est mi a pede"
317.01,142.30,561.92,151.15,"/F8",9.96,"donec. Rhoncus magna sem quis porta montes lorem"
317.01,130.35,561.82,139.19,"/F8",9.96,"curabitur hac nibh suscipit dictumst curae. Potenti do-"
317.01,118.39,561.85,127.24,"/F8",9.96,"lor porta per amet nam taciti eu litora laoreet ve mattis."
