37.61,748.78,288.43,757.62,"/F8",9.96,"torquent sodales. Posuere fames metus penatibus dis odio"
37.61,736.82,215.85,745.67,"/F8",9.96,"at fusce tempus imperdiet in hymenaeos."
52.56,724.87,288.49,733.71,"/F8",9.96,"Vivamus metus urna mus purus mus. Gravida magna"
37.61,712.91,288.42,721.76,"/F8",9.96,"purus felis phasellus morbi malesuada phasellus. Feugiat"
37.61,700.96,288.44,709.80,"/F8",9.96,"purus odio magna nullam morbi leo quis. Dapibus risus."
37.61,689.00,288.46,697.85,"/F8",9.96,"Conubia nulla pede nascetur cum consectetuer magna do-"
37.61,677.04,288.42,685.89,"/F8",9.96,"lor mus erat bibendum. Aliquet porta. Vivamus proin est"
37.61,665.09,288.41,673.94,"/F8",9.96,"faucibus lacinia tortor non pede nunc ultrices rhoncus sol-"
37.61,653.13,288.39,661.98,"/F8",9.96,"licitudin. Iaculis proin parturient conubia quam urna fusce"
37.61,641.18,288.47,650.03,"/F8",9.96,"ad. Feugiat magna. Natoque curae quis a urna. Feugiat"
37.61,629.22,288.42,638.07,"/F8",9.96,"vitae in. Aliquet porta mi fames lacus suspendisse nec. Ia-"
37.61,617.27,288.40,626.11,"/F8",9.96,"culis risus quam nostra porttitor ac eros per. Blandit justo"
37.61,605.31,288.40,614.16,"/F8",9.96,"curae rutrum facilisis ac at nullam dapibus duis mi ridicu-"
37.61,593.36,288.42,602.20,"/F8",9.96,"lus diam sed velit magna. Integer dolor. Feugiat felis urna"
37.61,581.40,288.47,590.25,"/F8",9.96,"euismod netus curae montes. Nonummy neque donec ae-"
37.61,569.45,288.47,578.29,"/F8",9.96,"nean malesuada dis nam gravida eget metus cursus metus"
37.61,557.49,288.45,566.34,"/F8",9.96,"conubia cursus non. Viverra augue nisl nonummy in dis"
37.61,545.54,288.43,554.38,"/F8",9.96,"at felis ad. Aliquam fames cras in massa luctus vulputate"
37.61,533.58,288.42,542.43,"/F8",9.96,"sociosqu cursus. Aliquam morbi nisi sem lorem ultricies"
37.61,521.63,288.45,530.47,"/F8",9.96,"condimentum massa mollis enim. Dapibus proin amet per"
37.61,509.67,288.41,518.52,"/F8",9.96,"justo venenatis lobortis mollis primis neque arcu. Egestas"
37.61,497.72,148.59,506.56,"/F8",9.96,"proin vitae ultricies urna."
37.61,475.30,123.62,484.15,"/F27",9.96,"3.2. Dapibus curae."
52.56,461.85,288.46,470.70,"/F8",9.96,"Rhoncus metus. Feugiat fames vivamus dignissim. Iac-"
37.61,449.90,288.43,458.74,"/F8",9.96,"ulis ipsum erat nec morbi phasellus quam. Aliquam morbi"
37.61,437.94,288.43,446.79,"/F8",9.96,"eu lectus senectus ve hac id etiam mus etiam morbi fusce."
37.61,425.99,288.45,434.83,"/F8",9.96,"Iaculis porta. Euismod curae. Potenti proin amet. Na-"
37.61,414.03,288.48,422.88,"/F8",9.96,"toque donec. Rhoncus lorem. Nonummy donec arcu dui"
37.61,402.08,288.45,410.92,"/F8",9.96,"aliquam augue neque. Posuere risus. Integer magna. Feu-"
37.61,390.12,288.41,398.97,"/F8",9.96,"giat curae. Quisque velit. Potenti ipsum hac. Aliquet"
37.61,378.17,288.40,387.01,"/F8",9.96,"proin. Rhoncus ipsum dui tristique. Aliquet neque adip-"
37.61,366.21,288.43,375.06,"/F8",9.96,"iscing. Egestas purus. Cubilia etiam nec urna sed sodales."
37.61,354.26,288.42,363.10,"/F8",9.96,"Euismod class vel donec tincidunt et fermentum conubia"
37.61,342.30,288.40,351.15,"/F8",9.96,"sapien auctor. Blandit velit ut amet erat proin facilisis"
37.61,330.34,80.47,339.19,"/F8",9.96,"ante cum."
52.56,318.39,288.44,327.24,"/F8",9.96,"Integer felis quis nam fermentum conubia. Rhoncus ip-"
37.61,306.43,288.43,315.28,"/F8",9.96,"sum. Conubia vitae ut hendrerit donec a tempus. Rhoncus"
37.61,294.48,288.43,303.33,"/F8",9.96,"fames hac vel ridiculus nullam vulputate neque eu magna."
37.61,282.52,288.46,291.37,"/F8",9.96,"Euismod fusce massa a. Viverra dolor. Feugiat class arcu"
37.61,270.57,288.40,279.41,"/F8",9.96,"dolor turpis sit parturient vestibulum et. Conubia fames"
37.61,258.61,288.41,267.46,"/F8",9.96,"urna tellus mollis fringilla praesent platea conubia ve po-"
37.61,246.66,288.42,255.51,"/F8",9.96,"tenti ac orci. Integer vitae laoreet integer tempus ac id."
37.61,234.70,288.42,243.55,"/F8",9.96,"Rhoncus massa. Pretium fames et ultricies risus duis ul-"
37.61,222.75,288.41,231.60,"/F8",9.96,"tricies consectetuer vestibulum. Laoreet neque lorem auc-"
37.61,210.79,288.43,219.64,"/F8",9.96,"tor. Cubilia proin ve a elit purus sodales enim. Iaculis"
37.61,198.84,288.42,207.68,"/F8",9.96,"neque. Lacinia fusce. Potenti ipsum vitae tortor condi-"
37.61,186.88,288.43,195.73,"/F8",9.96,"mentum curae. Potenti morbi. Lacinia neque ut porta in"
37.61,174.93,288.40,183.77,"/F8",9.96,"habitasse lacinia hac interdum penatibus quam tristique."
37.61,162.97,288.47,171.82,"/F8",9.96,"Lacinia purus eu faucibus cras litora ligula. Commodo"
37.61,151.02,288.44,159.86,"/F8",9.96,"nulla. Laoreet massa cras porttitor. Blandit dolor adip-"
37.61,139.06,180.94,147.91,"/F8",9.96,"iscing volutpat velit quisque nisi."
52.56,127.11,288.45,135.95,"/F8",9.96,"Quisque etiam leo dui consectetuer at egestas diam."
37.61,115.15,288.46,124.00,"/F8",9.96,"Natoque ipsum magna suspendisse ad turpis euismod cu-"
37.61,103.20,288.40,112.04,"/F8",9.96,"bilia penatibus orci dapibus justo arcu viverra quis lorem."
37.61,91.24,288.43,100.09,"/F8",9.96,"Feugiat justo eget at nulla primis lacus. Feugiat neque"
37.61,79.29,288.42,88.13,"/F8",9.96,"et sociis praesent vitae. Integer netus arcu condimentum"
306.60,748.78,557.44,757.62,"/F8",9.96,"id. Lacinia fames eros conubia eu metus platea. Dapibus"
306.60,736.82,557.43,745.67,"/F8",9.96,"augue elit. Euismod fames in pellentesque gravida. Na-"
306.60,724.87,557.38,733.71,"/F8",9.96,"toque netus vestibulum enim risus lacus taciti. Quisque"
306.60,712.91,557.38,721.76,"/F8",9.96,"vitae parturient dictumst. Cubilia risus leo dolor varius"
306.60,700.95,557.45,709.80,"/F8",9.96,"etiam adipiscing maecenas odio quis. Lacinia fames duis"
306.60,689.00,557.39,697.85,"/F8",9.96,"sociis pretium iaculis consectetuer fermentum justo ve auc-"
306.60,677.04,557.46,685.89,"/F8",9.96,"tor vel. Egestas donec class montes laoreet ad maecenas"
306.60,665.09,557.40,673.94,"/F8",9.96,"quam feugiat ad. Gravida netus sit mus consectetuer taciti"
306.60,653.13,557.42,661.98,"/F8",9.96,"risus. Natoque netus. Vivamus donec augue pulvinar risus"
306.60,641.18,557.46,650.02,"/F8",9.96,"lorem nascetur sem pretium amet. Nonummy fames eros"
306.60,629.22,557.43,638.07,"/F8",9.96,"aliquam. Nonummy neque vestibulum nascetur. Laoreet"
306.60,617.27,557.41,626.11,"/F8",9.96,"porta ad vitae consectetuer elementum primis ad turpis"
306.60,605.31,557.39,614.16,"/F8",9.96,"vulputate. Laoreet velit quam aptent ut diam mattis litora"
306.60,593.36,557.41,602.20,"/F8",9.96,"penatibus. Conubia dolor per vulputate nibh. Gravida"
306.60,581.40,557.40,590.25,"/F8",9.96,"nulla diam cras nibh eu suscipit erat imperdiet senectus"
306.60,569.45,342.09,578.29,"/F8",9.96,"class ut."
310.84,555.39,319.77,562.47,"/F19",7.97,"[1]"
324.75,555.39,557.53,562.47,"/F19",7.97,"M. Goresky, R. MacPherson, On the topology of complex alge-"
324.76,545.92,381.51,553.00,"/F19",7.97,"braic maps, in:"
386.77,545.92,557.55,553.00,"/F19",7.97,"Algebraic Geometry Proceedings, La Rabida,"
324.76,536.46,493.30,543.54,"/F19",7.97,"Lecture Notes in Mathematics, no. 961, 1981."
310.84,526.99,319.77,534.07,"/F19",7.97,"[2]"
324.75,526.99,536.49,534.07,"/F19",7.97,"R. MacPherson, Singularities of vector bundle maps, in:"
541.44,526.99,557.55,534.07,"/F19",7.97,"Pro-"
324.76,517.53,557.54,524.61,"/F19",7.97,"ceedings of Liverpool Singularities, Lecture Notes in Mathemat-"
324.76,508.07,390.64,515.14,"/F19",7.97,"ics, no. 192, 1981."
310.84,498.60,319.77,505.68,"/F19",7.97,"[3]"
324.75,498.60,557.55,505.68,"/F19",7.97,"D. Sullivan, Combinatorical invariants of analytic spaces, in:"
324.76,489.14,557.54,496.21,"/F19",7.97,"Proceedings of Liverpool Singularities, Lecture Notes in Math-"
324.76,479.67,408.98,486.75,"/F19",7.97,"ematics, no. 192, 1981."
310.84,470.21,319.77,477.29,"/F19",7.97,"[4]"
324.75,470.21,557.54,477.29,"/F19",7.97,"A. Parusinski, P. Pragacz, Characteristic classes of hypersur-"
324.76,460.74,531.48,467.82,"/F19",7.97,"faces and characteristic cycles, preprint (January 1998)."
310.84,451.28,319.77,458.36,"/F19",7.97,"[5]"
324.75,451.28,335.80,458.36,"/F19",7.97,"W."
341.51,451.28,370.55,458.36,"/F19",7.97,"Pardon,"
376.99,451.28,387.09,458.36,"/F19",7.97,"M."
392.80,451.28,414.91,458.36,"/F19",7.97,"Stern,"
421.34,451.28,438.86,458.36,"/F19",7.97,"Pure"
444.58,451.28,466.44,458.36,"/F19",7.97,"hodge"
472.15,451.28,505.60,458.36,"/F19",7.97,"structure"
511.32,451.28,520.25,458.36,"/F19",7.97,"on"
525.97,451.28,537.72,458.36,"/F19",7.97,"the"
543.52,451.28,549.27,458.36,"/F22",7.97,"L"
549.28,450.56,552.93,455.87,"/F21",5.98,"2"
553.43,451.28,557.66,458.36,"/F19",7.97,"{"
324.76,441.81,368.25,448.89,"/F19",7.97,"cohomology"
373.30,441.81,380.11,448.89,"/F19",7.97,"of"
385.16,441.81,415.55,448.89,"/F19",7.97,"varieties"
420.60,441.81,437.06,448.89,"/F19",7.97,"with"
442.10,441.81,470.36,448.89,"/F19",7.97,"isolated"
475.42,441.81,522.07,448.89,"/F19",7.97,"singularities,"
527.69,441.81,557.56,448.89,"/F19",7.97,"preprint"
324.76,432.35,350.62,439.43,"/F19",7.97,"(1997)."
310.84,422.88,319.77,429.96,"/F19",7.97,"[6]"
324.75,422.88,557.55,429.96,"/F19",7.97,"A. S. Dubson, Calcul des invariants numeriques des singularites"
324.76,413.42,463.30,420.50,"/F19",7.97,"et applications, where from?? (1981)."
310.84,403.96,319.77,411.03,"/F19",7.97,"[7]"
324.75,403.96,557.54,411.03,"/F19",7.97,"L. D. Trang, Z. Mebkhout, Varietes caracteristiques et varietes"
324.76,394.49,514.36,401.57,"/F19",7.97,"polaires, C. R. Acad. Sc. Paris 296 (1983) 129{132."
310.84,385.03,319.77,392.10,"/F19",7.97,"[8]"
324.75,385.03,557.54,392.10,"/F19",7.97,"J.-L. Brylinski, (Co){Homologie d'intersection et faisceaux per-"
324.76,375.56,494.22,382.64,"/F19",7.97,"vers, Seminaire Bourbaki 585 (1982) 129{157."
310.84,364.94,319.77,372.01,"/F19",7.97,"[9]"
324.75,364.94,390.92,372.01,"/F19",7.97,"D. Siersma, M. Ti"
391.19,367.04,395.42,374.12,"/F19",7.97,""
390.95,364.94,557.58,372.01,"/F19",7.97,"bar, Singularities at innity and their vanish-"
324.76,355.47,491.72,362.55,"/F19",7.97,"ing cycles, Duke Math. J. 80 (1995) 771{783."
306.60,346.01,319.77,353.08,"/F19",7.97,"[10]"
324.75,346.01,557.57,353.08,"/F19",7.97,"G. Barthel, J.-P. Brasselet, K.-H. Fieseler, Classes de Chern des"
324.76,336.54,557.55,343.62,"/F19",7.97,"varietes toriques singulieres, C. R. Acad. Sci. Paris 315 (1992)"
324.76,327.08,356.74,334.16,"/F19",7.97,"187{192."
306.60,317.61,319.77,324.69,"/F19",7.97,"[11]"
324.75,317.61,557.53,324.69,"/F19",7.97,"P. Alu, Singular schemes of hypersurfaces, Duke Math. J. 80"
324.76,308.15,383.07,315.23,"/F19",7.97,"(1995) 325{351."
306.60,298.68,319.77,305.76,"/F19",7.97,"[12]"
324.75,298.68,557.53,305.76,"/F19",7.97,"G. Gonzalez-Sprinberg, Cycle maximal et invariant d'Euler local"
324.76,289.22,557.55,296.30,"/F19",7.97,"des singularites isolees de surfaces, Topology 21 (1982) 401{408."
306.60,279.75,319.77,286.83,"/F19",7.97,"[13]"
324.75,279.75,341.66,286.83,"/F19",7.97,"J.-P."
349.61,279.75,385.33,286.83,"/F19",7.97,"Brasselet,"
394.55,279.75,403.54,286.83,"/F19",7.97,"G."
411.48,279.75,485.85,286.83,"/F19",7.97,"Gonzalez-Sprinberg,"
495.07,279.75,507.78,286.83,"/F19",7.97,"Sur"
515.72,279.75,557.57,286.83,"/F19",7.97,"l'homologie"
324.76,270.29,557.57,277.37,"/F19",7.97,"d'intersection et les classes de Chern des varietes singulieres"
324.76,260.83,557.55,267.90,"/F19",7.97,"(Espaces de Thom et contre-exemples de Verdier et Goresky),"
324.76,251.36,524.47,258.44,"/F19",7.97,"Geometrie Algebrique et Applications 23 (1987) 5{14."
306.60,241.90,319.77,248.97,"/F19",7.97,"[14]"
324.75,241.90,557.53,248.97,"/F19",7.97,"R. Langevin, Coubures au voisinage d'une singularite algebrique"
324.76,232.43,484.77,239.51,"/F19",7.97,"isolee, Asterisque 82-83 (1978{1979) 33{43."
306.60,222.97,319.77,230.05,"/F19",7.97,"[15]"
324.75,222.97,557.55,230.05,"/F19",7.97,"O. Riemenschneider, Characterizing Moisezon spaces by almost"
324.76,213.50,557.54,220.58,"/F19",7.97,"positive coherent analytic sheaves, Math. Zeit. 123 (1971) 265{"
324.76,204.04,339.81,211.12,"/F19",7.97,"284."
295.15,61.35,300.13,70.20,"/F8",9.96,"5"
