37.61,748.78,265.44,757.62,"/F8",9.96,"enim convallis elit dis a dictum nibh mattis platea."
272.10,748.78,288.41,757.62,"/F8",9.96,"Ali-"
37.61,736.82,288.42,745.67,"/F8",9.96,"quet magna quam luctus venenatis parturient eros semper."
37.61,724.87,288.42,733.71,"/F8",9.96,"Pretium morbi orci posuere at dapibus. Pretium risus so-"
37.61,712.91,288.40,721.76,"/F8",9.96,"dales ut blandit diam et. Iaculis metus nulla vitae integer"
37.61,700.96,155.36,709.80,"/F8",9.96,"conubia cubilia vitae ante."
162.82,700.96,288.44,709.80,"/F8",9.96,"Feugiat ipsum mi nunc con-"
37.61,689.00,185.31,697.85,"/F8",9.96,"sequat varius mi amet primis ac."
192.96,689.00,288.44,697.85,"/F8",9.96,"Laoreet etiam aliquet"
37.61,677.04,288.40,685.89,"/F8",9.96,"ipsum quis ultrices nec gravida ac. Dapibus purus elit mi."
52.56,665.09,175.08,673.94,"/F8",9.96,"Dapibus donec fames odio."
185.37,665.09,288.48,673.94,"/F8",9.96,"Rhoncus lorem blandit"
37.61,653.13,60.41,661.98,"/F8",9.96,"risus."
70.75,653.13,261.82,661.98,"/F8",9.96,"Commodo fames eget et pharetra aliquet."
272.15,653.13,288.47,661.98,"/F8",9.96,"Iac-"
37.61,641.18,288.42,650.03,"/F8",9.96,"ulis massa dis. Viverra justo elit id amet senectus biben-"
37.61,629.22,59.73,638.07,"/F8",9.96,"dum."
67.07,629.22,288.45,638.07,"/F8",9.96,"Feugiat massa felis donec nascetur porttitor mae-"
37.61,617.27,63.66,626.11,"/F8",9.96,"cenas."
73.91,617.27,288.45,626.11,"/F8",9.96,"Euismod purus class dui nisl arcu dapibus hy-"
37.61,605.31,288.45,614.16,"/F8",9.96,"menaeos. Euismod dolor augue dui vehicula. Lacinia class"
37.61,593.36,288.44,602.20,"/F8",9.96,"purus. Lacinia magna duis semper platea. Dapibus neque"
37.61,581.40,195.40,590.25,"/F8",9.96,"ut massa montes pulvinar tristique."
202.08,581.40,288.43,590.25,"/F8",9.96,"Laoreet netus dolor"
37.61,569.45,288.41,578.29,"/F8",9.96,"pharetra sed sollicitudin magna netus pharetra. Iaculis cu-"
37.61,557.49,288.45,566.34,"/F8",9.96,"rae id proin netus auctor platea. Nonummy lorem etiam."
37.61,545.54,101.47,554.38,"/F8",9.96,"Posuere curae."
108.47,545.54,288.46,554.38,"/F8",9.96,"Nonummy massa vivamus lacinia pellen-"
37.61,533.58,139.55,542.43,"/F8",9.96,"tesque ridiculus purus."
149.37,533.58,288.43,542.43,"/F8",9.96,"Nonummy vitae eget habitasse"
37.61,521.63,77.47,530.47,"/F8",9.96,"pharetra."
84.02,521.63,288.44,530.47,"/F8",9.96,"Conubia nulla neque ipsum dolor a litora erat"
37.61,509.67,101.44,518.52,"/F8",9.96,"potenti donec."
111.60,509.67,180.96,518.52,"/F8",9.96,"Aliquam etiam."
191.13,509.67,288.48,518.52,"/F8",9.96,"Commodo donec quis"
37.61,497.72,288.44,506.56,"/F8",9.96,"accumsan aliquet odio arcu dolor laoreet natoque pellen-"
37.61,485.76,288.45,494.61,"/F8",9.96,"tesque hymenaeos metus. Vivamus fusce. Nonummy justo."
37.61,463.35,167.38,472.19,"/F27",9.96,"1.2. Integer netus orci luctus."
52.56,449.90,174.68,458.74,"/F8",9.96,"Sodales fusce enim gravida."
181.65,449.90,267.68,458.74,"/F8",9.96,"Rhoncus morbi est."
274.65,449.90,288.48,458.74,"/F8",9.96,"So-"
37.61,437.94,127.89,446.79,"/F8",9.96,"dales metus eni nisi."
134.53,437.94,224.85,446.79,"/F8",9.96,"Quisque lorem urna."
231.49,437.94,288.43,446.79,"/F8",9.96,"Egestas class"
37.61,425.99,288.40,434.83,"/F8",9.96,"eni adipiscing facilisis lacus consequat. Aliquet justo quam"
37.61,414.03,288.41,422.88,"/F8",9.96,"nec facilisis fames luctus torquent pede mauris cursus pe-"
37.61,402.08,288.43,410.92,"/F8",9.96,"natibus bibendum. Sodales donec diam habitant vel cras."
37.61,390.12,247.62,398.97,"/F8",9.96,"Iaculis lorem rhoncus cum vestibulum semper."
256.79,390.12,288.43,398.97,"/F8",9.96,"Potenti"
37.61,378.17,110.11,387.01,"/F8",9.96,"netus mi neque."
119.96,378.17,288.44,387.01,"/F8",9.96,"Blandit porta at morbi taciti aenean"
37.61,366.21,86.39,375.06,"/F8",9.96,"morbi sem."
92.56,366.21,288.43,375.06,"/F8",9.96,"Aliquet morbi et nunc tellus eros id orci ad."
37.61,354.26,288.44,363.10,"/F8",9.96,"Laoreet nulla. Laoreet fusce dolor dis. Cubilia metus ne-"
37.61,342.30,288.41,351.15,"/F8",9.96,"tus praesent. Natoque lorem morbi mattis proin tristique"
37.61,330.34,288.45,339.19,"/F8",9.96,"duis sem. Commodo purus cras tortor venenatis. Posuere"
37.61,318.39,65.84,327.24,"/F8",9.96,"morbi."
72.03,318.39,135.78,327.24,"/F8",9.96,"Gravida dolor."
141.98,318.39,204.68,327.24,"/F8",9.96,"Lacinia lorem."
210.87,318.39,288.44,327.24,"/F8",9.96,"Integer etiam nisi"
37.61,306.43,288.39,315.28,"/F8",9.96,"pretium feugiat elit ve consectetuer pellentesque gravida"
37.61,294.48,69.76,303.33,"/F8",9.96,"mauris."
78.01,294.48,288.46,303.33,"/F8",9.96,"Commodo fames cras orci nunc nisl eni libero."
37.61,282.52,288.44,291.37,"/F8",9.96,"Feugiat etiam odio risus ve pede urna tellus conubia na-"
37.61,270.57,98.76,279.41,"/F8",9.96,"toque montes."
52.56,258.61,288.40,267.46,"/F8",9.96,"Cubilia etiam at lectus a parturient. Viverra felis risus"
37.61,246.66,292.39,255.51,"/F8",9.96,"placerat nam. Feugiat nulla nunc hendrerit torquent congue"
37.61,234.70,65.86,243.55,"/F8",9.96,"mollis."
73.27,234.70,153.89,243.55,"/F8",9.96,"Quisque fames ac."
161.30,234.70,288.45,243.55,"/F8",9.96,"Iaculis donec mi nostra hen-"
37.61,222.75,288.40,231.60,"/F8",9.96,"drerit lacinia pellentesque fringilla neque a gravida dic-"
37.61,210.79,288.44,219.64,"/F8",9.96,"tum. Natoque morbi et. Rhoncus dolor quis ornare inter-"
37.61,198.84,288.45,207.68,"/F8",9.96,"dum lorem odio dui lacus varius. Gravida dolor diam non"
37.61,186.88,288.42,195.73,"/F8",9.96,"pellentesque ad morbi ve montes elementum velit phasel-"
37.61,174.93,250.32,183.77,"/F8",9.96,"lus viverra nisl adipiscing enim lacus venenatis."
257.97,174.93,288.40,183.77,"/F8",9.96,"Integer"
37.61,162.97,163.10,171.82,"/F8",9.96,"class eget leo eros nisl diam."
169.01,162.97,288.46,171.82,"/F8",9.96,"Vivamus etiam lacus fames"
37.61,151.02,288.45,159.86,"/F8",9.96,"aenean condimentum metus venenatis potenti pede con-"
37.61,139.06,79.15,147.91,"/F8",9.96,"sectetuer."
89.50,139.06,288.43,147.91,"/F8",9.96,"Blandit nulla etiam leo ipsum etiam platea"
37.61,127.11,93.20,135.95,"/F8",9.96,"fusce facilisi."
99.93,127.11,172.57,135.95,"/F8",9.96,"Iaculis augue et."
179.29,127.11,288.44,135.95,"/F8",9.96,"Nonummy justo natoque"
37.61,115.15,288.41,124.00,"/F8",9.96,"interdum nisi ultrices praesent feugiat praesent eros leo"
37.61,103.20,288.41,112.04,"/F8",9.96,"nisi penatibus vel vitae. Pretium dolor ad montes laoreet"
37.61,91.24,288.41,100.09,"/F8",9.96,"nibh nisi porttitor. Natoque neque quam eros vestibulum"
37.61,79.29,288.42,88.13,"/F8",9.96,"habitasse nunc. Viverra curae et morbi litora consectetuer"
306.60,748.78,470.26,757.62,"/F8",9.96,"dapibus nulla nec vestibulum luctus."
478.10,748.78,557.41,757.62,"/F8",9.96,"Aliquet massa est"
306.60,736.82,557.41,745.67,"/F8",9.96,"velit ligula non faucibus aliquam eu fermentum metus. In-"
306.60,724.87,359.75,733.71,"/F8",9.96,"teger donec."
365.96,724.87,557.44,733.71,"/F8",9.96,"Viverra porta quam a diam vestibulum sed"
306.60,712.91,403.56,721.76,"/F8",9.96,"purus dapibus mattis."
410.50,712.91,557.38,721.76,"/F8",9.96,"Aliquet curae in porttitor cubilia"
306.60,700.95,538.02,709.80,"/F8",9.96,"platea fusce. Commodo ipsum. Aliquam morbi class."
306.60,671.07,388.72,679.91,"/F17",9.96,"2. Integer fusce."
321.55,650.15,557.41,658.99,"/F8",9.96,"Integer porta class rutrum mi dis nisi sollicitudin at"
306.60,638.19,343.92,647.04,"/F8",9.96,"aliquam."
351.22,638.19,471.73,647.04,"/F8",9.96,"Natoque fusce cras feugiat."
479.03,638.19,557.44,647.04,"/F8",9.96,"Blandit fames eni"
306.60,626.24,557.43,635.08,"/F8",9.96,"consequat eni urna mi auctor. Feugiat morbi eu. Natoque"
306.60,614.28,557.44,623.13,"/F8",9.96,"morbi. Sodales justo neque augue. Euismod lorem. Rhon-"
306.60,602.32,557.41,611.17,"/F8",9.96,"cus ipsum fusce dis bibendum. Posuere justo proin varius"
306.60,590.37,557.44,599.22,"/F8",9.96,"magnis hymenaeos augue venenatis viverra nunc morbi eu-"
306.60,578.41,557.43,587.26,"/F8",9.96,"ismod ve interdum congue. Cubilia magna. Gravida felis"
306.60,566.46,557.42,575.31,"/F8",9.96,"at arcu curae et eni scelerisque egestas. Viverra metus in"
306.60,554.50,557.38,563.35,"/F8",9.96,"ad leo ultricies sagittis ve sit hendrerit montes arcu purus"
306.60,542.55,345.53,551.39,"/F8",9.96,"ac sociis."
351.10,542.55,557.42,551.39,"/F8",9.96,"Pretium augue pede et eni ullamcorper viverra"
306.60,530.59,557.44,539.44,"/F8",9.96,"magna cras elementum hac morbi elit nam pellentesque mi"
306.60,518.64,557.42,527.48,"/F8",9.96,"porta. Natoque proin. Rhoncus justo. Quisque vitae cras"
306.60,506.68,557.40,515.53,"/F8",9.96,"placerat diam cum. Gravida velit. Blandit netus. Iaculis"
306.60,494.73,557.39,503.57,"/F8",9.96,"class amet rutrum hendrerit in aenean sit vestibulum adip-"
306.60,482.77,557.39,491.62,"/F8",9.96,"iscing at lobortis potenti. Blandit dolor nec lorem integer."
306.60,470.82,542.94,479.66,"/F8",9.96,"Conubia ipsum. Natoque velit mi cras metus pretium."
321.55,458.86,557.47,467.71,"/F8",9.96,"Vivamus fames in massa mi vitae nascetur morbi cu-"
306.60,446.91,557.43,455.75,"/F8",9.96,"rae mauris hac. Iaculis fames arcu molestie consectetuer."
306.60,434.95,557.42,443.80,"/F8",9.96,"Blandit magna leo arcu porttitor faucibus rutrum platea"
306.60,423.00,557.45,431.84,"/F8",9.96,"amet arcu eu consectetuer congue. Sodales etiam. Conu-"
306.60,411.04,557.43,419.89,"/F8",9.96,"bia fames porta eros rhoncus vivamus ultricies pede dui"
306.60,399.09,403.53,407.93,"/F8",9.96,"vivamus per in lorem."
410.22,399.09,557.41,407.93,"/F8",9.96,"Dapibus augue velit libero ad ip-"
306.60,387.13,557.40,395.98,"/F8",9.96,"sum in curae. Rhoncus velit adipiscing. Gravida justo erat"
306.60,375.18,557.42,384.02,"/F8",9.96,"blandit amet consequat nascetur mi justo fermentum. In-"
306.60,363.22,557.42,372.07,"/F8",9.96,"teger fames quisque ut odio senectus. Quisque curae arcu"
306.60,351.27,557.38,360.11,"/F8",9.96,"a odio vestibulum taciti inceptos. Cubilia neque in luctus"
306.60,339.31,434.06,348.16,"/F8",9.96,"dui cubilia maecenas ut dui."
441.97,339.31,557.45,348.16,"/F8",9.96,"Commodo donec velit do-"
306.60,327.36,400.68,336.20,"/F8",9.96,"lor aliquet in magnis."
406.50,327.36,557.40,336.20,"/F8",9.96,"Potenti lorem sit adipiscing ipsum"
306.60,315.40,557.41,324.25,"/F8",9.96,"amet dictumst erat laoreet felis adipiscing nascetur augue"
306.60,303.45,557.43,312.29,"/F8",9.96,"ad fusce at. Natoque fames eni duis parturient magnis ve"
306.60,291.49,557.43,300.34,"/F8",9.96,"non id morbi at fringilla ac condimentum quam elit cur-"
306.60,279.53,557.41,288.38,"/F8",9.96,"abitur. Egestas purus nam nisi. Feugiat neque netus urna"
306.60,267.58,451.83,276.43,"/F8",9.96,"pharetra neque sed nam quisque."
457.44,267.58,557.41,276.43,"/F8",9.96,"Pretium ipsum blandit"
306.60,255.62,557.42,264.47,"/F8",9.96,"viverra sociis magna praesent pede integer habitasse urna."
306.60,243.67,557.43,252.52,"/F8",9.96,"Lacinia purus mi turpis nam blandit amet urna lobortis a"
306.60,231.71,557.42,240.56,"/F8",9.96,"vehicula. Euismod massa erat nibh. Lacinia nulla. Iaculis"
306.60,219.76,557.42,228.61,"/F8",9.96,"porta class aliquet odio aliquet cras mi. Sodales morbi ve"
306.60,207.80,506.39,216.65,"/F8",9.96,"risus cursus scelerisque vitae convallis per vel."
306.60,183.89,470.07,192.74,"/F27",9.96,"2.1. Potenti etiam nam nisl euismod."
321.55,168.95,380.64,177.80,"/F8",9.96,"Posuere velit."
386.72,168.95,484.97,177.80,"/F8",9.96,"Nonummy morbi quis."
491.06,168.95,557.43,177.80,"/F8",9.96,"Aliquam proin."
306.60,156.99,557.38,165.84,"/F8",9.96,"Blandit felis cras ligula viverra nisi a. Quisque ipsum ante"
306.60,145.04,557.40,153.89,"/F8",9.96,"quisque ipsum. Gravida fames ac quis velit nullam sociis."
306.60,133.08,374.71,141.93,"/F8",9.96,"Natoque fames."
380.86,133.08,441.46,141.93,"/F8",9.96,"Aliquam felis."
447.60,133.08,557.44,141.93,"/F8",9.96,"Rhoncus lacus adipiscing"
306.60,121.13,345.42,129.98,"/F8",9.96,"sociosqu."
352.83,121.13,528.77,129.98,"/F8",9.96,"Commodo metus dis mattis malesuada."
536.18,121.13,557.48,129.98,"/F8",9.96,"Non-"
306.60,109.17,557.44,118.02,"/F8",9.96,"ummy neque eni diam augue. Laoreet justo ipsum dapibus"
306.60,97.22,557.43,106.07,"/F8",9.96,"semper et maecenas sem. Aliquam fames dui tortor aliquet"
306.60,85.26,325.42,94.11,"/F8",9.96,"orci."
331.87,85.26,557.39,94.11,"/F8",9.96,"Quisque lacus justo sociis turpis phasellus curae id"
295.15,61.35,300.13,70.20,"/F8",9.96,"2"
