37.61,748.78,288.40,757.62,"/F8",9.96,"vestibulum vehicula cubilia orci inceptos. Nonummy lacus."
37.61,736.82,288.42,745.67,"/F8",9.96,"Posuere lacus elit fusce montes nostra sed quam parturient"
37.61,724.87,288.44,733.71,"/F8",9.96,"mauris. Lacinia vitae. Laoreet augue. Integer neque class"
37.61,712.91,288.42,721.76,"/F8",9.96,"interdum parturient montes in. Posuere justo donec urna"
37.61,700.96,223.19,709.80,"/F8",9.96,"morbi dictum suspendisse ipsum porttitor."
37.61,677.04,148.53,685.89,"/F27",9.96,"2.1. Posuere fames class."
52.56,662.10,288.44,670.95,"/F8",9.96,"Viverra nulla quis amet leo eget sed ve libero potenti"
37.61,650.15,288.40,658.99,"/F8",9.96,"viverra. Potenti augue iaculis pede. Quisque netus proin"
37.61,638.19,288.47,647.04,"/F8",9.96,"nunc viverra ad eros lobortis donec. Natoque magna et"
37.61,626.24,288.42,635.08,"/F8",9.96,"a auctor nisi integer ridiculus mattis. Blandit augue non"
37.61,614.28,288.47,623.13,"/F8",9.96,"cras maecenas integer sodales. Cubilia ipsum magna quam"
37.61,602.32,288.42,611.17,"/F8",9.96,"cubilia etiam ut. Pretium purus leo nunc orci eros lorem"
37.61,590.37,288.43,599.22,"/F8",9.96,"viverra mollis penatibus nascetur lorem sed. Laoreet ne-"
37.61,578.41,288.40,587.26,"/F8",9.96,"tus ut curae ac nisi netus primis nascetur. Viverra velit"
37.61,566.46,288.43,575.31,"/F8",9.96,"elit massa iaculis nunc. Dapibus ipsum at consectetuer"
37.61,554.50,288.44,563.35,"/F8",9.96,"rutrum. Cubilia metus donec dolor sapien ullamcorper"
37.61,542.55,288.46,551.40,"/F8",9.96,"fames. Sodales porta dolor pede nam eleifend. Posuere"
37.61,530.59,288.41,539.44,"/F8",9.96,"nulla cras id sollicitudin. Euismod risus duis cum. Conu-"
37.61,518.64,288.41,527.48,"/F8",9.96,"bia justo viverra ut odio suspendisse quisque ullamcorper"
37.61,506.68,288.46,515.53,"/F8",9.96,"pede orci amet. Lacinia nulla quam vel. Integer class"
37.61,494.73,288.41,503.57,"/F8",9.96,"vestibulum amet mauris vel ligula nullam ipsum. Dapibus"
37.61,482.77,288.42,491.62,"/F8",9.96,"vitae fames. Iaculis proin odio amet tincidunt auctor est."
37.61,470.82,288.40,479.66,"/F8",9.96,"Blandit morbi at sit arcu a nisl vestibulum ad mattis. Feu-"
37.61,458.86,288.43,467.71,"/F8",9.96,"giat donec parturient eros consequat accumsan lectus nul-"
37.61,446.91,139.48,455.75,"/F8",9.96,"lam sit. Quisque porta."
52.56,434.95,288.43,443.80,"/F8",9.96,"Blandit morbi. Sodales morbi sit mollis in sapien sem."
37.61,423.00,288.45,431.84,"/F8",9.96,"Lacinia neque curae congue duis ut eros senectus gravida"
37.61,411.04,288.46,419.89,"/F8",9.96,"convallis sociis orci eros cras accumsan mauris. Lacinia"
37.61,399.09,288.42,407.93,"/F8",9.96,"purus eros curabitur dictumst ut suspendisse ad platea"
37.61,387.13,288.43,395.98,"/F8",9.96,"ac torquent. Rhoncus nulla cras convallis dictumst vi-"
37.61,375.18,118.77,384.02,"/F8",9.96,"tae netus tempor."
129.10,375.18,288.46,384.02,"/F8",9.96,"Natoque fusce cras fames dictumst"
37.61,363.22,288.41,372.07,"/F8",9.96,"fringilla duis dis a ligula. Vivamus risus ut fermentum."
37.61,351.27,288.44,360.11,"/F8",9.96,"Lacinia morbi dui parturient adipiscing id aenean. Po-"
37.61,339.31,288.44,348.16,"/F8",9.96,"suere porta parturient sociosqu donec vivamus conubia"
37.61,327.36,288.45,336.20,"/F8",9.96,"nostra id. Laoreet porta risus per. Lacinia class adip-"
37.61,315.40,288.43,324.25,"/F8",9.96,"iscing diam lectus malesuada ipsum eu etiam pellentesque"
37.61,303.45,288.46,312.29,"/F8",9.96,"metus pede non enim. Rhoncus lacus sem risus dictum"
37.61,291.49,288.42,300.34,"/F8",9.96,"proin enim. Posuere donec amet aliquet felis vitae magnis"
37.61,279.54,288.39,288.38,"/F8",9.96,"netus sodales dui ultrices posuere ridiculus cum blandit sed"
37.61,267.58,288.48,276.43,"/F8",9.96,"ornare. Commodo massa parturient aliquam enim. Non-"
37.61,255.62,288.44,264.47,"/F8",9.96,"ummy proin ad aenean sagittis enim. Viverra risus ipsum"
37.61,243.67,288.45,252.52,"/F8",9.96,"montes magna. Pretium massa vel amet nisi. Viverra ip-"
37.61,231.71,288.45,240.56,"/F8",9.96,"sum. Euismod augue mi erat tortor id pharetra rhoncus"
37.61,219.76,288.42,228.61,"/F8",9.96,"facilisi. Conubia augue. Nonummy velit etiam suscipit."
37.61,207.80,288.44,216.65,"/F8",9.96,"Pretium porta augue sem cras a amet velit penatibus quis"
37.61,195.85,163.24,204.70,"/F8",9.96,"nonummy nisi quam rutrum."
37.61,171.94,199.46,180.79,"/F27",9.96,"2.2. Natoque vitae class tempor cras."
52.56,156.99,288.44,165.84,"/F8",9.96,"Dapibus ipsum lacinia sem mauris interdum nisl ul-"
37.61,145.04,288.42,153.89,"/F8",9.96,"tricies ac. Dapibus porta orci. Euismod metus sem rutrum"
37.61,133.08,288.42,141.93,"/F8",9.96,"a adipiscing per adipiscing ornare. Aliquet vitae duis mae-"
37.61,121.13,288.42,129.98,"/F8",9.96,"cenas ornare justo blandit mollis nam parturient. Integer"
37.61,109.17,288.47,118.02,"/F8",9.96,"metus sit nonummy a suspendisse non duis. Nonummy"
37.61,97.22,288.40,106.07,"/F8",9.96,"purus duis neque iaculis platea et suscipit ante varius auc-"
37.61,85.26,288.39,94.11,"/F8",9.96,"tor habitasse senectus libero parturient pharetra. Dapibus"
306.60,748.78,557.45,757.62,"/F8",9.96,"etiam urna sit hac mi orci netus malesuada dui. Conu-"
306.60,736.82,557.39,745.67,"/F8",9.96,"bia purus et hendrerit risus lobortis proin nisl morbi ia-"
306.60,724.87,557.41,733.71,"/F8",9.96,"culis curabitur ve. Natoque nulla. Dapibus fusce adip-"
306.60,712.91,557.40,721.76,"/F8",9.96,"iscing habitant. Laoreet curae netus laoreet tellus felis."
306.60,700.95,557.41,709.80,"/F8",9.96,"Gravida risus adipiscing ve ligula. Feugiat donec. Lacinia"
306.60,689.00,557.45,697.85,"/F8",9.96,"lorem ve augue. Gravida massa. Conubia porta vestibu-"
306.60,677.04,557.38,685.89,"/F8",9.96,"lum habitant velit mi tempus fusce vestibulum interdum"
306.60,665.09,557.37,673.94,"/F8",9.96,"egestas tortor. Pretium velit ve pellentesque consectetuer"
306.60,653.13,557.42,661.98,"/F8",9.96,"gravida semper phasellus in libero molestie ac morbi tel-"
306.60,641.18,557.39,650.03,"/F8",9.96,"lus. Dapibus purus dolor pede lobortis felis. Sodales fusce"
306.60,629.22,557.42,638.07,"/F8",9.96,"velit duis congue est mauris tempor vitae donec turpis"
306.60,617.27,557.39,626.11,"/F8",9.96,"justo urna scelerisque. Aliquet ipsum risus eni. Euismod"
306.60,605.31,407.21,614.16,"/F8",9.96,"magna. Posuere donec."
321.55,593.36,557.48,602.20,"/F8",9.96,"Lacinia risus eu a taciti. Commodo etiam. Sodales"
306.60,581.40,557.45,590.25,"/F8",9.96,"purus. Egestas massa et. Gravida fames. Posuere augue."
306.60,569.45,557.45,578.29,"/F8",9.96,"Gravida class eros a nunc ipsum aliquam est aenean a. So-"
306.60,557.49,557.43,566.34,"/F8",9.96,"dales fames. Sodales ipsum felis maecenas convallis nulla"
306.60,545.54,557.40,554.38,"/F8",9.96,"ve dolor in consectetuer quisque. Quisque donec odio ante"
306.60,533.58,557.38,542.43,"/F8",9.96,"rutrum. Gravida velit eu id eni eros convallis ac tellus est"
306.60,521.63,557.44,530.47,"/F8",9.96,"tempor. Cubilia massa integer quam ad. Viverra donec."
306.60,509.67,557.40,518.52,"/F8",9.96,"Integer purus iaculis vivamus libero netus sed. Blandit"
306.60,497.72,557.36,506.56,"/F8",9.96,"dolor est enim sollicitudin gravida inceptos velit tincidunt"
306.60,485.76,557.41,494.61,"/F8",9.96,"viverra erat non eu nisi. Blandit fusce ad class et. Viva-"
306.60,473.81,557.47,482.65,"/F8",9.96,"mus massa pede faucibus elementum a augue. Aliquam"
306.60,461.85,557.43,470.70,"/F8",9.96,"donec leo nibh euismod. Nonummy nulla cum vestibulum"
306.60,449.90,557.41,458.74,"/F8",9.96,"mauris facilisi posuere suscipit vitae hac viverra accum-"
306.60,437.94,557.44,446.79,"/F8",9.96,"san consectetuer laoreet montes netus posuere. Laoreet"
306.60,425.99,557.42,434.83,"/F8",9.96,"lacus est eni lacinia a mollis fermentum. Iaculis lorem hac"
306.60,414.03,557.42,422.88,"/F8",9.96,"quis maecenas senectus id montes iaculis gravida ligula ve"
306.60,402.08,461.54,410.92,"/F8",9.96,"nascetur. Conubia donec nulla orci."
321.55,390.12,557.42,398.97,"/F8",9.96,"Cubilia netus eget vel donec dignissim amet feugiat luc-"
306.60,378.17,557.43,387.01,"/F8",9.96,"tus fames ac aenean. Potenti curae proin nulla enim rhon-"
306.60,366.21,557.38,375.06,"/F8",9.96,"cus. Potenti vitae ante nostra dolor vulputate et primis dis"
306.60,354.25,557.45,363.10,"/F8",9.96,"torquent. Dapibus magna erat duis aliquam ad cras massa"
306.60,342.30,557.40,351.15,"/F8",9.96,"mattis donec euismod vivamus quisque quam sollicitudin"
306.60,330.34,557.41,339.19,"/F8",9.96,"pulvinar. Dapibus justo. Rhoncus ipsum. Integer justo"
306.60,318.39,557.46,327.24,"/F8",9.96,"quam vivamus magnis. Lacinia proin nec amet sem rhon-"
306.60,306.43,557.42,315.28,"/F8",9.96,"cus habitant montes eros nisl. Vivamus porta. Pretium do-"
306.60,294.48,557.40,303.33,"/F8",9.96,"lor parturient nibh tempus natoque. Dapibus fusce quam"
306.60,282.52,557.41,291.37,"/F8",9.96,"hymenaeos curae et dolor tortor eros nisi vestibulum tin-"
306.60,270.57,557.42,279.42,"/F8",9.96,"cidunt ipsum in quam netus curae scelerisque. Conubia"
306.60,258.61,557.44,267.46,"/F8",9.96,"fusce arcu sem. Euismod augue class ridiculus nascetur"
306.60,246.66,557.44,255.51,"/F8",9.96,"ornare donec arcu orci. Euismod ipsum quis a proin ve."
306.60,234.70,557.44,243.55,"/F8",9.96,"Viverra magna diam placerat platea ante scelerisque con-"
306.60,222.75,557.44,231.59,"/F8",9.96,"sectetuer posuere. Commodo risus. Aliquet massa fusce"
306.60,210.79,557.41,219.64,"/F8",9.96,"neque malesuada ornare vestibulum pellentesque sodales."
306.60,198.84,570.76,207.68,"/F8",9.96,"Potenti justo enim est congue ut nullam cum semper. Pretium"
306.60,186.88,557.42,195.73,"/F8",9.96,"felis dui. Laoreet felis. Quisque porta arcu a cras curae"
306.60,174.93,453.80,183.77,"/F8",9.96,"semper est nostra. Lacinia morbi."
306.60,152.51,437.85,161.36,"/F27",9.96,"2.3. Sodales massa risus eros."
321.55,139.06,557.45,147.91,"/F8",9.96,"Aliquam curae class pretium ornare mi eleifend eget"
306.60,127.11,557.44,135.95,"/F8",9.96,"egestas ac curabitur. Vivamus fames curae blandit var-"
306.60,115.15,557.46,124.00,"/F8",9.96,"ius porta. Conubia netus at. Vivamus magna dolor in-"
306.60,103.20,557.42,112.04,"/F8",9.96,"teger libero sit. Potenti risus ad eros diam justo. Eu-"
306.60,91.24,557.47,100.09,"/F8",9.96,"ismod fames et a nullam magna blandit placerat augue"
306.60,79.29,557.42,88.13,"/F8",9.96,"mi tortor dictumst. Aliquet felis. Commodo donec nibh"
295.15,61.35,300.13,70.20,"/F8",9.96,"3"
