107.53,777.53,508.27,788.15,"/F17",11.96,"Commodo velit risus mollis nisl erat diam tortor rhoncus pede duis."
188.92,753.51,426.97,762.36,"/F8",9.96,"Dorsey Loughman, Walton Briere, and Myles Yantis"
263.98,743.24,352.04,751.21,"/F18",8.97,"Norton House Sports"
118.01,722.82,469.83,730.78,"/F15",8.97,"Nonummy vitae ad proin suspendisse ut mollis lacus parturient condimentum libero."
477.05,722.82,507.04,730.78,"/F15",8.97,"Sodales"
108.79,712.36,506.97,720.32,"/F15",8.97,"proin cras lacinia at leo enim cras sem quis elit lobortis class enim congue tempor potenti nunc."
108.79,701.90,187.91,709.86,"/F15",8.97,"Laoreet netus ante."
194.10,701.90,402.62,709.86,"/F15",8.97,"Integer morbi orci pede eros fermentum vulputate."
408.82,701.90,507.06,709.86,"/F15",8.97,"Blandit neque arcu mus"
108.79,691.44,506.97,699.40,"/F15",8.97,"sodales netus eget sagittis sollicitudin congue. Conubia neque mus molestie cubilia fames parturient"
108.79,680.98,506.97,688.94,"/F15",8.97,"sagittis proin metus vulputate hac proin eget. Gravida netus diam egestas tristique dictumst ligula"
108.79,670.52,506.98,678.48,"/F15",8.97,"tortor fames nec vitae aliquet lacus orci ut curabitur condimentum vitae imperdiet. Feugiat ipsum"
108.79,660.06,506.97,668.02,"/F15",8.97,"class massa aptent eleifend adipiscing fringilla fames nulla praesent convallis lacus phasellus duis"
108.79,649.59,300.44,657.56,"/F15",8.97,"aptent aliquam aptent massa in lorem dis per."
306.77,649.59,506.97,657.56,"/F15",8.97,"Lacinia dolor nisi magnis at vitae sociis proin id"
108.79,639.13,506.97,647.10,"/F15",8.97,"proin mauris facilisis magna ut cras magna. Blandit neque in a ante adipiscing cursus eu id porttitor"
108.79,628.67,507.00,636.64,"/F15",8.97,"a metus mi. Aliquet lacus natoque rhoncus fusce neque. Integer magna ut nostra ipsum convallis."
108.79,618.21,507.05,626.17,"/F15",8.97,"Euismod ipsum id amet lacus imperdiet suscipit tempus parturient risus nunc quis curae vivamus"
108.79,607.75,216.71,615.71,"/F15",8.97,"est lobortis facilisis a per."
224.26,607.75,365.89,615.71,"/F15",8.97,"Rhoncus porta adipiscing quisque."
373.43,607.75,427.39,615.71,"/F15",8.97,"Feugiat velit."
434.94,607.75,506.99,615.71,"/F15",8.97,"Quisque felis sem"
108.79,597.29,507.00,605.25,"/F15",8.97,"neque nulla libero ut justo scelerisque. Natoque proin eget sociis. Feugiat dolor sem proin nibh mus"
108.79,586.83,245.00,594.79,"/F15",8.97,"aliquam eu fringilla arcu non vel."
250.69,586.83,507.02,594.79,"/F15",8.97,"Euismod purus nisl potenti magna ac tincidunt fusce ac neque"
108.79,576.37,506.97,584.33,"/F15",8.97,"dolor varius ve. Cubilia etiam ante est purus fames conubia porttitor pede convallis. Feugiat lacus"
108.79,565.91,293.39,573.87,"/F15",8.97,"enim gravida ac vehicula sem ac tincidunt a."
299.49,565.91,506.98,573.87,"/F15",8.97,"Vivamus vitae odio suspendisse dapibus sem taciti"
108.79,555.45,221.26,563.41,"/F15",8.97,"maecenas parturient primis."
68.08,523.82,284.84,531.78,"/F19",8.97,"ALIQUAM DOLOR LOREM HABITANT AT"
74.10,513.36,278.85,521.32,"/F19",8.97,"TACITI NAM ODIO DIAM HENDRERIT."
63.96,481.04,298.84,489.89,"/F8",9.96,"Cubilia donec parturient ullamcorper. Sodales justo."
54.00,469.09,117.17,477.94,"/F8",9.96,"Integer fames."
127.55,469.09,226.12,477.94,"/F8",9.96,"Aliquam nulla ut leo."
236.50,469.09,298.88,477.94,"/F8",9.96,"Aliquam class"
54.00,457.13,298.86,465.98,"/F8",9.96,"quis a class natoque rhoncus pede est. Euismod proin"
54.00,445.18,298.81,454.03,"/F8",9.96,"duis pulvinar luctus rhoncus posuere suscipit. Pretium"
54.00,433.22,298.82,442.07,"/F8",9.96,"morbi ac varius ultricies dolor est diam. Integer felis eges-"
54.00,421.27,298.84,430.12,"/F8",9.96,"tas ante fusce ut elit quis nulla. Rhoncus curae in dic-"
54.00,409.31,298.83,418.16,"/F8",9.96,"tumst quisque gravida. Euismod neque. Aliquet purus"
54.00,397.36,298.86,406.21,"/F8",9.96,"quis. Laoreet porta. Rhoncus magna morbi scelerisque."
54.00,385.40,298.84,394.25,"/F8",9.96,"Dapibus risus in lacus venenatis. Dapibus dolor diam"
54.00,373.45,298.83,382.30,"/F8",9.96,"rhoncus velit dolor euismod nullam eros pellentesque."
54.00,361.49,298.84,370.34,"/F8",9.96,"Viverra ipsum nibh pretium lorem urna suspendisse. Na-"
54.00,349.54,298.88,358.38,"/F8",9.96,"toque porta et tempus tincidunt ad enim. Commodo"
54.00,337.58,298.86,346.43,"/F8",9.96,"neque diam a fames ve proin turpis mattis magna mollis."
54.00,325.63,298.88,334.47,"/F8",9.96,"Potenti fames odio hymenaeos ad felis ad dignissim a."
54.00,313.67,298.86,322.52,"/F8",9.96,"Quisque lorem cras. Gravida fusce. Laoreet proin odio"
54.00,301.72,165.85,310.56,"/F8",9.96,"convallis litora mauris eu."
63.96,283.77,298.86,292.62,"/F8",9.96,"Sodales magna. Euismod dolor velit turpis eleifend"
54.00,271.82,298.82,280.66,"/F8",9.96,"fringilla id ut pede. Potenti risus felis. Laoreet class"
54.00,259.86,298.83,268.71,"/F8",9.96,"arcu augue ultricies nec viverra ve. Rhoncus porta id nisi"
54.00,247.91,298.82,256.75,"/F8",9.96,"placerat imperdiet turpis dictumst nisl congue. Laoreet"
54.00,235.95,298.86,244.80,"/F8",9.96,"fusce eget sem ad bibendum cum pellentesque nullam."
54.00,224.00,298.84,232.84,"/F8",9.96,"Integer fusce id mi leo orci potenti cursus morbi. Laoreet"
54.00,212.04,298.84,220.89,"/F8",9.96,"neque ante rhoncus. Gravida metus. Aliquam risus. In-"
54.00,200.09,298.88,208.93,"/F8",9.96,"teger massa. Rhoncus neque. Conubia nulla enim est"
54.00,188.13,298.84,196.98,"/F8",9.96,"eleifend iaculis diam. Integer dolor. Laoreet neque dui"
54.00,176.18,298.84,185.02,"/F8",9.96,"urna leo porta tempus class parturient ullamcorper tem-"
54.00,164.22,298.85,173.07,"/F8",9.96,"por ve. Viverra fames nisi rhoncus congue nulla felis po-"
54.00,152.27,298.81,161.11,"/F8",9.96,"tenti. Blandit justo nisl. Viverra justo egestas eu dui at"
54.00,140.31,298.83,149.16,"/F8",9.96,"velit cras faucibus. Euismod porta integer habitant sol-"
54.00,128.36,298.82,137.20,"/F8",9.96,"licitudin posuere rutrum erat leo cursus. Iaculis curae."
54.00,116.40,243.31,125.25,"/F8",9.96,"Posuere lacus nunc porta. Feugiat velit dis."
337.94,523.82,541.03,531.78,"/F19",8.97,"Iaculis porta ante nunc lobortis urna quam."
326.98,492.25,427.54,501.10,"/F8",9.96,"Nonummy fames mus."
438.27,492.25,561.90,501.10,"/F8",9.96,"Integer morbi at hendrerit."
317.01,480.30,561.83,489.14,"/F8",9.96,"Dapibus proin fusce. Lacinia nulla elit phasellus at tel-"
317.01,468.34,561.84,477.19,"/F8",9.96,"lus pretium diam hac neque. Aliquet justo velit porta"
317.01,456.39,561.82,465.23,"/F8",9.96,"sed nunc est sociis ut ipsum tincidunt tortor orci varius"
317.01,444.43,561.87,453.28,"/F8",9.96,"montes fames. Commodo netus parturient facilisi nunc"
317.01,432.48,561.86,441.32,"/F8",9.96,"sociis ac pede lectus vestibulum nascetur quam eros ne-"
317.01,420.52,561.85,429.37,"/F8",9.96,"tus massa vivamus. Iaculis netus non nisl parturient."
317.01,408.57,561.81,417.41,"/F8",9.96,"Potenti velit nisi mi hendrerit eget nunc vestibulum non."
317.01,396.61,561.91,405.46,"/F8",9.96,"Euismod fames. Pretium magna class quam non ante"
317.01,384.66,561.86,393.50,"/F8",9.96,"fusce netus consequat sem cum id. Potenti vitae augue"
317.01,372.70,561.89,381.55,"/F8",9.96,"lorem aenean. Nonummy fames eu velit porta iaculis"
317.01,360.75,561.85,369.59,"/F8",9.96,"ac cum ullamcorper integer scelerisque orci ante conubia"
317.01,348.79,561.81,357.64,"/F8",9.96,"tristique. Dapibus justo elit. Viverra magna in nisl facili-"
317.01,336.84,561.82,345.68,"/F8",9.96,"sis senectus placerat sollicitudin. Cubilia massa et sapien"
317.01,324.88,561.85,333.73,"/F8",9.96,"elementum risus eu penatibus nonummy. Aliquam justo."
317.01,312.93,561.86,321.77,"/F8",9.96,"Gravida massa non ipsum vestibulum facilisi fames hy-"
317.01,300.97,561.84,309.82,"/F8",9.96,"menaeos in porttitor curabitur porta at cursus. Blandit"
317.01,289.01,561.84,297.86,"/F8",9.96,"justo cum duis enim proin. Gravida purus et tortor. In-"
317.01,277.06,561.89,285.91,"/F8",9.96,"teger porta ve congue consectetuer est magna posuere."
317.01,265.10,561.85,273.95,"/F8",9.96,"Blandit etiam eu risus consectetuer elementum montes."
317.01,253.15,561.85,262.00,"/F8",9.96,"Quisque nulla eu lorem massa elit venenatis ad phasellus"
317.01,241.19,473.95,250.04,"/F8",9.96,"quis non nec mi orci justo porttitor."
326.98,224.00,561.89,232.84,"/F8",9.96,"Integer purus quam condimentum ut aenean rhoncus"
317.01,212.04,561.83,220.89,"/F8",9.96,"feugiat quis at justo ad sit fringilla orci. Integer netus ad"
317.01,200.09,561.84,208.93,"/F8",9.96,"felis dis erat euismod phasellus rutrum. Gravida dolor"
317.01,188.13,561.87,196.98,"/F8",9.96,"eni quam commodo. Iaculis velit. Sodales velit id massa"
317.01,176.18,561.88,185.02,"/F8",9.96,"mollis auctor est pede cum nec in. Egestas lacus. Com-"
317.01,164.22,561.84,173.07,"/F8",9.96,"modo nulla vitae facilisis sociis phasellus. Sodales risus"
317.01,152.27,561.88,161.11,"/F8",9.96,"erat a nunc lacus malesuada vulputate. Nonummy morbi"
317.01,140.31,561.83,149.16,"/F8",9.96,"nulla potenti vulputate non habitant vivamus odio orci."
317.01,128.36,561.84,137.20,"/F8",9.96,"Feugiat vitae nibh blandit neque dis sapien a vehicula"
317.01,116.40,561.85,125.25,"/F8",9.96,"sit nisi. Pretium purus ac montes senectus euismod pu-"
