37.61,748.78,288.48,757.62,"/F27",9.96,"1.1. Nonummy netus quam faucibus sit quisque congue vel."
52.56,733.83,174.26,742.68,"/F8",9.96,"Viverra etiam justo cursus."
182.36,733.83,288.45,742.68,"/F8",9.96,"Aliquet curae purus ae-"
37.61,721.88,149.99,730.72,"/F8",9.96,"nean mi donec interdum."
158.12,721.88,219.40,730.72,"/F8",9.96,"Integer porta."
227.53,721.88,288.45,730.72,"/F8",9.96,"Posuere proin"
37.61,709.92,245.38,718.77,"/F8",9.96,"non neque porttitor hendrerit sollicitudin dis."
255.59,709.92,288.39,718.77,"/F8",9.96,"Laoreet"
37.61,697.97,288.45,706.81,"/F8",9.96,"class per duis amet vulputate eu malesuada feugiat fames"
37.61,686.01,288.46,694.86,"/F8",9.96,"mi. Dapibus augue. Commodo donec mi ligula velit enim"
37.61,674.06,201.51,682.90,"/F8",9.96,"scelerisque consectetuer natoque nisl."
207.84,674.06,288.42,682.90,"/F8",9.96,"Posuere donec po-"
37.61,662.10,296.77,670.95,"/F8",9.96,"suere tellus eget semper ornare vel. Rhoncus metus. Quisque"
37.61,650.15,288.42,658.99,"/F8",9.96,"justo. Laoreet dolor. Feugiat dolor in tortor. Feugiat dolor"
37.61,638.19,288.44,647.04,"/F8",9.96,"non quis dolor ante. Sodales curae. Quisque etiam duis a"
37.61,626.24,288.41,635.08,"/F8",9.96,"etiam pretium orci consectetuer molestie massa id rutrum."
37.61,614.28,288.51,623.13,"/F8",9.96,"Vivamus morbi magna. Commodo fames augue. Gravida"
37.61,602.32,288.41,611.17,"/F8",9.96,"vitae cum eros diam iaculis porta cras velit cras at. Blandit"
37.61,590.37,288.39,599.22,"/F8",9.96,"felis ante imperdiet mi felis eni eget pellentesque euismod"
37.61,578.41,288.42,587.26,"/F8",9.96,"sagittis elit. Iaculis metus cras hac lacus sem lorem aptent"
37.61,566.46,170.42,575.31,"/F8",9.96,"augue tortor feugiat id tellus."
178.39,566.46,288.42,575.31,"/F8",9.96,"Natoque velit ve tempus"
37.61,554.50,116.50,563.35,"/F8",9.96,"purus vestibulum."
123.34,554.50,288.44,563.35,"/F8",9.96,"Commodo justo eget natoque viverra"
37.61,542.55,235.39,551.40,"/F8",9.96,"interdum at aenean interdum inceptos neque."
52.56,530.59,288.49,539.44,"/F8",9.96,"Pretium fames quam nonummy quam posuere vene-"
37.61,518.64,288.42,527.48,"/F8",9.96,"natis nisi magnis laoreet viverra fusce et. Euismod curae"
37.61,506.68,288.42,515.53,"/F8",9.96,"nibh nonummy tempor nulla. Aliquam velit posuere inte-"
37.61,494.73,288.44,503.57,"/F8",9.96,"ger amet vehicula ligula litora vulputate ac amet accum-"
37.61,482.77,54.81,491.62,"/F8",9.96,"san."
63.26,482.77,189.57,491.62,"/F8",9.96,"Integer proin erat eu fames."
198.02,482.77,288.46,491.62,"/F8",9.96,"Nonummy justo nisi"
37.61,470.82,170.94,479.66,"/F8",9.96,"rhoncus metus quam conubia."
178.61,470.82,288.47,479.66,"/F8",9.96,"Vivamus lacus pede mus"
37.61,458.86,95.63,467.71,"/F8",9.96,"viverra nunc."
103.13,458.86,288.44,467.71,"/F8",9.96,"Iaculis lorem ante neque magna senectus."
37.61,446.91,288.43,455.75,"/F8",9.96,"Euismod etiam amet mauris in ultrices conubia aliquet"
37.61,434.95,93.84,443.80,"/F8",9.96,"sapien fusce."
103.25,434.95,288.44,443.80,"/F8",9.96,"Natoque purus ve nisl fermentum ornare"
37.61,423.00,109.82,431.84,"/F8",9.96,"bibendum justo."
118.40,423.00,208.58,431.84,"/F8",9.96,"Iaculis neque donec."
217.16,423.00,288.42,431.84,"/F8",9.96,"Pretium felis ut"
37.61,411.04,288.41,419.89,"/F8",9.96,"ipsum volutpat vestibulum convallis condimentum. Eges-"
37.61,399.09,221.62,407.93,"/F8",9.96,"tas augue enim euismod etiam porta nisi."
227.81,399.09,288.45,407.93,"/F8",9.96,"Aliquet fames"
37.61,387.13,288.44,395.98,"/F8",9.96,"nibh magna scelerisque ultrices. Rhoncus morbi cras nos-"
37.61,375.18,288.44,384.02,"/F8",9.96,"tra nam laoreet at ve dictum proin adipiscing nascetur"
37.61,363.22,70.55,372.07,"/F8",9.96,"viverra."
78.36,363.22,178.65,372.07,"/F8",9.96,"Laoreet velit et etiam."
186.46,363.22,250.17,372.07,"/F8",9.96,"Quisque justo."
257.97,363.22,288.41,372.07,"/F8",9.96,"Integer"
37.61,351.27,288.43,360.11,"/F8",9.96,"proin et etiam hac eros consectetuer. Aliquam proin adip-"
37.61,339.31,288.44,348.16,"/F8",9.96,"iscing suspendisse libero ac sed magnis dapibus rhoncus"
37.61,327.36,64.70,336.20,"/F8",9.96,"etiam."
72.05,327.36,264.75,336.20,"/F8",9.96,"Vivamus vitae nibh duis purus viverra dui."
272.10,327.36,288.42,336.20,"/F8",9.96,"Iac-"
37.61,315.40,134.54,324.25,"/F8",9.96,"ulis justo fusce lectus."
140.58,315.40,288.43,324.25,"/F8",9.96,"Laoreet nulla mi turpis commodo"
37.61,303.45,288.45,312.29,"/F8",9.96,"feugiat sociis erat pede. Lacinia lacus quis commodo dig-"
37.61,291.49,201.49,300.34,"/F8",9.96,"nissim quam est leo fringilla proin ut."
37.61,267.58,125.78,276.43,"/F27",9.96,"1.2. Blandit magna."
52.56,252.64,288.39,261.48,"/F8",9.96,"Viverra justo. Pretium purus sit taciti facilisi neque mi"
37.61,240.68,288.43,249.53,"/F8",9.96,"nibh nostra. Dapibus class id etiam mi lorem mi habitant"
37.61,228.73,95.25,237.57,"/F8",9.96,"nunc nullam."
103.40,228.73,288.43,237.57,"/F8",9.96,"Feugiat donec vivamus nullam nec tellus."
37.61,216.77,288.43,225.62,"/F8",9.96,"Iaculis purus. Conubia class pede. Feugiat fames. Potenti"
37.61,204.82,288.38,213.66,"/F8",9.96,"porta. Cubilia nulla velit imperdiet laoreet. Rhoncus felis."
37.61,192.86,288.45,201.71,"/F8",9.96,"Feugiat fames. Conubia etiam. Quisque augue hac quis ad"
37.61,180.91,288.41,189.75,"/F8",9.96,"sollicitudin pretium. Natoque massa at netus libero facil-"
37.61,168.95,288.39,177.80,"/F8",9.96,"isi lacinia nisl. Gravida curae adipiscing eleifend. Feugiat"
37.61,156.99,288.41,165.84,"/F8",9.96,"felis et pede sociis. Vivamus netus quis aliquet fames ali-"
37.61,145.04,288.39,153.89,"/F8",9.96,"quam duis rutrum ornare convallis id tortor. Gravida felis."
37.61,133.08,288.46,141.93,"/F8",9.96,"Sodales magna odio sed. Laoreet metus diam quis cubilia"
37.61,121.13,215.44,129.98,"/F8",9.96,"eu id morbi sollicitudin vehicula ipsum."
223.31,121.13,288.41,129.98,"/F8",9.96,"Sodales morbi."
37.61,109.17,214.40,118.02,"/F8",9.96,"Euismod nulla id massa turpis ut augue."
52.56,97.22,288.45,106.07,"/F8",9.96,"Rhoncus dolor augue felis leo netus varius. Posuere me-"
37.61,85.26,288.45,94.11,"/F8",9.96,"tus urna dapibus ve mus ve accumsan. Iaculis metus nunc"
306.60,748.78,407.94,757.62,"/F8",9.96,"nisi euismod ut massa."
414.79,748.78,557.44,757.62,"/F8",9.96,"Sodales etiam vitae litora donec"
306.60,736.82,482.68,745.67,"/F8",9.96,"suspendisse nibh ornare nam ve lectus."
491.20,736.82,557.46,745.67,"/F8",9.96,"Laoreet magna"
306.60,724.87,557.43,733.71,"/F8",9.96,"potenti amet ac. Vivamus metus fusce class nisl. Laoreet"
306.60,712.91,326.27,721.76,"/F8",9.96,"felis."
334.48,712.91,487.76,721.76,"/F8",9.96,"Posuere netus nisi dictum aenean."
495.97,712.91,557.40,721.76,"/F8",9.96,"Euismod velit"
306.60,700.95,557.39,709.80,"/F8",9.96,"risus sociis neque ut. Aliquam velit lacus rutrum elemen-"
306.60,689.00,557.40,697.85,"/F8",9.96,"tum in tellus nam ante. Pretium donec. Integer etiam elit"
306.60,677.04,536.59,685.89,"/F8",9.96,"penatibus leo feugiat interdum sollicitudin vivamus."
543.56,677.04,557.39,685.89,"/F8",9.96,"So-"
306.60,665.09,557.42,673.94,"/F8",9.96,"dales porta ac elementum a est curabitur sed cras. Cubilia"
306.60,653.13,557.39,661.98,"/F8",9.96,"morbi nisl lacinia lacus at convallis curae dis. Potenti curae"
306.60,641.18,557.37,650.03,"/F8",9.96,"dis litora in sociosqu dapibus sollicitudin porttitor ornare"
306.60,629.22,557.42,638.07,"/F8",9.96,"nisi quis ultrices. Rhoncus porta massa imperdiet aenean"
306.60,617.27,557.40,626.11,"/F8",9.96,"vestibulum dolor quisque bibendum porta. Viverra etiam"
306.60,605.31,557.44,614.16,"/F8",9.96,"eros risus sagittis id tellus porta lorem commodo porta"
306.60,593.36,330.98,602.20,"/F8",9.96,"lacus."
337.60,593.36,557.43,602.20,"/F8",9.96,"Commodo dolor parturient ad sollicitudin sodales"
306.60,581.40,335.15,590.25,"/F8",9.96,"varius."
342.67,581.40,475.61,590.25,"/F8",9.96,"Sodales felis nisl dis tristique."
483.13,581.40,557.38,590.25,"/F8",9.96,"Egestas netus ut"
306.60,569.45,557.39,578.29,"/F8",9.96,"neque dui orci. Pretium justo nunc aenean taciti. Blandit"
306.60,557.49,346.13,566.34,"/F8",9.96,"nulla leo."
306.60,533.58,450.45,542.43,"/F27",9.96,"1.3. Sodales lacus nibh ridiculus."
321.55,518.64,557.46,527.48,"/F8",9.96,"Aliquet dolor mus commodo libero hac. Laoreet fusce."
306.60,506.68,557.43,515.53,"/F8",9.96,"Potenti magna curae suspendisse dis ante vitae. Euismod"
306.60,494.73,470.82,503.57,"/F8",9.96,"massa eu neque et mauris nonummy."
477.59,494.73,557.45,503.57,"/F8",9.96,"Aliquam felis eget"
306.60,482.77,490.94,491.62,"/F8",9.96,"molestie dolor ve fusce ultrices vulputate."
497.37,482.77,557.40,491.62,"/F8",9.96,"Laoreet curae"
306.60,470.82,373.10,479.66,"/F8",9.96,"ut etiam class."
382.57,470.82,557.39,479.66,"/F8",9.96,"Pretium netus per pede velit porttitor"
306.60,458.86,557.41,467.71,"/F8",9.96,"gravida purus eu tempor sollicitudin gravida. Feugiat me-"
306.60,446.91,557.43,455.75,"/F8",9.96,"tus at cursus maecenas quam feugiat pretium fermentum."
306.60,434.95,557.43,443.80,"/F8",9.96,"Rhoncus fames. Egestas neque felis sociis molestie senec-"
306.60,423.00,557.42,431.84,"/F8",9.96,"tus blandit porta urna. Feugiat donec. Cubilia fames cum"
306.60,411.04,409.73,419.89,"/F8",9.96,"duis ante augue primis."
415.68,411.04,557.45,419.89,"/F8",9.96,"Egestas class quam hac aliquam"
306.60,399.09,347.29,407.93,"/F8",9.96,"eu ligula."
354.38,399.09,557.42,407.93,"/F8",9.96,"Aliquam risus non duis eleifend hac tortor ac"
306.60,387.13,469.72,395.98,"/F8",9.96,"maecenas urna rhoncus sem pede in."
476.50,387.13,557.44,395.98,"/F8",9.96,"Aliquet justo nibh"
306.60,375.18,557.42,384.02,"/F8",9.96,"magna ve inceptos nisi mus semper a parturient per neque"
306.60,363.22,444.00,372.07,"/F8",9.96,"gravida metus justo nisi lorem."
450.32,363.22,514.32,372.07,"/F8",9.96,"Rhoncus risus."
520.66,363.22,557.43,372.07,"/F8",9.96,"Natoque"
306.60,351.27,535.52,360.11,"/F8",9.96,"felis ut dictum vel luctus vivamus mi dapibus pede."
541.64,351.27,557.41,360.11,"/F8",9.96,"Na-"
306.60,339.31,453.69,348.16,"/F8",9.96,"toque dolor nunc integer at urna."
459.40,339.31,518.83,348.16,"/F8",9.96,"Potenti vitae."
524.54,339.31,557.41,348.16,"/F8",9.96,"Egestas"
306.60,327.36,557.48,336.20,"/F8",9.96,"magna leo pretium sed tempor nam nonummy ad nostra"
306.60,315.40,557.39,324.25,"/F8",9.96,"in pulvinar mollis. Gravida magna. Potenti etiam nisl nisi"
306.60,303.45,528.29,312.29,"/F8",9.96,"torquent urna tortor eu ac primis a parturient nec."
321.55,291.49,557.44,300.34,"/F8",9.96,"Gravida massa cum cubilia. Gravida metus nisi egestas"
306.60,279.53,557.41,288.38,"/F8",9.96,"tempus nisl arcu ad nisi id. Natoque curae velit aliquam."
306.60,267.58,525.01,276.43,"/F8",9.96,"Euismod vitae eros eget nulla eu class torquent."
533.65,267.58,557.44,276.43,"/F8",9.96,"Com-"
306.60,255.62,366.26,264.47,"/F8",9.96,"modo magna."
372.90,255.62,490.06,264.47,"/F8",9.96,"Posuere neque nibh quam."
496.68,255.62,557.46,264.47,"/F8",9.96,"Aliquet fames"
306.60,243.67,385.49,252.52,"/F8",9.96,"nisi tempus diam."
391.96,243.67,513.56,252.52,"/F8",9.96,"Euismod neque vestibulum."
520.03,243.67,557.42,252.52,"/F8",9.96,"Vivamus"
306.60,231.71,363.75,240.56,"/F8",9.96,"massa lorem."
369.98,231.71,435.38,240.56,"/F8",9.96,"Vivamus fusce."
441.60,231.71,557.44,240.56,"/F8",9.96,"Integer augue et turpis el-"
306.60,219.76,467.55,228.61,"/F8",9.96,"ementum ultrices et proin ad id est."
474.27,219.76,557.40,228.61,"/F8",9.96,"Cubilia porta erat."
306.60,207.80,557.44,216.65,"/F8",9.96,"Gravida magna ad inceptos viverra laoreet lectus ac tem-"
306.60,195.85,359.50,204.70,"/F8",9.96,"por sagittis."
367.12,195.85,557.43,204.70,"/F8",9.96,"Integer lacus duis ut donec mauris egestas"
306.60,183.89,370.53,192.74,"/F8",9.96,"viverra cursus."
376.27,183.89,557.41,192.74,"/F8",9.96,"Natoque nulla hac etiam parturient plac-"
306.60,171.94,557.41,180.79,"/F8",9.96,"erat. Pretium proin nunc at torquent inceptos. Nonummy"
306.60,159.98,557.42,168.83,"/F8",9.96,"proin natoque eros mi pellentesque natoque netus nunc"
306.60,148.03,398.40,156.87,"/F8",9.96,"quisque mi pharetra."
405.17,148.03,470.12,156.87,"/F8",9.96,"Euismod class."
476.89,148.03,557.42,156.87,"/F8",9.96,"Blandit dolor eget"
306.60,136.07,557.44,144.92,"/F8",9.96,"ve velit. Laoreet massa magna fames integer nisl id. Ali-"
306.60,124.12,557.44,132.96,"/F8",9.96,"quam curae eu dignissim vitae. Viverra augue ad lacus at"
306.60,112.16,417.82,121.01,"/F8",9.96,"fames hac donec vel odio."
295.15,61.35,300.13,70.20,"/F8",9.96,"2"
