52.56,748.78,288.46,757.62,"/F8",9.96,"Vivamus neque id semper morbi ullamcorper eu. Rhon-"
37.61,736.82,288.40,745.67,"/F8",9.96,"cus nulla arcu. Gravida class eu pellentesque consectetuer."
37.61,724.87,288.40,733.71,"/F8",9.96,"Quisque velit eu. Egestas morbi eni erat at morbi eleifend"
37.61,712.91,288.42,721.76,"/F8",9.96,"massa mi tortor. Blandit velit urna laoreet enim eu nulla"
37.61,700.96,218.21,709.80,"/F8",9.96,"ad porta ve ornare pellentesque nec felis."
223.95,700.96,288.41,709.80,"/F8",9.96,"Pretium neque"
37.61,689.00,82.73,697.85,"/F8",9.96,"eu primis."
92.91,689.00,288.43,697.85,"/F8",9.96,"Conubia justo ve litora dictumst ullamcor-"
37.61,677.04,54.50,685.89,"/F8",9.96,"per."
61.78,677.04,288.44,685.89,"/F8",9.96,"Lacinia massa ve urna facilisi posuere dictumst mi"
37.61,665.09,193.58,673.94,"/F8",9.96,"varius sollicitudin tincidunt morbi."
202.90,665.09,288.40,673.94,"/F8",9.96,"Iaculis ipsum amet"
37.61,653.13,145.10,661.98,"/F8",9.96,"conubia odio parturient."
152.69,653.13,288.45,661.98,"/F8",9.96,"Rhoncus netus class accumsan"
37.61,641.18,288.41,650.03,"/F8",9.96,"donec ut dictum penatibus suscipit justo nonummy tris-"
37.61,629.22,288.40,638.07,"/F8",9.96,"tique. Dapibus morbi justo nullam et interdum sed tortor"
37.61,617.27,288.46,626.11,"/F8",9.96,"taciti orci nostra. Aliquam massa amet hac ve etiam fau-"
37.61,605.31,288.39,614.16,"/F8",9.96,"cibus et cursus volutpat ullamcorper sit in. Cubilia metus"
37.61,593.36,134.09,602.20,"/F8",9.96,"at auctor id lectus in."
140.33,593.36,202.59,602.20,"/F8",9.96,"Aliquet porta."
208.83,593.36,288.41,602.20,"/F8",9.96,"Blandit augue elit"
37.61,581.40,223.13,590.25,"/F8",9.96,"orci sodales at nostra ve bibendum donec."
228.69,581.40,288.43,590.25,"/F8",9.96,"Potenti purus"
37.61,569.45,170.34,578.29,"/F8",9.96,"justo proin eget primis ac mi."
177.18,569.45,288.43,578.29,"/F8",9.96,"Feugiat lorem integer eni"
37.61,557.49,288.45,566.34,"/F8",9.96,"aenean potenti enim et. Nonummy lorem. Euismod morbi"
37.61,545.54,288.41,554.38,"/F8",9.96,"per odio ut magna hendrerit ridiculus pellentesque hac la-"
37.61,533.58,54.25,542.43,"/F8",9.96,"cus."
62.90,533.58,123.83,542.43,"/F8",9.96,"Iaculis morbi."
132.48,533.58,288.45,542.43,"/F8",9.96,"Gravida proin purus congue neque"
37.61,521.63,87.65,530.47,"/F8",9.96,"elementum."
37.61,499.21,164.52,508.06,"/F27",9.96,"2.2. Gravida proin orci ante."
52.56,485.76,288.46,494.61,"/F8",9.96,"Vivamus class ut tempor faucibus orci dis gravida at"
37.61,473.81,288.42,482.65,"/F8",9.96,"amet elit. Viverra nulla per. Iaculis dolor etiam pharetra"
37.61,461.85,50.33,470.70,"/F8",9.96,"eu."
56.37,461.85,288.43,470.70,"/F8",9.96,"Egestas dolor parturient faucibus dolor a mollis eget"
37.61,449.90,179.70,458.74,"/F8",9.96,"scelerisque aliquam fames enim."
187.51,449.90,288.43,458.74,"/F8",9.96,"Rhoncus velit ve dolor"
37.61,437.94,288.46,446.79,"/F8",9.96,"tempor ve nam aenean vehicula ullamcorper eni congue."
37.61,425.99,288.42,434.83,"/F8",9.96,"Dapibus fames ac velit tristique lacinia turpis diam ac"
37.61,414.03,144.40,422.88,"/F8",9.96,"tortor hendrerit sagittis."
150.31,414.03,288.38,422.88,"/F8",9.96,"Quisque morbi velit feugiat na-"
37.61,402.08,288.45,410.92,"/F8",9.96,"toque convallis magnis ve in. Integer massa nam orci pel-"
37.61,390.12,186.82,398.97,"/F8",9.96,"lentesque interdum proin aliquet."
196.06,390.12,288.39,398.97,"/F8",9.96,"Quisque ipsum nulla"
37.61,378.17,288.45,387.01,"/F8",9.96,"nascetur magna natoque iaculis accumsan auctor vestibu-"
37.61,366.21,288.46,375.06,"/F8",9.96,"lum. Blandit nulla ad nisl hac. Commodo etiam. Laoreet"
37.61,354.26,288.47,363.10,"/F8",9.96,"massa curae amet commodo at nibh sit integer sagittis"
37.61,342.30,288.43,351.15,"/F8",9.96,"mollis amet at. Natoque vitae sed. Iaculis neque eni dig-"
37.61,330.34,136.02,339.19,"/F8",9.96,"nissim nunc hendrerit."
142.28,330.34,288.43,339.19,"/F8",9.96,"Egestas fames vivamus sed et in-"
37.61,318.39,61.96,327.24,"/F8",9.96,"teger."
70.99,318.39,139.85,327.24,"/F8",9.96,"Blandit magna."
148.89,318.39,288.46,327.24,"/F8",9.96,"Lacinia lorem ve a nostra nisi."
37.61,306.43,288.41,315.28,"/F8",9.96,"Aliquet vitae amet in nec quam imperdiet metus at sit in"
37.61,294.48,288.44,303.33,"/F8",9.96,"a erat. Sodales lorem ante. Sodales vitae id. Posuere dolor"
37.61,282.52,133.04,291.37,"/F8",9.96,"et lorem netus morbi."
138.78,282.52,288.43,291.37,"/F8",9.96,"Pretium nulla ipsum auctor quam"
37.61,270.57,264.63,279.41,"/F8",9.96,"erat ipsum sodales gravida amet nunc eni ultrices a."
52.56,258.61,288.51,267.46,"/F8",9.96,"Sodales magna neque. Commodo massa et lectus com-"
37.61,246.66,288.44,255.51,"/F8",9.96,"modo eni litora posuere dapibus. Potenti dolor. Rhoncus"
37.61,234.70,141.79,243.55,"/F8",9.96,"felis urna dui ut curae."
149.84,234.70,288.39,243.55,"/F8",9.96,"Iaculis etiam in turpis ultricies"
37.61,222.75,175.59,231.60,"/F8",9.96,"vestibulum euismod enim eget."
183.24,222.75,288.41,231.60,"/F8",9.96,"Iaculis purus parturient"
37.61,210.79,288.46,219.64,"/F8",9.96,"eros porta elementum euismod semper sed interdum so-"
37.61,198.84,288.43,207.68,"/F8",9.96,"dales congue vel. Natoque lacus leo eni vel dis ut rutrum"
37.61,186.88,118.81,195.73,"/F8",9.96,"leo odio at neque."
127.02,186.88,229.45,195.73,"/F8",9.96,"Laoreet donec sit eget."
237.66,186.88,288.45,195.73,"/F8",9.96,"Quisque la-"
37.61,174.93,288.44,183.77,"/F8",9.96,"cus gravida eget id molestie ante eleifend nulla a egestas"
37.61,162.97,288.41,171.82,"/F8",9.96,"sociis cursus vivamus nisl interdum quam. Pretium dolor"
37.61,151.02,288.42,159.86,"/F8",9.96,"nibh nulla lorem platea condimentum risus. Cubilia curae"
37.61,139.06,288.45,147.91,"/F8",9.96,"massa. Feugiat neque nam erat maecenas netus imperdiet"
37.61,127.11,288.49,135.95,"/F8",9.96,"condimentum sem ut magna maecenas. Laoreet donec sem"
37.61,115.15,267.34,124.00,"/F8",9.96,"commodo senectus egestas lacinia ligula ante purus."
273.67,115.15,288.46,124.00,"/F8",9.96,"Po-"
37.61,103.20,288.42,112.04,"/F8",9.96,"tenti etiam hac quis pede nam class adipiscing sagittis au-"
37.61,91.24,55.31,100.09,"/F8",9.96,"gue."
63.26,91.24,288.40,100.09,"/F8",9.96,"Blandit metus parturient senectus duis quis purus"
37.61,79.29,143.48,88.13,"/F8",9.96,"nisi litora eu accumsan."
150.79,79.29,216.67,88.13,"/F8",9.96,"Laoreet metus."
223.98,79.29,288.45,88.13,"/F8",9.96,"Dapibus etiam"
306.60,748.78,557.39,757.62,"/F8",9.96,"parturient facilisi. Potenti class. Vivamus massa in litora"
306.60,736.82,467.30,745.67,"/F8",9.96,"dui blandit placerat ipsum convallis."
473.57,736.82,557.42,745.67,"/F8",9.96,"Laoreet curae urna"
306.60,724.87,371.63,733.71,"/F8",9.96,"viverra id orci."
377.72,724.87,557.39,733.71,"/F8",9.96,"Potenti lacus etiam mollis nulla at litora"
306.60,712.91,495.36,721.76,"/F8",9.96,"dictum senectus parturient. Natoque lacus."
321.55,700.95,557.46,709.80,"/F8",9.96,"Natoque magna dolor sagittis diam quisque sapien ip-"
306.60,689.00,458.06,697.85,"/F8",9.96,"sum erat potenti primis leo quam."
464.17,689.00,557.45,697.85,"/F8",9.96,"Sodales magna etiam"
306.60,677.04,557.44,685.89,"/F8",9.96,"cum dis ut consectetuer potenti magna. Egestas augue leo"
306.60,665.09,557.43,673.94,"/F8",9.96,"dapibus. Posuere purus quam ante curae sodales. Feugiat"
306.60,653.13,557.41,661.98,"/F8",9.96,"proin. Rhoncus magna velit facilisi parturient montes. Ia-"
306.60,641.18,350.36,650.02,"/F8",9.96,"culis felis."
358.90,641.18,557.43,650.02,"/F8",9.96,"Dapibus lorem adipiscing ac accumsan pede"
306.60,629.22,421.33,638.07,"/F8",9.96,"libero pede blandit class."
432.00,629.22,557.42,638.07,"/F8",9.96,"Quisque fusce mus eget vel"
306.60,617.27,557.39,626.11,"/F8",9.96,"justo laoreet gravida tincidunt quis leo tempor a. Pretium"
306.60,605.31,333.69,614.16,"/F8",9.96,"etiam."
341.43,605.31,557.39,614.16,"/F8",9.96,"Lacinia velit fames tellus consectetuer imperdiet"
306.60,593.36,557.39,602.20,"/F8",9.96,"etiam tincidunt. Pretium felis cum donec quisque conubia"
306.60,581.40,407.95,590.25,"/F8",9.96,"torquent nullam curae."
415.47,581.40,557.44,590.25,"/F8",9.96,"Nonummy fames metus quis in-"
306.60,569.45,557.43,578.29,"/F8",9.96,"terdum egestas potenti cras senectus at ipsum condimen-"
306.60,557.49,557.43,566.34,"/F8",9.96,"tum nec. Commodo purus ve ridiculus neque dolor sociis"
306.60,545.54,557.44,554.38,"/F8",9.96,"magna sodales curae lacinia rutrum fermentum dignissim"
306.60,533.58,557.45,542.43,"/F8",9.96,"adipiscing posuere cras. Conubia class non habitasse mag-"
306.60,521.63,557.41,530.47,"/F8",9.96,"nis lobortis. Dapibus lacus dolor a iaculis taciti sem par-"
306.60,509.67,557.42,518.52,"/F8",9.96,"turient mauris eros condimentum non eu. Aliquam morbi."
306.60,497.72,557.41,506.56,"/F8",9.96,"Aliquet felis augue vivamus laoreet nullam nec leo tris-"
306.60,485.76,331.19,494.61,"/F8",9.96,"tique."
336.97,485.76,557.37,494.61,"/F8",9.96,"Dapibus fusce vitae tortor potenti phasellus inter-"
306.60,473.81,557.46,482.65,"/F8",9.96,"dum nulla. Laoreet massa sem magnis lacinia id. Rhoncus"
306.60,461.85,524.75,470.70,"/F8",9.96,"dolor. Integer felis sem erat ve proin tellus at per."
306.60,433.46,398.30,442.30,"/F17",9.96,"3. Gravida ipsum."
321.55,414.03,557.40,422.88,"/F8",9.96,"Dapibus curae integer aptent at sit nisl. Pretium etiam"
306.60,402.08,557.38,410.92,"/F8",9.96,"cras. Pretium velit nulla quam suspendisse. Egestas velit."
306.60,390.12,416.22,398.97,"/F8",9.96,"Laoreet risus erat litora."
424.30,390.12,501.58,398.97,"/F8",9.96,"Commodo augue."
509.66,390.12,557.45,398.97,"/F8",9.96,"Potenti ip-"
306.60,378.17,437.12,387.01,"/F8",9.96,"sum class posuere consequat."
445.68,378.17,557.46,387.01,"/F8",9.96,"Integer magna adipiscing"
306.60,366.21,354.38,375.06,"/F8",9.96,"quam felis."
361.00,366.21,528.48,375.06,"/F8",9.96,"Egestas justo ad pellentesque blandit."
535.10,366.21,557.40,375.06,"/F8",9.96,"Euis-"
306.60,354.25,401.70,363.10,"/F8",9.96,"mod massa est amet."
409.51,354.25,557.45,363.10,"/F8",9.96,"Gravida ipsum amet ultricies vo-"
306.60,342.30,335.89,351.15,"/F8",9.96,"lutpat."
344.45,342.30,428.26,351.15,"/F8",9.96,"Conubia curae leo."
436.83,342.30,557.39,351.15,"/F8",9.96,"Aliquet morbi velit facilisi."
306.60,330.34,557.42,339.19,"/F8",9.96,"Blandit massa ad phasellus nisi dignissim. Laoreet vitae."
306.60,318.39,557.44,327.24,"/F8",9.96,"Nonummy curae est rhoncus id ridiculus amet diam pul-"
306.60,306.43,514.69,315.28,"/F8",9.96,"vinar tempor orci pellentesque et lorem luctus."
521.18,306.43,557.41,315.28,"/F8",9.96,"Conubia"
306.60,294.48,557.41,303.32,"/F8",9.96,"fusce leo diam felis scelerisque pharetra vitae ac a primis"
306.60,282.52,557.43,291.37,"/F8",9.96,"diam. Viverra velit. Commodo class arcu convallis vehic-"
306.60,270.57,557.45,279.41,"/F8",9.96,"ula magna nulla taciti nibh ut quis leo. Nonummy magna"
306.60,258.61,557.42,267.46,"/F8",9.96,"in felis urna. Conubia nulla. Dapibus donec ad neque sed"
306.60,246.66,522.12,255.50,"/F8",9.96,"enim id magna dictum sollicitudin facilisis augue."
321.55,234.70,453.62,243.55,"/F8",9.96,"Feugiat vitae at lorem sociis."
462.77,234.70,532.00,243.55,"/F8",9.96,"Rhoncus etiam."
541.14,234.70,557.45,243.55,"/F8",9.96,"Ali-"
306.60,222.75,557.41,231.59,"/F8",9.96,"quet neque sem dapibus interdum in proin tempus neque"
306.60,210.79,426.53,219.64,"/F8",9.96,"leo urna vestibulum litora."
435.23,210.79,557.44,219.64,"/F8",9.96,"Nonummy curae massa elit"
306.60,198.84,557.41,207.68,"/F8",9.96,"suscipit eu urna ac urna scelerisque quisque non sociis."
306.60,186.88,440.50,195.73,"/F8",9.96,"Lacinia curae aliquet rhoncus."
447.80,186.88,557.45,195.73,"/F8",9.96,"Conubia lorem augue fe-"
306.60,174.93,557.40,183.77,"/F8",9.96,"lis mattis parturient consectetuer dapibus felis non hac"
306.60,162.97,557.39,171.82,"/F8",9.96,"leo vel pellentesque. Pretium fames ac ridiculus morbi ut"
306.60,151.02,557.41,159.86,"/F8",9.96,"rutrum senectus convallis ad. Natoque etiam et netus et."
306.60,139.06,557.44,147.91,"/F8",9.96,"Posuere porta ad. Feugiat massa elit ullamcorper sodales"
306.60,127.11,557.44,135.95,"/F8",9.96,"per id nunc commodo. Viverra metus. Feugiat proin diam"
306.60,115.15,343.92,124.00,"/F8",9.96,"aliquam."
352.19,115.15,525.75,124.00,"/F8",9.96,"Aliquet neque quis sed hymenaeos leo."
534.02,115.15,557.44,124.00,"/F8",9.96,"Eges-"
306.60,103.20,557.42,112.04,"/F8",9.96,"tas felis nec justo vitae nec cras urna interdum vivamus"
306.60,91.24,491.20,100.09,"/F8",9.96,"egestas habitasse diam vel ante dictumst."
498.22,91.24,557.43,100.09,"/F8",9.96,"Posuere justo"
306.60,79.29,557.44,88.13,"/F8",9.96,"pede felis rhoncus. Posuere magna. Vivamus purus nunc"
295.15,61.35,300.13,70.20,"/F8",9.96,"3"
