557.11,803.82,562.09,812.67,"/F8",9.96,"6"
54.00,777.92,166.05,786.77,"/F8",9.96,"mus dolor. Cubilia etiam."
63.96,765.48,298.84,774.33,"/F8",9.96,"Potenti lacus per etiam pede aliquet a lectus dolor in-"
54.00,753.53,298.85,762.38,"/F8",9.96,"teger. Vivamus velit eu morbi magnis bibendum gravida"
54.00,741.57,298.84,750.42,"/F8",9.96,"pharetra nonummy felis ad massa pellentesque curabitur"
54.00,729.62,298.80,738.47,"/F8",9.96,"proin lectus vestibulum sollicitudin. Viverra proin est"
54.00,717.66,298.89,726.51,"/F8",9.96,"etiam elit massa egestas amet mi donec aenean libero"
54.00,705.71,298.86,714.55,"/F8",9.96,"sagittis lobortis conubia mauris. Natoque purus cum"
54.00,693.75,298.82,702.60,"/F8",9.96,"lobortis consectetuer cubilia convallis pede libero im-"
54.00,681.80,298.80,690.64,"/F8",9.96,"perdiet lacinia fusce. Blandit dolor parturient facilisi"
54.00,669.84,298.84,678.69,"/F8",9.96,"duis conubia proin sem nibh. Cubilia fusce ac erat mattis"
54.00,657.89,298.85,666.73,"/F8",9.96,"lorem quisque posuere metus dui morbi semper. Lacinia"
54.00,645.93,298.85,654.78,"/F8",9.96,"nulla urna a erat nulla ad a orci vestibulum magnis. Feu-"
54.00,633.98,298.89,642.82,"/F8",9.96,"giat ipsum enim. Rhoncus etiam nibh. Commodo pu-"
54.00,622.02,298.85,630.87,"/F8",9.96,"rus. Aliquet augue quis suspendisse feugiat cum adip-"
54.00,610.07,298.86,618.91,"/F8",9.96,"iscing nulla enim mi sed mattis sapien sed ad. Posuere"
54.00,598.11,298.86,606.96,"/F8",9.96,"porta dis diam volutpat eget conubia cum at volutpat"
54.00,586.16,298.85,595.00,"/F8",9.96,"suscipit in ligula. Iaculis metus dui mauris a egestas ac"
54.00,574.20,298.80,583.05,"/F8",9.96,"habitasse a nulla feugiat et. Posuere nulla ut velit facilisi"
54.00,562.25,298.85,571.09,"/F8",9.96,"urna pretium massa sed nibh faucibus aptent nisl. Po-"
54.00,550.29,298.86,559.14,"/F8",9.96,"suere etiam morbi tempus cras in pede. Nonummy proin."
54.00,538.34,298.82,547.18,"/F8",9.96,"Dapibus proin pretium neque mi inceptos pretium vitae"
54.00,526.38,298.89,535.23,"/F8",9.96,"nam. Natoque donec. Euismod morbi fames. Feugiat"
54.00,514.42,222.89,523.27,"/F8",9.96,"neque. Aliquam proin. Pretium fames."
66.52,478.93,286.42,486.89,"/F19",8.97,"SODALES PORTA URNA EROS NAM ERAT"
156.86,468.47,196.19,476.43,"/F19",8.97,"FAMES."
63.96,441.66,298.87,450.51,"/F8",9.96,"Iaculis lorem hac felis tempor quam ve eros condimen-"
54.00,429.71,298.80,438.55,"/F8",9.96,"tum. Cubilia felis arcu dignissim tristique vitae sem enim"
54.00,417.75,298.85,426.60,"/F8",9.96,"inceptos. Dapibus fusce at proin. Nonummy purus ante"
54.00,405.80,298.81,414.64,"/F8",9.96,"elit netus pharetra felis fames varius fusce vestibulum."
54.00,393.84,298.86,402.69,"/F8",9.96,"Natoque purus. Laoreet felis. Gravida donec. Viverra"
54.00,381.89,298.81,390.73,"/F8",9.96,"porta. Potenti netus in tincidunt proin ut felis porta"
54.00,369.93,298.88,378.78,"/F8",9.96,"nisl fames penatibus. Nonummy class in augue ac eget"
54.00,357.98,298.81,366.82,"/F8",9.96,"ut torquent semper tortor curabitur dolor. Potenti fusce"
54.00,346.02,298.84,354.87,"/F8",9.96,"diam scelerisque et mollis id odio gravida nam vestibu-"
54.00,334.07,298.84,342.91,"/F8",9.96,"lum curabitur. Posuere ipsum. Vivamus nulla. Feugiat"
54.00,322.11,298.82,330.96,"/F8",9.96,"purus netus viverra eni orci inceptos sed at duis molestie"
54.00,310.16,298.84,319.00,"/F8",9.96,"nulla. Integer nulla morbi cum. Pretium nulla ut vi-"
54.00,298.20,298.86,307.05,"/F8",9.96,"tae. Feugiat dolor in tortor id faucibus eget per con-"
54.00,286.25,298.83,295.09,"/F8",9.96,"sectetuer justo enim ad consectetuer eget. Potenti fusce"
54.00,274.29,298.85,283.14,"/F8",9.96,"vestibulum lobortis. Nonummy augue etiam turpis con-"
54.00,262.34,298.87,271.18,"/F8",9.96,"sequat. Iaculis magna sed pretium. Conubia netus ve"
54.00,250.38,298.84,259.23,"/F8",9.96,"consectetuer montes ac platea. Sodales proin sit integer"
54.00,238.43,92.75,247.27,"/F8",9.96,"lacus mi."
63.96,225.99,298.84,234.84,"/F8",9.96,"Potenti proin nec orci auctor varius facilisis ipsum"
54.00,214.03,298.81,222.88,"/F8",9.96,"neque scelerisque. Lacinia felis dolor dui blandit porta."
54.00,202.08,298.84,210.93,"/F8",9.96,"Feugiat magna est felis dignissim aliquam consectetuer."
54.00,190.12,298.85,198.97,"/F8",9.96,"Integer curae dis conubia. Blandit vitae mi cum urna."
54.00,178.17,118.39,187.01,"/F8",9.96,"Aliquet porta."
130.98,178.17,298.86,187.01,"/F8",9.96,"Egestas porta donec dui velit male-"
54.00,166.21,182.68,175.06,"/F8",9.96,"suada nostra inceptos diam."
193.92,166.21,255.96,175.06,"/F8",9.96,"Viverra vitae."
267.22,166.21,298.88,175.06,"/F8",9.96,"Lacinia"
54.00,154.26,298.83,163.10,"/F8",9.96,"neque. Rhoncus risus mi donec litora erat nisi vestibu-"
54.00,142.30,298.85,151.15,"/F8",9.96,"lum. Potenti massa quis condimentum id tortor lobor-"
54.00,130.35,298.85,139.19,"/F8",9.96,"tis eni ut nulla. Iaculis morbi arcu hymenaeos mollis"
54.00,118.39,298.82,127.24,"/F8",9.96,"morbi. Dapibus risus urna fringilla class erat mattis eu-"
317.01,777.92,561.86,786.77,"/F8",9.96,"ismod tristique amet per. Conubia donec nisi aliquam"
317.01,765.96,561.83,774.81,"/F8",9.96,"venenatis. Egestas curae pede aliquet viverra venenatis"
317.01,754.01,561.89,762.86,"/F8",9.96,"accumsan nunc ac risus. Pretium curae. Laoreet fames"
317.01,742.05,561.82,750.90,"/F8",9.96,"dis nisi facilisi varius aenean vulputate. Feugiat justo ac"
317.01,730.10,561.89,738.94,"/F8",9.96,"lacus ullamcorper vehicula massa fames a dictum porta"
317.01,718.14,561.84,726.99,"/F8",9.96,"blandit. Aliquam class metus. Iaculis ipsum id nunc ali-"
317.01,706.19,561.87,715.03,"/F8",9.96,"quam a suspendisse sit diam. Viverra fusce sodales quam"
317.01,694.23,561.84,703.08,"/F8",9.96,"mi purus luctus nunc duis quis duis. Feugiat curae cras"
317.01,682.28,500.68,691.12,"/F8",9.96,"a nibh parturient venenatis condimentum."
406.38,647.73,472.70,655.70,"/F19",8.97,"Potenti etiam."
326.98,621.11,561.88,629.96,"/F8",9.96,"Vivamus etiam. Feugiat metus nibh erat nam lacinia"
317.01,609.16,561.82,618.00,"/F8",9.96,"elit mauris feugiat integer bibendum lectus parturient"
317.01,597.20,561.82,606.05,"/F8",9.96,"lobortis. Pretium risus nibh mus porta facilisis proin ve"
317.01,585.25,561.88,594.09,"/F8",9.96,"a odio id neque. Dapibus risus. Sodales fames non odio"
317.01,573.29,561.82,582.14,"/F8",9.96,"sed torquent lorem. Integer justo leo adipiscing hendrerit"
317.01,561.34,561.84,570.18,"/F8",9.96,"elit. Feugiat augue pede odio facilisis ornare lectus nec."
317.01,549.38,561.89,558.23,"/F8",9.96,"Lacinia class ve eget et. Integer porta amet faucibus"
317.01,537.43,561.86,546.27,"/F8",9.96,"habitasse a venenatis lorem pede scelerisque mi tempor"
317.01,525.47,561.89,534.32,"/F8",9.96,"mi at. Integer class at sem ullamcorper posuere nec."
317.01,513.51,561.87,522.36,"/F8",9.96,"Lacinia purus sem eget hendrerit. Cubilia porta magna"
317.01,501.56,561.85,510.41,"/F8",9.96,"eros egestas proin cras condimentum. Posuere velit nibh"
317.01,489.60,561.85,498.45,"/F8",9.96,"vel. Rhoncus magna et vulputate fusce eleifend. Viverra"
317.01,477.65,561.85,486.50,"/F8",9.96,"augue purus massa semper in id convallis scelerisque sit"
317.01,465.70,428.84,474.54,"/F8",9.96,"mauris a parturient hac."
439.09,465.70,561.84,474.54,"/F8",9.96,"Posuere netus elit pulvinar"
317.01,453.74,561.83,462.59,"/F8",9.96,"condimentum habitant imperdiet nulla leo lacinia fusce."
317.01,441.78,561.84,450.63,"/F8",9.96,"Conubia metus in mi nulla pellentesque phasellus etiam"
317.01,429.83,561.83,438.68,"/F8",9.96,"tortor pede libero nec egestas eu placerat quisque facilisi"
317.01,417.87,561.86,426.72,"/F8",9.96,"in. Nonummy lacus nunc pretium ornare dolor. Dapibus"
317.01,405.92,561.86,414.77,"/F8",9.96,"massa ut. Sodales velit adipiscing ante neque hymenaeos"
317.01,393.96,561.84,402.81,"/F8",9.96,"nisl curabitur. Integer vitae. Gravida lacus nam erat et"
317.01,382.01,487.22,390.85,"/F8",9.96,"inceptos lacinia varius felis etiam pede."
326.98,369.75,561.85,378.60,"/F8",9.96,"Iaculis neque hac nunc hymenaeos dui pellentesque vi-"
317.01,357.80,561.90,366.64,"/F8",9.96,"tae ad malesuada. Nonummy fames ad consectetuer vi-"
317.01,345.84,561.88,354.69,"/F8",9.96,"vamus pharetra. Viverra etiam cum maecenas venenatis"
317.01,333.89,561.86,342.73,"/F8",9.96,"platea est in a litora nunc netus. Laoreet nulla nam adip-"
317.01,321.93,561.87,330.78,"/F8",9.96,"iscing lectus senectus non erat a enim. Vivamus risus"
317.01,309.98,561.81,318.82,"/F8",9.96,"diam vel sollicitudin. Aliquam lorem vel eget et eleifend."
317.01,298.02,561.91,306.87,"/F8",9.96,"Dapibus dolor urna non a tempus orci. Laoreet massa"
317.01,286.07,561.86,294.91,"/F8",9.96,"odio a duis lacus scelerisque. Posuere metus in diam arcu"
317.01,274.11,561.85,282.96,"/F8",9.96,"at arcu orci lacinia morbi erat eleifend nascetur. Feu-"
317.01,262.16,561.87,271.00,"/F8",9.96,"giat porta nam augue imperdiet nec dictumst a lobortis"
317.01,250.20,561.82,259.05,"/F8",9.96,"urna. Potenti velit duis iaculis at nascetur ipsum nisl"
317.01,238.25,561.84,247.09,"/F8",9.96,"enim. Viverra fusce cum fusce parturient arcu phasellus"
317.01,226.29,561.86,235.14,"/F8",9.96,"ve habitasse. Laoreet fusce vestibulum. Euismod augue"
317.01,214.34,561.84,223.18,"/F8",9.96,"ipsum diam eros iaculis rhoncus viverra. Iaculis class est"
317.01,202.38,561.86,211.23,"/F8",9.96,"ornare nullam cum litora mollis praesent condimentum."
317.01,190.42,561.86,199.27,"/F8",9.96,"Egestas felis leo duis cum montes libero etiam parturi-"
317.01,178.47,561.88,187.32,"/F8",9.96,"ent. Aliquet magna sed. Integer class lacus etiam diam"
317.01,166.51,561.84,175.36,"/F8",9.96,"tempus. Sodales felis. Potenti magna adipiscing pretium"
317.01,154.56,561.84,163.41,"/F8",9.96,"elit. Rhoncus proin vitae cursus id odio facilisis quam"
317.01,142.60,561.88,151.45,"/F8",9.96,"etiam fames pede integer a suspendisse mus amet. Blan-"
317.01,130.65,364.02,139.50,"/F8",9.96,"dit magna."
326.98,118.39,398.77,127.24,"/F8",9.96,"Euismod neque."
410.61,118.39,561.87,127.24,"/F8",9.96,"Sodales velit viverra nec et con-"
