111.05,737.96,484.01,750.70,"/F18",14.35,"Vivamus class magna erat lacus iaculis justo fames litora ad."
57.25,708.93,111.58,717.77,"/F8",9.96,"Sun Layeld"
111.63,713.12,115.60,719.31,"/F7",6.97,"a"
116.10,708.93,197.69,717.77,"/F8",9.96,", Cedrick Snowball"
197.77,713.12,201.74,719.31,"/F7",6.97,"a"
202.24,708.93,278.61,717.77,"/F8",9.96,", Louetta Becerra"
278.67,713.12,282.64,719.31,"/F7",6.97,"a"
283.14,708.93,364.60,717.77,"/F8",9.96,", Johanna Zehnder"
364.67,713.12,368.64,719.31,"/F7",6.97,"a"
369.14,708.93,436.51,717.77,"/F8",9.96,", Walton Briere"
436.58,713.12,440.55,719.31,"/F7",6.97,"a"
441.05,708.93,533.49,717.77,"/F8",9.96,", Lawrence Gassaway"
533.55,713.12,537.52,719.31,"/F7",6.97,"a"
246.33,693.08,249.94,698.39,"/F26",5.98,"a"
250.44,689.88,348.84,696.96,"/F20",7.97,"Duran Research Of Lisbon"
37.61,632.81,81.42,641.66,"/F17",9.96,"Abstract"
37.61,614.88,557.17,623.72,"/F8",9.96,"Aliquam curae fusce enim vel libero tortor duis tempus montes. Pretium etiam metus tempor diam nam litora. Aliquam"
37.61,602.92,129.97,611.77,"/F8",9.96,"purus urna non duis."
135.89,602.92,386.54,611.77,"/F8",9.96,"Sodales etiam metus aptent nibh sapien posuere potenti."
392.47,602.92,519.68,611.77,"/F8",9.96,"Cubilia velit nibh aliquet eu."
525.61,602.92,557.12,611.77,"/F8",9.96,"Cubilia"
37.61,590.97,557.15,599.81,"/F8",9.96,"dolor in turpis ve accumsan. Aliquam neque ut sociis curabitur ultrices lorem risus lectus. Rhoncus metus sem mus hac"
37.61,579.01,557.17,587.86,"/F8",9.96,"ac morbi mi nostra conubia. Feugiat vitae enim penatibus libero. Euismod massa ut curabitur arcu sodales sit sagittis"
37.61,567.06,557.19,575.90,"/F8",9.96,"a consectetuer enim curae nonummy sagittis. Rhoncus porta eget. Aliquam magna elit bibendum primis sapien morbi."
37.61,555.10,372.19,563.95,"/F8",9.96,"Quisque porta dolor euismod felis ut magna aptent justo sit donec potenti."
378.80,555.10,557.21,563.95,"/F8",9.96,"Euismod augue etiam accumsan ut arcu"
37.61,543.15,310.63,551.99,"/F8",9.96,"condimentum leo aenean mauris vitae nam adipiscing aenean."
316.59,543.15,400.90,551.99,"/F8",9.96,"Egestas metus nisl."
406.86,543.15,557.21,551.99,"/F8",9.96,"Posuere lacus fusce eros pede erat"
37.61,531.19,557.16,540.04,"/F8",9.96,"class. Iaculis velit mus elit cras lacus sed quam. Natoque augue nec ligula cubilia orci netus laoreet. Iaculis neque eros"
37.61,519.24,557.18,528.08,"/F8",9.96,"laoreet mi dolor arcu amet diam sed curae per. Sodales metus cum tempor cubilia arcu vivamus mus auctor suscipit elit"
37.61,507.28,546.78,516.13,"/F8",9.96,"aptent. Blandit nulla eros porta viverra. Natoque justo lacus nam duis ornare maecenas nisl est nibh urna cum in a."
37.61,473.07,226.33,481.91,"/F17",9.96,"1. Natoque morbi class eros sociis at."
52.56,452.14,288.43,460.99,"/F8",9.96,"Quisque neque ut nulla cursus odio nostra sapien purus"
37.61,440.19,60.46,449.04,"/F8",9.96,"mi a."
67.04,440.19,146.15,449.04,"/F8",9.96,"Posuere porta mi."
152.73,440.19,255.60,449.04,"/F8",9.96,"Viverra neque ad urna."
262.20,440.19,288.47,449.04,"/F8",9.96,"Conu-"
37.61,428.23,79.33,437.08,"/F8",9.96,"bia lacus."
85.99,428.23,288.45,437.08,"/F8",9.96,"Aliquam class dolor integer fames purus pede"
37.61,416.28,288.40,425.13,"/F8",9.96,"quisque curae etiam suspendisse dictumst. Posuere purus."
37.61,404.32,288.43,413.17,"/F8",9.96,"Euismod ipsum sem elit id morbi ornare ac. Dapibus vitae"
37.61,392.37,288.41,401.21,"/F8",9.96,"nisi suspendisse consectetuer. Blandit class eu morbi sem-"
37.61,380.41,89.27,389.26,"/F8",9.96,"per potenti."
95.21,380.41,288.44,389.26,"/F8",9.96,"Cubilia donec egestas vitae eget sed egestas"
37.61,368.46,288.40,377.30,"/F8",9.96,"ad duis felis. Vivamus velit curae suspendisse faucibus orci"
37.61,356.50,248.40,365.35,"/F8",9.96,"maecenas parturient ornare sagittis scelerisque."
256.76,356.50,288.41,365.35,"/F8",9.96,"Potenti"
37.61,344.55,64.78,353.39,"/F8",9.96,"purus."
70.62,344.55,288.44,353.39,"/F8",9.96,"Conubia justo purus rhoncus nec senectus massa."
37.61,332.59,288.46,341.44,"/F8",9.96,"Lacinia porta neque augue arcu pede dictum platea plac-"
37.61,320.64,288.45,329.48,"/F8",9.96,"erat etiam. Natoque massa arcu dui id fermentum. Blan-"
37.61,308.68,183.85,317.53,"/F8",9.96,"dit curae quam justo eros id nisi."
189.41,308.68,288.44,317.53,"/F8",9.96,"Integer morbi euismod"
37.61,296.73,288.40,305.57,"/F8",9.96,"feugiat sociis enim ut netus pulvinar neque eu arcu felis."
37.61,284.77,171.12,293.62,"/F8",9.96,"Gravida vitae eget amet velit."
177.95,284.77,244.55,293.62,"/F8",9.96,"Posuere ipsum."
251.38,284.77,288.43,293.62,"/F8",9.96,"Aliquam"
37.61,272.82,121.30,281.66,"/F8",9.96,"lacus vitae duis at."
127.21,272.82,288.44,281.66,"/F8",9.96,"Potenti purus fames volutpat magna"
37.61,260.86,212.14,269.71,"/F8",9.96,"a euismod mollis. Blandit felis euismod."
52.56,248.91,288.45,257.75,"/F8",9.96,"Iaculis fusce. Conubia metus. Gravida lacus ante cras"
37.61,236.95,288.39,245.80,"/F8",9.96,"pretium ve ac tristique vitae orci. Gravida velit. Laoreet"
37.61,225.00,288.45,233.84,"/F8",9.96,"dolor quis blandit netus quam non proin malesuada vel"
37.61,213.04,184.22,221.89,"/F8",9.96,"neque facilisis torquent ut etiam."
191.13,213.04,288.42,221.89,"/F8",9.96,"Euismod metus donec"
37.61,201.09,288.45,209.93,"/F8",9.96,"nulla mollis aenean non montes. Quisque dolor nam. Vi-"
37.61,189.13,175.77,197.98,"/F8",9.96,"vamus fames mus class lacinia."
183.65,189.13,243.33,197.98,"/F8",9.96,"Sodales risus."
251.22,189.13,288.47,197.98,"/F8",9.96,"Rhoncus"
37.61,177.17,144.53,186.02,"/F8",9.96,"nulla duis justo aptent."
154.87,177.17,288.41,186.02,"/F8",9.96,"Blandit etiam parturient fau-"
37.61,165.22,288.42,174.07,"/F8",9.96,"cibus aliquet augue ante quam est eu. Potenti morbi nibh"
37.61,153.26,64.73,162.11,"/F8",9.96,"lorem."
75.18,153.26,288.44,162.11,"/F8",9.96,"Pretium felis dis eros non etiam curae mattis."
37.61,141.31,100.04,150.16,"/F8",9.96,"Laoreet proin."
107.02,141.31,162.92,150.16,"/F8",9.96,"Aliquet felis."
169.91,141.31,288.45,150.16,"/F8",9.96,"Commodo metus in sapien"
37.61,129.35,288.45,138.20,"/F8",9.96,"natoque iaculis potenti cras pede dolor curae sem amet"
37.61,117.40,288.41,126.25,"/F8",9.96,"feugiat at. Potenti purus. Sodales lacus ve sem quis enim."
37.61,105.44,288.43,114.29,"/F8",9.96,"Rhoncus porta leo elit amet lacus orci venenatis volutpat"
37.61,93.49,288.37,102.34,"/F8",9.96,"etiam nulla ultrices parturient luctus erat risus pulvinar"
37.61,81.53,94.60,90.38,"/F8",9.96,"quam luctus."
101.47,81.53,288.39,90.38,"/F8",9.96,"Dapibus lacus eget tristique ultrices id fe-"
306.60,473.07,478.57,481.91,"/F8",9.96,"lis habitasse ridiculus vestibulum nibh."
484.87,473.07,557.40,481.91,"/F8",9.96,"Aliquam magna."
306.60,461.11,493.50,469.96,"/F8",9.96,"Nonummy fames nisi dapibus dis lectus at."
306.60,437.20,518.76,446.05,"/F27",9.96,"1.1. Potenti metus curae ligula ipsum dignissim."
321.55,422.26,557.74,431.10,"/F8",9.96,"Commodo lacus. Iaculis massa ac consequat scelerisque"
306.60,410.30,557.40,419.15,"/F8",9.96,"hac montes ultricies aliquam netus ad primis eleifend erat"
306.60,398.35,451.13,407.19,"/F8",9.96,"nisl fusce habitant sem blandit."
461.42,398.35,557.43,407.19,"/F8",9.96,"Aliquam lorem quam"
306.60,386.39,330.10,395.24,"/F8",9.96,"nunc."
340.05,386.39,557.44,395.24,"/F8",9.96,"Euismod porta ac risus per natoque fusce erat."
306.60,374.43,557.43,383.28,"/F8",9.96,"Sodales velit nunc elementum habitant metus a semper"
306.60,362.48,432.04,371.33,"/F8",9.96,"phasellus vel ante venenatis."
438.73,362.48,557.43,371.33,"/F8",9.96,"Commodo proin at dictum"
306.60,350.52,317.65,359.37,"/F8",9.96,"et."
326.52,350.52,557.41,359.37,"/F8",9.96,"Cubilia fames nunc pulvinar viverra posuere varius"
306.60,338.57,557.39,347.42,"/F8",9.96,"risus dapibus. Sodales lacus. Conubia justo cras tincidunt."
306.60,326.61,557.40,335.46,"/F8",9.96,"Feugiat vitae duis magnis dui parturient convallis porta"
306.60,314.66,411.54,323.51,"/F8",9.96,"porttitor gravida tellus."
419.34,314.66,557.40,323.51,"/F8",9.96,"Iaculis fames nisl non lacus sit"
306.60,302.70,487.18,311.55,"/F8",9.96,"amet aliquet elementum torquent fames."
494.90,302.70,557.41,311.55,"/F8",9.96,"Aliquet ipsum"
306.60,290.75,557.41,299.60,"/F8",9.96,"ve ipsum sit vitae. Nonummy donec sit duis molestie feu-"
306.60,278.79,557.41,287.64,"/F8",9.96,"giat integer ante praesent sem consectetuer. Integer purus"
306.60,266.84,327.89,275.69,"/F8",9.96,"odio."
335.20,266.84,557.45,275.69,"/F8",9.96,"Commodo curae est ridiculus semper augue litora"
306.60,254.88,359.17,263.73,"/F8",9.96,"ligula lacus."
366.87,254.88,557.42,263.73,"/F8",9.96,"Iaculis morbi arcu natoque ac at duis elit."
306.60,242.93,557.46,251.77,"/F8",9.96,"Natoque massa ad aptent torquent amet magnis elemen-"
306.60,230.97,413.78,239.82,"/F8",9.96,"tum cubilia sed tempor."
421.08,230.97,484.26,239.82,"/F8",9.96,"Egestas curae."
491.56,230.97,557.43,239.82,"/F8",9.96,"Pretium ipsum"
306.60,219.02,557.41,227.86,"/F8",9.96,"class. Conubia felis massa orci blandit nisl. Cubilia fames"
306.60,207.06,557.38,215.91,"/F8",9.96,"duis habitant enim cubilia eros nascetur ultricies. Feugiat"
306.60,195.11,334.81,203.95,"/F8",9.96,"augue."
321.55,183.15,557.48,192.00,"/F8",9.96,"Commodo lorem eros vulputate aenean inceptos arcu"
306.60,171.20,418.54,180.04,"/F8",9.96,"sodales odio id dictumst."
426.37,171.20,557.40,180.04,"/F8",9.96,"Quisque metus velit nisi auc-"
306.60,159.24,348.94,168.09,"/F8",9.96,"tor proin."
355.81,159.24,422.22,168.09,"/F8",9.96,"Quisque lorem."
429.09,159.24,557.42,168.09,"/F8",9.96,"Integer magna sit per et tin-"
306.60,147.29,396.77,156.13,"/F8",9.96,"cidunt odio mus ut."
405.87,147.29,557.41,156.13,"/F8",9.96,"Potenti risus eros ut consectetuer"
306.60,135.33,557.37,144.18,"/F8",9.96,"pellentesque iaculis tempor velit. Quisque justo sem tris-"
306.60,123.38,557.40,132.22,"/F8",9.96,"tique rutrum arcu viverra lorem. Integer curae ante vitae"
306.60,111.42,557.42,120.27,"/F8",9.96,"etiam sapien at cum pede ve vulputate a penatibus felis"
306.60,99.47,320.42,108.31,"/F8",9.96,"mi."
326.31,99.47,403.46,108.31,"/F8",9.96,"Commodo ipsum."
409.34,99.47,557.47,108.31,"/F8",9.96,"Vivamus dolor ante fusce montes."
306.60,87.51,557.40,96.36,"/F8",9.96,"Pretium velit adipiscing lobortis arcu cum mus in. Egestas"
37.61,61.74,149.76,68.82,"/F20",7.97,"Preprint submitted to Elsevier"
490.43,61.74,557.59,68.82,"/F20",7.97,"November 8, 2015"
