557.11,803.82,562.09,812.67,"/F8",9.96,"4"
54.00,777.92,298.85,786.77,"/F8",9.96,"diam venenatis. Sodales proin et consectetuer. Laoreet"
54.00,765.96,298.82,774.81,"/F8",9.96,"morbi sit. Quisque porta est ante elit porta porttitor"
54.00,754.01,298.84,762.86,"/F8",9.96,"vestibulum mus porta nostra varius vehicula condimen-"
54.00,742.05,109.35,750.90,"/F8",9.96,"tum ultrices."
63.96,729.62,298.84,738.47,"/F8",9.96,"Quisque vitae. Aliquam curae mus nec dui. Potenti au-"
54.00,717.66,298.85,726.51,"/F8",9.96,"gue nec quam cursus dapibus. Euismod donec in fringilla"
54.00,705.71,298.88,714.55,"/F8",9.96,"ante orci. Commodo netus. Conubia felis odio aliquam"
54.00,693.75,298.84,702.60,"/F8",9.96,"eu ornare vehicula donec pellentesque. Aliquam ipsum"
54.00,681.80,298.87,690.64,"/F8",9.96,"proin etiam congue vel tempor a faucibus sit ac sodales"
54.00,669.84,298.83,678.69,"/F8",9.96,"amet a nulla. Aliquet nulla nec interdum consectetuer"
54.00,657.89,298.82,666.73,"/F8",9.96,"laoreet ridiculus tempor praesent augue consectetuer dic-"
54.00,645.93,298.85,654.78,"/F8",9.96,"tumst. Commodo neque eros convallis torquent tellus"
54.00,633.98,298.88,642.82,"/F8",9.96,"vestibulum. Commodo neque massa facilisis malesuada"
54.00,622.02,298.83,630.87,"/F8",9.96,"adipiscing nunc lacus sagittis nisi erat fringilla. Non-"
54.00,610.07,298.89,618.91,"/F8",9.96,"ummy etiam. Posuere metus ve quam dolor hymenaeos"
54.00,598.11,298.88,606.96,"/F8",9.96,"dignissim parturient amet magna ac. Euismod metus"
54.00,586.16,298.87,595.00,"/F8",9.96,"parturient elit vitae massa. Commodo proin amet mus"
54.00,574.20,298.85,583.05,"/F8",9.96,"diam vehicula lectus eros. Integer vitae fusce egestas so-"
54.00,562.25,298.84,571.09,"/F8",9.96,"dales malesuada tempor felis inceptos. Integer netus. In-"
54.00,550.29,298.83,559.14,"/F8",9.96,"teger etiam sed taciti arcu ad vel pede. Cubilia netus ut"
54.00,538.34,298.86,547.18,"/F8",9.96,"augue varius suspendisse dolor. Sodales class. Conubia"
54.00,526.38,298.85,535.23,"/F8",9.96,"fusce. Lacinia donec. Gravida class adipiscing nascetur"
54.00,514.42,70.57,523.27,"/F8",9.96,"elit."
71.87,478.93,281.06,486.89,"/F19",8.97,"POSUERE DOLOR EROS VEL A MAGNIS"
138.83,468.47,214.20,476.43,"/F19",8.97,"FERMENTUM."
63.96,441.66,298.82,450.51,"/F8",9.96,"Cubilia felis elit ad sed id. Dapibus risus etiam cursus"
54.00,429.71,298.82,438.55,"/F8",9.96,"torquent. Potenti netus nibh ante lorem felis. Nonummy"
54.00,417.75,298.84,426.60,"/F8",9.96,"massa velit placerat dolor pharetra mi fusce varius nec."
54.00,405.80,298.84,414.64,"/F8",9.96,"Aliquet class et dui ante odio id massa dignissim. Iaculis"
54.00,393.84,298.86,402.69,"/F8",9.96,"porta vitae conubia nec ve. Feugiat augue. Dapibus me-"
54.00,381.89,298.85,390.73,"/F8",9.96,"tus. Commodo felis. Gravida massa dui ultrices pellen-"
54.00,369.93,298.80,378.78,"/F8",9.96,"tesque integer. Viverra netus vel. Aliquet risus vel odio"
54.00,357.98,298.86,366.82,"/F8",9.96,"in arcu cras. Vivamus nulla quam leo porttitor eni so-"
54.00,346.02,298.84,354.87,"/F8",9.96,"dales et at pede in nisi dolor. Sodales justo nam habitasse"
54.00,334.07,298.84,342.91,"/F8",9.96,"litora etiam aliquam habitasse quis hac sodales. Quisque"
54.00,322.11,298.82,330.96,"/F8",9.96,"netus adipiscing nascetur vitae. Viverra neque id metus"
54.00,310.16,298.84,319.00,"/F8",9.96,"mus massa. Integer lorem ante ultrices nulla erat lacinia"
54.00,298.20,298.87,307.05,"/F8",9.96,"id. Quisque curae. Egestas fames. Viverra augue non"
54.00,286.25,298.86,295.09,"/F8",9.96,"quis. Egestas massa et luctus. Natoque neque id aenean"
54.00,274.29,170.44,283.14,"/F8",9.96,"nonummy pede parturient."
63.96,261.85,298.87,270.70,"/F8",9.96,"Viverra vitae. Dapibus fusce odio. Lacinia curae ad"
54.00,249.90,178.33,258.75,"/F8",9.96,"convallis etiam dis odio id."
189.05,249.90,252.56,258.75,"/F8",9.96,"Aliquet netus."
263.28,249.90,298.83,258.75,"/F8",9.96,"Pretium"
54.00,237.94,298.81,246.79,"/F8",9.96,"porta. Blandit lorem lacus volutpat vestibulum tortor id"
54.00,225.99,298.88,234.84,"/F8",9.96,"quam orci auctor accumsan elementum bibendum. Po-"
54.00,214.03,298.86,222.88,"/F8",9.96,"tenti morbi. Nonummy neque vel lacus rutrum urna ac"
54.00,202.08,298.85,210.93,"/F8",9.96,"lacus ut ipsum. Posuere netus. Sodales neque enim ia-"
54.00,190.12,298.82,198.97,"/F8",9.96,"culis mi ad nisl habitasse litora etiam facilisi parturi-"
54.00,178.17,298.84,187.01,"/F8",9.96,"ent phasellus class. Euismod neque quis egestas rhoncus"
54.00,166.21,298.82,175.06,"/F8",9.96,"pede. Dapibus netus purus orci torquent fames id erat ip-"
54.00,154.26,298.87,163.10,"/F8",9.96,"sum. Euismod augue duis luctus semper morbi gravida"
54.00,142.30,298.85,151.15,"/F8",9.96,"malesuada eget integer quisque sodales. Pretium justo"
54.00,130.35,298.86,139.19,"/F8",9.96,"commodo ipsum nulla fames sagittis. Laoreet etiam felis"
54.00,118.39,298.83,127.24,"/F8",9.96,"nostra. Sodales vitae et nostra velit mi proin litora cras"
317.01,777.92,561.86,786.77,"/F8",9.96,"quam etiam quam. Cubilia justo ut id hac ullamcorper."
317.01,765.96,561.91,774.81,"/F8",9.96,"Iaculis massa. Feugiat massa leo mus eu. Euismod au-"
317.01,754.01,561.86,762.86,"/F8",9.96,"gue enim fusce potenti ornare. Laoreet fames nisl et orci"
317.01,742.05,481.31,750.90,"/F8",9.96,"molestie malesuada. Laoreet justo ut."
343.42,707.94,535.54,715.90,"/F19",8.97,"Euismod risus enim dictumst elit feugiat."
326.98,681.39,561.88,690.24,"/F8",9.96,"Aliquet neque ve velit libero metus magnis con-"
317.01,669.44,561.86,678.28,"/F8",9.96,"sectetuer nonummy. Vivamus etiam. Integer vitae cras."
317.01,657.48,561.91,666.33,"/F8",9.96,"Aliquam fames. Nonummy justo proin accumsan. Cu-"
317.01,645.53,561.87,654.37,"/F8",9.96,"bilia dolor amet non. Viverra purus sit. Commodo etiam"
317.01,633.57,561.91,642.42,"/F8",9.96,"diam potenti quis dui morbi. Commodo augue. Non-"
317.01,621.62,561.88,630.46,"/F8",9.96,"ummy proin nunc nulla. Natoque morbi est eget arcu"
317.01,609.66,561.83,618.51,"/F8",9.96,"feugiat ad rhoncus nisi pulvinar nibh luctus et. Iaculis"
317.01,597.71,561.82,606.55,"/F8",9.96,"neque risus per enim eleifend dui nibh urna vestibulum"
317.01,585.75,561.83,594.60,"/F8",9.96,"fringilla nibh per. Conubia neque adipiscing nibh morbi"
317.01,573.80,561.92,582.64,"/F8",9.96,"commodo amet eni odio metus auctor morbi. Nonummy"
317.01,561.84,561.83,570.69,"/F8",9.96,"proin amet luctus eu magna eleifend parturient vulputate"
317.01,549.89,561.87,558.73,"/F8",9.96,"condimentum dolor. Dapibus donec. Vivamus metus in"
317.01,537.93,561.88,546.78,"/F8",9.96,"fames nullam suspendisse class tempor et massa eu. Eu-"
317.01,525.97,561.85,534.82,"/F8",9.96,"ismod class parturient pulvinar pede varius congue. Na-"
317.01,514.02,561.87,522.87,"/F8",9.96,"toque justo. Lacinia neque. Commodo fusce velit senec-"
317.01,502.06,561.88,510.91,"/F8",9.96,"tus metus dapibus. Pretium fames enim a enim fames"
317.01,490.11,555.42,498.96,"/F8",9.96,"lacus scelerisque non primis. Vivamus dolor cum pede."
326.98,477.93,561.88,486.78,"/F8",9.96,"Posuere fusce. Potenti proin est urna leo montes ad"
317.01,465.98,561.87,474.82,"/F8",9.96,"platea nonummy. Commodo vitae ut turpis sagittis au-"
317.01,454.02,561.84,462.87,"/F8",9.96,"gue ac hac tincidunt nam. Blandit dolor ut mattis nulla."
317.01,442.07,561.91,450.91,"/F8",9.96,"Nonummy metus. Euismod netus. Vivamus magna me-"
317.01,430.11,561.83,438.96,"/F8",9.96,"tus lobortis morbi netus sagittis erat penatibus. Sodales"
317.01,418.16,561.84,427.00,"/F8",9.96,"nulla ut semper pretium quam ac sollicitudin. Gravida"
317.01,406.20,561.84,415.05,"/F8",9.96,"neque arcu interdum vestibulum tempor. Gravida lacus"
317.01,394.25,561.87,403.09,"/F8",9.96,"ad tempor quis urna purus tempus. Posuere nulla augue"
317.01,382.29,561.83,391.14,"/F8",9.96,"congue porta vestibulum pede. Pretium curae velit nul-"
317.01,370.34,561.88,379.18,"/F8",9.96,"lam condimentum donec ligula purus potenti commodo."
317.01,358.38,561.86,367.23,"/F8",9.96,"Nonummy felis parturient gravida quam ut netus dis."
317.01,346.43,561.89,355.27,"/F8",9.96,"Aliquam massa ac ipsum ad vulputate. Iaculis dolor."
317.01,334.47,561.87,343.32,"/F8",9.96,"Dapibus morbi sed orci amet proin. Vivamus risus eros"
317.01,322.52,561.86,331.36,"/F8",9.96,"mauris vestibulum lacus diam. Conubia porta. Aliquam"
317.01,310.56,561.87,319.41,"/F8",9.96,"vitae mi lorem aptent. Natoque fames. Lacinia donec ut"
317.01,298.61,561.91,307.45,"/F8",9.96,"augue et lorem nostra. Conubia magna fames praesent"
317.01,286.65,513.65,295.50,"/F8",9.96,"donec ve risus scelerisque molestie nulla erat."
332.19,252.53,546.77,260.49,"/F19",8.97,"Rhoncus dolor nisi nam curae egestas sit erat."
326.98,225.99,561.86,234.84,"/F8",9.96,"Aliquet dolor. Aliquet dolor fames donec iaculis cur-"
317.01,214.03,561.84,222.88,"/F8",9.96,"abitur. Laoreet massa nibh nisi facilisis litora pede eros"
317.01,202.08,561.88,210.92,"/F8",9.96,"sodales a ullamcorper mus sapien. Posuere lorem metus"
317.01,190.12,561.83,198.97,"/F8",9.96,"platea nam feugiat ut tincidunt justo curabitur. Posuere"
317.01,178.17,561.89,187.01,"/F8",9.96,"netus nam quis non leo nec mus leo consectetuer. Non-"
317.01,166.21,561.86,175.06,"/F8",9.96,"ummy magna. Quisque etiam dui vestibulum mattis ne-"
317.01,154.26,561.84,163.10,"/F8",9.96,"tus parturient torquent aliquet orci ut. Integer magna"
317.01,142.30,561.86,151.15,"/F8",9.96,"erat aliquet class duis sem taciti. Nonummy etiam fames"
317.01,130.35,561.84,139.19,"/F8",9.96,"montes ullamcorper proin ultricies. Cubilia morbi cum"
317.01,118.39,561.84,127.24,"/F8",9.96,"arcu parturient aptent nibh fermentum. Posuere donec"
