37.61,748.78,288.44,757.62,"/F8",9.96,"volutpat. Aliquet donec odio a vitae. Conubia fusce mi"
37.61,736.82,288.43,745.67,"/F8",9.96,"rutrum pulvinar etiam donec fusce. Viverra velit magna"
37.61,724.87,288.44,733.71,"/F8",9.96,"commodo porta diam potenti. Vivamus neque et fringilla"
37.61,712.91,288.42,721.76,"/F8",9.96,"dapibus morbi. Lacinia curae netus etiam scelerisque vel"
37.61,700.96,288.44,709.80,"/F8",9.96,"aenean malesuada. Aliquam dolor ad eni ut sollicitudin."
37.61,689.00,288.40,697.85,"/F8",9.96,"Integer class. Pretium purus duis sit morbi sit eget incep-"
37.61,677.04,288.46,685.89,"/F8",9.96,"tos mus. Sodales fames dolor ullamcorper sociosqu penat-"
37.61,665.09,288.42,673.94,"/F8",9.96,"ibus arcu suspendisse viverra. Natoque felis in malesuada"
37.61,653.13,288.44,661.98,"/F8",9.96,"neque magnis taciti. Aliquet fusce ad netus. Nonummy"
37.61,641.18,274.39,650.03,"/F8",9.96,"risus eros pretium ad tempor magna dignissim lacinia."
37.61,618.76,126.41,627.61,"/F27",9.96,"1.2. Rhoncus lorem."
52.56,605.31,288.46,614.16,"/F8",9.96,"Iaculis augue vitae cras hac risus hymenaeos sociis cu-"
37.61,593.36,288.47,602.20,"/F8",9.96,"rae diam et. Integer dolor sed magna auctor elementum"
37.61,581.40,288.43,590.25,"/F8",9.96,"quisque dui. Blandit magna mi lacus sociis facilisi. Non-"
37.61,569.45,288.44,578.29,"/F8",9.96,"ummy curae est aptent tempus placerat. Posuere risus"
37.61,557.49,288.43,566.34,"/F8",9.96,"duis euismod mi hendrerit. Euismod nulla class. Laoreet"
37.61,545.54,288.45,554.38,"/F8",9.96,"metus arcu eu netus. Posuere ipsum morbi ullamcorper"
37.61,533.58,288.41,542.43,"/F8",9.96,"in ligula ve amet nulla dapibus nunc in turpis. Pretium"
37.61,521.63,288.42,530.47,"/F8",9.96,"neque egestas urna senectus etiam in cras lobortis inceptos"
37.61,509.67,288.45,518.52,"/F8",9.96,"consectetuer parturient commodo leo malesuada dictum"
37.61,497.72,288.45,506.56,"/F8",9.96,"montes sem mi potenti. Commodo fames ve ultrices nibh"
37.61,485.76,288.43,494.61,"/F8",9.96,"habitasse luctus torquent pede vivamus. Viverra massa"
37.61,473.81,288.38,482.65,"/F8",9.96,"sit erat parturient aptent per ante vestibulum ve inceptos."
37.61,461.85,288.42,470.70,"/F8",9.96,"Vivamus nulla cubilia hac rutrum id est orci felis netus"
37.61,449.90,288.43,458.74,"/F8",9.96,"felis urna. Rhoncus fames dui massa ridiculus vehicula."
37.61,437.94,288.45,446.79,"/F8",9.96,"Lacinia augue ve platea felis dis sagittis nonummy dolor"
37.61,425.99,288.41,434.83,"/F8",9.96,"eget suscipit. Laoreet vitae cras a quis parturient. Viva-"
37.61,414.03,288.46,422.88,"/F8",9.96,"mus fames. Nonummy metus nec porta lectus. Dapibus"
37.61,402.08,288.41,410.92,"/F8",9.96,"neque nisl torquent faucibus ve metus mi vitae. Sodales"
37.61,390.12,288.43,398.97,"/F8",9.96,"ipsum vitae mollis ante potenti phasellus montes a adip-"
37.61,378.17,288.43,387.01,"/F8",9.96,"iscing cum parturient. Laoreet porta. Potenti fames eget"
37.61,366.21,248.35,375.06,"/F8",9.96,"litora. Nonummy donec quis vulputate vehicula."
52.56,354.26,288.41,363.10,"/F8",9.96,"Rhoncus lacus vestibulum mi sagittis potenti volutpat."
37.61,342.30,288.44,351.15,"/F8",9.96,"Nonummy proin. Egestas velit lorem ullamcorper volut-"
37.61,330.34,288.43,339.19,"/F8",9.96,"pat risus. Egestas massa diam ultrices mus. Aliquet augue"
37.61,318.39,288.43,327.24,"/F8",9.96,"duis sagittis nec euismod ornare amet eu pellentesque ia-"
37.61,306.43,288.42,315.28,"/F8",9.96,"culis. Aliquam fames erat duis parturient. Laoreet donec"
37.61,294.48,288.42,303.33,"/F8",9.96,"eget interdum risus at aptent a. Vivamus justo nibh nunc."
37.61,282.52,288.43,291.37,"/F8",9.96,"Aliquam curae ante a elit vitae. Feugiat neque id congue"
37.61,270.57,288.43,279.42,"/F8",9.96,"ipsum sociosqu proin tincidunt. Posuere morbi mi pel-"
37.61,258.61,288.38,267.46,"/F8",9.96,"lentesque sollicitudin posuere. Viverra nulla id dignissim"
37.61,246.66,288.43,255.51,"/F8",9.96,"nonummy pede molestie felis eni. Viverra curae amet. In-"
37.61,234.70,288.41,243.55,"/F8",9.96,"teger dolor odio leo quam sollicitudin blandit sociosqu nisi"
37.61,222.75,288.42,231.60,"/F8",9.96,"lacinia morbi. Cubilia lorem ut odio ridiculus magnis dui"
37.61,210.79,288.43,219.64,"/F8",9.96,"arcu. Egestas neque et. Egestas justo quis nisi quam ut."
37.61,198.84,288.41,207.68,"/F8",9.96,"Feugiat proin eros vehicula facilisis ve vulputate morbi"
37.61,186.88,288.40,195.73,"/F8",9.96,"eleifend netus penatibus. Sodales risus quis id. Integer"
37.61,174.93,288.39,183.77,"/F8",9.96,"donec non aliquet purus parturient sagittis vitae ut. Eges-"
37.61,162.97,288.40,171.82,"/F8",9.96,"tas justo sit erat lobortis a sollicitudin. Quisque curae"
37.61,151.02,288.43,159.86,"/F8",9.96,"enim dui malesuada senectus primis natoque feugiat curae"
37.61,139.06,116.43,147.91,"/F8",9.96,"nec diam fringilla."
37.61,110.67,254.23,119.52,"/F17",9.96,"2. Egestas nulla ve varius in cras mus erat."
52.56,91.24,288.42,100.09,"/F8",9.96,"Pretium fusce. Pretium lorem cum nisl vehicula fusce"
37.61,79.29,288.44,88.13,"/F8",9.96,"at convallis mi. Cubilia magna ut ornare. Gravida lorem"
306.60,748.78,402.14,757.62,"/F8",9.96,"cum per et a varius."
412.60,748.78,557.46,757.62,"/F8",9.96,"Feugiat curae magna rutrum id"
306.60,736.82,557.37,745.67,"/F8",9.96,"torquent aptent. Aliquet metus quisque eget ultrices. Po-"
306.60,724.87,557.38,733.71,"/F8",9.96,"suere nulla diam enim eu sollicitudin enim viverra nisl mus."
306.60,712.91,557.44,721.76,"/F8",9.96,"Aliquam porta quam. Dapibus risus non ante non proin"
306.60,700.95,557.44,709.80,"/F8",9.96,"auctor proin dis eget quis enim laoreet. Commodo velit"
306.60,689.00,557.41,697.85,"/F8",9.96,"nisi. Pretium lacus mi dignissim etiam. Posuere ipsum."
306.60,677.04,557.41,685.89,"/F8",9.96,"Dapibus proin eu neque auctor libero. Quisque lacus eu"
306.60,665.09,557.42,673.94,"/F8",9.96,"luctus. Vivamus morbi eros mattis adipiscing ipsum orci"
306.60,653.13,557.46,661.98,"/F8",9.96,"hac nonummy lorem. Rhoncus ipsum ve sapien id ac con-"
306.60,641.18,557.45,650.02,"/F8",9.96,"sequat risus a commodo eu diam. Posuere class. Blandit"
306.60,629.22,557.46,638.07,"/F8",9.96,"magna ad. Aliquam donec mi a. Quisque purus est eros"
306.60,617.27,557.40,626.11,"/F8",9.96,"praesent lorem cras. Integer risus id. Egestas lacus est nisi"
306.60,605.31,383.21,614.16,"/F8",9.96,"torquent fringilla."
321.55,593.36,557.43,602.20,"/F8",9.96,"Pretium felis odio est at ornare hac vestibulum adip-"
306.60,581.40,557.43,590.25,"/F8",9.96,"iscing et placerat pede. Feugiat netus. Viverra fames"
306.60,569.45,557.45,578.29,"/F8",9.96,"ante proin magna tempor sapien vitae per. Posuere pu-"
306.60,557.49,557.44,566.34,"/F8",9.96,"rus. Rhoncus dolor proin rhoncus commodo libero velit"
306.60,545.54,557.41,554.38,"/F8",9.96,"neque quis orci aptent tortor est accumsan potenti. Feu-"
306.60,533.58,557.43,542.43,"/F8",9.96,"giat ipsum metus odio sit at nunc bibendum lacus felis"
306.60,521.63,557.39,530.47,"/F8",9.96,"rutrum sagittis lorem. Gravida felis diam interdum fusce"
306.60,509.67,557.42,518.52,"/F8",9.96,"nulla. Euismod felis. Iaculis fames curae feugiat sociosqu"
306.60,497.72,557.40,506.56,"/F8",9.96,"massa. Cubilia lorem netus luctus ad blandit eu primis est."
306.60,485.76,557.46,494.61,"/F8",9.96,"Posuere class neque a aliquet at. Natoque massa quam."
306.60,473.81,557.40,482.65,"/F8",9.96,"Pretium dolor velit primis ipsum. Natoque nulla nunc na-"
306.60,461.85,557.40,470.70,"/F8",9.96,"toque eu pede felis ut quis. Blandit donec conubia duis ae-"
306.60,449.90,557.42,458.74,"/F8",9.96,"nean. Aliquam lorem. Aliquet proin diam per erat biben-"
306.60,437.94,557.48,446.79,"/F8",9.96,"dum. Natoque class diam ve donec. Posuere magna id"
306.60,425.99,557.41,434.83,"/F8",9.96,"tellus faucibus parturient. Feugiat fames urna cras fames"
306.60,414.03,557.40,422.88,"/F8",9.96,"facilisis ridiculus eget. Egestas proin etiam porta urna et"
306.60,402.08,557.37,410.92,"/F8",9.96,"inceptos montes vestibulum sollicitudin. Dapibus proin est"
306.60,390.12,328.14,398.97,"/F8",9.96,"velit."
306.60,367.70,387.37,376.55,"/F27",9.96,"2.1. Cubilia dolor."
321.55,354.25,557.45,363.10,"/F8",9.96,"Aliquam lorem eu. Sodales purus eu. Euismod ipsum"
306.60,342.30,557.43,351.15,"/F8",9.96,"eros ante urna adipiscing est. Conubia purus non fusce."
306.60,330.34,557.40,339.19,"/F8",9.96,"Euismod porta nisl a cras velit sit. Blandit velit diam"
306.60,318.39,557.43,327.24,"/F8",9.96,"scelerisque sodales hac ad. Dapibus nulla cras dapibus"
306.60,306.43,365.44,315.28,"/F8",9.96,"ad mi quam."
375.58,306.43,437.31,315.28,"/F8",9.96,"Blandit nulla."
447.46,306.43,557.44,315.28,"/F8",9.96,"Cubilia donec duis pede"
306.60,294.48,557.38,303.32,"/F8",9.96,"dictum. Potenti neque in cras ridiculus. Pretium curae."
306.60,282.52,557.39,291.37,"/F8",9.96,"Pretium justo eget. Potenti class nisl feugiat mi sagittis."
306.60,270.57,557.41,279.42,"/F8",9.96,"Integer massa sit enim parturient vel porta aenean libero."
306.60,258.61,557.44,267.46,"/F8",9.96,"Nonummy porta ac. Quisque metus odio quisque dolor."
306.60,246.66,557.43,255.51,"/F8",9.96,"Gravida morbi nec enim cras mus cubilia. Aliquam neque"
306.60,234.70,557.43,243.55,"/F8",9.96,"urna. Rhoncus massa dolor lobortis ad vel ut ligula eu nibh"
306.60,222.75,557.39,231.59,"/F8",9.96,"nisi adipiscing phasellus metus velit porta arcu. Blandit"
306.60,210.79,557.40,219.64,"/F8",9.96,"purus dis quam sem cras vestibulum fringilla vitae class."
306.60,198.84,557.43,207.68,"/F8",9.96,"Viverra lacus netus habitant massa turpis egestas urna ac"
306.60,186.88,557.43,195.73,"/F8",9.96,"enim facilisi. Aliquam augue urna nisl massa laoreet eget"
306.60,174.93,412.23,183.77,"/F8",9.96,"cras justo cras ridiculus."
321.55,162.97,557.45,171.82,"/F8",9.96,"Conubia morbi duis blandit et. Gravida lorem. Non-"
306.60,151.02,557.49,159.86,"/F8",9.96,"ummy etiam enim. Commodo lacus duis aenean male-"
306.60,139.06,557.43,147.91,"/F8",9.96,"suada velit lectus. Posuere etiam. Nonummy netus class"
306.60,127.11,557.38,135.95,"/F8",9.96,"sit nibh senectus class. Quisque risus id nisi interdum"
306.60,115.15,557.40,124.00,"/F8",9.96,"netus consectetuer sagittis dolor dignissim vivamus. Eges-"
306.60,103.20,557.41,112.04,"/F8",9.96,"tas nulla ac rutrum pulvinar arcu quis vitae elementum"
306.60,91.24,557.41,100.09,"/F8",9.96,"cum. Posuere vitae gravida lacinia nascetur pellentesque"
306.60,79.29,557.39,88.13,"/F8",9.96,"posuere tempus fermentum integer est mi hendrerit viverra"
295.15,61.35,300.13,70.20,"/F8",9.96,"2"
