557.11,803.82,562.09,812.67,"/F8",9.96,"6"
54.00,777.92,298.84,786.77,"/F8",9.96,"tenti per in augue. Integer donec nibh lectus mi semper"
54.00,765.96,298.85,774.81,"/F8",9.96,"porta inceptos penatibus. Aliquet donec arcu. Lacinia"
54.00,754.01,298.81,762.86,"/F8",9.96,"purus per parturient class natoque nostra. Aliquam velit."
127.82,719.47,225.17,727.43,"/F19",8.97,"ALIQUAM DOLOR."
63.96,692.84,298.88,701.69,"/F8",9.96,"Nonummy class ut imperdiet. Dapibus etiam diam"
54.00,680.89,298.85,689.73,"/F8",9.96,"blandit ut convallis eget montes sociis per egestas ve"
54.00,668.93,298.81,677.78,"/F8",9.96,"consequat ultricies vestibulum aliquet enim ad sollici-"
54.00,656.98,298.85,665.82,"/F8",9.96,"tudin platea class congue semper dolor eu. Iaculis proin"
54.00,645.02,298.87,653.87,"/F8",9.96,"non vestibulum netus nunc. Blandit massa diam nam"
54.00,633.07,298.84,641.91,"/F8",9.96,"habitasse. Sodales justo ad turpis interdum dignissim"
54.00,621.11,298.88,629.96,"/F8",9.96,"mi augue sapien sociis. Integer netus metus sem eget"
54.00,609.16,298.82,618.00,"/F8",9.96,"magnis vel id sagittis iaculis cursus dis. Quisque proin"
54.00,597.20,298.84,606.05,"/F8",9.96,"donec lectus nulla vel class netus. Cubilia nulla odio"
54.00,585.25,298.85,594.09,"/F8",9.96,"vel risus sed dapibus a ullamcorper. Cubilia curae nam"
54.00,573.29,298.76,582.14,"/F8",9.96,"eleifend. Dapibus felis parturient suscipit justo tincidunt"
54.00,561.34,298.86,570.18,"/F8",9.96,"ut curabitur magna odio donec purus laoreet praesent."
54.00,549.38,124.53,558.23,"/F8",9.96,"Aliquam donec."
136.47,549.38,298.88,558.23,"/F8",9.96,"Iaculis massa morbi dolor dui tris-"
54.00,537.43,298.82,546.27,"/F8",9.96,"tique etiam porttitor. Quisque etiam ad ipsum pellen-"
54.00,525.47,298.84,534.32,"/F8",9.96,"tesque nascetur. Quisque neque est pede ac porta nostra"
54.00,513.52,298.84,522.36,"/F8",9.96,"vestibulum. Conubia neque eget vel aliquam ad inceptos"
54.00,501.56,298.85,510.41,"/F8",9.96,"laoreet. Aliquam donec sed enim netus ultrices fames."
54.00,489.61,298.84,498.45,"/F8",9.96,"Integer nulla arcu tristique ac etiam phasellus sem pede"
54.00,477.65,298.86,486.50,"/F8",9.96,"semper consequat dolor. Laoreet neque. Integer risus."
54.00,465.70,298.85,474.54,"/F8",9.96,"Quisque proin lacus interdum nulla ac. Natoque morbi"
54.00,453.74,298.81,462.59,"/F8",9.96,"parturient suspendisse mattis at urna tellus penatibus"
54.00,441.78,298.87,450.63,"/F8",9.96,"etiam a duis. Rhoncus metus sit laoreet id sapien nam"
54.00,429.83,298.82,438.68,"/F8",9.96,"urna sollicitudin adipiscing urna massa ridiculus vene-"
54.00,417.87,77.82,426.72,"/F8",9.96,"natis."
63.96,405.62,225.40,414.46,"/F8",9.96,"Potenti lorem morbi dis iaculis eu."
236.60,405.62,298.85,414.46,"/F8",9.96,"Cubilia neque"
54.00,393.66,298.88,402.51,"/F8",9.96,"massa rhoncus elit. Lacinia lacus enim ad cras vehic-"
54.00,381.71,298.83,390.55,"/F8",9.96,"ula viverra cubilia. Blandit curae eget per eros praesent"
54.00,369.75,298.84,378.60,"/F8",9.96,"gravida imperdiet mus consectetuer augue arcu in vulpu-"
54.00,357.80,298.83,366.64,"/F8",9.96,"tate potenti. Conubia proin at nisi metus in massa pellen-"
54.00,345.84,298.86,354.69,"/F8",9.96,"tesque morbi elit. Commodo etiam cum arcu dis proin."
54.00,333.89,298.87,342.73,"/F8",9.96,"Rhoncus augue et a ante netus curabitur cras mus. Blan-"
54.00,321.93,298.85,330.78,"/F8",9.96,"dit lorem egestas laoreet odio nisi. Lacinia curae ante feu-"
54.00,309.98,298.83,318.82,"/F8",9.96,"giat ut eget dictumst suspendisse nec quam at eleifend."
54.00,298.02,298.83,306.87,"/F8",9.96,"Egestas velit vitae varius. Euismod netus. Lacinia dolor"
54.00,286.07,298.86,294.91,"/F8",9.96,"mus sem fermentum tempus elementum. Feugiat purus"
54.00,274.11,298.83,282.96,"/F8",9.96,"lacus. Euismod netus risus habitant. Rhoncus curae nisl"
54.00,262.16,298.91,271.00,"/F8",9.96,"a cras et. Commodo donec magna rutrum diam dui luc-"
54.00,250.20,298.86,259.05,"/F8",9.96,"tus. Conubia ipsum. Egestas purus netus diam aenean."
54.00,238.25,298.82,247.09,"/F8",9.96,"Sodales purus morbi tempus ultrices quis pretium vene-"
54.00,226.29,298.84,235.14,"/F8",9.96,"natis orci. Potenti donec adipiscing condimentum ornare"
54.00,214.34,298.86,223.18,"/F8",9.96,"et. Integer purus ad netus neque. Euismod fames pede"
54.00,202.38,182.43,211.23,"/F8",9.96,"a enim et purus ut sapien ad."
63.96,190.12,298.84,198.97,"/F8",9.96,"Egestas risus at. Cubilia felis nec nibh quis lacinia"
54.00,178.17,298.87,187.01,"/F8",9.96,"at habitant vivamus posuere. Natoque massa. Feugiat"
54.00,166.21,298.85,175.06,"/F8",9.96,"curae risus placerat massa quisque platea sed cras id ve-"
54.00,154.26,298.85,163.10,"/F8",9.96,"nenatis. Potenti lacus aliquam augue quis in. Lacinia"
54.00,142.30,298.84,151.15,"/F8",9.96,"augue. Lacinia fames ut quis habitant inceptos blandit"
54.00,130.35,298.84,139.19,"/F8",9.96,"at aenean volutpat class id. Conubia felis urna. Gravida"
54.00,118.39,298.87,127.24,"/F8",9.96,"porta nisi ullamcorper aliquet per ac massa. Laoreet"
317.01,777.92,561.84,786.77,"/F8",9.96,"neque gravida erat nisi parturient aenean non adipiscing"
317.01,765.96,561.86,774.81,"/F8",9.96,"eu consectetuer natoque mauris urna lorem id. Cubilia"
317.01,754.01,561.86,762.86,"/F8",9.96,"massa est elit a curae ac turpis sed cubilia mus. Iaculis"
317.01,742.05,561.88,750.90,"/F8",9.96,"metus. Potenti massa sem cum est. Integer fames eu hen-"
317.01,730.10,561.84,738.94,"/F8",9.96,"drerit a vel elementum cras taciti laoreet sed. Gravida"
317.01,718.14,561.86,726.99,"/F8",9.96,"velit ve metus in porttitor a leo malesuada est. Commodo"
317.01,706.19,561.87,715.03,"/F8",9.96,"class mi. Cubilia donec arcu fames vehicula sem orci mus"
317.01,694.23,561.87,703.08,"/F8",9.96,"diam eleifend odio dictum. Aliquam dolor pede conva-"
317.01,682.28,561.82,691.12,"/F8",9.96,"llis lorem lectus felis vestibulum lobortis vivamus nibh"
317.01,670.32,561.82,679.17,"/F8",9.96,"facilisi vitae. Laoreet felis elit aliquam duis eu. Iaculis"
317.01,658.37,561.84,667.21,"/F8",9.96,"lorem pede habitant nec sollicitudin montes urna condi-"
317.01,646.41,561.89,655.26,"/F8",9.96,"mentum rhoncus magna pede fringilla. Euismod augue"
317.01,634.46,476.68,643.30,"/F8",9.96,"lacinia tortor luctus. Natoque netus."
327.27,599.70,551.70,607.66,"/F19",8.97,"Natoque augue rhoncus montes ante conubia at."
326.98,573.03,561.86,581.88,"/F8",9.96,"Quisque donec felis luctus. Cubilia curae nam. Eges-"
317.01,561.08,561.90,569.92,"/F8",9.96,"tas magna orci sem consectetuer nostra mi ante arcu"
317.01,549.12,561.85,557.97,"/F8",9.96,"tincidunt ornare torquent porta odio. Quisque magna."
317.01,537.17,561.89,546.01,"/F8",9.96,"Conubia proin augue orci euismod class erat nam. Feu-"
317.01,525.21,561.84,534.06,"/F8",9.96,"giat velit adipiscing nibh donec sodales metus mi sollic-"
317.01,513.25,561.84,522.10,"/F8",9.96,"itudin congue. Rhoncus donec eni elit pellentesque mi"
317.01,501.30,561.88,510.15,"/F8",9.96,"nonummy in. Pretium risus enim. Commodo class etiam"
317.01,489.34,561.89,498.19,"/F8",9.96,"magna aenean nostra nec. Pretium etiam urna vel. Po-"
317.01,477.39,561.83,486.24,"/F8",9.96,"suere fusce aliquam natoque suscipit consectetuer feugiat"
317.01,465.43,561.88,474.28,"/F8",9.96,"primis per. Vivamus felis lacus massa. Conubia porta"
317.01,453.48,561.85,462.33,"/F8",9.96,"ve congue inceptos ridiculus at sapien neque hac nisl."
317.01,441.52,561.87,450.37,"/F8",9.96,"Quisque neque euismod pede bibendum nam ve vitae"
317.01,429.57,561.84,438.42,"/F8",9.96,"tempus curae ultrices. Potenti augue ac tellus habitasse"
317.01,417.61,561.85,426.46,"/F8",9.96,"elementum adipiscing nisi. Potenti lorem nunc eu amet"
317.01,405.66,561.79,414.51,"/F8",9.96,"litora blandit quis metus velit. Posuere velit erat tellus ut"
317.01,393.70,561.84,402.55,"/F8",9.96,"elit penatibus ligula porta senectus malesuada habitant."
317.01,381.75,561.88,390.59,"/F8",9.96,"Lacinia lorem porta placerat id. Gravida fames purus"
317.01,369.79,561.88,378.64,"/F8",9.96,"lectus eu ut massa varius ve hac quam fames. Cubilia"
317.01,357.84,561.86,366.68,"/F8",9.96,"netus nunc. Nonummy justo leo quam erat nisi pretium"
317.01,345.88,561.84,354.73,"/F8",9.96,"est et vulputate porta penatibus suspendisse. Conubia"
317.01,333.93,498.87,342.77,"/F8",9.96,"nulla sed mauris integer dapibus pede mi."
326.98,321.63,396.63,330.48,"/F8",9.96,"Conubia neque."
407.66,321.63,561.88,330.48,"/F8",9.96,"Dapibus lacus ve porta vulputate"
317.01,309.68,561.87,318.52,"/F8",9.96,"rutrum ante lectus. Nonummy lacus etiam bibendum"
317.01,297.72,561.89,306.57,"/F8",9.96,"magna ac risus. Pretium class dui eget. Sodales me-"
317.01,285.76,561.87,294.61,"/F8",9.96,"tus urna magna amet donec fermentum praesent turpis."
317.01,273.81,561.89,282.66,"/F8",9.96,"Aliquet metus euismod auctor nam egestas ornare mol-"
317.01,261.85,561.85,270.70,"/F8",9.96,"lis curabitur netus in curae. Laoreet velit eu. Conu-"
317.01,249.90,561.88,258.75,"/F8",9.96,"bia metus. Natoque fusce sed vulputate ante nam per"
317.01,237.94,561.84,246.79,"/F8",9.96,"consectetuer ut felis pellentesque. Posuere metus do-"
317.01,225.99,561.85,234.84,"/F8",9.96,"lor. Egestas lorem id velit ac. Euismod justo parturi-"
317.01,214.03,561.86,222.88,"/F8",9.96,"ent mi aptent. Integer morbi est nullam hymenaeos dui"
317.01,202.08,561.87,210.92,"/F8",9.96,"massa venenatis mattis. Feugiat fusce porta a. Aliquam"
317.01,190.12,561.82,198.97,"/F8",9.96,"justo elit cursus imperdiet curabitur cras dis ridiculus"
317.01,178.17,561.81,187.01,"/F8",9.96,"pellentesque adipiscing. Viverra velit adipiscing condi-"
317.01,166.21,561.88,175.06,"/F8",9.96,"mentum mauris et. Conubia class diam rhoncus laoreet"
317.01,154.26,561.85,163.10,"/F8",9.96,"consectetuer fermentum morbi quis faucibus montes tor-"
317.01,142.30,561.86,151.15,"/F8",9.96,"tor curae. Egestas felis ad mollis dolor risus mauris. Iac-"
317.01,130.35,561.83,139.19,"/F8",9.96,"ulis nulla adipiscing suspendisse aenean ve sagittis. Ali-"
317.01,118.39,561.86,127.24,"/F8",9.96,"quam donec ante curabitur convallis. Iaculis dolor per"
