95.21,737.96,499.85,750.70,"/F18",14.35,"Iaculis neque amet dictumst vehicula etiam ve fames dolor morbi."
107.55,708.93,190.31,717.77,"/F8",9.96,"Vincent Muszynski"
190.41,713.12,194.38,719.31,"/F7",6.97,"a"
194.88,708.93,266.53,717.77,"/F8",9.96,", Mario Sheahan"
266.58,713.12,270.55,719.31,"/F7",6.97,"a"
271.05,708.93,343.88,717.77,"/F8",9.96,", Willy Pinckney"
343.97,713.12,347.94,719.31,"/F7",6.97,"a"
348.44,708.93,421.25,717.77,"/F8",9.96,", Lyndsay Brann"
421.31,713.12,425.27,719.31,"/F7",6.97,"a"
425.78,708.93,483.20,717.77,"/F8",9.96,", Jose Shaikh"
483.25,713.12,487.22,719.31,"/F7",6.97,"a"
243.16,693.08,246.76,698.39,"/F26",5.98,"a"
247.26,689.88,352.03,696.96,"/F20",7.97,"Walter Air Media Financial"
37.61,634.36,81.42,643.21,"/F17",9.96,"Abstract"
37.61,616.43,557.15,625.27,"/F8",9.96,"Feugiat risus. Conubia ipsum eget potenti id nullam vehicula feugiat magnis fames cum hendrerit rutrum pede dis odio."
37.61,604.47,557.18,613.32,"/F8",9.96,"Nonummy lacus nisi cum pede justo hymenaeos aliquam tellus. Natoque justo elit nascetur et cursus placerat nonummy"
37.61,592.52,557.11,601.36,"/F8",9.96,"duis vestibulum nam. Blandit morbi amet lacinia et nisi. Pretium ipsum cras convallis leo fusce felis. Quisque fames dui"
37.61,580.56,557.13,589.41,"/F8",9.96,"nisi vivamus. Potenti porta. Vivamus donec parturient urna dolor id risus varius at nisl auctor in nisi. Dapibus massa."
37.61,568.61,557.17,577.45,"/F8",9.96,"Pretium dolor nisl eni vivamus et ad dis eu porta in venenatis. Natoque porta duis eu. Natoque velit laoreet porta"
37.61,556.65,557.19,565.50,"/F8",9.96,"enim quam magna natoque cras. Laoreet lacus velit tempor arcu eget porta in amet proin dignissim dis. Cubilia risus"
37.61,544.70,557.18,553.54,"/F8",9.96,"eget a quam in massa malesuada eros nec nullam blandit viverra morbi lacus a enim dolor cubilia tellus. Pretium etiam"
37.61,532.74,557.14,541.59,"/F8",9.96,"posuere vel mi lorem nullam ut quis eget. Aliquam risus adipiscing potenti nibh a curae at eros imperdiet rutrum nibh"
37.61,520.79,557.16,529.63,"/F8",9.96,"ullamcorper aliquam mus dignissim cubilia sollicitudin. Iaculis massa mi orci mus. Conubia dolor ad nibh netus neque"
37.61,508.83,557.21,517.68,"/F8",9.96,"purus nisi. Vivamus magna ad rutrum fusce egestas nibh. Gravida fames arcu a eget netus. Quisque magna pretium"
37.61,496.88,470.01,505.72,"/F8",9.96,"imperdiet orci velit tincidunt habitasse consectetuer sed morbi ultricies rhoncus metus ve ridiculus."
37.61,462.66,236.16,471.51,"/F17",9.96,"1. Commodo porta erat cubilia et eget."
52.56,441.74,301.65,450.59,"/F8",9.96,"Nonummy porta vestibulum condimentum sociis. Pretium"
37.61,429.78,288.45,438.63,"/F8",9.96,"magna eu eros ac nibh sagittis inceptos nulla dignissim"
37.61,417.83,288.43,426.67,"/F8",9.96,"eget. Cubilia velit etiam magna enim. Laoreet fusce risus"
37.61,405.87,288.44,414.72,"/F8",9.96,"molestie nisl. Natoque lorem amet ullamcorper. Feugiat"
37.61,393.92,288.44,402.76,"/F8",9.96,"ipsum non varius tortor purus. Lacinia etiam. Integer"
37.61,381.96,288.43,390.81,"/F8",9.96,"vitae risus suspendisse bibendum quam inceptos. Blan-"
37.61,370.01,288.44,378.85,"/F8",9.96,"dit justo erat. Vivamus class morbi nec dui et neque at"
37.61,358.05,288.41,366.90,"/F8",9.96,"taciti porttitor. Iaculis morbi massa facilisis consequat"
37.61,346.10,288.45,354.94,"/F8",9.96,"eros aliquam felis cum arcu. Aliquet fusce massa tempor"
37.61,334.14,288.40,342.99,"/F8",9.96,"convallis sodales pellentesque nostra lacus parturient amet"
37.61,322.19,288.47,331.03,"/F8",9.96,"lacus. Natoque etiam odio etiam nunc conubia a condi-"
37.61,310.23,288.42,319.08,"/F8",9.96,"mentum per luctus a vestibulum leo adipiscing. Integer"
37.61,298.28,288.44,307.12,"/F8",9.96,"massa at ornare at integer. Potenti ipsum sem nisi platea"
37.61,286.32,288.44,295.17,"/F8",9.96,"placerat enim mauris vitae ullamcorper eu luctus a mae-"
37.61,274.37,288.42,283.21,"/F8",9.96,"cenas est vivamus eu nibh velit blandit mi. Lacinia porta"
37.61,262.41,288.39,271.26,"/F8",9.96,"justo magnis ut. Iaculis justo quis lobortis ipsum ridiculus"
37.61,250.46,288.42,259.30,"/F8",9.96,"semper. Potenti purus enim eros vestibulum in. Lacinia"
37.61,238.50,288.45,247.35,"/F8",9.96,"class. Gravida magna vestibulum natoque eros. Conubia"
37.61,226.55,269.11,235.39,"/F8",9.96,"lorem. Rhoncus vitae eni maecenas fermentum justo."
52.56,214.59,288.39,223.44,"/F8",9.96,"Pretium nulla nisi dis auctor elit facilisis dictum. Ali-"
37.61,202.63,288.44,211.48,"/F8",9.96,"quam dolor urna etiam mauris class facilisis ullamcorper"
37.61,190.68,288.43,199.53,"/F8",9.96,"eni auctor. Pretium porta nunc posuere eu in nisi mi."
37.61,178.72,288.46,187.57,"/F8",9.96,"Conubia curae. Viverra ipsum. Egestas lorem. Sodales"
37.61,166.77,288.42,175.62,"/F8",9.96,"ipsum eni nunc malesuada habitant nulla arcu. Potenti la-"
37.61,154.81,288.41,163.66,"/F8",9.96,"cus ac sagittis vel consectetuer rutrum quis natoque cum at"
37.61,142.86,288.40,151.71,"/F8",9.96,"pellentesque quis dapibus sem. Pretium augue vestibulum"
37.61,130.90,288.42,139.75,"/F8",9.96,"orci augue dictum libero suscipit nunc maecenas convallis"
37.61,118.95,288.41,127.80,"/F8",9.96,"est odio. Aliquam neque. Blandit netus et ornare torquent"
37.61,106.99,288.42,115.84,"/F8",9.96,"urna cursus lacinia nam parturient malesuada scelerisque"
37.61,95.04,288.43,103.89,"/F8",9.96,"fringilla orci. Commodo dolor. Cubilia fusce orci. Integer"
37.61,83.08,288.44,91.93,"/F8",9.96,"metus. Commodo purus duis mauris suscipit venenatis."
306.60,462.66,557.45,471.51,"/F8",9.96,"Vivamus proin dolor tempor inceptos. Nonummy risus"
306.60,450.70,557.41,459.55,"/F8",9.96,"at cursus laoreet euismod turpis sem adipiscing. Dapibus"
306.60,438.75,557.42,447.60,"/F8",9.96,"porta nisl nibh in malesuada morbi. Aliquam vitae mi tor-"
306.60,426.79,557.44,435.64,"/F8",9.96,"tor id. Gravida donec at. Egestas metus. Vivamus fames"
306.60,414.84,444.55,423.69,"/F8",9.96,"parturient euismod est eu class."
306.60,390.93,401.78,399.78,"/F27",9.96,"1.1. Blandit porta ac."
321.55,375.98,557.44,384.83,"/F8",9.96,"Quisque magna felis dis parturient risus amet mat-"
306.60,364.03,557.44,372.88,"/F8",9.96,"tis faucibus. Vivamus porta. Natoque porta. Feugiat"
306.60,352.07,557.41,360.92,"/F8",9.96,"nulla cras odio nam nunc sollicitudin vivamus pulvinar"
306.60,340.12,557.42,348.97,"/F8",9.96,"platea luctus nunc. Natoque magna neque non tellus. Ali-"
306.60,328.16,557.40,337.01,"/F8",9.96,"quam fusce massa varius fusce luctus pellentesque. Feugiat"
306.60,316.21,557.39,325.06,"/F8",9.96,"magna nec elit odio integer ultricies nisl eni dis ac. Gravida"
306.60,304.25,557.43,313.10,"/F8",9.96,"lacus orci velit feugiat eros ve magna proin nostra cursus"
306.60,292.30,557.43,301.15,"/F8",9.96,"venenatis. Sodales justo. Aliquam velit dis magna cur-"
306.60,280.34,557.39,289.19,"/F8",9.96,"abitur odio dis erat et fusce curabitur. Conubia velit donec"
306.60,268.39,557.46,277.24,"/F8",9.96,"posuere potenti. Gravida augue ac justo ac. Commodo au-"
306.60,256.43,557.47,265.28,"/F8",9.96,"gue orci semper ut dui elementum. Commodo augue amet"
306.60,244.48,557.42,253.32,"/F8",9.96,"nascetur. Gravida porta. Sodales ipsum. Euismod justo."
306.60,232.52,557.41,241.37,"/F8",9.96,"Aliquet ipsum lorem pharetra penatibus volutpat eu tem-"
306.60,220.57,557.43,229.41,"/F8",9.96,"por ac congue pharetra. Potenti vitae. Posuere justo cu-"
306.60,208.61,557.40,217.46,"/F8",9.96,"rae dis amet pellentesque aliquam ultrices cras dictumst"
306.60,196.66,557.45,205.50,"/F8",9.96,"consequat. Euismod magna dolor arcu ullamcorper per."
306.60,184.70,521.97,193.55,"/F8",9.96,"Blandit nulla enim facilisi etiam vel cras fringilla."
321.55,172.75,557.44,181.59,"/F8",9.96,"Cubilia fusce. Euismod class cras senectus rhoncus ia-"
306.60,160.79,557.46,169.64,"/F8",9.96,"culis. Lacinia purus duis malesuada congue nibh magna"
306.60,148.84,557.44,157.68,"/F8",9.96,"dapibus egestas molestie augue. Laoreet justo eu inter-"
306.60,136.88,557.46,145.73,"/F8",9.96,"dum enim ornare ac. Rhoncus fames non diam imperdiet"
306.60,124.93,557.40,133.77,"/F8",9.96,"habitant id ullamcorper. Euismod proin in curabitur cu-"
306.60,112.97,557.43,121.82,"/F8",9.96,"rae ve proin netus. Blandit donec morbi curae molestie"
306.60,101.02,557.39,109.86,"/F8",9.96,"vestibulum fringilla ullamcorper mus. Quisque ipsum eu"
306.60,89.06,557.41,97.91,"/F8",9.96,"urna ultrices pharetra justo etiam. Potenti magna mi quis"
37.61,61.74,149.76,68.82,"/F20",7.97,"Preprint submitted to Elsevier"
490.43,61.74,557.59,68.82,"/F20",7.97,"November 8, 2015"
