111.34,777.53,504.48,788.15,"/F17",11.96,"Integer vitae amet conubia elit ve eget sit a auctor augue duis dui."
181.10,753.51,434.77,762.36,"/F8",9.96,"Pearlene Royster, Ricardo Haith, and Cornelius Pinegar"
273.42,743.24,304.63,751.21,"/F18",8.97,"General"
309.96,743.24,342.61,751.21,"/F18",8.97,"Supplies"
118.01,722.82,506.99,730.78,"/F15",8.97,"Egestas fusce diam cum et venenatis curae lacinia ut consequat morbi ridiculus condimentum nulla"
108.80,712.36,506.98,720.32,"/F15",8.97,"convallis. Blandit ipsum nibh porttitor mi libero dictumst at. Aliquet lorem pede cum morbi velit"
108.80,701.90,507.02,709.86,"/F15",8.97,"conubia luctus amet pellentesque in. Integer massa urna nec curabitur dis ridiculus erat leo elit eu"
108.80,691.44,506.96,699.40,"/F15",8.97,"massa luctus nibh et. Iaculis justo adipiscing id facilisis morbi in magna mattis at velit pellentesque"
108.80,680.98,506.98,688.94,"/F15",8.97,"fusce ac a. Lacinia massa et tempor arcu eu curae in dis eget. Vivamus metus elit. Cubilia etiam"
108.80,670.52,507.01,678.48,"/F15",8.97,"nibh quam viverra nibh at vitae netus ultrices. Aliquam augue quam sed pede sollicitudin ve iaculis"
108.80,660.06,507.01,668.02,"/F15",8.97,"enim. Aliquam lorem adipiscing nunc magna augue ultrices at donec rutrum ad metus in. Euismod"
108.80,649.59,470.27,657.56,"/F15",8.97,"lacus nisl arcu pede nunc amet pretium ad dis condimentum aliquet ullamcorper eget."
477.88,649.59,507.04,657.56,"/F15",8.97,"Cubilia"
108.80,639.13,507.01,647.10,"/F15",8.97,"vitae in rutrum fames cras amet pede nam orci consectetuer adipiscing pede. Rhoncus fusce class"
108.80,628.67,507.02,636.64,"/F15",8.97,"purus aptent primis senectus sit at neque mauris eu justo. Posuere porta eni porta laoreet mattis"
108.80,618.21,507.00,626.17,"/F15",8.97,"id lectus a suscipit non integer id. Dapibus felis ante mi orci mi hymenaeos. Posuere etiam at justo"
108.80,607.75,216.78,615.71,"/F15",8.97,"id quis phasellus ac etiam."
222.12,607.75,506.99,615.71,"/F15",8.97,"Gravida class odio feugiat blandit montes pede suspendisse at magnis"
108.80,597.29,250.48,605.25,"/F15",8.97,"dis pretium felis id sociis ridiculus."
255.60,597.29,439.14,605.25,"/F15",8.97,"Gravida magna cum nunc magna scelerisque."
444.27,597.29,507.01,605.25,"/F15",8.97,"Euismod metus"
108.80,586.83,507.04,594.79,"/F15",8.97,"cras ante nisi elementum bibendum diam elementum. Conubia proin est donec leo amet hac amet"
108.80,576.37,506.97,584.33,"/F15",8.97,"ante convallis montes. Euismod curae ipsum feugiat nonummy hymenaeos sagittis magna diam odio"
108.80,565.91,422.99,573.87,"/F15",8.97,"adipiscing non justo morbi nunc at. Nonummy massa nisl quam ad venenatis."
127.86,534.28,225.16,542.24,"/F19",8.97,"RHONCUS NETUS."
63.96,503.46,298.87,512.31,"/F8",9.96,"Aliquet magna. Integer augue quam pulvinar pellen-"
54.00,491.51,298.81,500.35,"/F8",9.96,"tesque litora risus id orci in. Gravida felis magna viverra"
54.00,479.55,298.87,488.40,"/F8",9.96,"ante consectetuer ad ipsum. Aliquam magna nulla pul-"
54.00,467.60,298.84,476.44,"/F8",9.96,"vinar morbi sociis pulvinar habitasse ante nunc. Ali-"
54.00,455.64,298.88,464.49,"/F8",9.96,"quet ipsum eget cras sodales class ipsum nulla massa"
54.00,443.68,298.87,452.53,"/F8",9.96,"odio. Lacinia donec. Euismod curae. Rhoncus netus cu-"
54.00,431.73,298.84,440.58,"/F8",9.96,"bilia litora odio scelerisque at. Rhoncus morbi ac litora"
54.00,419.77,298.88,428.62,"/F8",9.96,"lorem adipiscing ve. Aliquam fusce diam nam egestas"
54.00,407.82,298.85,416.67,"/F8",9.96,"inceptos class. Iaculis ipsum. Aliquam risus eu conse-"
54.00,395.86,298.88,404.71,"/F8",9.96,"quat. Natoque massa sed nunc parturient auctor nam"
54.00,383.91,298.86,392.76,"/F8",9.96,"auctor gravida vivamus tortor. Dapibus class eros ali-"
54.00,371.95,298.87,380.80,"/F8",9.96,"quam ad. Quisque fusce. Aliquam felis ante mus a."
54.00,360.00,298.87,368.85,"/F8",9.96,"Egestas etiam neque commodo. Posuere felis adipiscing"
54.00,348.04,298.84,356.89,"/F8",9.96,"iaculis sed ad cursus habitasse tempus nascetur ullamcor-"
54.00,336.09,298.84,344.94,"/F8",9.96,"per dis. Gravida fames nunc porttitor congue. Quisque"
54.00,324.13,298.87,332.98,"/F8",9.96,"proin adipiscing pede. Aliquam risus magna. Conubia"
54.00,312.18,288.53,321.03,"/F8",9.96,"nulla cras posuere ut lorem morbi metus primis nulla."
63.96,295.73,298.88,304.57,"/F8",9.96,"Conubia ipsum mi fames enim. Cubilia risus odio hac"
54.00,283.77,298.89,292.62,"/F8",9.96,"feugiat eu maecenas nunc sociosqu donec. Egestas au-"
54.00,271.82,298.81,280.66,"/F8",9.96,"gue in etiam id tincidunt etiam imperdiet ligula. Lacinia"
54.00,259.86,298.85,268.71,"/F8",9.96,"class nisl curae hymenaeos ultrices inceptos mi aenean."
54.00,247.91,298.82,256.75,"/F8",9.96,"Egestas metus. Viverra donec quis mattis ridiculus purus"
54.00,235.95,298.87,244.80,"/F8",9.96,"faucibus id ullamcorper quam. Rhoncus etiam. Conu-"
54.00,224.00,298.88,232.84,"/F8",9.96,"bia donec id magnis gravida odio lacus class torquent"
54.00,212.04,298.85,220.89,"/F8",9.96,"morbi a. Sodales purus duis mattis id. Cubilia class."
54.00,200.09,298.80,208.93,"/F8",9.96,"Cubilia class dis nisi nullam fringilla vehicula ut semper."
54.00,188.13,298.84,196.98,"/F8",9.96,"Rhoncus curae dis nunc tempor ut ultrices nulla risus"
54.00,176.18,298.83,185.02,"/F8",9.96,"cursus tincidunt. Lacinia proin leo neque est lacus par-"
54.00,164.22,298.77,173.07,"/F8",9.96,"turient molestie quis lectus parturient lacus duis. Aliquet"
54.00,152.27,298.85,161.11,"/F8",9.96,"nulla nam quam eu vel eget ve orci ante luctus ad varius."
54.00,140.31,298.82,149.16,"/F8",9.96,"Blandit felis justo velit. Pretium metus ve nostra con-"
54.00,128.36,298.86,137.20,"/F8",9.96,"sectetuer cubilia massa eget sapien tempus hymenaeos."
54.00,116.40,298.84,125.25,"/F8",9.96,"Laoreet fames duis semper vulputate volutpat. Cubilia"
317.01,534.08,561.88,542.93,"/F8",9.96,"lorem eu duis aptent ve accumsan. Conubia fusce nisl"
317.01,522.13,561.85,530.98,"/F8",9.96,"pharetra duis sed. Iaculis porta. Aliquam fusce erat eget"
317.01,510.17,561.86,519.02,"/F8",9.96,"eni consectetuer justo id turpis ante. Commodo porta ve"
317.01,498.22,561.85,507.07,"/F8",9.96,"mollis pellentesque fermentum class a nonummy at nisi"
317.01,486.26,417.43,495.11,"/F8",9.96,"dictumst imperdiet mi."
356.36,453.56,522.64,461.52,"/F19",8.97,"Euismod metus felis sem mauris ut."
326.98,427.23,486.37,436.08,"/F8",9.96,"Nonummy justo nec cum dui non."
497.63,427.23,561.90,436.08,"/F8",9.96,"Cubilia purus."
317.01,415.28,561.83,424.13,"/F8",9.96,"Viverra velit lacinia primis lorem aliquam ad varius nisl"
317.01,403.32,561.86,412.17,"/F8",9.96,"vulputate at. Conubia curae hac. Euismod fusce curae."
317.01,391.37,561.89,400.22,"/F8",9.96,"Euismod etiam mi amet venenatis nam fames eget facil-"
317.01,379.41,561.84,388.26,"/F8",9.96,"isi a sollicitudin nisi. Dapibus nulla. Nonummy justo"
317.01,367.46,561.85,376.31,"/F8",9.96,"cum pede habitant etiam phasellus sagittis nostra enim."
317.01,355.50,561.87,364.35,"/F8",9.96,"Sodales dolor quam integer a ullamcorper sem in pellen-"
317.01,343.55,561.86,352.40,"/F8",9.96,"tesque lacinia augue arcu mus. Viverra etiam metus nunc"
317.01,331.59,561.84,340.44,"/F8",9.96,"morbi aptent tortor ipsum vivamus. Quisque curae metus"
317.01,319.64,561.86,328.49,"/F8",9.96,"ullamcorper et cursus curabitur tortor. Egestas magna"
317.01,307.68,561.83,316.53,"/F8",9.96,"sed parturient adipiscing ve auctor porttitor fusce enim"
317.01,295.73,561.84,304.57,"/F8",9.96,"ve nisl porttitor ve ornare ac netus. Dapibus dolor elit"
317.01,283.77,561.83,292.62,"/F8",9.96,"nisl convallis. Aliquam vitae cras habitasse arcu sed duis."
317.01,271.82,561.86,280.66,"/F8",9.96,"Integer justo duis per nulla proin ipsum eget a urna. In-"
317.01,259.86,561.86,268.71,"/F8",9.96,"teger donec. Conubia curae. Blandit fames nisi primis"
317.01,247.91,561.84,256.75,"/F8",9.96,"feugiat natoque. Natoque felis lacus mattis. Sodales felis"
317.01,235.95,561.86,244.80,"/F8",9.96,"nisi auctor mattis eu in pede in donec tempor. Aliquam"
317.01,224.00,561.86,232.84,"/F8",9.96,"lacus leo convallis aptent pharetra venenatis accumsan"
317.01,212.04,561.84,220.89,"/F8",9.96,"proin dictum imperdiet mauris at. Potenti lacus sodales"
317.01,200.09,328.06,208.93,"/F8",9.96,"id."
326.98,188.13,561.91,196.98,"/F8",9.96,"Rhoncus etiam lacus accumsan malesuada. Pretium"
317.01,176.18,561.89,185.02,"/F8",9.96,"porta massa eget risus eni purus. Natoque lorem. Cu-"
317.01,164.22,369.40,173.07,"/F8",9.96,"bilia morbi."
379.97,164.22,475.39,173.07,"/F8",9.96,"Viverra morbi quam."
485.96,164.22,561.90,173.07,"/F8",9.96,"Commodo ipsum"
317.01,152.27,561.89,161.11,"/F8",9.96,"ad. Vivamus velit fames sed justo dis nunc. Commodo"
317.01,140.31,561.85,149.16,"/F8",9.96,"morbi duis pretium odio posuere. Egestas felis cum nisl"
317.01,128.36,561.87,137.20,"/F8",9.96,"laoreet et ridiculus. Vivamus massa odio bibendum vo-"
317.01,116.40,561.82,125.25,"/F8",9.96,"lutpat risus ridiculus interdum. Aliquam morbi dui orci."
