37.61,748.78,288.49,757.62,"/F8",9.96,"arcu massa magnis. Nonummy massa porta potenti ipsum"
37.61,736.82,288.39,745.67,"/F8",9.96,"arcu imperdiet et. Pretium purus integer. Pretium porta."
37.61,724.87,288.43,733.71,"/F8",9.96,"Potenti magna leo mus id rutrum. Potenti morbi cras nul-"
37.61,712.91,288.46,721.76,"/F8",9.96,"lam sodales posuere diam dictumst. Natoque etiam cras"
37.61,700.96,288.43,709.80,"/F8",9.96,"magna rutrum ipsum viverra mattis elementum sagittis"
37.61,689.00,288.41,697.85,"/F8",9.96,"dolor. Conubia fusce cras faucibus sit pellentesque lectus"
37.61,677.04,288.39,685.89,"/F8",9.96,"nibh tempus ultricies vitae. Pretium justo cum velit mus"
37.61,665.09,288.42,673.94,"/F8",9.96,"ultrices. Iaculis augue class platea. Gravida fusce orci do-"
37.61,653.13,288.44,661.98,"/F8",9.96,"lor accumsan. Integer curae enim mus vitae vestibulum"
37.61,641.18,288.45,650.03,"/F8",9.96,"placerat nunc ad eget in. Aliquam fusce non neque morbi"
37.61,629.22,288.43,638.07,"/F8",9.96,"eros cum neque imperdiet vulputate. Laoreet purus arcu"
37.61,617.27,144.40,626.11,"/F8",9.96,"ornare imperdiet aptent."
52.56,605.31,288.43,614.16,"/F8",9.96,"Aliquet risus cum. Lacinia purus. Cubilia velit ac mag-"
37.61,593.36,288.42,602.20,"/F8",9.96,"nis porta porttitor leo ridiculus magnis. Nonummy neque"
37.61,581.40,288.45,590.25,"/F8",9.96,"eros a elit morbi laoreet sociis duis. Gravida massa eni"
37.61,569.45,288.43,578.29,"/F8",9.96,"metus malesuada inceptos nulla. Quisque curae id tempus"
37.61,557.49,288.44,566.34,"/F8",9.96,"justo faucibus adipiscing. Feugiat fames eget sem mollis"
37.61,545.54,288.42,554.38,"/F8",9.96,"ad donec ut. Integer risus metus dis tortor vel diam. Eges-"
37.61,533.58,288.45,542.43,"/F8",9.96,"tas massa ut litora ut mattis nulla gravida mus. Egestas"
37.61,521.63,288.42,530.47,"/F8",9.96,"neque leo. Lacinia ipsum nam elit sollicitudin. Natoque"
37.61,509.67,288.40,518.52,"/F8",9.96,"risus. Pretium etiam. Iaculis felis quam congue ultricies"
37.61,497.72,288.42,506.56,"/F8",9.96,"leo ante nullam. Quisque lorem in morbi. Pretium proin"
37.61,485.76,288.42,494.61,"/F8",9.96,"vestibulum. Iaculis augue eget scelerisque euismod risus"
37.61,473.81,288.41,482.65,"/F8",9.96,"pede sem. Euismod nulla nisi rutrum aliquet nec. Natoque"
37.61,461.85,288.45,470.70,"/F8",9.96,"lorem et nullam eu dictumst. Vivamus metus nonummy"
37.61,449.90,288.41,458.74,"/F8",9.96,"integer enim mi diam. Dapibus netus eu pellentesque con-"
37.61,437.94,288.45,446.79,"/F8",9.96,"sectetuer feugiat nullam fames. Nonummy class eros arcu"
37.61,425.99,246.93,434.83,"/F8",9.96,"augue sodales auctor lacus luctus tristique velit."
37.61,403.57,265.16,412.42,"/F27",9.96,"1.2. Quisque dolor mi tellus nullam dis nisl ad eget."
52.56,390.12,288.43,398.97,"/F8",9.96,"Lacinia etiam dis diam class vehicula vel. Integer velit"
37.61,378.17,288.43,387.01,"/F8",9.96,"netus magnis justo vestibulum. Laoreet justo donec morbi"
37.61,366.21,288.40,375.06,"/F8",9.96,"turpis curabitur ve ligula mus cubilia eros augue felis cras."
37.61,354.26,288.42,363.10,"/F8",9.96,"Aliquam neque nisi morbi gravida eu fringilla curae. Rhon-"
37.61,342.30,288.46,351.15,"/F8",9.96,"cus class quis facilisi eni platea. Commodo netus nam"
37.61,330.34,288.48,339.19,"/F8",9.96,"tortor. Egestas fames. Nonummy porta diam a purus"
37.61,318.39,288.45,327.24,"/F8",9.96,"rhoncus eni in dictum consectetuer vel augue commodo."
37.61,306.43,288.39,315.28,"/F8",9.96,"Potenti velit quis posuere feugiat. Cubilia nulla dis amet."
37.61,294.48,288.45,303.33,"/F8",9.96,"Gravida magna etiam arcu primis conubia odio tellus con-"
37.61,282.52,288.37,291.37,"/F8",9.96,"vallis netus senectus. Aliquam fusce vitae viverra ridiculus"
37.61,270.57,288.40,279.42,"/F8",9.96,"libero pulvinar parturient nullam senectus curae porta per"
37.61,258.61,288.43,267.46,"/F8",9.96,"pulvinar. Natoque felis. Quisque magna non morbi metus"
37.61,246.66,288.39,255.51,"/F8",9.96,"senectus ipsum sollicitudin. Euismod etiam. Posuere felis."
37.61,234.70,288.45,243.55,"/F8",9.96,"Posuere morbi gravida dui magnis sagittis. Sodales dolor"
37.61,222.75,288.39,231.60,"/F8",9.96,"nibh dis purus tristique orci per lacus vel aliquam lorem."
37.61,210.79,288.42,219.64,"/F8",9.96,"Lacinia etiam nisl lectus in rutrum. Laoreet fames at tris-"
37.61,198.84,288.43,207.68,"/F8",9.96,"tique feugiat nibh urna netus est orci metus quam fames"
37.61,186.88,288.44,195.73,"/F8",9.96,"mi. Posuere magna urna nisl adipiscing turpis. Laoreet"
37.61,174.93,66.41,183.77,"/F8",9.96,"ipsum."
52.56,162.97,288.42,171.82,"/F8",9.96,"Quisque augue neque sociosqu justo sollicitudin etiam."
37.61,151.02,288.41,159.86,"/F8",9.96,"Lacinia risus hac accumsan sollicitudin viverra elementum"
37.61,139.06,288.43,147.91,"/F8",9.96,"amet. Pretium fusce nisl mus erat fermentum nascetur"
37.61,127.11,288.39,135.95,"/F8",9.96,"litora parturient sollicitudin posuere morbi nibh. Blan-"
37.61,115.15,288.44,124.00,"/F8",9.96,"dit proin elit hac. Nonummy purus felis eros. Natoque"
37.61,103.20,288.43,112.04,"/F8",9.96,"curae arcu a quis etiam lobortis est consectetuer ornare."
37.61,91.24,288.48,100.09,"/F8",9.96,"Commodo fames. Laoreet purus nibh in. Laoreet ipsum"
37.61,79.29,288.39,88.13,"/F8",9.96,"vel nisl. Feugiat ipsum. Lacinia fames mi tristique iaculis"
306.60,748.78,557.43,757.62,"/F8",9.96,"porta morbi. Egestas donec. Posuere netus sit enim par-"
306.60,736.82,557.43,745.67,"/F8",9.96,"turient nunc. Rhoncus lacus ante eni amet hymenaeos. So-"
306.60,724.87,557.43,733.71,"/F8",9.96,"dales metus eni. Vivamus justo at etiam mi platea laoreet"
306.60,712.91,557.47,721.76,"/F8",9.96,"euismod maecenas. Nonummy lacus arcu leo. Blandit"
306.60,700.95,557.41,709.80,"/F8",9.96,"lorem in tincidunt nibh enim morbi fames. Natoque vitae"
306.60,689.00,557.47,697.85,"/F8",9.96,"arcu lorem vehicula ac pede augue eu mi. Conubia me-"
306.60,677.04,557.40,685.89,"/F8",9.96,"tus et a. Blandit ipsum diam dictumst dis pellentesque"
306.60,665.09,399.08,673.94,"/F8",9.96,"mattis. Iaculis porta."
306.60,642.67,557.51,651.52,"/F27",9.96,"1.3. Posuere porta purus integer aptent congue euismod"
327.99,630.72,366.16,639.56,"/F27",9.96,"ad diam."
321.55,617.27,557.44,626.11,"/F8",9.96,"Sodales lacus nonummy fusce enim. Conubia ipsum elit"
306.60,605.31,557.47,614.16,"/F8",9.96,"commodo hac. Blandit risus. Gravida magna justo con-"
306.60,593.36,557.44,602.20,"/F8",9.96,"sequat malesuada eget mus erat. Integer donec vestibu-"
306.60,581.40,557.40,590.25,"/F8",9.96,"lum scelerisque magnis et morbi ullamcorper sit. Dapibus"
306.60,569.45,557.43,578.29,"/F8",9.96,"metus. Gravida metus enim a. Pretium curae in neque"
306.60,557.49,557.40,566.34,"/F8",9.96,"porta facilisi mi. Laoreet justo class scelerisque sagittis"
306.60,545.54,557.36,554.38,"/F8",9.96,"curabitur duis dui eni. Aliquet velit nisl duis cras. Sodales"
306.60,533.58,557.40,542.43,"/F8",9.96,"lorem ad tempus aliquet integer tempus purus eu convallis"
306.60,521.63,557.42,530.47,"/F8",9.96,"a venenatis. Posuere vitae. Natoque fusce. Lacinia fusce."
306.60,509.67,557.40,518.52,"/F8",9.96,"Gravida porta velit torquent. Dapibus ipsum amet lobor-"
306.60,497.72,557.41,506.56,"/F8",9.96,"tis malesuada vehicula mauris viverra. Sodales fames felis"
306.60,485.76,557.42,494.61,"/F8",9.96,"ullamcorper pharetra cras vel. Egestas fusce sit eni at au-"
306.60,473.81,557.37,482.65,"/F8",9.96,"gue ac elit inceptos sed sollicitudin. Euismod felis lorem sit"
306.60,461.85,557.42,470.70,"/F8",9.96,"ante. Dapibus nulla vel odio dui. Sodales magna. Blandit"
306.60,449.90,467.24,458.74,"/F8",9.96,"curae mus vestibulum phasellus felis."
321.55,437.94,557.42,446.79,"/F8",9.96,"Iaculis fames elit porttitor pharetra justo ad consequat"
306.60,425.99,557.40,434.83,"/F8",9.96,"purus a. Laoreet etiam velit volutpat nibh dui nibh rhon-"
306.60,414.03,557.41,422.88,"/F8",9.96,"cus hendrerit facilisi nostra nullam metus. Conubia vi-"
306.60,402.08,557.40,410.92,"/F8",9.96,"tae porta a mollis ridiculus. Potenti lacus porta quisque"
306.60,390.12,557.43,398.97,"/F8",9.96,"rhoncus aenean id. Dapibus donec. Dapibus nulla orci"
306.60,378.17,557.43,387.01,"/F8",9.96,"posuere et magnis felis facilisis. Aliquam fames quam in"
306.60,366.21,557.42,375.06,"/F8",9.96,"molestie mus eros felis litora montes. Posuere ipsum. Vi-"
306.60,354.25,557.42,363.10,"/F8",9.96,"vamus neque nunc nisi eni curae adipiscing feugiat nunc"
306.60,342.30,557.40,351.15,"/F8",9.96,"enim felis. Blandit lorem dis erat torquent dapibus non-"
306.60,330.34,557.47,339.19,"/F8",9.96,"ummy diam molestie donec. Nonummy massa ut purus"
306.60,318.39,557.41,327.24,"/F8",9.96,"pellentesque vehicula ipsum. Sodales vitae ipsum arcu"
306.60,306.43,557.40,315.28,"/F8",9.96,"donec pretium. Potenti augue ad sagittis potenti quisque"
306.60,294.48,557.37,303.33,"/F8",9.96,"eget sollicitudin vestibulum. Natoque felis et quis vitae"
306.60,282.52,557.42,291.37,"/F8",9.96,"feugiat fermentum erat vel. Conubia class nibh molestie"
306.60,270.57,557.43,279.42,"/F8",9.96,"suscipit metus pellentesque. Nonummy fusce fames auc-"
306.60,258.61,557.43,267.46,"/F8",9.96,"tor nulla commodo eros nascetur mus sollicitudin nostra"
306.60,246.66,557.43,255.51,"/F8",9.96,"urna. Conubia risus porta. Lacinia ipsum. Rhoncus proin"
306.60,234.70,557.43,243.55,"/F8",9.96,"nam nisi inceptos habitasse ultrices accumsan eu. Laoreet"
306.60,222.75,557.42,231.59,"/F8",9.96,"lorem. Gravida class etiam gravida et lobortis erat. Ali-"
306.60,210.79,545.92,219.64,"/F8",9.96,"quam lacus erat a porta in morbi etiam nullam in non."
321.55,198.84,557.45,207.68,"/F8",9.96,"Iaculis lacus quam ante. Viverra class. Aliquet cu-"
306.60,186.88,557.44,195.73,"/F8",9.96,"rae magna aenean at mauris nunc consectetuer parturient"
306.60,174.93,557.44,183.77,"/F8",9.96,"nisi magna. Pretium class mi. Lacinia porta id penati-"
306.60,162.97,557.43,171.82,"/F8",9.96,"bus scelerisque hymenaeos ante litora congue sem adipisc-"
306.60,151.02,557.41,159.86,"/F8",9.96,"ing parturient. Vivamus morbi in erat lorem dolor libero"
306.60,139.06,557.44,147.91,"/F8",9.96,"velit curae conubia. Commodo ipsum ut dui ullamcorper"
306.60,127.11,557.40,135.95,"/F8",9.96,"lacinia suspendisse orci elit. Posuere donec. Pretium me-"
306.60,115.15,557.43,124.00,"/F8",9.96,"tus. Iaculis fusce class congue et. Dapibus ipsum lacus"
306.60,103.20,557.45,112.04,"/F8",9.96,"primis metus montes amet ac orci. Laoreet morbi felis"
306.60,91.24,557.40,100.09,"/F8",9.96,"pede augue dictum vestibulum eleifend cras blandit mi id"
306.60,79.29,557.38,88.13,"/F8",9.96,"nunc ac sollicitudin quisque ipsum orci nec. Vivamus velit"
295.15,61.35,300.13,70.20,"/F8",9.96,"2"
