37.61,748.78,135.58,757.62,"/F27",9.96,"1.1. Aliquet ipsum ad."
52.56,736.82,288.44,745.67,"/F8",9.96,"Feugiat fames. Sodales felis mi torquent risus a nunc"
37.61,724.87,288.47,733.71,"/F8",9.96,"metus mi cursus a. Nonummy justo netus ornare eu mag-"
37.61,712.91,288.39,721.76,"/F8",9.96,"nis dictumst. Pretium neque eros eleifend justo cras ligula"
37.61,700.96,288.49,709.80,"/F8",9.96,"aenean nec. Gravida magna odio arcu sed duis odio eges-"
37.61,689.00,288.40,697.85,"/F8",9.96,"tas orci adipiscing turpis ut senectus. Lacinia ipsum. Ali-"
37.61,677.04,288.43,685.89,"/F8",9.96,"quam proin at eget arcu felis nec convallis egestas purus."
37.61,665.09,288.44,673.94,"/F8",9.96,"Natoque netus porta congue etiam pulvinar leo sollici-"
37.61,653.13,288.41,661.98,"/F8",9.96,"tudin platea arcu facilisis. Conubia neque id nisi eget mi"
37.61,641.18,288.42,650.03,"/F8",9.96,"porttitor eros hac potenti fusce id hymenaeos adipiscing."
37.61,629.22,288.40,638.07,"/F8",9.96,"Dapibus neque per risus phasellus elit diam vestibulum"
37.61,617.27,288.44,626.11,"/F8",9.96,"dui class duis. Gravida netus ac nascetur augue id fer-"
37.61,605.31,288.46,614.16,"/F8",9.96,"mentum. Gravida morbi nunc conubia diam duis urna"
37.61,593.36,288.46,602.20,"/F8",9.96,"nonummy ac tellus. Viverra augue. Conubia lorem quam"
37.61,581.40,288.40,590.25,"/F8",9.96,"lacus. Cubilia proin adipiscing condimentum taciti at pul-"
37.61,569.45,288.39,578.29,"/F8",9.96,"vinar donec. Feugiat class ve mattis sagittis risus curabitur"
37.61,557.49,288.44,566.34,"/F8",9.96,"ligula. Gravida ipsum dis quam conubia eu orci molestie"
37.61,545.54,288.44,554.38,"/F8",9.96,"adipiscing turpis. Nonummy dolor nunc a lorem integer"
37.61,533.58,288.39,542.43,"/F8",9.96,"duis erat eni. Aliquam justo ut penatibus neque hendrerit"
37.61,521.63,288.41,530.47,"/F8",9.96,"lacinia taciti fringilla class orci. Posuere curae ante male-"
37.61,509.67,288.46,518.52,"/F8",9.96,"suada nullam dignissim euismod donec. Nonummy ipsum"
37.61,497.72,288.44,506.56,"/F8",9.96,"adipiscing pretium urna lacus cum enim ante fermentum"
37.61,485.76,257.81,494.61,"/F8",9.96,"auctor massa mollis. Viverra netus duis leo morbi."
52.56,473.81,288.49,482.65,"/F8",9.96,"Nonummy vitae eget accumsan semper eros dapibus"
37.61,461.85,288.70,470.70,"/F8",9.96,"morbi lorem nullam class ullamcorper. Gravida fusce. Feu-"
37.61,449.90,295.35,458.74,"/F8",9.96,"giat lacus cras arcu fusce sodales. Rhoncus justo et habitasse"
37.61,437.94,288.46,446.79,"/F8",9.96,"commodo ornare. Feugiat proin. Potenti augue feugiat"
37.61,425.99,288.41,434.83,"/F8",9.96,"tempor. Posuere donec class. Potenti velit arcu. Quisque"
37.61,414.03,288.45,422.88,"/F8",9.96,"purus odio cubilia in donec in. Egestas curae ante ele-"
37.61,402.08,288.43,410.92,"/F8",9.96,"mentum eu facilisis justo proin. Lacinia nulla dis tem-"
37.61,390.12,288.43,398.97,"/F8",9.96,"pus platea vivamus natoque nunc consectetuer bibendum"
37.61,378.17,288.44,387.01,"/F8",9.96,"lorem. Vivamus lacus urna vivamus euismod dictumst au-"
37.61,366.21,288.45,375.06,"/F8",9.96,"gue. Quisque nulla commodo vivamus vulputate congue ac"
37.61,354.26,288.43,363.10,"/F8",9.96,"sociis rutrum fusce maecenas. Integer felis augue. Posuere"
37.61,342.30,291.91,351.15,"/F8",9.96,"purus quam ullamcorper posuere scelerisque. Laoreet fames"
37.61,330.34,288.44,339.19,"/F8",9.96,"nec penatibus nostra. Posuere metus erat egestas et enim"
37.61,318.39,288.47,327.24,"/F8",9.96,"sed eros enim. Aliquet massa lacus urna dignissim ad"
37.61,306.43,288.46,315.28,"/F8",9.96,"morbi auctor. Rhoncus metus. Iaculis etiam id conse-"
37.61,294.48,288.46,303.33,"/F8",9.96,"quat fusce. Commodo fusce sit elementum lacinia congue"
37.61,282.52,288.42,291.37,"/F8",9.96,"curae lacinia taciti. Posuere lorem eget euismod metus in."
52.56,270.57,288.49,279.42,"/F8",9.96,"Conubia augue. Vivamus lacus orci accumsan penat-"
37.61,258.61,288.47,267.46,"/F8",9.96,"ibus a magna ve. Egestas justo. Laoreet nulla urna ve."
37.61,246.66,288.47,255.51,"/F8",9.96,"Commodo lacus ipsum iaculis in massa mi volutpat cum."
37.61,234.70,288.44,243.55,"/F8",9.96,"Quisque class aliquet sociosqu dolor augue a lacinia. Po-"
37.61,222.75,288.42,231.60,"/F8",9.96,"suere neque id. Feugiat porta neque primis fusce vitae"
37.61,210.79,288.44,219.64,"/F8",9.96,"cum. Posuere netus erat est a tellus. Vivamus dolor ante"
37.61,198.84,288.40,207.68,"/F8",9.96,"est lectus in pede. Dapibus dolor per elit ante libero conu-"
37.61,186.88,288.45,195.73,"/F8",9.96,"bia eros ante nonummy. Cubilia proin. Rhoncus purus"
37.61,174.93,288.44,183.77,"/F8",9.96,"lacus. Feugiat netus quam mattis posuere egestas nisi."
37.61,162.97,288.41,171.82,"/F8",9.96,"Viverra lacus vestibulum sagittis felis nisl. Nonummy ne-"
37.61,151.02,288.42,159.86,"/F8",9.96,"tus eget nullam semper felis quam sem praesent imperdiet"
37.61,139.06,288.48,147.91,"/F8",9.96,"massa in per ligula. Pretium magna mi ad quam nulla"
37.61,127.11,288.43,135.95,"/F8",9.96,"natoque et felis ad nullam dis litora pharetra consequat"
37.61,115.15,288.42,124.00,"/F8",9.96,"sit nam. Euismod risus. Cubilia risus eros arcu est nulla"
37.61,103.20,288.41,112.04,"/F8",9.96,"nonummy imperdiet urna purus platea velit potenti urna"
37.61,91.24,288.41,100.09,"/F8",9.96,"ridiculus. Lacinia etiam. Quisque ipsum nisl iaculis ad"
37.61,79.29,286.50,88.13,"/F8",9.96,"vivamus. Pretium donec quis vel litora a parturient cum."
306.60,748.78,397.94,757.62,"/F27",9.96,"1.2. Vivamus ipsum."
321.55,733.83,557.43,742.68,"/F8",9.96,"Vivamus justo. Cubilia felis dapibus curae etiam tel-"
306.60,721.88,557.42,730.72,"/F8",9.96,"lus ve inceptos hac erat. Quisque proin. Nonummy neque"
306.60,709.92,557.40,718.77,"/F8",9.96,"class. Lacinia justo nibh cum felis nunc sit consectetuer."
306.60,697.97,557.44,706.81,"/F8",9.96,"Potenti morbi ut malesuada in. Cubilia donec eu curae"
306.60,686.01,557.37,694.86,"/F8",9.96,"consectetuer tristique libero cum id taciti lobortis ut au-"
306.60,674.06,557.44,682.90,"/F8",9.96,"gue. Pretium curae sem nisl a amet donec proin libero."
306.60,662.10,557.44,670.95,"/F8",9.96,"Nonummy netus diam integer tempus eget. Potenti la-"
306.60,650.15,557.40,658.99,"/F8",9.96,"cus dolor dignissim vehicula in scelerisque nisi. Integer"
306.60,638.19,557.44,647.04,"/F8",9.96,"felis elit gravida eget id dolor congue. Viverra massa me-"
306.60,626.23,557.44,635.08,"/F8",9.96,"tus. Blandit curae. Rhoncus fames. Iaculis donec. Po-"
306.60,614.28,557.42,623.13,"/F8",9.96,"suere purus potenti sem. Egestas lacus aliquet justo hac"
306.60,602.32,557.40,611.17,"/F8",9.96,"diam. Vivamus lacus vestibulum iaculis eni. Viverra lorem"
306.60,590.37,557.45,599.22,"/F8",9.96,"eget dapibus nibh molestie tellus commodo aliquam ae-"
306.60,578.41,359.87,587.26,"/F8",9.96,"nean fames."
370.48,578.41,433.65,587.26,"/F8",9.96,"Posuere fusce."
444.25,578.41,557.45,587.26,"/F8",9.96,"Feugiat proin hac cursus"
306.60,566.46,556.97,575.31,"/F8",9.96,"torquent fames facilisis nec sodales. Natoque risus augue."
321.55,554.50,557.46,563.35,"/F8",9.96,"Nonummy vitae egestas eget. Gravida netus ut hen-"
306.60,542.55,557.43,551.39,"/F8",9.96,"drerit eros nostra sodales urna ac consectetuer. Integer"
306.60,530.59,557.43,539.44,"/F8",9.96,"lorem massa ornare montes cum nisi convallis consectetuer"
306.60,518.64,557.41,527.48,"/F8",9.96,"nam fringilla feugiat morbi. Aliquam vitae urna volutpat"
306.60,506.68,557.45,515.53,"/F8",9.96,"hymenaeos duis. Vivamus donec id malesuada a imperdiet"
306.60,494.73,557.42,503.57,"/F8",9.96,"augue nunc cubilia. Nonummy neque eros eu sollicitudin"
306.60,482.77,557.46,491.62,"/F8",9.96,"commodo accumsan. Viverra purus eros a curae et mattis"
306.60,470.82,557.41,479.66,"/F8",9.96,"bibendum euismod. Potenti donec orci dis lorem sociis var-"
306.60,458.86,557.42,467.71,"/F8",9.96,"ius ante cras adipiscing eu consectetuer nonummy luctus"
306.60,446.91,557.37,455.75,"/F8",9.96,"fringilla at venenatis suspendisse sem. Blandit felis ve cur-"
306.60,434.95,557.40,443.80,"/F8",9.96,"abitur fames eu consequat elit sit nulla ipsum pede nullam"
306.60,423.00,557.41,431.84,"/F8",9.96,"adipiscing. Feugiat augue quam netus et varius volutpat."
306.60,411.04,557.42,419.89,"/F8",9.96,"Sodales felis nec. Rhoncus fames nec quis imperdiet vene-"
306.60,399.09,557.42,407.93,"/F8",9.96,"natis orci venenatis interdum. Nonummy nulla ad auctor"
306.60,387.13,557.40,395.98,"/F8",9.96,"venenatis mi. Vivamus justo vestibulum ad sollicitudin"
306.60,375.18,557.41,384.02,"/F8",9.96,"dapibus. Euismod class curae scelerisque et cursus ve vi-"
306.60,363.22,557.46,372.07,"/F8",9.96,"vamus urna lacinia id arcu. Nonummy vitae. Nonummy"
306.60,351.27,557.38,360.11,"/F8",9.96,"curae diam ve ridiculus ullamcorper. Blandit velit dui tem-"
306.60,339.31,557.42,348.16,"/F8",9.96,"pus nascetur elit tempor ve erat donec ipsum pharetra hac"
306.60,327.36,557.37,336.20,"/F8",9.96,"et. Integer fames nulla iaculis velit nisl. Gravida risus per"
306.60,315.40,557.44,324.25,"/F8",9.96,"fusce risus curae. Blandit proin ac ve arcu eget magna me-"
306.60,303.45,557.41,312.29,"/F8",9.96,"tus imperdiet vestibulum. Gravida donec massa potenti"
306.60,291.49,512.44,300.34,"/F8",9.96,"elementum urna arcu hymenaeos nam aliquam."
306.60,261.60,552.49,270.45,"/F17",9.96,"2. Aliquet risus ipsum commodo posuere lacinia."
321.55,240.68,557.46,249.53,"/F8",9.96,"Sodales purus neque commodo ligula eget ad luctus eu"
306.60,228.73,557.42,237.57,"/F8",9.96,"dolor et ligula consectetuer hac. Cubilia neque natoque"
306.60,216.77,557.40,225.62,"/F8",9.96,"orci ut torquent pretium id et dictum fermentum curae."
306.60,204.82,557.47,213.66,"/F8",9.96,"Iaculis magna. Rhoncus justo sem fames per erat adip-"
306.60,192.86,557.39,201.71,"/F8",9.96,"iscing eu pellentesque conubia platea et. Quisque risus."
306.60,180.90,557.39,189.75,"/F8",9.96,"Feugiat felis morbi congue risus parturient. Cubilia nulla"
306.60,168.95,557.44,177.80,"/F8",9.96,"iaculis taciti quam ad donec id semper bibendum. Po-"
306.60,156.99,557.40,165.84,"/F8",9.96,"tenti dolor pede. Laoreet massa sit torquent a ultrices duis"
306.60,145.04,557.39,153.89,"/F8",9.96,"eleifend pellentesque ligula etiam sociosqu in ullamcorper"
306.60,133.08,557.40,141.93,"/F8",9.96,"ut. Rhoncus porta dolor viverra sit ad libero lobortis. Ali-"
306.60,121.13,557.45,129.98,"/F8",9.96,"quam lorem enim vivamus consequat mi. Aliquam morbi"
306.60,109.17,557.40,118.02,"/F8",9.96,"conubia quisque dictumst class imperdiet platea ve nasce-"
306.60,97.22,557.44,106.07,"/F8",9.96,"tur dictumst. Rhoncus magna arcu quis diam habitant"
306.60,85.26,557.42,94.11,"/F8",9.96,"lacinia inceptos elit. Integer metus nam donec. Gravida"
295.15,61.35,300.13,70.20,"/F8",9.96,"2"
