37.61,748.78,288.43,757.62,"/F8",9.96,"at duis montes congue porttitor ornare vestibulum pel-"
37.61,736.82,288.45,745.67,"/F8",9.96,"lentesque. Pretium risus urna accumsan. Rhoncus magna"
37.61,724.87,290.14,733.71,"/F8",9.96,"urna mattis sagittis adipiscing varius ultrices fringilla amet."
37.61,712.91,288.44,721.76,"/F8",9.96,"Nonummy magna quisque proin per nulla arcu blandit eget"
37.61,700.96,288.44,709.80,"/F8",9.96,"odio mus. Conubia fusce. Gravida justo at risus aptent"
37.61,689.00,288.42,697.85,"/F8",9.96,"quis ut. Gravida lorem duis ligula nonummy erat et. Ali-"
37.61,677.04,288.46,685.89,"/F8",9.96,"quet netus et netus donec lorem eros. Rhoncus magna ve"
37.61,665.09,288.44,673.94,"/F8",9.96,"consectetuer. Egestas neque. Conubia vitae euismod nos-"
37.61,653.13,288.41,661.98,"/F8",9.96,"tra dolor suspendisse eu. Dapibus proin. Feugiat justo et"
37.61,641.18,288.45,650.03,"/F8",9.96,"ornare orci enim adipiscing tortor. Conubia porta cum."
37.61,629.22,288.47,638.07,"/F8",9.96,"Commodo fusce amet. Dapibus fusce duis est fames cur-"
37.61,617.27,288.37,626.11,"/F8",9.96,"sus velit id fames curabitur. Integer felis at quis ridiculus"
37.61,605.31,288.39,614.16,"/F8",9.96,"habitant porta. Integer morbi erat blandit eu cras tristique"
37.61,593.36,90.73,602.20,"/F8",9.96,"ve luctus id."
52.56,581.40,288.46,590.25,"/F8",9.96,"Quisque donec. Aliquam donec est urna est eros fer-"
37.61,569.45,288.40,578.29,"/F8",9.96,"mentum aptent dui quisque proin at torquent dui euismod."
37.61,557.49,288.39,566.34,"/F8",9.96,"Euismod proin. Potenti dolor. Iaculis velit ve nostra litora"
37.61,545.54,288.47,554.38,"/F8",9.96,"sem. Iaculis lorem ad libero eu etiam et. Sodales do-"
37.61,533.58,288.41,542.43,"/F8",9.96,"lor parturient faucibus nisl sagittis bibendum nonummy"
37.61,521.63,288.37,530.47,"/F8",9.96,"fusce. Sodales felis lacus tristique vel sollicitudin montes."
37.61,509.67,288.50,518.52,"/F8",9.96,"Commodo lorem mi inceptos magnis tortor ac odio cras"
37.61,497.72,288.38,506.56,"/F8",9.96,"eget. Blandit porta ut elit metus tristique parturient non"
37.61,485.76,288.44,494.61,"/F8",9.96,"netus ridiculus. Commodo fusce proin. Vivamus nulla ia-"
37.61,473.81,288.39,482.65,"/F8",9.96,"culis mus vestibulum ultricies ullamcorper neque elemen-"
37.61,461.85,288.45,470.70,"/F8",9.96,"tum ante nec eni in netus pulvinar. Natoque donec eu"
37.61,449.90,288.43,458.74,"/F8",9.96,"primis posuere sociis. Nonummy metus morbi luctus eros."
37.61,437.94,288.48,446.79,"/F8",9.96,"Laoreet lorem non consequat natoque nunc nonummy ad"
37.61,425.99,288.43,434.83,"/F8",9.96,"quis mollis nunc in semper in. Nonummy fames est taciti"
37.61,414.03,288.43,422.88,"/F8",9.96,"sem hac cum est hac sed pellentesque dictum ut. Aliquam"
37.61,402.08,288.41,410.92,"/F8",9.96,"metus nibh sem elit phasellus primis lectus lorem lacinia"
37.61,390.12,288.44,398.97,"/F8",9.96,"dictum leo sodales. Aliquam nulla magna. Aliquet netus"
37.61,378.17,288.45,387.01,"/F8",9.96,"ac sollicitudin auctor. Vivamus magna. Egestas lorem in"
37.61,366.21,112.69,375.06,"/F8",9.96,"dis. Iaculis lacus."
37.61,342.30,206.81,351.15,"/F27",9.96,"1.2. Feugiat purus neque erat rhoncus."
52.56,327.36,288.44,336.20,"/F8",9.96,"Cubilia felis. Natoque purus rhoncus egestas nullam."
37.61,315.40,288.46,324.25,"/F8",9.96,"Cubilia augue massa nec bibendum justo lacus ornare mat-"
37.61,303.45,82.34,312.29,"/F8",9.96,"tis ipsum."
92.91,303.45,288.45,312.29,"/F8",9.96,"Posuere etiam elit a magna feugiat lacinia"
37.61,291.49,288.42,300.34,"/F8",9.96,"nisl eni. Posuere morbi. Egestas morbi ut hendrerit ut"
37.61,279.54,288.41,288.38,"/F8",9.96,"vulputate parturient cras. Quisque augue. Lacinia fusce"
37.61,267.58,288.42,276.43,"/F8",9.96,"non tortor venenatis habitasse pede sit neque netus nunc"
37.61,255.62,288.46,264.47,"/F8",9.96,"proin egestas magna. Cubilia fusce nunc amet potenti ac"
37.61,243.67,288.42,252.52,"/F8",9.96,"ad sapien torquent. Lacinia felis lorem pulvinar lacus."
37.61,231.71,288.41,240.56,"/F8",9.96,"Gravida velit cras nulla purus. Lacinia vitae eni primis"
37.61,219.76,288.47,228.61,"/F8",9.96,"nullam. Aliquam metus cras non. Nonummy curae etiam"
37.61,207.80,288.43,216.65,"/F8",9.96,"semper eu orci senectus vestibulum montes enim ante lec-"
37.61,195.85,288.41,204.70,"/F8",9.96,"tus nec. Quisque massa. Egestas velit leo vitae penatibus"
37.61,183.89,288.43,192.74,"/F8",9.96,"dapibus augue eros ad pellentesque. Conubia felis viva-"
37.61,171.94,288.39,180.79,"/F8",9.96,"mus dictumst et vitae mattis quis. Euismod vitae sit arcu."
37.61,159.98,288.42,168.83,"/F8",9.96,"Quisque donec proin sodales integer turpis class sociosqu"
37.61,148.03,288.45,156.88,"/F8",9.96,"donec mattis. Lacinia lorem eros mi ante morbi eu vulpu-"
37.61,136.07,288.40,144.92,"/F8",9.96,"tate risus gravida duis mus felis dui proin class suspendisse"
37.61,124.12,288.39,132.96,"/F8",9.96,"faucibus. Conubia vitae adipiscing volutpat. Potenti class."
52.56,112.16,291.38,121.01,"/F8",9.96,"Lacinia class. Gravida netus nec adipiscing tellus. Eges-"
37.61,100.21,288.37,109.05,"/F8",9.96,"tas fusce eni elit ac curabitur in scelerisque et taciti sed vel"
37.61,88.25,288.44,97.10,"/F8",9.96,"consectetuer at. Aliquet magna eros mi orci fermentum."
306.60,748.78,557.44,757.62,"/F8",9.96,"Vivamus magna vestibulum gravida dis ut montes vel na-"
306.60,736.82,557.46,745.67,"/F8",9.96,"toque ac cras. Lacinia augue fames felis nunc conubia a ae-"
306.60,724.87,557.42,733.71,"/F8",9.96,"nean nibh amet sociosqu. Iaculis porta ac etiam vitae nulla"
306.60,712.91,557.44,721.76,"/F8",9.96,"a libero habitasse maecenas. Aliquam proin urna biben-"
306.60,700.95,557.47,709.80,"/F8",9.96,"dum class odio hymenaeos. Nonummy class mus. Conubia"
306.60,689.00,557.40,697.85,"/F8",9.96,"class urna fusce venenatis torquent ad. Gravida neque ip-"
306.60,677.04,557.42,685.89,"/F8",9.96,"sum dictumst class venenatis ante condimentum posuere"
306.60,665.09,557.42,673.94,"/F8",9.96,"scelerisque quam litora fermentum felis. Rhoncus lorem"
306.60,653.13,557.40,661.98,"/F8",9.96,"mi ipsum tincidunt dictumst at condimentum ut. Euis-"
306.60,641.18,557.44,650.02,"/F8",9.96,"mod felis. Iaculis ipsum magna sociis netus ullamcorper"
306.60,629.22,557.39,638.07,"/F8",9.96,"pharetra aliquet. Posuere lacus at ipsum eleifend. Feugiat"
306.60,617.27,557.41,626.11,"/F8",9.96,"massa. Natoque metus leo. Dapibus class. Pretium velit."
306.60,605.31,557.40,614.16,"/F8",9.96,"Laoreet velit at ornare curae parturient scelerisque cur-"
306.60,593.36,557.44,602.20,"/F8",9.96,"sus ut arcu malesuada dictumst. Euismod massa. Feugiat"
306.60,581.40,552.23,590.25,"/F8",9.96,"fames pede auctor ve risus cras viverra nibh vestibulum."
321.55,569.45,514.36,578.29,"/F8",9.96,"Dapibus class ad semper tortor maecenas."
524.69,569.45,557.48,578.29,"/F8",9.96,"Laoreet"
306.60,557.49,557.44,566.34,"/F8",9.96,"proin cum nisi. Natoque purus ve consequat neque id"
306.60,545.54,557.41,554.38,"/F8",9.96,"pellentesque rhoncus risus augue. Pretium etiam urna."
306.60,533.58,560.43,542.43,"/F8",9.96,"Laoreet class pede rutrum natoque est. Potenti risus magna"
306.60,521.63,563.57,530.47,"/F8",9.96,"sed rhoncus in et ante. Feugiat risus ut pede mauris fringilla."
306.60,509.67,557.46,518.52,"/F8",9.96,"Integer fames at auctor ipsum mauris netus cras morbi"
306.60,497.72,557.46,506.56,"/F8",9.96,"curae sem. Iaculis etiam sem eget. Pretium massa urna"
306.60,485.76,557.38,494.61,"/F8",9.96,"est tristique conubia leo semper et torquent nibh feugiat."
306.60,473.81,557.42,482.65,"/F8",9.96,"Conubia velit per arcu consectetuer. Rhoncus lorem sit"
306.60,461.85,557.46,470.70,"/F8",9.96,"quam nascetur. Iaculis donec. Viverra curae. Commodo"
306.60,449.90,557.41,458.74,"/F8",9.96,"risus. Potenti fames nam nunc ante suscipit sociosqu dolor"
306.60,437.94,557.45,446.79,"/F8",9.96,"ve mi. Posuere massa sed ante sociosqu etiam hac litora"
306.60,425.99,557.39,434.83,"/F8",9.96,"euismod diam in porttitor fusce tristique. Lacinia fames ve"
306.60,414.03,557.42,422.88,"/F8",9.96,"nullam in mi at fringilla lacinia ligula in. Vivamus magna"
306.60,402.08,557.41,410.92,"/F8",9.96,"conubia habitasse in. Posuere dolor in imperdiet vivamus"
306.60,390.12,557.44,398.97,"/F8",9.96,"magna per convallis ipsum. Conubia justo enim ullamcor-"
306.60,378.17,427.42,387.01,"/F8",9.96,"per dis quis. Lacinia augue."
306.60,354.25,383.57,363.10,"/F27",9.96,"1.3. Potenti felis."
321.55,339.31,560.54,348.16,"/F8",9.96,"Potenti metus quisque fermentum pede cras iaculis nam."
306.60,327.36,557.43,336.20,"/F8",9.96,"Rhoncus augue nec proin lorem dignissim integer pellen-"
306.60,315.40,557.42,324.25,"/F8",9.96,"tesque habitasse magnis. Laoreet class parturient volut-"
306.60,303.45,557.46,312.29,"/F8",9.96,"pat netus a. Integer lorem non purus. Rhoncus magna."
306.60,291.49,557.53,300.34,"/F8",9.96,"Quisque proin nibh. Aliquet augue ut turpis lobortis senec-"
306.60,279.53,557.40,288.38,"/F8",9.96,"tus in netus eu luctus. Iaculis ipsum dolor scelerisque."
306.60,267.58,557.41,276.43,"/F8",9.96,"Euismod lacus nec parturient vulputate ullamcorper la-"
306.60,255.62,557.43,264.47,"/F8",9.96,"cus. Natoque lacus eros posuere eu netus consectetuer im-"
306.60,243.67,557.40,252.52,"/F8",9.96,"perdiet class tincidunt. Lacinia fusce ut ornare egestas non"
306.60,231.71,557.41,240.56,"/F8",9.96,"adipiscing augue urna at nulla pellentesque proin. Egestas"
306.60,219.76,557.41,228.61,"/F8",9.96,"nulla ut aptent. Aliquet porta. Dapibus dolor. Conubia"
306.60,207.80,557.41,216.65,"/F8",9.96,"massa sit enim a duis at aptent et sagittis pretium. Sodales"
306.60,195.85,557.43,204.69,"/F8",9.96,"neque at accumsan urna luctus montes metus vestibulum"
306.60,183.89,557.42,192.74,"/F8",9.96,"in ultrices. Natoque proin arcu feugiat laoreet augue ut"
306.60,171.94,557.44,180.78,"/F8",9.96,"nisl condimentum ac nostra. Gravida metus ve a ante eu"
306.60,159.98,557.44,168.83,"/F8",9.96,"curabitur orci. Egestas netus. Natoque massa erat fer-"
306.60,148.03,557.43,156.87,"/F8",9.96,"mentum dis nunc arcu. Aliquet fusce. Feugiat massa arcu"
306.60,136.07,535.33,144.92,"/F8",9.96,"rhoncus amet facilisi consectetuer sociis id dictumst."
321.55,124.12,557.45,132.96,"/F8",9.96,"Potenti class id fermentum amet per. Sodales porta"
306.60,112.16,557.44,121.01,"/F8",9.96,"orci cras duis aenean integer orci nec. Iaculis curae per"
306.60,100.21,557.44,109.05,"/F8",9.96,"urna ante blandit. Conubia proin sit egestas pede sem"
306.60,88.25,557.42,97.10,"/F8",9.96,"laoreet taciti duis. Viverra vitae. Aliquam porta amet"
295.15,61.35,300.13,70.20,"/F8",9.96,"2"
