37.61,748.78,288.42,757.62,"/F8",9.96,"laoreet platea elementum sociosqu. Aliquet vitae proin."
37.61,736.82,288.48,745.67,"/F8",9.96,"Blandit curae mus vivamus eni odio nec. Commodo magna"
37.61,724.87,288.46,733.71,"/F8",9.96,"ut magna scelerisque ad aenean pellentesque nec massa"
37.61,712.91,288.44,721.76,"/F8",9.96,"convallis volutpat. Rhoncus netus. Commodo metus risus"
37.61,700.96,288.42,709.80,"/F8",9.96,"turpis cum ornare et. Pretium nulla nibh aenean tortor"
37.61,689.00,288.46,697.85,"/F8",9.96,"netus. Posuere magna justo odio a pede vestibulum at"
37.61,677.04,288.46,685.89,"/F8",9.96,"penatibus nunc. Posuere class. Egestas massa. Laoreet"
37.61,665.09,154.06,673.94,"/F8",9.96,"curae parturient sociosqu."
164.10,665.09,246.20,673.94,"/F8",9.96,"Vivamus lacus eu."
256.24,665.09,288.44,673.94,"/F8",9.96,"Feugiat"
37.61,653.13,288.47,661.98,"/F8",9.96,"magna quis sem vivamus eget. Posuere lacus etiam quam"
37.61,641.18,288.46,650.03,"/F8",9.96,"commodo a mauris urna eget taciti in. Egestas lorem nisi"
37.61,629.22,288.41,638.07,"/F8",9.96,"cubilia in consequat purus. Viverra fusce in nulla felis"
37.61,617.27,288.47,626.11,"/F8",9.96,"luctus donec feugiat lacus. Commodo class ad. Conubia"
37.61,605.31,288.39,614.16,"/F8",9.96,"netus urna tristique tempus a parturient per parturient"
37.61,593.36,288.43,602.20,"/F8",9.96,"fermentum erat morbi condimentum. Feugiat risus mi do-"
37.61,581.40,288.42,590.25,"/F8",9.96,"lor dictum. Integer ipsum amet cras conubia a scelerisque."
37.61,558.99,121.90,567.83,"/F27",9.96,"1.2. Gravida dolor."
52.56,545.54,288.46,554.38,"/F8",9.96,"Gravida metus urna senectus magna netus turpis mau-"
37.61,533.58,288.44,542.43,"/F8",9.96,"ris. Posuere class ipsum nullam morbi lacus congue nostra"
37.61,521.63,288.47,530.47,"/F8",9.96,"leo. Quisque lorem id cum arcu pede maecenas euismod"
37.61,509.67,288.43,518.52,"/F8",9.96,"pellentesque malesuada. Cubilia fusce nisi conubia arcu a"
37.61,497.72,288.42,506.56,"/F8",9.96,"dolor posuere vivamus morbi. Cubilia lacus adipiscing ul-"
37.61,485.76,288.43,494.61,"/F8",9.96,"trices euismod. Rhoncus ipsum eu pellentesque aenean id"
37.61,473.81,288.44,482.65,"/F8",9.96,"tortor pharetra id. Quisque magna in dolor in donec male-"
37.61,461.85,288.44,470.70,"/F8",9.96,"suada adipiscing diam vulputate eu id eu urna. Iaculis"
37.61,449.90,288.42,458.74,"/F8",9.96,"curae per eget pellentesque. Gravida morbi. Posuere ip-"
37.61,437.94,288.40,446.79,"/F8",9.96,"sum orci nisi risus magnis scelerisque felis elementum duis"
37.61,425.99,288.39,434.83,"/F8",9.96,"eni sit tristique rutrum. Euismod nulla ut. Posuere fames"
37.61,414.03,288.42,422.88,"/F8",9.96,"ut mauris eu odio in ultricies adipiscing. Feugiat lorem"
37.61,402.08,288.40,410.92,"/F8",9.96,"eu vitae praesent parturient dictum metus. Cubilia porta"
37.61,390.12,288.43,398.97,"/F8",9.96,"justo netus dolor est curabitur mauris. Laoreet vitae do-"
37.61,378.17,288.43,387.01,"/F8",9.96,"lor nullam hac cras diam adipiscing turpis in mauris augue"
37.61,366.21,288.45,375.06,"/F8",9.96,"sodales pede eget libero in diam. Commodo morbi vestibu-"
37.61,354.26,288.43,363.10,"/F8",9.96,"lum interdum purus ac tortor morbi accumsan vestibulum"
37.61,342.30,288.42,351.15,"/F8",9.96,"auctor dui arcu urna blandit. Blandit netus ipsum porta"
37.61,330.34,288.43,339.19,"/F8",9.96,"suspendisse. Cubilia ipsum curae a dapibus mollis neque"
37.61,318.39,288.43,327.24,"/F8",9.96,"et a turpis erat. Posuere augue mi facilisis curae. Inte-"
37.61,306.43,288.43,315.28,"/F8",9.96,"ger lorem ac diam tempus proin pretium. Dapibus risus."
37.61,294.48,278.13,303.33,"/F8",9.96,"Nonummy magna per enim nulla scelerisque accumsan."
52.56,282.52,288.46,291.37,"/F8",9.96,"Gravida fames urna scelerisque conubia ullamcorper"
37.61,270.57,288.44,279.42,"/F8",9.96,"ante. Dapibus morbi nec ante amet sit a aptent. Laoreet"
37.61,258.61,288.45,267.46,"/F8",9.96,"augue eni interdum justo gravida nam et a pede. Viverra"
37.61,246.66,288.40,255.51,"/F8",9.96,"porta elit non posuere nisl in nam facilisis. Integer felis."
37.61,234.70,288.38,243.55,"/F8",9.96,"Cubilia nulla laoreet vulputate aenean ultrices tristique"
37.61,222.75,288.45,231.60,"/F8",9.96,"auctor nulla risus. Commodo vitae ad varius ut mi dui"
37.61,210.79,288.41,219.64,"/F8",9.96,"facilisis diam pellentesque mauris congue dolor adipiscing"
37.61,198.84,288.43,207.68,"/F8",9.96,"condimentum. Sodales felis eget nec risus justo fusce non-"
37.61,186.88,288.43,195.73,"/F8",9.96,"ummy quis nibh at vel mauris curae ve morbi. Aliquet"
37.61,174.93,288.41,183.77,"/F8",9.96,"donec cras sed ut nisi inceptos nulla consectetuer faucibus"
37.61,162.97,288.44,171.82,"/F8",9.96,"risus. Feugiat fusce. Euismod curae diam neque ac senec-"
37.61,151.02,288.40,159.86,"/F8",9.96,"tus erat pretium. Gravida netus nunc ultrices senectus"
37.61,139.06,288.44,147.91,"/F8",9.96,"vitae ac varius dictumst enim. Conubia lacus ipsum fa-"
37.61,127.11,288.38,135.95,"/F8",9.96,"cilisi nisl tortor cras consectetuer. Viverra purus duis dui"
37.61,115.15,288.43,124.00,"/F8",9.96,"mus ad. Aliquet fames. Egestas metus. Iaculis velit enim"
37.61,103.20,288.40,112.04,"/F8",9.96,"imperdiet mi convallis fusce id nibh. Potenti donec pede."
37.61,91.24,288.43,100.09,"/F8",9.96,"Sodales curae ante semper libero eni. Gravida neque enim"
37.61,79.29,288.46,88.13,"/F8",9.96,"eros pede hymenaeos dolor lorem condimentum hac litora"
306.60,748.78,557.41,757.62,"/F8",9.96,"morbi viverra. Iaculis curae pede nascetur senectus eu sus-"
306.60,736.82,550.13,745.67,"/F8",9.96,"pendisse pede. Iaculis vitae duis nulla porttitor potenti."
321.55,724.87,557.46,733.71,"/F8",9.96,"Nonummy porta justo a cubilia ve conubia nibh eu ne-"
306.60,712.91,557.40,721.76,"/F8",9.96,"tus. Quisque lacus conubia dignissim id hendrerit eget."
306.60,700.95,557.43,709.80,"/F8",9.96,"Vivamus proin et. Nonummy neque at donec consectetuer."
306.60,689.00,557.43,697.85,"/F8",9.96,"Gravida neque ac ridiculus massa hymenaeos fermentum."
306.60,677.04,562.97,685.89,"/F8",9.96,"Commodo purus. Integer fusce enim natoque urna. Quisque"
306.60,665.09,557.40,673.94,"/F8",9.96,"justo nisl lacus quisque pretium tempus. Posuere fusce ac"
306.60,653.13,557.35,661.98,"/F8",9.96,"aptent ridiculus ad vulputate imperdiet felis facilisis pede"
306.60,641.18,557.40,650.02,"/F8",9.96,"nec tortor lacus iaculis enim volutpat consectetuer nostra"
306.60,629.22,557.40,638.07,"/F8",9.96,"dolor interdum. Sodales fusce in magnis etiam vel vestibu-"
306.60,617.27,557.44,626.11,"/F8",9.96,"lum ve ornare. Iaculis purus duis maecenas sed potenti"
306.60,605.31,557.43,614.16,"/F8",9.96,"porta fames sodales quis dictumst magna netus. Quisque"
306.60,593.36,557.46,602.20,"/F8",9.96,"morbi amet phasellus congue class. Lacinia magna. Viva-"
306.60,581.40,557.41,590.25,"/F8",9.96,"mus morbi arcu lobortis hendrerit a nec fermentum cursus"
306.60,569.45,557.41,578.29,"/F8",9.96,"a pharetra arcu mattis. Feugiat porta cras. Aliquet ipsum"
306.60,557.49,557.45,566.34,"/F8",9.96,"at dolor ac erat tempus primis justo at donec ad auctor"
306.60,545.54,557.42,554.38,"/F8",9.96,"hac. Sodales justo. Blandit class ante. Aliquet justo mi"
306.60,533.58,557.40,542.43,"/F8",9.96,"duis fringilla tortor hendrerit. Iaculis donec. Rhoncus"
306.60,521.63,557.49,530.47,"/F8",9.96,"fames leo cras accumsan sed aliquam lorem quam a amet"
306.60,509.67,557.40,518.52,"/F8",9.96,"ad metus faucibus vestibulum. Natoque velit elit a nisi"
306.60,497.72,484.87,506.56,"/F8",9.96,"curae molestie vulputate justo dignissim."
306.60,467.83,467.48,476.67,"/F17",9.96,"2. Egestas justo etiam a aptent."
321.55,446.91,557.44,455.75,"/F8",9.96,"Euismod donec risus lectus. Aliquet ipsum mus par-"
306.60,434.95,557.38,443.80,"/F8",9.96,"turient ridiculus suspendisse facilisis. Egestas magna arcu."
306.60,423.00,557.41,431.84,"/F8",9.96,"Aliquam proin amet quis eleifend risus fusce risus. Cu-"
306.60,411.04,557.36,419.89,"/F8",9.96,"bilia augue iaculis duis porttitor lectus turpis vel. Viverra"
306.60,399.09,557.39,407.93,"/F8",9.96,"fusce ac velit in neque id vulputate felis sed cras adipisc-"
306.60,387.13,557.40,395.98,"/F8",9.96,"ing ante porttitor. Integer justo dis turpis montes metus"
306.60,375.18,557.44,384.02,"/F8",9.96,"praesent justo. Aliquam justo. Sodales augue orci ele-"
306.60,363.22,557.40,372.07,"/F8",9.96,"mentum cras egestas a. Blandit risus vestibulum dictumst"
306.60,351.27,557.40,360.11,"/F8",9.96,"morbi. Aliquet morbi cras sociis tincidunt lacus hac odio."
306.60,339.31,557.44,348.16,"/F8",9.96,"Commodo ipsum morbi. Vivamus felis per primis feugiat"
306.60,327.36,557.43,336.20,"/F8",9.96,"sodales platea. Integer velit donec montes mi. Gravida"
306.60,315.40,557.42,324.25,"/F8",9.96,"ipsum eu congue. Potenti nulla nec nisi. Lacinia risus"
306.60,303.45,557.44,312.29,"/F8",9.96,"non porta erat. Pretium morbi quam dui magna sed elit."
306.60,291.49,557.41,300.34,"/F8",9.96,"Blandit proin. Nonummy dolor sit imperdiet cubilia sed"
306.60,279.53,557.42,288.38,"/F8",9.96,"dictumst pellentesque commodo. Lacinia metus orci viva-"
306.60,267.58,557.40,276.43,"/F8",9.96,"mus mi sodales in ad. Aliquet risus nisl tortor turpis leo"
306.60,255.62,438.09,264.47,"/F8",9.96,"luctus duis sollicitudin facilisi."
321.55,243.67,557.43,252.52,"/F8",9.96,"Rhoncus justo est eros nunc. Gravida felis. Quisque"
306.60,231.71,557.46,240.56,"/F8",9.96,"dolor. Commodo vitae enim est euismod cras. Aliquam"
306.60,219.76,563.85,228.61,"/F8",9.96,"curae. Egestas purus feugiat purus vel eget pulvinar vestibu-"
306.60,207.80,557.46,216.65,"/F8",9.96,"lum. Euismod porta id lectus nam mi a tortor quam."
306.60,195.85,557.48,204.70,"/F8",9.96,"Commodo dolor nibh. Vivamus neque non diam netus"
306.60,183.89,557.42,192.74,"/F8",9.96,"elementum blandit porta etiam feugiat. Dapibus nulla"
306.60,171.94,515.11,180.79,"/F8",9.96,"vestibulum aliquam enim hac commodo arcu."
525.81,171.94,557.47,180.79,"/F8",9.96,"Lacinia"
306.60,159.98,557.43,168.83,"/F8",9.96,"etiam urna sit dolor nonummy magnis fusce. Viverra etiam"
306.60,148.03,557.42,156.88,"/F8",9.96,"cum ante pharetra a sollicitudin eros. Iaculis donec par-"
306.60,136.07,557.42,144.92,"/F8",9.96,"turient nascetur eget rutrum. Conubia augue mi aptent"
306.60,124.12,557.45,132.96,"/F8",9.96,"inceptos. Egestas lacus duis quis commodo eu auctor."
306.60,112.16,557.41,121.01,"/F8",9.96,"Quisque felis ad. Quisque porta. Blandit risus mi nos-"
306.60,100.21,557.41,109.05,"/F8",9.96,"tra imperdiet inceptos justo id. Iaculis porta arcu quis"
306.60,88.25,557.38,97.10,"/F8",9.96,"sed risus eros euismod fringilla quis. Gravida lorem velit."
295.15,61.35,300.13,70.20,"/F8",9.96,"2"
