37.61,748.78,288.48,757.62,"/F8",9.96,"augue amet euismod lorem lacus arcu suspendisse eges-"
37.61,736.82,288.44,745.67,"/F8",9.96,"tas condimentum pede lectus. Dapibus ipsum quam curae"
37.61,724.87,288.43,733.71,"/F8",9.96,"lectus elit vulputate. Posuere magna. Sodales etiam per"
37.61,712.91,288.43,721.76,"/F8",9.96,"cras nascetur. Iaculis etiam elit. Posuere lacus sed eros."
37.61,700.96,288.40,709.80,"/F8",9.96,"Integer felis nunc. Blandit augue quisque fermentum elit"
37.61,689.00,288.43,697.85,"/F8",9.96,"pellentesque tortor magnis neque in ut eros eu. Sodales"
37.61,677.04,288.38,685.89,"/F8",9.96,"nulla parturient dictumst. Aliquet purus. Viverra netus"
37.61,665.09,271.44,673.94,"/F8",9.96,"morbi dis quis a porta. Pretium massa ve ligula arcu."
37.61,641.18,288.47,650.03,"/F27",9.96,"3.1. Quisque velit cum nulla etiam class laoreet urna quis"
59.00,629.22,101.10,638.07,"/F27",9.96,"cras velit."
52.56,614.28,288.46,623.13,"/F8",9.96,"Euismod massa nibh. Egestas felis ac nisi. Feugiat"
37.61,602.32,288.40,611.17,"/F8",9.96,"dolor erat a nisl vestibulum mattis justo placerat vestibu-"
37.61,590.37,288.42,599.22,"/F8",9.96,"lum auctor in proin sollicitudin. Conubia risus ac congue"
37.61,578.41,288.43,587.26,"/F8",9.96,"duis enim volutpat placerat ad. Euismod curae nisl ali-"
37.61,566.46,288.43,575.31,"/F8",9.96,"quam. Aliquet magna est felis est molestie gravida. Ali-"
37.61,554.50,288.44,563.35,"/F8",9.96,"quam metus adipiscing faucibus. Feugiat augue orci ali-"
37.61,542.55,288.43,551.40,"/F8",9.96,"quet consequat. Pretium vitae mi. Aliquam metus quam"
37.61,530.59,288.45,539.44,"/F8",9.96,"suspendisse sollicitudin aliquam diam amet accumsan a"
37.61,518.64,288.49,527.48,"/F8",9.96,"pharetra. Egestas augue amet nonummy nullam massa"
37.61,506.68,288.45,515.53,"/F8",9.96,"suspendisse mi. Aliquam porta cum. Feugiat fames eget"
37.61,494.73,288.44,503.57,"/F8",9.96,"hac curae erat turpis tempor class adipiscing elit. Com-"
37.61,482.77,288.45,491.62,"/F8",9.96,"modo lacus. Lacinia risus. Gravida curae. Posuere etiam"
37.61,470.82,288.38,479.66,"/F8",9.96,"ve nascetur viverra laoreet nisi tincidunt sit duis porta in"
37.61,458.86,288.44,467.71,"/F8",9.96,"ornare. Conubia velit quam sagittis eni quisque magna."
37.61,446.91,288.47,455.75,"/F8",9.96,"Quisque porta. Conubia ipsum magna sed lorem magnis."
37.61,434.95,164.62,443.80,"/F8",9.96,"Cubilia donec. Viverra lacus."
52.56,423.00,288.43,431.84,"/F8",9.96,"Potenti fusce parturient. Nonummy felis lacus montes"
37.61,411.04,288.41,419.89,"/F8",9.96,"felis potenti. Posuere proin amet aliquam mi lobortis erat"
37.61,399.09,288.42,407.93,"/F8",9.96,"dapibus ve cursus. Quisque risus quis aenean at eros pede"
37.61,387.13,288.43,395.98,"/F8",9.96,"aliquet. Euismod donec ante potenti a semper pede ut."
37.61,375.18,288.49,384.02,"/F8",9.96,"Sodales dolor. Aliquam morbi ad magna. Iaculis fames"
37.61,363.22,288.46,372.07,"/F8",9.96,"purus cum lectus euismod nibh per metus. Nonummy"
37.61,351.27,288.43,360.11,"/F8",9.96,"massa elit inceptos lorem a quisque ligula fames libero con-"
37.61,339.31,288.38,348.16,"/F8",9.96,"sectetuer integer metus. Aliquam purus parturient blandit"
37.61,327.36,288.42,336.20,"/F8",9.96,"odio. Euismod porta ut venenatis etiam suscipit id. Ali-"
37.61,315.40,288.44,324.25,"/F8",9.96,"quam velit. Nonummy vitae odio hymenaeos nascetur ut."
37.61,303.45,288.40,312.29,"/F8",9.96,"Lacinia lacus amet praesent viverra ve libero imperdiet id."
37.61,291.49,288.45,300.34,"/F8",9.96,"Rhoncus justo non enim duis integer donec et curae in."
37.61,279.54,288.46,288.38,"/F8",9.96,"Commodo netus. Viverra fusce. Euismod lorem ut pede"
37.61,267.58,288.45,276.43,"/F8",9.96,"arcu nec arcu. Quisque risus duis lorem vitae commodo"
37.61,255.62,288.46,264.47,"/F8",9.96,"nonummy. Conubia proin sem duis. Egestas etiam nunc"
37.61,243.67,288.41,252.52,"/F8",9.96,"penatibus vel ultricies nonummy congue ipsum primis non-"
37.61,231.71,134.22,240.56,"/F8",9.96,"ummy. Aliquam class."
37.61,207.80,130.87,216.65,"/F27",9.96,"3.2. Rhoncus magna."
52.56,192.86,288.46,201.71,"/F8",9.96,"Nonummy dolor. Natoque porta vestibulum ut libero"
37.61,180.91,288.40,189.75,"/F8",9.96,"dui rutrum eros. Viverra felis sem hendrerit pretium vel"
37.61,168.95,288.41,177.80,"/F8",9.96,"ad. Laoreet porta velit diam pulvinar aliquet etiam. Blan-"
37.61,156.99,288.40,165.84,"/F8",9.96,"dit lorem purus vehicula porta pede ultricies duis phasel-"
37.61,145.04,288.42,153.89,"/F8",9.96,"lus senectus dictum morbi ut odio eu pellentesque. Po-"
37.61,133.08,288.43,141.93,"/F8",9.96,"suere lorem id pellentesque montes netus gravida. Rhon-"
37.61,121.13,288.42,129.98,"/F8",9.96,"cus neque fusce nec senectus penatibus. Posuere class nunc"
37.61,109.17,288.44,118.02,"/F8",9.96,"amet venenatis nullam nam turpis ve et arcu. Lacinia ne-"
37.61,97.22,288.89,106.07,"/F8",9.96,"tus ve consequat parturient pretium hac arcu curae congue."
37.61,85.26,288.51,94.11,"/F8",9.96,"Sodales massa magna. Conubia curae ante sodales cras"
306.60,748.78,557.38,757.62,"/F8",9.96,"senectus netus per. Aliquet proin nisl varius lacinia ali-"
306.60,736.82,557.39,745.67,"/F8",9.96,"quet vulputate aenean molestie proin est erat duis viverra"
306.60,724.87,557.43,733.71,"/F8",9.96,"at litora. Egestas lorem nec proin nostra per feugiat eros"
306.60,712.91,557.41,721.76,"/F8",9.96,"eu donec luctus ut. Aliquet ipsum adipiscing. Aliquam"
306.60,700.95,557.40,709.80,"/F8",9.96,"proin eu dignissim a. Aliquet risus augue aptent facilisi"
306.60,689.00,557.45,697.85,"/F8",9.96,"phasellus ac diam eu mattis cursus. Rhoncus dolor quam"
306.60,677.04,557.47,685.89,"/F8",9.96,"sed luctus maecenas quam nec massa per urna amet cur-"
306.60,665.09,557.40,673.94,"/F8",9.96,"abitur. Conubia morbi risus arcu ridiculus penatibus con-"
306.60,653.13,557.42,661.98,"/F8",9.96,"sectetuer. Vivamus fames per eget hendrerit at. Natoque"
306.60,641.18,557.40,650.03,"/F8",9.96,"justo duis dui sit quisque. Viverra metus sit arcu quam"
306.60,629.22,557.42,638.07,"/F8",9.96,"luctus morbi id ve diam ac nunc. Potenti justo nonummy"
306.60,617.27,497.72,626.11,"/F8",9.96,"magnis arcu gravida facilisis urna odio eros."
321.55,605.31,557.48,614.16,"/F8",9.96,"Integer magna. Laoreet metus. Egestas porta arcu."
306.60,593.36,557.43,602.20,"/F8",9.96,"Natoque fusce amet hac justo pede habitant per ante nisi"
306.60,581.40,557.44,590.25,"/F8",9.96,"per bibendum a. Posuere dolor augue natoque eros velit"
306.60,569.45,557.43,578.29,"/F8",9.96,"id ornare eu senectus nisi nunc leo. Dapibus magna. Blan-"
306.60,557.49,557.40,566.34,"/F8",9.96,"dit lacus at turpis senectus urna odio. Pretium neque in"
306.60,545.54,557.44,554.38,"/F8",9.96,"nisi. Natoque curae morbi per enim. Cubilia fames eros"
306.60,533.58,557.46,542.43,"/F8",9.96,"cum a aenean pede. Dapibus proin. Viverra curae non"
306.60,521.63,557.41,530.47,"/F8",9.96,"est eni mi. Dapibus porta quis. Rhoncus fusce vestibu-"
306.60,509.67,557.41,518.52,"/F8",9.96,"lum natoque elit cras. Lacinia proin enim. Euismod vitae"
306.60,497.72,557.44,506.56,"/F8",9.96,"metus nunc conubia aliquam. Euismod fusce porta ante"
306.60,485.76,557.42,494.61,"/F8",9.96,"nostra quisque viverra. Vivamus purus etiam condimen-"
306.60,473.81,557.43,482.65,"/F8",9.96,"tum. Sodales purus. Conubia risus. Potenti dolor eu"
306.60,461.85,554.77,470.70,"/F8",9.96,"primis maecenas nunc platea. Rhoncus felis id metus mi."
310.84,447.79,319.77,454.87,"/F19",7.97,"[1]"
324.75,447.79,536.49,454.87,"/F19",7.97,"R. MacPherson, Singularities of vector bundle maps, in:"
541.44,447.79,557.55,454.87,"/F19",7.97,"Pro-"
324.76,438.33,557.54,445.40,"/F19",7.97,"ceedings of Liverpool Singularities, Lecture Notes in Mathemat-"
324.76,428.86,390.64,435.94,"/F19",7.97,"ics, no. 192, 1981."
310.84,419.40,319.77,426.48,"/F19",7.97,"[2]"
324.75,419.40,546.82,426.48,"/F19",7.97,"V. Pati, What is the title??, Ph.D. thesis, Princeton (1985)."
310.84,409.93,319.77,417.01,"/F19",7.97,"[3]"
324.75,409.93,557.54,417.01,"/F19",7.97,"A. Parusinski, P. Pragacz, Characteristic classes of hypersur-"
324.76,400.47,531.48,407.55,"/F19",7.97,"faces and characteristic cycles, preprint (January 1998)."
310.84,391.00,319.77,398.08,"/F19",7.97,"[4]"
324.75,391.00,557.55,398.08,"/F19",7.97,"A. S. Dubson, Calcul des invariants numeriques des singularites"
324.76,381.54,463.30,388.62,"/F19",7.97,"et applications, where from?? (1981)."
310.84,372.08,319.77,379.15,"/F19",7.97,"[5]"
324.75,372.08,557.54,379.15,"/F19",7.97,"J. Biran˘con, P. Maisonobe, M. Merle, Localisation de systemes"
324.76,362.61,557.56,369.69,"/F19",7.97,"dierentiels, stratications de Whitney et condition de Thom,"
324.76,353.15,452.17,360.22,"/F19",7.97,"Invent. Math. 117 (1994) 531{550."
310.84,343.68,319.77,350.76,"/F19",7.97,"[6]"
324.75,343.68,557.54,350.76,"/F19",7.97,"A. Parusinski, P. Pragacz, A formula for the Euler characteristic"
324.76,334.22,541.39,341.30,"/F19",7.97,"of singular hypersurfaces, J. Alg. Geom. 4 (1995) 337{351."
310.84,324.75,319.77,331.83,"/F19",7.97,"[7]"
324.75,324.75,333.74,331.83,"/F19",7.97,"G."
338.88,324.75,373.20,331.83,"/F19",7.97,"Kennedy,"
378.90,324.75,429.93,331.83,"/F19",7.97,"Specialization"
435.06,324.75,441.87,331.83,"/F19",7.97,"of"
447.01,324.75,498.23,331.83,"/F19",7.97,"MacPherson's"
503.36,324.75,525.94,331.83,"/F19",7.97,"Chern"
531.08,324.75,557.55,331.83,"/F19",7.97,"classes,"
324.76,315.29,438.31,322.37,"/F19",7.97,"Math. Scand. 66 (1990) 12{16."
310.84,305.82,319.77,312.90,"/F19",7.97,"[8]"
324.75,305.82,557.53,312.90,"/F19",7.97,"H. Whitney, Tangents to an analytic variety, Ann. of Math. 81"
324.76,296.36,383.07,303.44,"/F19",7.97,"(1965) 496{549."
310.84,286.89,319.77,293.97,"/F19",7.97,"[9]"
324.75,286.89,557.54,293.97,"/F19",7.97,"P. Alu, Singular schemes of hypersurfaces, Duke Math. J. 80"
324.76,277.43,383.07,284.51,"/F19",7.97,"(1995) 325{351."
306.60,267.97,319.77,275.04,"/F19",7.97,"[10]"
324.75,267.97,557.55,275.04,"/F19",7.97,"A. S. Dubson, Classes caracteristiques des varietes singulieres,"
324.76,258.50,483.03,265.58,"/F19",7.97,"C. R. Acad. Sci. Paris 287 (1978) 237{240."
306.60,249.04,319.77,256.11,"/F19",7.97,"[11]"
324.75,249.04,557.55,256.11,"/F19",7.97,"C. Sabbah, Quelques remarques sur la geometrie des espaces"
324.76,239.57,485.91,246.65,"/F19",7.97,"conormaux, Asterisque 130 (1985) 161{192."
306.60,230.11,319.77,237.19,"/F19",7.97,"[12]"
324.75,230.11,557.54,237.19,"/F19",7.97,"S. Halperin, D. Toledo, Stiefel{Whitney homology classes, Ann."
324.76,220.64,429.14,227.72,"/F19",7.97,"of Math. 96 (1972) 511{525."
306.60,211.18,319.77,218.26,"/F19",7.97,"[13]"
324.75,211.18,557.53,218.26,"/F19",7.97,"R. Langevin, Coubures au voisinage d'une singularite algebrique"
324.76,201.71,484.77,208.79,"/F19",7.97,"isolee, Asterisque 82-83 (1978{1979) 33{43."
306.60,192.25,319.77,199.33,"/F19",7.97,"[14]"
324.75,192.25,557.55,199.33,"/F19",7.97,"V. N. Aznar, Sur les multiplicites de Schubert locales des fais-"
324.76,182.79,554.32,189.86,"/F19",7.97,"ceaux algebriques coherents, Comp. Math. 48 (1983) 311{326."
306.60,173.32,319.77,180.40,"/F19",7.97,"[15]"
324.75,173.32,557.55,180.40,"/F19",7.97,"O. Riemenschneider, Characterizing Moisezon spaces by almost"
324.76,163.86,557.54,170.93,"/F19",7.97,"positive coherent analytic sheaves, Math. Zeit. 123 (1971) 265{"
324.76,154.39,339.81,161.47,"/F19",7.97,"284."
295.15,61.35,300.13,70.20,"/F8",9.96,"5"
