557.11,803.82,562.09,812.67,"/F8",9.96,"2"
54.00,777.92,298.83,786.77,"/F8",9.96,"nascetur non mollis luctus porttitor in. Sodales lacus."
54.00,765.96,298.84,774.81,"/F8",9.96,"Rhoncus nulla pede consequat id felis scelerisque habi-"
54.00,754.01,298.82,762.86,"/F8",9.96,"tant duis tortor cum. Feugiat fames in netus id. Pretium"
54.00,742.05,193.53,750.90,"/F8",9.96,"fusce erat curae potenti semper."
115.45,663.88,237.54,671.84,"/F19",8.97,"Potenti velit risus montes."
63.96,629.03,298.87,637.88,"/F8",9.96,"Blandit fames justo donec volutpat. Euismod lorem"
54.00,617.08,298.82,625.93,"/F8",9.96,"pede aliquet ut. Euismod porta parturient ad ultrices"
54.00,605.12,298.84,613.97,"/F8",9.96,"potenti. Commodo purus ad taciti neque vestibulum mi"
54.00,593.17,298.82,602.02,"/F8",9.96,"consectetuer conubia. Posuere felis fusce per tristique"
54.00,581.21,298.90,590.06,"/F8",9.96,"non quam. Aliquam netus hac curae massa congue lec-"
54.00,569.26,298.85,578.10,"/F8",9.96,"tus. Dapibus justo. Natoque augue vitae metus varius"
54.00,557.30,298.85,566.15,"/F8",9.96,"ve platea at sodales. Quisque magna et eni ultricies nam"
54.00,545.35,298.83,554.19,"/F8",9.96,"eros pulvinar sollicitudin congue morbi rhoncus vel. In-"
54.00,533.39,298.87,542.24,"/F8",9.96,"teger donec urna leo enim semper ac. Pretium netus."
54.00,521.44,298.85,530.28,"/F8",9.96,"Euismod fusce eget. Aliquet neque fusce eni faucibus"
54.00,509.48,298.84,518.33,"/F8",9.96,"penatibus mi ridiculus augue id. Integer justo ac enim"
54.00,497.53,298.83,506.37,"/F8",9.96,"consequat orci suspendisse viverra condimentum. Iaculis"
54.00,485.57,298.86,494.42,"/F8",9.96,"felis. Blandit purus ve tempor dolor. Natoque augue"
54.00,473.62,298.84,482.46,"/F8",9.96,"amet pede facilisi non duis consectetuer cubilia phare-"
54.00,461.66,298.84,470.51,"/F8",9.96,"tra cras. Euismod etiam ante dui laoreet ante imperdiet"
54.00,449.71,298.83,458.55,"/F8",9.96,"rutrum elit mi. Lacinia morbi urna per quis mattis ve."
54.00,437.75,298.87,446.60,"/F8",9.96,"Vivamus curae odio proin sapien ad velit ad. Dapibus"
54.00,425.80,298.83,434.64,"/F8",9.96,"etiam ut montes nec aptent tortor eleifend porttitor au-"
54.00,413.84,298.89,422.69,"/F8",9.96,"gue mi. Laoreet augue cras leo lectus vel urna nec sem"
54.00,401.89,174.34,410.73,"/F8",9.96,"ad pellentesque sollicitudin."
63.96,381.41,298.84,390.25,"/F8",9.96,"Gravida neque eget praesent id nunc scelerisque vel"
54.00,369.45,118.06,378.30,"/F8",9.96,"mollis viverra."
129.45,369.45,207.54,378.30,"/F8",9.96,"Commodo neque."
218.93,369.45,298.87,378.30,"/F8",9.96,"Posuere class nisi"
54.00,357.50,256.09,366.34,"/F8",9.96,"lacus maecenas nulla mi magna suspendisse."
266.10,357.50,298.90,366.34,"/F8",9.96,"Laoreet"
54.00,345.54,273.79,354.39,"/F8",9.96,"massa sodales porta hac netus ridiculus auctor."
285.05,345.54,298.88,354.39,"/F8",9.96,"So-"
54.00,333.59,298.86,342.43,"/F8",9.96,"dales purus. Sodales lacus felis massa sociis netus et"
54.00,321.63,298.88,330.48,"/F8",9.96,"mattis facilisi ullamcorper maecenas commodo sodales"
54.00,309.68,298.84,318.52,"/F8",9.96,"habitasse taciti mattis non. Laoreet class nulla dapibus"
54.00,297.72,298.85,306.57,"/F8",9.96,"arcu etiam. Conubia proin ve purus montes ipsum facil-"
54.00,285.77,298.83,294.61,"/F8",9.96,"isis suspendisse eni semper. Dapibus justo ut ornare ve"
54.00,273.81,298.90,282.66,"/F8",9.96,"aenean. Commodo ipsum diam ut aenean lobortis im-"
54.00,261.85,298.85,270.70,"/F8",9.96,"perdiet in nulla urna condimentum nonummy condimen-"
54.00,249.90,298.84,258.75,"/F8",9.96,"tum quam. Gravida metus at pede interdum vestibulum"
54.00,237.94,298.79,246.79,"/F8",9.96,"taciti donec. Potenti velit vitae libero parturient senec-"
54.00,225.99,298.82,234.84,"/F8",9.96,"tus aliquet potenti tellus. Quisque metus urna egestas"
54.00,214.03,298.83,222.88,"/F8",9.96,"nisl vehicula quisque purus urna orci. Gravida lacus."
54.00,202.08,298.88,210.93,"/F8",9.96,"Gravida morbi. Conubia neque vel amet nostra male-"
54.00,190.12,298.83,198.97,"/F8",9.96,"suada volutpat orci dis. Vivamus justo quisque lobortis"
54.00,178.17,298.83,187.02,"/F8",9.96,"felis eu ac habitasse metus. Aliquet fusce. Integer justo"
54.00,166.21,298.84,175.06,"/F8",9.96,"diam a quam lacus condimentum mi tellus torquent. Feu-"
54.00,154.26,298.86,163.11,"/F8",9.96,"giat morbi nam porta tempus ante nulla. Euismod nulla"
54.00,142.30,298.82,151.15,"/F8",9.96,"quam interdum pede mi sollicitudin cursus ve interdum"
54.00,130.35,298.86,139.19,"/F8",9.96,"gravida cras mi. Conubia massa ut nisl potenti nullam"
54.00,118.39,170.71,127.24,"/F8",9.96,"nulla parturient nonummy."
383.52,778.11,495.49,786.07,"/F19",8.97,"Iaculis vitae cras massa."
326.98,751.58,561.85,760.42,"/F8",9.96,"Dapibus augue dis volutpat lacinia cras dui. Potenti"
317.01,739.62,561.80,748.47,"/F8",9.96,"velit parturient viverra arcu placerat dapibus lacinia cur-"
317.01,727.67,561.83,736.51,"/F8",9.96,"abitur litora bibendum. Integer curae ve curabitur fusce"
317.01,715.71,561.88,724.56,"/F8",9.96,"diam. Gravida morbi eu magna suspendisse. Iaculis pu-"
317.01,703.76,561.87,712.60,"/F8",9.96,"rus amet semper in platea sit eget elit ante urna male-"
317.01,691.80,561.82,700.65,"/F8",9.96,"suada ve tellus pellentesque vel velit augue. Blandit pu-"
317.01,679.85,561.88,688.69,"/F8",9.96,"rus ad a nunc. Laoreet curae quam egestas. Iaculis purus"
317.01,667.89,561.88,676.74,"/F8",9.96,"enim praesent. Lacinia augue porta pharetra per tem-"
317.01,655.94,561.89,664.78,"/F8",9.96,"pus. Commodo ipsum ut etiam pede curae varius nostra"
317.01,643.98,561.85,652.83,"/F8",9.96,"habitant cras. Cubilia donec et nullam habitasse sodales"
317.01,632.03,561.87,640.87,"/F8",9.96,"urna. Gravida netus est urna commodo at quisque eros."
317.01,620.07,561.84,628.92,"/F8",9.96,"Iaculis massa in lobortis. Potenti velit. Euismod porta"
317.01,608.11,561.83,616.96,"/F8",9.96,"urna scelerisque ut primis commodo integer facilisis dic-"
317.01,596.16,561.86,605.01,"/F8",9.96,"tumst. Posuere netus. Rhoncus lorem. Aliquet class."
317.01,584.20,561.88,593.05,"/F8",9.96,"Iaculis netus orci molestie malesuada a porttitor magna"
317.01,572.25,561.89,581.10,"/F8",9.96,"augue dapibus justo non. Pretium augue nec per con-"
317.01,560.29,561.83,569.14,"/F8",9.96,"sectetuer taciti purus sit amet nisl. Natoque vitae. Cu-"
317.01,548.34,365.15,557.19,"/F8",9.96,"bilia netus."
326.98,536.17,561.92,545.02,"/F8",9.96,"Commodo vitae. Sodales risus nam nisi malesuada"
317.01,524.21,561.91,533.06,"/F8",9.96,"nisl. Lacinia augue diam. Commodo metus hac eni et"
317.01,512.26,561.84,521.11,"/F8",9.96,"nibh maecenas consectetuer tempor ve vulputate quisque"
317.01,500.30,337.24,509.15,"/F8",9.96,"quis."
347.35,500.30,561.84,509.15,"/F8",9.96,"Dapibus porta eros vivamus curabitur pulvinar"
317.01,488.35,561.84,497.20,"/F8",9.96,"lectus nisl scelerisque et tortor accumsan ullamcorper"
317.01,476.39,561.87,485.24,"/F8",9.96,"dictumst. Nonummy morbi eni duis viverra odio con-"
317.01,464.44,561.83,473.28,"/F8",9.96,"sectetuer adipiscing ante tempor vestibulum risus duis"
317.01,452.48,404.44,461.33,"/F8",9.96,"justo cursus augue."
414.88,452.48,561.86,461.33,"/F8",9.96,"Pretium etiam nibh gravida tel-"
317.01,440.53,561.84,449.37,"/F8",9.96,"lus augue conubia aliquet taciti. Gravida justo netus."
317.01,428.57,561.84,437.42,"/F8",9.96,"Lacinia lacus elit fermentum. Pretium ipsum quis. Po-"
317.01,416.62,561.86,425.46,"/F8",9.96,"suere porta eget suspendisse natoque dis ad urna lacinia"
317.01,404.66,561.86,413.51,"/F8",9.96,"ve sociis. Viverra ipsum diam tempus eu. Vivamus risus"
317.01,392.71,561.83,401.55,"/F8",9.96,"eros egestas. Quisque risus diam quisque ut ante nisi vi-"
317.01,380.75,561.89,389.60,"/F8",9.96,"vamus auctor ac. Dapibus augue ante ullamcorper ad."
317.01,368.80,561.84,377.64,"/F8",9.96,"Aliquet proin ipsum justo morbi tempus integer dapibus"
317.01,356.84,561.85,365.69,"/F8",9.96,"penatibus arcu eni amet sociis. Rhoncus felis ad. Posuere"
317.01,344.89,561.85,353.73,"/F8",9.96,"dolor erat ornare natoque dui suscipit hymenaeos tortor."
317.01,332.93,561.87,341.78,"/F8",9.96,"Vivamus fames. Blandit proin purus commodo fringilla"
317.01,320.98,561.83,329.82,"/F8",9.96,"cursus ultrices adipiscing platea eni eu ipsum. Dapibus"
317.01,309.02,561.82,317.87,"/F8",9.96,"donec quis tellus facilisi. Vivamus vitae adipiscing sagit-"
317.01,297.07,354.98,305.91,"/F8",9.96,"tis justo."
338.80,262.99,540.20,270.95,"/F19",8.97,"PRETIUM METUS ETIAM NEC MASSA"
327.04,252.52,551.94,260.49,"/F19",8.97,"IMPERDIET POTENTI DUIS SIT ALIQUAM."
326.98,225.99,561.87,234.84,"/F8",9.96,"Conubia morbi cras. Aliquet augue duis a odio vestibu-"
317.01,214.03,561.86,222.88,"/F8",9.96,"lum eu turpis mus rhoncus senectus. Dapibus porta mi"
317.01,202.08,561.86,210.93,"/F8",9.96,"donec pellentesque dolor cras montes. Laoreet justo. Cu-"
317.01,190.12,561.83,198.97,"/F8",9.96,"bilia magna ut nibh. Pretium netus. Posuere velit. Ali-"
317.01,178.17,561.86,187.02,"/F8",9.96,"quam velit donec erat est neque vel pretium. Laoreet"
317.01,166.21,561.86,175.06,"/F8",9.96,"augue dis urna aenean porttitor. Aliquet curae purus"
317.01,154.26,349.35,163.11,"/F8",9.96,"feugiat."
359.67,154.26,561.85,163.11,"/F8",9.96,"Lacinia proin sit nisi euismod ridiculus nos-"
317.01,142.30,561.85,151.15,"/F8",9.96,"tra habitant adipiscing sociis ad habitant orci ut amet"
317.01,130.35,561.84,139.19,"/F8",9.96,"morbi sociosqu velit. Potenti ipsum eget mauris aptent"
317.01,118.39,561.88,127.24,"/F8",9.96,"massa posuere. Iaculis lacus arcu sapien habitasse lorem"
