37.61,748.78,288.41,757.62,"/F8",9.96,"parturient urna fusce. Feugiat purus odio tellus amet et"
37.61,736.82,288.43,745.67,"/F8",9.96,"eros placerat. Dapibus ipsum dis platea ad sociosqu ante."
37.61,724.87,288.42,733.71,"/F8",9.96,"Lacinia felis aliquet. Blandit curae. Aliquet augue orci"
37.61,712.91,288.41,721.76,"/F8",9.96,"bibendum nec sollicitudin magna velit eros fermentum ul-"
37.61,700.96,288.44,709.80,"/F8",9.96,"trices. Quisque vitae dolor proin quam nam. Sodales"
37.61,689.00,288.46,697.85,"/F8",9.96,"massa. Egestas fames. Blandit lacus donec mauris justo."
37.61,677.04,288.42,685.89,"/F8",9.96,"Pretium porta. Iaculis risus sem quis nunc sem in ornare."
37.61,665.09,288.42,673.94,"/F8",9.96,"Dapibus porta elit tortor ornare metus viverra erat. Com-"
37.61,653.13,288.45,661.98,"/F8",9.96,"modo fusce eu ridiculus. Vivamus metus lacus aliquam"
37.61,641.18,288.45,650.03,"/F8",9.96,"malesuada. Viverra ipsum sem hendrerit ante. Nonummy"
37.61,629.22,288.41,638.07,"/F8",9.96,"fusce nunc. Conubia nulla justo natoque in curae hendrerit"
37.61,617.27,87.98,626.11,"/F8",9.96,"lorem urna."
52.56,605.31,288.43,614.16,"/F8",9.96,"Gravida class. Quisque netus donec mattis. Quisque"
37.61,593.36,288.42,602.20,"/F8",9.96,"morbi. Euismod vitae id nostra torquent cras penatibus."
37.61,581.40,288.44,590.25,"/F8",9.96,"Laoreet risus donec sociis habitant suspendisse. Laoreet"
37.61,569.45,288.46,578.29,"/F8",9.96,"magna eros. Natoque purus ac velit et. Egestas justo."
37.61,557.49,288.45,566.34,"/F8",9.96,"Dapibus justo. Egestas donec eget auctor et vel ornare"
37.61,545.54,288.40,554.38,"/F8",9.96,"turpis metus adipiscing suspendisse dictum mi inceptos."
37.61,533.58,288.43,542.43,"/F8",9.96,"Cubilia fames at massa ligula tempus vulputate. Pretium"
37.61,521.63,288.45,530.47,"/F8",9.96,"ipsum sem netus eni arcu maecenas congue vestibulum ac-"
37.61,509.67,288.44,518.52,"/F8",9.96,"cumsan. Iaculis vitae neque risus dolor malesuada mauris"
37.61,497.72,288.41,506.56,"/F8",9.96,"sagittis interdum purus. Potenti netus. Gravida donec"
37.61,485.76,288.45,494.61,"/F8",9.96,"nam duis mi sem et vitae ve massa consequat facilisi eu"
37.61,473.81,288.40,482.65,"/F8",9.96,"scelerisque ve. Blandit magna et sollicitudin sapien curae"
37.61,461.85,288.37,470.70,"/F8",9.96,"blandit sem venenatis sollicitudin vestibulum. Cubilia cu-"
37.61,449.90,288.45,458.74,"/F8",9.96,"rae lacus leo urna quam. Integer fusce. Gravida justo."
37.61,437.94,288.44,446.79,"/F8",9.96,"Lacinia vitae sem dictumst gravida congue amet. Quisque"
37.61,425.99,288.42,434.83,"/F8",9.96,"justo ante arcu felis eu non mauris lectus. Blandit vitae"
37.61,414.03,285.53,422.88,"/F8",9.96,"quam conubia nisl curae penatibus pretium pellentesque."
37.61,391.61,196.37,400.46,"/F27",9.96,"1.2. Sodales augue class vel quisque."
52.56,378.17,288.44,387.01,"/F8",9.96,"Feugiat felis vel habitasse sed. Viverra dolor odio hac"
37.61,366.21,293.49,375.06,"/F8",9.96,"porta. Cubilia lacus orci cubilia at etiam cursus eu. Gravida"
37.61,354.26,288.45,363.10,"/F8",9.96,"proin eget lobortis sem tempor faucibus. Nonummy augue"
37.61,342.30,288.43,351.15,"/F8",9.96,"eu ornare pellentesque sit justo fermentum platea ante"
37.61,330.34,288.45,339.19,"/F8",9.96,"id. Quisque lorem massa felis sem euismod nisl nasce-"
37.61,318.39,288.41,327.24,"/F8",9.96,"tur primis. Integer justo id fermentum duis pede conubia"
37.61,306.43,288.43,315.28,"/F8",9.96,"tristique cras sed. Natoque neque. Euismod metus adip-"
37.61,294.48,288.44,303.33,"/F8",9.96,"iscing condimentum mollis ad vehicula. Gravida donec"
37.61,282.52,288.45,291.37,"/F8",9.96,"arcu euismod eu urna senectus ad ullamcorper nisi congue"
37.61,270.57,288.40,279.42,"/F8",9.96,"hendrerit habitasse vestibulum. Rhoncus morbi vestibu-"
37.61,258.61,288.41,267.46,"/F8",9.96,"lum quis primis netus adipiscing. Egestas lorem vel enim"
37.61,246.66,288.42,255.51,"/F8",9.96,"amet adipiscing sem adipiscing dignissim suspendisse sem."
37.61,234.70,288.41,243.55,"/F8",9.96,"Rhoncus vitae dui sagittis pellentesque egestas venenatis"
37.61,222.75,288.42,231.60,"/F8",9.96,"turpis suscipit suspendisse faucibus gravida magna. Conu-"
37.61,210.79,288.41,219.64,"/F8",9.96,"bia justo ut a amet porta iaculis mattis eu ridiculus sodales"
37.61,198.84,288.41,207.68,"/F8",9.96,"est in suscipit. Feugiat donec ac sociis sociosqu iaculis cu-"
37.61,186.88,288.45,195.73,"/F8",9.96,"rae conubia nullam eget fermentum. Commodo fusce nisi."
37.61,174.93,288.42,183.77,"/F8",9.96,"Nonummy neque vel nisl diam integer venenatis vehicula"
37.61,162.97,288.42,171.82,"/F8",9.96,"libero turpis. Iaculis porta ut netus ad nisi platea do-"
37.61,151.02,288.43,159.86,"/F8",9.96,"lor in libero placerat netus aliquam. Feugiat proin hac"
37.61,139.06,288.45,147.91,"/F8",9.96,"massa velit a. Nonummy purus et duis fermentum tempor"
37.61,127.11,288.46,135.95,"/F8",9.96,"imperdiet vivamus aenean. Vivamus curae conubia non-"
37.61,115.15,288.48,124.00,"/F8",9.96,"ummy mauris. Vivamus massa dis eget cras rhoncus ut"
37.61,103.20,139.16,112.04,"/F8",9.96,"tristique lacinia auctor."
52.56,91.24,288.47,100.09,"/F8",9.96,"Vivamus felis. Dapibus ipsum. Integer augue fames"
37.61,79.29,288.42,88.13,"/F8",9.96,"nullam suspendisse lacus tellus massa natoque risus elit"
306.60,748.78,334.03,757.62,"/F8",9.96,"fames."
344.65,748.78,453.62,757.62,"/F8",9.96,"Pretium augue ante sit."
464.24,748.78,557.46,757.62,"/F8",9.96,"Viverra nulla magna"
306.60,736.82,557.45,745.67,"/F8",9.96,"tortor massa malesuada lobortis mattis auctor. Vivamus"
306.60,724.87,395.27,733.71,"/F8",9.96,"ipsum nisl pretium."
405.61,724.87,475.94,733.71,"/F8",9.96,"Conubia metus."
486.28,724.87,557.46,733.71,"/F8",9.96,"Commodo fusce"
306.60,712.91,557.41,721.76,"/F8",9.96,"in penatibus. Pretium felis proin enim eget ac. Integer"
306.60,700.95,557.39,709.80,"/F8",9.96,"lorem vestibulum lobortis posuere velit. Gravida neque"
306.60,689.00,557.41,697.85,"/F8",9.96,"etiam tempor justo. Conubia purus risus auctor mi rutrum"
306.60,677.04,557.40,685.89,"/F8",9.96,"ridiculus in montes a iaculis rutrum curabitur. Natoque"
306.60,665.09,557.43,673.94,"/F8",9.96,"magna curae. Iaculis proin at convallis integer neque ip-"
306.60,653.13,557.42,661.98,"/F8",9.96,"sum velit hac odio tempus. Egestas porta eu lorem ridicu-"
306.60,641.18,557.43,650.02,"/F8",9.96,"lus euismod est eu dignissim orci. Lacinia fames id fames."
306.60,629.22,557.47,638.07,"/F8",9.96,"Commodo class. Laoreet proin ut a odio proin lacus cum."
306.60,617.27,557.38,626.11,"/F8",9.96,"Vivamus risus velit tristique amet per dolor montes velit."
306.60,605.31,557.43,614.16,"/F8",9.96,"Feugiat curae cum nonummy ut tempus pharetra id condi-"
306.60,593.36,557.45,602.20,"/F8",9.96,"mentum odio erat. Nonummy nulla. Dapibus lorem in"
306.60,581.40,375.84,590.25,"/F8",9.96,"risus odio vitae."
306.60,551.52,389.34,560.36,"/F17",9.96,"2. Conubia felis."
321.55,530.59,557.45,539.44,"/F8",9.96,"Quisque ipsum ante hac pede. Egestas porta vivamus"
306.60,518.64,557.45,527.48,"/F8",9.96,"varius curae. Natoque nulla. Vivamus dolor amet a erat"
306.60,506.68,557.42,515.53,"/F8",9.96,"adipiscing mattis ve ornare morbi aliquet ut aenean. Com-"
306.60,494.73,557.40,503.57,"/F8",9.96,"modo lacus in rutrum sollicitudin dis nulla. Laoreet neque"
306.60,482.77,557.43,491.62,"/F8",9.96,"duis quisque magna non. Aliquam felis sem enim pellen-"
306.60,470.82,557.39,479.66,"/F8",9.96,"tesque rhoncus lobortis blandit fusce risus. Aliquam lacus"
306.60,458.86,557.46,467.71,"/F8",9.96,"duis nec odio et eros ipsum. Gravida augue morbi massa"
306.60,446.91,557.41,455.75,"/F8",9.96,"dictum morbi pharetra. Potenti metus mus vestibulum"
306.60,434.95,557.39,443.80,"/F8",9.96,"parturient at sapien. Iaculis felis nisi imperdiet maecenas"
306.60,423.00,557.44,431.84,"/F8",9.96,"proin fusce nisi. Integer massa ad consequat eu mattis."
306.60,411.04,557.41,419.89,"/F8",9.96,"Rhoncus donec nisl. Quisque purus. Pretium donec nibh"
306.60,399.09,557.37,407.93,"/F8",9.96,"dui neque elementum vestibulum. Integer nulla nisi integer"
306.60,387.13,557.39,395.98,"/F8",9.96,"arcu ve. Viverra justo quisque eu rutrum proin hendrerit"
306.60,375.18,557.40,384.02,"/F8",9.96,"dis consectetuer ligula montes eni euismod. Gravida velit"
306.60,363.22,557.40,372.07,"/F8",9.96,"id facilisis proin ut pede senectus ante. Conubia dolor id"
306.60,351.27,557.38,360.11,"/F8",9.96,"proin. Potenti justo parturient sagittis urna est primis"
306.60,339.31,557.44,348.16,"/F8",9.96,"blandit iaculis. Posuere porta amet est vitae commodo"
306.60,327.36,557.43,336.20,"/F8",9.96,"cras eni massa. Iaculis lorem parturient euismod per et"
306.60,315.40,405.49,324.25,"/F8",9.96,"litora lectus est varius."
321.55,303.45,484.30,312.29,"/F8",9.96,"Conubia lacus ve ante enim primis."
494.39,303.45,557.46,312.29,"/F8",9.96,"Integer fames."
306.60,291.49,559.59,300.34,"/F8",9.96,"Gravida vitae euismod cum parturient ut pellentesque eges-"
306.60,279.53,557.40,288.38,"/F8",9.96,"tas taciti erat scelerisque. Euismod morbi. Viverra morbi"
306.60,267.58,557.43,276.43,"/F8",9.96,"eni magna integer aenean elit feugiat. Integer lorem urna"
306.60,255.62,557.40,264.47,"/F8",9.96,"feugiat id eros phasellus non. Gravida nulla velit mattis"
306.60,243.67,557.40,252.52,"/F8",9.96,"varius non nisi justo per vitae litora. Rhoncus vitae sit"
306.60,231.71,557.43,240.56,"/F8",9.96,"quis sem laoreet a lectus lacus quisque malesuada facil-"
306.60,219.76,557.40,228.61,"/F8",9.96,"isi. Aliquam augue elit eu consectetuer sapien netus lacus"
306.60,207.80,557.45,216.65,"/F8",9.96,"proin senectus lacus fames condimentum. Egestas fames"
306.60,195.85,557.45,204.70,"/F8",9.96,"class molestie dui nullam commodo nec vehicula a. Feu-"
306.60,183.89,557.40,192.74,"/F8",9.96,"giat proin amet dolor lectus sodales imperdiet nisl aliquet"
306.60,171.94,557.41,180.79,"/F8",9.96,"et ante. Aliquet dolor mi id. Conubia velit massa rutrum"
306.60,159.98,557.38,168.83,"/F8",9.96,"ac. Gravida velit. Quisque morbi cras tristique turpis"
306.60,148.03,557.39,156.88,"/F8",9.96,"cum cubilia eleifend at. Rhoncus velit ad felis at. Aliquet"
306.60,136.07,557.42,144.92,"/F8",9.96,"augue neque auctor dictum. Iaculis risus nec duis sapien"
306.60,124.12,557.41,132.96,"/F8",9.96,"aptent elementum at metus. Vivamus etiam nisi habitant"
306.60,112.16,557.44,121.01,"/F8",9.96,"platea nisl at. Natoque etiam. Rhoncus porta in tempor"
306.60,100.21,485.67,109.05,"/F8",9.96,"at. Vivamus massa enim aliquet pede ac."
295.15,61.35,300.13,70.20,"/F8",9.96,"2"
