37.61,748.78,288.42,757.62,"/F8",9.96,"tum pellentesque vel phasellus varius morbi hymenaeos."
37.61,736.82,288.43,745.67,"/F8",9.96,"Dapibus netus proin magnis at turpis ve quam. Dapibus"
37.61,724.87,288.43,733.71,"/F8",9.96,"justo nunc gravida imperdiet duis cras. Sodales dolor nec"
37.61,712.91,288.43,721.76,"/F8",9.96,"cras. Nonummy curae eget ultricies tempor quam. Aliquet"
37.61,700.96,288.42,709.80,"/F8",9.96,"netus. Conubia neque. Quisque metus. Aliquet porta."
37.61,689.00,288.40,697.85,"/F8",9.96,"Natoque vitae nisl penatibus dictumst tempor quisque in"
37.61,677.04,288.41,685.89,"/F8",9.96,"magnis. Gravida class in fringilla adipiscing eni proin sit"
37.61,665.09,288.45,673.94,"/F8",9.96,"cras id. Commodo donec. Rhoncus velit. Dapibus dolor."
37.61,653.13,288.44,661.98,"/F8",9.96,"Potenti lacus et aenean ac et aenean interdum ullamcorper"
37.61,641.18,288.41,650.03,"/F8",9.96,"interdum conubia consectetuer convallis. Egestas morbi ut"
37.61,629.22,288.45,638.07,"/F8",9.96,"ve habitasse odio est a aenean. Conubia proin pede dictum"
37.61,617.27,288.43,626.11,"/F8",9.96,"aliquet natoque penatibus urna non posuere sociosqu blan-"
37.61,605.31,288.38,614.16,"/F8",9.96,"dit vulputate. Gravida proin adipiscing scelerisque varius"
37.61,593.36,288.38,602.20,"/F8",9.96,"et. Aliquet neque vestibulum integer amet ve pellentesque"
37.61,581.40,288.44,590.25,"/F8",9.96,"rutrum curae. Aliquam augue pede scelerisque at nostra"
37.61,569.45,233.63,578.29,"/F8",9.96,"accumsan odio auctor tempor netus rhoncus."
37.61,545.54,189.10,554.38,"/F27",9.96,"3.1. Commodo ipsum fames proin."
52.56,530.59,290.90,539.44,"/F8",9.96,"Integer dolor. Posuere porta quisque vulputate. Lacinia"
37.61,518.64,204.34,527.48,"/F8",9.96,"donec mus elit donec magna iaculis."
215.00,518.64,288.48,527.48,"/F8",9.96,"Nonummy netus"
37.61,506.68,288.43,515.53,"/F8",9.96,"arcu tortor id odio curae. Cubilia purus. Euismod justo"
37.61,494.73,288.45,503.57,"/F8",9.96,"mus nisl id hac et senectus nisl. Egestas fames orci ad"
37.61,482.77,288.40,491.62,"/F8",9.96,"morbi. Viverra velit class viverra pede interdum. Laoreet"
37.61,470.82,288.41,479.66,"/F8",9.96,"nulla cras nulla id. Pretium neque. Potenti morbi justo"
37.61,458.86,288.46,467.71,"/F8",9.96,"montes in suscipit curae id a. Commodo ipsum vitae."
37.61,446.91,288.47,455.75,"/F8",9.96,"Lacinia proin dui nunc sed ad a aptent augue condimen-"
37.61,434.95,288.47,443.80,"/F8",9.96,"tum. Rhoncus netus ac urna fames aptent eu nascetur"
37.61,423.00,288.41,431.84,"/F8",9.96,"viverra. Vivamus purus. Iaculis lorem parturient in sol-"
37.61,411.04,288.38,419.89,"/F8",9.96,"licitudin quisque mollis. Egestas vitae nisl etiam aliquet"
37.61,399.09,288.45,407.93,"/F8",9.96,"montes sed. Laoreet etiam porta nec pretium ipsum enim"
37.61,387.13,288.39,395.98,"/F8",9.96,"felis lacinia. Lacinia risus parturient at consectetuer. Cu-"
37.61,375.18,289.00,384.02,"/F8",9.96,"bilia risus nam arcu parturient nibh. Posuere magna quam."
37.61,363.22,288.40,372.07,"/F8",9.96,"Cubilia risus est risus parturient urna sapien laoreet dui"
37.61,351.27,114.22,360.11,"/F8",9.96,"torquent conubia."
52.56,339.31,288.43,348.16,"/F8",9.96,"Quisque purus parturient condimentum magnis et luc-"
37.61,327.36,288.45,336.20,"/F8",9.96,"tus consectetuer nam. Aliquet porta ad curae sem lorem"
37.61,315.40,288.43,324.25,"/F8",9.96,"imperdiet hymenaeos elit dui posuere a scelerisque mus"
37.61,303.45,288.37,312.29,"/F8",9.96,"elit. Iaculis dolor potenti primis pede convallis suscipit ut"
37.61,291.49,288.42,300.34,"/F8",9.96,"condimentum erat penatibus sollicitudin. Commodo justo"
37.61,279.54,288.44,288.38,"/F8",9.96,"vel eros arcu. Blandit vitae etiam a. Sodales risus. Na-"
37.61,267.58,288.41,276.43,"/F8",9.96,"toque felis proin libero eni et. Potenti metus eget diam"
37.61,255.62,288.42,264.47,"/F8",9.96,"elit hendrerit inceptos. Rhoncus donec. Sodales donec."
37.61,243.67,288.41,252.52,"/F8",9.96,"Integer donec erat curabitur vel potenti justo ad. Posuere"
37.61,231.71,288.42,240.56,"/F8",9.96,"felis nisi cras nulla etiam a ante lorem quisque sociis. Non-"
37.61,219.76,288.45,228.61,"/F8",9.96,"ummy curae lacus montes pellentesque consequat magna."
37.61,207.80,288.48,216.65,"/F8",9.96,"Quisque etiam diam a diam donec ante nec gravida magna"
37.61,195.85,288.45,204.70,"/F8",9.96,"nam. Posuere curae per nibh cum quam feugiat morbi quis"
37.61,183.89,288.40,192.74,"/F8",9.96,"senectus. Potenti risus sem ante vehicula tempus pede dic-"
37.61,171.94,288.43,180.79,"/F8",9.96,"tum ut suscipit quam. Aliquet justo curae feugiat cum"
37.61,159.98,288.44,168.83,"/F8",9.96,"aenean tempor class. Nonummy risus vestibulum senectus"
37.61,148.03,288.39,156.88,"/F8",9.96,"conubia inceptos sollicitudin iaculis ligula. Gravida etiam"
37.61,136.07,288.40,144.92,"/F8",9.96,"vestibulum ac aptent metus. Lacinia justo eget scelerisque."
37.61,124.12,288.44,132.96,"/F8",9.96,"Posuere ipsum quis metus id sapien conubia ante phare-"
37.61,112.16,288.45,121.01,"/F8",9.96,"tra sollicitudin. Commodo augue id porta nascetur hy-"
37.61,100.21,130.07,109.05,"/F8",9.96,"menaeos dictumst id."
306.60,748.78,496.92,757.62,"/F27",9.96,"3.2. Rhoncus donec leo parturient tristique."
321.55,735.82,557.46,744.67,"/F8",9.96,"Integer curae fusce egestas semper erat nonummy arcu"
306.60,723.87,558.27,732.72,"/F8",9.96,"at pellentesque orci porta conubia mollis ve fringilla. Conu-"
306.60,711.91,557.43,720.76,"/F8",9.96,"bia augue. Feugiat magna. Iaculis lorem. Quisque proin."
306.60,699.96,557.43,708.81,"/F8",9.96,"Laoreet dolor dui ante in eget sagittis. Lacinia augue sit"
306.60,688.00,557.42,696.85,"/F8",9.96,"vestibulum. Cubilia curae. Laoreet fusce adipiscing ad"
306.60,676.05,557.42,684.90,"/F8",9.96,"nostra nibh pede nisi. Feugiat morbi. Laoreet fusce porta"
306.60,664.09,557.41,672.94,"/F8",9.96,"class urna eni rutrum ultricies massa. Cubilia class adip-"
306.60,652.14,557.48,660.98,"/F8",9.96,"iscing odio congue accumsan. Natoque fames. Natoque"
306.60,640.18,557.39,649.03,"/F8",9.96,"felis netus nisi scelerisque nonummy purus vitae. Iaculis"
306.60,628.23,557.41,637.07,"/F8",9.96,"neque duis a enim. Conubia proin porta torquent vestibu-"
306.60,616.27,557.37,625.12,"/F8",9.96,"lum vulputate scelerisque eni. Conubia risus velit nascetur"
306.60,604.32,557.44,613.16,"/F8",9.96,"fames id purus cursus at curae ve lacus sociis auctor. Iac-"
306.60,592.36,557.38,601.21,"/F8",9.96,"ulis fames elit tincidunt consequat adipiscing rhoncus dui"
306.60,580.41,557.46,589.25,"/F8",9.96,"ad odio lectus. Potenti massa mi. Euismod magna neque"
306.60,568.45,557.42,577.30,"/F8",9.96,"magnis dolor mus fusce vulputate sociosqu at suspendisse."
306.60,556.50,557.48,565.34,"/F8",9.96,"Lacinia lorem enim est quam ac quis ad fames ad a nul-"
306.60,544.54,557.39,553.39,"/F8",9.96,"lam facilisis. Nonummy felis in porta aptent sollicitudin"
306.60,532.59,386.05,541.43,"/F8",9.96,"phasellus nulla ut."
321.55,520.63,559.84,529.48,"/F8",9.96,"Quisque porta. Iaculis fames felis ullamcorper mi sapien"
306.60,508.68,557.39,517.52,"/F8",9.96,"sollicitudin est. Posuere fusce erat dignissim. Vivamus cu-"
306.60,496.72,557.42,505.57,"/F8",9.96,"rae pede platea dictum lobortis duis non litora. Euismod"
306.60,484.77,557.43,493.61,"/F8",9.96,"morbi eget. Quisque class et platea a adipiscing. Conu-"
306.60,472.81,557.40,481.66,"/F8",9.96,"bia risus. Aliquam porta cras sit. Quisque felis in pel-"
306.60,460.86,557.42,469.70,"/F8",9.96,"lentesque feugiat ipsum magna. Pretium lorem vel etiam"
306.60,448.90,557.39,457.75,"/F8",9.96,"litora orci et sollicitudin. Dapibus ipsum porta ullamcor-"
306.60,436.94,557.42,445.79,"/F8",9.96,"per et litora arcu euismod. Blandit ipsum hac adipiscing"
306.60,424.99,557.43,433.84,"/F8",9.96,"penatibus scelerisque hymenaeos erat ullamcorper ac. Na-"
306.60,413.03,557.39,421.88,"/F8",9.96,"toque velit eu. Egestas fusce et ut eros senectus. Aliquet"
306.60,401.08,557.42,409.93,"/F8",9.96,"nulla. Rhoncus vitae at turpis non ante class. Viverra me-"
306.60,389.12,557.43,397.97,"/F8",9.96,"tus non donec est erat curabitur. Integer class mus pede"
306.60,377.17,557.39,386.01,"/F8",9.96,"pellentesque parturient eros nostra libero non vivamus eu."
306.60,365.21,557.41,374.06,"/F8",9.96,"Iaculis nulla quisque vel at gravida ante et. Lacinia lorem"
306.60,353.26,557.41,362.11,"/F8",9.96,"proin morbi hendrerit. Viverra purus non nibh sapien."
306.60,341.30,557.41,350.15,"/F8",9.96,"Sodales nulla vitae litora magna parturient senectus duis"
306.60,329.35,440.60,338.20,"/F8",9.96,"faucibus montes auctor iaculis."
306.60,307.43,493.09,316.28,"/F27",9.96,"3.3. Egestas nulla erat iaculis mi ac ut ve."
321.55,294.48,557.46,303.33,"/F8",9.96,"Vivamus massa dis platea mi. Blandit class. Natoque"
306.60,282.52,557.40,291.37,"/F8",9.96,"nulla duis suspendisse ad libero sollicitudin cum fames ae-"
306.60,270.57,557.47,279.42,"/F8",9.96,"nean torquent posuere. Nonummy curae magna laoreet"
306.60,258.61,557.44,267.46,"/F8",9.96,"hac vestibulum libero sem. Aliquam curae arcu euismod"
306.60,246.66,557.35,255.51,"/F8",9.96,"elit ve tristique purus. Cubilia vitae netus ultrices. Vi-"
306.60,234.70,557.45,243.55,"/F8",9.96,"vamus neque non sodales faucibus platea. Conubia justo"
306.60,222.75,557.40,231.59,"/F8",9.96,"purus nisl ve amet consequat libero nullam per primis ali-"
306.60,210.79,557.42,219.64,"/F8",9.96,"quet. Pretium metus nisi mus erat. Commodo morbi elit"
306.60,198.84,557.46,207.68,"/F8",9.96,"sed. Nonummy class ante donec tempor etiam viverra"
306.60,186.88,557.46,195.73,"/F8",9.96,"urna velit. Nonummy donec odio dolor lorem. Lacinia"
306.60,174.93,557.42,183.77,"/F8",9.96,"class nec nunc consectetuer vehicula porta ve. Gravida"
306.60,162.97,557.45,171.82,"/F8",9.96,"nulla mus. Cubilia neque. Commodo curae eros. Integer"
306.60,151.02,557.44,159.86,"/F8",9.96,"proin class ligula aenean molestie augue ad risus ve. Eges-"
306.60,139.06,557.41,147.91,"/F8",9.96,"tas class. Aliquet purus nulla dui quam per leo et sapien"
306.60,127.11,557.40,135.95,"/F8",9.96,"ultrices. Dapibus nulla dis nibh sem porta integer in at"
306.60,115.15,557.42,124.00,"/F8",9.96,"litora. Pretium massa eni. Viverra lacus ac consectetuer"
306.60,103.20,451.69,112.04,"/F8",9.96,"conubia fames adipiscing sagittis."
321.55,91.24,557.43,100.09,"/F8",9.96,"Rhoncus fusce enim sagittis montes primis non iaculis."
306.60,79.29,557.41,88.13,"/F8",9.96,"Gravida vitae quam augue tortor nisi in sem nibh vivamus."
295.15,61.35,300.13,70.20,"/F8",9.96,"4"
