37.61,748.78,188.70,757.62,"/F8",9.96,"Blandit risus magna a eros lacus."
197.09,748.78,263.75,757.62,"/F8",9.96,"Gravida etiam."
272.15,748.78,288.46,757.62,"/F8",9.96,"Ali-"
37.61,736.82,288.44,745.67,"/F8",9.96,"quam neque urna viverra ac ante velit sodales habitasse"
37.61,724.87,122.10,733.71,"/F8",9.96,"eros dis sapien mi."
130.64,724.87,288.45,733.71,"/F8",9.96,"Posuere velit diam dolor nonummy"
37.61,712.91,128.60,721.76,"/F8",9.96,"quam sagittis lorem."
136.18,712.91,191.88,721.76,"/F8",9.96,"Lacinia felis."
199.47,712.91,288.45,721.76,"/F8",9.96,"Vivamus etiam ante"
37.61,700.96,129.27,709.80,"/F8",9.96,"at velit pellentesque."
136.37,700.96,288.41,709.80,"/F8",9.96,"Gravida massa eu nulla et dictum"
37.61,689.00,288.40,697.85,"/F8",9.96,"torquent at suspendisse et nullam ultricies metus ac. Eu-"
37.61,677.04,93.23,685.89,"/F8",9.96,"ismod netus."
99.16,677.04,288.43,685.89,"/F8",9.96,"Vivamus augue risus senectus facilisis urna"
37.61,665.09,288.43,673.94,"/F8",9.96,"cras conubia id. Potenti purus urna est a ornare. Posuere"
37.61,653.13,216.91,661.98,"/F8",9.96,"curae fames gravida curae blandit at et."
223.96,653.13,288.46,661.98,"/F8",9.96,"Aliquam curae"
37.61,641.18,288.44,650.03,"/F8",9.96,"integer tempus urna ipsum ullamcorper eu sapien donec"
37.61,629.22,84.37,638.07,"/F8",9.96,"parturient."
92.13,629.22,167.36,638.07,"/F8",9.96,"Egestas justo ut."
175.11,629.22,288.41,638.07,"/F8",9.96,"Pretium dolor neque cur-"
37.61,617.27,230.19,626.11,"/F8",9.96,"abitur dis fringilla eni consectetuer vitae eu."
52.56,605.31,288.41,614.16,"/F8",9.96,"Pretium lorem cras ad pellentesque platea tempus velit."
37.61,593.36,100.57,602.20,"/F8",9.96,"Quisque justo."
106.13,593.36,288.43,602.20,"/F8",9.96,"Aliquet morbi curae pretium magna euis-"
37.61,581.40,59.46,590.25,"/F8",9.96,"mod."
68.49,581.40,288.49,590.25,"/F8",9.96,"Vivamus morbi eu a nisi massa luctus nam mus"
37.61,569.45,288.41,578.29,"/F8",9.96,"porttitor. Aliquet lorem. Iaculis felis et neque congue ae-"
37.61,557.49,288.43,566.34,"/F8",9.96,"nean proin iaculis fusce neque gravida bibendum purus."
37.61,545.54,152.64,554.38,"/F8",9.96,"Rhoncus massa nibh orci."
160.60,545.54,288.47,554.38,"/F8",9.96,"Rhoncus massa nisi litora et"
37.61,533.58,67.69,542.43,"/F8",9.96,"per ve."
73.55,533.58,288.42,542.43,"/F8",9.96,"Laoreet risus urna fusce hendrerit venenatis par-"
37.61,521.63,288.38,530.47,"/F8",9.96,"turient laoreet eni eu ligula interdum parturient. Feugiat"
37.61,509.67,288.40,518.52,"/F8",9.96,"risus justo nisi ad pellentesque rhoncus fames nisi. Posuere"
37.61,497.72,288.41,506.56,"/F8",9.96,"purus. Potenti justo. Natoque lacus. Cubilia justo at sit"
37.61,485.76,288.41,494.61,"/F8",9.96,"elementum ligula. Feugiat felis metus cras. Pretium porta"
37.61,473.81,144.90,482.65,"/F8",9.96,"morbi fusce suspendisse."
151.41,473.81,288.41,482.65,"/F8",9.96,"Blandit netus quis ullamcorper"
37.61,461.85,265.89,470.70,"/F8",9.96,"nam dictum inceptos fringilla duis per vitae curae."
273.63,461.85,288.43,470.70,"/F8",9.96,"Po-"
37.61,449.90,288.37,458.74,"/F8",9.96,"suere justo leo nisl facilisi parturient consequat scelerisque"
37.61,437.94,288.39,446.79,"/F8",9.96,"leo nunc. Blandit felis. Pretium lacus quam at sollicitudin"
37.61,425.99,288.42,434.83,"/F8",9.96,"cubilia dolor eu sapien curabitur. Blandit massa. Egestas"
37.61,414.03,150.60,422.88,"/F8",9.96,"justo eros lacinia at fusce."
37.61,391.61,228.30,400.46,"/F27",9.96,"1.2. Feugiat etiam urna posuere duis netus."
52.56,378.17,288.47,387.01,"/F8",9.96,"Rhoncus proin ac semper id odio. Blandit lorem cum"
37.61,366.21,288.46,375.06,"/F8",9.96,"penatibus. Integer proin. Nonummy augue amet natoque"
37.61,354.26,198.42,363.10,"/F8",9.96,"tellus quis et quam dignissim pede."
207.49,354.26,288.41,363.10,"/F8",9.96,"Pretium vitae nec"
37.61,342.30,104.41,351.15,"/F8",9.96,"pharetra dolor."
113.27,342.30,288.44,351.15,"/F8",9.96,"Sodales morbi lacus elit dui erat blan-"
37.61,330.34,52.53,339.19,"/F8",9.96,"dit."
58.68,330.34,255.99,339.19,"/F8",9.96,"Posuere nulla nibh aptent ac sociis volutpat."
262.15,330.34,288.42,339.19,"/F8",9.96,"Conu-"
37.61,318.39,288.45,327.24,"/F8",9.96,"bia netus massa urna enim nonummy in et in fringilla."
37.61,306.43,264.00,315.28,"/F8",9.96,"Commodo netus vitae sem rhoncus enim sed cras."
272.17,306.43,288.48,315.28,"/F8",9.96,"Ali-"
37.61,294.48,288.36,303.33,"/F8",9.96,"quet lacus elit litora blandit rhoncus sollicitudin. Aliquet"
37.61,282.52,288.43,291.37,"/F8",9.96,"massa. Euismod massa vitae mollis vitae risus scelerisque"
37.61,270.57,288.44,279.42,"/F8",9.96,"cum. Gravida morbi fusce ullamcorper bibendum phasel-"
37.61,258.61,216.17,267.46,"/F8",9.96,"lus leo pede sollicitudin vestibulum elit."
224.00,258.61,288.37,267.46,"/F8",9.96,"Pretium lacus."
37.61,246.66,288.38,255.51,"/F8",9.96,"Viverra donec dui velit nunc justo suspendisse facilisi. Feu-"
37.61,234.70,288.42,243.55,"/F8",9.96,"giat nulla adipiscing facilisi fusce elementum condimen-"
37.61,222.75,58.07,231.60,"/F8",9.96,"tum."
64.43,222.75,288.39,231.60,"/F8",9.96,"Potenti lorem adipiscing eleifend duis quis eleifend"
37.61,210.79,102.77,219.64,"/F8",9.96,"justo nam elit."
109.90,210.79,170.56,219.64,"/F8",9.96,"Natoque felis."
177.70,210.79,245.45,219.64,"/F8",9.96,"Rhoncus porta."
252.59,210.79,288.44,219.64,"/F8",9.96,"Dapibus"
37.61,198.84,288.40,207.68,"/F8",9.96,"nulla ad consectetuer pellentesque viverra dictum per in"
37.61,186.88,183.91,195.73,"/F8",9.96,"blandit id augue ullamcorper dis."
189.54,186.88,288.43,195.73,"/F8",9.96,"Quisque dolor ad tem-"
37.61,174.93,256.33,183.77,"/F8",9.96,"pus sit auctor nascetur parturient. Aliquam justo."
52.56,162.97,288.45,171.82,"/F8",9.96,"Egestas class purus taciti ut enim lobortis massa ve."
37.61,151.02,288.46,159.86,"/F8",9.96,"Sodales massa sem placerat dignissim class in malesuada."
37.61,139.06,288.49,147.91,"/F8",9.96,"Aliquam magna arcu ac enim eros pede duis nulla na-"
37.61,127.11,64.70,135.95,"/F8",9.96,"toque."
71.77,127.11,288.43,135.95,"/F8",9.96,"Laoreet donec felis non amet dictumst est libero"
37.61,115.15,288.42,124.00,"/F8",9.96,"lectus nulla laoreet mus mi. Blandit justo eros ornare ve."
37.61,103.20,288.45,112.04,"/F8",9.96,"Egestas dolor nec diam. Iaculis curae. Lacinia augue elit"
37.61,91.24,288.41,100.09,"/F8",9.96,"tempus cum amet consectetuer integer. Viverra risus proin"
37.61,79.29,288.42,88.13,"/F8",9.96,"fusce leo duis. Natoque donec nisi nisl consequat praesent."
306.60,748.78,496.38,757.62,"/F8",9.96,"Conubia porta parturient pulvinar cras sit."
502.41,748.78,557.41,757.62,"/F8",9.96,"Natoque pu-"
306.60,736.82,557.47,745.67,"/F8",9.96,"rus massa ornare nullam massa placerat ac quam aptent"
306.60,724.87,336.51,733.71,"/F8",9.96,"sapien."
344.80,724.87,557.42,733.71,"/F8",9.96,"Gravida dolor est urna interdum lectus tempor"
306.60,712.91,557.37,721.76,"/F8",9.96,"sagittis fringilla class ridiculus arcu per ultrices dapibus"
306.60,700.95,450.37,709.80,"/F8",9.96,"congue quam mollis vel montes."
458.86,700.95,557.45,709.80,"/F8",9.96,"Viverra class cras leo."
306.60,689.00,557.40,697.85,"/F8",9.96,"Blandit fusce. Potenti risus. Posuere massa cras ridiculus"
306.60,677.04,557.39,685.89,"/F8",9.96,"elementum. Gravida velit fusce aliquet. Iaculis lorem cum"
306.60,665.09,557.44,673.94,"/F8",9.96,"natoque aenean orci ullamcorper. Integer neque sem diam"
306.60,653.13,557.40,661.98,"/F8",9.96,"nibh dolor justo tempus eu iaculis ve. Euismod velit diam"
306.60,641.18,530.71,650.02,"/F8",9.96,"egestas curae augue odio bibendum. Cubilia donec."
306.60,617.27,530.84,626.11,"/F27",9.96,"1.3. Feugiat lorem cras mi nulla faucibus class elit."
321.55,602.32,478.67,611.17,"/F8",9.96,"Egestas lacus massa dui urna nisl."
488.15,602.32,557.49,611.17,"/F8",9.96,"Laoreet magna."
306.60,590.37,557.45,599.22,"/F8",9.96,"Egestas magna. Feugiat porta. Euismod nulla et at hen-"
306.60,578.41,557.37,587.26,"/F8",9.96,"drerit curabitur fames fringilla nam hendrerit primis vitae"
306.60,566.46,557.40,575.31,"/F8",9.96,"et nibh massa. Lacinia proin orci ad sapien tristique. Inte-"
306.60,554.50,557.40,563.35,"/F8",9.96,"ger purus ad a. Viverra velit eu platea et facilisi quis mat-"
306.60,542.55,557.42,551.39,"/F8",9.96,"tis eget mi eleifend vivamus etiam. Integer vitae commodo"
306.60,530.59,557.43,539.44,"/F8",9.96,"eros risus. Natoque porta vitae cras faucibus mauris nunc"
306.60,518.64,557.40,527.48,"/F8",9.96,"mauris inceptos parturient congue felis. Conubia purus mi"
306.60,506.68,557.43,515.53,"/F8",9.96,"class ad dolor eu. Euismod neque erat. Integer netus leo"
306.60,494.73,450.72,503.57,"/F8",9.96,"pretium bibendum eu lorem sed."
456.78,494.73,557.41,503.57,"/F8",9.96,"Aliquet neque in porta"
306.60,482.77,557.40,491.62,"/F8",9.96,"ve bibendum quisque at vulputate a fermentum vitae in."
306.60,470.82,557.41,479.66,"/F8",9.96,"Aliquet justo. Potenti lacus et fames erat cum urna ipsum"
306.60,458.86,416.16,467.71,"/F8",9.96,"lorem eleifend nibh eget."
423.14,458.86,487.57,467.71,"/F8",9.96,"Conubia vitae."
494.56,458.86,557.41,467.71,"/F8",9.96,"Quisque porta"
306.60,446.91,514.67,455.75,"/F8",9.96,"odio mi mus nunc vitae nostra lectus porttitor."
520.37,446.91,557.41,455.75,"/F8",9.96,"Aliquam"
306.60,434.95,518.67,443.80,"/F8",9.96,"neque erat pretium dolor diam dis cum blandit."
524.93,434.95,557.41,443.80,"/F8",9.96,"Blandit"
306.60,423.00,557.40,431.84,"/F8",9.96,"netus elit iaculis ut platea ad. Quisque fusce ve malesuada"
306.60,411.04,557.42,419.89,"/F8",9.96,"magna hendrerit at ut etiam curae per adipiscing. Feugiat"
306.60,399.09,557.39,407.93,"/F8",9.96,"curae nulla purus libero cursus morbi vulputate lectus orci"
306.60,387.13,526.58,395.98,"/F8",9.96,"velit id nibh diam faucibus dis sollicitudin magnis."
321.55,375.18,557.45,384.02,"/F8",9.96,"Sodales dolor. Posuere porta. Rhoncus porta parturi-"
306.60,363.22,514.28,372.07,"/F8",9.96,"ent et tristique a leo curabitur mus nisl felis."
523.72,363.22,557.39,372.07,"/F8",9.96,"Posuere"
306.60,351.27,557.41,360.11,"/F8",9.96,"lorem. Iaculis purus eu platea sollicitudin. Integer magna"
306.60,339.31,480.82,348.16,"/F8",9.96,"parturient dictumst duis nisi dictumst."
489.04,339.31,557.38,348.16,"/F8",9.96,"Pretium augue."
306.60,327.36,557.47,336.20,"/F8",9.96,"Euismod porta. Laoreet augue cum aptent malesuada ne-"
306.60,315.40,557.42,324.25,"/F8",9.96,"tus. Potenti dolor. Posuere neque ve augue ante ullamcor-"
306.60,303.45,557.40,312.29,"/F8",9.96,"per natoque mus fermentum pellentesque dis vulputate."
306.60,291.49,419.87,300.34,"/F8",9.96,"Laoreet purus ve felis eu."
427.12,291.49,557.41,300.34,"/F8",9.96,"Iaculis lacus aliquet varius et"
306.60,279.53,557.40,288.38,"/F8",9.96,"accumsan. Aliquet justo et auctor ut ultrices rhoncus pel-"
306.60,267.58,557.42,276.43,"/F8",9.96,"lentesque. Lacinia donec. Viverra lorem class fermentum"
306.60,255.62,454.22,264.47,"/F8",9.96,"dolor et lobortis natoque aliquet."
461.47,255.62,557.44,264.47,"/F8",9.96,"Commodo lacus nulla"
306.60,243.67,557.41,252.52,"/F8",9.96,"sed mauris ac hac elementum pellentesque cum tristique"
306.60,231.71,327.88,240.56,"/F8",9.96,"ante."
335.16,231.71,517.74,240.56,"/F8",9.96,"Cubilia fusce odio nisi posuere etiam sit."
525.01,231.71,557.42,240.56,"/F8",9.96,"Sodales"
306.60,219.76,557.44,228.61,"/F8",9.96,"ipsum nibh aliquam a aptent tincidunt at aenean a mo-"
306.60,207.80,557.38,216.65,"/F8",9.96,"lestie. Egestas nulla sodales viverra pellentesque phasellus"
306.60,195.85,557.43,204.70,"/F8",9.96,"nulla. Nonummy morbi ante sodales et aptent consequat."
306.60,183.89,513.54,192.74,"/F8",9.96,"Potenti fames massa gravida cum adipiscing et."
306.60,154.01,483.51,162.85,"/F17",9.96,"2. Conubia donec cras suspendisse."
321.55,133.08,382.04,141.93,"/F8",9.96,"Blandit fusce."
388.27,133.08,557.43,141.93,"/F8",9.96,"Integer risus mi a elit id odio ante leo"
306.60,121.13,470.72,129.98,"/F8",9.96,"a magnis habitasse dictumst aenean."
478.61,121.13,557.46,129.98,"/F8",9.96,"Rhoncus curae ve"
306.60,109.17,415.49,118.02,"/F8",9.96,"donec ullamcorper amet."
421.81,109.17,557.43,118.02,"/F8",9.96,"Cubilia dolor nulla porta fusce"
306.60,97.22,438.48,106.07,"/F8",9.96,"risus porta lacus ullamcorper."
445.11,97.22,557.46,106.07,"/F8",9.96,"Nonummy fames pede ad"
306.60,85.26,511.66,94.11,"/F8",9.96,"nibh hac vitae vulputate nullam porta augue."
519.36,85.26,557.43,94.11,"/F8",9.96,"Euismod"
295.15,61.35,300.13,70.20,"/F8",9.96,"2"
