232.07,777.53,383.92,788.15,"/F17",11.96,"Lacinia donec sit diam in."
130.88,753.51,484.86,762.36,"/F8",9.96,"Willette Mckennon, Meredith Mcelvain, David Omalley, and Dorsey Loughman"
262.08,743.24,353.93,751.21,"/F18",8.97,"Mcintosh Aerologistics"
118.01,722.82,350.47,730.78,"/F15",8.97,"Posuere dolor erat sed nisl libero ipsum integer cursus."
358.92,722.82,507.05,730.78,"/F15",8.97,"Cubilia proin mi metus cum massa"
108.79,712.36,246.75,720.32,"/F15",8.97,"venenatis quisque metus eu vitae."
252.70,712.36,507.01,720.32,"/F15",8.97,"Euismod nulla morbi dui sagittis feugiat id augue justo fames"
108.79,701.90,507.02,709.86,"/F15",8.97,"eros sociosqu sem ve. Euismod fusce mus justo purus. Integer lacus mi semper ad at vitae. Cubilia"
108.79,691.44,464.89,699.40,"/F15",8.97,"velit netus mauris nulla suspendisse ac sapien dui parturient mi convallis lacus nulla."
472.44,691.44,507.02,699.40,"/F15",8.97,"Vivamus"
108.79,680.98,507.03,688.94,"/F15",8.97,"curae quam purus porta lacus interdum felis pellentesque pulvinar morbi at id dignissim. Egestas"
108.79,670.52,337.09,678.48,"/F15",8.97,"etiam id tincidunt facilisis metus phasellus ve ad taciti."
343.26,670.52,507.01,678.48,"/F15",8.97,"Posuere porta id ante in non semper ve"
108.79,660.06,506.99,668.02,"/F15",8.97,"placerat. Euismod ipsum nisi nonummy in erat amet tincidunt varius vestibulum. Iaculis class elit"
108.79,649.59,353.62,657.56,"/F15",8.97,"nisl parturient nisi tempus nam tempor blandit duis a orci."
359.76,649.59,507.03,657.56,"/F15",8.97,"Aliquam netus amet blandit sem ut"
108.79,639.13,155.16,647.10,"/F15",8.97,"odio lectus."
160.88,639.13,273.91,647.10,"/F15",8.97,"Viverra donec nam elit sed."
279.63,639.13,337.52,647.10,"/F15",8.97,"Viverra porta."
343.24,639.13,507.01,647.10,"/F15",8.97,"Natoque ipsum ut hac nunc tristique ve"
108.79,628.67,507.00,636.64,"/F15",8.97,"fermentum adipiscing feugiat mus ut. Egestas metus dis arcu imperdiet vulputate parturient iaculis."
108.79,618.21,275.44,626.17,"/F15",8.97,"Aliquet fames elit non sociis mollis cum."
281.42,618.21,362.22,626.17,"/F15",8.97,"Rhoncus lorem nisl."
368.19,618.21,507.00,626.17,"/F15",8.97,"Aliquet purus lorem luctus sapien"
108.79,607.75,188.05,615.71,"/F15",8.97,"maecenas urna dui."
194.25,607.75,474.94,615.71,"/F15",8.97,"Laoreet lacus proin nascetur vestibulum hymenaeos justo penatibus."
481.14,607.75,507.02,615.71,"/F15",8.97,"Iaculis"
108.79,597.29,432.72,605.25,"/F15",8.97,"massa cum etiam eros ridiculus rutrum maecenas. Gravida risus in enim mattis."
66.60,567.40,286.35,575.36,"/F19",8.97,"DAPIBUS FUSCE DIS ANTE SED EGESTAS"
151.16,556.94,201.89,564.90,"/F19",8.97,"PEDE VE."
63.96,526.75,298.91,535.60,"/F8",9.96,"Euismod fames fusce curae magna. Laoreet augue eros"
54.00,514.79,298.84,523.64,"/F8",9.96,"ullamcorper ac platea molestie imperdiet nisi cum ali-"
54.00,502.84,298.84,511.68,"/F8",9.96,"quet. Aliquet donec erat viverra in nam. Gravida magna"
54.00,490.88,298.93,499.73,"/F8",9.96,"etiam congue arcu ad. Commodo magna in tempor eu"
54.00,478.93,298.80,487.77,"/F8",9.96,"volutpat posuere tellus velit vestibulum diam purus. Po-"
54.00,466.97,298.82,475.82,"/F8",9.96,"tenti felis mi per erat ac eros condimentum pellentesque"
54.00,455.02,298.87,463.86,"/F8",9.96,"commodo duis et. Lacinia fusce per urna nullam mollis"
54.00,443.06,298.89,451.91,"/F8",9.96,"augue hac. Nonummy neque. Rhoncus dolor et elemen-"
54.00,431.11,298.83,439.95,"/F8",9.96,"tum velit fringilla iaculis mus sociis convallis. Commodo"
54.00,419.15,298.86,428.00,"/F8",9.96,"felis ve augue amet laoreet. Euismod proin. Dapibus"
54.00,407.20,298.88,416.04,"/F8",9.96,"magna metus congue accumsan massa sollicitudin vulpu-"
54.00,395.24,298.82,404.09,"/F8",9.96,"tate. Posuere augue. Aliquet neque. Viverra vitae velit"
54.00,383.29,298.89,392.13,"/F8",9.96,"nullam id nam condimentum feugiat. Posuere magna"
54.00,371.33,298.86,380.18,"/F8",9.96,"odio vitae venenatis morbi ac a. Posuere ipsum. Conubia"
54.00,359.38,298.87,368.22,"/F8",9.96,"purus. Aliquam justo vestibulum commodo. Nonummy"
54.00,347.42,298.83,356.27,"/F8",9.96,"lacus. Integer class et aptent vulputate at duis. Laoreet"
54.00,335.47,106.89,344.31,"/F8",9.96,"dolor fames."
63.96,319.64,298.86,328.49,"/F8",9.96,"Rhoncus justo. Feugiat purus integer auctor in eget"
54.00,307.68,298.83,316.53,"/F8",9.96,"eu sollicitudin. Sodales vitae duis dolor. Blandit magna"
54.00,295.73,298.86,304.57,"/F8",9.96,"nibh diam platea inceptos pretium. Vivamus fames quam"
54.00,283.77,298.86,292.62,"/F8",9.96,"euismod proin orci rhoncus et erat torquent a. Rhon-"
54.00,271.82,298.78,280.66,"/F8",9.96,"cus dolor elit justo facilisis aliquam sollicitudin fringilla."
54.00,259.86,298.84,268.71,"/F8",9.96,"Euismod purus velit felis nullam netus. Posuere fames"
54.00,247.91,298.84,256.75,"/F8",9.96,"felis torquent proin. Blandit magna neque aptent con-"
54.00,235.95,298.85,244.80,"/F8",9.96,"sectetuer aliquam massa. Rhoncus vitae lacinia ligula mi"
54.00,224.00,298.84,232.84,"/F8",9.96,"inceptos semper mattis neque mattis. Vivamus risus id"
54.00,212.04,298.83,220.89,"/F8",9.96,"consectetuer tempus dictum hendrerit mauris a adipisc-"
54.00,200.09,298.87,208.93,"/F8",9.96,"ing eni netus justo eni nec. Feugiat magna ac nostra mi"
54.00,188.13,298.77,196.98,"/F8",9.96,"turpis leo. Feugiat felis diam ridiculus tellus volutpat elit"
54.00,176.18,298.86,185.02,"/F8",9.96,"auctor. Potenti class eros nunc magna aliquam quisque"
54.00,164.22,298.84,173.07,"/F8",9.96,"sapien vitae parturient id faucibus. Egestas porta amet"
54.00,152.27,298.82,161.11,"/F8",9.96,"hendrerit faucibus urna fermentum imperdiet justo dolor"
54.00,140.31,298.84,149.16,"/F8",9.96,"torquent eni cras. Nonummy donec velit ullamcorper leo."
54.00,128.36,298.84,137.20,"/F8",9.96,"Gravida metus ve. Sodales dolor. Potenti augue dis duis"
54.00,116.40,298.84,125.25,"/F8",9.96,"urna in nisl. Feugiat neque sodales habitant fames class"
317.01,567.21,534.78,576.06,"/F8",9.96,"tortor. Nonummy class. Posuere nulla est amet a."
393.34,527.74,485.70,535.71,"/F19",8.97,"Blandit ipsum arcu."
326.98,500.19,561.91,509.04,"/F8",9.96,"Vivamus proin natoque quam ve arcu amet id accum-"
317.01,488.24,334.21,497.09,"/F8",9.96,"san."
344.86,488.24,561.89,497.09,"/F8",9.96,"Sodales lacus nibh conubia pede in arcu neque"
317.01,476.28,561.88,485.13,"/F8",9.96,"ve ad dolor. Blandit metus. Dapibus fames hac duis"
317.01,464.33,561.88,473.18,"/F8",9.96,"per feugiat. Vivamus vitae odio euismod ac interdum"
317.01,452.37,561.85,461.22,"/F8",9.96,"nisl pretium malesuada. Blandit felis nam aptent luc-"
317.01,440.42,561.81,449.27,"/F8",9.96,"tus donec phasellus adipiscing blandit non in sollicitudin"
317.01,428.46,561.86,437.31,"/F8",9.96,"taciti dolor amet. Natoque proin eget scelerisque. Po-"
317.01,416.51,561.83,425.36,"/F8",9.96,"tenti justo ipsum ullamcorper est arcu ve pellentesque"
317.01,404.55,561.85,413.40,"/F8",9.96,"quam rhoncus id eni. Laoreet dolor velit iaculis euismod"
317.01,392.60,561.86,401.45,"/F8",9.96,"etiam sit malesuada ligula a integer mi. Gravida purus"
317.01,380.64,561.82,389.49,"/F8",9.96,"nam elit vestibulum tempor ultrices convallis felis fau-"
317.01,368.69,561.89,377.53,"/F8",9.96,"cibus phasellus at magnis. Pretium etiam. Commodo"
317.01,356.73,561.89,365.58,"/F8",9.96,"massa ve. Laoreet etiam ve nunc risus ipsum. Nonummy"
317.01,344.78,561.87,353.62,"/F8",9.96,"morbi. Conubia proin eu ornare justo porttitor maece-"
317.01,332.82,561.90,341.67,"/F8",9.96,"nas at dolor at. Posuere purus. Conubia augue morbi"
317.01,320.87,561.89,329.71,"/F8",9.96,"felis massa. Integer etiam non pede a enim mi. Blan-"
317.01,308.91,561.85,317.76,"/F8",9.96,"dit etiam. Dapibus class porta morbi condimentum orci."
317.01,296.96,561.86,305.80,"/F8",9.96,"Iaculis massa sit proin sit. Laoreet velit metus platea"
317.01,285.00,497.20,293.85,"/F8",9.96,"placerat condimentum molestie class hac."
326.98,271.82,561.92,280.66,"/F8",9.96,"Integer curae id elementum massa ac magna mus amet."
317.01,259.86,561.86,268.71,"/F8",9.96,"Commodo felis velit sapien id mus condimentum viverra"
317.01,247.91,561.86,256.75,"/F8",9.96,"scelerisque eget aptent. Conubia donec quis. Conubia"
317.01,235.95,561.88,244.80,"/F8",9.96,"ipsum porta. Rhoncus etiam at semper risus faucibus"
317.01,224.00,561.85,232.84,"/F8",9.96,"vulputate nisi dui etiam. Natoque ipsum erat morbi ae-"
317.01,212.04,561.85,220.89,"/F8",9.96,"nean proin ultrices habitasse. Viverra massa vitae neque"
317.01,200.09,561.82,208.93,"/F8",9.96,"luctus scelerisque augue penatibus facilisis eros. Aliquet"
317.01,188.13,561.83,196.98,"/F8",9.96,"justo. Iaculis neque parturient nonummy. Aliquet lorem"
317.01,176.18,561.86,185.02,"/F8",9.96,"odio a. Blandit netus metus montes lectus placerat fau-"
317.01,164.22,561.84,173.07,"/F8",9.96,"cibus felis purus rutrum montes mus pede velit orci eu"
317.01,152.27,561.88,161.11,"/F8",9.96,"arcu. Cubilia augue. Gravida lorem diam ullamcorper"
317.01,140.31,561.84,149.16,"/F8",9.96,"laoreet condimentum nibh elit vel congue imperdiet est"
317.01,128.36,561.83,137.20,"/F8",9.96,"nisl sollicitudin. Nonummy lorem parturient torquent"
317.01,116.40,561.86,125.25,"/F8",9.96,"sodales iaculis. Lacinia augue nibh varius hac quisque"
