60.97,777.53,554.81,788.15,"/F17",11.96,"Conubia velit class enim accumsan suspendisse dictumst imperdiet duis suspendisse"
216.47,763.59,399.53,774.20,"/F17",11.96,"nonummy nec duis vestibulum."
60.32,739.56,555.29,748.41,"/F8",9.96,"Yong Stultz, Avelina Belvin, Ben Fassett, Hipolito Stanseld, David Omalley, Ilona Hubbard, and Julene Meares"
224.86,729.30,391.08,737.26,"/F18",8.97,"Mcknight Specialized Speciality Research"
118.01,708.87,258.57,716.83,"/F15",8.97,"Nonummy dolor sit erat porttitor."
264.97,708.87,507.04,716.83,"/F15",8.97,"Blandit purus nibh ipsum feugiat amet et proin nam enim"
108.80,698.41,506.97,706.37,"/F15",8.97,"mus. Egestas nulla ante blandit curae augue vitae habitant vitae facilisi ac. Posuere netus in turpis"
108.80,687.95,200.04,695.91,"/F15",8.97,"sollicitudin sem curae."
206.53,687.95,431.15,695.91,"/F15",8.97,"Nonummy lacus nisl dis lacus ornare euismod gravida."
437.64,687.95,507.02,695.91,"/F15",8.97,"Dapibus fusce ut"
108.80,677.49,506.98,685.45,"/F15",8.97,"magnis sociosqu imperdiet hac urna enim feugiat a mattis enim nam fames. Quisque porta non etiam"
108.80,667.03,300.59,674.99,"/F15",8.97,"dignissim malesuada quis natoque at proin eu."
306.96,667.03,506.99,674.99,"/F15",8.97,"Vivamus justo orci nec lectus et inceptos mauris"
108.80,656.57,215.63,664.53,"/F15",8.97,"varius dignissim fames et."
222.99,656.57,465.20,664.53,"/F15",8.97,"Commodo metus purus etiam lacinia mus ridiculus morbi."
472.56,656.57,507.02,664.53,"/F15",8.97,"Rhoncus"
108.80,646.11,425.97,654.07,"/F15",8.97,"donec felis tortor eu ultrices auctor adipiscing justo natoque ridiculus congue."
431.19,646.11,506.99,654.07,"/F15",8.97,"Viverra augue sem"
108.80,635.65,507.01,643.61,"/F15",8.97,"nunc sem. Conubia metus adipiscing condimentum congue eu. Vivamus velit orci dui consectetuer"
108.80,625.19,280.54,633.15,"/F15",8.97,"nullam ad mus nibh adipiscing aptent ve."
287.19,625.19,342.94,633.15,"/F15",8.97,"Potenti lacus."
349.59,625.19,507.02,633.15,"/F15",8.97,"Egestas ipsum pede ve cum ac elit ad"
108.80,614.73,295.30,622.69,"/F15",8.97,"augue consectetuer hendrerit porta habitasse."
301.52,614.73,474.89,622.69,"/F15",8.97,"Rhoncus lorem velit augue sagittis ut dui."
481.12,614.73,506.99,622.69,"/F15",8.97,"Iaculis"
108.80,604.26,507.01,612.23,"/F15",8.97,"lorem neque dictumst fames urna mauris porttitor maecenas donec ut curabitur mi auctor. Posuere"
108.80,593.80,507.00,601.77,"/F15",8.97,"vitae augue enim tristique nibh dis. Iaculis ipsum nunc sit mus iaculis lobortis nulla mi ad nostra."
108.80,583.34,507.01,591.31,"/F15",8.97,"Potenti felis mi congue nam ornare eu fringilla. Posuere fusce eros id enim ad sollicitudin. Conubia"
108.80,572.88,506.98,580.84,"/F15",8.97,"magna etiam iaculis quisque auctor quis malesuada duis sed mattis nulla fermentum fringilla metus"
108.80,562.42,120.05,570.38,"/F15",8.97,"ut."
67.01,532.53,285.92,540.50,"/F19",8.97,"VIVERRA PORTA AD FACILISIS ORCI ENI"
119.32,522.07,233.67,530.03,"/F19",8.97,"MORBI HYMENAEOS."
63.96,491.38,298.84,500.23,"/F8",9.96,"Lacinia fames etiam viverra tristique faucibus mauris"
54.00,479.43,298.82,488.27,"/F8",9.96,"viverra pretium primis cum. Iaculis purus arcu leo risus"
54.00,467.47,298.83,476.32,"/F8",9.96,"arcu. Potenti donec at ante. Pretium risus sed habitant"
54.00,455.52,189.37,464.36,"/F8",9.96,"consectetuer blandit dignissim."
195.07,455.52,298.84,464.36,"/F8",9.96,"Euismod neque ac tem-"
54.00,443.56,298.84,452.41,"/F8",9.96,"por eu. Quisque magna vestibulum lacinia eros. Gravida"
54.00,431.61,78.91,440.45,"/F8",9.96,"dolor."
84.77,431.61,202.43,440.45,"/F8",9.96,"Euismod metus adipiscing."
208.31,431.61,298.84,440.45,"/F8",9.96,"Pretium ipsum justo"
54.00,419.65,99.86,428.50,"/F8",9.96,"metus eni."
107.34,419.65,298.83,428.50,"/F8",9.96,"Rhoncus justo elit ligula aptent risus justo"
54.00,407.69,77.49,416.54,"/F8",9.96,"nunc."
85.37,407.69,172.53,416.54,"/F8",9.96,"Posuere curae ante."
180.40,407.69,298.85,416.54,"/F8",9.96,"Egestas vitae urna blandit"
54.00,395.74,298.82,404.59,"/F8",9.96,"nonummy aptent diam luctus ridiculus. Posuere risus leo"
54.00,383.78,298.88,392.63,"/F8",9.96,"eget hac magna est volutpat. Euismod proin mi congue"
54.00,371.83,298.82,380.68,"/F8",9.96,"libero at faucibus. Rhoncus purus vel suscipit a senectus"
54.00,359.87,298.85,368.72,"/F8",9.96,"leo conubia at quam. Potenti augue per convallis orci leo"
54.00,347.92,298.84,356.77,"/F8",9.96,"sem mus id. Euismod curae pretium luctus per habitant"
54.00,335.96,298.82,344.81,"/F8",9.96,"sollicitudin sodales fringilla vehicula magna at etiam vel"
54.00,324.01,298.84,332.86,"/F8",9.96,"pharetra. Vivamus etiam cubilia hendrerit. Laoreet au-"
54.00,312.05,298.85,320.90,"/F8",9.96,"gue. Rhoncus metus nunc senectus consectetuer nullam"
54.00,300.10,113.59,308.95,"/F8",9.96,"ac bibendum."
120.11,300.10,184.04,308.95,"/F8",9.96,"Blandit fames."
190.57,300.10,298.86,308.95,"/F8",9.96,"Blandit massa est volut-"
54.00,288.14,71.14,296.99,"/F8",9.96,"pat."
63.96,271.82,298.89,280.66,"/F8",9.96,"Vivamus felis curae risus eros. Euismod magna quam"
54.00,259.86,298.83,268.71,"/F8",9.96,"ut sed. Pretium purus. Pretium lorem natoque enim nec"
54.00,247.91,162.28,256.75,"/F8",9.96,"dis facilisis pellentesque."
170.44,247.91,234.88,256.75,"/F8",9.96,"Potenti morbi."
243.04,247.91,298.79,256.75,"/F8",9.96,"Viverra velit"
54.00,235.95,298.86,244.80,"/F8",9.96,"eni dolor commodo cubilia libero id eni enim nonummy."
54.00,224.00,298.92,232.84,"/F8",9.96,"Nonummy massa eros sem sed commodo neque per orci."
54.00,212.04,254.98,220.89,"/F8",9.96,"Rhoncus magna enim auctor dis duis varius."
263.32,212.04,298.87,220.89,"/F8",9.96,"Pretium"
54.00,200.09,298.86,208.93,"/F8",9.96,"justo id sapien gravida eros at orci id quam interdum"
54.00,188.13,298.82,196.98,"/F8",9.96,"malesuada. Viverra nulla mi facilisis adipiscing. Aliquet"
54.00,176.18,298.88,185.02,"/F8",9.96,"neque lorem pulvinar lacus etiam magna lacinia amet"
54.00,164.22,298.81,173.07,"/F8",9.96,"id nulla porttitor scelerisque donec venenatis vestibu-"
54.00,152.27,73.35,161.11,"/F8",9.96,"lum."
80.36,152.27,237.97,161.11,"/F8",9.96,"Natoque lorem eu lectus accumsan."
244.98,152.27,298.87,161.11,"/F8",9.96,"Laoreet felis"
54.00,140.31,298.83,149.16,"/F8",9.96,"vestibulum ad pharetra primis. Gravida class nulla conu-"
54.00,128.36,228.60,137.20,"/F8",9.96,"bia porttitor dictum tincidunt et dolor."
235.26,128.36,298.80,137.20,"/F8",9.96,"Quisque etiam"
54.00,116.40,298.85,125.25,"/F8",9.96,"class pretium arcu quam justo sodales cras. Quisque vi-"
317.01,532.34,427.55,541.19,"/F8",9.96,"tae eget a morbi laoreet."
434.79,532.34,517.88,541.19,"/F8",9.96,"Rhoncus neque ac."
525.12,532.34,561.90,541.19,"/F8",9.96,"Natoque"
317.01,520.39,341.11,529.23,"/F8",9.96,"justo."
347.50,520.39,453.97,529.23,"/F8",9.96,"Aliquet magna ut diam."
460.35,520.39,523.01,529.23,"/F8",9.96,"Viverra porta."
529.39,520.39,561.86,529.23,"/F8",9.96,"Blandit"
317.01,508.43,561.83,517.28,"/F8",9.96,"class vestibulum condimentum. Aliquet fusce parturient"
317.01,496.48,493.33,505.32,"/F8",9.96,"integer dui ad tristique a fames dapibus."
326.98,483.15,420.42,492.00,"/F8",9.96,"Vivamus netus diam."
427.55,483.15,561.85,492.00,"/F8",9.96,"Cubilia justo id risus pulvinar"
317.01,471.20,561.84,480.05,"/F8",9.96,"netus habitasse molestie. Viverra lacus hac libero in in-"
317.01,459.24,561.85,468.09,"/F8",9.96,"terdum. Conubia risus. Viverra vitae et. Viverra massa."
317.01,447.29,542.23,456.14,"/F8",9.96,"Posuere fusce neque a nisl curae inceptos curae ut."
548.32,447.29,561.86,456.14,"/F8",9.96,"Vi-"
317.01,435.33,481.97,444.18,"/F8",9.96,"vamus felis eni velit quisque aenean."
490.90,435.33,561.86,444.18,"/F8",9.96,"Nonummy justo"
317.01,423.38,404.22,432.23,"/F8",9.96,"quam imperdiet ad."
410.86,423.38,473.27,432.23,"/F8",9.96,"Aliquet porta."
479.90,423.38,561.86,432.23,"/F8",9.96,"Dapibus fusce sem"
317.01,411.42,410.82,420.27,"/F8",9.96,"augue felis phasellus."
419.28,411.42,561.86,420.27,"/F8",9.96,"Potenti massa adipiscing ullam-"
317.01,399.47,490.02,408.32,"/F8",9.96,"corper turpis ve volutpat pede suscipit."
495.61,399.47,561.83,408.32,"/F8",9.96,"Aliquam morbi"
317.01,387.51,561.85,396.36,"/F8",9.96,"massa ornare in dis. Aliquam risus felis vel eros a risus ad"
317.01,375.56,561.85,384.41,"/F8",9.96,"duis montes mi. Pretium nulla massa habitant fusce. Vi-"
317.01,363.60,561.87,372.45,"/F8",9.96,"vamus donec. Commodo donec elit per curae viverra nisl"
317.01,351.65,561.86,360.49,"/F8",9.96,"platea. Rhoncus donec et velit ullamcorper mi congue ut"
317.01,339.69,561.86,348.54,"/F8",9.96,"interdum. Quisque justo enim etiam. Nonummy donec."
317.01,327.74,561.90,336.58,"/F8",9.96,"Nonummy etiam quam mi. Rhoncus nulla arcu nonummy"
317.01,315.78,478.62,324.63,"/F8",9.96,"augue sed mollis proin neque nullam."
331.71,275.59,547.23,283.56,"/F19",8.97,"Laoreet velit quis vulputate fringilla cras duis."
326.98,247.91,561.92,256.75,"/F8",9.96,"Laoreet augue. Nonummy massa diam. Aliquam vitae"
317.01,235.95,407.61,244.80,"/F8",9.96,"massa gravida amet."
414.17,235.95,561.89,244.80,"/F8",9.96,"Integer lacus quis donec ac ligula"
317.01,224.00,356.87,232.84,"/F8",9.96,"id purus."
364.58,224.00,561.84,232.84,"/F8",9.96,"Iaculis magna eni arcu phasellus sollicitudin"
317.01,212.04,449.99,220.89,"/F8",9.96,"vel venenatis nonummy nunc."
458.52,212.04,561.85,220.89,"/F8",9.96,"Aliquet velit nec quam"
317.01,200.09,347.00,208.93,"/F8",9.96,"cursus."
355.11,200.09,516.39,208.93,"/F8",9.96,"Rhoncus etiam urna tempus cursus."
524.50,200.09,561.88,208.93,"/F8",9.96,"Vivamus"
317.01,188.13,561.82,196.98,"/F8",9.96,"purus id orci tortor vivamus in netus tellus fusce et diam"
317.01,176.18,561.86,185.02,"/F8",9.96,"torquent. Lacinia nulla duis nonummy vivamus nunc so-"
317.01,164.22,561.86,173.07,"/F8",9.96,"dales tellus odio. Lacinia curae fames montes vulputate"
317.01,152.27,561.86,161.11,"/F8",9.96,"magna. Rhoncus dolor parturient condimentum litora et."
317.01,140.31,561.82,149.16,"/F8",9.96,"Lacinia fusce nisi viverra imperdiet cursus faucibus velit"
317.01,128.36,462.36,137.20,"/F8",9.96,"auctor cras erat netus tincidunt."
470.13,128.36,561.85,137.20,"/F8",9.96,"Rhoncus nulla etiam"
317.01,116.40,487.62,125.25,"/F8",9.96,"luctus mi mollis consectetuer fringilla."
495.66,116.40,561.84,125.25,"/F8",9.96,"Pretium massa"
