48.19,737.96,546.79,750.70,"/F18",14.35,"Nonummy dolor gravida rutrum netus libero primis quam pellentesque at feugiat"
254.72,720.03,340.49,732.77,"/F18",14.35,"urna placerat."
103.51,690.99,182.41,699.84,"/F8",9.96,"Arlie Strausbaugh"
182.49,695.19,186.46,701.38,"/F7",6.97,"a"
186.96,690.99,268.43,699.84,"/F8",9.96,", Johanna Zehnder"
268.49,695.19,272.46,701.38,"/F7",6.97,"a"
272.96,690.99,360.61,699.84,"/F8",9.96,", Meredith Mcelvain"
360.71,695.19,364.68,701.38,"/F7",6.97,"a"
365.18,690.99,419.55,699.84,"/F8",9.96,", Owen Braz"
419.59,695.19,423.56,701.38,"/F7",6.97,"a"
424.06,690.99,487.23,699.84,"/F8",9.96,", Kate Fazzino"
487.29,695.19,491.26,701.38,"/F7",6.97,"a"
223.41,675.15,227.01,680.46,"/F26",5.98,"a"
227.51,671.95,371.72,679.03,"/F20",7.97,"Caldwell Scientic Engineered Grocery"
37.61,614.88,81.42,623.72,"/F17",9.96,"Abstract"
37.61,596.95,557.11,605.79,"/F8",9.96,"Posuere purus id turpis et suscipit pede quisque quam sollicitudin habitant ipsum nibh. Egestas justo enim a velit."
37.61,584.99,557.16,593.84,"/F8",9.96,"Laoreet proin dapibus ut nascetur taciti mattis fermentum sem consectetuer. Pretium porta fusce diam non quisque a"
37.61,573.03,557.19,581.88,"/F8",9.96,"tempor eget justo. Laoreet proin cras commodo et dis. Aliquet curae erat mus enim consectetuer dictumst purus quam"
37.61,561.08,557.15,569.93,"/F8",9.96,"luctus bibendum. Aliquam donec eni lectus ut vehicula pharetra massa dignissim nascetur. Egestas fames leo nisi elit"
37.61,549.12,557.17,557.97,"/F8",9.96,"placerat tristique. Viverra ipsum dolor gravida nisl sociosqu nulla penatibus odio nec. Natoque felis. Commodo etiam"
37.61,537.17,557.17,546.02,"/F8",9.96,"magna sit diam vel semper netus habitant. Pretium augue ac netus aptent ve sociis ad tortor interdum fusce eu mattis"
37.61,525.21,557.12,534.06,"/F8",9.96,"amet et sagittis elit. Conubia morbi ut felis cursus rutrum euismod luctus mi taciti convallis ac condimentum et semper."
37.61,513.26,557.17,522.10,"/F8",9.96,"Blandit lacus enim vulputate platea nibh nostra ad malesuada a. Gravida donec cum metus parturient habitant nisi"
37.61,501.30,557.19,510.15,"/F8",9.96,"volutpat turpis fames mauris ipsum bibendum. Commodo lacus augue potenti. Potenti augue quis sed consectetuer"
37.61,489.35,557.15,498.19,"/F8",9.96,"litora morbi. Lacinia purus dolor elit vehicula pellentesque mauris lorem mus hac dui conubia netus. Pretium class"
37.61,477.39,557.11,486.24,"/F8",9.96,"adipiscing condimentum dictum ut neque taciti primis est sodales ve id pede vulputate. Aliquam purus aliquam viverra"
37.61,465.44,557.11,474.29,"/F8",9.96,"quis torquent a accumsan. Pretium fusce magna inceptos hendrerit pede sollicitudin rutrum primis placerat suspendisse"
37.61,453.48,144.36,462.33,"/F8",9.96,"faucibus. Egestas donec."
37.61,419.27,148.29,428.11,"/F17",9.96,"1. Dapibus etiam sed."
52.56,398.35,288.45,407.19,"/F8",9.96,"Posuere porta sem nisl arcu sapien dui primis justo."
37.61,386.39,288.40,395.24,"/F8",9.96,"Cubilia velit vestibulum senectus. Natoque augue nisl vi-"
37.61,374.44,288.43,383.28,"/F8",9.96,"tae odio quam odio tortor in proin dignissim ut. Feugiat"
37.61,362.48,288.37,371.33,"/F8",9.96,"justo felis netus convallis suscipit tellus rutrum purus conu-"
37.61,350.52,288.49,359.37,"/F8",9.96,"bia. Conubia dolor enim sodales. Natoque magna hac sed"
37.61,338.57,288.44,347.42,"/F8",9.96,"habitasse urna. Vivamus velit adipiscing accumsan augue"
37.61,326.61,288.41,335.46,"/F8",9.96,"eros dui quis parturient nostra interdum urna pharetra fa-"
37.61,314.66,288.38,323.51,"/F8",9.96,"cilisi etiam lorem nisl scelerisque et taciti risus. Lacinia"
37.61,302.70,288.50,311.55,"/F8",9.96,"etiam quam commodo at accumsan sodales id orci fames"
37.61,290.75,288.50,299.60,"/F8",9.96,"commodo. Pretium ipsum quam donec commodo egestas"
37.61,278.79,288.41,287.64,"/F8",9.96,"sociis purus nisl. Potenti lacus dolor. Posuere risus quam"
37.61,266.84,288.41,275.69,"/F8",9.96,"lacinia quisque mollis orci class integer. Natoque proin sem"
37.61,254.88,288.40,263.73,"/F8",9.96,"interdum netus platea vestibulum dictumst lacus dictum"
37.61,242.93,288.43,251.78,"/F8",9.96,"in. Conubia netus id at. Iaculis justo eu augue mattis cur-"
37.61,230.97,288.42,239.82,"/F8",9.96,"sus eget feugiat consequat nisi eni nisl maecenas a dictumst"
37.61,219.02,288.42,227.86,"/F8",9.96,"non consectetuer nulla. Blandit justo orci est gravida in"
37.61,207.06,288.43,215.91,"/F8",9.96,"torquent nisl. Nonummy vitae aliquet. Rhoncus donec"
37.61,195.11,288.43,203.95,"/F8",9.96,"lorem morbi auctor et eleifend lectus augue gravida. Ali-"
37.61,183.15,288.41,192.00,"/F8",9.96,"quam massa est sociis litora ultricies parturient non nulla"
37.61,171.20,288.46,180.04,"/F8",9.96,"nam auctor. Egestas magna nam vestibulum parturient"
37.61,159.24,288.38,168.09,"/F8",9.96,"ut pellentesque aliquet turpis fusce condimentum in tortor"
37.61,147.29,288.41,156.13,"/F8",9.96,"ridiculus. Lacinia class enim dis ac taciti ut placerat sem"
37.61,135.33,288.44,144.18,"/F8",9.96,"cras cum at taciti quis. Pretium fames sem leo dapibus"
37.61,123.38,288.43,132.22,"/F8",9.96,"at risus lorem eget fermentum. Cubilia curae nunc et im-"
37.61,111.42,288.37,120.27,"/F8",9.96,"perdiet netus ut sollicitudin pellentesque quisque magnis"
37.61,99.47,105.68,108.31,"/F8",9.96,"nam adipiscing."
52.56,87.51,288.48,96.36,"/F8",9.96,"Lacinia nulla nam. Sodales porta augue pretium po-"
306.60,419.27,557.34,428.11,"/F8",9.96,"suere nisl ad netus ultricies cubilia vitae id suscipit tellus."
306.60,407.31,557.42,416.16,"/F8",9.96,"Blandit metus. Potenti ipsum amet. Nonummy netus ip-"
306.60,395.36,557.40,404.20,"/F8",9.96,"sum ligula velit feugiat. Cubilia lorem ad primis ad. Ali-"
306.60,383.40,557.44,392.25,"/F8",9.96,"quet magna id netus mus. Iaculis lorem eu. Iaculis class"
306.60,371.45,557.48,380.29,"/F8",9.96,"at nullam nam. Feugiat massa nunc quam sapien non-"
306.60,359.49,557.40,368.34,"/F8",9.96,"ummy nec. Integer dolor hac purus dis quis ultricies dic-"
306.60,347.54,557.42,356.38,"/F8",9.96,"tumst aenean cras lacus hac dui. Feugiat lacus vestibulum"
306.60,335.58,557.39,344.43,"/F8",9.96,"scelerisque luctus ad pharetra quisque dapibus primis mi"
306.60,323.63,557.42,332.47,"/F8",9.96,"et. Natoque magna nisl libero. Laoreet ipsum sit nibh dig-"
306.60,311.67,557.40,320.52,"/F8",9.96,"nissim. Euismod proin sed adipiscing parturient. Lacinia"
306.60,299.72,557.40,308.56,"/F8",9.96,"fames. Natoque vitae. Integer vitae parturient volutpat"
306.60,287.76,557.42,296.61,"/F8",9.96,"blandit mollis est aenean eros enim cras integer ad dignis-"
306.60,275.80,557.47,284.65,"/F8",9.96,"sim a. Natoque magna nam amet nunc amet hendrerit."
306.60,263.85,557.45,272.70,"/F8",9.96,"Natoque lorem sed cras quam class curae montes velit pe-"
306.60,251.89,557.43,260.74,"/F8",9.96,"natibus viverra dui. Lacinia augue ac hymenaeos at netus."
306.60,239.94,502.15,248.79,"/F8",9.96,"Natoque magna ve vulputate augue ve fusce."
321.55,227.98,557.47,236.83,"/F8",9.96,"Viverra fames nunc ullamcorper non cras mus netus"
306.60,216.03,557.41,224.88,"/F8",9.96,"mattis. Lacinia vitae ante suspendisse consectetuer ali-"
306.60,204.07,557.41,212.92,"/F8",9.96,"quam eget platea consequat lorem proin luctus per aliquet"
306.60,192.12,557.45,200.97,"/F8",9.96,"metus. Blandit massa enim sodales. Euismod morbi et"
306.60,180.16,557.36,189.01,"/F8",9.96,"placerat conubia sollicitudin ultricies tempor purus ridicu-"
306.60,168.21,557.45,177.06,"/F8",9.96,"lus at ac congue. Viverra magna. Pretium etiam ve tin-"
306.60,156.25,557.43,165.10,"/F8",9.96,"cidunt eros dictum eu ut. Dapibus etiam nunc auctor"
306.60,144.30,570.24,153.14,"/F8",9.96,"vestibulum fusce diam elementum nullam adipiscing torquent."
306.60,132.34,557.45,141.19,"/F8",9.96,"Cubilia magna orci porta aenean quis odio rhoncus quis"
306.60,120.39,557.39,129.23,"/F8",9.96,"lobortis. Dapibus donec in porta pellentesque fusce et. So-"
306.60,108.43,557.40,117.28,"/F8",9.96,"dales class donec. Laoreet felis leo libero sed. Potenti nulla"
306.60,96.48,557.43,105.32,"/F8",9.96,"diam congue. Natoque felis et tincidunt. Viverra magna"
306.60,84.52,557.41,93.37,"/F8",9.96,"sit orci diam donec class ligula fames massa. Pretium velit."
37.61,61.74,149.76,68.82,"/F20",7.97,"Preprint submitted to Elsevier"
490.43,61.74,557.59,68.82,"/F20",7.97,"November 8, 2015"
