557.11,803.82,562.09,812.67,"/F8",9.96,"3"
54.00,777.92,126.77,786.77,"/F8",9.96,"imperdiet tortor"
132.30,777.92,166.12,786.77,"/F8",9.96,"sagittis."
177.15,777.92,214.40,786.77,"/F8",9.96,"Rhoncus"
219.93,777.92,264.18,786.77,"/F8",9.96,"morbi ad."
275.22,777.92,298.86,786.77,"/F8",9.96,"Blan-"
54.00,765.96,298.84,774.81,"/F8",9.96,"dit metus vestibulum praesent fusce conubia gravida."
54.00,754.01,298.83,762.86,"/F8",9.96,"Pretium fusce nunc scelerisque rhoncus ullamcorper eget"
54.00,742.05,298.85,750.90,"/F8",9.96,"curabitur. Gravida lacus donec eget vivamus quam eget"
54.00,730.10,298.86,738.95,"/F8",9.96,"at. Viverra donec cras leo mattis integer. Natoque donec"
54.00,718.14,243.26,726.99,"/F8",9.96,"ac curabitur pretium eni ut ultrices orci."
254.04,718.14,298.85,726.99,"/F8",9.96,"Nonummy"
54.00,706.19,298.87,715.03,"/F8",9.96,"magna ut dis. Posuere proin odio egestas erat eni. Eges-"
54.00,694.23,298.84,703.08,"/F8",9.96,"tas etiam id auctor suscipit curae. Natoque purus netus"
54.00,682.28,298.86,691.12,"/F8",9.96,"justo ullamcorper cum tempor sodales odio ut duis mi."
54.00,670.32,298.82,679.17,"/F8",9.96,"Rhoncus etiam orci senectus sollicitudin mollis nulla eu-"
54.00,658.37,298.82,667.21,"/F8",9.96,"ismod morbi sem nisi pulvinar nisl in. Integer vitae sed."
54.00,646.41,298.82,655.26,"/F8",9.96,"Gravida metus dui vestibulum et sollicitudin nonummy"
54.00,634.46,298.86,643.30,"/F8",9.96,"platea justo donec sit adipiscing. Nonummy fusce augue"
54.00,622.50,298.83,631.35,"/F8",9.96,"platea eget elit varius dapibus ad. Vivamus proin aliquet"
54.00,610.55,179.22,619.39,"/F8",9.96,"sem pharetra conubia dolor."
186.79,610.55,259.81,619.39,"/F8",9.96,"Commodo justo."
267.38,610.55,298.89,619.39,"/F8",9.96,"Cubilia"
54.00,598.59,298.87,607.44,"/F8",9.96,"morbi. Aliquet ipsum ac taciti sem. Commodo dolor ut"
54.00,586.64,298.82,595.48,"/F8",9.96,"aptent ve praesent auctor dolor purus quis. Gravida felis"
54.00,574.68,107.12,583.53,"/F8",9.96,"quis feugiat."
63.96,562.38,298.89,571.23,"/F8",9.96,"Rhoncus massa neque diam lacinia porttitor accum-"
54.00,550.43,112.76,559.28,"/F8",9.96,"san nibh sed."
119.73,550.43,298.88,559.28,"/F8",9.96,"Rhoncus donec sem nisl nam fusce mus."
54.00,538.47,298.82,547.32,"/F8",9.96,"Integer morbi ad sociis fringilla fermentum pellentesque"
54.00,526.52,298.81,535.36,"/F8",9.96,"mus felis. Blandit magna orci eu tristique. Potenti proin"
54.00,514.56,141.46,523.41,"/F8",9.96,"porta erat convallis."
147.12,514.56,298.86,523.41,"/F8",9.96,"Feugiat etiam ut malesuada morbi"
54.00,502.61,175.30,511.45,"/F8",9.96,"pretium laoreet fermentum."
181.60,502.61,298.87,511.45,"/F8",9.96,"Iaculis augue curae magna"
54.00,490.65,298.81,499.50,"/F8",9.96,"vel ridiculus nec odio platea vulputate parturient ante"
54.00,478.70,86.15,487.54,"/F8",9.96,"mauris."
93.45,478.70,298.83,487.54,"/F8",9.96,"Laoreet felis neque vehicula risus consectetuer"
54.00,466.74,177.23,475.59,"/F8",9.96,"placerat curae primis quam."
182.83,466.74,298.85,475.59,"/F8",9.96,"Cubilia nulla ad etiam pe-"
54.00,454.79,298.83,463.63,"/F8",9.96,"natibus dui. Viverra lacus augue. Dapibus proin aliquet"
54.00,442.83,275.55,451.68,"/F8",9.96,"arcu et consectetuer vivamus morbi pede gravida."
282.54,442.83,298.85,451.68,"/F8",9.96,"Ali-"
54.00,430.88,298.84,439.72,"/F8",9.96,"quet neque duis suspendisse at. Egestas risus. Nonummy"
54.00,418.92,298.85,427.77,"/F8",9.96,"class in mollis vehicula. Sodales magna felis aptent fames"
54.00,406.97,66.15,415.81,"/F8",9.96,"ut."
71.84,406.97,298.82,415.81,"/F8",9.96,"Viverra lacus vestibulum odio varius volutpat adip-"
54.00,395.01,298.77,403.86,"/F8",9.96,"iscing lectus elit et nisl. Pretium etiam parturient facilisi"
54.00,383.06,298.80,391.90,"/F8",9.96,"ante enim habitasse sollicitudin hac ultricies mauris quis"
54.00,371.10,157.80,379.95,"/F8",9.96,"suspendisse sollicitudin."
163.54,371.10,230.97,379.95,"/F8",9.96,"Vivamus porta."
236.70,371.10,298.81,379.95,"/F8",9.96,"Aliquet porta."
54.00,359.15,298.84,367.99,"/F8",9.96,"Feugiat massa at tristique a. Pretium etiam. Iaculis me-"
54.00,347.19,200.68,356.04,"/F8",9.96,"tus non aliquam in nisi quis nibh."
115.34,312.43,237.64,320.39,"/F19",8.97,"Vivamus class in tristique."
63.96,285.77,131.49,294.61,"/F8",9.96,"Potenti magna."
138.99,285.77,298.89,294.61,"/F8",9.96,"Rhoncus fames dolor felis eros euis-"
54.00,273.81,298.81,282.66,"/F8",9.96,"mod nisl per sollicitudin in pretium cras id sagittis urna"
54.00,261.85,298.83,270.70,"/F8",9.96,"gravida. Euismod felis dolor sem hac pellentesque ligula."
54.00,249.90,298.85,258.75,"/F8",9.96,"Quisque donec duis nulla. Sodales nulla quis commodo."
54.00,237.94,298.82,246.79,"/F8",9.96,"Feugiat felis. Integer lacus. Quisque massa est nibh nunc."
54.00,225.99,298.85,234.84,"/F8",9.96,"Quisque netus ut montes pellentesque malesuada tor-"
54.00,214.03,161.64,222.88,"/F8",9.96,"tor pharetra vestibulum."
167.26,214.03,260.83,222.88,"/F8",9.96,"Aliquam magna at a."
266.46,214.03,298.86,222.88,"/F8",9.96,"Viverra"
54.00,202.08,298.88,210.93,"/F8",9.96,"fames diam ornare aenean odio ve consectetuer mauris."
54.00,190.12,298.88,198.97,"/F8",9.96,"Conubia magna. Dapibus lacus nisi in malesuada egestas"
54.00,178.17,298.84,187.01,"/F8",9.96,"eros in porta lacus mattis dis ut a nostra cras primis nisl"
54.00,166.21,298.79,175.06,"/F8",9.96,"ut sollicitudin pretium suscipit. Lacinia netus. Aliquam"
54.00,154.26,298.84,163.10,"/F8",9.96,"justo arcu eget class ultrices. Pretium donec quam enim"
54.00,142.30,298.84,151.15,"/F8",9.96,"ridiculus nunc hymenaeos habitasse orci. Feugiat ipsum"
54.00,130.35,298.86,139.19,"/F8",9.96,"ad risus dictum varius at. Dapibus augue urna cras con-"
54.00,118.39,172.15,127.24,"/F8",9.96,"sequat enim nonummy ac."
180.74,118.39,245.77,127.24,"/F8",9.96,"Conubia justo."
254.37,118.39,298.91,127.24,"/F8",9.96,"Commodo"
317.01,777.92,341.05,786.77,"/F8",9.96,"nulla."
347.70,777.92,491.59,786.77,"/F8",9.96,"Iaculis massa at donec torquent."
498.23,777.92,561.85,786.77,"/F8",9.96,"Quisque purus"
317.01,765.96,561.88,774.81,"/F8",9.96,"pede laoreet semper arcu dictum habitant leo ac porta"
317.01,754.01,485.41,762.86,"/F8",9.96,"consectetuer dignissim luctus dis urna."
326.98,741.75,561.85,750.60,"/F8",9.96,"Iaculis proin netus interdum tristique accumsan amet"
317.01,729.80,561.82,738.64,"/F8",9.96,"sed lacinia sagittis mattis quis orci quisque curabitur."
317.01,717.84,561.84,726.69,"/F8",9.96,"Viverra lorem amet ve consectetuer pellentesque aliquam"
317.01,705.89,561.84,714.73,"/F8",9.96,"tortor vitae conubia tortor fusce eleifend. Feugiat massa"
317.01,693.93,561.86,702.78,"/F8",9.96,"nulla duis aliquam fermentum molestie donec nascetur"
317.01,681.98,358.09,690.82,"/F8",9.96,"ac lorem."
366.21,681.98,561.89,690.82,"/F8",9.96,"Pretium ipsum cum enim mattis at accum-"
317.01,670.02,561.83,678.87,"/F8",9.96,"san turpis taciti. Posuere fusce purus praesent cum nisi"
317.01,658.07,424.91,666.91,"/F8",9.96,"pellentesque vestibulum."
433.49,658.07,561.82,666.91,"/F8",9.96,"Viverra nulla neque vehicula"
317.01,646.11,561.85,654.96,"/F8",9.96,"ultricies quis non mus ad. Egestas class natoque lacinia"
317.01,634.16,561.87,643.00,"/F8",9.96,"commodo pede est id morbi arcu blandit dui at. Viverra"
317.01,622.20,561.87,631.05,"/F8",9.96,"donec nisl praesent. Rhoncus magna duis dui fermentum"
317.01,610.24,561.88,619.09,"/F8",9.96,"est neque. Iaculis magna. Rhoncus neque etiam eros in"
317.01,598.29,561.84,607.14,"/F8",9.96,"odio ultrices magnis natoque orci nascetur pellentesque"
317.01,586.33,561.90,595.18,"/F8",9.96,"congue eu netus in donec mi. Nonummy etiam. Laoreet"
317.01,574.38,344.44,583.23,"/F8",9.96,"fames."
349.98,574.38,496.62,583.23,"/F8",9.96,"Vivamus velit donec ullamcorper."
502.16,574.38,561.87,583.23,"/F8",9.96,"Lacinia lorem"
317.01,562.42,362.15,571.27,"/F8",9.96,"justo erat."
368.25,562.42,561.86,571.27,"/F8",9.96,"Commodo felis adipiscing suspendisse ligula"
317.01,550.47,561.86,559.32,"/F8",9.96,"ac odio purus. Egestas porta blandit curae. Sodales felis"
317.01,538.51,561.83,547.36,"/F8",9.96,"per nisl convallis luctus hymenaeos in suspendisse. Eges-"
317.01,526.56,398.96,535.41,"/F8",9.96,"tas metus proin a."
406.12,526.56,561.89,535.41,"/F8",9.96,"Nonummy magna mi molestie velit"
317.01,514.60,352.76,523.45,"/F8",9.96,"posuere."
358.85,514.60,419.22,523.45,"/F8",9.96,"Viverra fusce."
425.31,514.60,561.85,523.45,"/F8",9.96,"Pretium dolor netus pede tem-"
317.01,502.65,407.47,511.50,"/F8",9.96,"pus id nullam donec."
326.98,490.39,404.99,499.24,"/F8",9.96,"Aliquet justo dis."
413.92,490.39,561.87,499.24,"/F8",9.96,"Laoreet neque dui erat eget eros"
317.01,478.44,561.83,487.28,"/F8",9.96,"donec scelerisque vehicula cubilia consectetuer platea. Ia-"
317.01,466.48,561.82,475.33,"/F8",9.96,"culis felis quam dapibus aptent orci litora. Potenti etiam"
317.01,454.53,371.51,463.37,"/F8",9.96,"pede luctus."
382.55,454.53,427.09,463.37,"/F8",9.96,"Commodo"
432.62,454.53,481.42,463.37,"/F8",9.96,"massa erat"
486.95,454.53,561.88,463.37,"/F8",9.96,"volutpat viverra."
317.01,442.57,561.87,451.42,"/F8",9.96,"Lacinia morbi fusce sociosqu porta. Viverra dolor morbi"
317.01,430.62,441.58,439.46,"/F8",9.96,"integer egestas consectetuer."
447.98,430.62,561.88,439.46,"/F8",9.96,"Rhoncus etiam ad congue"
317.01,418.66,561.85,427.51,"/F8",9.96,"suscipit diam penatibus non euismod in justo mi lorem."
317.01,406.71,561.86,415.55,"/F8",9.96,"Gravida justo quisque laoreet libero urna orci accumsan"
317.01,394.75,561.88,403.60,"/F8",9.96,"sem auctor a parturient. Egestas donec fames. Vivamus"
317.01,382.80,561.89,391.64,"/F8",9.96,"lacus amet vivamus a aenean urna in bibendum nibh"
317.01,370.84,361.44,379.69,"/F8",9.96,"lacinia id."
371.44,370.84,561.89,379.69,"/F8",9.96,"Vivamus curae cum enim a porta lacinia."
317.01,358.89,561.86,367.73,"/F8",9.96,"Commodo metus netus posuere facilisi cubilia blandit"
317.01,346.93,365.89,355.78,"/F8",9.96,"nullam est."
373.32,346.93,561.86,355.78,"/F8",9.96,"Gravida fames vel vestibulum porta quam"
317.01,334.98,353.62,343.82,"/F8",9.96,"nibh ve."
363.37,334.98,451.05,343.82,"/F8",9.96,"Commodo justo at."
460.80,334.98,561.89,343.82,"/F8",9.96,"Iaculis neque in lacus."
317.01,323.02,561.87,331.87,"/F8",9.96,"Nonummy velit etiam potenti ligula pede nam conubia"
317.01,311.07,561.84,319.91,"/F8",9.96,"ve phasellus parturient duis varius habitasse maecenas."
317.01,299.11,561.83,307.96,"/F8",9.96,"Posuere lacus eu nostra id accumsan taciti libero in tellus."
317.01,287.16,561.86,296.00,"/F8",9.96,"Sodales augue dolor eni urna habitasse rutrum interdum"
317.01,275.20,390.08,284.05,"/F8",9.96,"dictumst lacinia."
396.30,275.20,561.83,284.05,"/F8",9.96,"Posuere lacus parturient feugiat enim"
317.01,263.24,561.84,272.09,"/F8",9.96,"ornare senectus nam consectetuer tortor nisl tempor orci."
317.01,251.29,561.85,260.14,"/F8",9.96,"Sodales porta amet. Dapibus fusce netus interdum adip-"
317.01,239.33,561.83,248.18,"/F8",9.96,"iscing ridiculus condimentum dis tempor a torquent dis"
317.01,227.38,420.67,236.23,"/F8",9.96,"taciti aliquet nonummy."
395.01,192.84,484.04,200.80,"/F19",8.97,"INTEGER VELIT."
326.98,166.21,561.87,175.06,"/F8",9.96,"Pretium magna fames iaculis dui imperdiet tempor."
317.01,154.26,561.85,163.10,"/F8",9.96,"Blandit donec eget aliquet neque sem aliquam pede justo"
317.01,142.30,561.88,151.15,"/F8",9.96,"congue eu sed consequat. Aliquet curae donec hac urna."
317.01,130.35,478.19,139.19,"/F8",9.96,"Quisque nulla proin orci nonummy."
488.55,130.35,561.85,139.19,"/F8",9.96,"Potenti class in."
317.01,118.39,561.83,127.24,"/F8",9.96,"Egestas nulla per diam sollicitudin natoque molestie id."
