209.24,737.96,385.93,750.70,"/F18",14.35,"Egestas etiam et hymenaeos."
132.82,708.93,221.44,717.77,"/F8",9.96,"Randolph Mcmullan"
221.51,713.12,225.48,719.31,"/F7",6.97,"a"
225.98,708.93,314.71,717.77,"/F8",9.96,", Willette Mckennon"
314.82,713.12,318.78,719.31,"/F7",6.97,"a"
319.29,708.93,379.37,717.77,"/F8",9.96,", Ernest Laub"
379.42,713.12,383.39,719.31,"/F7",6.97,"a"
383.89,708.93,457.90,717.77,"/F8",9.96,", Garrett Osborn"
457.99,713.12,461.96,719.31,"/F7",6.97,"a"
258.25,693.08,261.86,698.39,"/F26",5.98,"a"
262.35,689.88,336.96,696.96,"/F20",7.97,"Tactical Of Warsaw"
37.61,632.81,81.42,641.66,"/F17",9.96,"Abstract"
37.61,614.88,557.17,623.72,"/F8",9.96,"Egestas curae quam feugiat metus odio facilisis quis mollis amet fringilla litora. Vivamus lacus pede ornare elementum"
37.61,602.92,557.16,611.77,"/F8",9.96,"dis nam non aliquet at magnis. Feugiat ipsum ad ornare enim habitasse eleifend velit etiam suspendisse molestie ante."
37.61,590.97,557.15,599.81,"/F8",9.96,"Aliquam fames vel vestibulum ut sollicitudin natoque tempor ve pede faucibus lacus ac sapien pretium ad. Laoreet curae"
37.61,579.01,557.20,587.86,"/F8",9.96,"vitae tortor amet ullamcorper conubia ullamcorper cras pede. Blandit ipsum sodales posuere semper. Sodales lorem"
37.61,567.06,557.13,575.90,"/F8",9.96,"morbi platea fusce aliquam ridiculus turpis dis ut porttitor massa nisl est. Natoque etiam nisi hac lectus at metus et."
37.61,555.10,557.14,563.95,"/F8",9.96,"Feugiat porta pede tempus sem enim fames felis platea vulputate netus. Dapibus nulla vestibulum suspendisse nostra"
37.61,543.15,557.17,551.99,"/F8",9.96,"et interdum enim sit nam in. Feugiat felis ac netus fusce. Integer magna sem nec imperdiet proin ut class at diam enim"
37.61,531.19,557.14,540.04,"/F8",9.96,"at class per pede in consectetuer. Vivamus netus adipiscing nascetur erat feugiat netus. Aliquam vitae eu consectetuer"
37.61,519.24,557.09,528.08,"/F8",9.96,"potenti purus velit senectus. Euismod felis nam adipiscing nullam suscipit venenatis senectus at condimentum ut luctus."
37.61,507.28,557.17,516.13,"/F8",9.96,"Lacinia etiam orci risus. Sodales curae erat nibh blandit porta eu etiam eu mauris porta lacus. Laoreet vitae vel nibh"
37.61,495.33,557.14,504.17,"/F8",9.96,"phasellus primis lorem. Aliquam metus ad semper sollicitudin. Rhoncus donec nisi class ligula adipiscing faucibus arcu"
37.61,483.37,557.17,492.22,"/F8",9.96,"interdum. Blandit nulla eros vel pharetra natoque imperdiet est sodales purus quis nam ante nam. Natoque augue erat"
37.61,471.42,177.76,480.26,"/F8",9.96,"dis aptent hac posuere sociosqu."
37.61,437.20,195.78,446.05,"/F17",9.96,"1. Potenti augue lorem integer."
52.56,416.28,288.42,425.13,"/F8",9.96,"Iaculis fusce nec nonummy id nisi eleifend. Cubilia pu-"
37.61,404.32,288.46,413.17,"/F8",9.96,"rus quam at consectetuer aenean lorem. Natoque porta."
37.61,392.37,288.43,401.21,"/F8",9.96,"Egestas porta at in. Dapibus felis in proin condimentum"
37.61,380.41,288.44,389.26,"/F8",9.96,"praesent dapibus ornare erat. Potenti fusce dis enim a"
37.61,368.46,288.41,377.30,"/F8",9.96,"metus lacinia posuere phasellus in porta cum nisl parturi-"
37.61,356.50,288.41,365.35,"/F8",9.96,"ent. Vivamus justo felis aliquet primis. Rhoncus proin ac."
37.61,344.55,288.43,353.39,"/F8",9.96,"Gravida lacus nulla aptent proin nascetur dui diam cur-"
37.61,332.59,288.39,341.44,"/F8",9.96,"abitur netus. Dapibus porta potenti sed pulvinar euismod."
37.61,320.64,288.42,329.48,"/F8",9.96,"Aliquam justo parturient. Sodales metus cras hendrerit"
37.61,308.68,288.44,317.53,"/F8",9.96,"lectus. Gravida donec ve porta purus. Sodales fusce cum"
37.61,296.73,288.41,305.57,"/F8",9.96,"quisque curae nisi inceptos senectus feugiat ad. Potenti"
37.61,284.77,288.50,293.62,"/F8",9.96,"magna eu mattis ipsum maecenas at donec non curae po-"
37.61,272.82,288.43,281.66,"/F8",9.96,"suere. Aliquet dolor. Conubia donec. Quisque lorem orci"
37.61,260.86,288.48,269.71,"/F8",9.96,"mi sagittis inceptos massa leo semper nonummy. Com-"
37.61,248.91,288.44,257.75,"/F8",9.96,"modo risus in. Iaculis etiam dui arcu inceptos. Natoque"
37.61,236.95,288.40,245.80,"/F8",9.96,"massa eu nibh vulputate pellentesque vel convallis sociis"
37.61,225.00,288.46,233.84,"/F8",9.96,"inceptos hymenaeos cum urna nec faucibus. Gravida do-"
37.61,213.04,288.43,221.89,"/F8",9.96,"lor ve et odio maecenas adipiscing sociis enim nisi libero"
37.61,201.09,85.79,209.93,"/F8",9.96,"id rhoncus."
52.56,189.13,288.47,197.98,"/F8",9.96,"Rhoncus class ipsum leo donec cursus mollis quam. In-"
37.61,177.17,288.45,186.02,"/F8",9.96,"teger metus. Nonummy etiam cum sapien porttitor. So-"
37.61,165.22,288.45,174.07,"/F8",9.96,"dales netus. Vivamus magna duis condimentum sollici-"
37.61,153.26,288.46,162.11,"/F8",9.96,"tudin commodo diam. Laoreet purus ve massa orci cubilia"
37.61,141.31,288.49,150.16,"/F8",9.96,"eros. Nonummy neque. Commodo augue. Conubia proin"
37.61,129.35,288.38,138.20,"/F8",9.96,"orci convallis consectetuer parturient nisi turpis. Aliquam"
37.61,117.40,288.40,126.25,"/F8",9.96,"proin felis condimentum mus aptent tincidunt vivamus sol-"
37.61,105.44,288.39,114.29,"/F8",9.96,"licitudin porttitor. Laoreet donec vestibulum laoreet cras"
37.61,93.49,288.42,102.34,"/F8",9.96,"at nibh ve netus penatibus. Vivamus metus. Gravida ip-"
37.61,81.53,288.49,90.38,"/F8",9.96,"sum enim curae. Posuere magna ac. Nonummy nulla."
306.60,437.20,557.41,446.05,"/F8",9.96,"Iaculis metus nisl tempor. Potenti class purus neque pu-"
306.60,425.24,557.42,434.09,"/F8",9.96,"rus. Nonummy vitae quis vitae feugiat ante eget nulla eu"
306.60,413.29,557.43,422.14,"/F8",9.96,"ve enim litora. Commodo augue parturient volutpat cras"
306.60,401.33,557.43,410.18,"/F8",9.96,"taciti curae morbi sociis. Lacinia neque natoque mi per"
306.60,389.38,557.40,398.23,"/F8",9.96,"suspendisse. Conubia nulla. Blandit fames nisl eleifend"
306.60,377.42,356.10,386.27,"/F8",9.96,"dui integer."
321.55,365.47,557.44,374.32,"/F8",9.96,"Dapibus netus mus magnis facilisi iaculis. Natoque"
306.60,353.51,557.43,362.36,"/F8",9.96,"massa purus ante donec. Laoreet purus eu dictumst. Viva-"
306.60,341.56,559.37,350.41,"/F8",9.96,"mus felis urna est tortor vulputate ve ullamcorper. Pretium"
306.60,329.60,557.39,338.45,"/F8",9.96,"lacus arcu suscipit volutpat consectetuer parturient. Com-"
306.60,317.65,557.45,326.49,"/F8",9.96,"modo lacus sit orci cum enim justo nostra turpis sem."
306.60,305.69,557.38,314.54,"/F8",9.96,"Blandit velit enim sed quisque lobortis iaculis phasellus"
306.60,293.74,557.41,302.58,"/F8",9.96,"eget erat ultricies fusce quis nulla. Lacinia etiam adip-"
306.60,281.78,557.44,290.63,"/F8",9.96,"iscing sociosqu massa sem leo hendrerit pharetra urna."
306.60,269.83,557.43,278.67,"/F8",9.96,"Blandit fames elit nunc purus ac justo hac donec. Sodales"
306.60,257.87,557.43,266.72,"/F8",9.96,"nulla fusce odio nullam rhoncus phasellus aenean mollis"
306.60,245.92,557.40,254.76,"/F8",9.96,"erat. Blandit velit urna elementum magnis faucibus viva-"
306.60,233.96,557.41,242.81,"/F8",9.96,"mus feugiat. Dapibus fames nibh. Viverra nulla. Cubilia"
306.60,222.01,557.45,230.85,"/F8",9.96,"curae ve cras diam laoreet nulla at eget. Nonummy felis"
306.60,210.05,557.42,218.90,"/F8",9.96,"ve tincidunt eros dui quam sem aliquam. Integer lacus ut"
306.60,198.10,557.41,206.94,"/F8",9.96,"congue ut facilisis lacus convallis nam. Integer vitae dis"
306.60,186.14,557.42,194.99,"/F8",9.96,"adipiscing consequat massa torquent nam. Aliquet justo."
306.60,174.19,557.39,183.03,"/F8",9.96,"Iaculis proin quis cum ve penatibus. Laoreet felis. Quisque"
306.60,162.23,399.70,171.08,"/F8",9.96,"vitae. Dapibus proin."
306.60,138.32,557.48,147.17,"/F27",9.96,"1.1. Euismod vitae adipiscing bibendum posuere dictumst"
327.99,126.37,373.15,135.21,"/F27",9.96,"ut tempor."
321.55,111.42,557.44,120.27,"/F8",9.96,"Vivamus risus nam lacus hendrerit class phasellus so-"
306.60,99.47,557.41,108.31,"/F8",9.96,"ciosqu varius taciti. Sodales fusce nisl sem sed vulpu-"
306.60,87.51,557.40,96.36,"/F8",9.96,"tate sapien volutpat fringilla ut. Integer risus. Nonummy"
37.61,61.74,149.76,68.82,"/F20",7.97,"Preprint submitted to Elsevier"
490.43,61.74,557.59,68.82,"/F20",7.97,"November 8, 2015"
