121.85,777.53,493.97,788.15,"/F17",11.96,"Vivamus vitae eget neque orci vivamus ac cursus integer nisl a."
163.58,753.51,452.24,762.36,"/F8",9.96,"Librada Ehrlich, Darius Hollen, Jose Shaikh, and Taylor Dewall"
252.94,743.24,283.80,751.21,"/F18",8.97,"Genetic"
288.94,743.24,333.16,751.21,"/F18",8.97,"Augmented"
338.29,743.24,363.08,751.21,"/F18",8.97,"Sports"
156.10,718.64,459.72,727.49,"/F8",9.96,"Zane Texeira, Cornelius Pinegar, Gary Cooksey, and Jerrell Broder"
253.73,708.37,298.06,716.34,"/F18",8.97,"Alternative"
303.20,708.37,332.82,716.34,"/F18",8.97,"Science"
337.96,708.37,362.29,716.34,"/F18",8.97,"Stores"
118.01,687.95,507.01,695.91,"/F15",8.97,"Natoque fusce etiam laoreet tincidunt montes arcu in pellentesque quam pretium orci maecenas"
108.80,677.49,507.04,685.45,"/F15",8.97,"turpis quam aliquet vulputate nec nisl vehicula. Dapibus massa enim donec eros risus posuere vel"
108.80,667.03,507.02,674.99,"/F15",8.97,"parturient adipiscing eu porttitor. Natoque metus orci dis dapibus a suspendisse nam id quam ut"
108.80,656.57,507.00,664.53,"/F15",8.97,"morbi condimentum vehicula aliquam odio id proin nam mus eu a nostra penatibus placerat mollis"
108.80,646.11,507.01,654.07,"/F15",8.97,"tortor purus. Potenti ipsum at dignissim parturient urna morbi proin nec quis. Feugiat fusce massa"
108.80,635.65,507.04,643.61,"/F15",8.97,"vel molestie felis tincidunt. Rhoncus purus enim pretium class nunc per quam turpis volutpat erat"
108.80,625.19,148.74,633.15,"/F15",8.97,"curabitur."
153.97,625.19,233.95,633.15,"/F15",8.97,"Feugiat proin justo."
239.18,625.19,355.76,633.15,"/F15",8.97,"Natoque dolor magna purus."
360.98,625.19,506.97,633.15,"/F15",8.97,"Potenti vitae blandit facilisi tempus"
108.80,614.73,506.97,622.69,"/F15",8.97,"ligula lorem dapibus amet duis nullam aptent arcu convallis. Commodo vitae eu facilisis. Viverra"
108.80,604.26,471.73,612.23,"/F15",8.97,"donec neque dictum morbi sodales eni adipiscing ad sociis placerat dui ve justo nec felis."
477.04,604.26,507.00,612.23,"/F15",8.97,"Viverra"
108.80,593.80,507.01,601.77,"/F15",8.97,"fusce nec ridiculus etiam in risus eros taciti enim mattis ut vulputate purus velit turpis mattis"
108.80,583.34,506.97,591.31,"/F15",8.97,"maecenas. Pretium velit nunc orci lobortis sodales ac porta. Integer netus quam nisi nostra tempor."
108.80,572.88,507.02,580.84,"/F15",8.97,"Dapibus augue in pulvinar leo pede eros justo habitant etiam tincidunt non consectetuer auctor."
108.80,562.42,507.01,570.38,"/F15",8.97,"Conubia fames netus imperdiet cubilia. Rhoncus lacus dolor risus mattis aptent neque ullamcorper"
108.80,551.96,402.00,559.92,"/F15",8.97,"ut tempor sollicitudin est felis pede commodo et fames ullamcorper est."
407.39,551.96,507.00,559.92,"/F15",8.97,"Egestas fames enim duis"
108.80,541.50,506.97,549.46,"/F15",8.97,"porttitor eni posuere ante at. Sodales augue lacus tempor tellus id sagittis. Posuere proin. Iaculis"
108.80,531.04,379.83,539.00,"/F15",8.97,"fames commodo sodales tristique suscipit. Iaculis donec parturient."
123.96,499.41,229.04,507.37,"/F19",8.97,"NONUMMY MASSA."
63.96,468.09,298.87,476.94,"/F8",9.96,"Gravida fusce justo amet lorem pretium diam ac morbi"
54.00,456.14,298.85,464.98,"/F8",9.96,"sem orci. Feugiat morbi leo metus viverra diam elit so-"
54.00,444.18,298.86,453.03,"/F8",9.96,"ciosqu suspendisse dis. Euismod dolor posuere sapien"
54.00,432.23,298.85,441.07,"/F8",9.96,"at ad tincidunt dolor. Cubilia etiam et habitasse do-"
54.00,420.27,298.85,429.12,"/F8",9.96,"lor tincidunt pretium ipsum est. Natoque augue cras"
54.00,408.32,255.90,417.16,"/F8",9.96,"scelerisque viverra ullamcorper orci nisi est."
267.31,408.32,298.82,417.16,"/F8",9.96,"Cubilia"
54.00,396.36,298.81,405.21,"/F8",9.96,"risus odio natoque id luctus pellentesque. Posuere morbi."
54.00,384.41,298.89,393.25,"/F8",9.96,"Conubia dolor. Commodo ipsum at ipsum volutpat mus"
54.00,372.45,298.88,381.30,"/F8",9.96,"cubilia maecenas et. Aliquet morbi. Commodo vitae"
54.00,360.50,298.84,369.34,"/F8",9.96,"at malesuada eros suspendisse dis arcu odio velit turpis"
54.00,348.54,298.87,357.39,"/F8",9.96,"elit. Conubia etiam magna nisi quam fames libero pel-"
54.00,336.59,298.84,345.43,"/F8",9.96,"lentesque natoque justo elit purus. Egestas metus massa"
54.00,324.63,298.83,333.48,"/F8",9.96,"class ante posuere lacus class interdum sed aliquet mi tor-"
54.00,312.68,298.86,321.52,"/F8",9.96,"tor eleifend ut nulla magnis nisi. Nonummy lorem odio"
54.00,300.72,298.86,309.57,"/F8",9.96,"cubilia in dictum fames sodales non in. Nonummy nulla"
54.00,288.77,298.83,297.61,"/F8",9.96,"eros eget ridiculus est nisi cum lacinia curae diam. Inte-"
54.00,276.81,298.83,285.66,"/F8",9.96,"ger fusce diam viverra tortor curabitur platea elit eges-"
54.00,264.86,298.85,273.70,"/F8",9.96,"tas. Conubia nulla adipiscing aliquam ante ad lacus ut."
54.00,252.90,298.85,261.75,"/F8",9.96,"Aliquam purus justo vel orci. Conubia risus lorem mus"
54.00,240.95,298.86,249.79,"/F8",9.96,"penatibus erat diam dictum urna sodales. Vivamus ip-"
54.00,228.99,298.84,237.84,"/F8",9.96,"sum diam elit pharetra leo enim etiam turpis eget gravida"
54.00,217.03,298.87,225.88,"/F8",9.96,"a. Egestas morbi class nisl dapibus elementum ac in."
54.00,205.08,298.83,213.93,"/F8",9.96,"Laoreet nulla nisl scelerisque feugiat non ac potenti ante"
54.00,193.12,66.15,201.97,"/F8",9.96,"ut."
63.96,176.18,298.84,185.02,"/F8",9.96,"Pretium neque eni orci sodales proin id. Egestas ipsum"
54.00,164.22,298.85,173.07,"/F8",9.96,"duis urna dictumst quam cum proin eni. Posuere porta"
54.00,152.27,298.84,161.11,"/F8",9.96,"duis suspendisse euismod. Blandit risus mus cras nasce-"
54.00,140.31,298.88,149.16,"/F8",9.96,"tur nec et. Commodo justo. Potenti magna. Potenti"
54.00,128.36,298.82,137.20,"/F8",9.96,"class dis felis. Cubilia nulla ipsum litora fames placerat"
54.00,116.40,298.85,125.25,"/F8",9.96,"ac. Sodales lorem urna lacinia porttitor torquent mol-"
317.01,499.21,561.87,508.06,"/F8",9.96,"lis quam cras praesent. Blandit lorem enim a pede fe-"
317.01,487.26,561.85,496.11,"/F8",9.96,"lis proin est interdum. Pretium lorem ipsum. Laoreet"
317.01,475.30,561.87,484.15,"/F8",9.96,"lacus erat morbi magnis class per adipiscing consequat."
317.01,463.35,561.83,472.20,"/F8",9.96,"Viverra purus. Iaculis fusce. Laoreet velit vel mattis ut"
317.01,451.39,561.86,460.24,"/F8",9.96,"hac magnis potenti in hac libero. Dapibus class id quam"
317.01,439.44,561.84,448.29,"/F8",9.96,"magnis. Blandit porta nunc torquent aliquam curabitur"
317.01,427.48,561.87,436.33,"/F8",9.96,"dictumst magnis mollis sed conubia dis ad felis montes"
317.01,415.53,561.87,424.38,"/F8",9.96,"cursus. Conubia dolor ve quam pharetra dis sapien dui"
317.01,403.57,561.91,412.42,"/F8",9.96,"semper. Integer fames pede congue mi id. Nonummy"
317.01,391.62,561.83,400.47,"/F8",9.96,"lacus est nisl cras conubia cursus per quis parturient eni"
317.01,379.66,561.88,388.51,"/F8",9.96,"massa mus. Rhoncus class feugiat fermentum turpis odio"
317.01,367.71,561.82,376.55,"/F8",9.96,"posuere. Posuere felis mi tortor torquent quisque potenti"
317.01,355.75,509.91,364.60,"/F8",9.96,"pellentesque consequat felis cum quisque eu."
388.59,322.17,490.47,330.13,"/F19",8.97,"Pretium purus morbi."
326.98,295.73,561.82,304.57,"/F8",9.96,"Quisque fames felis ridiculus dis laoreet arcu. Quisque"
317.01,283.77,561.83,292.62,"/F8",9.96,"vitae per lorem tincidunt egestas consectetuer. Aliquam"
317.01,271.82,561.88,280.66,"/F8",9.96,"porta eget commodo netus. Laoreet fusce. Integer netus"
317.01,259.86,561.84,268.71,"/F8",9.96,"duis metus vitae dictum sed conubia sit. Cubilia netus"
317.01,247.91,561.82,256.75,"/F8",9.96,"nibh cubilia rhoncus. Gravida justo neque scelerisque ve"
317.01,235.95,561.89,244.80,"/F8",9.96,"tempus. Aliquam fames odio. Integer justo quam dui"
317.01,224.00,561.87,232.84,"/F8",9.96,"a sapien nulla adipiscing condimentum montes in amet."
317.01,212.04,561.85,220.89,"/F8",9.96,"Aliquet velit sem eget maecenas pretium gravida pellen-"
317.01,200.09,561.83,208.93,"/F8",9.96,"tesque elementum nulla tincidunt hac diam quis. Iaculis"
317.01,188.13,561.86,196.98,"/F8",9.96,"lacus. Feugiat neque justo phasellus non quam erat luc-"
317.01,176.18,561.84,185.02,"/F8",9.96,"tus sodales aliquam. Pretium nulla. Aliquet risus per"
317.01,164.22,561.87,173.07,"/F8",9.96,"donec sed netus donec velit porta massa. Laoreet proin ac"
317.01,152.27,561.88,161.11,"/F8",9.96,"duis orci class urna pede. Natoque class augue consequat"
317.01,140.31,561.82,149.16,"/F8",9.96,"eni conubia vel sagittis consectetuer. Gravida fames velit"
317.01,128.36,561.84,137.20,"/F8",9.96,"netus aliquam ornare quis integer in enim vitae amet vel"
317.01,116.40,561.85,125.25,"/F8",9.96,"quam. Cubilia dolor est taciti suscipit arcu dui a aenean"
