37.61,748.78,288.43,757.62,"/F8",9.96,"nunc ante orci fusce lobortis. Dapibus curae orci at amet"
37.61,736.82,288.41,745.67,"/F8",9.96,"donec felis eleifend arcu molestie lacus in. Dapibus proin"
37.61,724.87,288.45,733.71,"/F8",9.96,"cras pretium ad nostra sagittis convallis a ipsum. Iac-"
37.61,712.91,288.42,721.76,"/F8",9.96,"ulis donec proin sociosqu hac viverra a. Integer vitae urna"
37.61,700.96,288.37,709.80,"/F8",9.96,"tempor penatibus ultricies sollicitudin dui. Gravida metus"
37.61,689.00,288.41,697.85,"/F8",9.96,"id. Gravida velit cum odio dis sem pellentesque ad curae."
37.61,677.04,288.49,685.89,"/F8",9.96,"Commodo metus. Laoreet dolor. Natoque augue. Lacinia"
37.61,665.09,288.45,673.94,"/F8",9.96,"nulla fames volutpat fusce mi tempus ac nibh erat. Non-"
37.61,653.13,288.44,661.98,"/F8",9.96,"ummy vitae leo nostra. Posuere vitae quis sociosqu sem"
37.61,641.18,117.81,650.03,"/F8",9.96,"pellentesque vitae."
37.61,618.76,183.91,627.61,"/F27",9.96,"3.1. Aliquam fames mi vulputate."
52.56,605.31,288.45,614.16,"/F8",9.96,"Iaculis morbi nisl sodales. Posuere massa vestibulum"
37.61,593.36,288.47,602.20,"/F8",9.96,"accumsan commodo porta urna torquent. Gravida etiam"
37.61,581.40,288.47,590.25,"/F8",9.96,"at lorem fusce a. Vivamus metus odio malesuada sagittis"
37.61,569.45,288.42,578.29,"/F8",9.96,"libero taciti vel ac risus porta donec eget. Euismod etiam."
37.61,557.49,288.44,566.34,"/F8",9.96,"Pretium neque. Blandit morbi. Sodales risus urna ad"
37.61,545.54,288.38,554.38,"/F8",9.96,"pellentesque viverra fusce ut. Pretium ipsum enim iaculis"
37.61,533.58,288.43,542.43,"/F8",9.96,"diam in consectetuer mauris in eni. Aliquam lorem nibh"
37.61,521.63,288.43,530.47,"/F8",9.96,"senectus lorem netus class mus hac penatibus hac aliquet"
37.61,509.67,288.46,518.52,"/F8",9.96,"a. Rhoncus dolor non enim integer curae ve at primis."
37.61,497.72,288.41,506.56,"/F8",9.96,"Gravida metus et ridiculus cras aliquam ad. Iaculis ipsum."
37.61,485.76,288.42,494.61,"/F8",9.96,"Blandit felis pede nisi. Posuere justo amet sit conubia"
37.61,473.81,288.44,482.65,"/F8",9.96,"velit nam pharetra a sociosqu amet lacinia id. Blandit"
37.61,461.85,288.36,470.70,"/F8",9.96,"vitae eu sapien tincidunt cubilia velit id porttitor. Sodales"
37.61,449.90,288.41,458.74,"/F8",9.96,"lorem netus per nisl urna risus phasellus mollis at varius"
37.61,437.94,288.42,446.79,"/F8",9.96,"egestas aliquet taciti. Feugiat donec arcu cursus mi eget."
37.61,425.99,288.42,434.83,"/F8",9.96,"Feugiat class leo enim congue mi ut dictum. Potenti vitae"
37.61,414.03,288.44,422.88,"/F8",9.96,"mi ultrices erat ac lacus quis. Natoque donec. Viverra"
37.61,402.08,141.95,410.92,"/F8",9.96,"augue est lorem integer."
52.56,390.12,288.42,398.97,"/F8",9.96,"Integer nulla vestibulum scelerisque luctus at metus"
37.61,378.17,288.40,387.01,"/F8",9.96,"luctus mi varius lobortis. Viverra purus dolor ullamcorper"
37.61,366.21,288.45,375.06,"/F8",9.96,"eget montes nascetur lacus. Rhoncus fames aliquet dic-"
37.61,354.26,288.42,363.10,"/F8",9.96,"tum enim felis nonummy fermentum sem fringilla neque."
37.61,342.30,288.41,351.15,"/F8",9.96,"Cubilia risus curae mattis varius elementum interdum mi"
37.61,330.34,291.07,339.19,"/F8",9.96,"rutrum consectetuer elementum lacus. Integer fusce viverra"
37.61,318.39,289.43,327.24,"/F8",9.96,"eleifend sollicitudin aliquet. Aliquam justo. Conubia fames"
37.61,306.43,288.45,315.28,"/F8",9.96,"duis non fames facilisis nec neque. Commodo ipsum elit"
37.61,294.48,288.39,303.33,"/F8",9.96,"cras aliquam at eleifend quam curabitur tristique nisi. Cu-"
37.61,282.52,288.41,291.37,"/F8",9.96,"bilia etiam rhoncus tincidunt pulvinar id. Commodo nulla"
37.61,270.57,288.40,279.42,"/F8",9.96,"lorem suspendisse per. Vivamus velit duis nisi integer ve"
37.61,258.61,288.44,267.46,"/F8",9.96,"ut ve ligula consectetuer commodo. Lacinia dolor iaculis"
37.61,246.66,288.44,255.51,"/F8",9.96,"dictum purus libero. Laoreet etiam. Integer augue lorem"
37.61,234.70,288.43,243.55,"/F8",9.96,"orci suscipit. Egestas class ad. Potenti ipsum orci nec"
37.61,222.75,288.43,231.60,"/F8",9.96,"magnis turpis class lacinia. Natoque velit morbi ullam-"
37.61,210.79,288.41,219.64,"/F8",9.96,"corper praesent nibh duis augue sodales ultricies. Posuere"
37.61,198.84,288.40,207.68,"/F8",9.96,"vitae. Blandit risus fusce class leo arcu eleifend non iaculis"
37.61,186.88,288.43,195.73,"/F8",9.96,"morbi. Sodales nulla vel. Iaculis fusce id aptent eu tac-"
37.61,174.93,288.41,183.77,"/F8",9.96,"iti torquent venenatis nisi est. Conubia nulla amet quam"
37.61,162.97,148.03,171.82,"/F8",9.96,"nibh porta ac malesuada."
52.56,151.02,288.44,159.86,"/F8",9.96,"Potenti metus dolor lacinia mi amet dictumst neque"
37.61,139.06,292.45,147.91,"/F8",9.96,"sed. Feugiat velit vestibulum scelerisque cursus at. Dapibus"
37.61,127.11,288.41,135.95,"/F8",9.96,"class ad varius ridiculus ad tempor iaculis penatibus prae-"
37.61,115.15,288.42,124.00,"/F8",9.96,"sent litora nibh. Rhoncus donec ad. Aliquet netus. Blan-"
37.61,103.20,288.40,112.04,"/F8",9.96,"dit felis et augue consectetuer nascetur porta quisque feu-"
37.61,91.24,300.45,100.09,"/F8",9.96,"giat. Vivamus massa elit scelerisque. Egestas neque. Dapibus"
37.61,79.29,288.43,88.13,"/F8",9.96,"class duis ligula senectus eni. Euismod lacus ante sem ad."
306.60,748.78,557.45,757.62,"/F8",9.96,"Sodales ipsum. Euismod curae nibh lectus congue magna"
306.60,736.82,557.41,745.67,"/F8",9.96,"parturient nonummy sem pulvinar dignissim et. Integer"
306.60,724.87,557.44,733.71,"/F8",9.96,"risus eu montes hac vestibulum magna quis eget. Ali-"
306.60,712.91,557.45,721.76,"/F8",9.96,"quet class netus non erat auctor semper eros. Vivamus"
306.60,700.95,557.40,709.80,"/F8",9.96,"neque dis curae platea. Quisque felis nec nibh ac pellen-"
306.60,689.00,557.39,697.85,"/F8",9.96,"tesque consectetuer laoreet libero et lectus. Iaculis proin"
306.60,677.04,557.39,685.89,"/F8",9.96,"mi curabitur ridiculus. Quisque ipsum. Feugiat etiam"
306.60,665.09,557.40,673.94,"/F8",9.96,"ante gravida duis id. Integer lorem vestibulum suspendisse"
306.60,653.13,557.38,661.98,"/F8",9.96,"litora at cursus mus sagittis tincidunt mollis risus natoque"
306.60,641.18,557.45,650.02,"/F8",9.96,"quam magna. Egestas lacus ac dignissim risus proin luc-"
306.60,629.22,557.43,638.07,"/F8",9.96,"tus ve sapien ut hac fringilla erat massa sociosqu. Lacinia"
306.60,617.27,440.24,626.11,"/F8",9.96,"velit neque mauris vestibulum."
306.60,594.85,388.29,603.70,"/F27",9.96,"3.2. Potenti dolor."
321.55,581.40,557.46,590.25,"/F8",9.96,"Euismod felis augue orci nam laoreet volutpat. Po-"
306.60,569.45,557.39,578.29,"/F8",9.96,"tenti morbi id ornare quisque quis mus. Quisque risus."
306.60,557.49,557.44,566.34,"/F8",9.96,"Posuere neque. Integer etiam class inceptos diam auctor"
306.60,545.54,557.40,554.38,"/F8",9.96,"nostra fames vestibulum ante netus hendrerit proin ipsum"
306.60,533.58,557.45,542.43,"/F8",9.96,"a. Egestas massa id. Cubilia donec. Euismod ipsum et"
306.60,521.63,557.43,530.47,"/F8",9.96,"quam morbi. Cubilia risus pede ornare. Aliquam felis"
306.60,509.67,557.44,518.52,"/F8",9.96,"ve metus dis tempor in nibh. Feugiat fames. Euismod"
306.60,497.72,557.38,506.56,"/F8",9.96,"risus erat sagittis. Aliquet etiam vestibulum. Pretium"
306.60,485.76,557.42,494.61,"/F8",9.96,"fusce parturient condimentum congue id aenean sollici-"
306.60,473.81,557.41,482.65,"/F8",9.96,"tudin cum. Egestas porta odio facilisis tempus erat inte-"
306.60,461.85,557.42,470.70,"/F8",9.96,"ger. Natoque fames magna condimentum nisi nisl fringilla."
306.60,449.90,557.38,458.74,"/F8",9.96,"Blandit nulla elit sit taciti ipsum. Egestas proin. Lacinia"
306.60,437.94,557.43,446.79,"/F8",9.96,"risus massa. Vivamus lorem est dolor fringilla pharetra"
306.60,425.99,557.45,434.83,"/F8",9.96,"quam sociis. Rhoncus fames neque amet. Blandit porta"
306.60,414.03,510.93,422.88,"/F8",9.96,"etiam quis viverra felis arcu scelerisque lacinia."
321.55,402.08,557.40,410.92,"/F8",9.96,"Quisque justo parturient facilisi purus diam molestie"
306.60,390.12,557.41,398.97,"/F8",9.96,"proin penatibus volutpat taciti aenean. Conubia donec per"
306.60,378.17,557.40,387.01,"/F8",9.96,"quam pretium fames justo eleifend orci rutrum. Pretium"
306.60,366.21,557.40,375.06,"/F8",9.96,"lacus lorem tempus dapibus tellus. Cubilia fames quisque"
306.60,354.25,557.41,363.10,"/F8",9.96,"duis cras. Posuere massa felis a aliquet ve. Gravida justo."
306.60,342.30,557.44,351.15,"/F8",9.96,"Quisque velit. Euismod massa nunc a curae ac nulla con-"
306.60,330.34,557.41,339.19,"/F8",9.96,"sequat vivamus. Gravida netus sodales primis mi sociosqu"
306.60,318.39,557.44,327.24,"/F8",9.96,"mauris duis neque. Aliquam donec magna. Dapibus class"
306.60,306.43,557.43,315.28,"/F8",9.96,"ac netus. Rhoncus porta nisl phasellus senectus urna auc-"
306.60,294.48,557.41,303.33,"/F8",9.96,"tor. Sodales proin ante eni urna fringilla eni nibh est"
306.60,282.52,557.45,291.37,"/F8",9.96,"lorem pede non id. Viverra lorem leo. Nonummy purus ac"
306.60,270.57,557.40,279.42,"/F8",9.96,"penatibus consequat pede dui tellus pharetra suspendisse"
306.60,258.61,557.41,267.46,"/F8",9.96,"pharetra. Pretium class quisque non. Conubia risus ante"
306.60,246.66,557.41,255.51,"/F8",9.96,"ullamcorper in mauris sollicitudin non class montes ornare"
306.60,234.70,557.41,243.55,"/F8",9.96,"etiam. Cubilia netus. Lacinia class quis enim arcu mi ele-"
306.60,222.75,557.42,231.59,"/F8",9.96,"mentum netus a dapibus id cubilia eros senectus. Vivamus"
306.60,210.79,557.43,219.64,"/F8",9.96,"class est amet cras dapibus. Viverra augue. Blandit porta"
306.60,198.84,399.61,207.68,"/F8",9.96,"nam lacus adipiscing."
321.55,186.88,557.43,195.73,"/F8",9.96,"Conubia vitae. Dapibus neque. Viverra augue dis ali-"
306.60,174.93,557.41,183.77,"/F8",9.96,"quet at et sem scelerisque vivamus sit bibendum. Laoreet"
306.60,162.97,557.39,171.82,"/F8",9.96,"felis dis elementum cras consectetuer ligula platea nisi at."
306.60,151.02,557.43,159.86,"/F8",9.96,"Commodo purus erat mauris senectus aliquam facilisi sol-"
306.60,139.06,557.41,147.91,"/F8",9.96,"licitudin posuere. Nonummy neque. Viverra fusce posuere"
306.60,127.11,557.42,135.95,"/F8",9.96,"ad fusce consectetuer inceptos donec lectus. Sodales curae"
306.60,115.15,557.36,124.00,"/F8",9.96,"ut luctus sollicitudin facilisis tempus. Feugiat proin erat"
306.60,103.20,557.40,112.04,"/F8",9.96,"luctus mollis. Integer netus. Potenti nulla diam aliquam"
306.60,91.24,557.47,100.09,"/F8",9.96,"cras urna proin. Commodo ipsum dui odio donec senec-"
306.60,79.29,557.42,88.13,"/F8",9.96,"tus. Feugiat fames eu cras dolor. Vivamus proin. Pretium"
295.15,61.35,300.13,70.20,"/F8",9.96,"4"
