557.11,803.82,562.09,812.67,"/F8",9.96,"3"
54.00,777.92,298.88,786.77,"/F8",9.96,"arcu cubilia fames. Rhoncus class augue risus semper"
54.00,765.96,298.84,774.81,"/F8",9.96,"nulla vestibulum ve phasellus. Conubia felis odio magna"
54.00,754.01,298.84,762.86,"/F8",9.96,"litora. Aliquet nulla arcu non consectetuer mi gravida"
54.00,742.05,272.56,750.90,"/F8",9.96,"elit. Commodo donec est quam inceptos torquent."
63.96,729.80,298.85,738.64,"/F8",9.96,"Sodales class. Viverra porta per elit dictum pede tac-"
54.00,717.84,102.49,726.69,"/F8",9.96,"iti blandit."
113.15,717.84,250.82,726.69,"/F8",9.96,"Dapibus ipsum mi augue hac."
261.48,717.84,298.86,726.69,"/F8",9.96,"Vivamus"
54.00,705.89,298.87,714.73,"/F8",9.96,"porta euismod venenatis eros congue euismod laoreet im-"
54.00,693.93,298.82,702.78,"/F8",9.96,"perdiet. Quisque class eu primis consectetuer nec nulla"
54.00,681.98,298.87,690.82,"/F8",9.96,"malesuada mattis justo suspendisse. Commodo lorem sit"
54.00,670.02,298.85,678.87,"/F8",9.96,"amet nascetur mus ac metus per. Sodales velit enim ali-"
54.00,658.07,298.86,666.91,"/F8",9.96,"quam vitae metus donec inceptos elementum fusce cur-"
54.00,646.11,298.84,654.96,"/F8",9.96,"abitur. Nonummy purus mi dictum habitasse bibendum."
54.00,634.16,298.86,643.00,"/F8",9.96,"Rhoncus class. Rhoncus fusce. Gravida morbi. Dapibus"
54.00,622.20,298.87,631.05,"/F8",9.96,"magna etiam fermentum. Quisque class sed urna vel"
54.00,610.25,298.86,619.09,"/F8",9.96,"neque amet sit donec. Vivamus metus. Lacinia velit"
54.00,598.29,298.88,607.14,"/F8",9.96,"amet sociosqu. Nonummy purus erat ullamcorper cum"
54.00,586.34,298.87,595.18,"/F8",9.96,"magnis. Egestas dolor et at. Feugiat netus. Vivamus"
54.00,574.38,298.83,583.23,"/F8",9.96,"netus mus ornare. Dapibus neque mi risus scelerisque ve"
54.00,562.42,298.80,571.27,"/F8",9.96,"platea eu luctus potenti nisi. Pretium velit amet dapibus"
54.00,550.47,298.88,559.32,"/F8",9.96,"at tempor a egestas tempus odio tortor. Vivamus augue."
145.33,515.93,207.69,523.89,"/F19",8.97,"Lacinia justo."
63.96,489.30,298.87,498.15,"/F8",9.96,"Euismod curae dui odio interdum purus litora at"
54.00,477.35,298.84,486.20,"/F8",9.96,"habitasse a penatibus vitae. Dapibus class nisi montes"
54.00,465.39,298.83,474.24,"/F8",9.96,"arcu duis nec venenatis vel. Feugiat morbi. Aliquam vi-"
54.00,453.44,298.84,462.28,"/F8",9.96,"tae. Aliquet ipsum arcu euismod lectus eni. Dapibus"
54.00,441.48,298.84,450.33,"/F8",9.96,"augue id platea felis faucibus. Integer vitae et netus"
54.00,429.53,298.83,438.37,"/F8",9.96,"eu ve pede elementum. Viverra curae at porttitor velit"
54.00,417.57,298.83,426.42,"/F8",9.96,"molestie et. Gravida risus massa nisi nascetur sollici-"
54.00,405.62,298.82,414.46,"/F8",9.96,"tudin aenean porta libero parturient. Potenti lacus in"
54.00,393.66,298.84,402.51,"/F8",9.96,"imperdiet a facilisis fames. Dapibus morbi proin nul-"
54.00,381.71,298.84,390.55,"/F8",9.96,"lam parturient volutpat urna feugiat sodales elementum"
54.00,369.75,298.84,378.60,"/F8",9.96,"dui. Aliquam purus et diam nec aliquet a ligula. Integer"
54.00,357.80,298.86,366.64,"/F8",9.96,"fusce fames rhoncus ac sagittis nam. Blandit purus ante"
54.00,345.84,298.83,354.69,"/F8",9.96,"nibh euismod sociis orci consectetuer vestibulum. Conu-"
54.00,333.89,298.83,342.73,"/F8",9.96,"bia augue dui ridiculus sit donec fringilla nascetur eros"
54.00,321.93,298.85,330.78,"/F8",9.96,"sit aenean vivamus pretium. Euismod fusce cras per in"
54.00,309.98,298.80,318.82,"/F8",9.96,"facilisi sagittis ut ullamcorper ad tellus ipsum. Aliquet"
54.00,298.02,298.86,306.87,"/F8",9.96,"magna. Rhoncus lacus eros dui nisi penatibus lobortis"
54.00,286.07,298.86,294.91,"/F8",9.96,"congue nibh. Aliquet nulla orci per. Rhoncus porta ac"
54.00,274.11,298.86,282.96,"/F8",9.96,"lacus fermentum laoreet netus gravida varius mi fames"
54.00,262.16,298.84,271.00,"/F8",9.96,"consectetuer. Laoreet donec. Rhoncus vitae orci sit nisi"
54.00,250.20,266.22,259.05,"/F8",9.96,"parturient mauris non ante dui hac pellentesque."
63.96,237.94,298.84,246.79,"/F8",9.96,"Egestas metus ac lectus tincidunt neque sed nisl nec"
54.00,225.99,298.80,234.84,"/F8",9.96,"justo. Aliquam metus parturient id sollicitudin iaculis"
54.00,214.03,298.84,222.88,"/F8",9.96,"lectus aptent. Egestas etiam et risus ipsum conubia diam"
54.00,202.08,298.85,210.93,"/F8",9.96,"nam. Pretium velit gravida sociis urna penatibus so-"
54.00,190.12,298.83,198.97,"/F8",9.96,"ciosqu nostra parturient pellentesque quisque. Commodo"
54.00,178.17,298.83,187.01,"/F8",9.96,"risus quam urna elit risus aptent vestibulum magna quis"
54.00,166.21,298.83,175.06,"/F8",9.96,"ante et donec ad. Aliquet purus netus auctor id faucibus"
54.00,154.26,298.88,163.10,"/F8",9.96,"auctor odio justo rhoncus. Egestas massa. Iaculis fe-"
54.00,142.30,298.81,151.15,"/F8",9.96,"lis diam sagittis natoque pharetra sollicitudin. Dapibus"
54.00,130.35,298.86,139.19,"/F8",9.96,"fames parturient ullamcorper aptent at semper augue"
54.00,118.39,298.86,127.24,"/F8",9.96,"quam tincidunt sapien. Conubia morbi ad et duis eu"
317.01,777.92,561.85,786.77,"/F8",9.96,"erat dapibus diam. Conubia lacus ve fusce vel duis dui."
317.01,765.96,561.86,774.81,"/F8",9.96,"Laoreet augue eu cras nunc vulputate. Lacinia velit per"
317.01,754.01,561.84,762.86,"/F8",9.96,"nulla hac felis gravida blandit habitasse sociosqu montes."
317.01,742.05,561.85,750.90,"/F8",9.96,"Iaculis risus nisl posuere. Quisque augue proin cum pede"
317.01,730.10,561.84,738.94,"/F8",9.96,"nibh etiam elementum scelerisque. Feugiat ipsum dis"
317.01,718.14,561.82,726.99,"/F8",9.96,"parturient vestibulum ut. Egestas curae lacus justo. Ali-"
317.01,706.19,561.81,715.03,"/F8",9.96,"quet lacus laoreet curabitur ad tellus ve vel enim suscipit"
317.01,694.23,561.84,703.08,"/F8",9.96,"consectetuer semper. Pretium porta ut mollis phasellus"
317.01,682.28,561.85,691.12,"/F8",9.96,"vestibulum euismod quam at ridiculus. Lacinia proin."
317.01,670.32,451.62,679.17,"/F8",9.96,"Euismod lorem. Pretium risus."
404.11,618.20,474.95,626.16,"/F19",8.97,"Conubia etiam."
326.98,588.26,561.85,597.11,"/F8",9.96,"Gravida felis feugiat arcu nec sollicitudin morbi id"
317.01,576.30,561.87,585.15,"/F8",9.96,"neque et. Laoreet fames odio laoreet ve. Posuere felis"
317.01,564.35,561.85,573.20,"/F8",9.96,"eget auctor sed montes integer enim id praesent. Cubilia"
317.01,552.39,561.85,561.24,"/F8",9.96,"augue risus litora penatibus. Egestas etiam risus nunc"
317.01,540.44,561.87,549.29,"/F8",9.96,"mus sapien ac etiam in quis eu nibh. Egestas vitae mi"
317.01,528.48,561.84,537.33,"/F8",9.96,"luctus non mi a quam adipiscing vulputate. Aliquet ip-"
317.01,516.53,561.87,525.37,"/F8",9.96,"sum sem. Integer velit. Commodo nulla. Pretium augue"
317.01,504.57,561.84,513.42,"/F8",9.96,"hac nascetur fusce nec. Pretium vitae odio curabitur in"
317.01,492.62,561.84,501.46,"/F8",9.96,"mi cursus eu in quis nunc est cubilia quis. Vivamus fe-"
317.01,480.66,561.87,489.51,"/F8",9.96,"lis ve class. Posuere fames odio aliquam pede mus litora"
317.01,468.71,561.85,477.55,"/F8",9.96,"bibendum nonummy fames natoque ut velit rutrum eros."
317.01,456.75,561.89,465.60,"/F8",9.96,"Gravida ipsum massa metus conubia cum molestie pel-"
317.01,444.80,561.81,453.64,"/F8",9.96,"lentesque viverra convallis nunc. Potenti fames nisl pede"
317.01,432.84,561.85,441.69,"/F8",9.96,"curae condimentum sit varius a parturient. Euismod do-"
317.01,420.89,561.83,429.73,"/F8",9.96,"lor dis urna sapien convallis parturient mus vestibulum"
317.01,408.93,561.91,417.78,"/F8",9.96,"metus cras. Laoreet velit ad magna consequat commodo"
317.01,396.98,561.88,405.82,"/F8",9.96,"eni. Laoreet fames risus. Nonummy fusce ve sociis est"
317.01,385.02,561.83,393.87,"/F8",9.96,"parturient. Aliquet metus ve phasellus potenti massa leo"
317.01,373.07,561.90,381.91,"/F8",9.96,"pede. Nonummy nulla. Posuere massa odio leo vitae"
317.01,361.11,366.80,369.96,"/F8",9.96,"fermentum."
326.98,345.54,561.89,354.39,"/F8",9.96,"Commodo felis porta viverra facilisis eros hac cras a"
317.01,333.59,561.87,342.43,"/F8",9.96,"nisi morbi. Dapibus fusce mus. Euismod justo blan-"
317.01,321.63,561.88,330.48,"/F8",9.96,"dit non. Egestas morbi nam lorem. Cubilia lacus diam"
317.01,309.68,561.83,318.52,"/F8",9.96,"id morbi auctor. Viverra purus ut elit primis. Dapibus"
317.01,297.72,561.83,306.57,"/F8",9.96,"justo. Aliquam nulla per eleifend rhoncus pretium laoreet"
317.01,285.76,561.85,294.61,"/F8",9.96,"tempor per inceptos ridiculus. Gravida donec urna au-"
317.01,273.81,561.88,282.66,"/F8",9.96,"gue. Nonummy risus fusce lobortis adipiscing congue"
317.01,261.85,561.85,270.70,"/F8",9.96,"pede vulputate montes curabitur nam nisl elementum"
317.01,249.90,561.85,258.75,"/F8",9.96,"non eni malesuada mus per. Potenti donec elit aptent in-"
317.01,237.94,561.84,246.79,"/F8",9.96,"teger laoreet fringilla. Aliquam class. Viverra neque per"
317.01,225.99,561.82,234.84,"/F8",9.96,"vestibulum tincidunt suspendisse eni semper a dictumst"
317.01,214.03,561.86,222.88,"/F8",9.96,"quam nonummy ve. Dapibus proin urna natoque id elit"
317.01,202.08,561.87,210.92,"/F8",9.96,"augue hymenaeos nonummy proin ut. Gravida nulla. Vi-"
317.01,190.12,561.86,198.97,"/F8",9.96,"vamus netus sem tempus penatibus senectus nunc. Viva-"
317.01,178.17,561.85,187.01,"/F8",9.96,"mus dolor. Posuere fusce est netus lorem aliquet erat cras"
317.01,166.21,561.86,175.06,"/F8",9.96,"cum quis. Blandit donec amet elementum consectetuer"
317.01,154.26,561.81,163.10,"/F8",9.96,"parturient erat. Potenti etiam. Aliquet proin id vulpu-"
317.01,142.30,561.80,151.15,"/F8",9.96,"tate parturient hac felis porta luctus vehicula vestibulum"
317.01,130.35,561.88,139.19,"/F8",9.96,"tincidunt massa nascetur dis eu aenean. Sodales fames"
317.01,118.39,419.97,127.24,"/F8",9.96,"nibh et class nunc ante."
