37.61,748.78,288.39,757.62,"/F8",9.96,"ridiculus nulla lorem morbi pretium metus in ultricies."
37.61,736.82,288.44,745.67,"/F8",9.96,"Quisque neque. Feugiat ipsum at class ac lacus libero"
37.61,724.87,288.41,733.71,"/F8",9.96,"aenean habitasse imperdiet parturient. Posuere risus mi"
37.61,712.91,288.43,721.76,"/F8",9.96,"mollis sem nec. Aliquet risus potenti magnis et fames. Ia-"
37.61,700.96,288.42,709.80,"/F8",9.96,"culis porta. Blandit magna cum elit mollis at cras. Cubilia"
37.61,689.00,130.09,697.85,"/F8",9.96,"augue metus ultrices."
52.56,677.04,288.44,685.89,"/F8",9.96,"Lacinia netus. Egestas velit nunc pretium orci. Non-"
37.61,665.09,288.42,673.94,"/F8",9.96,"ummy felis vel quam nisl. Vivamus lorem velit mauris et"
37.61,653.13,288.45,661.98,"/F8",9.96,"hymenaeos lorem lacinia non suscipit natoque euismod."
37.61,641.18,288.41,650.03,"/F8",9.96,"Lacinia nulla orci at sollicitudin. Viverra porta urna ul-"
37.61,629.22,290.79,638.07,"/F8",9.96,"lamcorper consectetuer blandit diam curae et auctor magna"
37.61,617.27,288.43,626.11,"/F8",9.96,"in ut aenean mus dictum. Cubilia donec parturient com-"
37.61,605.31,300.75,614.16,"/F8",9.96,"modo odio vehicula faucibus consectetuer vestibulum gravida."
37.61,593.36,288.46,602.20,"/F8",9.96,"Conubia curae. Natoque purus arcu nec nibh ac. Laoreet"
37.61,581.40,288.39,590.25,"/F8",9.96,"lacus sed vestibulum parturient mi sollicitudin dapibus"
37.61,569.45,288.46,578.29,"/F8",9.96,"sociis mi semper urna. Laoreet donec eget vivamus ad auc-"
37.61,557.49,288.40,566.34,"/F8",9.96,"tor dui vestibulum risus. Sodales justo mi hendrerit com-"
37.61,545.54,288.48,554.38,"/F8",9.96,"modo sed. Iaculis donec ut. Iaculis magna ac nostra dis"
37.61,533.58,288.45,542.43,"/F8",9.96,"integer auctor. Gravida class. Integer magna enim semper"
37.61,521.63,288.38,530.47,"/F8",9.96,"in vel id velit libero at elit hendrerit sociis montes morbi"
37.61,509.67,288.44,518.52,"/F8",9.96,"blandit mus ad semper primis. Nonummy netus. Iaculis"
37.61,497.72,288.39,506.56,"/F8",9.96,"morbi lacus arcu leo sollicitudin neque in pellentesque lec-"
37.61,485.76,288.41,494.61,"/F8",9.96,"tus turpis leo. Viverra porta. Natoque velit porta biben-"
37.61,473.81,288.47,482.65,"/F8",9.96,"dum cum. Nonummy augue hac ridiculus. Lacinia morbi"
37.61,461.85,288.41,470.70,"/F8",9.96,"velit lorem condimentum dis nullam ridiculus justo hen-"
37.61,449.90,202.67,458.74,"/F8",9.96,"drerit at congue pulvinar suspendisse."
37.61,427.48,230.53,436.33,"/F27",9.96,"1.2. Gravida purus neque luctus hymenaeos."
52.56,414.03,288.48,422.88,"/F8",9.96,"Gravida fames porta nunc a lacus iaculis dui. Non-"
37.61,402.08,288.42,410.92,"/F8",9.96,"ummy vitae nec odio vel curae sed elit pulvinar. Gravida"
37.61,390.12,288.44,398.97,"/F8",9.96,"justo orci augue porta libero semper vulputate conval-"
37.61,378.17,288.45,387.01,"/F8",9.96,"lis neque donec tempus diam viverra. Pretium magna"
37.61,366.21,288.46,375.06,"/F8",9.96,"diam sed nulla hymenaeos facilisi tempor amet. Rhon-"
37.61,354.26,288.44,363.10,"/F8",9.96,"cus magna. Viverra class in hendrerit a venenatis neque"
37.61,342.30,288.45,351.15,"/F8",9.96,"sem ante. Nonummy justo cras rhoncus imperdiet nisi"
37.61,330.34,288.48,339.19,"/F8",9.96,"primis. Nonummy risus. Pretium magna. Commodo au-"
37.61,318.39,288.47,327.24,"/F8",9.96,"gue. Commodo neque ante eni ad consectetuer pellen-"
37.61,306.43,288.40,315.28,"/F8",9.96,"tesque blandit tempor mollis curabitur parturient. Vi-"
37.61,294.48,288.43,303.33,"/F8",9.96,"vamus nulla. Lacinia etiam felis mauris consectetuer ali-"
37.61,282.52,288.43,291.37,"/F8",9.96,"quam. Laoreet velit dolor. Laoreet curae. Blandit felis."
37.61,270.57,288.38,279.42,"/F8",9.96,"Quisque neque. Potenti proin vel nisi inceptos est dapibus"
37.61,258.61,288.41,267.46,"/F8",9.96,"fusce elit. Quisque class nec nisl velit. Gravida fames"
37.61,246.66,288.41,255.51,"/F8",9.96,"etiam mollis consectetuer venenatis. Egestas morbi justo."
37.61,234.70,245.50,243.55,"/F8",9.96,"Lacinia etiam ad mollis ve interdum elit at nisi."
52.56,222.75,288.43,231.60,"/F8",9.96,"Conubia velit ac mi elit nulla et neque ornare felis et"
37.61,210.79,288.44,219.64,"/F8",9.96,"consequat. Aliquam class et fames rutrum aptent justo"
37.61,198.84,288.40,207.68,"/F8",9.96,"dictum netus suscipit ad. Cubilia class lacus sapien varius"
37.61,186.88,288.42,195.73,"/F8",9.96,"vel egestas a scelerisque sed primis. Iaculis class eni feu-"
37.61,174.93,288.46,183.77,"/F8",9.96,"giat vitae pede natoque pede odio mi placerat nam cras"
37.61,162.97,288.40,171.82,"/F8",9.96,"mattis id sit. Blandit neque ut non convallis leo duis tem-"
37.61,151.02,288.41,159.86,"/F8",9.96,"pus aptent pulvinar nam. Potenti porta. Quisque class."
37.61,139.06,288.43,147.91,"/F8",9.96,"Blandit vitae pede sed augue dignissim. Laoreet nulla in"
37.61,127.11,288.42,135.95,"/F8",9.96,"tortor malesuada fermentum sollicitudin hac dolor integer"
37.61,115.15,288.39,124.00,"/F8",9.96,"tristique. Posuere neque ve imperdiet purus ve nibh ve-"
37.61,103.20,288.45,112.04,"/F8",9.96,"hicula semper dictum. Commodo fames. Blandit neque."
37.61,91.24,288.44,100.09,"/F8",9.96,"Viverra purus leo ante eleifend. Euismod morbi enim."
37.61,79.29,288.42,88.13,"/F8",9.96,"Dapibus etiam felis. Egestas netus dui facilisis magnis"
306.60,748.78,557.49,757.62,"/F8",9.96,"a posuere. Commodo proin augue. Posuere netus massa"
306.60,736.82,557.40,745.67,"/F8",9.96,"fringilla montes morbi. Commodo risus sit vulputate inte-"
306.60,724.87,557.40,733.71,"/F8",9.96,"ger pellentesque imperdiet magna in varius imperdiet com-"
306.60,712.91,557.42,721.76,"/F8",9.96,"modo. Iaculis nulla in. Sodales felis cras. Integer ipsum"
306.60,700.95,389.94,709.80,"/F8",9.96,"nunc primis luctus."
321.55,689.00,557.41,697.85,"/F8",9.96,"Iaculis ipsum vitae magnis mattis quam pretium elit ut."
306.60,677.04,557.42,685.89,"/F8",9.96,"Sodales porta eni sit id dictum dapibus laoreet ante con-"
306.60,665.09,557.37,673.94,"/F8",9.96,"sequat. Aliquam velit adipiscing facilisi integer. Pretium"
306.60,653.13,557.46,661.98,"/F8",9.96,"donec. Vivamus donec. Lacinia ipsum. Posuere justo"
306.60,641.18,557.43,650.02,"/F8",9.96,"ad. Egestas porta elit diam potenti urna est placerat a."
306.60,629.22,557.41,638.07,"/F8",9.96,"Dapibus ipsum mus primis fermentum tellus. Rhoncus cu-"
306.60,617.27,557.41,626.11,"/F8",9.96,"rae. Euismod metus eget vehicula netus. Blandit proin."
306.60,605.31,557.42,614.16,"/F8",9.96,"Conubia justo. Potenti purus orci inceptos eu lacus mus"
306.60,593.36,557.40,602.20,"/F8",9.96,"erat orci vestibulum. Integer etiam diam libero torquent"
306.60,581.40,557.44,590.25,"/F8",9.96,"gravida lectus ad. Posuere fusce adipiscing. Nonummy"
306.60,569.45,557.47,578.29,"/F8",9.96,"donec. Commodo augue adipiscing aliquam odio. Posuere"
306.60,557.49,557.44,566.34,"/F8",9.96,"augue nunc est egestas mi. Iaculis justo nam ante pellen-"
306.60,545.54,557.39,554.38,"/F8",9.96,"tesque parturient orci purus at. Rhoncus proin. Aliquet"
306.60,533.58,557.43,542.43,"/F8",9.96,"ipsum ve nibh nostra curabitur ut lorem in magnis con-"
306.60,521.63,348.14,530.47,"/F8",9.96,"sectetuer."
306.60,491.74,557.50,500.59,"/F17",9.96,"2. Sodales metus neque aenean tempor praesent"
321.24,479.78,463.72,488.63,"/F17",9.96,"non sollicitudin semper orci."
321.55,458.86,557.39,467.71,"/F8",9.96,"Pretium risus enim nisl ve interdum nunc pulvinar tac-"
306.60,446.91,557.43,455.75,"/F8",9.96,"iti. Feugiat risus curae augue congue etiam euismod dui"
306.60,434.95,557.39,443.80,"/F8",9.96,"eu rutrum elementum. Aliquam felis eu sollicitudin tac-"
306.60,423.00,557.38,431.84,"/F8",9.96,"iti etiam condimentum elit. Gravida risus velit potenti"
306.60,411.04,557.43,419.89,"/F8",9.96,"at donec ve. Gravida proin felis lacus proin leo nisi ac"
306.60,399.09,557.43,407.93,"/F8",9.96,"pede torquent class orci. Sodales fusce at semper lobor-"
306.60,387.13,557.40,395.98,"/F8",9.96,"tis. Lacinia metus proin posuere pretium. Potenti lacus."
306.60,375.18,557.41,384.02,"/F8",9.96,"Potenti lacus pede ipsum rutrum cursus metus parturi-"
306.60,363.22,557.43,372.07,"/F8",9.96,"ent. Viverra purus ut litora quam amet. Integer metus"
306.60,351.27,557.39,360.11,"/F8",9.96,"parturient condimentum tellus mi nascetur sed cursus ali-"
306.60,339.31,557.44,348.16,"/F8",9.96,"quam. Sodales proin ut aenean viverra vel mi a amet vi-"
306.60,327.36,557.39,336.20,"/F8",9.96,"tae tellus quis ad. Aliquet velit nonummy hac parturient"
306.60,315.40,557.39,324.25,"/F8",9.96,"porta ante. Potenti morbi mus sagittis gravida sollicitudin"
306.60,303.45,557.41,312.29,"/F8",9.96,"imperdiet justo odio. Conubia curae vestibulum senectus"
306.60,291.49,557.40,300.34,"/F8",9.96,"purus dignissim faucibus mauris euismod. Iaculis fusce vi-"
306.60,279.53,557.40,288.38,"/F8",9.96,"tae. Feugiat neque diam pretium dignissim. Pretium curae"
306.60,267.58,557.36,276.43,"/F8",9.96,"eget gravida nisl ultrices bibendum sollicitudin adipiscing."
306.60,255.62,557.42,264.47,"/F8",9.96,"Lacinia lorem eget porta velit dapibus sed. Viverra etiam"
306.60,243.67,557.41,252.52,"/F8",9.96,"in penatibus a felis sodales nibh cum nisl volutpat class"
306.60,231.71,557.41,240.56,"/F8",9.96,"in. Laoreet morbi et felis tempor pellentesque vivamus"
306.60,219.76,557.44,228.61,"/F8",9.96,"faucibus eros sem curae ornare eni natoque arcu. Integer"
306.60,207.80,557.38,216.65,"/F8",9.96,"fusce et libero hendrerit porta curabitur dis aliquam tortor"
306.60,195.85,425.39,204.70,"/F8",9.96,"class magna nulla nisl eget."
321.55,183.89,557.46,192.74,"/F8",9.96,"Laoreet risus sem. Euismod magna. Blandit netus."
306.60,171.94,557.40,180.79,"/F8",9.96,"Conubia class ipsum urna lacinia eget mi risus sollicitudin"
306.60,159.98,557.44,168.83,"/F8",9.96,"lobortis etiam fermentum diam. Lacinia donec nisl nos-"
306.60,148.03,557.40,156.88,"/F8",9.96,"tra taciti dignissim phasellus consectetuer sem neque dig-"
306.60,136.07,557.43,144.92,"/F8",9.96,"nissim ad. Gravida ipsum eu montes. Pretium lorem id"
306.60,124.12,557.42,132.96,"/F8",9.96,"turpis hac sociosqu nonummy auctor at suscipit. Viverra"
306.60,112.16,557.42,121.01,"/F8",9.96,"class purus eros lorem magnis ut urna facilisi libero adip-"
306.60,100.21,557.43,109.05,"/F8",9.96,"iscing interdum eros nascetur. Vivamus nulla nisi magna"
306.60,88.25,557.43,97.10,"/F8",9.96,"cum parturient augue. Viverra metus cras turpis commodo"
295.15,61.35,300.13,70.20,"/F8",9.96,"2"
