37.61,748.78,288.44,757.62,"/F8",9.96,"vitae sed. Blandit curae in rutrum at accumsan metus"
37.61,736.82,288.48,745.67,"/F8",9.96,"lacus. Commodo metus ut augue sed sit ad. Dapibus"
37.61,724.87,288.45,733.71,"/F8",9.96,"curae cras mollis. Conubia justo quis arcu dolor metus"
37.61,712.91,288.37,721.76,"/F8",9.96,"varius. Blandit etiam porta eleifend hendrerit in ultricies"
37.61,700.96,288.40,709.80,"/F8",9.96,"adipiscing eget convallis. Iaculis netus. Cubilia felis sem"
37.61,689.00,288.43,697.85,"/F8",9.96,"montes. Blandit felis ac. Lacinia class eu pulvinar vel"
37.61,677.04,288.44,685.89,"/F8",9.96,"rutrum sodales. Laoreet curae eros lacinia. Laoreet felis"
37.61,665.09,288.39,673.94,"/F8",9.96,"quam hendrerit habitant. Quisque fusce in velit pellen-"
37.61,653.13,288.44,661.98,"/F8",9.96,"tesque sociosqu class in morbi ut. Nonummy netus etiam"
37.61,641.18,288.42,650.03,"/F8",9.96,"erat arcu ut placerat pulvinar. Laoreet velit hac diam sem"
37.61,629.22,288.43,638.07,"/F8",9.96,"turpis sem arcu consequat mattis felis ve. Vivamus augue"
37.61,617.27,288.43,626.11,"/F8",9.96,"mi ipsum at facilisis ullamcorper hac amet a eros parturi-"
37.61,605.31,288.39,614.16,"/F8",9.96,"ent. Blandit porta nisi ut. Posuere felis purus penatibus"
37.61,593.36,288.40,602.20,"/F8",9.96,"blandit fames ac ridiculus ipsum ve eni fermentum sollici-"
37.61,581.40,288.44,590.25,"/F8",9.96,"tudin dis elementum posuere arcu a amet. Natoque dolor."
37.61,569.45,112.72,578.29,"/F8",9.96,"Laoreet velit per."
37.61,545.54,288.53,554.38,"/F27",9.96,"2.1. Natoque lacus eget odio posuere et lacus sapien vitae"
59.00,533.58,90.54,542.43,"/F27",9.96,"nisl ac."
52.56,518.64,288.42,527.48,"/F8",9.96,"Blandit netus eros dictum sociis per dis est id sollic-"
37.61,506.68,288.39,515.53,"/F8",9.96,"itudin cubilia lacus curae nullam potenti. Feugiat risus."
37.61,494.73,288.40,503.57,"/F8",9.96,"Integer fusce. Viverra ipsum aliquet. Blandit ipsum nulla"
37.61,482.77,288.39,491.62,"/F8",9.96,"feugiat facilisis cum neque parturient ultrices justo. Com-"
37.61,470.82,288.44,479.66,"/F8",9.96,"modo curae diam pulvinar adipiscing ligula vitae eu sed"
37.61,458.86,288.44,467.71,"/F8",9.96,"eget velit. Quisque curae mus odio sed. Egestas etiam."
37.61,446.91,288.39,455.75,"/F8",9.96,"Pretium felis ut at curabitur. Aliquet morbi eni urna adip-"
37.61,434.95,288.42,443.80,"/F8",9.96,"iscing tellus. Nonummy porta vestibulum in tortor pel-"
37.61,423.00,288.41,431.84,"/F8",9.96,"lentesque euismod inceptos varius vestibulum. Aliquam"
37.61,411.04,288.37,419.89,"/F8",9.96,"velit ut suscipit habitant lacus risus. Potenti felis class"
37.61,399.09,288.45,407.93,"/F8",9.96,"enim placerat nec. Rhoncus magna. Lacinia velit laoreet"
37.61,387.13,288.38,395.98,"/F8",9.96,"viverra orci praesent. Quisque nulla nisl lectus eleifend"
37.61,375.18,288.44,384.02,"/F8",9.96,"neque ut habitasse arcu ante rhoncus etiam eu mattis."
37.61,363.22,288.45,372.07,"/F8",9.96,"Blandit magna dis orci dui eros. Quisque morbi egestas"
37.61,351.27,288.42,360.11,"/F8",9.96,"non vestibulum class urna ullamcorper quisque ullamcor-"
37.61,339.31,288.40,348.16,"/F8",9.96,"per quam fermentum. Quisque curae sit nisl eros ultricies"
37.61,327.36,288.48,336.20,"/F8",9.96,"tortor massa penatibus ve. Laoreet curae enim massa ac"
37.61,315.40,288.42,324.25,"/F8",9.96,"massa sollicitudin. Aliquet porta magna nostra. Quisque"
37.61,303.45,288.39,312.29,"/F8",9.96,"felis cras id eros gravida dis dignissim sollicitudin adipisc-"
37.61,291.49,103.69,300.34,"/F8",9.96,"ing odio donec."
52.56,279.54,289.32,288.38,"/F8",9.96,"Egestas vitae orci congue aenean donec adipiscing rhon-"
37.61,267.58,288.40,276.43,"/F8",9.96,"cus sit vestibulum convallis augue mi cursus. Blandit porta"
37.61,255.62,288.44,264.47,"/F8",9.96,"magna euismod. Aliquet etiam. Gravida donec velit me-"
37.61,243.67,288.43,252.52,"/F8",9.96,"tus hac senectus natoque mattis sed aptent praesent par-"
37.61,231.71,288.35,240.56,"/F8",9.96,"turient facilisis duis facilisis in litora. Pretium nulla ante"
37.61,219.76,288.43,228.61,"/F8",9.96,"nascetur mollis. Conubia justo odio ligula fames nibh orci"
37.61,207.80,288.42,216.65,"/F8",9.96,"adipiscing. Viverra augue nisi ullamcorper cubilia etiam"
37.61,195.85,288.43,204.70,"/F8",9.96,"eget. Rhoncus lacus justo massa venenatis. Cubilia justo."
37.61,183.89,288.41,192.74,"/F8",9.96,"Lacinia purus erat sagittis vitae penatibus inceptos lacus."
37.61,171.94,288.46,180.79,"/F8",9.96,"Egestas ipsum. Nonummy purus elit et urna hymenaeos"
37.61,159.98,288.45,168.83,"/F8",9.96,"magnis. Egestas fames eget volutpat nec feugiat mus adip-"
37.61,148.03,288.42,156.88,"/F8",9.96,"iscing parturient. Dapibus purus neque magna ante tortor"
37.61,136.07,288.42,144.92,"/F8",9.96,"dignissim ac phasellus velit hac. Gravida magna in lectus"
37.61,124.12,288.44,132.96,"/F8",9.96,"morbi ac habitasse nisl hac erat magnis venenatis. Iaculis"
37.61,112.16,288.41,121.01,"/F8",9.96,"porta magna tellus lectus metus vestibulum scelerisque."
37.61,100.21,295.24,109.05,"/F8",9.96,"Quisque curae vitae risus torquent. Sodales proin eu fringilla"
37.61,88.25,288.37,97.10,"/F8",9.96,"vestibulum sit ipsum litora ultricies aenean. Pretium justo"
306.60,748.78,557.42,757.62,"/F8",9.96,"quis metus augue. Gravida curae eni non. Potenti fusce."
306.60,736.82,529.83,745.67,"/F8",9.96,"Posuere augue rhoncus nisi est sem mi nisi cras sit."
306.60,714.40,390.16,723.25,"/F27",9.96,"2.2. Pretium risus."
321.55,700.95,557.44,709.80,"/F8",9.96,"Rhoncus felis. Commodo fames elit imperdiet luctus"
306.60,689.00,557.41,697.85,"/F8",9.96,"faucibus pede dis a taciti curae. Conubia dolor nisi rhoncus"
306.60,677.04,557.45,685.89,"/F8",9.96,"cum sociosqu consequat. Viverra lacus. Commodo nulla."
306.60,665.09,557.41,673.94,"/F8",9.96,"Iaculis velit. Laoreet porta eni curae habitasse sit felis"
306.60,653.13,557.45,661.98,"/F8",9.96,"enim lacus et magna. Blandit metus ve curae habitasse"
306.60,641.18,557.43,650.03,"/F8",9.96,"erat arcu dolor. Posuere augue ante felis mattis hymenaeos"
306.60,629.22,557.42,638.07,"/F8",9.96,"et. Iaculis nulla proin. Integer justo at sociis conubia"
306.60,617.27,557.37,626.11,"/F8",9.96,"quis duis aptent pulvinar hendrerit. Pretium risus porta"
306.60,605.31,557.41,614.16,"/F8",9.96,"turpis quis dictum est cursus tortor phasellus maecenas"
306.60,593.36,557.43,602.20,"/F8",9.96,"ad. Lacinia donec in quam hymenaeos elit nisi elementum"
306.60,581.40,557.42,590.25,"/F8",9.96,"sociosqu et congue. Quisque etiam ad. Feugiat nulla augue"
306.60,569.45,557.39,578.29,"/F8",9.96,"ante venenatis. Quisque metus nisi sagittis condimentum"
306.60,557.49,557.44,566.34,"/F8",9.96,"senectus eget pede hac justo nullam condimentum class"
306.60,545.54,557.44,554.38,"/F8",9.96,"mattis ad facilisi aliquet. Rhoncus magna diam dapibus"
306.60,533.58,557.41,542.43,"/F8",9.96,"penatibus. Egestas donec. Sodales netus at porttitor odio"
306.60,521.63,557.43,530.47,"/F8",9.96,"cum. Quisque neque odio. Integer dolor nulla hac fusce"
306.60,509.67,557.40,518.52,"/F8",9.96,"ante. Euismod etiam at porta ac tellus inceptos parturient"
306.60,497.72,332.42,506.56,"/F8",9.96,"sociis."
321.55,485.76,557.46,494.61,"/F8",9.96,"Dapibus magna adipiscing ullamcorper taciti ac leo"
306.60,473.81,557.45,482.65,"/F8",9.96,"condimentum. Lacinia porta est ante mus eget nonummy"
306.60,461.85,562.97,470.70,"/F8",9.96,"ve. Aliquet fusce. Nonummy lacus. Rhoncus porta pretium."
306.60,449.90,557.44,458.74,"/F8",9.96,"Lacinia felis dis praesent egestas lacus nunc lorem. In-"
306.60,437.94,557.44,446.79,"/F8",9.96,"teger purus donec. Rhoncus felis urna. Egestas lorem."
306.60,425.99,557.44,434.83,"/F8",9.96,"Feugiat dolor urna viverra eu malesuada a proin conubia."
306.60,414.03,557.42,422.88,"/F8",9.96,"Aliquam lacus quis facilisis tempus. Natoque augue nisl a"
306.60,402.08,557.42,410.92,"/F8",9.96,"nunc class. Vivamus dolor vestibulum orci proin. Natoque"
306.60,390.12,557.39,398.97,"/F8",9.96,"netus dis quam pulvinar elit senectus nibh sociosqu adip-"
306.60,378.17,557.40,387.01,"/F8",9.96,"iscing. Natoque augue vel. Rhoncus velit enim aliquet in."
306.60,366.21,557.43,375.06,"/F8",9.96,"Aliquet fames ut cursus et. Laoreet magna nulla habitasse"
306.60,354.25,557.44,363.10,"/F8",9.96,"sed iaculis. Egestas netus leo. Rhoncus curae odio var-"
306.60,342.30,557.39,351.15,"/F8",9.96,"ius et ante litora ligula. Integer justo. Egestas ipsum elit"
306.60,330.34,342.82,339.19,"/F8",9.96,"conubia."
306.60,301.95,500.91,310.80,"/F17",9.96,"3. Conubia class dis sodales morbi dis."
321.55,282.52,557.42,291.37,"/F8",9.96,"Natoque fusce vitae. Lacinia proin vestibulum sociosqu"
306.60,270.57,557.43,279.42,"/F8",9.96,"risus. Potenti augue elit ad mus mi bibendum sed. Cu-"
306.60,258.61,557.45,267.46,"/F8",9.96,"bilia proin dis dui vel. Aliquam etiam. Commodo au-"
306.60,246.66,557.41,255.51,"/F8",9.96,"gue et tellus elementum integer aenean hac iaculis nisl."
306.60,234.70,557.45,243.55,"/F8",9.96,"Blandit porta sem. Feugiat etiam ac augue et mi ut arcu"
306.60,222.75,557.40,231.59,"/F8",9.96,"placerat aliquam pellentesque. Nonummy nulla at primis."
306.60,210.79,557.41,219.64,"/F8",9.96,"Potenti augue per. Gravida augue. Cubilia vitae class vi-"
306.60,198.84,557.43,207.68,"/F8",9.96,"vamus nisi erat aliquam ve mus quam pellentesque ad non-"
306.60,186.88,557.36,195.73,"/F8",9.96,"ummy nisi. Gravida velit parturient. Feugiat justo elit dis"
306.60,174.93,557.44,183.77,"/F8",9.96,"nunc dolor elementum eget. Lacinia dolor mus. Blandit"
306.60,162.97,557.38,171.82,"/F8",9.96,"nulla parturient nascetur viverra vivamus. Natoque nulla."
306.60,151.02,557.50,159.86,"/F8",9.96,"Nonummy magna ut. Viverra magna et nisi ac magna et"
306.60,139.06,557.45,147.91,"/F8",9.96,"turpis. Rhoncus porta ac massa ve sit duis diam vitae"
306.60,127.11,557.41,135.95,"/F8",9.96,"urna quisque. Quisque metus per tellus aenean ve diam"
306.60,115.15,557.42,124.00,"/F8",9.96,"ac erat dignissim tellus parturient curae. Commodo purus"
306.60,103.20,538.58,112.04,"/F8",9.96,"hac erat porta magna cras habitant sed consectetuer."
321.55,91.24,561.00,100.09,"/F8",9.96,"Posuere netus nam pulvinar pellentesque. Aliquet fames"
306.60,79.29,557.43,88.13,"/F8",9.96,"ante a diam ut cras taciti cum nostra. Gravida lorem quis"
295.15,61.35,300.13,70.20,"/F8",9.96,"3"
