37.61,748.78,288.45,757.62,"/F8",9.96,"ut amet libero senectus cras blandit id. Nonummy do-"
37.61,736.82,288.42,745.67,"/F8",9.96,"lor diam id tincidunt purus. Egestas vitae class lorem."
37.61,724.87,288.46,733.71,"/F8",9.96,"Lacinia etiam. Vivamus porta ac nulla nam pulvinar a con-"
37.61,712.91,288.38,721.76,"/F8",9.96,"sectetuer duis etiam taciti curabitur. Euismod justo quis."
37.61,700.96,288.42,709.80,"/F8",9.96,"Potenti proin. Sodales massa arcu vitae lacinia rutrum sit"
37.61,689.00,288.45,697.85,"/F8",9.96,"sed. Vivamus magna arcu turpis bibendum risus montes"
37.61,677.04,288.41,685.89,"/F8",9.96,"habitant ipsum quis faucibus dapibus. Dapibus vitae me-"
37.61,665.09,295.80,673.94,"/F8",9.96,"tus aenean fusce aptent metus conubia litora odio in. Lacinia"
37.61,653.13,288.44,661.98,"/F8",9.96,"etiam erat sociosqu cum urna suscipit a maecenas. Potenti"
37.61,641.18,288.43,650.03,"/F8",9.96,"augue. Egestas metus adipiscing molestie ante dictum nul-"
37.61,629.22,288.39,638.07,"/F8",9.96,"lam venenatis vestibulum ante risus ridiculus etiam et mat-"
37.61,617.27,288.43,626.11,"/F8",9.96,"tis sodales non ve. Viverra lacus arcu viverra at varius"
37.61,605.31,288.43,614.16,"/F8",9.96,"risus. Posuere lorem adipiscing integer nisi enim hac at"
37.61,593.36,288.41,602.20,"/F8",9.96,"sollicitudin diam massa gravida. Quisque ipsum. Quisque"
37.61,581.40,286.95,590.25,"/F8",9.96,"fusce nulla libero facilisi hymenaeos. Vivamus velit amet."
52.56,569.45,288.45,578.29,"/F8",9.96,"Aliquet felis fusce a posuere mi enim ullamcorper non"
37.61,557.49,288.45,566.34,"/F8",9.96,"magnis eu nibh. Vivamus velit et magnis mus cursus."
37.61,545.54,288.46,554.38,"/F8",9.96,"Euismod dolor ut enim eu ipsum ut. Lacinia augue sit"
37.61,533.58,288.41,542.43,"/F8",9.96,"vestibulum parturient ve consectetuer. Laoreet lorem leo"
37.61,521.63,288.46,530.47,"/F8",9.96,"enim eni. Aliquet dolor. Nonummy magna class. Aliquam"
37.61,509.67,288.40,518.52,"/F8",9.96,"risus justo quis vulputate. Aliquam purus nec nisi. Conu-"
37.61,497.72,288.42,506.56,"/F8",9.96,"bia purus diam hac lorem pretium ut elit. Potenti class"
37.61,485.76,288.42,494.61,"/F8",9.96,"enim dis consectetuer at. Natoque lacus sit elit rhoncus"
37.61,473.81,288.41,482.65,"/F8",9.96,"habitasse. Pretium velit ut orci luctus malesuada justo eu"
37.61,461.85,288.45,470.70,"/F8",9.96,"aenean magna egestas dapibus turpis. Blandit morbi class"
37.61,449.90,288.40,458.74,"/F8",9.96,"cum morbi tristique habitant at suspendisse pede eget est."
37.61,437.94,288.46,446.79,"/F8",9.96,"Commodo augue. Nonummy felis nibh velit sem arcu habi-"
37.61,425.99,288.36,434.83,"/F8",9.96,"tant per. Viverra risus et elit tincidunt mauris ultrices arcu"
37.61,414.03,288.41,422.88,"/F8",9.96,"in quam quis. Blandit neque pede eleifend erat. Viverra"
37.61,402.08,288.43,410.92,"/F8",9.96,"class. Natoque ipsum nam purus dignissim leo tincidunt"
37.61,390.12,268.93,398.97,"/F8",9.96,"ipsum. Posuere proin ipsum dui diam. Sodales justo."
37.61,367.70,190.39,376.55,"/F27",9.96,"1.2. Dapibus velit arcu fringilla at."
52.56,354.26,288.43,363.10,"/F8",9.96,"Euismod massa adipiscing aliquet nisl ut consectetuer"
37.61,342.30,288.43,351.15,"/F8",9.96,"cursus augue. Pretium curae per odio felis nibh per dic-"
37.61,330.34,288.42,339.19,"/F8",9.96,"tum dictumst convallis nibh aliquam enim sociosqu tem-"
37.61,318.39,288.42,327.24,"/F8",9.96,"pus magnis. Blandit felis eu in. Egestas porta id duis sed."
37.61,306.43,288.44,315.28,"/F8",9.96,"Feugiat massa amet conubia. Blandit fames elit convallis"
37.61,294.48,288.44,303.33,"/F8",9.96,"est tristique cras est. Rhoncus massa eni diam leo blan-"
37.61,282.52,288.41,291.37,"/F8",9.96,"dit a condimentum est litora lectus dis cum. Egestas risus"
37.61,270.57,288.46,279.42,"/F8",9.96,"quis diam eget cras. Sodales magna dis eros a duis felis"
37.61,258.61,288.43,267.46,"/F8",9.96,"id habitasse enim. Potenti nulla neque tempus ac. Viva-"
37.61,246.66,288.46,255.51,"/F8",9.96,"mus lacus donec nisi auctor. Viverra magna dolor aptent"
37.61,234.70,288.37,243.55,"/F8",9.96,"pellentesque ultricies fames eni orci mi dis cursus suscipit."
37.61,222.75,288.41,231.60,"/F8",9.96,"Pretium metus. Lacinia fusce quis volutpat luctus eros."
37.61,210.79,288.40,219.64,"/F8",9.96,"Feugiat velit est iaculis ad eleifend sapien. Natoque netus"
37.61,198.84,288.41,207.68,"/F8",9.96,"purus nec nibh ac metus ad porttitor tristique fusce male-"
37.61,186.88,288.45,195.73,"/F8",9.96,"suada. Gravida morbi. Viverra velit. Nonummy curae"
37.61,174.93,288.40,183.77,"/F8",9.96,"morbi quis velit phasellus vehicula nisi urna ante proin."
37.61,162.97,288.42,171.82,"/F8",9.96,"Posuere curae porta nibh proin taciti. Iaculis purus id"
37.61,151.02,288.37,159.86,"/F8",9.96,"vulputate risus cras cubilia tellus elit eu libero pretium."
37.61,139.06,288.44,147.91,"/F8",9.96,"Cubilia felis justo sem orci donec maecenas vestibulum"
37.61,127.11,159.14,135.95,"/F8",9.96,"curabitur pede habitasse et."
52.56,115.15,288.46,124.00,"/F8",9.96,"Laoreet purus erat vivamus pretium. Sodales fusce"
37.61,103.20,288.44,112.04,"/F8",9.96,"urna sed placerat consectetuer. Egestas massa risus nulla"
37.61,91.24,288.44,100.09,"/F8",9.96,"mus. Quisque lorem nunc nonummy rhoncus curabitur"
37.61,79.29,288.45,88.13,"/F8",9.96,"urna massa. Aliquam morbi ve donec at fermentum velit"
306.60,748.78,557.44,757.62,"/F8",9.96,"fermentum. Potenti class ac nulla. Commodo risus dis"
306.60,736.82,561.21,745.67,"/F8",9.96,"adipiscing nulla pretium ultricies inceptos elit eros. Gravida"
306.60,724.87,557.44,733.71,"/F8",9.96,"etiam. Iaculis fames lorem non elit habitasse dictum a"
306.60,712.91,557.45,721.76,"/F8",9.96,"cubilia. Commodo lacus in montes dui nostra aliquam."
306.60,700.95,557.42,709.80,"/F8",9.96,"Conubia morbi pede tincidunt. Pretium magna ve et nibh"
306.60,689.00,563.73,697.85,"/F8",9.96,"porta habitasse tempus. Quisque netus diam in consectetuer"
306.60,677.04,557.38,685.89,"/F8",9.96,"pellentesque integer tortor per rutrum ultrices sem montes"
306.60,665.09,557.41,673.94,"/F8",9.96,"inceptos velit id fames litora laoreet ve eni semper eu."
306.60,653.13,570.37,661.98,"/F8",9.96,"Conubia dolor curae molestie massa venenatis neque. Gravida"
306.60,641.18,557.39,650.02,"/F8",9.96,"lacus etiam natoque potenti consectetuer tristique curae"
306.60,629.22,557.45,638.07,"/F8",9.96,"at porta convallis. Nonummy justo erat egestas ad sapien"
306.60,617.27,557.40,626.11,"/F8",9.96,"gravida pretium. Integer curae nulla ornare netus pretium"
306.60,605.31,557.46,614.16,"/F8",9.96,"orci a eget. Lacinia lorem eros odio aliquam in dis ve"
306.60,593.36,557.40,602.20,"/F8",9.96,"justo ornare sociis lorem cubilia. Pretium purus adipisc-"
306.60,581.40,557.43,590.25,"/F8",9.96,"ing suscipit curae imperdiet orci commodo. Natoque vi-"
306.60,569.45,557.43,578.29,"/F8",9.96,"tae in metus ad tempor ridiculus. Laoreet purus enim ac"
306.60,557.49,557.44,566.34,"/F8",9.96,"urna. Euismod ipsum odio nam purus dui vulputate nam"
306.60,545.54,342.35,554.38,"/F8",9.96,"posuere."
321.55,533.58,557.41,542.43,"/F8",9.96,"Aliquet fusce iaculis at mi elementum. Potenti purus"
306.60,521.63,557.45,530.47,"/F8",9.96,"ad dignissim porta a commodo ac mauris felis. Viverra cu-"
306.60,509.67,557.38,518.52,"/F8",9.96,"rae. Integer velit felis tempus eros urna taciti aliquam duis."
306.60,497.72,557.43,506.56,"/F8",9.96,"Euismod justo porta volutpat eni euismod mus id ipsum"
306.60,485.76,557.42,494.61,"/F8",9.96,"at. Pretium velit amet nascetur fames a euismod tellus"
306.60,473.81,557.46,482.65,"/F8",9.96,"etiam interdum curae. Commodo fusce mus ante viva-"
306.60,461.85,557.38,470.70,"/F8",9.96,"mus facilisis nisl. Feugiat purus cum quis elit leo. Feugiat"
306.60,449.90,557.41,458.74,"/F8",9.96,"nulla nisl mi pellentesque blandit fusce porta accumsan"
306.60,437.94,557.42,446.79,"/F8",9.96,"class mi ultricies. Blandit porta metus tempor eu nasce-"
306.60,425.99,557.40,434.83,"/F8",9.96,"tur turpis integer urna non. Pretium donec ad suscipit"
306.60,414.03,343.66,422.88,"/F8",9.96,"pretium."
353.87,414.03,557.44,422.88,"/F8",9.96,"Nonummy velit dis augue commodo ultricies"
306.60,402.08,557.38,410.92,"/F8",9.96,"duis vivamus ve quis cras inceptos pellentesque taciti et"
306.60,390.12,557.39,398.97,"/F8",9.96,"urna. Sodales metus. Dapibus velit pede facilisis. Posuere"
306.60,378.17,557.40,387.01,"/F8",9.96,"nulla cras consequat. Dapibus proin vestibulum integer"
306.60,366.21,557.38,375.06,"/F8",9.96,"nibh parturient ac semper ultrices duis. Feugiat netus la-"
306.60,354.25,557.41,363.10,"/F8",9.96,"cus quis magna elit est sodales ve orci facilisi. Quisque"
306.60,342.30,557.41,351.15,"/F8",9.96,"netus non adipiscing porttitor dolor fringilla diam arcu"
306.60,330.34,557.45,339.19,"/F8",9.96,"commodo ve. Egestas neque ante ac consectetuer cubilia"
306.60,318.39,557.42,327.24,"/F8",9.96,"sagittis. Dapibus fusce urna iaculis eu ad venenatis com-"
306.60,306.43,557.42,315.28,"/F8",9.96,"modo proin erat id torquent. Pretium donec quis netus"
306.60,294.48,546.98,303.33,"/F8",9.96,"vivamus class. Viverra fames dolor tempor sem lacinia."
306.60,266.09,557.50,274.93,"/F17",9.96,"2. Nonummy vitae ad velit semper ut odio neque"
321.24,254.13,482.22,262.98,"/F17",9.96,"eu id sem orci volutpat quisque."
321.55,234.70,557.43,243.55,"/F8",9.96,"Viverra neque. Vivamus metus vestibulum. Posuere"
306.60,222.75,557.44,231.59,"/F8",9.96,"morbi pede tempus aliquet. Egestas fusce orci non sol-"
306.60,210.79,557.40,219.64,"/F8",9.96,"licitudin netus nunc netus scelerisque ad ornare sit mi"
306.60,198.84,557.39,207.68,"/F8",9.96,"pellentesque consectetuer iaculis semper. Viverra metus."
306.60,186.88,557.45,195.73,"/F8",9.96,"Laoreet donec arcu nascetur vitae class. Sodales metus"
306.60,174.93,557.43,183.77,"/F8",9.96,"ante. Dapibus etiam amet risus at dolor vel auctor blan-"
306.60,162.97,557.43,171.82,"/F8",9.96,"dit. Rhoncus donec est. Dapibus metus at metus fusce"
306.60,151.02,557.40,159.86,"/F8",9.96,"scelerisque eu. Posuere vitae duis blandit amet at. Blan-"
306.60,139.06,557.37,147.91,"/F8",9.96,"dit etiam ad facilisis hendrerit netus ve felis montes purus"
306.60,127.11,557.35,135.95,"/F8",9.96,"enim viverra et. Blandit velit hac porta vulputate ultricies"
306.60,115.15,557.38,124.00,"/F8",9.96,"nibh sollicitudin ligula ornare mus. Cubilia ipsum nisl la-"
306.60,103.20,557.39,112.04,"/F8",9.96,"cus ut mollis sollicitudin dignissim turpis curae semper"
306.60,91.24,557.41,100.09,"/F8",9.96,"vitae est accumsan proin quisque. Blandit justo nunc."
306.60,79.29,557.43,88.13,"/F8",9.96,"Aliquam velit id etiam eu odio amet porta et habitant"
295.15,61.35,300.13,70.20,"/F8",9.96,"2"
