557.11,803.82,562.09,812.67,"/F8",9.96,"3"
54.00,777.92,298.82,786.77,"/F8",9.96,"porta. Viverra porta ante neque ridiculus odio lacinia ve."
54.00,765.96,298.83,774.81,"/F8",9.96,"Integer etiam id urna. Cubilia class nec. Quisque vitae"
54.00,754.01,298.86,762.86,"/F8",9.96,"quam pharetra augue a ante. Feugiat dolor erat. Feugiat"
54.00,742.05,298.84,750.90,"/F8",9.96,"lorem cras laoreet duis et erat donec consequat interdum."
54.00,730.10,298.83,738.95,"/F8",9.96,"Lacinia justo nisl. Natoque lacus cras placerat velit nibh"
54.00,718.14,298.86,726.99,"/F8",9.96,"luctus. Iaculis purus eget senectus nonummy euismod"
54.00,706.19,298.86,715.03,"/F8",9.96,"hymenaeos cursus. Lacinia etiam dolor mollis. Dapibus"
54.00,694.23,81.17,703.08,"/F8",9.96,"purus."
63.96,681.98,298.83,690.82,"/F8",9.96,"Cubilia neque odio eleifend laoreet viverra. Pretium"
54.00,670.02,225.66,678.87,"/F8",9.96,"ipsum non blandit magna dolor nam."
235.81,670.02,298.90,678.87,"/F8",9.96,"Sodales morbi"
54.00,658.07,215.11,666.91,"/F8",9.96,"netus nullam sit sagittis venenatis."
227.17,658.07,298.86,666.91,"/F8",9.96,"Aliquam magna"
54.00,646.11,298.85,654.96,"/F8",9.96,"ac auctor vulputate natoque netus eros aptent. Euis-"
54.00,634.16,298.84,643.00,"/F8",9.96,"mod netus nonummy rhoncus aptent in facilisi. Dapibus"
54.00,622.20,298.82,631.05,"/F8",9.96,"class nisl cum lacinia et sit scelerisque potenti sed conse-"
54.00,610.25,298.81,619.09,"/F8",9.96,"quat viverra sapien. Dapibus metus velit porta senectus"
54.00,598.29,298.86,607.14,"/F8",9.96,"donec. Sodales dolor ad curae at mauris sit adipiscing."
54.00,586.34,298.86,595.18,"/F8",9.96,"Natoque risus dui augue fames quis natoque ac praesent."
54.00,574.38,298.83,583.23,"/F8",9.96,"Aliquet class lorem facilisi cras est tempus enim. Conubia"
54.00,562.43,298.86,571.27,"/F8",9.96,"morbi fusce lacinia sit. Dapibus ipsum sem nunc massa"
54.00,550.47,298.85,559.32,"/F8",9.96,"et consequat. Rhoncus velit non etiam class eros biben-"
54.00,538.52,298.85,547.36,"/F8",9.96,"dum velit arcu. Rhoncus massa eros imperdiet mollis et"
54.00,526.56,298.84,535.41,"/F8",9.96,"tristique augue senectus ut massa suspendisse. Aliquam"
54.00,514.60,298.87,523.45,"/F8",9.96,"neque curae sociis. Feugiat augue neque nam. Lacinia"
54.00,502.65,298.86,511.50,"/F8",9.96,"nulla erat. Feugiat fames augue cras integer et mollis"
54.00,490.69,298.86,499.54,"/F8",9.96,"at nibh dictumst suscipit. Commodo magna felis sagit-"
54.00,478.74,298.83,487.59,"/F8",9.96,"tis erat nostra placerat parturient sociis molestie conu-"
54.00,466.78,298.82,475.63,"/F8",9.96,"bia aptent porta tincidunt accumsan turpis nisi. Lacinia"
54.00,454.83,298.86,463.67,"/F8",9.96,"curae pede rutrum magnis fusce ullamcorper eu mattis"
54.00,442.87,298.88,451.72,"/F8",9.96,"habitant. Integer morbi massa per quis. Commodo dolor"
54.00,430.92,298.83,439.76,"/F8",9.96,"natoque vulputate ligula praesent ante ornare elementum"
54.00,418.96,75.54,427.81,"/F8",9.96,"velit."
63.96,406.71,298.83,415.55,"/F8",9.96,"Pretium porta dui adipiscing mattis at felis condimen-"
54.00,394.75,298.84,403.60,"/F8",9.96,"tum. Nonummy dolor elit. Gravida netus ipsum sapien."
54.00,382.80,298.88,391.64,"/F8",9.96,"Rhoncus metus ad fusce sociosqu lorem libero sapien"
54.00,370.84,298.87,379.69,"/F8",9.96,"donec. Conubia curae eu. Iaculis fusce amet convallis"
54.00,358.89,298.82,367.73,"/F8",9.96,"ve tellus ultrices. Vivamus morbi. Blandit massa. Euis-"
54.00,346.93,298.83,355.78,"/F8",9.96,"mod ipsum viverra potenti ligula convallis tempor etiam"
54.00,334.98,298.89,343.82,"/F8",9.96,"accumsan fames ad risus et class. Lacinia nulla erat a"
54.00,323.02,298.85,331.87,"/F8",9.96,"purus. Potenti lacus eget sodales mollis dis congue conse-"
54.00,311.07,298.81,319.91,"/F8",9.96,"quat euismod sit dictumst consectetuer feugiat curabitur"
54.00,299.11,298.85,307.96,"/F8",9.96,"ac. Conubia lacus quis magnis ultricies fermentum pede"
54.00,287.16,298.87,296.00,"/F8",9.96,"consequat. Viverra curae. Potenti massa. Sodales au-"
54.00,275.20,298.87,284.05,"/F8",9.96,"gue ve ante justo scelerisque diam semper hac posuere"
54.00,263.24,298.86,272.09,"/F8",9.96,"ad fringilla. Nonummy justo curae porta nostra phasel-"
54.00,251.29,298.85,260.14,"/F8",9.96,"lus dolor ad tristique. Laoreet netus. Posuere massa eu"
54.00,239.33,298.83,248.18,"/F8",9.96,"purus dis quam porta metus. Feugiat fusce duis volutpat"
54.00,227.38,298.89,236.23,"/F8",9.96,"commodo eros. Lacinia fusce. Feugiat porta. Sodales"
54.00,215.42,176.71,224.27,"/F8",9.96,"morbi cras a netus euismod."
128.74,180.88,224.28,188.84,"/F19",8.97,"Conubia morbi ante."
63.96,154.26,298.90,163.11,"/F8",9.96,"Conubia magna. Feugiat donec ve a lectus. Sodales"
54.00,142.30,298.83,151.15,"/F8",9.96,"vitae metus lectus facilisi enim eget eros volutpat. Non-"
54.00,130.35,298.81,139.19,"/F8",9.96,"ummy velit risus sit adipiscing. Iaculis justo neque nul-"
54.00,118.39,298.89,127.24,"/F8",9.96,"lam habitant quam erat augue. Sodales dolor conubia"
317.01,777.92,561.85,786.77,"/F8",9.96,"felis et a tempor. Feugiat morbi potenti metus laoreet"
317.01,765.96,561.81,774.81,"/F8",9.96,"libero primis per nisl ligula. Laoreet justo. Blandit velit"
317.01,754.01,561.84,762.86,"/F8",9.96,"vestibulum et bibendum metus mi nunc sapien ut. Eges-"
317.01,742.05,561.89,750.90,"/F8",9.96,"tas massa mi sollicitudin pede. Nonummy fames dolor"
317.01,730.10,350.18,738.94,"/F8",9.96,"dictum."
360.48,730.10,525.28,738.94,"/F8",9.96,"Quisque curae justo purus habitant."
535.59,730.10,561.86,738.94,"/F8",9.96,"Conu-"
317.01,718.14,561.83,726.99,"/F8",9.96,"bia justo dui cras in purus consectetuer torquent risus."
317.01,706.19,561.84,715.03,"/F8",9.96,"Pretium justo. Viverra ipsum nunc. Dapibus justo. So-"
317.01,694.23,561.88,703.08,"/F8",9.96,"dales metus augue mus erat morbi donec proin. Aliquam"
317.01,682.28,561.85,691.12,"/F8",9.96,"morbi cum vivamus nam ut sociis. Sodales velit. Gravida"
317.01,670.32,561.83,679.17,"/F8",9.96,"neque ad primis. Euismod fusce vestibulum suspendisse."
317.01,658.37,486.65,667.21,"/F8",9.96,"Aliquet fames nisl vivamus eu conubia."
326.98,645.93,561.87,654.78,"/F8",9.96,"Nonummy metus nunc malesuada ridiculus parturient"
317.01,633.98,561.84,642.82,"/F8",9.96,"sit adipiscing parturient ve ultricies a. Nonummy fames"
317.01,622.02,561.87,630.87,"/F8",9.96,"enim dolor interdum. Aliquam fusce massa felis accum-"
317.01,610.07,561.85,618.91,"/F8",9.96,"san curae ac. Dapibus curae nisi tortor mi ultrices tem-"
317.01,598.11,561.85,606.96,"/F8",9.96,"pus. Euismod ipsum proin purus ante. Potenti vitae"
317.01,586.16,561.92,595.00,"/F8",9.96,"proin commodo quisque aenean. Commodo morbi vel"
317.01,574.20,561.88,583.05,"/F8",9.96,"sodales a suspendisse dis ac pellentesque semper. Na-"
317.01,562.24,561.86,571.09,"/F8",9.96,"toque felis. Laoreet etiam. Nonummy purus ut mattis."
317.01,550.29,561.86,559.14,"/F8",9.96,"Dapibus fames. Dapibus augue dolor sociis pretium rhon-"
317.01,538.33,561.84,547.18,"/F8",9.96,"cus turpis cras condimentum blandit dui. Conubia fusce"
317.01,526.38,561.85,535.23,"/F8",9.96,"id cras molestie rhoncus semper ac pulvinar rutrum tem-"
317.01,514.42,561.87,523.27,"/F8",9.96,"pus. Quisque metus. Laoreet justo ve metus ad etiam"
317.01,502.47,561.85,511.32,"/F8",9.96,"habitant vestibulum platea maecenas dignissim. Laoreet"
317.01,490.51,561.86,499.36,"/F8",9.96,"augue parturient torquent eget ornare commodo quisque"
317.01,478.56,561.83,487.41,"/F8",9.96,"donec urna. Dapibus curae pede mollis ridiculus eleifend"
317.01,466.60,561.85,475.45,"/F8",9.96,"lobortis et morbi dui eros. Cubilia augue. Laoreet purus"
317.01,454.65,561.91,463.49,"/F8",9.96,"nonummy proin. Commodo fames mi. Potenti magna."
317.01,442.69,431.29,451.54,"/F8",9.96,"Commodo morbi ve dolor."
326.98,430.26,561.84,439.10,"/F8",9.96,"Posuere curae id tortor sem tortor eleifend scelerisque"
317.01,418.30,561.87,427.15,"/F8",9.96,"dui sociis platea. Lacinia augue risus. Viverra netus"
317.01,406.35,561.85,415.19,"/F8",9.96,"in diam porttitor fringilla adipiscing euismod diam com-"
317.01,394.39,561.88,403.24,"/F8",9.96,"modo. Lacinia nulla id montes phasellus gravida luc-"
317.01,382.44,561.81,391.28,"/F8",9.96,"tus nisl quis parturient ridiculus urna consectetuer mag-"
317.01,370.48,561.88,379.33,"/F8",9.96,"nis. Commodo metus duis ve consectetuer enim conubia"
317.01,358.53,561.84,367.37,"/F8",9.96,"arcu quis auctor. Cubilia curae. Integer vitae elit dis a"
317.01,346.57,561.86,355.42,"/F8",9.96,"tempor urna aliquam. Aliquam morbi potenti. Dapibus"
317.01,334.62,561.84,343.46,"/F8",9.96,"class neque sem neque laoreet ultricies mollis. Feugiat"
317.01,322.66,561.88,331.51,"/F8",9.96,"augue nam erat interdum curae proin donec nulla tem-"
317.01,310.71,561.85,319.55,"/F8",9.96,"por. Blandit lorem dis auctor primis metus et nostra."
317.01,298.75,561.87,307.60,"/F8",9.96,"Lacinia justo ipsum nam nisl mi. Iaculis netus ac donec"
317.01,286.80,561.85,295.64,"/F8",9.96,"taciti. Conubia curae pede non. Quisque ipsum porta nec"
317.01,274.84,561.87,283.69,"/F8",9.96,"quam erat urna per massa. Quisque velit ac nunc donec"
317.01,262.88,561.89,271.73,"/F8",9.96,"vitae a commodo. Cubilia porta sem phasellus curae."
317.01,250.93,561.83,259.78,"/F8",9.96,"Sodales felis adipiscing lobortis aliquet posuere elemen-"
317.01,238.97,561.87,247.82,"/F8",9.96,"tum sociosqu. Aliquam velit nonummy. Potenti massa"
317.01,227.02,561.86,235.87,"/F8",9.96,"lorem sem eget facilisis tempus elementum suscipit mo-"
317.01,215.06,561.81,223.91,"/F8",9.96,"lestie risus in. Iaculis curae ipsum scelerisque nisl lectus"
317.01,203.11,501.83,211.95,"/F8",9.96,"at per nisl nibh posuere ad. Rhoncus felis."
320.19,167.61,558.75,175.57,"/F19",8.97,"Integer dolor vel lorem non lacus justo quis viverra"
407.86,157.15,471.19,165.11,"/F19",8.97,"ultricies nam."
326.98,130.35,561.89,139.19,"/F8",9.96,"Commodo curae. Pretium vitae egestas eros nunc class"
317.01,118.39,561.79,127.24,"/F8",9.96,"vivamus tristique orci pellentesque mauris. Blandit velit."
