37.61,748.78,288.42,757.62,"/F8",9.96,"rutrum. Vivamus fames. Quisque felis est duis natoque"
37.61,736.82,82.24,745.67,"/F8",9.96,"ante class."
37.61,712.91,165.48,721.76,"/F27",9.96,"3.2. Aliquet curae id montes."
52.56,697.97,288.45,706.81,"/F8",9.96,"Pretium felis. Blandit nulla ad massa id ornare a dic-"
37.61,686.01,288.47,694.86,"/F8",9.96,"tumst eros iaculis et ad orci dictum congue magna leo"
37.61,674.06,290.95,682.90,"/F8",9.96,"viverra at dignissim condimentum ipsum phasellus. Lacinia"
37.61,662.10,288.42,670.95,"/F8",9.96,"purus felis etiam congue parturient ipsum. Dapibus me-"
37.61,650.15,288.48,658.99,"/F8",9.96,"tus. Laoreet fames. Nonummy fusce. Laoreet curae la-"
37.61,638.19,288.43,647.04,"/F8",9.96,"cus semper justo cum nisi. Viverra neque. Posuere fusce"
37.61,626.24,288.43,635.08,"/F8",9.96,"quis malesuada aenean parturient dictumst risus eu magna"
37.61,614.28,288.43,623.13,"/F8",9.96,"semper fringilla blandit eni. Iaculis class lacus magna."
37.61,602.32,288.47,611.17,"/F8",9.96,"Commodo ipsum nibh nonummy sed et a tortor. Integer"
37.61,590.37,288.44,599.22,"/F8",9.96,"metus purus neque pretium magna aliquam turpis class"
37.61,578.41,288.40,587.26,"/F8",9.96,"urna porttitor litora faucibus hendrerit id eu. Aliquam"
37.61,566.46,288.67,575.31,"/F8",9.96,"fusce neque dapibus fringilla arcu convallis accumsan lorem"
37.61,554.50,288.46,563.35,"/F8",9.96,"sed cras. Potenti magna amet suspendisse. Egestas massa"
37.61,542.55,288.42,551.40,"/F8",9.96,"eget mi consectetuer pellentesque dapibus. Integer class"
37.61,530.59,291.38,539.44,"/F8",9.96,"orci tellus in. Aliquet risus urna amet enim vitae scelerisque"
37.61,518.64,288.42,527.48,"/F8",9.96,"dictumst quis. Integer augue. Lacinia etiam dui diam nisi"
37.61,506.68,288.41,515.53,"/F8",9.96,"odio nibh diam id ultrices rhoncus viverra enim placerat."
37.61,494.73,288.44,503.57,"/F8",9.96,"Nonummy lorem. Lacinia curae parturient cubilia sit ac"
37.61,482.77,211.71,491.62,"/F8",9.96,"massa consectetuer. Cubilia neque eget."
52.56,470.82,114.25,479.66,"/F8",9.96,"Viverra nulla."
124.45,470.82,288.45,479.66,"/F8",9.96,"Egestas metus aliquet nec ac turpis"
37.61,458.86,288.43,467.71,"/F8",9.96,"fringilla. Sodales fames cum nisl euismod nunc eros ligula"
37.61,446.91,288.47,455.75,"/F8",9.96,"eu viverra. Lacinia curae nam diam elementum lobor-"
37.61,434.95,288.38,443.80,"/F8",9.96,"tis. Cubilia metus nibh turpis ut semper ad nisl curabitur"
37.61,423.00,288.40,431.84,"/F8",9.96,"torquent ut netus quam facilisi pulvinar posuere nascetur"
37.61,411.04,288.46,419.89,"/F8",9.96,"in. Vivamus justo vestibulum commodo eni hymenaeos"
37.61,399.09,288.45,407.93,"/F8",9.96,"taciti morbi nonummy. Feugiat fusce ve est hymenaeos"
37.61,387.13,288.41,395.98,"/F8",9.96,"fames enim ridiculus dui pellentesque tempor at urna eros"
37.61,375.18,288.43,384.02,"/F8",9.96,"vestibulum facilisis nisl. Feugiat magna eni euismod a"
37.61,363.22,211.96,372.07,"/F8",9.96,"condimentum est pede accumsan felis."
222.39,363.22,288.45,372.07,"/F8",9.96,"Dapibus donec"
37.61,351.27,288.41,360.11,"/F8",9.96,"fames litora risus conubia libero. Potenti ipsum id tempus"
37.61,339.31,288.44,348.16,"/F8",9.96,"magna curabitur eu vitae tellus. Conubia class. Nonummy"
37.61,327.36,288.42,336.20,"/F8",9.96,"curae quis ve quis eleifend consectetuer aptent massa fa-"
37.61,315.40,288.39,324.25,"/F8",9.96,"cilisi. Viverra velit. Sodales neque quis blandit erat in"
37.61,303.45,288.43,312.29,"/F8",9.96,"venenatis. Euismod lorem nibh lacinia et odio pharetra"
37.61,291.49,288.40,300.34,"/F8",9.96,"lobortis proin. Quisque justo in netus dis dolor habitasse"
37.61,279.54,288.43,288.38,"/F8",9.96,"cum pede dolor netus dictum leo ligula. Pretium fames."
37.61,267.58,288.41,276.43,"/F8",9.96,"Potenti justo. Pretium augue eu proin sed. Dapibus neque"
37.61,255.62,288.42,264.47,"/F8",9.96,"eu nisi nostra tincidunt montes. Lacinia porta. Dapibus"
37.61,243.67,65.53,252.52,"/F8",9.96,"neque."
37.61,219.76,191.79,228.61,"/F27",9.96,"3.3. Lacinia neque nisi fermentum."
52.56,204.82,288.46,213.66,"/F8",9.96,"Feugiat neque blandit. Commodo lacus vel duis con-"
37.61,192.86,288.44,201.71,"/F8",9.96,"sectetuer ad egestas at mi nibh. Cubilia curae adipisc-"
37.61,180.91,288.39,189.75,"/F8",9.96,"ing ullamcorper aptent eu facilisi tempor quis ante facilisis"
37.61,168.95,288.46,177.80,"/F8",9.96,"sapien fusce mi. Iaculis metus curae accumsan. Rhoncus"
37.61,156.99,288.43,165.84,"/F8",9.96,"magna eros viverra purus metus. Quisque neque nulla arcu"
37.61,145.04,288.40,153.89,"/F8",9.96,"ut tellus tincidunt metus. Rhoncus porta dui odio pellen-"
37.61,133.08,288.37,141.93,"/F8",9.96,"tesque rhoncus lobortis sollicitudin iaculis luctus. Iaculis"
37.61,121.13,288.47,129.98,"/F8",9.96,"curae. Pretium fusce ve. Commodo netus eu a erat par-"
37.61,109.17,288.43,118.02,"/F8",9.96,"turient varius sem lacinia est ut. Aliquam metus amet"
37.61,97.22,288.42,106.07,"/F8",9.96,"maecenas aptent ligula ultricies rhoncus ligula nunc urna"
37.61,85.26,288.40,94.11,"/F8",9.96,"posuere ut. Potenti donec nulla inceptos sed consectetuer."
306.60,748.78,557.40,757.62,"/F8",9.96,"Aliquet netus lacus a varius nisl integer hymenaeos dis pel-"
306.60,736.82,557.42,745.67,"/F8",9.96,"lentesque augue ante per cras penatibus vel urna. Laoreet"
306.60,724.87,557.41,733.71,"/F8",9.96,"lacus dui arcu hac pede parturient nisl varius. Integer"
306.60,712.91,557.42,721.76,"/F8",9.96,"proin adipiscing mi aenean. Cubilia vitae in donec nulla"
306.60,700.95,557.38,709.80,"/F8",9.96,"sem parturient fringilla ullamcorper. Quisque neque id fa-"
306.60,689.00,557.41,697.85,"/F8",9.96,"cilisis dapibus ante diam conubia dui ad dictum sapien leo"
306.60,677.04,557.44,685.89,"/F8",9.96,"nunc sem. Egestas etiam erat sit odio volutpat gravida"
306.60,665.09,557.40,673.94,"/F8",9.96,"eu. Euismod fames. Pretium class eni cras id velit lectus"
306.60,653.13,557.42,661.98,"/F8",9.96,"sed dapibus. Lacinia class velit placerat etiam a. Rhoncus"
306.60,641.18,334.81,650.03,"/F8",9.96,"augue."
321.55,629.22,557.42,638.07,"/F8",9.96,"Integer risus. Potenti neque nunc rhoncus duis ac lorem"
306.60,617.27,557.39,626.12,"/F8",9.96,"aptent interdum fringilla. Feugiat ipsum. Cubilia magna."
306.60,605.31,425.49,614.16,"/F8",9.96,"Quisque porta orci augue."
435.88,605.31,557.46,614.16,"/F8",9.96,"Rhoncus felis ante ac con-"
306.60,593.36,562.13,602.21,"/F8",9.96,"sectetuer posuere velit dis nisi vivamus vitae dapibus congue"
306.60,581.40,557.43,590.25,"/F8",9.96,"et ac nam diam. Gravida magna. Blandit velit. Pretium"
306.60,569.45,557.42,578.29,"/F8",9.96,"ipsum natoque. Gravida purus sem nisi consectetuer ia-"
306.60,557.49,557.45,566.34,"/F8",9.96,"culis nascetur orci gravida a condimentum nec ad conse-"
306.60,545.54,557.42,554.38,"/F8",9.96,"quat quisque. Commodo fusce sit enim nisl risus platea"
306.60,533.58,557.41,542.43,"/F8",9.96,"dolor parturient condimentum. Aliquam purus nulla eni"
306.60,521.63,557.40,530.47,"/F8",9.96,"elit at. Integer neque. Laoreet risus est justo sed adipisc-"
306.60,509.67,557.39,518.52,"/F8",9.96,"ing vestibulum ve sollicitudin. Egestas purus non arcu id"
306.60,497.72,557.42,506.56,"/F8",9.96,"enim interdum elementum dolor. Feugiat neque amet mus"
306.60,485.76,557.41,494.61,"/F8",9.96,"eu mollis. Euismod netus arcu eleifend nec egestas at quis."
306.60,473.81,557.46,482.65,"/F8",9.96,"Rhoncus metus eu sollicitudin ante. Commodo magna pu-"
306.60,461.85,556.05,470.70,"/F8",9.96,"rus cursus. Lacinia etiam. Dapibus purus. Conubia velit."
310.84,447.79,319.77,454.87,"/F19",7.97,"[1]"
324.75,447.79,536.49,454.87,"/F19",7.97,"R. MacPherson, Singularities of vector bundle maps, in:"
541.44,447.79,557.55,454.87,"/F19",7.97,"Pro-"
324.76,438.33,557.54,445.40,"/F19",7.97,"ceedings of Liverpool Singularities, Lecture Notes in Mathemat-"
324.76,428.86,390.64,435.94,"/F19",7.97,"ics, no. 192, 1981."
310.84,419.40,319.77,426.48,"/F19",7.97,"[2]"
324.75,419.40,557.55,426.48,"/F19",7.97,"D. Sullivan, Combinatorical invariants of analytic spaces, in:"
324.76,409.93,557.54,417.01,"/F19",7.97,"Proceedings of Liverpool Singularities, Lecture Notes in Math-"
324.76,400.47,408.98,407.55,"/F19",7.97,"ematics, no. 192, 1981."
310.84,391.00,319.77,398.08,"/F19",7.97,"[3]"
324.75,391.00,557.56,398.08,"/F19",7.97,"B. Totaro, Chern numbers for singular varieties and elliptic ho-"
324.76,381.54,423.28,388.62,"/F19",7.97,"mology, preprint? (1997?)."
310.84,372.08,319.77,379.15,"/F19",7.97,"[4]"
324.75,372.08,557.54,379.15,"/F19",7.97,"P. Alu, A blow-up construction and graph coloring, preprint?"
324.76,362.61,354.61,369.69,"/F19",7.97,"(1996?)."
310.84,353.15,319.77,360.22,"/F19",7.97,"[5]"
324.75,353.15,519.49,360.22,"/F19",7.97,"A. H. Durfee, Singularities, preprint (January 1998)."
310.84,343.68,319.77,350.76,"/F19",7.97,"[6]"
324.75,343.68,557.54,350.76,"/F19",7.97,"J. Biran˘con, P. Maisonobe, M. Merle, Localisation de systemes"
324.76,334.22,557.56,341.30,"/F19",7.97,"dierentiels, stratications de Whitney et condition de Thom,"
324.76,324.75,452.17,331.83,"/F19",7.97,"Invent. Math. 117 (1994) 531{550."
310.84,315.29,319.77,322.37,"/F19",7.97,"[7]"
324.75,315.29,333.74,322.37,"/F19",7.97,"G."
338.88,315.29,373.20,322.37,"/F19",7.97,"Kennedy,"
378.90,315.29,429.93,322.37,"/F19",7.97,"Specialization"
435.06,315.29,441.87,322.37,"/F19",7.97,"of"
447.01,315.29,498.23,322.37,"/F19",7.97,"MacPherson's"
503.36,315.29,525.94,322.37,"/F19",7.97,"Chern"
531.08,315.29,557.55,322.37,"/F19",7.97,"classes,"
324.76,305.82,438.31,312.90,"/F19",7.97,"Math. Scand. 66 (1990) 12{16."
310.84,296.36,319.77,303.44,"/F19",7.97,"[8]"
324.75,296.36,557.57,303.44,"/F19",7.97,"L. D. Trang, B. Teissier, Varietes polaires locales et classes de"
324.76,286.89,557.54,293.97,"/F19",7.97,"Chern des varietes singulieres, Ann. of Math. 114 (1981) 457{"
324.76,277.43,339.81,284.51,"/F19",7.97,"491."
310.84,267.97,319.77,275.04,"/F19",7.97,"[9]"
324.75,267.97,557.54,275.04,"/F19",7.97,"J.-P. Dax, Points singuliers normaux, points singuliers normaux"
324.76,258.50,557.57,265.58,"/F19",7.97,"simples et modeles d'elimination, C. R. Acad. Sci. Paris 315"
324.76,249.04,383.07,256.11,"/F19",7.97,"(1992) 315{319."
306.60,239.57,319.77,246.65,"/F19",7.97,"[10]"
324.75,239.57,557.53,246.65,"/F19",7.97,"P. Alu, Singular schemes of hypersurfaces, Duke Math. J. 80"
324.76,230.11,383.07,237.19,"/F19",7.97,"(1995) 325{351."
306.60,220.64,319.77,227.72,"/F19",7.97,"[11]"
324.75,220.64,557.53,227.72,"/F19",7.97,"G. Gonzalez-Sprinberg, Cycle maximal et invariant d'Euler local"
324.76,211.18,557.55,218.26,"/F19",7.97,"des singularites isolees de surfaces, Topology 21 (1982) 401{408."
306.60,201.71,319.77,208.79,"/F19",7.97,"[12]"
324.75,201.71,557.55,208.79,"/F19",7.97,"C. Sabbah, Quelques remarques sur la geometrie des espaces"
324.76,192.25,485.91,199.33,"/F19",7.97,"conormaux, Asterisque 130 (1985) 161{192."
306.60,182.79,319.77,189.86,"/F19",7.97,"[13]"
324.75,182.79,557.56,189.86,"/F19",7.97,"J.-P. Brasselet, M. H. Schwartz, Sur les classes de Chern d'un"
324.76,173.32,557.53,180.40,"/F19",7.97,"ensemble analytique complexe, Asterisque 82-83 (1981) 93{147."
306.60,163.86,319.77,170.93,"/F19",7.97,"[14]"
324.75,163.86,332.39,170.93,"/F19",7.97,"L."
338.95,163.86,363.20,170.93,"/F19",7.97,"Illusie,"
370.69,163.86,398.91,170.93,"/F19",7.97,"Theorie"
405.47,163.86,413.93,170.93,"/F19",7.97,"de"
420.49,163.86,445.78,170.93,"/F19",7.97,"Brauer"
452.34,163.86,459.39,170.93,"/F19",7.97,"et"
465.95,163.86,519.84,170.93,"/F19",7.97,"caracteristique"
526.40,163.86,557.56,170.93,"/F19",7.97,"d'Euler{"
324.76,154.39,505.53,161.47,"/F19",7.97,"Poincare, Asterisque 82-83 (1978{1979) 161{172."
306.60,144.93,319.77,152.01,"/F19",7.97,"[15]"
324.75,144.93,557.55,152.01,"/F19",7.97,"G. Kennedy, MacPherson's Chern classes of singular algebraic"
324.76,135.46,486.09,142.54,"/F19",7.97,"varieties, Comm. Alg. 18 (1990) 2821{2839."
306.60,126.00,319.77,133.08,"/F19",7.97,"[16]"
324.75,126.00,557.55,133.08,"/F19",7.97,"V. N. Aznar, Sur les multiplicites de Schubert locales des fais-"
324.76,116.53,554.32,123.61,"/F19",7.97,"ceaux algebriques coherents, Comp. Math. 48 (1983) 311{326."
295.15,61.35,300.13,70.20,"/F8",9.96,"5"
