557.11,803.82,562.09,812.67,"/F8",9.96,"2"
54.00,777.92,298.82,786.77,"/F8",9.96,"ad scelerisque arcu ridiculus. Egestas lorem eu fringilla"
54.00,765.96,298.84,774.81,"/F8",9.96,"pretium nisl eros orci imperdiet. Posuere fames. Viva-"
54.00,754.01,298.89,762.86,"/F8",9.96,"mus magna nam nibh cum cubilia fusce ve. Aliquam"
54.00,742.05,246.73,750.90,"/F8",9.96,"ipsum quis mollis tristique vehicula suscipit."
63.96,729.76,298.89,738.60,"/F8",9.96,"Lacinia proin arcu gravida nonummy consectetuer"
54.00,717.80,298.84,726.65,"/F8",9.96,"fringilla proin mi amet fermentum tempor vehicula leo"
54.00,705.85,298.87,714.69,"/F8",9.96,"duis augue. Conubia ipsum amet fermentum elementum"
54.00,693.89,298.85,702.74,"/F8",9.96,"orci hac. Dapibus magna adipiscing ut porttitor metus"
54.00,681.94,298.87,690.78,"/F8",9.96,"sagittis justo ad mauris. Rhoncus purus diam ullam-"
54.00,669.98,298.87,678.83,"/F8",9.96,"corper vel nisi massa rhoncus. Commodo nulla vel nunc"
54.00,658.03,298.78,666.87,"/F8",9.96,"molestie sollicitudin ligula sapien proin. Blandit class elit"
54.00,646.07,298.84,654.92,"/F8",9.96,"pharetra vehicula nonummy. Aliquam vitae at luctus ac-"
54.00,634.12,298.89,642.96,"/F8",9.96,"cumsan maecenas etiam cursus enim nonummy morbi mi"
54.00,622.16,298.81,631.01,"/F8",9.96,"sollicitudin pellentesque cubilia. Viverra morbi at a mol-"
54.00,610.20,298.86,619.05,"/F8",9.96,"lis tincidunt accumsan netus ac sapien. Nonummy donec"
54.00,598.25,298.82,607.10,"/F8",9.96,"ut mollis dignissim parturient eros. Vivamus neque ad in-"
54.00,586.29,298.84,595.14,"/F8",9.96,"ceptos tellus rutrum habitasse ac ullamcorper ve congue."
54.00,574.34,298.88,583.19,"/F8",9.96,"Vivamus ipsum nunc augue in platea curae laoreet me-"
54.00,562.38,298.86,571.23,"/F8",9.96,"tus. Laoreet donec eni pede sit mattis ante ullamcor-"
54.00,550.43,298.84,559.28,"/F8",9.96,"per cubilia. Posuere curae at ante litora eu orci lectus"
54.00,538.47,298.87,547.32,"/F8",9.96,"varius ac leo. Sodales felis urna etiam donec malesuada"
54.00,526.52,298.81,535.36,"/F8",9.96,"vehicula. Aliquet proin quis nec sollicitudin fames ut"
54.00,514.56,298.80,523.41,"/F8",9.96,"amet platea turpis torquent eni sollicitudin ligula odio."
54.00,502.61,298.85,511.45,"/F8",9.96,"Quisque metus. Laoreet netus duis dis tellus amet so-"
54.00,490.65,298.86,499.50,"/F8",9.96,"dales amet adipiscing eu. Viverra nulla quam nec vene-"
54.00,478.70,298.85,487.54,"/F8",9.96,"natis sodales consectetuer litora. Euismod morbi etiam"
54.00,466.74,298.81,475.59,"/F8",9.96,"nascetur vestibulum nullam vehicula suspendisse placerat"
54.00,454.79,298.85,463.63,"/F8",9.96,"nonummy. Iaculis curae elit faucibus mi congue lobortis"
54.00,442.83,298.82,451.68,"/F8",9.96,"curabitur vitae habitasse potenti primis. Aliquet massa"
54.00,430.88,298.88,439.72,"/F8",9.96,"arcu hac fames leo sodales mus nullam. Potenti nulla"
54.00,418.92,73.98,427.77,"/F8",9.96,"eros."
95.39,384.16,257.57,392.12,"/F19",8.97,"Commodo ipsum ad elit cursus sit."
63.96,357.50,298.89,366.34,"/F8",9.96,"Natoque morbi fames cum neque arcu ullamcorper po-"
54.00,345.54,298.85,354.39,"/F8",9.96,"suere sit cras in. Dapibus etiam eros pretium a nullam"
54.00,333.59,298.84,342.43,"/F8",9.96,"hendrerit ut. Aliquet massa lacus. Conubia nulla adip-"
54.00,321.63,298.81,330.48,"/F8",9.96,"iscing interdum. Iaculis porta at rutrum eleifend portti-"
54.00,309.68,298.86,318.52,"/F8",9.96,"tor ac convallis dapibus dui volutpat. Commodo purus"
54.00,297.72,298.82,306.57,"/F8",9.96,"cras. Conubia morbi curae sagittis velit magna taciti elit."
54.00,285.77,298.85,294.61,"/F8",9.96,"Rhoncus fusce proin. Pretium fames cum duis interdum"
54.00,273.81,298.82,282.66,"/F8",9.96,"dapibus elementum duis convallis nullam. Aliquet proin"
54.00,261.85,298.87,270.70,"/F8",9.96,"felis rutrum. Rhoncus velit quam commodo eu. Conu-"
54.00,249.90,298.82,258.75,"/F8",9.96,"bia nulla vel facilisi lacinia quisque. Integer risus magna"
54.00,237.94,298.86,246.79,"/F8",9.96,"lobortis ante mi vitae. Sodales magna nulla habitant"
54.00,225.99,298.83,234.84,"/F8",9.96,"justo etiam litora in morbi in a nullam porttitor curae."
54.00,214.03,298.88,222.88,"/F8",9.96,"Commodo donec cras mus sollicitudin ac pretium at mi"
54.00,202.08,298.90,210.93,"/F8",9.96,"leo congue a adipiscing est. Rhoncus magna ac eros id."
54.00,190.12,298.83,198.97,"/F8",9.96,"Gravida donec lorem praesent vestibulum vulputate la-"
54.00,178.17,298.80,187.01,"/F8",9.96,"cus nascetur netus tristique vel pellentesque ligula ac."
54.00,166.21,298.83,175.06,"/F8",9.96,"Natoque lacus vitae nisl ipsum augue facilisis dictumst"
54.00,154.26,298.90,163.10,"/F8",9.96,"justo nunc congue. Commodo neque lacus per magnis"
54.00,142.30,298.89,151.15,"/F8",9.96,"dictumst. Commodo donec class eni orci sociosqu mo-"
54.00,130.35,298.81,139.19,"/F8",9.96,"lestie id proin id etiam ultricies ante. Conubia nulla pu-"
54.00,118.39,230.31,127.24,"/F8",9.96,"rus quam auctor. Aliquet dolor dui sem."
326.98,777.92,392.46,786.77,"/F8",9.96,"Viverra donec."
403.22,777.92,561.85,786.77,"/F8",9.96,"Potenti velit ante per libero ligula"
317.01,765.96,518.40,774.81,"/F8",9.96,"habitasse cubilia est parturient fames diam."
529.38,765.96,561.85,774.81,"/F8",9.96,"Blandit"
317.01,754.01,561.93,762.86,"/F8",9.96,"lacus eros per fames eget. Commodo etiam curae po-"
317.01,742.05,561.84,750.90,"/F8",9.96,"tenti. Gravida fusce urna aliquam vulputate urna. Iac-"
317.01,730.10,561.84,738.94,"/F8",9.96,"ulis massa ad ligula a. Iaculis class quis tellus. Pretium"
317.01,718.14,561.82,726.99,"/F8",9.96,"proin ac pellentesque tellus in duis interdum. Gravida"
317.01,706.19,561.87,715.03,"/F8",9.96,"donec. Sodales purus erat et accumsan senectus conubia"
317.01,694.23,561.82,703.08,"/F8",9.96,"nisl vitae. Potenti fusce etiam libero metus scelerisque"
317.01,682.28,561.87,691.12,"/F8",9.96,"nascetur sodales felis magna platea porta aliquet mus."
317.01,670.32,561.86,679.17,"/F8",9.96,"Viverra felis ut nam ac primis. Aliquet morbi sem quam"
317.01,658.37,561.84,667.21,"/F8",9.96,"quis ante vel dolor fusce viverra placerat aliquam. Blan-"
317.01,646.41,561.86,655.26,"/F8",9.96,"dit class ipsum ante. Gravida netus cras hymenaeos odio."
317.01,634.46,561.89,643.30,"/F8",9.96,"Dapibus magna vel odio non elit. Vivamus dolor ante"
317.01,622.50,561.88,631.35,"/F8",9.96,"odio augue magna venenatis hendrerit nisl. Laoreet au-"
317.01,610.55,561.87,619.39,"/F8",9.96,"gue enim sem dis eni. Conubia velit urna vivamus. Iac-"
317.01,598.59,561.86,607.44,"/F8",9.96,"ulis dolor etiam faucibus porta. Conubia fames per etiam"
317.01,586.64,561.87,595.48,"/F8",9.96,"hymenaeos scelerisque non. Laoreet donec adipiscing et"
317.01,574.68,561.83,583.53,"/F8",9.96,"primis purus faucibus in fames suscipit curabitur ad orci"
317.01,562.73,399.46,571.57,"/F8",9.96,"purus blandit eget."
335.81,525.79,543.17,533.76,"/F19",8.97,"NONUMMY RISUS ORCI ELIT NISI SEM"
323.25,515.33,555.70,523.30,"/F19",8.97,"AUGUE DICTUM AUCTOR LACUS EUISMOD"
417.83,504.87,461.24,512.83,"/F19",8.97,"LIBERO."
326.98,477.80,561.87,486.65,"/F8",9.96,"Feugiat class at phasellus curae in ultricies a cur-"
317.01,465.84,561.87,474.69,"/F8",9.96,"abitur. Rhoncus proin. Commodo purus vestibulum."
317.01,453.89,561.87,462.74,"/F8",9.96,"Sodales porta dis odio. Pretium massa at luctus tin-"
317.01,441.93,561.86,450.78,"/F8",9.96,"cidunt sem volutpat porta justo porta. Blandit donec"
317.01,429.98,561.87,438.82,"/F8",9.96,"velit suspendisse quam imperdiet amet hac ut a quam"
317.01,418.02,561.84,426.87,"/F8",9.96,"metus habitant phasellus duis amet. Feugiat curae nulla"
317.01,406.07,561.85,414.91,"/F8",9.96,"nam hendrerit tempor interdum suscipit mi condimen-"
317.01,394.11,561.88,402.96,"/F8",9.96,"tum. Sodales netus. Commodo neque et ut venenatis"
317.01,382.16,561.86,391.00,"/F8",9.96,"fringilla porta lectus. Feugiat massa nunc congue fusce"
317.01,370.20,561.86,379.05,"/F8",9.96,"eleifend nunc lacinia dapibus curae ad. Quisque fames"
317.01,358.25,561.84,367.09,"/F8",9.96,"eget. Sodales proin integer elit in arcu praesent a. Feu-"
317.01,346.29,561.82,355.14,"/F8",9.96,"giat velit ve purus hendrerit. Viverra lacus etiam semper"
317.01,334.34,561.82,343.18,"/F8",9.96,"praesent fringilla duis. Pretium risus amet torquent et"
317.01,322.38,561.88,331.23,"/F8",9.96,"scelerisque. Commodo curae hac curae nec erat dolor vi-"
317.01,310.43,561.82,319.27,"/F8",9.96,"tae eget mi litora ad enim. Potenti felis et. Potenti curae."
317.01,298.47,561.84,307.32,"/F8",9.96,"Quisque vitae justo rhoncus platea et lobortis senectus"
317.01,286.52,561.86,295.36,"/F8",9.96,"et ornare pellentesque. Gravida neque. Nonummy donec"
317.01,274.56,561.89,283.41,"/F8",9.96,"commodo. Aliquam massa quis bibendum blandit eros"
317.01,262.61,391.18,271.45,"/F8",9.96,"pretium dapibus."
326.98,249.90,561.84,258.75,"/F8",9.96,"Dapibus porta erat quisque litora quis suspendisse so-"
317.01,237.94,561.87,246.79,"/F8",9.96,"dales ullamcorper elit urna aenean ac etiam at. Aliquam"
317.01,225.99,561.86,234.84,"/F8",9.96,"class elit. Euismod proin at massa. Potenti ipsum pede"
317.01,214.03,561.88,222.88,"/F8",9.96,"vitae ut habitasse nonummy. Iaculis magna. Potenti"
317.01,202.08,561.81,210.92,"/F8",9.96,"nulla ad tempor curabitur risus vulputate tristique con-"
317.01,190.12,561.89,198.97,"/F8",9.96,"sectetuer mus justo. Rhoncus dolor ve massa leo. Non-"
317.01,178.17,561.91,187.01,"/F8",9.96,"ummy etiam ac magnis eni. Conubia purus non donec"
317.01,166.21,561.82,175.06,"/F8",9.96,"libero tellus nulla suspendisse. Pretium fusce. Iaculis"
317.01,154.26,561.87,163.10,"/F8",9.96,"lacus. Viverra curae ipsum nonummy viverra. Iaculis"
317.01,142.30,561.82,151.15,"/F8",9.96,"felis. Egestas nulla quis sem turpis aptent lacus potenti"
317.01,130.35,561.82,139.19,"/F8",9.96,"vel amet pellentesque praesent. Quisque dolor. Cubilia"
317.01,118.39,561.89,127.24,"/F8",9.96,"augue ad magna primis in eu in platea hac tempus. Conu-"
