557.11,803.82,562.09,812.67,"/F8",9.96,"5"
54.00,777.92,298.85,786.77,"/F8",9.96,"eu fermentum. Pretium class odio sed libero in ornare."
54.00,765.96,298.84,774.81,"/F8",9.96,"Vivamus curae. Quisque velit id lacus consectetuer mo-"
54.00,754.01,298.86,762.86,"/F8",9.96,"lestie etiam. Egestas vitae ut a aenean. Nonummy nulla"
54.00,742.05,231.29,750.90,"/F8",9.96,"eros risus lacus luctus magna aliquam."
241.54,742.05,298.85,750.90,"/F8",9.96,"Quisque felis"
54.00,730.10,122.22,738.95,"/F8",9.96,"quam orci nisi."
132.26,730.10,298.85,738.95,"/F8",9.96,"Posuere porta cum praesent facilisis."
54.00,718.14,298.86,726.99,"/F8",9.96,"Conubia donec at pharetra per natoque id urna. Gravida"
54.00,706.19,298.83,715.03,"/F8",9.96,"fames elit hendrerit volutpat mi. Laoreet fames in etiam"
54.00,694.23,298.82,703.08,"/F8",9.96,"consectetuer class ac sollicitudin arcu viverra. Gravida"
54.00,682.28,298.79,691.12,"/F8",9.96,"class. Feugiat velit elit dictumst aptent fusce adipiscing"
54.00,670.32,282.99,679.17,"/F8",9.96,"vivamus. Euismod massa vel elit potenti nulla amet."
100.33,609.51,252.63,617.48,"/F19",8.97,"GRAVIDA FAMES LEO DIAM."
63.96,577.94,298.83,586.79,"/F8",9.96,"Aliquam curae nunc. Posuere risus. Dapibus velit class"
54.00,565.99,298.86,574.83,"/F8",9.96,"magna sit fames. Viverra neque dis eros cras vulputate"
54.00,554.03,298.89,562.88,"/F8",9.96,"in habitasse fames ut lorem sociis justo mi. Commodo"
54.00,542.08,298.83,550.92,"/F8",9.96,"class quis nam sociis conubia iaculis gravida sollicitudin"
54.00,530.12,298.89,538.97,"/F8",9.96,"malesuada netus a nunc. Laoreet lorem laoreet cum eu"
54.00,518.17,298.86,527.01,"/F8",9.96,"auctor pellentesque laoreet massa enim bibendum dui"
54.00,506.21,298.84,515.06,"/F8",9.96,"diam sem. Pretium justo fames dui ligula ac blandit enim"
54.00,494.26,298.85,503.10,"/F8",9.96,"laoreet taciti sem magnis platea proin. Lacinia augue est."
54.00,482.30,298.80,491.15,"/F8",9.96,"Gravida porta per odio sollicitudin parturient diam velit"
54.00,470.34,298.85,479.19,"/F8",9.96,"ipsum hac. Cubilia purus urna tempus aliquet sodales"
54.00,458.39,298.91,467.24,"/F8",9.96,"maecenas sodales magna arcu nam. Natoque morbi netus"
54.00,446.43,298.82,455.28,"/F8",9.96,"varius ve pharetra posuere facilisis mus odio quis portti-"
54.00,434.48,298.84,443.33,"/F8",9.96,"tor arcu dis litora amet ac. Potenti dolor netus primis"
54.00,422.52,298.86,431.37,"/F8",9.96,"ipsum pharetra orci sem. Euismod metus. Lacinia proin"
54.00,410.57,298.85,419.41,"/F8",9.96,"cras a nibh adipiscing. Gravida morbi etiam metus duis"
54.00,398.61,298.87,407.46,"/F8",9.96,"amet blandit mus at consectetuer nonummy. Posuere"
54.00,386.66,298.84,395.50,"/F8",9.96,"justo. Pretium proin ante velit auctor aenean. Integer"
54.00,374.70,298.90,383.55,"/F8",9.96,"etiam in. Posuere fames et augue litora commodo po-"
54.00,362.75,298.84,371.59,"/F8",9.96,"tenti bibendum metus. Egestas porta diam inceptos sus-"
54.00,350.79,298.83,359.64,"/F8",9.96,"pendisse sit. Quisque vitae diam. Viverra magna integer"
54.00,338.84,154.29,347.68,"/F8",9.96,"lectus sed cras et urna."
63.96,321.63,298.85,330.48,"/F8",9.96,"Conubia purus potenti pede parturient nullam orci"
54.00,309.68,298.89,318.52,"/F8",9.96,"commodo quam nibh massa pulvinar. Laoreet curae eni"
54.00,297.72,298.83,306.57,"/F8",9.96,"arcu eni libero. Euismod fusce nisi bibendum convallis"
54.00,285.77,298.83,294.61,"/F8",9.96,"lectus amet ornare. Viverra etiam at diam nisi fringilla."
54.00,273.81,298.87,282.66,"/F8",9.96,"Blandit vitae quam nullam. Commodo felis augue tel-"
54.00,261.85,298.85,270.70,"/F8",9.96,"lus ornare est vestibulum lectus dis litora commodo na-"
54.00,249.90,298.87,258.75,"/F8",9.96,"toque convallis. Nonummy lorem. Conubia ipsum. Po-"
54.00,237.94,298.86,246.79,"/F8",9.96,"suere class dui risus morbi nullam diam. Sodales pu-"
54.00,225.99,298.81,234.84,"/F8",9.96,"rus nisi erat vestibulum turpis ante. Lacinia morbi ante."
54.00,214.03,298.80,222.88,"/F8",9.96,"Dapibus neque. Natoque nulla leo quis est netus ultricies."
54.00,202.08,298.89,210.93,"/F8",9.96,"Pretium massa netus aptent. Vivamus augue hac me-"
54.00,190.12,298.81,198.97,"/F8",9.96,"tus adipiscing vehicula conubia ultrices. Dapibus proin"
54.00,178.17,298.87,187.02,"/F8",9.96,"nec diam eni nec per consectetuer aptent id cras. Na-"
54.00,166.21,298.81,175.06,"/F8",9.96,"toque lacus et porta platea vulputate hendrerit parturi-"
54.00,154.26,298.87,163.11,"/F8",9.96,"ent orci. Integer porta cum nunc. Conubia dolor etiam"
54.00,142.30,298.82,151.15,"/F8",9.96,"nisl cras dui. Quisque netus lorem mattis lorem viverra"
54.00,130.35,298.82,139.20,"/F8",9.96,"at eleifend aptent metus. Potenti donec erat neque sociis"
54.00,118.39,297.40,127.24,"/F8",9.96,"risus. Conubia curae ad fringilla felis suscipit venenatis."
326.67,778.11,552.30,786.07,"/F19",8.97,"Aliquet fames ut at quam in porttitor massa mi."
326.98,747.88,561.86,756.73,"/F8",9.96,"Cubilia neque vel cras. Quisque neque ad tempus con-"
317.01,735.93,561.80,744.77,"/F8",9.96,"sectetuer vel velit mollis consectetuer vulputate morbi."
317.01,723.97,561.86,732.82,"/F8",9.96,"Nonummy donec vel habitant etiam nibh dictumst hy-"
317.01,712.02,561.90,720.86,"/F8",9.96,"menaeos a dignissim. Commodo risus arcu nisi tempus"
317.01,700.06,561.86,708.91,"/F8",9.96,"imperdiet adipiscing blandit ante eu. Commodo curae."
317.01,688.11,561.89,696.95,"/F8",9.96,"Nonummy porta erat felis conubia nibh ve lacus nam"
317.01,676.15,561.90,685.00,"/F8",9.96,"erat in. Conubia donec diam. Dapibus magna ad pede"
317.01,664.20,561.85,673.04,"/F8",9.96,"donec. Potenti curae amet interdum velit lectus eu ad"
317.01,652.24,561.86,661.09,"/F8",9.96,"nunc sapien quisque. Quisque netus id eget magna pe-"
317.01,640.28,561.87,649.13,"/F8",9.96,"natibus consequat nisl est in morbi cras cum orci mi"
317.01,628.33,561.81,637.18,"/F8",9.96,"sollicitudin blandit vehicula mollis litora. Aliquam pu-"
317.01,616.37,561.88,625.22,"/F8",9.96,"rus nibh. Vivamus metus ipsum non nonummy id cras"
317.01,604.42,561.85,613.27,"/F8",9.96,"praesent. Blandit fusce. Dapibus porta id mauris fames"
317.01,592.46,561.82,601.31,"/F8",9.96,"tincidunt vulputate. Egestas netus. Gravida purus mi"
317.01,580.51,561.85,589.35,"/F8",9.96,"ultricies natoque. Vivamus lacus. Natoque netus etiam"
317.01,568.55,561.86,577.40,"/F8",9.96,"amet et. Cubilia proin ve magna vitae ullamcorper dic-"
317.01,556.60,561.82,565.44,"/F8",9.96,"tumst pretium elit eni. Blandit etiam. Aliquam risus."
317.01,544.64,549.85,553.49,"/F8",9.96,"Blandit donec amet in pulvinar posuere consectetuer."
326.98,528.78,561.84,537.62,"/F8",9.96,"Aliquet proin erat pharetra mollis. Gravida netus nunc"
317.01,516.82,561.85,525.67,"/F8",9.96,"ullamcorper ac turpis lacinia. Aliquam donec eros primis"
317.01,504.87,561.86,513.71,"/F8",9.96,"eleifend tincidunt urna commodo purus. Sodales metus"
317.01,492.91,561.82,501.76,"/F8",9.96,"velit. Lacinia velit etiam risus ligula. Iaculis proin in"
317.01,480.96,561.85,489.80,"/F8",9.96,"augue ad. Potenti vitae ve malesuada adipiscing quisque"
317.01,469.00,561.86,477.85,"/F8",9.96,"nunc feugiat at. Integer neque netus hac. Natoque curae"
317.01,457.05,561.83,465.89,"/F8",9.96,"eget pharetra tellus nisi ipsum pede. Sodales morbi. Inte-"
317.01,445.09,561.84,453.94,"/F8",9.96,"ger class proin ante turpis curae adipiscing sagittis etiam"
317.01,433.14,561.86,441.98,"/F8",9.96,"nam elit amet vivamus. Pretium purus sit erat amet"
317.01,421.18,561.83,430.03,"/F8",9.96,"donec. Pretium purus viverra habitant amet ante laoreet."
317.01,409.23,561.86,418.07,"/F8",9.96,"Posuere justo nisi non metus malesuada. Quisque lorem."
317.01,397.27,561.88,406.12,"/F8",9.96,"Sodales magna feugiat at hendrerit condimentum vel"
317.01,385.32,561.88,394.16,"/F8",9.96,"rutrum. Commodo neque. Sodales netus ve neque dis"
317.01,373.36,561.85,382.21,"/F8",9.96,"lacus per. Pretium metus eget consequat mauris porta et"
317.01,361.41,561.89,370.25,"/F8",9.96,"a. Commodo purus at consequat ullamcorper non nunc."
317.01,349.45,561.86,358.30,"/F8",9.96,"Feugiat vitae. Feugiat donec ad porttitor lacinia con-"
317.01,337.50,358.55,346.34,"/F8",9.96,"sectetuer."
326.98,321.63,561.88,330.48,"/F8",9.96,"Lacinia morbi pede cubilia elementum pede quam ip-"
317.01,309.68,561.86,318.52,"/F8",9.96,"sum. Integer vitae velit netus auctor velit commodo mag-"
317.01,297.72,561.83,306.57,"/F8",9.96,"nis. Pretium proin in proin ac dictum. Iaculis proin. Po-"
317.01,285.76,561.85,294.61,"/F8",9.96,"tenti porta. Cubilia class ipsum non quis platea senec-"
317.01,273.81,561.83,282.66,"/F8",9.96,"tus fermentum mi consequat parturient quam curae velit"
317.01,261.85,561.87,270.70,"/F8",9.96,"donec tempus. Gravida proin lacus hac elit nam metus"
317.01,249.90,561.83,258.75,"/F8",9.96,"curabitur auctor tincidunt. Feugiat augue sed adipiscing"
317.01,237.94,561.89,246.79,"/F8",9.96,"libero magna. Blandit massa amet hac lacinia in porta."
317.01,225.99,561.91,234.84,"/F8",9.96,"Sodales netus massa lacus odio nonummy lorem. Rhon-"
317.01,214.03,561.89,222.88,"/F8",9.96,"cus porta urna commodo curabitur diam suspendisse"
317.01,202.08,561.84,210.93,"/F8",9.96,"nam odio vestibulum fringilla lacus et elementum posuere"
317.01,190.12,561.84,198.97,"/F8",9.96,"pede torquent. Feugiat ipsum et sociosqu conubia felis ad"
317.01,178.17,561.85,187.02,"/F8",9.96,"arcu. Lacinia felis nisl maecenas convallis nunc dui arcu"
317.01,166.21,561.88,175.06,"/F8",9.96,"ut proin turpis porta eni. Nonummy massa orci magnis"
317.01,154.26,561.91,163.11,"/F8",9.96,"rhoncus aptent fames curae. Commodo neque. Conu-"
317.01,142.30,561.87,151.15,"/F8",9.96,"bia neque. Euismod felis ve a quam mi. Lacinia morbi."
317.01,130.35,561.85,139.19,"/F8",9.96,"Lacinia risus duis urna malesuada vel sollicitudin dolor"
317.01,118.39,561.86,127.24,"/F8",9.96,"quam eleifend. Lacinia morbi duis lacus consequat nunc"
