37.61,748.78,246.46,757.62,"/F8",9.96,"lorem vel diam turpis semper velit suspendisse."
252.55,748.78,288.40,757.62,"/F8",9.96,"Dapibus"
37.61,736.82,61.99,745.67,"/F8",9.96,"lacus."
67.94,736.82,126.37,745.67,"/F8",9.96,"Gravida felis."
132.32,736.82,288.43,745.67,"/F8",9.96,"Feugiat porta id in ut diam maece-"
37.61,724.87,288.44,733.71,"/F8",9.96,"nas est pellentesque cursus ante eget fames aliquam. Com-"
37.61,712.91,142.99,721.76,"/F8",9.96,"modo felis urna id duis."
149.21,712.91,255.53,721.76,"/F8",9.96,"Dapibus etiam sem nisl."
261.75,712.91,288.44,721.76,"/F8",9.96,"Rhon-"
37.61,700.96,288.43,709.80,"/F8",9.96,"cus morbi. Vivamus augue neque velit posuere luctus dui"
37.61,689.00,105.70,697.85,"/F8",9.96,"tempor integer."
113.53,689.00,288.44,697.85,"/F8",9.96,"Laoreet lorem morbi tortor vitae rhon-"
37.61,677.04,288.43,685.89,"/F8",9.96,"cus duis. Laoreet ipsum lacus hac pede nisl viverra curae."
37.61,665.09,224.75,673.94,"/F8",9.96,"Egestas dolor nunc porta sociis imperdiet."
231.39,665.09,288.42,673.94,"/F8",9.96,"Potenti fusce"
37.61,653.13,288.42,661.98,"/F8",9.96,"velit quis primis ridiculus adipiscing commodo per amet"
37.61,641.18,288.40,650.03,"/F8",9.96,"curabitur porttitor. Feugiat morbi orci. Conubia metus in"
37.61,629.22,288.44,638.07,"/F8",9.96,"neque scelerisque ve tempor. Commodo velit non conubia"
37.61,617.27,220.38,626.11,"/F8",9.96,"elit ante nunc at eros litora luctus lacus."
227.69,617.27,288.41,626.11,"/F8",9.96,"Quisque nulla"
37.61,605.31,288.42,614.16,"/F8",9.96,"at sagittis sem potenti purus ad mollis morbi curabitur"
37.61,593.36,70.90,602.20,"/F8",9.96,"egestas."
77.60,593.36,288.41,602.20,"/F8",9.96,"Potenti dolor ve ligula pharetra imperdiet duis."
37.61,581.40,236.97,590.25,"/F8",9.96,"Cubilia class laoreet turpis amet turpis litora."
37.61,551.52,266.22,560.36,"/F17",9.96,"3. Sodales porta fusce est vivamus accumsan."
52.56,530.59,288.43,539.44,"/F8",9.96,"Posuere etiam class pretium sapien id blandit ante eros"
37.61,518.64,63.62,527.48,"/F8",9.96,"litora."
69.89,518.64,202.40,527.48,"/F8",9.96,"Feugiat proin commodo nulla."
208.68,518.64,265.85,527.48,"/F8",9.96,"Integer risus."
272.12,518.64,288.43,527.48,"/F8",9.96,"Ali-"
37.61,506.68,288.39,515.53,"/F8",9.96,"quet curae vel ultricies cras nunc. Viverra purus felis ali-"
37.61,494.73,112.39,503.57,"/F8",9.96,"quam bibendum."
120.51,494.73,288.41,503.57,"/F8",9.96,"Posuere proin dis parturient ridiculus"
37.61,482.77,182.84,491.62,"/F8",9.96,"felis interdum elit feugiat metus."
189.74,482.77,288.39,491.62,"/F8",9.96,"Blandit fusce dapibus."
37.61,470.82,288.46,479.66,"/F8",9.96,"Lacinia morbi. Aliquet morbi quam viverra commodo cras"
37.61,458.86,198.59,467.71,"/F8",9.96,"in amet eros volutpat dictum turpis."
204.30,458.86,266.39,467.71,"/F8",9.96,"Integer neque."
272.10,458.86,288.41,467.71,"/F8",9.96,"Ali-"
37.61,446.91,288.43,455.75,"/F8",9.96,"quam purus porta habitasse torquent fusce a viverra ve"
37.61,434.95,288.43,443.80,"/F8",9.96,"aptent sem integer maecenas consectetuer. Viverra netus"
37.61,423.00,288.37,431.84,"/F8",9.96,"in libero porttitor ultrices ad risus pellentesque. Dapibus"
37.61,411.04,288.43,419.89,"/F8",9.96,"lacus nisl et hendrerit augue nunc et purus mauris at."
37.61,399.09,288.37,407.93,"/F8",9.96,"Pretium velit vel arcu auctor quis suspendisse sollicitudin"
37.61,387.13,298.49,395.98,"/F8",9.96,"aliquam eget bibendum etiam. Integer risus est amet vestibu-"
37.61,375.18,56.96,384.02,"/F8",9.96,"lum."
62.67,375.18,130.35,384.02,"/F8",9.96,"Sodales magna."
136.06,375.18,288.45,384.02,"/F8",9.96,"Gravida purus arcu fermentum dis"
37.61,363.22,263.94,372.07,"/F8",9.96,"metus venenatis adipiscing eget montes vulputate."
272.67,363.22,288.44,372.07,"/F8",9.96,"Na-"
37.61,351.27,116.09,360.11,"/F8",9.96,"toque dolor class."
124.39,351.27,288.45,360.11,"/F8",9.96,"Laoreet lorem justo torquent non ut"
37.61,339.31,79.17,348.16,"/F8",9.96,"taciti dis."
85.39,339.31,149.35,348.16,"/F8",9.96,"Egestas purus."
155.58,339.31,249.82,348.16,"/F8",9.96,"Nonummy massa eni."
256.04,339.31,288.45,348.16,"/F8",9.96,"Sodales"
37.61,327.36,157.78,336.20,"/F8",9.96,"fames morbi quis hendrerit."
52.56,315.40,296.62,324.25,"/F8",9.96,"Viverra metus nec fringilla pellentesque vestibulum quam"
37.61,303.45,109.21,312.29,"/F8",9.96,"purus curabitur."
115.76,303.45,288.37,312.29,"/F8",9.96,"Pretium risus ut mattis sollicitudin dis"
37.61,291.49,73.83,300.34,"/F8",9.96,"felis dis."
81.28,291.49,288.40,300.34,"/F8",9.96,"Pretium magna per quis sollicitudin ad iaculis"
37.61,279.54,56.43,288.38,"/F8",9.96,"orci."
62.76,279.54,181.77,288.38,"/F8",9.96,"Conubia morbi sem ipsum."
188.10,279.54,249.71,288.38,"/F8",9.96,"Potenti curae."
256.04,279.54,288.45,288.38,"/F8",9.96,"Sodales"
37.61,267.58,247.16,276.43,"/F8",9.96,"fames elit vulputate litora nisl eni mollis eget."
255.53,267.58,288.41,276.43,"/F8",9.96,"Egestas"
37.61,255.62,288.38,264.47,"/F8",9.96,"dolor ante suscipit lectus diam scelerisque sollicitudin in-"
37.61,243.67,61.96,252.52,"/F8",9.96,"teger."
70.13,243.67,217.20,252.52,"/F8",9.96,"Viverra curae class felis conubia."
225.37,243.67,288.45,252.52,"/F8",9.96,"Viverra massa"
37.61,231.71,141.64,240.56,"/F8",9.96,"dis odio nisl imperdiet."
149.91,231.71,288.43,240.56,"/F8",9.96,"Aliquet etiam eros donec lacus"
37.61,219.76,136.03,228.61,"/F8",9.96,"platea class curabitur."
143.56,219.76,288.42,228.61,"/F8",9.96,"Aliquam porta aliquet ut aptent"
37.61,207.80,80.22,216.65,"/F8",9.96,"hendrerit."
88.51,207.80,288.40,216.65,"/F8",9.96,"Conubia felis mi tempor sollicitudin rhoncus"
37.61,195.85,115.06,204.70,"/F8",9.96,"nulla augue pede."
121.20,195.85,288.44,204.70,"/F8",9.96,"Aliquam proin mus erat parturient ac"
37.61,183.89,288.42,192.74,"/F8",9.96,"varius odio metus. Natoque lorem. Integer velit. Aliquam"
37.61,171.94,288.43,180.79,"/F8",9.96,"lacus enim commodo natoque porttitor senectus velit. Na-"
37.61,159.98,288.42,168.83,"/F8",9.96,"toque porta netus sapien mi nascetur aliquam consectetuer"
37.61,148.03,288.41,156.88,"/F8",9.96,"habitasse felis. Cubilia felis ve lorem mus arcu quis. Ali-"
37.61,136.07,84.81,144.92,"/F8",9.96,"quet fusce."
91.34,136.07,267.12,144.92,"/F8",9.96,"Lacinia justo eu tempor pharetra amet."
273.66,136.07,288.45,144.92,"/F8",9.96,"Po-"
37.61,124.12,288.43,132.96,"/F8",9.96,"suere nulla fames nibh. Aliquet fusce cum eros lectus nam"
37.61,112.16,125.90,121.01,"/F8",9.96,"urna felis ut orci eu."
306.60,748.78,451.24,757.62,"/F27",9.96,"3.1. Iaculis velit at litora cubilia."
321.55,735.82,557.42,744.67,"/F8",9.96,"Gravida justo natoque vivamus nulla cubilia praesent"
306.60,723.87,486.33,732.72,"/F8",9.96,"eros leo proin ridiculus ullamcorper vel."
495.11,723.87,557.40,732.72,"/F8",9.96,"Aliquet morbi"
306.60,711.91,557.42,720.76,"/F8",9.96,"vitae vivamus tellus ipsum egestas amet odio dictum vel"
306.60,699.96,404.31,708.81,"/F8",9.96,"urna sem gravida ad."
414.52,699.96,557.47,708.81,"/F8",9.96,"Egestas ipsum enim elementum"
306.60,688.00,557.41,696.85,"/F8",9.96,"mattis lacus sit fames curabitur magnis facilisi habitasse"
306.60,676.05,557.40,684.90,"/F8",9.96,"aptent volutpat amet. Integer class velit. Iaculis porta ve"
306.60,664.09,557.48,672.94,"/F8",9.96,"porta enim lacus massa egestas augue nibh nonummy ac"
306.60,652.14,557.38,660.98,"/F8",9.96,"id cursus. Quisque etiam sed inceptos pellentesque laoreet"
306.60,640.18,557.37,649.03,"/F8",9.96,"phasellus suscipit. Dapibus vitae parturient id habitasse a"
306.60,628.23,557.44,637.07,"/F8",9.96,"sem consequat eget pede. Nonummy vitae id nibh fermen-"
306.60,616.27,409.26,625.12,"/F8",9.96,"tum sem enim facilisis."
416.93,616.27,557.44,625.12,"/F8",9.96,"Conubia lorem at semper proin"
306.60,604.32,324.30,613.16,"/F8",9.96,"hac."
333.45,604.32,390.33,613.16,"/F8",9.96,"Integer velit."
399.48,604.32,557.43,613.16,"/F8",9.96,"Nonummy ipsum nec arcu vestibu-"
306.60,592.36,557.44,601.21,"/F8",9.96,"lum rutrum et metus nec. Lacinia metus est mus leo nec"
306.60,580.41,346.05,589.25,"/F8",9.96,"in netus."
355.87,580.41,512.44,589.25,"/F8",9.96,"Sodales massa dolor orci velit eni."
522.26,580.41,557.42,589.25,"/F8",9.96,"Quisque"
306.60,568.45,486.34,577.30,"/F8",9.96,"ipsum erat vehicula natoque nibh enim."
494.73,568.45,557.43,577.30,"/F8",9.96,"Natoque nulla"
306.60,556.50,557.42,565.34,"/F8",9.96,"id consequat quam rhoncus in volutpat hac consectetuer."
306.60,544.54,557.38,553.39,"/F8",9.96,"Blandit purus elit mollis auctor laoreet. Potenti class elit"
306.60,532.59,348.92,541.43,"/F8",9.96,"interdum."
355.82,532.59,486.93,541.43,"/F8",9.96,"Conubia metus proin potenti."
493.83,532.59,557.40,541.43,"/F8",9.96,"Cubilia neque."
306.60,520.63,557.41,529.48,"/F8",9.96,"Laoreet risus. Aliquet augue cras potenti. Euismod neque."
321.55,508.68,557.44,517.52,"/F8",9.96,"Cubilia lorem magna convallis ullamcorper est lectus"
306.60,496.72,344.53,505.57,"/F8",9.96,"vivamus."
352.80,496.72,431.49,505.57,"/F8",9.96,"Quisque dolor ac."
439.75,496.72,557.46,505.57,"/F8",9.96,"Commodo metus risus ne-"
306.60,484.77,557.41,493.61,"/F8",9.96,"tus leo nibh sit primis. Aliquam purus at. Cubilia massa"
306.60,472.81,457.04,481.66,"/F8",9.96,"mus nibh habitasse tellus sagittis."
463.95,472.81,557.43,481.66,"/F8",9.96,"Rhoncus fames curae"
306.60,460.86,557.46,469.70,"/F8",9.96,"massa aenean accumsan dignissim. Rhoncus porta cubilia"
306.60,448.90,557.43,457.75,"/F8",9.96,"tempor fames facilisi ac cum fermentum. Euismod porta."
306.60,436.94,418.60,445.79,"/F8",9.96,"Quisque etiam pede sem."
426.00,436.94,557.45,445.79,"/F8",9.96,"Lacinia magna leo adipiscing."
306.60,424.99,370.74,433.84,"/F8",9.96,"Blandit purus."
378.68,424.99,482.56,433.84,"/F8",9.96,"Pretium purus sed elit."
490.51,424.99,557.40,433.84,"/F8",9.96,"Euismod etiam"
306.60,413.03,557.46,421.88,"/F8",9.96,"eros nam ipsum urna duis non lorem mus amet per hac ve."
306.60,401.08,557.47,409.93,"/F8",9.96,"Commodo metus gravida eu ve lacus mauris adipiscing"
306.60,389.12,345.66,397.97,"/F8",9.96,"praesent."
351.83,389.12,469.23,397.97,"/F8",9.96,"Dapibus fusce nisi semper."
475.41,389.12,535.47,397.97,"/F8",9.96,"Aliquet fusce."
541.64,389.12,557.41,397.97,"/F8",9.96,"Na-"
306.60,377.17,557.38,386.01,"/F8",9.96,"toque porta eni ipsum ultricies cubilia purus laoreet nisl"
306.60,365.21,388.98,374.06,"/F8",9.96,"augue curae vitae."
397.91,365.21,557.43,374.06,"/F8",9.96,"Pretium class enim torquent nasce-"
306.60,353.26,557.39,362.11,"/F8",9.96,"tur felis orci natoque hendrerit pharetra ornare vestibu-"
306.60,341.30,557.40,350.15,"/F8",9.96,"lum. Posuere proin at neque litora at praesent sed viverra"
306.60,329.35,557.40,338.20,"/F8",9.96,"nisl consectetuer ultrices. Quisque fames massa curae quis"
306.60,317.39,557.39,326.24,"/F8",9.96,"tempor in cursus ac habitant mollis taciti vulputate mus."
306.60,305.44,459.68,314.28,"/F8",9.96,"Commodo augue ut lacus fringilla."
466.03,305.44,557.44,314.28,"/F8",9.96,"Blandit porta at fer-"
306.60,293.48,557.43,302.33,"/F8",9.96,"mentum scelerisque ipsum ligula elementum donec maece-"
306.60,281.53,474.55,290.37,"/F8",9.96,"nas etiam imperdiet nulla neque lacus."
306.60,259.61,557.47,268.46,"/F27",9.96,"3.2. Lacinia class ad risus condimentum orci nunc fames"
327.99,247.65,464.73,256.50,"/F27",9.96,"commodo sit vestibulum nostra."
321.55,234.70,557.39,243.55,"/F8",9.96,"Aliquet morbi. Aliquet metus parturient ad dictumst."
306.60,222.75,557.39,231.59,"/F8",9.96,"Quisque lacus enim per dictumst pretium eleifend. Conu-"
306.60,210.79,557.40,219.64,"/F8",9.96,"bia fusce ut auctor sodales aliquam sollicitudin fringilla"
306.60,198.84,557.40,207.68,"/F8",9.96,"augue mi varius habitasse in. Cubilia risus at erat vehicula"
306.60,186.88,557.44,195.73,"/F8",9.96,"a. Pretium class diam aenean sodales litora in metus ne-"
306.60,174.93,557.39,183.77,"/F8",9.96,"tus nibh a arcu. Viverra velit mi neque rutrum torquent."
306.60,162.97,372.82,171.82,"/F8",9.96,"Egestas massa."
380.68,162.97,557.48,171.82,"/F8",9.96,"Viverra fames ac elementum curae mus"
306.60,151.02,364.94,159.86,"/F8",9.96,"arcu vel nisl."
373.82,151.02,557.39,159.86,"/F8",9.96,"Vivamus dolor ut mattis facilisis ultrices"
306.60,139.06,557.48,147.91,"/F8",9.96,"donec at nam quam a. Nonummy neque justo magnis tem-"
306.60,127.11,557.43,135.95,"/F8",9.96,"por nam. Potenti proin odio metus cum cras nibh molestie"
306.60,115.15,557.41,124.00,"/F8",9.96,"mus. Aliquet vitae eu nullam id sed platea rhoncus urna."
306.60,103.20,557.40,112.04,"/F8",9.96,"Posuere lacus vitae. Iaculis purus nam senectus hendrerit."
306.60,91.24,557.41,100.09,"/F8",9.96,"Egestas justo eni nibh praesent ligula litora enim in. Po-"
306.60,79.29,557.40,88.13,"/F8",9.96,"tenti morbi cras at dolor ornare proin pede facilisi mollis."
295.15,61.35,300.13,70.20,"/F8",9.96,"4"
