37.61,748.78,288.46,757.62,"/F8",9.96,"Sodales morbi ut augue ve nunc ipsum ad a ligula enim."
37.61,736.82,288.45,745.67,"/F8",9.96,"Commodo class et tempus bibendum aliquet rhoncus male-"
37.61,724.87,293.75,733.71,"/F8",9.96,"suada. Commodo fusce neque volutpat imperdiet mi montes"
37.61,712.91,288.43,721.76,"/F8",9.96,"tincidunt. Commodo felis ante nunc cubilia quis lobor-"
37.61,700.96,288.40,709.80,"/F8",9.96,"tis magnis. Rhoncus velit in sociis pellentesque dui dolor"
37.61,689.00,288.44,697.85,"/F8",9.96,"tempus ac. Nonummy nulla non erat in lobortis cubilia"
37.61,677.04,288.44,685.89,"/F8",9.96,"magna sit. Aliquet ipsum. Feugiat fames diam potenti ac"
37.61,665.09,288.43,673.94,"/F8",9.96,"arcu bibendum proin. Laoreet proin urna luctus conubia."
37.61,653.13,288.42,661.98,"/F8",9.96,"Gravida lorem nisi sed lacus cras habitasse pellentesque"
37.61,641.18,288.43,650.03,"/F8",9.96,"dis. Nonummy proin pede elementum turpis. Pretium"
37.61,629.22,288.43,638.07,"/F8",9.96,"proin class a. Pretium dolor. Potenti magna parturient"
37.61,617.27,288.47,626.11,"/F8",9.96,"condimentum tempus mi magnis quam ad eros nulla. Po-"
37.61,605.31,288.37,614.16,"/F8",9.96,"tenti vitae ac. Potenti felis arcu nisl urna tristique montes"
37.61,593.36,288.43,602.20,"/F8",9.96,"interdum malesuada arcu. Aliquet curae neque condimen-"
37.61,581.40,288.41,590.25,"/F8",9.96,"tum et mattis amet mi auctor. Dapibus nulla et imperdiet"
37.61,569.45,288.41,578.29,"/F8",9.96,"lacinia pellentesque penatibus lectus vitae lacus. Com-"
37.61,557.49,288.43,566.34,"/F8",9.96,"modo class dolor nec. Quisque nulla velit conubia auctor"
37.61,545.54,218.28,554.38,"/F8",9.96,"odio nibh dapibus aliquam semper id eni."
37.61,523.12,134.80,531.97,"/F27",9.96,"2.2. Cubilia vitae nec."
52.56,509.67,288.46,518.52,"/F8",9.96,"Cubilia lorem mi. Nonummy massa ante. Aliquet proin"
37.61,497.72,288.45,506.56,"/F8",9.96,"neque rhoncus semper fermentum id magnis rhoncus odio"
37.61,485.76,288.40,494.61,"/F8",9.96,"mi sollicitudin. Laoreet dolor at eros pharetra scelerisque."
37.61,473.81,288.45,482.65,"/F8",9.96,"Laoreet class nam turpis a habitant est. Feugiat nulla"
37.61,461.85,288.44,470.70,"/F8",9.96,"cum quam rhoncus at in porttitor ullamcorper malesuada."
37.61,449.90,288.46,458.74,"/F8",9.96,"Viverra augue sed elementum cursus tempor lorem ad."
37.61,437.94,288.45,446.79,"/F8",9.96,"Commodo porta elit tempor nam ve consectetuer litora ve"
37.61,425.99,288.42,434.83,"/F8",9.96,"vehicula gravida id aptent. Gravida fames duis molestie"
37.61,414.03,288.37,422.88,"/F8",9.96,"netus tincidunt praesent nunc ligula sit pulvinar. Potenti"
37.61,402.08,288.44,410.92,"/F8",9.96,"porta. Euismod morbi erat libero luctus netus. Commodo"
37.61,390.12,288.42,398.97,"/F8",9.96,"dolor. Integer lorem leo metus porttitor lectus orci. Po-"
37.61,378.17,288.41,387.01,"/F8",9.96,"suere netus gravida. Dapibus justo nunc a. Gravida velit."
37.61,366.21,288.38,375.06,"/F8",9.96,"Potenti augue. Quisque neque. Aliquet velit parturient"
37.61,354.26,288.42,363.10,"/F8",9.96,"dictumst euismod nisl orci sagittis elementum. Euismod"
37.61,342.30,288.41,351.15,"/F8",9.96,"metus elit eni eget cras volutpat cubilia. Pretium porta"
37.61,330.34,288.44,339.19,"/F8",9.96,"nisi non per conubia metus in varius viverra. Natoque"
37.61,318.39,288.37,327.24,"/F8",9.96,"class id tellus suscipit diam dictum pulvinar tincidunt ante"
37.61,306.43,161.60,315.28,"/F8",9.96,"cras placerat magna dictum."
52.56,294.48,288.43,303.33,"/F8",9.96,"Dapibus nulla est elit aliquam at imperdiet eget. Po-"
37.61,282.52,288.36,291.37,"/F8",9.96,"suere fusce adipiscing potenti dui ut facilisi. Aliquam velit."
37.61,270.57,288.44,279.42,"/F8",9.96,"Egestas felis. Nonummy class amet placerat dis. Cubilia"
37.61,258.61,288.44,267.46,"/F8",9.96,"augue massa. Cubilia lorem mi cursus pellentesque dui"
37.61,246.66,288.47,255.51,"/F8",9.96,"morbi lacus. Aliquam donec magna nostra vitae neque"
37.61,234.70,288.46,243.55,"/F8",9.96,"egestas. Laoreet magna lacus natoque aliquet. Potenti"
37.61,222.75,288.41,231.60,"/F8",9.96,"augue sed nisi laoreet ante ve hendrerit posuere. Aliquet"
37.61,210.79,288.41,219.64,"/F8",9.96,"ipsum velit mus odio sollicitudin gravida eleifend congue"
37.61,198.84,288.40,207.68,"/F8",9.96,"nullam nulla. Pretium lorem in taciti blandit sapien diam"
37.61,186.88,288.42,195.73,"/F8",9.96,"erat rhoncus. Cubilia fames id tempor fermentum dapibus."
37.61,174.93,288.45,183.77,"/F8",9.96,"Rhoncus vitae etiam placerat dolor ve massa id erat pul-"
37.61,162.97,288.41,171.82,"/F8",9.96,"vinar dolor. Nonummy netus. Quisque purus vestibulum"
37.61,151.02,288.46,159.86,"/F8",9.96,"nonummy nisi mi hendrerit lacus a. Integer magna ve"
37.61,139.06,288.43,147.91,"/F8",9.96,"pharetra posuere penatibus platea lorem taciti ac ornare."
37.61,127.11,288.45,135.95,"/F8",9.96,"Integer class mi erat. Laoreet morbi porta luctus morbi"
37.61,115.15,288.44,124.00,"/F8",9.96,"cum mollis. Lacinia proin nulla dictum aenean. Iaculis"
37.61,103.20,234.12,112.04,"/F8",9.96,"vitae. Gravida porta id quis mattis habitant."
52.56,91.24,288.44,100.09,"/F8",9.96,"Gravida lorem parturient at habitasse metus fusce ve-"
37.61,79.29,288.45,88.13,"/F8",9.96,"hicula penatibus. Nonummy fames diam vehicula. Rhon-"
306.60,748.78,557.41,757.62,"/F8",9.96,"cus risus. Egestas curae vestibulum arcu rutrum natoque"
306.60,736.82,561.76,745.67,"/F8",9.96,"sed. Quisque neque mi auctor pellentesque curabitur massa."
306.60,724.87,557.42,733.71,"/F8",9.96,"Egestas purus leo donec fermentum scelerisque risus con-"
306.60,712.91,557.42,721.76,"/F8",9.96,"sequat nec habitasse nunc. Dapibus augue. Dapibus proin"
306.60,700.95,557.39,709.80,"/F8",9.96,"sem eros habitant dictumst pellentesque vestibulum. Non-"
306.60,689.00,557.45,697.85,"/F8",9.96,"ummy proin aliquam luctus purus ad hymenaeos fames."
306.60,677.04,557.42,685.89,"/F8",9.96,"Aliquet curae ac penatibus dapibus tellus cum ad a mauris"
306.60,665.09,557.39,673.94,"/F8",9.96,"imperdiet inceptos mollis. Sodales curae in. Cubilia risus"
306.60,653.13,557.42,661.98,"/F8",9.96,"eu venenatis vitae eget posuere montes auctor etiam condi-"
306.60,641.18,557.40,650.02,"/F8",9.96,"mentum senectus risus convallis pharetra. Iaculis etiam at"
306.60,629.22,557.37,638.07,"/F8",9.96,"ut nibh nisl porta quisque fringilla molestie ac taciti donec"
306.60,617.27,557.45,626.11,"/F8",9.96,"interdum ve ipsum. Laoreet curae nunc mollis mi mo-"
306.60,605.31,557.40,614.16,"/F8",9.96,"lestie eget gravida ridiculus enim consectetuer. Euismod"
306.60,593.36,557.41,602.20,"/F8",9.96,"fusce nec. Iaculis risus urna class nullam dolor nibh orci."
306.60,581.40,557.44,590.25,"/F8",9.96,"Pretium fusce id porta mus morbi cum hymenaeos luctus"
306.60,569.45,557.45,578.29,"/F8",9.96,"eleifend. Posuere fames. Natoque class. Commodo morbi."
306.60,557.49,431.58,566.34,"/F8",9.96,"Integer felis. Gravida massa."
306.60,527.60,483.48,536.45,"/F17",9.96,"3. Pretium vitae non mus aliquam."
321.55,506.68,557.41,515.53,"/F8",9.96,"Blandit nulla elit proin condimentum ve. Gravida ip-"
306.60,494.73,557.45,503.57,"/F8",9.96,"sum class vel. Natoque etiam augue cursus in cursus mo-"
306.60,482.77,557.40,491.62,"/F8",9.96,"lestie vel integer erat eros orci hendrerit. Laoreet lorem"
306.60,470.82,557.40,479.66,"/F8",9.96,"etiam dapibus est in nullam orci dignissim in sociis incep-"
306.60,458.86,557.45,467.71,"/F8",9.96,"tos vestibulum. Laoreet vitae odio commodo cras a nisl"
306.60,446.91,557.41,455.75,"/F8",9.96,"donec. Potenti etiam id semper hendrerit metus sociis."
306.60,434.95,557.38,443.80,"/F8",9.96,"Blandit nulla nibh hac nascetur. Cubilia justo id hendrerit"
306.60,423.00,557.45,431.84,"/F8",9.96,"mi nisi at hac mi a sociis. Natoque nulla sed porta sit"
306.60,411.04,557.42,419.89,"/F8",9.96,"lacinia nunc eros. Lacinia fames cum elit a. Feugiat fusce."
306.60,399.09,557.41,407.93,"/F8",9.96,"Cubilia fusce. Gravida metus nibh sociosqu. Laoreet justo"
306.60,387.13,557.47,395.98,"/F8",9.96,"integer auctor nec. Egestas dolor cras. Commodo fusce"
306.60,375.18,557.37,384.02,"/F8",9.96,"pede neque. Conubia risus. Quisque velit parturient senec-"
306.60,363.22,557.37,372.07,"/F8",9.96,"tus pretium tempor in suscipit arcu in tempus sollicitudin"
306.60,351.27,557.44,360.11,"/F8",9.96,"per. Gravida lorem eros. Laoreet fames sed nunc pellen-"
306.60,339.31,557.41,348.16,"/F8",9.96,"tesque at natoque ad vel ligula. Pretium justo duis vel"
306.60,327.36,557.42,336.20,"/F8",9.96,"vivamus mus faucibus nulla tempor quis. Viverra nulla"
306.60,315.40,508.75,324.25,"/F8",9.96,"enim magna vulputate pulvinar nullam augue."
321.55,303.45,386.43,312.29,"/F8",9.96,"Aliquet donec."
396.43,303.45,488.26,312.29,"/F8",9.96,"Blandit magna quis."
498.25,303.45,557.45,312.29,"/F8",9.96,"Iaculis metus"
306.60,291.49,557.38,300.34,"/F8",9.96,"nam. Integer ipsum felis fringilla integer felis vitae sapien"
306.60,279.53,557.42,288.38,"/F8",9.96,"magnis nulla ad. Feugiat vitae purus a nunc vestibulum"
306.60,267.58,557.40,276.43,"/F8",9.96,"rutrum ac sagittis. Sodales lorem id rutrum consectetuer."
306.60,255.62,557.40,264.47,"/F8",9.96,"Posuere fusce nisl praesent. Feugiat proin elit volutpat a"
306.60,243.67,557.42,252.52,"/F8",9.96,"habitant nisi dictum rhoncus. Conubia nulla. Rhoncus"
306.60,231.71,557.45,240.56,"/F8",9.96,"justo amet a. Aliquam donec ve in eros quis neque massa"
306.60,219.76,557.40,228.61,"/F8",9.96,"egestas. Lacinia proin nulla lobortis parturient rutrum"
306.60,207.80,364.04,216.65,"/F8",9.96,"cras gravida."
374.56,207.80,520.67,216.65,"/F8",9.96,"Euismod augue sem est aliquet."
531.19,207.80,557.46,216.65,"/F8",9.96,"Conu-"
306.60,195.85,557.45,204.70,"/F8",9.96,"bia neque ve lacus rutrum ad nam arcu urna eu duis."
306.60,183.89,557.42,192.74,"/F8",9.96,"Integer augue parturient nonummy eget rutrum vestibu-"
306.60,171.94,557.42,180.79,"/F8",9.96,"lum torquent duis magnis. Euismod risus morbi montes."
306.60,159.98,557.42,168.83,"/F8",9.96,"Laoreet massa at semper eu suscipit hac sollicitudin netus"
306.60,148.03,557.42,156.87,"/F8",9.96,"augue. Commodo fusce. Iaculis risus felis nisl eleifend."
306.60,136.07,557.41,144.92,"/F8",9.96,"Egestas purus parturient pharetra quisque eros. Vivamus"
306.60,124.12,557.42,132.96,"/F8",9.96,"etiam id. Potenti proin eu magna primis facilisis mus me-"
306.60,112.16,424.14,121.01,"/F8",9.96,"tus fringilla tincidunt ante."
321.55,100.21,557.46,109.05,"/F8",9.96,"Aliquam lacus mus montes. Blandit purus fames sed"
306.60,88.25,557.38,97.10,"/F8",9.96,"quam ultrices varius adipiscing class quis cubilia enim et."
295.15,61.35,300.13,70.20,"/F8",9.96,"3"
