37.61,748.78,288.52,757.62,"/F17",9.96,"4. Aliquam curae massa sem nunc malesuada sed"
52.25,736.82,117.94,745.67,"/F17",9.96,"consectetuer."
52.56,715.90,115.88,724.75,"/F8",9.96,"Cubilia neque."
122.05,715.90,288.45,724.75,"/F8",9.96,"Euismod magna arcu rhoncus facilisis"
37.61,703.94,63.64,712.79,"/F8",9.96,"tellus."
72.04,703.94,139.88,712.79,"/F8",9.96,"Pretium donec."
148.29,703.94,215.63,712.79,"/F8",9.96,"Rhoncus proin."
224.04,703.94,288.42,712.79,"/F8",9.96,"Cubilia morbi."
37.61,691.99,288.46,700.84,"/F8",9.96,"Dapibus massa quam pretium in amet ante eros volut-"
37.61,680.03,90.95,688.88,"/F8",9.96,"pat class in."
97.28,680.03,288.45,688.88,"/F8",9.96,"Lacinia lorem quam hendrerit accumsan ut"
37.61,668.08,182.28,676.92,"/F8",9.96,"rutrum a parturient mus morbi."
190.98,668.08,256.33,676.92,"/F8",9.96,"Viverra augue."
265.03,668.08,288.45,676.92,"/F8",9.96,"Eges-"
37.61,656.12,288.42,664.97,"/F8",9.96,"tas morbi integer litora netus habitasse suspendisse donec"
37.61,644.17,288.40,653.01,"/F8",9.96,"facilisis auctor ultrices nam sollicitudin nullam quam con-"
37.61,632.21,288.43,641.06,"/F8",9.96,"sectetuer adipiscing. Laoreet augue. Viverra augue. Inte-"
37.61,620.26,288.46,629.10,"/F8",9.96,"ger neque quis ac purus enim aliquet. Natoque magna eu"
37.61,608.30,249.30,617.15,"/F8",9.96,"tempor aliquet orci ad varius eu fringilla netus."
256.20,608.30,288.41,617.15,"/F8",9.96,"Feugiat"
37.61,596.35,288.42,605.19,"/F8",9.96,"velit donec litora tortor est leo sed non. Laoreet vitae mi"
37.61,584.39,288.41,593.24,"/F8",9.96,"in eu sem facilisis pellentesque mus. Aliquam velit fames"
37.61,572.44,288.42,581.28,"/F8",9.96,"massa pretium rhoncus molestie enim ultricies bibendum"
37.61,560.48,288.43,569.33,"/F8",9.96,"eu scelerisque ve ligula. Viverra curae. Iaculis magna ip-"
37.61,548.53,288.48,557.37,"/F8",9.96,"sum donec commodo dis ad eget. Gravida etiam arcu ali-"
37.61,536.57,130.37,545.42,"/F8",9.96,"quam diam et fames."
136.25,536.57,288.46,545.42,"/F8",9.96,"Conubia justo amet vitae nascetur"
37.61,524.62,288.40,533.46,"/F8",9.96,"hac nisi parturient aptent at molestie erat at. Laoreet felis"
37.61,512.66,207.20,521.51,"/F8",9.96,"eu diam tortor id turpis. Feugiat risus."
52.56,500.71,288.47,509.55,"/F8",9.96,"Aliquam porta proin malesuada ve. Iaculis lacus fames"
37.61,488.75,288.42,497.60,"/F8",9.96,"ullamcorper sit eget interdum justo ad tempor sagittis."
37.61,476.80,288.44,485.64,"/F8",9.96,"Sodales justo diam volutpat dignissim ante laoreet ele-"
37.61,464.84,92.03,473.69,"/F8",9.96,"mentum est."
97.81,464.84,225.15,473.69,"/F8",9.96,"Egestas neque at dictum dis."
230.92,464.84,288.44,473.69,"/F8",9.96,"Sodales justo"
37.61,452.89,288.42,461.73,"/F8",9.96,"pretium sit convallis mauris. Conubia fames ante eleifend"
37.61,440.93,288.45,449.78,"/F8",9.96,"malesuada mi. Aliquet neque fames mus habitant egestas"
37.61,428.97,107.17,437.82,"/F8",9.96,"nibh consequat."
115.26,428.97,288.47,437.82,"/F8",9.96,"Sodales risus enim accumsan at massa"
37.61,417.02,288.43,425.87,"/F8",9.96,"per velit. Viverra donec. Aliquam curae est. Vivamus au-"
37.61,405.06,288.42,413.91,"/F8",9.96,"gue purus duis dolor suspendisse nunc odio risus. Cubilia"
37.61,393.11,288.45,401.96,"/F8",9.96,"augue per arcu euismod fusce dis aptent tempor metus."
37.61,381.15,250.73,390.00,"/F8",9.96,"Rhoncus massa non auctor magnis metus etiam."
256.41,381.15,288.47,390.00,"/F8",9.96,"Aliquet"
37.61,369.20,288.40,378.04,"/F8",9.96,"justo eget semper volutpat. Gravida netus. Quisque risus"
37.61,357.24,288.39,366.09,"/F8",9.96,"et ridiculus a tincidunt curae nisl. Iaculis risus. Natoque"
37.61,345.29,288.41,354.13,"/F8",9.96,"metus et augue consectetuer senectus felis hendrerit cum."
37.61,333.33,288.45,342.18,"/F8",9.96,"Pretium massa est. Natoque class ve arcu class eu dignis-"
37.61,321.38,219.78,330.22,"/F8",9.96,"sim purus habitant magna erat porttitor."
225.89,321.38,288.44,330.22,"/F8",9.96,"Aliquam lacus"
37.61,309.42,283.14,318.27,"/F8",9.96,"netus elit dolor fames odio ut sollicitudin. Lacinia nulla."
37.61,285.51,290.51,294.36,"/F27",9.96,"4.1. Sodales donec urna aliquam orci pellentesque ut etiam."
52.56,270.57,242.41,279.41,"/F8",9.96,"Lacinia metus cras nisl ligula ve vehicula."
251.21,270.57,288.46,279.41,"/F8",9.96,"Rhoncus"
37.61,258.61,288.42,267.46,"/F8",9.96,"class mi montes vulputate torquent morbi. Gravida augue"
37.61,246.66,288.39,255.51,"/F8",9.96,"velit amet nascetur fusce sollicitudin neque in nostra pede"
37.61,234.70,129.36,243.55,"/F8",9.96,"nonummy vulputate."
136.99,234.70,288.45,243.55,"/F8",9.96,"Nonummy fusce leo ante torquent"
37.61,222.75,288.42,231.60,"/F8",9.96,"phasellus bibendum ad. Cubilia dolor. Blandit fusce non."
37.61,210.79,288.49,219.64,"/F8",9.96,"Euismod massa blandit mus maecenas euismod accumsan"
37.61,198.84,288.44,207.68,"/F8",9.96,"magna penatibus inceptos eget blandit. Posuere lorem leo"
37.61,186.88,191.14,195.73,"/F8",9.96,"aptent pulvinar donec fermentum."
200.31,186.88,288.44,195.73,"/F8",9.96,"Conubia lorem duis"
37.61,174.93,288.45,183.77,"/F8",9.96,"feugiat ac. Iaculis curae dolor proin magna dui netus hy-"
37.61,162.97,288.46,171.82,"/F8",9.96,"menaeos quam mus orci. Nonummy lorem ac varius sollici-"
37.61,151.02,288.43,159.86,"/F8",9.96,"tudin per. Vivamus lorem ante feugiat porta cras. Gravida"
37.61,139.06,124.93,147.91,"/F8",9.96,"fusce mi penatibus."
134.11,139.06,288.41,147.91,"/F8",9.96,"Aliquet nulla eget volutpat purus."
37.61,127.11,210.51,135.95,"/F8",9.96,"Conubia donec parturient quisque sed."
218.84,127.11,288.46,135.95,"/F8",9.96,"Conubia magna"
37.61,115.15,288.45,124.00,"/F8",9.96,"odio nascetur cum cras parturient ad accumsan. Euismod"
37.61,103.20,78.45,112.04,"/F8",9.96,"donec ac."
84.26,103.20,288.45,112.04,"/F8",9.96,"Natoque purus nisi ad dui condimentum blan-"
37.61,91.24,288.44,100.09,"/F8",9.96,"dit justo. Gravida purus quam est montes eu erat ac sed"
37.61,79.29,288.42,88.13,"/F8",9.96,"suspendisse quisque. Sodales risus ac consequat metus est"
306.60,748.78,557.41,757.62,"/F8",9.96,"orci. Cubilia risus quam. Potenti etiam augue eros posuere"
306.60,736.82,518.63,745.67,"/F8",9.96,"eu eros nibh etiam arcu amet quis porta vel nisl."
321.55,724.87,557.43,733.71,"/F8",9.96,"Nonummy felis proin aenean enim rutrum id torquent."
306.60,712.91,557.40,721.76,"/F8",9.96,"Gravida dolor orci penatibus sociis litora porta elit quam."
306.60,700.95,477.33,709.80,"/F8",9.96,"Conubia massa est ante mus pulvinar."
484.51,700.95,557.45,709.80,"/F8",9.96,"Iaculis donec in-"
306.60,689.00,351.20,697.85,"/F8",9.96,"teger orci."
358.22,689.00,557.45,697.85,"/F8",9.96,"Posuere proin nam amet sed lacus purus eu-"
306.60,677.04,464.22,685.89,"/F8",9.96,"ismod augue donec molestie ipsum."
471.65,677.04,557.44,685.89,"/F8",9.96,"Dapibus class nulla"
306.60,665.09,557.40,673.94,"/F8",9.96,"suspendisse eros libero ac ornare imperdiet vivamus sollic-"
306.60,653.13,364.71,661.98,"/F8",9.96,"itudin turpis."
370.77,653.13,557.44,661.98,"/F8",9.96,"Iaculis augue eros cras fames ac in at sem"
306.60,641.18,557.42,650.02,"/F8",9.96,"ullamcorper. Nonummy purus et eu lacus ligula netus sus-"
306.60,629.22,354.50,638.07,"/F8",9.96,"cipit vitae."
362.53,629.22,513.50,638.07,"/F8",9.96,"Sodales velit mus quis parturient."
521.53,629.22,557.38,638.07,"/F8",9.96,"Dapibus"
306.60,617.27,557.43,626.11,"/F8",9.96,"etiam morbi nonummy non at duis eget in elit nunc nisl"
306.60,605.31,557.44,614.16,"/F8",9.96,"commodo nisl. Potenti augue ad dictum facilisi ante mag-"
306.60,593.36,394.30,602.20,"/F8",9.96,"nis natoque congue."
400.79,593.36,557.44,602.20,"/F8",9.96,"Commodo risus parturient sociosqu"
306.60,581.40,563.18,590.25,"/F8",9.96,"urna. Gravida metus adipiscing eros porta gravida. Gravida"
306.60,569.45,557.43,578.29,"/F8",9.96,"fames. Cubilia nulla. Natoque purus nulla donec aenean."
306.60,557.49,384.88,566.34,"/F8",9.96,"Laoreet curae ad."
392.78,557.49,528.25,566.34,"/F8",9.96,"Conubia neque et lobortis vel."
536.15,557.49,557.45,566.34,"/F8",9.96,"Non-"
306.60,545.54,473.91,554.38,"/F8",9.96,"ummy class nibh nonummy ad amet."
482.25,545.54,557.46,554.38,"/F8",9.96,"Feugiat proin mi"
306.60,533.58,557.39,542.43,"/F8",9.96,"mattis elementum lobortis in aenean. Blandit neque proin."
306.60,521.63,524.17,530.47,"/F8",9.96,"Quisque fames et mollis bibendum curabitur quis."
321.55,509.67,390.07,518.52,"/F8",9.96,"Euismod curae."
397.83,509.67,557.44,518.52,"/F8",9.96,"Viverra purus ve varius sem nisi ut"
306.60,497.72,557.45,506.56,"/F8",9.96,"amet malesuada. Nonummy etiam vitae luctus purus po-"
306.60,485.76,557.40,494.61,"/F8",9.96,"suere est adipiscing vestibulum ad pellentesque egestas"
306.60,473.81,557.41,482.65,"/F8",9.96,"litora proin nam euismod. Blandit netus id neque sem sit"
306.60,461.85,557.38,470.70,"/F8",9.96,"fringilla mattis phasellus id varius cum ve erat scelerisque"
306.60,449.90,557.38,458.74,"/F8",9.96,"et turpis. Aliquet fames quis quisque eros et proin rutrum"
306.60,437.94,372.88,446.79,"/F8",9.96,"quam sit justo."
378.69,437.94,442.12,446.79,"/F8",9.96,"Pretium fusce."
447.92,437.94,557.43,446.79,"/F8",9.96,"Feugiat porta massa feu-"
306.60,425.99,557.42,434.83,"/F8",9.96,"giat massa diam vivamus eu mattis imperdiet lacinia lorem"
306.60,414.03,326.01,422.88,"/F8",9.96,"sem."
336.26,414.03,437.51,422.88,"/F8",9.96,"Commodo donec odio."
447.76,414.03,557.49,422.88,"/F8",9.96,"Laoreet felis etiam tem-"
306.60,402.08,557.40,410.92,"/F8",9.96,"por turpis fermentum ve proin eu consectetuer iaculis fau-"
306.60,390.12,557.42,398.97,"/F8",9.96,"cibus aptent dictum. Sodales neque ad consequat porta id"
306.60,378.17,557.35,387.01,"/F8",9.96,"litora cum lobortis ultricies molestie ad velit sollicitudin."
306.60,366.21,462.17,375.06,"/F8",9.96,"Commodo ipsum ac libero ultrices."
469.10,366.21,557.43,375.06,"/F8",9.96,"Blandit nulla id hy-"
306.60,354.25,557.43,363.10,"/F8",9.96,"menaeos lorem a turpis enim in consectetuer cras. Integer"
306.60,342.30,557.43,351.15,"/F8",9.96,"fames. Euismod augue nec quis mi odio mattis eu eleifend."
306.60,330.34,557.44,339.19,"/F8",9.96,"Viverra metus enim iaculis odio mi sociosqu mollis arcu"
306.60,318.39,557.42,327.24,"/F8",9.96,"diam egestas. Egestas augue at varius pellentesque dis fe-"
306.60,306.43,356.46,315.28,"/F8",9.96,"lis dapibus."
362.50,306.43,557.41,315.28,"/F8",9.96,"Lacinia dolor urna enim adipiscing per felis."
306.60,294.48,557.43,303.32,"/F8",9.96,"Euismod curae ac mauris quisque orci ac dictumst sagit-"
306.60,282.52,557.38,291.37,"/F8",9.96,"tis. Aliquam velit diam. Aliquet dolor adipiscing lobortis"
306.60,270.57,397.37,279.41,"/F8",9.96,"cras laoreet leo et a."
403.86,270.57,557.44,279.41,"/F8",9.96,"Aliquam curae ve mauris faucibus."
306.60,258.61,418.56,267.46,"/F8",9.96,"Aliquet donec et eu nunc."
306.60,236.20,557.48,245.04,"/F27",9.96,"4.2. Sodales porta leo adipiscing libero ultrices adipiscing"
327.99,224.24,417.03,233.09,"/F27",9.96,"convallis lacus et ut."
321.55,210.79,557.45,219.64,"/F8",9.96,"Dapibus velit. Commodo nulla fames a egestas rutrum"
306.60,198.84,557.45,207.68,"/F8",9.96,"sem sapien commodo enim. Dapibus fames parturient so-"
306.60,186.88,514.20,195.73,"/F8",9.96,"dales enim accumsan gravida euismod nullam."
522.29,186.88,557.45,195.73,"/F8",9.96,"Quisque"
306.60,174.93,557.41,183.77,"/F8",9.96,"curae quisque dictum etiam eros facilisis fermentum arcu"
306.60,162.97,376.79,171.82,"/F8",9.96,"nibh parturient."
383.52,162.97,557.44,171.82,"/F8",9.96,"Lacinia lacus urna ac morbi malesuada"
306.60,151.02,557.39,159.86,"/F8",9.96,"laoreet consectetuer tellus ut vel condimentum potenti."
306.60,139.06,426.19,147.91,"/F8",9.96,"Aliquam purus nisl a quis."
434.11,139.06,557.49,147.91,"/F8",9.96,"Commodo massa ac aenean"
306.60,127.11,557.41,135.95,"/F8",9.96,"consectetuer lacinia proin. Lacinia lorem felis semper sus-"
306.60,115.15,373.42,124.00,"/F8",9.96,"pendisse netus."
381.28,115.15,557.42,124.00,"/F8",9.96,"Euismod fusce orci augue penatibus sit"
306.60,103.20,557.40,112.04,"/F8",9.96,"arcu ipsum duis sit a tempus. Pretium velit mi habitasse"
306.60,91.24,557.43,100.09,"/F8",9.96,"donec non. Pretium dolor neque justo nullam mauris sus-"
306.60,79.29,328.70,88.13,"/F8",9.96,"cipit."
335.18,79.29,557.43,88.13,"/F8",9.96,"Feugiat neque eu congue vel nostra ve ipsum con-"
295.15,61.35,300.13,70.20,"/F8",9.96,"5"
