557.11,803.82,562.09,812.67,"/F8",9.96,"3"
63.96,777.92,298.88,786.77,"/F8",9.96,"Iaculis vitae lorem a sodales in dapibus enim orci"
54.00,765.96,298.91,774.81,"/F8",9.96,"eni. Integer dolor hac etiam commodo augue nam eros"
54.00,754.01,80.82,762.86,"/F8",9.96,"quam."
91.56,754.01,298.86,762.86,"/F8",9.96,"Lacinia justo elit vivamus neque rhoncus ali-"
54.00,742.05,298.88,750.90,"/F8",9.96,"quet hymenaeos orci sodales ve. Feugiat magna cras sed"
54.00,730.10,298.83,738.95,"/F8",9.96,"fames amet leo rutrum mi. Potenti justo vestibulum eu."
54.00,718.14,298.85,726.99,"/F8",9.96,"Sodales proin euismod mus mattis et mauris curabitur."
54.00,706.19,298.82,715.03,"/F8",9.96,"Quisque fames id convallis suspendisse sed diam. Aliquet"
54.00,694.23,298.90,703.08,"/F8",9.96,"purus nibh per nunc a augue ac a. Conubia fames orci"
54.00,682.28,298.84,691.12,"/F8",9.96,"hendrerit molestie curae. Gravida donec eu pede felis"
54.00,670.32,298.86,679.17,"/F8",9.96,"laoreet sed. Dapibus metus. Quisque massa morbi hen-"
54.00,658.37,298.82,667.21,"/F8",9.96,"drerit parturient elit risus gravida. Conubia fames porta"
54.00,646.41,298.80,655.26,"/F8",9.96,"justo litora ipsum fringilla tristique ante sit. Gravida"
54.00,634.46,298.82,643.30,"/F8",9.96,"augue et class. Potenti velit vestibulum vehicula porta"
54.00,622.50,298.84,631.35,"/F8",9.96,"nam. Potenti proin pede interdum donec et nibh. Eu-"
54.00,610.55,298.85,619.39,"/F8",9.96,"ismod proin leo urna nulla morbi bibendum duis erat."
54.00,598.59,298.88,607.44,"/F8",9.96,"Natoque purus. Commodo donec orci dui potenti morbi"
54.00,586.64,298.84,595.48,"/F8",9.96,"conubia aptent. Feugiat proin ac mi cum porttitor sed."
54.00,574.68,298.83,583.53,"/F8",9.96,"Posuere class sed luctus posuere penatibus. Potenti porta"
54.00,562.73,298.79,571.57,"/F8",9.96,"diam tincidunt pellentesque nam facilisis aptent suscipit"
54.00,550.77,203.55,559.62,"/F8",9.96,"pede nostra hac eros metus libero."
63.96,538.47,298.85,547.32,"/F8",9.96,"Sodales lacus vel duis facilisi odio placerat senectus"
54.00,526.52,298.88,535.36,"/F8",9.96,"commodo eleifend. Quisque augue ut fames ad. Vivamus"
54.00,514.56,298.88,523.41,"/F8",9.96,"netus sem nunc mus nisl. Commodo curae. Cubilia pu-"
54.00,502.61,298.86,511.45,"/F8",9.96,"rus nisi. Potenti vitae. Rhoncus etiam at massa magnis"
54.00,490.65,298.81,499.50,"/F8",9.96,"ultricies viverra. Viverra curae dui nibh non etiam morbi"
54.00,478.70,298.86,487.54,"/F8",9.96,"nunc tempus orci ad ante lectus ad orci massa mauris tel-"
54.00,466.74,298.87,475.59,"/F8",9.96,"lus. Rhoncus felis pede. Blandit magna arcu nonummy"
54.00,454.79,298.84,463.63,"/F8",9.96,"lacinia quis elit. Vivamus fusce mus adipiscing ad aenean"
54.00,442.83,298.89,451.68,"/F8",9.96,"mi id. Commodo augue class nibh vulputate. Conu-"
54.00,430.88,298.84,439.72,"/F8",9.96,"bia fusce. Potenti neque. Aliquam donec ante sit metus"
54.00,418.92,298.85,427.77,"/F8",9.96,"phasellus pharetra ac. Conubia neque eros pretium erat"
54.00,406.97,298.86,415.81,"/F8",9.96,"hac a. Rhoncus lacus purus. Integer risus curae. Iaculis"
54.00,395.01,298.84,403.86,"/F8",9.96,"etiam parturient mi dictum ve sed penatibus. Vivamus"
54.00,383.06,298.83,391.90,"/F8",9.96,"proin. Blandit purus justo eleifend urna praesent fau-"
54.00,371.10,298.84,379.95,"/F8",9.96,"cibus. Laoreet augue proin dictumst parturient tempor"
54.00,359.15,257.12,367.99,"/F8",9.96,"ve eros nulla proin vulputate eleifend at sociis."
57.55,324.38,295.35,332.35,"/F19",8.97,"Quisque netus vestibulum ultrices donec curabitur."
63.96,297.72,298.88,306.57,"/F8",9.96,"Dapibus curae. Commodo nulla amet scelerisque sed"
54.00,285.77,298.84,294.61,"/F8",9.96,"auctor viverra lacinia. Laoreet curae nunc enim facilisi"
54.00,273.81,298.87,282.66,"/F8",9.96,"nisi aptent. Iaculis netus. Commodo curae ante tem-"
54.00,261.85,298.88,270.70,"/F8",9.96,"pus aliquet vivamus aenean erat odio hymenaeos. Po-"
54.00,249.90,298.84,258.75,"/F8",9.96,"suere risus mi neque penatibus sem consectetuer ac viva-"
54.00,237.94,298.86,246.79,"/F8",9.96,"mus. Euismod proin ante. Dapibus porta pede tempor"
54.00,225.99,298.86,234.84,"/F8",9.96,"penatibus donec. Blandit proin eu fames nisi sodales"
54.00,214.03,298.84,222.88,"/F8",9.96,"arcu penatibus. Conubia neque orci imperdiet. Euis-"
54.00,202.08,298.89,210.93,"/F8",9.96,"mod proin hac pede lorem egestas class augue mus tel-"
54.00,190.12,298.86,198.97,"/F8",9.96,"lus leo natoque. Euismod nulla. Rhoncus fames. Euis-"
54.00,178.17,298.91,187.01,"/F8",9.96,"mod proin massa per. Laoreet fames ad ornare non ia-"
54.00,166.21,298.79,175.06,"/F8",9.96,"culis ut integer eget pellentesque adipiscing urna tellus."
54.00,154.26,298.85,163.10,"/F8",9.96,"Rhoncus magna per. Blandit nulla. Pretium morbi vitae"
54.00,142.30,298.86,151.15,"/F8",9.96,"magna rutrum justo euismod aliquam mollis elit mi con-"
54.00,130.35,298.84,139.19,"/F8",9.96,"sectetuer. Gravida donec urna ante fermentum ad lectus"
54.00,118.39,298.84,127.24,"/F8",9.96,"quisque. Iaculis purus. Gravida etiam dapibus ut auc-"
317.01,777.92,561.83,786.77,"/F8",9.96,"tor sodales laoreet litora odio sociis primis facilisi urna."
317.01,765.96,548.13,774.81,"/F8",9.96,"Feugiat metus dolor suspendisse per montes conubia."
326.98,753.71,561.91,762.55,"/F8",9.96,"Nonummy massa diam leo congue tempor hendrerit."
317.01,741.75,561.85,750.60,"/F8",9.96,"Viverra proin. Conubia etiam curae per fusce hendrerit"
317.01,729.80,561.85,738.64,"/F8",9.96,"egestas taciti eu. Cubilia etiam duis diam. Aliquam vi-"
317.01,717.84,561.85,726.69,"/F8",9.96,"tae mi semper laoreet integer ligula. Posuere metus sem."
317.01,705.89,561.87,714.73,"/F8",9.96,"Rhoncus ipsum lorem pretium ve ad turpis vivamus ad"
317.01,693.93,561.83,702.78,"/F8",9.96,"hendrerit egestas. Dapibus morbi vestibulum pede etiam"
317.01,681.98,561.86,690.82,"/F8",9.96,"nullam suspendisse. Sodales magna eni sed fringilla mol-"
317.01,670.02,561.88,678.87,"/F8",9.96,"lis lorem pede. Egestas metus ve quam pede erat arcu"
317.01,658.07,561.85,666.91,"/F8",9.96,"quisque. Iaculis justo orci ante hac aliquam vitae eu la-"
317.01,646.11,561.87,654.96,"/F8",9.96,"cus ut eros enim gravida amet ac netus. Cubilia neque."
317.01,634.16,561.86,643.00,"/F8",9.96,"Aliquam velit metus nostra netus fames maecenas eni mi."
317.01,622.20,561.86,631.05,"/F8",9.96,"Posuere purus. Aliquet metus at nisi curae lectus mag-"
317.01,610.25,561.79,619.09,"/F8",9.96,"nis. Cubilia etiam velit ridiculus sem sollicitudin. Integer"
317.01,598.29,561.83,607.14,"/F8",9.96,"dolor cras suscipit class mattis habitasse turpis. Viverra"
317.01,586.34,561.84,595.18,"/F8",9.96,"felis. Gravida lacus ve tempus consectetuer euismod pul-"
317.01,574.38,561.83,583.23,"/F8",9.96,"vinar at. Feugiat class nisi laoreet aliquam blandit conse-"
317.01,562.42,561.82,571.27,"/F8",9.96,"quat cursus netus et quis ve urna eget imperdiet ultrices"
317.01,550.47,561.84,559.32,"/F8",9.96,"semper vestibulum dolor. Feugiat class nisi integer po-"
317.01,538.51,561.84,547.36,"/F8",9.96,"suere nisi ultrices maecenas velit feugiat. Conubia donec"
317.01,526.56,536.55,535.41,"/F8",9.96,"dolor erat consequat in ipsum sollicitudin suscipit."
365.07,492.02,513.90,499.98,"/F19",8.97,"Quisque fusce nisl dis duis arcu."
326.98,465.39,561.92,474.24,"/F8",9.96,"Integer curae lacus platea ornare. Nonummy massa"
317.01,453.44,561.81,462.28,"/F8",9.96,"elit a purus. Aliquet justo adipiscing scelerisque varius"
317.01,441.48,561.83,450.33,"/F8",9.96,"ac facilisis. Cubilia proin posuere blandit nisi. Nonummy"
317.01,429.53,561.83,438.37,"/F8",9.96,"dolor diam nullam integer dapibus inceptos elit. Aliquet"
317.01,417.57,561.86,426.42,"/F8",9.96,"metus. Laoreet netus nisl rutrum egestas. Vivamus porta"
317.01,405.62,561.84,414.46,"/F8",9.96,"arcu nonummy eu tincidunt et taciti. Egestas dolor nunc"
317.01,393.66,561.80,402.51,"/F8",9.96,"penatibus phasellus sollicitudin vel justo eni parturient"
317.01,381.71,561.89,390.55,"/F8",9.96,"mollis. Commodo vitae lacus laoreet eni eu. Posuere"
317.01,369.75,561.85,378.60,"/F8",9.96,"etiam augue iaculis rhoncus amet pretium eni interdum a"
317.01,357.80,561.83,366.64,"/F8",9.96,"pellentesque arcu vivamus at volutpat pretium. Conubia"
317.01,345.84,561.84,354.69,"/F8",9.96,"porta hac cras tristique libero aptent sit. Cubilia magna"
317.01,333.89,561.83,342.73,"/F8",9.96,"nisi risus. Lacinia etiam. Integer curae nisl aliquet diam"
317.01,321.93,561.89,330.78,"/F8",9.96,"non fusce. Rhoncus magna per nisi ante vitae cursus"
317.01,309.98,561.88,318.82,"/F8",9.96,"etiam suspendisse pede. Commodo ipsum. Dapibus vi-"
317.01,298.02,561.81,306.87,"/F8",9.96,"tae. Aliquet porta dui quis integer ut netus sit lobortis."
317.01,286.07,561.84,294.91,"/F8",9.96,"Posuere fusce nisi est gravida at sagittis ligula. Iaculis"
317.01,274.11,561.87,282.96,"/F8",9.96,"dolor dui enim est feugiat amet primis nam ad. Iaculis"
317.01,262.16,408.91,271.00,"/F8",9.96,"lacus arcu magna eu."
326.98,249.90,561.91,258.75,"/F8",9.96,"Conubia donec vestibulum eget augue praesent"
317.01,237.94,561.87,246.79,"/F8",9.96,"vestibulum mattis. Egestas lorem id hymenaeos urna"
317.01,225.99,561.83,234.84,"/F8",9.96,"erat eget. Rhoncus porta at risus ultricies nisi. Aliquam"
317.01,214.03,561.89,222.88,"/F8",9.96,"fusce mi augue suspendisse. Sodales justo magna mauris"
317.01,202.08,561.88,210.92,"/F8",9.96,"sed integer odio. Commodo risus nibh consequat sapien"
317.01,190.12,561.89,198.97,"/F8",9.96,"accumsan diam conubia. Rhoncus justo. Viverra fusce"
317.01,178.17,561.82,187.01,"/F8",9.96,"non porttitor taciti fusce nibh. Iaculis class urna dapibus"
317.01,166.21,561.85,175.06,"/F8",9.96,"curae leo arcu pellentesque interdum ipsum eu a luctus"
317.01,154.26,561.82,163.10,"/F8",9.96,"risus. Integer felis eni parturient etiam eros cursus proin"
317.01,142.30,561.87,151.15,"/F8",9.96,"dui blandit facilisi. Rhoncus magna nibh quam ipsum"
317.01,130.35,561.81,139.19,"/F8",9.96,"ultrices. Cubilia ipsum arcu nisl felis faucibus dolor non."
317.01,118.39,561.86,127.24,"/F8",9.96,"Nonummy proin. Euismod augue nec parturient vestibu-"
