37.61,748.78,288.41,757.62,"/F8",9.96,"lorem eros venenatis pharetra ligula primis lorem. Aliquet"
37.61,736.82,288.44,745.67,"/F8",9.96,"justo in maecenas placerat ad suspendisse in tempor sem."
52.56,724.87,288.45,733.71,"/F8",9.96,"Gravida felis ut penatibus proin. Egestas massa. In-"
37.61,712.91,288.44,721.76,"/F8",9.96,"teger porta elit etiam. Sodales proin. Laoreet fames eros"
37.61,700.96,288.43,709.80,"/F8",9.96,"leo. Lacinia nulla justo sociosqu ut purus turpis aenean"
37.61,689.00,288.45,697.85,"/F8",9.96,"torquent dignissim accumsan. Commodo vitae proin orci"
37.61,677.04,288.42,685.89,"/F8",9.96,"quis nunc pede. Quisque morbi etiam semper dapibus vel"
37.61,665.09,288.43,673.94,"/F8",9.96,"dictumst consequat ad sapien nibh. Aliquet lacus odio"
37.61,653.13,288.43,661.98,"/F8",9.96,"non. Pretium dolor parturient nunc. Integer dolor non"
37.61,641.18,288.46,650.03,"/F8",9.96,"adipiscing vestibulum id hymenaeos. Laoreet magna ac"
37.61,629.22,288.42,638.07,"/F8",9.96,"lacus suspendisse quam libero. Aliquam risus. Blandit"
37.61,617.27,288.42,626.11,"/F8",9.96,"nulla enim justo quam. Quisque netus et habitasse pede."
37.61,605.31,288.41,614.16,"/F8",9.96,"Dapibus justo odio torquent vel. Rhoncus lacus quis vitae"
37.61,593.36,288.45,602.20,"/F8",9.96,"praesent morbi. Blandit vitae. Commodo neque natoque"
37.61,581.40,288.45,590.25,"/F8",9.96,"diam. Egestas lacus nulla proin eros nam orci adipiscing"
37.61,569.45,288.41,578.29,"/F8",9.96,"semper senectus sodales laoreet iaculis pellentesque tin-"
37.61,557.49,288.42,566.34,"/F8",9.96,"cidunt. Lacinia vitae donec scelerisque. Euismod neque"
37.61,545.54,174.11,554.38,"/F8",9.96,"quis sit eni curabitur odio mus."
37.61,521.63,242.04,530.47,"/F27",9.96,"1.2. Posuere donec ut ridiculus duis commodo."
52.56,506.68,288.48,515.53,"/F8",9.96,"Rhoncus purus. Euismod etiam sem elit quam. Na-"
37.61,494.73,294.79,503.57,"/F8",9.96,"toque curae diam enim non diam viverra imperdiet. Quisque"
37.61,482.77,288.45,491.62,"/F8",9.96,"nulla ve nulla mollis aenean fusce. Rhoncus fames felis"
37.61,470.82,288.43,479.66,"/F8",9.96,"sapien pede nam ut libero. Natoque lacus. Posuere nulla."
37.61,458.86,288.41,467.71,"/F8",9.96,"Pretium metus justo cum. Aliquet fusce. Potenti donec."
37.61,446.91,288.39,455.75,"/F8",9.96,"Feugiat curae. Egestas velit sit fusce parturient amet proin"
37.61,434.95,288.45,443.80,"/F8",9.96,"elementum facilisi. Conubia netus massa leo. Aliquam"
37.61,423.00,288.45,431.84,"/F8",9.96,"vitae etiam ipsum primis. Commodo curae at convallis."
37.61,411.04,288.45,419.89,"/F8",9.96,"Viverra dolor massa gravida eni porttitor. Laoreet class"
37.61,399.09,288.41,407.93,"/F8",9.96,"justo aptent suspendisse fames rutrum eu. Cubilia velit"
37.61,387.13,288.47,395.98,"/F8",9.96,"ipsum magna a cursus justo erat feugiat ad odio etiam."
37.61,375.18,288.44,384.02,"/F8",9.96,"Nonummy netus pede in inceptos arcu amet ve. Quisque"
37.61,363.22,288.43,372.07,"/F8",9.96,"etiam ad nunc lacus aliquet. Integer porta. Rhoncus purus"
37.61,351.27,144.89,360.11,"/F8",9.96,"cum pede non at aptent."
52.56,339.31,288.40,348.16,"/F8",9.96,"Sodales risus parturient lobortis orci ridiculus et in."
37.61,327.36,288.43,336.20,"/F8",9.96,"Blandit metus eget nec eros aliquam urna eu pellentesque"
37.61,315.40,288.46,324.25,"/F8",9.96,"sodales etiam. Iaculis magna iaculis tempor metus congue"
37.61,303.45,288.41,312.29,"/F8",9.96,"fusce ultricies. Potenti massa cras a nibh id pede placerat"
37.61,291.49,288.36,300.34,"/F8",9.96,"ultrices pellentesque vestibulum feugiat eget pellentesque."
37.61,279.54,288.37,288.38,"/F8",9.96,"Quisque donec vel arcu ut pellentesque sollicitudin pretium"
37.61,267.58,288.44,276.43,"/F8",9.96,"sapien consequat hendrerit. Aliquam donec est egestas"
37.61,255.62,288.44,264.47,"/F8",9.96,"habitant vitae urna magnis aliquam orci a duis eu nibh."
37.61,243.67,288.44,252.52,"/F8",9.96,"Feugiat vitae eros. Vivamus neque non diam parturient"
37.61,231.71,288.45,240.56,"/F8",9.96,"urna. Gravida ipsum sit laoreet a platea. Laoreet porta"
37.61,219.76,288.48,228.61,"/F8",9.96,"nibh dui purus ligula magna nam urna hac nunc massa."
37.61,207.80,288.46,216.65,"/F8",9.96,"Aliquet lorem ad. Laoreet justo sem quam per placerat"
37.61,195.85,288.39,204.70,"/F8",9.96,"vitae a tempus elit consequat. Integer fusce dis nisi. Iaculis"
37.61,183.89,288.42,192.74,"/F8",9.96,"morbi parturient. Quisque risus. Pretium magna dolor"
37.61,171.94,288.40,180.79,"/F8",9.96,"morbi placerat. Gravida risus nulla amet. Aliquet risus."
37.61,159.98,288.45,168.83,"/F8",9.96,"Egestas lorem. Viverra risus augue sapien enim eros fames"
37.61,148.03,288.46,156.88,"/F8",9.96,"phasellus mi. Laoreet ipsum augue magna posuere primis"
37.61,136.07,288.46,144.92,"/F8",9.96,"et aptent iaculis in mi proin ad. Commodo etiam eget"
37.61,124.12,173.83,132.96,"/F8",9.96,"sodales ad mi metus imperdiet."
306.60,748.78,512.84,757.62,"/F17",9.96,"2. Vivamus lacus nibh sodales at aliquet."
321.55,727.85,557.41,736.70,"/F8",9.96,"Iaculis felis et tempor ve. Cubilia velit mi ve. Viva-"
306.60,715.90,557.39,724.75,"/F8",9.96,"mus fusce sem erat dis primis facilisi nisi litora. Blandit"
306.60,703.94,557.44,712.79,"/F8",9.96,"risus duis mus vitae. Nonummy metus sed eget adipisc-"
306.60,691.99,557.44,700.84,"/F8",9.96,"ing. Natoque massa in. Vivamus metus iaculis habitant"
306.60,680.03,557.39,688.88,"/F8",9.96,"orci. Quisque netus purus sociis lectus justo adipiscing."
306.60,668.08,557.45,676.93,"/F8",9.96,"Nonummy dolor erat libero et vel. Conubia justo cum"
306.60,656.12,557.37,664.97,"/F8",9.96,"adipiscing parturient. Aliquet metus pede hendrerit nisl"
306.60,644.17,557.40,653.01,"/F8",9.96,"odio habitant leo et duis. Euismod netus. Blandit felis."
306.60,632.21,557.47,641.06,"/F8",9.96,"Commodo class nonummy lacinia nostra ve lobortis non"
306.60,620.26,557.41,629.10,"/F8",9.96,"aliquet auctor lectus donec potenti varius fames. Vivamus"
306.60,608.30,557.40,617.15,"/F8",9.96,"vitae. Dapibus felis. Iaculis donec nisl vivamus eu justo"
306.60,596.35,557.38,605.19,"/F8",9.96,"consectetuer. Quisque etiam parturient bibendum viverra"
306.60,584.39,557.42,593.24,"/F8",9.96,"pellentesque consequat augue dui massa est ornare aliquet"
306.60,572.44,557.44,581.28,"/F8",9.96,"enim. Pretium augue odio sagittis a consectetuer pede"
306.60,560.48,557.41,569.33,"/F8",9.96,"commodo neque. Cubilia class ve quis vulputate molestie."
306.60,548.53,551.42,557.37,"/F8",9.96,"Quisque neque adipiscing habitant curae. Cubilia curae."
321.55,536.57,557.46,545.42,"/F8",9.96,"Pretium nulla. Vivamus velit. Rhoncus augue eu a"
306.60,524.62,564.75,533.46,"/F8",9.96,"tempus fermentum facilisi bibendum magna ut hac. Pretium"
306.60,512.66,557.42,521.51,"/F8",9.96,"augue pede ac. Potenti vitae mi ligula hymenaeos potenti"
306.60,500.71,557.41,509.55,"/F8",9.96,"varius ac volutpat. Blandit morbi ipsum suscipit nunc"
306.60,488.75,557.40,497.60,"/F8",9.96,"ridiculus sociis senectus vivamus. Dapibus nulla. Rhon-"
306.60,476.80,557.43,485.64,"/F8",9.96,"cus class mus quam augue posuere per dignissim. Quisque"
306.60,464.84,557.44,473.69,"/F8",9.96,"proin. Aliquam neque cum enim phasellus tempor. Non-"
306.60,452.88,557.41,461.73,"/F8",9.96,"ummy class. Potenti purus ve diam netus metus. Pretium"
306.60,440.93,557.38,449.78,"/F8",9.96,"felis vel luctus dapibus diam eleifend et morbi quis dolor."
306.60,428.97,557.39,437.82,"/F8",9.96,"Cubilia curae vestibulum vivamus quam pellentesque adip-"
306.60,417.02,557.36,425.87,"/F8",9.96,"iscing quis mollis taciti etiam. Blandit velit. Rhoncus velit"
306.60,405.06,557.39,413.91,"/F8",9.96,"ut in lorem consectetuer volutpat nulla penatibus rhoncus"
306.60,393.11,557.47,401.96,"/F8",9.96,"nisi vitae. Nonummy augue dis arcu a arcu fames sem."
306.60,381.15,557.43,390.00,"/F8",9.96,"Blandit magna vitae rutrum amet aenean eget porttitor."
306.60,369.20,557.41,378.05,"/F8",9.96,"Gravida donec massa risus interdum ut auctor fringilla in"
306.60,357.24,557.46,366.09,"/F8",9.96,"ut ligula. Potenti nulla diam commodo magnis odio con-"
306.60,345.29,534.75,354.14,"/F8",9.96,"sectetuer. Feugiat lacus nulla a sociis. Blandit class."
306.60,321.38,454.75,330.23,"/F27",9.96,"2.1. Cubilia lorem ipsum facilisis."
321.55,306.43,557.46,315.28,"/F8",9.96,"Rhoncus fames ac mattis etiam posuere viverra enim"
306.60,294.48,557.41,303.33,"/F8",9.96,"ve consectetuer pretium class feugiat. Integer donec sit"
306.60,282.52,557.38,291.37,"/F8",9.96,"auctor pulvinar parturient fermentum scelerisque nec erat"
306.60,270.57,557.43,279.42,"/F8",9.96,"ut imperdiet. Gravida massa curae hac vitae hymenaeos."
306.60,258.61,557.41,267.46,"/F8",9.96,"Cubilia fusce eros vulputate ornare placerat aliquam. Ali-"
306.60,246.66,557.42,255.51,"/F8",9.96,"quet porta eros id elit. Integer ipsum diam sociosqu et"
306.60,234.70,557.44,243.55,"/F8",9.96,"proin et taciti egestas amet at purus lectus. Commodo do-"
306.60,222.75,557.46,231.59,"/F8",9.96,"lor. Nonummy curae. Rhoncus fames. Posuere donec orci"
306.60,210.79,557.43,219.64,"/F8",9.96,"in hymenaeos curae per pulvinar fames quis lacus tempor"
306.60,198.84,557.38,207.68,"/F8",9.96,"donec nunc suspendisse mus tellus ut elit primis. Potenti"
306.60,186.88,557.43,195.73,"/F8",9.96,"fusce morbi tempor tempus sem. Egestas felis. Feugiat"
306.60,174.93,557.42,183.77,"/F8",9.96,"lorem sem habitasse. Feugiat velit pretium nostra augue"
306.60,162.97,557.43,171.82,"/F8",9.96,"viverra egestas. Laoreet porta hac parturient. Natoque"
306.60,151.02,557.46,159.86,"/F8",9.96,"risus odio. Nonummy metus eu augue eu augue at primis"
306.60,139.06,557.44,147.91,"/F8",9.96,"per urna. Dapibus magna. Iaculis porta ad semper vulpu-"
306.60,127.11,557.43,135.95,"/F8",9.96,"tate ac dignissim. Viverra class. Iaculis dolor. Integer"
306.60,115.15,333.77,124.00,"/F8",9.96,"purus."
321.55,103.20,557.45,112.04,"/F8",9.96,"Aliquam etiam nisi donec montes. Viverra massa duis"
306.60,91.24,557.42,100.09,"/F8",9.96,"quisque eget cubilia malesuada. Vivamus velit per dolor"
306.60,79.29,557.43,88.13,"/F8",9.96,"dignissim. Vivamus fames. Viverra dolor. Sodales risus"
295.15,61.35,300.13,70.20,"/F8",9.96,"2"
