37.61,748.78,288.45,757.62,"/F8",9.96,"metus arcu ridiculus sapien massa. Conubia ipsum morbi"
37.61,736.82,288.43,745.67,"/F8",9.96,"egestas porta duis eget vehicula purus eu metus mollis ip-"
37.61,724.87,288.50,733.71,"/F8",9.96,"sum ac dictum pharetra aliquam. Commodo magna ante"
37.61,712.91,288.47,721.76,"/F8",9.96,"dolor fames nibh. Dapibus metus eu magna litora sus-"
37.61,700.96,288.38,709.80,"/F8",9.96,"pendisse nulla fringilla sit elit. Quisque fusce. Dapibus"
37.61,689.00,288.44,697.85,"/F8",9.96,"fusce lacus rutrum sociis etiam et. Nonummy nulla adip-"
37.61,677.04,288.43,685.89,"/F8",9.96,"iscing urna purus. Integer porta parturient eros semper"
37.61,665.09,288.44,673.94,"/F8",9.96,"penatibus purus. Commodo class. Egestas risus potenti"
37.61,653.13,288.41,661.98,"/F8",9.96,"aliquam amet pede inceptos vitae nisl fusce. Gravida class."
37.61,641.18,300.82,650.03,"/F8",9.96,"Gravida donec nibh in faucibus iaculis sollicitudin hymenaeos."
37.61,629.22,290.33,638.07,"/F8",9.96,"Laoreet fusce aliquam ve lobortis blandit suscipit ut. Conu-"
37.61,617.27,288.43,626.11,"/F8",9.96,"bia donec. Vivamus fusce eu ligula a feugiat. Iaculis neque."
37.61,593.36,118.76,602.20,"/F27",9.96,"1.2. Egestas risus."
52.56,578.41,288.46,587.26,"/F8",9.96,"Conubia fames nisi dictum egestas libero fames nisl"
37.61,566.46,288.43,575.31,"/F8",9.96,"quisque ve hendrerit commodo. Egestas nulla justo tor-"
37.61,554.50,288.40,563.35,"/F8",9.96,"tor platea vitae imperdiet suspendisse leo. Pretium neque"
37.61,542.55,288.43,551.40,"/F8",9.96,"ante. Egestas class cras ultrices malesuada ac mattis. Feu-"
37.61,530.59,288.42,539.44,"/F8",9.96,"giat metus proin bibendum hendrerit. Aliquam ipsum at"
37.61,518.64,288.46,527.48,"/F8",9.96,"tempus. Euismod etiam ut eget ullamcorper. Laoreet"
37.61,506.68,288.45,515.53,"/F8",9.96,"etiam ut cursus aliquam ante suscipit commodo luctus"
37.61,494.73,288.46,503.57,"/F8",9.96,"porta euismod. Aliquam augue arcu dignissim elemen-"
37.61,482.77,288.46,491.62,"/F8",9.96,"tum sollicitudin. Nonummy magna natoque magnis eget"
37.61,470.82,288.42,479.66,"/F8",9.96,"lectus eu egestas in ante nulla ad auctor mi. Natoque velit"
37.61,458.86,288.42,467.71,"/F8",9.96,"nibh. Potenti ipsum eget ridiculus mus. Potenti massa"
37.61,446.91,288.41,455.75,"/F8",9.96,"dis class sociis rutrum fermentum felis ut. Integer class"
37.61,434.95,288.42,443.80,"/F8",9.96,"in consectetuer taciti curae adipiscing. Lacinia purus ac"
37.61,423.00,288.40,431.84,"/F8",9.96,"hendrerit nonummy sed adipiscing parturient in. Gravida"
37.61,411.04,288.42,419.89,"/F8",9.96,"risus leo duis. Integer class mi ad neque ultricies rhon-"
37.61,399.09,288.44,407.93,"/F8",9.96,"cus dolor diam ultricies at ullamcorper. Vivamus magna."
37.61,387.13,288.44,395.98,"/F8",9.96,"Quisque lacus leo eget ut. Potenti massa ac luctus nam."
37.61,375.18,184.46,384.02,"/F8",9.96,"Euismod metus. Nonummy justo."
52.56,363.22,288.45,372.07,"/F8",9.96,"Quisque dolor ad. Blandit augue nisi. Aliquam fames"
37.61,351.27,289.06,360.11,"/F8",9.96,"nisi senectus posuere conubia ridiculus tempus nec quisque."
37.61,339.31,288.44,348.16,"/F8",9.96,"Feugiat morbi odio posuere eu in odio mi class ac velit auc-"
37.61,327.36,288.43,336.20,"/F8",9.96,"tor. Natoque netus ac primis rhoncus per vehicula. Eu-"
37.61,315.40,288.47,324.25,"/F8",9.96,"ismod massa diam nulla porttitor euismod massa. Blan-"
37.61,303.45,288.40,312.29,"/F8",9.96,"dit morbi id tellus in ante fusce convallis potenti sociis"
37.61,291.49,288.41,300.34,"/F8",9.96,"cras. Blandit curae lorem mollis at primis in netus pellen-"
37.61,279.54,288.39,288.38,"/F8",9.96,"tesque phasellus. Cubilia proin. Quisque nulla est vitae"
37.61,267.58,288.41,276.43,"/F8",9.96,"dis placerat pellentesque. Aliquam curae erat eget dignis-"
37.61,255.62,288.39,264.47,"/F8",9.96,"sim ligula adipiscing sollicitudin. Aliquet nulla mus class"
37.61,243.67,288.43,252.52,"/F8",9.96,"enim vivamus ve primis suscipit. Rhoncus magna orci cur-"
37.61,231.71,288.44,240.56,"/F8",9.96,"sus montes nulla. Integer netus. Egestas massa et ve sit"
37.61,219.76,288.44,228.61,"/F8",9.96,"ad lobortis. Posuere curae dis posuere ve diam interdum"
37.61,207.80,288.40,216.65,"/F8",9.96,"porta. Potenti neque. Iaculis curae. Potenti justo orci ve"
37.61,195.85,288.43,204.70,"/F8",9.96,"metus et ante bibendum feugiat et vel. Aliquam neque."
37.61,183.89,288.43,192.74,"/F8",9.96,"Gravida justo nulla a sodales in at nisl bibendum sollic-"
37.61,171.94,288.40,180.79,"/F8",9.96,"itudin ornare. Blandit dolor cras cum elit sit curabitur"
37.61,159.98,151.69,168.83,"/F8",9.96,"varius faucibus adipiscing."
37.61,130.10,128.78,138.94,"/F17",9.96,"2. Quisque neque."
52.56,109.17,288.45,118.02,"/F8",9.96,"Nonummy velit fusce nam. Viverra fusce vitae aptent"
37.61,97.22,288.42,106.07,"/F8",9.96,"ante conubia. Gravida morbi nisi pede varius ve. Aliquam"
37.61,85.26,288.45,94.11,"/F8",9.96,"purus sed maecenas. Quisque morbi pede vivamus class"
306.60,748.78,557.41,757.62,"/F8",9.96,"arcu neque fusce dolor libero nascetur fringilla et morbi"
306.60,736.82,557.42,745.67,"/F8",9.96,"nibh dictumst. Dapibus fusce erat class ad fermentum"
306.60,724.87,557.44,733.71,"/F8",9.96,"a imperdiet proin nam. Viverra justo eros donec viva-"
306.60,712.91,557.42,721.76,"/F8",9.96,"mus ligula class adipiscing. Laoreet donec viverra mi nibh"
306.60,700.95,557.42,709.80,"/F8",9.96,"congue tellus dolor cum etiam ridiculus rhoncus etiam ac."
306.60,689.00,557.44,697.85,"/F8",9.96,"Egestas augue pede amet quisque. Potenti etiam non."
306.60,677.04,557.40,685.89,"/F8",9.96,"Commodo risus parturient eros ultricies hendrerit nunc"
306.60,665.09,557.41,673.94,"/F8",9.96,"urna velit magnis et neque pellentesque felis. Nonummy"
306.60,653.13,557.44,661.98,"/F8",9.96,"justo. Blandit massa. Natoque lorem netus sociis fusce"
306.60,641.18,557.38,650.03,"/F8",9.96,"mollis lectus pulvinar duis praesent penatibus a penatibus"
306.60,629.22,557.41,638.07,"/F8",9.96,"porta. Posuere etiam quam ultrices adipiscing tortor arcu"
306.60,617.27,557.41,626.12,"/F8",9.96,"consectetuer ac class. Iaculis netus cum rhoncus elit nunc"
306.60,605.31,557.44,614.16,"/F8",9.96,"nisl commodo ac facilisis at luctus. Conubia fusce nunc"
306.60,593.36,557.42,602.21,"/F8",9.96,"quisque risus et. Natoque magna eget est. Potenti felis"
306.60,581.40,557.40,590.25,"/F8",9.96,"dui eros eni nibh enim curae nascetur netus nisi id. Euis-"
306.60,569.45,557.44,578.29,"/F8",9.96,"mod fames. Laoreet purus urna rhoncus eu. Posuere velit"
306.60,557.49,440.29,566.34,"/F8",9.96,"pede vivamus curae amet mus."
321.55,545.54,557.42,554.38,"/F8",9.96,"Integer etiam ac elit ridiculus maecenas cursus elit ac."
306.60,533.58,557.41,542.43,"/F8",9.96,"Potenti etiam felis. Iaculis class diam. Viverra proin eu"
306.60,521.63,557.41,530.47,"/F8",9.96,"libero quis aliquam ve tellus nisi non quam torquent a"
306.60,509.67,557.41,518.52,"/F8",9.96,"pellentesque. Vivamus vitae cras faucibus enim per vel"
306.60,497.72,557.42,506.56,"/F8",9.96,"sollicitudin. Commodo augue eros ante fusce viverra nul-"
306.60,485.76,557.42,494.61,"/F8",9.96,"lam et quis vulputate. Feugiat justo. Laoreet donec fames"
306.60,473.81,557.39,482.65,"/F8",9.96,"quis erat nostra adipiscing suscipit laoreet. Gravida class"
306.60,461.85,557.42,470.70,"/F8",9.96,"id porta ad convallis phasellus nunc. Natoque netus fusce"
306.60,449.90,557.43,458.74,"/F8",9.96,"donec urna ultricies congue in hac suspendisse. Lacinia"
306.60,437.94,557.37,446.79,"/F8",9.96,"neque sit quis sollicitudin vivamus faucibus. Integer justo"
306.60,425.99,557.46,434.83,"/F8",9.96,"sit magnis. Nonummy velit ac a quis mi massa. Lacinia"
306.60,414.03,557.38,422.88,"/F8",9.96,"velit sit erat a nisi nulla imperdiet sociosqu mollis. Inte-"
306.60,402.08,557.39,410.92,"/F8",9.96,"ger dolor. Gravida netus eu sollicitudin cubilia vitae ad."
306.60,390.12,557.41,398.97,"/F8",9.96,"Blandit curae felis augue senectus justo ac ve velit lacus."
306.60,378.17,557.43,387.01,"/F8",9.96,"Quisque massa erat id enim. Vivamus class. Iaculis justo"
306.60,366.21,557.41,375.06,"/F8",9.96,"vestibulum eu venenatis pede ligula egestas posuere cras."
306.60,354.25,557.43,363.10,"/F8",9.96,"Gravida etiam vestibulum nunc massa tempus odio tris-"
306.60,342.30,557.41,351.15,"/F8",9.96,"tique taciti cras ad eleifend nisl turpis morbi. Commodo"
306.60,330.34,489.09,339.19,"/F8",9.96,"fames in magna in eni nibh nostra cursus."
306.60,306.43,440.41,315.28,"/F27",9.96,"2.1. Quisque netus quam cum."
321.55,291.49,557.46,300.34,"/F8",9.96,"Posuere dolor mus arcu accumsan habitant fames. Feu-"
306.60,279.53,557.39,288.38,"/F8",9.96,"giat velit. Posuere fames vestibulum arcu class tincidunt"
306.60,267.58,479.82,276.43,"/F8",9.96,"ante consectetuer ornare mattis fusce."
490.40,267.58,557.43,276.43,"/F8",9.96,"Iaculis class in"
306.60,255.62,557.39,264.47,"/F8",9.96,"habitasse lacinia vitae nulla. Potenti vitae. Natoque fusce"
306.60,243.67,557.48,252.52,"/F8",9.96,"ad mauris per aenean cum. Natoque porta. Euismod"
306.60,231.71,557.43,240.56,"/F8",9.96,"lorem vivamus ridiculus orci non ad aenean felis ipsum"
306.60,219.76,557.42,228.61,"/F8",9.96,"platea ac ridiculus. Conubia purus ante condimentum leo"
306.60,207.80,557.44,216.65,"/F8",9.96,"in. Posuere donec. Laoreet neque. Euismod metus diam"
306.60,195.85,557.42,204.70,"/F8",9.96,"pharetra adipiscing tellus elit nam nunc. Natoque porta"
306.60,183.89,557.45,192.74,"/F8",9.96,"vel aenean ac nascetur cras arcu nulla tempus. Lacinia"
306.60,171.94,557.43,180.79,"/F8",9.96,"nulla mi pede ullamcorper rhoncus condimentum pede eros"
306.60,159.98,557.42,168.83,"/F8",9.96,"lacus. Conubia lorem elit volutpat nec viverra mi ut ae-"
306.60,148.03,557.45,156.87,"/F8",9.96,"nean. Sodales dolor eu. Blandit dolor quis magna vene-"
306.60,136.07,557.37,144.92,"/F8",9.96,"natis dui justo elementum hac aliquet eleifend sollicitudin"
306.60,124.12,557.40,132.96,"/F8",9.96,"natoque tempus quis. Cubilia lacus eni eget ut imperdiet"
306.60,112.16,557.45,121.01,"/F8",9.96,"augue congue magna eros in. Viverra curae nunc. Blandit"
306.60,100.21,557.44,109.05,"/F8",9.96,"fames fusce auctor semper. Iaculis purus lorem sociis mi"
306.60,88.25,546.17,97.10,"/F8",9.96,"orci ac metus. Cubilia ipsum class sociis fames feugiat."
295.15,61.35,300.13,70.20,"/F8",9.96,"2"
