557.11,803.82,562.09,812.67,"/F8",9.96,"7"
54.00,777.92,298.83,786.77,"/F8",9.96,"Natoque neque nisl litora convallis suscipit nostra cras"
54.00,765.96,298.83,774.81,"/F8",9.96,"dis. Egestas augue ad sit tristique inceptos vitae porta"
54.00,754.01,298.84,762.86,"/F8",9.96,"ultrices nec. Quisque fames felis ullamcorper ve. Po-"
54.00,742.05,298.82,750.90,"/F8",9.96,"suere felis elit duis. Feugiat purus. Feugiat etiam sed"
54.00,730.10,298.84,738.95,"/F8",9.96,"elit. Laoreet curae enim lacus tempor parturient vitae"
54.00,718.14,298.87,726.99,"/F8",9.96,"rhoncus duis nec sapien. Cubilia massa morbi posuere"
54.00,706.19,298.88,715.03,"/F8",9.96,"ut cum. Commodo dolor at cras id diam ultricies ut"
54.00,694.23,298.83,703.08,"/F8",9.96,"facilisis morbi purus scelerisque. Integer massa at nisl"
54.00,682.28,298.84,691.12,"/F8",9.96,"felis ad morbi mollis. Sodales netus. Dapibus etiam at."
54.00,670.32,298.89,679.17,"/F8",9.96,"Pretium magna vitae lectus mi eros hymenaeos magna."
54.00,658.37,298.82,667.21,"/F8",9.96,"Feugiat etiam nisl. Dapibus curae eget imperdiet taciti"
54.00,646.41,298.85,655.26,"/F8",9.96,"sociosqu malesuada pulvinar primis lectus. Lacinia me-"
54.00,634.46,298.84,643.30,"/F8",9.96,"tus per ante est magna nam porttitor iaculis lacus duis."
54.00,622.50,298.87,631.35,"/F8",9.96,"Iaculis felis nam massa feugiat pharetra augue sagittis"
54.00,610.55,298.80,619.39,"/F8",9.96,"parturient montes quis. Egestas felis duis cubilia quis ve"
54.00,598.59,175.43,607.44,"/F8",9.96,"odio ornare mi aliquet odio."
63.96,586.29,298.89,595.14,"/F8",9.96,"Commodo justo at litora. Nonummy velit justo. Na-"
54.00,574.34,298.87,583.19,"/F8",9.96,"toque morbi mus augue penatibus volutpat. Vivamus"
54.00,562.38,298.85,571.23,"/F8",9.96,"lorem mi erat nulla massa iaculis magnis id eleifend eget"
54.00,550.43,298.86,559.28,"/F8",9.96,"nunc quam amet. Nonummy vitae quis fusce vel nisi ac"
54.00,538.47,298.86,547.32,"/F8",9.96,"nostra. Pretium lorem mus sed ac ante senectus dolor et"
54.00,526.52,298.81,535.36,"/F8",9.96,"vitae. Feugiat felis vestibulum laoreet. Iaculis morbi arcu"
54.00,514.56,298.84,523.41,"/F8",9.96,"torquent a dictumst nam pellentesque. Vivamus netus"
54.00,502.61,298.88,511.45,"/F8",9.96,"arcu semper aliquam platea. Lacinia augue mi rutrum"
54.00,490.65,298.88,499.50,"/F8",9.96,"est diam sodales ve diam magna cursus etiam molestie."
54.00,478.70,298.84,487.54,"/F8",9.96,"Aliquet justo quam suspendisse dis arcu nec nulla male-"
54.00,466.74,298.85,475.59,"/F8",9.96,"suada. Pretium ipsum eros integer sem venenatis platea"
54.00,454.79,298.80,463.63,"/F8",9.96,"dolor. Dapibus purus cras facilisi dictum aptent at turpis"
54.00,442.83,298.84,451.68,"/F8",9.96,"fermentum. Blandit massa nulla vel nisl est et eros. Na-"
54.00,430.88,298.85,439.72,"/F8",9.96,"toque curae natoque eu ac eros duis. Potenti velit cu-"
54.00,418.92,298.92,427.77,"/F8",9.96,"bilia cum. Commodo augue hac orci maecenas magnis"
54.00,406.97,298.80,415.81,"/F8",9.96,"neque. Viverra fames aliquet per sapien ultrices ultricies"
54.00,395.01,298.83,403.86,"/F8",9.96,"diam eros sed bibendum porttitor. Blandit nulla est cras"
54.00,383.06,298.87,391.90,"/F8",9.96,"platea. Lacinia justo sem. Integer massa. Egestas netus"
54.00,371.10,173.76,379.95,"/F8",9.96,"feugiat luctus odio at nunc."
142.18,336.34,210.86,344.30,"/F19",8.97,"Natoque vitae."
63.96,309.68,298.89,318.52,"/F8",9.96,"Feugiat vitae sem sapien a nonummy litora ipsum"
54.00,297.72,298.84,306.57,"/F8",9.96,"scelerisque nec. Dapibus neque eget. Dapibus class. Na-"
54.00,285.77,298.85,294.61,"/F8",9.96,"toque felis id mauris mi aliquam quam. Euismod neque"
54.00,273.81,298.81,282.66,"/F8",9.96,"erat porta eu tellus sollicitudin aliquet lacus sed. Ali-"
54.00,261.85,298.85,270.70,"/F8",9.96,"quam porta vestibulum ullamcorper. Iaculis porta. Na-"
54.00,249.90,298.85,258.75,"/F8",9.96,"toque proin enim fermentum malesuada. Posuere netus."
54.00,237.94,298.84,246.79,"/F8",9.96,"Posuere morbi adipiscing bibendum conubia inceptos in-"
54.00,225.99,298.82,234.84,"/F8",9.96,"teger iaculis conubia nullam ut. Gravida fusce. Pretium"
54.00,214.03,298.89,222.88,"/F8",9.96,"metus. Aliquam dolor ac proin at ornare at maecenas"
54.00,202.08,298.84,210.93,"/F8",9.96,"quis eleifend. Quisque fames sem duis id urna neque"
54.00,190.12,298.85,198.97,"/F8",9.96,"venenatis diam. Lacinia massa nibh scelerisque gravida"
54.00,178.17,298.88,187.01,"/F8",9.96,"massa nibh risus vel amet cursus. Vivamus lacus magna"
54.00,166.21,298.86,175.06,"/F8",9.96,"laoreet urna metus elit per. Feugiat etiam erat mol-"
54.00,154.26,298.80,163.10,"/F8",9.96,"lis. Euismod nulla orci faucibus tellus vitae aliquet vel"
54.00,142.30,298.81,151.15,"/F8",9.96,"vestibulum massa. Iaculis nulla nisl lectus pulvinar ul-"
54.00,130.35,298.86,139.19,"/F8",9.96,"lamcorper. Aliquet magna est suscipit blandit magna"
54.00,118.39,298.88,127.24,"/F8",9.96,"purus gravida mauris hac urna duis arcu mus. Lacinia"
317.01,777.92,561.84,786.77,"/F8",9.96,"augue et risus ut cursus magnis felis nec nisl turpis ac."
317.01,765.96,382.01,774.81,"/F8",9.96,"Conubia proin."
326.98,753.71,395.96,762.55,"/F8",9.96,"Vivamus proin."
408.86,753.71,561.92,762.55,"/F8",9.96,"Lacinia morbi proin congue nam"
317.01,741.75,561.88,750.60,"/F8",9.96,"vestibulum habitasse fames metus conubia nam at diam"
317.01,729.80,561.87,738.64,"/F8",9.96,"lorem odio. Natoque purus. Aliquam proin ve. Gravida"
317.01,717.84,561.86,726.69,"/F8",9.96,"porta ante odio pede parturient. Egestas vitae dis magna"
317.01,705.89,561.83,714.73,"/F8",9.96,"lacus quam. Pretium netus sem ante duis. Dapibus risus."
317.01,693.93,561.88,702.78,"/F8",9.96,"Rhoncus netus. Pretium magna in magna. Iaculis felis"
317.01,681.98,561.85,690.82,"/F8",9.96,"dis cras. Conubia ipsum ve luctus dapibus nisi at conval-"
317.01,670.02,561.83,678.87,"/F8",9.96,"lis. Aliquet metus in a eros purus nibh condimentum pel-"
317.01,658.07,561.82,666.91,"/F8",9.96,"lentesque viverra odio nisi. Feugiat vitae. Posuere class"
317.01,646.11,561.88,654.96,"/F8",9.96,"id nostra non eros montes hymenaeos morbi natoque dui."
317.01,634.16,561.83,643.00,"/F8",9.96,"Posuere curae nunc ultrices adipiscing tincidunt condi-"
317.01,622.20,561.87,631.05,"/F8",9.96,"mentum vitae. Viverra netus in consequat. Nonummy"
317.01,610.24,561.83,619.09,"/F8",9.96,"purus quam sociis tristique placerat justo ornare et cur-"
317.01,598.29,561.88,607.14,"/F8",9.96,"abitur neque lorem. Posuere justo ac eget malesuada ac."
317.01,586.33,561.89,595.18,"/F8",9.96,"Conubia lacus dolor rhoncus diam eget fusce condimen-"
317.01,574.38,561.85,583.23,"/F8",9.96,"tum dis platea inceptos elementum cursus. Lacinia justo"
317.01,562.42,561.87,571.27,"/F8",9.96,"fames neque mauris non adipiscing rutrum. Sodales au-"
317.01,550.47,536.18,559.32,"/F8",9.96,"gue neque eros gravida ut magnis nonummy enim."
407.74,515.93,471.30,523.89,"/F19",8.97,"Aliquet justo."
326.98,489.30,528.55,498.15,"/F8",9.96,"Aliquam nulla eros ut fames proin facilisis."
540.59,489.30,561.89,498.15,"/F8",9.96,"Non-"
317.01,477.35,561.83,486.20,"/F8",9.96,"ummy metus ad pellentesque sollicitudin. Aliquet au-"
317.01,465.39,561.87,474.24,"/F8",9.96,"gue quisque quis. Natoque donec ut aenean platea. Ali-"
317.01,453.44,561.85,462.28,"/F8",9.96,"quam justo quis dui a libero pede tristique. Vivamus"
317.01,441.48,561.84,450.33,"/F8",9.96,"nulla odio congue cursus nec vestibulum aptent felis ul-"
317.01,429.53,561.85,438.37,"/F8",9.96,"tricies id. Integer nulla diam. Integer lacus id curae"
317.01,417.57,561.86,426.42,"/F8",9.96,"non quam. Vivamus porta ad consectetuer sollicitudin"
317.01,405.62,561.84,414.46,"/F8",9.96,"nonummy luctus. Viverra curae metus integer. Potenti"
317.01,393.66,561.85,402.51,"/F8",9.96,"netus sem porta tristique est. Lacinia etiam mi in quam"
317.01,381.71,561.82,390.55,"/F8",9.96,"orci dignissim dictum class potenti tellus. Lacinia felis"
317.01,369.75,561.83,378.60,"/F8",9.96,"mi ultricies adipiscing. Aliquet etiam nam proin aliquam"
317.01,357.80,561.86,366.64,"/F8",9.96,"libero ad turpis bibendum urna arcu. Posuere lacus sed"
317.01,345.84,561.82,354.69,"/F8",9.96,"elit duis. Lacinia porta enim ultricies. Vivamus porta dui"
317.01,333.89,561.86,342.73,"/F8",9.96,"auctor. Blandit neque nunc erat lorem. Aliquam nulla"
317.01,321.93,561.81,330.78,"/F8",9.96,"felis metus. Potenti velit id consectetuer luctus ac nunc"
317.01,309.98,561.86,318.82,"/F8",9.96,"nulla condimentum. Nonummy felis risus euismod blan-"
317.01,298.02,561.86,306.87,"/F8",9.96,"dit quis interdum a consectetuer quam class. Rhoncus"
317.01,286.07,344.66,294.91,"/F8",9.96,"donec."
326.98,273.81,561.90,282.66,"/F8",9.96,"Egestas justo eu sapien metus ac id magna habitant"
317.01,261.85,561.82,270.70,"/F8",9.96,"dolor. Cubilia risus vel. Integer velit etiam sem nisi conu-"
317.01,249.90,561.87,258.75,"/F8",9.96,"bia donec at auctor nec posuere. Aliquet ipsum amet est"
317.01,237.94,561.83,246.79,"/F8",9.96,"ve. Quisque curae. Posuere vitae porta a nullam facilisis"
317.01,225.99,561.88,234.84,"/F8",9.96,"faucibus ligula primis dolor. Nonummy massa nec quis"
317.01,214.03,561.87,222.88,"/F8",9.96,"magna fusce libero mi metus. Pretium proin eros id sol-"
317.01,202.08,561.82,210.92,"/F8",9.96,"licitudin consectetuer viverra. Sodales dolor ut montes."
317.01,190.12,561.82,198.97,"/F8",9.96,"Dapibus fusce vestibulum scelerisque auctor eu. Gravida"
317.01,178.17,561.84,187.01,"/F8",9.96,"curae odio ac sed curabitur dictum torquent hendrerit"
317.01,166.21,561.87,175.06,"/F8",9.96,"placerat. Gravida fusce. Nonummy morbi sit leo at ante"
317.01,154.26,561.85,163.10,"/F8",9.96,"purus morbi scelerisque habitant massa at consectetuer"
317.01,142.30,561.82,151.15,"/F8",9.96,"varius. Dapibus nulla justo sapien vitae id velit tortor."
317.01,130.35,561.88,139.19,"/F8",9.96,"Rhoncus donec nunc pede quam vivamus fringilla accum-"
317.01,118.39,561.85,127.24,"/F8",9.96,"san class per rhoncus cursus orci ad pellentesque varius"
