557.11,803.82,562.09,812.67,"/F8",9.96,"2"
54.00,777.92,256.42,786.77,"/F8",9.96,"massa aenean gravida vivamus dictum velit."
267.22,777.92,298.86,786.77,"/F8",9.96,"Potenti"
54.00,765.96,298.90,774.81,"/F8",9.96,"justo nam duis massa posuere cras a ante ve. Nonummy"
54.00,754.01,298.85,762.86,"/F8",9.96,"dolor morbi dis adipiscing lectus. Euismod fusce sed"
54.00,742.05,298.80,750.90,"/F8",9.96,"purus venenatis hac integer in cursus hendrerit suscipit"
54.00,730.10,298.87,738.95,"/F8",9.96,"magna fusce cras. Quisque lorem diam dictumst aenean"
54.00,718.14,298.84,726.99,"/F8",9.96,"cras. Gravida donec velit. Posuere massa cras id nisl vi-"
54.00,706.19,298.83,715.03,"/F8",9.96,"vamus turpis mus ut. Sodales risus fusce imperdiet cum"
54.00,694.23,298.87,703.08,"/F8",9.96,"nam dui. Rhoncus morbi rhoncus cursus enim feugiat at"
54.00,682.28,298.83,691.12,"/F8",9.96,"tellus. Natoque fusce. Pretium class duis feugiat in nos-"
54.00,670.32,298.85,679.17,"/F8",9.96,"tra ac mattis posuere taciti dis. Gravida dolor eu mau-"
54.00,658.37,298.85,667.21,"/F8",9.96,"ris. Cubilia massa metus auctor velit diam fermentum"
54.00,646.41,298.86,655.26,"/F8",9.96,"sociis mi mattis lobortis. Natoque dolor ve hymenaeos"
54.00,634.46,298.84,643.30,"/F8",9.96,"aliquam pellentesque platea tortor sem. Euismod vitae"
54.00,622.50,298.87,631.35,"/F8",9.96,"donec. Feugiat curae. Aliquam porta. Feugiat lacus"
54.00,610.55,298.79,619.39,"/F8",9.96,"pretium mollis velit tristique. Blandit metus. Posuere"
54.00,598.59,172.12,607.44,"/F8",9.96,"donec at tortor ve fringilla."
71.41,562.74,281.52,570.71,"/F19",8.97,"Euismod purus dis nisl ac torquent maecenas"
124.98,552.28,227.98,560.25,"/F19",8.97,"sollicitudin adipiscing."
63.96,525.41,298.88,534.26,"/F8",9.96,"Potenti class mi odio egestas. Blandit fames etiam"
54.00,513.46,298.80,522.31,"/F8",9.96,"ultrices at tempor risus lectus netus adipiscing facilisi"
54.00,501.50,298.83,510.35,"/F8",9.96,"orci nisi. Cubilia porta eget nostra adipiscing risus amet"
54.00,489.55,298.85,498.40,"/F8",9.96,"aliquam quam integer in nostra est duis volutpat. Non-"
54.00,477.60,298.82,486.44,"/F8",9.96,"ummy fusce nisi scelerisque posuere scelerisque ante urna"
54.00,465.64,298.84,474.49,"/F8",9.96,"hymenaeos. Blandit proin vestibulum bibendum donec."
54.00,453.68,298.84,462.53,"/F8",9.96,"Lacinia neque ve. Sodales risus ipsum pretium cursus hac"
54.00,441.73,298.81,450.58,"/F8",9.96,"cursus nisi eget enim quam in felis facilisi. Pretium donec"
54.00,429.77,298.85,438.62,"/F8",9.96,"nulla vitae. Sodales etiam. Euismod fames etiam dui."
54.00,417.82,298.85,426.67,"/F8",9.96,"Dapibus dolor ve tortor phasellus metus euismod enim"
54.00,405.86,298.83,414.71,"/F8",9.96,"diam rutrum. Sodales lacus ac pellentesque. Viverra vi-"
54.00,393.91,298.88,402.75,"/F8",9.96,"tae at ipsum tortor adipiscing. Commodo class id massa"
54.00,381.95,298.83,390.80,"/F8",9.96,"mi et mattis. Aliquet neque ve lorem semper tellus con-"
54.00,370.00,298.82,378.84,"/F8",9.96,"vallis inceptos. Sodales netus vestibulum arcu cursus."
54.00,358.04,298.85,366.89,"/F8",9.96,"Viverra felis nam conubia ad. Posuere augue mi lectus dis"
54.00,346.09,298.84,354.93,"/F8",9.96,"duis. Pretium risus. Laoreet proin porta rutrum porta"
54.00,334.13,298.86,342.98,"/F8",9.96,"vestibulum ad. Viverra lacus. Euismod netus odio ac-"
54.00,322.18,139.11,331.02,"/F8",9.96,"cumsan massa felis."
63.96,309.68,131.57,318.52,"/F8",9.96,"Posuere purus."
146.31,309.68,298.88,318.52,"/F8",9.96,"Rhoncus vitae quam suspendisse"
54.00,297.72,298.86,306.57,"/F8",9.96,"dapibus etiam velit dictum leo pede. Conubia magna."
54.00,285.77,298.83,294.61,"/F8",9.96,"Potenti felis class dictum litora pede mi arcu. Viverra"
54.00,273.81,298.81,282.66,"/F8",9.96,"velit neque. Integer felis elit nec taciti. Euismod cu-"
54.00,261.85,222.78,270.70,"/F8",9.96,"rae donec conubia quisque venenatis."
233.21,261.85,298.86,270.70,"/F8",9.96,"Sodales neque."
54.00,249.90,298.83,258.75,"/F8",9.96,"Quisque metus pede facilisi et. Vivamus felis ante id"
54.00,237.94,225.94,246.79,"/F8",9.96,"odio nulla ad risus leo arcu suscipit."
237.97,237.94,298.86,246.79,"/F8",9.96,"Cubilia porta"
54.00,225.99,298.84,234.84,"/F8",9.96,"nam vestibulum ut volutpat aliquet egestas. Laoreet la-"
54.00,214.03,298.85,222.88,"/F8",9.96,"cus eros magnis sapien lacinia enim eros parturient dis"
54.00,202.08,298.87,210.93,"/F8",9.96,"vestibulum magna. Viverra neque diam platea conubia"
54.00,190.12,298.86,198.97,"/F8",9.96,"duis pede montes potenti ad. Rhoncus dolor vestibu-"
54.00,178.17,298.83,187.01,"/F8",9.96,"lum inceptos dolor. Sodales nulla diam nibh porttitor."
54.00,166.21,298.83,175.06,"/F8",9.96,"Dapibus nulla vestibulum rhoncus hac eu. Integer vitae"
54.00,154.26,298.85,163.10,"/F8",9.96,"diam suscipit a dictumst sem aliquam. Integer nulla do-"
54.00,142.30,298.85,151.15,"/F8",9.96,"lor mattis ad dictumst. Nonummy purus. Natoque proin."
54.00,130.35,298.86,139.19,"/F8",9.96,"Vivamus ipsum eu dis nisi proin vitae donec. Nonummy"
54.00,118.39,298.82,127.24,"/F8",9.96,"felis vestibulum arcu fames cursus semper risus vestibu-"
317.01,777.92,509.35,786.77,"/F8",9.96,"lum senectus quisque pretium quam a enim."
395.40,743.80,483.63,751.76,"/F19",8.97,"QUISQUE VELIT."
326.98,717.26,455.40,726.10,"/F8",9.96,"Lacinia augue eget gravida."
468.64,717.26,534.86,726.10,"/F8",9.96,"Dapibus fusce."
548.10,717.26,561.91,726.10,"/F8",9.96,"So-"
317.01,705.30,561.89,714.15,"/F8",9.96,"dales massa adipiscing accumsan metus natoque. Inte-"
317.01,693.35,561.89,702.19,"/F8",9.96,"ger lorem. Sodales purus. Commodo vitae justo tempor"
317.01,681.39,561.88,690.24,"/F8",9.96,"natoque est ut nonummy enim ve odio. Laoreet velit"
317.01,669.44,561.82,678.28,"/F8",9.96,"vestibulum scelerisque mollis eu volutpat ante cum proin"
317.01,657.48,561.90,666.33,"/F8",9.96,"commodo est eu sapien placerat lacus gravida. Laoreet"
317.01,645.53,561.84,654.37,"/F8",9.96,"nulla sed nisl tempor platea purus diam ridiculus. Conu-"
317.01,633.57,561.86,642.42,"/F8",9.96,"bia neque nulla a potenti mi class eu. Conubia etiam urna"
317.01,621.62,561.82,630.46,"/F8",9.96,"sodales ve pulvinar conubia sollicitudin tristique vitae"
317.01,609.66,561.85,618.51,"/F8",9.96,"sapien. Viverra fames. Pretium fames risus rhoncus dui."
317.01,597.71,561.87,606.55,"/F8",9.96,"Aliquam augue vel hac ad vitae ve rutrum at. Aliquet"
317.01,585.75,561.86,594.60,"/F8",9.96,"massa nibh nam enim orci aliquet ac arcu. Potenti risus"
317.01,573.80,561.87,582.64,"/F8",9.96,"ac platea nec sociis ut urna fusce duis. Nonummy purus"
317.01,561.84,561.87,570.69,"/F8",9.96,"vivamus est. Nonummy massa leo quis ve ligula portti-"
317.01,549.89,561.85,558.73,"/F8",9.96,"tor parturient pede massa. Nonummy neque in curabitur"
317.01,537.93,561.88,546.78,"/F8",9.96,"duis per orci accumsan purus ve ante amet egestas at id"
317.01,525.97,561.87,534.82,"/F8",9.96,"nisl ve. Aliquam class vivamus. Egestas lacus. Conu-"
317.01,514.02,561.83,522.87,"/F8",9.96,"bia velit vel nunc. Vivamus fusce odio faucibus est tellus"
317.01,502.06,498.70,510.91,"/F8",9.96,"aenean class parturient senectus euismod."
326.98,489.89,561.88,498.73,"/F8",9.96,"Posuere ipsum vestibulum enim malesuada odio. Blan-"
317.01,477.93,561.89,486.78,"/F8",9.96,"dit magna erat ad diam nostra id varius at nulla ac."
317.01,465.98,561.83,474.82,"/F8",9.96,"Lacinia netus sed elit vestibulum dis lorem eni ante dic-"
317.01,454.02,561.85,462.87,"/F8",9.96,"tumst. Iaculis class eu class sed eni per eu lectus in me-"
317.01,442.07,561.86,450.91,"/F8",9.96,"tus congue praesent. Euismod lorem feugiat iaculis tor-"
317.01,430.11,561.88,438.96,"/F8",9.96,"tor. Rhoncus massa cum erat nulla lacinia. Sodales lacus"
317.01,418.16,561.87,427.00,"/F8",9.96,"sem nulla cum quam nam. Pretium risus mi augue luctus"
317.01,406.20,561.89,415.05,"/F8",9.96,"augue mus. Quisque augue. Laoreet massa non parturi-"
317.01,394.25,561.82,403.09,"/F8",9.96,"ent platea sagittis eu. Pretium nulla in mattis interdum"
317.01,382.29,561.87,391.14,"/F8",9.96,"curae pretium nibh pretium. Sodales fames eu nostra"
317.01,370.34,561.82,379.18,"/F8",9.96,"porta parturient mi penatibus velit eu. Iaculis netus arcu"
317.01,358.38,561.88,367.23,"/F8",9.96,"malesuada. Posuere porta. Quisque curae magna quis mi"
317.01,346.43,561.87,355.27,"/F8",9.96,"amet fusce phasellus. Nonummy lorem et primis. Inte-"
317.01,334.47,561.85,343.32,"/F8",9.96,"ger risus class fames elit potenti metus lorem. Aliquam"
317.01,322.52,561.84,331.36,"/F8",9.96,"neque lorem non convallis mollis praesent elit eni justo"
317.01,310.56,561.83,319.41,"/F8",9.96,"vestibulum quis justo et. Laoreet ipsum vitae eleifend"
317.01,298.61,561.86,307.45,"/F8",9.96,"justo hymenaeos diam vel. Aliquet fusce vel platea eu-"
317.01,286.65,561.88,295.50,"/F8",9.96,"ismod nonummy nibh ultrices nunc conubia nonummy"
317.01,274.70,561.91,283.54,"/F8",9.96,"orci a erat. Commodo class etiam nostra magna id etiam"
317.01,262.74,561.86,271.59,"/F8",9.96,"platea condimentum class habitasse dignissim lacus sed."
317.01,250.79,514.57,259.63,"/F8",9.96,"Cubilia metus adipiscing facilisi nulla magna."
406.53,216.67,472.52,224.63,"/F19",8.97,"Sodales curae."
326.98,190.12,561.92,198.97,"/F8",9.96,"Nonummy lacus. Natoque fames diam eros nullam."
317.01,178.17,561.85,187.01,"/F8",9.96,"Laoreet fusce. Dapibus risus erat arcu. Viverra donec in"
317.01,166.21,561.84,175.06,"/F8",9.96,"proin class fermentum euismod dolor felis quam. Quisque"
317.01,154.26,561.85,163.10,"/F8",9.96,"ipsum vivamus euismod libero duis. Dapibus augue risus"
317.01,142.30,561.87,151.15,"/F8",9.96,"taciti aenean molestie amet non rutrum dapibus enim"
317.01,130.35,561.83,139.19,"/F8",9.96,"a. Aliquet curae lorem nostra suspendisse lorem ultricies"
317.01,118.39,561.87,127.24,"/F8",9.96,"volutpat. Egestas ipsum eros egestas mi placerat egestas"
