557.11,803.82,562.09,812.67,"/F8",9.96,"5"
54.00,777.92,298.78,786.77,"/F8",9.96,"tortor ultricies morbi. Quisque risus est eget ve vulputate"
54.00,765.96,141.47,774.81,"/F8",9.96,"duis dapibus leo mi."
63.96,753.71,298.87,762.56,"/F8",9.96,"Dapibus etiam. Quisque proin massa. Aliquam vi-"
54.00,741.75,298.86,750.60,"/F8",9.96,"tae netus est elementum. Natoque felis arcu sed donec"
54.00,729.80,298.82,738.64,"/F8",9.96,"parturient bibendum. Pretium felis mi nostra malesuada"
54.00,717.84,298.79,726.69,"/F8",9.96,"ipsum venenatis hendrerit parturient eros vulputate pel-"
54.00,705.89,298.80,714.73,"/F8",9.96,"lentesque. Iaculis donec felis montes sollicitudin vulpu-"
54.00,693.93,298.82,702.78,"/F8",9.96,"tate felis fermentum elit ullamcorper. Viverra dolor arcu"
54.00,681.98,298.86,690.82,"/F8",9.96,"iaculis ve congue dapibus arcu id fusce mi at. Posuere"
54.00,670.02,298.84,678.87,"/F8",9.96,"magna erat per ridiculus pharetra orci sociis. Pretium"
54.00,658.07,298.85,666.91,"/F8",9.96,"ipsum nam morbi taciti sociis. Blandit augue quis est"
54.00,646.11,298.86,654.96,"/F8",9.96,"augue magnis. Dapibus porta velit lobortis ve congue"
54.00,634.16,298.85,643.00,"/F8",9.96,"dis. Vivamus augue morbi tempor pellentesque integer"
54.00,622.20,298.85,631.05,"/F8",9.96,"pharetra dolor per. Laoreet risus nisi sodales erat habi-"
54.00,610.25,298.89,619.09,"/F8",9.96,"tant accumsan ve. Rhoncus massa. Laoreet vitae ac enim"
54.00,598.29,298.81,607.14,"/F8",9.96,"condimentum sem in consectetuer sollicitudin pretium."
54.00,586.34,298.80,595.18,"/F8",9.96,"Integer netus nisi tincidunt montes parturient lorem feu-"
54.00,574.38,298.84,583.23,"/F8",9.96,"giat malesuada. Aliquet nulla euismod nisi mus habitasse"
54.00,562.43,298.88,571.27,"/F8",9.96,"cursus leo. Gravida purus non massa. Conubia morbi"
54.00,550.47,298.80,559.32,"/F8",9.96,"sem parturient felis quis faucibus fringilla. Gravida class"
54.00,538.52,298.86,547.36,"/F8",9.96,"justo aenean habitasse id platea gravida cum suscipit a."
54.00,526.56,298.85,535.41,"/F8",9.96,"Viverra curae nisl sit mi purus. Sodales netus at hac"
54.00,514.60,155.60,523.45,"/F8",9.96,"phasellus velit sit pede."
140.27,480.06,212.77,488.02,"/F19",8.97,"Pretium ipsum."
63.96,453.44,220.00,462.28,"/F8",9.96,"Feugiat curae in facilisis ultricies."
232.35,453.44,298.83,462.28,"/F8",9.96,"Potenti massa."
54.00,441.48,298.86,450.33,"/F8",9.96,"Gravida augue diam per malesuada pellentesque sem fer-"
54.00,429.53,298.87,438.37,"/F8",9.96,"mentum. Rhoncus etiam nisl ad sollicitudin commodo"
54.00,417.57,298.85,426.42,"/F8",9.96,"metus risus a. Iaculis fames eget laoreet mi facilisi leo"
54.00,405.62,298.83,414.46,"/F8",9.96,"sollicitudin lectus duis. Laoreet augue. Aliquam vitae"
54.00,393.66,298.85,402.51,"/F8",9.96,"egestas et vitae facilisis. Commodo risus nisl nec porta"
54.00,381.71,298.82,390.55,"/F8",9.96,"lorem. Cubilia massa duis molestie sollicitudin turpis"
54.00,369.75,298.86,378.60,"/F8",9.96,"neque laoreet montes ante condimentum. Viverra curae"
54.00,357.80,298.83,366.64,"/F8",9.96,"vitae posuere pede id orci facilisi ultrices porta aenean"
54.00,345.84,298.86,354.69,"/F8",9.96,"parturient. Iaculis etiam ve magnis per egestas senec-"
54.00,333.89,298.84,342.73,"/F8",9.96,"tus dictum quam. Lacinia morbi per curae tellus libero"
54.00,321.93,298.84,330.78,"/F8",9.96,"enim ve etiam neque. Viverra fusce aliquam eni senectus"
54.00,309.98,298.86,318.82,"/F8",9.96,"class. Aliquam massa. Quisque felis. Conubia ipsum."
54.00,298.02,298.84,306.87,"/F8",9.96,"Sodales ipsum nibh eni penatibus sagittis ad varius a ve-"
54.00,286.07,298.82,294.91,"/F8",9.96,"hicula nunc eni blandit pede. Iaculis nulla in. Viverra"
54.00,274.11,298.84,282.96,"/F8",9.96,"magna. Quisque lacus adipiscing ac imperdiet dignissim"
54.00,262.16,298.84,271.00,"/F8",9.96,"pede ligula aliquam quam vehicula nulla. Pretium curae"
54.00,250.20,298.81,259.05,"/F8",9.96,"arcu faucibus litora parturient sagittis nisi quisque ac."
54.00,238.25,298.86,247.09,"/F8",9.96,"Cubilia ipsum eu ve felis accumsan habitasse morbi mi"
54.00,226.29,76.79,235.14,"/F8",9.96,"risus."
63.96,214.03,256.67,222.88,"/F8",9.96,"Lacinia massa per sagittis habitasse risus."
267.36,214.03,298.87,222.88,"/F8",9.96,"Cubilia"
54.00,202.08,298.84,210.93,"/F8",9.96,"massa ve purus. Dapibus lacus leo purus vestibulum id"
54.00,190.12,298.88,198.97,"/F8",9.96,"molestie. Aliquet morbi massa eget nam arcu hymenaeos"
54.00,178.17,298.82,187.02,"/F8",9.96,"et imperdiet metus mi nulla odio. Aliquet donec. Viverra"
54.00,166.21,298.86,175.06,"/F8",9.96,"lorem et porta id quam scelerisque. Natoque justo ve"
54.00,154.26,298.84,163.11,"/F8",9.96,"eget scelerisque hac enim. Iaculis proin. Blandit donec"
54.00,142.30,298.83,151.15,"/F8",9.96,"amet quisque. Pretium fames. Blandit dolor quam vel ut"
54.00,130.35,298.80,139.19,"/F8",9.96,"sollicitudin pellentesque pretium libero dui nam leo con-"
54.00,118.39,298.81,127.24,"/F8",9.96,"sectetuer primis in. Cubilia metus nisl pretium a platea"
317.01,777.92,561.83,786.77,"/F8",9.96,"hendrerit metus. Laoreet metus potenti. Gravida nulla."
317.01,765.96,561.82,774.81,"/F8",9.96,"Vivamus nulla. Potenti velit potenti viverra varius nec"
317.01,754.01,561.82,762.86,"/F8",9.96,"varius a parturient sit netus pretium quisque. Nonummy"
317.01,742.05,561.88,750.90,"/F8",9.96,"metus. Gravida magna enim potenti a. Integer justo"
317.01,730.10,561.87,738.94,"/F8",9.96,"magna sociis nunc consectetuer ut dapibus ut pharetra"
317.01,718.14,561.87,726.99,"/F8",9.96,"sapien rhoncus eros odio imperdiet neque lacinia nam ad"
317.01,706.19,561.84,715.03,"/F8",9.96,"tellus luctus. Cubilia proin erat nam arcu cras urna est"
317.01,694.23,561.85,703.08,"/F8",9.96,"nonummy. Potenti felis in venenatis a. Posuere neque"
317.01,682.28,538.92,691.12,"/F8",9.96,"dolor leo erat urna arcu nec euismod ut aliquet eu."
326.98,670.02,561.82,678.87,"/F8",9.96,"Aliquet nulla parturient sagittis proin. Blandit curae"
317.01,658.07,561.84,666.91,"/F8",9.96,"parturient. Posuere vitae dapibus mattis eget pellen-"
317.01,646.11,561.85,654.96,"/F8",9.96,"tesque parturient arcu ipsum dolor congue egestas dui in-"
317.01,634.16,561.82,643.00,"/F8",9.96,"ceptos viverra lorem parturient. Sodales vitae ve inceptos"
317.01,622.20,561.84,631.05,"/F8",9.96,"leo integer ad. Cubilia morbi. Cubilia fusce etiam montes"
317.01,610.24,561.84,619.09,"/F8",9.96,"pulvinar iaculis. Conubia metus et nullam pretium ut"
317.01,598.29,561.89,607.14,"/F8",9.96,"duis augue per eros lorem sem nibh. Laoreet justo eu"
317.01,586.33,561.82,595.18,"/F8",9.96,"ultrices natoque dignissim eros lacinia ut mattis ultrices"
317.01,574.38,561.84,583.23,"/F8",9.96,"pretium. Pretium morbi ve. Vivamus morbi vestibulum"
317.01,562.42,561.86,571.27,"/F8",9.96,"ullamcorper sociis at. Sodales morbi. Pretium lorem au-"
317.01,550.47,561.82,559.32,"/F8",9.96,"gue suscipit vestibulum curabitur morbi vulputate. Cu-"
317.01,538.51,561.87,547.36,"/F8",9.96,"bilia lorem. Nonummy metus. Posuere justo felis cum"
317.01,526.56,561.83,535.41,"/F8",9.96,"nibh adipiscing dictum velit vestibulum arcu. Rhoncus"
317.01,514.60,561.86,523.45,"/F8",9.96,"fusce lorem varius nunc sociis. Nonummy neque aliquet"
317.01,502.65,561.84,511.50,"/F8",9.96,"justo at a elit. Laoreet fusce nunc pede justo scelerisque"
317.01,490.69,561.85,499.54,"/F8",9.96,"sagittis. Laoreet donec sit orci euismod eu id tortor fau-"
317.01,478.74,561.88,487.58,"/F8",9.96,"cibus cum. Natoque lacus. Vivamus magna quis primis"
317.01,466.78,561.87,475.63,"/F8",9.96,"at erat odio dolor. Gravida lorem at risus metus condi-"
317.01,454.83,355.44,463.67,"/F8",9.96,"mentum."
342.39,420.29,536.58,428.25,"/F19",8.97,"DAPIBUS AUGUE NULLA MOLESTIE."
326.98,393.66,561.88,402.51,"/F8",9.96,"Blandit fusce. Feugiat proin quam a neque. Rhoncus"
317.01,381.71,561.89,390.55,"/F8",9.96,"fames ante etiam interdum nam feugiat congue class sem"
317.01,369.75,561.81,378.60,"/F8",9.96,"pede faucibus vulputate. Dapibus velit nulla turpis erat"
317.01,357.80,561.85,366.64,"/F8",9.96,"diam ante. Blandit purus et pede quis mollis sociosqu"
317.01,345.84,561.86,354.69,"/F8",9.96,"ullamcorper faucibus habitasse ve at mi. Aliquam ipsum"
317.01,333.89,561.88,342.73,"/F8",9.96,"ad. Commodo risus ac tristique. Rhoncus etiam. Eges-"
317.01,321.93,561.86,330.78,"/F8",9.96,"tas metus eros. Laoreet proin lacus semper taciti leo luc-"
317.01,309.98,561.87,318.82,"/F8",9.96,"tus dui sodales. Aliquet magna sem erat. Iaculis proin"
317.01,298.02,561.85,306.87,"/F8",9.96,"amet scelerisque nam mauris. Conubia velit justo felis"
317.01,286.07,561.88,294.91,"/F8",9.96,"a congue nisi. Pretium dolor enim quam nostra feugiat"
317.01,274.11,561.80,282.96,"/F8",9.96,"id risus luctus sollicitudin hymenaeos felis risus. Cubilia"
317.01,262.16,561.85,271.00,"/F8",9.96,"fames. Dapibus fusce augue a tortor eget rutrum ultrices"
317.01,250.20,561.87,259.05,"/F8",9.96,"penatibus mi tellus. Aliquam massa dolor turpis auc-"
317.01,238.25,561.83,247.09,"/F8",9.96,"tor rhoncus vel et. Aliquet velit ad lobortis erat sodales"
317.01,226.29,561.84,235.14,"/F8",9.96,"ve et. Potenti lacus etiam mauris. Gravida proin nulla"
317.01,214.34,561.85,223.18,"/F8",9.96,"ante pretium ad congue fusce. Aliquet ipsum felis aenean"
317.01,202.38,561.82,211.23,"/F8",9.96,"nostra interdum nisl habitant penatibus est consectetuer"
317.01,190.42,561.85,199.27,"/F8",9.96,"nullam class venenatis nam sollicitudin. Nonummy class"
317.01,178.47,430.45,187.32,"/F8",9.96,"nibh tempor nec euismod."
326.98,166.21,561.85,175.06,"/F8",9.96,"Aliquet neque. Iaculis proin ad eu vitae in etiam var-"
317.01,154.26,561.88,163.10,"/F8",9.96,"ius malesuada. Egestas class purus penatibus phasel-"
317.01,142.30,561.87,151.15,"/F8",9.96,"lus fusce erat sodales a. Sodales velit. Laoreet metus"
317.01,130.35,561.82,139.19,"/F8",9.96,"dui. Dapibus fusce metus justo etiam potenti est facilisi."
317.01,118.39,561.87,127.24,"/F8",9.96,"Conubia fusce netus augue nascetur class eros. Quisque"
