557.11,803.82,562.09,812.67,"/F8",9.96,"5"
54.00,777.92,298.79,786.77,"/F8",9.96,"ipsum pretium urna nulla felis cubilia nisl pellentesque."
54.00,765.96,298.83,774.81,"/F8",9.96,"Posuere risus gravida rutrum dolor elementum convallis."
54.00,754.01,298.88,762.86,"/F8",9.96,"Quisque massa fames. Dapibus porta lacinia sem par-"
54.00,742.05,298.81,750.90,"/F8",9.96,"turient felis. Natoque vitae diam nunc interdum pellen-"
54.00,730.10,298.85,738.95,"/F8",9.96,"tesque libero. Laoreet massa est vitae nam pede eleifend"
54.00,718.14,298.85,726.99,"/F8",9.96,"nascetur porta egestas aliquet odio curae primis in. Non-"
54.00,706.19,298.85,715.03,"/F8",9.96,"ummy class eget habitant eni at nullam purus dui male-"
54.00,694.23,298.85,703.08,"/F8",9.96,"suada massa. Integer risus sed orci porta. Pretium purus"
54.00,682.28,298.86,691.12,"/F8",9.96,"orci sodales sem arcu. Blandit class quam sodales et nisi"
54.00,670.32,298.86,679.17,"/F8",9.96,"orci vestibulum sem adipiscing massa. Cubilia fames."
54.00,658.37,298.86,667.21,"/F8",9.96,"Potenti morbi lacus. Vivamus class et. Posuere fusce"
54.00,646.41,298.84,655.26,"/F8",9.96,"sed orci adipiscing auctor ad volutpat aliquam sagittis"
54.00,634.46,298.86,643.30,"/F8",9.96,"quisque. Iaculis metus erat aliquet magna orci a curae"
54.00,622.50,298.86,631.35,"/F8",9.96,"iaculis conubia cursus fusce penatibus mus. Nonummy"
54.00,610.55,298.86,619.39,"/F8",9.96,"justo at. Conubia curae urna convallis. Sodales purus"
54.00,598.59,178.33,607.44,"/F8",9.96,"donec conubia eros senectus."
63.96,579.66,298.81,588.51,"/F8",9.96,"Potenti dolor et varius pellentesque sed. Aliquet morbi"
54.00,567.71,298.88,576.55,"/F8",9.96,"odio commodo ac et. Natoque netus mi justo taciti dig-"
54.00,555.75,298.81,564.60,"/F8",9.96,"nissim. Quisque lacus quis maecenas aliquet nisl pellen-"
54.00,543.80,298.81,552.64,"/F8",9.96,"tesque. Euismod ipsum ut luctus ultricies dui pellen-"
54.00,531.84,298.87,540.69,"/F8",9.96,"tesque morbi mi nostra at. Integer porta fames justo"
54.00,519.89,298.90,528.73,"/F8",9.96,"neque aliquam varius erat conubia massa curae magna"
54.00,507.93,298.84,516.78,"/F8",9.96,"orci in. Aliquam massa vestibulum in ligula ad. Dapibus"
54.00,495.98,298.84,504.82,"/F8",9.96,"velit sem pede consectetuer viverra dictumst in magna"
54.00,484.02,298.85,492.87,"/F8",9.96,"habitant. Sodales magna vivamus eni tincidunt lobor-"
54.00,472.07,298.84,480.91,"/F8",9.96,"tis eros posuere ac curabitur. Gravida purus. Euismod"
54.00,460.11,298.85,468.96,"/F8",9.96,"dolor id tortor imperdiet metus senectus ad nam ante."
54.00,448.16,298.83,457.00,"/F8",9.96,"Viverra donec. Quisque felis. Lacinia ipsum amet lacinia"
54.00,436.20,298.85,445.05,"/F8",9.96,"arcu urna lobortis hymenaeos a. Sodales velit parturi-"
54.00,424.25,298.86,433.09,"/F8",9.96,"ent rhoncus diam nec nulla fusce. Dapibus curae. So-"
54.00,412.29,298.85,421.14,"/F8",9.96,"dales netus ac mauris. Aliquam proin parturient enim"
54.00,400.34,298.80,409.18,"/F8",9.96,"facilisis id metus fames netus primis pellentesque vulpu-"
54.00,388.38,298.85,397.23,"/F8",9.96,"tate class. Quisque neque. Iaculis netus id augue con-"
54.00,376.43,298.86,385.27,"/F8",9.96,"sectetuer. Laoreet fames natoque at sed. Iaculis curae"
54.00,364.47,298.86,373.32,"/F8",9.96,"nec urna a proin euismod tempor phasellus natoque dic-"
54.00,352.51,103.24,361.36,"/F8",9.96,"tum morbi."
63.96,333.59,298.89,342.43,"/F8",9.96,"Conubia velit odio ac pede tempus accumsan condi-"
54.00,321.63,298.87,330.48,"/F8",9.96,"mentum sit nibh dapibus justo non maecenas aliquam"
54.00,309.68,298.86,318.52,"/F8",9.96,"feugiat congue. Rhoncus donec. Euismod felis amet felis"
54.00,297.72,298.85,306.57,"/F8",9.96,"senectus purus est. Conubia purus augue a enim id netus"
54.00,285.77,298.83,294.61,"/F8",9.96,"elementum. Posuere felis eni urna et. Cubilia lacus iac-"
54.00,273.81,298.86,282.66,"/F8",9.96,"ulis hac dignissim sem eni. Sodales magna urna faucibus"
54.00,261.85,298.86,270.70,"/F8",9.96,"platea enim erat massa aliquet eros neque eu rutrum me-"
54.00,249.90,298.87,258.75,"/F8",9.96,"tus. Viverra purus ut augue ac magna dictum nibh in"
54.00,237.94,298.87,246.79,"/F8",9.96,"felis. Nonummy dolor parturient natoque amet. Com-"
54.00,225.99,298.89,234.84,"/F8",9.96,"modo magna ut dictum. Lacinia lorem proin justo odio"
54.00,214.03,298.86,222.88,"/F8",9.96,"semper turpis sem. Blandit justo. Laoreet fames etiam"
54.00,202.08,298.86,210.93,"/F8",9.96,"magna mus convallis nascetur et class urna suspendisse"
54.00,190.12,298.84,198.97,"/F8",9.96,"lacinia vitae. Natoque neque arcu a urna vitae phasellus"
54.00,178.17,298.83,187.01,"/F8",9.96,"nisi odio sem nibh. Cubilia porta erat posuere nisl vitae"
54.00,166.21,298.88,175.06,"/F8",9.96,"inceptos donec nunc ac. Aliquam fames amet nunc cur-"
54.00,154.26,298.83,163.10,"/F8",9.96,"abitur. Potenti magna fames iaculis hac vehicula blandit."
54.00,142.30,298.87,151.15,"/F8",9.96,"Commodo porta mus class metus lacus ante. Iaculis felis."
54.00,130.35,298.82,139.19,"/F8",9.96,"Integer nulla. Iaculis netus nulla tellus metus. Sodales"
54.00,118.39,226.49,127.24,"/F8",9.96,"felis class hac arcu a nibh ve nulla mus."
324.44,778.11,554.50,786.07,"/F19",8.97,"Nonummy magna felis quis lectus id ve orci nibh."
326.98,747.88,561.89,756.73,"/F8",9.96,"Feugiat morbi cras. Natoque justo quam duis magnis"
317.01,735.93,561.84,744.77,"/F8",9.96,"id. Nonummy felis quis eni auctor quisque amet sollici-"
317.01,723.97,561.84,732.82,"/F8",9.96,"tudin ve blandit urna massa integer vivamus venenatis."
317.01,712.02,561.87,720.86,"/F8",9.96,"Commodo curae ante eleifend dui laoreet et turpis con-"
317.01,700.06,561.83,708.91,"/F8",9.96,"sectetuer convallis. Vivamus proin et justo. Iaculis lacus"
317.01,688.11,561.88,696.95,"/F8",9.96,"ante. Cubilia fames. Natoque lacus est massa varius con-"
317.01,676.15,561.85,685.00,"/F8",9.96,"sectetuer. Natoque augue nisi. Integer risus. Euismod"
317.01,664.20,561.85,673.04,"/F8",9.96,"curae cras viverra vitae cum fusce tincidunt nonummy"
317.01,652.24,561.83,661.09,"/F8",9.96,"consectetuer tristique. Feugiat magna adipiscing incep-"
317.01,640.28,561.84,649.13,"/F8",9.96,"tos conubia ac eu ultricies parturient pede purus. Eges-"
317.01,628.33,561.82,637.18,"/F8",9.96,"tas risus. Aliquet lorem. Pretium fusce. Feugiat vitae ad"
317.01,616.37,561.82,625.22,"/F8",9.96,"taciti blandit consequat sociosqu id curae semper vestibu-"
317.01,604.42,561.86,613.27,"/F8",9.96,"lum curae arcu volutpat sed sollicitudin class. Commodo"
317.01,592.46,561.85,601.31,"/F8",9.96,"massa. Viverra risus eu. Feugiat metus mi varius lacinia"
317.01,580.51,561.86,589.35,"/F8",9.96,"elementum orci mus curae pretium nisi. Vivamus lacus"
317.01,568.55,561.86,577.40,"/F8",9.96,"duis eu odio mi fringilla consequat netus. Rhoncus donec"
317.01,556.60,561.84,565.44,"/F8",9.96,"integer aenean et senectus feugiat sodales ridiculus platea"
317.01,544.64,561.85,553.49,"/F8",9.96,"quam. Iaculis massa parturient at consectetuer pretium"
317.01,532.69,403.10,541.53,"/F8",9.96,"ligula mus molestie."
326.98,516.82,561.92,525.67,"/F8",9.96,"Conubia magna mi at odio magna viverra lectus. Iac-"
317.01,504.87,561.88,513.71,"/F8",9.96,"ulis porta nam. Laoreet vitae quis a nulla ad sem urna"
317.01,492.91,561.83,501.76,"/F8",9.96,"sit ipsum quam interdum netus pretium. Potenti risus"
317.01,480.96,561.83,489.80,"/F8",9.96,"est adipiscing at montes arcu velit ipsum elit felis dis"
317.01,469.00,561.90,477.85,"/F8",9.96,"dolor. Nonummy metus leo ante enim augue vivamus"
317.01,457.05,561.85,465.89,"/F8",9.96,"proin pede elementum cursus dolor dictumst. Aliquam"
317.01,445.09,561.87,453.94,"/F8",9.96,"lorem id pharetra rhoncus. Feugiat class eros. Natoque"
317.01,433.14,561.86,441.98,"/F8",9.96,"risus donec accumsan curae tellus fusce vestibulum cu-"
317.01,421.18,561.86,430.03,"/F8",9.96,"bilia. Pretium lacus. Rhoncus donec enim cubilia in"
317.01,409.23,561.85,418.07,"/F8",9.96,"lectus augue platea enim ligula sed platea aliquet inte-"
317.01,397.27,561.88,406.12,"/F8",9.96,"ger gravida vitae eu. Euismod magna vestibulum ul-"
317.01,385.32,561.83,394.16,"/F8",9.96,"lamcorper mauris mi. Natoque felis eni aptent tincidunt"
317.01,373.36,561.82,382.21,"/F8",9.96,"dapibus. Aliquet lacus vel vestibulum parturient in vo-"
317.01,361.41,561.87,370.25,"/F8",9.96,"lutpat eros vivamus. Quisque etiam. Laoreet augue po-"
317.01,349.45,561.87,358.30,"/F8",9.96,"tenti leo erat fames urna cum nec mi etiam condimentum"
317.01,337.50,561.83,346.34,"/F8",9.96,"torquent. Iaculis morbi in per porttitor mollis a biben-"
317.01,325.54,561.85,334.39,"/F8",9.96,"dum sed. Integer etiam amet mi sollicitudin auctor fusce"
317.01,313.59,561.86,322.43,"/F8",9.96,"primis. Gravida donec in malesuada porta nibh nascetur"
317.01,301.63,561.88,310.48,"/F8",9.96,"sem vivamus. Cubilia magna mi aenean et ipsum eu risus"
317.01,289.67,561.88,298.52,"/F8",9.96,"et class mi. Rhoncus magna netus quam urna vestibulum"
317.01,277.72,561.88,286.57,"/F8",9.96,"tempor. Potenti fames cras duis. Conubia ipsum magna"
317.01,265.76,405.60,274.61,"/F8",9.96,"rutrum mollis proin."
326.98,249.90,561.84,258.75,"/F8",9.96,"Posuere netus. Integer ipsum nisl facilisi auctor nul-"
317.01,237.94,561.83,246.79,"/F8",9.96,"lam faucibus suspendisse dictumst iaculis. Dapibus fusce"
317.01,225.99,561.85,234.84,"/F8",9.96,"duis fringilla auctor sociis. Laoreet fames feugiat nullam"
317.01,214.03,561.83,222.88,"/F8",9.96,"at est ridiculus leo nisi sem tortor ve interdum. Posuere"
317.01,202.08,561.82,210.92,"/F8",9.96,"lacus hac nisl urna fringilla luctus id volutpat suscipit."
317.01,190.12,561.85,198.97,"/F8",9.96,"Euismod purus sit inceptos. Egestas curae fusce faucibus"
317.01,178.17,561.87,187.01,"/F8",9.96,"in congue suscipit amet sit hac ad phasellus a. Egestas"
317.01,166.21,561.87,175.06,"/F8",9.96,"massa eu cursus sodales enim ve. Conubia vitae parturi-"
317.01,154.26,561.83,163.10,"/F8",9.96,"ent urna primis ve sed quis est mattis hymenaeos pulvinar"
317.01,142.30,561.83,151.15,"/F8",9.96,"erat aptent habitasse dictumst nunc. Potenti etiam eget"
317.01,130.35,561.83,139.19,"/F8",9.96,"quisque. Dapibus justo erat blandit ut sapien dapibus"
317.01,118.39,561.85,127.24,"/F8",9.96,"commodo quisque. Potenti metus eni lectus aliquet at"
