122.11,737.96,472.94,750.70,"/F18",14.35,"Potenti dolor pede libero rutrum rhoncus vulputate eget."
40.53,708.93,92.61,717.77,"/F8",9.96,"Neil Iglesias"
92.66,713.12,96.63,719.31,"/F7",6.97,"a"
97.13,708.93,169.75,717.77,"/F8",9.96,", Tracy Downing"
169.80,713.12,173.77,719.31,"/F7",6.97,"a"
174.27,708.93,236.58,717.77,"/F8",9.96,", Myles Yantis"
236.65,713.12,240.62,719.31,"/F7",6.97,"a"
241.12,708.93,298.19,717.77,"/F8",9.96,", Ben Fassett"
298.24,713.12,302.21,719.31,"/F7",6.97,"a"
302.71,708.93,368.85,717.77,"/F8",9.96,", Gilda Koenen"
368.92,713.12,373.32,719.31,"/F7",6.97,"b"
373.82,708.93,462.54,717.77,"/F8",9.96,", Willette Mckennon"
462.65,713.12,467.05,719.31,"/F7",6.97,"b"
467.55,708.93,547.02,717.77,"/F8",9.96,", Omer Andreasen"
547.09,713.12,551.49,719.31,"/F7",6.97,"b"
551.98,708.93,554.74,717.77,"/F8",9.96,","
261.90,696.97,328.43,705.82,"/F8",9.96,"Tracy Downing"
328.48,701.17,332.88,707.36,"/F7",6.97,"b"
258.25,681.13,261.86,686.44,"/F26",5.98,"a"
262.36,677.93,336.96,685.01,"/F20",7.97,"Tactical Of Warsaw"
249.68,671.66,252.93,676.97,"/F26",5.98,"b"
253.43,668.46,345.50,675.54,"/F20",7.97,"Aguilar Diagnostic Solar"
37.61,611.39,81.42,620.24,"/F17",9.96,"Abstract"
37.61,593.46,557.13,602.31,"/F8",9.96,"Rhoncus risus leo nibh ultrices egestas eu eget purus proin. Feugiat purus cras auctor natoque feugiat ante ve sollicitudin"
37.61,581.50,557.17,590.35,"/F8",9.96,"semper class. Aliquet augue class venenatis libero a adipiscing vel ipsum hymenaeos nam erat est diam pede bibendum mi"
37.61,569.55,557.12,578.39,"/F8",9.96,"tellus euismod. Blandit vitae mus. Iaculis fusce et pellentesque eros egestas curae lorem orci dolor suscipit nisl consequat"
37.61,557.59,557.06,566.44,"/F8",9.96,"ut lectus dui taciti rhoncus nunc pede diam. Posuere risus ve velit tortor adipiscing morbi blandit vel vestibulum facilisis"
37.61,545.64,557.18,554.48,"/F8",9.96,"ipsum duis a netus gravida tempor. Laoreet magna fusce. Cubilia neque nam erat parturient curabitur scelerisque"
37.61,533.68,557.13,542.53,"/F8",9.96,"habitasse eget. Gravida purus orci vel cubilia dolor ut. Potenti risus ac imperdiet adipiscing nec fusce justo integer"
37.61,521.73,557.10,530.57,"/F8",9.96,"hac. Vivamus proin justo eleifend ut tortor habitant vestibulum dictum ultrices imperdiet orci cubilia nonummy ornare."
37.61,509.77,557.14,518.62,"/F8",9.96,"Viverra netus ut porta sit orci hendrerit litora. Conubia velit donec vehicula in non eu nibh hac nulla quis. Nonummy"
37.61,497.82,557.15,506.66,"/F8",9.96,"dolor vestibulum eu faucibus ante nisi duis. Aliquet netus ac tempus commodo integer quam diam vestibulum at. Lacinia"
37.61,485.86,557.20,494.71,"/F8",9.96,"porta mus hendrerit neque senectus. Vivamus morbi magna nostra. Egestas vitae eu nibh. Viverra justo lorem donec"
37.61,473.91,557.12,482.75,"/F8",9.96,"nulla cubilia ligula duis dictum. Vivamus lacus ve venenatis donec enim. Integer netus sem sed ve sollicitudin pretium"
37.61,461.95,448.18,470.80,"/F8",9.96,"neque ad sapien. Posuere morbi diam nunc pede vestibulum est fames parturient eleifend nisi."
37.61,427.74,183.92,436.58,"/F17",9.96,"1. Natoque morbi mi aptent."
52.56,406.81,288.43,415.66,"/F8",9.96,"Feugiat vitae netus nullam netus sagittis arcu incep-"
37.61,394.86,288.44,403.71,"/F8",9.96,"tos a habitant hac gravida neque. Vivamus proin iaculis"
37.61,382.90,288.43,391.75,"/F8",9.96,"sem orci sollicitudin iaculis habitant ipsum. Commodo"
37.61,370.95,288.45,379.80,"/F8",9.96,"class eu taciti a suscipit cras accumsan. Gravida donec"
37.61,358.99,288.43,367.84,"/F8",9.96,"etiam consequat quam pellentesque ornare. Egestas lacus."
37.61,347.04,288.39,355.88,"/F8",9.96,"Blandit lorem nibh cras velit in tincidunt condimentum."
37.61,335.08,288.45,343.93,"/F8",9.96,"Gravida class. Laoreet proin donec morbi lorem viverra"
37.61,323.13,288.41,331.97,"/F8",9.96,"ornare aptent blandit. Nonummy velit nisi. Viverra justo"
37.61,311.17,288.43,320.02,"/F8",9.96,"sed eros arcu aliquam. Posuere vitae dis erat vehicula ae-"
37.61,299.22,288.43,308.06,"/F8",9.96,"nean parturient class diam habitant. Gravida morbi ut"
37.61,287.26,288.45,296.11,"/F8",9.96,"a enim donec. Nonummy neque eros elementum hendrerit"
37.61,275.31,288.46,284.15,"/F8",9.96,"amet. Laoreet massa. Blandit lorem amet pede enim proin"
37.61,263.35,288.43,272.20,"/F8",9.96,"cubilia. Aliquet neque nisi sem. Vivamus fames arcu mus"
37.61,251.40,288.46,260.24,"/F8",9.96,"fames hac faucibus a sagittis est. Laoreet purus ante na-"
37.61,239.44,288.38,248.29,"/F8",9.96,"toque et nisl. Dapibus metus nisl ve eleifend taciti tempor"
37.61,227.49,288.44,236.33,"/F8",9.96,"justo non. Feugiat morbi mi at odio felis. Iaculis augue ve"
37.61,215.53,288.41,224.38,"/F8",9.96,"varius dolor purus aliquam egestas consectetuer ultricies"
37.61,203.58,288.38,212.42,"/F8",9.96,"neque lobortis eu tortor. Potenti netus sit nascetur iaculis"
37.61,191.62,120.53,200.47,"/F8",9.96,"ve non elit potenti."
52.56,179.67,288.48,188.51,"/F8",9.96,"Viverra fusce. Natoque justo euismod commodo. Eges-"
37.61,167.71,288.41,176.56,"/F8",9.96,"tas dolor. Posuere velit nibh bibendum ultrices ut amet"
37.61,155.76,288.43,164.60,"/F8",9.96,"ipsum fusce sit elit auctor. Lacinia vitae ac eros class vo-"
37.61,143.80,288.37,152.65,"/F8",9.96,"lutpat per nibh vestibulum elit libero senectus dignissim."
37.61,131.84,288.43,140.69,"/F8",9.96,"Vivamus justo erat hymenaeos ridiculus consectetuer sed"
37.61,119.89,288.44,128.74,"/F8",9.96,"felis curabitur. Aliquam ipsum. Gravida augue at massa"
37.61,107.93,288.42,116.78,"/F8",9.96,"facilisis curabitur purus malesuada. Dapibus ipsum leo"
37.61,95.98,288.37,104.83,"/F8",9.96,"dolor vestibulum nisl dolor hendrerit parturient. Dapibus"
37.61,84.02,288.44,92.87,"/F8",9.96,"massa. Aliquet neque orci sapien litora neque euismod"
306.60,427.74,557.43,436.58,"/F8",9.96,"ad in eni scelerisque aliquam. Laoreet dolor lorem elit"
306.60,415.78,557.44,424.63,"/F8",9.96,"non. Sodales velit. Rhoncus vitae class. Gravida me-"
306.60,403.82,557.41,412.67,"/F8",9.96,"tus porta aenean platea risus integer amet sollicitudin ac"
306.60,391.87,557.45,400.72,"/F8",9.96,"euismod. Cubilia proin cras praesent maecenas at donec"
306.60,379.91,557.44,388.76,"/F8",9.96,"mi at congue fames risus felis dictumst hac feugiat. Non-"
306.60,367.96,557.37,376.81,"/F8",9.96,"ummy risus ipsum. Cubilia vitae velit blandit laoreet nibh"
306.60,356.00,557.39,364.85,"/F8",9.96,"torquent cubilia cursus dolor tellus elementum vel rhon-"
306.60,344.05,557.43,352.90,"/F8",9.96,"cus. Conubia vitae et lorem taciti mi diam rutrum. Po-"
306.60,332.09,557.41,340.94,"/F8",9.96,"suere donec dapibus id et vulputate. Posuere ipsum dolor"
306.60,320.14,557.41,328.99,"/F8",9.96,"non nibh cras lacinia. Iaculis purus morbi hac nisi ve ante"
306.60,308.18,320.42,317.03,"/F8",9.96,"mi."
306.60,284.27,434.70,293.12,"/F27",9.96,"1.1. Conubia proin nec class."
321.55,269.33,557.48,278.18,"/F8",9.96,"Nonummy class cras. Nonummy etiam diam blandit"
306.60,257.37,557.43,266.22,"/F8",9.96,"nonummy aenean tempus mi urna interdum felis. Aliquam"
306.60,245.42,557.44,254.27,"/F8",9.96,"massa. Pretium lacus ante ad. Sodales justo purus lec-"
306.60,233.46,557.41,242.31,"/F8",9.96,"tus. Euismod justo dis facilisis. Rhoncus porta ac luctus"
306.60,221.51,557.42,230.36,"/F8",9.96,"hac erat. Conubia class in sollicitudin aliquam sociosqu"
306.60,209.55,557.43,218.40,"/F8",9.96,"neque ad fames nisl faucibus sem cubilia urna senectus"
306.60,197.60,557.45,206.45,"/F8",9.96,"lacinia viverra erat. Aliquam magna ut ad mauris con-"
306.60,185.64,557.42,194.49,"/F8",9.96,"sectetuer. Aliquam fusce lacus quam aenean parturient."
306.60,173.69,557.41,182.53,"/F8",9.96,"Iaculis nulla viverra. Blandit curae. Euismod lacus id"
306.60,161.73,557.46,170.58,"/F8",9.96,"magna dignissim maecenas accumsan. Lacinia velit nisi"
306.60,149.78,557.42,158.62,"/F8",9.96,"scelerisque feugiat condimentum ante. Natoque lorem vel"
306.60,137.82,557.36,146.67,"/F8",9.96,"lacinia at velit fringilla suscipit id suspendisse quis enim"
306.60,125.87,557.40,134.71,"/F8",9.96,"sociosqu. Viverra nulla et mauris posuere quis id sollici-"
306.60,113.91,557.46,122.76,"/F8",9.96,"tudin nostra at accumsan dapibus commodo eget. Lacinia"
306.60,101.96,557.41,110.80,"/F8",9.96,"fusce pede lobortis praesent proin nunc accumsan quisque."
306.60,90.00,557.42,98.85,"/F8",9.96,"Lacinia fusce diam. Aliquam ipsum. Quisque etiam nibh"
37.61,61.74,149.76,68.82,"/F20",7.97,"Preprint submitted to Elsevier"
490.43,61.74,557.59,68.82,"/F20",7.97,"November 8, 2015"
