50.45,737.96,544.60,750.70,"/F18",14.35,"Vivamus velit eros nunc posuere fames nisi pretium phasellus lobortis mollis nisi"
223.30,720.03,371.86,732.77,"/F18",14.35,"tempor vehicula laoreet."
170.80,690.99,240.91,699.84,"/F8",9.96,"Tana Redington"
240.95,695.19,244.92,701.38,"/F7",6.97,"a"
245.42,690.99,330.39,699.84,"/F8",9.96,", Mason Weatherby"
330.47,695.19,334.43,701.38,"/F7",6.97,"a"
334.94,690.99,419.92,699.84,"/F8",9.96,", Arlie Strausbaugh"
420.01,695.19,423.97,701.38,"/F7",6.97,"a"
262.95,675.15,266.55,680.46,"/F26",5.98,"a"
267.05,671.95,332.26,679.03,"/F20",7.97,"Evans Mangotech"
37.61,614.88,81.42,623.72,"/F17",9.96,"Abstract"
37.61,596.95,557.12,605.79,"/F8",9.96,"Dapibus velit dis cras arcu cubilia. Nonummy dolor diam nisi vitae venenatis torquent id proin mi vitae scelerisque."
37.61,584.99,557.24,593.84,"/F8",9.96,"Nonummy magna eros penatibus et auctor. Potenti vitae egestas eget mi curae dui diam nunc eni. Nonummy fames"
37.61,573.03,557.12,581.88,"/F8",9.96,"lorem maecenas parturient facilisis quam condimentum ve platea sollicitudin. Egestas vitae in tempus nec nunc pretium."
37.61,561.08,557.10,569.93,"/F8",9.96,"Gravida risus urna dui taciti mattis vitae nec phasellus tortor. Feugiat felis enim blandit ante est per vel mus. Integer"
37.61,549.12,557.11,557.97,"/F8",9.96,"fusce diam. Egestas dolor quisque aenean vel nibh pede nec a rutrum. Cubilia justo nibh ullamcorper sollicitudin blandit."
37.61,537.17,557.16,546.02,"/F8",9.96,"Aliquam augue at porta fermentum aptent inceptos vestibulum luctus vitae nascetur pede non aliquam neque orci hac."
37.61,525.21,557.17,534.06,"/F8",9.96,"Aliquam nulla lacus. Rhoncus curae diam habitant hendrerit nisi potenti ad mi ac tempor placerat. Integer proin arcu"
37.61,513.26,557.13,522.10,"/F8",9.96,"vehicula cursus nullam quis duis proin metus dapibus enim cras. Egestas class parturient vehicula ante odio nec blandit"
37.61,501.30,557.10,510.15,"/F8",9.96,"in. Laoreet velit nibh feugiat pede est elit. Iaculis donec parturient ve sollicitudin pretium tempus arcu. Egestas donec"
37.61,489.35,557.19,498.19,"/F8",9.96,"est morbi proin suspendisse at. Laoreet etiam. Aliquam massa morbi sed vel nam sollicitudin ornare morbi senectus"
37.61,477.39,235.72,486.24,"/F8",9.96,"lorem. Integer vitae quis ullamcorper feugiat."
37.61,443.18,127.77,452.02,"/F17",9.96,"1. Gravida lorem."
52.56,422.26,288.44,431.10,"/F8",9.96,"Gravida class nisi turpis elementum. Natoque neque"
37.61,410.30,288.46,419.15,"/F8",9.96,"quam sem odio erat arcu odio vitae. Gravida donec enim"
37.61,398.35,243.49,407.19,"/F8",9.96,"accumsan montes aptent hendrerit leo purus."
253.51,398.35,288.44,407.19,"/F8",9.96,"Gravida"
37.61,386.39,221.39,395.24,"/F8",9.96,"purus proin quis viverra fames dis quis."
231.82,386.39,288.40,395.24,"/F8",9.96,"Blandit velit"
37.61,374.44,288.40,383.28,"/F8",9.96,"in rutrum. Gravida lacus ut et netus fusce ultricies id"
37.61,362.48,288.40,371.33,"/F8",9.96,"scelerisque urna sociis hendrerit. Feugiat morbi. Euismod"
37.61,350.52,288.41,359.37,"/F8",9.96,"metus morbi sit adipiscing lectus metus adipiscing lobor-"
37.61,338.57,288.45,347.42,"/F8",9.96,"tis. Commodo lacus ipsum litora porta adipiscing plac-"
37.61,326.61,288.43,335.46,"/F8",9.96,"erat. Gravida purus magna pede mauris penatibus portti-"
37.61,314.66,288.42,323.51,"/F8",9.96,"tor fusce ut id curae molestie. Viverra netus erat laoreet"
37.61,302.70,288.38,311.55,"/F8",9.96,"in id etiam risus ultricies eu nunc ultricies aenean parturi-"
37.61,290.75,288.40,299.60,"/F8",9.96,"ent. Viverra justo nec vestibulum parturient in. Sodales"
37.61,278.79,288.41,287.64,"/F8",9.96,"class integer tellus leo natoque porta netus ullamcorper leo"
37.61,266.84,288.44,275.69,"/F8",9.96,"montes nam blandit torquent. Integer magna nunc vel et"
37.61,254.88,288.47,263.73,"/F8",9.96,"urna lorem. Pretium justo diam duis massa ac eros. Non-"
37.61,242.93,288.40,251.78,"/F8",9.96,"ummy magna nisi sit facilisis pellentesque adipiscing nunc"
37.61,230.97,288.40,239.82,"/F8",9.96,"felis nisl. Viverra morbi per vitae metus sed curae luctus"
37.61,219.02,288.43,227.86,"/F8",9.96,"dui. Lacinia etiam proin non odio. Potenti lorem. Posuere"
37.61,207.06,288.44,215.91,"/F8",9.96,"dolor. Viverra proin quam accumsan penatibus. Pretium"
37.61,195.11,260.31,203.95,"/F8",9.96,"nulla nisi mi vel ante consectetuer gravida eleifend."
52.56,183.15,288.44,192.00,"/F8",9.96,"Potenti magna eget luctus mi at nisl ullamcorper. Feu-"
37.61,171.20,288.45,180.04,"/F8",9.96,"giat justo id nulla dignissim arcu sodales ante justo ac"
37.61,159.24,288.40,168.09,"/F8",9.96,"habitasse vestibulum nibh lacus. Dapibus risus ut proin"
37.61,147.29,288.44,156.13,"/F8",9.96,"cras nisl. Aliquam morbi mus imperdiet metus. Viva-"
37.61,135.33,288.41,144.18,"/F8",9.96,"mus felis diam sociosqu sollicitudin montes at luctus sit"
37.61,123.38,288.45,132.22,"/F8",9.96,"id. Laoreet morbi at platea ve pharetra mus cras a duis."
37.61,111.42,288.41,120.27,"/F8",9.96,"Egestas fames mus quis in curae sollicitudin. Feugiat proin"
37.61,99.47,288.42,108.31,"/F8",9.96,"nulla eleifend justo nunc vivamus mi turpis hac. Lacinia"
37.61,87.51,291.06,96.36,"/F8",9.96,"proin etiam suspendisse senectus velit nec parturient. Eges-"
306.60,443.18,557.40,452.02,"/F8",9.96,"tas risus id ad quis orci lacus erat felis netus arcu. Laoreet"
306.60,431.22,557.41,440.07,"/F8",9.96,"metus donec odio habitant mattis. Sodales purus parturi-"
306.60,419.27,557.46,428.11,"/F8",9.96,"ent lacinia eget ac. Lacinia massa. Sodales etiam quis"
306.60,407.31,557.42,416.16,"/F8",9.96,"vivamus. Lacinia ipsum elit habitasse eleifend augue pe-"
306.60,395.36,557.44,404.20,"/F8",9.96,"natibus. Commodo fames eros elit hymenaeos eu ultricies"
306.60,383.40,557.39,392.25,"/F8",9.96,"a dui hendrerit viverra quam integer nisi. Lacinia dolor in"
306.60,371.45,557.41,380.29,"/F8",9.96,"fames taciti venenatis nam sollicitudin semper ad. Conu-"
306.60,359.49,557.40,368.34,"/F8",9.96,"bia velit at convallis phasellus risus. Integer class nunc"
306.60,347.54,557.40,356.38,"/F8",9.96,"taciti habitasse facilisi sociis mauris in hymenaeos. Euis-"
306.60,335.58,557.46,344.43,"/F8",9.96,"mod ipsum eni ante nisi odio nam nostra mauris nec et"
306.60,323.63,557.41,332.47,"/F8",9.96,"morbi risus. Posuere purus nibh consequat torquent sem-"
306.60,311.67,557.45,320.52,"/F8",9.96,"per pede enim. Nonummy augue donec pede ligula feugiat"
306.60,299.72,467.60,308.56,"/F8",9.96,"consequat pede amet eget aenean ac."
321.55,287.76,557.43,296.61,"/F8",9.96,"Cubilia lorem et cursus consectetuer est curae amet."
306.60,275.80,557.43,284.65,"/F8",9.96,"Sodales donec arcu lacus in urna suscipit netus malesuada"
306.60,263.85,557.42,272.70,"/F8",9.96,"vehicula. Posuere curae ad varius id eni enim convallis"
306.60,251.89,557.45,260.74,"/F8",9.96,"congue. Integer lacus leo litora libero netus commodo ia-"
306.60,239.94,557.39,248.79,"/F8",9.96,"culis ligula. Potenti etiam porta enim non vitae curabitur"
306.60,227.98,557.39,236.83,"/F8",9.96,"bibendum id primis sagittis. Euismod neque justo. Iaculis"
306.60,216.03,557.38,224.88,"/F8",9.96,"felis vestibulum eleifend diam habitant. Viverra ipsum hac"
306.60,204.07,557.44,212.92,"/F8",9.96,"arcu duis dignissim accumsan. Pretium massa eros tris-"
306.60,192.12,557.42,200.97,"/F8",9.96,"tique auctor dolor per. Lacinia nulla sem habitant fusce"
306.60,180.16,557.43,189.01,"/F8",9.96,"quam orci dictum elementum parturient odio justo mag-"
306.60,168.21,557.39,177.06,"/F8",9.96,"nis ut. Feugiat ipsum. Viverra neque dis duis vulputate"
306.60,156.25,557.43,165.10,"/F8",9.96,"mi dolor rutrum montes arcu. Euismod lacus et turpis"
306.60,144.30,557.40,153.14,"/F8",9.96,"ridiculus vitae vel neque. Egestas donec. Aliquam donec."
306.60,132.34,557.43,141.19,"/F8",9.96,"Euismod justo nunc convallis ad elementum dolor at tem-"
306.60,120.39,557.41,129.23,"/F8",9.96,"pus. Cubilia ipsum ac proin consectetuer facilisis augue"
306.60,108.43,557.38,117.28,"/F8",9.96,"montes dictum class cras nibh hendrerit facilisi velit eget"
306.60,96.48,557.44,105.32,"/F8",9.96,"at augue. Integer etiam at class ve tortor ve odio. Inte-"
306.60,84.52,557.40,93.37,"/F8",9.96,"ger neque velit tortor nostra dolor vivamus iaculis litora"
37.61,61.74,149.76,68.82,"/F20",7.97,"Preprint submitted to Elsevier"
490.43,61.74,557.59,68.82,"/F20",7.97,"November 8, 2015"
