557.11,803.82,562.09,812.67,"/F8",9.96,"5"
54.00,777.92,298.81,786.77,"/F8",9.96,"iscing. Potenti lacus ve fames pellentesque lacus ut felis"
54.00,765.96,298.84,774.81,"/F8",9.96,"ullamcorper senectus fusce aliquam. Dapibus morbi. So-"
54.00,754.01,298.87,762.86,"/F8",9.96,"dales donec sed dolor quis dis per. Commodo class quis"
54.00,742.05,298.83,750.90,"/F8",9.96,"purus nullam mollis inceptos scelerisque hac diam id con-"
54.00,730.10,298.83,738.95,"/F8",9.96,"sectetuer. Cubilia risus fames accumsan felis dapibus ve."
54.00,718.14,298.84,726.99,"/F8",9.96,"Laoreet fusce. Gravida velit. Natoque netus odio iaculis"
54.00,706.19,220.54,715.03,"/F8",9.96,"luctus orci condimentum pellentesque."
55.84,670.69,297.03,678.65,"/F19",8.97,"Cubilia dolor risus duis vivamus class duis egestas a"
152.88,660.23,200.14,668.19,"/F19",8.97,"litora nisi."
63.96,633.43,298.81,642.27,"/F8",9.96,"Rhoncus felis id imperdiet risus lorem cursus velit tin-"
54.00,621.47,84.12,630.32,"/F8",9.96,"cidunt."
91.08,621.47,158.99,630.32,"/F8",9.96,"Gravida metus."
165.95,621.47,298.84,630.32,"/F8",9.96,"Rhoncus proin purus senectus"
54.00,609.52,130.48,618.36,"/F8",9.96,"porttitor sagittis."
139.17,609.52,298.82,618.36,"/F8",9.96,"Integer vitae quis sociosqu molestie"
54.00,597.56,298.84,606.41,"/F8",9.96,"ad. Aliquet neque mus elit pharetra non. Laoreet ipsum."
54.00,585.61,298.85,594.45,"/F8",9.96,"Vivamus justo. Laoreet netus. Gravida justo orci tortor"
54.00,573.65,298.89,582.50,"/F8",9.96,"ac conubia mi maecenas bibendum at cursus. Nonummy"
54.00,561.70,298.90,570.54,"/F8",9.96,"magna ante nulla fames a nunc. Natoque donec cras sus-"
54.00,549.74,298.81,558.59,"/F8",9.96,"pendisse egestas velit aliquet. Conubia lorem vestibulum"
54.00,537.79,87.29,546.63,"/F8",9.96,"egestas."
94.39,537.79,159.27,546.63,"/F8",9.96,"Blandit augue."
166.38,537.79,232.54,546.63,"/F8",9.96,"Aliquam dolor."
239.64,537.79,298.86,546.63,"/F8",9.96,"Conubia velit"
54.00,525.83,298.82,534.68,"/F8",9.96,"porta luctus egestas quisque etiam. Pretium velit mi mus"
54.00,513.88,298.81,522.72,"/F8",9.96,"arcu enim felis dignissim habitasse vestibulum nisl justo"
54.00,501.92,298.84,510.77,"/F8",9.96,"placerat parturient. Laoreet porta nam pede dictum nisi"
54.00,489.97,298.86,498.81,"/F8",9.96,"hac bibendum vitae et fames. Iaculis donec cras urna et"
54.00,478.01,298.87,486.86,"/F8",9.96,"consectetuer amet lacinia urna fusce nullam. Commodo"
54.00,466.06,298.80,474.90,"/F8",9.96,"purus per nisl. Euismod purus eu netus scelerisque volut-"
54.00,454.10,298.85,462.95,"/F8",9.96,"pat netus taciti ac congue in curae. Integer nulla ipsum"
54.00,442.14,298.84,450.99,"/F8",9.96,"varius ve. Sodales ipsum est eros netus montes vehicula"
54.00,430.19,94.95,439.04,"/F8",9.96,"morbi ve."
63.96,417.75,298.87,426.60,"/F8",9.96,"Rhoncus justo. Sodales justo sit amet odio lacinia odio"
54.00,405.80,80.82,414.64,"/F8",9.96,"quam."
89.74,405.80,298.86,414.64,"/F8",9.96,"Integer augue et metus rutrum cras imperdiet"
54.00,393.84,166.36,402.69,"/F8",9.96,"tortor vehicula ipsum ve."
174.11,393.84,298.85,402.69,"/F8",9.96,"Egestas dolor arcu natoque."
54.00,381.89,298.86,390.73,"/F8",9.96,"Dapibus magna. Laoreet fusce et eros facilisi libero mag-"
54.00,369.93,130.62,378.78,"/F8",9.96,"nis neque primis."
139.08,369.93,298.86,378.78,"/F8",9.96,"Aliquam fames id metus ac rutrum"
54.00,357.98,298.80,366.82,"/F8",9.96,"pharetra convallis mollis taciti. Laoreet velit quis purus"
54.00,346.02,298.85,354.87,"/F8",9.96,"id erat quis. Commodo dolor et venenatis. Blandit porta"
54.00,334.07,162.95,342.91,"/F8",9.96,"urna leo ut semper mus."
169.75,334.07,298.86,342.91,"/F8",9.96,"Viverra dolor ad tellus lorem"
54.00,322.11,298.83,330.96,"/F8",9.96,"curae dui odio ac sollicitudin turpis. Cubilia magna. In-"
54.00,310.16,298.84,319.00,"/F8",9.96,"teger proin eget duis sodales eu pulvinar vivamus mauris"
54.00,298.20,298.86,307.05,"/F8",9.96,"sem ac urna diam. Egestas morbi parturient feugiat eni"
54.00,286.25,298.81,295.09,"/F8",9.96,"id sollicitudin lectus montes ut felis lorem a erat mi. Cu-"
54.00,274.29,298.81,283.14,"/F8",9.96,"bilia felis. Dapibus nulla ve mauris sodales nec ut cursus."
54.00,262.34,298.83,271.18,"/F8",9.96,"Quisque neque amet ultrices. Sodales nulla cras nec nunc"
54.00,250.38,298.83,259.23,"/F8",9.96,"molestie consectetuer ornare. Pretium justo ante a nisi."
54.00,238.43,119.39,247.27,"/F8",9.96,"Rhoncus fusce."
125.99,238.43,298.84,247.27,"/F8",9.96,"Nonummy etiam in nibh id sollicitudin"
54.00,226.47,134.13,235.32,"/F8",9.96,"turpis eu suscipit."
142.38,226.47,298.84,235.32,"/F8",9.96,"Vivamus netus egestas odio et tin-"
54.00,214.52,243.71,223.36,"/F8",9.96,"cidunt etiam leo nibh pellentesque pretium."
63.96,202.08,298.84,210.93,"/F8",9.96,"Euismod vitae euismod placerat nullam tortor fringilla"
54.00,190.12,298.86,198.97,"/F8",9.96,"pharetra ante mus mi augue varius. Conubia metus mi ve"
54.00,178.17,256.90,187.02,"/F8",9.96,"taciti purus ridiculus mauris lorem imperdiet."
263.64,178.17,298.80,187.02,"/F8",9.96,"Quisque"
54.00,166.21,151.81,175.06,"/F8",9.96,"metus velit mauris et."
158.83,166.21,225.60,175.06,"/F8",9.96,"Quisque fames."
232.62,166.21,298.85,175.06,"/F8",9.96,"Vivamus fames"
54.00,154.26,116.90,163.11,"/F8",9.96,"ipsum congue."
124.07,154.26,298.85,163.11,"/F8",9.96,"Blandit etiam vitae dictum ac faucibus"
54.00,142.30,80.53,151.15,"/F8",9.96,"ligula."
87.48,142.30,298.84,151.15,"/F8",9.96,"Euismod augue elit metus taciti nascetur male-"
54.00,130.35,298.85,139.19,"/F8",9.96,"suada id condimentum eros. Aliquam ipsum id. Pretium"
54.00,118.39,298.84,127.24,"/F8",9.96,"morbi lacus. Sodales felis adipiscing ullamcorper sapien"
317.01,777.92,371.95,786.77,"/F8",9.96,"ad class vel."
380.65,777.92,461.09,786.77,"/F8",9.96,"Potenti ipsum ad."
469.79,777.92,561.87,786.77,"/F8",9.96,"Gravida purus curae"
317.01,765.96,561.86,774.81,"/F8",9.96,"suspendisse nam cras eni aenean integer ve dictum dui."
317.01,754.01,385.73,762.86,"/F8",9.96,"Dapibus morbi."
394.08,754.01,459.88,762.86,"/F8",9.96,"Natoque lacus."
468.24,754.01,561.85,762.86,"/F8",9.96,"Aliquet neque iaculis"
317.01,742.05,561.84,750.90,"/F8",9.96,"taciti orci feugiat est habitant laoreet diam. Conubia la-"
317.01,730.10,561.86,738.95,"/F8",9.96,"cus etiam nulla convallis. Gravida magna cum urna vitae"
317.01,718.14,471.98,726.99,"/F8",9.96,"risus fusce eros nunc eni in mattis."
478.55,718.14,561.85,726.99,"/F8",9.96,"Integer porta nulla"
317.01,706.19,488.39,715.04,"/F8",9.96,"nec vestibulum parturient id molestie."
497.06,706.19,561.83,715.04,"/F8",9.96,"Natoque netus"
317.01,694.23,561.85,703.08,"/F8",9.96,"hac nisi nascetur morbi turpis mi venenatis class nasce-"
317.01,682.28,561.83,691.12,"/F8",9.96,"tur. Natoque velit mi ante nascetur egestas pellentesque"
317.01,670.32,561.84,679.17,"/F8",9.96,"libero ac nibh. Cubilia risus diam elementum libero quam"
317.01,658.37,561.82,667.21,"/F8",9.96,"varius. Rhoncus neque cras bibendum sollicitudin tortor."
391.85,623.61,487.20,631.57,"/F19",8.97,"PRETIUM NULLA."
326.98,596.94,561.89,605.79,"/F8",9.96,"Aliquet massa arcu odio. Vivamus class vel eget nasce-"
317.01,584.99,561.85,593.83,"/F8",9.96,"tur sit viverra. Vivamus dolor. Potenti magna et montes"
317.01,573.03,561.82,581.88,"/F8",9.96,"natoque egestas mollis metus et penatibus felis imperdiet."
317.01,561.08,561.89,569.92,"/F8",9.96,"Posuere risus vivamus massa ac cras ad consequat tin-"
317.01,549.12,422.72,557.97,"/F8",9.96,"cidunt parturient diam."
432.20,549.12,561.88,557.97,"/F8",9.96,"Sodales magna fames metus."
317.01,537.17,561.82,546.01,"/F8",9.96,"Aliquet risus in mattis ut et mus ante mi per curabitur."
317.01,525.21,561.85,534.06,"/F8",9.96,"Potenti velit leo dapibus placerat dolor ac mauris mi."
317.01,513.26,379.25,522.10,"/F8",9.96,"Cubilia porta."
387.01,513.26,537.80,522.10,"/F8",9.96,"Laoreet morbi eu luctus sociosqu."
545.57,513.26,561.88,522.10,"/F8",9.96,"Iac-"
317.01,501.30,561.88,510.15,"/F8",9.96,"ulis proin arcu convallis. Aliquam massa odio nonummy"
317.01,489.35,561.84,498.19,"/F8",9.96,"phasellus dis dictumst. Conubia lacus orci iaculis. Conu-"
317.01,477.39,561.85,486.24,"/F8",9.96,"bia fusce adipiscing orci montes blandit posuere inter-"
317.01,465.44,561.86,474.28,"/F8",9.96,"dum. Feugiat class curae aliquam dis montes blandit eros"
317.01,453.48,488.61,462.33,"/F8",9.96,"auctor parturient consectetuer sodales."
495.73,453.48,561.86,462.33,"/F8",9.96,"Rhoncus fames"
317.01,441.52,561.85,450.37,"/F8",9.96,"mus vestibulum luctus massa ipsum nec lorem dui vulpu-"
317.01,429.57,561.86,438.42,"/F8",9.96,"tate enim quisque. Rhoncus augue. Potenti lorem conu-"
317.01,417.61,561.84,426.46,"/F8",9.96,"bia turpis ve urna auctor ut eleifend. Conubia metus orci"
317.01,405.66,400.42,414.51,"/F8",9.96,"nisl rhoncus lorem."
406.15,405.66,471.25,414.51,"/F8",9.96,"Rhoncus fusce."
476.98,405.66,561.86,414.51,"/F8",9.96,"Pretium fames erat"
317.01,393.70,468.32,402.55,"/F8",9.96,"quisque dignissim. Rhoncus etiam."
326.98,381.41,561.87,390.25,"/F8",9.96,"Viverra proin ante euismod ad nullam montes risus vel"
317.01,369.45,338.60,378.30,"/F8",9.96,"arcu."
344.26,369.45,561.84,378.30,"/F8",9.96,"Aliquam velit dolor venenatis ve suspendisse eget"
317.01,357.50,561.87,366.34,"/F8",9.96,"hymenaeos mus faucibus rhoncus euismod. Blandit dolor"
317.01,345.54,561.86,354.39,"/F8",9.96,"fusce metus a duis at proin pellentesque augue ve arcu."
317.01,333.59,561.86,342.43,"/F8",9.96,"Iaculis purus ac quam tempor in habitant. Conubia nulla"
317.01,321.63,561.84,330.48,"/F8",9.96,"elit faucibus facilisis neque nibh sem diam. Aliquam la-"
317.01,309.68,561.85,318.52,"/F8",9.96,"cus id ante at fusce accumsan enim quisque velit mi a duis"
317.01,297.72,561.84,306.57,"/F8",9.96,"ac enim amet ut sollicitudin sodales bibendum. Pretium"
317.01,285.76,502.28,294.61,"/F8",9.96,"netus class taciti porta placerat fringilla."
511.56,285.76,561.84,294.61,"/F8",9.96,"Cubilia do-"
317.01,273.81,561.83,282.66,"/F8",9.96,"lor. Cubilia dolor nisl a arcu parturient habitasse ullam-"
317.01,261.85,347.20,270.70,"/F8",9.96,"corper."
353.83,261.85,500.52,270.70,"/F8",9.96,"Lacinia nulla urna condimentum."
507.14,261.85,561.86,270.70,"/F8",9.96,"Iaculis proin"
317.01,249.90,561.85,258.75,"/F8",9.96,"quam penatibus senectus justo ve ipsum suspendisse. Po-"
317.01,237.94,561.84,246.79,"/F8",9.96,"tenti purus parturient ullamcorper mauris at donec cras"
317.01,225.99,561.82,234.84,"/F8",9.96,"quisque mi cursus mi lobortis nisl suscipit ullamcorper."
317.01,214.03,434.94,222.88,"/F8",9.96,"Euismod metus cras class."
443.21,214.03,561.91,222.88,"/F8",9.96,"Cubilia massa morbi a so-"
317.01,202.08,561.88,210.93,"/F8",9.96,"dales ad. Commodo netus viverra dictum odio. Viverra"
317.01,190.12,536.46,198.97,"/F8",9.96,"risus ipsum conubia et nisi nonummy vitae nisl."
545.83,190.12,561.86,198.97,"/F8",9.96,"Cu-"
317.01,178.17,561.86,187.02,"/F8",9.96,"bilia porta orci posuere ad lorem libero dolor vestibu-"
317.01,166.21,336.36,175.06,"/F8",9.96,"lum."
342.45,166.21,536.81,175.06,"/F8",9.96,"Potenti felis donec taciti bibendum class at."
542.91,166.21,561.83,175.06,"/F8",9.96,"Feu-"
317.01,154.26,561.88,163.11,"/F8",9.96,"giat morbi vestibulum ad elementum nibh leo aenean a"
317.01,142.30,561.82,151.15,"/F8",9.96,"adipiscing est fames vestibulum ad eleifend risus sociis ul-"
317.01,130.35,374.74,139.19,"/F8",9.96,"tricies neque."
380.47,130.35,447.35,139.19,"/F8",9.96,"Gravida augue."
453.09,130.35,525.69,139.19,"/F8",9.96,"Nonummy vitae."
531.42,130.35,561.86,139.19,"/F8",9.96,"Integer"
317.01,118.39,479.76,127.24,"/F8",9.96,"etiam nisl laoreet viverra odio a duis."
