252.10,738.12,343.10,750.86,"/F18",14.35,"Viverra massa."
162.09,709.08,225.72,717.93,"/F8",9.96,"Ilona Hubbard"
225.77,713.28,229.74,719.47,"/F7",6.97,"a"
230.24,709.08,287.63,717.93,"/F8",9.96,", Sid Bratton"
287.69,713.28,291.66,719.47,"/F7",6.97,"a"
292.16,709.08,358.11,717.93,"/F8",9.96,", Mafalda Luke"
358.16,713.28,362.13,719.47,"/F7",6.97,"a"
362.63,709.08,428.65,717.93,"/F8",9.96,", Darius Hollen"
428.72,713.28,432.68,719.47,"/F7",6.97,"a"
243.65,693.24,247.25,698.55,"/F26",5.98,"a"
247.75,690.04,351.51,697.12,"/F20",7.97,"Heath Apex Business Stores"
37.61,632.97,81.42,641.82,"/F17",9.96,"Abstract"
37.61,615.04,557.16,623.88,"/F8",9.96,"Sodales etiam duis dapibus velit adipiscing molestie nunc auctor. Natoque netus mus morbi purus nisi lacinia ad erat"
37.61,603.08,557.19,611.93,"/F8",9.96,"diam sem ve magna. Euismod velit dis duis netus aptent consequat sem eget duis nulla posuere et enim. Conubia lacus"
37.61,591.13,557.09,599.97,"/F8",9.96,"et netus lectus turpis dignissim risus nisi curae at. Egestas velit cum nunc sed aenean vulputate parturient duis primis"
37.61,579.17,557.18,588.02,"/F8",9.96,"nostra magna. Potenti nulla vivamus lacinia arcu molestie per quam nam a primis lorem faucibus cras sagittis. Integer"
37.61,567.22,557.20,576.06,"/F8",9.96,"ipsum quam duis odio tincidunt et id ad mattis arcu. Laoreet metus quam donec auctor diam at eget rhoncus. Vivamus"
37.61,555.26,557.17,564.11,"/F8",9.96,"velit erat. Euismod augue et sollicitudin consectetuer natoque. Commodo magna eros et nibh eros ac facilisi. Aliquam"
37.61,543.31,557.16,552.15,"/F8",9.96,"porta netus mauris at. Viverra ipsum nonummy blandit dignissim inceptos. Blandit augue et cursus cum odio ante nibh"
37.61,531.35,557.07,540.20,"/F8",9.96,"curabitur pellentesque est convallis dui netus dictum sociis magna facilisis dui sagittis hendrerit lacus. Aliquet justo sed"
37.61,519.40,557.17,528.24,"/F8",9.96,"rhoncus ac ad tellus pharetra euismod gravida consectetuer dignissim porta. Potenti risus leo orci aliquet ac egestas"
37.61,507.44,557.14,516.29,"/F8",9.96,"nisi ultrices est ante consectetuer adipiscing. Dapibus felis ac eu lectus suscipit. Rhoncus lorem in fames hymenaeos"
37.61,495.49,557.11,504.33,"/F8",9.96,"nonummy cursus dis eu libero dictumst. Iaculis purus nec parturient adipiscing ut mattis senectus fermentum. Gravida"
37.61,483.53,557.12,492.38,"/F8",9.96,"dolor curae. Iaculis donec risus odio mi imperdiet vestibulum odio tellus molestie natoque. Natoque lacus ut nec ultricies"
37.61,471.58,364.77,480.42,"/F8",9.96,"libero augue phasellus quam suspendisse rhoncus dis adipiscing ac suscipit."
37.61,437.36,125.28,446.21,"/F17",9.96,"1. Pretium lacus."
52.56,416.44,296.12,425.28,"/F8",9.96,"Gravida massa erat bibendum massa accumsan. Dapibus"
37.61,404.48,288.40,413.33,"/F8",9.96,"felis nisl viverra tristique aenean. Gravida vitae. Com-"
37.61,392.53,288.45,401.37,"/F8",9.96,"modo neque. Integer augue eni neque pede netus primis"
37.61,380.57,288.40,389.42,"/F8",9.96,"eu bibendum. Blandit velit proin quis dignissim sociosqu"
37.61,368.62,288.40,377.46,"/F8",9.96,"ve non odio. Sodales nulla nibh in est. Cubilia velit felis"
37.61,356.66,288.40,365.51,"/F8",9.96,"auctor litora penatibus massa venenatis eni. Cubilia velit"
37.61,344.71,288.41,353.55,"/F8",9.96,"adipiscing sagittis. Egestas velit mus proin felis a montes"
37.61,332.75,288.47,341.60,"/F8",9.96,"eget. Laoreet dolor. Laoreet magna donec pretium mollis"
37.61,320.80,288.45,329.64,"/F8",9.96,"eget augue inceptos felis. Conubia massa nisl nonummy mi"
37.61,308.84,288.39,317.69,"/F8",9.96,"facilisis ullamcorper hendrerit quis. Sodales purus ve ele-"
37.61,296.89,288.42,305.73,"/F8",9.96,"mentum egestas turpis imperdiet sed. Conubia risus dolor"
37.61,284.93,288.42,293.78,"/F8",9.96,"velit lectus. Quisque purus fusce tempor augue. Rhon-"
37.61,272.98,288.44,281.82,"/F8",9.96,"cus felis. Vivamus curae ve diam congue habitasse nulla."
37.61,261.02,288.40,269.87,"/F8",9.96,"Lacinia justo. Aliquet justo nibh id metus mollis fusce dis"
37.61,249.07,288.46,257.91,"/F8",9.96,"nisi dictum. Laoreet morbi sed pede a eget ad. Egestas"
37.61,237.11,216.72,245.96,"/F8",9.96,"metus lacus curae magna pede nam duis."
52.56,225.15,288.45,234.00,"/F8",9.96,"Sodales morbi nisl fermentum praesent nunc mattis"
37.61,213.20,288.44,222.05,"/F8",9.96,"sapien praesent id cras erat. Euismod fames adipiscing."
37.61,201.24,288.40,210.09,"/F8",9.96,"Dapibus etiam. Cubilia velit. Aliquam class ante velit ac"
37.61,189.29,288.44,198.14,"/F8",9.96,"nunc vitae laoreet integer. Laoreet curae sed donec. Cu-"
37.61,177.33,288.44,186.18,"/F8",9.96,"bilia risus id senectus eros posuere. Vivamus curae fames"
37.61,165.38,288.46,174.23,"/F8",9.96,"sem duis mi quam orci hac id cursus. Vivamus morbi arcu"
37.61,153.42,288.45,162.27,"/F8",9.96,"placerat condimentum sit. Vivamus justo urna leo eget"
37.61,141.47,288.42,150.32,"/F8",9.96,"sociosqu class lectus turpis odio aliquet et morbi ad. Cu-"
37.61,129.51,288.38,138.36,"/F8",9.96,"bilia netus. Aliquet curae per lacus quis primis ve pulvinar"
37.61,117.56,288.45,126.41,"/F8",9.96,"gravida lacus. Aliquam vitae quam egestas. Sodales fusce"
37.61,105.60,288.41,114.45,"/F8",9.96,"eros sociosqu sed elit tincidunt congue dictumst. Euismod"
37.61,93.65,288.43,102.49,"/F8",9.96,"augue odio hac eu. Viverra etiam felis suspendisse faucibus"
37.61,81.69,288.43,90.54,"/F8",9.96,"posuere sodales. Blandit neque. Cubilia lacus. Vivamus"
306.60,437.36,557.39,446.21,"/F8",9.96,"velit id tortor etiam id etiam. Cubilia purus erat gravida"
306.60,425.40,557.44,434.25,"/F8",9.96,"penatibus id massa vitae. Posuere massa. Rhoncus vitae"
306.60,413.45,413.40,422.30,"/F8",9.96,"elit vel ipsum vitae quis."
321.55,401.49,557.43,410.34,"/F8",9.96,"Conubia etiam vel enim platea ultricies velit a non-"
306.60,389.54,351.03,398.39,"/F8",9.96,"ummy ve."
361.00,389.54,557.43,398.39,"/F8",9.96,"Viverra magna elit dis velit elementum vel"
306.60,377.58,557.43,386.43,"/F8",9.96,"viverra nibh nam quis ad. Natoque porta ve imperdiet"
306.60,365.63,557.38,374.47,"/F8",9.96,"ipsum venenatis dui. Integer velit nisl nam fusce viverra."
306.60,353.67,557.42,362.52,"/F8",9.96,"Lacinia vitae lorem fames diam sem nisl felis class ultri-"
306.60,341.72,557.46,350.56,"/F8",9.96,"ces fermentum amet leo. Lacinia class. Iaculis magna."
306.60,329.76,557.42,338.61,"/F8",9.96,"Viverra justo. Blandit proin diam sed eros. Laoreet netus"
306.60,317.81,557.39,326.65,"/F8",9.96,"mi mollis. Blandit etiam adipiscing ve bibendum viverra."
306.60,305.85,564.59,314.70,"/F8",9.96,"Aliquam augue. Potenti metus eu litora sodales erat vestibu-"
306.60,293.90,557.44,302.74,"/F8",9.96,"lum tempor diam condimentum viverra. Vivamus curae."
306.60,281.94,557.41,290.79,"/F8",9.96,"Conubia neque etiam congue fringilla feugiat. Feugiat vi-"
306.60,269.99,557.42,278.83,"/F8",9.96,"tae urna ligula ut eget curae. Potenti etiam in. Sodales"
306.60,258.03,557.42,266.88,"/F8",9.96,"fusce adipiscing scelerisque montes. Potenti magna morbi"
306.60,246.08,557.40,254.92,"/F8",9.96,"nullam fermentum parturient leo massa porttitor. Posuere"
306.60,234.12,557.43,242.97,"/F8",9.96,"augue netus. Potenti morbi id at. Natoque purus curae"
306.60,222.17,375.79,231.01,"/F8",9.96,"fusce commodo."
306.60,198.26,567.36,207.10,"/F27",9.96,"1.1. Pretium nulla odio quis fringilla sociosqu dictum gravida"
327.99,186.30,348.08,195.15,"/F27",9.96,"quis."
321.55,171.36,557.43,180.20,"/F8",9.96,"Posuere proin. Lacinia lacus. Euismod porta. Aliquet"
306.60,159.40,557.40,168.25,"/F8",9.96,"neque erat lectus habitant. Rhoncus lacus proin a. Blandit"
306.60,147.45,557.43,156.29,"/F8",9.96,"lacus id semper fermentum adipiscing nec dolor rhoncus"
306.60,135.49,557.41,144.34,"/F8",9.96,"tincidunt interdum metus nostra sed natoque cras. Eges-"
306.60,123.54,557.39,132.38,"/F8",9.96,"tas risus nisi. Integer metus erat. Iaculis vitae pede id class"
306.60,111.58,557.43,120.43,"/F8",9.96,"et purus accumsan fames in morbi. Iaculis proin euismod."
306.60,99.63,557.41,108.47,"/F8",9.96,"Vivamus lorem. Dapibus porta etiam varius eros et sollici-"
306.60,87.67,557.41,96.52,"/F8",9.96,"tudin euismod. Quisque fames. Feugiat dolor felis magnis"
37.61,61.74,149.76,68.82,"/F20",7.97,"Preprint submitted to Elsevier"
490.43,61.74,557.59,68.82,"/F20",7.97,"November 8, 2015"
