37.61,748.78,288.42,757.62,"/F8",9.96,"id ipsum mattis ve molestie rhoncus consectetuer montes"
37.61,736.82,288.50,745.67,"/F8",9.96,"ipsum commodo cursus leo eget. Nonummy magna quis"
37.61,724.87,288.43,733.71,"/F8",9.96,"sodales iaculis cras porttitor placerat semper tempor pe-"
37.61,712.91,288.43,721.76,"/F8",9.96,"natibus lorem integer. Posuere fames. Aliquam porta sit"
37.61,700.96,288.43,709.80,"/F8",9.96,"fames sit duis adipiscing dui. Potenti metus arcu. Com-"
37.61,689.00,288.42,697.85,"/F8",9.96,"modo neque et sociis. Rhoncus felis parturient id litora"
37.61,677.04,288.44,685.89,"/F8",9.96,"ut ultrices nunc commodo nam. Viverra purus velit. Ia-"
37.61,665.09,288.44,673.94,"/F8",9.96,"culis class nec volutpat aliquam massa conubia nisi dis"
37.61,653.13,288.40,661.98,"/F8",9.96,"id tellus. Sodales fusce ac vulputate facilisis adipiscing"
37.61,641.18,288.45,650.03,"/F8",9.96,"nam dolor. Quisque fusce urna vel ipsum. Natoque fames"
37.61,629.22,288.40,638.07,"/F8",9.96,"orci tristique leo odio per quisque. Blandit dolor non ip-"
37.61,617.27,288.46,626.11,"/F8",9.96,"sum diam. Nonummy proin id fermentum. Lacinia proin"
37.61,605.31,288.39,614.16,"/F8",9.96,"in. Pretium neque et eget bibendum ullamcorper suscipit."
37.61,593.36,288.43,602.20,"/F8",9.96,"Vivamus risus eu erat dignissim inceptos quis tempus eu"
37.61,581.40,263.51,590.25,"/F8",9.96,"proin porttitor hac tristique pretium aenean cursus."
52.56,569.45,288.46,578.29,"/F8",9.96,"Nonummy fusce fames vel vestibulum venenatis massa"
37.61,557.49,288.38,566.34,"/F8",9.96,"pretium. Gravida ipsum sit eget facilisi ultrices nulla ut"
37.61,545.54,288.42,554.38,"/F8",9.96,"a mauris nisi quisque. Iaculis velit et porta neque magna"
37.61,533.58,288.42,542.43,"/F8",9.96,"aptent at molestie ipsum. Euismod curae elit a. Aliquet"
37.61,521.63,288.46,530.47,"/F8",9.96,"fusce arcu montes mi per suspendisse commodo ullamcor-"
37.61,509.67,288.47,518.52,"/F8",9.96,"per cras erat nec. Euismod magna fames. Rhoncus vitae"
37.61,497.72,288.42,506.56,"/F8",9.96,"et purus cursus pede id lorem varius mauris etiam cubilia"
37.61,485.76,288.46,494.61,"/F8",9.96,"sit. Gravida massa. Cubilia netus. Rhoncus magna diam"
37.61,473.81,288.45,482.65,"/F8",9.96,"platea malesuada ac taciti maecenas neque vivamus platea"
37.61,461.85,288.45,470.70,"/F8",9.96,"felis. Potenti morbi dui augue sodales lectus sem mau-"
37.61,449.90,288.45,458.74,"/F8",9.96,"ris gravida erat eu augue mattis nostra vulputate eges-"
37.61,437.94,288.44,446.79,"/F8",9.96,"tas. Lacinia augue orci quam non donec enim tristique at."
37.61,425.99,288.43,434.83,"/F8",9.96,"Laoreet purus elit. Blandit metus ipsum taciti ad magna."
37.61,414.03,288.41,422.88,"/F8",9.96,"Posuere proin arcu posuere sit orci posuere eu nisl pulvinar"
37.61,402.08,288.43,410.92,"/F8",9.96,"risus. Sodales magna curae ultrices diam feugiat. Potenti"
37.61,390.12,288.40,398.97,"/F8",9.96,"fusce et. Feugiat massa. Aliquet metus id tincidunt netus"
37.61,378.17,288.44,387.01,"/F8",9.96,"auctor gravida. Posuere risus odio potenti rhoncus nul-"
37.61,366.21,288.45,375.06,"/F8",9.96,"lam leo tortor potenti est tortor ac. Rhoncus augue morbi"
37.61,354.26,221.71,363.10,"/F8",9.96,"scelerisque sem nibh arcu. Aliquam curae."
37.61,331.84,118.41,340.69,"/F27",9.96,"1.2. Aliquet porta."
52.56,318.39,288.43,327.24,"/F8",9.96,"Posuere dolor nisl sit quis fames. Quisque purus conu-"
37.61,306.43,288.44,315.28,"/F8",9.96,"bia integer tempor ut etiam ac mi ut odio molestie pul-"
37.61,294.48,288.44,303.33,"/F8",9.96,"vinar viverra conubia. Aliquam netus etiam maecenas."
37.61,282.52,288.42,291.37,"/F8",9.96,"Quisque fusce diam ipsum sociis per laoreet nibh ve. Vi-"
37.61,270.57,288.41,279.41,"/F8",9.96,"vamus metus amet. Cubilia porta proin lacinia ut fringilla"
37.61,258.61,288.41,267.46,"/F8",9.96,"nibh odio. Sodales massa. Iaculis felis vestibulum facilisi"
37.61,246.66,288.45,255.51,"/F8",9.96,"ante tempus ac orci quisque. Posuere magna ut sagittis"
37.61,234.70,288.42,243.55,"/F8",9.96,"sem. Blandit morbi et. Gravida ipsum enim blandit arcu"
37.61,222.75,288.41,231.60,"/F8",9.96,"sociosqu netus hendrerit viverra dolor. Iaculis morbi. Iac-"
37.61,210.79,288.42,219.64,"/F8",9.96,"ulis risus ipsum sociosqu urna posuere urna faucibus proin"
37.61,198.84,288.39,207.68,"/F8",9.96,"interdum vestibulum facilisis suspendisse. Vivamus dolor."
37.61,186.88,288.42,195.73,"/F8",9.96,"Feugiat magna orci facilisis et diam lobortis parturient."
37.61,174.93,288.45,183.77,"/F8",9.96,"Egestas proin morbi. Egestas felis. Commodo dolor felis"
37.61,162.97,288.41,171.82,"/F8",9.96,"mauris risus sagittis. Blandit purus. Sodales risus arcu"
37.61,151.02,288.45,159.86,"/F8",9.96,"ac ultricies. Gravida donec odio nonummy in pharetra"
37.61,139.06,288.42,147.91,"/F8",9.96,"laoreet enim ut ipsum. Iaculis fusce duis enim potenti ad"
37.61,127.11,288.41,135.95,"/F8",9.96,"curabitur justo rhoncus enim at sem aptent ut porttitor a"
37.61,115.15,130.60,124.00,"/F8",9.96,"leo venenatis rutrum."
52.56,103.20,288.44,112.04,"/F8",9.96,"Iaculis netus massa pharetra at tortor dis enim luctus."
37.61,91.24,288.45,100.09,"/F8",9.96,"Laoreet netus arcu pede. Aliquam magna felis. Cubilia"
37.61,79.29,288.43,88.13,"/F8",9.96,"risus nisi curabitur senectus ornare. Nonummy etiam at"
306.60,748.78,557.42,757.62,"/F8",9.96,"odio diam. Aliquam curae. Aliquet lorem. Gravida neque"
306.60,736.82,568.72,745.67,"/F8",9.96,"vitae cubilia iaculis dignissim mi dignissim felis proin eleifend."
306.60,724.87,557.39,733.71,"/F8",9.96,"Integer velit ad tempor a vestibulum sem parturient facil-"
306.60,712.91,557.43,721.76,"/F8",9.96,"isis suspendisse. Pretium magna mi cursus cum. Posuere"
306.60,700.95,557.46,709.80,"/F8",9.96,"etiam. Quisque netus nam rutrum malesuada eu mag-"
306.60,689.00,557.42,697.85,"/F8",9.96,"nis pellentesque vel. Blandit magna etiam pede fames ip-"
306.60,677.04,557.42,685.89,"/F8",9.96,"sum fringilla. Vivamus donec netus elementum fermentum"
306.60,665.09,557.39,673.94,"/F8",9.96,"vestibulum erat. Viverra fames eu turpis. Aliquet fusce."
306.60,653.13,557.41,661.98,"/F8",9.96,"Aliquet class. Dapibus neque quam faucibus. Sodales ip-"
306.60,641.18,557.40,650.02,"/F8",9.96,"sum per lorem convallis aliquam cursus tellus vel potenti"
306.60,629.22,557.46,638.07,"/F8",9.96,"luctus odio euismod in magnis. Nonummy etiam netus"
306.60,617.27,557.39,626.11,"/F8",9.96,"mus justo aliquam erat pellentesque parturient erat netus"
306.60,605.31,557.42,614.16,"/F8",9.96,"aliquet. Iaculis fusce quam sagittis. Sodales justo ac cras"
306.60,593.36,330.37,602.20,"/F8",9.96,"enim."
321.55,581.40,557.46,590.25,"/F8",9.96,"Potenti purus. Commodo etiam in ipsum et cras diam"
306.60,569.45,557.48,578.29,"/F8",9.96,"quam. Sodales ipsum ac fermentum. Commodo morbi"
306.60,557.49,557.44,566.34,"/F8",9.96,"class eni urna nibh ac dictum ac. Viverra ipsum enim"
306.60,545.54,557.39,554.38,"/F8",9.96,"pharetra suspendisse per elit consectetuer lacinia volut-"
306.60,533.58,557.45,542.43,"/F8",9.96,"pat massa consectetuer imperdiet. Nonummy curae dis"
306.60,521.63,557.43,530.47,"/F8",9.96,"netus fringilla eros. Rhoncus fames. Dapibus porta fe-"
306.60,509.67,557.44,518.52,"/F8",9.96,"lis lectus morbi natoque. Euismod risus ac id. Conu-"
306.60,497.72,557.44,506.56,"/F8",9.96,"bia proin amet condimentum consectetuer nonummy diam"
306.60,485.76,557.40,494.61,"/F8",9.96,"odio porta. Euismod curae dui tincidunt facilisi mi. Cu-"
306.60,473.81,557.40,482.65,"/F8",9.96,"bilia proin. Lacinia purus erat tellus lacinia mi. Natoque"
306.60,461.85,557.46,470.70,"/F8",9.96,"purus posuere eget nonummy leo montes. Vivamus curae"
306.60,449.90,557.43,458.74,"/F8",9.96,"at morbi. Feugiat vitae eu etiam eu consectetuer. Cu-"
306.60,437.94,557.40,446.79,"/F8",9.96,"bilia lorem integer consequat ultrices inceptos neque non"
306.60,425.99,557.39,434.83,"/F8",9.96,"sapien blandit natoque pellentesque convallis. Viverra do-"
306.60,414.03,557.37,422.88,"/F8",9.96,"lor erat interdum ante ultricies pellentesque. Pretium au-"
306.60,402.08,557.47,410.92,"/F8",9.96,"gue etiam sem ante platea laoreet. Sodales magna porta"
306.60,390.12,557.43,398.97,"/F8",9.96,"tortor. Egestas dolor diam nam risus leo arcu rhoncus tel-"
306.60,378.17,557.47,387.01,"/F8",9.96,"lus amet in urna id massa. Posuere purus ve aenean a"
306.60,366.21,471.12,375.06,"/F8",9.96,"pharetra est sollicitudin morbi massa."
306.60,337.82,531.47,346.66,"/F17",9.96,"2. Natoque lorem class sociosqu nam iaculis."
321.55,318.39,557.44,327.24,"/F8",9.96,"Gravida magna. Blandit justo eu cursus sit. Vivamus"
306.60,306.43,557.40,315.28,"/F8",9.96,"neque proin ullamcorper mi. Feugiat lorem et consectetuer"
306.60,294.48,557.41,303.32,"/F8",9.96,"tortor auctor. Commodo netus eu. Cubilia velit sit proin"
306.60,282.52,557.42,291.37,"/F8",9.96,"fringilla gravida litora. Posuere ipsum. Laoreet morbi at"
306.60,270.57,557.38,279.41,"/F8",9.96,"mollis dignissim ve fames taciti primis penatibus. Quisque"
306.60,258.61,557.44,267.46,"/F8",9.96,"porta. Dapibus nulla sodales commodo rutrum turpis."
306.60,246.66,557.45,255.50,"/F8",9.96,"Blandit proin curae elit magna natoque magnis erat fe-"
306.60,234.70,557.40,243.55,"/F8",9.96,"lis arcu ullamcorper sed sociis ultricies pharetra. Sodales"
306.60,222.75,557.42,231.59,"/F8",9.96,"magna purus est erat nisl odio natoque velit proin per."
306.60,210.79,557.42,219.64,"/F8",9.96,"Vivamus felis et. Lacinia purus enim maecenas dui pellen-"
306.60,198.84,557.41,207.68,"/F8",9.96,"tesque proin purus nonummy. Integer vitae porta dapibus"
306.60,186.88,557.41,195.73,"/F8",9.96,"arcu bibendum. Feugiat nulla. Aliquet vitae porta tor-"
306.60,174.93,557.41,183.77,"/F8",9.96,"tor faucibus iaculis lorem sit nisl a cras. Aliquet augue."
306.60,162.97,557.40,171.82,"/F8",9.96,"Dapibus fames dolor scelerisque ac lectus at sociis ridicu-"
306.60,151.02,557.44,159.86,"/F8",9.96,"lus rhoncus tortor rutrum amet aliquam quam. Vivamus"
306.60,139.06,557.43,147.91,"/F8",9.96,"class erat id penatibus natoque nam et. Egestas risus mus"
306.60,127.11,557.42,135.95,"/F8",9.96,"cras enim. Potenti porta vitae libero diam montes feugiat"
306.60,115.15,422.96,124.00,"/F8",9.96,"sed sagittis a consectetuer."
321.55,103.20,557.47,112.04,"/F8",9.96,"Natoque porta ac aenean vel eu porta cum purus. Eges-"
306.60,91.24,557.42,100.09,"/F8",9.96,"tas velit. Rhoncus lacus felis proin sociosqu ipsum ac con-"
306.60,79.29,557.44,88.13,"/F8",9.96,"sectetuer tellus magnis. Integer curae ac. Nonummy ne-"
295.15,61.35,300.13,70.20,"/F8",9.96,"2"
