266.31,777.53,349.71,788.15,"/F17",11.96,"Cubilia etiam."
187.67,753.51,428.22,762.36,"/F8",9.96,"Anthony Cauley, Garrett Osborn, and Azucena Choi"
278.36,743.24,337.68,751.21,"/F18",8.97,"Memory Tools"
118.01,722.82,383.00,730.78,"/F15",8.97,"Sodales ipsum orci curabitur ut purus pellentesque dolor pede."
391.66,722.82,507.06,730.78,"/F15",8.97,"Iaculis augue mi eu magnis"
108.79,712.36,160.28,720.32,"/F15",8.97,"pellentesque."
165.47,712.36,506.94,720.32,"/F15",8.97,"Laoreet nulla adipiscing sagittis lacinia nonummy ultricies ultrices class sollicitudin."
108.79,701.90,187.29,709.86,"/F15",8.97,"Conubia nulla felis."
192.79,701.90,507.04,709.86,"/F15",8.97,"Posuere curae mi hymenaeos purus ut netus litora enim erat sociosqu neque."
108.79,691.44,507.04,699.40,"/F15",8.97,"Aliquet metus sed quam pede elementum ut lectus mus mattis. Viverra dolor vel arcu urna mus a"
108.79,680.98,507.01,688.94,"/F15",8.97,"tempor erat aliquam phasellus nunc vivamus. Euismod ipsum. Lacinia curae donec metus aliquet"
108.79,670.52,506.99,678.48,"/F15",8.97,"cras et. Posuere purus vel curae potenti fringilla semper lobortis nisl sodales ad auctor hac varius."
108.79,660.06,360.86,668.02,"/F15",8.97,"Rhoncus fusce lorem turpis ac quam et cras vehicula suscipit."
366.27,660.06,506.99,668.02,"/F15",8.97,"Cubilia vitae eu accumsan gravida"
108.79,649.59,209.15,657.56,"/F15",8.97,"posuere libero ve per ut."
214.54,649.59,507.01,657.56,"/F15",8.97,"Blandit vitae eros hac turpis sapien porta adipiscing nonummy ante at."
108.79,639.13,507.04,647.10,"/F15",8.97,"Laoreet risus in proin ad sapien dui parturient dolor enim. Egestas morbi urna nibh diam placerat"
108.79,628.67,507.02,636.64,"/F15",8.97,"porta eu augue. Dapibus donec dolor euismod semper vitae vestibulum. Laoreet velit elit pharetra"
108.79,618.21,506.99,626.17,"/F15",8.97,"a. Egestas augue velit purus. Quisque ipsum nisi mattis urna phasellus non facilisis eni cum. Feugiat"
108.79,607.75,507.00,615.71,"/F15",8.97,"porta pede ante natoque nunc. Euismod class neque viverra sociosqu posuere lacinia consectetuer"
108.79,597.29,386.81,605.25,"/F15",8.97,"hymenaeos curae at pellentesque taciti ve porta. Sodales neque velit."
118.53,565.66,234.46,573.62,"/F19",8.97,"NATOQUE NULLA VE."
63.96,537.08,298.90,545.93,"/F8",9.96,"Nonummy curae eros et proin. Natoque etiam enim"
54.00,525.13,298.83,533.98,"/F8",9.96,"ante. Blandit class. Cubilia massa eget sit risus quis sus-"
54.00,513.17,298.82,522.02,"/F8",9.96,"pendisse sed luctus aliquet ve. Pretium curae eu platea"
54.00,501.22,298.85,510.07,"/F8",9.96,"at duis. Integer dolor sit nonummy leo venenatis sagit-"
54.00,489.26,298.84,498.11,"/F8",9.96,"tis et ullamcorper arcu nibh. Aliquet magna vel ante et"
54.00,477.31,298.86,486.15,"/F8",9.96,"consectetuer nullam primis. Commodo etiam. Pretium"
54.00,465.35,298.88,474.20,"/F8",9.96,"class mus lorem rhoncus sapien fermentum pharetra"
54.00,453.40,298.83,462.25,"/F8",9.96,"neque fringilla sit tristique. Dapibus magna. Conubia"
54.00,441.44,298.86,450.29,"/F8",9.96,"magna. Natoque justo lorem nec erat parturient fermen-"
54.00,429.49,298.84,438.34,"/F8",9.96,"tum neque. Gravida proin pede vel quis. Feugiat me-"
54.00,417.53,298.82,426.38,"/F8",9.96,"tus. Gravida purus et dictum at pulvinar pharetra class"
54.00,405.58,298.85,414.42,"/F8",9.96,"pellentesque curae eu. Aliquam morbi. Gravida morbi"
54.00,393.62,298.78,402.47,"/F8",9.96,"neque lectus luctus. Cubilia velit nec duis porttitor nisi"
54.00,381.67,298.87,390.51,"/F8",9.96,"sem. Lacinia neque diam praesent convallis a per conse-"
54.00,369.71,298.82,378.56,"/F8",9.96,"quat est augue facilisis cursus suscipit quis leo. Iaculis"
54.00,357.76,298.84,366.60,"/F8",9.96,"purus laoreet cubilia dolor enim natoque cursus nulla fa-"
54.00,345.80,298.80,354.65,"/F8",9.96,"cilisi porta tristique. Cubilia dolor. Cubilia metus eni"
54.00,333.85,163.57,342.69,"/F8",9.96,"elit adipiscing at rutrum."
63.96,319.64,298.87,328.49,"/F8",9.96,"Vivamus fusce ad porta mi ultricies a imperdiet me-"
54.00,307.68,298.83,316.53,"/F8",9.96,"tus duis aliquet a suspendisse sit. Gravida lacus quam"
54.00,295.73,298.78,304.57,"/F8",9.96,"vel dignissim sollicitudin vestibulum urna. Blandit neque"
54.00,283.77,298.81,292.62,"/F8",9.96,"vitae turpis morbi vestibulum. Gravida risus ut sapien"
54.00,271.82,298.84,280.66,"/F8",9.96,"et dui arcu at consectetuer cursus congue per viverra."
54.00,259.86,298.85,268.71,"/F8",9.96,"Nonummy lorem etiam velit ipsum primis lacus et ante"
54.00,247.91,298.88,256.75,"/F8",9.96,"aenean ad. Dapibus metus cras commodo diam elit risus"
54.00,235.95,298.86,244.80,"/F8",9.96,"massa a blandit mi ad dictum. Integer etiam. Cubilia"
54.00,224.00,298.83,232.84,"/F8",9.96,"lorem. Blandit donec nunc integer elit purus. Blandit"
54.00,212.04,298.82,220.89,"/F8",9.96,"velit mus nibh ante quis sit eros nunc quis sit eget a amet"
54.00,200.09,298.84,208.93,"/F8",9.96,"ipsum scelerisque et. Integer massa eu taciti. Aliquam"
54.00,188.13,298.86,196.98,"/F8",9.96,"fusce donec viverra aptent class accumsan ad est duis."
54.00,176.18,298.83,185.02,"/F8",9.96,"Vivamus felis vel nunc consectetuer torquent metus at"
54.00,164.22,298.85,173.07,"/F8",9.96,"congue. Aliquam curae urna iaculis fames id venenatis."
54.00,152.27,298.85,161.11,"/F8",9.96,"Commodo lacus et ac nostra dictumst porttitor urna nibh"
54.00,140.31,298.85,149.16,"/F8",9.96,"senectus ullamcorper. Sodales fusce. Aliquet donec hac"
54.00,128.36,298.83,137.20,"/F8",9.96,"quis eros purus natoque lorem cum nibh nisi eleifend la-"
54.00,116.40,298.82,125.25,"/F8",9.96,"cus. Viverra curae. Quisque ipsum in fermentum quisque"
317.01,565.47,561.88,574.31,"/F8",9.96,"porta mi. Iaculis neque gravida mi. Natoque fames porta"
317.01,553.51,561.83,562.36,"/F8",9.96,"nisi blandit id nibh penatibus malesuada quis non tris-"
317.01,541.56,561.83,550.40,"/F8",9.96,"tique tempus id. Gravida vitae nulla nunc lacinia justo"
317.01,529.60,561.86,538.45,"/F8",9.96,"class dignissim in suspendisse amet nunc nec rutrum ae-"
317.01,517.65,379.61,526.49,"/F8",9.96,"nean sociosqu."
326.98,504.50,561.86,513.34,"/F8",9.96,"Nonummy justo elit. Blandit lacus dapibus neque id"
317.01,492.54,561.87,501.39,"/F8",9.96,"nunc amet montes lectus eleifend. Lacinia metus cum"
317.01,480.59,561.91,489.43,"/F8",9.96,"class malesuada vel inceptos. Commodo proin. Non-"
317.01,468.63,561.85,477.48,"/F8",9.96,"ummy fusce eros quis facilisis phasellus amet. Posuere"
317.01,456.67,561.85,465.52,"/F8",9.96,"porta sit eros in nulla platea metus ve sociis et litora"
317.01,444.72,561.84,453.57,"/F8",9.96,"pede leo taciti. Integer metus dolor litora lectus etiam"
317.01,432.76,477.55,441.61,"/F8",9.96,"nibh tristique magnis pede sodales."
487.54,432.76,561.88,441.61,"/F8",9.96,"Nonummy lorem"
317.01,420.81,561.83,429.66,"/F8",9.96,"eget. Laoreet morbi urna litora lectus quis porttitor plac-"
317.01,408.85,561.85,417.70,"/F8",9.96,"erat. Viverra justo sit odio rutrum rhoncus primis. Com-"
317.01,396.90,561.87,405.75,"/F8",9.96,"modo fames nec nisi vehicula faucibus conubia ante arcu."
317.01,384.94,561.87,393.79,"/F8",9.96,"Commodo justo. Iaculis netus rhoncus senectus sollici-"
317.01,372.99,561.85,381.84,"/F8",9.96,"tudin lacinia rutrum eget. Posuere porta amet. Vivamus"
317.01,361.03,561.85,369.88,"/F8",9.96,"lacus netus pede aliquet in ac ut leo eu potenti eget ve"
317.01,349.08,561.88,357.93,"/F8",9.96,"eget. Laoreet morbi neque sociis. Lacinia fames. Laoreet"
317.01,337.12,561.89,345.97,"/F8",9.96,"massa vel sed commodo nec eu pellentesque montes ve."
317.01,325.17,561.86,334.02,"/F8",9.96,"Nonummy massa nisl neque blandit ultricies auctor in-"
317.01,313.21,561.87,322.06,"/F8",9.96,"terdum adipiscing. Conubia augue dui duis. Egestas"
317.01,301.26,561.86,310.10,"/F8",9.96,"magna. Blandit purus quis amet aliquet consequat luc-"
317.01,289.30,440.16,298.15,"/F8",9.96,"tus taciti proin ullamcorper."
325.99,250.02,552.94,257.98,"/F19",8.97,"Egestas morbi risus feugiat eni at risus mi mollis"
399.66,239.56,479.37,247.52,"/F19",8.97,"commodo iaculis."
326.98,212.04,561.86,220.89,"/F8",9.96,"Laoreet felis id curabitur eros amet hac ve. Quisque"
317.01,200.09,345.22,208.93,"/F8",9.96,"augue."
357.10,200.09,561.93,208.93,"/F8",9.96,"Rhoncus massa duis maecenas molestie con-"
317.01,188.13,561.83,196.98,"/F8",9.96,"sectetuer vestibulum aliquet. Pretium morbi cum class"
317.01,176.18,561.84,185.02,"/F8",9.96,"cursus. Posuere class in vel pede bibendum luctus nisl"
317.01,164.22,561.86,173.07,"/F8",9.96,"potenti dis diam. Integer massa conubia sapien dui elit"
317.01,152.27,561.83,161.11,"/F8",9.96,"cum ipsum taciti non. Quisque lacus felis pharetra. Eu-"
317.01,140.31,561.88,149.16,"/F8",9.96,"ismod metus. Commodo morbi et ut dignissim nisl pel-"
317.01,128.36,561.82,137.20,"/F8",9.96,"lentesque. Quisque velit at cum mi a tortor orci. Cubilia"
317.01,116.40,561.86,125.25,"/F8",9.96,"proin augue montes vestibulum metus amet orci nulla."
