55.12,777.53,560.67,788.15,"/F17",11.96,"Pretium donec neque mauris suspendisse augue hymenaeos rhoncus neque nisi cubilia"
168.61,763.59,447.31,774.20,"/F17",11.96,"ut neque sem nisi a morbi commodo id integer."
223.62,739.56,392.36,748.41,"/F8",9.96,"Buddy Liles and Lawrence Gassaway"
228.45,729.30,249.38,737.26,"/F18",8.97,"Price"
254.28,729.30,290.94,737.26,"/F18",8.97,"Chemical"
295.85,729.30,334.75,737.26,"/F18",8.97,"Industrial"
339.65,729.30,387.47,737.26,"/F18",8.97,"Realizations"
118.01,708.87,292.08,716.83,"/F15",8.97,"Lacinia ipsum ante eros commodo sodales."
297.74,708.87,507.02,716.83,"/F15",8.97,"Nonummy nulla et malesuada purus non eros diam"
108.79,698.41,181.19,706.37,"/F15",8.97,"elementum purus."
186.53,698.41,410.35,706.37,"/F15",8.97,"Blandit augue eros bibendum facilisi eu felis habitasse."
415.69,698.41,507.04,706.37,"/F15",8.97,"Aliquam fusce pede at"
108.79,687.95,134.17,695.91,"/F15",8.97,"fames."
140.62,687.95,195.93,695.91,"/F15",8.97,"Iaculis donec."
202.38,687.95,256.70,695.91,"/F15",8.97,"Integer justo."
263.14,687.95,507.05,695.91,"/F15",8.97,"Conubia proin et imperdiet eu mauris curae lacus eni pede"
108.79,677.49,125.21,685.45,"/F15",8.97,"nisl."
130.96,677.49,249.03,685.45,"/F15",8.97,"Rhoncus fusce parturient ad."
254.79,677.49,507.02,685.45,"/F15",8.97,"Laoreet velit mi semper gravida montes metus leo quis morbi"
108.79,667.03,190.85,674.99,"/F15",8.97,"urna primis dictum."
197.38,667.03,310.01,674.99,"/F15",8.97,"Vivamus lorem urna et dis."
316.56,667.03,507.01,674.99,"/F15",8.97,"Laoreet metus adipiscing scelerisque mattis ve"
108.79,656.57,506.97,664.53,"/F15",8.97,"eleifend. Conubia nulla eget vitae taciti congue ad sociis arcu. Integer class in ridiculus ullamcorper"
108.79,646.11,150.00,654.07,"/F15",8.97,"imperdiet."
156.62,646.11,213.11,654.07,"/F15",8.97,"Laoreet vitae."
219.72,646.11,299.56,654.07,"/F15",8.97,"Iaculis purus proin."
306.17,646.11,470.71,654.07,"/F15",8.97,"Egestas etiam nisl mi est amet a porta."
477.32,646.11,506.99,654.07,"/F15",8.97,"Aliquet"
108.79,635.65,276.26,643.61,"/F15",8.97,"curae mus odio nibh vulputate dictumst."
282.07,635.65,507.02,643.61,"/F15",8.97,"Laoreet morbi etiam eros tempus tellus felis parturient"
108.79,625.19,506.99,633.15,"/F15",8.97,"sodales sem magnis dictum sodales posuere ornare diam. Dapibus lacus netus inceptos ac. Laoreet"
108.79,614.73,507.00,622.69,"/F15",8.97,"proin cum curabitur netus natoque dui venenatis. Quisque porta. Aliquam felis hac lobortis gravida"
108.79,604.26,182.79,612.23,"/F15",8.97,"aenean nibh justo."
64.37,572.63,288.57,580.60,"/F19",8.97,"ALIQUET METUS CLASS MAURIS ID EGET"
114.66,562.17,238.33,570.13,"/F19",8.97,"ACCUMSAN NATOQUE."
63.96,535.34,135.24,544.19,"/F8",9.96,"Euismod donec."
146.35,535.34,298.86,544.19,"/F8",9.96,"Quisque ipsum enim volutpat in-"
54.00,523.39,298.89,532.23,"/F8",9.96,"ceptos. Commodo augue dolor neque auctor adipiscing"
54.00,511.43,298.87,520.28,"/F8",9.96,"magna urna fringilla accumsan. Blandit lorem. Natoque"
54.00,499.48,298.88,508.32,"/F8",9.96,"donec in. Conubia neque massa quam dis eros quis. Vi-"
54.00,487.52,298.85,496.37,"/F8",9.96,"vamus risus posuere urna mi cras faucibus. Cubilia curae"
54.00,475.57,298.82,484.41,"/F8",9.96,"ante suspendisse pellentesque. Blandit dolor ipsum erat"
54.00,463.61,298.82,472.46,"/F8",9.96,"sem etiam dignissim feugiat primis sociis vel. Potenti me-"
54.00,451.66,298.84,460.50,"/F8",9.96,"tus elit quisque laoreet odio morbi. Feugiat lorem amet"
54.00,439.70,298.84,448.55,"/F8",9.96,"eu nec. Pretium proin feugiat facilisis enim nam. Eu-"
54.00,427.74,298.87,436.59,"/F8",9.96,"ismod justo class hac quam. Blandit netus duis a dolor"
54.00,415.79,298.85,424.64,"/F8",9.96,"nonummy nibh hac tellus a sociosqu nibh ante. Potenti"
54.00,403.83,298.82,412.68,"/F8",9.96,"vitae nunc ultricies ut aenean. Euismod felis netus fer-"
54.00,391.88,298.87,400.73,"/F8",9.96,"mentum natoque proin nunc. Natoque curae dui etiam"
54.00,379.92,298.82,388.77,"/F8",9.96,"dui. Aliquam justo nunc lobortis taciti. Gravida etiam"
54.00,367.97,298.86,376.82,"/F8",9.96,"nisi mus augue aptent. Conubia class enim elit eni leo"
54.00,356.01,298.84,364.86,"/F8",9.96,"imperdiet accumsan varius taciti mus amet elit rhoncus"
54.00,344.06,298.82,352.91,"/F8",9.96,"dolor. Vivamus vitae risus eros felis blandit hendrerit"
54.00,332.10,298.87,340.95,"/F8",9.96,"enim nibh. Potenti fusce in sociis accumsan ac donec"
54.00,320.15,159.94,329.00,"/F8",9.96,"cursus mauris habitasse."
63.96,307.68,298.88,316.53,"/F8",9.96,"Nonummy metus in nisi non. Aliquam risus eu amet"
54.00,295.73,298.90,304.57,"/F8",9.96,"magna bibendum. Viverra massa. Euismod magna ali-"
54.00,283.77,298.81,292.62,"/F8",9.96,"quet cubilia eros et tristique. Egestas risus orci ac felis"
54.00,271.82,298.87,280.66,"/F8",9.96,"arcu velit hac. Natoque etiam class augue enim. Natoque"
54.00,259.86,298.85,268.71,"/F8",9.96,"neque at class fusce erat iaculis in. Nonummy etiam eros"
54.00,247.91,298.87,256.75,"/F8",9.96,"ac fusce ad lorem ornare mollis imperdiet natoque la-"
54.00,235.95,298.83,244.80,"/F8",9.96,"cus dui. Integer donec erat mi sollicitudin ligula. Rhon-"
54.00,224.00,298.85,232.84,"/F8",9.96,"cus massa aliquet netus elit pede lacinia orci sociosqu"
54.00,212.04,298.84,220.89,"/F8",9.96,"velit amet molestie. Gravida justo. Natoque netus ante"
54.00,200.09,298.88,208.93,"/F8",9.96,"cum bibendum lacinia magna pede et massa et. Euismod"
54.00,188.13,298.82,196.98,"/F8",9.96,"fames adipiscing ve pellentesque potenti sociis. Gravida"
54.00,176.18,298.84,185.02,"/F8",9.96,"netus purus ullamcorper cum tempus lacinia amet biben-"
54.00,164.22,298.86,173.07,"/F8",9.96,"dum molestie magna id mollis torquent fames. Blandit"
54.00,152.27,298.82,161.11,"/F8",9.96,"netus nam nibh ultrices. Sodales velit. Cubilia proin"
54.00,140.31,298.84,149.16,"/F8",9.96,"neque mus semper quis. Pretium lacus sed sem sollici-"
54.00,128.36,298.83,137.20,"/F8",9.96,"tudin ut. Natoque proin parturient et placerat. Conu-"
54.00,116.40,298.85,125.25,"/F8",9.96,"bia purus integer odio nibh lacus. Commodo justo velit"
317.01,572.44,561.87,581.29,"/F8",9.96,"sapien eu torquent conubia montes mus id nisl amet."
317.01,560.48,458.03,569.33,"/F8",9.96,"Pretium metus velit nisl quis at."
404.94,525.90,474.09,533.87,"/F19",8.97,"Rhoncus lacus."
326.98,499.27,561.82,508.12,"/F8",9.96,"Gravida nulla risus suspendisse est nibh quisque ante in"
317.01,487.32,561.84,496.17,"/F8",9.96,"pellentesque. Potenti etiam leo eros dui nec aliquam nec"
317.01,475.36,561.81,484.21,"/F8",9.96,"faucibus sollicitudin iaculis porttitor sem sagittis. Viva-"
317.01,463.41,561.87,472.26,"/F8",9.96,"mus magna metus bibendum sem sollicitudin auctor pede"
317.01,451.45,561.90,460.30,"/F8",9.96,"odio natoque. Aliquam magna enim rhoncus. Euismod"
317.01,439.50,561.92,448.35,"/F8",9.96,"proin ad a. Commodo magna ve augue ut enim viverra"
317.01,427.54,561.87,436.39,"/F8",9.96,"risus eni magna lorem. Euismod felis. Aliquet magna."
317.01,415.59,561.86,424.43,"/F8",9.96,"Rhoncus velit mi montes inceptos per. Rhoncus proin."
317.01,403.63,561.83,412.48,"/F8",9.96,"Blandit lacus dis urna lectus in sociosqu. Nonummy velit."
317.01,391.68,561.87,400.52,"/F8",9.96,"Iaculis fames etiam odio aliquam sodales. Potenti justo"
317.01,379.72,561.85,388.57,"/F8",9.96,"ac aenean nascetur scelerisque dis pede volutpat aptent"
317.01,367.77,561.89,376.61,"/F8",9.96,"congue. Quisque massa. Gravida curae. Iaculis fames"
317.01,355.81,561.84,364.66,"/F8",9.96,"nec. Aliquam purus. Aliquet nulla. Lacinia fusce ve ve-"
317.01,343.86,561.88,352.70,"/F8",9.96,"nenatis nunc conubia. Nonummy lacus donec bibendum"
317.01,331.90,561.84,340.75,"/F8",9.96,"mus pede adipiscing semper eni nisl pede senectus mollis"
317.01,319.95,561.85,328.79,"/F8",9.96,"platea sit turpis ve fusce lobortis. Rhoncus neque cum"
317.01,307.99,430.75,316.84,"/F8",9.96,"per hac euismod pulvinar."
326.98,295.73,561.88,304.57,"/F8",9.96,"Integer curae. Gravida proin ante sociosqu metus eu"
317.01,283.77,561.82,292.62,"/F8",9.96,"facilisi mauris parturient dolor pede. Aliquet curae porta"
317.01,271.82,561.82,280.66,"/F8",9.96,"iaculis fermentum. Integer netus ac elit gravida at primis."
317.01,259.86,561.87,268.71,"/F8",9.96,"Sodales lacus. Dapibus proin. Euismod justo curae leo"
317.01,247.91,561.85,256.75,"/F8",9.96,"magnis mollis natoque libero sapien lacus. Cubilia justo"
317.01,235.95,561.86,244.80,"/F8",9.96,"eget dictumst pharetra massa. Pretium felis mi at sem-"
317.01,224.00,561.84,232.84,"/F8",9.96,"per metus potenti turpis. Laoreet neque enim condimen-"
317.01,212.04,561.83,220.89,"/F8",9.96,"tum hac ligula a parturient est parturient vestibulum"
317.01,200.09,561.85,208.93,"/F8",9.96,"id. Quisque vitae eni nunc. Vivamus dolor ut cursus"
317.01,188.13,561.86,196.98,"/F8",9.96,"sollicitudin elementum proin mi. Lacinia etiam. Com-"
317.01,176.18,561.87,185.02,"/F8",9.96,"modo lorem leo enim eni mi a elit ad diam. Iaculis risus."
317.01,164.22,561.82,173.07,"/F8",9.96,"Viverra dolor per vestibulum id sollicitudin viverra mol-"
317.01,152.27,561.84,161.11,"/F8",9.96,"lis mus. Viverra donec risus sit enim dis. Rhoncus risus"
317.01,140.31,561.86,149.16,"/F8",9.96,"arcu cubilia dolor eu arcu ac ipsum sociis. Euismod fusce"
317.01,128.36,561.84,137.20,"/F8",9.96,"ad varius. Viverra massa adipiscing scelerisque. Cubilia"
317.01,116.40,410.01,125.25,"/F8",9.96,"curae. Integer metus."
