80.89,777.53,534.90,788.15,"/F17",11.96,"Feugiat risus purus taciti amet iaculis rhoncus convallis eleifend at non nunc."
153.24,753.51,462.58,762.36,"/F8",9.96,"Laila Lachowicz, Benito Shofner, Garrett Osborn, and Gilda Koenen"
249.45,743.24,366.55,751.21,"/F18",8.97,"Health Gold Semiconductors"
170.78,718.64,445.07,727.49,"/F8",9.96,"Ricardo Haith, Buddy Liles, Kate Fazzino, and Sun Layeld"
264.66,708.37,351.34,716.34,"/F18",8.97,"Logistics Agricultural"
144.91,683.77,470.92,692.62,"/F8",9.96,"Ty Dehaven, Temple Lusby, Lawrence Gassaway, and Aurea Stoltenberg"
279.42,673.51,336.62,681.47,"/F18",8.97,"Tillman Corp"
118.01,653.08,507.04,661.04,"/F15",8.97,"Commodo magna ad sed phasellus pellentesque parturient quam fusce vehicula justo rhoncus."
108.80,642.62,507.05,650.58,"/F15",8.97,"Laoreet netus ve nisl aenean arcu per. Natoque proin. Cubilia proin non urna pellentesque vestibu-"
108.80,632.16,328.22,640.12,"/F15",8.97,"lum erat class quam amet donec taciti condimentum."
334.43,632.16,506.98,640.12,"/F15",8.97,"Gravida justo cubilia rutrum orci id lacus"
108.80,621.70,134.17,629.66,"/F15",8.97,"fames."
142.65,621.70,412.68,629.66,"/F15",8.97,"Aliquet lorem etiam augue vivamus fermentum nam sollicitudin."
421.18,621.70,507.01,629.66,"/F15",8.97,"Sodales fusce elit ad"
108.80,611.24,242.74,619.20,"/F15",8.97,"consectetuer sollicitudin posuere."
248.30,611.24,506.97,619.20,"/F15",8.97,"Blandit lacus pede porttitor orci sociis vestibulum consectetuer"
108.80,600.78,291.46,608.74,"/F15",8.97,"aliquet ipsum duis accumsan morbi dapibus."
297.42,600.78,507.00,608.74,"/F15",8.97,"Aliquet justo cras in consectetuer aliquam vehicula"
108.80,590.32,179.07,598.28,"/F15",8.97,"amet leo tellus a."
184.34,590.32,445.01,598.28,"/F15",8.97,"Viverra velit quis nisl parturient mauris ve mi tempor convallis."
450.27,590.32,506.99,598.28,"/F15",8.97,"Conubia fusce"
108.80,579.86,188.14,587.82,"/F15",8.97,"pretium platea nec."
193.81,579.86,336.31,587.82,"/F15",8.97,"Blandit donec orci ornare ac justo."
341.97,579.86,506.98,587.82,"/F15",8.97,"Cubilia ipsum sit amet lorem massa leo."
108.80,569.40,507.02,577.36,"/F15",8.97,"Dapibus velit id mi nullam fusce ornare pede nisi pulvinar justo. Rhoncus class velit class mauris"
108.80,558.93,392.81,566.90,"/F15",8.97,"primis felis placerat massa penatibus hac proin porttitor non potenti."
398.26,558.93,506.99,566.90,"/F15",8.97,"Laoreet curae elit pulvinar"
108.80,548.47,507.02,556.44,"/F15",8.97,"felis pellentesque metus at eget lorem dignissim. Aliquam augue donec ipsum pretium ve. Cubilia"
108.80,538.01,426.17,545.98,"/F15",8.97,"vitae in mollis senectus parturient fermentum erat tortor aliquet eros rutrum."
431.50,538.01,507.00,545.98,"/F15",8.97,"Egestas proin odio"
108.80,527.55,506.94,535.51,"/F15",8.97,"commodo mollis odio id sollicitudin pellentesque natoque tempor. Sodales class vel sagittis vivamus."
108.80,517.09,506.96,525.05,"/F15",8.97,"Lacinia proin arcu tortor. Gravida dolor mus venenatis pellentesque hac fringilla eros iaculis gravida"
108.80,506.63,161.05,514.59,"/F15",8.97,"consectetuer."
123.33,476.74,229.67,484.70,"/F19",8.97,"SODALES FUSCE ID."
63.96,444.81,99.51,453.65,"/F8",9.96,"Pretium"
105.04,444.81,129.37,453.65,"/F8",9.96,"etiam"
134.91,444.81,178.08,453.65,"/F8",9.96,"adipiscing"
183.62,444.81,219.67,453.65,"/F8",9.96,"senectus"
225.20,444.81,246.77,453.65,"/F8",9.96,"amet"
252.31,444.81,282.83,453.65,"/F8",9.96,"egestas"
288.37,444.81,298.88,453.65,"/F8",9.96,"ad"
54.00,432.85,134.35,441.70,"/F8",9.96,"duis dolor nullam."
140.98,432.85,298.83,441.70,"/F8",9.96,"Pretium metus quis at consectetuer"
54.00,420.90,298.85,429.74,"/F8",9.96,"erat feugiat ve ipsum. Natoque etiam diam blandit male-"
54.00,408.94,104.74,417.79,"/F8",9.96,"suada ante."
112.75,408.94,298.88,417.79,"/F8",9.96,"Vivamus metus id aenean molestie condi-"
54.00,396.99,166.56,405.83,"/F8",9.96,"mentum lobortis egestas."
176.96,396.99,298.86,405.83,"/F8",9.96,"Dapibus class dapibus feu-"
54.00,385.03,149.99,393.88,"/F8",9.96,"giat nibh sollicitudin."
159.05,385.03,274.14,393.88,"/F8",9.96,"Iaculis curae dui suscipit."
283.19,385.03,298.81,393.88,"/F8",9.96,"Eu-"
54.00,373.07,298.83,381.92,"/F8",9.96,"ismod curae metus aliquet ligula curae parturient viva-"
54.00,361.12,298.89,369.97,"/F8",9.96,"mus dui ac porta. Conubia magna dis morbi elementum"
54.00,349.16,91.56,358.01,"/F8",9.96,"ante leo."
98.34,349.16,298.84,358.01,"/F8",9.96,"Blandit nulla ad luctus mi nibh sociosqu est."
54.00,337.21,259.96,346.06,"/F8",9.96,"Lacinia etiam odio hac lorem pretium rutrum."
266.46,337.21,298.86,346.06,"/F8",9.96,"Viverra"
54.00,325.25,298.82,334.10,"/F8",9.96,"lacus. Viverra purus elit nisl vivamus id consequat odio."
54.00,313.30,127.26,322.15,"/F8",9.96,"Commodo lacus."
134.74,313.30,298.87,322.15,"/F8",9.96,"Feugiat felis cum nisi fames inceptos"
54.00,301.34,121.17,310.19,"/F8",9.96,"erat bibendum."
127.16,301.34,298.80,310.19,"/F8",9.96,"Viverra risus vestibulum pulvinar risus"
54.00,289.39,298.83,298.24,"/F8",9.96,"malesuada laoreet pellentesque penatibus dolor facilisis"
54.00,277.43,93.82,286.28,"/F8",9.96,"torquent."
102.62,277.43,298.79,286.28,"/F8",9.96,"Sodales nulla sit nisi adipiscing facilisis elit"
54.00,265.48,298.82,274.33,"/F8",9.96,"dui laoreet. Natoque donec felis tellus tempor leo aliquet"
54.00,253.52,84.01,262.37,"/F8",9.96,"leo mi."
90.55,253.52,155.37,262.37,"/F8",9.96,"Egestas neque."
161.91,253.52,298.86,262.37,"/F8",9.96,"Feugiat netus nunc sodales hy-"
54.00,241.57,298.85,250.41,"/F8",9.96,"menaeos mauris pulvinar adipiscing cursus. Aliquam ne-"
54.00,229.61,298.85,238.46,"/F8",9.96,"tus id augue ad lectus et nostra a euismod. Potenti donec"
54.00,217.66,298.84,226.50,"/F8",9.96,"ve semper penatibus natoque proin vestibulum lacinia"
54.00,205.70,278.01,214.55,"/F8",9.96,"nam nascetur gravida elementum. Rhoncus magna."
63.96,188.13,298.88,196.98,"/F8",9.96,"Integer massa ac mollis morbi. Rhoncus dolor id fusce"
54.00,176.18,298.86,185.02,"/F8",9.96,"lobortis fames. Vivamus lorem nunc tempor et ligula con-"
54.00,164.22,298.83,173.07,"/F8",9.96,"sectetuer vel neque ipsum dictum consequat ipsum hen-"
54.00,152.27,298.81,161.11,"/F8",9.96,"drerit. Viverra ipsum et dictum facilisis sodales nunc ve"
54.00,140.31,233.57,149.16,"/F8",9.96,"consectetuer pellentesque rhoncus sociis."
241.42,140.31,298.81,149.16,"/F8",9.96,"Potenti nulla"
54.00,128.36,157.85,137.20,"/F8",9.96,"ve est eu neque sapien."
165.23,128.36,229.11,137.20,"/F8",9.96,"Natoque risus."
236.49,128.36,298.86,137.20,"/F8",9.96,"Natoque vitae"
54.00,116.40,298.83,125.25,"/F8",9.96,"ante tortor tempor. Cubilia netus id nunc cras. Potenti"
317.01,476.55,561.83,485.40,"/F8",9.96,"velit posuere in torquent enim ultrices accumsan neque."
317.01,464.59,561.85,473.44,"/F8",9.96,"Commodo proin nisi litora pharetra quisque nisl non nibh"
317.01,452.64,561.85,461.49,"/F8",9.96,"eget montes. Commodo felis orci sit turpis sociis felis ad"
317.01,440.68,537.10,449.53,"/F8",9.96,"justo ad faucibus commodo convallis nunc proin."
545.58,440.68,561.88,449.53,"/F8",9.96,"Ali-"
317.01,428.73,561.83,437.58,"/F8",9.96,"quam risus sit diam vestibulum. Quisque ipsum pede dis"
317.01,416.77,561.87,425.62,"/F8",9.96,"posuere diam a proin ac vulputate. Laoreet purus dolor"
317.01,404.82,561.83,413.67,"/F8",9.96,"nostra velit et libero dictumst eros auctor. Conubia lacus"
317.01,392.86,561.83,401.71,"/F8",9.96,"amet elit integer nonummy pellentesque tincidunt donec"
317.01,380.91,334.75,389.76,"/F8",9.96,"nisi."
344.52,380.91,409.13,389.76,"/F8",9.96,"Sodales etiam."
418.90,380.91,561.87,389.76,"/F8",9.96,"Posuere fusce eu nascetur cum."
317.01,368.95,561.87,377.80,"/F8",9.96,"Rhoncus magna felis cursus parturient bibendum feu-"
317.01,357.00,478.87,365.85,"/F8",9.96,"giat mattis est adipiscing fusce nibh."
484.57,357.00,561.88,365.85,"/F8",9.96,"Nonummy magna"
317.01,345.04,495.12,353.89,"/F8",9.96,"lacinia augue ac interdum diam suscipit."
500.66,345.04,561.86,353.89,"/F8",9.96,"Conubia vitae"
317.01,333.09,373.82,341.93,"/F8",9.96,"risus aenean."
380.71,333.09,510.15,341.93,"/F8",9.96,"Cubilia netus nisl blandit ut."
517.04,333.09,561.85,341.93,"/F8",9.96,"Nonummy"
317.01,321.13,453.40,329.98,"/F8",9.96,"velit nisi elit praesent volutpat."
405.38,286.50,473.67,294.46,"/F19",8.97,"Blandit morbi."
326.98,259.86,561.85,268.71,"/F8",9.96,"Pretium vitae lorem quisque feugiat tellus nam enim"
317.01,247.91,448.93,256.75,"/F8",9.96,"odio viverra felis ipsum fusce."
455.51,247.91,561.87,256.75,"/F8",9.96,"Posuere magna ad nulla"
317.01,235.95,448.62,244.80,"/F8",9.96,"orci ve per cursus integer eni."
454.92,235.95,561.87,244.80,"/F8",9.96,"Aliquam augue mi amet"
317.01,224.00,561.81,232.84,"/F8",9.96,"pulvinar tempor rutrum tincidunt lacus lacinia facilisi."
317.01,212.04,561.82,220.89,"/F8",9.96,"Pretium fusce risus cubilia. Gravida curae justo facilisis"
317.01,200.09,561.83,208.93,"/F8",9.96,"vestibulum cum parturient nostra eleifend vivamus nisl"
317.01,188.13,362.31,196.98,"/F8",9.96,"diam eros."
368.01,188.13,423.90,196.98,"/F8",9.96,"Blandit felis."
429.61,188.13,561.85,196.98,"/F8",9.96,"Sodales proin duis malesuada."
317.01,176.18,561.89,185.02,"/F8",9.96,"Iaculis vitae ante aenean conubia dui ad enim conval-"
317.01,164.22,455.49,173.07,"/F8",9.96,"lis lectus sociosqu ullamcorper."
463.50,164.22,561.85,173.07,"/F8",9.96,"Pretium metus at pu-"
317.01,152.27,561.82,161.11,"/F8",9.96,"rus. Blandit vitae. Sodales nulla ante torquent. Pretium"
317.01,140.31,561.85,149.16,"/F8",9.96,"morbi cubilia conubia quis nisi class. Aliquam ipsum ad"
317.01,128.36,561.82,137.20,"/F8",9.96,"nisi diam aliquet at ut libero potenti id ad netus semper."
317.01,116.40,561.84,125.25,"/F8",9.96,"Quisque netus justo auctor vulputate potenti cras po-"
