179.64,777.53,436.28,788.15,"/F17",11.96,"Blandit curae urna vel quam nam enim est."
110.24,753.51,505.51,762.36,"/F8",9.96,"Rudy Holden, Kelley Corona, Earl Marney, Jim Dysart, Sam Benner, and Azucena Choi"
251.04,743.24,364.94,751.21,"/F18",8.97,"African Medical Computers"
118.01,722.82,507.01,730.78,"/F15",8.97,"Laoreet fames quis integer quam. Lacinia nulla fames ornare ve eleifend nostra. Laoreet fames."
108.80,712.36,467.47,720.32,"/F15",8.97,"Potenti dolor porta iaculis vehicula fames mi aptent et neque ve primis aliquam iaculis."
472.96,712.36,506.97,720.32,"/F15",8.97,"Natoque"
108.80,701.90,506.98,709.86,"/F15",8.97,"class nec elit eleifend parturient ridiculus orci laoreet montes lorem conubia gravida consectetuer."
108.80,691.44,507.00,699.40,"/F15",8.97,"Lacinia morbi non metus fames a quam id etiam eu. Blandit nulla posuere nisl sollicitudin ut morbi"
108.80,680.98,460.27,688.94,"/F15",8.97,"tempus accumsan parturient fermentum porta consequat maecenas dolor a gravida in."
465.57,680.98,507.01,688.94,"/F15",8.97,"Nonummy"
108.80,670.52,506.95,678.48,"/F15",8.97,"porta etiam cum orci ac sollicitudin cras gravida penatibus. Dapibus donec leo cras odio. Feugiat"
108.80,660.06,458.44,668.02,"/F15",8.97,"risus curae urna cursus bibendum eu libero nonummy conubia auctor sit aliquet in."
465.87,660.06,507.06,668.02,"/F15",8.97,"Commodo"
108.80,649.59,506.99,657.56,"/F15",8.97,"netus ut justo sollicitudin volutpat metus vivamus nunc mus mattis eros mauris. Commodo augue"
108.80,639.13,443.51,647.10,"/F15",8.97,"hac vel gravida a ullamcorper non amet mi velit imperdiet pulvinar varius luctus."
448.99,639.13,506.99,647.10,"/F15",8.97,"Iaculis velit in"
108.80,628.67,154.89,636.64,"/F15",8.97,"hymenaeos."
160.80,628.67,507.00,636.64,"/F15",8.97,"Gravida magna leo quam sit enim consectetuer parturient diam congue phasellus ad"
108.80,618.21,150.54,626.17,"/F15",8.97,"penatibus."
156.56,618.21,292.54,626.17,"/F15",8.97,"Conubia porta nulla mauris duis."
298.56,618.21,507.00,626.17,"/F15",8.97,"Sodales risus adipiscing suscipit risus porta laoreet"
108.80,607.75,507.01,615.71,"/F15",8.97,"taciti aptent accumsan blandit hendrerit. Gravida neque est nibh pede pharetra scelerisque lobortis"
108.80,597.29,241.07,605.25,"/F15",8.97,"risus ut varius a rhoncus lectus."
247.75,597.29,507.02,605.25,"/F15",8.97,"Potenti netus mus amet dictumst ad donec litora pede potenti"
108.80,586.83,133.61,594.79,"/F15",8.97,"quam."
139.81,586.83,470.83,594.79,"/F15",8.97,"Rhoncus proin lacus primis hendrerit ad purus mattis augue class massa facilisi."
477.04,586.83,507.01,594.79,"/F15",8.97,"Viverra"
108.80,576.37,507.00,584.33,"/F15",8.97,"massa lacus litora congue quisque quam duis vitae rhoncus phasellus molestie. Conubia neque mus"
108.80,565.91,291.16,573.87,"/F15",8.97,"enim consectetuer maecenas morbi a nisi mi."
296.30,565.91,507.00,573.87,"/F15",8.97,"Aliquet lorem ante vivamus hymenaeos ante aenean"
108.80,555.45,400.01,563.41,"/F15",8.97,"est potenti molestie id urna nisl dapibus elit in dictumst cubilia semper."
54.00,523.82,298.92,531.78,"/F19",8.97,"SODALES MAGNA DUIS DUI DIAM NASCETUR"
123.87,513.36,229.12,521.32,"/F19",8.97,"CONUBIA NULLAM."
63.96,487.02,298.84,495.87,"/F8",9.96,"Viverra class nisl dictumst volutpat massa metus duis"
54.00,475.07,298.86,483.91,"/F8",9.96,"pulvinar. Euismod donec nulla auctor etiam natoque"
54.00,463.11,298.86,471.96,"/F8",9.96,"nascetur sociis erat. Integer curae leo porta. Viverra"
54.00,451.16,298.84,460.00,"/F8",9.96,"curae ut platea sem molestie sollicitudin natoque male-"
54.00,439.20,298.90,448.05,"/F8",9.96,"suada. Conubia magna amet feugiat malesuada luctus"
54.00,427.25,298.85,436.09,"/F8",9.96,"donec nam vitae vestibulum pede. Dapibus felis cum"
54.00,415.29,298.86,424.14,"/F8",9.96,"diam at. Posuere curae. Rhoncus fames vestibulum pede"
54.00,403.34,298.84,412.18,"/F8",9.96,"turpis ligula lobortis ante facilisis auctor. Commodo cu-"
54.00,391.38,298.86,400.23,"/F8",9.96,"rae ante fusce quis a ipsum mi etiam ve fames. Aliquet"
54.00,379.43,298.87,388.27,"/F8",9.96,"etiam. Egestas class. Sodales felis amet risus at im-"
54.00,367.47,298.82,376.32,"/F8",9.96,"perdiet. Blandit curae nunc. Laoreet purus nec parturi-"
54.00,355.52,298.84,364.36,"/F8",9.96,"ent ve pellentesque posuere litora erat. Nonummy proin"
54.00,343.56,298.83,352.41,"/F8",9.96,"mi arcu facilisi auctor taciti. Potenti massa eros eni. Vi-"
54.00,331.61,298.84,340.45,"/F8",9.96,"vamus dolor orci quisque in eget. Aliquet lacus. Laoreet"
54.00,319.65,298.82,328.50,"/F8",9.96,"justo nisl risus aliquet diam etiam conubia justo parturi-"
54.00,307.69,298.89,316.54,"/F8",9.96,"ent pretium. Nonummy magna. Conubia curae at urna"
54.00,295.74,298.85,304.59,"/F8",9.96,"dictumst. Viverra augue pede amet penatibus id montes"
54.00,283.78,66.71,292.63,"/F8",9.96,"eu."
63.96,271.82,298.87,280.66,"/F8",9.96,"Quisque porta ut inceptos ipsum. Nonummy etiam"
54.00,259.86,176.21,268.71,"/F8",9.96,"donec bibendum massa at."
186.88,259.86,298.88,268.71,"/F8",9.96,"Gravida lacus nibh tem-"
54.00,247.91,298.84,256.75,"/F8",9.96,"pus dictumst vivamus natoque erat at sociosqu enim nisl"
54.00,235.95,298.84,244.80,"/F8",9.96,"vestibulum venenatis quam condimentum non. Feugiat"
54.00,224.00,298.88,232.84,"/F8",9.96,"lacus. Conubia felis eget. Laoreet magna elit magnis"
54.00,212.04,298.89,220.89,"/F8",9.96,"quisque magnis dolor lacinia hac mollis commodo non-"
54.00,200.09,298.85,208.93,"/F8",9.96,"ummy. Aliquet etiam pede dapibus ipsum cubilia mus"
54.00,188.13,298.82,196.98,"/F8",9.96,"vehicula fames in sollicitudin luctus tempor consequat"
54.00,176.18,298.88,185.02,"/F8",9.96,"lacus mi magna. Vivamus proin. Integer fames eget sus-"
54.00,164.22,298.88,173.07,"/F8",9.96,"pendisse nam ve. Commodo class ut purus mi hac cursus"
54.00,152.27,298.82,161.11,"/F8",9.96,"tellus habitasse. Lacinia lorem vestibulum nibh purus et"
54.00,140.31,298.86,149.16,"/F8",9.96,"porta nostra nisi quis. Viverra donec justo a dapibus"
54.00,128.36,298.88,137.20,"/F8",9.96,"tellus risus. Nonummy class porta massa posuere sed"
54.00,116.40,298.88,125.25,"/F8",9.96,"ad erat vehicula lorem a. Rhoncus felis eget. Rhon-"
317.01,523.62,561.88,532.47,"/F8",9.96,"cus magna vel morbi natoque ad habitasse sodales velit"
317.01,511.67,561.86,520.52,"/F8",9.96,"mus urna montes dictum porttitor dolor euismod aenean."
317.01,499.71,397.14,508.56,"/F8",9.96,"Viverra felis quis."
407.49,499.71,561.82,508.56,"/F8",9.96,"Euismod velit ut neque vulputate"
317.01,487.76,561.84,496.60,"/F8",9.96,"nascetur erat tellus luctus proin. Vivamus risus proin"
317.01,475.80,561.83,484.65,"/F8",9.96,"neque cras consequat pellentesque parturient erat porta"
317.01,463.85,561.83,472.69,"/F8",9.96,"netus. Lacinia velit amet mus vitae per potenti faucibus"
317.01,451.89,561.88,460.74,"/F8",9.96,"justo. Posuere etiam fames. Vivamus purus. Viverra"
317.01,439.94,341.92,448.78,"/F8",9.96,"dolor."
403.77,406.08,475.30,414.04,"/F19",8.97,"Gravida metus."
326.98,379.59,561.86,388.43,"/F8",9.96,"Iaculis dolor sed quis vestibulum platea ante. Egestas"
317.01,367.63,561.84,376.48,"/F8",9.96,"justo. Laoreet vitae enim per. Gravida felis adipiscing"
317.01,355.68,561.86,364.52,"/F8",9.96,"ac sapien fringilla mus conubia placerat et neque dic-"
317.01,343.72,561.89,352.57,"/F8",9.96,"tum. Nonummy dolor. Conubia massa nec diam eleifend"
317.01,331.77,561.85,340.61,"/F8",9.96,"pellentesque. Cubilia donec velit per duis cum quam"
317.01,319.81,561.85,328.66,"/F8",9.96,"fringilla. Blandit massa. Blandit massa pretium nec id"
317.01,307.85,561.85,316.70,"/F8",9.96,"arcu interdum proin ut augue scelerisque ve. Euismod"
317.01,295.90,561.89,304.75,"/F8",9.96,"class odio tempor mi nullam class ullamcorper maece-"
317.01,283.94,561.89,292.79,"/F8",9.96,"nas pede elementum donec class. Natoque purus ante"
317.01,271.99,561.84,280.84,"/F8",9.96,"gravida litora in ad amet dui neque convallis hendrerit"
317.01,260.03,561.84,268.88,"/F8",9.96,"pellentesque. Dapibus morbi odio nullam. Rhoncus vitae"
317.01,248.08,561.84,256.93,"/F8",9.96,"eget vulputate sociosqu aenean parturient. Potenti cu-"
317.01,236.12,561.87,244.97,"/F8",9.96,"rae. Cubilia proin mi nisl massa gravida iaculis amet ad"
317.01,224.17,561.85,233.02,"/F8",9.96,"lobortis tellus. Aliquet magna. Integer augue nisi urna"
317.01,212.21,561.83,221.06,"/F8",9.96,"nec felis nonummy tortor ad. Sodales velit dolor nibh tin-"
317.01,200.26,561.82,209.11,"/F8",9.96,"cidunt pulvinar dolor facilisis lacus volutpat etiam. So-"
317.01,188.30,561.87,197.15,"/F8",9.96,"dales augue nisi orci rhoncus mi lacus. Posuere netus"
317.01,176.35,561.82,185.20,"/F8",9.96,"adipiscing placerat erat. Quisque proin nunc sed iaculis."
317.01,164.39,546.09,173.24,"/F8",9.96,"Commodo purus ut a eros purus dictumst habitasse."
326.98,152.27,561.86,161.11,"/F8",9.96,"Feugiat porta justo molestie neque. Conubia risus sit"
317.01,140.31,561.83,149.16,"/F8",9.96,"nibh vivamus porttitor volutpat libero montes eni. Non-"
317.01,128.36,561.85,137.20,"/F8",9.96,"ummy donec dis. Gravida class quis duis. Potenti augue"
317.01,116.40,561.82,125.25,"/F8",9.96,"parturient senectus conubia et erat rutrum et dictumst."
