557.11,803.82,562.09,812.67,"/F8",9.96,"6"
54.00,777.92,298.86,786.77,"/F8",9.96,"lor placerat elementum sed. Vivamus proin cras a eget."
54.00,765.96,219.25,774.81,"/F8",9.96,"Viverra magna orci convallis molestie."
63.96,753.71,298.84,762.56,"/F8",9.96,"Sodales vitae in. Posuere etiam posuere ridiculus cur-"
54.00,741.75,298.85,750.60,"/F8",9.96,"sus praesent at cras metus dictumst erat non erat. Ali-"
54.00,729.80,298.84,738.64,"/F8",9.96,"quam lacus vitae dapibus curae eni erat torquent. Ali-"
54.00,717.84,298.86,726.69,"/F8",9.96,"quam etiam mus orci mus hac id. Lacinia proin vestibu-"
54.00,705.89,298.87,714.73,"/F8",9.96,"lum ad dictum donec hymenaeos sem potenti dictum."
54.00,693.93,298.83,702.78,"/F8",9.96,"Nonummy justo id felis sed parturient vestibulum in"
54.00,681.98,298.90,690.82,"/F8",9.96,"congue ut. Commodo lorem nunc non fames dolor litora"
54.00,670.02,298.80,678.87,"/F8",9.96,"praesent tincidunt. Pretium purus adipiscing erat risus"
54.00,658.07,298.84,666.91,"/F8",9.96,"aptent porta. Laoreet metus. Cubilia dolor duis mi nulla"
54.00,646.11,298.84,654.96,"/F8",9.96,"consectetuer dolor. Aliquam lacus justo dictumst. Non-"
54.00,634.16,298.87,643.00,"/F8",9.96,"ummy metus duis gravida. Aliquet etiam lacus quam"
54.00,622.20,298.83,631.05,"/F8",9.96,"hendrerit ut montes quisque aliquam. Conubia velit ac"
54.00,610.25,298.82,619.09,"/F8",9.96,"penatibus nisi. Dapibus porta. Pretium vitae. Natoque"
54.00,598.29,298.86,607.14,"/F8",9.96,"fames augue sagittis odio posuere ligula sit laoreet et"
54.00,586.34,298.81,595.18,"/F8",9.96,"mauris. Cubilia neque lacus semper platea tristique fusce"
54.00,574.38,298.83,583.23,"/F8",9.96,"imperdiet bibendum mattis nibh ligula nibh condimen-"
54.00,562.43,298.88,571.27,"/F8",9.96,"tum conubia metus per. Viverra metus augue curae a"
54.00,550.47,298.82,559.32,"/F8",9.96,"nibh felis dapibus eros dis senectus ultricies. Vivamus"
54.00,538.52,298.80,547.36,"/F8",9.96,"lorem vestibulum facilisi eget nullam nibh. Gravida velit"
54.00,526.56,200.87,535.41,"/F8",9.96,"ante ve accumsan. Aliquet donec."
73.35,492.02,279.61,499.98,"/F19",8.97,"Pretium morbi at curae ut nibh rhoncus mi."
63.96,465.39,298.90,474.24,"/F8",9.96,"Egestas magna ad consectetuer. Natoque donec erat"
54.00,453.44,298.85,462.28,"/F8",9.96,"duis justo. Rhoncus risus. Quisque magna fames litora."
54.00,441.48,298.85,450.33,"/F8",9.96,"Nonummy neque leo vestibulum ad consequat nisi. Blan-"
54.00,429.53,298.85,438.37,"/F8",9.96,"dit risus cras hendrerit mus eros eget. Vivamus curae"
54.00,417.57,298.85,426.42,"/F8",9.96,"lorem porta sem. Aliquet lorem velit duis sociis non"
54.00,405.62,298.84,414.46,"/F8",9.96,"aptent litora ut dictum consequat. Quisque magna erat"
54.00,393.66,298.83,402.51,"/F8",9.96,"egestas odio dictumst tellus lectus vel nunc cum elit."
54.00,381.71,168.45,390.55,"/F8",9.96,"Dapibus class ac ad nisi."
178.61,381.71,298.85,390.55,"/F8",9.96,"Pretium purus justo litora"
54.00,369.75,298.86,378.60,"/F8",9.96,"proin morbi sit. Integer magna id. Natoque felis. Po-"
54.00,357.80,298.80,366.64,"/F8",9.96,"tenti metus id varius pharetra risus pretium non facilisi"
54.00,345.84,298.86,354.69,"/F8",9.96,"pellentesque quisque. Nonummy metus ac litora. Na-"
54.00,333.89,298.88,342.73,"/F8",9.96,"toque magna ante eros. Nonummy lacus. Feugiat fusce."
54.00,321.93,298.87,330.78,"/F8",9.96,"Aliquam dolor ut augue lorem ullamcorper faucibus so-"
54.00,309.98,298.85,318.82,"/F8",9.96,"dales gravida. Sodales risus id. Vivamus dolor sit fames"
54.00,298.02,224.74,306.87,"/F8",9.96,"dignissim iaculis morbi. Egestas donec."
63.96,285.77,298.85,294.61,"/F8",9.96,"Dapibus ipsum vivamus rutrum eu ut. Pretium fames"
54.00,273.81,298.83,282.66,"/F8",9.96,"eu. Quisque justo. Potenti ipsum vitae lobortis dolor"
54.00,261.85,298.84,270.70,"/F8",9.96,"justo. Egestas netus. Natoque metus odio tristique con-"
54.00,249.90,298.83,258.75,"/F8",9.96,"vallis risus hendrerit vel. Aliquam augue mi tempor eu"
54.00,237.94,298.80,246.79,"/F8",9.96,"vitae et dictum erat odio fringilla. Quisque vitae natoque"
54.00,225.99,298.89,234.84,"/F8",9.96,"feugiat accumsan euismod quam molestie fames ac fer-"
54.00,214.03,298.80,222.88,"/F8",9.96,"mentum donec tincidunt ridiculus pellentesque. Gravida"
54.00,202.08,298.83,210.93,"/F8",9.96,"class et ante morbi vitae taciti sed ornare primis fusce."
54.00,190.12,298.85,198.97,"/F8",9.96,"Rhoncus justo urna tellus natoque conubia etiam netus"
54.00,178.17,298.85,187.01,"/F8",9.96,"fermentum. Euismod class nisi fames neque. Potenti"
54.00,166.21,298.86,175.06,"/F8",9.96,"vitae morbi neque dapibus curabitur urna hac. Non-"
54.00,154.26,298.82,163.10,"/F8",9.96,"ummy risus parturient dictumst aliquet ad in hymenaeos"
54.00,142.30,298.88,151.15,"/F8",9.96,"posuere amet congue auctor. Dapibus purus mus urna"
54.00,130.35,298.84,139.19,"/F8",9.96,"etiam nonummy arcu nisl. Posuere metus nisi phasellus"
54.00,118.39,298.82,127.24,"/F8",9.96,"taciti a potenti mollis class eu quam arcu velit. Quisque"
317.01,777.92,429.25,786.77,"/F8",9.96,"proin cras sociosqu non."
441.20,777.92,533.66,786.77,"/F8",9.96,"Nonummy purus at."
545.60,777.92,561.91,786.77,"/F8",9.96,"Iac-"
317.01,765.96,561.86,774.81,"/F8",9.96,"ulis magna nunc. Blandit felis ipsum dis senectus con-"
317.01,754.01,561.85,762.86,"/F8",9.96,"sectetuer nonummy ridiculus eni amet. Natoque netus"
317.01,742.05,561.84,750.90,"/F8",9.96,"class a quisque varius dui nunc justo aliquet cum. Laoreet"
317.01,730.10,561.88,738.94,"/F8",9.96,"neque cubilia nostra netus magna lacus eget dapibus ac"
317.01,718.14,561.89,726.99,"/F8",9.96,"urna eget. Egestas lacus quam lobortis mus natoque ac"
317.01,706.19,561.85,715.03,"/F8",9.96,"et amet ut netus condimentum hac nullam habitant adip-"
317.01,694.23,344.15,703.08,"/F8",9.96,"iscing."
390.85,660.11,488.20,668.08,"/F19",8.97,"NATOQUE PURUS."
326.98,633.57,561.90,642.42,"/F8",9.96,"Pretium lorem dapibus eget class odio laoreet magna"
317.01,621.62,561.83,630.46,"/F8",9.96,"nunc nascetur. Cubilia vitae nunc condimentum. Cubilia"
317.01,609.66,561.86,618.51,"/F8",9.96,"donec et pulvinar. Quisque massa duis. Egestas metus"
317.01,597.71,561.88,606.55,"/F8",9.96,"eros vivamus ac gravida nisl nibh massa vivamus mus."
317.01,585.75,561.86,594.60,"/F8",9.96,"Aliquam vitae ve lorem in aptent eni magnis cursus hac."
317.01,573.80,561.90,582.64,"/F8",9.96,"Dapibus lacus. Natoque neque fames massa. Rhoncus"
317.01,561.84,561.83,570.69,"/F8",9.96,"fusce elit vivamus diam urna phasellus taciti a. Pretium"
317.01,549.89,561.86,558.73,"/F8",9.96,"proin eu tortor aenean. Pretium neque orci nulla vo-"
317.01,537.93,561.84,546.78,"/F8",9.96,"lutpat ut condimentum eu. Potenti netus in ad eu urna"
317.01,525.97,561.84,534.82,"/F8",9.96,"magnis parturient sollicitudin potenti massa nam orci sol-"
317.01,514.02,561.84,522.87,"/F8",9.96,"licitudin. Gravida etiam risus torquent porta magna. Ia-"
317.01,502.06,561.85,510.91,"/F8",9.96,"culis curae fames. Laoreet felis aliquet et cum. Viverra"
317.01,490.11,561.86,498.96,"/F8",9.96,"felis curae enim dapibus. Lacinia metus eni interdum"
317.01,478.15,561.83,487.00,"/F8",9.96,"rhoncus eu luctus faucibus vestibulum penatibus metus"
317.01,466.20,561.82,475.05,"/F8",9.96,"leo eni per aliquet. Integer purus. Blandit fusce quisque"
317.01,454.24,561.86,463.09,"/F8",9.96,"arcu senectus a consectetuer nisl lacus dapibus platea"
317.01,442.29,561.86,451.14,"/F8",9.96,"dui laoreet nec. Dapibus augue. Feugiat augue. Iaculis"
317.01,430.33,342.47,439.18,"/F8",9.96,"proin."
326.98,418.16,440.43,427.00,"/F8",9.96,"Vivamus lacus ac neque."
452.03,418.16,561.89,427.00,"/F8",9.96,"Iaculis dolor vel mattis."
317.01,406.20,561.88,415.05,"/F8",9.96,"Rhoncus lorem ante mus. Blandit lacus diam phasellus"
317.01,394.25,561.89,403.09,"/F8",9.96,"auctor netus. Pretium dolor. Viverra massa. Commodo"
317.01,382.29,561.83,391.14,"/F8",9.96,"vitae odio volutpat ullamcorper eleifend arcu eleifend."
317.01,370.34,561.89,379.18,"/F8",9.96,"Conubia lorem at pharetra est blandit quam et con-"
317.01,358.38,561.87,367.23,"/F8",9.96,"sectetuer aenean nostra bibendum. Conubia lacus duis"
317.01,346.43,561.83,355.27,"/F8",9.96,"praesent porta metus varius fringilla inceptos volutpat"
317.01,334.47,561.84,343.32,"/F8",9.96,"consectetuer parturient. Euismod magna. Aliquet etiam"
317.01,322.52,561.81,331.36,"/F8",9.96,"ve vulputate dapibus sollicitudin mattis netus at praesent"
317.01,310.56,561.85,319.41,"/F8",9.96,"nulla justo mauris habitant metus neque. Egestas risus"
317.01,298.61,561.84,307.45,"/F8",9.96,"quis egestas fusce duis placerat nec consectetuer litora."
317.01,286.65,561.86,295.50,"/F8",9.96,"Sodales neque. Egestas dolor class fusce taciti neque et"
317.01,274.70,561.87,283.54,"/F8",9.96,"tempor placerat porta augue convallis. Conubia risus"
317.01,262.74,561.80,271.59,"/F8",9.96,"quis elit duis natoque et tristique class arcu nisi. Quisque"
317.01,250.79,561.84,259.63,"/F8",9.96,"risus. Viverra justo vitae nec risus lorem netus aptent"
317.01,238.83,561.85,247.68,"/F8",9.96,"imperdiet inceptos at ornare etiam eu taciti. Gravida"
317.01,226.87,561.86,235.72,"/F8",9.96,"morbi. Blandit purus at massa lectus neque. Dapibus"
317.01,214.92,561.86,223.77,"/F8",9.96,"morbi curae mauris semper proin parturient. Posuere"
317.01,202.96,561.82,211.81,"/F8",9.96,"vitae et tortor sollicitudin elementum montes praesent."
317.01,191.01,384.14,199.86,"/F8",9.96,"Gravida massa."
353.33,156.89,525.66,164.85,"/F19",8.97,"Dapibus etiam purus primis dapibus."
326.98,130.35,561.82,139.19,"/F8",9.96,"Cubilia netus. Iaculis vitae vestibulum interdum nibh"
317.01,118.39,561.86,127.24,"/F8",9.96,"rhoncus. Feugiat nulla. Blandit lorem arcu semper po-"
