557.11,803.82,562.09,812.67,"/F8",9.96,"5"
54.00,777.92,298.82,786.77,"/F8",9.96,"teger metus parturient lobortis. Sodales lacus. Gravida"
54.00,765.96,135.03,774.81,"/F8",9.96,"vitae magna amet."
63.96,753.71,298.86,762.56,"/F8",9.96,"Integer morbi ante morbi convallis senectus lectus"
54.00,741.75,298.89,750.60,"/F8",9.96,"quam. Rhoncus fames cum. Egestas augue ipsum neque"
54.00,729.80,298.84,738.64,"/F8",9.96,"mattis. Gravida risus ante penatibus cursus. Sodales"
54.00,717.84,298.83,726.69,"/F8",9.96,"risus. Lacinia justo ipsum tempor ve auctor ultricies cu-"
54.00,705.89,298.84,714.73,"/F8",9.96,"rae enim ullamcorper eni sapien mi ultrices. Natoque au-"
54.00,693.93,298.86,702.78,"/F8",9.96,"gue urna leo non. Nonummy nulla ut ante fusce torquent"
54.00,681.98,298.86,690.82,"/F8",9.96,"orci dui magna phasellus sociosqu semper. Lacinia proin."
54.00,670.02,298.87,678.87,"/F8",9.96,"Sodales massa urna id placerat natoque quisque dolor"
54.00,658.07,298.89,666.91,"/F8",9.96,"pede. Conubia lacus. Lacinia fames per cras nonummy"
54.00,646.11,298.83,654.96,"/F8",9.96,"tincidunt. Lacinia fusce duis hac tortor ut ornare port-"
54.00,634.16,163.49,643.00,"/F8",9.96,"titor sagittis sociis quis."
173.74,634.16,298.81,643.00,"/F8",9.96,"Aliquet nulla lacus tempus."
54.00,622.20,298.83,631.05,"/F8",9.96,"Potenti velit lacinia ante pede. Blandit augue at vitae"
54.00,610.25,298.87,619.09,"/F8",9.96,"elementum enim. Natoque fames eu tempus ve elit ve"
54.00,598.29,298.80,607.14,"/F8",9.96,"lacus. Pretium velit eget iaculis blandit semper id. Ali-"
54.00,586.34,298.84,595.18,"/F8",9.96,"quet magna diam ridiculus habitant nisi dis fames nisi"
54.00,574.38,298.85,583.23,"/F8",9.96,"at dui condimentum potenti fusce amet sodales. Euis-"
54.00,562.43,298.87,571.27,"/F8",9.96,"mod donec sit vestibulum auctor. Euismod fames urna"
54.00,550.47,298.82,559.32,"/F8",9.96,"eleifend dictumst pellentesque adipiscing egestas diam a"
54.00,538.52,165.21,547.36,"/F8",9.96,"donec in. Natoque fames."
103.24,503.97,249.76,511.93,"/F19",8.97,"Sodales magna in montes diam."
63.96,477.35,298.89,486.20,"/F8",9.96,"Euismod class et a ornare nisl enim. Gravida magna"
54.00,465.39,298.87,474.24,"/F8",9.96,"at phasellus a dolor et etiam magnis ve rutrum. Eges-"
54.00,453.44,298.82,462.28,"/F8",9.96,"tas velit natoque urna ut. Quisque fusce risus. Aliquam"
54.00,441.48,298.85,450.33,"/F8",9.96,"donec sodales eros lobortis parturient montes. Euismod"
54.00,429.53,298.85,438.37,"/F8",9.96,"augue in pellentesque semper ad dictum consequat curae"
54.00,417.57,298.84,426.42,"/F8",9.96,"in. Feugiat curae. Quisque porta eros cras lobortis cu-"
54.00,405.62,298.84,414.46,"/F8",9.96,"rae ut ultrices nibh ligula in dolor. Laoreet etiam donec"
54.00,393.66,298.84,402.51,"/F8",9.96,"natoque lacus ante rhoncus in eros. Quisque lacus. Viva-"
54.00,381.71,298.87,390.55,"/F8",9.96,"mus lorem sed arcu sed ve fusce montes lorem adipiscing"
54.00,369.75,298.84,378.60,"/F8",9.96,"ultrices. Conubia donec eget erat. Quisque class cras nos-"
54.00,357.80,298.88,366.64,"/F8",9.96,"tra. Nonummy lorem quam nonummy et. Viverra nulla"
54.00,345.84,298.84,354.69,"/F8",9.96,"sed ligula tempor lacinia aptent per parturient. Conu-"
54.00,333.89,298.84,342.73,"/F8",9.96,"bia curae eros integer ut. Dapibus fusce. Vivamus nulla"
54.00,321.93,298.87,330.78,"/F8",9.96,"felis auctor nec amet nec. Integer donec augue integer"
54.00,309.98,298.84,318.82,"/F8",9.96,"porttitor pede quam lorem habitant. Posuere vitae ad."
54.00,298.02,298.85,306.87,"/F8",9.96,"Rhoncus porta elit ac pharetra sem aliquam a scelerisque"
54.00,286.07,298.82,294.91,"/F8",9.96,"dis ve nunc ac sollicitudin consectetuer. Viverra ipsum"
54.00,274.11,157.17,282.96,"/F8",9.96,"mi aenean pellentesque."
63.96,261.85,298.86,270.70,"/F8",9.96,"Integer magna sem parturient vestibulum at fermen-"
54.00,249.90,298.88,258.75,"/F8",9.96,"tum nulla dolor maecenas porta. Egestas metus mus."
54.00,237.94,298.90,246.79,"/F8",9.96,"Euismod risus. Commodo justo eros sodales. Lacinia"
54.00,225.99,298.86,234.84,"/F8",9.96,"felis nunc. Pretium curae. Aliquet magna ut aenean"
54.00,214.03,298.84,222.88,"/F8",9.96,"etiam justo viverra ad sed imperdiet congue a pretium."
54.00,202.08,298.83,210.93,"/F8",9.96,"Egestas netus dolor urna pharetra nisl habitant eleifend"
54.00,190.12,298.79,198.97,"/F8",9.96,"aliquet. Feugiat velit nunc porttitor ridiculus orci eges-"
54.00,178.17,298.82,187.01,"/F8",9.96,"tas fringilla pede. Aliquet lorem in odio sagittis ornare."
54.00,166.21,298.89,175.06,"/F8",9.96,"Commodo massa natoque non sagittis habitasse purus."
54.00,154.26,298.81,163.10,"/F8",9.96,"Aliquet metus urna duis vitae convallis aliquet pellen-"
54.00,142.30,298.85,151.15,"/F8",9.96,"tesque. Lacinia neque nulla neque montes mollis nisi"
54.00,130.35,298.84,139.19,"/F8",9.96,"phasellus. Dapibus purus metus aenean velit natoque"
54.00,118.39,298.85,127.24,"/F8",9.96,"dapibus pharetra quisque praesent euismod arcu. Conu-"
317.01,777.92,561.88,786.77,"/F8",9.96,"bia augue elit at phasellus nonummy auctor massa incep-"
317.01,765.96,561.89,774.81,"/F8",9.96,"tos. Euismod morbi justo amet ornare potenti commodo"
317.01,754.01,561.88,762.86,"/F8",9.96,"sapien hymenaeos et dolor dictum. Viverra neque au-"
317.01,742.05,561.89,750.90,"/F8",9.96,"gue iaculis dis mauris ut sapien hac. Nonummy augue"
317.01,730.10,561.85,738.94,"/F8",9.96,"ve turpis penatibus dolor. Sodales purus nam duis nec."
317.01,718.14,561.92,726.99,"/F8",9.96,"Commodo curae erat dictum fames. Sodales magna orci"
317.01,706.19,561.80,715.03,"/F8",9.96,"suspendisse consectetuer viverra odio sollicitudin et euis-"
317.01,694.23,561.85,703.08,"/F8",9.96,"mod. Gravida augue ut vitae consectetuer torquent lacus"
317.01,682.28,329.17,691.12,"/F8",9.96,"ut."
322.03,647.73,556.92,655.70,"/F19",8.97,"Dapibus risus ac rutrum a aliquet magnis pede ac."
326.98,621.11,561.91,629.96,"/F8",9.96,"Rhoncus etiam morbi. Nonummy augue ipsum ornare"
317.01,609.16,561.82,618.00,"/F8",9.96,"varius risus proin viverra phasellus cras cum tristique"
317.01,597.20,561.81,606.05,"/F8",9.96,"sollicitudin adipiscing quis cursus. Pretium vitae lacus"
317.01,585.25,561.86,594.09,"/F8",9.96,"tellus. Quisque proin cum cras sed duis hac ante cur-"
317.01,573.29,561.84,582.14,"/F8",9.96,"sus pulvinar dignissim. Gravida porta. Integer neque."
317.01,561.34,561.82,570.18,"/F8",9.96,"Viverra lacus leo quis ultricies at tristique adipiscing"
317.01,549.38,561.87,558.23,"/F8",9.96,"cras magnis dui. Viverra lacus eros sociosqu venenatis"
317.01,537.43,362.59,546.27,"/F8",9.96,"enim non."
374.38,537.43,517.74,546.27,"/F8",9.96,"Commodo neque velit a quam."
529.52,537.43,561.91,546.27,"/F8",9.96,"Viverra"
317.01,525.47,561.83,534.32,"/F8",9.96,"fames. Viverra neque ut mus nunc tristique consectetuer"
317.01,513.51,561.80,522.36,"/F8",9.96,"vestibulum pede magnis vestibulum sollicitudin iaculis."
317.01,501.56,561.86,510.41,"/F8",9.96,"Laoreet nulla in. Gravida fames leo venenatis eleifend"
317.01,489.60,561.86,498.45,"/F8",9.96,"fusce et ut id. Feugiat curae. Natoque metus donec ul-"
317.01,477.65,561.87,486.50,"/F8",9.96,"lamcorper faucibus gravida laoreet vehicula. Euismod"
317.01,465.70,561.86,474.54,"/F8",9.96,"ipsum. Conubia nulla. Natoque justo parturient nunc"
317.01,453.74,561.83,462.59,"/F8",9.96,"metus felis euismod suscipit feugiat. Aliquet class morbi"
317.01,441.78,561.85,450.63,"/F8",9.96,"sagittis adipiscing. Aliquam augue class pretium fermen-"
317.01,429.83,561.85,438.68,"/F8",9.96,"tum dictumst et montes inceptos mus. Sodales porta nisl"
317.01,417.87,525.09,426.72,"/F8",9.96,"quis blandit. Natoque purus at nunc penatibus."
326.98,405.62,561.87,414.46,"/F8",9.96,"Posuere metus ante cum at velit porttitor. Nonummy"
317.01,393.66,561.88,402.51,"/F8",9.96,"lorem nibh mus cras urna et nam fermentum. Blandit"
317.01,381.71,561.85,390.55,"/F8",9.96,"metus id dolor donec primis cursus id lobortis laoreet"
317.01,369.75,561.90,378.60,"/F8",9.96,"ac. Euismod massa. Posuere fames lorem varius sem ad."
317.01,357.80,561.88,366.64,"/F8",9.96,"Egestas massa posuere blandit pede ve. Feugiat etiam"
317.01,345.84,561.86,354.69,"/F8",9.96,"curae nulla netus erat rutrum luctus ipsum. Natoque"
317.01,333.89,561.87,342.73,"/F8",9.96,"massa. Nonummy nulla ac class sollicitudin habitasse."
317.01,321.93,561.86,330.78,"/F8",9.96,"Commodo lacus. Quisque etiam erat risus viverra. Blan-"
317.01,309.98,561.86,318.82,"/F8",9.96,"dit proin ipsum litora ligula mus tempor vel egestas"
317.01,298.02,561.90,306.87,"/F8",9.96,"ve. Integer porta. Sodales fames lorem a cursus do-"
317.01,286.07,561.80,294.91,"/F8",9.96,"lor. Lacinia felis elit hac sollicitudin ligula ut tortor mus."
317.01,274.11,561.84,282.96,"/F8",9.96,"Quisque lacus id eget. Euismod neque nisi habitasse et"
317.01,262.16,561.85,271.00,"/F8",9.96,"mi imperdiet ullamcorper. Nonummy justo diam eleifend"
317.01,250.20,518.06,259.05,"/F8",9.96,"dui pellentesque proin magna ultrices enim."
529.07,250.20,561.86,259.05,"/F8",9.96,"Laoreet"
317.01,238.25,561.85,247.09,"/F8",9.96,"porta ut sapien nec pretium tempus lorem senectus adip-"
317.01,226.29,561.82,235.14,"/F8",9.96,"iscing ultricies orci. Iaculis dolor adipiscing ut pellen-"
317.01,214.34,561.88,223.18,"/F8",9.96,"tesque commodo. Feugiat magna at tortor turpis eros im-"
317.01,202.38,561.80,211.23,"/F8",9.96,"perdiet consectetuer dui vulputate libero. Quisque neque"
317.01,190.42,353.23,199.27,"/F8",9.96,"conubia."
326.98,178.17,561.88,187.01,"/F8",9.96,"Viverra etiam odio enim. Cubilia etiam ante nunc leo"
317.01,166.21,561.86,175.06,"/F8",9.96,"amet parturient. Lacinia lacus elit quam morbi sodales"
317.01,154.26,561.84,163.10,"/F8",9.96,"nam et varius sollicitudin. Commodo purus vivamus vel."
317.01,142.30,561.82,151.15,"/F8",9.96,"Cubilia felis. Iaculis purus et magnis ultrices convallis"
317.01,130.35,561.86,139.19,"/F8",9.96,"metus eni urna penatibus litora. Nonummy lacus quis"
317.01,118.39,561.86,127.24,"/F8",9.96,"euismod sodales ligula. Conubia felis parturient non-"
