37.61,748.78,288.40,757.62,"/F8",9.96,"diam nisi donec. Cubilia velit odio vehicula aliquet. Blan-"
37.61,736.82,288.43,745.67,"/F8",9.96,"dit fames ut semper sit eget ve augue sollicitudin donec"
37.61,724.87,288.43,733.71,"/F8",9.96,"nibh sem. Rhoncus metus aliquet lacinia duis diam porta"
37.61,712.91,288.46,721.76,"/F8",9.96,"quisque. Natoque curae nunc dis a magnis quam tempus"
37.61,700.96,288.44,709.80,"/F8",9.96,"purus ullamcorper ut libero magna ad vitae dui. Conubia"
37.61,689.00,288.40,697.85,"/F8",9.96,"porta. Aliquam netus velit a feugiat litora etiam vestibu-"
37.61,677.04,288.47,685.89,"/F8",9.96,"lum praesent egestas. Commodo fames. Potenti ipsum"
37.61,665.09,288.44,673.94,"/F8",9.96,"nonummy urna ad nisi vel urna mus. Blandit vitae dui"
37.61,653.13,288.44,661.98,"/F8",9.96,"cras hac quisque fames vel cras ve. Posuere neque elit"
37.61,641.18,288.40,650.03,"/F8",9.96,"scelerisque sem litora odio pellentesque lobortis. Rhoncus"
37.61,629.22,288.42,638.07,"/F8",9.96,"velit erat. Sodales porta duis ve. Rhoncus lacus eget plac-"
37.61,617.27,288.42,626.11,"/F8",9.96,"erat augue ve turpis dignissim nascetur litora pede orci."
37.61,605.31,261.26,614.16,"/F8",9.96,"Quisque purus adipiscing torquent nunc magnis eu."
37.61,581.40,137.47,590.25,"/F27",9.96,"1.2. Iaculis porta duis."
52.56,566.46,288.46,575.31,"/F8",9.96,"Aliquam purus arcu. Natoque purus mi morbi ullam-"
37.61,554.50,288.45,563.35,"/F8",9.96,"corper dictumst sodales. Posuere lacus. Aliquet magna"
37.61,542.55,288.44,551.40,"/F8",9.96,"at nisl quam metus mauris ornare neque. Blandit risus"
37.61,530.59,288.42,539.44,"/F8",9.96,"pede donec convallis velit mi id cum. Cubilia neque fames"
37.61,518.64,288.43,527.48,"/F8",9.96,"ante ullamcorper pellentesque sodales odio cras. Iaculis"
37.61,506.68,288.43,515.53,"/F8",9.96,"netus at fusce at enim. Vivamus metus class luctus nostra"
37.61,494.73,288.47,503.57,"/F8",9.96,"magna torquent eu condimentum nunc hymenaeos urna"
37.61,482.77,288.42,491.62,"/F8",9.96,"nam. Feugiat nulla metus dictum tincidunt leo hac penat-"
37.61,470.82,288.44,479.66,"/F8",9.96,"ibus sed. Iaculis donec lacus. Lacinia nulla donec varius"
37.61,458.86,288.45,467.71,"/F8",9.96,"justo nam varius id. Cubilia class. Conubia massa proin"
37.61,446.91,288.44,455.75,"/F8",9.96,"enim massa et. Blandit proin vel porta nibh cum nibh"
37.61,434.95,288.46,443.80,"/F8",9.96,"fringilla ac. Rhoncus curae enim duis nunc massa dic-"
37.61,423.00,288.44,431.84,"/F8",9.96,"tumst sed cras pellentesque. Sodales fames. Euismod me-"
37.61,411.04,288.41,419.89,"/F8",9.96,"tus quam natoque et. Iaculis fusce vel. Pretium risus dui"
37.61,399.09,288.42,407.93,"/F8",9.96,"vivamus cum nibh et. Conubia fusce hac non sollicitudin."
37.61,387.13,288.44,395.98,"/F8",9.96,"Vivamus fusce cras nec dictumst a sagittis dui. Integer"
37.61,375.18,208.33,384.02,"/F8",9.96,"morbi pede elementum semper nam at."
52.56,363.22,288.49,372.07,"/F8",9.96,"Rhoncus purus eu. Rhoncus justo at morbi auctor"
37.61,351.27,288.39,360.11,"/F8",9.96,"vestibulum sollicitudin nonummy interdum erat pharetra."
37.61,339.31,288.42,348.16,"/F8",9.96,"Aliquam donec et tellus eleifend diam. Iaculis etiam eros"
37.61,327.36,301.10,336.20,"/F8",9.96,"cubilia ac viverra ante ultrices nascetur pellentesque. Pretium"
37.61,315.40,288.42,324.25,"/F8",9.96,"metus vitae aliquam fringilla bibendum eu magnis placerat"
37.61,303.45,288.42,312.29,"/F8",9.96,"amet. Conubia netus. Posuere velit arcu. Pretium lacus"
37.61,291.49,288.46,300.34,"/F8",9.96,"odio sodales quisque aliquam arcu non nunc a class. Vi-"
37.61,279.54,288.44,288.38,"/F8",9.96,"vamus felis lacus mollis vitae id platea. Rhoncus fusce"
37.61,267.58,288.42,276.43,"/F8",9.96,"mi purus est mollis dictumst natoque consectetuer tem-"
37.61,255.62,288.41,264.47,"/F8",9.96,"por id. Blandit ipsum ad ridiculus odio sed vitae vulpu-"
37.61,243.67,288.41,252.52,"/F8",9.96,"tate nam. Nonummy nulla vestibulum urna lectus facilisis"
37.61,231.71,288.40,240.56,"/F8",9.96,"ad. Aliquet justo pretium litora urna varius nostra pulv-"
37.61,219.76,288.38,228.61,"/F8",9.96,"inar nisl sit ornare. Cubilia porta purus primis fringilla et"
37.61,207.80,288.41,216.65,"/F8",9.96,"vulputate neque eu velit eu diam ligula libero nec. Feu-"
37.61,195.85,288.45,204.70,"/F8",9.96,"giat porta dis quam adipiscing hymenaeos amet pretium"
37.61,183.89,288.40,192.74,"/F8",9.96,"ve cum suspendisse viverra ullamcorper. Iaculis purus quis"
37.61,171.94,288.46,180.79,"/F8",9.96,"lorem orci cum a luctus. Aliquam class quam nonummy."
37.61,159.98,288.42,168.83,"/F8",9.96,"Vivamus velit neque luctus vestibulum magna orci. Feu-"
37.61,148.03,288.42,156.88,"/F8",9.96,"giat lacus eget auctor dis duis placerat lobortis quisque."
37.61,136.07,277.38,144.92,"/F8",9.96,"Integer magna. Viverra risus justo pede. Iaculis donec."
37.61,112.16,265.70,121.01,"/F27",9.96,"1.3. Cubilia fusce nec diam mi consectetuer montes."
52.56,97.22,288.50,106.07,"/F8",9.96,"Cubilia augue massa odio massa vivamus nunc ad vel"
37.61,85.26,306.70,94.11,"/F8",9.96,"suspendisse rhoncus suspendisse. Pretium augue quis. Gravida"
306.60,748.78,557.40,757.62,"/F8",9.96,"ipsum adipiscing integer pede nibh parturient non dolor."
306.60,736.82,557.42,745.67,"/F8",9.96,"Aliquam vitae eget dui magna est amet imperdiet tellus."
306.60,724.87,557.43,733.71,"/F8",9.96,"Aliquam ipsum. Iaculis donec nam nibh in consectetuer"
306.60,712.91,557.48,721.76,"/F8",9.96,"laoreet. Commodo lorem quis mus posuere in. Conu-"
306.60,700.95,557.41,709.80,"/F8",9.96,"bia purus orci iaculis augue morbi lacus enim elit mattis."
306.60,689.00,557.45,697.85,"/F8",9.96,"Commodo lacus etiam ante montes dui sed. Cubilia curae"
306.60,677.04,557.38,685.89,"/F8",9.96,"vitae nostra tortor eni blandit ut fringilla. Euismod purus"
306.60,665.09,557.37,673.94,"/F8",9.96,"at imperdiet aliquam nisl hendrerit ad vulputate diam vel."
306.60,653.13,557.44,661.98,"/F8",9.96,"Nonummy porta amet. Lacinia proin. Lacinia nulla risus"
306.60,641.18,557.39,650.03,"/F8",9.96,"ultricies. Potenti magna vestibulum quis varius dictum"
306.60,629.22,557.43,638.07,"/F8",9.96,"malesuada in curabitur urna eros sed interdum. Euismod"
306.60,617.27,557.40,626.11,"/F8",9.96,"ipsum cras suscipit tincidunt eget. Viverra ipsum. Eges-"
306.60,605.31,557.42,614.16,"/F8",9.96,"tas donec ac cursus mi ultrices. Dapibus morbi et ornare"
306.60,593.36,557.43,602.20,"/F8",9.96,"morbi vivamus integer pede in curae id mauris egestas."
306.60,581.40,557.40,590.25,"/F8",9.96,"Egestas felis integer leo elit sagittis dapibus metus. Cu-"
306.60,569.45,557.39,578.29,"/F8",9.96,"bilia purus felis luctus in cubilia erat consequat malesuada"
306.60,557.49,543.07,566.34,"/F8",9.96,"adipiscing quam. Gravida netus at fames ad purus ut."
321.55,545.54,557.46,554.38,"/F8",9.96,"Pretium justo quam euismod orci accumsan ullamcor-"
306.60,533.58,557.39,542.43,"/F8",9.96,"per ultrices arcu per arcu a erat parturient. Pretium porta"
306.60,521.63,557.41,530.47,"/F8",9.96,"augue dictumst. Viverra proin in montes molestie. Egestas"
306.60,509.67,557.42,518.52,"/F8",9.96,"purus nisi aenean mi sociosqu eni dapibus. Aliquam porta"
306.60,497.72,557.41,506.56,"/F8",9.96,"amet ac. Commodo velit at etiam vulputate. Pretium velit"
306.60,485.76,557.42,494.61,"/F8",9.96,"sed vivamus. Integer curae netus praesent. Viverra augue"
306.60,473.81,557.40,482.65,"/F8",9.96,"neque enim primis senectus orci nostra sagittis porta enim"
306.60,461.85,557.41,470.70,"/F8",9.96,"a. Potenti justo cras feugiat metus cras taciti. Aliquet"
306.60,449.90,557.39,458.74,"/F8",9.96,"lorem proin tellus suspendisse class ridiculus. Quisque"
306.60,437.94,557.39,446.79,"/F8",9.96,"etiam nisl ac nascetur. Potenti morbi parturient potenti"
306.60,425.99,557.47,434.83,"/F8",9.96,"nec accumsan. Quisque dolor at. Nonummy donec fames"
306.60,414.03,557.86,422.88,"/F8",9.96,"tristique nam cras accumsan adipiscing aptent lorem. Non-"
306.60,402.08,557.40,410.92,"/F8",9.96,"ummy dolor sem arcu facilisi enim duis pulvinar per integer"
306.60,390.12,557.44,398.97,"/F8",9.96,"diam. Sodales class. Commodo class mi facilisis parturi-"
306.60,378.17,557.38,387.01,"/F8",9.96,"ent. Cubilia velit vestibulum et inceptos nibh sem eni."
306.60,366.21,557.47,375.06,"/F8",9.96,"Commodo morbi ve tempor sed nisl ligula lectus magna"
306.60,354.25,557.39,363.10,"/F8",9.96,"non eros quis. Natoque fusce egestas tristique elit per nunc"
306.60,342.30,557.37,351.15,"/F8",9.96,"hendrerit eros venenatis sollicitudin vel consequat rutrum"
306.60,330.34,491.04,339.19,"/F8",9.96,"risus. Vivamus magna erat pulvinar lacus."
306.60,301.95,391.79,310.80,"/F17",9.96,"2. Quisque risus."
321.55,282.52,557.45,291.37,"/F8",9.96,"Gravida fusce ve mi cras dignissim interdum congue"
306.60,270.57,557.41,279.42,"/F8",9.96,"lacinia odio id. Dapibus risus aliquam sed ultrices con-"
306.60,258.61,557.38,267.46,"/F8",9.96,"sectetuer integer. Blandit justo est porta vulputate platea"
306.60,246.66,557.45,255.51,"/F8",9.96,"ac suscipit diam mus mauris. Gravida class. Rhoncus"
306.60,234.70,557.47,243.55,"/F8",9.96,"metus mi eros mi sociosqu conubia enim eu erat diam"
306.60,222.75,557.49,231.59,"/F8",9.96,"arcu fames commodo. Nonummy dolor diam pharetra ae-"
306.60,210.79,557.45,219.64,"/F8",9.96,"nean nullam hac nisi a cras et vulputate. Sodales magna"
306.60,198.84,557.44,207.68,"/F8",9.96,"orci viverra a scelerisque sed mattis maecenas augue sol-"
306.60,186.88,557.38,195.73,"/F8",9.96,"licitudin facilisis. Viverra augue arcu cum nisl. Potenti"
306.60,174.93,557.39,183.77,"/F8",9.96,"fames sed fusce vestibulum in pellentesque viverra platea"
306.60,162.97,557.39,171.82,"/F8",9.96,"eni cursus et neque pellentesque venenatis class ad fermen-"
306.60,151.02,557.43,159.86,"/F8",9.96,"tum vulputate enim. Dapibus massa eget eu vel semper."
306.60,139.06,557.41,147.91,"/F8",9.96,"Dapibus neque per urna erat dis ve aliquet quam. Feugiat"
306.60,127.11,557.43,135.95,"/F8",9.96,"donec mi ante sociis semper leo nisi venenatis. Sodales"
306.60,115.15,557.38,124.00,"/F8",9.96,"fames parturient in sociosqu amet pulvinar non sollicitudin"
306.60,103.20,557.41,112.04,"/F8",9.96,"mattis. Natoque lacus ac sapien eleifend ante sed nisi elit"
306.60,91.24,557.43,100.09,"/F8",9.96,"massa imperdiet. Gravida lacus ad ultricies massa lacus"
306.60,79.29,557.43,88.13,"/F8",9.96,"inceptos hymenaeos. Quisque lorem quam cubilia mauris"
295.15,61.35,300.13,70.20,"/F8",9.96,"2"
