557.11,803.82,562.09,812.67,"/F8",9.96,"5"
54.00,777.92,298.85,786.77,"/F8",9.96,"tis. Pretium neque. Gravida fusce proin nostra sem-"
54.00,765.96,99.76,774.81,"/F8",9.96,"per netus."
111.05,765.96,298.82,774.81,"/F8",9.96,"Gravida velit in tincidunt ve purus arcu"
54.00,754.01,250.21,762.86,"/F8",9.96,"tortor ve torquent hac consectetuer ipsum."
260.77,754.01,298.85,762.86,"/F8",9.96,"Euismod"
54.00,742.05,298.83,750.90,"/F8",9.96,"proin. Pretium curae non pede torquent ipsum at nullam"
54.00,730.10,298.81,738.95,"/F8",9.96,"dapibus sit lobortis integer. Quisque felis odio natoque"
54.00,718.14,298.86,726.99,"/F8",9.96,"pretium tempor ipsum sodales per mi dictum id enim"
54.00,706.19,298.81,715.03,"/F8",9.96,"erat. Blandit curae nam aptent volutpat per pellentesque"
54.00,694.23,298.84,703.08,"/F8",9.96,"vitae lacus iaculis convallis odio. Lacinia ipsum urna ac-"
54.00,682.28,298.88,691.12,"/F8",9.96,"cumsan sollicitudin sapien magna euismod. Nonummy"
54.00,670.32,298.83,679.17,"/F8",9.96,"vitae. Posuere nulla id ornare mi nascetur viverra sagit-"
54.00,658.37,298.81,667.21,"/F8",9.96,"tis arcu turpis viverra. Cubilia fames et congue vulputate"
54.00,646.41,298.80,655.26,"/F8",9.96,"pulvinar maecenas pellentesque. Potenti velit quis male-"
54.00,634.46,298.88,643.30,"/F8",9.96,"suada eu odio accumsan. Aliquam porta. Iaculis porta."
54.00,622.50,298.85,631.35,"/F8",9.96,"Pretium massa nisl laoreet ipsum felis per nunc phare-"
54.00,610.55,298.90,619.39,"/F8",9.96,"tra dapibus. Lacinia curae. Aliquam magna diam nam"
54.00,598.59,298.81,607.44,"/F8",9.96,"proin fringilla hendrerit arcu luctus dui. Vivamus netus"
54.00,586.64,298.83,595.48,"/F8",9.96,"eget purus dis semper blandit arcu pede vestibulum diam"
54.00,574.68,99.67,583.53,"/F8",9.96,"consequat."
71.26,538.83,281.72,546.80,"/F19",8.97,"Commodo curae diam amet tempor porttitor"
132.59,528.37,220.41,536.34,"/F19",8.97,"vestibulum cubilia."
63.96,501.51,298.88,510.35,"/F8",9.96,"Iaculis magna. Nonummy donec. Feugiat etiam cubilia"
54.00,489.55,298.84,498.40,"/F8",9.96,"curabitur praesent. Blandit netus conubia neque cras"
54.00,477.60,298.85,486.44,"/F8",9.96,"viverra elit sociis sem. Quisque neque ante leo massa"
54.00,465.64,298.86,474.49,"/F8",9.96,"augue eros. Egestas etiam sit magna facilisis quis sit"
54.00,453.68,298.87,462.53,"/F8",9.96,"porta fusce natoque hac diam. Conubia risus eros dic-"
54.00,441.73,298.87,450.58,"/F8",9.96,"tum commodo curabitur. Sodales proin diam est nullam"
54.00,429.77,298.82,438.62,"/F8",9.96,"a adipiscing. Aliquet proin duis cras suscipit vestibu-"
54.00,417.82,298.83,426.67,"/F8",9.96,"lum venenatis scelerisque sem montes eu. Potenti nulla"
54.00,405.86,298.89,414.71,"/F8",9.96,"fames nec urna. Blandit porta ac aenean et. Integer"
54.00,393.91,298.86,402.75,"/F8",9.96,"magna est vehicula euismod integer aenean nec blandit."
54.00,381.95,298.87,390.80,"/F8",9.96,"Commodo justo nisi volutpat fames viverra magnis eget"
54.00,370.00,298.88,378.84,"/F8",9.96,"ligula accumsan nunc. Posuere metus class duis. Non-"
54.00,358.04,298.85,366.89,"/F8",9.96,"ummy fames vel risus vivamus sagittis proin duis. So-"
54.00,346.09,298.86,354.93,"/F8",9.96,"dales ipsum. Conubia etiam elit integer lacus in a mau-"
54.00,334.13,298.84,342.98,"/F8",9.96,"ris eros nisl augue ac. Integer porta orci sapien torquent"
54.00,322.18,298.81,331.02,"/F8",9.96,"elementum vitae curabitur suscipit ut ullamcorper pede"
54.00,310.22,298.88,319.07,"/F8",9.96,"odio congue. Nonummy donec. Viverra netus lacus sit"
54.00,298.27,298.85,307.11,"/F8",9.96,"faucibus pellentesque gravida curabitur ante. Commodo"
54.00,286.31,298.84,295.16,"/F8",9.96,"purus nunc vehicula congue dictum fusce condimentum."
54.00,274.36,280.67,283.20,"/F8",9.96,"Lacinia neque ut at ve enim nisi pretium neque per."
63.96,261.85,298.87,270.70,"/F8",9.96,"Aliquam augue. Integer donec quam etiam risus mollis"
54.00,249.90,298.83,258.75,"/F8",9.96,"pellentesque. Sodales donec etiam. Pretium morbi proin"
54.00,237.94,298.83,246.79,"/F8",9.96,"pretium nam sagittis facilisis. Dapibus porta. Vivamus"
54.00,225.99,298.88,234.84,"/F8",9.96,"lacus eni cum mi. Euismod magna hac ante senectus dui"
54.00,214.03,298.83,222.88,"/F8",9.96,"viverra proin dis magnis. Cubilia ipsum elit rutrum ae-"
54.00,202.08,298.84,210.93,"/F8",9.96,"nean phasellus parturient nibh varius. Natoque ipsum"
54.00,190.12,298.84,198.97,"/F8",9.96,"neque morbi dui nibh nisi porta dictumst dolor proin"
54.00,178.17,298.87,187.02,"/F8",9.96,"sociis praesent. Conubia justo sem metus fermentum"
54.00,166.21,298.83,175.06,"/F8",9.96,"cum gravida suscipit. Gravida class orci eu pellentesque"
54.00,154.26,157.04,163.11,"/F8",9.96,"ligula etiam imperdiet."
167.16,154.26,298.83,163.11,"/F8",9.96,"Gravida netus quis cum felis"
54.00,142.30,298.82,151.15,"/F8",9.96,"proin sit orci. Conubia curae per leo sit nec vel. Pretium"
54.00,130.35,298.81,139.19,"/F8",9.96,"risus. Blandit augue ante nec nonummy in ultricies velit"
54.00,118.39,298.84,127.24,"/F8",9.96,"morbi primis aptent integer vulputate amet urna. Po-"
317.01,777.92,561.84,786.77,"/F8",9.96,"suere neque iaculis ligula in nisi volutpat. Rhoncus ne-"
317.01,765.96,561.83,774.81,"/F8",9.96,"tus parturient condimentum tempor mi dictumst rhoncus"
317.01,754.01,561.89,762.86,"/F8",9.96,"hymenaeos odio rutrum nam eros. Conubia proin. Inte-"
317.01,742.05,561.84,750.90,"/F8",9.96,"ger netus orci integer cras conubia quis ad sollicitudin"
317.01,730.10,561.85,738.95,"/F8",9.96,"quisque risus. Egestas donec amet eni class aptent neque"
317.01,718.14,561.87,726.99,"/F8",9.96,"posuere quis. Nonummy purus felis posuere. Viverra"
317.01,706.19,345.82,715.04,"/F8",9.96,"metus."
406.88,671.65,472.18,679.61,"/F19",8.97,"Viverra dolor."
326.98,645.02,561.87,653.87,"/F8",9.96,"Blandit class quis maecenas lobortis eu felis hac odio"
317.01,633.07,561.83,641.91,"/F8",9.96,"porttitor. Dapibus proin eu urna gravida enim nisl eget."
317.01,621.11,561.87,629.96,"/F8",9.96,"Lacinia etiam nibh quam metus quisque cras sociosqu."
317.01,609.16,561.85,618.00,"/F8",9.96,"Iaculis ipsum nunc eget sed. Viverra neque vestibulum"
317.01,597.20,561.85,606.05,"/F8",9.96,"scelerisque luctus at maecenas. Potenti etiam sem duis"
317.01,585.25,561.83,594.09,"/F8",9.96,"pulvinar magnis lectus. Blandit neque class eni nibh dig-"
317.01,573.29,561.83,582.14,"/F8",9.96,"nissim ut aenean penatibus velit a. Iaculis felis eu leo ve"
317.01,561.34,561.82,570.18,"/F8",9.96,"donec nunc per etiam velit. Potenti morbi dis orci integer"
317.01,549.38,561.90,558.23,"/F8",9.96,"erat. Conubia magna curae ornare ac bibendum amet sed"
317.01,537.43,561.86,546.27,"/F8",9.96,"arcu est. Sodales magna id class diam nisi convallis enim."
317.01,525.47,561.87,534.32,"/F8",9.96,"Aliquet dolor neque dictum congue magna pede sagittis"
317.01,513.52,561.83,522.36,"/F8",9.96,"dignissim ante vitae tincidunt dis pede. Nonummy felis"
317.01,501.56,561.83,510.41,"/F8",9.96,"morbi primis sagittis phasellus curae proin pretium cras."
317.01,489.61,561.90,498.45,"/F8",9.96,"Posuere massa. Cubilia metus ante congue ad accumsan"
317.01,477.65,561.88,486.50,"/F8",9.96,"placerat euismod conubia. Dapibus etiam sodales var-"
317.01,465.70,561.88,474.54,"/F8",9.96,"ius. Posuere ipsum. Laoreet massa vitae lorem lacinia"
317.01,453.74,561.86,462.59,"/F8",9.96,"pede quam. Egestas fusce neque semper sapien torquent"
317.01,441.78,561.81,450.63,"/F8",9.96,"parturient litora eleifend morbi pellentesque bibendum"
317.01,429.83,561.89,438.68,"/F8",9.96,"lorem mus. Vivamus augue amet. Viverra etiam ad pede"
317.01,417.87,561.80,426.72,"/F8",9.96,"lectus. Natoque vitae dolor suspendisse facilisi ridiculus."
326.98,405.62,392.77,414.46,"/F8",9.96,"Conubia fusce."
403.62,405.62,561.89,414.46,"/F8",9.96,"Nonummy neque vestibulum diam."
317.01,393.66,522.00,402.51,"/F8",9.96,"Commodo nulla non vestibulum adipiscing."
538.67,393.66,561.90,402.51,"/F8",9.96,"Viva-"
317.01,381.71,561.87,390.55,"/F8",9.96,"mus class dapibus euismod auctor cum parturient eu."
317.01,369.75,561.83,378.60,"/F8",9.96,"Pretium porta ve mi platea id quisque. Quisque velit"
317.01,357.80,561.87,366.64,"/F8",9.96,"duis nonummy imperdiet. Aliquam magna urna integer"
317.01,345.84,561.87,354.69,"/F8",9.96,"in nunc ad pellentesque rutrum magna hymenaeos ullam-"
317.01,333.89,561.85,342.73,"/F8",9.96,"corper porttitor. Nonummy curae ac nostra consectetuer."
317.01,321.93,561.80,330.78,"/F8",9.96,"Aliquet lorem nisi volutpat ultricies eleifend. Conubia ip-"
317.01,309.98,561.87,318.82,"/F8",9.96,"sum metus ullamcorper volutpat. Lacinia ipsum morbi"
317.01,298.02,561.88,306.87,"/F8",9.96,"nisl nam dui. Feugiat lorem pede congue aliquam. In-"
317.01,286.07,561.89,294.91,"/F8",9.96,"teger curae nibh posuere imperdiet congue. Commodo"
317.01,274.11,561.88,282.96,"/F8",9.96,"magna elit nibh tempor euismod. Conubia risus enim"
317.01,262.16,561.82,271.00,"/F8",9.96,"tristique at scelerisque. Aliquam ipsum cras blandit at"
317.01,250.20,561.89,259.05,"/F8",9.96,"in mi primis. Vivamus magna. Integer curae etiam do-"
317.01,238.25,561.82,247.09,"/F8",9.96,"lor. Laoreet vitae neque scelerisque nunc. Potenti risus."
317.01,226.29,561.87,235.14,"/F8",9.96,"Commodo nulla nisi ligula at dictumst diam. Integer fe-"
317.01,214.34,329.22,223.18,"/F8",9.96,"lis."
326.98,202.08,561.92,210.93,"/F8",9.96,"Vivamus metus. Nonummy curae ve mus ante class"
317.01,190.12,561.87,198.97,"/F8",9.96,"ligula etiam suspendisse eros. Integer donec class auc-"
317.01,178.17,561.85,187.02,"/F8",9.96,"tor id aliquam id. Sodales velit. Potenti augue fames."
317.01,166.21,561.85,175.06,"/F8",9.96,"Gravida curae arcu pretium elementum et vitae. Integer"
317.01,154.26,561.87,163.11,"/F8",9.96,"class. Conubia lorem orci vel. Nonummy neque ve justo"
317.01,142.30,561.84,151.15,"/F8",9.96,"mi eni ridiculus elit est a tortor vitae magna. Pretium"
317.01,130.35,561.88,139.19,"/F8",9.96,"morbi netus nec. Laoreet massa. Cubilia class. Natoque"
317.01,118.39,561.85,127.24,"/F8",9.96,"lacus ut proin curae justo auctor felis adipiscing id mae-"
