37.61,748.78,288.43,757.62,"/F8",9.96,"leo. Aliquam magna elit habitant ipsum nisl. Pretium"
37.61,736.82,288.47,745.67,"/F8",9.96,"massa nam orci. Feugiat metus in magna imperdiet ali-"
37.61,724.87,288.43,733.71,"/F8",9.96,"quam tempus. Pretium donec. Vivamus felis adipiscing"
37.61,712.91,288.41,721.76,"/F8",9.96,"condimentum auctor id dictumst turpis dictum integer"
37.61,700.96,288.44,709.80,"/F8",9.96,"eros ad consectetuer pretium lorem. Cubilia lorem. Com-"
37.61,689.00,288.47,697.85,"/F8",9.96,"modo lorem. Iaculis metus. Integer lacus ve semper ad"
37.61,677.04,288.41,685.89,"/F8",9.96,"eros purus. Viverra fames ante turpis ac sit hendrerit con-"
37.61,665.09,288.39,673.94,"/F8",9.96,"sectetuer parturient nisi. Viverra magna ut ultricies augue"
37.61,653.13,288.44,661.98,"/F8",9.96,"non morbi enim id quam facilisis sem nisl. Natoque dolor"
37.61,641.18,288.41,650.03,"/F8",9.96,"velit ridiculus. Aliquam proin diam dis diam at. Lacinia"
37.61,629.22,288.44,638.07,"/F8",9.96,"porta urna nunc. Rhoncus etiam urna inceptos dignissim"
37.61,617.27,288.40,626.11,"/F8",9.96,"mollis. Potenti curae ante blandit. Lacinia nulla. Cubilia"
37.61,605.31,129.03,614.16,"/F8",9.96,"curae ut urna massa."
37.61,581.40,164.72,590.25,"/F27",9.96,"2.1. Rhoncus etiam amet eu."
52.56,566.46,288.42,575.31,"/F8",9.96,"Gravida vitae eget facilisis placerat metus eu sollici-"
37.61,554.50,295.19,563.35,"/F8",9.96,"tudin platea class vestibulum ullamcorper aptent ve eleifend."
37.61,542.55,288.42,551.40,"/F8",9.96,"Viverra velit cras amet eget nibh dapibus laoreet luctus"
37.61,530.59,288.42,539.44,"/F8",9.96,"duis. Gravida etiam proin donec taciti sagittis natoque"
37.61,518.64,288.77,527.48,"/F8",9.96,"commodo enim praesent posuere. Viverra justo nec. Conu-"
37.61,506.68,288.45,515.53,"/F8",9.96,"bia fusce ad fusce ac urna. Cubilia augue. Gravida fusce"
37.61,494.73,288.46,503.57,"/F8",9.96,"nisi eget libero sem posuere ad. Posuere justo eu sem-"
37.61,482.77,288.39,491.62,"/F8",9.96,"per phasellus facilisi ac justo sollicitudin volutpat dolor"
37.61,470.82,288.42,479.66,"/F8",9.96,"justo. Laoreet curae vestibulum senectus feugiat integer"
37.61,458.86,288.42,467.71,"/F8",9.96,"elementum. Viverra donec lacus lorem purus primis incep-"
37.61,446.91,288.41,455.75,"/F8",9.96,"tos blandit inceptos pellentesque. Lacinia netus mi morbi"
37.61,434.95,288.47,443.80,"/F8",9.96,"ut sem. Euismod porta. Nonummy donec pede integer"
37.61,423.00,288.42,431.84,"/F8",9.96,"lacus curae dolor ligula vestibulum felis. Vivamus morbi."
37.61,411.04,288.44,419.89,"/F8",9.96,"Aliquam porta duis sem. Quisque fames est eget sagittis a"
37.61,399.09,288.46,407.93,"/F8",9.96,"eleifend leo montes ut placerat. Sodales magna massa ele-"
37.61,387.13,288.44,395.98,"/F8",9.96,"mentum vivamus eros dictumst sed integer diam. Laoreet"
37.61,375.18,288.45,384.02,"/F8",9.96,"morbi. Viverra lorem at elementum fames in sociis. Po-"
37.61,363.22,288.46,372.07,"/F8",9.96,"suere massa risus praesent justo magna diam. Posuere ne-"
37.61,351.27,288.41,360.11,"/F8",9.96,"tus mi felis venenatis mus. Egestas nulla orci quam integer"
37.61,339.31,212.15,348.16,"/F8",9.96,"ve hendrerit odio lorem eu ut ante odio."
52.56,327.36,288.42,336.20,"/F8",9.96,"Sodales proin vestibulum duis. Iaculis metus elit fer-"
37.61,315.40,288.47,324.25,"/F8",9.96,"mentum rutrum cum mattis. Laoreet massa. Posuere"
37.61,303.45,288.41,312.29,"/F8",9.96,"etiam. Euismod velit est enim semper vulputate. Lacinia"
37.61,291.49,288.47,300.34,"/F8",9.96,"magna metus etiam egestas nullam ve proin ve. Posuere"
37.61,279.54,288.44,288.38,"/F8",9.96,"massa eu sit suspendisse blandit dis inceptos fames mi"
37.61,267.58,288.47,276.43,"/F8",9.96,"justo. Commodo morbi quam fringilla mauris dolor vo-"
37.61,255.62,288.42,264.47,"/F8",9.96,"lutpat. Potenti felis porta conubia. Aliquet augue sem"
37.61,243.67,288.43,252.52,"/F8",9.96,"adipiscing hymenaeos. Blandit proin. Rhoncus fusce conu-"
37.61,231.71,288.37,240.56,"/F8",9.96,"bia dis mi posuere nisi ut pellentesque sollicitudin blandit"
37.61,219.76,288.44,228.61,"/F8",9.96,"cursus cum parturient neque ante cum. Aliquam lorem"
37.61,207.80,288.41,216.65,"/F8",9.96,"duis ridiculus elementum vestibulum mus. Vivamus justo"
37.61,195.85,288.42,204.70,"/F8",9.96,"class. Nonummy netus. Potenti proin nisl suspendisse non"
37.61,183.89,288.45,192.74,"/F8",9.96,"mattis. Laoreet curae. Quisque augue justo accumsan cras"
37.61,171.94,288.37,180.79,"/F8",9.96,"turpis ut eget. Potenti vitae neque arcu viverra tincidunt"
37.61,159.98,288.46,168.83,"/F8",9.96,"urna iaculis at convallis fames. Egestas donec arcu ad."
37.61,148.03,288.41,156.88,"/F8",9.96,"Quisque porta ve proin fusce suscipit adipiscing tempor"
37.61,136.07,131.45,144.92,"/F8",9.96,"diam. Vivamus lacus."
37.61,112.16,117.74,121.01,"/F27",9.96,"2.2. Pretium felis."
52.56,97.22,288.49,106.07,"/F8",9.96,"Cubilia augue quam mus augue eni. Gravida curae"
37.61,85.26,288.42,94.11,"/F8",9.96,"velit dui. Aliquam neque. Feugiat risus. Nonummy massa."
306.60,748.78,557.44,757.62,"/F8",9.96,"Gravida neque felis elit. Rhoncus magna cum odio ac eget."
306.60,736.82,557.43,745.67,"/F8",9.96,"Dapibus magna ve. Integer justo. Pretium metus ante au-"
306.60,724.87,557.41,733.71,"/F8",9.96,"gue vivamus diam quis in nunc metus proin quis sagittis"
306.60,712.91,557.48,721.76,"/F8",9.96,"augue eu litora. Commodo magna nec adipiscing ornare"
306.60,700.95,557.41,709.80,"/F8",9.96,"morbi parturient scelerisque montes at per suspendisse"
306.60,689.00,557.44,697.85,"/F8",9.96,"conubia. Rhoncus lorem eros arcu etiam litora dictum."
306.60,677.04,557.44,685.89,"/F8",9.96,"Aliquam felis blandit cum ad a quam vestibulum. Non-"
306.60,665.09,557.41,673.94,"/F8",9.96,"ummy netus non nisi vivamus nibh. Pretium lacus ipsum"
306.60,653.13,557.41,661.98,"/F8",9.96,"aptent quisque aliquam fames at in porttitor a. Cubilia"
306.60,641.18,557.42,650.03,"/F8",9.96,"porta vel pede odio sapien nisl eu purus sociis inceptos"
306.60,629.22,557.41,638.07,"/F8",9.96,"proin sollicitudin lorem nibh natoque. Lacinia justo eu"
306.60,617.27,557.42,626.11,"/F8",9.96,"fermentum. Viverra curae nisl. Sodales vitae morbi per"
306.60,605.31,557.42,614.16,"/F8",9.96,"amet accumsan justo etiam. Blandit felis nisl bibendum"
306.60,593.36,557.38,602.20,"/F8",9.96,"vel egestas. Quisque justo adipiscing scelerisque dictum ut"
306.60,581.40,557.38,590.25,"/F8",9.96,"ultricies fusce pede integer et aliquet elit ante fames curae"
306.60,569.45,557.42,578.29,"/F8",9.96,"nonummy. Pretium lorem elit fusce pretium auctor nam"
306.60,557.49,504.97,566.34,"/F8",9.96,"eget vestibulum tempus nibh at duis eleifend."
321.55,545.54,562.78,554.38,"/F8",9.96,"Nonummy donec vitae hac quam lacinia. Dapibus lorem."
306.60,533.58,557.45,542.43,"/F8",9.96,"Conubia lorem elit bibendum metus cum arcu. Laoreet"
306.60,521.63,557.40,530.47,"/F8",9.96,"nulla. Viverra velit. Rhoncus neque nibh iaculis est et"
306.60,509.67,557.40,518.52,"/F8",9.96,"platea inceptos. Vivamus nulla id nisl leo pellentesque"
306.60,497.72,569.18,506.56,"/F8",9.96,"primis. Gravida dolor eni nibh neque placerat purus. Gravida"
306.60,485.76,557.41,494.61,"/F8",9.96,"risus id neque et diam nulla sociis. Integer justo id sem-"
306.60,473.81,557.42,482.65,"/F8",9.96,"per hac turpis nostra. Cubilia velit pede magna feugiat"
306.60,461.85,557.42,470.70,"/F8",9.96,"sociis mi cursus ac nunc quisque lorem. Potenti dolor me-"
306.60,449.90,557.41,458.74,"/F8",9.96,"tus semper ve dictumst cum nunc. Cubilia ipsum amet dis"
306.60,437.94,557.46,446.79,"/F8",9.96,"nunc. Commodo class nunc nullam lacinia urna a neque"
306.60,425.99,557.37,434.83,"/F8",9.96,"ve sociis. Lacinia proin nibh tristique lobortis purus in dis"
306.60,414.03,557.39,422.88,"/F8",9.96,"nisi elit id. Potenti lacus eni. Vivamus vitae hac urna diam"
306.60,402.08,557.40,410.92,"/F8",9.96,"suscipit augue. Aliquet neque diam nisi quis praesent com-"
306.60,390.12,557.43,398.97,"/F8",9.96,"modo luctus. Dapibus metus. Vivamus nulla nibh diam"
306.60,378.17,557.43,387.01,"/F8",9.96,"augue sagittis nisi dictum egestas nec cras amet dapibus"
306.60,366.21,557.44,375.06,"/F8",9.96,"erat vestibulum ad. Vivamus lorem odio sem purus par-"
306.60,354.25,418.61,363.10,"/F8",9.96,"turient. Integer donec ad."
321.55,342.30,557.42,351.15,"/F8",9.96,"Quisque fusce class luctus nulla porta fames vel arcu."
306.60,330.34,557.39,339.19,"/F8",9.96,"Euismod porta integer hendrerit. Blandit netus elit eros"
306.60,318.39,557.46,327.24,"/F8",9.96,"magna ullamcorper nam orci. Feugiat morbi metus aenean"
306.60,306.43,557.40,315.28,"/F8",9.96,"molestie nisl laoreet mi. Blandit class massa vulputate in-"
306.60,294.48,557.42,303.33,"/F8",9.96,"terdum ad. Egestas justo cum nibh nisi dictumst platea"
306.60,282.52,557.44,291.37,"/F8",9.96,"netus. Gravida porta nec duis per porta dui quam eget"
306.60,270.57,557.42,279.42,"/F8",9.96,"risus congue diam. Conubia felis per lorem. Quisque pu-"
306.60,258.61,557.38,267.46,"/F8",9.96,"rus ac tincidunt a per ultricies nisl per curae elementum."
306.60,246.66,557.45,255.51,"/F8",9.96,"Lacinia massa. Rhoncus metus. Euismod lorem nibh luc-"
306.60,234.70,557.43,243.55,"/F8",9.96,"tus vel posuere fames pede feugiat ipsum. Viverra metus"
306.60,222.75,557.40,231.59,"/F8",9.96,"eu porta ve sapien curae sed ipsum ultricies elit sollici-"
306.60,210.79,557.41,219.64,"/F8",9.96,"tudin rutrum. Gravida metus urna ullamcorper nec nul-"
306.60,198.84,557.44,207.68,"/F8",9.96,"lam libero. Aliquam fames cras vel sem blandit a nullam"
306.60,186.88,557.45,195.73,"/F8",9.96,"nibh vitae maecenas felis. Laoreet fames ipsum ornare"
306.60,174.93,557.45,183.77,"/F8",9.96,"duis fusce varius proin ante sed ornare. Posuere massa"
306.60,162.97,557.41,171.82,"/F8",9.96,"nisl eget cubilia magnis non eu nullam faucibus fringilla"
306.60,151.02,557.42,159.86,"/F8",9.96,"sagittis magnis. Cubilia etiam natoque sociis mus egestas."
306.60,139.06,557.45,147.91,"/F8",9.96,"Iaculis massa. Viverra justo rhoncus. Rhoncus ipsum eu"
306.60,127.11,557.47,135.95,"/F8",9.96,"metus semper erat. Posuere fames hac nam sed nonummy"
306.60,115.15,355.89,124.00,"/F8",9.96,"morbi duis."
295.15,61.35,300.13,70.20,"/F8",9.96,"3"
