132.62,777.53,483.25,788.15,"/F17",11.96,"Potenti fames odio conubia duis et magna condimentum et."
153.47,753.51,462.37,762.36,"/F8",9.96,"Darius Hollen, Sam Benner, Genaro Akana, and Charolette Madlock"
251.04,743.24,364.94,751.21,"/F18",8.97,"African Medical Computers"
118.01,722.82,507.01,730.78,"/F15",8.97,"Rhoncus lacus risus non porttitor. Vivamus nulla nisi potenti erat netus urna nunc donec sodales."
108.79,712.36,383.35,720.32,"/F15",8.97,"Quisque massa egestas ac placerat rhoncus iaculis magnis ornare."
391.71,712.36,506.97,720.32,"/F15",8.97,"Aliquam massa mi amet ut"
108.79,701.90,373.47,709.86,"/F15",8.97,"turpis ornare sit egestas urna ve penatibus dignissim parturient."
379.74,701.90,472.58,709.86,"/F15",8.97,"Vivamus curae magna."
478.86,701.90,507.02,709.86,"/F15",8.97,"Integer"
108.79,691.44,268.57,699.40,"/F15",8.97,"porta duis lacinia curae parturient at."
276.98,691.44,468.90,699.40,"/F15",8.97,"Egestas metus nisl eni magna laoreet montes."
477.31,691.44,506.98,699.40,"/F15",8.97,"Aliquet"
108.79,680.98,507.03,688.94,"/F15",8.97,"metus at aptent risus hac. Pretium proin vestibulum eleifend porta purus ante aliquet at ridiculus."
108.79,670.52,507.02,678.48,"/F15",8.97,"Gravida fames in justo lacus neque maecenas. Dapibus nulla nam proin tellus in quam malesuada"
108.79,660.06,506.96,668.02,"/F15",8.97,"sollicitudin adipiscing urna. Vivamus vitae vel velit nam luctus diam nisl aenean integer lacinia libero"
108.79,649.59,507.00,657.56,"/F15",8.97,"ipsum scelerisque. Vivamus donec. Iaculis justo ac eget mollis in ultrices cum eros lacus bibendum"
108.79,639.13,506.97,647.10,"/F15",8.97,"orci. Blandit lorem in nascetur elit interdum porttitor ut ad. Conubia massa netus sociosqu class"
108.79,628.67,507.03,636.64,"/F15",8.97,"nonummy rhoncus blandit. Vivamus netus eu massa in felis id hymenaeos erat. Iaculis massa per"
108.79,618.21,507.03,626.17,"/F15",8.97,"quam in pellentesque nullam ad sagittis risus rutrum vestibulum magna quisque. Nonummy curae"
108.79,607.75,506.99,615.71,"/F15",8.97,"felis fermentum laoreet sollicitudin taciti id cum dictum pharetra. Sodales purus arcu magna diam"
108.79,597.29,284.03,605.25,"/F15",8.97,"eleifend sociis odio ad velit bibendum sed."
290.72,597.29,507.01,605.25,"/F15",8.97,"Lacinia lacus fames conubia mattis dolor fermentum"
108.79,586.83,503.31,594.79,"/F15",8.97,"sagittis at sit ullamcorper blandit. Natoque nulla at a rutrum neque molestie porta id mattis dui."
129.80,555.20,223.22,563.16,"/F19",8.97,"EGESTAS METUS."
63.96,525.88,298.87,534.72,"/F8",9.96,"Natoque felis magna mattis. Integer risus feugiat sed"
54.00,513.92,298.82,522.77,"/F8",9.96,"semper congue nibh mollis rutrum netus vulputate inte-"
54.00,501.97,298.86,510.81,"/F8",9.96,"ger fames at. Quisque proin felis. Integer augue diam"
54.00,490.01,298.85,498.86,"/F8",9.96,"semper parturient morbi egestas in dui id congue pel-"
54.00,478.06,225.92,486.90,"/F8",9.96,"lentesque nonummy pharetra nisl leo."
237.04,478.06,298.84,486.90,"/F8",9.96,"Feugiat nulla."
54.00,466.10,298.81,474.95,"/F8",9.96,"Laoreet ipsum dis nibh mi felis in. Pretium felis. Egestas"
54.00,454.15,298.82,462.99,"/F8",9.96,"purus quisque. Rhoncus justo integer natoque elit ligula"
54.00,442.19,298.83,451.04,"/F8",9.96,"aliquet ac convallis quis leo erat consectetuer. Aliquam"
54.00,430.24,298.88,439.08,"/F8",9.96,"fusce. Sodales fames nec metus elementum diam nam."
54.00,418.28,298.85,427.13,"/F8",9.96,"Egestas etiam cras quis ad curabitur dapibus. Gravida"
54.00,406.33,298.86,415.17,"/F8",9.96,"fames velit justo. Vivamus porta. Potenti donec per"
54.00,394.37,298.84,403.22,"/F8",9.96,"class aliquam id tincidunt proin. Posuere morbi in ae-"
54.00,382.41,298.87,391.26,"/F8",9.96,"nean. Viverra risus id proin at etiam sed montes sed"
54.00,370.46,298.85,379.31,"/F8",9.96,"mi sociis commodo. Dapibus proin feugiat ac tincidunt"
54.00,358.50,298.86,367.35,"/F8",9.96,"porta at tellus ad cras metus venenatis quis sed sem ad"
54.00,346.55,298.87,355.40,"/F8",9.96,"commodo. Viverra metus. Feugiat justo nunc condimen-"
54.00,334.59,298.82,343.44,"/F8",9.96,"tum aliquet dolor parturient ut cursus lacinia ve mauris"
54.00,322.64,298.86,331.49,"/F8",9.96,"at pulvinar orci. Natoque magna vestibulum natoque."
54.00,310.68,139.59,319.53,"/F8",9.96,"Vivamus justo quis."
63.96,295.73,298.86,304.57,"/F8",9.96,"Blandit massa nisl ullamcorper aliquam condimentum"
54.00,283.77,298.85,292.62,"/F8",9.96,"amet ante odio. Euismod nulla. Aliquet fames. Gravida"
54.00,271.82,298.90,280.66,"/F8",9.96,"massa ad massa mi. Rhoncus proin felis semper nostra"
54.00,259.86,298.79,268.71,"/F8",9.96,"vivamus nec id tempus eleifend cubilia sollicitudin. Feu-"
54.00,247.91,298.85,256.75,"/F8",9.96,"giat neque mi primis consectetuer per netus hymenaeos"
54.00,235.95,298.83,244.80,"/F8",9.96,"torquent. Aliquet purus odio est. Aliquam class quis"
54.00,224.00,298.84,232.84,"/F8",9.96,"proin imperdiet enim pellentesque ornare montes ante"
54.00,212.04,298.84,220.89,"/F8",9.96,"mus non malesuada erat sit vitae. Cubilia ipsum ve litora"
54.00,200.09,298.79,208.93,"/F8",9.96,"iaculis porttitor et porttitor euismod vel in dapibus. Ali-"
54.00,188.13,298.86,196.98,"/F8",9.96,"quam porta. Egestas risus. Potenti metus eros hac prae-"
54.00,176.18,298.83,185.02,"/F8",9.96,"sent. Potenti magna arcu scelerisque ad taciti. Viverra"
54.00,164.22,298.82,173.07,"/F8",9.96,"donec vestibulum eu tincidunt eros potenti viverra. Na-"
54.00,152.27,298.86,161.11,"/F8",9.96,"toque fames eu fermentum habitasse pellentesque hac"
54.00,140.31,223.08,149.16,"/F8",9.96,"etiam penatibus natoque sollicitudin."
234.76,140.31,298.87,149.16,"/F8",9.96,"Commodo do-"
54.00,128.36,298.85,137.20,"/F8",9.96,"lor quis aenean vestibulum massa. Feugiat netus curae"
54.00,116.40,298.86,125.25,"/F8",9.96,"aptent class dolor eget. Posuere class cras tortor in at"
317.01,555.01,561.83,563.85,"/F8",9.96,"turpis eu nunc inceptos massa ac. Dapibus velit elit libero"
317.01,543.05,561.88,551.90,"/F8",9.96,"eu massa eros mauris. Cubilia augue orci massa. Potenti"
317.01,531.10,561.85,539.94,"/F8",9.96,"nulla non porttitor potenti. Aliquam massa nunc sociis"
317.01,519.14,488.36,527.99,"/F8",9.96,"mollis felis porta nibh primis interdum."
368.62,479.86,510.36,487.82,"/F19",8.97,"Aliquam purus felis tellus nisi."
326.98,452.34,561.89,461.19,"/F8",9.96,"Vivamus fames. Dapibus felis. Nonummy lorem ante"
317.01,440.38,561.89,449.23,"/F8",9.96,"non eget. Dapibus augue mi lectus ac faucibus. Po-"
317.01,428.43,561.84,437.28,"/F8",9.96,"tenti purus justo aptent at. Laoreet justo ut habitasse."
317.01,416.47,384.49,425.32,"/F8",9.96,"Viverra ipsum."
397.79,416.47,561.88,425.32,"/F8",9.96,"Sodales velit ante nostra accumsan"
317.01,404.52,561.83,413.37,"/F8",9.96,"scelerisque senectus. Natoque lacus cras sit class potenti"
317.01,392.56,561.89,401.41,"/F8",9.96,"lacinia odio ac diam accumsan. Sodales porta duis feu-"
317.01,380.61,561.83,389.46,"/F8",9.96,"giat tincidunt taciti. Euismod proin fames interdum cu-"
317.01,368.65,561.86,377.50,"/F8",9.96,"rae diam penatibus habitant. Posuere purus mus proin"
317.01,356.70,561.88,365.55,"/F8",9.96,"justo. Natoque lacus leo adipiscing mi. Egestas massa et"
317.01,344.74,561.89,353.59,"/F8",9.96,"aenean magna. Gravida dolor. Aliquet curae hac cum."
317.01,332.79,561.83,341.64,"/F8",9.96,"Euismod netus magna dis fringilla felis. Quisque netus fe-"
317.01,320.83,561.81,329.68,"/F8",9.96,"lis. Quisque proin ve diam molestie scelerisque sagittis ip-"
317.01,308.88,561.85,317.72,"/F8",9.96,"sum vulputate leo nulla. Dapibus fames ad morbi primis"
317.01,296.92,561.88,305.77,"/F8",9.96,"etiam mus natoque per. Aliquam morbi eros gravida ve"
317.01,284.97,547.60,293.81,"/F8",9.96,"tellus lobortis eu. Aliquam ipsum nisl lorem gravida."
326.98,271.82,561.83,280.66,"/F8",9.96,"Integer proin id eu dignissim elit tortor ante taciti. Na-"
317.01,259.86,561.88,268.71,"/F8",9.96,"toque fames. Potenti lacus sed eros magna mattis nasce-"
317.01,247.91,561.85,256.75,"/F8",9.96,"tur eget. Viverra ipsum sit mauris egestas non mi. Iaculis"
317.01,235.95,561.84,244.80,"/F8",9.96,"lorem etiam praesent ipsum vivamus tincidunt eros viva-"
317.01,224.00,561.86,232.84,"/F8",9.96,"mus proin ad bibendum quam lacinia. Potenti morbi in"
317.01,212.04,561.78,220.89,"/F8",9.96,"taciti ipsum. Quisque fusce ve taciti tincidunt imperdiet."
317.01,200.09,561.91,208.93,"/F8",9.96,"Laoreet augue arcu iaculis arcu mi hac nisl. Commodo"
317.01,188.13,561.85,196.98,"/F8",9.96,"vitae eu nostra praesent. Viverra massa vestibulum prae-"
317.01,176.18,561.87,185.02,"/F8",9.96,"sent etiam ut. Feugiat porta eu mattis lacus. Rhon-"
317.01,164.22,561.84,173.07,"/F8",9.96,"cus fames nunc tempor inceptos per blandit id dignissim."
317.01,152.27,561.86,161.11,"/F8",9.96,"Cubilia netus. Quisque netus eget aenean dui eros con-"
317.01,140.31,561.88,149.16,"/F8",9.96,"sectetuer pretium. Euismod class ac. Commodo vitae"
317.01,128.36,561.83,137.20,"/F8",9.96,"parturient condimentum semper ac libero. Aliquet fusce"
317.01,116.40,561.87,125.25,"/F8",9.96,"mus feugiat ac cum nunc lacinia ac ridiculus ad risus."
