37.61,748.78,288.43,757.62,"/F8",9.96,"Iaculis justo curae ornare felis adipiscing. Dapibus magna"
37.61,736.82,173.82,745.67,"/F8",9.96,"vestibulum ultrices arcu tortor."
52.56,724.87,288.42,733.71,"/F8",9.96,"Laoreet vitae eu dictum et cursus sollicitudin elemen-"
37.61,712.91,288.46,721.76,"/F8",9.96,"tum ligula a posuere litora. Viverra morbi. Nonummy"
37.61,700.96,288.41,709.80,"/F8",9.96,"velit sit. Nonummy curae elit ve pellentesque. Euismod"
37.61,689.00,296.30,697.85,"/F8",9.96,"neque vestibulum orci. Feugiat justo nunc bibendum gravida"
37.61,677.04,288.46,685.89,"/F8",9.96,"orci at dolor ligula congue cum amet. Euismod velit ac"
37.61,665.09,288.47,673.94,"/F8",9.96,"arcu etiam viverra aliquam fermentum pede. Egestas class."
37.61,653.13,288.51,661.98,"/F8",9.96,"Commodo magna purus est praesent commodo duis mus"
37.61,641.18,288.42,650.03,"/F8",9.96,"ipsum curae scelerisque id montes at. Integer velit iac-"
37.61,629.22,288.39,638.07,"/F8",9.96,"ulis pede tristique leo quis orci cursus et ve vulputate."
37.61,617.27,288.44,626.11,"/F8",9.96,"Quisque curae amet eleifend per diam. Nonummy fusce."
37.61,605.31,288.45,614.16,"/F8",9.96,"Egestas porta nisl augue phasellus egestas nec molestie"
37.61,593.36,288.45,602.20,"/F8",9.96,"consectetuer potenti. Integer lorem eros. Rhoncus massa"
37.61,581.40,288.44,590.25,"/F8",9.96,"at. Cubilia lorem. Rhoncus velit. Gravida donec lacus"
37.61,569.45,288.43,578.29,"/F8",9.96,"quis eni vel cum vel. Nonummy dolor nisl libero ve cum"
37.61,557.49,288.45,566.34,"/F8",9.96,"at. Dapibus purus donec netus. Rhoncus fames mus nisl"
37.61,545.54,140.73,554.38,"/F8",9.96,"interdum. Cubilia velit."
52.56,533.58,288.43,542.43,"/F8",9.96,"Euismod etiam amet libero proin eleifend vestibulum"
37.61,521.63,288.41,530.47,"/F8",9.96,"luctus. Sodales neque eros gravida eni parturient. Integer"
37.61,509.67,288.39,518.52,"/F8",9.96,"ipsum. Aliquet fusce parturient molestie feugiat. Gravida"
37.61,497.72,288.42,506.56,"/F8",9.96,"proin lacus diam nisi elit dis fames aptent luctus proin"
37.61,485.76,288.42,494.61,"/F8",9.96,"cum nisi. Aliquet metus posuere tempor. Dapibus morbi"
37.61,473.81,288.39,482.65,"/F8",9.96,"velit eros rhoncus platea tincidunt bibendum elit. Lacinia"
37.61,461.85,288.46,470.70,"/F8",9.96,"vitae odio. Nonummy justo hac netus ornare proin par-"
37.61,449.90,288.41,458.74,"/F8",9.96,"turient nascetur euismod. Dapibus fusce eros fusce sodales"
37.61,437.94,288.35,446.79,"/F8",9.96,"ut in ligula. Posuere velit blandit nisi parturient mollis eni."
37.61,425.99,288.39,434.83,"/F8",9.96,"Pretium lorem parturient pulvinar urna lacinia risus fusce"
37.61,414.03,288.46,422.88,"/F8",9.96,"condimentum odio malesuada ut habitasse donec orci eros"
37.61,402.08,288.42,410.92,"/F8",9.96,"neque molestie ut hac odio. Iaculis porta nisi quisque in"
37.61,390.12,288.38,398.97,"/F8",9.96,"sit et turpis sollicitudin hymenaeos. Lacinia risus. Viverra"
37.61,378.17,288.44,387.01,"/F8",9.96,"nulla. Laoreet ipsum vivamus. Laoreet nulla ad habitasse"
37.61,366.21,288.38,375.06,"/F8",9.96,"erat imperdiet ridiculus consectetuer eni netus. Dapibus"
37.61,354.26,288.44,363.10,"/F8",9.96,"fames in. Natoque vitae id neque platea vitae hymenaeos"
37.61,342.30,288.40,351.15,"/F8",9.96,"nullam. Iaculis felis urna per nibh. Euismod vitae nisl in-"
37.61,330.34,288.42,339.19,"/F8",9.96,"teger ad ut nunc feugiat vel in. Iaculis nulla neque nostra"
37.61,318.39,247.61,327.24,"/F8",9.96,"eu mauris imperdiet vestibulum pede imperdiet."
37.61,294.48,140.26,303.33,"/F27",9.96,"1.2. Iaculis morbi mus."
52.56,279.54,288.43,288.38,"/F8",9.96,"Posuere felis sit mollis porta nascetur ad scelerisque"
37.61,267.58,288.46,276.43,"/F8",9.96,"nunc eget pede potenti eni. Lacinia curae odio maece-"
37.61,255.62,288.41,264.47,"/F8",9.96,"nas a sollicitudin enim justo euismod lacus ut convallis ul-"
37.61,243.67,288.39,252.52,"/F8",9.96,"tricies. Viverra vitae risus lorem velit pharetra duis arcu"
37.61,231.71,288.44,240.56,"/F8",9.96,"ve. Commodo lorem in id enim bibendum sem sollicitudin"
37.61,219.76,288.43,228.61,"/F8",9.96,"donec fames amet litora ve eget. Iaculis fusce velit sodales"
37.61,207.80,288.42,216.65,"/F8",9.96,"rutrum lorem cubilia dui eu etiam nostra class. Iaculis pu-"
37.61,195.85,288.48,204.70,"/F8",9.96,"rus quis ac. Commodo metus diam lacinia ac eu cras dolor"
37.61,183.89,288.44,192.74,"/F8",9.96,"dignissim rhoncus dui habitasse. Lacinia dolor. Vivamus"
37.61,171.94,288.43,180.79,"/F8",9.96,"dolor odio vehicula sollicitudin semper ad libero. Rhon-"
37.61,159.98,288.43,168.83,"/F8",9.96,"cus class quis egestas donec orci laoreet quisque. Vivamus"
37.61,148.03,288.44,156.88,"/F8",9.96,"proin eros per auctor. Euismod porta eu taciti. Lacinia"
37.61,136.07,288.44,144.92,"/F8",9.96,"class. Integer fusce porta nunc eros urna sed nibh odio dui"
37.61,124.12,288.46,132.96,"/F8",9.96,"ligula. Laoreet donec erat nisi magnis malesuada. Inte-"
37.61,112.16,288.43,121.01,"/F8",9.96,"ger etiam velit mus elit diam. Nonummy lacus cras taciti"
37.61,100.21,288.43,109.05,"/F8",9.96,"ve etiam at ligula vehicula amet. Feugiat justo. Viverra"
37.61,88.25,288.43,97.10,"/F8",9.96,"nulla neque pede ipsum. Integer magna in primis. Feugiat"
306.60,748.78,557.43,757.62,"/F8",9.96,"massa ve a ante vitae elementum. Aliquet porta orci nunc"
306.60,736.82,337.04,745.67,"/F8",9.96,"auctor."
321.55,724.87,557.44,733.71,"/F8",9.96,"Aliquet morbi ante. Conubia dolor porta faucibus vel"
306.60,712.91,557.44,721.76,"/F8",9.96,"sodales diam pede rutrum. Vivamus risus ac lorem sagit-"
306.60,700.95,557.38,709.80,"/F8",9.96,"tis justo ve ultricies morbi porta netus elit ut. Aliquam"
306.60,689.00,557.40,697.85,"/F8",9.96,"risus netus mus adipiscing vestibulum ut habitasse donec"
306.60,677.04,557.42,685.89,"/F8",9.96,"bibendum. Blandit augue dolor nec viverra at duis odio."
306.60,665.09,557.41,673.94,"/F8",9.96,"Sodales risus. Blandit porta ut luctus massa pulvinar ve"
306.60,653.13,557.44,661.98,"/F8",9.96,"condimentum diam elementum vehicula. Vivamus augue"
306.60,641.18,557.47,650.02,"/F8",9.96,"risus est quam sem commodo ve eni ante urna at. Conu-"
306.60,629.22,557.42,638.07,"/F8",9.96,"bia porta parturient mi maecenas nam et primis a blandit."
306.60,617.27,557.39,626.11,"/F8",9.96,"Aliquet curae. Aliquam velit arcu aptent eu. Viverra curae"
306.60,605.31,557.39,614.16,"/F8",9.96,"mus eros habitant faucibus consectetuer parturient cubilia"
306.60,593.36,557.50,602.20,"/F8",9.96,"quam ad. Commodo justo purus commodo ac orci massa."
306.60,581.40,557.41,590.25,"/F8",9.96,"Vivamus purus proin tempor dolor ullamcorper facilisi cur-"
306.60,569.45,557.40,578.29,"/F8",9.96,"abitur duis odio etiam interdum. Cubilia morbi nisi sed"
306.60,557.49,557.42,566.34,"/F8",9.96,"enim. Vivamus proin gravida netus nunc primis orci nisl"
306.60,545.54,557.40,554.38,"/F8",9.96,"lacinia elementum. Egestas purus et fusce tellus ante tor-"
306.60,533.58,557.41,542.43,"/F8",9.96,"tor in dictum ad felis fringilla. Laoreet etiam orci montes"
306.60,521.63,557.40,530.47,"/F8",9.96,"euismod eros. Pretium lacus sit nibh placerat ullamcorper"
306.60,509.67,557.43,518.52,"/F8",9.96,"inceptos. Viverra felis eros massa malesuada nec torquent"
306.60,497.72,557.44,506.56,"/F8",9.96,"feugiat metus. Nonummy felis eget urna eros habitant a"
306.60,485.76,518.20,494.61,"/F8",9.96,"sollicitudin diam. Rhoncus purus cum lectus mi."
321.55,473.81,557.47,482.65,"/F8",9.96,"Integer dolor est amet ut urna tempus ac. Sodales"
306.60,461.85,557.43,470.70,"/F8",9.96,"metus. Natoque justo enim. Aliquam class nisl est cras"
306.60,449.90,557.45,458.74,"/F8",9.96,"erat. Commodo fusce curae lorem nullam id nostra phare-"
306.60,437.94,557.43,446.79,"/F8",9.96,"tra elit. Euismod donec ve platea dui enim nullam eu."
306.60,425.99,557.41,434.83,"/F8",9.96,"Pretium curae ante ullamcorper pretium. Cubilia lorem."
306.60,414.03,557.43,422.88,"/F8",9.96,"Egestas metus. Sodales purus. Quisque fames amet tin-"
306.60,402.08,557.38,410.92,"/F8",9.96,"cidunt suscipit taciti donec scelerisque diam eros. Viverra"
306.60,390.12,557.38,398.97,"/F8",9.96,"proin ut facilisis fusce ut curae pellentesque consequat auc-"
306.60,378.17,557.43,387.01,"/F8",9.96,"tor senectus hymenaeos etiam urna. Natoque risus at ante"
306.60,366.21,557.43,375.06,"/F8",9.96,"sodales ve varius neque. Natoque nulla odio ullamcorper"
306.60,354.25,557.44,363.10,"/F8",9.96,"viverra magna. Egestas justo. Posuere dolor. Dapibus"
306.60,342.30,557.42,351.15,"/F8",9.96,"proin nisl nunc cubilia diam. Feugiat justo ac a tempus."
306.60,330.34,557.43,339.19,"/F8",9.96,"Euismod nulla eget sit neque fermentum morbi a quam pu-"
306.60,318.39,557.40,327.24,"/F8",9.96,"rus ultricies. Aliquet donec dui etiam rhoncus. Vivamus"
306.60,306.43,557.40,315.28,"/F8",9.96,"fusce dolor laoreet venenatis urna purus suspendisse facil-"
306.60,294.48,557.40,303.32,"/F8",9.96,"isi elementum praesent ad condimentum quis elit. Lacinia"
306.60,282.52,332.90,291.37,"/F8",9.96,"porta."
306.60,252.64,557.49,261.48,"/F17",9.96,"2. Quisque donec morbi donec aptent id sit ele-"
321.24,240.68,365.61,249.53,"/F17",9.96,"mentum."
321.55,219.76,557.46,228.61,"/F8",9.96,"Quisque augue per odio a velit ve platea posuere ad"
306.60,207.80,557.42,216.65,"/F8",9.96,"suscipit egestas montes. Dapibus fames eu rutrum inte-"
306.60,195.85,557.44,204.69,"/F8",9.96,"ger. Iaculis augue. Conubia neque ve nisl metus. Inte-"
306.60,183.89,557.44,192.74,"/F8",9.96,"ger curae nulla. Rhoncus justo. Natoque lorem ad nisl."
306.60,171.94,557.38,180.78,"/F8",9.96,"Gravida nulla leo nisi id quis pede etiam taciti ridiculus"
306.60,159.98,557.43,168.83,"/F8",9.96,"neque. Iaculis lacus. Aliquam lorem. Feugiat metus et a"
306.60,148.03,557.41,156.87,"/F8",9.96,"aptent justo. Laoreet vitae. Feugiat fusce. Laoreet risus"
306.60,136.07,557.41,144.92,"/F8",9.96,"vestibulum eu venenatis sodales dis eu. Sodales proin odio"
306.60,124.12,557.39,132.96,"/F8",9.96,"potenti a condimentum sit nunc sollicitudin. Dapibus do-"
306.60,112.16,557.41,121.01,"/F8",9.96,"lor. Nonummy velit nisi class sem pede turpis fermentum"
306.60,100.21,557.42,109.05,"/F8",9.96,"blandit libero. Posuere lacus mi ve mattis donec condi-"
306.60,88.25,557.43,97.10,"/F8",9.96,"mentum nascetur. Lacinia nulla pede. Conubia felis arcu"
295.15,61.35,300.13,70.20,"/F8",9.96,"2"
