37.61,748.78,288.44,757.62,"/F8",9.96,"justo ut a ligula lacus. Aliquam metus sed diam penati-"
37.61,736.82,288.45,745.67,"/F8",9.96,"bus eu ve. Viverra magna metus platea in faucibus magnis"
37.61,724.87,203.47,733.71,"/F8",9.96,"nisl. Feugiat donec odio donec sapien."
52.56,712.91,288.46,721.76,"/F8",9.96,"Aliquam lacus in sociis. Nonummy neque id nibh fe-"
37.61,700.96,288.42,709.80,"/F8",9.96,"lis sodales nibh mi consectetuer feugiat placerat. Laoreet"
37.61,689.00,288.49,697.85,"/F8",9.96,"fames eu taciti ad quam ut magna consectetuer magna"
37.61,677.04,288.43,685.89,"/F8",9.96,"ac lorem ad morbi lacus sed class tristique pulvinar mau-"
37.61,665.09,288.40,673.94,"/F8",9.96,"ris parturient. Gravida velit pretium libero odio morbi"
37.61,653.13,288.42,661.98,"/F8",9.96,"pretium feugiat consectetuer fermentum purus mi netus"
37.61,641.18,288.45,650.03,"/F8",9.96,"ullamcorper quam semper rhoncus pede. Aliquam lorem."
37.61,629.22,288.43,638.07,"/F8",9.96,"Quisque fusce id duis etiam felis. Vivamus lorem pede"
37.61,617.27,288.45,626.11,"/F8",9.96,"aliquet in mus ad. Gravida donec euismod. Vivamus ip-"
37.61,605.31,288.46,614.16,"/F8",9.96,"sum vel massa vulputate fermentum ante hac auctor a."
37.61,593.36,288.45,602.20,"/F8",9.96,"Gravida proin ac magna dictumst fermentum ve eu amet."
37.61,581.40,288.45,590.25,"/F8",9.96,"Viverra massa etiam sociosqu lorem auctor pellentesque"
37.61,569.45,288.45,578.29,"/F8",9.96,"vivamus etiam adipiscing. Aliquam dolor euismod aenean"
37.61,557.49,288.42,566.34,"/F8",9.96,"dis primis risus class pharetra et. Aliquet fames hac lacus"
37.61,545.54,288.36,554.38,"/F8",9.96,"etiam est. Aliquet nulla orci mi risus tristique eleifend cur-"
37.61,533.58,288.37,542.43,"/F8",9.96,"sus lectus velit pretium taciti felis eu dignissim. Viverra"
37.61,521.63,288.41,530.47,"/F8",9.96,"donec adipiscing pede cursus tempor ultricies in. Euismod"
37.61,509.67,288.38,518.52,"/F8",9.96,"lorem purus turpis cubilia. Viverra risus duis luctus facil-"
37.61,497.72,288.38,506.56,"/F8",9.96,"isis parturient dui porta parturient viverra nisl. Vivamus"
37.61,485.76,288.46,494.61,"/F8",9.96,"augue ve. Nonummy justo arcu feugiat cras ante ad. Inte-"
37.61,473.81,288.44,482.65,"/F8",9.96,"ger vitae et. Posuere morbi urna nostra consequat laoreet"
37.61,461.85,288.40,470.70,"/F8",9.96,"nec vestibulum parturient ut. Dapibus curae adipiscing"
37.61,449.90,142.83,458.74,"/F8",9.96,"nisi ipsum ornare ligula."
37.61,427.48,177.31,436.33,"/F27",9.96,"4.2. Blandit neque sed urna leo."
52.56,414.03,288.43,422.88,"/F8",9.96,"Potenti class proin luctus scelerisque magna. Aliquam"
37.61,402.08,288.45,410.92,"/F8",9.96,"magna amet vulputate consectetuer hac malesuada sollic-"
37.61,390.12,288.43,398.97,"/F8",9.96,"itudin. Potenti donec ipsum ullamcorper erat arcu mau-"
37.61,378.17,288.45,387.01,"/F8",9.96,"ris. Nonummy proin ad curae vel. Posuere nulla morbi a"
37.61,366.21,288.44,375.06,"/F8",9.96,"congue odio tempor dignissim sapien. Feugiat lacus adip-"
37.61,354.26,288.38,363.10,"/F8",9.96,"iscing. Dapibus felis eu velit class hendrerit dignissim par-"
37.61,342.30,288.38,351.15,"/F8",9.96,"turient. Pretium nulla lacus aenean mollis sit elit eni. Cu-"
37.61,330.34,288.42,339.19,"/F8",9.96,"bilia vitae. Euismod velit ac dolor dictum malesuada class"
37.61,318.39,288.43,327.24,"/F8",9.96,"id. Gravida neque dis velit metus mauris litora. Non-"
37.61,306.43,288.45,315.28,"/F8",9.96,"ummy velit mus leo at iaculis nisi ve tempor maecenas"
37.61,294.48,288.45,303.33,"/F8",9.96,"porta lacus. Feugiat fames in augue ad tincidunt massa."
37.61,282.52,288.47,291.37,"/F8",9.96,"Commodo magna adipiscing eleifend posuere velit. Na-"
37.61,270.57,288.45,279.42,"/F8",9.96,"toque velit. Dapibus porta non pede donec mus arcu na-"
37.61,258.61,288.43,267.46,"/F8",9.96,"toque elit. Quisque nulla quam orci porta eget malesuada"
37.61,246.66,288.38,255.51,"/F8",9.96,"ve quis interdum pulvinar consectetuer parturient. Inte-"
37.61,234.70,288.43,243.55,"/F8",9.96,"ger etiam aliquet sem duis sodales facilisis arcu rhoncus"
37.61,222.75,288.42,231.60,"/F8",9.96,"venenatis. Feugiat curae vestibulum inceptos nonummy"
37.61,210.79,288.45,219.64,"/F8",9.96,"gravida eget augue dis. Dapibus fames nisi sociosqu et"
37.61,198.84,288.41,207.68,"/F8",9.96,"class dui sagittis. Blandit dolor. Viverra donec duis nibh"
37.61,186.88,169.96,195.73,"/F8",9.96,"netus justo non ante nisi arcu."
52.56,174.93,288.42,183.77,"/F8",9.96,"Dapibus magna blandit aptent nisl odio id pellentesque"
37.61,162.97,289.57,171.82,"/F8",9.96,"diam. Aliquam justo nulla lectus ligula imperdiet. Pretium"
37.61,151.02,288.42,159.86,"/F8",9.96,"netus nisi tempus hymenaeos ultrices tempor ante. Feu-"
37.61,139.06,288.38,147.91,"/F8",9.96,"giat vitae parturient scelerisque sapien et ultrices posuere"
37.61,127.11,288.45,135.95,"/F8",9.96,"dapibus odio rutrum. Integer justo porta class nonummy"
37.61,115.15,288.42,124.00,"/F8",9.96,"eget orci venenatis rutrum. Cubilia metus amet urna duis"
37.61,103.20,288.41,112.04,"/F8",9.96,"vestibulum. Laoreet class nulla. Aliquet donec proin sus-"
37.61,91.24,288.44,100.09,"/F8",9.96,"pendisse quam diam ante quisque ac aliquet eget egestas"
37.61,79.29,288.46,88.13,"/F8",9.96,"eu duis metus. Commodo etiam cras et dui suspendisse"
306.60,748.78,557.41,757.62,"/F8",9.96,"pretium nam praesent dignissim. Natoque neque vestibu-"
306.60,736.82,557.43,745.67,"/F8",9.96,"lum. Quisque fames quis nunc sed at. Egestas porta in"
306.60,724.87,557.40,733.71,"/F8",9.96,"magnis sociosqu velit curae sociis velit dis. Posuere felis"
306.60,712.91,557.39,721.76,"/F8",9.96,"at proin tellus pellentesque fermentum donec. Sodales vi-"
306.60,700.95,557.40,709.80,"/F8",9.96,"tae ac a elit adipiscing nisi. Iaculis fusce nibh. Aliquet"
306.60,689.00,557.44,697.85,"/F8",9.96,"curae eu. Iaculis risus. Euismod fames eros laoreet amet"
306.60,677.04,557.42,685.89,"/F8",9.96,"ve quam id fusce. Egestas fusce. Dapibus curae. Aliquet"
306.60,665.09,557.40,673.94,"/F8",9.96,"donec. Viverra fusce est pede justo ultricies senectus var-"
306.60,653.13,321.58,661.98,"/F8",9.96,"ius."
321.55,641.18,557.43,650.02,"/F8",9.96,"Posuere augue ut litora mi in tincidunt. Rhoncus me-"
306.60,629.22,557.42,638.07,"/F8",9.96,"tus id velit amet ipsum eros. Cubilia morbi arcu sodales"
306.60,617.27,557.36,626.11,"/F8",9.96,"tincidunt cras blandit et tellus. Quisque proin ve urna erat"
306.60,605.31,557.51,614.16,"/F8",9.96,"ad. Blandit magna vitae diam odio. Commodo massa"
306.60,593.36,557.43,602.20,"/F8",9.96,"fusce luctus habitant class a aliquam dictum. Conubia"
306.60,581.40,557.43,590.25,"/F8",9.96,"purus nunc mi curae porttitor. Posuere magna ac. Iaculis"
306.60,569.45,557.42,578.29,"/F8",9.96,"ipsum augue dis lacinia diam nisi diam curabitur luctus"
306.60,557.49,557.41,566.34,"/F8",9.96,"praesent convallis. Gravida justo curae turpis pharetra"
306.60,545.54,557.41,554.38,"/F8",9.96,"vitae. Posuere porta in proin eros integer ut litora nec."
306.60,533.58,557.43,542.43,"/F8",9.96,"Gravida class. Iaculis risus eu maecenas faucibus posuere"
306.60,521.63,557.45,530.47,"/F8",9.96,"odio cras eu dolor. Integer donec. Euismod netus nisi"
306.60,509.67,557.47,518.52,"/F8",9.96,"commodo diam a. Nonummy netus eu class in. Aliquet"
306.60,497.72,557.41,506.56,"/F8",9.96,"proin mi sociis porttitor ligula class semper. Viverra cu-"
306.60,485.76,557.37,494.61,"/F8",9.96,"rae leo parturient. Euismod velit ut fringilla convallis erat"
306.60,473.81,557.40,482.65,"/F8",9.96,"blandit. Cubilia ipsum urna libero pretium nibh morbi"
306.60,461.85,557.40,470.70,"/F8",9.96,"dapibus natoque potenti. Egestas lacus pede taciti volut-"
306.60,449.90,488.82,458.74,"/F8",9.96,"pat. Egestas morbi integer hac vulputate."
310.84,435.84,319.77,442.91,"/F19",7.97,"[1]"
324.75,435.84,557.56,442.91,"/F19",7.97,"T. Shifrin, Curvature integrals and Chern classes of singular"
324.76,426.37,370.63,433.45,"/F19",7.97,"varieties, in:"
375.85,426.37,557.55,433.45,"/F19",7.97,"Integral Geoemetry, Proceedings, Contemporary"
324.76,416.91,428.00,423.99,"/F19",7.97,"Mathematics, Vol. 63, 1984."
310.84,407.44,319.77,414.52,"/F19",7.97,"[2]"
324.75,407.44,557.55,414.52,"/F19",7.97,"D. Sullivan, Combinatorical invariants of analytic spaces, in:"
324.76,397.98,557.54,405.06,"/F19",7.97,"Proceedings of Liverpool Singularities, Lecture Notes in Math-"
324.76,388.51,408.98,395.59,"/F19",7.97,"ematics, no. 192, 1981."
310.84,379.05,319.77,386.13,"/F19",7.97,"[3]"
324.75,379.05,557.54,386.13,"/F19",7.97,"A. Parusinski, P. Pragacz, Characteristic classes of hypersur-"
324.76,369.58,531.48,376.66,"/F19",7.97,"faces and characteristic cycles, preprint (January 1998)."
310.84,360.12,319.77,367.20,"/F19",7.97,"[4]"
324.75,360.12,557.56,367.20,"/F19",7.97,"B. Totaro, Chern numbers for singular varieties and elliptic ho-"
324.76,350.66,423.28,357.73,"/F19",7.97,"mology, preprint? (1997?)."
310.84,341.19,319.77,348.27,"/F19",7.97,"[5]"
324.75,341.19,519.49,348.27,"/F19",7.97,"A. H. Durfee, Singularities, preprint (January 1998)."
310.84,331.73,319.77,338.80,"/F19",7.97,"[6]"
324.75,331.73,557.54,338.80,"/F19",7.97,"J.-L. Brylinski, (Co){Homologie d'intersection et faisceaux per-"
324.76,322.26,494.22,329.34,"/F19",7.97,"vers, Seminaire Bourbaki 585 (1982) 129{157."
310.84,312.80,319.77,319.88,"/F19",7.97,"[7]"
324.75,312.80,557.57,319.88,"/F19",7.97,"L. D. Trang, B. Teissier, Varietes polaires locales et classes de"
324.76,303.33,557.54,310.41,"/F19",7.97,"Chern des varietes singulieres, Ann. of Math. 114 (1981) 457{"
324.76,293.87,339.81,300.95,"/F19",7.97,"491."
310.84,284.40,319.77,291.48,"/F19",7.97,"[8]"
324.75,284.40,557.54,291.48,"/F19",7.97,"J.-P. Dax, Points singuliers normaux, points singuliers normaux"
324.76,274.94,557.57,282.02,"/F19",7.97,"simples et modeles d'elimination, C. R. Acad. Sci. Paris 315"
324.76,265.48,383.07,272.55,"/F19",7.97,"(1992) 315{319."
310.84,256.01,319.77,263.09,"/F19",7.97,"[9]"
324.75,256.01,557.54,263.09,"/F19",7.97,"P. Alu, Singular schemes of hypersurfaces, Duke Math. J. 80"
324.76,246.55,383.07,253.62,"/F19",7.97,"(1995) 325{351."
306.60,237.08,319.77,244.16,"/F19",7.97,"[10]"
324.75,237.08,333.74,244.16,"/F19",7.97,"G."
340.08,237.08,414.45,244.16,"/F19",7.97,"Gonzalez-Sprinberg,"
421.66,237.08,471.20,244.16,"/F19",7.97,"L'obstruction"
477.54,237.08,498.47,244.16,"/F19",7.97,"locale"
504.80,237.08,531.73,244.16,"/F19",7.97,"d'Euler"
538.06,237.08,545.12,244.16,"/F19",7.97,"et"
551.45,237.08,557.56,244.16,"/F19",7.97,"le"
324.76,227.62,534.50,234.70,"/F19",7.97,"theoreme de MacPherson, Asterisque 82{83 (1981) 7{32."
306.60,218.15,319.77,225.23,"/F19",7.97,"[11]"
324.75,218.15,341.66,225.23,"/F19",7.97,"J.-P."
349.61,218.15,385.33,225.23,"/F19",7.97,"Brasselet,"
394.55,218.15,403.54,225.23,"/F19",7.97,"G."
411.48,218.15,485.85,225.23,"/F19",7.97,"Gonzalez-Sprinberg,"
495.07,218.15,507.78,225.23,"/F19",7.97,"Sur"
515.72,218.15,557.57,225.23,"/F19",7.97,"l'homologie"
324.76,208.69,557.57,215.77,"/F19",7.97,"d'intersection et les classes de Chern des varietes singulieres"
324.76,199.22,557.55,206.30,"/F19",7.97,"(Espaces de Thom et contre-exemples de Verdier et Goresky),"
324.76,189.76,524.47,196.84,"/F19",7.97,"Geometrie Algebrique et Applications 23 (1987) 5{14."
306.60,180.29,319.77,187.37,"/F19",7.97,"[12]"
324.75,180.29,557.56,187.37,"/F19",7.97,"J.-P. Brasselet, M. H. Schwartz, Sur les classes de Chern d'un"
324.76,170.83,557.53,177.91,"/F19",7.97,"ensemble analytique complexe, Asterisque 82-83 (1981) 93{147."
306.60,161.37,319.77,168.44,"/F19",7.97,"[13]"
324.75,161.37,557.53,168.44,"/F19",7.97,"R. Langevin, Coubures au voisinage d'une singularite algebrique"
324.76,151.90,484.77,158.98,"/F19",7.97,"isolee, Asterisque 82-83 (1978{1979) 33{43."
306.60,142.44,319.77,149.51,"/F19",7.97,"[14]"
324.75,142.44,557.56,149.51,"/F19",7.97,"L. D. Trang, Limites d'espaces tangents et obstruction d'Euler"
324.76,132.97,510.03,140.05,"/F19",7.97,"des surfaces, Asterisque 82{83 (1978{1979) 45{69."
295.15,61.35,300.13,70.20,"/F8",9.96,"6"
