557.11,803.82,562.09,812.67,"/F8",9.96,"4"
54.00,777.92,298.82,786.77,"/F8",9.96,"dis rhoncus a suspendisse dis tempor ve tempus ultricies"
54.00,765.96,298.84,774.81,"/F8",9.96,"praesent tellus nullam. Aliquet massa in proin cursus"
54.00,754.01,298.85,762.86,"/F8",9.96,"fermentum. Rhoncus fusce. Pretium magna velit eget."
54.00,742.05,298.87,750.90,"/F8",9.96,"Cubilia dolor curae torquent arcu commodo fermentum"
54.00,730.10,241.08,738.95,"/F8",9.96,"turpis tincidunt mattis velit accumsan per."
54.00,694.82,298.90,702.78,"/F19",8.97,"Posuere velit porta tellus consectetuer ultricies lacus"
169.98,684.35,183.09,692.32,"/F19",8.97,"ve."
63.96,657.59,298.83,666.44,"/F8",9.96,"Quisque purus ut hendrerit. Quisque curae orci. In-"
54.00,645.64,298.84,654.48,"/F8",9.96,"teger morbi porta amet curabitur volutpat sapien ligula"
54.00,633.68,298.85,642.53,"/F8",9.96,"phasellus maecenas molestie feugiat praesent proin. Po-"
54.00,621.73,298.85,630.57,"/F8",9.96,"tenti fusce. Sodales dolor ve. Egestas risus amet. Vi-"
54.00,609.77,298.87,618.62,"/F8",9.96,"vamus donec at cursus nam pretium diam sagittis cras"
54.00,597.82,298.82,606.66,"/F8",9.96,"ligula risus tellus velit morbi. Feugiat dolor erat cu-"
54.00,585.86,298.84,594.71,"/F8",9.96,"bilia integer venenatis bibendum proin accumsan nisi"
54.00,573.91,298.85,582.75,"/F8",9.96,"non. Pretium vitae diam sodales ut penatibus porta id"
54.00,561.95,298.85,570.80,"/F8",9.96,"facilisis quis taciti. Laoreet ipsum etiam fames commodo"
54.00,550.00,298.83,558.84,"/F8",9.96,"vel sagittis a pellentesque odio. Viverra fames quisque"
54.00,538.04,298.84,546.89,"/F8",9.96,"primis ad ligula pellentesque commodo netus id ligula."
54.00,526.09,298.91,534.93,"/F8",9.96,"Commodo curae et lorem in urna. Rhoncus vitae ad"
54.00,514.13,298.84,522.98,"/F8",9.96,"consequat ipsum elit faucibus. Dapibus curae eros ele-"
54.00,502.18,298.86,511.02,"/F8",9.96,"mentum montes bibendum venenatis a. Posuere neque"
54.00,490.22,298.85,499.07,"/F8",9.96,"aliquam ipsum. Cubilia purus sit nunc hac cum. Conu-"
54.00,478.26,298.87,487.11,"/F8",9.96,"bia magna. Cubilia morbi sed cras nam leo pellentesque"
54.00,466.31,298.88,475.16,"/F8",9.96,"id. Nonummy augue gravida tempor sem tellus magnis."
54.00,454.35,298.86,463.20,"/F8",9.96,"Potenti nulla fusce erat egestas nisi massa aenean sapien"
54.00,442.40,298.88,451.25,"/F8",9.96,"purus consequat. Posuere magna amet ullamcorper con-"
54.00,430.44,269.51,439.29,"/F8",9.96,"sectetuer natoque odio. Nonummy vitae ve fusce."
63.96,418.05,298.83,426.89,"/F8",9.96,"Cubilia donec parturient viverra pede suscipit augue"
54.00,406.09,298.83,414.94,"/F8",9.96,"rhoncus risus. Integer dolor nibh praesent vestibulum"
54.00,394.14,298.83,402.98,"/F8",9.96,"magnis urna. Euismod velit sit mus integer nisl a. Inte-"
54.00,382.18,298.84,391.03,"/F8",9.96,"ger netus ut a tempor duis arcu tortor convallis. Viverra"
54.00,370.23,298.88,379.07,"/F8",9.96,"morbi ut magna nostra mauris cum. Egestas ipsum adip-"
54.00,358.27,155.08,367.12,"/F8",9.96,"iscing nisl tempus mi."
165.88,358.27,298.86,367.12,"/F8",9.96,"Potenti porta orci malesuada"
54.00,346.32,298.84,355.16,"/F8",9.96,"at dictum habitasse facilisi libero. Aliquam fames cu-"
54.00,334.36,298.78,343.21,"/F8",9.96,"bilia velit id mauris venenatis et hendrerit convallis risus"
54.00,322.41,298.83,331.25,"/F8",9.96,"imperdiet ve ultricies metus. Posuere lacus. Sodales"
54.00,310.45,298.84,319.30,"/F8",9.96,"fames orci quisque ve vehicula dictum diam dignissim"
54.00,298.50,298.83,307.34,"/F8",9.96,"ac. Quisque felis sit orci consectetuer mi. Lacinia curae"
54.00,286.54,298.87,295.39,"/F8",9.96,"laoreet. Posuere metus diam arcu lacinia a ligula amet"
54.00,274.59,298.83,283.43,"/F8",9.96,"dignissim phasellus. Sodales vitae id ac massa tincidunt"
54.00,262.63,298.82,271.48,"/F8",9.96,"ullamcorper. Blandit justo ut. Pretium curae lacus inte-"
54.00,250.68,298.85,259.52,"/F8",9.96,"ger quam ac consectetuer diam gravida nunc eni cubilia."
54.00,238.72,298.85,247.57,"/F8",9.96,"Blandit porta. Commodo fusce morbi felis habitant dolor"
54.00,226.77,298.86,235.61,"/F8",9.96,"nam quis. Gravida vitae. Posuere vitae. Nonummy do-"
54.00,214.81,298.85,223.66,"/F8",9.96,"lor eget consequat ornare. Sodales netus per netus dolor"
54.00,202.85,154.51,211.70,"/F8",9.96,"cum lacus posuere hac."
60.52,167.57,292.41,175.53,"/F19",8.97,"Aliquam netus orci etiam rhoncus natoque aptent"
168.51,157.11,184.56,165.07,"/F19",8.97,"vel."
63.96,130.35,298.87,139.20,"/F8",9.96,"Natoque justo mi purus in proin cursus morbi accum-"
54.00,118.39,298.86,127.24,"/F8",9.96,"san amet taciti. Dapibus magna erat inceptos est conu-"
317.01,777.92,561.86,786.77,"/F8",9.96,"bia ad erat nascetur. Laoreet lacus adipiscing nunc nulla"
317.01,765.96,561.86,774.81,"/F8",9.96,"torquent risus. Nonummy metus nisi sapien mi nam eros"
317.01,754.01,561.88,762.86,"/F8",9.96,"a. Conubia risus at quis elementum sociosqu enim mo-"
317.01,742.05,561.80,750.90,"/F8",9.96,"lestie sollicitudin ligula nulla eu phasellus a purus blandit"
317.01,730.10,561.85,738.95,"/F8",9.96,"elementum tellus facilisi. Egestas massa ante dui ante"
317.01,718.14,561.89,726.99,"/F8",9.96,"urna pede leo fusce nonummy nam. Iaculis lacus mi."
317.01,706.19,561.84,715.03,"/F8",9.96,"Natoque felis est aptent vivamus potenti. Iaculis morbi"
317.01,694.23,561.85,703.08,"/F8",9.96,"eni quam nibh parturient nibh ornare mattis non sapien"
317.01,682.28,561.86,691.12,"/F8",9.96,"montes dignissim massa. Cubilia ipsum parturient ve-"
317.01,670.32,561.90,679.17,"/F8",9.96,"hicula. Natoque fames urna molestie augue. Egestas"
317.01,658.37,561.84,667.21,"/F8",9.96,"fusce. Aliquam class duis libero ornare netus est dapibus"
317.01,646.41,561.89,655.26,"/F8",9.96,"pulvinar ut class. Nonummy magna fusce hymenaeos ele-"
317.01,634.46,561.87,643.30,"/F8",9.96,"mentum duis. Laoreet metus ante magna. Aliquet proin"
317.01,622.50,561.87,631.35,"/F8",9.96,"netus nec erat sem et a. Gravida class. Viverra netus"
317.01,610.55,561.84,619.39,"/F8",9.96,"adipiscing nascetur netus inceptos ac. Aliquet neque."
317.01,598.59,561.85,607.44,"/F8",9.96,"Lacinia nulla ad pellentesque viverra curae. Lacinia do-"
317.01,586.64,559.00,595.48,"/F8",9.96,"lor quis dictumst. Iaculis felis adipiscing arcu felis eget."
326.98,574.34,561.84,583.19,"/F8",9.96,"Feugiat velit. Viverra fusce diam. Cubilia ipsum quis"
317.01,562.38,561.86,571.23,"/F8",9.96,"natoque mus parturient in consectetuer dapibus mat-"
317.01,550.43,561.85,559.27,"/F8",9.96,"tis. Viverra velit lacus lectus congue euismod mauris."
317.01,538.47,561.84,547.32,"/F8",9.96,"Rhoncus augue curae leo nibh pellentesque integer ultri-"
317.01,526.52,561.87,535.36,"/F8",9.96,"ces mauris montes proin sociosqu at nunc ullamcorper in"
317.01,514.56,561.84,523.41,"/F8",9.96,"aptent. Gravida netus nisl quisque a sapien enim pel-"
317.01,502.61,561.83,511.45,"/F8",9.96,"lentesque vestibulum orci nullam sem libero a adipiscing"
317.01,490.65,561.87,499.50,"/F8",9.96,"cum magna natoque per. Sodales risus parturient ad var-"
317.01,478.70,561.90,487.54,"/F8",9.96,"ius. Blandit lorem. Commodo ipsum dolor commodo id"
317.01,466.74,561.84,475.59,"/F8",9.96,"sapien volutpat. Sodales ipsum. Potenti lacus. Posuere"
317.01,454.79,561.83,463.63,"/F8",9.96,"netus amet iaculis in curabitur a velit eu. Aliquet massa"
317.01,442.83,561.82,451.68,"/F8",9.96,"et ut orci ridiculus placerat praesent mi scelerisque nibh"
317.01,430.88,561.85,439.72,"/F8",9.96,"primis. Laoreet donec eni conubia et ultrices lacinia po-"
317.01,418.92,561.85,427.77,"/F8",9.96,"suere. Natoque porta blandit ve ante scelerisque. Conu-"
317.01,406.97,561.91,415.81,"/F8",9.96,"bia augue commodo nam. Gravida proin in platea con-"
317.01,395.01,561.84,403.86,"/F8",9.96,"sectetuer leo augue est consequat consectetuer vestibu-"
317.01,383.06,561.87,391.90,"/F8",9.96,"lum. Aliquam velit leo cum hac aliquet risus. Commodo"
317.01,371.10,561.85,379.95,"/F8",9.96,"donec ut aptent curabitur ut ipsum ve primis sociosqu"
317.01,359.15,561.86,367.99,"/F8",9.96,"suspendisse vel. Vivamus class metus platea nulla cum"
317.01,347.19,561.86,356.04,"/F8",9.96,"etiam porttitor proin varius. Nonummy donec neque nam"
317.01,335.24,561.90,344.08,"/F8",9.96,"neque varius dolor hac arcu sit. Commodo neque eros"
317.01,323.28,414.14,332.13,"/F8",9.96,"gravida odio pharetra."
395.11,288.52,483.93,296.48,"/F19",8.97,"CUBILIA NETUS."
326.98,261.85,561.83,270.70,"/F8",9.96,"Quisque risus orci sed nisi ad sollicitudin conubia ip-"
317.01,249.90,561.88,258.75,"/F8",9.96,"sum. Natoque lorem gravida rutrum vel primis eges-"
317.01,237.94,561.87,246.79,"/F8",9.96,"tas fermentum nostra adipiscing velit. Commodo etiam"
317.01,225.99,561.86,234.84,"/F8",9.96,"eget cum lectus. Lacinia metus urna per odio torquent."
317.01,214.03,561.82,222.88,"/F8",9.96,"Feugiat ipsum eu dictum hendrerit. Pretium neque nisl"
317.01,202.08,561.88,210.92,"/F8",9.96,"amet. Rhoncus augue magna orci vel amet. Potenti justo"
317.01,190.12,561.86,198.97,"/F8",9.96,"orci tempor. Euismod porta duis conubia pede ve erat fe-"
317.01,178.17,561.88,187.01,"/F8",9.96,"lis montes ullamcorper. Rhoncus massa lorem orci condi-"
317.01,166.21,561.83,175.06,"/F8",9.96,"mentum per. Viverra netus nunc ultricies mollis semper"
317.01,154.26,561.85,163.10,"/F8",9.96,"risus fames quisque ad nulla sed. Feugiat purus hac port-"
317.01,142.30,561.85,151.15,"/F8",9.96,"titor mattis montes lacus aliquet sem eget. Laoreet metus"
317.01,130.35,561.90,139.19,"/F8",9.96,"augue natoque nibh eros felis. Egestas magna conubia"
317.01,118.39,561.83,127.24,"/F8",9.96,"hendrerit pharetra varius platea lacinia enim urna elit"
