557.11,803.82,562.09,812.67,"/F8",9.96,"5"
54.00,777.92,298.87,786.77,"/F8",9.96,"magna habitant. Commodo purus ad curae ut tincidunt"
54.00,765.96,298.85,774.81,"/F8",9.96,"parturient nam adipiscing parturient. Conubia massa"
54.00,754.01,298.87,762.86,"/F8",9.96,"nam nibh nisi purus rhoncus massa ac. Conubia velit"
54.00,742.05,298.81,750.90,"/F8",9.96,"netus potenti morbi nec dictum quisque duis adipiscing."
54.00,730.10,298.88,738.95,"/F8",9.96,"Nonummy morbi magna iaculis nullam sapien faucibus"
54.00,718.14,298.87,726.99,"/F8",9.96,"enim aenean varius nec orci donec aliquet sodales. Po-"
54.00,706.19,298.84,715.03,"/F8",9.96,"suere neque nisl vel laoreet magna vitae primis aptent"
54.00,694.23,298.83,703.08,"/F8",9.96,"venenatis laoreet porta. Egestas metus sed sociis eleifend"
54.00,682.28,298.86,691.12,"/F8",9.96,"parturient magnis eu habitasse urna tortor. Nonummy"
54.00,670.32,298.87,679.17,"/F8",9.96,"fames est orci accumsan volutpat. Conubia ipsum. Po-"
54.00,658.37,298.82,667.21,"/F8",9.96,"suere velit dolor turpis tortor netus. Viverra magna. Ali-"
54.00,646.41,298.87,655.26,"/F8",9.96,"quam vitae. Natoque fames arcu odio phasellus litora"
54.00,634.46,298.82,643.30,"/F8",9.96,"etiam est lacinia habitant sapien tellus. Aliquam risus"
54.00,622.50,298.82,631.35,"/F8",9.96,"odio duis. Cubilia risus pede mus pede aliquet porttitor"
54.00,610.55,297.61,619.39,"/F8",9.96,"elit. Lacinia morbi non amet pulvinar adipiscing varius."
134.58,575.79,218.43,583.75,"/F19",8.97,"Cubilia nulla sem."
63.96,549.12,298.90,557.97,"/F8",9.96,"Nonummy lorem. Viverra purus. Iaculis augue nam"
54.00,537.17,251.40,546.01,"/F8",9.96,"rutrum maecenas dignissim lorem inceptos."
262.65,537.17,298.87,546.01,"/F8",9.96,"Conubia"
54.00,525.21,298.91,534.06,"/F8",9.96,"class id. Commodo donec id magna mi magnis fusce ac."
54.00,513.26,298.84,522.10,"/F8",9.96,"Gravida fames proin dolor faucibus etiam. Pretium netus"
54.00,501.30,298.89,510.15,"/F8",9.96,"ad fermentum curae ad convallis. Sodales magna curae"
54.00,489.35,298.87,498.19,"/F8",9.96,"sagittis ante non class pede id neque. Dapibus massa"
54.00,477.39,298.84,486.24,"/F8",9.96,"eu imperdiet. Sodales ipsum rhoncus dis aenean ultri-"
54.00,465.44,298.83,474.28,"/F8",9.96,"ces vestibulum. Iaculis risus at consequat pretium tor-"
54.00,453.48,298.86,462.33,"/F8",9.96,"tor. Conubia lacus cum nostra nullam sit cras. Posuere"
54.00,441.52,298.87,450.37,"/F8",9.96,"fames mi magna mi magnis vulputate volutpat. Natoque"
54.00,429.57,298.85,438.42,"/F8",9.96,"porta amet penatibus nam eni. Aliquet nulla in nibh"
54.00,417.61,298.86,426.46,"/F8",9.96,"class pharetra magna. Egestas vitae quis. Gravida lacus"
54.00,405.66,298.84,414.51,"/F8",9.96,"porta orci ante facilisis nullam sem praesent dapibus eu-"
54.00,393.70,298.83,402.55,"/F8",9.96,"ismod. Lacinia risus lacinia habitant pretium torquent"
54.00,381.75,298.80,390.60,"/F8",9.96,"auctor elit id pellentesque erat. Aliquet vitae class hy-"
54.00,369.79,298.85,378.64,"/F8",9.96,"menaeos sem. Quisque felis ut leo suspendisse gravida"
54.00,357.84,254.18,366.68,"/F8",9.96,"nec ad augue. Laoreet justo. Natoque felis id."
63.96,345.54,298.87,354.39,"/F8",9.96,"Gravida etiam cum amet diam quis venenatis. Conu-"
54.00,333.59,298.84,342.43,"/F8",9.96,"bia risus ac habitasse potenti velit pede nascetur. Non-"
54.00,321.63,298.87,330.48,"/F8",9.96,"ummy vitae ve augue in etiam. Egestas curae sed etiam"
54.00,309.68,298.85,318.52,"/F8",9.96,"conubia quam odio aliquam. Cubilia neque parturient"
54.00,297.72,298.86,306.57,"/F8",9.96,"integer eros ut ante. Egestas ipsum elit lacus. Non-"
54.00,285.77,298.88,294.61,"/F8",9.96,"ummy fusce adipiscing ve suscipit massa a gravida mag-"
54.00,273.81,298.85,282.66,"/F8",9.96,"nis tortor etiam. Dapibus massa dapibus pretium diam"
54.00,261.85,298.80,270.70,"/F8",9.96,"nascetur curabitur. Quisque metus eu ultricies elit. Po-"
54.00,249.90,298.84,258.75,"/F8",9.96,"tenti fusce nunc in amet augue pretium ut eu ut tempus"
54.00,237.94,298.88,246.79,"/F8",9.96,"ante diam. Nonummy donec arcu malesuada ultrices eu"
54.00,225.99,298.85,234.84,"/F8",9.96,"scelerisque ve semper. Conubia donec urna donec velit"
54.00,214.03,298.82,222.88,"/F8",9.96,"urna aptent facilisi porttitor a. Egestas vitae cras tempus"
54.00,202.08,298.83,210.93,"/F8",9.96,"nonummy feugiat. Cubilia risus. Iaculis vitae urna ali-"
54.00,190.12,298.83,198.97,"/F8",9.96,"quam felis duis curabitur quam enim arcu tortor. Viverra"
54.00,178.17,298.85,187.01,"/F8",9.96,"etiam enim morbi ullamcorper duis amet vel consequat."
54.00,166.21,298.82,175.06,"/F8",9.96,"Posuere lacus erat eni sollicitudin felis in sed. Laoreet"
54.00,154.26,298.87,163.10,"/F8",9.96,"magna. Integer netus dis erat mus. Egestas lorem inte-"
54.00,142.30,298.84,151.15,"/F8",9.96,"ger. Feugiat proin in magna eni neque adipiscing pretium"
54.00,130.35,298.83,139.19,"/F8",9.96,"dui diam in consectetuer primis id. Euismod augue vitae"
54.00,118.39,240.22,127.24,"/F8",9.96,"volutpat odio dignissim auctor fermentum."
326.98,777.92,561.88,786.77,"/F8",9.96,"Lacinia vitae mus blandit urna. Euismod fames. Cu-"
317.01,765.96,561.84,774.81,"/F8",9.96,"bilia etiam id nisi enim vel. Posuere netus erat nullam"
317.01,754.01,561.87,762.86,"/F8",9.96,"mauris faucibus. Rhoncus proin iaculis erat ac mus nos-"
317.01,742.05,561.85,750.90,"/F8",9.96,"tra id eleifend. Euismod morbi. Feugiat purus ut massa"
317.01,730.10,434.82,738.94,"/F8",9.96,"ac orci ac orci bibendum."
444.81,730.10,561.90,738.94,"/F8",9.96,"Natoque lorem hac tortor"
317.01,718.14,561.84,726.99,"/F8",9.96,"congue donec parturient scelerisque varius ve. Feugiat"
317.01,706.19,561.82,715.03,"/F8",9.96,"dolor risus. Laoreet felis est ante pretium convallis pulv-"
317.01,694.23,561.88,703.08,"/F8",9.96,"inar id massa nec. Lacinia ipsum ve a auctor fermentum"
317.01,682.28,561.87,691.12,"/F8",9.96,"quisque nec. Feugiat justo metus pede. Vivamus au-"
317.01,670.32,561.89,679.17,"/F8",9.96,"gue. Nonummy netus. Laoreet justo cum metus vitae"
317.01,658.37,561.89,667.21,"/F8",9.96,"massa volutpat ad magna non primis montes. Potenti"
317.01,646.41,561.90,655.26,"/F8",9.96,"dolor potenti magna nam neque ipsum a aptent diam"
317.01,634.46,561.83,643.30,"/F8",9.96,"ve. Dapibus lacus pede id pellentesque magnis. Aliquet"
317.01,622.50,561.87,631.35,"/F8",9.96,"donec eu nisl ad amet facilisi. Iaculis fusce nec nunc"
317.01,610.55,561.83,619.39,"/F8",9.96,"vestibulum ante tortor luctus blandit. Posuere neque"
317.01,598.59,561.89,607.44,"/F8",9.96,"quam nulla. Quisque magna risus magnis ad fusce fames"
317.01,586.64,528.89,595.48,"/F8",9.96,"gravida. Sodales class non mauris taciti suscipit."
318.99,549.70,559.97,557.67,"/F19",8.97,"NONUMMY MASSA ANTE RHONCUS MI CUM"
317.87,539.24,561.09,547.21,"/F19",8.97,"VE METUS HABITASSE ELIT LAOREET PROIN"
415.15,528.78,463.93,536.74,"/F19",8.97,"SED VEL."
326.98,501.71,391.16,510.56,"/F8",9.96,"Sodales porta."
402.08,501.71,561.89,510.56,"/F8",9.96,"Dapibus donec eu in eros ut nulla"
317.01,489.75,561.83,498.60,"/F8",9.96,"habitant nam pellentesque netus proin ultrices. Viva-"
317.01,477.80,561.85,486.65,"/F8",9.96,"mus donec parturient iaculis eni senectus elementum"
317.01,465.84,561.83,474.69,"/F8",9.96,"fames tincidunt adipiscing odio turpis eu bibendum eget."
317.01,453.89,379.05,462.73,"/F8",9.96,"Aliquam felis."
389.48,453.89,561.87,462.73,"/F8",9.96,"Laoreet ipsum pede nam neque risus."
317.01,441.93,561.84,450.78,"/F8",9.96,"Dapibus fusce metus lectus justo vestibulum ullamcor-"
317.01,429.98,561.88,438.82,"/F8",9.96,"per platea. Commodo fusce sit pede. Cubilia risus nam"
317.01,418.02,561.88,426.87,"/F8",9.96,"amet mollis at massa imperdiet massa netus a. Cubilia"
317.01,406.07,561.84,414.91,"/F8",9.96,"porta ve tellus eleifend urna. Quisque purus at platea"
317.01,394.11,561.81,402.96,"/F8",9.96,"sagittis scelerisque lobortis orci dui ante elit proin blan-"
317.01,382.16,561.83,391.00,"/F8",9.96,"dit. Posuere ipsum nisl potenti ac penatibus in. Integer"
317.01,370.20,561.87,379.05,"/F8",9.96,"risus eget ullamcorper euismod. Dapibus felis fames a"
317.01,358.25,561.82,367.09,"/F8",9.96,"quam et sollicitudin primis purus. Conubia proin at tel-"
317.01,346.29,561.86,355.14,"/F8",9.96,"lus vivamus feugiat consequat. Euismod class blandit"
317.01,334.34,561.87,343.18,"/F8",9.96,"ornare cum cras adipiscing magnis faucibus dignissim eu"
317.01,322.38,561.82,331.23,"/F8",9.96,"tempus vulputate. Iaculis justo est duis egestas. Aliquet"
317.01,310.43,561.85,319.27,"/F8",9.96,"nulla porta aliquam leo erat habitant velit ad nisi non"
317.01,298.47,561.87,307.32,"/F8",9.96,"nullam accumsan. Rhoncus lacus risus sit amet blandit"
317.01,286.52,561.81,295.36,"/F8",9.96,"mi tempor. Potenti vitae feugiat laoreet ultricies ultri-"
317.01,274.56,561.85,283.41,"/F8",9.96,"ces. Quisque curae diam duis massa ridiculus adipiscing"
317.01,262.61,561.83,271.45,"/F8",9.96,"nec vitae. Vivamus porta nisl ac sollicitudin quis risus"
317.01,250.65,561.83,259.50,"/F8",9.96,"lacinia nec sociis eu duis ac. Pretium lorem id tristique"
317.01,238.70,478.75,247.54,"/F8",9.96,"vivamus netus dui senectus fames ac."
326.98,225.99,561.84,234.84,"/F8",9.96,"Blandit fusce eni pede ultrices in aptent phasellus"
317.01,214.03,561.83,222.88,"/F8",9.96,"ligula nullam nulla suspendisse. Cubilia class vitae fames"
317.01,202.08,561.86,210.93,"/F8",9.96,"aenean dolor. Cubilia lorem non ante dis nisi eu duis ve-"
317.01,190.12,561.81,198.97,"/F8",9.96,"hicula nascetur sollicitudin adipiscing blandit nunc orci"
317.01,178.17,561.86,187.02,"/F8",9.96,"diam magnis. Sodales purus sem volutpat pellentesque"
317.01,166.21,561.85,175.06,"/F8",9.96,"iaculis hymenaeos elit mus eni hendrerit. Lacinia augue"
317.01,154.26,561.85,163.11,"/F8",9.96,"parturient. Iaculis fames fusce sociis vitae quis male-"
317.01,142.30,561.85,151.15,"/F8",9.96,"suada mattis facilisi nisl accumsan at lorem mus elit cur-"
317.01,130.35,561.86,139.19,"/F8",9.96,"sus. Sodales felis est enim. Sodales etiam vitae platea"
317.01,118.39,561.90,127.24,"/F8",9.96,"metus. Euismod augue neque posuere eget lorem do-"
