37.61,748.78,288.48,757.62,"/F8",9.96,"ger ut fusce primis. Commodo morbi at montes accumsan"
37.61,736.82,178.88,745.67,"/F8",9.96,"pulvinar. Lacinia risus vitae vel."
52.56,724.87,199.94,733.71,"/F8",9.96,"Euismod massa nunc cubilia ac."
210.58,724.87,288.48,733.71,"/F8",9.96,"Posuere neque in"
37.61,712.91,288.46,721.76,"/F8",9.96,"a platea ipsum dis donec malesuada facilisi nostra diam"
37.61,700.96,288.47,709.80,"/F8",9.96,"ad nulla malesuada placerat neque. Gravida massa eros"
37.61,689.00,288.43,697.85,"/F8",9.96,"gravida ut. Lacinia class. Aliquet augue. Viverra purus."
37.61,677.04,288.45,685.89,"/F8",9.96,"Posuere lorem cras integer ac curabitur. Integer donec"
37.61,665.09,288.46,673.94,"/F8",9.96,"id ut et nunc nisl fames dui. Commodo lorem. Euismod"
37.61,653.13,288.40,661.98,"/F8",9.96,"class et eu orci tortor feugiat. Quisque ipsum elit eros eget."
37.61,641.18,288.39,650.03,"/F8",9.96,"Feugiat curae vestibulum facilisi arcu blandit ac facilisis."
37.61,629.22,288.47,638.07,"/F8",9.96,"Commodo felis nisl nunc lacinia fusce. Commodo neque"
37.61,617.27,288.39,626.11,"/F8",9.96,"eget amet ve. Cubilia ipsum velit quis penatibus turpis."
37.61,605.31,288.42,614.16,"/F8",9.96,"Quisque lorem. Feugiat fames. Aliquam felis ante orci in-"
37.61,593.36,288.46,602.20,"/F8",9.96,"teger et. Natoque lacus et nullam maecenas elementum"
37.61,581.40,288.40,590.25,"/F8",9.96,"curae praesent class. Iaculis dolor nisi scelerisque quisque"
37.61,569.45,288.41,578.29,"/F8",9.96,"eni. Gravida class eget ac sollicitudin pellentesque. Com-"
37.61,557.49,120.45,566.34,"/F8",9.96,"modo curae massa."
37.61,533.58,288.50,542.43,"/F27",9.96,"1.2. Nonummy massa ante turpis conubia gravida male-"
59.00,521.63,102.50,530.47,"/F27",9.96,"suada dis."
52.56,506.68,288.45,515.53,"/F8",9.96,"Posuere velit dis primis. Conubia donec. Natoque au-"
37.61,494.73,288.42,503.57,"/F8",9.96,"gue. Aliquet felis id a duis. Integer dolor amet in elit"
37.61,482.77,288.44,491.62,"/F8",9.96,"neque penatibus eu magnis natoque rhoncus luctus. In-"
37.61,470.82,288.43,479.66,"/F8",9.96,"teger purus egestas elementum elit consectetuer auctor"
37.61,458.86,288.44,467.71,"/F8",9.96,"libero massa. Blandit proin. Nonummy fusce. Potenti"
37.61,446.91,288.45,455.75,"/F8",9.96,"dolor. Gravida porta massa lorem nunc per felis tempus"
37.61,434.95,288.39,443.80,"/F8",9.96,"sollicitudin natoque volutpat urna nisi sed. Vivamus netus"
37.61,423.00,288.44,431.84,"/F8",9.96,"ut platea sociosqu nibh dis eu a. Lacinia neque duis. So-"
37.61,411.04,288.44,419.89,"/F8",9.96,"dales ipsum eu ligula hac. Dapibus porta. Feugiat porta"
37.61,399.09,288.46,407.93,"/F8",9.96,"mus erat lorem ut class vehicula ante. Euismod dolor"
37.61,387.13,288.38,395.98,"/F8",9.96,"neque velit habitant. Aliquet ipsum vivamus cursus duis."
37.61,375.18,288.48,384.02,"/F8",9.96,"Quisque massa. Viverra augue magna consequat diam eu-"
37.61,363.22,288.42,372.07,"/F8",9.96,"ismod eu arcu. Sodales fusce vestibulum id pellentesque"
37.61,351.27,273.65,360.11,"/F8",9.96,"potenti auctor vel. Cubilia fames. Aliquet metus cras."
52.56,339.31,288.50,348.16,"/F8",9.96,"Blandit class integer ad. Commodo curae massa amet"
37.61,327.36,288.42,336.20,"/F8",9.96,"nonummy pretium fringilla montes faucibus suspendisse."
37.61,315.40,294.65,324.25,"/F8",9.96,"Conubia porta nisl ullamcorper pellentesque nonummy amet"
37.61,303.45,288.45,312.29,"/F8",9.96,"sociosqu nostra nunc posuere ut. Lacinia netus pede sem"
37.61,291.49,288.41,300.34,"/F8",9.96,"dolor porttitor imperdiet nunc donec metus dis. Viverra"
37.61,279.54,288.42,288.38,"/F8",9.96,"etiam blandit eu rhoncus nunc praesent id donec molestie"
37.61,267.58,288.40,276.43,"/F8",9.96,"parturient. Potenti etiam. Aliquet nulla eros leo neque"
37.61,255.62,288.43,264.47,"/F8",9.96,"quis duis fusce lectus malesuada morbi mi duis. Gravida"
37.61,243.67,288.47,252.52,"/F8",9.96,"ipsum arcu magna semper proin id. Euismod magna purus"
37.61,231.71,288.44,240.56,"/F8",9.96,"sem erat. Integer morbi. Nonummy dolor. Aliquet proin"
37.61,219.76,288.46,228.61,"/F8",9.96,"ante. Laoreet massa. Posuere porta augue elit eros felis"
37.61,207.80,288.46,216.65,"/F8",9.96,"malesuada per. Posuere augue ad. Euismod vitae felis"
37.61,195.85,288.40,204.70,"/F8",9.96,"bibendum metus a elit parturient rutrum. Viverra metus"
37.61,183.89,288.40,192.74,"/F8",9.96,"erat eu. Gravida vitae eget nisi interdum viverra tortor"
37.61,171.94,288.45,180.79,"/F8",9.96,"lacus mauris quam. Sodales lorem et. Pretium morbi ac"
37.61,159.98,288.41,168.83,"/F8",9.96,"vulputate ve ligula praesent eleifend donec consequat ul-"
37.61,148.03,288.40,156.88,"/F8",9.96,"lamcorper. Pretium purus in ultricies morbi integer. Po-"
37.61,136.07,118.70,144.92,"/F8",9.96,"tenti justo viverra."
37.61,112.16,272.29,121.01,"/F27",9.96,"1.3. Conubia fusce nisi mus lacinia ve diam pulvinar."
52.56,97.22,288.44,106.07,"/F8",9.96,"Posuere risus augue magnis fermentum turpis. Viverra"
37.61,85.26,288.45,94.11,"/F8",9.96,"porta et. Conubia augue dolor euismod ligula sit sodales"
306.60,748.78,438.29,757.62,"/F8",9.96,"praesent sollicitudin aliquam."
448.48,748.78,514.81,757.62,"/F8",9.96,"Aliquam vitae."
525.00,748.78,557.41,757.62,"/F8",9.96,"Sodales"
306.60,736.82,557.47,745.67,"/F8",9.96,"etiam sed justo magna condimentum mi magnis. Feu-"
306.60,724.87,557.41,733.71,"/F8",9.96,"giat lacus in penatibus lacus mi felis ad vulputate. Vi-"
306.60,712.91,557.43,721.76,"/F8",9.96,"vamus risus. Conubia risus quam posuere et turpis hac"
306.60,700.95,557.43,709.80,"/F8",9.96,"nibh at ligula. Euismod justo amet nunc netus cursus"
306.60,689.00,557.46,697.85,"/F8",9.96,"elit. Integer netus magna arcu vehicula commodo prae-"
306.60,677.04,557.41,685.89,"/F8",9.96,"sent metus id semper a parturient vel. Potenti lorem ac"
306.60,665.09,557.42,673.94,"/F8",9.96,"lorem. Gravida porta. Quisque risus ac fermentum augue"
306.60,653.13,557.43,661.98,"/F8",9.96,"at justo eni. Euismod felis odio senectus fames tempor."
306.60,641.18,557.41,650.03,"/F8",9.96,"Integer lorem augue lectus tincidunt augue fusce primis."
306.60,629.22,557.41,638.07,"/F8",9.96,"Dapibus ipsum. Feugiat vitae cras enim netus fusce neque"
306.60,617.27,557.45,626.11,"/F8",9.96,"odio hymenaeos sagittis. Natoque proin porta aliquam."
306.60,605.31,557.47,614.16,"/F8",9.96,"Commodo curae. Lacinia justo felis. Commodo morbi est"
306.60,593.36,557.45,602.20,"/F8",9.96,"sem gravida. Aliquam etiam et platea mus cras lorem eni"
306.60,581.40,390.69,590.25,"/F8",9.96,"tempus velit etiam."
321.55,569.45,557.45,578.29,"/F8",9.96,"Aliquet morbi et varius eu eget habitant nam con-"
306.60,557.49,557.42,566.34,"/F8",9.96,"sectetuer porta. Iaculis nulla eros nibh elementum nos-"
306.60,545.54,456.68,554.38,"/F8",9.96,"tra ultrices non rhoncus tempus."
467.33,545.54,557.44,554.38,"/F8",9.96,"Potenti massa amet"
306.60,533.58,557.40,542.43,"/F8",9.96,"per ipsum ante. Posuere porta pede aliquet imperdiet vel"
306.60,521.63,557.44,530.47,"/F8",9.96,"ante accumsan ullamcorper nam erat nec facilisi sodales."
306.60,509.67,557.45,518.52,"/F8",9.96,"Feugiat massa dolor fames dolor luctus proin. Aliquam"
306.60,497.72,557.40,506.56,"/F8",9.96,"etiam ad fusce libero aptent iaculis. Feugiat netus nibh"
306.60,485.76,557.43,494.61,"/F8",9.96,"nisl lacinia platea ipsum rhoncus ad curae semper. Ali-"
306.60,473.81,557.42,482.65,"/F8",9.96,"quet ipsum. Natoque nulla netus purus arcu ullamcorper"
306.60,461.85,557.44,470.70,"/F8",9.96,"eni diam penatibus ad magnis est eget quis sem. Egestas"
306.60,449.90,557.43,458.74,"/F8",9.96,"risus nam odio curae ultrices donec eros praesent class ut"
306.60,437.94,557.45,446.79,"/F8",9.96,"tempor elit. Nonummy fusce sed nam ad feugiat enim."
306.60,425.99,557.47,434.83,"/F8",9.96,"Commodo massa ve mi. Iaculis ipsum pede porta iaculis"
306.60,414.03,557.41,422.88,"/F8",9.96,"orci enim habitant. Feugiat vitae dolor feugiat mattis."
306.60,402.08,557.40,410.92,"/F8",9.96,"Lacinia proin arcu molestie cum nisi nisl viverra. Feugiat"
306.60,390.12,557.40,398.97,"/F8",9.96,"nulla at penatibus scelerisque hac turpis nam. Feugiat fe-"
306.60,378.17,557.37,387.01,"/F8",9.96,"lis parturient id porttitor arcu urna elit. Pretium curae."
306.60,366.21,557.45,375.06,"/F8",9.96,"Viverra dolor. Euismod magna eni molestie lacus ligula"
306.60,354.25,557.45,363.10,"/F8",9.96,"ad nisl. Lacinia etiam non nec nam dui per dapibus sed"
306.60,342.30,557.40,351.15,"/F8",9.96,"mauris. Quisque porta ac sociis molestie facilisis est dui"
306.60,330.34,495.12,339.19,"/F8",9.96,"consectetuer fusce ut tristique ullamcorper."
306.60,301.95,395.28,310.80,"/F17",9.96,"2. Gravida netus."
321.55,282.52,557.41,291.37,"/F8",9.96,"Cubilia proin vestibulum ad porttitor natoque lacus."
306.60,270.57,558.36,279.42,"/F8",9.96,"Sodales metus sit nostra varius neque dictum orci. Dapibus"
306.60,258.61,557.36,267.46,"/F8",9.96,"purus nisi diam adipiscing ut tristique nibh vel mi pellen-"
306.60,246.66,557.41,255.51,"/F8",9.96,"tesque mollis metus. Vivamus vitae purus enim id phasel-"
306.60,234.70,557.41,243.55,"/F8",9.96,"lus aliquet aenean litora sociosqu venenatis justo auctor"
306.60,222.75,557.40,231.59,"/F8",9.96,"pellentesque elementum luctus. Egestas metus ve ligula."
306.60,210.79,557.44,219.64,"/F8",9.96,"Lacinia risus cras quam lobortis metus eu. Commodo felis"
306.60,198.84,557.41,207.68,"/F8",9.96,"donec tellus vel cras. Euismod proin in proin ullamcorper"
306.60,186.88,557.45,195.73,"/F8",9.96,"pulvinar nisi dui. Conubia magna dolor massa leo facil-"
306.60,174.93,557.44,183.77,"/F8",9.96,"isi feugiat class enim id. Nonummy augue purus netus"
306.60,162.97,557.45,171.82,"/F8",9.96,"nisl gravida. Potenti magna nisl commodo aliquam platea"
306.60,151.02,557.39,159.86,"/F8",9.96,"aptent tincidunt purus id ligula arcu. Rhoncus netus vi-"
306.60,139.06,557.44,147.91,"/F8",9.96,"vamus. Commodo ipsum arcu integer mi ante scelerisque"
306.60,127.11,557.42,135.95,"/F8",9.96,"integer nam dictumst hymenaeos. Blandit proin enim in"
306.60,115.15,557.38,124.00,"/F8",9.96,"hendrerit lacus eleifend id dis platea accumsan nisl. Iaculis"
306.60,103.20,557.39,112.04,"/F8",9.96,"proin. Conubia netus enim proin felis lacinia litora id diam"
306.60,91.24,557.43,100.09,"/F8",9.96,"ac facilisis felis a nunc donec aenean etiam nullam. Conu-"
306.60,79.29,557.44,88.13,"/F8",9.96,"bia lacus. Viverra augue dis erat purus. Natoque porta ad"
295.15,61.35,300.13,70.20,"/F8",9.96,"2"
