557.11,803.82,562.09,812.67,"/F8",9.96,"3"
54.00,777.92,298.82,786.77,"/F8",9.96,"mi mattis facilisi. Euismod metus sed dapibus vehicula."
54.00,765.96,298.83,774.81,"/F8",9.96,"Blandit augue dis magna. Aliquet fusce felis curabitur."
54.00,754.01,298.86,762.86,"/F8",9.96,"Laoreet velit. Laoreet dolor. Laoreet neque urna laoreet"
54.00,742.05,298.82,750.90,"/F8",9.96,"purus netus volutpat massa est quis sollicitudin sodales"
54.00,730.10,298.87,738.95,"/F8",9.96,"placerat. Sodales massa. Posuere ipsum fusce eni diam"
54.00,718.14,298.83,726.99,"/F8",9.96,"lacus tellus. Pretium dolor. Lacinia neque nec amet dic-"
54.00,706.19,298.84,715.03,"/F8",9.96,"tumst suspendisse praesent imperdiet mi semper. So-"
54.00,694.23,298.87,703.08,"/F8",9.96,"dales magna quis primis commodo. Quisque donec risus"
54.00,682.28,298.89,691.12,"/F8",9.96,"sodales nec varius. Commodo massa. Feugiat fusce id"
54.00,670.32,298.85,679.17,"/F8",9.96,"amet at nisl morbi montes turpis fusce euismod primis"
54.00,658.37,298.83,667.21,"/F8",9.96,"et orci dis odio sollicitudin. Aliquam vitae ut nullam"
54.00,646.41,222.70,655.26,"/F8",9.96,"posuere duis molestie duis eni eros leo."
63.96,634.16,298.87,643.00,"/F8",9.96,"Euismod curae urna ullamcorper aliquet lacus id."
54.00,622.20,298.83,631.05,"/F8",9.96,"Conubia lorem. Blandit justo ve nulla congue parturient."
54.00,610.25,298.83,619.09,"/F8",9.96,"Lacinia fames et. Egestas felis. Potenti felis adipiscing"
54.00,598.29,298.87,607.14,"/F8",9.96,"suscipit. Dapibus lorem nibh. Nonummy massa eget."
54.00,586.34,298.83,595.18,"/F8",9.96,"Viverra purus dis elit consectetuer ve. Euismod donec."
54.00,574.38,298.85,583.23,"/F8",9.96,"Posuere ipsum nec. Aliquam neque urna quam. Aliquet"
54.00,562.43,298.84,571.27,"/F8",9.96,"ipsum nulla pharetra eni ad sapien senectus adipiscing"
54.00,550.47,168.87,559.32,"/F8",9.96,"hymenaeos urna aliquam."
179.16,550.47,298.87,559.32,"/F8",9.96,"Dapibus proin amet ligula"
54.00,538.52,298.84,547.36,"/F8",9.96,"sagittis egestas justo ac fusce id quis. Gravida nulla."
54.00,526.56,298.84,535.41,"/F8",9.96,"Aliquam etiam elit placerat convallis. Laoreet ipsum hac"
54.00,514.60,298.86,523.45,"/F8",9.96,"odio vestibulum aptent eu euismod quam. Euismod fe-"
54.00,502.65,298.84,511.50,"/F8",9.96,"lis amet turpis eni suscipit venenatis fusce. Commodo"
54.00,490.69,298.88,499.54,"/F8",9.96,"fusce. Natoque fames morbi a eget morbi massa sit duis"
54.00,478.74,298.84,487.59,"/F8",9.96,"ve. Viverra morbi pede praesent potenti quisque. Com-"
54.00,466.78,238.05,475.63,"/F8",9.96,"modo netus est fermentum quis non nulla."
142.81,432.24,210.24,440.20,"/F19",8.97,"Viverra etiam."
63.96,405.62,298.82,414.46,"/F8",9.96,"Blandit nulla egestas tellus vel faucibus integer posuere"
54.00,393.66,298.83,402.51,"/F8",9.96,"amet interdum a sollicitudin ante. Potenti fames gravida"
54.00,381.71,298.83,390.55,"/F8",9.96,"nec pede porta cras. Posuere purus vestibulum ultrices"
54.00,369.75,298.82,378.60,"/F8",9.96,"porta pellentesque bibendum. Quisque felis. Laoreet do-"
54.00,357.80,298.86,366.64,"/F8",9.96,"lor. Lacinia ipsum amet nulla phasellus. Rhoncus dolor"
54.00,345.84,298.83,354.69,"/F8",9.96,"est platea id. Conubia netus id nulla phasellus blandit"
54.00,333.89,298.83,342.73,"/F8",9.96,"dui mi duis quis odio. Rhoncus etiam elit dictumst male-"
54.00,321.93,298.87,330.78,"/F8",9.96,"suada id curae dis donec sit quam. Iaculis netus eget"
54.00,309.98,298.89,318.82,"/F8",9.96,"proin luctus id orci per nonummy ad maecenas. Com-"
54.00,298.02,298.88,306.87,"/F8",9.96,"modo magna eu nunc dolor imperdiet cras. Sodales proin"
54.00,286.07,298.83,294.91,"/F8",9.96,"non nulla aptent risus condimentum dictumst. Gravida"
54.00,274.11,298.84,282.96,"/F8",9.96,"netus. Quisque class cum eros nec fermentum justo vitae"
54.00,262.16,298.82,271.00,"/F8",9.96,"rutrum augue posuere aliquet interdum tellus. Gravida"
54.00,250.20,298.81,259.05,"/F8",9.96,"fames. Potenti proin erat sagittis cum quisque porta velit"
54.00,238.25,298.82,247.09,"/F8",9.96,"hac inceptos lorem sollicitudin. Sodales augue quis tellus"
54.00,226.29,298.88,235.14,"/F8",9.96,"est sed. Pretium lorem amet a quis porta fames tor-"
54.00,214.34,298.82,223.18,"/F8",9.96,"tor parturient. Pretium augue nisl gravida a scelerisque"
54.00,202.38,298.85,211.23,"/F8",9.96,"eni ante congue litora duis ullamcorper ad sapien sodales"
54.00,190.43,298.83,199.27,"/F8",9.96,"aliquam cursus. Euismod velit nisi faucibus etiam cur-"
54.00,178.47,298.81,187.32,"/F8",9.96,"abitur suspendisse convallis. Conubia felis orci nulla duis"
54.00,166.51,243.47,175.36,"/F8",9.96,"phasellus ornare. Blandit dolor nisl feugiat."
63.96,154.26,298.83,163.10,"/F8",9.96,"Potenti morbi parturient molestie egestas auctor eu est"
54.00,142.30,298.85,151.15,"/F8",9.96,"vulputate. Blandit curae. Conubia class. Egestas ip-"
54.00,130.35,298.86,139.19,"/F8",9.96,"sum dolor tempor curae laoreet. Cubilia donec et. Blan-"
54.00,118.39,298.85,127.24,"/F8",9.96,"dit risus urna sem eget. Posuere risus. Vivamus morbi"
317.01,777.92,561.80,786.77,"/F8",9.96,"at dictum purus scelerisque quis hendrerit id imperdiet"
317.01,765.96,561.84,774.81,"/F8",9.96,"ridiculus. Integer netus. Potenti risus ve a amet adip-"
317.01,754.01,561.86,762.86,"/F8",9.96,"iscing diam justo. Conubia etiam. Dapibus metus nulla"
317.01,742.05,561.89,750.90,"/F8",9.96,"tempus magna id a eros mi. Aliquet nulla justo con-"
317.01,730.10,561.87,738.94,"/F8",9.96,"sequat blandit. Aliquet massa ut donec non. Rhoncus"
317.01,718.14,561.85,726.99,"/F8",9.96,"porta odio leo eros ipsum. Pretium velit vitae nibh nam"
317.01,706.19,561.82,715.03,"/F8",9.96,"sed dapibus. Cubilia velit amet eleifend quam porttitor"
317.01,694.23,561.86,703.08,"/F8",9.96,"habitasse magna nunc sit fusce. Aliquet curae morbi nec"
317.01,682.28,561.89,691.12,"/F8",9.96,"nunc ad accumsan. Lacinia metus justo nec porta. Eu-"
317.01,670.32,561.86,679.17,"/F8",9.96,"ismod justo ac nunc netus laoreet feugiat convallis nec"
317.01,658.37,561.83,667.21,"/F8",9.96,"pellentesque cursus ad. Feugiat risus odio integer mi ul-"
317.01,646.41,561.82,655.26,"/F8",9.96,"trices. Lacinia velit id semper ut iaculis nisi ut arcu ve"
317.01,634.46,378.75,643.30,"/F8",9.96,"urna euismod."
405.05,591.01,474.00,598.98,"/F19",8.97,"Quisque porta."
326.98,562.71,561.88,571.56,"/F8",9.96,"Viverra proin nonummy nibh orci lobortis sociis"
317.01,550.76,561.83,559.60,"/F8",9.96,"vestibulum pellentesque natoque suscipit aenean montes"
317.01,538.80,561.86,547.65,"/F8",9.96,"est posuere volutpat erat. Conubia neque. Lacinia fames"
317.01,526.85,561.81,535.69,"/F8",9.96,"donec. Integer etiam vestibulum id sollicitudin quisque"
317.01,514.89,414.70,523.74,"/F8",9.96,"auctor orci in ipsum."
426.02,514.89,493.27,523.74,"/F8",9.96,"Rhoncus lacus."
504.60,514.89,561.88,523.74,"/F8",9.96,"Egestas velit"
317.01,502.94,561.90,511.78,"/F8",9.96,"commodo ac. Nonummy netus est. Dapibus porta ali-"
317.01,490.98,561.88,499.83,"/F8",9.96,"quet ante orci quam rhoncus curae id sapien etiam et"
317.01,479.03,561.90,487.87,"/F8",9.96,"urna ornare sociosqu. Commodo justo erat. Gravida"
317.01,467.07,561.86,475.92,"/F8",9.96,"lorem lacinia. Posuere ipsum. Natoque felis. Euismod"
317.01,455.12,561.83,463.96,"/F8",9.96,"velit sed blandit. Potenti justo cum mattis quisque ac"
317.01,443.16,561.88,452.01,"/F8",9.96,"hac. Sodales morbi vel sociosqu porta per duis enim"
317.01,431.21,561.89,440.05,"/F8",9.96,"primis. Commodo porta vestibulum ve hymenaeos cu-"
317.01,419.25,561.86,428.10,"/F8",9.96,"rae mi. Gravida nulla. Potenti etiam. Lacinia morbi."
317.01,407.30,561.82,416.14,"/F8",9.96,"Pretium morbi parturient dictumst nibh posuere nullam"
317.01,395.34,561.85,404.19,"/F8",9.96,"cras velit proin cum ante. Natoque donec duis suscipit"
317.01,383.39,561.82,392.23,"/F8",9.96,"sagittis proin et dictum. Blandit felis adipiscing gravida"
317.01,371.43,469.29,380.28,"/F8",9.96,"nisl duis hymenaeos cum dictumst."
326.98,357.50,561.84,366.34,"/F8",9.96,"Iaculis purus vestibulum sagittis dapibus diam a fusce."
317.01,345.54,561.85,354.39,"/F8",9.96,"Conubia purus eu mattis proin lacinia aliquam ridicu-"
317.01,333.59,561.82,342.43,"/F8",9.96,"lus lectus. Feugiat class adipiscing placerat potenti erat"
317.01,321.63,561.87,330.48,"/F8",9.96,"quis ipsum mus ligula. Egestas class nonummy ve vene-"
317.01,309.68,561.81,318.52,"/F8",9.96,"natis vestibulum vel fusce leo tristique mauris vulputate"
317.01,297.72,561.82,306.57,"/F8",9.96,"mi. Pretium risus cubilia varius. Cubilia neque posuere"
317.01,285.76,561.82,294.61,"/F8",9.96,"consequat rutrum molestie ut velit ridiculus praesent ad."
317.01,273.81,561.87,282.66,"/F8",9.96,"Laoreet etiam amet mus duis consectetuer at fusce in."
317.01,261.85,561.86,270.70,"/F8",9.96,"Lacinia felis ve ligula ut mi fames dictumst. Aliquam"
317.01,249.90,561.85,258.75,"/F8",9.96,"neque etiam orci in. Cubilia metus orci. Laoreet risus."
317.01,237.94,561.91,246.79,"/F8",9.96,"Cubilia vitae donec auctor ad. Nonummy augue nam"
317.01,225.99,561.89,234.84,"/F8",9.96,"nunc a cras eu consectetuer. Posuere magna proin pu-"
317.01,214.03,561.81,222.88,"/F8",9.96,"rus torquent ridiculus porta cubilia metus in consectetuer"
317.01,202.08,561.91,210.93,"/F8",9.96,"nullam neque accumsan. Commodo neque. Posuere me-"
317.01,190.12,561.88,198.97,"/F8",9.96,"tus. Natoque felis. Rhoncus ipsum ac a nisi purus po-"
317.01,178.17,561.83,187.01,"/F8",9.96,"tenti litora ipsum sociis eni natoque eros. Pretium porta"
317.01,166.21,561.81,175.06,"/F8",9.96,"adipiscing elit rutrum ve litora consectetuer mus velit hy-"
317.01,154.26,561.88,163.10,"/F8",9.96,"menaeos. Viverra class. Gravida morbi odio eu pellen-"
317.01,142.30,561.86,151.15,"/F8",9.96,"tesque ligula congue proin ut donec magnis consectetuer"
317.01,130.35,561.84,139.19,"/F8",9.96,"aliquam faucibus sapien nullam dis. Gravida velit par-"
317.01,118.39,419.72,127.24,"/F8",9.96,"turient nascetur iaculis."
