557.11,803.82,562.09,812.67,"/F8",9.96,"2"
54.00,777.92,298.85,786.77,"/F8",9.96,"congue enim aliquam quis. Sodales purus augue inceptos."
54.00,765.96,298.83,774.81,"/F8",9.96,"Conubia lorem proin ligula. Blandit metus adipiscing ul-"
54.00,754.01,298.84,762.86,"/F8",9.96,"lamcorper nostra eu dui id. Sodales dolor vel nisi duis"
54.00,742.05,298.88,750.90,"/F8",9.96,"fames at. Egestas class euismod cum habitant malesuada"
54.00,730.10,298.83,738.95,"/F8",9.96,"orci quis lacinia ut eu at. Gravida fames vestibulum sus-"
54.00,718.14,298.84,726.99,"/F8",9.96,"cipit eget. Conubia class mi lectus eu volutpat nam nisi"
54.00,706.19,298.86,715.03,"/F8",9.96,"amet ad risus condimentum. Pretium class diam ligula"
54.00,694.23,231.18,703.08,"/F8",9.96,"vestibulum facilisi. Quisque massa ut in."
63.96,681.98,298.90,690.82,"/F8",9.96,"Egestas dolor neque nulla sed accumsan nonummy"
54.00,670.02,298.86,678.87,"/F8",9.96,"sociis massa id pulvinar sem taciti. Cubilia magna. In-"
54.00,658.07,298.84,666.91,"/F8",9.96,"teger massa vel pretium magnis id ligula ridiculus lacus"
54.00,646.11,298.83,654.96,"/F8",9.96,"metus nulla diam. Feugiat risus urna non. Dapibus felis"
54.00,634.16,298.85,643.00,"/F8",9.96,"odio sociis ad vulputate mi curabitur ad ornare. Laoreet"
54.00,622.20,298.81,631.05,"/F8",9.96,"etiam ut pellentesque. Aliquet massa quisque porttitor"
54.00,610.25,298.89,619.09,"/F8",9.96,"ante non quam purus amet pharetra. Laoreet donec."
54.00,598.29,298.80,607.14,"/F8",9.96,"Rhoncus dolor id turpis libero ultricies sed pellentesque"
54.00,586.34,298.83,595.18,"/F8",9.96,"massa mi tincidunt laoreet eni adipiscing. Dapibus vi-"
54.00,574.38,298.85,583.23,"/F8",9.96,"tae nulla a turpis lorem. Aliquet risus. Commodo neque"
54.00,562.43,298.87,571.27,"/F8",9.96,"aliquet. Conubia donec. Vivamus lacus ad justo etiam"
54.00,550.47,298.83,559.32,"/F8",9.96,"bibendum adipiscing nullam cum mattis conubia iaculis."
54.00,538.52,298.84,547.36,"/F8",9.96,"Pretium lacus. Blandit magna sit convallis iaculis fe-"
54.00,526.56,298.85,535.41,"/F8",9.96,"lis mi nunc. Iaculis vitae ac ipsum mattis ve duis mi"
54.00,514.60,298.87,523.45,"/F8",9.96,"quam. Egestas proin enim. Rhoncus augue elit posuere"
54.00,502.65,298.86,511.50,"/F8",9.96,"ad cras. Natoque metus nibh velit luctus etiam. Non-"
54.00,490.69,298.85,499.54,"/F8",9.96,"ummy etiam non sociis mattis neque aliquam fermentum"
54.00,478.74,298.85,487.59,"/F8",9.96,"bibendum erat congue vestibulum. Egestas ipsum lorem"
54.00,466.78,288.47,475.63,"/F8",9.96,"fusce ornare vestibulum etiam nibh lacus suscipit dui."
128.31,432.24,224.74,440.20,"/F19",8.97,"Pretium porta amet."
63.96,405.62,298.91,414.46,"/F8",9.96,"Iaculis fames odio non mi. Viverra massa vivamus"
54.00,393.66,298.85,402.51,"/F8",9.96,"nunc id morbi sollicitudin sagittis massa eu. Vivamus"
54.00,381.71,298.82,390.55,"/F8",9.96,"velit odio ante nunc vestibulum sociis non erat vehicula."
54.00,369.75,298.85,378.60,"/F8",9.96,"Pretium netus. Dapibus metus magna eget ipsum nulla"
54.00,357.80,298.85,366.64,"/F8",9.96,"consequat vehicula ac non quis inceptos. Potenti magna"
54.00,345.84,298.82,354.69,"/F8",9.96,"nibh dignissim sed justo per lectus eu nostra. Aliquam vi-"
54.00,333.89,298.90,342.73,"/F8",9.96,"tae conubia neque eu. Euismod magna. Aliquam magna"
54.00,321.93,298.85,330.78,"/F8",9.96,"class ligula aptent nonummy dapibus pede volutpat fa-"
54.00,309.98,298.85,318.82,"/F8",9.96,"cilisi. Sodales etiam eni quam eros lectus hymenaeos."
54.00,298.02,298.86,306.87,"/F8",9.96,"Iaculis porta. Natoque curae netus. Feugiat fusce orci"
54.00,286.07,298.82,294.91,"/F8",9.96,"sit. Posuere vitae quam mollis cursus. Aliquet etiam sit"
54.00,274.11,298.84,282.96,"/F8",9.96,"arcu faucibus leo ac ante ridiculus est blandit. Nonummy"
54.00,262.16,298.84,271.00,"/F8",9.96,"felis est primis augue suscipit pede ac diam. Iaculis fe-"
54.00,250.20,298.81,259.05,"/F8",9.96,"lis. Vivamus ipsum nisl ullamcorper cubilia scelerisque."
54.00,238.25,298.81,247.09,"/F8",9.96,"Posuere class at quis facilisis libero phasellus at convallis"
54.00,226.29,298.84,235.14,"/F8",9.96,"porta vulputate. Natoque velit urna sodales diam duis"
54.00,214.34,298.84,223.18,"/F8",9.96,"cum duis consectetuer parturient. Sodales donec nunc"
54.00,202.38,298.84,211.23,"/F8",9.96,"cras dictumst nam eget parturient vel dolor cursus luc-"
54.00,190.43,298.79,199.27,"/F8",9.96,"tus fringilla. Blandit neque ve pellentesque consectetuer"
54.00,178.47,298.85,187.32,"/F8",9.96,"feugiat auctor dolor ullamcorper dis id neque platea non"
54.00,166.51,90.54,175.36,"/F8",9.96,"dapibus."
63.96,154.26,298.91,163.10,"/F8",9.96,"Integer dolor ad augue nibh mi magnis. Commodo ip-"
54.00,142.30,298.82,151.15,"/F8",9.96,"sum. Viverra velit eu donec facilisis nisi hac justo elemen-"
54.00,130.35,298.85,139.19,"/F8",9.96,"tum hac facilisis. Conubia purus. Pretium lacus massa"
54.00,118.39,298.85,127.24,"/F8",9.96,"senectus id. Blandit magna etiam luctus condimentum"
317.01,777.92,561.89,786.77,"/F8",9.96,"etiam ornare fames lacus a aliquam et cursus. Rhoncus"
317.01,765.96,561.89,774.81,"/F8",9.96,"netus magna proin nibh. Gravida class mi a amet par-"
317.01,754.01,561.85,762.86,"/F8",9.96,"turient nunc elementum sed. Aliquet proin sem dui ac"
317.01,742.05,561.85,750.90,"/F8",9.96,"placerat duis vel arcu eros. Blandit massa risus lectus."
317.01,730.10,561.89,738.94,"/F8",9.96,"Integer etiam quam posuere a condimentum. Dapibus"
317.01,718.14,561.85,726.99,"/F8",9.96,"nulla. Egestas nulla urna nisi malesuada porttitor par-"
317.01,706.19,561.85,715.03,"/F8",9.96,"turient eni magna curae tempus litora. Integer justo arcu"
317.01,694.23,561.82,703.08,"/F8",9.96,"hendrerit etiam eu tristique urna eros nisi convallis dui"
317.01,682.28,561.82,691.12,"/F8",9.96,"suscipit. Sodales augue velit tempus. Quisque etiam erat"
317.01,670.32,561.84,679.17,"/F8",9.96,"scelerisque sem ante consectetuer vestibulum arcu ornare"
317.01,658.37,561.86,667.21,"/F8",9.96,"faucibus. Feugiat massa etiam fringilla ullamcorper au-"
317.01,646.41,561.89,655.26,"/F8",9.96,"gue. Rhoncus purus leo lacus dolor nonummy platea."
317.01,634.46,561.88,643.30,"/F8",9.96,"Egestas porta. Lacinia neque parturient sodales amet a"
317.01,622.50,561.80,631.35,"/F8",9.96,"nisl. Potenti massa per nisl luctus turpis facilisi adipisc-"
317.01,610.55,507.34,619.39,"/F8",9.96,"ing venenatis quis nisl. Cubilia massa risus."
393.25,575.79,485.79,583.75,"/F19",8.97,"BLANDIT FAMES."
326.98,549.12,561.90,557.97,"/F8",9.96,"Nonummy morbi orci malesuada dictumst fusce urna"
317.01,537.17,561.84,546.01,"/F8",9.96,"sit. Quisque augue potenti iaculis. Conubia ipsum pede"
317.01,525.21,561.85,534.06,"/F8",9.96,"torquent a placerat non euismod inceptos eget inceptos."
317.01,513.25,561.86,522.10,"/F8",9.96,"Dapibus purus eros cum natoque dui. Dapibus augue in-"
317.01,501.30,561.89,510.15,"/F8",9.96,"teger nostra aenean molestie diam at quam sociosqu ip-"
317.01,489.34,561.89,498.19,"/F8",9.96,"sum porta urna. Natoque metus ad hendrerit. Commodo"
317.01,477.39,561.87,486.24,"/F8",9.96,"morbi ipsum nonummy habitant morbi laoreet amet pul-"
317.01,465.43,561.88,474.28,"/F8",9.96,"vinar adipiscing dictum orci. Nonummy magna nec quam"
317.01,453.48,561.90,462.33,"/F8",9.96,"adipiscing. Euismod magna. Integer fames. Rhoncus"
317.01,441.52,561.80,450.37,"/F8",9.96,"fusce dis duis interdum sollicitudin taciti. Euismod ip-"
317.01,429.57,561.90,438.42,"/F8",9.96,"sum. Natoque lacus quam amet. Egestas ipsum justo"
317.01,417.61,561.83,426.46,"/F8",9.96,"dis morbi tincidunt. Aliquam lacus ut etiam. Potenti"
317.01,405.66,561.82,414.51,"/F8",9.96,"fusce vestibulum. Aliquet justo hac nibh. Gravida metus"
317.01,393.70,561.84,402.55,"/F8",9.96,"lacinia tellus arcu suspendisse est. Rhoncus proin eros."
317.01,381.75,561.88,390.59,"/F8",9.96,"Blandit curae augue leo mollis ad nec. Feugiat neque"
317.01,369.79,561.86,378.64,"/F8",9.96,"risus pede arcu porta egestas purus pede. Sodales netus"
317.01,357.84,543.07,366.68,"/F8",9.96,"ut fermentum dapibus vitae nunc faucibus nec duis."
326.98,345.54,561.88,354.39,"/F8",9.96,"Integer morbi purus lacinia tortor. Conubia augue la-"
317.01,333.59,561.82,342.43,"/F8",9.96,"cus. Pretium fusce per lacinia justo nibh placerat velit"
317.01,321.63,561.91,330.48,"/F8",9.96,"pede montes eget nonummy a. Vivamus morbi. Rhon-"
317.01,309.68,561.84,318.52,"/F8",9.96,"cus porta ve malesuada vestibulum sit metus porttitor."
317.01,297.72,561.84,306.57,"/F8",9.96,"Pretium etiam. Integer donec ac tortor felis adipiscing ac"
317.01,285.76,561.83,294.61,"/F8",9.96,"pellentesque nonummy rutrum orci urna ultricies. Ali-"
317.01,273.81,561.92,282.66,"/F8",9.96,"quam morbi magna mus tortor magnis amet condimen-"
317.01,261.85,561.87,270.70,"/F8",9.96,"tum potenti condimentum quam habitasse. Vivamus au-"
317.01,249.90,561.82,258.75,"/F8",9.96,"gue. Dapibus etiam leo parturient ipsum duis nisi iaculis"
317.01,237.94,561.84,246.79,"/F8",9.96,"a scelerisque hac taciti mattis. Iaculis neque. Cubilia"
317.01,225.99,561.87,234.84,"/F8",9.96,"lorem nam pede erat ligula turpis. Nonummy fusce. Po-"
317.01,214.03,561.86,222.88,"/F8",9.96,"tenti dolor nisl congue vivamus eros at justo cras nec."
317.01,202.08,561.85,210.92,"/F8",9.96,"Rhoncus dolor gravida arcu ut consectetuer pellentesque"
317.01,190.12,561.86,198.97,"/F8",9.96,"sodales montes arcu semper parturient etiam viverra."
317.01,178.17,561.86,187.01,"/F8",9.96,"Sodales purus etiam dapibus dolor ut auctor curabitur"
317.01,166.21,561.87,175.06,"/F8",9.96,"cubilia montes curae. Feugiat neque massa nullam vi-"
317.01,154.26,561.86,163.10,"/F8",9.96,"tae. Aliquam neque dolor accumsan parturient aptent"
317.01,142.30,561.90,151.15,"/F8",9.96,"ve. Quisque massa id. Nonummy justo nam erat amet"
317.01,130.35,561.85,139.19,"/F8",9.96,"ridiculus eni leo eni mus per euismod a. Gravida felis"
317.01,118.39,505.16,127.24,"/F8",9.96,"porta auctor leo adipiscing. Conubia dolor."
