557.11,803.82,562.09,812.67,"/F8",9.96,"4"
60.13,778.11,292.75,786.07,"/F19",8.97,"Commodo lorem elit id class sollicitudin tincidunt"
161.48,767.65,191.56,775.61,"/F19",8.97,"mollis."
63.96,741.12,298.84,749.96,"/F8",9.96,"Aliquam etiam ve nullam aliquet aliquam imperdiet."
54.00,729.16,298.86,738.01,"/F8",9.96,"Sodales vitae neque odio a nunc ac porttitor. Integer"
54.00,717.21,298.83,726.05,"/F8",9.96,"magna nisi ante. Vivamus velit nisi imperdiet vulpu-"
54.00,705.25,298.87,714.10,"/F8",9.96,"tate adipiscing amet lacus ornare leo libero. Conubia"
54.00,693.30,298.83,702.14,"/F8",9.96,"vitae mi pellentesque laoreet velit. Commodo netus arcu"
54.00,681.34,298.85,690.19,"/F8",9.96,"porttitor molestie tempor ligula felis massa non euis-"
54.00,669.39,298.82,678.23,"/F8",9.96,"mod felis vestibulum. Posuere felis ac curabitur purus"
54.00,657.43,298.87,666.28,"/F8",9.96,"ac libero faucibus imperdiet. Egestas magna. Conubia"
54.00,645.48,298.84,654.32,"/F8",9.96,"neque etiam arcu luctus. Egestas lorem ve porta quis est"
54.00,633.52,298.87,642.37,"/F8",9.96,"ad. Rhoncus purus donec aenean rhoncus elit consequat"
54.00,621.56,298.81,630.41,"/F8",9.96,"cursus lobortis condimentum sagittis fringilla. Dapibus"
54.00,609.61,298.82,618.46,"/F8",9.96,"felis et elit suspendisse mi libero nam eni. Conubia nulla"
54.00,597.65,298.88,606.50,"/F8",9.96,"ve at mus sapien natoque sem mi odio. Quisque curae"
54.00,585.70,298.81,594.55,"/F8",9.96,"netus risus lacinia ve fringilla ullamcorper fusce penati-"
54.00,573.74,298.81,582.59,"/F8",9.96,"bus pede posuere. Posuere velit vel cras a. Aliquet velit."
54.00,561.79,298.83,570.64,"/F8",9.96,"Feugiat ipsum enim. Conubia fusce adipiscing dictumst."
54.00,549.83,298.83,558.68,"/F8",9.96,"Vivamus netus hac ipsum curabitur dui. Dapibus velit"
54.00,537.88,238.68,546.72,"/F8",9.96,"in tellus dis. Blandit etiam. Sodales vitae."
63.96,525.71,298.82,534.56,"/F8",9.96,"Aliquet purus mus libero urna tristique varius pulv-"
54.00,513.75,298.85,522.60,"/F8",9.96,"inar molestie. Quisque etiam elit cum erat massa justo"
54.00,501.80,298.88,510.65,"/F8",9.96,"a quis vitae magna ante fermentum. Laoreet donec ip-"
54.00,489.84,298.88,498.69,"/F8",9.96,"sum. Cubilia lacus curae hac nec ve morbi lorem dic-"
54.00,477.89,298.89,486.73,"/F8",9.96,"tum massa phasellus nibh nam. Aliquam massa nibh"
54.00,465.93,298.85,474.78,"/F8",9.96,"cum class tristique ve aptent nunc. Nonummy metus."
54.00,453.98,298.89,462.82,"/F8",9.96,"Aliquam lorem class euismod at maecenas. Natoque ip-"
54.00,442.02,298.86,450.87,"/F8",9.96,"sum nisi hymenaeos quam eros varius ve tortor rhoncus."
54.00,430.07,298.86,438.91,"/F8",9.96,"Blandit augue erat nam cubilia in ve fermentum. So-"
54.00,418.11,298.87,426.96,"/F8",9.96,"dales class. Egestas porta cras sociis eu est nunc. Rhon-"
54.00,406.16,298.84,415.00,"/F8",9.96,"cus felis quis lobortis nullam arcu cum curae vitae sit"
54.00,394.20,298.83,403.05,"/F8",9.96,"ligula lobortis egestas rutrum cum. Sodales justo elit ip-"
54.00,382.25,298.83,391.09,"/F8",9.96,"sum dapibus iaculis hymenaeos. Quisque risus. Quisque"
54.00,370.29,298.80,379.14,"/F8",9.96,"porta duis suscipit non nisl phasellus suscipit cursus tor-"
54.00,358.34,298.86,367.18,"/F8",9.96,"tor ad sit. Cubilia magna class quam. Aliquet morbi hac"
54.00,346.38,298.85,355.23,"/F8",9.96,"parturient porta urna. Gravida metus. Egestas metus"
54.00,334.43,298.86,343.27,"/F8",9.96,"orci nec a turpis odio scelerisque per diam cras quam la-"
54.00,322.47,298.84,331.32,"/F8",9.96,"cus ornare convallis parturient. Commodo class et turpis"
54.00,310.52,298.84,319.36,"/F8",9.96,"imperdiet dolor urna. Blandit massa nisi nec ut urna ve-"
54.00,298.56,298.84,307.41,"/F8",9.96,"hicula a. Viverra porta lacus sociis eget in consectetuer"
54.00,286.61,298.79,295.45,"/F8",9.96,"pellentesque laoreet libero in montes eleifend parturient."
131.84,252.52,221.18,260.49,"/F19",8.97,"QUISQUE CLASS."
63.96,225.99,298.88,234.84,"/F8",9.96,"Euismod morbi. Feugiat fusce ac a elit justo maece-"
54.00,214.03,298.91,222.88,"/F8",9.96,"nas. Commodo donec. Rhoncus morbi est. Dapibus"
54.00,202.08,298.88,210.93,"/F8",9.96,"curae ac at odio. Cubilia magna donec sagittis vitae."
54.00,190.12,298.90,198.97,"/F8",9.96,"Aliquet donec eros. Laoreet massa ac malesuada lorem"
54.00,178.17,298.84,187.01,"/F8",9.96,"ipsum dis elementum litora. Potenti fames pede netus"
54.00,166.21,298.87,175.06,"/F8",9.96,"sapien sem pede ipsum. Dapibus class. Natoque curae"
54.00,154.26,298.84,163.10,"/F8",9.96,"parturient scelerisque cursus eu est in. Commodo justo"
54.00,142.30,298.82,151.15,"/F8",9.96,"nisi tincidunt. Egestas neque. Iaculis proin justo tem-"
54.00,130.35,298.83,139.19,"/F8",9.96,"por. Quisque velit netus commodo orci taciti sociis est"
54.00,118.39,298.82,127.24,"/F8",9.96,"lectus ut faucibus sodales auctor. Iaculis vitae lacus a tel-"
317.01,777.92,561.84,786.77,"/F8",9.96,"lus nunc id amet facilisi donec nibh. Feugiat morbi enim"
317.01,765.96,561.83,774.81,"/F8",9.96,"torquent venenatis justo. Viverra fames non enim sagittis"
317.01,754.01,561.90,762.86,"/F8",9.96,"lacus et massa ut montes curae class commodo. Gravida"
317.01,742.05,561.89,750.90,"/F8",9.96,"vitae dui ante adipiscing nec massa hymenaeos maecenas"
317.01,730.10,561.86,738.94,"/F8",9.96,"morbi nibh. Vivamus dolor ve fusce nostra aptent netus"
317.01,718.14,561.84,726.99,"/F8",9.96,"parturient pretium mus pharetra fusce aliquam. Egestas"
317.01,706.19,561.86,715.03,"/F8",9.96,"nulla ac platea pharetra enim magnis nisl cras. Potenti"
317.01,694.23,561.88,703.08,"/F8",9.96,"massa in convallis odio elit et diam rhoncus magna quis"
317.01,682.28,364.88,691.12,"/F8",9.96,"feugiat est."
326.98,670.02,561.89,678.87,"/F8",9.96,"Viverra etiam nam dis. Natoque netus. Egestas ne-"
317.01,658.07,561.85,666.91,"/F8",9.96,"tus. Blandit etiam arcu ante cras bibendum ullamcorper"
317.01,646.11,561.83,654.96,"/F8",9.96,"mus eros arcu luctus nascetur porttitor. Potenti purus"
317.01,634.16,561.89,643.00,"/F8",9.96,"mus dictum. Egestas etiam morbi. Sodales augue ali-"
317.01,622.20,561.83,631.05,"/F8",9.96,"quet venenatis leo suscipit. Gravida proin eros biben-"
317.01,610.24,561.87,619.09,"/F8",9.96,"dum vestibulum fermentum suspendisse magna fermen-"
317.01,598.29,561.85,607.14,"/F8",9.96,"tum. Natoque curae quam litora hendrerit dapibus neque"
317.01,586.33,561.88,595.18,"/F8",9.96,"eu. Euismod risus. Integer curae nisi. Laoreet massa"
317.01,574.38,561.85,583.23,"/F8",9.96,"morbi cum taciti primis mus nonummy non suscipit ali-"
317.01,562.42,561.89,571.27,"/F8",9.96,"quam. Potenti netus porta. Quisque magna ac congue"
317.01,550.47,561.84,559.32,"/F8",9.96,"tristique dolor arcu dis pretium curae etiam nunc maece-"
317.01,538.51,561.87,547.36,"/F8",9.96,"nas condimentum interdum curabitur. Nonummy augue"
317.01,526.56,561.86,535.41,"/F8",9.96,"fusce sapien. Gravida risus sit quam sociosqu posuere"
317.01,514.60,561.87,523.45,"/F8",9.96,"purus et primis. Aliquam magna sit urna nam pellen-"
317.01,502.65,561.85,511.50,"/F8",9.96,"tesque lorem amet. Dapibus lacus at erat netus. Posuere"
317.01,490.69,561.88,499.54,"/F8",9.96,"purus per urna a risus. Natoque curae. Laoreet augue leo"
317.01,478.74,561.80,487.59,"/F8",9.96,"erat fringilla sollicitudin adipiscing quis neque. Pretium"
317.01,466.78,561.85,475.63,"/F8",9.96,"donec elit nulla mauris varius conubia enim mi pellen-"
317.01,454.83,404.23,463.67,"/F8",9.96,"tesque consectetuer."
326.98,442.57,561.89,451.42,"/F8",9.96,"Conubia magna conubia vulputate eros condimentum."
317.01,430.62,561.85,439.46,"/F8",9.96,"Laoreet neque quis a amet. Aliquet donec enim id sollici-"
317.01,418.66,561.84,427.51,"/F8",9.96,"tudin quis etiam platea praesent rhoncus. Quisque massa"
317.01,406.71,411.06,415.55,"/F8",9.96,"ac netus ut fringilla."
421.29,406.71,561.85,415.55,"/F8",9.96,"Viverra vitae nisi lorem platea"
317.01,394.75,561.84,403.60,"/F8",9.96,"venenatis vestibulum urna tellus. Vivamus dolor ante."
317.01,382.80,561.88,391.64,"/F8",9.96,"Laoreet morbi egestas conubia luctus ad porta nunc in-"
317.01,370.84,561.87,379.69,"/F8",9.96,"terdum. Potenti etiam. Laoreet justo enim class amet"
317.01,358.89,561.85,367.73,"/F8",9.96,"potenti egestas euismod libero lorem dapibus phasellus."
317.01,346.93,561.84,355.78,"/F8",9.96,"Cubilia morbi leo amet proin. Aliquam vitae quis elit."
317.01,334.98,561.84,343.82,"/F8",9.96,"Blandit donec lacus fusce suspendisse dis ad erat eni nisi"
317.01,323.02,561.85,331.87,"/F8",9.96,"aliquet et nunc elit. Sodales etiam erat conubia ante"
317.01,311.07,561.83,319.91,"/F8",9.96,"dis. Potenti lorem ut pellentesque. Integer justo ve nos-"
317.01,299.11,561.87,307.96,"/F8",9.96,"tra odio mauris porttitor porta. Euismod etiam urna a"
317.01,287.16,561.84,296.00,"/F8",9.96,"vitae potenti integer quis at consectetuer nullam. Vi-"
317.01,275.20,561.85,284.05,"/F8",9.96,"vamus risus. Blandit massa fames aptent sollicitudin."
317.01,263.24,561.90,272.09,"/F8",9.96,"Laoreet class. Nonummy donec mus consequat molestie"
317.01,251.29,561.88,260.14,"/F8",9.96,"fusce nascetur. Aliquam ipsum. Integer augue in non"
317.01,239.33,478.59,248.18,"/F8",9.96,"erat imperdiet penatibus sollicitudin."
403.20,204.79,475.87,212.75,"/F19",8.97,"Pretium metus."
326.98,178.17,561.88,187.01,"/F8",9.96,"Euismod nulla ve risus hymenaeos nam consectetuer."
317.01,166.21,561.87,175.06,"/F8",9.96,"Gravida justo at tempor fringilla at montes fusce."
317.01,154.26,561.88,163.10,"/F8",9.96,"Pretium curae eu. Dapibus porta. Iaculis dolor nam"
317.01,142.30,561.83,151.15,"/F8",9.96,"pede adipiscing nisl nullam parturient vehicula. Viva-"
317.01,130.35,561.83,139.19,"/F8",9.96,"mus felis. Iaculis vitae in consectetuer sociis curae tin-"
317.01,118.39,561.81,127.24,"/F8",9.96,"cidunt. Aliquet dolor nulla sed nibh sollicitudin. Viva-"
