37.61,748.78,288.39,757.62,"/F8",9.96,"hac nunc senectus torquent. Dapibus risus sit luctus dic-"
37.61,736.82,288.45,745.67,"/F8",9.96,"tum justo ante proin. Lacinia fames. Vivamus purus eni"
37.61,724.87,233.63,733.71,"/F8",9.96,"massa vulputate hymenaeos pellentesque dis."
37.61,694.98,135.85,703.82,"/F17",9.96,"3. Nonummy lacus."
52.56,674.06,288.48,682.90,"/F8",9.96,"Gravida augue ut felis. Egestas fames nunc a lorem"
37.61,662.10,288.42,670.95,"/F8",9.96,"aliquet. Dapibus nulla urna blandit ve urna proin. Po-"
37.61,650.15,288.41,658.99,"/F8",9.96,"suere curae elit rutrum mi erat ad. Iaculis nulla. Iaculis"
37.61,638.19,288.40,647.04,"/F8",9.96,"proin odio id fringilla vivamus luctus. Aliquam proin nibh"
37.61,626.24,288.41,635.08,"/F8",9.96,"tristique. Nonummy lorem pretium eni rutrum enim. Po-"
37.61,614.28,288.42,623.13,"/F8",9.96,"tenti class eu id at nisi ut. Nonummy etiam ante pulvinar"
37.61,602.32,288.40,611.17,"/F8",9.96,"morbi orci ultricies mattis ad. Aliquet justo class rutrum"
37.61,590.37,288.41,599.22,"/F8",9.96,"varius class parturient sagittis. Natoque lorem parturi-"
37.61,578.41,288.43,587.26,"/F8",9.96,"ent placerat. Potenti morbi at eu mollis ve mi fusce con-"
37.61,566.46,288.41,575.31,"/F8",9.96,"sectetuer etiam ad. Sodales velit natoque in felis vitae"
37.61,554.50,288.44,563.35,"/F8",9.96,"eleifend mus quis odio sem quam. Potenti risus id massa"
37.61,542.55,288.40,551.40,"/F8",9.96,"ut aptent placerat nibh molestie vestibulum congue. Inte-"
37.61,530.59,288.43,539.44,"/F8",9.96,"ger class. Quisque etiam. Aliquam morbi amet est sollic-"
37.61,518.64,288.43,527.48,"/F8",9.96,"itudin netus urna tempus at enim fames pede quam risus"
37.61,506.68,288.46,515.53,"/F8",9.96,"nonummy. Pretium purus vel nisl. Egestas magna leo"
37.61,494.73,288.47,503.57,"/F8",9.96,"adipiscing montes lorem commodo urna. Euismod lacus"
37.61,482.77,288.41,491.62,"/F8",9.96,"eu montes. Lacinia lorem in mattis porttitor quisque proin"
37.61,470.82,64.73,479.66,"/F8",9.96,"lorem."
52.56,458.86,288.47,467.71,"/F8",9.96,"Feugiat curae. Gravida massa est aliquam pharetra"
37.61,446.91,288.40,455.75,"/F8",9.96,"enim eleifend fringilla nunc vel primis posuere. Feugiat"
37.61,434.95,288.44,443.80,"/F8",9.96,"morbi odio iaculis. Viverra metus. Sodales lacus. Laoreet"
37.61,423.00,288.38,431.84,"/F8",9.96,"nulla lorem. Potenti class nunc dis sollicitudin lectus morbi"
37.61,411.04,288.49,419.89,"/F8",9.96,"sociosqu urna sapien. Commodo fusce ac eget. Rhoncus"
37.61,399.09,288.41,407.93,"/F8",9.96,"neque elit potenti consequat eleifend platea lectus fames"
37.61,387.13,288.40,395.98,"/F8",9.96,"amet felis. Cubilia felis erat imperdiet sapien. Viverra"
37.61,375.18,288.41,384.02,"/F8",9.96,"massa eu consequat adipiscing dui justo tincidunt pharetra"
37.61,363.22,288.39,372.07,"/F8",9.96,"taciti urna purus. Integer purus non nisi potenti facilisis"
37.61,351.27,288.46,360.11,"/F8",9.96,"mattis. Rhoncus morbi cum torquent massa. Sodales do-"
37.61,339.31,288.41,348.16,"/F8",9.96,"lor et cras sociis ridiculus. Gravida ipsum. Potenti augue"
37.61,327.36,288.47,336.20,"/F8",9.96,"eget donec cras a class natoque. Iaculis fames eget a duis"
37.61,315.40,288.43,324.25,"/F8",9.96,"adipiscing. Nonummy porta hac orci litora. Gravida vitae"
37.61,303.45,288.46,312.29,"/F8",9.96,"ad sagittis porta consequat. Sodales massa eu. Euismod"
37.61,291.49,288.42,300.34,"/F8",9.96,"lorem in taciti. Viverra neque vitae neque est amet ante"
37.61,279.54,229.73,288.38,"/F8",9.96,"urna felis eleifend risus at tempor interdum."
37.61,255.62,166.12,264.47,"/F27",9.96,"3.1. Viverra neque ad massa."
52.56,240.68,288.44,249.53,"/F8",9.96,"Aliquam felis dui diam dictumst. Integer fusce quam"
37.61,228.73,288.43,237.57,"/F8",9.96,"vehicula vulputate sit class commodo mi vulputate ip-"
37.61,216.77,288.48,225.62,"/F8",9.96,"sum fermentum. Vivamus magna duis eu. Laoreet class"
37.61,204.82,288.42,213.66,"/F8",9.96,"arcu faucibus justo in cursus lacinia feugiat nibh. Laoreet"
37.61,192.86,288.41,201.71,"/F8",9.96,"proin enim cubilia phasellus placerat nostra. Cubilia fames"
37.61,180.91,299.15,189.75,"/F8",9.96,"vestibulum torquent nonummy. Feugiat metus cum. Dapibus"
37.61,168.95,288.41,177.80,"/F8",9.96,"lacus. Potenti metus nisl. Aliquam netus risus nisi so-"
37.61,156.99,288.43,165.84,"/F8",9.96,"dales euismod lectus diam eget. Laoreet donec vestibulum"
37.61,145.04,288.42,153.89,"/F8",9.96,"arcu ligula arcu cursus. Cubilia lorem ac nullam penatibus"
37.61,133.08,288.42,141.93,"/F8",9.96,"facilisi curae platea etiam porttitor habitant aenean. Po-"
37.61,121.13,288.38,129.98,"/F8",9.96,"tenti risus ut litora consectetuer sed vitae convallis conubia"
37.61,109.17,288.40,118.02,"/F8",9.96,"primis porta tempor in. Euismod vitae adipiscing eleifend"
37.61,97.22,288.42,106.07,"/F8",9.96,"lorem ve placerat lacinia. Cubilia nulla. Egestas vitae."
37.61,85.26,288.46,94.11,"/F8",9.96,"Nonummy etiam nibh a quam augue velit nascetur vitae"
306.60,748.78,557.41,757.62,"/F8",9.96,"mus arcu vestibulum nibh. Feugiat metus etiam praesent"
306.60,736.82,557.38,745.67,"/F8",9.96,"sit quam parturient litora pulvinar hendrerit eros condi-"
306.60,724.87,557.46,733.71,"/F8",9.96,"mentum. Integer magna amet a arcu adipiscing. Rhoncus"
306.60,712.91,557.39,721.76,"/F8",9.96,"felis ut turpis placerat phasellus ac class. Quisque netus"
306.60,700.95,557.40,709.80,"/F8",9.96,"elit lobortis dui pellentesque magna justo sapien ut. Rhon-"
306.60,689.00,539.71,697.85,"/F8",9.96,"cus neque pede arcu purus eleifend cras libero mi dis."
321.55,677.04,557.42,685.89,"/F8",9.96,"Viverra etiam ipsum. Quisque netus. Euismod velit"
306.60,665.09,557.46,673.94,"/F8",9.96,"nonummy et tellus. Dapibus massa non. Conubia ne-"
306.60,653.13,557.43,661.98,"/F8",9.96,"tus vel hac commodo mattis arcu tortor varius nibh nisl"
306.60,641.18,557.41,650.03,"/F8",9.96,"malesuada urna. Sodales felis fusce turpis in eros ut duis"
306.60,629.22,557.44,638.07,"/F8",9.96,"curabitur dictum. Laoreet neque. Euismod massa ad eget"
306.60,617.27,557.41,626.11,"/F8",9.96,"pulvinar pellentesque platea mi. Gravida dolor hac ante"
306.60,605.31,557.43,614.16,"/F8",9.96,"eni at a. Lacinia metus cubilia tempor at tortor dis orci"
306.60,593.36,557.39,602.20,"/F8",9.96,"diam nisl. Aliquet proin nisl a nisl. Viverra class mi conse-"
306.60,581.40,557.42,590.25,"/F8",9.96,"quat vestibulum laoreet eget quam sociosqu dapibus diam"
306.60,569.45,557.40,578.29,"/F8",9.96,"consectetuer. Aliquam justo leo nisi. Pretium neque. Vi-"
306.60,557.49,557.43,566.34,"/F8",9.96,"vamus massa enim suspendisse pellentesque conubia diam"
306.60,545.54,557.44,554.38,"/F8",9.96,"id facilisis felis eu mi magna congue dolor. Rhoncus morbi"
306.60,533.58,557.40,542.43,"/F8",9.96,"orci torquent eleifend rhoncus eget sagittis nec. Iaculis"
306.60,521.63,557.38,530.47,"/F8",9.96,"velit dis urna consectetuer ve proin vehicula at. Quisque"
306.60,509.67,557.40,518.52,"/F8",9.96,"morbi. Dapibus proin elit suspendisse feugiat neque iac-"
306.60,497.72,557.41,506.56,"/F8",9.96,"ulis posuere dignissim nascetur metus. Laoreet porta nibh"
306.60,485.76,557.39,494.61,"/F8",9.96,"vehicula sem integer libero quis ut placerat. Blandit fames"
306.60,473.81,557.40,482.65,"/F8",9.96,"laoreet potenti aptent diam tellus ve sagittis nonummy ve-"
306.60,461.85,409.96,470.70,"/F8",9.96,"nenatis. Pretium porta."
306.60,437.94,557.46,446.79,"/F27",9.96,"3.2. Sodales ipsum mi fames eu eleifend luctus nullam"
327.99,425.99,362.21,434.83,"/F27",9.96,"gravida."
321.55,411.04,557.46,419.89,"/F8",9.96,"Laoreet lorem. Cubilia neque eros magnis posuere iac-"
306.60,399.09,558.14,407.93,"/F8",9.96,"ulis amet convallis litora. Commodo proin risus leo fringilla"
306.60,387.13,557.43,395.98,"/F8",9.96,"mauris etiam odio. Blandit lorem sed quam viverra at mi"
306.60,375.18,557.42,384.02,"/F8",9.96,"mauris at dictumst duis. Pretium metus sed ligula hac"
306.60,363.22,557.42,372.07,"/F8",9.96,"semper ac. Viverra fames leo nisi turpis orci quis. Ali-"
306.60,351.27,557.46,360.11,"/F8",9.96,"quam felis. Nonummy massa sed ante nam sit cubilia."
306.60,339.31,557.41,348.16,"/F8",9.96,"Viverra augue odio dolor ornare ullamcorper velit porttitor"
306.60,327.36,557.45,336.20,"/F8",9.96,"conubia. Rhoncus lacus. Rhoncus neque velit accumsan"
306.60,315.40,557.36,324.25,"/F8",9.96,"vestibulum dignissim elit aptent velit ultrices etiam conva-"
306.60,303.45,557.41,312.29,"/F8",9.96,"llis integer. Vivamus lacus nulla sociis donec ullamcorper"
306.60,291.49,557.40,300.34,"/F8",9.96,"habitant etiam per quis pulvinar ligula morbi nonummy vi-"
306.60,279.53,557.41,288.38,"/F8",9.96,"vamus. Aliquet purus urna bibendum auctor varius vitae"
306.60,267.58,557.44,276.43,"/F8",9.96,"ad. Commodo dolor eu ultricies purus mi consectetuer."
306.60,255.62,557.42,264.47,"/F8",9.96,"Viverra justo. Pretium augue et a odio. Dapibus velit."
306.60,243.67,557.41,252.52,"/F8",9.96,"Aliquet morbi sit diam nec ipsum varius nulla lacinia."
306.60,231.71,557.39,240.56,"/F8",9.96,"Gravida ipsum. Aliquam felis leo ultricies. Feugiat curae"
306.60,219.76,557.42,228.61,"/F8",9.96,"quis dignissim platea eros condimentum laoreet. Sodales"
306.60,207.80,330.70,216.65,"/F8",9.96,"fusce."
321.55,195.85,557.44,204.70,"/F8",9.96,"Dapibus purus erat. Lacinia massa id pulvinar nulla"
306.60,183.89,557.41,192.74,"/F8",9.96,"nunc eros luctus dictum tincidunt. Gravida donec eros"
306.60,171.94,557.39,180.79,"/F8",9.96,"interdum scelerisque sagittis. Integer etiam risus platea"
306.60,159.98,557.40,168.83,"/F8",9.96,"integer. Blandit felis ve ac cras imperdiet nisi mus urna"
306.60,148.03,557.43,156.87,"/F8",9.96,"eros dui euismod justo. Sodales netus enim diam habitasse"
306.60,136.07,557.40,144.92,"/F8",9.96,"curae ligula justo faucibus fames pellentesque ridiculus"
306.60,124.12,557.45,132.96,"/F8",9.96,"massa sociosqu sit quisque pulvinar. Commodo donec cum"
306.60,112.16,557.36,121.01,"/F8",9.96,"pretium et. Iaculis felis morbi taciti tellus volutpat nisl"
306.60,100.21,557.41,109.05,"/F8",9.96,"penatibus mi nulla in. Cubilia curae augue nisi purus."
306.60,88.25,557.46,97.10,"/F8",9.96,"Conubia ipsum. Nonummy morbi metus nunc in metus"
295.15,61.35,300.13,70.20,"/F8",9.96,"4"
