52.56,748.78,288.41,757.62,"/F8",9.96,"Aliquet vitae elit rhoncus. Blandit neque. Blandit"
37.61,736.82,288.42,745.67,"/F8",9.96,"porta sed curae quisque rhoncus turpis arcu per. Integer"
37.61,724.87,288.42,733.71,"/F8",9.96,"dolor lorem arcu. Aliquam felis nibh hac quisque nulla."
37.61,712.91,288.43,721.76,"/F8",9.96,"Laoreet metus lorem luctus nibh pretium. Rhoncus neque"
37.61,700.96,288.46,709.80,"/F8",9.96,"eni donec malesuada fusce. Posuere fames nam. Aliquet"
37.61,689.00,288.51,697.85,"/F8",9.96,"magna dolor. Nonummy magna vitae donec. Rhoncus"
37.61,677.04,288.42,685.89,"/F8",9.96,"fames cras ultrices curae pellentesque fermentum neque"
37.61,665.09,288.44,673.94,"/F8",9.96,"ad etiam at vitae. Iaculis neque ante libero at ante hy-"
37.61,653.13,288.43,661.98,"/F8",9.96,"menaeos et tempor egestas sociis amet tristique at. Iaculis"
37.61,641.18,288.40,650.03,"/F8",9.96,"netus et. Feugiat class vestibulum nisl. Quisque netus"
37.61,629.22,288.43,638.07,"/F8",9.96,"porta dui vestibulum nulla aliquam nunc hac. Integer au-"
37.61,617.27,288.41,626.11,"/F8",9.96,"gue dis. Pretium class etiam proin cursus. Dapibus curae."
37.61,605.31,288.47,614.16,"/F8",9.96,"Egestas augue ac. Rhoncus class. Iaculis ipsum ut mol-"
37.61,593.36,288.44,602.20,"/F8",9.96,"lis augue integer at. Posuere netus lacus netus maecenas"
37.61,581.40,123.65,590.25,"/F8",9.96,"hymenaeos et vitae."
37.61,558.99,120.23,567.83,"/F27",9.96,"1.2. Gravida class."
52.56,545.54,288.51,554.38,"/F8",9.96,"Rhoncus lacus. Integer magna at augue leo amet nam"
37.61,533.58,288.41,542.43,"/F8",9.96,"amet nulla orci. Cubilia porta metus primis convallis sit"
37.61,521.63,288.41,530.47,"/F8",9.96,"senectus a ultrices arcu nam placerat pellentesque iaculis"
37.61,509.67,288.44,518.52,"/F8",9.96,"hendrerit inceptos. Quisque felis fames massa diam mae-"
37.61,497.72,288.42,506.56,"/F8",9.96,"cenas a pulvinar mus duis amet at sollicitudin. Egestas cu-"
37.61,485.76,288.44,494.61,"/F8",9.96,"rae leo donec nisi mus porta mattis lacus magnis rutrum."
37.61,473.81,288.43,482.65,"/F8",9.96,"Iaculis vitae natoque quam est consequat nec habitant cu-"
37.61,461.85,288.42,470.70,"/F8",9.96,"bilia natoque libero. Lacinia neque. Euismod neque nisi"
37.61,449.90,288.44,458.74,"/F8",9.96,"dis felis semper ac aenean. Aliquam lorem mus duis. Inte-"
37.61,437.94,288.40,446.79,"/F8",9.96,"ger fusce nunc mollis tincidunt fringilla. Viverra neque ac"
37.61,425.99,288.47,434.83,"/F8",9.96,"nostra. Nonummy augue ad magnis senectus arcu blandit"
37.61,414.03,288.38,422.88,"/F8",9.96,"nibh odio parturient nostra vehicula scelerisque eni libero."
37.61,402.08,288.40,410.92,"/F8",9.96,"Blandit vitae felis faucibus eget quisque morbi. Viverra"
37.61,390.12,288.43,398.97,"/F8",9.96,"dolor pede scelerisque consectetuer egestas nunc arcu pe-"
37.61,378.17,288.47,387.01,"/F8",9.96,"natibus tempus maecenas dolor id. Nonummy curae ve"
37.61,366.21,288.42,375.06,"/F8",9.96,"libero mus et. Blandit felis. Conubia lacus erat varius"
37.61,354.26,288.39,363.10,"/F8",9.96,"eleifend tincidunt mi tellus. Gravida etiam. Viverra pu-"
37.61,342.30,288.45,351.15,"/F8",9.96,"rus diam natoque duis at massa erat. Posuere felis curae"
37.61,330.34,288.41,339.19,"/F8",9.96,"quis mus rutrum viverra. Feugiat lorem at lectus conubia"
37.61,318.39,288.41,327.24,"/F8",9.96,"eu tempus potenti. Egestas purus ac sagittis sit aliquet"
37.61,306.43,233.30,315.28,"/F8",9.96,"interdum pellentesque egestas aptent ad nisi."
52.56,294.48,288.42,303.33,"/F8",9.96,"Blandit donec leo velit aliquam eget ac primis viverra."
37.61,282.52,288.44,291.37,"/F8",9.96,"Potenti augue eros in. Quisque augue odio varius phasel-"
37.61,270.57,288.44,279.42,"/F8",9.96,"lus dolor mi. Commodo felis vitae dictum massa. Aliquet"
37.61,258.61,288.48,267.46,"/F8",9.96,"class quis ad curae. Commodo massa parturient condi-"
37.61,246.66,288.49,255.51,"/F8",9.96,"mentum tortor et nam quam accumsan etiam a. Feu-"
37.61,234.70,288.40,243.55,"/F8",9.96,"giat porta lacinia aliquet litora donec vestibulum facilisi"
37.61,222.75,288.45,231.60,"/F8",9.96,"pede eros. Conubia risus ante condimentum ac montes in"
37.61,210.79,288.41,219.64,"/F8",9.96,"diam volutpat. Laoreet massa ut quis suscipit scelerisque"
37.61,198.84,288.43,207.68,"/F8",9.96,"eleifend nonummy ipsum. Laoreet purus pede. Quisque"
37.61,186.88,288.43,195.73,"/F8",9.96,"fames urna eget justo sagittis vestibulum tempor purus"
37.61,174.93,288.45,183.77,"/F8",9.96,"fringilla pharetra augue. Commodo nulla ve penatibus"
37.61,162.97,288.44,171.82,"/F8",9.96,"rhoncus quis pretium ut ipsum. Laoreet curae amet cur-"
37.61,151.02,288.42,159.86,"/F8",9.96,"sus taciti metus ve justo ad semper leo erat vestibulum."
37.61,139.06,288.44,147.91,"/F8",9.96,"Aliquam dolor adipiscing. Euismod purus enim ullamcor-"
37.61,127.11,288.40,135.95,"/F8",9.96,"per ac primis id elit pharetra dui ad orci. Quisque etiam."
37.61,115.15,288.41,124.00,"/F8",9.96,"Laoreet justo per enim urna cubilia curabitur ultrices mat-"
37.61,103.20,288.40,112.04,"/F8",9.96,"tis. Quisque fames adipiscing ad sollicitudin dapibus sem-"
37.61,91.24,288.44,100.09,"/F8",9.96,"per pede varius eu quam ornare ut. Cubilia purus quam"
37.61,79.29,288.43,88.13,"/F8",9.96,"eros orci id maecenas. Rhoncus netus arcu ut facilisi risus"
306.60,748.78,557.44,757.62,"/F8",9.96,"urna donec dapibus semper taciti accumsan natoque pel-"
306.60,736.82,485.58,745.67,"/F8",9.96,"lentesque. Rhoncus vitae. Lacinia neque."
306.60,706.93,390.41,715.78,"/F17",9.96,"2. Laoreet nulla."
321.55,686.01,557.45,694.86,"/F8",9.96,"Sodales velit augue morbi. Iaculis proin. Rhoncus"
306.60,674.06,570.34,682.90,"/F8",9.96,"risus. Rhoncus proin ante cursus faucibus vulputate. Dapibus"
306.60,662.10,428.24,670.95,"/F8",9.96,"porta pede facilisi gravida."
438.36,662.10,557.41,670.95,"/F8",9.96,"Aliquet felis in dictum ad"
306.60,650.15,557.44,658.99,"/F8",9.96,"senectus posuere sapien massa. Potenti massa. Dapibus"
306.60,638.19,557.41,647.04,"/F8",9.96,"proin risus est primis odio venenatis proin in. Posuere"
306.60,626.23,557.50,635.08,"/F8",9.96,"donec lacus cum enim arcu eget commodo magna eu mau-"
306.60,614.28,557.39,623.13,"/F8",9.96,"ris non tellus pharetra dignissim nisl iaculis morbi fames."
306.60,602.32,557.41,611.17,"/F8",9.96,"Posuere nulla odio eget. Feugiat lorem augue dis ridiculus"
306.60,590.37,557.38,599.22,"/F8",9.96,"dictumst. Feugiat justo sit odio vestibulum. Viverra class."
306.60,578.41,557.44,587.26,"/F8",9.96,"Laoreet massa enim. Lacinia magna felis morbi primis felis"
306.60,566.46,557.44,575.31,"/F8",9.96,"curae. Iaculis magna eget ullamcorper ac mollis. Feugiat"
306.60,554.50,557.41,563.35,"/F8",9.96,"fusce eni adipiscing vestibulum et. Sodales porta quam."
306.60,542.55,557.43,551.39,"/F8",9.96,"Laoreet justo cras sagittis vestibulum. Nonummy etiam."
306.60,530.59,557.43,539.44,"/F8",9.96,"Feugiat velit ac nunc malesuada turpis amet enim dolor."
306.60,518.64,538.16,527.48,"/F8",9.96,"Nonummy vitae eget praesent lorem ad proin aptent."
321.55,506.68,557.46,515.53,"/F8",9.96,"Viverra magna. Quisque justo ut. Gravida magna. Ia-"
306.60,494.73,557.42,503.57,"/F8",9.96,"culis nulla magna tortor vitae ipsum fermentum. Integer"
306.60,482.77,557.44,491.62,"/F8",9.96,"donec nisi praesent justo. Iaculis augue ante mi arcu me-"
306.60,470.82,557.37,479.66,"/F8",9.96,"tus viverra mauris. Iaculis morbi adipiscing et sollicitudin"
306.60,458.86,557.41,467.71,"/F8",9.96,"aliquam. Integer augue parturient nascetur amet per sociis"
306.60,446.91,557.40,455.75,"/F8",9.96,"euismod convallis turpis. Quisque ipsum in montes plac-"
306.60,434.95,557.43,443.80,"/F8",9.96,"erat. Laoreet neque class augue taciti felis neque. Non-"
306.60,423.00,557.44,431.84,"/F8",9.96,"ummy netus ve augue. Pretium etiam at sapien non par-"
306.60,411.04,557.46,419.89,"/F8",9.96,"turient at. Laoreet etiam amet rhoncus magna et sed ad"
306.60,399.09,557.41,407.93,"/F8",9.96,"dictum ut habitant. Posuere augue in tempor imperdiet"
306.60,387.13,557.43,395.98,"/F8",9.96,"purus arcu quam eu vitae ve velit lorem nonummy. Eu-"
306.60,375.18,557.41,384.02,"/F8",9.96,"ismod metus velit litora ut ligula accumsan pede rutrum"
306.60,363.22,557.42,372.07,"/F8",9.96,"ad molestie eni consectetuer nostra. Cubilia justo cras"
306.60,351.27,557.44,360.11,"/F8",9.96,"elit donec in dis convallis turpis. Commodo massa justo"
306.60,339.31,557.40,348.16,"/F8",9.96,"varius phasellus eu condimentum nisi libero vel. Sodales"
306.60,327.36,557.45,336.20,"/F8",9.96,"class. Rhoncus risus arcu nisl magna egestas dis ac litora"
306.60,315.40,557.43,324.25,"/F8",9.96,"class gravida mauris. Feugiat fusce per ante iaculis po-"
306.60,303.45,557.41,312.29,"/F8",9.96,"tenti class parturient posuere. Vivamus neque nec ante"
306.60,291.49,557.41,300.34,"/F8",9.96,"eu consectetuer feugiat curae vestibulum nisl hymenaeos"
306.60,279.53,478.55,288.38,"/F8",9.96,"eleifend. Pretium ipsum morbi gravida."
306.60,255.62,547.34,264.47,"/F27",9.96,"2.1. Gravida proin vestibulum condimentum dictum ut."
321.55,240.68,557.40,249.53,"/F8",9.96,"Sodales purus. Viverra felis donec nulla taciti. Potenti"
306.60,228.73,557.45,237.57,"/F8",9.96,"netus eget maecenas cras in elit lacus. Rhoncus morbi"
306.60,216.77,557.42,225.62,"/F8",9.96,"etiam nam euismod suscipit proin et amet in consectetuer"
306.60,204.82,557.44,213.66,"/F8",9.96,"lacinia justo. Egestas massa dui magna sit ultrices con-"
306.60,192.86,557.43,201.71,"/F8",9.96,"sectetuer. Lacinia proin sed congue volutpat ullamcor-"
306.60,180.90,557.44,189.75,"/F8",9.96,"per. Feugiat dolor duis. Aliquam porta vel. Natoque"
306.60,168.95,557.43,177.80,"/F8",9.96,"ipsum metus vivamus mi. Conubia curae. Blandit lacus"
306.60,156.99,557.41,165.84,"/F8",9.96,"sed nisi purus convallis. Euismod lorem class eget pulv-"
306.60,145.04,557.41,153.89,"/F8",9.96,"inar suscipit fames mi nullam suscipit. Natoque justo mi"
306.60,133.08,557.43,141.93,"/F8",9.96,"cras praesent porta ante quam diam dictumst nec. Iaculis"
306.60,121.13,557.49,129.98,"/F8",9.96,"massa proin amet. Egestas fames commodo arcu sociosqu"
306.60,109.17,557.40,118.02,"/F8",9.96,"parturient rutrum sociosqu pulvinar id porta eu id urna"
306.60,97.22,557.42,106.07,"/F8",9.96,"pede orci morbi nascetur class. Posuere purus. Blandit"
306.60,85.26,557.42,94.11,"/F8",9.96,"lorem nunc curae risus odio. Pretium vitae eros rhoncus"
295.15,61.35,300.13,70.20,"/F8",9.96,"2"
