37.61,748.78,288.45,757.62,"/F8",9.96,"Blandit curae fusce erat vitae ac elementum. Rhoncus"
37.61,736.82,288.46,745.67,"/F8",9.96,"magna leo nisl eros accumsan morbi hendrerit nascetur"
37.61,724.87,288.41,733.71,"/F8",9.96,"luctus odio felis. Aliquet felis sem morbi. Conubia donec."
37.61,712.91,288.45,721.76,"/F8",9.96,"Conubia purus velit odio. Commodo dolor morbi turpis."
37.61,700.96,288.46,709.80,"/F8",9.96,"Nonummy class vestibulum odio auctor semper class con-"
37.61,689.00,308.15,697.85,"/F8",9.96,"vallis scelerisque class tincidunt ridiculus pellentesque. Pretium"
37.61,677.04,288.39,685.89,"/F8",9.96,"velit. Natoque lacus. Potenti velit parturient condimen-"
37.61,665.09,288.43,673.94,"/F8",9.96,"tum primis ve mi orci morbi. Pretium augue urna a nisi."
37.61,653.13,288.42,661.98,"/F8",9.96,"Conubia velit. Lacinia etiam. Aliquet purus urna justo."
37.61,641.18,288.42,650.03,"/F8",9.96,"Sodales curae diam mus in proin. Iaculis purus sit turpis"
37.61,629.22,288.40,638.07,"/F8",9.96,"cum montes elementum ad curabitur tristique duis cubilia"
37.61,617.27,288.47,626.11,"/F8",9.96,"eu. Rhoncus magna duis inceptos convallis cras magnis"
37.61,605.31,288.42,614.16,"/F8",9.96,"viverra quisque semper. Euismod neque integer at ante"
37.61,593.36,150.26,602.20,"/F8",9.96,"hendrerit. Vivamus dolor."
37.61,569.45,285.95,578.29,"/F27",9.96,"1.2. Viverra fusce pede vehicula cubilia etiam adipiscing."
52.56,554.50,288.44,563.35,"/F8",9.96,"Aliquam fusce massa condimentum id taciti suscipit."
37.61,542.55,288.41,551.40,"/F8",9.96,"Potenti purus id donec aptent mauris porta sit diam. Feu-"
37.61,530.59,288.42,539.44,"/F8",9.96,"giat fusce netus curae. Iaculis lacus erat lacinia. Dapibus"
37.61,518.64,288.42,527.48,"/F8",9.96,"curae per nisi nonummy et tempor eleifend velit accumsan"
37.61,506.68,288.46,515.53,"/F8",9.96,"in donec scelerisque urna. Aliquam magna curae ligula"
37.61,494.73,288.42,503.57,"/F8",9.96,"nam adipiscing lorem arcu facilisis. Gravida risus. Conu-"
37.61,482.77,288.46,491.62,"/F8",9.96,"bia vitae ve donec. Feugiat magna ante hac posuere habi-"
37.61,470.82,199.88,479.66,"/F8",9.96,"tant ipsum est eget volutpat proin."
210.20,470.82,288.43,479.66,"/F8",9.96,"Pretium lacus ad"
37.61,458.86,288.39,467.71,"/F8",9.96,"nascetur viverra litora eu neque taciti elit. Pretium fe-"
37.61,446.91,159.86,455.75,"/F8",9.96,"lis parturient quisque eros."
170.49,446.91,288.39,455.75,"/F8",9.96,"Egestas neque velit lectus"
37.61,434.95,288.40,443.80,"/F8",9.96,"justo primis fames sapien pellentesque viverra. Iaculis cu-"
37.61,423.00,288.39,431.84,"/F8",9.96,"rae arcu fringilla dis felis convallis nam interdum. Potenti"
37.61,411.04,288.46,419.89,"/F8",9.96,"magna enim interdum proin ve ante amet. Lacinia justo"
37.61,399.09,288.40,407.93,"/F8",9.96,"eros sed duis sit sociosqu potenti sollicitudin semper fe-"
37.61,387.13,288.41,395.98,"/F8",9.96,"lis parturient. Vivamus fusce leo nisl sem netus. Viverra"
37.61,375.18,288.47,384.02,"/F8",9.96,"etiam fames cubilia lacinia malesuada pede diam maece-"
37.61,363.22,288.43,372.07,"/F8",9.96,"nas facilisis a tincidunt. Sodales netus. Commodo justo."
37.61,351.27,288.43,360.11,"/F8",9.96,"Pretium justo est duis. Rhoncus fusce at. Quisque magna"
37.61,339.31,97.66,348.16,"/F8",9.96,"metus aptent."
52.56,327.36,288.48,336.20,"/F8",9.96,"Rhoncus donec. Rhoncus fusce odio feugiat potenti"
37.61,315.40,288.41,324.25,"/F8",9.96,"libero ante rhoncus lectus leo. Vivamus justo urna pretium"
37.61,303.45,288.45,312.29,"/F8",9.96,"class et felis ut nostra ac. Nonummy fusce. Sodales pu-"
37.61,291.49,288.46,300.34,"/F8",9.96,"rus quam ullamcorper. Conubia magna nec justo integer"
37.61,279.54,288.48,288.38,"/F8",9.96,"mus eu commodo amet sed. Posuere donec felis nunc la-"
37.61,267.58,288.41,276.43,"/F8",9.96,"cus platea class scelerisque molestie dolor potenti gravida."
37.61,255.62,288.45,264.47,"/F8",9.96,"Laoreet fusce diam dui augue dis amet blandit netus. In-"
37.61,243.67,288.48,252.52,"/F8",9.96,"teger nulla ac consequat magna odio dapibus ve magnis"
37.61,231.71,288.47,240.56,"/F8",9.96,"habitasse nec habitant laoreet conubia. Commodo massa."
37.61,219.76,288.45,228.61,"/F8",9.96,"Aliquet donec erat a. Nonummy lacus felis ornare nostra"
37.61,207.80,288.44,216.65,"/F8",9.96,"felis etiam molestie. Quisque augue risus diam hac do-"
37.61,195.85,288.46,204.70,"/F8",9.96,"lor commodo natoque. Potenti etiam lorem condimentum"
37.61,183.89,288.47,192.74,"/F8",9.96,"mi. Viverra donec. Natoque class. Natoque lacus erat"
37.61,171.94,288.48,180.79,"/F8",9.96,"nonummy mi enim donec rhoncus. Conubia porta augue"
37.61,159.98,288.40,168.83,"/F8",9.96,"auctor. Aliquet vitae per. Iaculis nulla amet scelerisque"
37.61,148.03,288.42,156.88,"/F8",9.96,"ve lectus mus adipiscing convallis elit. Aliquam massa ve"
37.61,136.07,288.45,144.92,"/F8",9.96,"at tempor dis cras dolor fringilla viverra magna augue."
37.61,124.12,288.45,132.96,"/F8",9.96,"Pretium magna mi fames sed etiam habitasse suscipit in-"
37.61,112.16,196.73,121.01,"/F8",9.96,"terdum netus auctor mattis eleifend."
306.60,748.78,495.50,757.62,"/F17",9.96,"2. Integer proin ipsum habitant velit."
321.55,727.85,557.44,736.70,"/F8",9.96,"Integer nulla erat per. Viverra fames curae consequat"
306.60,715.90,557.46,724.75,"/F8",9.96,"commodo nulla velit cras et dolor. Commodo justo. Ali-"
306.60,703.94,565.75,712.79,"/F8",9.96,"quam lorem. Potenti etiam urna ligula id duis risus. Dapibus"
306.60,691.99,557.40,700.84,"/F8",9.96,"velit vel molestie a eleifend. Laoreet fusce. Iaculis ipsum"
306.60,680.03,557.41,688.88,"/F8",9.96,"ad libero hendrerit congue. Feugiat ipsum orci est quam."
306.60,668.08,557.40,676.93,"/F8",9.96,"Aliquam velit ipsum montes facilisi cum quis morbi. Conu-"
306.60,656.12,557.43,664.97,"/F8",9.96,"bia fames. Dapibus felis ut velit nam quam mattis po-"
306.60,644.17,557.42,653.01,"/F8",9.96,"tenti ad. Aliquet lorem eu ipsum varius arcu habitasse"
306.60,632.21,557.42,641.06,"/F8",9.96,"pellentesque. Nonummy massa purus auctor vestibulum."
306.60,620.26,557.46,629.10,"/F8",9.96,"Lacinia vitae cras a arcu fusce ve. Vivamus fusce. Vi-"
306.60,608.30,557.43,617.15,"/F8",9.96,"vamus neque id class. Posuere purus arcu dui consequat"
306.60,596.35,557.41,605.19,"/F8",9.96,"ultrices porta. Iaculis vitae nibh ad dignissim augue eni"
306.60,584.39,557.39,593.24,"/F8",9.96,"nisl pellentesque et class leo vehicula. Aliquet donec odio"
306.60,572.44,557.40,581.28,"/F8",9.96,"ullamcorper gravida scelerisque eget odio eni primis orci la-"
306.60,560.48,557.43,569.33,"/F8",9.96,"cus. Pretium class diam a eget metus laoreet ad. Gravida"
306.60,548.53,326.27,557.37,"/F8",9.96,"felis."
321.55,536.57,557.46,545.42,"/F8",9.96,"Commodo etiam erat conubia mi justo pellentesque."
306.60,524.62,557.38,533.46,"/F8",9.96,"Posuere justo sit eros habitant felis porttitor mollis felis"
306.60,512.66,557.43,521.51,"/F8",9.96,"ipsum varius. Integer metus magna facilisi mus lacinia"
306.60,500.71,557.40,509.55,"/F8",9.96,"ve. Feugiat neque diam lacinia conubia sociis vitae mollis."
306.60,488.75,557.42,497.60,"/F8",9.96,"Nonummy justo donec netus justo ultrices per. Aliquet"
306.60,476.80,557.40,485.64,"/F8",9.96,"vitae at tempor cum eu sollicitudin nisl sodales nisl mol-"
306.60,464.84,557.39,473.69,"/F8",9.96,"lis fermentum nascetur ve nec. Potenti felis eros quisque"
306.60,452.88,557.41,461.73,"/F8",9.96,"ad ante. Potenti morbi felis tortor vel eros inceptos fames"
306.60,440.93,557.44,449.78,"/F8",9.96,"sed tellus congue lacus feugiat aenean nulla ac. Aliquam"
306.60,428.97,557.38,437.82,"/F8",9.96,"fames ve velit eu lacus hendrerit nibh quam. Quisque risus"
306.60,417.02,557.43,425.87,"/F8",9.96,"morbi fusce. Dapibus nulla enim nec risus nam sed at."
306.60,405.06,557.39,413.91,"/F8",9.96,"Laoreet felis massa nibh tempus ve facilisi etiam tristique."
306.60,393.11,557.43,401.96,"/F8",9.96,"Posuere porta enim pharetra dis enim consectetuer non-"
306.60,381.15,557.41,390.00,"/F8",9.96,"ummy bibendum porta leo vestibulum proin. Feugiat pu-"
306.60,369.20,557.41,378.05,"/F8",9.96,"rus lorem eros dis sem per iaculis ac platea. Euismod felis."
306.60,357.24,557.44,366.09,"/F8",9.96,"Integer ipsum neque primis. Sodales lacus mi diam mus"
306.60,345.29,557.43,354.14,"/F8",9.96,"iaculis sagittis vivamus ad senectus sodales. Commodo pu-"
306.60,333.33,557.44,342.18,"/F8",9.96,"rus non eros id arcu risus tempor accumsan lacus. Viverra"
306.60,321.38,557.38,330.22,"/F8",9.96,"neque arcu justo ridiculus suscipit donec urna. Aliquet la-"
306.60,309.42,557.43,318.27,"/F8",9.96,"cus purus eros. Posuere vitae eni malesuada nisl diam eget"
306.60,297.47,557.40,306.31,"/F8",9.96,"feugiat vulputate habitant. Aliquam morbi nec adipiscing"
306.60,285.51,557.38,294.36,"/F8",9.96,"lorem rhoncus vehicula felis fringilla est eget tellus lorem."
321.55,273.56,569.64,282.40,"/F8",9.96,"Nonummy vitae urna a morbi ve neque non donec fringilla."
306.60,261.60,557.41,270.45,"/F8",9.96,"Aliquam netus parturient dictumst nisi quam. Rhoncus"
306.60,249.65,557.40,258.49,"/F8",9.96,"velit erat dolor ultrices massa pulvinar facilisis. Rhon-"
306.60,237.69,557.41,246.54,"/F8",9.96,"cus magna vitae netus nascetur ut vitae mauris ridiculus"
306.60,225.74,557.45,234.58,"/F8",9.96,"nascetur at. Integer risus fames ipsum massa. Conubia"
306.60,213.78,557.44,222.63,"/F8",9.96,"fusce eros fermentum dictumst mattis ligula. Commodo"
306.60,201.83,557.42,210.67,"/F8",9.96,"fames vivamus placerat id aenean primis. Aliquet justo"
306.60,189.87,557.41,198.72,"/F8",9.96,"pede lacinia ad nec hendrerit urna eni vitae nibh sem pede"
306.60,177.92,557.40,186.76,"/F8",9.96,"hac ante duis vulputate mattis. Viverra velit porta vi-"
306.60,165.96,557.43,174.81,"/F8",9.96,"tae fusce egestas. Natoque curae proin sagittis. Gravida"
306.60,154.01,557.41,162.85,"/F8",9.96,"proin donec potenti libero luctus ipsum. Rhoncus proin"
306.60,142.05,557.36,150.90,"/F8",9.96,"amet dolor quisque elit in curabitur tincidunt parturient"
306.60,130.10,557.43,138.94,"/F8",9.96,"nunc risus vivamus. Cubilia augue ve aenean bibendum"
306.60,118.14,557.40,126.99,"/F8",9.96,"felis cras platea. Aliquam purus est parturient donec ante"
306.60,106.18,557.41,115.03,"/F8",9.96,"ultricies eu cursus arcu gravida. Laoreet justo class justo"
306.60,94.23,557.43,103.08,"/F8",9.96,"fusce fames gravida fusce per. Viverra fames urna iaculis"
306.60,82.27,557.37,91.12,"/F8",9.96,"quis ridiculus sollicitudin adipiscing odio fermentum plac-"
295.15,61.35,300.13,70.20,"/F8",9.96,"2"
