37.61,748.78,288.43,757.62,"/F8",9.96,"lorem nibh. Posuere augue mi odio facilisis rutrum adip-"
37.61,736.82,149.72,745.67,"/F8",9.96,"iscing proin nisl dapibus."
157.71,736.82,222.67,745.67,"/F8",9.96,"Potenti metus."
230.66,736.82,288.40,745.67,"/F8",9.96,"Integer risus."
37.61,724.87,266.25,733.71,"/F8",9.96,"Pretium augue ad. Potenti felis vel. Rhoncus augue."
52.56,712.91,288.44,721.76,"/F8",9.96,"Cubilia neque arcu posuere id varius sit amet euismod"
37.61,700.96,288.44,709.80,"/F8",9.96,"montes et arcu. Nonummy justo. Gravida netus. Cubilia"
37.61,689.00,66.41,697.85,"/F8",9.96,"metus."
72.26,689.00,173.32,697.85,"/F8",9.96,"Integer fames et porta."
179.17,689.00,288.47,697.85,"/F8",9.96,"Rhoncus fames eu metus"
37.61,677.04,288.39,685.89,"/F8",9.96,"mi primis sollicitudin. Cubilia class elit dui magna eget eni"
37.61,665.09,148.66,673.94,"/F8",9.96,"aliquet tempus augue eu."
154.87,665.09,288.44,673.94,"/F8",9.96,"Sodales purus risus sem purus"
37.61,653.13,124.90,661.98,"/F8",9.96,"diam massa lacinia."
132.33,653.13,288.44,661.98,"/F8",9.96,"Potenti fusce neque ornare lobortis"
37.61,641.18,151.25,650.03,"/F8",9.96,"iaculis elit rhoncus sociis."
158.77,641.18,288.42,650.03,"/F8",9.96,"Lacinia vitae eget cras lacus."
37.61,629.22,128.84,638.07,"/F8",9.96,"Feugiat etiam proin."
137.17,629.22,288.41,638.07,"/F8",9.96,"Integer nulla velit nisi elementum"
37.61,617.27,288.40,626.11,"/F8",9.96,"ridiculus parturient cras felis amet. Iaculis massa ut auctor"
37.61,605.31,80.84,614.16,"/F8",9.96,"dignissim."
88.68,605.31,288.40,614.16,"/F8",9.96,"Aliquet metus amet viverra tellus lectus hac"
37.61,593.36,288.45,602.20,"/F8",9.96,"laoreet. Rhoncus curae ad lorem per sit vel mi proin cum"
37.61,581.40,89.09,590.25,"/F8",9.96,"arcu metus."
95.09,581.40,288.48,590.25,"/F8",9.96,"Commodo massa diam urna lacus curabitur"
37.61,569.45,288.44,578.29,"/F8",9.96,"lobortis. Conubia dolor eu imperdiet a. Nonummy curae."
37.61,557.49,288.40,566.34,"/F8",9.96,"Aliquam lacus potenti taciti elementum nulla nec. Viverra"
37.61,545.54,288.41,554.38,"/F8",9.96,"risus adipiscing sociosqu cubilia. Aliquam metus. Sodales"
37.61,533.58,64.70,542.43,"/F8",9.96,"etiam."
37.61,511.17,255.79,520.01,"/F27",9.96,"1.2. Blandit porta ad massa nec proin malesuada."
52.56,497.72,288.44,506.56,"/F8",9.96,"Aliquet class ac cum scelerisque egestas nulla nec urna."
37.61,485.76,288.41,494.61,"/F8",9.96,"Blandit morbi diam. Cubilia proin quis penatibus id eros"
37.61,473.81,147.88,482.65,"/F8",9.96,"hymenaeos tempus enim."
154.14,473.81,288.43,482.65,"/F8",9.96,"Pretium porta eget scelerisque"
37.61,461.85,298.75,470.70,"/F8",9.96,"sit diam fusce eget dapibus morbi metus orci leo sed. Dapibus"
37.61,449.90,288.43,458.74,"/F8",9.96,"metus ut metus ve dictum leo. Integer risus ut augue ul-"
37.61,437.94,288.41,446.79,"/F8",9.96,"lamcorper. Gravida augue nunc eni nisi ridiculus quis per"
37.61,425.99,151.48,434.83,"/F8",9.96,"non ve donec class mollis."
157.39,425.99,288.45,434.83,"/F8",9.96,"Natoque metus justo molestie"
37.61,414.03,129.08,422.88,"/F8",9.96,"justo class tellus sit."
137.09,414.03,288.39,422.88,"/F8",9.96,"Potenti proin id donec scelerisque"
37.61,402.08,288.42,410.92,"/F8",9.96,"sagittis penatibus eu porttitor quam consectetuer mau-"
37.61,390.12,50.95,398.97,"/F8",9.96,"ris."
56.82,390.12,118.38,398.97,"/F8",9.96,"Conubia velit."
124.25,390.12,185.77,398.97,"/F8",9.96,"Gravida risus."
191.63,390.12,266.25,398.97,"/F8",9.96,"Nonummy curae."
272.11,390.12,288.42,398.97,"/F8",9.96,"Ali-"
37.61,378.17,288.41,387.01,"/F8",9.96,"quet augue adipiscing ut interdum cursus nostra. Pretium"
37.61,366.21,288.83,375.06,"/F8",9.96,"justo. Gravida etiam nunc duis. Quisque proin felis phasel-"
37.61,354.26,93.50,363.10,"/F8",9.96,"lus ante per."
100.38,354.26,288.45,363.10,"/F8",9.96,"Nonummy fusce eu id urna lacus aliquam."
37.61,342.30,288.48,351.15,"/F8",9.96,"Natoque risus non dolor odio nonummy. Commodo netus"
37.61,330.34,288.43,339.19,"/F8",9.96,"orci in nam. Feugiat proin sem congue sapien nisl elit cu-"
37.61,318.39,288.38,327.24,"/F8",9.96,"rae placerat. Dapibus purus parturient pulvinar velit amet"
37.61,306.43,229.64,315.28,"/F8",9.96,"magna. Natoque augue mus nullam montes."
52.56,294.48,288.49,303.33,"/F8",9.96,"Conubia risus enim eros metus ac amet lorem cur-"
37.61,282.52,112.54,291.37,"/F8",9.96,"abitur maecenas."
120.86,282.52,288.46,291.37,"/F8",9.96,"Rhoncus fames duis sagittis mus pel-"
37.61,270.57,80.22,279.42,"/F8",9.96,"lentesque."
86.54,270.57,288.37,279.42,"/F8",9.96,"Laoreet velit orci et neque sit dis sollicitudin."
37.61,258.61,288.43,267.46,"/F8",9.96,"Pretium neque class augue eni blandit ipsum. Integer la-"
37.61,246.66,54.25,255.51,"/F8",9.96,"cus."
64.00,246.66,250.67,255.51,"/F8",9.96,"Blandit etiam vel vulputate pellentesque."
260.43,246.66,288.40,255.51,"/F8",9.96,"Iaculis"
37.61,234.70,228.04,243.55,"/F8",9.96,"justo porta sagittis amet ornare eni quam."
235.35,234.70,288.44,243.55,"/F8",9.96,"Pretium ne-"
37.61,222.75,288.44,231.60,"/F8",9.96,"tus enim habitasse mi at magnis. Potenti ipsum dui par-"
37.61,210.79,288.41,219.64,"/F8",9.96,"turient cursus quis condimentum. Vivamus justo id neque"
37.61,198.84,220.67,207.68,"/F8",9.96,"id ad eget class dignissim leo vulputate."
229.84,198.84,288.43,207.68,"/F8",9.96,"Sodales nulla"
37.61,186.88,144.51,195.73,"/F8",9.96,"vestibulum quam tellus."
152.81,186.88,288.42,195.73,"/F8",9.96,"Natoque purus iaculis conubia"
37.61,174.93,78.57,183.77,"/F8",9.96,"dictumst."
88.62,174.93,288.44,183.77,"/F8",9.96,"Rhoncus class vestibulum diam lorem sociis"
37.61,162.97,125.06,171.82,"/F8",9.96,"pharetra adipiscing."
132.79,162.97,288.44,171.82,"/F8",9.96,"Pretium morbi dis quis magna po-"
37.61,151.02,288.43,159.86,"/F8",9.96,"suere. Quisque morbi in orci porta. Sodales etiam id do-"
37.61,139.06,216.64,147.91,"/F8",9.96,"lor ut sociosqu commodo varius aenean."
224.15,139.06,288.47,147.91,"/F8",9.96,"Posuere porta."
37.61,127.11,164.30,135.95,"/F8",9.96,"Iaculis class sit massa enim."
172.45,127.11,288.47,135.95,"/F8",9.96,"Aliquet magna curae cum"
37.61,115.15,288.42,124.00,"/F8",9.96,"odio consequat nostra parturient pellentesque. Nonummy"
37.61,103.20,288.43,112.04,"/F8",9.96,"ipsum ad morbi convallis interdum nullam lectus porta"
37.61,91.24,288.44,100.09,"/F8",9.96,"fusce a luctus. Rhoncus proin dis pede. Laoreet metus in"
37.61,79.29,107.87,88.13,"/F8",9.96,"ligula curabitur."
306.60,748.78,448.83,757.62,"/F17",9.96,"2. Pretium etiam ac felis in."
321.55,727.85,568.61,736.70,"/F8",9.96,"Nonummy neque hac mattis ve interdum aliquet. Dapibus"
306.60,715.90,469.00,724.75,"/F8",9.96,"metus mus nunc lacinia erat eu eros."
474.90,715.90,557.45,724.75,"/F8",9.96,"Conubia donec ali-"
306.60,703.94,374.01,712.79,"/F8",9.96,"quam tristique."
381.43,703.94,557.37,712.79,"/F8",9.96,"Feugiat proin metus torquent porttitor."
306.60,691.99,557.40,700.84,"/F8",9.96,"Egestas justo dis praesent consectetuer lacinia imperdiet"
306.60,680.03,557.41,688.88,"/F8",9.96,"rutrum habitant. Natoque justo est amet vivamus urna ut."
306.60,668.08,557.44,676.92,"/F8",9.96,"Conubia augue pede mi dolor mattis lectus sagittis sus-"
306.60,656.12,459.41,664.97,"/F8",9.96,"pendisse faucibus vivamus rutrum."
465.71,656.12,557.41,664.97,"/F8",9.96,"Posuere metus justo."
306.60,644.17,557.44,653.01,"/F8",9.96,"Vivamus ipsum aliquet hymenaeos platea fames condimen-"
306.60,632.21,557.41,641.06,"/F8",9.96,"tum habitant. Pretium justo amet posuere risus vel conu-"
306.60,620.26,557.42,629.10,"/F8",9.96,"bia faucibus. Egestas vitae mi ornare consectetuer non me-"
306.60,608.30,557.41,617.15,"/F8",9.96,"tus vulputate ullamcorper fusce. Laoreet fames. Pretium"
306.60,596.35,367.96,605.19,"/F8",9.96,"donec erat id."
374.82,596.35,517.78,605.19,"/F8",9.96,"Vivamus etiam lacinia tellus ad."
524.64,596.35,557.44,605.19,"/F8",9.96,"Laoreet"
306.60,584.39,557.41,593.24,"/F8",9.96,"risus dolor. Iaculis neque quis egestas aptent tempor dolor"
306.60,572.44,322.08,581.28,"/F8",9.96,"eni."
329.78,572.44,557.38,581.28,"/F8",9.96,"Blandit purus eros phasellus sollicitudin leo vulpu-"
306.60,560.48,557.36,569.33,"/F8",9.96,"tate mauris vestibulum sollicitudin potenti ultrices. Eges-"
306.60,548.53,484.13,557.37,"/F8",9.96,"tas metus mi fermentum condimentum."
492.81,548.53,557.43,557.37,"/F8",9.96,"Potenti morbi."
306.60,536.57,557.43,545.42,"/F8",9.96,"Viverra fames dolor ante libero adipiscing. Conubia etiam"
306.60,524.62,461.83,533.46,"/F8",9.96,"diam condimentum. Gravida curae."
321.55,512.66,561.18,521.51,"/F8",9.96,"Laoreet lacus odio viverra in nisl porta laoreet habitasse."
306.60,500.71,557.44,509.55,"/F8",9.96,"Egestas magna vestibulum at malesuada a curabitur felis"
306.60,488.75,402.83,497.60,"/F8",9.96,"at et lectus nascetur."
412.14,488.75,557.43,497.60,"/F8",9.96,"Posuere fusce eu aenean penati-"
306.60,476.80,336.67,485.64,"/F8",9.96,"bus in."
343.24,476.80,465.44,485.64,"/F8",9.96,"Egestas fusce arcu pretium."
472.00,476.80,557.42,485.64,"/F8",9.96,"Lacinia nulla purus"
306.60,464.84,557.37,473.69,"/F8",9.96,"aptent ipsum. Potenti etiam vestibulum. Viverra velit orci"
306.60,452.88,557.42,461.73,"/F8",9.96,"egestas mi vehicula est consectetuer donec curae. Viverra"
306.60,440.93,557.39,449.78,"/F8",9.96,"metus. Cubilia class vel eget donec ultricies facilisi aenean"
306.60,428.97,557.40,437.82,"/F8",9.96,"auctor lacinia ad ante fames. Blandit lorem in pellentesque"
306.60,417.02,385.14,425.87,"/F8",9.96,"sociis metus cum."
392.24,417.02,456.02,425.87,"/F8",9.96,"Blandit etiam."
463.13,417.02,557.43,425.87,"/F8",9.96,"Quisque ipsum mi ac"
306.60,405.06,395.90,413.91,"/F8",9.96,"eu at urna tellus in."
402.55,405.06,557.41,413.91,"/F8",9.96,"Aliquam netus eros metus velit leo"
306.60,393.11,557.42,401.96,"/F8",9.96,"class primis. Viverra netus id fames mattis. Laoreet lorem"
306.60,381.15,557.42,390.00,"/F8",9.96,"donec ornare sed parturient. Natoque netus dui. Sodales"
306.60,369.20,557.43,378.04,"/F8",9.96,"ipsum curae tempus augue malesuada convallis parturient"
306.60,357.24,484.92,366.09,"/F8",9.96,"integer urna id consequat lacinia porta."
493.25,357.24,557.43,366.09,"/F8",9.96,"Natoque class."
306.60,345.29,509.72,354.13,"/F8",9.96,"Natoque risus sem phasellus mollis habitant."
519.36,345.29,557.43,354.13,"/F8",9.96,"Euismod"
306.60,333.33,335.41,342.18,"/F8",9.96,"metus."
340.95,333.33,557.44,342.18,"/F8",9.96,"Pretium lorem risus ante hac porta curae magnis"
306.60,321.38,502.18,330.22,"/F8",9.96,"fusce. Nonummy curae elit ac eleifend porta."
306.60,297.47,390.70,306.31,"/F27",9.96,"2.1. Posuere dolor."
321.55,282.52,538.67,291.37,"/F8",9.96,"Sodales ipsum sit dignissim mus vel ad ridiculus."
544.98,282.52,557.42,291.37,"/F8",9.96,"In-"
306.60,270.57,557.38,279.42,"/F8",9.96,"teger netus duis elit morbi auctor adipiscing sagittis velit"
306.60,258.61,557.43,267.46,"/F8",9.96,"hymenaeos. Feugiat netus eu non ac torquent cubilia cu-"
306.60,246.66,322.66,255.51,"/F8",9.96,"rae."
331.76,246.66,512.47,255.51,"/F8",9.96,"Aliquet neque netus dictumst ac tortor."
521.56,246.66,557.41,255.51,"/F8",9.96,"Dapibus"
306.60,234.70,534.48,243.55,"/F8",9.96,"fames eros mus diam id consectetuer laoreet purus."
541.13,234.70,557.44,243.55,"/F8",9.96,"Ali-"
306.60,222.75,557.44,231.59,"/F8",9.96,"quet donec non magnis nam nunc fringilla et primis con-"
306.60,210.79,557.42,219.64,"/F8",9.96,"sectetuer per magna. Cubilia felis sem parturient ac con-"
306.60,198.84,566.22,207.68,"/F8",9.96,"sectetuer cubilia mauris nam vel id taciti ornare eni. Dapibus"
306.60,186.88,557.39,195.73,"/F8",9.96,"etiam ut venenatis velit vitae. Feugiat neque arcu cursus"
306.60,174.93,373.97,183.77,"/F8",9.96,"quisque cursus."
382.56,174.93,557.43,183.77,"/F8",9.96,"Euismod fames fusce nec nascetur feu-"
306.60,162.97,557.39,171.82,"/F8",9.96,"giat interdum nunc arcu eget rutrum. Quisque felis etiam"
306.60,151.02,487.68,159.86,"/F8",9.96,"dui nibh at morbi consectetuer fringilla."
496.36,151.02,557.42,159.86,"/F8",9.96,"Laoreet porta"
306.60,139.06,557.41,147.91,"/F8",9.96,"cum metus tempus vestibulum facilisi cubilia odio enim"
306.60,127.11,370.98,135.95,"/F8",9.96,"quis hendrerit."
378.36,127.11,526.77,135.95,"/F8",9.96,"Gravida velit risus lectus orci ve."
534.15,127.11,557.37,135.95,"/F8",9.96,"Viva-"
306.60,115.15,557.41,124.00,"/F8",9.96,"mus felis iaculis taciti quam cras purus class sem. Gravida"
306.60,103.20,471.16,112.04,"/F8",9.96,"porta eu justo at hymenaeos potenti."
477.68,103.20,557.42,112.04,"/F8",9.96,"Potenti risus class"
306.60,91.24,557.39,100.09,"/F8",9.96,"pede rutrum venenatis parturient ante auctor phasellus."
306.60,79.29,557.41,88.13,"/F8",9.96,"Posuere proin commodo dis tincidunt pretium lectus per"
295.15,61.35,300.13,70.20,"/F8",9.96,"2"
