37.61,748.78,288.43,757.62,"/F8",9.96,"nibh lobortis class euismod. Cubilia purus sem sociosqu"
37.61,736.82,288.44,745.67,"/F8",9.96,"euismod posuere nonummy tincidunt at auctor vitae fe-"
37.61,724.87,288.47,733.71,"/F8",9.96,"lis etiam. Natoque etiam eni eget augue platea maece-"
37.61,712.91,288.44,721.76,"/F8",9.96,"nas donec. Natoque curae neque rutrum neque mauris ve."
37.61,700.96,288.38,709.80,"/F8",9.96,"Quisque netus dis volutpat consectetuer viverra. Iaculis fe-"
37.61,689.00,288.44,697.85,"/F8",9.96,"lis eu nullam. Commodo augue ut dolor ac ultricies felis ae-"
37.61,677.04,288.47,685.89,"/F8",9.96,"nean pede mi. Iaculis magna et ornare leo montes. Laoreet"
37.61,665.09,288.40,673.94,"/F8",9.96,"lacus elit ut duis suspendisse ut tortor vivamus. Vivamus"
37.61,653.13,288.43,661.98,"/F8",9.96,"fames ac morbi ultricies sit lorem sed. Posuere nulla sem"
37.61,641.18,288.45,650.03,"/F8",9.96,"quisque hac primis morbi dolor. Viverra fusce ad a amet"
37.61,629.22,288.44,638.07,"/F8",9.96,"nulla risus pharetra cum nunc vestibulum. Commodo cu-"
37.61,617.27,288.45,626.11,"/F8",9.96,"rae eget a pede ad tortor faucibus curae at hymenaeos risus"
37.61,605.31,288.43,614.16,"/F8",9.96,"sociis ut nec urna. Quisque risus. Natoque fames nec erat"
37.61,593.36,288.46,602.20,"/F8",9.96,"in. Dapibus magna ut aenean accumsan vestibulum tor-"
37.61,581.40,288.43,590.25,"/F8",9.96,"tor nam. Conubia proin vitae eget sit sapien rhoncus nisl"
37.61,569.45,288.44,578.29,"/F8",9.96,"fames sem leo. Lacinia class justo porta quisque iaculis."
37.61,557.49,145.46,566.34,"/F8",9.96,"Posuere vitae ut semper."
52.56,545.54,288.44,554.38,"/F8",9.96,"Dapibus justo. Cubilia netus. Vivamus augue mi fusce"
37.61,533.58,288.37,542.43,"/F8",9.96,"cursus. Cubilia felis duis cursus ut turpis aliquet blandit"
37.61,521.63,288.45,530.47,"/F8",9.96,"diam ut accumsan quisque. Sodales risus. Aliquam cu-"
37.61,509.67,288.42,518.52,"/F8",9.96,"rae parturient nascetur pretium cubilia quam pede cras"
37.61,497.72,288.43,506.56,"/F8",9.96,"iaculis. Natoque porta duis. Natoque donec vestibulum"
37.61,485.76,288.42,494.61,"/F8",9.96,"ultrices velit leo hac ut curabitur. Natoque fames adip-"
37.61,473.81,288.43,482.65,"/F8",9.96,"iscing eleifend cras tortor. Feugiat augue. Euismod ne-"
37.61,461.85,288.44,470.70,"/F8",9.96,"tus. Nonummy fusce proin turpis class magna sagittis est"
37.61,449.90,288.44,458.74,"/F8",9.96,"cras amet blandit. Euismod etiam. Conubia neque id ip-"
37.61,437.94,288.41,446.79,"/F8",9.96,"sum suspendisse eros tempor. Egestas nulla vestibulum in."
37.61,425.99,288.41,434.83,"/F8",9.96,"Aliquam nulla porta bibendum adipiscing taciti nibh erat"
37.61,414.03,288.43,422.88,"/F8",9.96,"turpis arcu urna diam nisl nec. Gravida etiam. Sodales"
37.61,402.08,288.42,410.92,"/F8",9.96,"ipsum eros vehicula eni. Quisque purus. Rhoncus netus"
37.61,390.12,288.39,398.97,"/F8",9.96,"fusce elit turpis dapibus feugiat montes rutrum fringilla"
37.61,378.17,288.41,387.01,"/F8",9.96,"imperdiet. Natoque justo id phasellus nisi consectetuer"
37.61,366.21,288.38,375.06,"/F8",9.96,"taciti aenean rhoncus quisque. Potenti class nibh ultricies"
37.61,354.26,288.38,363.10,"/F8",9.96,"mollis parturient sollicitudin dapibus eleifend lacinia po-"
37.61,342.30,131.38,351.15,"/F8",9.96,"suere taciti tincidunt."
52.56,330.34,288.43,339.19,"/F8",9.96,"Potenti class ut risus ad id. Quisque massa gravida in."
37.61,318.39,288.41,327.24,"/F8",9.96,"Dapibus neque eros a nibh vestibulum vulputate fusce non"
37.61,306.43,288.41,315.28,"/F8",9.96,"nec et netus in nisi morbi. Posuere nulla metus sit. Conu-"
37.61,294.48,288.42,303.33,"/F8",9.96,"bia metus nibh dignissim maecenas tellus tortor sit nisi"
37.61,282.52,288.44,291.37,"/F8",9.96,"parturient. Feugiat fusce proin a commodo mauris neque"
37.61,270.57,288.45,279.42,"/F8",9.96,"id per cras. Iaculis lacus donec lectus fusce. Nonummy"
37.61,258.61,288.42,267.46,"/F8",9.96,"curae pede eu eget nulla curabitur parturient. Posuere"
37.61,246.66,288.41,255.51,"/F8",9.96,"justo lacinia aliquam sapien lorem felis consequat ut sociis"
37.61,234.70,288.41,243.55,"/F8",9.96,"lacinia tellus dui. Posuere fames quam amet. Viverra velit"
37.61,222.75,288.42,231.60,"/F8",9.96,"et aptent viverra hac. Aliquet etiam eu netus vel class"
37.61,210.79,288.40,219.64,"/F8",9.96,"imperdiet condimentum imperdiet quis risus proin class."
37.61,198.84,288.45,207.68,"/F8",9.96,"Viverra curae nibh odio nam nunc nulla natoque ut. So-"
37.61,186.88,288.44,195.73,"/F8",9.96,"dales augue odio nisl. Vivamus dolor mi diam cras facilisis"
37.61,174.93,288.43,183.77,"/F8",9.96,"nibh eni diam mi pede. Aliquet lacus. Posuere fusce eni"
37.61,162.97,288.40,171.82,"/F8",9.96,"etiam cursus gravida integer eros ve felis in. Sodales velit"
37.61,151.02,288.43,159.86,"/F8",9.96,"curae duis hac netus adipiscing eu tellus. Posuere lacus"
37.61,139.06,288.41,147.91,"/F8",9.96,"adipiscing ve faucibus laoreet varius elit dolor sapien et."
37.61,127.11,288.44,135.95,"/F8",9.96,"Viverra magna. Euismod neque sit nibh erat eleifend fa-"
37.61,115.15,231.64,124.00,"/F8",9.96,"cilisi. Aliquet fusce id curae donec mus quis."
306.60,748.78,435.60,757.62,"/F27",9.96,"4.2. Aliquam massa eu nulla."
321.55,733.83,557.42,742.68,"/F8",9.96,"Integer morbi leo metus convallis pharetra taciti purus"
306.60,721.88,557.42,730.72,"/F8",9.96,"vestibulum suspendisse auctor ac nibh leo a ligula. Eu-"
306.60,709.92,557.40,718.77,"/F8",9.96,"ismod fusce. Feugiat risus ut nulla suscipit elementum"
306.60,697.97,557.42,706.81,"/F8",9.96,"lorem ad odio ipsum netus nulla. Feugiat justo nunc conse-"
306.60,686.01,557.42,694.86,"/F8",9.96,"quat lectus sociosqu adipiscing malesuada nulla nisi quam"
306.60,674.06,557.41,682.90,"/F8",9.96,"magna. Quisque risus duis ullamcorper iaculis. Aliquet"
306.60,662.10,557.41,670.95,"/F8",9.96,"vitae cras purus venenatis. Lacinia curae. Cubilia etiam."
306.60,650.15,557.42,658.99,"/F8",9.96,"Pretium dolor id maecenas dis. Integer class ve tellus mi"
306.60,638.19,557.38,647.04,"/F8",9.96,"amet. Gravida velit adipiscing faucibus cubilia ridiculus"
306.60,626.23,557.44,635.08,"/F8",9.96,"sociis. Vivamus augue quis nam. Aliquam felis. Egestas"
306.60,614.28,557.41,623.13,"/F8",9.96,"risus ad tortor per conubia in posuere nunc. Feugiat lacus."
306.60,602.32,557.41,611.17,"/F8",9.96,"Posuere class quam vel nibh. Aliquam neque diam cubilia."
306.60,590.37,557.43,599.22,"/F8",9.96,"Iaculis donec. Dapibus lacus feugiat odio. Posuere metus"
306.60,578.41,557.40,587.26,"/F8",9.96,"ipsum arcu ligula fringilla molestie tortor platea. Euis-"
306.60,566.46,557.41,575.31,"/F8",9.96,"mod augue. Quisque augue risus scelerisque in luctus dis"
306.60,554.50,504.43,563.35,"/F8",9.96,"pharetra ridiculus nam eni sollicitudin neque."
321.55,542.55,557.43,551.39,"/F8",9.96,"Gravida metus at ve varius sociosqu. Iaculis felis do-"
306.60,530.59,557.41,539.44,"/F8",9.96,"lor fermentum torquent magnis mollis sed in arcu volutpat"
306.60,518.64,557.42,527.48,"/F8",9.96,"vitae vivamus massa velit. Posuere morbi ut vitae diam"
306.60,506.68,557.42,515.53,"/F8",9.96,"aliquam tristique sociosqu metus ad fames. Gravida pu-"
306.60,494.73,557.40,503.57,"/F8",9.96,"rus ve felis porta tortor. Cubilia neque curae fusce nullam"
306.60,482.77,557.40,491.62,"/F8",9.96,"eu dui mollis. Aliquet porta. Feugiat vitae lacus aptent"
306.60,470.82,557.39,479.66,"/F8",9.96,"felis adipiscing id maecenas. Dapibus felis adipiscing. Ali-"
306.60,458.86,557.48,467.71,"/F8",9.96,"quet etiam sem erat massa magna dapibus. Laoreet do-"
306.60,446.91,557.41,455.75,"/F8",9.96,"lor. Lacinia porta donec vitae. Blandit purus netus facil-"
306.60,434.95,557.42,443.80,"/F8",9.96,"isi at massa convallis hac urna sem felis vulputate. Ali-"
306.60,423.00,557.44,431.84,"/F8",9.96,"quam fusce. Laoreet morbi arcu dui lacus tempus lacus."
306.60,411.04,557.42,419.89,"/F8",9.96,"Dapibus felis adipiscing maecenas justo a elit. Posuere"
306.60,399.09,557.38,407.93,"/F8",9.96,"ipsum odio lobortis pulvinar sollicitudin parturient com-"
306.60,387.13,557.41,395.98,"/F8",9.96,"modo odio. Aliquet felis integer cum adipiscing habitasse"
306.60,375.18,557.40,384.02,"/F8",9.96,"suspendisse tincidunt amet duis. Euismod augue pede elit"
306.60,363.22,557.39,372.07,"/F8",9.96,"per elit molestie porttitor velit. Lacinia nulla. Laoreet"
306.60,351.27,557.44,360.11,"/F8",9.96,"donec nonummy. Viverra ipsum vitae vivamus. Sodales"
306.60,339.31,500.08,348.16,"/F8",9.96,"netus ve montes et ornare aliquam ante nisi."
310.84,325.25,319.77,332.33,"/F19",7.97,"[1]"
324.75,325.25,536.49,332.33,"/F19",7.97,"R. MacPherson, Singularities of vector bundle maps, in:"
541.44,325.25,557.55,332.33,"/F19",7.97,"Pro-"
324.76,315.79,557.54,322.86,"/F19",7.97,"ceedings of Liverpool Singularities, Lecture Notes in Mathemat-"
324.76,306.32,390.64,313.40,"/F19",7.97,"ics, no. 192, 1981."
310.84,296.86,319.77,303.94,"/F19",7.97,"[2]"
324.75,296.86,546.82,303.94,"/F19",7.97,"V. Pati, What is the title??, Ph.D. thesis, Princeton (1985)."
310.84,287.39,319.77,294.47,"/F19",7.97,"[3]"
324.75,287.39,557.56,294.47,"/F19",7.97,"B. Totaro, Chern numbers for singular varieties and elliptic ho-"
324.76,277.93,423.28,285.01,"/F19",7.97,"mology, preprint? (1997?)."
310.84,268.46,319.77,275.54,"/F19",7.97,"[4]"
324.75,268.46,557.55,275.54,"/F19",7.97,"A. S. Dubson, Calcul des invariants numeriques des singularites"
324.76,259.00,463.30,266.08,"/F19",7.97,"et applications, where from?? (1981)."
310.84,249.53,319.77,256.61,"/F19",7.97,"[5]"
324.75,249.53,557.54,256.61,"/F19",7.97,"J. Biran˘con, P. Maisonobe, M. Merle, Localisation de systemes"
324.76,240.07,557.56,247.15,"/F19",7.97,"dierentiels, stratications de Whitney et condition de Thom,"
324.76,230.61,452.17,237.68,"/F19",7.97,"Invent. Math. 117 (1994) 531{550."
310.84,221.14,319.77,228.22,"/F19",7.97,"[6]"
324.75,221.14,333.74,228.22,"/F19",7.97,"G."
338.88,221.14,373.20,228.22,"/F19",7.97,"Kennedy,"
378.90,221.14,429.93,228.22,"/F19",7.97,"Specialization"
435.06,221.14,441.87,228.22,"/F19",7.97,"of"
447.01,221.14,498.23,228.22,"/F19",7.97,"MacPherson's"
503.36,221.14,525.94,228.22,"/F19",7.97,"Chern"
531.08,221.14,557.55,228.22,"/F19",7.97,"classes,"
324.76,211.68,438.31,218.75,"/F19",7.97,"Math. Scand. 66 (1990) 12{16."
310.84,202.21,319.77,209.29,"/F19",7.97,"[7]"
324.75,202.21,557.53,209.29,"/F19",7.97,"H. Whitney, Tangents to an analytic variety, Ann. of Math. 81"
324.76,192.75,383.07,199.83,"/F19",7.97,"(1965) 496{549."
310.84,183.28,319.77,190.36,"/F19",7.97,"[8]"
324.75,183.28,557.54,190.36,"/F19",7.97,"J.-P. Dax, Points singuliers normaux, points singuliers normaux"
324.76,173.82,557.57,180.90,"/F19",7.97,"simples et modeles d'elimination, C. R. Acad. Sci. Paris 315"
324.76,164.35,383.07,171.43,"/F19",7.97,"(1992) 315{319."
310.84,154.89,319.77,161.97,"/F19",7.97,"[9]"
324.75,154.89,557.54,161.97,"/F19",7.97,"P. Alu, Singular schemes of hypersurfaces, Duke Math. J. 80"
324.76,145.43,383.07,152.50,"/F19",7.97,"(1995) 325{351."
306.60,135.96,319.77,143.04,"/F19",7.97,"[10]"
324.75,135.96,557.53,143.04,"/F19",7.97,"G. Gonzalez-Sprinberg, Cycle maximal et invariant d'Euler local"
324.76,126.50,557.55,133.57,"/F19",7.97,"des singularites isolees de surfaces, Topology 21 (1982) 401{408."
306.60,117.03,319.77,124.11,"/F19",7.97,"[11]"
324.75,117.03,557.54,124.11,"/F19",7.97,"S. Halperin, D. Toledo, Stiefel{Whitney homology classes, Ann."
324.76,107.57,429.14,114.65,"/F19",7.97,"of Math. 96 (1972) 511{525."
306.60,98.10,319.77,105.18,"/F19",7.97,"[12]"
324.75,98.10,557.55,105.18,"/F19",7.97,"G. Kennedy, MacPherson's Chern classes of singular algebraic"
324.76,88.64,486.09,95.72,"/F19",7.97,"varieties, Comm. Alg. 18 (1990) 2821{2839."
295.15,61.35,300.13,70.20,"/F8",9.96,"6"
