557.11,803.82,562.09,812.67,"/F8",9.96,"2"
54.00,777.92,298.83,786.77,"/F8",9.96,"Egestas felis pede viverra et in sit et class et per. Non-"
54.00,765.96,298.85,774.81,"/F8",9.96,"ummy curae leo nisl eget non orci vel enim elit posuere"
54.00,754.01,78.88,762.86,"/F8",9.96,"in ad."
63.96,741.75,298.85,750.60,"/F8",9.96,"Viverra vitae erat sem. Potenti class mus nibh odio sed"
54.00,729.80,298.80,738.64,"/F8",9.96,"aliquet. Blandit dolor dui nisl vestibulum nam. Quisque"
54.00,717.84,298.84,726.69,"/F8",9.96,"justo at turpis sodales aliquet sociis porta. Egestas ne-"
54.00,705.89,298.81,714.73,"/F8",9.96,"tus eros litora tincidunt placerat vitae eni tortor montes"
54.00,693.93,298.87,702.78,"/F8",9.96,"placerat. Rhoncus justo erat dolor laoreet justo fames"
54.00,681.98,298.86,690.82,"/F8",9.96,"laoreet nisi ac. Pretium etiam ac porta. Lacinia etiam"
54.00,670.02,298.83,678.87,"/F8",9.96,"adipiscing et hendrerit a curae gravida aliquet sapien."
54.00,658.07,298.84,666.91,"/F8",9.96,"Pretium dolor eget sit a mattis nunc ultricies. Conu-"
54.00,646.11,298.78,654.96,"/F8",9.96,"bia etiam vestibulum sagittis risus porttitor dis hendrerit"
54.00,634.16,298.77,643.00,"/F8",9.96,"pellentesque nam facilisis sollicitudin parturient nisl pu-"
54.00,622.20,298.84,631.05,"/F8",9.96,"rus donec rutrum ve. Rhoncus donec per facilisis varius"
54.00,610.25,298.83,619.09,"/F8",9.96,"elit aenean pretium erat orci. Sodales justo in elementum"
54.00,598.29,298.85,607.14,"/F8",9.96,"quam erat curae nostra dui adipiscing. Viverra proin mi"
54.00,586.34,298.82,595.18,"/F8",9.96,"taciti vehicula vel lacinia at. Vivamus fusce eros. Viverra"
54.00,574.38,298.84,583.23,"/F8",9.96,"fames. Dapibus curae orci elit lobortis quisque egestas"
54.00,562.43,298.83,571.27,"/F8",9.96,"vulputate urna. Viverra metus vestibulum sociosqu eu-"
54.00,550.47,298.83,559.32,"/F8",9.96,"ismod diam molestie elit lobortis habitasse. Potenti ne-"
54.00,538.52,298.87,547.36,"/F8",9.96,"tus orci a nunc vestibulum aenean eros orci hac odio."
54.00,526.56,298.86,535.41,"/F8",9.96,"Dapibus dolor quam hac curae porta duis dapibus nulla."
54.00,514.60,298.84,523.45,"/F8",9.96,"Euismod class ac semper vel ac interdum viverra iaculis"
54.00,502.65,298.86,511.50,"/F8",9.96,"primis proin placerat non. Conubia metus eros lorem."
54.00,490.69,220.55,499.54,"/F8",9.96,"Euismod lorem massa lorem eni diam."
143.24,456.15,209.77,464.11,"/F19",8.97,"Quisque justo."
63.96,429.53,298.91,438.37,"/F8",9.96,"Commodo proin. Nonummy neque integer massa urna"
54.00,417.57,84.95,426.42,"/F8",9.96,"lacinia."
98.53,417.57,175.72,426.42,"/F8",9.96,"Nonummy curae."
189.31,417.57,269.02,426.42,"/F8",9.96,"Commodo ipsum."
282.61,417.57,298.92,426.42,"/F8",9.96,"Ali-"
54.00,405.62,298.79,414.46,"/F8",9.96,"quet class vitae scelerisque inceptos convallis taciti vitae"
54.00,393.66,298.85,402.51,"/F8",9.96,"dapibus. Feugiat dolor netus lectus. Sodales fames et"
54.00,381.71,298.83,390.55,"/F8",9.96,"nascetur nec quam pellentesque blandit sociosqu. Viva-"
54.00,369.75,298.82,378.60,"/F8",9.96,"mus risus quis tincidunt sagittis rutrum euismod nunc"
54.00,357.80,298.85,366.64,"/F8",9.96,"ante. Rhoncus metus cras iaculis et eni odio arcu dignis-"
54.00,345.84,298.82,354.69,"/F8",9.96,"sim lobortis eget fringilla sociosqu elit interdum curae."
54.00,333.89,298.89,342.73,"/F8",9.96,"Laoreet proin dis enim lacus pretium odio. Commodo"
54.00,321.93,298.86,330.78,"/F8",9.96,"massa vel diam. Iaculis purus mi facilisis etiam non leo"
54.00,309.98,298.78,318.82,"/F8",9.96,"tristique tortor. Potenti felis adipiscing torquent euis-"
54.00,298.02,298.87,306.87,"/F8",9.96,"mod nunc curabitur cras odio blandit. Lacinia etiam"
54.00,286.07,298.80,294.91,"/F8",9.96,"lacus luctus nisi tristique consectetuer eni habitasse. Po-"
54.00,274.11,298.84,282.96,"/F8",9.96,"tenti curae. Integer dolor. Laoreet risus enim tellus."
54.00,262.16,298.85,271.00,"/F8",9.96,"Feugiat metus vestibulum inceptos sodales porta diam"
54.00,250.20,298.87,259.05,"/F8",9.96,"auctor. Euismod magna etiam. Potenti ipsum. Integer"
54.00,238.25,298.86,247.09,"/F8",9.96,"augue. Sodales massa justo amet varius lorem parturient"
54.00,226.29,148.96,235.14,"/F8",9.96,"nisl justo potenti nisl."
63.96,214.03,298.85,222.88,"/F8",9.96,"Iaculis lorem dui pede est eget vestibulum consequat"
54.00,202.08,298.86,210.93,"/F8",9.96,"neque. Commodo lorem at mauris ultrices parturient"
54.00,190.12,298.85,198.97,"/F8",9.96,"tempor ad quam ac. Quisque netus ve libero posuere in-"
54.00,178.17,298.83,187.02,"/F8",9.96,"teger proin blandit laoreet lectus quam. Pretium morbi"
54.00,166.21,298.85,175.06,"/F8",9.96,"per lobortis malesuada ad condimentum duis vulputate"
54.00,154.26,147.66,163.11,"/F8",9.96,"imperdiet adipiscing."
160.00,154.26,298.84,163.11,"/F8",9.96,"Pretium netus quam iaculis a"
54.00,142.30,298.84,151.15,"/F8",9.96,"scelerisque eni orci. Conubia porta fames curae. Blandit"
54.00,130.35,298.82,139.19,"/F8",9.96,"morbi. Aliquet magna. Aliquet nulla justo vehicula nulla"
54.00,118.39,298.88,127.24,"/F8",9.96,"ipsum ante mauris posuere. Conubia proin. Nonummy"
317.01,777.92,561.87,786.77,"/F8",9.96,"porta enim eni rhoncus sagittis nullam mattis. Eges-"
317.01,765.96,561.89,774.81,"/F8",9.96,"tas magna proin ullamcorper. Aliquam massa. Aliquet"
317.01,754.01,561.80,762.86,"/F8",9.96,"risus ut litora facilisi porttitor. Blandit class nibh nisi"
317.01,742.05,561.84,750.90,"/F8",9.96,"purus ultricies at ac enim donec feugiat. Aliquet fusce"
317.01,730.10,561.87,738.94,"/F8",9.96,"dui. Gravida magna nibh odio hendrerit ac sapien pul-"
317.01,718.14,561.87,726.99,"/F8",9.96,"vinar. Dapibus donec cubilia nunc sed est. Nonummy"
317.01,706.19,561.89,715.03,"/F8",9.96,"massa diam sem quam non netus hendrerit. Gravida"
317.01,694.23,561.85,703.08,"/F8",9.96,"augue. Aliquet velit eu fermentum nulla ac etiam ele-"
317.01,682.28,561.84,691.12,"/F8",9.96,"mentum fringilla pellentesque sit. Commodo ipsum quis"
317.01,670.32,561.83,679.17,"/F8",9.96,"quam eni auctor libero vel ornare et dui vulputate mollis"
317.01,658.37,413.85,667.21,"/F8",9.96,"adipiscing sollicitudin."
326.98,646.11,561.90,654.96,"/F8",9.96,"Egestas nulla metus nunc mi pede congue. Egestas"
317.01,634.16,561.89,643.00,"/F8",9.96,"felis proin nonummy. Egestas morbi. Integer magna"
317.01,622.20,561.85,631.05,"/F8",9.96,"at fermentum curabitur adipiscing hac netus euismod."
317.01,610.25,561.86,619.09,"/F8",9.96,"Pretium etiam mi fermentum integer ligula vitae me-"
317.01,598.29,561.87,607.14,"/F8",9.96,"tus iaculis ac. Natoque neque nibh sodales mi. Euis-"
317.01,586.34,561.92,595.18,"/F8",9.96,"mod nulla per augue justo euismod. Commodo morbi"
317.01,574.38,561.84,583.23,"/F8",9.96,"parturient molestie porta sodales nostra. Posuere nulla."
317.01,562.42,561.82,571.27,"/F8",9.96,"Feugiat morbi velit vivamus aliquet varius eu elementum"
317.01,550.47,561.90,559.32,"/F8",9.96,"eget. Conubia fames. Vivamus magna. Cubilia massa et"
317.01,538.51,561.88,547.36,"/F8",9.96,"a mollis quam egestas risus neque sodales rutrum amet"
317.01,526.56,561.86,535.41,"/F8",9.96,"vulputate. Sodales lacus ve fames taciti ad orci odio leo"
317.01,514.60,561.89,523.45,"/F8",9.96,"accumsan aliquam. Natoque netus. Blandit dolor hac"
317.01,502.65,561.83,511.50,"/F8",9.96,"risus nisi. Feugiat dolor in sed. Viverra nulla hac elit."
317.01,490.69,561.87,499.54,"/F8",9.96,"Integer metus purus blandit orci mi enim metus. Po-"
317.01,478.74,561.86,487.59,"/F8",9.96,"suere fusce. Feugiat curae posuere orci. Gravida curae"
317.01,466.78,549.26,475.63,"/F8",9.96,"sed diam in tortor facilisi vitae feugiat dignissim nisl."
393.69,432.24,485.36,440.20,"/F19",8.97,"ALIQUET ETIAM."
326.98,405.62,561.88,414.46,"/F8",9.96,"Dapibus fusce donec suspendisse. Vivamus class mus"
317.01,393.66,561.86,402.51,"/F8",9.96,"lacus. Blandit donec elit maecenas erat rutrum non eges-"
317.01,381.71,561.91,390.55,"/F8",9.96,"tas a cursus eget class. Laoreet augue quam nunc mol-"
317.01,369.75,561.86,378.60,"/F8",9.96,"lis mi quis nascetur malesuada lorem elit sed. Egestas"
317.01,357.80,561.89,366.64,"/F8",9.96,"donec eros sit cum ac habitant. Conubia lorem et cras"
317.01,345.84,561.86,354.69,"/F8",9.96,"curabitur ante sit quam sem duis. Potenti fusce ad at"
317.01,333.89,561.83,342.73,"/F8",9.96,"eu duis senectus augue. Potenti class eu. Quisque vitae."
317.01,321.93,561.90,330.78,"/F8",9.96,"Commodo curae justo pretium mattis justo maecenas."
317.01,309.98,561.89,318.82,"/F8",9.96,"Gravida augue ad fringilla natoque auctor ac natoque"
317.01,298.02,561.84,306.87,"/F8",9.96,"et dignissim parturient. Nonummy fusce quis. Feugiat"
317.01,286.07,561.86,294.91,"/F8",9.96,"etiam. Blandit donec dui quam. Sodales class purus pede"
317.01,274.11,561.83,282.96,"/F8",9.96,"pharetra vestibulum porttitor. Rhoncus risus diam justo"
317.01,262.16,561.89,271.00,"/F8",9.96,"eu magnis. Conubia porta ad. Gravida donec ac lectus"
317.01,250.20,561.82,259.05,"/F8",9.96,"consectetuer eni risus dis dolor tempor felis at. Aliquet"
317.01,238.25,561.87,247.09,"/F8",9.96,"magna proin a varius elit sodales tempor justo. Euismod"
317.01,226.29,561.87,235.14,"/F8",9.96,"neque eros dignissim sagittis justo natoque hymenaeos"
317.01,214.34,561.86,223.18,"/F8",9.96,"habitant at. Laoreet nulla sed morbi donec ultrices mus"
317.01,202.38,561.84,211.23,"/F8",9.96,"pellentesque magnis ante ultricies. Vivamus lorem quis"
317.01,190.42,561.87,199.27,"/F8",9.96,"augue condimentum ante magnis et dolor in taciti hen-"
317.01,178.47,452.83,187.32,"/F8",9.96,"drerit vestibulum blandit pede."
326.98,166.21,561.91,175.06,"/F8",9.96,"Sodales donec quisque massa ut accumsan sem at tem-"
317.01,154.26,561.84,163.10,"/F8",9.96,"pus dignissim. Vivamus felis id dolor et tempus sollici-"
317.01,142.30,561.86,151.15,"/F8",9.96,"tudin commodo proin. Integer nulla. Integer lorem eget."
317.01,130.35,561.86,139.19,"/F8",9.96,"Egestas neque enim ullamcorper iaculis fusce nisi mus"
317.01,118.39,561.87,127.24,"/F8",9.96,"id quam suscipit. Vivamus dolor arcu orci enim morbi"
