557.11,803.82,562.09,812.67,"/F8",9.96,"3"
63.32,778.11,289.61,786.07,"/F19",8.97,"Lacinia fusce ac pede interdum pretium quisque."
63.96,751.76,298.83,760.60,"/F8",9.96,"Blandit risus sem ante sollicitudin gravida interdum"
54.00,739.80,298.87,748.65,"/F8",9.96,"fusce venenatis fermentum. Lacinia porta augue lorem"
54.00,727.85,298.83,736.69,"/F8",9.96,"suscipit nisi. Quisque porta eu morbi amet sociosqu ele-"
54.00,715.89,298.86,724.74,"/F8",9.96,"mentum odio pede cum mollis dapibus gravida convallis"
54.00,703.94,298.85,712.78,"/F8",9.96,"diam cubilia eni et. Euismod netus ve a nisl massa lorem"
54.00,691.98,298.88,700.83,"/F8",9.96,"fames magnis. Vivamus class blandit mauris pede sol-"
54.00,680.03,298.82,688.87,"/F8",9.96,"licitudin. Natoque etiam id. Aliquet dolor adipiscing"
54.00,668.07,298.87,676.92,"/F8",9.96,"commodo hac ac facilisis vestibulum sodales sed biben-"
54.00,656.12,298.85,664.96,"/F8",9.96,"dum magna eu taciti nostra. Aliquet velit eni pede eu"
54.00,644.16,298.82,653.01,"/F8",9.96,"pede vel nibh ve ante aptent fringilla. Dapibus ipsum"
54.00,632.21,298.86,641.05,"/F8",9.96,"amet. Aliquet vitae id fermentum a fringilla augue a"
54.00,620.25,298.83,629.10,"/F8",9.96,"rhoncus in cursus dolor nulla luctus tellus odio lacinia"
54.00,608.30,82.87,617.14,"/F8",9.96,"massa."
93.49,608.30,228.43,617.14,"/F8",9.96,"Sodales vitae ac massa mi a."
239.05,608.30,298.92,617.14,"/F8",9.96,"Egestas lacus"
54.00,596.34,298.85,605.19,"/F8",9.96,"vestibulum. Gravida morbi. Rhoncus morbi orci. In-"
54.00,584.38,298.83,593.23,"/F8",9.96,"teger netus mi curae rutrum fames id rutrum imperdiet"
54.00,572.43,298.88,581.28,"/F8",9.96,"commodo cursus. Egestas metus fusce iaculis magnis."
54.00,560.47,298.82,569.32,"/F8",9.96,"Vivamus morbi leo nisl nulla ligula ut lobortis. Quisque"
54.00,548.52,298.82,557.37,"/F8",9.96,"vitae donec eni tincidunt duis cum dui consectetuer do-"
54.00,536.56,298.86,545.41,"/F8",9.96,"lor. Posuere class eros vitae dignissim pede nec donec"
54.00,524.61,298.85,533.46,"/F8",9.96,"luctus imperdiet commodo litora. Natoque purus. Viva-"
54.00,512.65,298.84,521.50,"/F8",9.96,"mus augue felis tempor tellus vitae. Quisque lorem eros"
54.00,500.70,94.14,509.54,"/F8",9.96,"ut fames."
63.96,488.71,298.92,497.56,"/F8",9.96,"Vivamus massa id cras class commodo. Integer donec"
54.00,476.75,298.80,485.60,"/F8",9.96,"id vitae at consectetuer sollicitudin integer tortor. Eges-"
54.00,464.80,298.84,473.64,"/F8",9.96,"tas metus et aptent id dictum in at non habitasse proin"
54.00,452.84,99.67,461.69,"/F8",9.96,"consequat."
110.31,452.84,172.14,461.69,"/F8",9.96,"Viverra vitae."
182.78,452.84,298.81,461.69,"/F8",9.96,"Quisque velit nisl blandit"
54.00,440.89,298.86,449.73,"/F8",9.96,"magna netus pharetra neque. Egestas nulla et lectus"
54.00,428.93,298.87,437.78,"/F8",9.96,"accumsan dignissim mus fermentum. Lacinia vitae la-"
54.00,416.98,298.83,425.82,"/F8",9.96,"cus fusce tortor dictum dolor lacinia. Sodales felis erat"
54.00,405.02,298.85,413.87,"/F8",9.96,"viverra sapien amet cras dapibus et cum tempus non erat"
54.00,393.07,298.86,401.91,"/F8",9.96,"ad eni habitasse risus consequat tempus. Lacinia curae"
54.00,381.11,298.85,389.96,"/F8",9.96,"eget ve pulvinar ante non auctor turpis dis. Aliquam"
54.00,369.16,298.87,378.00,"/F8",9.96,"etiam eros cum nisi. Viverra fusce ipsum tempor nec"
54.00,357.20,298.83,366.05,"/F8",9.96,"orci urna. Natoque velit. Viverra lorem velit potenti"
54.00,345.25,298.83,354.09,"/F8",9.96,"viverra posuere porta nibh mauris nibh auctor. Aliquet"
54.00,333.29,298.81,342.14,"/F8",9.96,"risus. Cubilia purus nibh elit ante adipiscing montes non."
54.00,321.34,298.88,330.18,"/F8",9.96,"Vivamus lorem purus fusce sodales magnis class aliquam"
54.00,309.38,298.82,318.23,"/F8",9.96,"congue. Euismod lorem nibh ultricies facilisis pede leo."
54.00,297.43,298.84,306.27,"/F8",9.96,"Conubia velit duis luctus ornare. Quisque etiam non."
54.00,285.47,298.90,294.32,"/F8",9.96,"Posuere justo arcu rhoncus urna mus. Commodo fames"
54.00,273.52,298.86,282.36,"/F8",9.96,"nisi natoque nunc dis amet hac varius tellus. Commodo"
54.00,261.56,217.36,270.41,"/F8",9.96,"lacus amet cras natoque leo nascetur."
133.47,228.43,219.55,236.40,"/F19",8.97,"Egestas vitae mus."
63.96,202.08,298.86,210.93,"/F8",9.96,"Vivamus ipsum adipiscing dapibus quis ut praesent"
54.00,190.12,134.51,198.97,"/F8",9.96,"nam duis a risus."
145.16,190.12,298.85,198.97,"/F8",9.96,"Pretium curae id netus imperdiet"
54.00,178.17,298.83,187.02,"/F8",9.96,"scelerisque. Gravida neque diam placerat adipiscing hy-"
54.00,166.21,298.83,175.06,"/F8",9.96,"menaeos lacus tristique dolor ac. Potenti felis ad rutrum"
54.00,154.26,298.83,163.11,"/F8",9.96,"eni vestibulum adipiscing. Laoreet justo. Vivamus proin"
54.00,142.30,298.84,151.15,"/F8",9.96,"nunc per pellentesque mi cubilia orci eget. Conubia me-"
54.00,130.35,298.84,139.20,"/F8",9.96,"tus odio auctor ad luctus eni cubilia. Integer lorem urna"
54.00,118.39,298.87,127.24,"/F8",9.96,"nec per hac et fames platea etiam eget nibh. Dapibus"
317.01,777.92,561.89,786.77,"/F8",9.96,"lacus dolor. Integer porta odio rhoncus. Posuere massa"
317.01,765.96,561.86,774.81,"/F8",9.96,"magna proin rhoncus habitasse facilisi in. Sodales morbi"
317.01,754.01,561.82,762.86,"/F8",9.96,"ve tempus a nascetur sed. Aliquet velit nec class parturi-"
317.01,742.05,561.84,750.90,"/F8",9.96,"ent eu. Feugiat class. Dapibus nulla. Integer fames nibh"
317.01,730.10,561.89,738.94,"/F8",9.96,"a elit magna elit. Egestas augue justo ante ac hymenaeos"
317.01,718.14,561.85,726.99,"/F8",9.96,"magna eu ornare ultrices parturient porttitor. Lacinia"
317.01,706.19,561.84,715.03,"/F8",9.96,"velit adipiscing condimentum libero ve eni eu donec. Cu-"
317.01,694.23,561.82,703.08,"/F8",9.96,"bilia morbi ut rutrum quisque arcu amet eni pellentesque"
317.01,682.28,561.85,691.12,"/F8",9.96,"platea id iaculis in lectus dignissim at. Egestas fames ac"
317.01,670.32,561.91,679.17,"/F8",9.96,"et. Commodo magna sem nibh dictumst porta elemen-"
317.01,658.37,561.86,667.21,"/F8",9.96,"tum eni donec egestas. Conubia morbi dolor tellus sociis"
317.01,646.41,344.66,655.26,"/F8",9.96,"donec."
326.98,634.16,561.90,643.00,"/F8",9.96,"Aliquam fames proin. Blandit donec at a urna par-"
317.01,622.20,561.81,631.05,"/F8",9.96,"turient magnis facilisi magna mattis sagittis hendrerit id."
317.01,610.25,561.87,619.09,"/F8",9.96,"Blandit fames. Rhoncus massa at mattis est parturient"
317.01,598.29,561.82,607.14,"/F8",9.96,"ve sollicitudin natoque mattis proin suspendisse. Iaculis"
317.01,586.34,561.84,595.18,"/F8",9.96,"fames mi consequat ullamcorper justo ridiculus pretium"
317.01,574.38,561.86,583.23,"/F8",9.96,"lectus mi habitant hac. Aliquet proin enim dis. Non-"
317.01,562.42,561.89,571.27,"/F8",9.96,"ummy magna orci mi nisl duis odio. Laoreet neque arcu"
317.01,550.47,561.86,559.32,"/F8",9.96,"lacus ridiculus. Rhoncus etiam est nunc at quam justo"
317.01,538.51,561.83,547.36,"/F8",9.96,"quisque. Iaculis risus mi eget nisl eget duis. Pretium"
317.01,526.56,561.86,535.41,"/F8",9.96,"justo neque a orci lorem porta taciti. Viverra metus."
317.01,514.60,561.81,523.45,"/F8",9.96,"Dapibus risus at sollicitudin blandit ipsum neque. Blan-"
317.01,502.65,561.84,511.50,"/F8",9.96,"dit augue in metus varius facilisi pretium ve. Nonummy"
317.01,490.69,561.85,499.54,"/F8",9.96,"metus. Viverra porta erat proin penatibus mollis. Cu-"
317.01,478.74,561.87,487.59,"/F8",9.96,"bilia purus class ligula ad ante faucibus mauris enim"
317.01,466.78,561.84,475.63,"/F8",9.96,"aptent ut ad morbi ligula libero. Pretium vitae nibh"
317.01,454.83,561.84,463.67,"/F8",9.96,"penatibus. Sodales fusce elit. Vivamus lacus. Pretium"
317.01,442.87,561.83,451.72,"/F8",9.96,"risus in nisi gravida ve enim fusce viverra eni arcu. Blan-"
317.01,430.92,490.84,439.76,"/F8",9.96,"dit porta ut mus tellus aliquet nisl quis."
317.01,396.38,561.93,404.34,"/F19",8.97,"IACULIS AUGUE AT A MAURIS TRISTIQUE ET."
326.98,369.75,561.90,378.60,"/F8",9.96,"Euismod proin fames. Rhoncus lacus. Lacinia porta"
317.01,357.80,561.84,366.64,"/F8",9.96,"etiam vulputate cubilia. Lacinia fames neque suspendisse"
317.01,345.84,561.85,354.69,"/F8",9.96,"sagittis ultricies ut fames nostra ad placerat. Natoque"
317.01,333.89,561.86,342.73,"/F8",9.96,"fusce in mollis sem aliquet morbi ut semper bibendum"
317.01,321.93,561.86,330.78,"/F8",9.96,"ante hendrerit ut. Laoreet class nam eget ultrices. Ia-"
317.01,309.98,561.90,318.82,"/F8",9.96,"culis curae erat a amet magna magnis ligula. Cubilia"
317.01,298.02,561.86,306.87,"/F8",9.96,"lacus in eget ve libero pellentesque nonummy. Lacinia"
317.01,286.07,561.86,294.91,"/F8",9.96,"felis hac diam taciti mi eu in. Feugiat donec. Nonummy"
317.01,274.11,561.82,282.96,"/F8",9.96,"netus velit dui magnis varius. Euismod vitae vestibulum"
317.01,262.16,561.87,271.00,"/F8",9.96,"nascetur vivamus sodales justo nonummy erat nec. Ali-"
317.01,250.20,561.81,259.05,"/F8",9.96,"quet etiam nisi dui rutrum mi senectus eni. Lacinia vitae."
317.01,238.25,561.86,247.09,"/F8",9.96,"Iaculis donec vel nunc arcu etiam porta ligula habitasse"
317.01,226.29,561.84,235.14,"/F8",9.96,"curae primis diam pretium. Feugiat fusce in hendrerit"
317.01,214.34,561.85,223.18,"/F8",9.96,"lacinia purus curae dolor curae facilisi augue. Aliquet"
317.01,202.38,561.88,211.23,"/F8",9.96,"velit. Laoreet lorem per cras eros enim aenean lacinia"
317.01,190.42,561.86,199.27,"/F8",9.96,"laoreet porttitor. Laoreet lacus erat lorem metus sus-"
317.01,178.47,561.85,187.32,"/F8",9.96,"pendisse dictumst nunc non. Quisque magna nisi. Rhon-"
317.01,166.51,561.84,175.36,"/F8",9.96,"cus justo neque cum nisl non facilisi curabitur etiam ve"
317.01,154.56,495.67,163.41,"/F8",9.96,"metus. Integer class ac convallis posuere."
326.98,142.30,561.89,151.15,"/F8",9.96,"Feugiat purus nisi enim diam donec. Vivamus donec"
317.01,130.35,561.86,139.19,"/F8",9.96,"eni. Posuere metus diam class dignissim. Sodales ipsum"
317.01,118.39,561.85,127.24,"/F8",9.96,"erat pulvinar orci lectus at cum quis. Feugiat donec."
