557.11,803.82,562.09,812.67,"/F8",9.96,"6"
54.00,777.92,298.89,786.77,"/F8",9.96,"gue class dignissim nec. Commodo vitae posuere mus"
54.00,765.96,298.88,774.81,"/F8",9.96,"inceptos a. Aliquet augue diam. Vivamus lorem at leo"
54.00,754.01,298.83,762.86,"/F8",9.96,"arcu eni. Rhoncus fusce nisi nibh proin aptent sollici-"
54.00,742.05,298.80,750.90,"/F8",9.96,"tudin viverra neque sit quis faucibus. Viverra netus eni"
54.00,730.10,298.84,738.95,"/F8",9.96,"orci sed. Dapibus lorem ac volutpat ante. Quisque lorem"
54.00,718.14,143.83,726.99,"/F8",9.96,"sit sodales a semper."
111.01,683.60,241.95,691.56,"/F19",8.97,"Dapibus magna hac facilisis."
63.96,656.98,298.87,665.82,"/F8",9.96,"Dapibus curae. Aliquet massa id luctus ante. Non-"
54.00,645.02,298.86,653.87,"/F8",9.96,"ummy nulla diam nunc ultricies nisi eros dis odio."
54.00,633.07,298.86,641.91,"/F8",9.96,"Dapibus class lacus ultrices augue ut tempor sem urna"
54.00,621.11,298.86,629.96,"/F8",9.96,"habitant eu. Pretium lorem eget dui ante a. Rhoncus"
54.00,609.16,298.84,618.00,"/F8",9.96,"lorem proin nostra. Gravida lorem ac per nisi adipiscing"
54.00,597.20,298.89,606.05,"/F8",9.96,"ve. Laoreet donec justo. Posuere curae sem ante com-"
54.00,585.25,298.82,594.09,"/F8",9.96,"modo quisque taciti ridiculus magna justo tristique est"
54.00,573.29,298.82,582.14,"/F8",9.96,"blandit nunc. Euismod felis class potenti quam et netus"
54.00,561.34,298.87,570.18,"/F8",9.96,"et enim. Conubia purus orci massa ad torquent ante."
54.00,549.38,298.87,558.23,"/F8",9.96,"Sodales magna ipsum faucibus risus in auctor a sociosqu"
54.00,537.43,298.83,546.27,"/F8",9.96,"duis pulvinar potenti lorem. Cubilia porta adipiscing"
54.00,525.47,298.78,534.32,"/F8",9.96,"eros curabitur litora varius. Cubilia vitae cubilia suscipit"
54.00,513.52,298.80,522.36,"/F8",9.96,"sollicitudin feugiat. Pretium morbi urna ut consectetuer"
54.00,501.56,298.88,510.41,"/F8",9.96,"aliquam justo conubia per amet vestibulum nam magna"
54.00,489.61,298.89,498.45,"/F8",9.96,"nam ante massa. Nonummy justo at enim id ante nisl"
54.00,477.65,298.84,486.50,"/F8",9.96,"hendrerit litora. Egestas risus ad. Laoreet metus dolor"
54.00,465.70,298.80,474.54,"/F8",9.96,"elit fusce sagittis curabitur. Rhoncus curae nisl ultrices"
54.00,453.74,298.82,462.59,"/F8",9.96,"luctus risus sed lobortis lacinia conubia. Egestas etiam ut"
54.00,441.78,298.84,450.63,"/F8",9.96,"rutrum feugiat hymenaeos tempus nibh tortor senectus"
54.00,429.83,298.85,438.68,"/F8",9.96,"et fames ve proin. Aliquam fusce ut amet nibh pharetra"
54.00,417.87,137.87,426.72,"/F8",9.96,"felis. Sodales nulla."
63.96,405.62,298.85,414.46,"/F8",9.96,"Vivamus netus eget duis nisi praesent odio mi. Egestas"
54.00,393.66,298.85,402.51,"/F8",9.96,"class eget mattis phasellus lacus semper sociosqu etiam."
54.00,381.71,298.82,390.55,"/F8",9.96,"Lacinia lacus ut ultricies diam cum ligula vitae adipiscing"
54.00,369.75,298.79,378.60,"/F8",9.96,"elit. Vivamus class elit nisi dictumst pellentesque varius"
54.00,357.80,298.87,366.64,"/F8",9.96,"velit mus commodo ut. Aliquet fames enim ante class"
54.00,345.84,298.88,354.69,"/F8",9.96,"curae fames fusce urna. Natoque lorem. Aliquet magna"
54.00,333.89,298.83,342.73,"/F8",9.96,"risus lectus metus curabitur. Potenti neque. Laoreet"
54.00,321.93,298.88,330.78,"/F8",9.96,"lorem amet dictumst hac magnis vehicula netus con-"
54.00,309.98,298.86,318.82,"/F8",9.96,"sectetuer augue ve. Feugiat etiam cras ante vivamus."
54.00,298.02,298.88,306.87,"/F8",9.96,"Commodo massa ad penatibus adipiscing. Laoreet proin."
54.00,286.07,298.79,294.91,"/F8",9.96,"Lacinia velit et ante suscipit. Quisque class sit quis facil-"
54.00,274.11,298.83,282.96,"/F8",9.96,"isis tincidunt donec a. Sodales justo nisi posuere auctor"
54.00,262.16,298.85,271.00,"/F8",9.96,"at quis felis ve a erat et. Euismod donec class risus sem-"
54.00,250.20,298.82,259.05,"/F8",9.96,"per ultricies molestie lacus ligula et nulla ve. Integer"
54.00,238.25,298.85,247.09,"/F8",9.96,"netus. Gravida metus risus. Sodales metus sed etiam"
54.00,226.29,298.85,235.14,"/F8",9.96,"cras mauris mollis pretium habitasse. Sodales morbi ut"
54.00,214.34,298.84,223.18,"/F8",9.96,"tristique a dolor. Pretium morbi non purus. Euismod"
54.00,202.38,264.42,211.23,"/F8",9.96,"dolor parturient scelerisque tempus ve ac tortor."
63.96,190.12,298.86,198.97,"/F8",9.96,"Vivamus metus urna sagittis justo eu proin placerat"
54.00,178.17,298.88,187.01,"/F8",9.96,"diam egestas vivamus dictum nullam morbi. Rhoncus"
54.00,166.21,298.88,175.06,"/F8",9.96,"lorem. Cubilia etiam non sit sem sodales ad urna hy-"
54.00,154.26,298.86,163.10,"/F8",9.96,"menaeos mi rutrum rhoncus sapien nibh class. Posuere"
54.00,142.30,298.82,151.15,"/F8",9.96,"neque class nullam facilisis molestie nibh diam adipiscing"
54.00,130.35,298.80,139.19,"/F8",9.96,"dictum elit ullamcorper. Aliquet proin dui elit sem cur-"
54.00,118.39,298.84,127.24,"/F8",9.96,"sus ornare mus odio hac vel sollicitudin. Sodales fusce."
317.01,777.92,561.82,786.77,"/F8",9.96,"Feugiat velit in tempus. Integer dolor. Cubilia nulla urna"
317.01,765.96,561.77,774.81,"/F8",9.96,"tincidunt pellentesque mus tincidunt sollicitudin parturi-"
317.01,754.01,561.86,762.86,"/F8",9.96,"ent eros lacus suspendisse bibendum fermentum at. Po-"
317.01,742.05,561.81,750.90,"/F8",9.96,"suere dolor. Potenti velit adipiscing ut pellentesque po-"
317.01,730.10,561.86,738.94,"/F8",9.96,"suere primis lorem. Vivamus ipsum lacus aliquet erat"
317.01,718.14,561.87,726.99,"/F8",9.96,"arcu lacus curae cum nisi. Euismod risus dui hac. Eges-"
317.01,706.19,561.82,715.03,"/F8",9.96,"tas neque lacus cubilia hac facilisi laoreet. Blandit velit"
317.01,694.23,561.89,703.08,"/F8",9.96,"ac nostra id magnis mi eni. Laoreet donec lacus mauris"
317.01,682.28,561.88,691.12,"/F8",9.96,"pellentesque vivamus curae non. Vivamus magna neque"
317.01,670.32,561.82,679.17,"/F8",9.96,"urna eros rutrum ultricies sagittis montes nisi. Potenti"
317.01,658.37,561.83,667.21,"/F8",9.96,"felis in diam morbi feugiat tortor varius proin placerat."
317.01,646.41,561.88,655.26,"/F8",9.96,"Integer risus nibh. Natoque magna. Posuere class adip-"
317.01,634.46,561.89,643.30,"/F8",9.96,"iscing pharetra augue fames amet felis ad eu ac non. Vi-"
317.01,622.50,516.69,631.35,"/F8",9.96,"vamus porta at litora a vestibulum dis massa."
336.88,587.96,542.08,595.92,"/F19",8.97,"Potenti dolor duis varius quam cum congue."
326.98,561.34,561.86,570.18,"/F8",9.96,"Natoque purus est quis nisl potenti pretium ante"
317.01,549.38,561.88,558.23,"/F8",9.96,"ac. Iaculis lorem. Commodo netus amet duis potenti."
317.01,537.43,561.88,546.27,"/F8",9.96,"Lacinia lacus. Pretium neque odio magna ultrices fa-"
317.01,525.47,561.89,534.32,"/F8",9.96,"cilisis a sem hymenaeos nec metus. Sodales lacus sem"
317.01,513.51,561.84,522.36,"/F8",9.96,"vivamus ut orci maecenas adipiscing taciti sit. Aliquam"
317.01,501.56,561.86,510.41,"/F8",9.96,"morbi. Aliquet class neque mauris odio habitasse pel-"
317.01,489.60,561.82,498.45,"/F8",9.96,"lentesque nec tristique sociosqu et. Aliquet porta lacus"
317.01,477.65,561.84,486.50,"/F8",9.96,"lectus curae facilisi est pretium etiam nonummy urna ad."
317.01,465.70,561.83,474.54,"/F8",9.96,"Rhoncus neque lacus. Feugiat proin. Potenti felis ut id"
317.01,453.74,561.80,462.59,"/F8",9.96,"ligula tristique molestie. Cubilia felis in a eget adipiscing"
317.01,441.78,561.84,450.63,"/F8",9.96,"ad ultricies. Iaculis metus vel quam suscipit a molestie"
317.01,429.83,561.88,438.68,"/F8",9.96,"per. Natoque risus eget. Rhoncus etiam vel class mus"
317.01,417.87,561.86,426.72,"/F8",9.96,"nisi sociosqu cum. Gravida netus. Integer ipsum. Vi-"
317.01,405.92,561.86,414.77,"/F8",9.96,"vamus curae at sociis eleifend justo phasellus. Vivamus"
317.01,393.96,561.87,402.81,"/F8",9.96,"vitae. Gravida etiam. Lacinia augue arcu hac sagittis"
317.01,382.01,367.35,390.85,"/F8",9.96,"sollicitudin."
326.98,369.75,561.87,378.60,"/F8",9.96,"Viverra dolor nisi massa ligula. Potenti nulla adip-"
317.01,357.80,561.82,366.64,"/F8",9.96,"iscing. Feugiat justo integer aliquet quis laoreet est id"
317.01,345.84,561.83,354.69,"/F8",9.96,"neque sollicitudin. Integer proin. Potenti neque ut a"
317.01,333.89,561.87,342.73,"/F8",9.96,"erat at magna tincidunt accumsan. Euismod risus adip-"
317.01,321.93,561.90,330.78,"/F8",9.96,"iscing ac consectetuer. Nonummy class. Rhoncus magna"
317.01,309.98,561.88,318.82,"/F8",9.96,"metus commodo praesent dictum nullam torquent sus-"
317.01,298.02,561.84,306.87,"/F8",9.96,"pendisse placerat conubia eget adipiscing dis lacus elit."
317.01,286.07,561.87,294.91,"/F8",9.96,"Natoque porta cras morbi viverra platea fusce ullamcor-"
317.01,274.11,561.84,282.96,"/F8",9.96,"per mus dictum nascetur ridiculus. Feugiat risus ali-"
317.01,262.16,561.88,271.00,"/F8",9.96,"quet porta ut. Quisque massa nibh massa ornare in."
317.01,250.20,561.84,259.05,"/F8",9.96,"Potenti lorem duis imperdiet litora a sodales. Potenti"
317.01,238.25,561.85,247.09,"/F8",9.96,"purus massa ornare dictum porta etiam. Aliquet velit."
317.01,226.29,408.75,235.14,"/F8",9.96,"Dapibus augue erat."
418.98,226.29,561.90,235.14,"/F8",9.96,"Sodales massa quis gravida na-"
317.01,214.34,561.86,223.18,"/F8",9.96,"toque consectetuer convallis vitae id mauris. Commodo"
317.01,202.38,561.84,211.23,"/F8",9.96,"lorem sed donec risus rutrum felis dis curabitur purus"
317.01,190.42,561.85,199.27,"/F8",9.96,"in. Laoreet neque non. Pretium netus pede egestas nibh"
317.01,178.47,561.83,187.32,"/F8",9.96,"sagittis sit rhoncus. Pretium metus pede sodales turpis"
317.01,166.51,561.87,175.36,"/F8",9.96,"et pulvinar mus consectetuer. Dapibus fames eni mo-"
317.01,154.56,561.83,163.41,"/F8",9.96,"lestie hymenaeos. Lacinia fusce lacinia urna sollicitudin"
317.01,142.60,462.34,151.45,"/F8",9.96,"parturient nunc semper pharetra."
326.98,130.35,561.83,139.19,"/F8",9.96,"Viverra lorem. Aliquet dolor dui dictum at nibh luctus"
317.01,118.39,561.84,127.24,"/F8",9.96,"eu senectus amet varius eleifend vivamus cursus diam et."
