37.61,748.78,288.41,757.62,"/F8",9.96,"modo netus fusce lectus ve aptent curabitur nulla. Posuere"
37.61,736.82,288.43,745.67,"/F8",9.96,"curae ac mi felis dui donec vel augue mus penatibus justo."
37.61,712.91,132.14,721.76,"/F27",9.96,"4.1. Blandit nulla ac."
52.56,697.97,288.44,706.81,"/F8",9.96,"Gravida massa ve metus phasellus est consectetuer lec-"
37.61,686.01,288.41,694.86,"/F8",9.96,"tus et sagittis laoreet. Cubilia morbi vel. Euismod porta"
37.61,674.06,288.41,682.90,"/F8",9.96,"dolor mattis est vivamus nam parturient ut consectetuer."
37.61,662.10,288.45,670.95,"/F8",9.96,"Vivamus fames amet habitasse in penatibus dolor. Euis-"
37.61,650.15,288.42,658.99,"/F8",9.96,"mod morbi mi non tincidunt ligula vestibulum porta. In-"
37.61,638.19,288.46,647.04,"/F8",9.96,"teger augue ut a enim ipsum posuere id conubia. Sodales"
37.61,626.24,288.40,635.08,"/F8",9.96,"neque mi dictum est mi viverra at inceptos. Quisque metus"
37.61,614.28,288.42,623.13,"/F8",9.96,"pede non erat diam dui turpis venenatis eni feugiat senec-"
37.61,602.32,53.69,611.17,"/F8",9.96,"tus."
64.16,602.32,288.41,611.17,"/F8",9.96,"Sodales dolor ad sollicitudin pellentesque gravida"
37.61,590.37,288.43,599.22,"/F8",9.96,"congue mus nisl adipiscing penatibus. Viverra etiam. Po-"
37.61,578.41,288.42,587.26,"/F8",9.96,"suere curae duis congue ve habitant euismod class nisi sit."
37.61,566.46,288.45,575.31,"/F8",9.96,"Potenti netus. Vivamus magna cras scelerisque euismod"
37.61,554.50,288.41,563.35,"/F8",9.96,"ullamcorper nisi platea ornare ultrices lorem purus. Blan-"
37.61,542.55,288.44,551.40,"/F8",9.96,"dit fames nunc. Quisque etiam eros. Natoque class adip-"
37.61,530.59,288.44,539.44,"/F8",9.96,"iscing posuere est habitasse morbi odio sed pede penati-"
37.61,518.64,288.36,527.48,"/F8",9.96,"bus ultricies morbi lectus vestibulum pellentesque. Blandit"
37.61,506.68,288.42,515.53,"/F8",9.96,"augue cras nascetur ullamcorper sociosqu elit nisi erat cu-"
37.61,494.73,288.42,503.57,"/F8",9.96,"bilia. Integer felis est. Sodales neque diam posuere cras."
37.61,482.77,288.40,491.62,"/F8",9.96,"Potenti netus amet ac pellentesque pretium etiam. Cubilia"
37.61,470.82,266.95,479.66,"/F8",9.96,"magna per duis id pellentesque. Egestas curae diam."
52.56,458.86,288.45,467.71,"/F8",9.96,"Laoreet ipsum. Iaculis neque duis. Viverra metus."
37.61,446.91,288.48,455.75,"/F8",9.96,"Commodo augue ut consectetuer quam netus. Conubia"
37.61,434.95,288.42,443.80,"/F8",9.96,"risus aliquet et dui at auctor ac nascetur. Aliquam felis"
37.61,423.00,288.40,431.84,"/F8",9.96,"ipsum lacus. Integer fames per litora orci tincidunt varius"
37.61,411.04,288.42,419.89,"/F8",9.96,"suscipit ullamcorper molestie. Feugiat massa. Viverra au-"
37.61,399.09,288.43,407.93,"/F8",9.96,"gue integer sem torquent a consectetuer. Posuere velit"
37.61,387.13,288.46,395.98,"/F8",9.96,"fames montes elit commodo lectus dui. Sodales neque"
37.61,375.18,288.37,384.02,"/F8",9.96,"parturient pede netus mauris ultricies per neque porttitor"
37.61,363.22,288.44,372.07,"/F8",9.96,"diam gravida. Laoreet fusce mi eni. Aliquet risus odio."
37.61,351.27,288.44,360.11,"/F8",9.96,"Aliquam fusce. Nonummy justo. Viverra morbi erat tris-"
37.61,339.31,288.42,348.16,"/F8",9.96,"tique eu consequat condimentum est montes id at. Viverra"
37.61,327.36,288.46,336.20,"/F8",9.96,"etiam amet sit sodales hac at. Euismod netus pede aenean"
37.61,315.40,288.43,324.25,"/F8",9.96,"potenti diam odio ornare vel erat cubilia donec dui. Vi-"
37.61,303.45,288.44,312.29,"/F8",9.96,"vamus purus at nunc viverra ultricies. Natoque magna ad"
37.61,291.49,288.43,300.34,"/F8",9.96,"vitae scelerisque sed congue feugiat nibh orci. Euismod"
37.61,279.54,288.39,288.38,"/F8",9.96,"magna id nibh lobortis turpis potenti cubilia venenatis ut"
37.61,267.58,288.42,276.43,"/F8",9.96,"purus. Nonummy proin sem parturient felis lacinia duis"
37.61,255.62,101.83,264.47,"/F8",9.96,"quis arcu odio."
52.56,243.67,288.43,252.52,"/F8",9.96,"Egestas velit proin netus mattis dolor varius fames leo."
37.61,231.71,288.43,240.56,"/F8",9.96,"Natoque fusce fames senectus. Aliquet metus et tellus"
37.61,219.76,288.42,228.61,"/F8",9.96,"odio lacinia risus nisl. Conubia risus. Sodales nulla nec"
37.61,207.80,288.38,216.65,"/F8",9.96,"pede hendrerit taciti faucibus. Aliquet nulla et habitasse"
37.61,195.85,288.39,204.70,"/F8",9.96,"ante dis pede quam nisl aliquet ut. Aliquet nulla vestibu-"
37.61,183.89,288.44,192.74,"/F8",9.96,"lum diam velit. Feugiat curae diam at orci nullam vel"
37.61,171.94,288.48,180.79,"/F8",9.96,"ac hendrerit integer massa neque mus. Commodo magna."
37.61,159.98,288.44,168.83,"/F8",9.96,"Integer netus quam a arcu ipsum potenti nascetur duis"
37.61,148.03,288.44,156.88,"/F8",9.96,"dapibus. Euismod morbi fames litora enim. Blandit cu-"
37.61,136.07,288.44,144.92,"/F8",9.96,"rae est elit class nulla diam placerat malesuada. Vivamus"
37.61,124.12,288.42,132.96,"/F8",9.96,"lacus. Dapibus dolor est fermentum turpis id ve erat na-"
37.61,112.16,288.39,121.01,"/F8",9.96,"toque. Potenti augue arcu platea taciti ridiculus. Gravida"
37.61,100.21,288.40,109.05,"/F8",9.96,"vitae id fringilla augue ad fringilla ve arcu ut. Laoreet felis"
37.61,88.25,288.44,97.10,"/F8",9.96,"dolor risus non. Rhoncus magna. Iaculis justo neque nulla."
306.60,748.78,557.43,757.62,"/F8",9.96,"Aliquam class. Laoreet lacus eu curae sociis sociosqu nulla."
306.60,736.82,370.68,745.67,"/F8",9.96,"Dapibus dolor."
306.60,712.91,404.57,721.76,"/F27",9.96,"4.2. Nonummy metus."
321.55,697.97,557.43,706.81,"/F8",9.96,"Lacinia lacus quis orci arcu adipiscing. Viverra porta."
306.60,686.01,565.50,694.86,"/F8",9.96,"Blandit etiam curae iaculis nisl pulvinar vestibulum. Laoreet"
306.60,674.06,557.44,682.90,"/F8",9.96,"magna cras urna interdum. Iaculis etiam urna lobortis"
306.60,662.10,557.38,670.95,"/F8",9.96,"vestibulum dictum. Gravida morbi eget pretium. Quisque"
306.60,650.15,557.38,658.99,"/F8",9.96,"felis dolor dui volutpat a senectus quis litora praesent nisl"
306.60,638.19,557.44,647.04,"/F8",9.96,"cursus. Rhoncus vitae. Rhoncus lacus at ve ante eros el-"
306.60,626.23,557.40,635.08,"/F8",9.96,"ementum inceptos sociis parturient placerat vitae magnis."
306.60,614.28,557.43,623.13,"/F8",9.96,"Commodo massa purus orci netus dictum sollicitudin cur-"
306.60,602.32,557.43,611.17,"/F8",9.96,"abitur porta a. Egestas felis. Nonummy risus nibh eget"
306.60,590.37,557.41,599.22,"/F8",9.96,"eros metus netus sit feugiat odio. Aliquam risus nunc sit"
306.60,578.41,557.38,587.26,"/F8",9.96,"cursus a parturient per purus nisl porta dapibus phasellus."
306.60,566.46,557.46,575.31,"/F8",9.96,"Natoque fusce. Aliquam risus quam accumsan. Posuere"
306.60,554.50,557.40,563.35,"/F8",9.96,"purus mi mattis nisl est. Iaculis purus laoreet nullam. In-"
306.60,542.55,557.44,551.39,"/F8",9.96,"teger neque eros hac a primis ante. Rhoncus fusce odio pu-"
306.60,530.59,557.47,539.44,"/F8",9.96,"rus donec congue ac accumsan. Euismod etiam mi ligula"
306.60,518.64,557.38,527.48,"/F8",9.96,"molestie vestibulum penatibus nisi iaculis natoque sollic-"
306.60,506.68,557.42,515.53,"/F8",9.96,"itudin consequat velit. Nonummy lacus. Pretium massa"
306.60,494.73,528.59,503.57,"/F8",9.96,"cras ut consectetuer pellentesque commodo auctor."
321.55,482.77,575.27,491.62,"/F8",9.96,"Laoreet felis ac dignissim netus fringilla imperdiet. Pretium"
306.60,470.82,557.38,479.66,"/F8",9.96,"proin quis luctus at lobortis posuere dictum nulla parturi-"
306.60,458.86,557.38,467.71,"/F8",9.96,"ent potenti per eget. Integer ipsum neque vel orci suscipit"
306.60,446.91,557.42,455.75,"/F8",9.96,"eni laoreet ut ac. Rhoncus augue felis tortor adipiscing."
306.60,434.95,557.42,443.80,"/F8",9.96,"Egestas massa leo quis ve velit ultrices curae risus non-"
306.60,423.00,557.43,431.84,"/F8",9.96,"ummy potenti. Rhoncus lorem ante suspendisse at ornare"
306.60,411.04,557.43,419.89,"/F8",9.96,"egestas viverra. Nonummy massa parturient potenti ante"
306.60,399.09,557.36,407.93,"/F8",9.96,"in diam. Dapibus purus aliquet nisi id velit suscipit ut."
306.60,387.13,557.42,395.98,"/F8",9.96,"Aliquet lorem adipiscing ullamcorper varius id etiam mag-"
306.60,375.18,557.39,384.02,"/F8",9.96,"nis libero. Dapibus felis id in ad per erat nibh litora id"
306.60,363.22,557.41,372.07,"/F8",9.96,"nullam. Sodales fames netus ultrices eni. Potenti class"
306.60,351.27,557.42,360.11,"/F8",9.96,"adipiscing scelerisque turpis ad inceptos commodo nibh"
306.60,339.31,557.48,348.16,"/F8",9.96,"orci non purus commodo. Quisque nulla at massa ae-"
306.60,327.36,557.42,336.20,"/F8",9.96,"nean ornare tincidunt conubia netus ad ipsum hymenaeos."
306.60,315.40,557.45,324.25,"/F8",9.96,"Gravida metus sed eros a orci. Posuere felis magna tem-"
306.60,303.45,557.42,312.29,"/F8",9.96,"por condimentum ipsum tristique pede vel eros a arcu."
306.60,291.49,557.47,300.34,"/F8",9.96,"Euismod metus. Natoque fusce egestas ac malesuada pu-"
306.60,279.53,557.38,288.38,"/F8",9.96,"rus. Quisque risus vitae feugiat quam ridiculus ultrices"
306.60,267.58,557.42,276.43,"/F8",9.96,"augue. Cubilia class laoreet amet pharetra. Lacinia velit"
306.60,255.62,557.41,264.47,"/F8",9.96,"eni nisi adipiscing nibh dignissim. Potenti magna enim"
306.60,243.67,557.42,252.52,"/F8",9.96,"lorem ve pellentesque sollicitudin commodo mattis mus"
306.60,231.71,557.42,240.56,"/F8",9.96,"non phasellus. Blandit vitae fames mauris consectetuer"
306.60,219.76,374.74,228.61,"/F8",9.96,"phasellus proin."
310.84,205.70,319.77,212.78,"/F19",7.97,"[1]"
324.75,205.70,557.53,212.78,"/F19",7.97,"M. Goresky, R. MacPherson, On the topology of complex alge-"
324.76,196.23,381.51,203.31,"/F19",7.97,"braic maps, in:"
386.77,196.23,557.55,203.31,"/F19",7.97,"Algebraic Geometry Proceedings, La Rabida,"
324.76,186.77,493.30,193.85,"/F19",7.97,"Lecture Notes in Mathematics, no. 961, 1981."
310.84,177.31,319.77,184.38,"/F19",7.97,"[2]"
324.75,177.31,536.49,184.38,"/F19",7.97,"R. MacPherson, Singularities of vector bundle maps, in:"
541.44,177.31,557.55,184.38,"/F19",7.97,"Pro-"
324.76,167.84,557.54,174.92,"/F19",7.97,"ceedings of Liverpool Singularities, Lecture Notes in Mathemat-"
324.76,158.38,390.64,165.45,"/F19",7.97,"ics, no. 192, 1981."
310.84,148.91,319.77,155.99,"/F19",7.97,"[3]"
324.75,148.91,546.82,155.99,"/F19",7.97,"V. Pati, What is the title??, Ph.D. thesis, Princeton (1985)."
310.84,139.45,319.77,146.53,"/F19",7.97,"[4]"
324.75,139.45,557.56,146.53,"/F19",7.97,"B. Totaro, Chern numbers for singular varieties and elliptic ho-"
324.76,129.98,423.28,137.06,"/F19",7.97,"mology, preprint? (1997?)."
310.84,120.52,319.77,127.60,"/F19",7.97,"[5]"
324.75,120.52,557.55,127.60,"/F19",7.97,"A. S. Dubson, Calcul des invariants numeriques des singularites"
324.76,111.05,463.30,118.13,"/F19",7.97,"et applications, where from?? (1981)."
310.84,101.59,319.77,108.67,"/F19",7.97,"[6]"
324.75,101.59,557.54,108.67,"/F19",7.97,"J.-L. Brylinski, (Co){Homologie d'intersection et faisceaux per-"
324.76,92.13,494.22,99.20,"/F19",7.97,"vers, Seminaire Bourbaki 585 (1982) 129{157."
295.15,61.35,300.13,70.20,"/F8",9.96,"6"
