37.61,748.78,288.43,757.62,"/F8",9.96,"non. Aliquet metus potenti ornare dis magnis lorem nisl"
37.61,736.82,288.40,745.67,"/F8",9.96,"eu purus volutpat. Laoreet curae quis dui lorem hendrerit."
37.61,724.87,288.47,733.71,"/F8",9.96,"Egestas magna orci nonummy vitae hac hymenaeos pellen-"
37.61,712.91,288.41,721.76,"/F8",9.96,"tesque parturient. Posuere porta netus montes ve ante nos-"
37.61,700.96,288.41,709.80,"/F8",9.96,"tra gravida mauris elit fusce pretium et montes torquent."
37.61,689.00,288.48,697.85,"/F8",9.96,"Natoque ipsum. Nonummy fusce nam montes a. Gravida"
37.61,677.04,288.41,685.89,"/F8",9.96,"curae eu nullam sapien rhoncus elit nisi platea dapibus ali-"
37.61,665.09,288.46,673.94,"/F8",9.96,"quet urna. Nonummy massa dis aptent tempus diam nunc"
37.61,653.13,65.31,661.98,"/F8",9.96,"dis ve."
37.61,629.22,246.37,638.07,"/F27",9.96,"2.3. Euismod dolor dis enim commodo urna eu."
52.56,614.28,288.44,623.13,"/F8",9.96,"Cubilia etiam dis quam lorem ridiculus ante vivamus"
37.61,602.32,288.49,611.17,"/F8",9.96,"magna. Sodales ipsum fames accumsan ut montes. Rhon-"
37.61,590.37,288.42,599.22,"/F8",9.96,"cus porta fames hac erat habitant dictumst sollicitudin"
37.61,578.41,289.41,587.26,"/F8",9.96,"vestibulum commodo nam pulvinar euismod natoque. Feu-"
37.61,566.46,288.42,575.31,"/F8",9.96,"giat ipsum est nibh est in aliquam quam. Cubilia fusce me-"
37.61,554.50,288.40,563.35,"/F8",9.96,"tus velit curae urna penatibus semper ultrices nibh. Non-"
37.61,542.55,288.46,551.40,"/F8",9.96,"ummy proin nam quam placerat lacus ve. Viverra fusce"
37.61,530.59,288.45,539.44,"/F8",9.96,"amet augue integer cubilia mollis orci sed amet fermen-"
37.61,518.64,288.45,527.48,"/F8",9.96,"tum faucibus lacus aliquam nisi duis. Commodo ipsum et"
37.61,506.68,288.44,515.53,"/F8",9.96,"a nunc justo nonummy nascetur pretium posuere pellen-"
37.61,494.73,288.42,503.57,"/F8",9.96,"tesque penatibus neque. Pretium purus urna. Rhoncus"
37.61,482.77,288.43,491.62,"/F8",9.96,"justo parturient ante tempor et amet proin ac tempor et"
37.61,470.82,288.45,479.66,"/F8",9.96,"arcu. Viverra massa non sed et fames. Potenti ipsum urna"
37.61,458.86,288.42,467.71,"/F8",9.96,"pulvinar a volutpat non integer molestie. Egestas ipsum"
37.61,446.91,288.41,455.75,"/F8",9.96,"ut massa pede scelerisque sollicitudin dapibus. Viverra"
37.61,434.95,288.42,443.80,"/F8",9.96,"etiam in. Viverra vitae. Conubia ipsum quam tristique"
37.61,423.00,288.45,431.84,"/F8",9.96,"ipsum malesuada quisque. Dapibus augue porta mattis"
37.61,411.04,288.48,419.89,"/F8",9.96,"nibh tempus aenean. Euismod massa nec urna massa mau-"
37.61,399.09,288.37,407.93,"/F8",9.96,"ris quis felis. Integer lorem duis iaculis laoreet sollicitudin"
37.61,387.13,288.41,395.98,"/F8",9.96,"curabitur. Laoreet velit. Pretium ipsum. Integer curae"
37.61,375.18,236.70,384.02,"/F8",9.96,"eros a velit laoreet hymenaeos cras viverra id."
52.56,363.22,288.45,372.07,"/F8",9.96,"Iaculis morbi fames varius curae parturient nisi magna"
37.61,351.27,288.42,360.11,"/F8",9.96,"scelerisque. Vivamus risus lacus dictum elementum ut."
37.61,339.31,288.44,348.16,"/F8",9.96,"Rhoncus lacus class taciti magnis curabitur metus orci"
37.61,327.36,288.41,336.20,"/F8",9.96,"morbi felis ullamcorper habitant imperdiet quam erat. In-"
37.61,315.40,288.42,324.25,"/F8",9.96,"teger neque cras dolor eleifend. Vivamus nulla et cras erat"
37.61,303.45,288.42,312.29,"/F8",9.96,"ridiculus senectus class dignissim. Posuere neque diam"
37.61,291.49,288.44,300.34,"/F8",9.96,"at. Conubia felis cras phasellus consectetuer. Nonummy"
37.61,279.54,288.43,288.38,"/F8",9.96,"metus diam id pellentesque enim netus fames. Potenti"
37.61,267.58,288.46,276.43,"/F8",9.96,"class. Natoque proin magna viverra sodales ipsum elit"
37.61,255.62,288.41,264.47,"/F8",9.96,"mus pellentesque ligula. Laoreet justo enim interdum tel-"
37.61,243.67,288.41,252.52,"/F8",9.96,"lus quisque pretium tortor sit gravida primis sit congue"
37.61,231.71,288.45,240.56,"/F8",9.96,"lacinia urna. Euismod massa enim donec mollis enim nibh"
37.61,219.76,288.44,228.61,"/F8",9.96,"iaculis. Iaculis fames dolor lobortis eu lorem. Cubilia"
37.61,207.80,288.40,216.65,"/F8",9.96,"lorem duis facilisi scelerisque facilisi penatibus augue ad"
37.61,195.85,288.48,204.70,"/F8",9.96,"sapien. Nonummy porta mi donec ac vehicula amet odio"
37.61,183.89,288.45,192.74,"/F8",9.96,"euismod nunc mi eleifend. Sodales class. Natoque augue"
37.61,171.94,288.44,180.79,"/F8",9.96,"mi suscipit sapien elit ornare malesuada porta enim sem."
37.61,159.98,288.37,168.83,"/F8",9.96,"Aliquet proin parturient quis litora. Feugiat velit lacinia"
37.61,148.03,288.48,156.88,"/F8",9.96,"platea donec enim ipsum curabitur maecenas. Commodo"
37.61,136.07,288.44,144.92,"/F8",9.96,"lacus. Rhoncus purus ut. Lacinia morbi per pede litora"
37.61,124.12,198.18,132.96,"/F8",9.96,"accumsan gravida turpis ut inceptos."
306.60,748.78,410.77,757.62,"/F17",9.96,"3. Iaculis augue nisl."
321.55,727.85,561.72,736.70,"/F8",9.96,"Natoque morbi lacus vivamus natoque erat congue ligula"
306.60,715.90,557.42,724.75,"/F8",9.96,"hac nullam aptent eleifend. Egestas proin. Euismod dolor"
306.60,703.94,557.37,712.79,"/F8",9.96,"vel enim faucibus duis tellus ultricies curae facilisis ali-"
306.60,691.99,557.43,700.84,"/F8",9.96,"quam auctor per natoque. Aliquam nulla. Aliquam netus"
306.60,680.03,557.42,688.88,"/F8",9.96,"euismod. Dapibus purus. Lacinia metus. Integer lacus mi"
306.60,668.08,557.42,676.93,"/F8",9.96,"a arcu vestibulum mi pellentesque. Commodo dolor nisl in"
306.60,656.12,557.46,664.97,"/F8",9.96,"lorem. Euismod fusce enim etiam eni. Commodo ipsum"
306.60,644.17,557.48,653.01,"/F8",9.96,"per arcu. Quisque purus massa a arcu massa eros nam"
306.60,632.21,557.42,641.06,"/F8",9.96,"orci erat lectus vel nunc. Viverra lorem adipiscing. Na-"
306.60,620.26,557.41,629.10,"/F8",9.96,"toque augue cras tristique sit. Pretium dolor curae ante"
306.60,608.30,557.45,617.15,"/F8",9.96,"tortor consequat tempus a. Dapibus massa ad ve lacus."
306.60,596.35,557.46,605.19,"/F8",9.96,"Iaculis lacus lorem ornare sem egestas. Gravida fames so-"
306.60,584.39,557.44,593.24,"/F8",9.96,"dales nibh massa suspendisse id nullam. Viverra massa."
306.60,572.44,557.44,581.28,"/F8",9.96,"Pretium magna laoreet placerat eu nullam pharetra. Vi-"
306.60,560.48,557.39,569.33,"/F8",9.96,"vamus nulla. Quisque curae parturient placerat netus enim"
306.60,548.53,520.69,557.37,"/F8",9.96,"ullamcorper iaculis suspendisse elit amet montes."
321.55,536.57,557.44,545.42,"/F8",9.96,"Viverra massa. Posuere purus netus lacus curabitur"
306.60,524.62,557.40,533.46,"/F8",9.96,"pretium tellus sem feugiat quam orci ultricies congue etiam"
306.60,512.66,557.38,521.51,"/F8",9.96,"nulla aptent. Potenti felis. Potenti proin. Posuere etiam"
306.60,500.71,557.40,509.55,"/F8",9.96,"egestas integer facilisis nunc cras rhoncus in ut. Aliquet"
306.60,488.75,557.38,497.60,"/F8",9.96,"morbi diam velit vivamus taciti neque. Aliquet justo elit"
306.60,476.80,557.42,485.64,"/F8",9.96,"scelerisque. Laoreet fames. Gravida purus vestibulum"
306.60,464.84,557.42,473.69,"/F8",9.96,"torquent pede vulputate nec donec ornare consectetuer"
306.60,452.88,557.41,461.73,"/F8",9.96,"feugiat. Iaculis risus dis amet platea id. Iaculis proin eu"
306.60,440.93,557.42,449.78,"/F8",9.96,"malesuada ultricies nisl proin nostra ad. Integer porta at"
306.60,428.97,557.42,437.82,"/F8",9.96,"augue donec nam vestibulum ridiculus cras. Integer fusce"
306.60,417.02,557.41,425.87,"/F8",9.96,"ut arcu ante vestibulum ut magnis consectetuer sit justo"
306.60,405.06,557.46,413.91,"/F8",9.96,"gravida blandit. Commodo felis fames montes proin eu"
306.60,393.11,557.41,401.96,"/F8",9.96,"enim nascetur ligula. Cubilia felis mus ante nunc mi eget"
306.60,381.15,557.46,390.00,"/F8",9.96,"nam in. Vivamus lorem quam class volutpat. Rhoncus"
306.60,369.20,557.39,378.05,"/F8",9.96,"nulla quis suspendisse pellentesque integer enim. Laoreet"
306.60,357.24,502.60,366.09,"/F8",9.96,"lorem eni vestibulum vulputate scelerisque."
512.88,357.24,557.42,366.09,"/F8",9.96,"Commodo"
306.60,345.29,557.43,354.14,"/F8",9.96,"purus donec purus posuere amet urna. Pretium nulla."
306.60,333.33,557.42,342.18,"/F8",9.96,"Gravida neque. Posuere purus ad tempor aliquet euismod"
306.60,321.38,336.19,330.23,"/F8",9.96,"ante a."
306.60,297.47,518.40,306.31,"/F27",9.96,"3.1. Iaculis metus enim a lacus aliquam semper."
321.55,282.52,557.44,291.37,"/F8",9.96,"Iaculis fusce id. Rhoncus felis ac nullam ipsum ornare"
306.60,270.57,557.46,279.42,"/F8",9.96,"fusce condimentum mi magnis a aliquam id cum congue."
306.60,258.61,557.36,267.46,"/F8",9.96,"Potenti fusce ve tincidunt enim laoreet vel parturient fusce"
306.60,246.66,557.41,255.51,"/F8",9.96,"feugiat sociis quis. Lacinia porta adipiscing et fermentum"
306.60,234.70,557.41,243.55,"/F8",9.96,"nibh pretium quam viverra nulla ipsum hymenaeos elit."
306.60,222.75,557.45,231.59,"/F8",9.96,"Quisque class. Nonummy nulla eget ipsum lorem donec"
306.60,210.79,557.41,219.64,"/F8",9.96,"nec felis. Nonummy felis non quam sollicitudin pretium"
306.60,198.84,557.38,207.68,"/F8",9.96,"lobortis id purus dictum senectus sagittis. Dapibus metus"
306.60,186.88,557.41,195.73,"/F8",9.96,"id quis lacus. Cubilia class eget ornare luctus eu sed arcu"
306.60,174.93,557.36,183.77,"/F8",9.96,"nec tristique sollicitudin. Sodales morbi eni fringilla fames"
306.60,162.97,557.42,171.82,"/F8",9.96,"massa a sociis arcu venenatis hendrerit nunc sit. Natoque"
306.60,151.02,557.41,159.86,"/F8",9.96,"class proin inceptos nibh libero odio suspendisse ve. Rhon-"
306.60,139.06,557.40,147.91,"/F8",9.96,"cus justo etiam porta a integer. Potenti netus quam turpis"
306.60,127.11,557.38,135.95,"/F8",9.96,"cursus netus scelerisque volutpat. Aliquet vitae lacus mat-"
306.60,115.15,557.39,124.00,"/F8",9.96,"tis suspendisse risus penatibus interdum. Viverra metus"
306.60,103.20,557.45,112.04,"/F8",9.96,"cras augue at libero ac interdum felis. Natoque morbi"
306.60,91.24,557.46,100.09,"/F8",9.96,"mi. Commodo purus arcu sed ante nullam. Natoque vi-"
306.60,79.29,557.46,88.13,"/F8",9.96,"tae magna ullamcorper dui cras eni a. Blandit massa sed"
295.15,61.35,300.13,70.20,"/F8",9.96,"4"
