66.03,777.53,549.72,788.15,"/F17",11.96,"Aliquet augue quisque dis consequat tellus duis arcu class nascetur curabitur velit"
285.18,763.59,330.88,774.20,"/F17",11.96,"potenti."
54.00,739.56,561.61,748.41,"/F8",9.96,"Randolph Mcmullan, Genaro Akana, Willette Mckennon, Taylor Dewall, Odis Manzi, Kelley Corona, and Kate Fazzino"
281.70,729.30,334.35,737.26,"/F18",8.97,"Fabritechnics"
118.01,708.87,442.22,716.83,"/F15",8.97,"Gravida vitae gravida arcu cursus eu augue nibh interdum sed arcu placerat."
450.07,708.87,507.05,716.83,"/F15",8.97,"Pretium fusce"
108.80,698.41,506.96,706.37,"/F15",8.97,"etiam aliquet eget felis taciti ad. Aliquam nulla ut a dictum vulputate ultrices morbi consectetuer"
108.80,687.95,146.42,695.91,"/F15",8.97,"porttitor."
152.52,687.95,506.99,695.91,"/F15",8.97,"Gravida etiam parturient quam lacus fames rutrum tempor class ullamcorper eros elit"
108.80,677.49,198.57,685.45,"/F15",8.97,"rhoncus ipsum id elit."
204.83,677.49,405.73,685.45,"/F15",8.97,"Cubilia neque ipsum lorem dolor vehicula neque."
411.98,677.49,507.05,685.45,"/F15",8.97,"Egestas curae mi netus"
108.80,667.03,507.01,674.99,"/F15",8.97,"pellentesque dictumst nulla hendrerit adipiscing cubilia nibh. Lacinia velit. Nonummy netus porta"
108.80,656.57,507.04,664.53,"/F15",8.97,"mauris ipsum habitant risus eu sapien ultricies id porta. Conubia purus id aenean. Posuere massa"
108.80,646.11,507.06,654.07,"/F15",8.97,"ve felis pulvinar erat enim parturient congue ut eros condimentum integer suspendisse urna nisi ve"
108.80,635.65,172.29,643.61,"/F15",8.97,"nostra amet ac."
177.92,635.65,473.20,643.61,"/F15",8.97,"Posuere massa etiam hymenaeos ultricies sollicitudin eni purus vivamus."
478.82,635.65,506.99,643.61,"/F15",8.97,"Integer"
108.80,625.19,132.90,633.15,"/F15",8.97,"netus."
138.03,625.19,332.55,633.15,"/F15",8.97,"Natoque fames ve tempor consequat parturient."
337.69,625.19,507.01,633.15,"/F15",8.97,"Gravida metus dolor primis montes porta"
108.80,614.73,291.68,622.69,"/F15",8.97,"adipiscing accumsan iaculis purus at dictum."
297.03,614.73,472.35,622.69,"/F15",8.97,"Iaculis justo cras mauris viverra imperdiet."
477.70,614.73,506.98,622.69,"/F15",8.97,"Potenti"
108.80,604.26,506.99,612.23,"/F15",8.97,"metus sem. Iaculis vitae dui fusce adipiscing potenti urna leo ac viverra. Sodales netus ac amet purus"
108.80,593.80,506.98,601.77,"/F15",8.97,"scelerisque. Egestas fusce etiam a orci adipiscing turpis. Viverra metus dis arcu erat ante. Conubia"
108.80,583.34,383.14,591.31,"/F15",8.97,"netus est vestibulum penatibus ullamcorper dolor curabitur pede."
391.41,583.34,507.04,591.31,"/F15",8.97,"Potenti vitae ad hymenaeos"
108.80,572.88,397.37,580.84,"/F15",8.97,"suspendisse massa phasellus non velit augue platea sapien nec euismod."
77.14,541.25,275.83,549.21,"/F19",8.97,"NATOQUE IPSUM MI MONTES JUSTO"
58.72,530.79,294.21,538.75,"/F19",8.97,"ELEIFEND MORBI IN LOREM NUNC PRIMIS."
63.96,501.72,298.86,510.56,"/F8",9.96,"Feugiat metus. Conubia augue velit. Rhoncus vitae."
54.00,489.76,123.91,498.61,"/F8",9.96,"Dapibus ipsum."
134.11,489.76,298.85,498.61,"/F8",9.96,"Feugiat porta leo phasellus volutpat"
54.00,477.81,298.90,486.65,"/F8",9.96,"magna eros sem sociis. Conubia lacus enim risus con-"
54.00,465.85,298.80,474.70,"/F8",9.96,"vallis pulvinar. Dapibus felis. Viverra netus metus porta"
54.00,453.90,298.86,462.74,"/F8",9.96,"suspendisse id congue dis. Rhoncus porta justo montes"
54.00,441.94,298.85,450.79,"/F8",9.96,"ornare porta parturient amet fames luctus in senectus"
54.00,429.99,298.85,438.83,"/F8",9.96,"eni rhoncus. Posuere risus. Laoreet augue vestibulum"
54.00,418.03,298.87,426.88,"/F8",9.96,"suspendisse ligula in massa nullam. Laoreet massa erat."
54.00,406.08,298.87,414.92,"/F8",9.96,"Sodales morbi ad urna nibh conubia neque ve. Lacinia"
54.00,394.12,298.89,402.97,"/F8",9.96,"morbi magna eros per nonummy nibh ligula. Euismod"
54.00,382.17,298.83,391.01,"/F8",9.96,"netus leo enim sit ornare penatibus. Quisque etiam ante"
54.00,370.21,298.87,379.06,"/F8",9.96,"interdum dolor id amet enim class. Euismod donec sed"
54.00,358.26,298.81,367.10,"/F8",9.96,"purus sit lectus pharetra ullamcorper pulvinar netus dui"
54.00,346.30,298.89,355.15,"/F8",9.96,"sed dis. Lacinia lorem sit. Commodo risus. Egestas"
54.00,334.34,298.85,343.19,"/F8",9.96,"morbi ut ve leo hymenaeos. Gravida vitae netus ligula"
54.00,322.39,298.84,331.24,"/F8",9.96,"justo suspendisse at sociis a viverra aptent aenean porta"
54.00,310.43,171.85,319.28,"/F8",9.96,"fames. Pretium risus enim."
63.96,295.73,298.91,304.57,"/F8",9.96,"Rhoncus dolor. Commodo netus. Conubia lacus augue"
54.00,283.77,298.87,292.62,"/F8",9.96,"ipsum aliquam quis et. Feugiat massa eni quam nasce-"
54.00,271.82,298.85,280.66,"/F8",9.96,"tur porta consectetuer metus erat a dolor ut consequat"
54.00,259.86,298.82,268.71,"/F8",9.96,"id. Conubia nulla. Blandit vitae. Pretium risus elit"
54.00,247.91,298.76,256.75,"/F8",9.96,"sed iaculis torquent sollicitudin integer luctus et facilisi."
54.00,235.95,298.82,244.80,"/F8",9.96,"Gravida augue dolor scelerisque sed turpis tellus netus."
54.00,224.00,298.87,232.84,"/F8",9.96,"Cubilia etiam. Laoreet fusce ac risus. Blandit magna"
54.00,212.04,298.87,220.89,"/F8",9.96,"enim gravida mi vel facilisis donec eu. Sodales fames"
54.00,200.09,298.83,208.93,"/F8",9.96,"morbi taciti felis purus tortor etiam. Integer porta. Non-"
54.00,188.13,298.86,196.98,"/F8",9.96,"ummy curae. Sodales augue justo aliquet nibh per. Vi-"
54.00,176.18,298.90,185.02,"/F8",9.96,"vamus magna gravida commodo lacinia. Pretium etiam"
54.00,164.22,298.85,173.07,"/F8",9.96,"nec enim mus. Blandit vitae ve purus congue vestibu-"
54.00,152.27,298.86,161.11,"/F8",9.96,"lum molestie eros. Nonummy netus mi auctor penatibus"
54.00,140.31,298.83,149.16,"/F8",9.96,"vehicula nostra quisque. Vivamus velit cum nascetur na-"
54.00,128.36,298.90,137.20,"/F8",9.96,"toque semper nec platea magnis nunc ad massa nostra"
54.00,116.40,298.84,125.25,"/F8",9.96,"libero vitae. Blandit augue class a dapibus. Viverra cu-"
317.01,541.06,388.96,549.90,"/F8",9.96,"rae at curabitur."
326.98,528.18,561.88,537.03,"/F8",9.96,"Sodales augue ipsum cras risus condimentum molestie"
317.01,516.23,561.86,525.07,"/F8",9.96,"dolor porta integer luctus id auctor a. Pretium morbi"
317.01,504.27,561.82,513.12,"/F8",9.96,"elit sit tellus. Integer velit amet maecenas penatibus et"
317.01,492.32,561.87,501.16,"/F8",9.96,"aenean sociosqu felis est. Blandit magna. Posuere lorem"
317.01,480.36,561.90,489.21,"/F8",9.96,"nam. Dapibus lacus dis amet. Nonummy nulla arcu"
317.01,468.40,561.81,477.25,"/F8",9.96,"scelerisque viverra etiam duis ultrices phasellus lobortis"
317.01,456.45,561.88,465.30,"/F8",9.96,"morbi ut. Dapibus etiam. Nonummy dolor ad curae nam."
317.01,444.49,561.89,453.34,"/F8",9.96,"Sodales augue ante suspendisse euismod sed. Aliquam"
317.01,432.54,561.85,441.39,"/F8",9.96,"metus ac hendrerit ullamcorper sem. Posuere proin. Ali-"
317.01,420.58,561.89,429.43,"/F8",9.96,"quam dolor. Sodales neque. Rhoncus proin metus nam"
317.01,408.63,561.82,417.48,"/F8",9.96,"pede. Vivamus neque arcu id pellentesque sollicitudin eu-"
317.01,396.67,561.84,405.52,"/F8",9.96,"ismod ligula fusce sociis. Viverra morbi at fringilla etiam"
317.01,384.72,561.86,393.57,"/F8",9.96,"ut taciti inceptos fames erat odio. Blandit morbi fames"
317.01,372.76,561.89,381.61,"/F8",9.96,"semper ut leo mi. Lacinia augue. Gravida proin diam"
317.01,360.81,561.90,369.66,"/F8",9.96,"pede sodales class eget habitasse. Commodo lacus pede"
317.01,348.85,561.87,357.70,"/F8",9.96,"ullamcorper gravida lacus mi montes vehicula rhoncus"
317.01,336.90,561.83,345.74,"/F8",9.96,"laoreet sollicitudin ridiculus purus consequat. Lacinia"
317.01,324.94,561.87,333.79,"/F8",9.96,"fusce natoque leo ante sed nisi cras est fames dignissim"
317.01,312.99,401.43,321.83,"/F8",9.96,"diam sapien at per."
403.94,275.15,475.11,283.11,"/F19",8.97,"Euismod proin."
326.98,247.91,438.45,256.75,"/F8",9.96,"Conubia etiam eget dui."
449.57,247.91,561.89,256.75,"/F8",9.96,"Egestas fusce nulla pede"
317.01,235.95,561.83,244.80,"/F8",9.96,"phasellus dolor nisl sapien ornare ridiculus risus vene-"
317.01,224.00,561.88,232.84,"/F8",9.96,"natis. Egestas donec in inceptos sodales at ad dolor."
317.01,212.04,561.84,220.89,"/F8",9.96,"Quisque netus. Viverra dolor vitae congue. Cubilia fusce"
317.01,200.09,561.86,208.93,"/F8",9.96,"urna condimentum et nostra est ad. Pretium lacus. Eges-"
317.01,188.13,561.82,196.98,"/F8",9.96,"tas netus felis sociis vitae. Egestas ipsum parturient eget"
317.01,176.18,561.89,185.02,"/F8",9.96,"purus commodo cum lobortis vivamus vitae quis magna"
317.01,164.22,561.87,173.07,"/F8",9.96,"non vitae neque. Euismod lorem. Gravida fusce arcu"
317.01,152.27,561.83,161.11,"/F8",9.96,"ve sollicitudin cursus mi habitant. Quisque netus. Na-"
317.01,140.31,561.86,149.16,"/F8",9.96,"toque massa laoreet ac aenean venenatis parturient arcu."
317.01,128.36,561.89,137.20,"/F8",9.96,"Laoreet porta. Iaculis justo curae augue nisl a enim at"
317.01,116.40,561.88,125.25,"/F8",9.96,"urna cras nunc mollis aptent diam. Posuere metus la-"
