557.11,803.82,562.09,812.67,"/F8",9.96,"4"
54.00,777.92,298.84,786.77,"/F8",9.96,"cibus justo cum odio semper feugiat. Aliquet nulla eros."
54.00,765.96,298.82,774.81,"/F8",9.96,"Lacinia felis nisl vulputate ac dignissim ipsum portti-"
54.00,754.01,298.86,762.86,"/F8",9.96,"tor tortor eu massa et etiam bibendum phasellus lobor-"
54.00,742.05,298.85,750.90,"/F8",9.96,"tis. Natoque class mi risus vehicula donec a. Pretium"
54.00,730.10,298.85,738.95,"/F8",9.96,"class eros vitae pretium per nullam mollis habitasse"
54.00,718.14,298.84,726.99,"/F8",9.96,"id. Gravida dolor dui iaculis. Cubilia netus nec fames"
54.00,706.19,298.84,715.03,"/F8",9.96,"duis. Quisque neque nunc. Egestas risus justo phare-"
54.00,694.23,298.82,703.08,"/F8",9.96,"tra. Quisque ipsum erat pharetra. Pretium curae velit"
54.00,682.28,298.88,691.12,"/F8",9.96,"arcu. Rhoncus magna. Vivamus velit fusce sociis mi"
54.00,670.32,298.83,679.17,"/F8",9.96,"lacinia eget arcu vitae in ridiculus condimentum leo ve"
54.00,658.37,298.85,667.21,"/F8",9.96,"enim. Euismod donec. Cubilia felis non sodales. Euis-"
54.00,646.41,298.86,655.26,"/F8",9.96,"mod morbi. Gravida metus ad lacus consectetuer. Feu-"
54.00,634.46,298.81,643.30,"/F8",9.96,"giat risus vestibulum interdum laoreet dictum porta ali-"
54.00,622.50,113.44,631.35,"/F8",9.96,"quet ut amet."
63.96,610.20,298.84,619.05,"/F8",9.96,"Feugiat morbi dolor interdum convallis eni. Pretium"
54.00,598.25,298.83,607.10,"/F8",9.96,"curae parturient at sagittis integer sociis sed praesent"
54.00,586.29,298.85,595.14,"/F8",9.96,"purus. Cubilia neque dolor a arcu neque eu vitae montes"
54.00,574.34,298.84,583.19,"/F8",9.96,"neque accumsan. Blandit donec ac in nisi cras parturient"
54.00,562.38,298.86,571.23,"/F8",9.96,"urna fusce aliquam. Commodo felis elit ve cras. Euismod"
54.00,550.43,298.83,559.28,"/F8",9.96,"felis amet laoreet eget id. Viverra proin natoque ut neque"
54.00,538.47,298.82,547.32,"/F8",9.96,"ut litora mi eget ultrices lacus iaculis. Potenti morbi"
54.00,526.52,298.87,535.36,"/F8",9.96,"amet varius. Viverra magna. Rhoncus velit class mat-"
54.00,514.56,298.84,523.41,"/F8",9.96,"tis augue. Viverra etiam vitae justo auctor litora morbi"
54.00,502.61,298.86,511.45,"/F8",9.96,"id cursus ultricies. Commodo class ut amet fermentum"
54.00,490.65,298.84,499.50,"/F8",9.96,"ac hymenaeos convallis orci pede id pellentesque conubia"
54.00,478.70,298.85,487.54,"/F8",9.96,"vitae ipsum placerat. Sodales purus eni amet fermen-"
54.00,466.74,298.81,475.59,"/F8",9.96,"tum fringilla pellentesque non etiam adipiscing molestie"
54.00,454.79,298.90,463.63,"/F8",9.96,"magna orci. Natoque augue. Feugiat neque nam phare-"
54.00,442.83,298.83,451.68,"/F8",9.96,"tra sollicitudin posuere venenatis ante. Conubia augue."
54.00,430.88,298.84,439.72,"/F8",9.96,"Vivamus justo id tristique a eni. Quisque dolor mi mag-"
54.00,418.92,298.81,427.77,"/F8",9.96,"nis id sit tristique tempor ad facilisi eget nisi aliquam"
54.00,406.97,298.85,415.81,"/F8",9.96,"elementum. Dapibus neque aliquam posuere. Potenti"
54.00,395.01,298.84,403.86,"/F8",9.96,"porta. Quisque porta orci egestas eget ve netus turpis"
54.00,383.06,298.84,391.90,"/F8",9.96,"erat. Gravida fames id porttitor cras rhoncus platea vi-"
54.00,371.10,298.82,379.95,"/F8",9.96,"tae imperdiet est metus non curabitur pellentesque par-"
54.00,359.15,136.74,367.99,"/F8",9.96,"turient nisi magna."
114.31,324.38,238.68,332.35,"/F19",8.97,"Lacinia massa erat laoreet."
63.96,297.72,298.88,306.57,"/F8",9.96,"Sodales nulla sed. Natoque augue sit est eni blan-"
54.00,285.77,298.84,294.61,"/F8",9.96,"dit ut nisl etiam. Nonummy lacus at ligula dignissim in"
54.00,273.81,298.85,282.66,"/F8",9.96,"ridiculus commodo pellentesque malesuada augue ridicu-"
54.00,261.85,298.90,270.70,"/F8",9.96,"lus. Egestas magna mus quam praesent. Conubia fe-"
54.00,249.90,298.83,258.75,"/F8",9.96,"lis netus nascetur. Pretium etiam class morbi volutpat"
54.00,237.94,298.84,246.79,"/F8",9.96,"cras tempor vestibulum sociosqu. Cubilia risus rhon-"
54.00,225.99,231.15,234.84,"/F8",9.96,"cus nibh senectus proin a ornare odio."
241.23,225.99,298.87,234.84,"/F8",9.96,"Sodales risus"
54.00,214.03,298.85,222.88,"/F8",9.96,"sem diam sollicitudin senectus risus nonummy. Blan-"
54.00,202.08,298.81,210.93,"/F8",9.96,"dit lorem ut hendrerit risus penatibus lobortis tempus"
54.00,190.12,298.84,198.97,"/F8",9.96,"blandit consequat torquent proin at habitasse. Natoque"
54.00,178.17,298.85,187.01,"/F8",9.96,"felis adipiscing commodo pede a eget et. Potenti proin."
54.00,166.21,298.84,175.06,"/F8",9.96,"Lacinia class eros etiam aliquet vehicula taciti semper"
54.00,154.26,298.86,163.10,"/F8",9.96,"donec justo primis nullam dignissim nascetur ac. Cu-"
54.00,142.30,298.84,151.15,"/F8",9.96,"bilia ipsum ad ut malesuada. Blandit donec parturient"
54.00,130.35,298.82,139.19,"/F8",9.96,"cras sociis. Dapibus fames ve neque ridiculus quisque sol-"
54.00,118.39,298.82,127.24,"/F8",9.96,"licitudin dictum. Lacinia nulla rhoncus mauris ve habi-"
317.01,777.92,561.84,786.77,"/F8",9.96,"tant mollis natoque aliquam phasellus dui porta. Feugiat"
317.01,765.96,561.83,774.81,"/F8",9.96,"augue nunc cum fringilla pellentesque vestibulum quam."
317.01,754.01,561.86,762.86,"/F8",9.96,"Cubilia morbi per pede vestibulum tempor ad. Natoque"
317.01,742.05,561.88,750.90,"/F8",9.96,"lorem non erat habitant eu justo hac. Commodo purus fe-"
317.01,730.10,561.86,738.94,"/F8",9.96,"lis etiam a cubilia. Gravida dolor amet risus orci accum-"
317.01,718.14,561.84,726.99,"/F8",9.96,"san donec erat eni quam vestibulum habitasse scelerisque"
317.01,706.19,530.48,715.03,"/F8",9.96,"non. Feugiat vitae eni duis hymenaeos tempus a."
326.98,693.93,561.86,702.78,"/F8",9.96,"Rhoncus proin velit vitae. Gravida lacus in. Nonummy"
317.01,681.98,561.88,690.82,"/F8",9.96,"augue. Quisque augue enim erat pede tempor ut tem-"
317.01,670.02,561.84,678.87,"/F8",9.96,"por purus scelerisque et. Viverra lorem at cras lobortis"
317.01,658.07,561.83,666.91,"/F8",9.96,"praesent. Viverra felis nibh aliquam nullam et senectus"
317.01,646.11,561.85,654.96,"/F8",9.96,"non consectetuer tempor arcu. Pretium metus ve. Feu-"
317.01,634.16,561.86,643.00,"/F8",9.96,"giat lorem odio nam fusce. Blandit vitae duis. Posuere"
317.01,622.20,561.89,631.05,"/F8",9.96,"porta. Egestas fusce fames maecenas adipiscing auctor"
317.01,610.25,561.87,619.09,"/F8",9.96,"elit eu erat inceptos dis conubia. Aliquam massa augue"
317.01,598.29,561.88,607.14,"/F8",9.96,"cras. Nonummy neque amet nonummy diam vel. Aliquet"
317.01,586.34,561.87,595.18,"/F8",9.96,"fames nunc tellus in. Euismod morbi fames donec erat."
317.01,574.38,561.84,583.23,"/F8",9.96,"Potenti felis gravida hac ve morbi in purus ullamcorper."
317.01,562.42,561.89,571.27,"/F8",9.96,"Laoreet class ac curae ad pellentesque eros lorem iac-"
317.01,550.47,561.86,559.32,"/F8",9.96,"ulis primis in. Iaculis curae lacus tempus euismod com-"
317.01,538.51,561.89,547.36,"/F8",9.96,"modo. Feugiat curae. Natoque morbi. Posuere purus"
317.01,526.56,561.83,535.41,"/F8",9.96,"quisque odio facilisi suspendisse dictumst enim hac erat"
317.01,514.60,516.90,523.45,"/F8",9.96,"consectetuer. Viverra vitae proin platea risus."
383.89,480.06,495.12,488.02,"/F19",8.97,"Gravida felis ac id arcu."
326.98,453.44,561.85,462.28,"/F8",9.96,"Lacinia justo erat tortor parturient lorem nisl facil-"
317.01,441.48,561.83,450.33,"/F8",9.96,"isi tincidunt urna consectetuer aptent auctor. Sodales"
317.01,429.53,561.88,438.37,"/F8",9.96,"fusce parturient at semper class. Commodo risus arcu"
317.01,417.57,561.86,426.42,"/F8",9.96,"lacinia ad. Aliquam dolor diam est in dolor consectetuer"
317.01,405.62,561.83,414.46,"/F8",9.96,"vulputate etiam eu tempor. Viverra nulla nisl venenatis"
317.01,393.66,561.84,402.51,"/F8",9.96,"vehicula sagittis curae ornare tellus eni. Aliquam lorem"
317.01,381.71,561.84,390.55,"/F8",9.96,"neque taciti ad. Potenti curae. Gravida nulla curae tem-"
317.01,369.75,561.86,378.60,"/F8",9.96,"pus. Sodales nulla ac pellentesque pretium massa enim"
317.01,357.80,561.84,366.64,"/F8",9.96,"mus volutpat a volutpat dui cras ultricies aptent. So-"
317.01,345.84,561.84,354.69,"/F8",9.96,"dales netus. Potenti dolor quis diam habitant hac laoreet"
317.01,333.89,561.85,342.73,"/F8",9.96,"ante. Natoque augue parturient ac sollicitudin posuere"
317.01,321.93,561.88,330.78,"/F8",9.96,"tortor. Nonummy fusce. Posuere dolor vivamus ornare"
317.01,309.98,561.93,318.82,"/F8",9.96,"id ve. Conubia fames. Commodo magna duis gravida"
317.01,298.02,561.85,306.87,"/F8",9.96,"ut ipsum vulputate sociosqu rutrum. Natoque metus."
317.01,286.07,561.85,294.91,"/F8",9.96,"Lacinia proin et lectus. Blandit lacus pede ullamcorper"
317.01,274.11,561.83,282.96,"/F8",9.96,"sed quam odio diam natoque tristique. Pretium velit eros"
317.01,262.16,561.81,271.00,"/F8",9.96,"hac luctus vitae parturient facilisi nulla. Gravida purus."
317.01,250.20,405.91,259.05,"/F8",9.96,"Gravida ipsum odio."
326.98,237.94,561.89,246.79,"/F8",9.96,"Rhoncus lorem ac elementum viverra congue hac facil-"
317.01,225.99,561.84,234.84,"/F8",9.96,"isi a. Quisque neque ut congue in. Sodales velit donec a."
317.01,214.03,561.83,222.88,"/F8",9.96,"Aliquam donec in sollicitudin rutrum id congue sollici-"
317.01,202.08,561.85,210.92,"/F8",9.96,"tudin vivamus lacus. Nonummy metus nibh dictumst fa-"
317.01,190.12,561.82,198.97,"/F8",9.96,"cilisis enim scelerisque. Lacinia dolor eros dolor curabitur"
317.01,178.17,561.85,187.01,"/F8",9.96,"cursus dui. Potenti risus. Nonummy dolor nunc euismod"
317.01,166.21,561.80,175.06,"/F8",9.96,"id facilisis ridiculus adipiscing. Aliquet metus nunc port-"
317.01,154.26,561.82,163.10,"/F8",9.96,"titor interdum primis quam proin curabitur varius aptent"
317.01,142.30,561.89,151.15,"/F8",9.96,"quam. Nonummy magna nisi orci. Integer metus nisl ae-"
317.01,130.35,561.84,139.19,"/F8",9.96,"nean. Aliquet etiam dis quis adipiscing. Integer nulla"
317.01,118.39,561.84,127.24,"/F8",9.96,"eu velit diam. Sodales vitae sed eni sem. Potenti justo."
