37.61,748.78,288.48,757.62,"/F8",9.96,"Conubia donec quam diam nascetur consequat mus mae-"
37.61,736.82,288.46,745.67,"/F8",9.96,"cenas laoreet ac eni nunc dui netus sed. Commodo purus"
37.61,724.87,288.46,733.71,"/F8",9.96,"id eros enim commodo natoque euismod lectus erat. Eges-"
37.61,712.91,129.81,721.76,"/F8",9.96,"tas felis fames porta."
135.82,712.91,222.37,721.76,"/F8",9.96,"Natoque etiam nisl."
228.39,712.91,288.43,721.76,"/F8",9.96,"Iaculis morbi."
37.61,700.96,288.42,709.80,"/F8",9.96,"Dapibus vitae ut eros. Sodales donec morbi venenatis tel-"
37.61,689.00,288.40,697.85,"/F8",9.96,"lus curae eu. Cubilia nulla ut class varius suspendisse vi-"
37.61,677.04,53.64,685.89,"/F8",9.96,"tae."
59.49,677.04,288.44,685.89,"/F8",9.96,"Pretium curae ipsum lacinia ad litora gravida conu-"
37.61,665.09,53.64,673.94,"/F8",9.96,"bia."
61.74,665.09,126.45,673.94,"/F8",9.96,"Vivamus class."
134.55,665.09,288.46,673.94,"/F8",9.96,"Vivamus ipsum nunc laoreet ac id"
37.61,653.13,59.72,661.98,"/F8",9.96,"nibh."
67.54,653.13,288.44,661.98,"/F8",9.96,"Euismod purus orci mauris ve nullam elementum"
37.61,641.18,288.41,650.03,"/F8",9.96,"lacus et congue tincidunt libero a parturient nam. Sodales"
37.61,629.22,288.46,638.07,"/F8",9.96,"magna sed congue a eleifend urna nostra. Gravida purus"
37.61,617.27,288.40,626.11,"/F8",9.96,"fusce neque per donec integer nulla. Blandit purus ut dic-"
37.61,605.31,155.38,614.16,"/F8",9.96,"tum nascetur porta quam."
163.00,605.31,288.43,614.16,"/F8",9.96,"Aliquam etiam et hendrerit."
37.61,593.36,101.74,602.20,"/F8",9.96,"Cubilia neque."
110.31,593.36,288.46,602.20,"/F8",9.96,"Blandit netus amet a pede fusce massa"
37.61,581.40,125.96,590.25,"/F8",9.96,"molestie malesuada."
134.64,581.40,288.45,590.25,"/F8",9.96,"Dapibus lorem etiam platea ligula"
37.61,569.45,213.90,578.29,"/F8",9.96,"maecenas fringilla bibendum tortor felis."
52.56,557.49,288.45,566.34,"/F8",9.96,"Euismod netus. Dapibus felis nisi nonummy magna ut"
37.61,545.54,124.80,554.38,"/F8",9.96,"dolor eu nulla eget."
132.62,545.54,257.21,554.38,"/F8",9.96,"Aliquam velit erat a metus."
265.02,545.54,288.45,554.38,"/F8",9.96,"Eges-"
37.61,533.58,288.48,542.43,"/F8",9.96,"tas magna odio cum accumsan sodales faucibus metus ali-"
37.61,521.63,59.44,530.47,"/F8",9.96,"quet."
69.72,521.63,288.42,530.47,"/F8",9.96,"Pretium felis at dignissim purus malesuada eni."
37.61,509.67,118.38,518.52,"/F8",9.96,"Cubilia magna ut."
125.33,509.67,192.84,518.52,"/F8",9.96,"Aliquam porta."
199.79,509.67,259.17,518.52,"/F8",9.96,"Pretium felis."
266.13,509.67,288.43,518.52,"/F8",9.96,"Euis-"
37.61,497.72,230.12,506.56,"/F8",9.96,"mod lacus elit ante purus quisque dapibus."
237.51,497.72,288.44,506.56,"/F8",9.96,"Laoreet au-"
37.61,485.76,288.41,494.61,"/F8",9.96,"gue eu metus cursus tortor purus luctus donec vestibulum"
37.61,473.81,288.46,482.65,"/F8",9.96,"gravida. Commodo ipsum mi vitae nostra elementum. Vi-"
37.61,461.85,288.46,470.70,"/F8",9.96,"vamus magna at congue id. Pretium augue adipiscing in-"
37.61,449.90,288.44,458.74,"/F8",9.96,"terdum. Nonummy lacus enim porttitor massa fermentum"
37.61,437.94,197.11,446.79,"/F8",9.96,"sit fringilla litora ad etiam ac quis."
205.46,437.94,288.42,446.79,"/F8",9.96,"Viverra class nulla"
37.61,425.99,164.08,434.83,"/F8",9.96,"elementum purus ut felis ac."
170.78,425.99,288.43,434.83,"/F8",9.96,"Conubia ipsum dolor viva-"
37.61,414.03,193.33,422.88,"/F8",9.96,"mus dui congue et accumsan cum."
201.70,414.03,288.49,422.88,"/F8",9.96,"Nonummy class eni"
37.61,402.08,288.43,410.92,"/F8",9.96,"orci tempor ornare vulputate morbi eros ve. Integer lorem"
37.61,390.12,288.42,398.97,"/F8",9.96,"diam hac fames penatibus per nisl mus. Potenti justo euis-"
37.61,378.17,288.47,387.01,"/F8",9.96,"mod egestas ornare per ad ligula dignissim. Nonummy au-"
37.61,366.21,288.48,375.06,"/F8",9.96,"gue purus a nonummy congue fermentum interdum mag-"
37.61,354.26,288.40,363.10,"/F8",9.96,"nis adipiscing felis. Euismod lacus. Feugiat metus dapibus"
37.61,342.30,288.46,351.15,"/F8",9.96,"neque ut penatibus a fames et tempor ac mauris laoreet"
37.61,330.34,247.96,339.19,"/F8",9.96,"egestas magnis diam condimentum pellentesque."
37.61,307.93,280.57,316.77,"/F27",9.96,"1.2. Blandit morbi et felis congue faucibus ullamcorper."
52.56,294.48,245.15,303.33,"/F8",9.96,"Aliquet risus proin nullam curae adipiscing."
251.05,294.48,288.43,303.33,"/F8",9.96,"Vivamus"
37.61,282.52,288.45,291.37,"/F8",9.96,"velit. Aliquam morbi etiam malesuada amet laoreet. Na-"
37.61,270.57,288.42,279.42,"/F8",9.96,"toque morbi ac vulputate lorem id felis eu interdum com-"
37.61,258.61,163.47,267.46,"/F8",9.96,"modo proin nisi nam dolor."
173.24,258.61,288.49,267.46,"/F8",9.96,"Posuere donec fames sus-"
37.61,246.66,76.70,255.51,"/F8",9.96,"pendisse."
85.97,246.66,288.43,255.51,"/F8",9.96,"Commodo risus dis vestibulum parturient ac"
37.61,234.70,288.40,243.55,"/F8",9.96,"dictumst primis risus porta. Integer morbi. Aliquet lorem"
37.61,222.75,82.34,231.60,"/F8",9.96,"proin sed."
92.99,222.75,162.85,231.60,"/F8",9.96,"Nonummy felis."
173.50,222.75,254.17,231.60,"/F8",9.96,"Posuere neque id."
264.82,222.75,288.46,231.60,"/F8",9.96,"Blan-"
37.61,210.79,111.22,219.64,"/F8",9.96,"dit magna nunc."
119.46,210.79,235.43,219.64,"/F8",9.96,"Sodales justo odio primis."
243.67,210.79,288.47,219.64,"/F8",9.96,"Nonummy"
37.61,198.84,288.40,207.68,"/F8",9.96,"proin netus. Cubilia velit mi class etiam suspendisse dic-"
37.61,186.88,221.92,195.73,"/F8",9.96,"tumst dignissim cras pellentesque nostra."
230.14,186.88,288.42,195.73,"/F8",9.96,"Natoque felis"
37.61,174.93,288.48,183.77,"/F8",9.96,"nam cras accumsan diam non nisi est massa nunc tellus"
37.61,162.97,288.43,171.82,"/F8",9.96,"luctus habitasse at ac. Potenti massa adipiscing ad sollic-"
37.61,151.02,288.42,159.86,"/F8",9.96,"itudin potenti tempor hac rutrum. Nonummy nulla nunc"
37.61,139.06,222.34,147.91,"/F8",9.96,"lorem augue primis ve non pede facilisis."
230.83,139.06,288.42,147.91,"/F8",9.96,"Potenti nulla"
37.61,127.11,288.40,135.95,"/F8",9.96,"class lectus posuere mi luctus nascetur sed pellentesque."
37.61,115.15,288.42,124.00,"/F8",9.96,"Iaculis etiam cras senectus sem eu duis felis molestie sed."
37.61,103.20,100.87,112.04,"/F8",9.96,"Lacinia fames."
107.81,103.20,288.46,112.04,"/F8",9.96,"Feugiat dolor eu et ad ornare a lobortis."
37.61,91.24,288.48,100.09,"/F8",9.96,"Lacinia neque ad morbi sed congue sapien augue egestas"
37.61,79.29,79.69,88.13,"/F8",9.96,"odio quis."
321.55,748.78,557.41,757.62,"/F8",9.96,"Aliquet purus class blandit litora per enim suscipit"
306.60,736.82,557.43,745.67,"/F8",9.96,"justo quis urna lacus vivamus neque per malesuada quis"
306.60,724.87,557.43,733.71,"/F8",9.96,"eget. Nonummy nulla et litora pharetra ullamcorper mae-"
306.60,712.91,557.44,721.76,"/F8",9.96,"cenas elit per sodales erat molestie habitant ac. Commodo"
306.60,700.95,557.48,709.80,"/F8",9.96,"fames enim suspendisse. Commodo magna amet dis dolor"
306.60,689.00,557.39,697.85,"/F8",9.96,"litora tincidunt vulputate quis venenatis. Aliquam magna"
306.60,677.04,557.37,685.89,"/F8",9.96,"eni facilisi pellentesque conubia. Gravida purus per elit ac"
306.60,665.09,557.44,673.94,"/F8",9.96,"amet inceptos ullamcorper maecenas eros aliquam ut porta"
306.60,653.13,557.41,661.98,"/F8",9.96,"lectus. Nonummy metus. Posuere netus dis ante vestibu-"
306.60,641.18,557.42,650.02,"/F8",9.96,"lum imperdiet donec ut. Conubia fames mus elit. Posuere"
306.60,629.22,557.40,638.07,"/F8",9.96,"donec leo nisi eget hendrerit eu suspendisse nunc facili-"
306.60,617.27,445.95,626.11,"/F8",9.96,"sis aptent proin posuere primis."
451.82,617.27,557.39,626.11,"/F8",9.96,"Aliquet class netus orci."
306.60,605.31,557.39,614.16,"/F8",9.96,"Cubilia neque justo nam eget consectetuer parturient nisl."
306.60,593.36,557.42,602.20,"/F8",9.96,"Cubilia risus hac sagittis massa ad porttitor eros dis urna"
306.60,581.40,364.03,590.25,"/F8",9.96,"facilisi netus."
370.44,581.40,557.43,590.25,"/F8",9.96,"Lacinia fusce ac varius non ut magnis sol-"
306.60,569.45,467.23,578.29,"/F8",9.96,"licitudin aliquam neque ipsum justo."
472.84,569.45,557.41,578.29,"/F8",9.96,"Nonummy nulla mi"
306.60,557.49,338.94,566.34,"/F8",9.96,"nullam."
345.37,557.49,557.43,566.34,"/F8",9.96,"Dapibus metus ipsum erat etiam sapien tempus"
306.60,545.54,557.43,554.38,"/F8",9.96,"sem vestibulum platea mus maecenas. Integer risus morbi"
306.60,533.58,557.44,542.43,"/F8",9.96,"bibendum hymenaeos neque eros a ante vestibulum mus"
306.60,521.63,533.73,530.47,"/F8",9.96,"vestibulum at sollicitudin quisque rutrum mi velit."
541.60,521.63,557.37,530.47,"/F8",9.96,"Na-"
306.60,509.67,557.41,518.52,"/F8",9.96,"toque ipsum id consequat a lorem. Dapibus justo quisque"
306.60,497.72,535.44,506.56,"/F8",9.96,"quam nibh ante hymenaeos suscipit rutrum aptent."
542.63,497.72,557.43,506.56,"/F8",9.96,"Po-"
306.60,485.76,557.41,494.61,"/F8",9.96,"tenti curae amet eleifend purus auctor purus lacinia eu"
306.60,473.81,326.27,482.65,"/F8",9.96,"felis."
334.56,473.81,406.50,482.65,"/F8",9.96,"Commodo risus."
414.78,473.81,557.45,482.65,"/F8",9.96,"Laoreet purus cum rhoncus nisl"
306.60,461.85,346.99,470.70,"/F8",9.96,"lorem eu."
306.60,431.96,557.48,440.81,"/F17",9.96,"2. Nonummy magna ut interdum eni euismod quis"
321.24,420.01,397.76,428.85,"/F17",9.96,"venenatis class."
321.55,399.09,557.42,407.93,"/F8",9.96,"Nonummy augue nisl venenatis sollicitudin adipiscing"
306.60,387.13,557.42,395.98,"/F8",9.96,"odio netus. Cubilia felis lorem tempus justo congue sapien"
306.60,375.18,528.76,384.02,"/F8",9.96,"sagittis mus sollicitudin tortor eget at sollicitudin."
535.06,375.18,557.36,384.02,"/F8",9.96,"Euis-"
306.60,363.22,557.42,372.07,"/F8",9.96,"mod porta at montes torquent nibh semper parturient con-"
306.60,351.27,557.44,360.11,"/F8",9.96,"sectetuer feugiat. Nonummy augue eros eu nibh faucibus"
306.60,339.31,371.05,348.16,"/F8",9.96,"felis habitasse."
380.09,339.31,557.39,348.16,"/F8",9.96,"Potenti purus ipsum risus lacinia proin"
306.60,327.36,557.42,336.20,"/F8",9.96,"urna. Nonummy porta nibh condimentum integer. Aliquet"
306.60,315.40,557.40,324.25,"/F8",9.96,"netus nisi ligula ad fames eu ipsum in a mattis eget facilisis"
306.60,303.45,340.95,312.29,"/F8",9.96,"ultrices."
346.90,303.45,518.59,312.29,"/F8",9.96,"Blandit donec diam dis morbi leo erat."
524.55,303.45,557.42,312.29,"/F8",9.96,"Egestas"
306.60,291.49,557.35,300.34,"/F8",9.96,"netus vel pede facilisi vehicula aliquet. Aliquet fames velit"
306.60,279.53,557.42,288.38,"/F8",9.96,"blandit eu elit netus primis. Lacinia purus massa aenean"
306.60,267.58,557.41,276.43,"/F8",9.96,"urna ridiculus senectus nostra parturient maecenas etiam"
306.60,255.62,367.33,264.47,"/F8",9.96,"fusce suscipit."
373.52,255.62,523.25,264.47,"/F8",9.96,"Nonummy vitae ante vitae augue."
529.45,255.62,557.42,264.47,"/F8",9.96,"Iaculis"
306.60,243.67,488.93,252.52,"/F8",9.96,"velit justo cras ve consectetuer tellus ve."
496.62,243.67,557.39,252.52,"/F8",9.96,"Posuere proin"
306.60,231.71,557.45,240.56,"/F8",9.96,"fusce. Commodo magna dis nullam hendrerit etiam curae"
306.60,219.76,437.75,228.61,"/F8",9.96,"mollis vestibulum sollicitudin."
443.82,219.76,557.37,228.61,"/F8",9.96,"Pretium augue eget tellus"
306.60,207.80,557.41,216.65,"/F8",9.96,"viverra sociis ad lectus metus. Potenti etiam pede eu mae-"
306.60,195.85,557.45,204.70,"/F8",9.96,"cenas eros. Euismod proin et a ligula consequat nam ante"
306.60,183.89,350.29,192.74,"/F8",9.96,"cum odio."
357.19,183.89,518.03,192.74,"/F8",9.96,"Integer class adipiscing eleifend nisl."
524.93,183.89,557.41,192.74,"/F8",9.96,"Blandit"
306.60,171.94,489.44,180.79,"/F8",9.96,"vitae. Potenti vitae. Cubilia velit ve ante."
321.55,159.98,382.93,168.83,"/F8",9.96,"Quisque velit."
391.42,159.98,557.41,168.83,"/F8",9.96,"Euismod curae class risus etiam felis"
306.60,148.03,343.88,156.87,"/F8",9.96,"fames a."
352.98,148.03,503.85,156.87,"/F8",9.96,"Blandit proin at class sociis sem."
512.94,148.03,557.48,156.87,"/F8",9.96,"Commodo"
306.60,136.07,557.42,144.92,"/F8",9.96,"massa conubia ac id ridiculus dolor senectus mi mollis in."
306.60,124.12,374.64,132.96,"/F8",9.96,"Aliquam porta."
383.20,124.12,557.43,132.96,"/F8",9.96,"Laoreet risus ac ve imperdiet netus ut"
306.60,112.16,557.43,121.01,"/F8",9.96,"libero commodo ut quis interdum a pellentesque quam."
306.60,100.21,557.42,109.05,"/F8",9.96,"Iaculis ipsum sit egestas mollis hac nascetur dolor dis hy-"
306.60,88.25,557.44,97.10,"/F8",9.96,"menaeos mollis ipsum. Euismod purus cras. Egestas lorem"
295.15,61.35,300.13,70.20,"/F8",9.96,"2"
