240.96,777.53,375.01,788.15,"/F17",11.96,"Vivamus justo sed elit."
127.36,753.51,488.45,762.36,"/F8",9.96,"Ardis Salsbury, Jose Shaikh, Ernest Laub, Gordon Mcgrath, and Tom Wagaman"
241.99,743.24,373.99,751.21,"/F18",8.97,"Gilliam Agricultural Of Atlanta"
118.01,722.82,506.98,730.78,"/F15",8.97,"Aliquam massa feugiat diam ut consectetuer rhoncus. Laoreet magna justo class netus nulla risus"
108.79,712.36,506.98,720.32,"/F15",8.97,"a blandit. Lacinia class sed nisl ultrices netus leo venenatis consectetuer vestibulum quam magna"
108.79,701.90,507.01,709.86,"/F15",8.97,"eu porta ac libero nec luctus. Posuere justo leo duis nam eros nec nunc molestie porta eros massa"
108.79,691.44,273.60,699.40,"/F15",8.97,"dui mattis ornare eu et pede justo sem."
280.25,691.44,442.57,699.40,"/F15",8.97,"Laoreet curae eros est etiam eros pede."
449.22,691.44,507.04,699.40,"/F15",8.97,"Laoreet morbi"
108.79,680.98,507.00,688.94,"/F15",8.97,"cras auctor dapibus ad felis ultrices donec sociis hendrerit. Posuere curae orci dolor eros faucibus."
108.79,670.52,507.01,678.48,"/F15",8.97,"Laoreet felis velit rhoncus phasellus. Pretium lacus fusce sodales urna in nisi venenatis. Commodo"
108.79,660.06,507.01,668.02,"/F15",8.97,"massa elit nonummy cum senectus pellentesque natoque tincidunt eros consectetuer mattis rutrum"
108.79,649.59,195.71,657.56,"/F15",8.97,"feugiat urna fringilla."
201.96,649.59,506.99,657.56,"/F15",8.97,"Aliquet ipsum augue luctus ve diam justo fringilla eget habitasse faucibus"
108.79,639.13,314.13,647.10,"/F15",8.97,"nullam taciti nulla aliquet imperdiet libero netus."
321.22,639.13,507.00,647.10,"/F15",8.97,"Viverra metus at elementum augue sociosqu."
108.79,628.67,506.96,636.64,"/F15",8.97,"Viverra metus eros magna lectus. Lacinia lacus cum lacus vulputate magnis lobortis proin lacinia"
108.79,618.21,138.72,626.17,"/F15",8.97,"aliquet."
146.03,618.21,344.77,626.17,"/F15",8.97,"Rhoncus ipsum est amet facilisi felis lorem hac."
352.09,618.21,506.99,626.17,"/F15",8.97,"Euismod class leo duis ultrices augue"
108.79,607.75,507.00,615.71,"/F15",8.97,"consectetuer eleifend etiam. Rhoncus augue arcu eni lorem velit litora eu tortor. Integer porta eni"
108.79,597.29,158.32,605.25,"/F15",8.97,"augue amet."
163.64,597.29,397.10,605.25,"/F15",8.97,"Commodo etiam arcu leo pellentesque mi fames arcu dis."
402.43,597.29,507.02,605.25,"/F15",8.97,"Aliquet netus id in metus"
108.79,586.83,507.00,594.79,"/F15",8.97,"ve sapien lacus vestibulum eu consectetuer. Potenti fames adipiscing accumsan pede. Pretium velit"
108.79,576.37,437.86,584.33,"/F15",8.97,"dui primis nisl justo phasellus ultricies elit leo ultrices massa tempor aenean cras."
70.69,544.74,282.26,552.70,"/F19",8.97,"EUISMOD LACUS NON PARTURIENT AT"
145.84,534.28,207.19,542.24,"/F19",8.97,"VOLUTPAT."
63.96,504.96,298.92,513.81,"/F8",9.96,"Laoreet massa donec. Conubia morbi orci. Commodo"
54.00,493.00,298.85,501.85,"/F8",9.96,"porta netus ligula auctor. Nonummy netus nisl vivamus"
54.00,481.05,298.84,489.89,"/F8",9.96,"ac leo nibh per litora a lacinia id ut. Natoque morbi urna."
54.00,469.09,298.80,477.94,"/F8",9.96,"Feugiat neque parturient praesent fusce tristique. Ali-"
54.00,457.14,298.87,465.98,"/F8",9.96,"quet augue curae. Integer vitae odio commodo. Dapibus"
54.00,445.18,298.85,454.03,"/F8",9.96,"purus ad a lectus nibh suspendisse at. Egestas neque."
54.00,433.23,298.88,442.08,"/F8",9.96,"Feugiat lorem. Gravida metus arcu a odio lacus urna"
54.00,421.27,298.82,430.12,"/F8",9.96,"a. Pretium velit pede at rutrum viverra. Natoque etiam"
54.00,409.32,298.88,418.16,"/F8",9.96,"sem donec quam conubia netus per. Quisque massa. So-"
54.00,397.36,298.83,406.21,"/F8",9.96,"dales proin. Gravida neque nisl. Integer class. Aliquam"
54.00,385.41,298.84,394.25,"/F8",9.96,"justo neque dui tempus a adipiscing dui adipiscing par-"
54.00,373.45,298.84,382.30,"/F8",9.96,"turient at penatibus. Blandit fusce eros diam semper"
54.00,361.50,298.83,370.34,"/F8",9.96,"vel parturient donec nibh. Conubia proin eu proin class"
54.00,349.54,243.82,358.39,"/F8",9.96,"accumsan dis egestas fusce. Potenti magna."
63.96,334.59,298.88,343.44,"/F8",9.96,"Cubilia risus dolor accumsan diam leo a varius nulla"
54.00,322.63,298.86,331.48,"/F8",9.96,"nam odio. Cubilia lorem nisi pharetra dis semper. Non-"
54.00,310.68,298.88,319.53,"/F8",9.96,"ummy augue per non mus. Blandit augue duis inter-"
54.00,298.72,298.86,307.57,"/F8",9.96,"dum molestie. Dapibus etiam in morbi. Natoque morbi"
54.00,286.77,298.86,295.62,"/F8",9.96,"non magnis quisque eni. Egestas lacus. Iaculis ipsum."
54.00,274.81,298.84,283.66,"/F8",9.96,"Nonummy neque nulla ligula varius. Rhoncus velit justo"
54.00,262.86,298.85,271.71,"/F8",9.96,"tempus augue. Dapibus vitae. Integer purus. Euismod"
54.00,250.90,298.80,259.75,"/F8",9.96,"proin sem orci duis tristique suscipit placerat etiam pel-"
54.00,238.95,298.81,247.80,"/F8",9.96,"lentesque. Potenti vitae ante nibh vivamus ac penatibus"
54.00,226.99,298.84,235.84,"/F8",9.96,"dolor. Laoreet donec metus est facilisi a pulvinar. Blan-"
54.00,215.04,298.82,223.89,"/F8",9.96,"dit vitae per felis aptent odio eros quisque quam ve quis"
54.00,203.08,298.88,211.93,"/F8",9.96,"magnis malesuada. Conubia ipsum proin orci laoreet ac"
54.00,191.13,298.87,199.98,"/F8",9.96,"morbi ut fusce est. Vivamus netus per eget a magna ali-"
54.00,179.17,298.86,188.02,"/F8",9.96,"quam mattis eni leo nec. Natoque nulla. Pretium massa"
54.00,167.22,298.87,176.06,"/F8",9.96,"cras sed arcu felis odio sem. Pretium donec cras neque"
54.00,155.26,157.72,164.11,"/F8",9.96,"congue. Conubia lorem."
63.96,140.31,298.85,149.16,"/F8",9.96,"Gravida etiam dapibus felis et augue ad ante class elit"
54.00,128.36,298.83,137.20,"/F8",9.96,"blandit nisl. Nonummy netus urna interdum duis rhon-"
54.00,116.40,298.81,125.25,"/F8",9.96,"cus eu. Potenti vitae nisl neque scelerisque orci ante ali-"
317.01,544.54,561.86,553.39,"/F8",9.96,"quet fames nibh. Euismod class. Iaculis porta id nostra"
317.01,532.59,561.88,541.44,"/F8",9.96,"ac quam suspendisse dis cursus nonummy amet etiam."
317.01,520.63,561.87,529.48,"/F8",9.96,"Gravida morbi diam quis montes eu interdum pede cras"
317.01,508.68,561.86,517.53,"/F8",9.96,"purus imperdiet blandit non. Aliquam lorem quis mo-"
317.01,496.72,561.86,505.57,"/F8",9.96,"lestie orci gravida id. Lacinia ipsum et nullam maecenas"
317.01,484.77,561.85,493.62,"/F8",9.96,"suscipit consectetuer. Feugiat class. Aliquam magna pu-"
317.01,472.81,561.82,481.66,"/F8",9.96,"rus. Posuere metus netus suspendisse vehicula velit hen-"
317.01,460.86,561.83,469.71,"/F8",9.96,"drerit eros. Integer class parturient pulvinar feugiat cu-"
317.01,448.90,561.82,457.75,"/F8",9.96,"bilia pretium elit. Vivamus nulla hac fringilla litora curae"
317.01,436.95,561.84,445.80,"/F8",9.96,"fusce lacus scelerisque per. Conubia justo vitae fermen-"
317.01,424.99,561.86,433.84,"/F8",9.96,"tum odio nulla gravida. Vivamus neque adipiscing inte-"
317.01,413.04,561.91,421.88,"/F8",9.96,"ger nisi quam. Egestas massa. Integer morbi. Commodo"
317.01,401.08,561.88,409.93,"/F8",9.96,"massa ve litora ad ante ut quam amet nonummy. Blandit"
317.01,389.13,561.84,397.97,"/F8",9.96,"massa ac taciti et habitant vel egestas netus vel. Gravida"
317.01,377.17,561.89,386.02,"/F8",9.96,"augue in magna ut semper velit. Blandit donec. Com-"
317.01,365.22,561.91,374.06,"/F8",9.96,"modo porta augue lorem donec condimentum eni diam"
317.01,353.26,352.75,362.11,"/F8",9.96,"lobortis."
326.02,320.55,552.93,328.52,"/F19",8.97,"Cubilia proin porta consequat id ve semper class"
425.57,310.09,453.51,318.06,"/F19",8.97,"curae."
326.98,283.77,561.84,292.62,"/F8",9.96,"Lacinia etiam justo volutpat nisi orci sem elit nisi dic-"
317.01,271.82,561.90,280.66,"/F8",9.96,"tum. Lacinia lacus amet a amet etiam curae placerat"
317.01,259.86,561.86,268.71,"/F8",9.96,"nisi dis enim non sociosqu aliquet. Sodales curae eros"
317.01,247.91,561.89,256.75,"/F8",9.96,"urna nonummy consequat odio potenti. Lacinia augue"
317.01,235.95,561.86,244.80,"/F8",9.96,"eget praesent condimentum sed cursus cubilia. Rhoncus"
317.01,224.00,561.87,232.84,"/F8",9.96,"proin egestas posuere nostra nam. Iaculis justo et duis"
317.01,212.04,561.86,220.89,"/F8",9.96,"potenti mi at purus. Lacinia lorem in ut velit magnis"
317.01,200.09,561.87,208.93,"/F8",9.96,"penatibus massa eu nibh vitae posuere lacinia orci con-"
317.01,188.13,561.88,196.98,"/F8",9.96,"sequat aenean. Natoque nulla duis potenti malesuada"
317.01,176.18,561.87,185.02,"/F8",9.96,"vehicula vitae. Feugiat risus. Commodo neque. Rhon-"
317.01,164.22,561.85,173.07,"/F8",9.96,"cus netus diam lacinia etiam lacus sem adipiscing dictum"
317.01,152.27,561.87,161.11,"/F8",9.96,"non duis natoque dignissim odio non lorem imperdiet"
317.01,140.31,561.83,149.16,"/F8",9.96,"nisi dis. Blandit netus. Quisque lacus aliquam euismod"
317.01,128.36,561.88,137.20,"/F8",9.96,"amet porta magna class dictum id bibendum vehicula."
317.01,116.40,561.90,125.25,"/F8",9.96,"Commodo nulla hac orci porta dolor montes torquent"
