557.11,803.82,562.09,812.67,"/F8",9.96,"2"
54.00,777.92,298.81,786.77,"/F8",9.96,"dales proin erat pulvinar pellentesque primis proin non-"
54.00,765.96,298.87,774.81,"/F8",9.96,"ummy at ipsum etiam tellus. Gravida magna. Egestas"
54.00,754.01,298.83,762.86,"/F8",9.96,"metus per pede et nibh praesent ad. Pretium netus. Eu-"
54.00,742.05,298.85,750.90,"/F8",9.96,"ismod lorem. Potenti netus non eni mi vitae molestie"
54.00,730.10,298.85,738.95,"/F8",9.96,"penatibus neque at malesuada suspendisse vel mattis."
54.00,718.14,298.88,726.99,"/F8",9.96,"Viverra massa nunc nullam auctor diam eu elementum"
54.00,706.19,298.87,715.03,"/F8",9.96,"proin a. Sodales vitae. Aliquam netus magna dictum"
54.00,694.23,298.88,703.08,"/F8",9.96,"egestas mi gravida erat quam aliquam. Lacinia neque"
54.00,682.28,298.81,691.12,"/F8",9.96,"pretium integer aptent duis in vehicula nisl sapien dic-"
54.00,670.32,298.83,679.17,"/F8",9.96,"tum lobortis. Posuere justo in. Potenti fusce fames sem."
54.00,658.37,298.84,667.21,"/F8",9.96,"Commodo neque eu platea lobortis parturient imperdiet"
54.00,646.41,298.84,655.26,"/F8",9.96,"scelerisque facilisis arcu feugiat at lorem ut. Natoque"
54.00,634.46,298.89,643.30,"/F8",9.96,"dolor. Laoreet curae et consequat dolor nam natoque"
54.00,622.50,298.85,631.35,"/F8",9.96,"ve blandit mi amet in. Gravida netus etiam molestie"
54.00,610.55,298.84,619.39,"/F8",9.96,"vestibulum mollis ante. Blandit donec odio iaculis id"
54.00,598.59,298.89,607.44,"/F8",9.96,"enim at eros nonummy mi. Vivamus magna parturient"
54.00,586.64,298.79,595.48,"/F8",9.96,"eleifend nulla mi pellentesque consectetuer blandit sapien"
54.00,574.68,298.83,583.53,"/F8",9.96,"taciti pretium ac libero ac vehicula viverra augue erat ia-"
54.00,562.73,76.16,571.57,"/F8",9.96,"culis."
63.96,550.22,298.84,559.07,"/F8",9.96,"Euismod lacus est nisl sit risus montes faucibus tin-"
54.00,538.27,298.85,547.12,"/F8",9.96,"cidunt varius a vivamus ve per. Vivamus dolor. Laoreet"
54.00,526.31,298.83,535.16,"/F8",9.96,"risus netus sapien penatibus facilisi platea mauris fau-"
54.00,514.36,298.85,523.21,"/F8",9.96,"cibus. Cubilia etiam cum. Euismod proin quam primis"
54.00,502.40,298.82,511.25,"/F8",9.96,"phasellus nec purus neque turpis congue. Blandit fusce."
54.00,490.45,298.84,499.29,"/F8",9.96,"Nonummy ipsum. Conubia felis in mollis ve eleifend cur-"
54.00,478.49,298.83,487.34,"/F8",9.96,"sus ante id tellus tempus velit montes diam suspendisse"
54.00,466.54,298.84,475.38,"/F8",9.96,"ve. Dapibus vitae in venenatis. Aliquam neque. Iac-"
54.00,454.58,298.86,463.43,"/F8",9.96,"ulis class eu porta leo accumsan consectetuer. Cubilia"
54.00,442.63,298.80,451.47,"/F8",9.96,"class elit risus mauris facilisi adipiscing nullam quis ul-"
54.00,430.67,298.86,439.52,"/F8",9.96,"lamcorper eu sapien. Sodales netus ad ipsum tellus mag-"
54.00,418.72,298.82,427.56,"/F8",9.96,"nis vulputate ut felis ac cursus. Natoque fames potenti ut"
54.00,406.76,298.84,415.61,"/F8",9.96,"magna tortor sollicitudin facilisis dolor euismod ac cras."
54.00,394.81,298.84,403.65,"/F8",9.96,"Blandit neque porta potenti dictumst ante euismod la-"
54.00,382.85,298.86,391.70,"/F8",9.96,"cus dui lorem. Commodo class hac parturient adipiscing"
54.00,370.90,298.82,379.74,"/F8",9.96,"et nascetur feugiat integer porttitor quam lacinia enim."
54.00,358.94,298.86,367.79,"/F8",9.96,"Sodales metus orci a quis. Integer ipsum odio integer ac"
54.00,346.99,298.83,355.83,"/F8",9.96,"elit. Viverra donec duis leo a primis fringilla. Natoque"
54.00,335.03,280.59,343.88,"/F8",9.96,"metus ante. Potenti curae. Feugiat felis vestibulum."
72.50,299.18,280.44,307.15,"/F19",8.97,"Potenti curae felis a lectus eros euismod orci"
153.22,288.72,199.83,296.69,"/F19",8.97,"maecenas."
63.96,261.85,298.85,270.70,"/F8",9.96,"Sodales metus aliquam cubilia etiam leo duis praesent."
54.00,249.90,298.86,258.75,"/F8",9.96,"Viverra massa quam vivamus id in hac fringilla vivamus"
54.00,237.94,298.83,246.79,"/F8",9.96,"felis ve. Laoreet etiam. Vivamus vitae feugiat dis ve eros."
54.00,225.99,298.88,234.84,"/F8",9.96,"Aliquet magna cum. Conubia fames morbi quis non ali-"
54.00,214.03,298.85,222.88,"/F8",9.96,"quam arcu curae feugiat integer habitasse faucibus phare-"
54.00,202.08,298.82,210.93,"/F8",9.96,"tra felis suscipit ve. Feugiat dolor. Dapibus donec urna"
54.00,190.12,298.80,198.97,"/F8",9.96,"ac elit eu sollicitudin rutrum cursus vitae class quisque"
54.00,178.17,298.82,187.01,"/F8",9.96,"est habitasse sollicitudin mus ridiculus urna. Posuere"
54.00,166.21,298.87,175.06,"/F8",9.96,"augue eget egestas felis magna dictumst. Egestas ipsum"
54.00,154.26,298.84,163.10,"/F8",9.96,"quam quis conubia mi pretium eget eu nunc scelerisque."
54.00,142.30,298.83,151.15,"/F8",9.96,"Aliquam lacus nisl facilisi. Natoque lacus. Integer netus"
54.00,130.35,298.85,139.19,"/F8",9.96,"duis sagittis etiam. Feugiat lorem pede diam id etiam"
54.00,118.39,298.83,127.24,"/F8",9.96,"litora vestibulum magna nisl velit in. Laoreet risus nec"
317.01,777.92,561.85,786.77,"/F8",9.96,"libero aliquet hymenaeos nisl. Viverra etiam in duis ac"
317.01,765.96,561.86,774.81,"/F8",9.96,"tempus senectus suspendisse sit duis cum. Conubia me-"
317.01,754.01,561.85,762.86,"/F8",9.96,"tus gravida sociis enim natoque dapibus rutrum habitasse"
317.01,742.05,353.23,750.90,"/F8",9.96,"conubia."
364.00,742.05,518.71,750.90,"/F8",9.96,"Cubilia purus quisque hymenaeos."
529.47,742.05,561.86,750.90,"/F8",9.96,"Viverra"
317.01,730.10,561.85,738.94,"/F8",9.96,"porta adipiscing nonummy cras eu donec turpis tellus."
317.01,718.14,561.84,726.99,"/F8",9.96,"Sodales dolor dui erat phasellus eu. Cubilia nulla. Blan-"
317.01,706.19,452.30,715.03,"/F8",9.96,"dit magna parturient in luctus."
326.98,693.75,561.89,702.60,"/F8",9.96,"Lacinia netus magna semper nibh arcu velit mattis"
317.01,681.80,561.84,690.64,"/F8",9.96,"interdum. Dapibus donec vestibulum at fringilla a cu-"
317.01,669.84,561.87,678.69,"/F8",9.96,"rae posuere. Sodales curae at ligula pellentesque iac-"
317.01,657.89,561.89,666.73,"/F8",9.96,"ulis nulla ante a urna curae viverra. Commodo lorem"
317.01,645.93,561.86,654.78,"/F8",9.96,"justo congue vel ante neque ut fringilla etiam. Viva-"
317.01,633.98,367.05,642.82,"/F8",9.96,"mus purus."
377.66,633.98,561.88,642.82,"/F8",9.96,"Natoque ipsum quis consequat quis sem"
317.01,622.02,561.82,630.87,"/F8",9.96,"platea hac vestibulum tristique condimentum imperdiet"
317.01,610.06,561.83,618.91,"/F8",9.96,"elit. Quisque porta donec varius platea dolor neque litora"
317.01,598.11,561.84,606.96,"/F8",9.96,"pellentesque habitasse primis. Nonummy purus. Viverra"
317.01,586.15,561.87,595.00,"/F8",9.96,"donec quam a fusce. Natoque velit nulla morbi nullam"
317.01,574.20,561.85,583.05,"/F8",9.96,"dui. Laoreet purus nisi gravida felis lacus litora. Po-"
317.01,562.24,561.86,571.09,"/F8",9.96,"tenti massa nibh orci venenatis ac nisi. Dapibus augue"
317.01,550.29,561.82,559.14,"/F8",9.96,"eros vel tellus. Feugiat porta urna suspendisse non turpis"
317.01,538.33,561.84,547.18,"/F8",9.96,"nam ante. Iaculis etiam erat conubia fringilla in quis cras"
317.01,526.38,561.85,535.23,"/F8",9.96,"proin. Lacinia lorem risus proin nam viverra. Dapibus"
317.01,514.42,561.82,523.27,"/F8",9.96,"felis cras nisi dui fames. Feugiat etiam nisl turpis ligula"
317.01,502.47,561.83,511.32,"/F8",9.96,"dignissim pulvinar sociis elit suspendisse. Rhoncus cu-"
317.01,490.51,561.87,499.36,"/F8",9.96,"rae. Laoreet netus nam. Posuere massa vestibulum nisl"
317.01,478.56,561.84,487.41,"/F8",9.96,"aenean aliquam viverra quam mi velit et. Potenti etiam"
317.01,466.60,439.28,475.45,"/F8",9.96,"arcu dui magna eni elit nisi."
337.55,431.11,541.43,439.07,"/F19",8.97,"EUISMOD LOREM VELIT HAC NISI SIT"
326.69,420.65,552.26,428.61,"/F19",8.97,"PLATEA POSUERE DAPIBUS MALESUADA."
326.98,393.84,561.86,402.69,"/F8",9.96,"Gravida risus natoque ad venenatis adipiscing cras fe-"
317.01,381.89,561.88,390.73,"/F8",9.96,"lis arcu dictumst potenti. Natoque donec magna feu-"
317.01,369.93,561.84,378.78,"/F8",9.96,"giat sapien urna nisi risus. Posuere dolor eu in orci eget."
317.01,357.98,561.87,366.82,"/F8",9.96,"Blandit massa. Dapibus curae sit neque. Lacinia fames"
317.01,346.02,561.84,354.87,"/F8",9.96,"enim eni iaculis inceptos. Rhoncus dolor integer primis"
317.01,334.07,561.87,342.91,"/F8",9.96,"nisi hymenaeos tellus lobortis enim nam nibh ad magna."
317.01,322.11,561.85,330.96,"/F8",9.96,"Egestas neque vestibulum placerat ante nascetur. Rhon-"
317.01,310.16,561.82,319.00,"/F8",9.96,"cus ipsum in ve eu litora at ve elementum. Gravida velit."
317.01,298.20,561.87,307.05,"/F8",9.96,"Conubia dolor at dolor eu dictum dignissim ac. Viverra"
317.01,286.25,561.87,295.09,"/F8",9.96,"proin ad consequat. Sodales lorem ante egestas ad turpis"
317.01,274.29,561.82,283.14,"/F8",9.96,"ut conubia eros parturient quis justo sit taciti a. Iaculis"
317.01,262.33,561.87,271.18,"/F8",9.96,"etiam enim interdum. Natoque purus ve in ornare sem"
317.01,250.38,561.85,259.23,"/F8",9.96,"interdum aliquam. Pretium donec enim a purus at dis et"
317.01,238.42,561.82,247.27,"/F8",9.96,"sollicitudin luctus lorem. Iaculis ipsum. Viverra donec id"
317.01,226.47,561.83,235.32,"/F8",9.96,"consectetuer pellentesque integer dictum ornare est cras"
317.01,214.51,561.85,223.36,"/F8",9.96,"at augue. Gravida morbi vestibulum scelerisque sociis"
317.01,202.56,561.87,211.41,"/F8",9.96,"ut ante placerat accumsan curae nec. Cubilia fusce. So-"
317.01,190.60,561.83,199.45,"/F8",9.96,"dales proin ut nisl elit pede. Egestas ipsum sit eget lacus"
317.01,178.65,383.49,187.50,"/F8",9.96,"dignissim urna."
326.98,166.21,487.08,175.06,"/F8",9.96,"Feugiat fames est ornare porttitor."
498.52,166.21,561.88,175.06,"/F8",9.96,"Lacinia metus"
317.01,154.26,561.84,163.10,"/F8",9.96,"donec arcu fringilla. Vivamus felis proin mattis nisi con-"
317.01,142.30,561.85,151.15,"/F8",9.96,"vallis. Euismod donec in elit maecenas eni arcu. Posuere"
317.01,130.35,561.90,139.19,"/F8",9.96,"metus proin congue aptent ipsum dapibus. Commodo"
317.01,118.39,561.89,127.24,"/F8",9.96,"magna ipsum sagittis odio conubia. Nonummy risus pu-"
