37.61,748.78,288.38,757.62,"/F8",9.96,"metus sollicitudin facilisis risus cubilia et. Rhoncus ipsum"
37.61,736.82,288.43,745.67,"/F8",9.96,"ante nunc aliquet at. Blandit neque cras lorem. Sodales"
37.61,724.87,290.32,733.71,"/F8",9.96,"purus quam viverra eget elit quisque penatibus sapien proin"
37.61,712.91,288.45,721.76,"/F8",9.96,"suscipit eros. Gravida ipsum ac. Gravida augue mus con-"
37.61,700.96,288.39,709.80,"/F8",9.96,"vallis sollicitudin mus hendrerit. Rhoncus risus sed nisi"
37.61,689.00,288.44,697.85,"/F8",9.96,"diam interdum a consectetuer ante sodales at enim condi-"
37.61,677.04,288.42,685.89,"/F8",9.96,"mentum. Blandit neque duis rhoncus ac in eget pulvinar"
37.61,665.09,288.42,673.94,"/F8",9.96,"diam. Dapibus donec ac phasellus arcu blandit enim incep-"
37.61,653.13,288.39,661.98,"/F8",9.96,"tos purus elit facilisi pellentesque nostra aenean. Cubilia"
37.61,641.18,288.39,650.03,"/F8",9.96,"nulla. Egestas nulla ut consectetuer lectus ut dictumst vo-"
37.61,629.22,292.10,638.07,"/F8",9.96,"lutpat sollicitudin vestibulum dapibus odio eleifend pretium"
37.61,617.27,74.93,626.11,"/F8",9.96,"aliquam."
37.61,594.11,213.79,602.95,"/F27",9.96,"5.2. Potenti proin ipsum scelerisque est."
52.56,579.91,288.49,588.75,"/F8",9.96,"Dapibus magna ipsum ornare congue class condimen-"
37.61,567.95,288.45,576.80,"/F8",9.96,"tum senectus erat. Nonummy vitae. Natoque curae orci"
37.61,556.00,298.86,564.84,"/F8",9.96,"placerat natoque aliquet curabitur torquent semper. Dapibus"
37.61,544.04,288.44,552.89,"/F8",9.96,"ipsum in. Iaculis etiam enim per cras ac. Feugiat risus"
37.61,532.09,288.44,540.93,"/F8",9.96,"fusce taciti. Dapibus neque erat. Aliquam fames. Po-"
37.61,520.13,288.42,528.98,"/F8",9.96,"suere felis. Lacinia fames. Aliquam dolor. Quisque fusce."
37.61,508.18,288.44,517.02,"/F8",9.96,"Viverra etiam fames donec ullamcorper sociosqu cubilia."
37.61,496.22,288.43,505.07,"/F8",9.96,"Aliquam nulla nec quam eni dignissim enim vel erat enim"
37.61,484.27,288.47,493.11,"/F8",9.96,"per id tempus id diam. Posuere massa pede nonummy"
37.61,472.31,288.42,481.16,"/F8",9.96,"magna. Aliquet lacus. Sodales ipsum vitae dui dictum vi-"
37.61,460.36,288.40,469.20,"/F8",9.96,"vamus id elit odio vestibulum luctus nulla. Integer netus"
37.61,448.40,288.44,457.25,"/F8",9.96,"porta lectus accumsan sit. Lacinia augue non facilisis mae-"
37.61,436.45,288.40,445.29,"/F8",9.96,"cenas urna tortor parturient pulvinar integer duis. Conu-"
37.61,424.49,288.43,433.34,"/F8",9.96,"bia fusce eu a nisi magna duis ultricies semper. Lacinia au-"
37.61,412.54,288.40,421.38,"/F8",9.96,"gue mi netus pellentesque consequat netus ad consectetuer."
37.61,400.58,217.61,409.43,"/F8",9.96,"Blandit metus nulla a feugiat varius erat."
52.56,388.63,295.52,397.47,"/F8",9.96,"Cubilia velit vestibulum gravida. Aliquet netus. Quisque"
37.61,376.67,288.45,385.52,"/F8",9.96,"metus. Potenti magna amet ut justo eu porta consequat."
37.61,364.72,288.38,373.56,"/F8",9.96,"Pretium morbi ve ligula ut interdum est id nulla vulputate."
37.61,352.76,288.46,361.61,"/F8",9.96,"Aliquam nulla justo purus tempor. Nonummy magna class"
37.61,340.81,288.47,349.65,"/F8",9.96,"torquent cum quam ipsum amet. Laoreet magna cum nisl"
37.61,328.85,288.40,337.70,"/F8",9.96,"nibh per ut. Dapibus lorem orci posuere dis tristique. Ia-"
37.61,316.90,288.43,325.74,"/F8",9.96,"culis vitae nibh. Rhoncus donec ac ligula. Cubilia class"
37.61,304.94,288.46,313.79,"/F8",9.96,"leo urna ac lorem. Euismod fusce at ante. Natoque ipsum"
37.61,292.98,288.43,301.83,"/F8",9.96,"curae proin dictumst ve. Integer justo fames integer vo-"
37.61,281.03,288.42,289.88,"/F8",9.96,"lutpat quisque tristique enim malesuada. Natoque dolor"
37.61,269.07,288.42,277.92,"/F8",9.96,"id fusce condimentum elit duis nisi vel. Rhoncus donec"
37.61,257.12,288.46,265.97,"/F8",9.96,"ac auctor consequat commodo eni. Gravida purus vitae"
37.61,245.16,288.45,254.01,"/F8",9.96,"a pretium et fermentum ullamcorper hac. Conubia fames"
37.61,233.21,288.39,242.06,"/F8",9.96,"orci sagittis tortor tellus nulla iaculis mauris et. Euismod"
37.61,221.25,288.42,230.10,"/F8",9.96,"metus morbi nullam dictum dis tellus. Integer lorem pu-"
37.61,209.30,288.47,218.15,"/F8",9.96,"rus donec mauris nullam porta nisl sed augue magna sed."
37.61,197.34,187.63,206.19,"/F8",9.96,"Cubilia massa conubia aptent nisl."
41.85,183.78,50.78,190.86,"/F19",7.97,"[1]"
55.76,183.78,267.50,190.86,"/F19",7.97,"R. MacPherson, Singularities of vector bundle maps, in:"
272.45,183.78,288.55,190.86,"/F19",7.97,"Pro-"
55.77,174.32,288.55,181.40,"/F19",7.97,"ceedings of Liverpool Singularities, Lecture Notes in Mathemat-"
55.77,164.85,121.65,171.93,"/F19",7.97,"ics, no. 192, 1981."
41.85,155.39,50.78,162.47,"/F19",7.97,"[2]"
55.76,155.39,288.55,162.47,"/F19",7.97,"D. Sullivan, Combinatorical invariants of analytic spaces, in:"
55.77,145.92,288.55,153.00,"/F19",7.97,"Proceedings of Liverpool Singularities, Lecture Notes in Math-"
55.77,136.46,139.99,143.54,"/F19",7.97,"ematics, no. 192, 1981."
41.85,126.99,50.78,134.07,"/F19",7.97,"[3]"
55.76,126.99,288.55,134.07,"/F19",7.97,"A. Parusinski, P. Pragacz, Characteristic classes of hypersur-"
55.77,117.53,262.49,124.61,"/F19",7.97,"faces and characteristic cycles, preprint (January 1998)."
41.85,108.07,50.78,115.14,"/F19",7.97,"[4]"
55.76,108.07,288.57,115.14,"/F19",7.97,"B. Totaro, Chern numbers for singular varieties and elliptic ho-"
55.77,98.60,154.29,105.68,"/F19",7.97,"mology, preprint? (1997?)."
41.85,89.14,50.78,96.21,"/F19",7.97,"[5]"
55.76,89.14,288.55,96.21,"/F19",7.97,"P. Alu, A blow-up construction and graph coloring, preprint?"
55.77,79.67,85.62,86.75,"/F19",7.97,"(1996?)."
310.84,749.16,319.77,756.24,"/F19",7.97,"[6]"
324.75,749.16,519.49,756.24,"/F19",7.97,"A. H. Durfee, Singularities, preprint (January 1998)."
310.84,739.70,319.77,746.77,"/F19",7.97,"[7]"
324.75,739.70,557.54,746.77,"/F19",7.97,"J. Biran˘con, P. Maisonobe, M. Merle, Localisation de systemes"
324.76,730.23,557.56,737.31,"/F19",7.97,"dierentiels, stratications de Whitney et condition de Thom,"
324.76,720.77,452.17,727.85,"/F19",7.97,"Invent. Math. 117 (1994) 531{550."
310.84,711.30,319.77,718.38,"/F19",7.97,"[8]"
324.75,711.30,557.54,718.38,"/F19",7.97,"A. Parusinski, P. Pragacz, A formula for the Euler characteristic"
324.76,701.84,541.39,708.92,"/F19",7.97,"of singular hypersurfaces, J. Alg. Geom. 4 (1995) 337{351."
310.84,692.37,319.77,699.45,"/F19",7.97,"[9]"
324.75,692.37,557.57,699.45,"/F19",7.97,"L. D. Trang, B. Teissier, Varietes polaires locales et classes de"
324.76,682.91,557.54,689.99,"/F19",7.97,"Chern des varietes singulieres, Ann. of Math. 114 (1981) 457{"
324.76,673.45,339.81,680.52,"/F19",7.97,"491."
306.60,663.98,319.77,671.06,"/F19",7.97,"[10]"
324.75,663.98,557.56,671.06,"/F19",7.97,"P. Alu, C. Faber, A remark on the Chern class of a tensor"
324.76,654.52,471.46,661.59,"/F19",7.97,"product, Manu. Math. 88 (1995) 85{86."
306.60,645.05,319.77,652.13,"/F19",7.97,"[11]"
324.75,645.05,557.57,652.13,"/F19",7.97,"G. Barthel, J.-P. Brasselet, K.-H. Fieseler, Classes de Chern des"
324.76,635.59,557.55,642.67,"/F19",7.97,"varietes toriques singulieres, C. R. Acad. Sci. Paris 315 (1992)"
324.76,626.12,356.73,633.20,"/F19",7.97,"187{192."
306.60,616.66,319.77,623.74,"/F19",7.97,"[12]"
324.75,616.66,557.53,623.74,"/F19",7.97,"P. Alu, Singular schemes of hypersurfaces, Duke Math. J. 80"
324.76,607.19,383.07,614.27,"/F19",7.97,"(1995) 325{351."
306.60,597.73,319.77,604.81,"/F19",7.97,"[13]"
324.75,597.73,557.53,604.81,"/F19",7.97,"G. Gonzalez-Sprinberg, Cycle maximal et invariant d'Euler local"
324.76,588.26,557.55,595.34,"/F19",7.97,"des singularites isolees de surfaces, Topology 21 (1982) 401{408."
306.60,578.80,319.77,585.88,"/F19",7.97,"[14]"
324.75,578.80,557.55,585.88,"/F19",7.97,"C. Sabbah, Quelques remarques sur la geometrie des espaces"
324.76,569.34,485.91,576.41,"/F19",7.97,"conormaux, Asterisque 130 (1985) 161{192."
306.60,559.87,319.77,566.95,"/F19",7.97,"[15]"
324.75,559.87,557.56,566.95,"/F19",7.97,"J.-P. Brasselet, M. H. Schwartz, Sur les classes de Chern d'un"
324.76,550.41,557.53,557.48,"/F19",7.97,"ensemble analytique complexe, Asterisque 82-83 (1981) 93{147."
306.60,540.94,319.77,548.02,"/F19",7.97,"[16]"
324.75,540.94,557.54,548.02,"/F19",7.97,"S. Halperin, D. Toledo, Stiefel{Whitney homology classes, Ann."
324.76,531.48,429.13,538.56,"/F19",7.97,"of Math. 96 (1972) 511{525."
306.60,522.01,319.77,529.09,"/F19",7.97,"[17]"
324.75,522.01,557.55,529.09,"/F19",7.97,"R. MacPherson, Chern classes for singular algebraic varieties,"
324.76,512.55,454.28,519.63,"/F19",7.97,"Ann. of Math. 100 (1974) 423{432."
295.15,61.35,300.13,70.20,"/F8",9.96,"8"
