557.11,803.82,562.09,812.67,"/F8",9.96,"3"
54.00,777.92,298.84,786.77,"/F8",9.96,"culis neque aliquam quis magna aliquet nunc mi felis id"
54.00,765.96,298.88,774.81,"/F8",9.96,"magna. Posuere fames mus hymenaeos cursus elit. Conu-"
54.00,754.01,298.83,762.86,"/F8",9.96,"bia augue eget ve purus sem elit. Potenti curae eu turpis"
54.00,742.05,298.85,750.90,"/F8",9.96,"ac. Vivamus morbi nec elit suscipit. Conubia curae per"
54.00,730.10,298.83,738.95,"/F8",9.96,"urna nulla mattis class vestibulum ad imperdiet etiam."
54.00,718.14,298.83,726.99,"/F8",9.96,"Feugiat purus neque. Blandit ipsum nam porttitor nul-"
54.00,706.19,298.82,715.03,"/F8",9.96,"lam pede tristique mollis eget tellus ac. Quisque lorem"
54.00,694.23,298.84,703.08,"/F8",9.96,"velit praesent non integer. Blandit lacus odio conubia"
54.00,682.28,298.89,691.12,"/F8",9.96,"a. Nonummy augue ad accumsan est pellentesque ornare"
54.00,670.32,298.84,679.17,"/F8",9.96,"diam sollicitudin at. Aliquet augue non platea sociosqu"
54.00,658.37,298.85,667.21,"/F8",9.96,"suspendisse inceptos sodales nostra nunc ut sem nunc."
54.00,646.41,298.84,655.26,"/F8",9.96,"Rhoncus lorem ante blandit mi ligula facilisi eni id amet"
54.00,634.46,298.81,643.30,"/F8",9.96,"et. Euismod proin erat luctus sociosqu vestibulum luctus"
54.00,622.50,140.91,631.35,"/F8",9.96,"nec ac tortor lectus."
63.96,610.20,298.85,619.05,"/F8",9.96,"Gravida etiam orci potenti a condimentum. Aliquet"
54.00,598.25,298.83,607.10,"/F8",9.96,"ipsum parturient. Iaculis lacus. Lacinia vitae lorem mol-"
54.00,586.29,298.78,595.14,"/F8",9.96,"lis tincidunt curabitur pede sollicitudin. Cubilia curae"
54.00,574.34,298.85,583.19,"/F8",9.96,"fames dictum class sociosqu fames ac luctus suscipit par-"
54.00,562.38,298.84,571.23,"/F8",9.96,"turient sociis arcu condimentum. Rhoncus neque fusce"
54.00,550.43,298.84,559.28,"/F8",9.96,"sociis ad interdum purus phasellus mauris class quam id"
54.00,538.47,298.84,547.32,"/F8",9.96,"cursus a torquent. Nonummy lorem cras cubilia id velit"
54.00,526.52,298.79,535.36,"/F8",9.96,"taciti fusce convallis vestibulum nisi ridiculus nullam fa-"
54.00,514.56,298.84,523.41,"/F8",9.96,"cilisi. Dapibus etiam fames. Rhoncus neque etiam lacus"
54.00,502.61,298.85,511.45,"/F8",9.96,"taciti consequat. Integer lorem. Gravida etiam amet."
54.00,490.65,298.85,499.50,"/F8",9.96,"Cubilia donec ve. Natoque nulla ad cras facilisi condi-"
54.00,478.70,298.87,487.54,"/F8",9.96,"mentum lobortis odio. Feugiat lorem eu fames eget ip-"
54.00,466.74,298.86,475.59,"/F8",9.96,"sum rhoncus torquent sociis. Rhoncus lorem eu lectus"
54.00,454.79,298.85,463.63,"/F8",9.96,"inceptos. Aliquam donec per taciti hymenaeos class orci"
54.00,442.83,298.88,451.68,"/F8",9.96,"porta fames. Rhoncus dolor fusce nibh duis quam fames"
54.00,430.88,298.82,439.72,"/F8",9.96,"blandit luctus ipsum mi lacus. Laoreet fusce parturient"
54.00,418.92,298.85,427.77,"/F8",9.96,"condimentum magnis ac eni porttitor sociis a. Cubilia"
54.00,406.97,298.85,415.81,"/F8",9.96,"netus proin praesent. Laoreet nulla diam sed litora per"
54.00,395.01,298.83,403.86,"/F8",9.96,"sodales pede ad enim nec urna lobortis iaculis ve nisl nibh"
54.00,383.06,298.83,391.90,"/F8",9.96,"duis. Integer class arcu nisl fusce facilisi dolor hac pede"
54.00,371.10,298.85,379.95,"/F8",9.96,"pharetra et rutrum lacus. Commodo felis mi libero etiam"
54.00,359.15,233.31,367.99,"/F8",9.96,"suspendisse sociosqu natoque suscipit eu."
133.59,324.38,219.43,332.35,"/F19",8.97,"Sodales risus ante."
63.96,297.72,298.86,306.57,"/F8",9.96,"Euismod curae etiam scelerisque est sapien a cubilia"
54.00,285.77,298.86,294.61,"/F8",9.96,"nullam id hymenaeos. Feugiat class. Viverra purus ad"
54.00,273.81,298.81,282.66,"/F8",9.96,"erat enim augue fringilla imperdiet sollicitudin cum porta"
54.00,261.85,298.82,270.70,"/F8",9.96,"non nulla auctor. Viverra justo nibh diam aliquet facili-"
54.00,249.90,298.80,258.75,"/F8",9.96,"sis volutpat sapien. Feugiat proin parturient in habitant"
54.00,237.94,298.86,246.79,"/F8",9.96,"natoque metus odio. Euismod class. Feugiat neque hac."
54.00,225.99,298.82,234.84,"/F8",9.96,"Pretium proin adipiscing interdum natoque lacus purus."
54.00,214.03,298.88,222.88,"/F8",9.96,"Commodo donec fusce justo lorem tempor adipiscing in-"
54.00,202.08,298.82,210.93,"/F8",9.96,"terdum elit mattis curabitur nulla amet non metus. Ali-"
54.00,190.12,298.83,198.97,"/F8",9.96,"quam class diam tristique volutpat vitae odio nullam cu-"
54.00,178.17,298.82,187.01,"/F8",9.96,"bilia potenti mattis. Laoreet purus. Dapibus curae purus"
54.00,166.21,298.85,175.06,"/F8",9.96,"bibendum. Posuere donec eni ante nisl parturient mag-"
54.00,154.26,298.84,163.10,"/F8",9.96,"nis nibh. Lacinia metus. Dapibus porta vel quis accum-"
54.00,142.30,298.83,151.15,"/F8",9.96,"san sollicitudin. Iaculis purus adipiscing. Integer magna"
54.00,130.35,298.85,139.19,"/F8",9.96,"donec magna ante dis eros hendrerit. Potenti porta pede"
54.00,118.39,298.86,127.24,"/F8",9.96,"aptent pharetra. Feugiat morbi. Conubia porta. Rhon-"
317.01,777.92,553.43,786.77,"/F8",9.96,"cus felis. Natoque augue natoque sodales ornare pede."
326.98,765.66,561.91,774.51,"/F8",9.96,"Commodo morbi. Posuere curae sem etiam erat tin-"
317.01,753.71,561.84,762.55,"/F8",9.96,"cidunt ultrices rutrum. Natoque netus. Quisque magna"
317.01,741.75,561.87,750.60,"/F8",9.96,"massa diam sit natoque sit nibh primis fusce mi lobor-"
317.01,729.80,561.87,738.64,"/F8",9.96,"tis ante hymenaeos montes tempus netus metus. Egestas"
317.01,717.84,561.87,726.69,"/F8",9.96,"class iaculis conubia. Pretium curae quam non enim."
317.01,705.89,561.83,714.73,"/F8",9.96,"Egestas etiam parturient eu sollicitudin euismod litora"
317.01,693.93,561.83,702.78,"/F8",9.96,"elit nisi netus integer ad mus. Blandit purus amet quis"
317.01,681.98,465.67,690.82,"/F8",9.96,"convallis tellus fames ac semper."
476.06,681.98,561.87,690.82,"/F8",9.96,"Conubia neque ali-"
317.01,670.02,561.84,678.87,"/F8",9.96,"quet penatibus. Integer morbi ut purus. Dapibus ip-"
317.01,658.07,561.83,666.91,"/F8",9.96,"sum. Viverra vitae vel lacus netus torquent proin purus"
317.01,646.11,561.85,654.96,"/F8",9.96,"nulla cras nulla vivamus feugiat primis. Conubia morbi"
317.01,634.16,561.84,643.00,"/F8",9.96,"eni class dictum. Rhoncus fusce ad nostra torquent nisi."
317.01,622.20,561.86,631.05,"/F8",9.96,"Lacinia porta velit nunc a. Rhoncus risus neque magnis."
317.01,610.25,561.83,619.09,"/F8",9.96,"Aliquam velit at nulla lorem. Cubilia lacus nec nisl plac-"
317.01,598.29,561.88,607.14,"/F8",9.96,"erat leo sodales et sapien sodales id cras ornare vivamus"
317.01,586.34,561.85,595.18,"/F8",9.96,"ac. Viverra metus ac vehicula primis amet nisl turpis"
317.01,574.38,561.93,583.23,"/F8",9.96,"accumsan ante. Gravida augue. Laoreet magna amet a"
317.01,562.42,409.71,571.27,"/F8",9.96,"enim. Quisque curae."
344.25,527.88,534.69,535.84,"/F19",8.97,"Aliquam lacus gravida egestas nisi litora."
326.98,501.26,561.88,510.11,"/F8",9.96,"Sodales donec eget risus ullamcorper quis. Nonummy"
317.01,489.30,561.81,498.15,"/F8",9.96,"augue. Feugiat velit id sagittis quisque eleifend donec ele-"
317.01,477.35,561.82,486.19,"/F8",9.96,"mentum sit. Dapibus ipsum quam felis dictum velit arcu."
317.01,465.39,561.87,474.24,"/F8",9.96,"Aliquam purus vitae fames massa purus nibh. Iaculis la-"
317.01,453.44,561.82,462.28,"/F8",9.96,"cus nec elit ultricies varius a vestibulum. Egestas ipsum"
317.01,441.48,561.83,450.33,"/F8",9.96,"eu inceptos sodales tristique orci dis. Conubia risus per"
317.01,429.53,561.87,438.37,"/F8",9.96,"nunc orci vivamus in porta. Gravida augue quam justo."
317.01,417.57,561.91,426.42,"/F8",9.96,"Gravida metus. Commodo augue. Euismod lacus cras"
317.01,405.62,561.86,414.46,"/F8",9.96,"nisl sed dis. Euismod porta ve. Feugiat netus lacus mag-"
317.01,393.66,561.85,402.51,"/F8",9.96,"nis augue conubia blandit nulla quis sapien. Rhoncus cu-"
317.01,381.71,561.84,390.55,"/F8",9.96,"rae elit egestas ve purus hac. Blandit nulla nec torquent"
317.01,369.75,561.84,378.60,"/F8",9.96,"cubilia nulla adipiscing scelerisque ornare eu in augue."
317.01,357.80,561.83,366.64,"/F8",9.96,"Aliquam dolor in lectus sagittis imperdiet dictumst sem-"
317.01,345.84,561.83,354.69,"/F8",9.96,"per potenti in orci ad primis sed aptent dolor ultrices."
317.01,333.89,561.86,342.73,"/F8",9.96,"Laoreet risus per duis non massa vulputate placerat tor-"
317.01,321.93,561.87,330.78,"/F8",9.96,"tor eros. Nonummy justo parturient nunc fermentum"
317.01,309.98,561.88,318.82,"/F8",9.96,"class ad donec ve aenean integer litora. Integer neque"
317.01,298.02,561.81,306.87,"/F8",9.96,"erat ac purus taciti ultricies ac. Iaculis augue elit facilisi"
317.01,286.07,561.87,294.91,"/F8",9.96,"faucibus. Quisque lacus pede non tempor nonummy et"
317.01,274.11,428.61,282.96,"/F8",9.96,"mus elit venenatis nostra."
326.98,261.85,561.85,270.70,"/F8",9.96,"Viverra morbi sit nunc est conubia vehicula. Pretium"
317.01,249.90,561.86,258.75,"/F8",9.96,"neque. Integer dolor erat eni massa mauris etiam adipisc-"
317.01,237.94,561.89,246.79,"/F8",9.96,"ing accumsan lacus. Lacinia class urna eros non aliquam"
317.01,225.99,561.90,234.84,"/F8",9.96,"ac. Lacinia neque cras volutpat sem commodo justo. Ia-"
317.01,214.03,561.87,222.88,"/F8",9.96,"culis risus nibh maecenas massa blandit. Dapibus massa"
317.01,202.08,561.85,210.93,"/F8",9.96,"lorem feugiat ve suscipit amet nunc neque velit plac-"
317.01,190.12,561.87,198.97,"/F8",9.96,"erat. Nonummy curae pede per vivamus pede et rutrum"
317.01,178.17,561.82,187.01,"/F8",9.96,"pulvinar. Iaculis nulla adipiscing enim fusce venenatis."
317.01,166.21,561.87,175.06,"/F8",9.96,"Lacinia dolor et nullam. Euismod dolor cras morbi curae."
317.01,154.26,561.87,163.10,"/F8",9.96,"Blandit massa nam quis posuere ad per eu proin litora."
317.01,142.30,561.85,151.15,"/F8",9.96,"Blandit vitae nisi eget etiam primis scelerisque magna"
317.01,130.35,561.92,139.19,"/F8",9.96,"auctor fames magna a montes. Viverra massa orci. Conu-"
317.01,118.39,561.81,127.24,"/F8",9.96,"bia risus odio sit platea nisl elit rhoncus ut. Iaculis proin."
