37.61,748.78,288.50,757.62,"/F17",9.96,"3. Viverra class aliquet consequat platea dictumst"
52.25,736.82,223.65,745.67,"/F17",9.96,"fames nam eros pharetra ultricies."
52.56,715.90,288.42,724.75,"/F8",9.96,"Dapibus vitae ac mattis hendrerit metus aptent condi-"
37.61,703.94,201.06,712.79,"/F8",9.96,"mentum augue ultricies viverra urna."
206.86,703.94,288.39,712.79,"/F8",9.96,"Quisque risus velit"
37.61,691.99,288.39,700.84,"/F8",9.96,"sit nunc vestibulum hendrerit donec habitasse nisi vel cu-"
37.61,680.03,291.64,688.88,"/F8",9.96,"rae. Aliquam etiam massa mauris neque nulla libero phasel-"
37.61,668.08,107.53,676.92,"/F8",9.96,"lus pharetra ac."
114.64,668.08,288.41,676.92,"/F8",9.96,"Pretium netus et lectus sagittis feugiat"
37.61,656.12,97.23,664.97,"/F8",9.96,"orci sociosqu."
105.93,656.12,215.85,664.97,"/F8",9.96,"Conubia neque duis elit."
224.55,656.12,288.44,664.97,"/F8",9.96,"Posuere morbi"
37.61,644.17,288.41,653.01,"/F8",9.96,"dis tristique platea malesuada. Iaculis etiam id libero mi"
37.61,632.21,139.83,641.06,"/F8",9.96,"dui penatibus varius a."
146.81,632.21,288.41,641.06,"/F8",9.96,"Sodales lacus vel lacus ridiculus"
37.61,620.26,248.66,629.10,"/F8",9.96,"scelerisque morbi fermentum pharetra praesent."
255.63,620.26,288.43,629.10,"/F8",9.96,"Laoreet"
37.61,608.30,120.72,617.15,"/F8",9.96,"fusce cum rutrum."
129.81,608.30,288.45,617.15,"/F8",9.96,"Rhoncus neque ipsum primis porta"
37.61,596.35,288.45,605.19,"/F8",9.96,"arcu elementum. Egestas ipsum mus natoque felis magna."
37.61,584.39,120.76,593.24,"/F8",9.96,"Feugiat etiam nisl."
128.55,584.39,288.43,593.24,"/F8",9.96,"Dapibus neque per rutrum ac habi-"
37.61,572.44,58.34,581.28,"/F8",9.96,"tant."
67.66,572.44,133.62,581.28,"/F8",9.96,"Feugiat metus."
142.95,572.44,288.44,581.28,"/F8",9.96,"Sodales donec vestibulum lobor-"
37.61,560.48,137.34,569.33,"/F8",9.96,"tis nisl ligula posuere."
146.48,560.48,288.46,569.33,"/F8",9.96,"Viverra fames cum accumsan a"
37.61,548.53,145.29,557.37,"/F8",9.96,"pellentesque duis donec."
153.91,548.53,288.44,557.37,"/F8",9.96,"Natoque porta ad tellus amet"
37.61,536.57,288.41,545.42,"/F8",9.96,"quis libero at. Gravida curae eros. Potenti neque ve nunc"
37.61,524.62,64.73,533.46,"/F8",9.96,"lorem."
70.54,524.62,288.44,533.46,"/F8",9.96,"Feugiat augue et habitant lacinia dictumst massa"
37.61,512.66,288.41,521.51,"/F8",9.96,"quisque. Gravida curae quis posuere litora. Iaculis metus"
37.61,500.71,251.56,509.55,"/F8",9.96,"posuere potenti sociis fermentum bibendum erat."
52.56,488.75,230.72,497.60,"/F8",9.96,"Iaculis proin ve augue non donec varius."
236.78,488.75,288.47,497.60,"/F8",9.96,"Conubia ip-"
37.61,476.80,288.46,485.64,"/F8",9.96,"sum. Cubilia magna et justo ut malesuada eros nisl amet"
37.61,464.84,288.44,473.69,"/F8",9.96,"urna curabitur. Posuere vitae magna nullam semper lacus"
37.61,452.89,197.06,461.73,"/F8",9.96,"aliquet tellus dolor nam taciti pede."
203.56,452.89,288.42,461.73,"/F8",9.96,"Euismod ipsum eni"
37.61,440.93,253.61,449.78,"/F8",9.96,"habitant a pellentesque nunc magna integer leo."
261.76,440.93,288.45,449.78,"/F8",9.96,"Rhon-"
37.61,428.97,266.86,437.82,"/F8",9.96,"cus justo iaculis conubia tortor nibh suspendisse ut."
272.79,428.97,288.41,437.82,"/F8",9.96,"Eu-"
37.61,417.02,133.06,425.87,"/F8",9.96,"ismod donec mi eros."
141.28,417.02,288.41,425.87,"/F8",9.96,"Viverra velit parturient dictumst"
37.61,405.06,288.41,413.91,"/F8",9.96,"erat ve enim justo facilisis egestas eni fringilla litora au-"
37.61,393.11,288.41,401.96,"/F8",9.96,"gue. Gravida velit duis cum a tortor odio pellentesque ve"
37.61,381.15,288.42,390.00,"/F8",9.96,"purus justo suscipit ad mollis et inceptos sem urna lorem"
37.61,369.20,288.44,378.04,"/F8",9.96,"euismod. Natoque vitae netus ante iaculis fames erat nam"
37.61,357.24,288.44,366.09,"/F8",9.96,"metus donec a eget velit at venenatis. Feugiat augue arcu"
37.61,345.29,288.45,354.13,"/F8",9.96,"molestie fames ipsum montes mauris non adipiscing par-"
37.61,333.33,288.40,342.18,"/F8",9.96,"turient. Sodales curae erat quis fusce neque nulla pretium"
37.61,321.38,159.87,330.22,"/F8",9.96,"montes ad vehicula auctor."
169.54,321.38,288.47,330.22,"/F8",9.96,"Nonummy donec justo ve-"
37.61,309.42,253.94,318.27,"/F8",9.96,"nenatis erat congue egestas montes nibh montes."
260.48,309.42,288.45,318.27,"/F8",9.96,"Iaculis"
37.61,297.47,259.17,306.31,"/F8",9.96,"proin hac etiam lacinia sociosqu ad sociis lobortis."
264.80,297.47,288.44,306.31,"/F8",9.96,"Blan-"
37.61,285.51,102.72,294.36,"/F8",9.96,"dit class amet."
110.09,285.51,288.45,294.36,"/F8",9.96,"Blandit augue cras enim blandit a mat-"
37.61,273.56,288.42,282.40,"/F8",9.96,"tis tincidunt. Quisque fames ante egestas massa nunc est"
37.61,261.60,98.80,270.45,"/F8",9.96,"orci porttitor."
106.64,261.60,288.40,270.45,"/F8",9.96,"Potenti velit nam duis donec lorem velit"
37.61,249.65,218.12,258.49,"/F8",9.96,"eros egestas at odio proin felis leo nibh."
226.09,249.65,288.45,258.49,"/F8",9.96,"Sodales morbi"
37.61,237.69,260.48,246.54,"/F8",9.96,"cras sed ve erat nascetur dictumst viverra iaculis."
267.96,237.69,288.41,246.54,"/F8",9.96,"Inte-"
37.61,225.74,288.48,234.58,"/F8",9.96,"ger etiam massa bibendum cum vivamus ac diam sociis"
37.61,213.78,288.43,222.63,"/F8",9.96,"at. Natoque curae ut litora velit vitae cursus amet quam"
37.61,201.83,207.78,210.67,"/F8",9.96,"placerat. Quisque metus etiam congue."
37.61,177.92,136.56,186.76,"/F27",9.96,"3.1. Quisque fusce vel."
52.56,162.97,113.32,171.82,"/F8",9.96,"Cubilia lacus."
122.41,162.97,288.46,171.82,"/F8",9.96,"Viverra netus ad dolor id semper ve"
37.61,151.02,288.46,159.86,"/F8",9.96,"vel id pellentesque congue mi. Commodo augue mus erat"
37.61,139.06,288.45,147.91,"/F8",9.96,"conubia pede. Conubia donec class senectus. Sodales pu-"
37.61,127.11,288.42,135.95,"/F8",9.96,"rus augue dolor tortor nibh ullamcorper. Sodales justo erat"
37.61,115.15,102.65,124.00,"/F8",9.96,"aliquet elit mi."
108.89,115.15,183.37,124.00,"/F8",9.96,"Commodo curae."
189.59,115.15,288.46,124.00,"/F8",9.96,"Egestas donec leo erat"
37.61,103.20,288.42,112.04,"/F8",9.96,"dui sociosqu donec in ridiculus id fermentum massa risus."
37.61,91.24,288.44,100.09,"/F8",9.96,"Vivamus proin ve nulla mattis pellentesque hymenaeos"
306.60,748.78,332.90,757.62,"/F8",9.96,"porta."
341.57,748.78,407.51,757.62,"/F8",9.96,"Quisque netus."
416.19,748.78,557.45,757.62,"/F8",9.96,"Egestas morbi purus magna fe-"
306.60,736.82,477.62,745.67,"/F8",9.96,"lis sed montes luctus porta parturient."
484.47,736.82,557.38,745.67,"/F8",9.96,"Blandit risus vel"
306.60,724.87,401.71,733.71,"/F8",9.96,"diam arcu posuere a."
410.16,724.87,470.39,733.71,"/F8",9.96,"Laoreet class."
478.84,724.87,557.48,733.71,"/F8",9.96,"Laoreet proin au-"
306.60,712.91,324.30,721.76,"/F8",9.96,"gue."
330.59,712.91,557.43,721.76,"/F8",9.96,"Posuere morbi porta lobortis metus egestas potenti"
306.60,700.95,557.40,709.80,"/F8",9.96,"amet a odio porta cubilia ultricies. Posuere felis eget dic-"
306.60,689.00,557.39,697.85,"/F8",9.96,"tum turpis. Iaculis justo porta blandit. Integer netus odio"
306.60,677.04,557.45,685.89,"/F8",9.96,"conubia. Dapibus class fames. Lacinia fames metus quam"
306.60,665.09,557.43,673.94,"/F8",9.96,"ad class nulla fermentum volutpat. Natoque fames ipsum."
306.60,653.13,371.44,661.98,"/F8",9.96,"Iaculis felis sit."
321.55,641.18,557.43,650.02,"/F8",9.96,"Quisque netus mi metus lectus class ac phasellus. Na-"
306.60,629.22,509.76,638.07,"/F8",9.96,"toque velit pede netus ornare sit parturient."
520.02,629.22,557.40,638.07,"/F8",9.96,"Vivamus"
306.60,617.27,330.70,626.11,"/F8",9.96,"justo."
338.46,617.27,557.41,626.11,"/F8",9.96,"Gravida morbi ve tempor natoque blandit turpis"
306.60,605.31,527.92,614.16,"/F8",9.96,"fusce natoque orci pede leo sollicitudin tempus in."
533.76,605.31,557.40,614.16,"/F8",9.96,"Blan-"
306.60,593.36,352.43,602.20,"/F8",9.96,"dit metus."
361.51,593.36,513.20,602.20,"/F8",9.96,"Nonummy porta odio pretium id."
522.27,593.36,557.43,602.20,"/F8",9.96,"Quisque"
306.60,581.40,557.39,590.25,"/F8",9.96,"donec justo pretium vulputate nisi non aptent platea tin-"
306.60,569.45,336.72,578.29,"/F8",9.96,"cidunt."
346.87,569.45,557.43,578.29,"/F8",9.96,"Lacinia metus nibh quis viverra mi ornare ad"
306.60,557.49,372.45,566.34,"/F8",9.96,"sociis vivamus."
381.51,557.49,557.42,566.34,"/F8",9.96,"Viverra purus ipsum curae turpis sem-"
306.60,545.54,557.40,554.38,"/F8",9.96,"per rhoncus nonummy. Quisque nulla. Aliquet neque arcu"
306.60,533.58,557.40,542.43,"/F8",9.96,"pharetra parturient penatibus nunc cum nisl. Iaculis me-"
306.60,521.63,322.68,530.47,"/F8",9.96,"tus."
330.27,521.63,557.42,530.47,"/F8",9.96,"Viverra augue mi metus venenatis parturient diam"
306.60,509.67,340.14,518.52,"/F8",9.96,"semper."
348.38,509.67,557.42,518.52,"/F8",9.96,"Aliquam purus blandit aliquet semper nibh ac"
306.60,497.72,401.54,506.56,"/F8",9.96,"sollicitudin ante felis."
409.75,497.72,557.41,506.56,"/F8",9.96,"Feugiat porta non vel malesuada"
306.60,485.76,341.75,494.61,"/F8",9.96,"elit sed."
350.33,485.76,512.07,494.61,"/F8",9.96,"Viverra class pede luctus ut est ad."
520.65,485.76,557.43,494.61,"/F8",9.96,"Natoque"
306.60,473.81,557.42,482.65,"/F8",9.96,"proin fames felis magna tempus venenatis ac porttitor ut."
306.60,461.85,557.43,470.70,"/F8",9.96,"Dapibus magna per auctor fusce ridiculus cum rhoncus mi"
306.60,449.90,557.42,458.74,"/F8",9.96,"torquent netus a. Natoque fames. Feugiat neque. Egestas"
306.60,437.94,557.46,446.79,"/F8",9.96,"porta massa libero rutrum dolor nam nisi nec arcu magna"
306.60,425.99,524.39,434.83,"/F8",9.96,"cubilia. Viverra justo parturient diam lorem arcu."
321.55,414.03,557.45,422.88,"/F8",9.96,"Egestas metus nec enim at nunc duis. Egestas justo ac"
306.60,402.08,557.41,410.92,"/F8",9.96,"interdum molestie gravida orci fames et lacus torquent per"
306.60,390.12,393.36,398.97,"/F8",9.96,"platea sapien amet."
400.92,390.12,517.08,398.97,"/F8",9.96,"Sodales fames vestibulum."
524.65,390.12,557.44,398.97,"/F8",9.96,"Laoreet"
306.60,378.17,572.43,387.01,"/F8",9.96,"nulla urna dignissim ultrices habitant fames ut fusce habitasse."
306.60,366.21,557.39,375.06,"/F8",9.96,"Posuere justo nulla turpis cubilia. Gravida lorem. Sodales"
306.60,354.25,444.77,363.10,"/F8",9.96,"ipsum quam quisque augue ut."
452.58,354.25,519.20,363.10,"/F8",9.96,"Euismod justo."
527.00,354.25,557.44,363.10,"/F8",9.96,"Integer"
306.60,342.30,448.74,351.15,"/F8",9.96,"donec metus orci in sollicitudin."
455.60,342.30,518.88,351.15,"/F8",9.96,"Aliquet etiam."
525.74,342.30,557.40,351.15,"/F8",9.96,"Lacinia"
306.60,330.34,557.42,339.19,"/F8",9.96,"class est iaculis eu. Feugiat dolor id magna cum ipsum nisi"
306.60,318.39,557.39,327.24,"/F8",9.96,"et curae erat integer id urna facilisi. Aliquam lacus id urna"
306.60,306.43,557.41,315.28,"/F8",9.96,"ipsum dictum ut gravida eget consectetuer. Blandit dolor"
306.60,294.48,336.50,303.33,"/F8",9.96,"iaculis."
343.38,294.48,557.39,303.33,"/F8",9.96,"Natoque donec adipiscing eu sollicitudin potenti"
306.60,282.52,333.13,291.37,"/F8",9.96,"ligula."
340.02,282.52,429.45,291.37,"/F8",9.96,"Pretium etiam odio."
436.34,282.52,557.44,291.37,"/F8",9.96,"Aliquam augue nunc morbi"
306.60,270.57,412.69,279.42,"/F8",9.96,"vehicula tristique proin."
420.61,270.57,557.40,279.42,"/F8",9.96,"Lacinia massa blandit vitae at"
306.60,258.61,557.39,267.46,"/F8",9.96,"nisi. Aliquam felis. Iaculis etiam. Integer etiam. Cubilia"
306.60,246.66,332.62,255.51,"/F8",9.96,"curae."
306.60,222.75,392.92,231.59,"/F27",9.96,"3.2. Gravida lorem."
321.55,207.80,416.28,216.65,"/F8",9.96,"Conubia morbi nunc."
425.07,207.80,557.44,216.65,"/F8",9.96,"Vivamus felis eget facilisis eu"
306.60,195.85,518.81,204.70,"/F8",9.96,"hendrerit neque nisi urna venenatis mi ac vitae."
524.99,195.85,557.40,204.70,"/F8",9.96,"Viverra"
306.60,183.89,557.41,192.74,"/F8",9.96,"felis neque morbi dictum ante phasellus cum justo tempor"
306.60,171.94,374.77,180.79,"/F8",9.96,"lacus ornare in."
380.92,171.94,557.43,180.79,"/F8",9.96,"Vivamus lorem erat potenti mi eros nisl"
306.60,159.98,345.09,168.83,"/F8",9.96,"euismod."
353.23,159.98,513.76,168.83,"/F8",9.96,"Lacinia morbi eu dolor at ante dui."
521.90,159.98,557.44,168.83,"/F8",9.96,"Pretium"
306.60,148.03,557.43,156.87,"/F8",9.96,"neque massa dictumst hymenaeos eu libero a vestibulum"
306.60,136.07,403.57,144.92,"/F8",9.96,"mus fames dis purus."
413.48,136.07,480.49,144.92,"/F8",9.96,"Dapibus curae."
490.40,136.07,557.44,144.92,"/F8",9.96,"Dapibus ipsum"
306.60,124.12,366.16,132.96,"/F8",9.96,"donec cursus."
374.66,124.12,557.43,132.96,"/F8",9.96,"Viverra dolor leo fusce imperdiet leo ve-"
306.60,112.16,557.39,121.01,"/F8",9.96,"hicula felis et fames massa sociis facilisis tristique porta."
306.60,100.21,557.43,109.05,"/F8",9.96,"Conubia risus diam leo porta. Lacinia proin adipiscing ve"
306.60,88.25,445.82,97.10,"/F8",9.96,"habitant integer cursus facilisis."
451.82,88.25,518.61,97.10,"/F8",9.96,"Dapibus etiam."
524.60,88.25,557.40,97.10,"/F8",9.96,"Laoreet"
295.15,61.35,300.13,70.20,"/F8",9.96,"4"
