557.11,803.82,562.09,812.67,"/F8",9.96,"4"
54.00,777.92,298.84,786.77,"/F8",9.96,"aptent adipiscing netus natoque habitant integer fames"
54.00,765.96,161.78,774.81,"/F8",9.96,"sodales. Gravida magna."
65.16,731.42,287.76,739.38,"/F19",8.97,"SODALES LOREM ENIM NONUMMY ORCI."
63.96,704.80,298.80,713.65,"/F8",9.96,"Posuere curae in varius ut in pede tincidunt sollicitudin"
54.00,692.84,298.87,701.69,"/F8",9.96,"adipiscing ante. Natoque magna nisl eros. Euismod cu-"
54.00,680.89,298.87,689.73,"/F8",9.96,"rae at mauris penatibus ornare accumsan adipiscing. So-"
54.00,668.93,298.82,677.78,"/F8",9.96,"dales lacus leo duis sed mi a varius elit. Feugiat felis vel"
54.00,656.98,298.85,665.82,"/F8",9.96,"pharetra a. Integer augue. Dapibus augue parturient so-"
54.00,645.02,298.86,653.87,"/F8",9.96,"ciosqu odio. Laoreet netus ad magnis. Blandit felis mus"
54.00,633.07,298.82,641.91,"/F8",9.96,"pede eleifend proin netus augue blandit mollis neque in-"
54.00,621.11,298.85,629.96,"/F8",9.96,"ceptos sem pellentesque curae risus diam. Posuere class"
54.00,609.16,298.83,618.00,"/F8",9.96,"nisl ultrices a consectetuer urna dolor semper metus eros."
54.00,597.20,298.82,606.05,"/F8",9.96,"Blandit dolor erat et consectetuer. Quisque lorem purus"
54.00,585.25,201.05,594.09,"/F8",9.96,"taciti convallis habitant sociosqu."
207.79,585.25,298.83,594.09,"/F8",9.96,"Rhoncus nulla etiam"
54.00,573.29,117.11,582.14,"/F8",9.96,"netus eleifend."
124.18,573.29,247.27,582.14,"/F8",9.96,"Vivamus fames ante primis."
254.34,573.29,298.87,582.14,"/F8",9.96,"Commodo"
54.00,561.34,298.79,570.18,"/F8",9.96,"metus et sollicitudin pellentesque viverra litora. Sodales"
54.00,549.38,298.82,558.23,"/F8",9.96,"risus mus egestas nascetur id mollis curabitur aliquet me-"
54.00,537.43,298.83,546.27,"/F8",9.96,"tus. Feugiat fames. Rhoncus nulla nunc scelerisque pel-"
54.00,525.47,255.05,534.32,"/F8",9.96,"lentesque gravida eget sed purus orci turpis."
263.90,525.47,298.84,534.32,"/F8",9.96,"Gravida"
54.00,513.52,254.49,522.36,"/F8",9.96,"purus nulla gravida elementum praesent nisi."
261.79,513.52,298.84,522.36,"/F8",9.96,"Aliquam"
54.00,501.56,298.87,510.41,"/F8",9.96,"magna massa ullamcorper ve taciti justo nulla sociosqu"
54.00,489.61,298.82,498.45,"/F8",9.96,"ve fusce eu sem. Pretium netus mi ultricies condimentum"
54.00,477.65,180.07,486.50,"/F8",9.96,"dis arcu. Feugiat justo diam."
63.96,465.39,122.99,474.24,"/F8",9.96,"Lacinia risus."
131.17,465.39,298.87,474.24,"/F8",9.96,"Integer morbi sed lobortis a pharetra"
54.00,453.44,75.59,462.28,"/F8",9.96,"arcu."
84.53,453.44,161.81,462.28,"/F8",9.96,"Commodo neque."
170.73,453.44,298.87,462.28,"/F8",9.96,"Aliquet dolor eget felis risus"
54.00,441.48,298.85,450.33,"/F8",9.96,"cursus elementum nullam dignissim elementum vitae a"
54.00,429.53,298.81,438.37,"/F8",9.96,"rhoncus. Feugiat fusce dis erat inceptos vestibulum libero"
54.00,417.57,298.81,426.42,"/F8",9.96,"eleifend parturient semper ve lectus consectetuer. Blan-"
54.00,405.62,298.87,414.46,"/F8",9.96,"dit purus cras pharetra sit ad magna eu. Aliquam augue"
54.00,393.66,298.81,402.51,"/F8",9.96,"dapibus felis erat dictum litora phasellus curae mi rutrum"
54.00,381.71,298.79,390.55,"/F8",9.96,"risus velit. Cubilia nulla justo per nisi ornare parturient"
54.00,369.75,298.81,378.60,"/F8",9.96,"nulla pretium semper ve diam tellus quisque ut. Euismod"
54.00,357.80,298.85,366.64,"/F8",9.96,"netus amet donec odio aptent facilisi maecenas aliquet."
54.00,345.84,298.84,354.69,"/F8",9.96,"Posuere augue eni elit vitae id augue vehicula fusce. Non-"
54.00,333.89,298.87,342.73,"/F8",9.96,"ummy curae. Nonummy felis. Lacinia dolor morbi lorem"
54.00,321.93,176.37,330.78,"/F8",9.96,"rutrum tortor magna curae."
181.92,321.93,298.87,330.78,"/F8",9.96,"Lacinia metus hac adipisc-"
54.00,309.98,298.87,318.82,"/F8",9.96,"ing. Pretium etiam. Nonummy magna eu ipsum sollici-"
54.00,298.02,298.82,306.87,"/F8",9.96,"tudin dignissim dolor eni. Pretium neque ac sapien vitae"
54.00,286.07,298.82,294.91,"/F8",9.96,"feugiat hendrerit dictumst sapien rhoncus aliquet quam"
54.00,274.11,191.38,282.96,"/F8",9.96,"erat nonummy id mus pede at."
197.73,274.11,298.85,282.96,"/F8",9.96,"Potenti netus id metus"
54.00,262.16,298.87,271.00,"/F8",9.96,"diam tempus elementum eu et malesuada suspendisse."
54.00,250.20,298.79,259.05,"/F8",9.96,"Quisque vitae nisl dui dolor laoreet ultricies eget eni sit"
54.00,238.25,102.17,247.09,"/F8",9.96,"malesuada."
110.74,238.25,263.61,247.09,"/F8",9.96,"Posuere nulla vestibulum conubia."
272.18,238.25,298.87,247.09,"/F8",9.96,"Rhon-"
54.00,226.29,298.83,235.14,"/F8",9.96,"cus porta vel ipsum arcu curabitur facilisi cursus ante"
54.00,214.34,285.23,223.18,"/F8",9.96,"fringilla. Egestas dolor parturient id faucibus lacinia."
63.96,202.08,298.82,210.93,"/F8",9.96,"Aliquet vitae dui diam sollicitudin nonummy lobortis"
54.00,190.12,298.82,198.97,"/F8",9.96,"curae taciti luctus donec. Aliquet lorem adipiscing nibh"
54.00,178.17,298.83,187.02,"/F8",9.96,"aptent id aptent est quis. Egestas ipsum quam at sit urna"
54.00,166.21,298.79,175.06,"/F8",9.96,"ut sollicitudin posuere. Feugiat nulla erat scelerisque sit"
54.00,154.26,298.84,163.11,"/F8",9.96,"quam. Lacinia justo mus eros nec purus tincidunt semper"
54.00,142.30,298.85,151.15,"/F8",9.96,"donec vel. Viverra augue diam libero auctor elementum."
54.00,130.35,298.87,139.19,"/F8",9.96,"Integer vitae at curae mattis nunc tortor nam ante do-"
54.00,118.39,68.40,127.24,"/F8",9.96,"lor."
75.70,118.39,226.94,127.24,"/F8",9.96,"Laoreet donec in ultrices rhoncus."
234.24,118.39,298.84,127.24,"/F8",9.96,"Viverra neque."
317.01,777.92,561.84,786.77,"/F8",9.96,"Sodales dolor vestibulum lobortis laoreet pharetra pede."
317.01,765.96,561.85,774.81,"/F8",9.96,"Potenti massa erat netus. Blandit purus mi ut quam dic-"
317.01,754.01,406.79,762.86,"/F8",9.96,"tum convallis neque."
412.69,754.01,561.84,762.86,"/F8",9.96,"Potenti fusce lacus rhoncus mollis"
317.01,742.05,561.89,750.90,"/F8",9.96,"augue potenti. Conubia fames non. Conubia justo diam"
317.01,730.10,343.62,738.94,"/F8",9.96,"a nisi."
349.78,730.10,561.85,738.94,"/F8",9.96,"Pretium justo sem nibh gravida sociis neque ul-"
317.01,718.14,561.86,726.99,"/F8",9.96,"trices cum pellentesque felis massa cum magna. Pretium"
317.01,706.19,561.85,715.03,"/F8",9.96,"netus pede ullamcorper mi litora. Feugiat ipsum hac odio"
317.01,694.23,561.86,703.08,"/F8",9.96,"habitant. Vivamus netus lorem consequat faucibus amet"
317.01,682.28,561.82,691.12,"/F8",9.96,"blandit. Viverra netus. Dapibus vitae eget litora gravida"
317.01,670.32,508.29,679.17,"/F8",9.96,"nonummy accumsan eu non. Feugiat donec."
353.85,600.83,525.13,608.79,"/F19",8.97,"Sodales class est augue ante quisque."
326.98,567.62,361.90,576.47,"/F8",9.96,"Gravida"
367.55,567.62,391.88,576.47,"/F8",9.96,"etiam"
397.53,567.62,414.76,576.47,"/F8",9.96,"eros"
420.41,567.62,454.71,576.47,"/F8",9.96,"pretium"
460.36,567.62,485.82,576.47,"/F8",9.96,"morbi"
491.46,567.62,518.28,576.47,"/F8",9.96,"quam."
529.68,567.62,561.89,576.47,"/F8",9.96,"Feugiat"
317.01,555.67,561.87,564.51,"/F8",9.96,"massa nulla congue ad neque lacus molestie vestibulum."
317.01,543.71,561.84,552.56,"/F8",9.96,"Aliquam fames eget habitant sollicitudin tempor eu elit"
317.01,531.76,561.82,540.60,"/F8",9.96,"urna in risus pellentesque etiam. Gravida velit. Feugiat"
317.01,519.80,418.68,528.65,"/F8",9.96,"vitae nam odio lacinia."
425.24,519.80,561.85,528.65,"/F8",9.96,"Euismod nulla et aptent sollic-"
317.01,507.85,423.53,516.69,"/F8",9.96,"itudin nam risus luctus."
430.92,507.85,496.50,516.69,"/F8",9.96,"Sodales massa."
503.87,507.85,561.85,516.69,"/F8",9.96,"Viverra vitae"
317.01,495.89,561.82,504.74,"/F8",9.96,"quis vivamus euismod primis tellus velit dignissim ante"
317.01,483.94,561.83,492.78,"/F8",9.96,"cubilia. Egestas proin non facilisis aenean. Dapibus vitae"
317.01,471.98,462.73,480.83,"/F8",9.96,"vestibulum scelerisque varius ad."
470.52,471.98,561.85,480.83,"/F8",9.96,"Natoque lacus quam"
317.01,460.03,346.31,468.87,"/F8",9.96,"platea."
352.85,460.03,561.88,468.87,"/F8",9.96,"Euismod neque diam purus ac magnis ve pulv-"
317.01,448.07,561.84,456.92,"/F8",9.96,"inar. Posuere purus fusce libero pede luctus sociis lorem"
317.01,436.12,561.85,444.96,"/F8",9.96,"varius. Sodales risus mi justo condimentum senectus con-"
317.01,424.16,561.89,433.01,"/F8",9.96,"sequat a magna aliquam curabitur pede. Commodo nulla"
317.01,412.20,561.84,421.05,"/F8",9.96,"neque viverra tempor eu ligula. Sodales purus adipiscing"
317.01,400.25,561.85,409.10,"/F8",9.96,"eros vulputate. Gravida metus. Vivamus neque at ligula"
317.01,388.29,561.82,397.14,"/F8",9.96,"sollicitudin blandit etiam. Egestas vitae. Posuere lorem"
317.01,376.34,520.98,385.19,"/F8",9.96,"urna pretium ac sociis curae malesuada ante."
529.10,376.34,561.89,385.19,"/F8",9.96,"Laoreet"
317.01,364.38,561.86,373.23,"/F8",9.96,"morbi netus amet maecenas posuere pellentesque mattis"
317.01,352.43,561.88,361.28,"/F8",9.96,"tortor non. Nonummy felis eu platea dis egestas ac enim"
317.01,340.47,354.07,349.32,"/F8",9.96,"pretium."
326.98,321.63,468.56,330.48,"/F8",9.96,"Posuere felis adipiscing dapibus."
474.32,321.63,561.86,330.48,"/F8",9.96,"Viverra morbi dolor"
317.01,309.68,504.37,318.52,"/F8",9.96,"magna vehicula parturient phasellus justo."
510.65,309.68,561.86,318.52,"/F8",9.96,"Conubia la-"
317.01,297.72,400.00,306.57,"/F8",9.96,"cus cras vulputate."
405.56,297.72,561.80,306.57,"/F8",9.96,"Blandit netus eu sit facilisis facilisi."
317.01,285.76,463.14,294.61,"/F8",9.96,"Gravida fusce risus sem cras per."
469.04,285.76,561.88,294.61,"/F8",9.96,"Nonummy augue nisi"
317.01,273.81,561.85,282.66,"/F8",9.96,"ac praesent odio luctus volutpat hac mattis at erat condi-"
317.01,261.85,561.85,270.70,"/F8",9.96,"mentum hac. Egestas ipsum fusce urna aliquet imperdiet"
317.01,249.90,350.52,258.75,"/F8",9.96,"montes."
357.10,249.90,561.85,258.75,"/F8",9.96,"Blandit neque ac ut quis sit augue vitae facil-"
317.01,237.94,561.87,246.79,"/F8",9.96,"isi augue elementum. Aliquet class. Integer magna class"
317.01,225.99,454.15,234.84,"/F8",9.96,"nascetur nulla ad lorem tortor."
460.74,225.99,561.84,234.84,"/F8",9.96,"Pretium netus in port-"
317.01,214.03,339.14,222.88,"/F8",9.96,"titor."
345.84,214.03,450.35,222.88,"/F8",9.96,"Dapibus vitae quis hac."
457.04,214.03,561.86,222.88,"/F8",9.96,"Nonummy justo egestas"
317.01,202.08,510.46,210.93,"/F8",9.96,"ipsum lacus cum dictum pretium hendrerit."
517.05,202.08,561.86,210.93,"/F8",9.96,"Nonummy"
317.01,190.12,561.82,198.97,"/F8",9.96,"purus pede taciti interdum proin a dictum nibh. Blandit"
317.01,178.17,561.85,187.02,"/F8",9.96,"lacus dapibus diam ut pede hendrerit ut mi id mauris do-"
317.01,166.21,561.87,175.06,"/F8",9.96,"lor. Aliquam etiam. Aliquam neque. Dapibus augue sed"
317.01,154.26,561.86,163.11,"/F8",9.96,"vitae curae morbi quam porttitor varius fames adipisc-"
317.01,142.30,561.83,151.15,"/F8",9.96,"ing diam ridiculus. Cubilia lorem. Egestas porta et velit"
317.01,130.35,333.90,139.19,"/F8",9.96,"per."
340.63,130.35,405.72,139.19,"/F8",9.96,"Feugiat ipsum."
412.46,130.35,561.86,139.19,"/F8",9.96,"Aliquet proin ad nunc hymenaeos"
317.01,118.39,391.97,127.24,"/F8",9.96,"non pellentesque."
