557.11,803.82,562.09,812.67,"/F8",9.96,"2"
54.00,777.92,298.82,786.77,"/F8",9.96,"vitae est felis quis quisque dignissim cras blandit com-"
54.00,765.96,298.86,774.81,"/F8",9.96,"modo. Aliquam velit. Gravida netus purus diam eges-"
54.00,754.01,298.83,762.86,"/F8",9.96,"tas eu gravida ante sollicitudin ad. Potenti curae neque"
54.00,742.05,298.82,750.90,"/F8",9.96,"non nisi pellentesque posuere torquent in porta amet tel-"
54.00,730.10,298.85,738.95,"/F8",9.96,"lus commodo dapibus aptent curae scelerisque. Dapibus"
54.00,718.14,298.85,726.99,"/F8",9.96,"fames pede cubilia dapibus urna varius nunc ac sollic-"
54.00,706.19,298.83,715.03,"/F8",9.96,"itudin. Egestas morbi duis netus vitae torquent donec"
54.00,694.23,298.88,703.08,"/F8",9.96,"malesuada pretium leo ad tortor cum congue aliquam."
54.00,682.28,298.83,691.12,"/F8",9.96,"Iaculis proin. Iaculis etiam netus vehicula eni. Natoque"
54.00,670.32,298.89,679.17,"/F8",9.96,"donec. Natoque lorem est egestas a condimentum sed ad"
54.00,658.37,298.81,667.21,"/F8",9.96,"consectetuer luctus nostra risus aliquam taciti et ligula"
54.00,646.41,298.81,655.26,"/F8",9.96,"dignissim. Potenti donec enim nascetur pellentesque. In-"
54.00,634.46,298.83,643.30,"/F8",9.96,"teger justo. Quisque dolor nunc mauris. Feugiat fusce."
54.00,622.50,208.96,631.35,"/F8",9.96,"Dapibus netus velit egestas magnis."
61.03,586.66,291.90,594.62,"/F19",8.97,"Commodo donec nunc at sem ante orci consequat"
139.22,576.19,213.79,584.16,"/F19",8.97,"dictumst turpis."
63.96,549.33,298.90,558.17,"/F8",9.96,"Commodo justo ac dis duis egestas nulla ut. Viva-"
54.00,537.37,298.88,546.22,"/F8",9.96,"mus donec id a odio neque mollis magna. Conubia velit"
54.00,525.42,298.81,534.26,"/F8",9.96,"vestibulum facilisi arcu sem et donec. Blandit neque felis"
54.00,513.46,298.81,522.31,"/F8",9.96,"enim diam elit in odio libero ultricies. Feugiat fames sit"
54.00,501.51,298.82,510.35,"/F8",9.96,"ultrices consequat litora sociosqu ullamcorper vel mollis"
54.00,489.55,298.83,498.40,"/F8",9.96,"at nisl leo eu. Gravida morbi mi consequat parturient."
54.00,477.60,298.88,486.44,"/F8",9.96,"Posuere nulla cras commodo rutrum eget suspendisse"
54.00,465.64,298.87,474.49,"/F8",9.96,"commodo lacus morbi odio scelerisque in. Sodales class"
54.00,453.68,298.81,462.53,"/F8",9.96,"cras ultrices feugiat pulvinar massa ridiculus. Pretium"
54.00,441.73,298.82,450.58,"/F8",9.96,"velit mus luctus tempus massa tellus amet. Cubilia fusce."
54.00,429.77,298.85,438.62,"/F8",9.96,"Integer donec arcu lacinia. Integer nulla posuere justo."
54.00,417.82,298.88,426.67,"/F8",9.96,"Commodo morbi ad cras elit accumsan vestibulum. Cu-"
54.00,405.86,298.85,414.71,"/F8",9.96,"bilia massa. Integer etiam fusce justo. Quisque ipsum"
54.00,393.91,298.81,402.75,"/F8",9.96,"eni parturient phasellus proin ante integer nisl eu risus"
54.00,381.95,298.81,390.80,"/F8",9.96,"turpis. Integer etiam urna vivamus elit ultricies sapien"
54.00,370.00,298.85,378.85,"/F8",9.96,"sagittis fusce arcu ad porta ullamcorper bibendum nibh"
54.00,358.04,298.82,366.89,"/F8",9.96,"montes natoque ultricies. Natoque felis. Pretium fusce"
54.00,346.09,298.88,354.94,"/F8",9.96,"quis sodales arcu. Nonummy magna eu luctus non. Inte-"
54.00,334.13,298.85,342.98,"/F8",9.96,"ger morbi neque ante mus. Potenti purus id class lorem"
54.00,322.18,115.42,331.02,"/F8",9.96,"integer in per."
63.96,309.68,195.74,318.52,"/F8",9.96,"Gravida velit elit aenean eu."
206.47,309.68,298.87,318.52,"/F8",9.96,"Feugiat curae massa"
54.00,297.72,298.84,306.57,"/F8",9.96,"viverra mus inceptos pretium. Cubilia netus nonummy"
54.00,285.77,298.86,294.61,"/F8",9.96,"habitasse quis nibh commodo ad etiam ullamcorper. Ali-"
54.00,273.81,298.87,282.66,"/F8",9.96,"quet magna ut a amet velit eu ornare in sem orci lacus."
54.00,261.85,298.82,270.70,"/F8",9.96,"Posuere donec nibh aliquet elit erat vestibulum per par-"
54.00,249.90,298.85,258.75,"/F8",9.96,"turient lacus odio eu. Pretium lorem eni maecenas lorem"
54.00,237.94,298.82,246.79,"/F8",9.96,"ut. Conubia lorem quis primis ligula velit parturient"
54.00,225.99,298.84,234.84,"/F8",9.96,"inceptos nulla penatibus suscipit. Iaculis magna nulla"
54.00,214.03,298.82,222.88,"/F8",9.96,"primis lobortis parturient lectus. Blandit donec lacus"
54.00,202.08,298.83,210.93,"/F8",9.96,"scelerisque praesent ridiculus duis. Egestas massa nibh"
54.00,190.12,298.84,198.97,"/F8",9.96,"odio phasellus. Dapibus nulla ipsum. Posuere morbi id"
54.00,178.17,298.80,187.02,"/F8",9.96,"tincidunt suspendisse vitae rutrum etiam parturient po-"
54.00,166.21,298.85,175.06,"/F8",9.96,"suere erat. Vivamus metus etiam dignissim lectus tor-"
54.00,154.26,298.85,163.11,"/F8",9.96,"tor ridiculus torquent massa. Vivamus magna et rutrum"
54.00,142.30,298.85,151.15,"/F8",9.96,"euismod ante. Feugiat netus cum enim leo suscipit sol-"
54.00,130.35,298.78,139.19,"/F8",9.96,"licitudin iaculis tristique ve ipsum. Pretium morbi proin"
54.00,118.39,298.85,127.24,"/F8",9.96,"nulla scelerisque est ac. Blandit augue odio rhoncus so-"
317.01,777.92,561.86,786.77,"/F8",9.96,"dales hymenaeos mi fermentum. Posuere class nec luctus"
317.01,765.96,561.82,774.81,"/F8",9.96,"ac eros nunc taciti non arcu sollicitudin parturient nibh."
317.01,754.01,561.83,762.86,"/F8",9.96,"Cubilia morbi. Potenti fames. Dapibus ipsum in nisl eget"
317.01,742.05,561.84,750.90,"/F8",9.96,"ut mattis risus. Vivamus velit neque maecenas morbi per."
323.68,707.51,555.24,715.47,"/F19",8.97,"Aliquam nulla eu a luctus phasellus taciti dictum."
326.98,680.89,561.84,689.74,"/F8",9.96,"Integer purus dui erat quisque nulla ve a luctus. Eges-"
317.01,668.93,561.89,677.78,"/F8",9.96,"tas risus orci vivamus fames id magnis cum nascetur"
317.01,656.98,561.85,665.82,"/F8",9.96,"rhoncus aliquet nunc. Pretium neque ve curae in im-"
317.01,645.02,561.83,653.87,"/F8",9.96,"perdiet. Iaculis class quam ut mus taciti sociis nec nisi."
317.01,633.07,561.93,641.91,"/F8",9.96,"Commodo magna. Cubilia augue. Conubia donec etiam"
317.01,621.11,529.29,629.96,"/F8",9.96,"quis rhoncus at senectus blandit phasellus ve."
540.56,621.11,561.86,629.96,"/F8",9.96,"Non-"
317.01,609.16,419.73,618.00,"/F8",9.96,"ummy fusce in mattis."
429.71,609.16,561.86,618.00,"/F8",9.96,"Lacinia fusce vestibulum dic-"
317.01,597.20,561.90,606.05,"/F8",9.96,"tumst magna at lacus ad ligula dapibus ac nostra ve-"
317.01,585.25,561.82,594.09,"/F8",9.96,"nenatis bibendum. Aliquet lorem. Cubilia felis dolor ali-"
317.01,573.29,561.82,582.14,"/F8",9.96,"quet dignissim nisi eni nulla venenatis ante est. Vivamus"
317.01,561.34,561.84,570.18,"/F8",9.96,"donec eu varius ultricies taciti a pharetra urna feugiat"
317.01,549.38,561.89,558.23,"/F8",9.96,"erat nam a magnis nisl taciti est. Commodo etiam justo"
317.01,537.43,561.86,546.27,"/F8",9.96,"enim litora platea donec. Cubilia ipsum. Posuere fames"
317.01,525.47,561.85,534.32,"/F8",9.96,"parturient suspendisse platea et. Sodales neque fames"
317.01,513.52,561.86,522.36,"/F8",9.96,"augue litora. Viverra morbi est eros pulvinar hac platea"
317.01,501.56,561.81,510.41,"/F8",9.96,"iaculis nibh aliquet elit dictum eros. Blandit donec lacus"
317.01,489.61,561.89,498.45,"/F8",9.96,"a pede netus. Rhoncus donec sodales. Blandit ipsum"
317.01,477.65,561.85,486.50,"/F8",9.96,"urna suspendisse cum eu. Feugiat netus felis fames ali-"
317.01,465.70,561.87,474.54,"/F8",9.96,"quet cras eu congue erat cras. Potenti augue risus dui"
317.01,453.74,463.73,462.59,"/F8",9.96,"quam maecenas dapibus vivamus."
326.98,441.48,561.87,450.33,"/F8",9.96,"Laoreet netus. Euismod metus nibh mattis enim orci"
317.01,429.53,561.86,438.37,"/F8",9.96,"felis. Nonummy justo arcu. Rhoncus proin duis quis hy-"
317.01,417.57,561.90,426.42,"/F8",9.96,"menaeos sociosqu donec eu tempus. Natoque fusce ve"
317.01,405.62,561.82,414.46,"/F8",9.96,"taciti sit pretium sociosqu erat arcu nunc eros pulvinar."
317.01,393.66,561.84,402.51,"/F8",9.96,"Iaculis velit ad ut mi arcu metus purus nisl mattis. Cu-"
317.01,381.71,561.87,390.55,"/F8",9.96,"bilia proin etiam lacus scelerisque accumsan. Nonummy"
317.01,369.75,561.85,378.60,"/F8",9.96,"felis porta a litora velit. Commodo metus velit luctus"
317.01,357.80,561.92,366.64,"/F8",9.96,"mauris nulla nam erat aenean ac. Commodo porta donec"
317.01,345.84,561.85,354.69,"/F8",9.96,"a nisl donec sem vehicula cubilia dapibus potenti enim"
317.01,333.89,561.86,342.73,"/F8",9.96,"phasellus. Natoque purus neque. Blandit nulla ad. Na-"
317.01,321.93,561.84,330.78,"/F8",9.96,"toque massa nisl penatibus ultrices ipsum netus aliquam"
317.01,309.98,561.84,318.82,"/F8",9.96,"nisi senectus scelerisque per diam sit. Egestas porta sem"
317.01,298.02,561.86,306.87,"/F8",9.96,"duis pellentesque sodales inceptos nostra aenean accum-"
317.01,286.07,561.85,294.91,"/F8",9.96,"san parturient. Euismod justo class. Blandit massa nunc"
317.01,274.11,561.85,282.96,"/F8",9.96,"rhoncus. Laoreet felis. Euismod proin. Integer porta dis"
317.01,262.16,561.87,271.00,"/F8",9.96,"amet leo laoreet rutrum justo quisque lorem cras prae-"
317.01,250.20,561.83,259.05,"/F8",9.96,"sent bibendum consectetuer vestibulum dapibus urna leo"
317.01,238.25,561.92,247.09,"/F8",9.96,"sed ut metus. Commodo donec nunc. Aliquam massa"
317.01,226.29,561.85,235.14,"/F8",9.96,"nonummy posuere tempor ut faucibus ultrices ad primis"
317.01,214.34,561.85,223.18,"/F8",9.96,"habitasse convallis purus nisi nonummy venenatis prae-"
317.01,202.38,561.86,211.23,"/F8",9.96,"sent fusce phasellus urna erat justo. Viverra massa nunc"
317.01,190.42,458.41,199.27,"/F8",9.96,"ac ipsum ultricies condimentum."
326.98,178.17,561.88,187.02,"/F8",9.96,"Aliquam dolor elit donec proin convallis. Nonummy"
317.01,166.21,561.89,175.06,"/F8",9.96,"netus. Nonummy morbi id donec dis nonummy platea"
317.01,154.26,561.90,163.11,"/F8",9.96,"dolor magna dapibus sem vehicula sodales. Lacinia fe-"
317.01,142.30,561.84,151.15,"/F8",9.96,"lis. Vivamus felis at proin non urna. Quisque nulla dolor"
317.01,130.35,561.86,139.19,"/F8",9.96,"aenean ac odio ipsum in primis dis suscipit porta. Ali-"
317.01,118.39,561.85,127.24,"/F8",9.96,"quam vitae mi proin curabitur est euismod. Integer pu-"
