37.61,748.78,242.15,757.62,"/F17",9.96,"2. Feugiat velit hac proin vestibulum ut."
52.56,727.85,113.99,736.70,"/F8",9.96,"Blandit fusce."
123.02,727.85,288.46,736.70,"/F8",9.96,"Conubia fusce et convallis fames po-"
37.61,715.90,288.41,724.75,"/F8",9.96,"suere. Viverra dolor. Blandit vitae mi cursus interdum fa-"
37.61,703.94,288.40,712.79,"/F8",9.96,"cilisis a. Lacinia netus et turpis. Rhoncus lorem. Pretium"
37.61,691.99,297.22,700.84,"/F8",9.96,"massa eni parturient vestibulum ad elementum iaculis magna"
37.61,680.03,288.39,688.88,"/F8",9.96,"leo dis tincidunt pellentesque. Rhoncus lacus dolor taciti"
37.61,668.08,288.41,676.92,"/F8",9.96,"consectetuer imperdiet donec orci. Dapibus nulla cras mi"
37.61,656.12,248.40,664.97,"/F8",9.96,"vulputate metus hymenaeos eget mus aliquam."
256.94,656.12,288.44,664.97,"/F8",9.96,"Cubilia"
37.61,644.17,111.96,653.01,"/F8",9.96,"proin sem purus."
118.18,644.17,288.43,653.01,"/F8",9.96,"Posuere donec cubilia dis habitant im-"
37.61,632.21,288.40,641.06,"/F8",9.96,"perdiet id. Gravida curae fames tellus porta nulla placerat"
37.61,620.26,170.64,629.10,"/F8",9.96,"enim nostra iaculis nibh class."
176.80,620.26,288.45,629.10,"/F8",9.96,"Commodo lacus duis tor-"
37.61,608.30,288.43,617.15,"/F8",9.96,"tor placerat aliquam hendrerit dictumst. Commodo ipsum"
37.61,596.35,288.45,605.19,"/F8",9.96,"eros hac diam justo inceptos vel congue risus bibendum"
37.61,584.39,288.43,593.24,"/F8",9.96,"magna. Viverra netus diam class venenatis. Aliquet class"
37.61,572.44,288.39,581.28,"/F8",9.96,"velit ridiculus accumsan nisi posuere dolor. Quisque proin"
37.61,560.48,213.30,569.33,"/F8",9.96,"urna blandit porta sed tristique libero."
222.01,560.48,288.41,569.33,"/F8",9.96,"Rhoncus purus"
37.61,548.53,288.41,557.37,"/F8",9.96,"dui odio. Pretium nulla netus elementum ullamcorper im-"
37.61,536.57,288.45,545.42,"/F8",9.96,"perdiet nisl amet cras sem enim. Egestas dolor. Nonummy"
37.61,524.62,287.35,533.46,"/F8",9.96,"metus eros tempus ve metus montes. Viverra etiam velit."
52.56,512.66,288.44,521.51,"/F8",9.96,"Iaculis curae nec neque morbi lacus. Gravida morbi in."
37.61,500.71,288.41,509.55,"/F8",9.96,"Cubilia morbi dis placerat neque fringilla elit odio diam"
37.61,488.75,288.39,497.60,"/F8",9.96,"est. Egestas ipsum quis inceptos a sollicitudin diam viverra"
37.61,476.80,288.39,485.64,"/F8",9.96,"ac id. Blandit netus. Pretium etiam felis dictum mi libero"
37.61,464.84,123.88,473.69,"/F8",9.96,"ve eu quis dapibus."
131.26,464.84,266.27,473.69,"/F8",9.96,"Dapibus fames per gravida et."
273.65,464.84,288.45,473.69,"/F8",9.96,"Po-"
37.61,452.89,97.43,461.73,"/F8",9.96,"suere felis ut."
104.72,452.89,288.44,461.73,"/F8",9.96,"Cubilia massa urna dui mi ante pharetra"
37.61,440.93,288.44,449.78,"/F8",9.96,"ultricies enim vel magna montes. Sodales netus ad porta"
37.61,428.97,288.38,437.82,"/F8",9.96,"habitant est potenti felis elit donec. Potenti fusce per ve-"
37.61,417.02,139.97,425.87,"/F8",9.96,"hicula curabitur donec."
146.90,417.02,207.31,425.87,"/F8",9.96,"Feugiat nulla."
214.25,417.02,288.41,425.87,"/F8",9.96,"Viverra vitae leo"
37.61,405.06,288.39,413.91,"/F8",9.96,"nisl vel felis vivamus iaculis netus non feugiat tortor ad ul-"
37.61,393.11,288.41,401.96,"/F8",9.96,"trices. Cubilia neque elit dignissim. Laoreet massa laoreet"
37.61,381.15,288.44,390.00,"/F8",9.96,"eni. Egestas netus fusce dolor mus. Feugiat lacus sem eget"
37.61,369.20,158.62,378.05,"/F8",9.96,"ac maecenas egestas purus."
165.99,369.20,288.46,378.05,"/F8",9.96,"Aliquet porta odio molestie"
37.61,357.24,82.72,366.09,"/F8",9.96,"penatibus."
90.59,357.24,288.46,366.09,"/F8",9.96,"Gravida vitae arcu id diam quam accumsan"
37.61,345.29,216.73,354.13,"/F8",9.96,"parturient montes nec dapibus a ornare."
223.65,345.29,288.43,354.13,"/F8",9.96,"Quisque morbi"
37.61,333.33,247.60,342.18,"/F8",9.96,"eu mi sociis porttitor metus mi nisl hymenaeos."
253.26,333.33,288.42,342.18,"/F8",9.96,"Quisque"
37.61,321.38,196.54,330.22,"/F8",9.96,"metus in hac eget proin scelerisque."
203.46,321.38,288.45,330.22,"/F8",9.96,"Sodales augue arcu"
37.61,309.42,96.34,318.27,"/F8",9.96,"platea massa."
52.56,297.47,288.45,306.31,"/F8",9.96,"Feugiat proin massa ligula arcu nibh lacus suspendisse"
37.61,285.51,151.88,294.36,"/F8",9.96,"nam odio porttitor ligula."
158.83,285.51,288.46,294.36,"/F8",9.96,"Commodo fusce sit amet sol-"
37.61,273.56,288.35,282.40,"/F8",9.96,"licitudin pulvinar vitae natoque cubilia tincidunt faucibus"
37.61,261.60,172.15,270.45,"/F8",9.96,"tortor adipiscing consectetuer."
180.72,261.60,288.42,270.45,"/F8",9.96,"Sodales lacus viverra ve"
37.61,249.65,291.64,258.49,"/F8",9.96,"lorem convallis cubilia. Commodo netus eros morbi dapibus"
37.61,237.69,79.73,246.54,"/F8",9.96,"phasellus."
88.82,237.69,288.41,246.54,"/F8",9.96,"Vivamus nulla duis dignissim tincidunt arcu"
37.61,225.74,288.44,234.58,"/F8",9.96,"rhoncus. Rhoncus lorem pede. Vivamus netus elit porta."
37.61,213.78,288.37,222.63,"/F8",9.96,"Aliquam lacus quisque integer sollicitudin porttitor vitae"
37.61,201.83,243.86,210.67,"/F8",9.96,"bibendum phasellus erat nisi hendrerit platea."
251.64,201.83,288.41,210.67,"/F8",9.96,"Natoque"
37.61,189.87,288.45,198.72,"/F8",9.96,"morbi. Viverra massa. Pretium proin amet urna aliquam"
37.61,177.92,288.41,186.76,"/F8",9.96,"odio id sit pede litora lacinia ridiculus eros. Lacinia donec"
37.61,165.96,90.16,174.81,"/F8",9.96,"porta dolor."
96.94,165.96,245.40,174.81,"/F8",9.96,"Quisque justo dui nisi parturient."
252.19,165.96,288.41,174.81,"/F8",9.96,"Conubia"
37.61,154.01,180.40,162.85,"/F8",9.96,"fames in risus mi dolor at odio."
188.09,154.01,288.46,162.85,"/F8",9.96,"Natoque fusce eget vi-"
37.61,142.05,198.71,150.90,"/F8",9.96,"vamus at ante quam blandit quam."
208.01,142.05,288.48,150.90,"/F8",9.96,"Aliquam fames at"
37.61,130.10,288.39,138.94,"/F8",9.96,"arcu neque lobortis non nisi sollicitudin feugiat nascetur."
37.61,118.14,214.36,126.99,"/F8",9.96,"Lacinia netus eni quam ad eros cursus."
222.48,118.14,288.48,126.99,"/F8",9.96,"Natoque fames"
37.61,106.19,288.41,115.03,"/F8",9.96,"metus sociosqu. Euismod donec. Aliquet neque ut aptent."
37.61,94.23,292.24,103.08,"/F8",9.96,"Rhoncus justo nonummy egestas quam eros parturient port-"
37.61,82.27,288.40,91.12,"/F8",9.96,"titor fusce. Laoreet purus netus vitae purus urna sagittis."
306.60,748.78,473.54,757.62,"/F27",9.96,"2.1. Vivamus velit per neque hac erat."
321.55,733.83,559.26,742.68,"/F8",9.96,"Aliquam fusce at porttitor ac imperdiet a ultricies lorem"
306.60,721.88,362.04,730.72,"/F8",9.96,"nisi dapibus."
368.26,721.88,491.21,730.72,"/F8",9.96,"Euismod felis nunc suscipit."
497.44,721.88,557.39,730.72,"/F8",9.96,"Rhoncus velit"
306.60,709.92,348.53,718.77,"/F8",9.96,"est litora."
354.12,709.92,557.39,718.77,"/F8",9.96,"Pretium ipsum massa nisl metus libero sollici-"
306.60,697.97,557.41,706.81,"/F8",9.96,"tudin habitasse lorem. Potenti metus elit maecenas a. Vi-"
306.60,686.01,557.44,694.86,"/F8",9.96,"vamus ipsum. Natoque proin. Nonummy ipsum. Quisque"
306.60,674.06,557.42,682.90,"/F8",9.96,"proin diam mollis fermentum magna suscipit vestibulum"
306.60,662.10,460.48,670.95,"/F8",9.96,"tellus maecenas erat nec vivamus."
470.06,662.10,531.55,670.95,"/F8",9.96,"Natoque felis."
541.12,662.10,557.44,670.95,"/F8",9.96,"Iac-"
306.60,650.15,557.37,658.99,"/F8",9.96,"ulis lacus vel duis sapien imperdiet ultrices turpis ornare"
306.60,638.19,557.39,647.04,"/F8",9.96,"curabitur porttitor eget consectetuer cursus. Rhoncus vi-"
306.60,626.23,557.38,635.08,"/F8",9.96,"tae ad curabitur nibh est porta potenti per tincidunt dis"
306.60,614.28,344.80,623.13,"/F8",9.96,"molestie."
351.33,614.28,557.41,623.13,"/F8",9.96,"Natoque fusce ante ipsum iaculis lectus ut dui"
306.60,602.32,349.77,611.17,"/F8",9.96,"curabitur."
359.57,602.32,557.44,611.17,"/F8",9.96,"Laoreet augue erat nostra integer est eu a."
306.60,590.37,371.99,599.22,"/F8",9.96,"Dapibus proin."
378.68,590.37,451.39,599.22,"/F8",9.96,"Commodo justo."
458.09,590.37,557.43,599.22,"/F8",9.96,"Vivamus velit at nibh."
306.60,578.41,557.45,587.26,"/F8",9.96,"Conubia lacus eu platea. Nonummy proin. Euismod lacus"
306.60,566.46,365.28,575.31,"/F8",9.96,"purus facilisi."
372.08,566.46,557.39,575.31,"/F8",9.96,"Dapibus curae nec ligula porta parturient"
306.60,554.50,427.17,563.35,"/F8",9.96,"blandit ante ipsum magnis."
433.46,554.50,557.41,563.35,"/F8",9.96,"Potenti etiam nunc molestie"
306.60,542.55,451.80,551.39,"/F8",9.96,"mauris euismod quis dui eros dis."
321.55,530.59,557.43,539.44,"/F8",9.96,"Viverra donec potenti urna nisi. Integer lacus nunc la-"
306.60,518.64,557.47,527.48,"/F8",9.96,"cus. Rhoncus magna et augue malesuada tempor torquent"
306.60,506.68,557.43,515.53,"/F8",9.96,"phasellus. Natoque ipsum. Sodales etiam. Rhoncus etiam"
306.60,494.73,512.44,503.57,"/F8",9.96,"ve tellus aliquet iaculis consectetuer tristique."
521.15,494.73,557.37,503.57,"/F8",9.96,"Conubia"
306.60,482.77,557.44,491.62,"/F8",9.96,"dolor. Blandit proin augue purus. Commodo proin curae."
306.60,470.82,425.84,479.66,"/F8",9.96,"Feugiat curae eget laoreet."
434.29,470.82,557.44,479.66,"/F8",9.96,"Laoreet proin etiam laoreet"
306.60,458.86,557.43,467.71,"/F8",9.96,"morbi commodo luctus dui tortor vivamus quis. Euismod"
306.60,446.91,380.91,455.75,"/F8",9.96,"etiam et tempor."
386.84,446.91,557.48,455.75,"/F8",9.96,"Commodo magna class lacinia rhoncus"
306.60,434.95,557.37,443.80,"/F8",9.96,"viverra augue mi venenatis porttitor elit facilisis leo etiam"
306.60,423.00,462.74,431.84,"/F8",9.96,"libero at dignissim morbi nec enim."
468.36,423.00,557.44,431.84,"/F8",9.96,"Aliquam fames urna"
306.60,411.04,557.37,419.89,"/F8",9.96,"laoreet id aptent inceptos neque sollicitudin vitae eros cur-"
306.60,399.09,335.92,407.93,"/F8",9.96,"abitur."
344.93,399.09,557.42,407.93,"/F8",9.96,"Lacinia netus erat duis eros tellus montes mus"
306.60,387.13,557.45,395.98,"/F8",9.96,"erat. Lacinia fusce ac ve sapien eu accumsan nullam tac-"
306.60,375.18,557.35,384.02,"/F8",9.96,"iti venenatis lobortis auctor parturient felis nisi potenti."
306.60,363.22,557.44,372.07,"/F8",9.96,"Integer porta ipsum a gravida rutrum cum nisi nibh com-"
306.60,351.27,355.41,360.11,"/F8",9.96,"modo cum."
361.05,351.27,557.42,360.11,"/F8",9.96,"Integer proin dis erat cubilia quis a nulla at."
306.60,339.31,557.39,348.16,"/F8",9.96,"Quisque lacus augue luctus tincidunt cum neque. Cubilia"
306.60,327.36,537.03,336.20,"/F8",9.96,"purus orci commodo. Quisque ipsum. Feugiat lorem."
306.60,303.45,414.35,312.29,"/F27",9.96,"2.2. Pretium morbi non."
321.55,288.50,557.43,297.35,"/F8",9.96,"Rhoncus donec ad felis et taciti pretium et mi montes"
306.60,276.55,557.42,285.39,"/F8",9.96,"ad. Gravida morbi dis inceptos potenti nisl maecenas eu-"
306.60,264.59,557.42,273.44,"/F8",9.96,"ismod nisi. Gravida curae. Quisque lorem sed arcu ornare"
306.60,252.64,557.41,261.48,"/F8",9.96,"et. Nonummy felis mi tempor facilisis sed cum eu vehicula"
306.60,240.68,326.59,249.53,"/F8",9.96,"eros."
333.81,240.68,461.05,249.53,"/F8",9.96,"Feugiat risus conubia luctus."
468.28,240.68,557.42,249.53,"/F8",9.96,"Potenti fames etiam"
306.60,228.73,557.40,237.57,"/F8",9.96,"ante volutpat lacus vulputate. Quisque dolor lacinia nos-"
306.60,216.77,557.45,225.62,"/F8",9.96,"tra quis ut arcu rutrum. Natoque lorem. Conubia massa"
306.60,204.82,527.22,213.66,"/F8",9.96,"porta fames curae commodo gravida magnis felis."
534.25,204.82,557.48,213.66,"/F8",9.96,"Viva-"
306.60,192.86,460.23,201.71,"/F8",9.96,"mus augue dolor risus mattis quis."
467.05,192.86,557.47,201.71,"/F8",9.96,"Rhoncus massa nam"
306.60,180.90,358.42,189.75,"/F8",9.96,"arcu augue."
367.25,180.90,483.11,189.75,"/F8",9.96,"Natoque proin dui morbi."
491.93,180.90,557.45,189.75,"/F8",9.96,"Dapibus donec"
306.60,168.95,557.43,177.80,"/F8",9.96,"porta turpis condimentum lorem. Gravida morbi sem au-"
306.60,156.99,442.45,165.84,"/F8",9.96,"gue odio dui luctus nonummy."
450.22,156.99,514.50,165.84,"/F8",9.96,"Gravida dolor."
522.27,156.99,557.43,165.84,"/F8",9.96,"Quisque"
306.60,145.04,557.45,153.89,"/F8",9.96,"magna erat rhoncus et. Conubia risus ve eu morbi nasce-"
306.60,133.08,322.65,141.93,"/F8",9.96,"tur."
330.68,133.08,393.85,141.93,"/F8",9.96,"Dapibus risus."
401.88,133.08,557.42,141.93,"/F8",9.96,"Euismod porta vitae odio senectus"
306.60,121.13,469.74,129.97,"/F8",9.96,"ad dictum ac id lacus massa sodales."
475.82,121.13,557.46,129.97,"/F8",9.96,"Conubia purus ad."
306.60,109.17,412.89,118.02,"/F8",9.96,"Posuere massa nam nisi."
321.55,97.22,557.45,106.06,"/F8",9.96,"Euismod donec per vestibulum hymenaeos ullamcor-"
306.60,85.26,323.49,94.11,"/F8",9.96,"per."
332.56,85.26,557.40,94.11,"/F8",9.96,"Lacinia felis at consectetuer pellentesque dapibus."
295.15,61.35,300.13,70.20,"/F8",9.96,"3"
