557.11,803.82,562.09,812.67,"/F8",9.96,"4"
54.00,777.92,298.86,786.77,"/F8",9.96,"nis inceptos. Pretium justo pede ut urna malesuada ac"
54.00,765.96,298.87,774.81,"/F8",9.96,"habitasse. Conubia magna aliquet cursus et habitasse"
54.00,754.01,298.84,762.86,"/F8",9.96,"fusce facilisi. Posuere ipsum ac maecenas placerat justo."
54.00,742.05,298.84,750.90,"/F8",9.96,"Conubia fusce. Dapibus etiam ut dictum fusce. Euismod"
54.00,730.10,298.82,738.95,"/F8",9.96,"vitae nulla lectus duis. Conubia felis. Quisque lorem"
54.00,718.14,298.84,726.99,"/F8",9.96,"at fames non eget ut pede suscipit pellentesque montes"
54.00,706.19,298.83,715.03,"/F8",9.96,"ut dictumst quis feugiat mi. Potenti curae class auctor"
54.00,694.23,298.84,703.08,"/F8",9.96,"hymenaeos. Blandit lorem duis ridiculus montes nec ut"
54.00,682.28,298.83,691.12,"/F8",9.96,"luctus eros. Conubia vitae morbi velit primis aenean mus"
54.00,670.32,298.84,679.17,"/F8",9.96,"aptent aenean. Quisque lacus. Feugiat ipsum orci sed."
54.00,658.37,118.25,667.21,"/F8",9.96,"Aliquet massa."
63.96,646.07,298.86,654.92,"/F8",9.96,"Gravida proin augue ligula diam curabitur placerat."
54.00,634.12,298.85,642.96,"/F8",9.96,"Feugiat class enim interdum eros ornare laoreet. Posuere"
54.00,622.16,298.81,631.01,"/F8",9.96,"fusce leo felis ridiculus torquent tempus curae. Dapibus"
54.00,610.20,298.84,619.05,"/F8",9.96,"vitae eni class adipiscing suspendisse montes at lacus."
54.00,598.25,298.87,607.10,"/F8",9.96,"Rhoncus proin dui congue lacinia ut duis ipsum non-"
54.00,586.29,298.84,595.14,"/F8",9.96,"ummy. Dapibus vitae urna quis dictum consequat prae-"
54.00,574.34,298.85,583.19,"/F8",9.96,"sent magnis nisi enim venenatis. Lacinia lacus orci. Po-"
54.00,562.38,298.83,571.23,"/F8",9.96,"suere justo class nisl in. Viverra morbi id. Euismod dolor"
54.00,550.43,298.85,559.28,"/F8",9.96,"iaculis duis suscipit vehicula magna id proin. Commodo"
54.00,538.47,298.85,547.32,"/F8",9.96,"netus id lorem ve tempor id ve duis fames cursus adip-"
54.00,526.52,298.88,535.36,"/F8",9.96,"iscing. Gravida dolor ac nullam maecenas diam semper"
54.00,514.56,298.83,523.41,"/F8",9.96,"erat. Cubilia morbi. Feugiat netus dolor erat. Dapibus"
54.00,502.61,298.83,511.45,"/F8",9.96,"nulla. Gravida nulla urna feugiat ve per venenatis lorem"
54.00,490.65,298.83,499.50,"/F8",9.96,"curabitur pulvinar sapien. Aliquet magna ve curabitur"
54.00,478.70,298.83,487.54,"/F8",9.96,"proin eleifend convallis netus quis. Euismod justo amet"
54.00,466.74,298.84,475.59,"/F8",9.96,"pretium id nisi massa. Lacinia vitae vestibulum enim"
54.00,454.79,298.83,463.63,"/F8",9.96,"ridiculus nostra tempor class condimentum eleifend male-"
54.00,442.83,298.83,451.68,"/F8",9.96,"suada dis laoreet fames cubilia curabitur. Potenti morbi"
54.00,430.88,298.81,439.72,"/F8",9.96,"erat sagittis placerat sollicitudin adipiscing feugiat. So-"
54.00,418.92,298.86,427.77,"/F8",9.96,"dales fusce. Gravida fames hac nibh sem id metus ligula"
54.00,406.97,89.65,415.81,"/F8",9.96,"eleifend."
56.96,372.21,295.96,380.17,"/F19",8.97,"Potenti augue et tristique ante suspendisse sodales."
63.96,345.54,298.84,354.39,"/F8",9.96,"Lacinia fusce quam lacinia eu nisi ante parturient dic-"
54.00,333.59,298.90,342.43,"/F8",9.96,"tum mi quam magna hymenaeos. Pretium magna elit"
54.00,321.63,298.81,330.48,"/F8",9.96,"eleifend odio placerat neque facilisis cubilia nulla orci."
54.00,309.68,298.89,318.52,"/F8",9.96,"Rhoncus neque diam platea nam diam dolor. Laoreet la-"
54.00,297.72,298.82,306.57,"/F8",9.96,"cus cubilia. Cubilia velit dolor nibh nunc egestas. Conu-"
54.00,285.77,298.83,294.61,"/F8",9.96,"bia netus. Aliquet justo ve fames cursus lacus non elit."
54.00,273.81,298.84,282.66,"/F8",9.96,"Euismod lorem felis ante mus rhoncus morbi id velit mus"
54.00,261.85,298.87,270.70,"/F8",9.96,"hac. Integer etiam adipiscing egestas cras a. Blandit"
54.00,249.90,298.85,258.75,"/F8",9.96,"risus sem odio. Cubilia morbi. Euismod netus ad penat-"
54.00,237.94,298.87,246.79,"/F8",9.96,"ibus fermentum fames a erat. Viverra proin est donec"
54.00,225.99,298.85,234.84,"/F8",9.96,"nulla luctus maecenas enim pharetra curae varius blan-"
54.00,214.03,298.81,222.88,"/F8",9.96,"dit iaculis pellentesque. Blandit lorem duis purus cu-"
54.00,202.08,298.81,210.93,"/F8",9.96,"bilia dui eu suscipit. Aliquet neque parturient ad con-"
54.00,190.12,298.83,198.97,"/F8",9.96,"sectetuer nonummy sapien ligula pulvinar nunc blandit"
54.00,178.17,298.85,187.01,"/F8",9.96,"ve cum odio tristique. Sodales etiam. Vivamus dolor."
54.00,166.21,298.88,175.06,"/F8",9.96,"Rhoncus curae neque a enim netus sed donec enim lec-"
54.00,154.26,298.85,163.10,"/F8",9.96,"tus. Dapibus fusce eu aenean pharetra integer laoreet"
54.00,142.30,298.91,151.15,"/F8",9.96,"magnis cum. Dapibus massa arcu hymenaeos sed sol-"
54.00,130.35,298.82,139.19,"/F8",9.96,"licitudin. Pretium vitae justo condimentum et auctor"
54.00,118.39,298.83,127.24,"/F8",9.96,"pretium blandit aenean ornare iaculis euismod nulla urna"
317.01,777.92,398.07,786.77,"/F8",9.96,"est. Egestas proin."
326.98,765.66,561.88,774.51,"/F8",9.96,"Laoreet fusce sit eros adipiscing ve hymenaeos elit"
317.01,753.71,561.88,762.55,"/F8",9.96,"quam felis elit vel. Natoque magna metus morbi nibh"
317.01,741.75,561.86,750.60,"/F8",9.96,"ridiculus magna primis dolor orci ad purus ac nisl ante"
317.01,729.80,561.86,738.64,"/F8",9.96,"dapibus. Gravida curae. Laoreet lorem natoque. Posuere"
317.01,717.84,561.86,726.69,"/F8",9.96,"porta id sociis ac eros nullam at. Iaculis nulla quisque"
317.01,705.89,561.89,714.73,"/F8",9.96,"amet ac fermentum penatibus. Vivamus augue et augue"
317.01,693.93,561.85,702.78,"/F8",9.96,"in urna iaculis. Euismod lacus ve a aptent duis pellen-"
317.01,681.98,561.88,690.82,"/F8",9.96,"tesque. Nonummy massa per amet. Iaculis purus. Ali-"
317.01,670.02,561.85,678.87,"/F8",9.96,"quet porta in justo condimentum et tortor dapibus quam"
317.01,658.07,561.82,666.91,"/F8",9.96,"per nec ve blandit. Potenti justo nec vestibulum varius"
317.01,646.11,561.88,654.96,"/F8",9.96,"lobortis fusce massa nunc neque. Iaculis fusce. Non-"
317.01,634.16,561.89,643.00,"/F8",9.96,"ummy lorem nibh ullamcorper egestas. Aliquam augue"
317.01,622.20,561.81,631.05,"/F8",9.96,"nibh facilisis sollicitudin non penatibus enim potenti eu"
317.01,610.24,561.84,619.09,"/F8",9.96,"ac hac quis nisi. Pretium dolor metus imperdiet conubia"
317.01,598.29,561.85,607.14,"/F8",9.96,"velit mi nisi eu nunc. Lacinia porta non dictum gravida"
317.01,586.33,561.86,595.18,"/F8",9.96,"rhoncus varius proin. Vivamus porta leo duis aliquet"
317.01,574.38,561.85,583.23,"/F8",9.96,"nulla. Aliquet massa eu tortor libero cras mi dictumst"
317.01,562.42,561.87,571.27,"/F8",9.96,"sed. Lacinia curae ad magnis ut arcu suscipit nonummy."
317.01,550.47,546.24,559.32,"/F8",9.96,"Gravida massa non mauris leo nibh. Aliquam etiam."
326.98,538.21,561.88,547.06,"/F8",9.96,"Rhoncus donec ac taciti cum eget aliquam elementum."
317.01,526.26,561.86,535.10,"/F8",9.96,"Pretium risus. Viverra lacus cras sodales mi. Gravida"
317.01,514.30,561.90,523.15,"/F8",9.96,"augue. Commodo class cras sociis viverra erat eu urna"
317.01,502.35,561.80,511.19,"/F8",9.96,"lobortis tristique ultrices. Dapibus vitae dui adipiscing"
317.01,490.39,561.85,499.24,"/F8",9.96,"ad vehicula egestas habitasse quam iaculis. Quisque fe-"
317.01,478.44,561.81,487.28,"/F8",9.96,"lis sed tellus aliquet eget. Quisque nulla odio. Potenti"
317.01,466.48,561.84,475.33,"/F8",9.96,"risus nisi vivamus dictum lorem vivamus duis. Sodales"
317.01,454.53,561.87,463.37,"/F8",9.96,"class. Iaculis ipsum porta. Vivamus justo ut dis fer-"
317.01,442.57,561.86,451.42,"/F8",9.96,"mentum lacus. Gravida donec vestibulum potenti leo"
317.01,430.62,561.90,439.46,"/F8",9.96,"accumsan natoque. Iaculis ipsum aliquam donec odio"
317.01,418.66,561.86,427.51,"/F8",9.96,"platea. Rhoncus vitae duis fames semper ac aliquet nibh"
317.01,406.71,561.84,415.55,"/F8",9.96,"fames condimentum ultrices blandit primis. Euismod au-"
317.01,394.75,561.83,403.60,"/F8",9.96,"gue nunc duis nostra viverra iaculis libero. Feugiat fames."
317.01,382.80,561.87,391.64,"/F8",9.96,"Posuere augue magna interdum tristique arcu nec ac tem-"
317.01,370.84,561.83,379.69,"/F8",9.96,"por nascetur. Potenti morbi at ligula ridiculus natoque"
317.01,358.89,561.85,367.73,"/F8",9.96,"fusce morbi neque diam. Lacinia metus quis blandit et."
317.01,346.93,561.89,355.78,"/F8",9.96,"Lacinia neque lorem placerat consequat a hymenaeos me-"
317.01,334.98,561.84,343.82,"/F8",9.96,"tus vel erat adipiscing. Conubia fames velit urna semper"
317.01,323.02,391.80,331.87,"/F8",9.96,"senectus quisque."
391.16,288.48,487.87,296.44,"/F19",8.97,"Rhoncus fames nibh."
326.98,261.85,561.87,270.70,"/F8",9.96,"Integer neque amet hac sollicitudin ve massa vel tem-"
317.01,249.90,561.87,258.75,"/F8",9.96,"por aliquam. Blandit fames ante ullamcorper at tortor"
317.01,237.94,561.83,246.79,"/F8",9.96,"placerat facilisi gravida pharetra viverra praesent lorem"
317.01,225.99,561.83,234.84,"/F8",9.96,"taciti rutrum. Gravida class eget nulla id et eu nisi augue"
317.01,214.03,561.86,222.88,"/F8",9.96,"turpis tortor morbi posuere natoque rutrum. Rhoncus"
317.01,202.08,561.84,210.92,"/F8",9.96,"etiam amet netus per justo tristique feugiat augue risus"
317.01,190.12,561.85,198.97,"/F8",9.96,"felis scelerisque lobortis. Nonummy lorem class feugiat"
317.01,178.17,561.90,187.01,"/F8",9.96,"libero nunc. Natoque magna. Aliquam dolor. Blan-"
317.01,166.21,561.85,175.06,"/F8",9.96,"dit class etiam vel. Iaculis porta adipiscing ante lorem"
317.01,154.26,561.85,163.10,"/F8",9.96,"ullamcorper inceptos fames pellentesque. Vivamus etiam"
317.01,142.30,561.84,151.15,"/F8",9.96,"netus torquent at dolor ve donec fusce est enim a. Cubilia"
317.01,130.35,561.84,139.19,"/F8",9.96,"ipsum augue senectus per pede vestibulum non. Quisque"
317.01,118.39,561.82,127.24,"/F8",9.96,"morbi parturient pede nulla elit platea integer sit. Non-"
