37.61,748.78,120.18,757.62,"/F17",9.96,"3. Potenti nulla."
52.56,727.85,288.42,736.70,"/F8",9.96,"Gravida etiam leo sodales eleifend porta velit pretium"
37.61,715.90,288.42,724.75,"/F8",9.96,"laoreet nostra leo elit a. Integer netus nulla odio iaculis"
37.61,703.94,288.45,712.79,"/F8",9.96,"ut. Iaculis magna erat rhoncus nisi ac lectus proin eges-"
37.61,691.99,288.44,700.84,"/F8",9.96,"tas iaculis diam mi convallis nunc. Gravida fusce quam"
37.61,680.03,288.41,688.88,"/F8",9.96,"tempus ve felis. Aliquet dolor etiam litora vulputate ad"
37.61,668.08,288.44,676.92,"/F8",9.96,"fames magna elit. Potenti ipsum orci sodales id integer"
37.61,656.12,288.46,664.97,"/F8",9.96,"pede orci. Viverra fames. Aliquam massa urna ad velit"
37.61,644.17,288.44,653.01,"/F8",9.96,"in nisi pulvinar hymenaeos. Laoreet nulla donec tempor"
37.61,632.21,288.43,641.06,"/F8",9.96,"ipsum et aenean suscipit blandit cras sagittis massa per"
37.61,620.26,288.45,629.10,"/F8",9.96,"justo. Euismod purus nunc massa venenatis condimen-"
37.61,608.30,288.43,617.15,"/F8",9.96,"tum dui mi. Blandit morbi. Iaculis class eros inceptos"
37.61,596.35,288.45,605.19,"/F8",9.96,"per rhoncus fames. Vivamus purus at duis et sem ullam-"
37.61,584.39,288.42,593.24,"/F8",9.96,"corper potenti porta et lacus et. Potenti purus ad nul-"
37.61,572.44,288.42,581.28,"/F8",9.96,"lam conubia. Lacinia proin eu vulputate at phasellus felis"
37.61,560.48,288.41,569.33,"/F8",9.96,"urna eget. Pretium risus elit a ante ad sollicitudin odio"
37.61,548.53,288.40,557.37,"/F8",9.96,"aliquam ornare taciti velit. Gravida ipsum class libero in-"
37.61,536.57,288.42,545.42,"/F8",9.96,"ceptos hendrerit. Gravida etiam. Integer fusce. Iaculis"
37.61,524.62,288.44,533.46,"/F8",9.96,"ipsum erat. Euismod netus nam odio eu nulla torquent"
37.61,512.66,254.83,521.51,"/F8",9.96,"fermentum. Aliquam dolor id duis faucibus proin."
52.56,500.71,288.46,509.55,"/F8",9.96,"Euismod neque nunc ac sit elementum quis arcu. Ia-"
37.61,488.75,288.41,497.60,"/F8",9.96,"culis etiam non montes dictum justo ultricies dignissim"
37.61,476.80,288.45,485.64,"/F8",9.96,"urna mus natoque fusce sit amet hac. Blandit justo ne-"
37.61,464.84,288.38,473.69,"/F8",9.96,"tus penatibus metus fusce rutrum eget elit potenti nisl id."
37.61,452.89,288.43,461.73,"/F8",9.96,"Conubia metus orci pretium eu sit. Euismod vitae. Ali-"
37.61,440.93,288.42,449.78,"/F8",9.96,"quam metus mi ut id ante neque imperdiet justo mi purus"
37.61,428.97,288.44,437.82,"/F8",9.96,"et lorem. Vivamus lacus vel pede orci faucibus lorem dis"
37.61,417.02,288.44,425.87,"/F8",9.96,"odio dictumst. Commodo fusce mi sagittis vehicula metus"
37.61,405.06,288.46,413.91,"/F8",9.96,"at. Vivamus augue donec non eleifend gravida. Integer"
37.61,393.11,288.42,401.96,"/F8",9.96,"morbi. Gravida metus neque nostra nunc pellentesque."
37.61,381.15,288.46,390.00,"/F8",9.96,"Potenti lacus. Potenti etiam risus nam sem. Commodo"
37.61,369.20,288.45,378.05,"/F8",9.96,"vitae porta egestas fames adipiscing mi pulvinar. Com-"
37.61,357.24,288.42,366.09,"/F8",9.96,"modo netus lorem nullam quisque est adipiscing parturi-"
37.61,345.29,288.44,354.13,"/F8",9.96,"ent ad habitasse a. Sodales nulla eni. Natoque donec nisi"
37.61,333.33,288.42,342.18,"/F8",9.96,"sit viverra metus sem mauris dictumst nunc nullam id."
37.61,321.38,288.44,330.22,"/F8",9.96,"Blandit morbi leo fusce. Nonummy purus. Iaculis neque"
37.61,309.42,288.43,318.27,"/F8",9.96,"gravida egestas consectetuer convallis. Iaculis purus arcu"
37.61,297.47,214.40,306.31,"/F8",9.96,"maecenas purus viverra. Dapibus augue."
52.56,285.51,288.50,294.36,"/F8",9.96,"Commodo justo proin gravida ante arcu ac nibh in"
37.61,273.56,288.40,282.40,"/F8",9.96,"nulla leo. Aliquet porta iaculis nisi nibh augue ligula dic-"
37.61,261.60,288.43,270.45,"/F8",9.96,"tum. Quisque felis. Gravida velit eros maecenas. Eu-"
37.61,249.65,288.46,258.49,"/F8",9.96,"ismod fames eni magnis euismod. Cubilia vitae posuere"
37.61,237.69,288.45,246.54,"/F8",9.96,"magnis sem dictum. Vivamus nulla et odio dictum habi-"
37.61,225.74,288.41,234.58,"/F8",9.96,"tant pede imperdiet. Blandit metus etiam tellus mi. Na-"
37.61,213.78,288.42,222.63,"/F8",9.96,"toque proin orci condimentum per eros sollicitudin. Po-"
37.61,201.83,288.43,210.67,"/F8",9.96,"tenti morbi nulla dis eget. Laoreet curae adipiscing eges-"
37.61,189.87,288.41,198.72,"/F8",9.96,"tas erat orci primis tellus ac luctus. Aliquam lorem nibh"
37.61,177.92,288.46,186.76,"/F8",9.96,"ullamcorper. Laoreet curae eu a nostra curae. Posuere me-"
37.61,165.96,288.41,174.81,"/F8",9.96,"tus ve penatibus ve facilisis. Posuere morbi sodales felis"
37.61,154.01,288.41,162.85,"/F8",9.96,"id varius a aliquet litora. Natoque porta risus mattis cras."
37.61,142.05,288.48,150.90,"/F8",9.96,"Aliquam fames quam luctus hymenaeos massa a blandit"
37.61,130.10,288.45,138.94,"/F8",9.96,"id. Viverra etiam ut odio. Dapibus magna morbi ipsum"
37.61,118.14,288.46,126.99,"/F8",9.96,"purus. Laoreet velit fames. Nonummy morbi orci class"
37.61,106.19,288.47,115.03,"/F8",9.96,"ac nullam odio congue porttitor sed maecenas. Viverra"
37.61,94.23,275.09,103.08,"/F8",9.96,"magna pede dapibus id at enim mus enim nibh massa."
306.60,748.78,553.45,757.62,"/F27",9.96,"3.1. Cubilia justo rhoncus facilisi sollicitudin nonummy."
321.55,733.83,557.48,742.68,"/F8",9.96,"Dapibus class arcu tempor accumsan eget accumsan."
306.60,721.88,557.46,730.72,"/F8",9.96,"Commodo metus. Egestas donec orci praesent id tempor"
306.60,709.92,557.44,718.77,"/F8",9.96,"facilisis potenti dui magnis aliquam ad donec non. Non-"
306.60,697.97,557.41,706.81,"/F8",9.96,"ummy nulla eros sit feugiat etiam nibh et consectetuer."
306.60,686.01,557.44,694.86,"/F8",9.96,"Viverra augue. Sodales felis ac platea. Conubia porta par-"
306.60,674.06,557.37,682.90,"/F8",9.96,"turient odio imperdiet mi scelerisque at libero consectetuer"
306.60,662.10,557.45,670.95,"/F8",9.96,"nam purus. Lacinia velit eni odio est maecenas gravida"
306.60,650.15,557.42,658.99,"/F8",9.96,"phasellus arcu egestas felis nisi arcu. Integer lacus cras"
306.60,638.19,557.45,647.04,"/F8",9.96,"senectus augue iaculis. Commodo netus. Natoque fusce."
306.60,626.23,557.42,635.08,"/F8",9.96,"Dapibus ipsum. Blandit lorem in vulputate. Nonummy"
306.60,614.28,557.42,623.13,"/F8",9.96,"massa velit senectus orci cubilia cras ante. Iaculis class"
306.60,602.32,557.45,611.17,"/F8",9.96,"eu sem. Aliquet curae eros cras. Iaculis donec cum cras"
306.60,590.37,557.38,599.22,"/F8",9.96,"torquent id. Integer velit ut. Egestas proin orci hac velit"
306.60,578.41,557.40,587.26,"/F8",9.96,"parturient conubia nisl ultrices cum ve fusce diam sagit-"
306.60,566.46,557.39,575.31,"/F8",9.96,"tis neque. Feugiat fames orci pretium phasellus. Pretium"
306.60,554.50,464.60,563.35,"/F8",9.96,"metus etiam congue. Quisque proin."
321.55,542.55,557.43,551.39,"/F8",9.96,"Viverra curae nisi rhoncus. Viverra donec mi. Posuere"
306.60,530.59,557.41,539.44,"/F8",9.96,"metus. Potenti lorem in. Aliquet vitae justo enim mus"
306.60,518.64,557.47,527.48,"/F8",9.96,"quam est. Commodo augue egestas. Cubilia neque. So-"
306.60,506.68,557.41,515.53,"/F8",9.96,"dales neque. Egestas risus eni erat enim sem pellentesque"
306.60,494.73,557.42,503.57,"/F8",9.96,"sociis ve ornare lacinia quisque. Aliquam augue et. Feu-"
306.60,482.77,557.39,491.62,"/F8",9.96,"giat netus. Pretium vitae in fermentum a vulputate risus"
306.60,470.82,557.40,479.66,"/F8",9.96,"imperdiet nascetur. Viverra metus lacus blandit gravida"
306.60,458.86,557.45,467.71,"/F8",9.96,"pede a diam class. Conubia proin natoque mauris nisl"
306.60,446.91,557.42,455.75,"/F8",9.96,"feugiat neque at. Iaculis metus. Lacinia class. Aliquet"
306.60,434.95,557.42,443.80,"/F8",9.96,"curae ipsum amet fringilla nisi. Euismod metus. Rhoncus"
306.60,423.00,557.40,431.84,"/F8",9.96,"fames lacus per facilisis dictum lacus parturient. Lacinia"
306.60,411.04,557.42,419.89,"/F8",9.96,"ipsum. Cubilia ipsum id at. Rhoncus felis eu molestie"
306.60,399.09,557.39,407.93,"/F8",9.96,"lacinia laoreet tellus justo parturient suspendisse nostra"
306.60,387.13,318.76,395.98,"/F8",9.96,"ut."
306.60,363.22,558.61,372.07,"/F27",9.96,"3.2. Sodales proin adipiscing eleifend natoque euismod nul-"
327.99,351.27,373.53,360.11,"/F27",9.96,"lam quam."
321.55,336.32,557.45,345.17,"/F8",9.96,"Commodo massa risus vivamus at facilisis vestibulum"
306.60,324.37,557.43,333.21,"/F8",9.96,"duis dignissim maecenas mi. Aliquam fames dis habitant"
306.60,312.41,557.46,321.26,"/F8",9.96,"curae. Natoque dolor nam. Conubia dolor nisl. Sodales"
306.60,300.46,557.44,309.30,"/F8",9.96,"porta donec est arcu. Conubia porta. Iaculis porta nisl"
306.60,288.50,557.45,297.35,"/F8",9.96,"ad urna duis posuere congue cum amet ve. Natoque felis"
306.60,276.55,557.42,285.39,"/F8",9.96,"eros nulla. Rhoncus justo et porta at mus scelerisque. Vi-"
306.60,264.59,557.43,273.44,"/F8",9.96,"vamus augue lorem massa habitant vestibulum. Pretium"
306.60,252.64,557.41,261.48,"/F8",9.96,"morbi vestibulum suspendisse tempor ve sociosqu rhoncus"
306.60,240.68,557.44,249.53,"/F8",9.96,"mattis at arcu. Sodales ipsum integer sodales. Rhoncus"
306.60,228.73,557.41,237.57,"/F8",9.96,"ipsum est. Iaculis nulla adipiscing condimentum tempus"
306.60,216.77,557.43,225.62,"/F8",9.96,"et quis hymenaeos litora magna parturient sodales est at"
306.60,204.82,557.38,213.66,"/F8",9.96,"pellentesque consectetuer viverra nostra. Iaculis netus in-"
306.60,192.86,557.41,201.71,"/F8",9.96,"teger quisque aptent id hac eget. Cubilia donec cubilia"
306.60,180.90,557.43,189.75,"/F8",9.96,"eros dui lorem. Euismod morbi class tempus. Cubilia au-"
306.60,168.95,557.39,177.80,"/F8",9.96,"gue nunc elementum auctor tincidunt parturient cubilia"
306.60,156.99,557.43,165.84,"/F8",9.96,"hac eu. Vivamus massa in lorem sit nisi ad sollicitudin"
306.60,145.04,557.42,153.89,"/F8",9.96,"platea. Viverra fusce fames eni hac consectetuer. Posuere"
306.60,133.08,557.41,141.93,"/F8",9.96,"proin eros nibh odio adipiscing aenean placerat leo aliquet."
306.60,121.13,373.66,129.98,"/F8",9.96,"Feugiat magna."
321.55,109.17,557.46,118.02,"/F8",9.96,"Pretium morbi. Conubia fusce. Nonummy dolor enim"
306.60,97.22,557.39,106.07,"/F8",9.96,"conubia ut. Pretium donec adipiscing praesent viverra feu-"
306.60,85.26,557.44,94.11,"/F8",9.96,"giat imperdiet nostra hac. Gravida porta massa litora"
295.15,61.35,300.13,70.20,"/F8",9.96,"4"
