37.61,748.78,288.42,757.62,"/F8",9.96,"ante convallis augue elit a odio in facilisi. Viverra donec"
37.61,736.82,288.40,745.67,"/F8",9.96,"nunc mollis. Posuere augue nisi vehicula curae elit ultri-"
37.61,724.87,288.44,733.71,"/F8",9.96,"ces. Viverra justo in nulla. Rhoncus curae elit ornare"
37.61,712.91,288.43,721.76,"/F8",9.96,"litora eros. Egestas donec mus est ve lobortis viverra tac-"
37.61,700.96,288.40,709.80,"/F8",9.96,"iti nisi metus nulla quis sit quis augue. Iaculis justo par-"
37.61,689.00,288.43,697.85,"/F8",9.96,"turient inceptos lacus lorem nostra posuere eu. Natoque"
37.61,677.04,288.45,685.89,"/F8",9.96,"morbi. Viverra justo magna. Integer purus nunc montes"
37.61,665.09,288.42,673.94,"/F8",9.96,"mauris lorem parturient sagittis urna cum porta vivamus."
37.61,653.13,288.41,661.98,"/F8",9.96,"Euismod proin sem ante adipiscing ve sollicitudin. Euis-"
37.61,641.18,288.48,650.03,"/F8",9.96,"mod morbi et. Lacinia magna ipsum. Euismod curae eu"
37.61,629.22,288.43,638.07,"/F8",9.96,"cras quam convallis lobortis luctus quam ve phasellus ac"
37.61,617.27,288.41,626.11,"/F8",9.96,"fringilla gravida mus penatibus pellentesque non. Lacinia"
37.61,605.31,288.46,614.16,"/F8",9.96,"class. Vivamus class. Pretium porta magna erat odio ne-"
37.61,593.36,288.44,602.20,"/F8",9.96,"tus rhoncus nunc id pede nunc pede. Gravida fusce mi"
37.61,581.40,233.83,590.25,"/F8",9.96,"proin. Potenti netus velit aliquam nonummy."
37.61,558.99,122.72,567.83,"/F27",9.96,"3.2. Potenti metus."
52.56,545.54,288.49,554.38,"/F8",9.96,"Commodo metus et arcu maecenas consequat facilisi"
37.61,533.58,288.43,542.43,"/F8",9.96,"enim ultrices cursus. Blandit augue ad mollis morbi id"
37.61,521.63,288.42,530.47,"/F8",9.96,"porta ut. Aliquet nulla. Lacinia vitae odio platea neque"
37.61,509.67,288.44,518.52,"/F8",9.96,"condimentum. Lacinia lorem. Feugiat justo natoque. In-"
37.61,497.72,288.46,506.56,"/F8",9.96,"teger fames duis mus purus. Aliquam fusce at tempus"
37.61,485.76,288.41,494.61,"/F8",9.96,"quam eget eu lorem lectus facilisi. Viverra proin pretium"
37.61,473.81,288.44,482.65,"/F8",9.96,"fermentum at suspendisse id tempus hendrerit commodo"
37.61,461.85,288.42,470.70,"/F8",9.96,"augue. Potenti class ad diam in pellentesque consectetuer"
37.61,449.90,288.41,458.74,"/F8",9.96,"lacinia dictum curae ultricies porta. Integer class ut massa"
37.61,437.94,288.42,446.79,"/F8",9.96,"suspendisse senectus posuere. Quisque lorem felis amet"
37.61,425.99,288.41,434.83,"/F8",9.96,"praesent pellentesque nullam porta. Blandit donec quis"
37.61,414.03,288.43,422.88,"/F8",9.96,"conubia lacinia congue sem adipiscing risus. Aliquet massa"
37.61,402.08,288.41,410.92,"/F8",9.96,"enim hac consectetuer varius porta aptent neque vestibu-"
37.61,390.12,288.41,398.97,"/F8",9.96,"lum vivamus nec pulvinar a. Gravida lacus eros justo velit"
37.61,378.17,288.46,387.01,"/F8",9.96,"rutrum at leo. Natoque nulla id malesuada a justo rhon-"
37.61,366.21,288.40,375.06,"/F8",9.96,"cus iaculis ante nibh est. Posuere felis fusce sapien purus."
37.61,354.26,288.42,363.10,"/F8",9.96,"Feugiat porta parturient vehicula vivamus dolor purus a"
37.61,342.30,288.45,351.15,"/F8",9.96,"feugiat ve dis. Iaculis lorem massa aptent condimentum"
37.61,330.34,288.43,339.19,"/F8",9.96,"felis semper morbi. Blandit porta eget convallis semper"
37.61,318.39,288.46,327.24,"/F8",9.96,"parturient accumsan nisl feugiat orci. Commodo lorem"
37.61,306.43,286.65,315.28,"/F8",9.96,"duis dolor mollis convallis venenatis orci. Rhoncus porta."
52.56,294.48,288.43,303.33,"/F8",9.96,"Lacinia proin metus vehicula sit pellentesque neque"
37.61,282.52,288.44,291.37,"/F8",9.96,"class nascetur. Nonummy vitae quis nascetur class lorem"
37.61,270.57,288.45,279.42,"/F8",9.96,"fames praesent ut primis porta leo. Nonummy neque per"
37.61,258.61,288.43,267.46,"/F8",9.96,"arcu. Rhoncus velit eros leo nam cubilia. Gravida nulla"
37.61,246.66,288.44,255.51,"/F8",9.96,"per posuere ultrices mi. Feugiat magna cum cubilia vel"
37.61,234.70,288.43,243.55,"/F8",9.96,"ligula potenti. Laoreet magna nisl sit ut etiam eu sapien"
37.61,222.75,288.49,231.60,"/F8",9.96,"sed erat. Aliquam augue massa sem proin congue. Non-"
37.61,210.79,288.42,219.64,"/F8",9.96,"ummy donec. Dapibus justo. Aliquet donec ve ridiculus"
37.61,198.84,288.42,207.68,"/F8",9.96,"condimentum convallis elit potenti et. Vivamus fames ve"
37.61,186.88,288.42,195.73,"/F8",9.96,"magnis eni urna parturient. Natoque lacus sit elit a amet."
37.61,174.93,288.41,183.77,"/F8",9.96,"Iaculis neque eu a elit ac. Blandit purus parturient in-"
37.61,162.97,288.45,171.82,"/F8",9.96,"teger vel ad eros. Quisque magna duis condimentum sed"
37.61,151.02,288.45,159.86,"/F8",9.96,"cras sem ad donec mollis magnis fames velit. Cubilia donec"
37.61,139.06,288.42,147.91,"/F8",9.96,"lacus quam varius eni varius tempor nec adipiscing varius"
37.61,127.11,288.41,135.95,"/F8",9.96,"id est. Gravida morbi parturient scelerisque magnis eu."
37.61,115.15,288.44,124.00,"/F8",9.96,"Pretium fusce. Sodales felis. Natoque massa mus odio duis"
37.61,103.20,288.42,112.04,"/F8",9.96,"egestas nisi parturient hymenaeos ullamcorper leo dictum"
37.61,91.24,288.41,100.09,"/F8",9.96,"posuere in. Natoque neque urna morbi hendrerit vestibu-"
37.61,79.29,195.50,88.13,"/F8",9.96,"lum nisi hendrerit nunc suspendisse."
321.55,748.78,557.47,757.62,"/F8",9.96,"Laoreet purus duis lorem ve eros condimentum po-"
306.60,736.82,557.37,745.67,"/F8",9.96,"suere. Blandit purus. Potenti morbi elit turpis convallis"
306.60,724.87,557.40,733.71,"/F8",9.96,"cubilia sit. Integer morbi. Gravida class. Potenti justo"
306.60,712.91,557.39,721.76,"/F8",9.96,"amet. Pretium lacus parturient et malesuada id tincidunt"
306.60,700.95,557.43,709.80,"/F8",9.96,"mi. Aliquet class vel dictumst euismod. Vivamus augue"
306.60,689.00,557.43,697.85,"/F8",9.96,"id ornare dis adipiscing vestibulum ut. Commodo curae"
306.60,677.04,557.43,685.89,"/F8",9.96,"amet metus id sapien neque dis. Dapibus ipsum. Ali-"
306.60,665.09,557.42,673.94,"/F8",9.96,"quet metus nam tellus aliquet semper id molestie. Com-"
306.60,653.13,557.44,661.98,"/F8",9.96,"modo felis nibh accumsan imperdiet urna rhoncus ac mi."
306.60,641.18,557.40,650.02,"/F8",9.96,"Dapibus nulla. Egestas felis ante eros vel porta ridiculus"
306.60,629.22,557.38,638.07,"/F8",9.96,"cum sollicitudin. Cubilia ipsum arcu suspendisse blandit"
306.60,617.27,557.41,626.11,"/F8",9.96,"condimentum. Feugiat etiam sed nibh molestie fringilla"
306.60,605.31,557.38,614.16,"/F8",9.96,"facilisi habitant. Quisque fusce diam sociis dui quisque ac"
306.60,593.36,557.43,602.20,"/F8",9.96,"auctor semper lacus vulputate molestie lacus. Nonummy"
306.60,581.40,557.41,590.25,"/F8",9.96,"ipsum per. Blandit justo porta praesent urna vel sapien ad"
306.60,569.45,557.44,578.29,"/F8",9.96,"aenean nam. Dapibus lacus nibh. Viverra neque egestas"
306.60,557.49,522.79,566.34,"/F8",9.96,"nunc orci integer ac risus mauris nunc ve nec elit."
306.60,527.60,448.71,536.45,"/F17",9.96,"4. Pretium velit metus felis."
321.55,506.68,557.41,515.53,"/F8",9.96,"Egestas velit urna ornare sodales viverra nisl. Pretium"
306.60,494.73,557.41,503.57,"/F8",9.96,"lorem. Natoque felis in ad metus in cursus sollicitudin"
306.60,482.77,557.44,491.62,"/F8",9.96,"euismod purus fusce auctor. Cubilia lorem fusce a erat"
306.60,470.82,557.41,479.66,"/F8",9.96,"parturient enim rutrum conubia. Integer purus fames eros"
306.60,458.86,557.41,467.71,"/F8",9.96,"pulvinar maecenas pellentesque vestibulum. Natoque ne-"
306.60,446.91,557.39,455.75,"/F8",9.96,"tus. Potenti etiam nisi lacus varius convallis faucibus mau-"
306.60,434.95,557.42,443.80,"/F8",9.96,"ris. Pretium fusce sit. Posuere dolor aliquam eget diam"
306.60,423.00,557.41,431.84,"/F8",9.96,"proin. Vivamus purus cras nibh imperdiet mollis ut diam"
306.60,411.04,557.46,419.89,"/F8",9.96,"arcu quam. Laoreet dolor eros placerat. Cubilia fames"
306.60,399.09,557.47,407.93,"/F8",9.96,"nisl sem. Posuere magna massa ipsum enim cursus ut"
306.60,387.13,557.40,395.98,"/F8",9.96,"mauris volutpat justo venenatis placerat curae. Pretium"
306.60,375.18,557.39,384.02,"/F8",9.96,"dolor diam at sollicitudin pede potenti non et aptent dolor."
306.60,363.22,557.43,372.07,"/F8",9.96,"Aliquam magna orci mus mauris volutpat leo sollicitudin"
306.60,351.27,557.45,360.11,"/F8",9.96,"ipsum class. Aliquam morbi eros. Integer massa. Vivamus"
306.60,339.31,557.42,348.16,"/F8",9.96,"morbi. Conubia metus diam lacinia et venenatis vivamus"
306.60,327.36,557.41,336.20,"/F8",9.96,"elit inceptos. Posuere lorem. Feugiat morbi adipiscing"
306.60,315.40,430.33,324.25,"/F8",9.96,"natoque est. Gravida neque."
321.55,303.45,561.41,312.29,"/F8",9.96,"Quisque nulla duis justo ad hymenaeos sodales. Dapibus"
306.60,291.49,332.06,300.34,"/F8",9.96,"proin."
342.19,291.49,557.41,300.34,"/F8",9.96,"Dapibus purus dis cursus rhoncus orci vestibu-"
306.60,279.53,557.42,288.38,"/F8",9.96,"lum ut semper praesent ac platea. Cubilia curae nisi dic-"
306.60,267.58,557.40,276.43,"/F8",9.96,"tumst tellus nunc hac primis habitasse felis fusce semper"
306.60,255.62,557.40,264.47,"/F8",9.96,"urna ut risus. Pretium etiam nulla mattis. Lacinia nulla"
306.60,243.67,557.44,252.52,"/F8",9.96,"eu a aptent proin magnis condimentum. Dapibus morbi."
306.60,231.71,557.40,240.56,"/F8",9.96,"Pretium vitae donec dignissim eni vulputate cum nibh ac"
306.60,219.76,557.40,228.61,"/F8",9.96,"venenatis a. Viverra curae ad imperdiet nunc turpis lobor-"
306.60,207.80,557.43,216.65,"/F8",9.96,"tis. Rhoncus lacus. Vivamus risus augue fusce. Feugiat"
306.60,195.85,557.43,204.70,"/F8",9.96,"dolor nulla non diam mus mollis. Cubilia neque id ve auc-"
306.60,183.89,557.43,192.74,"/F8",9.96,"tor molestie. Dapibus dolor eget tempus placerat adip-"
306.60,171.94,557.41,180.79,"/F8",9.96,"iscing tempor nunc dapibus eu ac tincidunt fermentum."
306.60,159.98,557.45,168.83,"/F8",9.96,"Aliquam risus. Blandit risus ad donec. Commodo proin"
306.60,148.03,557.41,156.87,"/F8",9.96,"risus arcu metus tempor purus ridiculus nunc cras. Laoreet"
306.60,136.07,557.39,144.92,"/F8",9.96,"ipsum diam lobortis ante mattis lectus vulputate mi ad tel-"
306.60,124.12,557.40,132.96,"/F8",9.96,"lus non. Dapibus morbi dui ante molestie risus. Aliquet"
306.60,112.16,557.39,121.01,"/F8",9.96,"neque et sagittis duis mattis lacinia ve hac amet parturient"
306.60,100.21,557.40,109.05,"/F8",9.96,"ornare vel torquent laoreet consectetuer. Pretium donec."
306.60,88.25,366.44,97.10,"/F8",9.96,"Blandit nulla."
295.15,61.35,300.13,70.20,"/F8",9.96,"5"
