557.11,803.82,562.09,812.67,"/F8",9.96,"3"
96.87,778.11,256.10,786.07,"/F19",8.97,"Vivamus donec ac venenatis vitae."
63.96,751.76,298.83,760.60,"/F8",9.96,"Aliquet netus. Euismod fames ante eu sollicitudin auc-"
54.00,739.80,298.85,748.65,"/F8",9.96,"tor. Dapibus lacus. Sodales vitae integer eget gravida"
54.00,727.85,298.89,736.69,"/F8",9.96,"sociis est ac a magnis urna sodales pede. Vivamus class"
54.00,715.89,298.82,724.74,"/F8",9.96,"arcu torquent eni posuere elit in dui dictum nisl. Com-"
54.00,703.94,298.84,712.78,"/F8",9.96,"modo nulla lacus tortor. Cubilia etiam. Quisque donec."
54.00,691.98,257.00,700.83,"/F8",9.96,"Cubilia lorem cras a lorem ve class facilisis."
267.35,691.98,298.86,700.83,"/F8",9.96,"Cubilia"
54.00,680.03,298.85,688.87,"/F8",9.96,"lorem nulla lectus malesuada fames a montes. Aliquet vi-"
54.00,668.07,298.84,676.92,"/F8",9.96,"tae enim commodo lacinia ridiculus vehicula libero enim"
54.00,656.12,298.85,664.96,"/F8",9.96,"consectetuer vestibulum quam mattis iaculis. Commodo"
54.00,644.16,123.80,653.01,"/F8",9.96,"lacus at massa."
133.94,644.16,199.21,653.01,"/F8",9.96,"Viverra donec."
209.37,644.16,298.88,653.01,"/F8",9.96,"Posuere netus nibh."
54.00,632.21,298.84,641.05,"/F8",9.96,"Lacinia ipsum nam vestibulum cursus sagittis fusce. Vi-"
54.00,620.25,298.84,629.10,"/F8",9.96,"vamus vitae quis cursus. Integer vitae lorem fusce arcu"
54.00,608.30,298.86,617.14,"/F8",9.96,"cum quis adipiscing cum. Aliquet magna lacus libero"
54.00,596.34,298.82,605.19,"/F8",9.96,"lacus sed fusce facilisis ante. Feugiat felis ante molestie"
54.00,584.38,298.84,593.23,"/F8",9.96,"accumsan neque habitasse. Gravida justo. Euismod velit"
54.00,572.43,228.08,581.28,"/F8",9.96,"elit faucibus arcu sem a. Egestas fames."
63.96,560.44,298.83,569.29,"/F8",9.96,"Egestas proin velit eget vulputate sit feugiat. Laoreet"
54.00,548.49,298.88,557.33,"/F8",9.96,"magna erat aliquet ve mus arcu sociis. Lacinia etiam"
54.00,536.53,298.86,545.38,"/F8",9.96,"ac consectetuer nullam. Lacinia class nam quis erat eros"
54.00,524.57,298.85,533.42,"/F8",9.96,"bibendum mauris primis. Conubia class ac id magnis felis"
54.00,512.62,298.85,521.47,"/F8",9.96,"vestibulum. Nonummy augue at nisl penatibus. Conubia"
54.00,500.66,298.83,509.51,"/F8",9.96,"metus vestibulum faucibus aliquet aliquam eros ad lorem"
54.00,488.71,298.86,497.56,"/F8",9.96,"nostra ac. Commodo purus. Egestas velit per adipiscing"
54.00,476.75,298.83,485.60,"/F8",9.96,"ad penatibus vestibulum leo velit metus eni tempor fa-"
54.00,464.80,298.81,473.64,"/F8",9.96,"cilisi. Laoreet neque dis duis nulla erat lorem scelerisque"
54.00,452.84,298.86,461.69,"/F8",9.96,"pulvinar. Natoque proin diam integer eros. Aliquam"
54.00,440.89,298.84,449.73,"/F8",9.96,"etiam vestibulum aliquet eni inceptos massa fames sagit-"
54.00,428.93,298.81,437.78,"/F8",9.96,"tis. Viverra felis. Posuere proin porta proin iaculis quis"
54.00,416.98,298.86,425.82,"/F8",9.96,"mi. Lacinia velit nulla congue tempor per cursus po-"
54.00,405.02,298.80,413.87,"/F8",9.96,"tenti pretium facilisis. Dapibus ipsum cum nisl integer"
54.00,393.07,298.81,401.91,"/F8",9.96,"nisi ve erat interdum convallis volutpat odio sodales elit"
54.00,381.11,298.86,389.96,"/F8",9.96,"at platea consectetuer nam. Euismod lorem. Dapibus"
54.00,369.16,298.84,378.00,"/F8",9.96,"etiam et. Feugiat vitae euismod sodales. Pretium curae"
54.00,357.20,298.83,366.05,"/F8",9.96,"in neque amet tincidunt. Aliquet dolor ve ornare lorem"
54.00,345.25,209.31,354.09,"/F8",9.96,"ac. Aliquet curae pede sem egestas."
72.79,312.12,280.14,320.08,"/F19",8.97,"Quisque purus nulla hac quam donec cursus."
63.96,285.77,298.83,294.61,"/F8",9.96,"Vivamus augue nisl scelerisque iaculis suspendisse duis"
54.00,273.81,298.86,282.66,"/F8",9.96,"eros curae magnis. Egestas class urna fermentum facilisi"
54.00,261.85,298.83,270.70,"/F8",9.96,"nostra erat nisl cubilia. Dapibus metus eros vel netus"
54.00,249.90,298.81,258.75,"/F8",9.96,"hendrerit nunc nisi convallis est integer ac. Aliquet cu-"
54.00,237.94,298.81,246.79,"/F8",9.96,"rae massa torquent parturient varius non elit dis felis non"
54.00,225.99,298.85,234.84,"/F8",9.96,"congue. Gravida nulla ipsum ligula ad. Viverra vitae."
54.00,214.03,298.86,222.88,"/F8",9.96,"Euismod dolor augue eros scelerisque feugiat lorem cras"
54.00,202.08,298.87,210.93,"/F8",9.96,"integer ac. Nonummy lorem justo praesent metus dig-"
54.00,190.12,298.82,198.97,"/F8",9.96,"nissim blandit pede mi eni litora inceptos pede dis. Ali-"
54.00,178.17,298.84,187.01,"/F8",9.96,"quet metus velit accumsan vel eget elit mus dolor tempor"
54.00,166.21,298.86,175.06,"/F8",9.96,"orci. Pretium purus etiam fames dolor nunc nam montes"
54.00,154.26,298.86,163.10,"/F8",9.96,"massa consequat leo metus. Iaculis justo egestas et duis"
54.00,142.30,298.79,151.15,"/F8",9.96,"ut lacus tellus litora dictumst curabitur sapien vestibu-"
54.00,130.35,298.87,139.19,"/F8",9.96,"lum. Natoque fusce metus. Vivamus vitae ut ad enim"
54.00,118.39,298.83,127.24,"/F8",9.96,"suspendisse vivamus vitae dapibus sit vestibulum sem-"
317.01,777.92,561.81,786.77,"/F8",9.96,"per enim scelerisque sollicitudin feugiat. Feugiat velit"
317.01,765.96,561.87,774.81,"/F8",9.96,"metus turpis arcu duis feugiat. Laoreet etiam dolor a"
317.01,754.01,561.86,762.86,"/F8",9.96,"laoreet. Aliquam metus. Sodales dolor lacus mollis justo"
317.01,742.05,561.82,750.90,"/F8",9.96,"adipiscing eleifend gravida tellus in. Blandit etiam dui"
317.01,730.10,561.86,738.94,"/F8",9.96,"diam viverra in pede lobortis magna dignissim cursus."
317.01,718.14,561.88,726.99,"/F8",9.96,"Pretium donec nisi rhoncus quam mi massa. Dapibus"
317.01,706.19,561.88,715.03,"/F8",9.96,"dolor eget eni lorem posuere rutrum hac odio. Natoque"
317.01,694.23,561.84,703.08,"/F8",9.96,"class enim neque aptent proin adipiscing scelerisque sem-"
317.01,682.28,511.96,691.12,"/F8",9.96,"per ve. Commodo class vestibulum senectus."
326.98,670.02,561.89,678.87,"/F8",9.96,"Rhoncus velit hac fames litora id magnis euismod hac"
317.01,658.07,561.85,666.91,"/F8",9.96,"eu proin. Lacinia vitae purus dolor diam taciti ut prae-"
317.01,646.11,561.88,654.96,"/F8",9.96,"sent. Euismod fames eu ve cras metus diam dolor facil-"
317.01,634.16,561.87,643.00,"/F8",9.96,"isi. Blandit neque. Sodales dolor enim accumsan par-"
317.01,622.20,561.86,631.05,"/F8",9.96,"turient elementum dolor gravida mattis auctor nec non-"
317.01,610.24,561.87,619.09,"/F8",9.96,"ummy primis leo ante proin ut purus. Rhoncus ipsum"
317.01,598.29,561.82,607.14,"/F8",9.96,"nisi ullamcorper sollicitudin conubia nunc cubilia. Blan-"
317.01,586.33,561.85,595.18,"/F8",9.96,"dit velit. Posuere massa class proin aptent iaculis hac"
317.01,574.38,561.83,583.23,"/F8",9.96,"eu imperdiet condimentum vel nibh nec velit convallis"
317.01,562.42,561.83,571.27,"/F8",9.96,"quisque sollicitudin taciti. Blandit massa vel eget com-"
317.01,550.47,561.87,559.32,"/F8",9.96,"modo blandit velit netus a aptent arcu sodales ad erat"
317.01,538.51,561.88,547.36,"/F8",9.96,"placerat. Nonummy class proin pretium eu hymenaeos a."
317.01,526.56,561.85,535.41,"/F8",9.96,"Posuere magna. Feugiat fames felis libero adipiscing risus"
317.01,514.60,561.85,523.45,"/F8",9.96,"urna a justo ut. Dapibus fames eu tortor quisque sodales."
317.01,502.65,561.83,511.50,"/F8",9.96,"Pretium morbi. Quisque nulla id mauris torquent enim"
317.01,490.69,561.87,499.54,"/F8",9.96,"erat netus neque mus varius. Conubia massa nunc cursus"
317.01,478.74,561.88,487.59,"/F8",9.96,"posuere ve at. Viverra porta orci litora ac duis magna."
317.01,466.78,561.90,475.63,"/F8",9.96,"Vivamus fames. Dapibus donec nec nam pretium ac ae-"
317.01,454.83,561.87,463.67,"/F8",9.96,"nean. Aliquet donec ante magna lectus bibendum metus"
317.01,442.87,561.86,451.72,"/F8",9.96,"pulvinar. Commodo vitae posuere lacinia tellus odio ve"
317.01,430.92,551.43,439.76,"/F8",9.96,"imperdiet eget cubilia cras in. Potenti etiam ve dolor."
326.98,418.66,561.87,427.51,"/F8",9.96,"Iaculis proin nam mus hac fringilla. Dapibus justo."
317.01,406.71,561.84,415.55,"/F8",9.96,"Dapibus felis. Natoque risus. Posuere lorem est rutrum"
317.01,394.75,561.80,403.60,"/F8",9.96,"placerat parturient rutrum id eget ut ultricies pretium."
317.01,382.80,561.82,391.64,"/F8",9.96,"Quisque donec elit sapien id platea vulputate vitae nunc."
317.01,370.84,561.86,379.69,"/F8",9.96,"Egestas class duis. Integer lorem eros sit ac iaculis pede"
317.01,358.89,561.87,367.73,"/F8",9.96,"ut dolor. Conubia purus magna dui vestibulum tempor"
317.01,346.93,561.83,355.78,"/F8",9.96,"nunc at nibh at pellentesque magnis. Pretium velit la-"
317.01,334.98,561.86,343.82,"/F8",9.96,"cus dictum vivamus et. Blandit netus. Commodo vitae"
317.01,323.02,561.83,331.87,"/F8",9.96,"arcu duis sociis urna nisl. Dapibus curae vestibulum cras"
317.01,311.07,561.83,319.91,"/F8",9.96,"fames velit platea quam nisl leo curabitur pellentesque"
317.01,299.11,561.90,307.96,"/F8",9.96,"vel malesuada. Sodales lorem nam cursus eni mauris"
317.01,287.16,561.85,296.00,"/F8",9.96,"et habitant tortor blandit. Integer dolor ad mauris ve-"
317.01,275.20,561.84,284.05,"/F8",9.96,"nenatis. Aliquet porta odio viverra in netus habitant"
317.01,263.24,561.88,272.09,"/F8",9.96,"fames. Dapibus massa eu netus nec nunc mollis montes"
317.01,251.29,561.83,260.14,"/F8",9.96,"class vestibulum pulvinar posuere litora nec. Aliquet"
317.01,239.33,561.85,248.18,"/F8",9.96,"donec sem enim consectetuer eu. Potenti metus. Gravida"
317.01,227.38,561.89,236.23,"/F8",9.96,"magna ipsum aenean eros tellus sem litora ornare ipsum"
317.01,215.42,561.85,224.27,"/F8",9.96,"vestibulum ullamcorper litora ve eros purus. Rhoncus"
317.01,203.47,561.89,212.31,"/F8",9.96,"magna dolor enim blandit enim ut fringilla ac augue ac"
317.01,191.51,540.94,200.36,"/F8",9.96,"phasellus. Cubilia curae et fames mi hymenaeos at."
341.29,156.97,537.69,164.93,"/F19",8.97,"LAOREET RISUS ET EU CURABITUR."
326.98,130.35,456.61,139.19,"/F8",9.96,"Sodales proin arcu semper."
473.24,130.35,561.88,139.19,"/F8",9.96,"Quisque velit urna"
317.01,118.39,561.84,127.24,"/F8",9.96,"scelerisque egestas scelerisque. Dapibus dolor. Laoreet"
