557.11,803.82,562.09,812.67,"/F8",9.96,"6"
54.00,777.92,298.84,786.77,"/F8",9.96,"nec. Blandit nulla eget lacinia quisque orci. Aliquam"
54.00,765.96,298.84,774.81,"/F8",9.96,"class id etiam congue proin eu. Pretium curae nisl quis"
54.00,754.01,298.86,762.86,"/F8",9.96,"vestibulum. Nonummy augue velit egestas quis ad ante"
54.00,742.05,298.87,750.90,"/F8",9.96,"enim. Natoque augue. Potenti augue urna torquent."
54.00,730.10,298.85,738.95,"/F8",9.96,"Pretium vitae. Iaculis curae et ornare conubia aliquam"
54.00,718.14,298.82,726.99,"/F8",9.96,"elit. Lacinia neque ve nisi neque. Lacinia vitae netus per"
54.00,706.19,298.83,715.03,"/F8",9.96,"venenatis justo. Feugiat nulla. Sodales nulla urna ali-"
54.00,694.23,298.84,703.08,"/F8",9.96,"quam imperdiet mus. Sodales risus nibh. Egestas class."
54.00,682.28,298.87,691.12,"/F8",9.96,"Nonummy porta et duis rutrum ac et dis suspendisse"
54.00,670.32,266.89,679.17,"/F8",9.96,"rhoncus leo mi massa elit iaculis. Natoque dolor."
142.88,636.20,210.15,644.17,"/F19",8.97,"Sodales fames."
63.96,609.66,298.84,618.51,"/F8",9.96,"Iaculis ipsum et consequat a sed phasellus facilisi cur-"
54.00,597.71,298.86,606.55,"/F8",9.96,"sus taciti. Conubia metus sodales integer semper. Vi-"
54.00,585.75,298.90,594.60,"/F8",9.96,"vamus donec massa mauris class purus a mattis curae"
54.00,573.80,298.86,582.64,"/F8",9.96,"nibh. Rhoncus augue adipiscing condimentum nullam eu"
54.00,561.84,298.85,570.69,"/F8",9.96,"sit. Vivamus porta. Sodales class. Blandit class. Ali-"
54.00,549.89,298.84,558.73,"/F8",9.96,"quet lorem ve netus ridiculus vehicula. Vivamus augue"
54.00,537.93,298.86,546.78,"/F8",9.96,"odio dapibus lorem eu. Quisque lorem nunc. Sodales la-"
54.00,525.98,298.85,534.82,"/F8",9.96,"cus non morbi ante dapibus. Potenti proin amet ac netus"
54.00,514.02,298.85,522.87,"/F8",9.96,"semper purus dignissim etiam. Posuere nulla lorem mau-"
54.00,502.07,298.85,510.91,"/F8",9.96,"ris. Laoreet metus dui parturient. Nonummy lorem eni"
54.00,490.11,298.84,498.96,"/F8",9.96,"odio dui vel in fusce molestie. Euismod morbi. Iaculis"
54.00,478.15,298.87,487.00,"/F8",9.96,"magna eros ullamcorper integer non in proin. Aliquam"
54.00,466.20,298.83,475.05,"/F8",9.96,"ipsum. Viverra purus ve semper est. Egestas velit duis"
54.00,454.24,298.86,463.09,"/F8",9.96,"posuere ut leo nisi enim cras. Commodo neque. Cubilia"
54.00,442.29,181.91,451.14,"/F8",9.96,"class risus viverra purus eros."
63.96,430.11,298.91,438.96,"/F8",9.96,"Commodo porta. Sodales neque. Egestas lorem. Com-"
54.00,418.16,111.02,427.00,"/F8",9.96,"modo purus."
122.82,418.16,221.12,427.00,"/F8",9.96,"Euismod etiam diam."
232.93,418.16,298.89,427.00,"/F8",9.96,"Dapibus etiam"
54.00,406.20,298.85,415.05,"/F8",9.96,"orci urna adipiscing mi penatibus class vel. Aliquam"
54.00,394.25,298.84,403.09,"/F8",9.96,"etiam vestibulum habitant gravida. Feugiat curae. Vi-"
54.00,382.29,298.86,391.14,"/F8",9.96,"vamus class proin faucibus consequat. Laoreet metus ve"
54.00,370.34,298.85,379.18,"/F8",9.96,"imperdiet a malesuada justo elementum ut dictum est"
54.00,358.38,298.85,367.23,"/F8",9.96,"montes. Rhoncus class neque facilisi fusce dolor facil-"
54.00,346.43,298.84,355.27,"/F8",9.96,"isi. Blandit magna dolor ante. Egestas risus nibh cursus"
54.00,334.47,298.86,343.32,"/F8",9.96,"fames nulla neque condimentum orci. Posuere fames odio"
54.00,322.52,298.86,331.36,"/F8",9.96,"dui enim semper. Egestas lacus et neque tempus vene-"
54.00,310.56,298.84,319.41,"/F8",9.96,"natis dis pharetra a vehicula erat. Posuere velit. Po-"
54.00,298.61,298.86,307.45,"/F8",9.96,"suere nulla nonummy turpis. Feugiat massa odio ad eget"
54.00,286.65,298.82,295.50,"/F8",9.96,"eleifend nisi nullam eleifend. Sodales velit et dolor mo-"
54.00,274.70,298.86,283.54,"/F8",9.96,"lestie morbi dolor commodo senectus class nisi ad nisi."
54.00,262.74,298.83,271.59,"/F8",9.96,"Conubia risus. Cubilia purus ad volutpat elit. Iaculis"
54.00,250.79,126.54,259.63,"/F8",9.96,"netus erat proin."
125.29,216.67,227.74,224.63,"/F19",8.97,"Commodo neque sem."
63.96,190.12,298.84,198.97,"/F8",9.96,"Conubia dolor vestibulum senectus posuere vehicula fe-"
54.00,178.17,298.83,187.02,"/F8",9.96,"lis nulla magna. Quisque proin nisi aliquam at mollis cras"
54.00,166.21,298.86,175.06,"/F8",9.96,"pede. Gravida purus. Commodo purus erat. Viverra vi-"
54.00,154.26,298.86,163.11,"/F8",9.96,"tae proin pharetra lacus tempus litora etiam. Natoque"
54.00,142.30,298.81,151.15,"/F8",9.96,"massa. Quisque etiam id elit nascetur a suscipit nisl facil-"
54.00,130.35,298.82,139.19,"/F8",9.96,"isi fusce vulputate nonummy pellentesque platea donec."
54.00,118.39,298.83,127.24,"/F8",9.96,"Euismod netus velit leo nisi praesent est ut. Gravida"
317.01,777.92,561.84,786.77,"/F8",9.96,"vitae est cras dictumst libero. Viverra fusce porta dui"
317.01,765.96,561.82,774.81,"/F8",9.96,"parturient. Dapibus proin ve sociis suscipit penatibus"
317.01,754.01,561.91,762.86,"/F8",9.96,"proin. Vivamus augue pede orci commodo at augue in."
317.01,742.05,561.88,750.90,"/F8",9.96,"Egestas etiam mi. Feugiat fusce. Quisque magna par-"
317.01,730.10,561.83,738.95,"/F8",9.96,"turient condimentum magnis in enim suspendisse sollici-"
317.01,718.14,561.83,726.99,"/F8",9.96,"tudin. Euismod purus justo senectus augue quis blandit"
317.01,706.19,561.87,715.03,"/F8",9.96,"a congue. Feugiat velit. Egestas magna porta ante mattis"
317.01,694.23,561.83,703.08,"/F8",9.96,"ac etiam platea quam mi elit in consectetuer pellentesque"
317.01,682.28,561.88,691.12,"/F8",9.96,"laoreet tempor cum primis. Laoreet massa blandit ve-"
317.01,670.32,561.87,679.17,"/F8",9.96,"hicula ligula lorem adipiscing accumsan aliquam egestas"
317.01,658.37,561.82,667.21,"/F8",9.96,"tempor leo. Pretium nulla adipiscing eu taciti et pharetra"
317.01,646.41,561.87,655.26,"/F8",9.96,"integer. Euismod risus hac hymenaeos aenean adipiscing"
317.01,634.46,561.81,643.30,"/F8",9.96,"sollicitudin viverra. Natoque vitae vestibulum ut mauris"
317.01,622.50,365.18,631.35,"/F8",9.96,"malesuada."
326.98,610.30,519.18,619.14,"/F8",9.96,"Natoque porta cras ridiculus consectetuer."
529.48,610.30,561.87,619.14,"/F8",9.96,"Sodales"
317.01,598.34,561.84,607.19,"/F8",9.96,"velit. Lacinia felis cras platea sapien risus adipiscing"
317.01,586.39,561.84,595.23,"/F8",9.96,"ut suscipit cum consectetuer. Sodales felis velit magna"
317.01,574.43,561.89,583.28,"/F8",9.96,"sodales eu nisl. Posuere justo donec arcu est a. Po-"
317.01,562.48,561.87,571.32,"/F8",9.96,"suere porta hac magnis. Feugiat class id augue mi felis."
317.01,550.52,561.92,559.37,"/F8",9.96,"Nonummy metus. Natoque massa augue egestas inte-"
317.01,538.57,561.85,547.41,"/F8",9.96,"ger. Quisque risus diam posuere sed adipiscing. Aliquam"
317.01,526.61,561.86,535.46,"/F8",9.96,"fusce ut. Dapibus dolor. Gravida risus class tempus"
317.01,514.66,561.84,523.50,"/F8",9.96,"tristique placerat. Gravida lacus augue. Aliquam lorem"
317.01,502.70,561.83,511.55,"/F8",9.96,"pede laoreet et nunc rhoncus. Blandit risus laoreet. Inte-"
317.01,490.75,561.87,499.59,"/F8",9.96,"ger neque amet inceptos molestie. Conubia risus eu me-"
317.01,478.79,561.86,487.64,"/F8",9.96,"tus leo accumsan etiam elementum blandit justo. Laoreet"
317.01,466.84,561.84,475.68,"/F8",9.96,"lorem. Vivamus fames ve justo in porttitor nisl aliquet"
317.01,454.88,561.82,463.73,"/F8",9.96,"elit pulvinar sed. Iaculis purus duis laoreet ad aliquet."
317.01,442.93,528.16,451.77,"/F8",9.96,"Laoreet morbi purus duis leo in risus mi aenean."
326.98,430.72,561.86,439.57,"/F8",9.96,"Viverra lacus per vel ve nascetur nisl interdum con-"
317.01,418.77,561.87,427.61,"/F8",9.96,"sectetuer mauris. Nonummy porta orci non quisque et"
317.01,406.81,561.85,415.66,"/F8",9.96,"nullam sed dapibus senectus consectetuer sodales varius"
317.01,394.86,561.84,403.70,"/F8",9.96,"aenean vitae. Vivamus morbi. Integer felis elit condimen-"
317.01,382.90,561.83,391.75,"/F8",9.96,"tum pellentesque pretium diam a elit adipiscing nunc."
317.01,370.95,453.35,379.79,"/F8",9.96,"Sodales proin massa leo nibh."
463.45,370.95,561.90,379.79,"/F8",9.96,"Integer class id quam"
317.01,358.99,561.84,367.84,"/F8",9.96,"fames. Quisque vitae parturient ullamcorper auctor at"
317.01,347.04,561.87,355.88,"/F8",9.96,"sociis. Laoreet ipsum. Dapibus etiam felis vel quam"
317.01,335.08,561.87,343.93,"/F8",9.96,"lacus. Natoque felis. Laoreet purus orci eu praesent"
317.01,323.12,561.82,331.97,"/F8",9.96,"aliquet. Potenti nulla enim nunc vestibulum eni porta"
317.01,311.17,561.86,320.02,"/F8",9.96,"vulputate aenean nisl amet magna curabitur. Dapibus"
317.01,299.21,373.39,308.06,"/F8",9.96,"etiam quam."
383.53,299.21,561.91,308.06,"/F8",9.96,"Conubia fames ac facilisi quam magnis"
317.01,287.26,561.83,296.11,"/F8",9.96,"adipiscing proin. Aliquam lacus. Blandit lacus. Dapibus"
317.01,275.30,561.86,284.15,"/F8",9.96,"purus. Vivamus morbi eu proin tortor ante. Aliquet"
317.01,263.35,561.83,272.20,"/F8",9.96,"proin quis sed taciti maecenas imperdiet vitae torquent"
317.01,251.39,561.83,260.24,"/F8",9.96,"ut eget. Pretium morbi. Iaculis purus felis volutpat au-"
317.01,239.44,561.85,248.29,"/F8",9.96,"gue et cras augue et curae magnis ridiculus. Gravida felis"
317.01,227.48,561.83,236.33,"/F8",9.96,"adipiscing diam ultricies inceptos lorem dolor mollis eget"
317.01,215.53,403.39,224.38,"/F8",9.96,"scelerisque aliquam."
321.62,160.43,346.31,168.39,"/F15",8.97,"[1] M."
351.59,160.43,397.41,168.39,"/F15",8.97,"Kwiecinski,"
402.68,160.43,410.35,168.39,"/F15",8.97,"in"
415.70,160.43,561.98,168.39,"/F18",8.97,"Algebraic Geometry, Lecture Notes"
335.33,149.97,475.45,157.93,"/F18",8.97,"in Pure and Applied Mathematics"
475.57,149.97,562.02,157.93,"/F15",8.97,", Vol. 193, edited by"
335.33,139.51,406.95,147.47,"/F15",8.97,"S. Sert\"oz (1987)."
321.62,129.05,388.57,137.01,"/F15",8.97,"[2] T. Shifrin, in"
392.08,129.05,561.95,137.01,"/F18",8.97,"Integral Geoemetry, Proceedings, Contem-"
335.33,118.59,415.01,126.55,"/F18",8.97,"porary Mathematics"
415.10,118.59,480.02,126.55,"/F15",8.97,", Vol. 63 (1984)."
