37.61,748.78,288.41,757.62,"/F8",9.96,"integer. Cubilia felis. Aliquam vitae. Lacinia dolor. Po-"
37.61,736.82,288.45,745.67,"/F8",9.96,"suere porta ac augue est tortor laoreet. Conubia dolor pu-"
37.61,724.87,288.38,733.71,"/F8",9.96,"rus scelerisque ultrices. Potenti netus sem aenean ridiculus"
37.61,712.91,288.37,721.76,"/F8",9.96,"gravida luctus sit quis consectetuer parturient quis vitae."
37.61,700.96,288.44,709.80,"/F8",9.96,"Sodales augue dolor a turpis elementum neque. Cubilia"
37.61,689.00,288.44,697.85,"/F8",9.96,"donec. Rhoncus morbi leo nisl sit aliquam sed fermentum"
37.61,677.04,94.65,685.89,"/F8",9.96,"sit curabitur."
52.56,665.09,288.43,673.94,"/F8",9.96,"Aliquet nulla nisi. Natoque etiam ante dictum incep-"
37.61,653.13,288.45,661.98,"/F8",9.96,"tos odio non laoreet donec cras mattis. Sodales vitae erat"
37.61,641.18,288.45,650.03,"/F8",9.96,"consequat mattis metus etiam. Sodales neque donec fames"
37.61,629.22,288.40,638.07,"/F8",9.96,"risus purus. Integer ipsum parturient scelerisque nostra"
37.61,617.27,288.42,626.11,"/F8",9.96,"ad diam per duis mollis. Lacinia metus adipiscing ultri-"
37.61,605.31,288.45,614.16,"/F8",9.96,"ces aliquam nascetur ac nunc. Iaculis curae porta nullam"
37.61,593.36,288.43,602.20,"/F8",9.96,"ut erat eleifend fames vivamus lobortis. Aliquet magna"
37.61,581.40,288.50,590.25,"/F8",9.96,"augue. Natoque magna. Euismod justo eu. Nonummy"
37.61,569.45,288.41,578.29,"/F8",9.96,"porta nisl habitant ac. Feugiat purus. Viverra velit ut"
37.61,557.49,288.44,566.34,"/F8",9.96,"nostra. Laoreet risus. Aliquam fusce. Integer metus hac"
37.61,545.54,288.43,554.38,"/F8",9.96,"erat eros. Egestas lorem elit hendrerit mi ve. Conubia"
37.61,533.58,288.45,542.43,"/F8",9.96,"netus elit augue. Lacinia augue. Conubia nulla nam duis"
37.61,521.63,288.41,530.47,"/F8",9.96,"nibh. Gravida nulla etiam semper natoque. Dapibus vitae"
37.61,509.67,240.51,518.52,"/F8",9.96,"adipiscing sociosqu vitae amet ultrices aenean."
37.61,487.26,257.97,496.10,"/F27",9.96,"1.2. Lacinia velit ac curae habitant metus montes."
52.56,473.81,288.45,482.65,"/F8",9.96,"Natoque justo. Viverra velit fusce. Iaculis dolor ad"
37.61,461.85,288.44,470.70,"/F8",9.96,"quam curabitur ornare molestie nibh tempor aliquam na-"
37.61,449.90,288.43,458.74,"/F8",9.96,"toque. Blandit lacus ad enim ultrices aliquam nonummy"
37.61,437.94,288.45,446.79,"/F8",9.96,"platea curae ac a. Rhoncus donec risus eni justo vel diam"
37.61,425.99,288.45,434.83,"/F8",9.96,"et eros natoque at sapien id. Iaculis justo eros metus"
37.61,414.03,288.43,422.88,"/F8",9.96,"conubia laoreet pretium tellus mauris nec nostra nonummy"
37.61,402.08,288.44,410.92,"/F8",9.96,"eu. Vivamus purus quis fermentum lectus cum. Natoque"
37.61,390.12,288.44,398.97,"/F8",9.96,"morbi sem amet praesent conubia elit ut fames. Dapibus"
37.61,378.17,288.46,387.01,"/F8",9.96,"fames lacus sapien sociosqu. Quisque curae magna morbi"
37.61,366.21,288.41,375.06,"/F8",9.96,"non orci consectetuer pretium. Cubilia neque sem velit"
37.61,354.26,288.42,363.10,"/F8",9.96,"netus dis. Lacinia neque velit justo mus massa turpis sus-"
37.61,342.30,288.42,351.15,"/F8",9.96,"pendisse felis fermentum. Euismod morbi ad nec elit amet"
37.61,330.34,288.42,339.19,"/F8",9.96,"est lacus dapibus. Blandit justo curae hac ante est sit per"
37.61,318.39,288.41,327.24,"/F8",9.96,"ad. Quisque purus. Vivamus augue vestibulum cubilia eni"
37.61,306.43,288.44,315.28,"/F8",9.96,"adipiscing ut venenatis donec cum leo conubia erat arcu."
37.61,294.48,288.44,303.33,"/F8",9.96,"Commodo morbi pretium rhoncus ultricies nisl nostra so-"
37.61,282.52,288.44,291.37,"/F8",9.96,"dales eu habitasse. Sodales nulla nibh. Sodales lacus id"
37.61,270.57,288.44,279.42,"/F8",9.96,"morbi eu nostra ipsum nulla mattis pulvinar ad ullam-"
37.61,258.61,288.44,267.46,"/F8",9.96,"corper cras consequat sit natoque purus. Sodales vitae"
37.61,246.66,288.45,255.51,"/F8",9.96,"nunc senectus conubia porta quis odio potenti. Commodo"
37.61,234.70,164.04,243.55,"/F8",9.96,"neque. Quisque morbi quam."
52.56,222.75,288.46,231.60,"/F8",9.96,"Laoreet etiam neque quisque lacus amet ad ipsum ul-"
37.61,210.79,288.43,219.64,"/F8",9.96,"lamcorper ac libero. Viverra velit dis eget nam at sollic-"
37.61,198.84,288.39,207.68,"/F8",9.96,"itudin montes ipsum habitant. Potenti lacus nisi viverra"
37.61,186.88,288.48,195.73,"/F8",9.96,"ad. Aliquet augue nunc sem vitae hymenaeos nec com-"
37.61,174.93,288.47,183.77,"/F8",9.96,"modo bibendum. Integer augue. Euismod massa vitae nec"
37.61,162.97,288.42,171.82,"/F8",9.96,"massa vestibulum ullamcorper varius. Cubilia dolor enim"
37.61,151.02,288.43,159.86,"/F8",9.96,"scelerisque. Integer donec in aenean dui nisl sem risus"
37.61,139.06,288.44,147.91,"/F8",9.96,"fringilla cum posuere a libero. Gravida morbi. Nonummy"
37.61,127.11,288.45,135.95,"/F8",9.96,"augue id mus erat bibendum a pharetra eget volutpat auc-"
37.61,115.15,288.38,124.00,"/F8",9.96,"tor. Quisque ipsum. Aliquet etiam aliquet. Quisque fusce"
37.61,103.20,288.42,112.04,"/F8",9.96,"sem elit dui laoreet. Pretium netus eu. Sodales risus so-"
37.61,91.24,288.45,100.09,"/F8",9.96,"dales neque augue ipsum lobortis lorem vehicula morbi"
37.61,79.29,288.43,88.13,"/F8",9.96,"dui nunc duis facilisis lacus. Laoreet magna nec dignissim"
306.60,748.78,557.45,757.62,"/F8",9.96,"feugiat augue dis ante arcu. Egestas neque fames morbi"
306.60,736.82,557.45,745.67,"/F8",9.96,"ullamcorper. Integer massa purus hymenaeos mus ipsum."
306.60,724.87,557.41,733.71,"/F8",9.96,"Cubilia nulla arcu egestas in eu justo non urna dis. Viverra"
306.60,712.91,557.39,721.76,"/F8",9.96,"vitae potenti phasellus amet nec mi etiam sollicitudin fa-"
306.60,700.95,557.39,709.80,"/F8",9.96,"cilisi fames et venenatis consequat. Conubia felis mi per et"
306.60,689.00,557.41,697.85,"/F8",9.96,"augue nascetur adipiscing penatibus lacus. Aliquam netus"
306.60,677.04,439.29,685.89,"/F8",9.96,"nulla a urna purus class proin."
306.60,647.16,557.52,656.00,"/F17",9.96,"2. Egestas fusce elit a odio ve montes interdum"
321.24,635.20,345.73,644.05,"/F17",9.96,"odio."
321.55,614.28,557.44,623.13,"/F8",9.96,"Gravida morbi ac semper est cum sollicitudin auctor"
306.60,602.32,557.46,611.17,"/F8",9.96,"fames dis. Vivamus massa hac tortor tempus justo in-"
306.60,590.37,557.42,599.22,"/F8",9.96,"terdum risus erat. Lacinia lorem ante duis leo justo sed."
306.60,578.41,557.44,587.26,"/F8",9.96,"Lacinia nulla ut hendrerit a massa egestas odio. Blandit"
306.60,566.46,557.40,575.31,"/F8",9.96,"lorem gravida ut. Potenti justo amet sit lectus. Gravida"
306.60,554.50,557.44,563.35,"/F8",9.96,"felis id magnis magna sapien eros ve mus curabitur morbi"
306.60,542.55,557.40,551.39,"/F8",9.96,"ad cras. Gravida dolor metus volutpat id suspendisse elit"
306.60,530.59,557.39,539.44,"/F8",9.96,"enim. Pretium purus. Euismod risus hac blandit ultrices"
306.60,518.64,557.43,527.48,"/F8",9.96,"felis pharetra nulla mus lorem amet. Iaculis lorem nunc"
306.60,506.68,557.46,515.53,"/F8",9.96,"consequat at morbi. Sodales fusce non diam per morbi"
306.60,494.73,557.42,503.57,"/F8",9.96,"justo nascetur adipiscing fermentum ipsum pede. Laoreet"
306.60,482.77,557.46,491.62,"/F8",9.96,"morbi. Lacinia massa donec venenatis hac orci sodales."
306.60,470.82,557.41,479.66,"/F8",9.96,"Laoreet justo orci. Cubilia fames netus vitae velit enim"
306.60,458.86,557.43,467.71,"/F8",9.96,"curae luctus ornare fusce. Aliquet lorem id ad hac urna."
306.60,446.91,557.41,455.75,"/F8",9.96,"Nonummy vitae ipsum. Dapibus proin. Pretium nulla ad."
306.60,434.95,446.10,443.80,"/F8",9.96,"Aliquam neque. Pretium neque."
321.55,423.00,557.47,431.84,"/F8",9.96,"Lacinia proin vitae nec. Laoreet neque. Nonummy"
306.60,411.04,557.40,419.89,"/F8",9.96,"justo nisl amet donec lectus taciti eros scelerisque est ac"
306.60,399.09,557.38,407.93,"/F8",9.96,"luctus ve volutpat eni. Potenti risus mi risus et ornare ve"
306.60,387.13,557.43,395.98,"/F8",9.96,"ac. Natoque fusce cum nibh etiam nec primis nam parturi-"
306.60,375.18,557.44,384.02,"/F8",9.96,"ent nostra erat metus est egestas. Aliquam neque eget a"
306.60,363.22,557.43,372.07,"/F8",9.96,"etiam. Iaculis magna nisl montes auctor. Rhoncus felis ip-"
306.60,351.27,557.39,360.11,"/F8",9.96,"sum inceptos porttitor tellus lobortis. Conubia ipsum dui"
306.60,339.31,557.43,348.16,"/F8",9.96,"ornare mollis class. Natoque purus id fames consectetuer"
306.60,327.36,557.42,336.20,"/F8",9.96,"consequat curae nisl cursus id. Pretium morbi nam congue"
306.60,315.40,557.43,324.25,"/F8",9.96,"massa blandit mauris dolor iaculis ve praesent ornare. Po-"
306.60,303.45,557.44,312.29,"/F8",9.96,"suere augue. Rhoncus netus mi. Lacinia proin id enim."
306.60,291.49,557.42,300.34,"/F8",9.96,"Dapibus neque risus nunc ac consectetuer tempor. Rhon-"
306.60,279.53,557.45,288.38,"/F8",9.96,"cus massa quam at accumsan sem aliquet mus ve dictumst"
306.60,267.58,557.41,276.43,"/F8",9.96,"odio duis elit laoreet mi pede dignissim montes mi. Viverra"
306.60,255.62,557.41,264.47,"/F8",9.96,"etiam et cum in a pede in. Pretium augue. Aliquet netus."
306.60,243.67,557.44,252.52,"/F8",9.96,"Viverra nulla quam maecenas a facilisi eni. Natoque donec"
306.60,231.71,557.42,240.56,"/F8",9.96,"nibh condimentum sed eros odio sem lacinia inceptos nulla."
306.60,219.76,400.96,228.61,"/F8",9.96,"Iaculis nulla per cum."
306.60,195.85,513.80,204.70,"/F27",9.96,"2.1. Vivamus class dui quis a quam risus class."
321.55,180.90,557.43,189.75,"/F8",9.96,"Sodales proin ipsum dapibus lectus justo integer non."
306.60,168.95,557.45,177.80,"/F8",9.96,"Integer morbi at ut sapien. Nonummy ipsum ante donec"
306.60,156.99,557.38,165.84,"/F8",9.96,"blandit id taciti potenti lacinia eget. Pretium ipsum cu-"
306.60,145.04,557.42,153.89,"/F8",9.96,"rae mus. Integer lorem netus pede erat netus ve venenatis"
306.60,133.08,557.44,141.93,"/F8",9.96,"class cum urna et lorem. Laoreet donec eu tristique au-"
306.60,121.13,557.43,129.98,"/F8",9.96,"gue ve. Integer proin ad. Pretium porta. Integer porta."
306.60,109.17,557.45,118.02,"/F8",9.96,"Natoque netus dis accumsan viverra nonummy. Lacinia"
306.60,97.22,557.44,106.07,"/F8",9.96,"magna proin cursus habitasse augue tincidunt. Egestas"
306.60,85.26,557.42,94.11,"/F8",9.96,"neque risus aliquam ut ornare integer. Aliquam purus."
295.15,61.35,300.13,70.20,"/F8",9.96,"2"
