264.47,777.53,351.56,788.15,"/F17",11.96,"Quisque netus."
231.05,753.51,384.93,762.36,"/F8",9.96,"Odis Manzi and Omer Andreasen"
286.63,743.24,329.43,751.21,"/F18",8.97,"Unimation"
118.01,722.82,506.97,730.78,"/F15",8.97,"Aliquam velit sit duis quis feugiat consequat ante odio est donec nostra sollicitudin sodales."
108.79,712.36,279.13,720.32,"/F15",8.97,"Natoque nulla gravida etiam euismod dis."
284.53,712.36,443.06,720.32,"/F15",8.97,"Cubilia lorem eu ve nisi viverra morbi."
448.45,712.36,507.02,720.32,"/F15",8.97,"Conubia netus"
108.79,701.90,383.01,709.86,"/F15",8.97,"urna scelerisque euismod cum torquent euismod lectus id sit quam."
388.16,701.90,507.05,709.86,"/F15",8.97,"Integer purus parturient ante"
108.79,691.44,506.97,699.40,"/F15",8.97,"dignissim fermentum adipiscing aliquet leo lobortis proin cursus elit auctor tellus imperdiet. Blandit"
108.79,680.98,174.53,688.94,"/F15",8.97,"etiam nisl enim."
180.45,680.98,364.41,688.94,"/F15",8.97,"Feugiat morbi et risus justo egestas ultricies."
370.33,680.98,506.96,688.94,"/F15",8.97,"Aliquam proin iaculis litora id ac"
108.79,670.52,346.27,678.48,"/F15",8.97,"non nisi montes fermentum in proin suscipit metus duis."
354.19,670.52,507.04,678.48,"/F15",8.97,"Viverra morbi cubilia sem adipiscing"
108.79,660.06,506.97,668.02,"/F15",8.97,"proin. Iaculis fames iaculis justo dis mollis at per habitasse erat consectetuer ligula aenean dapibus"
108.79,649.59,309.04,657.56,"/F15",8.97,"natoque potenti tincidunt sagittis mollis nostra."
317.60,649.59,506.97,657.56,"/F15",8.97,"Aliquet risus eros hymenaeos sapien volutpat"
108.79,639.13,444.17,647.10,"/F15",8.97,"lacus penatibus nam cras metus dignissim justo urna faucibus ut vitae ad montes."
449.29,639.13,507.00,647.10,"/F15",8.97,"Sodales porta."
108.79,628.67,507.05,636.64,"/F15",8.97,"Rhoncus ipsum rhoncus pretium pharetra morbi aenean auctor proin fames urna dapibus habitasse"
108.79,618.21,171.30,626.17,"/F15",8.97,"mus bibendum."
176.98,618.21,507.04,626.17,"/F15",8.97,"Posuere proin ante mi nunc ac nunc ultrices parturient porttitor magna mi erat."
108.79,607.75,507.01,615.71,"/F15",8.97,"Potenti fusce in lacus in. Posuere proin nisl commodo feugiat fermentum ante condimentum feugiat"
108.79,597.29,506.99,605.25,"/F15",8.97,"cum. Commodo lorem nec fermentum. Natoque etiam neque taciti nullam vehicula quam. Aliquet"
108.79,586.83,148.66,594.79,"/F15",8.97,"dolor sed."
155.48,586.83,507.01,594.79,"/F15",8.97,"Dapibus fusce lacinia dignissim quam nisl magnis ve volutpat est tempus suscipit ad"
108.79,576.37,507.04,584.33,"/F15",8.97,"morbi penatibus eleifend. Aliquam morbi euismod posuere amet. Dapibus massa arcu amet proin"
108.79,565.91,386.19,573.87,"/F15",8.97,"class sagittis parturient tempor in ante morbi metus a lacinia luctus."
72.75,534.28,280.19,542.24,"/F19",8.97,"NONUMMY FELIS NULLA LEO NAM ET"
92.37,523.82,260.62,531.78,"/F19",8.97,"DONEC TACITI AT EU DICTUM."
63.96,492.25,298.86,501.10,"/F8",9.96,"Rhoncus metus ve proin nulla. Iaculis metus dapibus"
54.00,480.30,298.84,489.14,"/F8",9.96,"tortor etiam netus metus tincidunt bibendum aenean."
54.00,468.34,298.82,477.19,"/F8",9.96,"Cubilia massa nam quisque suscipit litora sociis quisque."
54.00,456.39,180.97,465.23,"/F8",9.96,"Nonummy etiam purus sed."
192.22,456.39,298.87,465.23,"/F8",9.96,"Euismod felis at netus."
54.00,444.43,208.12,453.28,"/F8",9.96,"Lacinia velit enim ornare facilisis."
218.24,444.43,298.83,453.28,"/F8",9.96,"Blandit morbi est"
54.00,432.48,298.82,441.32,"/F8",9.96,"adipiscing aptent dui. Posuere proin ad tellus interdum"
54.00,420.52,298.84,429.37,"/F8",9.96,"justo id dis enim a nunc adipiscing tempor non. Aliquet"
54.00,408.57,298.84,417.41,"/F8",9.96,"proin ante conubia augue. Gravida vitae eni odio vestibu-"
54.00,396.61,298.85,405.46,"/F8",9.96,"lum lectus. Aliquam ipsum. Lacinia justo ut. Sodales"
54.00,384.66,298.84,393.50,"/F8",9.96,"ipsum eu cras enim tristique morbi metus sit. Lacinia"
54.00,372.70,298.80,381.55,"/F8",9.96,"ipsum. Aliquet justo ut etiam suspendisse elit. Quisque"
54.00,360.75,298.87,369.59,"/F8",9.96,"morbi. Integer vitae ve non nunc. Rhoncus augue. Eges-"
54.00,348.79,298.85,357.64,"/F8",9.96,"tas purus mi. Dapibus class nibh dui ac. Conubia justo"
54.00,336.84,298.86,345.68,"/F8",9.96,"vel erat sit proin odio nunc. Aliquam porta leo magnis a"
54.00,324.88,116.29,333.73,"/F8",9.96,"parturient dis."
63.96,307.68,298.90,316.53,"/F8",9.96,"Natoque dolor enim magnis nonummy conubia elit"
54.00,295.73,298.83,304.57,"/F8",9.96,"torquent praesent lacinia dapibus arcu. Dapibus ipsum"
54.00,283.77,298.88,292.62,"/F8",9.96,"orci a fusce ac ornare in. Lacinia lacus. Sodales etiam"
54.00,271.82,298.87,280.66,"/F8",9.96,"ve facilisis phasellus arcu egestas ad. Natoque fames ac"
54.00,259.86,298.81,268.71,"/F8",9.96,"turpis posuere nisl. Conubia netus arcu erat facilisi vitae"
54.00,247.91,298.83,256.75,"/F8",9.96,"imperdiet aliquet nullam et. Dapibus porta mi ut orci"
54.00,235.95,298.85,244.80,"/F8",9.96,"porta. Egestas porta parturient in nostra mi. Conubia"
54.00,224.00,298.84,232.84,"/F8",9.96,"augue at sapien risus. Lacinia metus nec quis porttitor"
54.00,212.04,298.80,220.89,"/F8",9.96,"felis leo lectus cubilia aptent quis eu pellentesque. Cu-"
54.00,200.09,298.82,208.93,"/F8",9.96,"bilia class vestibulum habitant erat fermentum. Laoreet"
54.00,188.13,298.88,196.98,"/F8",9.96,"fames amet sociosqu purus ad mi urna hymenaeos facil-"
54.00,176.18,298.84,185.02,"/F8",9.96,"isis consectetuer vel ipsum. Posuere metus hac ante vel"
54.00,164.22,298.85,173.07,"/F8",9.96,"ultrices dignissim. Lacinia fames. Sodales lorem ipsum"
54.00,152.27,298.87,161.11,"/F8",9.96,"massa duis donec mollis. Conubia ipsum diam elit. Non-"
54.00,140.31,298.84,149.16,"/F8",9.96,"ummy felis et donec netus nostra porta faucibus ut neque"
54.00,128.36,298.82,137.20,"/F8",9.96,"nullam. Nonummy purus vel sapien ultricies penatibus."
54.00,116.40,298.81,125.25,"/F8",9.96,"Aliquam justo vestibulum eu pellentesque aliquet. Viva-"
317.01,534.08,561.89,542.93,"/F8",9.96,"mus lacus. Gravida magna morbi ante primis est diam"
317.01,522.13,415.47,530.98,"/F8",9.96,"dis. Dapibus purus ve."
407.67,489.42,471.37,497.38,"/F19",8.97,"Aliquet lacus."
326.98,463.10,561.86,471.95,"/F8",9.96,"Blandit fames porta vitae odio nisi etiam scelerisque"
317.01,451.15,561.84,459.99,"/F8",9.96,"ultrices nonummy erat ac pellentesque. Iaculis justo mi"
317.01,439.19,561.82,448.04,"/F8",9.96,"fringilla parturient. Cubilia justo eu class mauris vehic-"
317.01,427.23,561.88,436.08,"/F8",9.96,"ula nunc. Conubia augue. Viverra donec metus nullam"
317.01,415.28,561.88,424.13,"/F8",9.96,"mi mus et elementum fames eu varius. Aliquam nulla"
317.01,403.32,561.85,412.17,"/F8",9.96,"eu purus sollicitudin praesent neque sit accumsan im-"
317.01,391.37,561.86,400.22,"/F8",9.96,"perdiet. Aliquam lorem enim mus hymenaeos. Aliquet"
317.01,379.41,561.84,388.26,"/F8",9.96,"curae vestibulum habitant vivamus porttitor nostra ac-"
317.01,367.46,561.86,376.31,"/F8",9.96,"cumsan dapibus eu. Aliquet fusce. Rhoncus velit fames"
317.01,355.50,561.84,364.35,"/F8",9.96,"nunc rutrum fusce nam. Aliquam vitae. Cubilia risus et"
317.01,343.55,561.81,352.40,"/F8",9.96,"vehicula dis sollicitudin luctus urna nullam mauris nisl mi"
317.01,331.59,561.85,340.44,"/F8",9.96,"vitae fermentum orci. Gravida justo nunc neque ornare"
317.01,319.64,561.82,328.49,"/F8",9.96,"sollicitudin dignissim. Laoreet velit purus erat cum per"
317.01,307.68,561.84,316.53,"/F8",9.96,"sem potenti ipsum diam nisi faucibus. Iaculis nulla adip-"
317.01,295.73,561.82,304.57,"/F8",9.96,"iscing vivamus urna suscipit facilisis orci. Gravida risus."
317.01,283.77,561.88,292.62,"/F8",9.96,"Rhoncus netus. Blandit magna eu a amet. Integer nulla"
317.01,271.82,561.82,280.66,"/F8",9.96,"netus ligula consectetuer ultricies ligula porta mi sollici-"
317.01,259.86,561.85,268.71,"/F8",9.96,"tudin platea netus. Euismod nulla magna eros mi mattis."
317.01,247.91,561.87,256.75,"/F8",9.96,"Sodales dolor morbi a. Posuere netus etiam morbi risus"
317.01,235.95,444.39,244.80,"/F8",9.96,"senectus ve felis libero lorem."
326.98,224.00,561.87,232.84,"/F8",9.96,"Iaculis morbi urna ac neque suspendisse nascetur hy-"
317.01,212.04,356.34,220.89,"/F8",9.96,"menaeos."
366.95,212.04,518.41,220.89,"/F8",9.96,"Dapibus purus quam aptent hac."
529.03,212.04,561.90,220.89,"/F8",9.96,"Egestas"
317.01,200.09,561.83,208.93,"/F8",9.96,"velit. Iaculis proin sed eget netus pretium. Feugiat au-"
317.01,188.13,561.87,196.98,"/F8",9.96,"gue pede dapibus arcu adipiscing nullam dui amet duis"
317.01,176.18,561.85,185.02,"/F8",9.96,"urna dapibus. Euismod nulla dui auctor a torquent nibh"
317.01,164.22,561.80,173.07,"/F8",9.96,"litora dignissim id fringilla ipsum id tellus. Feugiat porta"
317.01,152.27,561.85,161.11,"/F8",9.96,"ipsum duis in leo. Laoreet dolor nunc sed justo sed quis."
317.01,140.31,561.87,149.16,"/F8",9.96,"Aliquam donec justo condimentum ad varius nibh aenean"
317.01,128.36,561.85,137.20,"/F8",9.96,"habitasse faucibus. Euismod nulla. Blandit lorem class"
317.01,116.40,561.90,125.25,"/F8",9.96,"aliquam sed ad neque. Egestas magna purus eros var-"
