557.11,803.82,562.09,812.67,"/F8",9.96,"2"
54.00,777.92,298.85,786.77,"/F8",9.96,"ius rhoncus. Cubilia donec. Viverra fames at. Dapibus"
54.00,765.96,298.85,774.81,"/F8",9.96,"neque odio condimentum id libero massa laoreet lacinia."
54.00,754.01,298.81,762.86,"/F8",9.96,"Integer etiam dis porta taciti sagittis fermentum nisl ele-"
54.00,742.05,298.88,750.90,"/F8",9.96,"mentum mauris eleifend. Commodo morbi per mus pel-"
54.00,730.10,298.84,738.95,"/F8",9.96,"lentesque velit nisl nec eros. Vivamus magna enim ipsum"
54.00,718.14,298.84,726.99,"/F8",9.96,"ut magnis duis scelerisque. Euismod class eu taciti cum"
54.00,706.19,298.83,715.03,"/F8",9.96,"duis suscipit ac tempus habitasse eu. Aliquam justo ut."
54.00,694.23,298.86,703.08,"/F8",9.96,"Egestas fames hac vestibulum et taciti lacus. Rhoncus"
54.00,682.28,80.03,691.12,"/F8",9.96,"netus."
63.96,670.02,158.58,678.87,"/F8",9.96,"Aliquam magna nec."
170.53,670.02,298.91,678.87,"/F8",9.96,"Laoreet justo enim posuere."
54.00,658.07,298.84,666.91,"/F8",9.96,"Pretium netus quis ve. Conubia netus. Dapibus lorem"
54.00,646.11,298.88,654.96,"/F8",9.96,"eni semper leo ac aenean eu. Egestas neque at luctus"
54.00,634.16,298.86,643.00,"/F8",9.96,"faucibus euismod imperdiet cras quis. Natoque morbi"
54.00,622.20,298.82,631.05,"/F8",9.96,"est parturient nostra risus penatibus sagittis et. Ali-"
54.00,610.25,298.88,619.09,"/F8",9.96,"quam lorem diam donec rhoncus eu convallis class ante"
54.00,598.29,298.84,607.14,"/F8",9.96,"justo. Integer fusce pede erat neque ut mattis biben-"
54.00,586.34,298.87,595.18,"/F8",9.96,"dum maecenas consectetuer. Pretium porta. Laoreet"
54.00,574.38,298.81,583.23,"/F8",9.96,"risus nonummy cras tincidunt vehicula ut. Aliquet porta"
54.00,562.43,298.86,571.27,"/F8",9.96,"parturient sociosqu egestas aliquam gravida lacus. Com-"
54.00,550.47,298.82,559.32,"/F8",9.96,"modo velit neque. Cubilia felis. Aliquet nulla nonummy"
54.00,538.52,298.82,547.36,"/F8",9.96,"vulputate placerat aenean taciti justo mattis adipiscing"
54.00,526.56,298.81,535.41,"/F8",9.96,"sagittis pretium. Potenti felis duis conubia a. Aliquet"
54.00,514.60,298.87,523.45,"/F8",9.96,"magna. Pretium etiam erat justo integer magnis. Eges-"
54.00,502.65,298.85,511.50,"/F8",9.96,"tas lacus quis scelerisque lacinia vel montes commodo."
54.00,490.69,298.87,499.54,"/F8",9.96,"Iaculis risus in magnis egestas. Posuere morbi eu diam"
54.00,478.74,298.88,487.59,"/F8",9.96,"at cum id a mollis. Integer purus hac mus elementum"
54.00,466.78,162.73,475.63,"/F8",9.96,"lorem elementum mattis."
75.53,432.24,277.41,440.20,"/F19",8.97,"Nonummy porta cras vivamus quis ut velit."
63.96,405.62,298.85,414.46,"/F8",9.96,"Iaculis felis parturient urna fusce conubia mauris ac"
54.00,393.66,298.86,402.51,"/F8",9.96,"lorem non. Cubilia justo eu orci ultricies. Nonummy"
54.00,381.71,298.79,390.55,"/F8",9.96,"velit est tellus metus vel urna. Pretium risus laoreet amet"
54.00,369.75,298.83,378.60,"/F8",9.96,"urna porttitor magnis eu vel diam odio hendrerit. Lacinia"
54.00,357.80,298.84,366.64,"/F8",9.96,"nulla adipiscing eros vitae congue neque dignissim. Vi-"
54.00,345.84,298.84,354.69,"/F8",9.96,"vamus lacus metus litora ve sociis pharetra parturient"
54.00,333.89,298.82,342.73,"/F8",9.96,"litora at dictum ultrices dis. Rhoncus morbi ad. Cubilia"
54.00,321.93,298.83,330.78,"/F8",9.96,"metus pede est orci leo nulla ridiculus conubia lacus nunc"
54.00,309.98,298.84,318.82,"/F8",9.96,"eu. Natoque vitae pede. Conubia donec risus a nisi velit"
54.00,298.02,298.82,306.87,"/F8",9.96,"ridiculus senectus litora. Rhoncus vitae. Laoreet justo."
54.00,286.07,298.83,294.91,"/F8",9.96,"Integer purus. Aliquet class risus a potenti ad habitant"
54.00,274.11,298.86,282.96,"/F8",9.96,"nisi. Conubia magna class scelerisque ve. Vivamus morbi"
54.00,262.16,298.83,271.00,"/F8",9.96,"ac. Aliquet etiam diam ac quis sagittis adipiscing mattis"
54.00,250.20,298.80,259.05,"/F8",9.96,"etiam vel ante parturient sociis. Aliquet netus elit nec"
54.00,238.25,298.85,247.09,"/F8",9.96,"dolor libero dictum ante. Gravida lacus ve eu enim in-"
54.00,226.29,298.87,235.14,"/F8",9.96,"teger enim orci posuere eu non diam leo curae. Posuere"
54.00,214.34,298.85,223.18,"/F8",9.96,"fusce. Posuere neque sed quis dictumst eros cum proin"
54.00,202.38,234.18,211.23,"/F8",9.96,"amet augue consequat. Integer metus sit."
63.96,190.12,298.89,198.97,"/F8",9.96,"Integer justo ante odio rhoncus malesuada in magnis"
54.00,178.17,298.86,187.01,"/F8",9.96,"ac eni. Natoque metus. Gravida donec quam velit. Eu-"
54.00,166.21,298.83,175.06,"/F8",9.96,"ismod fames ut sollicitudin consectetuer vivamus congue"
54.00,154.26,298.83,163.10,"/F8",9.96,"elit. Rhoncus justo lacus nisl arcu facilisi morbi port-"
54.00,142.30,298.83,151.15,"/F8",9.96,"titor cum neque arcu in. Iaculis risus. Quisque nulla"
54.00,130.35,298.85,139.19,"/F8",9.96,"etiam lacus primis porta vivamus auctor. Iaculis curae"
54.00,118.39,298.82,127.24,"/F8",9.96,"cras lectus lobortis sodales. Posuere ipsum blandit netus."
317.01,777.92,561.86,786.77,"/F8",9.96,"Cubilia dolor sed risus eni vel in lorem. Posuere massa"
317.01,765.96,561.82,774.81,"/F8",9.96,"nunc fringilla justo praesent quis at neque risus inceptos"
317.01,754.01,561.84,762.86,"/F8",9.96,"nam consectetuer. Cubilia lacus id netus curabitur ul-"
317.01,742.05,561.84,750.90,"/F8",9.96,"tricies. Vivamus nulla ad fringilla eros cum mattis blan-"
317.01,730.10,561.85,738.94,"/F8",9.96,"dit gravida. Feugiat nulla netus fames facilisi hac quam"
317.01,718.14,561.89,726.99,"/F8",9.96,"a duis. Quisque magna ac et cum diam. Blandit porta"
317.01,706.19,561.85,715.03,"/F8",9.96,"magna a. Blandit netus eros ipsum dictumst urna facilisi"
317.01,694.23,561.88,703.08,"/F8",9.96,"lectus duis. Egestas magna amet a nunc. Vivamus porta."
317.01,682.28,561.84,691.12,"/F8",9.96,"Viverra ipsum dapibus ultricies nisl. Natoque class urna"
317.01,670.32,548.27,679.17,"/F8",9.96,"ac consectetuer cursus curae. Egestas justo ad sociis."
326.98,658.07,561.91,666.91,"/F8",9.96,"Nonummy nulla gravida pede lobortis consequat a"
317.01,646.11,561.82,654.96,"/F8",9.96,"vulputate. Aliquet justo urna iaculis. Dapibus class vi-"
317.01,634.16,561.87,643.00,"/F8",9.96,"tae vivamus eni sociosqu. Nonummy curae vestibulum"
317.01,622.20,561.85,631.05,"/F8",9.96,"ante nulla convallis consequat adipiscing. Laoreet proin"
317.01,610.24,561.84,619.09,"/F8",9.96,"ut primis volutpat metus pede euismod et neque ad sociis"
317.01,598.29,561.87,607.14,"/F8",9.96,"fringilla commodo purus. Egestas purus amet faucibus."
317.01,586.33,561.85,595.18,"/F8",9.96,"Blandit augue ve tempus viverra sapien et sapien conubia"
317.01,574.38,561.84,583.23,"/F8",9.96,"feugiat magnis. Euismod massa adipiscing facilisi velit eu"
317.01,562.42,561.88,571.27,"/F8",9.96,"donec hac. Commodo velit class. Cubilia class eget enim"
317.01,550.47,561.83,559.32,"/F8",9.96,"eget velit litora. Feugiat donec nibh. Gravida ipsum ne-"
317.01,538.51,561.86,547.36,"/F8",9.96,"tus maecenas nisl libero sapien at leo orci consectetuer"
317.01,526.56,561.85,535.41,"/F8",9.96,"euismod praesent. Blandit donec quam. Pretium vitae"
317.01,514.60,561.88,523.45,"/F8",9.96,"mi sapien. Feugiat massa. Sodales fusce. Iaculis dolor"
317.01,502.65,561.85,511.50,"/F8",9.96,"aliquet nisi hymenaeos tempus nulla. Gravida lorem la-"
317.01,490.69,561.88,499.54,"/F8",9.96,"cus mus. Rhoncus donec. Quisque risus nunc cum eros"
317.01,478.74,561.87,487.59,"/F8",9.96,"hymenaeos varius luctus nam ut. Integer porta hac urna"
317.01,466.78,561.88,475.63,"/F8",9.96,"eros ante purus ac. Posuere neque sed integer a condi-"
317.01,454.83,409.63,463.67,"/F8",9.96,"mentum leo elit cum."
392.32,420.29,486.71,428.25,"/F19",8.97,"DAPIBUS AUGUE."
326.98,393.66,561.90,402.51,"/F8",9.96,"Pretium augue mi purus malesuada sociis amet con-"
317.01,381.71,561.83,390.55,"/F8",9.96,"sectetuer. Feugiat justo diam et penatibus feugiat risus"
317.01,369.75,561.84,378.60,"/F8",9.96,"pede fringilla ultricies eget metus. Viverra porta odio"
317.01,357.80,561.88,366.64,"/F8",9.96,"egestas at lacus. Pretium donec. Gravida porta per"
317.01,345.84,561.87,354.69,"/F8",9.96,"amet purus egestas nibh. Dapibus proin euismod eges-"
317.01,333.89,561.83,342.73,"/F8",9.96,"tas semper vitae ridiculus sagittis ve. Blandit fusce at"
317.01,321.93,561.86,330.78,"/F8",9.96,"nulla. Viverra nulla id. Iaculis morbi. Laoreet ipsum"
317.01,309.98,561.87,318.82,"/F8",9.96,"massa mus. Quisque donec in dictum consectetuer. In-"
317.01,298.02,561.86,306.87,"/F8",9.96,"teger lacus mi felis ullamcorper molestie. Natoque cu-"
317.01,286.07,561.86,294.91,"/F8",9.96,"rae urna eget suscipit vulputate. Nonummy lacus enim"
317.01,274.11,561.82,282.96,"/F8",9.96,"dapibus ante ut facilisi vivamus quam porttitor platea vi-"
317.01,262.16,561.83,271.00,"/F8",9.96,"tae parturient. Nonummy proin. Pretium vitae vestibu-"
317.01,250.20,561.84,259.05,"/F8",9.96,"lum condimentum cursus id eu elit id ante faucibus justo"
317.01,238.25,561.82,247.09,"/F8",9.96,"cubilia. Blandit purus. Aliquet etiam vitae ullamcorper"
317.01,226.29,561.85,235.14,"/F8",9.96,"enim lectus non. Potenti fusce natoque at ut mi. Ali-"
317.01,214.34,561.92,223.18,"/F8",9.96,"quam magna urna leo class. Conubia donec cras etiam"
317.01,202.38,561.87,211.23,"/F8",9.96,"in. Conubia nulla est urna augue vehicula dolor ac ornare"
317.01,190.42,367.35,199.27,"/F8",9.96,"sollicitudin."
326.98,178.17,561.87,187.01,"/F8",9.96,"Posuere augue. Conubia felis proin libero cubilia mau-"
317.01,166.21,561.82,175.06,"/F8",9.96,"ris neque tristique. Aliquet dolor quam dictum rutrum"
317.01,154.26,561.86,163.10,"/F8",9.96,"nisi condimentum. Iaculis dolor arcu fermentum tempor"
317.01,142.30,561.86,151.15,"/F8",9.96,"curae at consectetuer. Pretium fusce. Conubia neque"
317.01,130.35,561.87,139.19,"/F8",9.96,"cras at sapien dis leo in nunc quam curabitur cras non."
317.01,118.39,561.88,127.24,"/F8",9.96,"Iaculis morbi urna a cras ut fames. Aliquet justo et"
