37.61,748.78,288.39,757.62,"/F8",9.96,"pulvinar. Potenti neque. Cubilia augue adipiscing in port-"
37.61,736.82,288.43,745.67,"/F8",9.96,"titor ante. Gravida class nunc venenatis litora accumsan"
37.61,724.87,288.45,733.71,"/F8",9.96,"in nulla. Commodo magna parturient ultrices. Euismod"
37.61,712.91,288.39,721.76,"/F8",9.96,"nulla purus metus suscipit morbi quis quisque et. Viverra"
37.61,700.96,288.44,709.80,"/F8",9.96,"lacus. Blandit fames proin mattis congue metus ullamcor-"
37.61,689.00,288.46,697.85,"/F8",9.96,"per amet dictum. Cubilia nulla. Nonummy massa nibh"
37.61,677.04,288.41,685.89,"/F8",9.96,"eget erat parturient hendrerit nisl feugiat mi eget. Non-"
37.61,665.09,119.74,673.94,"/F8",9.96,"ummy augue pede."
52.56,653.13,288.47,661.98,"/F8",9.96,"Rhoncus fames in sem in semper phasellus ligula ul-"
37.61,641.18,288.40,650.03,"/F8",9.96,"trices suspendisse ultrices hymenaeos dis. Iaculis nulla."
37.61,629.22,288.40,638.07,"/F8",9.96,"Lacinia neque risus turpis vehicula justo. Blandit lorem."
37.61,617.27,288.41,626.11,"/F8",9.96,"Viverra felis. Vivamus justo. Conubia felis sit primis."
37.61,605.31,288.44,614.16,"/F8",9.96,"Lacinia felis duis leo pretium eu. Nonummy morbi nisi"
37.61,593.36,288.42,602.20,"/F8",9.96,"quisque ut orci purus. Conubia donec urna eu consectetuer"
37.61,581.40,288.45,590.25,"/F8",9.96,"rhoncus magna. Aliquam fusce eni parturient. Nonummy"
37.61,569.45,288.40,578.29,"/F8",9.96,"netus ut ipsum mi pede habitasse ultrices. Potenti morbi"
37.61,557.49,288.43,566.34,"/F8",9.96,"sit nostra a adipiscing. Dapibus massa nibh habitasse est"
37.61,545.54,288.46,554.38,"/F8",9.96,"pharetra risus a luctus diam nunc. Commodo netus massa"
37.61,533.58,288.37,542.43,"/F8",9.96,"suscipit in nec erat a duis at felis mollis quis libero parturi-"
37.61,521.63,288.40,530.47,"/F8",9.96,"ent sollicitudin. Egestas etiam aliquet mi eu at. Dapibus"
37.61,509.67,288.39,518.52,"/F8",9.96,"proin class dui hendrerit rutrum inceptos parturient tem-"
37.61,497.72,288.40,506.56,"/F8",9.96,"pus in sagittis tellus arcu. Vivamus proin. Blandit proin"
37.61,485.76,288.46,494.61,"/F8",9.96,"diam euismod vel ridiculus odio cras. Egestas magna par-"
37.61,473.81,288.40,482.65,"/F8",9.96,"turient praesent nisl iaculis ad magnis venenatis inceptos"
37.61,461.85,288.42,470.70,"/F8",9.96,"pede. Egestas dolor et primis eni. Vivamus vitae per enim"
37.61,449.90,101.21,458.74,"/F8",9.96,"elit gravida in."
37.61,427.48,211.65,436.33,"/F27",9.96,"3.1. Blandit etiam dolor congue cubilia."
52.56,414.03,288.42,422.88,"/F8",9.96,"Feugiat purus nam nisi sollicitudin pharetra. Posuere"
37.61,402.08,288.47,410.92,"/F8",9.96,"justo ad a arcu vestibulum eni. Commodo etiam ipsum"
37.61,390.12,288.40,398.97,"/F8",9.96,"lobortis facilisis vitae dui enim dui integer. Sodales ne-"
37.61,378.17,288.44,387.01,"/F8",9.96,"tus adipiscing eros. Natoque porta fusce montes ve euis-"
37.61,366.21,288.41,375.06,"/F8",9.96,"mod et habitant per libero aliquet integer erat eu. Sodales"
37.61,354.26,288.47,363.10,"/F8",9.96,"neque. Rhoncus fusce ad et ut nisi aliquam. Commodo"
37.61,342.30,288.43,351.15,"/F8",9.96,"class neque vehicula. Commodo lorem purus justo sit nisi"
37.61,330.34,288.43,339.19,"/F8",9.96,"a nibh. Euismod nulla nunc vitae. Dapibus ipsum nibh"
37.61,318.39,288.47,327.24,"/F8",9.96,"mi enim eros eget ante sodales ad quis. Natoque lacus ad"
37.61,306.43,288.41,315.28,"/F8",9.96,"tempus. Pretium morbi hac quam lobortis volutpat felis."
37.61,294.48,288.41,303.33,"/F8",9.96,"Gravida neque dis urna libero et. Aliquam purus eni nasce-"
37.61,282.52,288.42,291.37,"/F8",9.96,"tur rhoncus netus ante. Lacinia vitae eu augue ve vehicula"
37.61,270.57,288.44,279.42,"/F8",9.96,"arcu phasellus auctor. Viverra dolor duis hymenaeos mi."
37.61,258.61,288.44,267.46,"/F8",9.96,"Euismod vitae. Conubia nulla. Lacinia fames. Aliquet"
37.61,246.66,226.41,255.51,"/F8",9.96,"metus. Potenti proin duis natoque et ut et."
52.56,234.70,288.45,243.55,"/F8",9.96,"Vivamus ipsum ac cursus aliquam cras. Dapibus velit"
37.61,222.75,288.44,231.60,"/F8",9.96,"vestibulum molestie amet posuere. Aliquam proin diam"
37.61,210.79,288.45,219.64,"/F8",9.96,"nam a cursus amet turpis. Sodales purus quis at metus"
37.61,198.84,288.41,207.68,"/F8",9.96,"venenatis neque porta. Cubilia vitae quis rhoncus elemen-"
37.61,186.88,288.42,195.73,"/F8",9.96,"tum cras potenti. Euismod curae in neque semper felis par-"
37.61,174.93,288.42,183.77,"/F8",9.96,"turient suspendisse ligula ad accumsan praesent. Posuere"
37.61,162.97,288.49,171.82,"/F8",9.96,"metus ac magnis augue eget. Natoque donec et semper"
37.61,151.02,288.42,159.86,"/F8",9.96,"volutpat orci nonummy justo. Aliquam velit lacus. Eges-"
37.61,139.06,288.38,147.91,"/F8",9.96,"tas dolor felis pretium integer sollicitudin penatibus dolor"
37.61,127.11,288.40,135.95,"/F8",9.96,"in convallis magna. Euismod fusce vestibulum ultrices nisi"
37.61,115.15,288.38,124.00,"/F8",9.96,"ligula eu aptent facilisi class vel litora. Gravida justo. Ali-"
37.61,103.20,288.39,112.04,"/F8",9.96,"quam purus. Potenti risus dis justo arcu vel fusce fringilla"
37.61,91.24,288.41,100.09,"/F8",9.96,"non hac. Posuere fusce parturient placerat elit libero mi"
37.61,79.29,288.43,88.13,"/F8",9.96,"in venenatis pede sed. Aliquam massa ut vitae penatibus"
306.60,748.78,557.47,757.62,"/F8",9.96,"augue mi. Sodales massa dapibus eni mi a. Laoreet morbi"
306.60,736.82,557.41,745.67,"/F8",9.96,"pede amet facilisis nibh condimentum. Egestas netus dis"
306.60,724.87,557.40,733.71,"/F8",9.96,"dolor tristique. Sodales class metus luctus mollis sodales"
306.60,712.91,557.48,721.76,"/F8",9.96,"ad at. Viverra augue. Conubia ipsum hac odio a fusce"
306.60,700.95,417.27,709.80,"/F8",9.96,"pretium in dapibus amet."
306.60,677.04,395.91,685.89,"/F27",9.96,"3.2. Commodo velit."
321.55,662.10,557.42,670.95,"/F8",9.96,"Laoreet vitae lorem sit. Posuere risus felis cursus odio"
306.60,650.15,558.72,658.99,"/F8",9.96,"cras volutpat posuere pede ve nec scelerisque iaculis. Conu-"
306.60,638.19,557.42,647.04,"/F8",9.96,"bia ipsum ve cras ultrices dis ad nunc congue litora. Ali-"
306.60,626.23,557.40,635.08,"/F8",9.96,"quet morbi mi fusce varius ve ridiculus etiam primis massa"
306.60,614.28,557.43,623.13,"/F8",9.96,"dignissim. Rhoncus purus duis vitae elementum. Non-"
306.60,602.32,557.44,611.17,"/F8",9.96,"ummy vitae. Dapibus fames. Laoreet curae at primis cu-"
306.60,590.37,557.44,599.22,"/F8",9.96,"rae condimentum. Natoque lorem cubilia maecenas sollic-"
306.60,578.41,557.43,587.26,"/F8",9.96,"itudin egestas montes netus ipsum. Conubia metus enim"
306.60,566.46,557.43,575.31,"/F8",9.96,"sagittis a pellentesque diam ipsum at maecenas. Integer"
306.60,554.50,557.42,563.35,"/F8",9.96,"class at congue phasellus parturient cum porta habitasse."
306.60,542.55,557.43,551.39,"/F8",9.96,"Egestas etiam dui arcu primis in sem amet nisl. Viverra"
306.60,530.59,557.40,539.44,"/F8",9.96,"augue in. Quisque vitae elit vel cum. Pretium curae nec"
306.60,518.64,557.39,527.48,"/F8",9.96,"urna parturient odio ligula mattis interdum suspendisse."
306.60,506.68,557.41,515.53,"/F8",9.96,"Sodales vitae proin sociosqu sit sodales elit id. Euismod"
306.60,494.73,557.43,503.57,"/F8",9.96,"proin augue rhoncus blandit posuere cras dictumst est"
306.60,482.77,557.46,491.62,"/F8",9.96,"urna quis quam aliquam consequat quis. Commodo class"
306.60,470.82,557.41,479.66,"/F8",9.96,"metus ante scelerisque consectetuer gravida nunc id vi-"
306.60,458.86,557.44,467.71,"/F8",9.96,"tae. Posuere class cras sem lacus quisque cursus et eros"
306.60,446.91,557.43,455.75,"/F8",9.96,"massa urna. Pretium curae nunc litora tempor phasellus"
306.60,434.95,557.40,443.80,"/F8",9.96,"lectus per inceptos blandit primis habitasse. Natoque me-"
306.60,423.00,557.38,431.84,"/F8",9.96,"tus. Cubilia lacus nisl vulputate litora metus curabitur"
306.60,411.04,521.64,419.89,"/F8",9.96,"vestibulum nam vestibulum parturient et mauris."
321.55,399.09,557.44,407.93,"/F8",9.96,"Laoreet fusce id curae facilisis congue. Posuere metus"
306.60,387.13,557.40,395.98,"/F8",9.96,"conubia dui convallis aenean lobortis elit nullam sagittis"
306.60,375.18,557.42,384.02,"/F8",9.96,"ante leo nec et pretium. Euismod nulla. Feugiat lorem."
306.60,363.22,557.43,372.07,"/F8",9.96,"Rhoncus donec. Gravida lorem urna nec. Potenti felis eu"
306.60,351.27,557.42,360.11,"/F8",9.96,"mauris pellentesque nam. Egestas augue. Quisque vitae"
306.60,339.31,557.41,348.16,"/F8",9.96,"eu mollis hac. Feugiat vitae. Gravida morbi class cursus."
306.60,327.36,557.39,336.20,"/F8",9.96,"Feugiat nulla. Quisque netus nec augue fringilla aliquet"
306.60,315.40,557.44,324.25,"/F8",9.96,"vitae dis ante sapien euismod. Aliquam ipsum. Laoreet"
306.60,303.45,557.40,312.29,"/F8",9.96,"ipsum mi phasellus parturient diam auctor penatibus. In-"
306.60,291.49,557.42,300.34,"/F8",9.96,"teger metus iaculis ligula mollis dolor sodales. Aliquam"
306.60,279.53,557.43,288.38,"/F8",9.96,"massa. Viverra netus duis per dictum ad. Quisque fames"
306.60,267.58,557.38,276.43,"/F8",9.96,"nunc libero nostra molestie nulla ut porta pellentesque ele-"
306.60,255.62,557.44,264.47,"/F8",9.96,"mentum fames fusce orci. Egestas fusce vivamus nec tem-"
306.60,243.67,557.45,252.52,"/F8",9.96,"por in elit duis. Commodo donec. Cubilia etiam arcu"
306.60,231.71,473.67,240.56,"/F8",9.96,"etiam at quis in quam torquent etiam."
306.60,201.83,487.48,210.67,"/F17",9.96,"4. Cubilia nulla massa velit facilisis."
321.55,180.90,557.43,189.75,"/F8",9.96,"Posuere morbi pede placerat in taciti. Gravida massa."
306.60,168.95,557.42,177.80,"/F8",9.96,"Lacinia lacus. Natoque justo nisi quisque proin non auctor"
306.60,156.99,557.39,165.84,"/F8",9.96,"pulvinar suspendisse est ut sagittis quam. Blandit justo"
306.60,145.04,557.43,153.89,"/F8",9.96,"curae vehicula quam mi. Conubia vitae hac libero sociosqu"
306.60,133.08,557.42,141.93,"/F8",9.96,"malesuada enim sed lobortis aliquam cubilia aliquet odio."
306.60,121.13,557.41,129.98,"/F8",9.96,"Potenti porta vitae. Integer vitae eget cubilia ad ve eget"
306.60,109.17,557.44,118.02,"/F8",9.96,"sed primis taciti magna. Aliquet etiam eu etiam. Iac-"
306.60,97.22,557.40,106.07,"/F8",9.96,"ulis lacus parturient at. Laoreet porta ad vulputate nisl"
306.60,85.26,557.47,94.11,"/F8",9.96,"diam sodales penatibus. Natoque magna ac porta id sem"
295.15,61.35,300.13,70.20,"/F8",9.96,"4"
