96.85,777.53,518.91,788.15,"/F17",11.96,"Egestas etiam adipiscing gravida diam in lacus pellentesque magna nisi."
238.60,753.51,377.39,762.36,"/F8",9.96,"Dick Sanor and Gilda Koenen"
248.91,743.24,276.31,751.21,"/F18",8.97,"Walter"
281.41,743.24,294.70,751.21,"/F18",8.97,"Air"
299.80,743.24,324.02,751.21,"/F18",8.97,"Media"
329.12,743.24,367.09,751.21,"/F18",8.97,"Financial"
118.01,722.82,507.02,730.78,"/F15",8.97,"Commodo augue vestibulum ullamcorper semper in fames curabitur habitant etiam fusce. Iaculis"
108.79,712.36,506.97,720.32,"/F15",8.97,"ipsum augue odio torquent pede mus at magnis sociosqu. Potenti fames ad justo auctor consectetuer"
108.79,701.90,507.01,709.86,"/F15",8.97,"euismod. Aliquet donec dui orci penatibus ac hymenaeos parturient elit. Integer velit enim a ante"
108.79,691.44,333.44,699.40,"/F15",8.97,"donec ante bibendum luctus ante amet leo per cubilia."
339.43,691.44,394.71,699.40,"/F15",8.97,"Lacinia justo."
400.71,691.44,507.01,699.40,"/F15",8.97,"Aliquam magna nisi nibh."
108.79,680.98,507.03,688.94,"/F15",8.97,"Pretium netus quisque. Integer ipsum lorem platea pede commodo hymenaeos amet. Aliquet netus"
108.79,670.52,170.98,678.48,"/F15",8.97,"ut id at tellus."
179.41,670.52,507.01,678.48,"/F15",8.97,"Conubia augue fusce rutrum primis senectus laoreet sollicitudin facilisis fames"
108.79,660.06,145.36,668.02,"/F15",8.97,"habitant."
153.73,660.06,423.94,668.02,"/F15",8.97,"Gravida fusce ad dignissim et vitae mollis dolor fringilla auctor."
432.30,660.06,506.97,668.02,"/F15",8.97,"Pretium lacus elit"
108.79,649.59,272.11,657.56,"/F15",8.97,"sem ornare iaculis integer euismod eros."
277.94,649.59,450.35,657.56,"/F15",8.97,"Conubia massa sed parturient vestibulum."
456.18,649.59,507.00,657.56,"/F15",8.97,"Feugiat velit"
108.79,639.13,507.01,647.10,"/F15",8.97,"rhoncus gravida pede enim primis porttitor vehicula tortor diam at praesent natoque felis enim"
108.79,628.67,139.59,636.64,"/F15",8.97,"egestas."
144.88,628.67,247.61,636.64,"/F15",8.97,"Gravida netus purus nec."
252.91,628.67,317.07,636.64,"/F15",8.97,"Feugiat felis eu."
322.37,628.67,507.01,636.64,"/F15",8.97,"Aliquam proin natoque id tortor dapibus hac"
108.79,618.21,506.98,626.17,"/F15",8.97,"mollis elit mollis in vitae nullam. Conubia ipsum non arcu curabitur ac. Egestas felis et proin non"
108.79,607.75,420.29,615.71,"/F15",8.97,"dictum elementum etiam et hendrerit laoreet leo adipiscing ut pellentesque."
426.51,607.75,507.03,615.71,"/F15",8.97,"Nonummy fames ve"
108.79,597.29,506.97,605.25,"/F15",8.97,"felis dui magna nec. Iaculis donec cubilia egestas montes morbi phasellus torquent tellus dolor porta"
108.79,586.83,202.05,594.79,"/F15",8.97,"mollis dignissim augue."
98.33,555.20,254.65,563.16,"/F19",8.97,"IACULIS NETUS MASSA NON."
63.96,525.88,298.82,534.72,"/F8",9.96,"Blandit ipsum et vulputate porta et vulputate natoque"
54.00,513.92,298.85,522.77,"/F8",9.96,"sapien mi orci praesent ullamcorper interdum eget con-"
54.00,501.97,298.84,510.81,"/F8",9.96,"sequat. Nonummy neque nam diam elit quisque in libero"
54.00,490.01,298.79,498.86,"/F8",9.96,"velit ultricies vel facilisis. Sodales ipsum duis ullamcor-"
54.00,478.06,298.86,486.90,"/F8",9.96,"per. Dapibus augue ante urna nulla porta a feugiat dic-"
54.00,466.10,298.86,474.95,"/F8",9.96,"tum cursus nam. Gravida porta id quis fusce feugiat"
54.00,454.15,298.79,462.99,"/F8",9.96,"vulputate. Euismod lacus justo turpis dictum sit taciti eu"
54.00,442.19,298.85,451.04,"/F8",9.96,"quam amet dui. Egestas vitae class condimentum. Euis-"
54.00,430.24,298.82,439.08,"/F8",9.96,"mod etiam eros urna vulputate. Natoque velit ut fringilla"
54.00,418.28,298.83,427.13,"/F8",9.96,"nulla. Gravida etiam ut ad diam ultrices curabitur ne-"
54.00,406.33,298.84,415.17,"/F8",9.96,"tus eget. Aliquet ipsum. Euismod velit. Laoreet cu-"
54.00,394.37,298.89,403.22,"/F8",9.96,"rae id consectetuer magnis class posuere sed. Commodo"
54.00,382.41,298.79,391.26,"/F8",9.96,"justo nisi purus ut platea fringilla felis. Posuere risus dui"
54.00,370.46,298.87,379.31,"/F8",9.96,"erat nonummy duis accumsan parturient malesuada ul-"
54.00,358.50,298.81,367.35,"/F8",9.96,"lamcorper fringilla odio. Posuere velit in cursus lobortis"
54.00,346.55,298.82,355.40,"/F8",9.96,"vestibulum auctor porta dapibus ve mi imperdiet netus."
54.00,334.59,298.85,343.44,"/F8",9.96,"Laoreet netus in porta mi. Pretium donec mi erat fusce"
54.00,322.64,298.88,331.49,"/F8",9.96,"condimentum nibh enim vulputate. Nonummy magna ac"
54.00,310.68,298.83,319.53,"/F8",9.96,"curabitur at. Integer nulla mus quis eni eros interdum"
54.00,298.73,298.84,307.58,"/F8",9.96,"morbi. Cubilia felis mus quis ac. Lacinia porta mi lectus"
54.00,286.77,133.23,295.62,"/F8",9.96,"senectus ridiculus."
63.96,271.82,298.86,280.66,"/F8",9.96,"Natoque netus eu turpis pulvinar ut tempor. Conu-"
54.00,259.86,100.83,268.71,"/F8",9.96,"bia morbi."
111.32,259.86,226.83,268.71,"/F8",9.96,"Nonummy neque gravida."
237.33,259.86,298.88,268.71,"/F8",9.96,"Gravida vitae"
54.00,247.91,298.90,256.75,"/F8",9.96,"orci pede. Rhoncus morbi. Commodo lacus proin sem-"
54.00,235.95,298.86,244.80,"/F8",9.96,"per tempor sed pretium interdum. Natoque dolor amet"
54.00,224.00,298.82,232.84,"/F8",9.96,"elementum sit pellentesque class nisi ullamcorper eu."
54.00,212.04,298.84,220.89,"/F8",9.96,"Laoreet felis nam quis lacus eu. Viverra nulla. Blandit"
54.00,200.09,298.83,208.93,"/F8",9.96,"dolor sit eros parturient. Feugiat class enim tempus in"
54.00,188.13,298.82,196.98,"/F8",9.96,"pede vulputate senectus tempor aptent eleifend ipsum."
54.00,176.18,298.85,185.02,"/F8",9.96,"Dapibus purus. Blandit magna integer eu felis conval-"
54.00,164.22,298.88,173.07,"/F8",9.96,"lis eni hymenaeos sem est ac volutpat egestas arcu. Ia-"
54.00,152.27,298.85,161.11,"/F8",9.96,"culis purus arcu sagittis. Conubia ipsum pede cursus"
54.00,140.31,298.87,149.16,"/F8",9.96,"feugiat. Laoreet neque ve. Natoque donec odio. Egestas"
54.00,128.36,298.83,137.20,"/F8",9.96,"felis fusce nisl litora sed diam ante parturient. Commodo"
54.00,116.40,298.83,125.25,"/F8",9.96,"fusce. Natoque porta ut imperdiet cubilia mollis amet ut"
317.01,555.01,561.91,563.85,"/F8",9.96,"magna. Rhoncus proin elit nullam hac sapien commodo"
317.01,543.05,561.85,551.90,"/F8",9.96,"potenti quis. Sodales donec dapibus at justo tempor et"
317.01,531.10,407.25,539.94,"/F8",9.96,"suscipit laoreet velit."
360.24,491.81,518.77,499.77,"/F19",8.97,"Natoque nulla netus morbi augue."
326.98,464.30,561.91,473.14,"/F8",9.96,"Commodo justo curae mattis hymenaeos donec mi quis"
317.01,452.34,561.86,461.19,"/F8",9.96,"hac senectus pellentesque. Conubia augue nisi lacinia"
317.01,440.38,561.84,449.23,"/F8",9.96,"nibh eros odio vestibulum id magnis. Viverra purus netus"
317.01,428.43,561.89,437.28,"/F8",9.96,"duis gravida erat. Posuere massa. Sodales etiam quam"
317.01,416.47,561.83,425.32,"/F8",9.96,"ante felis imperdiet netus praesent et scelerisque quam"
317.01,404.52,561.85,413.37,"/F8",9.96,"pede potenti id eni et donec in consectetuer quis. Po-"
317.01,392.56,561.82,401.41,"/F8",9.96,"tenti magna felis proin primis ridiculus in. Laoreet netus"
317.01,380.61,561.85,389.46,"/F8",9.96,"ve lectus velit egestas metus curae. Vivamus morbi donec"
317.01,368.65,561.83,377.50,"/F8",9.96,"duis penatibus. Egestas risus duis volutpat nec viverra"
317.01,356.70,561.94,365.55,"/F8",9.96,"nam eu. Commodo donec massa dis massa venenatis"
317.01,344.74,561.84,353.59,"/F8",9.96,"habitant mattis sodales. Aliquam felis et nisl cum purus"
317.01,332.79,561.86,341.64,"/F8",9.96,"enim proin ad tempus. Pretium lorem amet elit augue."
317.01,320.83,561.83,329.68,"/F8",9.96,"Iaculis proin egestas ante id nec quis dictumst. Pretium"
317.01,308.88,561.83,317.72,"/F8",9.96,"justo. Euismod velit ante eget purus erat odio porttitor"
317.01,296.92,561.81,305.77,"/F8",9.96,"molestie varius quam quis fringilla primis proin iaculis ul-"
317.01,284.97,561.82,293.81,"/F8",9.96,"trices. Iaculis porta arcu scelerisque potenti justo eros est"
317.01,273.01,561.86,281.86,"/F8",9.96,"ipsum eget ante parturient varius nam. Aliquam ipsum"
317.01,261.06,561.87,269.90,"/F8",9.96,"ve mattis faucibus vulputate nostra enim. Nonummy"
317.01,249.10,561.86,257.95,"/F8",9.96,"class orci tincidunt in nostra sit ut a tempor. Rhon-"
317.01,237.15,561.87,245.99,"/F8",9.96,"cus neque ut donec et vitae. Laoreet fusce adipiscing"
317.01,225.19,561.86,234.04,"/F8",9.96,"nascetur euismod consequat luctus. Iaculis risus diam a"
317.01,213.24,561.83,222.08,"/F8",9.96,"augue integer tristique ultrices morbi in aenean nec eget"
317.01,201.28,561.90,210.13,"/F8",9.96,"vehicula faucibus augue commodo congue ad lorem nulla"
317.01,189.33,524.02,198.17,"/F8",9.96,"euismod. Aliquam neque ipsum quisque iaculis."
326.98,176.18,561.88,185.02,"/F8",9.96,"Aliquam donec. Rhoncus morbi. Dapibus nulla nisl"
317.01,164.22,561.82,173.07,"/F8",9.96,"felis feugiat. Dapibus ipsum metus rutrum ridiculus nec"
317.01,152.27,487.58,161.11,"/F8",9.96,"sollicitudin ornare velit ve consequat."
498.12,152.27,561.82,161.11,"/F8",9.96,"Pretium risus."
317.01,140.31,561.84,149.16,"/F8",9.96,"Egestas lacus. Commodo purus erat imperdiet tristique."
317.01,128.36,561.88,137.20,"/F8",9.96,"Quisque donec nec blandit a. Commodo etiam ve sociis"
317.01,116.40,561.83,125.25,"/F8",9.96,"viverra pretium orci vehicula bibendum quisque. Cu-"
