557.11,803.82,562.09,812.67,"/F8",9.96,"2"
54.00,777.92,202.75,786.77,"/F8",9.96,"urna. Lacinia class non eleifend a."
63.96,765.48,298.85,774.33,"/F8",9.96,"Pretium porta justo augue ligula semper hendrerit."
54.00,753.53,186.57,762.38,"/F8",9.96,"Aliquam magna adipiscing in."
193.57,753.53,259.09,762.38,"/F8",9.96,"Blandit massa."
266.08,753.53,298.88,762.38,"/F8",9.96,"Laoreet"
54.00,741.57,298.81,750.42,"/F8",9.96,"netus mi proin mi duis. Euismod porta nisi porttitor ut."
54.00,729.62,298.83,738.47,"/F8",9.96,"Conubia morbi orci eleifend sollicitudin platea at aenean"
54.00,717.66,102.38,726.51,"/F8",9.96,"a pulvinar."
110.05,717.66,298.83,726.51,"/F8",9.96,"Egestas justo mi dolor mi sollicitudin pel-"
54.00,705.71,298.87,714.55,"/F8",9.96,"lentesque posuere auctor. Commodo donec eni duis eros"
54.00,693.75,121.63,702.60,"/F8",9.96,"mauris sodales."
130.11,693.75,222.67,702.60,"/F8",9.96,"Posuere purus ut id."
231.15,693.75,298.87,702.60,"/F8",9.96,"Cubilia magna."
54.00,681.80,121.85,690.64,"/F8",9.96,"Gravida metus."
128.64,681.80,298.83,690.64,"/F8",9.96,"Cubilia morbi quis scelerisque sodales."
54.00,669.84,298.83,678.69,"/F8",9.96,"Dapibus justo sem tempor odio fringilla cursus pulvinar"
54.00,657.89,298.80,666.73,"/F8",9.96,"vestibulum montes ut quis. Pretium justo mi facilisis in-"
54.00,645.93,298.89,654.78,"/F8",9.96,"teger congue proin nam nibh a arcu class. Conubia me-"
54.00,633.98,90.08,642.82,"/F8",9.96,"tus orci."
96.38,633.98,298.85,642.82,"/F8",9.96,"Euismod donec et venenatis mi curae at risus"
54.00,622.02,298.85,630.87,"/F8",9.96,"consequat facilisi eget sapien ac. Iaculis augue. Egestas"
54.00,610.07,189.25,618.91,"/F8",9.96,"etiam ac ad cum amet platea."
196.85,610.07,298.88,618.91,"/F8",9.96,"Viverra purus urna ut."
54.00,598.11,120.83,606.96,"/F8",9.96,"Dapibus etiam."
126.97,598.11,298.85,606.96,"/F8",9.96,"Iaculis curae eu enim eu vitae eu vitae"
54.00,586.16,261.58,595.00,"/F8",9.96,"ac. Conubia justo nam erat lobortis sed aptent."
63.96,573.72,101.01,582.57,"/F8",9.96,"Aliquam"
106.84,573.72,135.64,582.57,"/F8",9.96,"ipsum."
147.60,573.72,184.37,582.57,"/F8",9.96,"Natoque"
190.20,573.72,210.23,582.57,"/F8",9.96,"risus"
216.06,573.72,232.12,582.57,"/F8",9.96,"orci"
237.96,573.72,274.22,582.57,"/F8",9.96,"tristique"
280.06,573.72,298.87,582.57,"/F8",9.96,"nam"
54.00,561.76,298.82,570.61,"/F8",9.96,"sagittis iaculis aliquam duis eget cras curabitur cras sed."
54.00,549.81,298.85,558.66,"/F8",9.96,"Gravida justo magna aptent purus pulvinar habitasse ac-"
54.00,537.85,298.87,546.70,"/F8",9.96,"cumsan congue nisi hymenaeos volutpat nunc dictum."
54.00,525.90,116.43,534.74,"/F8",9.96,"Conubia velit."
124.85,525.90,298.85,534.74,"/F8",9.96,"Conubia lorem ac taciti dolor quis hy-"
54.00,513.94,165.49,522.79,"/F8",9.96,"menaeos mollis pulvinar."
175.64,513.94,298.87,522.79,"/F8",9.96,"Rhoncus felis urna conubia"
54.00,501.99,298.85,510.83,"/F8",9.96,"quisque etiam. Lacinia felis eros condimentum nonummy"
54.00,490.03,298.83,498.88,"/F8",9.96,"eni torquent metus. Cubilia neque ac nibh ac nulla fusce"
54.00,478.08,244.42,486.92,"/F8",9.96,"sem eni mi blandit nisi suscipit cum nisi."
254.05,478.08,298.85,486.92,"/F8",9.96,"Nonummy"
54.00,466.12,298.84,474.97,"/F8",9.96,"lorem duis lacinia proin diam sem erat felis rutrum dig-"
54.00,454.17,202.00,463.01,"/F8",9.96,"nissim curae ve fermentum ante."
211.36,454.17,298.86,463.01,"/F8",9.96,"Viverra fames duis."
54.00,442.21,116.85,451.06,"/F8",9.96,"Lacinia purus."
123.40,442.21,298.85,451.06,"/F8",9.96,"Aliquam felis urna nec non potenti luc-"
54.00,430.26,230.71,439.10,"/F8",9.96,"tus arcu magnis ac inceptos vivamus id."
236.69,430.26,298.86,439.10,"/F8",9.96,"Aliquam nulla"
54.00,418.30,198.08,427.15,"/F8",9.96,"id ornare ridiculus sed quis dis."
207.33,418.30,298.86,427.15,"/F8",9.96,"Egestas magna class"
54.00,406.35,117.84,415.19,"/F8",9.96,"sodales eu dis."
124.47,406.35,298.84,415.19,"/F8",9.96,"Viverra nulla adipiscing at taciti lobor-"
54.00,394.39,298.88,403.24,"/F8",9.96,"tis hymenaeos hac morbi auctor ornare hac adipiscing"
54.00,382.44,161.61,391.28,"/F8",9.96,"parturient ve imperdiet."
170.61,382.44,298.81,391.28,"/F8",9.96,"Aliquet metus neque dictum"
54.00,370.48,298.85,379.33,"/F8",9.96,"eros. Commodo justo erat et pellentesque mauris ut var-"
54.00,358.53,173.92,367.37,"/F8",9.96,"ius lorem ac ligula ve arcu."
179.91,358.53,245.23,367.37,"/F8",9.96,"Vivamus justo."
251.21,358.53,298.86,367.37,"/F8",9.96,"Feugiat ip-"
54.00,346.57,298.90,355.42,"/F8",9.96,"sum eni quam. Commodo class orci at hymenaeos metus"
54.00,334.62,199.65,343.46,"/F8",9.96,"a mauris massa facilisis eu quis."
208.32,334.62,298.89,343.46,"/F8",9.96,"Rhoncus massa duis"
54.00,322.66,229.54,331.51,"/F8",9.96,"arcu. Nonummy augue ante cursus mus."
62.54,287.16,290.42,295.13,"/F19",8.97,"Viverra massa vitae pharetra morbi orci pretium"
155.70,276.70,197.35,284.66,"/F19",8.97,"curae ve."
63.96,249.90,298.83,258.75,"/F8",9.96,"Sodales justo erat per felis parturient. Aliquam proin"
54.00,237.94,88.90,246.79,"/F8",9.96,"ac arcu."
95.07,237.94,183.86,246.79,"/F8",9.96,"Dapibus neque eros."
190.04,237.94,298.90,246.79,"/F8",9.96,"Natoque magna nec cras"
54.00,225.99,298.80,234.84,"/F8",9.96,"hendrerit ultrices pharetra sollicitudin adipiscing com-"
54.00,214.03,106.67,222.88,"/F8",9.96,"modo nunc."
116.48,214.03,173.60,222.88,"/F8",9.96,"Iaculis nulla."
183.40,214.03,298.88,222.88,"/F8",9.96,"Aliquam magna id netus."
54.00,202.08,256.39,210.93,"/F8",9.96,"Aliquet proin et etiam turpis quam ridiculus."
263.65,202.08,298.81,210.93,"/F8",9.96,"Quisque"
54.00,190.12,80.01,198.97,"/F8",9.96,"curae."
88.25,190.12,298.84,198.97,"/F8",9.96,"Blandit porta lacus velit rhoncus odio pretium"
54.00,178.17,298.86,187.02,"/F8",9.96,"nisi. Vivamus magna donec nulla natoque lectus morbi."
54.00,166.21,298.82,175.06,"/F8",9.96,"Conubia lacus leo orci vel elit sociis vestibulum sollici-"
54.00,154.26,79.97,163.11,"/F8",9.96,"tudin."
87.89,154.26,234.33,163.11,"/F8",9.96,"Gravida porta enim sit euismod."
242.25,154.26,298.83,163.11,"/F8",9.96,"Aliquet risus"
54.00,142.30,298.83,151.15,"/F8",9.96,"ac mi facilisis felis. Aliquam ipsum. Laoreet netus. Eu-"
54.00,130.35,298.85,139.20,"/F8",9.96,"ismod ipsum dis aliquam nisi vestibulum eu hymenaeos"
54.00,118.39,298.82,127.24,"/F8",9.96,"adipiscing duis. Quisque etiam id non diam dolor fringilla"
317.01,777.92,561.81,786.77,"/F8",9.96,"ultricies adipiscing duis tristique diam condimentum eu-"
317.01,765.96,561.84,774.81,"/F8",9.96,"ismod cum nunc class interdum urna ridiculus. Quisque"
317.01,754.01,561.88,762.86,"/F8",9.96,"vitae nibh sapien blandit commodo aptent nisi magna"
317.01,742.05,561.91,750.90,"/F8",9.96,"malesuada eros pede natoque urna. Commodo risus cras"
317.01,730.10,394.51,738.94,"/F8",9.96,"sit cras senectus."
405.34,730.10,471.12,738.94,"/F8",9.96,"Cubilia metus."
481.95,730.10,561.85,738.94,"/F8",9.96,"Blandit proin dui"
317.01,718.14,399.23,726.99,"/F8",9.96,"nisi elementum at."
406.23,718.14,561.84,726.99,"/F8",9.96,"Quisque dolor ut imperdiet a vitae"
317.01,706.19,392.87,715.03,"/F8",9.96,"quisque ridiculus."
326.98,693.93,419.25,702.78,"/F8",9.96,"Viverra porta quam."
428.01,693.93,494.88,702.78,"/F8",9.96,"Euismod nulla."
503.63,693.93,561.88,702.78,"/F8",9.96,"Feugiat nulla"
317.01,681.98,337.47,690.82,"/F8",9.96,"eget."
344.67,681.98,492.11,690.82,"/F8",9.96,"Blandit augue quam facilisis nec."
499.31,681.98,561.88,690.82,"/F8",9.96,"Egestas augue"
317.01,670.02,561.84,678.87,"/F8",9.96,"nec turpis a euismod cursus sed rutrum vivamus. Viverra"
317.01,658.07,457.82,666.91,"/F8",9.96,"curae dis vivamus massa in ad."
465.78,658.07,561.92,666.91,"/F8",9.96,"Nonummy porta nam"
317.01,646.11,449.13,654.96,"/F8",9.96,"odio nulla maecenas eros vel."
457.96,646.11,561.90,654.96,"/F8",9.96,"Euismod augue id nos-"
317.01,634.16,409.36,643.00,"/F8",9.96,"tra augue vulputate."
418.31,634.16,561.84,643.00,"/F8",9.96,"Viverra class lorem risus facilisi"
317.01,622.20,561.84,631.05,"/F8",9.96,"eni duis ve consectetuer integer metus rhoncus urna et."
317.01,610.25,561.85,619.09,"/F8",9.96,"Integer risus at ac lorem. Gravida felis et habitasse par-"
317.01,598.29,561.84,607.14,"/F8",9.96,"turient rhoncus ante nascetur condimentum vel dictum"
317.01,586.34,561.86,595.18,"/F8",9.96,"quisque hac ut. Pretium vitae nunc nonummy at conse-"
317.01,574.38,339.40,583.23,"/F8",9.96,"quat."
346.40,574.38,561.83,583.23,"/F8",9.96,"Rhoncus velit odio quam taciti tincidunt feugiat"
317.01,562.42,561.80,571.27,"/F8",9.96,"primis ut nunc vehicula turpis. Viverra justo in ridiculus"
317.01,550.47,400.65,559.32,"/F8",9.96,"a lorem et tempus."
406.79,550.47,561.87,559.32,"/F8",9.96,"Viverra augue cras pulvinar morbi."
317.01,538.51,506.42,547.36,"/F8",9.96,"Rhoncus neque ad magna ridiculus mauris."
511.97,538.51,561.88,547.36,"/F8",9.96,"Viverra au-"
317.01,526.56,561.87,535.41,"/F8",9.96,"gue nibh nonummy ut sapien gravida vivamus donec nulla"
317.01,514.60,361.87,523.45,"/F8",9.96,"accumsan."
370.77,514.60,492.17,523.45,"/F8",9.96,"Iaculis nulla porta lacus a."
501.07,514.60,561.88,523.45,"/F8",9.96,"Potenti lorem"
317.01,502.65,523.65,511.50,"/F8",9.96,"mi nisl nunc potenti dui torquent pellentesque."
529.33,502.65,561.80,511.50,"/F8",9.96,"Blandit"
317.01,490.69,561.84,499.54,"/F8",9.96,"porta. Integer purus nam potenti elit nam tellus aliquam"
317.01,478.74,507.41,487.59,"/F8",9.96,"semper leo ac tempor. Vivamus vitae diam."
326.98,466.48,394.88,475.33,"/F8",9.96,"Pretium donec."
403.47,466.48,466.61,475.33,"/F8",9.96,"Viverra netus."
475.21,466.48,561.88,475.33,"/F8",9.96,"Aliquet massa ut a"
317.01,454.53,561.86,463.37,"/F8",9.96,"nibh dolor scelerisque sociosqu. Natoque lacus quam cras"
317.01,442.57,449.24,451.42,"/F8",9.96,"viverra at vulputate proin et."
456.99,442.57,522.44,451.42,"/F8",9.96,"Laoreet morbi."
530.19,442.57,561.85,451.42,"/F8",9.96,"Lacinia"
317.01,430.62,561.86,439.46,"/F8",9.96,"neque euismod vel mi felis habitasse faucibus dolor cu-"
317.01,418.66,561.85,427.51,"/F8",9.96,"bilia aptent ve senectus ligula. Conubia ipsum pede pu-"
317.01,406.71,561.83,415.55,"/F8",9.96,"rus arcu. Quisque justo mi aptent consectetuer leo. Ali-"
317.01,394.75,561.87,403.60,"/F8",9.96,"quam nulla magna quisque enim sed consectetuer montes"
317.01,382.80,561.83,391.64,"/F8",9.96,"at vehicula. Blandit neque at aptent pretium amet. Viva-"
317.01,370.84,561.85,379.69,"/F8",9.96,"mus neque parturient volutpat quam urna nibh morbi po-"
317.01,358.89,561.84,367.73,"/F8",9.96,"tenti cursus nunc euismod. Vivamus lorem in mi portti-"
317.01,346.93,561.82,355.78,"/F8",9.96,"tor morbi mi lacus eni vestibulum ad sollicitudin. Viverra"
317.01,334.98,492.76,343.82,"/F8",9.96,"purus ve augue enim mollis maecenas."
502.99,334.98,561.89,343.82,"/F8",9.96,"Cubilia dolor"
317.01,323.02,561.89,331.87,"/F8",9.96,"arcu quam porta iaculis egestas nostra lacus augue in-"
317.01,311.07,445.38,319.91,"/F8",9.96,"teger pulvinar elit blandit a."
453.38,311.07,561.84,319.91,"/F8",9.96,"Posuere massa justo elit"
317.01,299.11,561.83,307.96,"/F8",9.96,"a vitae ut nunc nisl lacinia. Pretium velit eros nunc na-"
317.01,287.16,561.81,296.00,"/F8",9.96,"toque. Sodales vitae viverra tincidunt senectus morbi sol-"
317.01,275.20,477.10,284.05,"/F8",9.96,"licitudin dignissim lectus parturient."
483.60,275.20,561.82,284.05,"/F8",9.96,"Feugiat fusce sem"
317.01,263.24,338.29,272.09,"/F8",9.96,"ante."
345.86,263.24,561.86,272.09,"/F8",9.96,"Blandit massa eros penatibus id felis eget purus"
317.01,251.29,392.74,260.14,"/F8",9.96,"fusce cum tortor."
399.05,251.29,494.22,260.14,"/F8",9.96,"Integer netus sodales."
500.53,251.29,561.87,260.14,"/F8",9.96,"Vivamus class"
317.01,239.33,537.31,248.18,"/F8",9.96,"ac nulla mi consectetuer laoreet porta dapibus ac."
542.94,239.33,561.86,248.18,"/F8",9.96,"Feu-"
317.01,227.38,363.21,236.23,"/F8",9.96,"giat porta."
406.05,192.84,473.00,200.80,"/F19",8.97,"Euismod velit."
326.98,166.21,561.87,175.06,"/F8",9.96,"Commodo felis justo quisque placerat tellus lorem mi"
317.01,154.26,561.85,163.10,"/F8",9.96,"ac pede pretium porttitor. Viverra massa lorem faucibus"
317.01,142.30,561.87,151.15,"/F8",9.96,"non dictum. Cubilia lorem augue aenean. Egestas lorem."
317.01,130.35,561.83,139.19,"/F8",9.96,"Natoque proin. Integer risus integer porttitor sit accum-"
317.01,118.39,561.85,127.24,"/F8",9.96,"san quisque quam consectetuer facilisi curae metus fames"
