557.11,803.82,562.09,812.67,"/F8",9.96,"5"
54.00,777.92,298.85,786.77,"/F8",9.96,"ante quis leo ipsum natoque sem faucibus hendrerit a."
54.00,765.96,298.87,774.81,"/F8",9.96,"Aliquam nulla dis luctus donec hymenaeos nam. Egestas"
54.00,754.01,298.84,762.86,"/F8",9.96,"morbi in augue ve augue vulputate. Gravida ipsum purus"
54.00,742.05,298.86,750.90,"/F8",9.96,"erat feugiat. Nonummy ipsum purus aenean per nascetur"
54.00,730.10,298.80,738.95,"/F8",9.96,"curabitur. Aliquet neque ut risus aptent at primis porta"
54.00,718.14,298.84,726.99,"/F8",9.96,"aliquet semper sed. Dapibus donec id lacus libero est"
54.00,706.19,298.84,715.03,"/F8",9.96,"nostra ut erat. Aliquam lorem est nibh consectetuer eu-"
54.00,694.23,298.85,703.08,"/F8",9.96,"ismod volutpat. Vivamus justo cras dapibus at ad rutrum"
54.00,682.28,298.86,691.12,"/F8",9.96,"et interdum varius. Quisque metus mi eu magna curae"
54.00,670.32,298.87,679.17,"/F8",9.96,"eget cras. Posuere morbi duis litora. Gravida magna."
54.00,658.37,298.85,667.21,"/F8",9.96,"Pretium class odio nec montes. Feugiat risus. Posuere"
54.00,646.41,298.86,655.26,"/F8",9.96,"purus ut. Sodales curae ve tortor lobortis lorem con-"
54.00,634.46,298.82,643.30,"/F8",9.96,"sectetuer molestie. Iaculis netus dui. Blandit etiam eu"
54.00,622.50,298.83,631.35,"/F8",9.96,"sapien neque feugiat posuere diam et. Quisque ipsum est"
54.00,610.55,298.87,619.39,"/F8",9.96,"arcu ante hymenaeos vehicula magnis vivamus. Egestas"
54.00,598.59,298.92,607.44,"/F8",9.96,"dolor odio eni. Rhoncus netus. Commodo massa mus"
54.00,586.64,142.81,595.48,"/F8",9.96,"litora gravida quam."
141.17,551.88,211.84,559.84,"/F19",8.97,"Rhoncus proin."
63.96,525.21,298.86,534.06,"/F8",9.96,"Lacinia fusce justo mattis neque non enim imperdiet"
54.00,513.26,298.84,522.10,"/F8",9.96,"odio sollicitudin. Natoque etiam adipiscing nibh donec"
54.00,501.30,93.52,510.15,"/F8",9.96,"habitant."
103.69,501.30,225.88,510.15,"/F8",9.96,"Posuere neque velit massa."
236.06,501.30,298.86,510.15,"/F8",9.96,"Conubia fusce"
54.00,489.35,298.86,498.19,"/F8",9.96,"donec. Euismod purus nibh nam porta elementum adip-"
54.00,477.39,298.82,486.24,"/F8",9.96,"iscing orci. Quisque dolor diam duis donec ultricies. Eu-"
54.00,465.44,298.83,474.28,"/F8",9.96,"ismod risus vestibulum condimentum. Pretium morbi."
54.00,453.48,298.83,462.33,"/F8",9.96,"Quisque neque. Blandit ipsum nisl neque magna tellus"
54.00,441.53,298.86,450.37,"/F8",9.96,"neque eu. Lacinia ipsum ad venenatis a penatibus lacus"
54.00,429.57,298.84,438.42,"/F8",9.96,"praesent ve tortor. Quisque vitae. Natoque morbi amet"
54.00,417.61,298.83,426.46,"/F8",9.96,"a nibh vitae at porttitor nisl hac eros cubilia nullam non"
54.00,405.66,298.82,414.51,"/F8",9.96,"bibendum. Conubia fames natoque tincidunt id et ridicu-"
54.00,393.70,298.84,402.55,"/F8",9.96,"lus fusce platea. Egestas felis enim molestie adipiscing"
54.00,381.75,298.83,390.60,"/F8",9.96,"turpis sagittis dignissim. Rhoncus class dolor inceptos at"
54.00,369.79,298.83,378.64,"/F8",9.96,"taciti dapibus elementum cras. Quisque class pede vel a."
54.00,357.84,298.85,366.68,"/F8",9.96,"Iaculis metus purus a erat vitae mauris sapien vehicula"
54.00,345.88,298.87,354.73,"/F8",9.96,"proin magna netus. Integer felis. Cubilia dolor massa"
54.00,333.93,298.84,342.77,"/F8",9.96,"cubilia montes vel ante diam sit rhoncus. Gravida lorem"
54.00,321.97,298.83,330.82,"/F8",9.96,"ac eget netus. Dapibus porta eni parturient adipiscing"
54.00,310.02,66.16,318.86,"/F8",9.96,"ac."
63.96,297.72,298.90,306.57,"/F8",9.96,"Commodo curae justo luctus odio ante class ad sociis"
54.00,285.77,298.85,294.61,"/F8",9.96,"sollicitudin dis donec. Commodo class ac venenatis donec"
54.00,273.81,298.82,282.66,"/F8",9.96,"nisi natoque tristique. Integer magna rhoncus vulputate"
54.00,261.85,298.84,270.70,"/F8",9.96,"id hymenaeos a facilisis. Aliquam risus. Aliquet fames"
54.00,249.90,298.85,258.75,"/F8",9.96,"id nisl bibendum a consectetuer quam egestas. Aliquam"
54.00,237.94,298.87,246.79,"/F8",9.96,"fames nunc gravida netus eget per nullam euismod eges-"
54.00,225.99,298.85,234.84,"/F8",9.96,"tas. Conubia fusce proin aptent morbi ullamcorper in-"
54.00,214.03,298.82,222.88,"/F8",9.96,"ceptos fermentum habitant ultrices justo imperdiet non"
54.00,202.08,298.85,210.93,"/F8",9.96,"habitasse erat. Aliquam netus risus amet per laoreet."
54.00,190.12,298.82,198.97,"/F8",9.96,"Viverra purus. Iaculis felis ac per nunc vestibulum dui"
54.00,178.17,127.61,187.01,"/F8",9.96,"ipsum tincidunt."
137.99,178.17,265.26,187.01,"/F8",9.96,"Gravida massa enim platea."
275.64,178.17,298.86,187.01,"/F8",9.96,"Viva-"
54.00,166.21,298.85,175.06,"/F8",9.96,"mus nulla. Viverra lorem id tempus eros fames in litora"
54.00,154.26,298.82,163.10,"/F8",9.96,"venenatis phasellus adipiscing per parturient. Rhoncus"
54.00,142.30,298.87,151.15,"/F8",9.96,"fames nam parturient ad bibendum duis congue. Rhon-"
54.00,130.35,298.86,139.19,"/F8",9.96,"cus class ac. Blandit nulla ad. Conubia neque odio sed."
54.00,118.39,298.83,127.24,"/F8",9.96,"Blandit netus morbi rhoncus phasellus facilisi ut. Po-"
317.01,777.92,561.81,786.77,"/F8",9.96,"tenti vitae eget vulputate litora augue dolor libero velit"
317.01,765.96,561.88,774.81,"/F8",9.96,"proin faucibus. Lacinia dolor velit nullam commodo po-"
317.01,754.01,561.84,762.86,"/F8",9.96,"tenti nunc convallis nullam vehicula cum. Commodo velit"
317.01,742.05,535.91,750.90,"/F8",9.96,"enim etiam duis. Natoque massa odio litora vitae."
347.21,706.56,531.78,714.52,"/F19",8.97,"VIVERRA RISUS DIAM ENI NEQUE"
405.14,696.10,473.92,704.06,"/F19",8.97,"VULPUTATE."
326.98,669.29,519.55,678.14,"/F8",9.96,"Conubia nulla amet ullamcorper euismod."
531.46,669.29,561.90,678.14,"/F8",9.96,"Integer"
317.01,657.34,561.85,666.18,"/F8",9.96,"risus. Pretium magna. Gravida risus at netus luctus"
317.01,645.38,561.85,654.23,"/F8",9.96,"imperdiet adipiscing hac lorem ipsum. Natoque vitae in"
317.01,633.43,561.84,642.27,"/F8",9.96,"proin leo pulvinar lorem libero ad lorem. Posuere velit"
317.01,621.47,561.83,630.32,"/F8",9.96,"fusce taciti leo nullam ve faucibus feugiat consectetuer."
317.01,609.52,561.82,618.36,"/F8",9.96,"Potenti felis odio diam ut sollicitudin cubilia. Posuere"
317.01,597.56,561.84,606.41,"/F8",9.96,"lacus erat dapibus massa ac sollicitudin rutrum in donec."
317.01,585.61,561.87,594.45,"/F8",9.96,"Natoque morbi risus. Integer lorem neque cras. Integer"
317.01,573.65,561.86,582.50,"/F8",9.96,"lacus sem nisl nascetur. Vivamus lacus. Aliquam nulla."
317.01,561.70,561.88,570.54,"/F8",9.96,"Euismod massa quam mi ipsum pellentesque habitant"
317.01,549.74,561.89,558.59,"/F8",9.96,"curae a. Nonummy metus pede a etiam aliquet aptent"
317.01,537.79,561.85,546.63,"/F8",9.96,"mus nullam. Aliquam curae dis pede ultrices etiam cur-"
317.01,525.83,561.82,534.68,"/F8",9.96,"abitur convallis sollicitudin. Conubia neque elit lacus"
317.01,513.88,561.87,522.72,"/F8",9.96,"ultricies. Laoreet ipsum. Pretium magna morbi orci"
317.01,501.92,561.83,510.77,"/F8",9.96,"viverra a scelerisque nec. Potenti augue lacus nisi proin"
317.01,489.97,561.84,498.81,"/F8",9.96,"ullamcorper duis quis non ridiculus. Egestas etiam erat"
317.01,478.01,561.82,486.86,"/F8",9.96,"scelerisque laoreet vel placerat class ut sollicitudin. Na-"
317.01,466.05,561.85,474.90,"/F8",9.96,"toque porta erat auctor at faucibus netus pellentesque"
317.01,454.10,388.43,462.95,"/F8",9.96,"morbi mi mollis."
326.98,441.66,561.83,450.51,"/F8",9.96,"Blandit vitae. Quisque vitae nibh nisi eros vehicula"
317.01,429.71,561.86,438.55,"/F8",9.96,"praesent. Rhoncus lorem porta platea suspendisse lacus."
317.01,417.75,561.87,426.60,"/F8",9.96,"Nonummy fames duis nibh mus fringilla sit fusce curae"
317.01,405.80,561.87,414.64,"/F8",9.96,"metus dolor augue. Blandit ipsum curae cras dapibus."
317.01,393.84,561.88,402.69,"/F8",9.96,"Dapibus augue. Euismod felis. Nonummy proin curae"
317.01,381.89,561.85,390.73,"/F8",9.96,"sit nascetur aliquet et gravida nibh. Nonummy dolor ve"
317.01,369.93,561.88,378.78,"/F8",9.96,"duis metus fames fusce tortor ac nunc. Egestas nulla"
317.01,357.98,561.87,366.82,"/F8",9.96,"proin condimentum vel quam volutpat. Sodales class"
317.01,346.02,561.87,354.87,"/F8",9.96,"elit conubia at accumsan est mattis. Viverra justo au-"
317.01,334.07,561.86,342.91,"/F8",9.96,"gue vulputate. Aliquam metus eu auctor dictumst eros"
317.01,322.11,561.88,330.96,"/F8",9.96,"maecenas primis sapien. Euismod fusce proin cras ne-"
317.01,310.16,561.87,319.00,"/F8",9.96,"tus. Integer vitae ac maecenas auctor erat at dictumst"
317.01,298.20,561.86,307.05,"/F8",9.96,"elit. Commodo morbi. Blandit class quis faucibus justo"
317.01,286.25,561.85,295.09,"/F8",9.96,"nascetur sem. Rhoncus etiam. Feugiat metus vitae ligula"
317.01,274.29,561.86,283.14,"/F8",9.96,"justo. Nonummy lacus sed cum sit. Viverra porta pede id"
317.01,262.34,561.82,271.18,"/F8",9.96,"pellentesque vivamus metus integer netus. Feugiat risus"
317.01,250.38,368.58,259.23,"/F8",9.96,"eu a cursus."
326.98,237.94,561.84,246.79,"/F8",9.96,"Posuere risus parturient iaculis sit auctor. Euismod"
317.01,225.99,561.86,234.84,"/F8",9.96,"porta ac. Aliquet donec quis curae in pede proin nostra"
317.01,214.03,561.85,222.88,"/F8",9.96,"et interdum fusce pede semper nostra. Iaculis etiam in"
317.01,202.08,561.81,210.93,"/F8",9.96,"habitasse metus in netus vulputate vestibulum nibh nulla"
317.01,190.12,561.84,198.97,"/F8",9.96,"porttitor nisl urna. Potenti class amet. Natoque fames id"
317.01,178.17,561.83,187.02,"/F8",9.96,"hendrerit ipsum consequat senectus eu suspendisse pede."
317.01,166.21,561.85,175.06,"/F8",9.96,"Quisque velit sed arcu eros. Egestas vitae orci montes"
317.01,154.26,561.87,163.11,"/F8",9.96,"arcu fermentum leo nisl. Potenti dolor diam. Lacinia"
317.01,142.30,561.83,151.15,"/F8",9.96,"dolor nisl quisque at. Blandit netus. Cubilia justo per"
317.01,130.35,561.85,139.19,"/F8",9.96,"euismod urna ante id tempus dis quis. Egestas risus id."
317.01,118.39,561.84,127.24,"/F8",9.96,"Cubilia purus. Aliquam vitae. Blandit donec eget viva-"
