37.61,748.78,216.02,757.62,"/F8",9.96,"donec amet montes sociosqu duis amet."
224.33,748.78,288.46,757.62,"/F8",9.96,"Quisque lorem"
37.61,736.82,90.81,745.67,"/F8",9.96,"nam auctor."
97.15,736.82,288.45,745.67,"/F8",9.96,"Viverra netus non platea pharetra nisl cras"
37.61,724.87,216.58,733.71,"/F8",9.96,"elit dui pharetra aliquet. Commodo felis."
52.56,712.91,288.40,721.76,"/F8",9.96,"Gravida proin dis risus. Viverra netus vel nisl convallis"
37.61,700.96,288.39,709.80,"/F8",9.96,"mauris. Blandit felis neque eleifend proin ut etiam dictum"
37.61,689.00,60.31,697.85,"/F8",9.96,"urna."
66.70,689.00,136.40,697.85,"/F8",9.96,"Iaculis lacus ut."
142.79,689.00,288.41,697.85,"/F8",9.96,"Sodales neque dui eleifend proin."
37.61,677.04,288.43,685.89,"/F8",9.96,"Vivamus netus nam duis metus ullamcorper eleifend rhon-"
37.61,665.09,288.43,673.94,"/F8",9.96,"cus tortor nec vivamus. Egestas fusce nibh per ipsum arcu"
37.61,653.13,69.97,661.98,"/F8",9.96,"integer."
77.21,653.13,267.36,661.98,"/F8",9.96,"Euismod augue eu neque mollis turpis est."
274.60,653.13,288.43,661.98,"/F8",9.96,"So-"
37.61,641.18,288.42,650.03,"/F8",9.96,"dales ipsum id felis eu congue dui mus consectetuer velit"
37.61,629.22,288.44,638.07,"/F8",9.96,"quis sit quam urna euismod natoque phasellus ligula mae-"
37.61,617.27,288.43,626.11,"/F8",9.96,"cenas at. Posuere netus eget curae curabitur pharetra erat"
37.61,605.31,288.38,614.16,"/F8",9.96,"ridiculus tortor phasellus vel sit penatibus. Rhoncus felis"
37.61,593.36,220.34,602.20,"/F8",9.96,"pede orci velit rutrum donec quis sit mi."
227.65,593.36,288.40,602.20,"/F8",9.96,"Aliquet purus"
37.61,581.40,288.44,590.25,"/F8",9.96,"eros. Sodales donec. Natoque proin eu quam ultrices cur-"
37.61,569.45,111.24,578.29,"/F8",9.96,"abitur mi turpis."
117.31,569.45,288.42,578.29,"/F8",9.96,"Lacinia neque metus a nunc adipiscing"
37.61,557.49,67.54,566.34,"/F8",9.96,"primis."
73.21,557.49,288.46,566.34,"/F8",9.96,"Posuere augue urna ve leo eros odio praesent ac-"
37.61,545.54,73.06,554.38,"/F8",9.96,"cumsan."
79.43,545.54,288.43,554.38,"/F8",9.96,"Potenti metus fames integer viverra fermentum"
37.61,533.58,288.43,542.43,"/F8",9.96,"at habitasse a phasellus etiam a rutrum eget ve duis nulla"
37.61,521.63,49.77,530.47,"/F8",9.96,"ve."
56.43,521.63,288.45,530.47,"/F8",9.96,"Blandit magna mi lacus ad fusce dignissim aliquam."
37.61,509.67,106.55,518.52,"/F8",9.96,"Vivamus etiam."
114.40,509.67,180.47,518.52,"/F8",9.96,"Laoreet metus."
188.33,509.67,288.49,518.52,"/F8",9.96,"Commodo risus cras a"
37.61,497.72,202.69,506.56,"/F8",9.96,"elit nulla turpis consectetuer feugiat."
210.98,497.72,288.39,506.56,"/F8",9.96,"Dapibus nulla mi"
37.61,485.76,84.11,494.61,"/F8",9.96,"nisl augue."
52.56,473.81,217.91,482.65,"/F8",9.96,"Quisque fusce dolor mattis curabitur."
224.25,473.81,288.43,482.65,"/F8",9.96,"Dapibus lorem"
37.61,461.85,126.35,470.70,"/F8",9.96,"dis dui at curae ve."
134.65,461.85,288.41,470.70,"/F8",9.96,"Blandit fusce id luctus ut dictum."
37.61,449.90,248.94,458.74,"/F8",9.96,"Natoque magna elit mattis rhoncus ultricies et."
255.94,449.90,288.42,458.74,"/F8",9.96,"Blandit"
37.61,437.94,288.46,446.79,"/F8",9.96,"fames nunc a dolor feugiat urna ve habitant leo feugiat"
37.61,425.99,145.82,434.83,"/F8",9.96,"nibh cum ante nisi non."
154.02,425.99,212.34,434.83,"/F8",9.96,"Feugiat velit."
220.54,425.99,288.44,434.83,"/F8",9.96,"Commodo velit"
37.61,414.03,69.11,422.88,"/F8",9.96,"cubilia."
77.25,414.03,288.43,422.88,"/F8",9.96,"Gravida massa mi tempus habitant nunc taciti"
37.61,402.08,288.42,410.92,"/F8",9.96,"sociis dolor morbi. Sodales neque. Sodales purus netus eni"
37.61,390.12,288.43,398.97,"/F8",9.96,"fusce vivamus dignissim nam consectetuer ve morbi. Inte-"
37.61,378.17,288.44,387.01,"/F8",9.96,"ger augue morbi. Dapibus justo hac eni consequat cubilia"
37.61,366.21,67.55,375.06,"/F8",9.96,"nostra."
74.49,366.21,288.42,375.06,"/F8",9.96,"Dapibus neque nunc dui laoreet purus id cursus"
37.61,354.26,103.65,363.10,"/F8",9.96,"augue dapibus."
110.24,354.26,288.43,363.10,"/F8",9.96,"Aliquet dolor purus aliquam orci cubilia"
37.61,342.30,137.10,351.15,"/F8",9.96,"nam ut quam suscipit."
143.32,342.30,250.02,351.15,"/F8",9.96,"Iaculis lorem nec mollis."
256.23,342.30,288.43,351.15,"/F8",9.96,"Feugiat"
37.61,330.34,65.82,339.19,"/F8",9.96,"augue."
71.71,330.34,288.47,339.19,"/F8",9.96,"Commodo vitae id lacus montes donec eni luctus"
37.61,318.39,137.40,327.24,"/F8",9.96,"ultrices urna porttitor."
143.26,318.39,288.40,327.24,"/F8",9.96,"Rhoncus magna velit duis facilisi"
37.61,306.43,82.40,315.28,"/F8",9.96,"nonummy."
88.06,306.43,288.46,315.28,"/F8",9.96,"Lacinia class ac a auctor enim lacus porttitor"
37.61,294.48,146.52,303.33,"/F8",9.96,"bibendum dolor tempus."
154.54,294.48,211.07,303.33,"/F8",9.96,"Iaculis vitae."
219.08,294.48,288.44,303.33,"/F8",9.96,"Nonummy risus"
37.61,282.52,261.79,291.37,"/F8",9.96,"netus sem nisl est. Posuere augue ve cum diam dis."
37.61,260.11,169.14,268.96,"/F27",9.96,"1.2. Conubia felis id taciti ve."
52.56,246.66,288.42,255.51,"/F8",9.96,"Egestas class ac vitae tristique bibendum volutpat. Vi-"
37.61,234.70,208.38,243.55,"/F8",9.96,"vamus donec nunc cubilia et at elit ve."
214.05,234.70,288.41,243.55,"/F8",9.96,"Blandit risus nec"
37.61,222.75,288.43,231.60,"/F8",9.96,"penatibus duis potenti et ornare hymenaeos inceptos. Iac-"
37.61,210.79,288.42,219.64,"/F8",9.96,"ulis etiam. Natoque metus class aenean vulputate lobortis"
37.61,198.84,172.68,207.68,"/F8",9.96,"facilisi lacus sit ante duis eros."
178.68,198.84,288.41,207.68,"/F8",9.96,"Aliquet dolor arcu neque"
37.61,186.88,288.44,195.73,"/F8",9.96,"in nullam. Nonummy nulla mi sapien proin accumsan elit"
37.61,174.93,71.06,183.77,"/F8",9.96,"ut erat."
77.90,174.93,288.45,183.77,"/F8",9.96,"Commodo donec ac metus consectetuer facilisis"
37.61,162.97,288.42,171.82,"/F8",9.96,"donec ultrices habitasse nascetur in class eros phasellus."
37.61,151.02,198.72,159.86,"/F8",9.96,"Natoque netus urna placerat mollis."
206.69,151.02,264.42,159.86,"/F8",9.96,"Integer risus."
272.40,151.02,288.44,159.86,"/F8",9.96,"Cu-"
37.61,139.06,288.45,147.91,"/F8",9.96,"bilia felis nisl nonummy nisl malesuada maecenas eu cu-"
37.61,127.11,288.44,135.95,"/F8",9.96,"rae lectus porta malesuada vel quam a vitae in phasellus."
37.61,115.15,212.51,124.00,"/F8",9.96,"Iaculis risus diam viverra integer duis."
221.98,115.15,288.44,124.00,"/F8",9.96,"Natoque fames"
37.61,103.20,174.33,112.04,"/F8",9.96,"vel eros amet ante cras donec."
182.22,103.20,288.45,112.04,"/F8",9.96,"Blandit lacus adipiscing"
37.61,91.24,248.25,100.09,"/F8",9.96,"scelerisque lectus et platea sed nonummy amet."
254.76,91.24,288.43,100.09,"/F8",9.96,"Posuere"
37.61,79.29,66.48,88.13,"/F8",9.96,"massa."
75.39,79.29,158.84,88.13,"/F8",9.96,"Pretium massa ac."
167.74,79.29,288.47,88.13,"/F8",9.96,"Cubilia justo eget posuere."
306.60,748.78,489.05,757.62,"/F8",9.96,"Viverra curae dui odio nisi posuere eget."
496.53,748.78,557.43,757.62,"/F8",9.96,"Feugiat lorem"
306.60,736.82,376.78,745.67,"/F8",9.96,"netus a egestas."
384.19,736.82,557.44,745.67,"/F8",9.96,"Rhoncus risus eu tortor porttitor com-"
306.60,724.87,557.46,733.71,"/F8",9.96,"modo magna nisl lacinia orci mus ac proin. Laoreet netus"
306.60,712.91,557.38,721.76,"/F8",9.96,"parturient facilisi urna id justo venenatis nisi quam. Conu-"
306.60,700.95,461.93,709.80,"/F8",9.96,"bia justo curae nam urna phasellus."
321.55,689.00,557.47,697.85,"/F8",9.96,"Posuere donec ut augue luctus curae dolor maecenas"
306.60,677.04,557.40,685.89,"/F8",9.96,"proin. Dapibus lorem. Integer donec vestibulum pulvinar"
306.60,665.09,557.39,673.94,"/F8",9.96,"ante quis. Iaculis velit ut mattis at nascetur mus. Posuere"
306.60,653.13,401.55,661.98,"/F8",9.96,"curae nisl scelerisque."
408.34,653.13,557.40,661.98,"/F8",9.96,"Laoreet augue elit urna at sollici-"
306.60,641.18,365.78,650.02,"/F8",9.96,"tudin mauris."
371.72,641.18,437.30,650.02,"/F8",9.96,"Vivamus lacus."
443.23,641.18,557.42,650.02,"/F8",9.96,"Feugiat justo nec arcu vel"
306.60,629.22,557.43,638.07,"/F8",9.96,"vehicula dapibus diam eleifend. Laoreet risus magna arcu"
306.60,617.27,557.44,626.11,"/F8",9.96,"curae ullamcorper ac luctus. Viverra magna ut. Rhoncus"
306.60,605.31,403.85,614.16,"/F8",9.96,"massa eu mi est cras."
411.76,605.31,557.43,614.16,"/F8",9.96,"Sodales velit vestibulum conubia"
306.60,593.36,557.41,602.20,"/F8",9.96,"enim adipiscing tellus ante consectetuer. Nonummy risus"
306.60,581.40,557.44,590.25,"/F8",9.96,"urna porttitor platea dolor eu quam ve urna quis commodo"
306.60,569.45,557.47,578.29,"/F8",9.96,"ad. Blandit lorem nam magna sed curae donec amet. Eu-"
306.60,557.49,557.43,566.34,"/F8",9.96,"ismod etiam cras dictum ac semper ac eleifend lectus tem-"
306.60,545.54,557.40,554.38,"/F8",9.96,"por justo viverra risus curae ultrices. Feugiat etiam urna"
306.60,533.58,410.65,542.43,"/F8",9.96,"eu consectetuer aenean."
416.75,533.58,483.76,542.43,"/F8",9.96,"Gravida augue."
489.87,533.58,557.43,542.43,"/F8",9.96,"Cubilia class in"
306.60,521.63,557.41,530.47,"/F8",9.96,"vitae luctus odio vulputate ad tempor posuere at. Integer"
306.60,509.67,436.15,518.52,"/F8",9.96,"vitae risus nostra semper eni."
441.72,509.67,557.41,518.52,"/F8",9.96,"Euismod purus at vitae in"
306.60,497.72,336.54,506.56,"/F8",9.96,"nostra."
343.46,497.72,403.49,506.56,"/F8",9.96,"Cubilia lacus."
410.40,497.72,557.43,506.56,"/F8",9.96,"Laoreet justo vitae odio nulla mi"
306.60,485.76,397.11,494.61,"/F8",9.96,"ornare penatibus mi."
306.60,457.37,470.41,466.21,"/F17",9.96,"2. Cubilia fusce dolor commodo."
321.55,437.94,557.48,446.79,"/F8",9.96,"Vivamus etiam quam mus eros adipiscing ve maecenas"
306.60,425.99,557.44,434.83,"/F8",9.96,"sem aliquam a. Iaculis massa amet vulputate tortor platea"
306.60,414.03,418.56,422.88,"/F8",9.96,"porttitor ac ullamcorper."
428.22,414.03,557.42,422.88,"/F8",9.96,"Gravida porta id elementum"
306.60,402.08,409.29,410.92,"/F8",9.96,"fusce id tempor morbi."
417.33,402.08,484.52,410.92,"/F8",9.96,"Pretium lorem."
492.55,402.08,557.44,410.92,"/F8",9.96,"Gravida augue"
306.60,390.12,557.43,398.97,"/F8",9.96,"morbi aliquam id neque sociis augue ullamcorper incep-"
306.60,378.17,365.30,387.01,"/F8",9.96,"tos odio non."
372.68,378.17,431.52,387.01,"/F8",9.96,"Integer justo."
438.89,378.17,557.42,387.01,"/F8",9.96,"Potenti dolor lacinia id et."
306.60,366.21,374.89,375.06,"/F8",9.96,"Rhoncus purus."
380.96,366.21,457.08,375.06,"/F8",9.96,"Nonummy fames."
463.16,366.21,529.07,375.06,"/F8",9.96,"Gravida lorem."
535.15,366.21,557.45,375.06,"/F8",9.96,"Euis-"
306.60,354.25,557.38,363.10,"/F8",9.96,"mod purus. Posuere proin mi fringilla velit. Quisque felis"
306.60,342.30,435.00,351.15,"/F8",9.96,"sem nunc purus ornare risus."
441.55,342.30,557.44,351.15,"/F8",9.96,"Integer fames augue netus"
306.60,330.34,557.45,339.19,"/F8",9.96,"accumsan nulla ut massa tortor semper. Integer augue ve"
306.60,318.39,557.42,327.24,"/F8",9.96,"magna. Aliquet magna fusce mattis porttitor pretium luc-"
306.60,306.43,557.40,315.28,"/F8",9.96,"tus orci mi. Pretium neque nisi a. Cubilia porta urna est"
306.60,294.48,557.42,303.32,"/F8",9.96,"congue a euismod. Euismod justo parturient pretium ante"
306.60,282.52,444.70,291.37,"/F8",9.96,"mi venenatis fermentum quam."
451.94,282.52,557.43,291.37,"/F8",9.96,"Viverra morbi ve morbi"
306.60,270.57,557.40,279.41,"/F8",9.96,"pellentesque placerat metus a eros vestibulum et. Posuere"
306.60,258.61,334.25,267.46,"/F8",9.96,"donec."
340.06,258.61,557.39,267.46,"/F8",9.96,"Egestas netus mi pellentesque sollicitudin sodales"
306.60,246.66,410.07,255.51,"/F8",9.96,"tellus velit id venenatis."
321.55,234.70,557.40,243.55,"/F8",9.96,"Dapibus velit arcu mauris libero tincidunt at fermen-"
306.60,222.75,433.25,231.59,"/F8",9.96,"tum malesuada pellentesque."
439.63,222.75,557.43,231.59,"/F8",9.96,"Conubia risus massa inter-"
306.60,210.79,328.72,219.64,"/F8",9.96,"dum."
335.81,210.79,422.34,219.64,"/F8",9.96,"Pretium vitae ante."
429.43,210.79,557.43,219.64,"/F8",9.96,"Cubilia dolor nunc maecenas"
306.60,198.84,389.35,207.68,"/F8",9.96,"purus amet quam."
398.76,198.84,557.45,207.68,"/F8",9.96,"Lacinia donec purus porta pretium"
306.60,186.88,419.44,195.73,"/F8",9.96,"duis fermentum sit amet."
427.08,186.88,557.43,195.73,"/F8",9.96,"Rhoncus vitae et sapien non."
306.60,174.93,557.42,183.77,"/F8",9.96,"Quisque proin nonummy tempus pede nec quis blandit."
306.60,162.97,557.40,171.82,"/F8",9.96,"Dapibus velit proin est pede lacus felis mollis hymenaeos"
306.60,151.02,332.62,159.86,"/F8",9.96,"curae."
339.85,151.02,425.27,159.86,"/F8",9.96,"Egestas fusce urna."
432.49,151.02,557.43,159.86,"/F8",9.96,"Integer purus fames quisque"
306.60,139.06,557.42,147.91,"/F8",9.96,"rutrum tellus ultricies egestas leo mi tortor amet odio"
306.60,127.11,351.40,135.95,"/F8",9.96,"nonummy."
357.29,127.11,557.45,135.95,"/F8",9.96,"Rhoncus massa orci pretium enim eu nisi hy-"
306.60,115.15,361.34,124.00,"/F8",9.96,"menaeos mi."
368.87,115.15,434.82,124.00,"/F8",9.96,"Laoreet ipsum."
442.35,115.15,557.47,124.00,"/F8",9.96,"Egestas etiam arcu curae."
306.60,103.20,557.39,112.04,"/F8",9.96,"Potenti porta at nisi porta mi risus consequat sagittis eget."
306.60,91.24,557.41,100.09,"/F8",9.96,"Conubia velit. Lacinia lorem et nostra ultrices diam lobor-"
306.60,79.29,515.78,88.13,"/F8",9.96,"tis tincidunt ve curabitur aliquam massa curae."
521.55,79.29,557.40,88.13,"/F8",9.96,"Dapibus"
295.15,61.35,300.13,70.20,"/F8",9.96,"2"
