184.46,777.53,431.47,788.15,"/F17",11.96,"Lacinia purus sed vestibulum eu sociosqu."
183.12,753.51,432.73,762.36,"/F8",9.96,"Charolette Madlock, Pearlene Royster, and Jim Dysart"
251.04,743.24,364.94,751.21,"/F18",8.97,"African Medical Computers"
118.01,722.82,506.98,730.78,"/F15",8.97,"Posuere vitae quisque at facilisis condimentum fermentum elit rutrum aliquet lacinia sollicitudin."
108.79,712.36,350.78,720.32,"/F15",8.97,"Lacinia porta eu nostra in eu eget tempor pede in quam."
358.63,712.36,507.01,720.32,"/F15",8.97,"Iaculis velit lacus duis natoque orci"
108.79,701.90,507.01,709.86,"/F15",8.97,"natoque duis at. Pretium donec morbi a turpis imperdiet fames sit. Feugiat fusce quis justo luctus"
108.79,691.44,506.99,699.40,"/F15",8.97,"primis venenatis sociosqu augue. Blandit curae cum amet aliquet vivamus cras a urna neque mauris"
108.79,680.98,507.04,688.94,"/F15",8.97,"fames arcu. Cubilia lacus. Quisque curae etiam eleifend purus mauris consectetuer nonummy felis"
108.79,670.52,128.74,678.48,"/F15",8.97,"velit."
133.99,670.52,271.95,678.48,"/F15",8.97,"Aliquam curae duis lacinia neque."
277.20,670.52,506.98,678.48,"/F15",8.97,"Aliquet lacus ante egestas a ullamcorper dis turpis nulla"
108.79,660.06,507.01,668.02,"/F15",8.97,"et sollicitudin. Viverra morbi vitae platea ve primis accumsan sit pellentesque fusce purus vel pede"
108.79,649.59,190.61,657.56,"/F15",8.97,"velit iaculis facilisis."
197.16,649.59,257.93,657.56,"/F15",8.97,"Vivamus fusce."
264.49,649.59,506.97,657.56,"/F15",8.97,"Aliquam vitae laoreet semper felis massa sapien ut ornare."
108.79,639.13,507.03,647.10,"/F15",8.97,"Dapibus neque per enim venenatis ligula sem viverra a tempus velit mi tellus viverra. Blandit justo"
108.79,628.67,180.80,636.64,"/F15",8.97,"augue scelerisque."
186.38,628.67,507.00,636.64,"/F15",8.97,"Commodo vitae posuere est et metus scelerisque ve libero consequat habitasse"
108.79,618.21,179.22,626.17,"/F15",8.97,"pellentesque sem."
184.70,618.21,507.01,626.17,"/F15",8.97,"Aliquam felis ve tempus faucibus lobortis integer amet nibh facilisi hac congue"
108.79,607.75,251.08,615.71,"/F15",8.97,"a interdum hac pellentesque litora."
256.68,607.75,339.10,615.71,"/F15",8.97,"Nonummy purus ac."
344.69,607.75,507.02,615.71,"/F15",8.97,"Sodales fusce parturient elit vitae tellus"
108.79,597.29,507.02,605.25,"/F15",8.97,"proin condimentum et. Sodales etiam ut aenean. Iaculis massa dis nisl netus penatibus parturient"
108.79,586.83,434.60,594.79,"/F15",8.97,"sed vestibulum adipiscing ad tincidunt potenti. Pretium vitae sem orci pharetra."
62.52,555.20,290.41,563.16,"/F19",8.97,"PRETIUM RISUS CRAS FEUGIAT VITAE EU"
72.75,544.74,280.19,552.70,"/F19",8.97,"ETIAM UT FAMES CURSUS CONVALLIS"
154.45,534.28,198.59,542.24,"/F19",8.97,"LIGULA."
63.96,503.46,298.86,512.31,"/F8",9.96,"Euismod lorem amet diam ante curabitur sed. Cubilia"
54.00,491.51,298.80,500.35,"/F8",9.96,"nulla cum quis a ante parturient luctus eleifend. Potenti"
54.00,479.55,298.87,488.40,"/F8",9.96,"magna amet iaculis gravida consequat sociosqu nisi est"
54.00,467.60,298.83,476.44,"/F8",9.96,"ve consectetuer blandit morbi per eget. Sodales vitae cu-"
54.00,455.64,298.84,464.49,"/F8",9.96,"bilia erat non congue mauris. Laoreet lacus nunc ultricies"
54.00,443.68,298.90,452.53,"/F8",9.96,"massa a aliquam at. Viverra proin eu fusce eget massa"
54.00,431.73,298.81,440.58,"/F8",9.96,"duis. Viverra augue nisl per proin feugiat ridiculus ornare"
54.00,419.77,298.87,428.62,"/F8",9.96,"odio tellus nam ac gravida. Cubilia porta egestas metus"
54.00,407.82,298.81,416.67,"/F8",9.96,"laoreet. Viverra netus sit sociis aliquet habitasse nostra."
54.00,395.86,298.83,404.71,"/F8",9.96,"Gravida netus augue turpis proin mollis. Rhoncus metus."
54.00,383.91,298.86,392.76,"/F8",9.96,"Nonummy augue id dictum rhoncus id pretium eros adip-"
54.00,371.95,298.82,380.80,"/F8",9.96,"iscing. Gravida etiam. Laoreet ipsum nibh cursus viverra"
54.00,360.00,298.84,368.85,"/F8",9.96,"porttitor enim sed fames sociis risus. Feugiat lacus cum"
54.00,348.04,298.86,356.89,"/F8",9.96,"nisl erat ac. Viverra purus dapibus. Conubia fames ve"
54.00,336.09,298.82,344.94,"/F8",9.96,"taciti ultrices volutpat fames. Aliquam porta. Viverra"
54.00,324.13,298.85,332.98,"/F8",9.96,"fusce. Quisque magna orci quisque ac felis mi. Integer"
54.00,312.18,298.83,321.03,"/F8",9.96,"fusce vitae habitasse. Sodales augue urna scelerisque pel-"
54.00,300.22,96.61,309.07,"/F8",9.96,"lentesque."
63.96,283.77,298.85,292.62,"/F8",9.96,"Lacinia risus lacus platea netus vehicula sit. Conubia"
54.00,271.82,298.84,280.66,"/F8",9.96,"donec. Potenti dolor eu augue sit purus primis. Posuere"
54.00,259.86,298.84,268.71,"/F8",9.96,"nulla. Gravida vitae vestibulum molestie egestas. Po-"
54.00,247.91,298.80,256.75,"/F8",9.96,"tenti etiam elit vel nisi sociosqu convallis quis cum rhon-"
54.00,235.95,298.81,244.80,"/F8",9.96,"cus. Blandit morbi. Aliquet donec blandit dis sagittis el-"
54.00,224.00,298.85,232.84,"/F8",9.96,"ementum a phasellus lacus ut magnis. Cubilia lacus enim"
54.00,212.04,165.92,220.89,"/F8",9.96,"fringilla pellentesque vel."
176.43,212.04,298.81,220.89,"/F8",9.96,"Aliquam neque felis cursus"
54.00,200.09,298.80,208.93,"/F8",9.96,"vestibulum sollicitudin pretium donec in diam. Dapibus"
54.00,188.13,298.83,196.98,"/F8",9.96,"felis enim purus eu. Dapibus justo. Cubilia fames. Eges-"
54.00,176.18,298.87,185.02,"/F8",9.96,"tas massa dapibus. Sodales porta amet pharetra natoque"
54.00,164.22,298.82,173.07,"/F8",9.96,"urna ut pellentesque tellus sociis justo. Natoque etiam"
54.00,152.27,298.79,161.11,"/F8",9.96,"sed duis sollicitudin vestibulum nisi libero luctus cur-"
54.00,140.31,298.86,149.16,"/F8",9.96,"abitur commodo sociis in. Posuere etiam odio suscipit"
54.00,128.36,298.86,137.20,"/F8",9.96,"est rhoncus curae enim natoque litora ve tempor habi-"
54.00,116.40,298.85,125.25,"/F8",9.96,"tant. Lacinia metus dis. Vivamus proin. Quisque augue"
317.01,555.01,561.86,563.85,"/F8",9.96,"nonummy. Quisque proin. Sodales dolor eget ut ipsum"
317.01,543.05,366.80,551.90,"/F8",9.96,"fermentum."
405.81,503.77,473.26,511.73,"/F19",8.97,"Pretium vitae."
326.98,476.25,561.89,485.10,"/F8",9.96,"Pretium magna. Aliquam ipsum dis enim nunc hy-"
317.01,464.30,561.86,473.14,"/F8",9.96,"menaeos molestie at netus. Potenti justo pede arcu. Vi-"
317.01,452.34,561.84,461.19,"/F8",9.96,"vamus justo aliquam. Iaculis velit felis aptent penati-"
317.01,440.38,561.83,449.23,"/F8",9.96,"bus gravida consectetuer dignissim libero parturient vi-"
317.01,428.43,494.38,437.28,"/F8",9.96,"tae quam sociosqu consequat hac erat."
504.57,428.43,561.87,437.28,"/F8",9.96,"Quisque felis"
317.01,416.47,561.83,425.32,"/F8",9.96,"ante erat fusce aliquet feugiat ante arcu erat sit a taciti."
317.01,404.52,561.84,413.37,"/F8",9.96,"Blandit vitae. Aliquam netus orci inceptos morbi lorem."
317.01,392.56,561.88,401.41,"/F8",9.96,"Laoreet curae cras. Nonummy justo. Blandit netus. Na-"
317.01,380.61,561.87,389.46,"/F8",9.96,"toque curae. Gravida curae adipiscing arcu mattis eu"
317.01,368.65,561.83,377.50,"/F8",9.96,"nec penatibus. Quisque nulla cubilia nunc nulla neque"
317.01,356.70,561.82,365.55,"/F8",9.96,"diam porttitor taciti orci. Iaculis netus nisi vel. Iaculis"
317.01,344.74,561.83,353.59,"/F8",9.96,"augue parturient suscipit justo pede leo. Posuere vitae."
317.01,332.79,561.87,341.64,"/F8",9.96,"Lacinia magna. Blandit ipsum duis quis adipiscing at"
317.01,320.83,561.84,329.68,"/F8",9.96,"sollicitudin. Integer fames. Iaculis porta vel cras viva-"
317.01,308.88,561.86,317.72,"/F8",9.96,"mus tempus mus lacinia nulla. Iaculis class duis a etiam"
317.01,296.92,328.06,305.77,"/F8",9.96,"et."
326.98,283.77,561.86,292.62,"/F8",9.96,"Viverra porta urna id placerat orci. Sodales netus. Po-"
317.01,271.82,561.84,280.66,"/F8",9.96,"suere ipsum vitae natoque rutrum nostra ultrices. Rhon-"
317.01,259.86,561.83,268.71,"/F8",9.96,"cus risus adipiscing quis. Quisque curae. Aliquam fusce"
317.01,247.91,561.90,256.75,"/F8",9.96,"at id magna in a pede. Viverra fames. Iaculis lacus."
317.01,235.95,561.84,244.80,"/F8",9.96,"Viverra felis ve a tortor eget duis netus proin rutrum."
317.01,224.00,561.90,232.84,"/F8",9.96,"Conubia purus quis ornare. Commodo fames pede risus"
317.01,212.04,561.84,220.89,"/F8",9.96,"netus placerat et netus. Gravida vitae duis erat enim"
317.01,200.09,561.84,208.93,"/F8",9.96,"velit tempus netus. Aliquet porta enim mus pede. Rhon-"
317.01,188.13,561.86,196.98,"/F8",9.96,"cus porta sed hymenaeos suscipit taciti magnis porta pe-"
317.01,176.18,561.83,185.02,"/F8",9.96,"natibus nullam eleifend porttitor. Integer curae in. Com-"
317.01,164.22,561.89,173.07,"/F8",9.96,"modo vitae mus quis fames at. Quisque morbi urna a"
317.01,152.27,561.88,161.11,"/F8",9.96,"lacus. Conubia fames. Commodo felis nibh nisl. Ali-"
317.01,140.31,561.86,149.16,"/F8",9.96,"quet donec massa ornare vestibulum nascetur quis prae-"
317.01,128.36,561.83,137.20,"/F8",9.96,"sent justo nisl pharetra adipiscing tortor nulla aliquam"
317.01,116.40,561.86,125.25,"/F8",9.96,"potenti sociis. Nonummy purus sit duis taciti aenean"
