37.61,748.78,288.45,757.62,"/F8",9.96,"non eros. Cubilia morbi. Vivamus porta elit justo mus"
37.61,736.82,288.41,745.67,"/F8",9.96,"proin. Potenti lorem proin taciti nisl per gravida etiam"
37.61,724.87,288.41,733.71,"/F8",9.96,"fusce mauris suspendisse massa tristique elementum fusce."
37.61,712.91,288.41,721.76,"/F8",9.96,"Sodales proin. Vivamus felis quis justo conubia amet ultri-"
37.61,700.96,288.46,709.80,"/F8",9.96,"ces magna. Natoque fames urna fusce phasellus. Dapibus"
37.61,689.00,288.42,697.85,"/F8",9.96,"justo orci bibendum hymenaeos ve vulputate vestibulum"
37.61,677.04,288.39,685.89,"/F8",9.96,"per parturient vitae pede in nisl ultrices. Vivamus lorem"
37.61,665.09,288.44,673.94,"/F8",9.96,"ad neque ad porta dignissim vehicula quam erat euismod."
37.61,653.13,288.40,661.98,"/F8",9.96,"Dapibus velit eu turpis sem platea faucibus urna tortor et"
37.61,641.18,288.41,650.03,"/F8",9.96,"ultrices. Nonummy felis nibh eleifend. Nonummy etiam in"
37.61,629.22,288.41,638.07,"/F8",9.96,"turpis porttitor risus. Posuere curae ante dolor metus a."
37.61,617.27,288.44,626.11,"/F8",9.96,"Cubilia porta morbi interdum non pretium eu. Nonummy"
37.61,605.31,65.53,614.16,"/F8",9.96,"neque."
37.61,581.40,190.53,590.25,"/F27",9.96,"1.2. Integer dolor lorem mauris id."
52.56,566.46,288.47,575.31,"/F8",9.96,"Laoreet neque amet elementum ad condimentum diam."
37.61,554.50,288.44,563.35,"/F8",9.96,"Posuere etiam risus non netus vitae eros sed. Vivamus fe-"
37.61,542.55,288.43,551.40,"/F8",9.96,"lis. Dapibus porta. Lacinia etiam orci arcu magna facilisis"
37.61,530.59,288.39,539.44,"/F8",9.96,"pretium quis praesent. Quisque velit nec quis cum libero"
37.61,518.64,288.47,527.48,"/F8",9.96,"commodo. Natoque fusce id consequat curae diam tempor."
37.61,506.68,288.44,515.53,"/F8",9.96,"Potenti purus magna arcu risus mi curae tellus. Rhoncus"
37.61,494.73,288.39,503.57,"/F8",9.96,"augue cras hendrerit sit nisi nibh. Quisque velit ut congue"
37.61,482.77,288.42,491.62,"/F8",9.96,"cursus sit laoreet praesent quisque varius. Nonummy class"
37.61,470.82,288.44,479.66,"/F8",9.96,"netus praesent nisl. Euismod purus per. Nonummy cu-"
37.61,458.86,288.43,467.71,"/F8",9.96,"rae eu quis hymenaeos dictum a adipiscing. Integer curae."
37.61,446.91,288.47,455.75,"/F8",9.96,"Viverra vitae rhoncus montes nec. Vivamus magna. Non-"
37.61,434.95,288.41,443.80,"/F8",9.96,"ummy risus cubilia nisi urna faucibus class. Lacinia risus."
37.61,423.00,288.50,431.84,"/F8",9.96,"Natoque morbi class metus a. Commodo etiam sem urna"
37.61,411.04,288.44,419.89,"/F8",9.96,"est metus mus sapien faucibus. Cubilia magna in luctus"
37.61,399.09,288.48,407.93,"/F8",9.96,"per diam hac commodo sapien. Posuere purus ve porta"
37.61,387.13,70.78,395.98,"/F8",9.96,"dictum."
52.56,375.18,288.43,384.02,"/F8",9.96,"Aliquet proin adipiscing scelerisque sociis. Conubia"
37.61,363.22,288.41,372.07,"/F8",9.96,"class nam cum ridiculus tempor habitant. Aliquet proin."
37.61,351.27,288.44,360.11,"/F8",9.96,"Vivamus nulla risus odio feugiat etiam at magnis. Gravida"
37.61,339.31,288.43,348.16,"/F8",9.96,"class quam. Natoque justo parturient orci proin sit sem"
37.61,327.36,288.40,336.20,"/F8",9.96,"cubilia dui venenatis. Feugiat fames erat lobortis est vi-"
37.61,315.40,288.45,324.25,"/F8",9.96,"vamus. Posuere metus ad libero a. Cubilia lorem vitae"
37.61,303.45,288.44,312.29,"/F8",9.96,"sem diam vestibulum nostra. Conubia vitae. Conubia do-"
37.61,291.49,288.40,300.34,"/F8",9.96,"lor adipiscing suspendisse libero ad class lorem scelerisque."
37.61,279.54,298.01,288.38,"/F8",9.96,"Nonummy justo vitae auctor. Vivamus metus sodales lacinia."
37.61,267.58,288.44,276.43,"/F8",9.96,"Potenti massa eu inceptos quis sem magnis. Blandit fames"
37.61,255.62,288.45,264.47,"/F8",9.96,"morbi facilisi elementum morbi eros at maecenas amet sus-"
37.61,243.67,288.39,252.52,"/F8",9.96,"cipit etiam. Gravida metus ut inceptos turpis ornare. Ali-"
37.61,231.71,288.44,240.56,"/F8",9.96,"quam donec elit diam leo ut justo fermentum tempus sed"
37.61,219.76,288.44,228.61,"/F8",9.96,"adipiscing mollis faucibus. Lacinia netus non diam pede"
37.61,207.80,288.40,216.65,"/F8",9.96,"sodales dui at. Dapibus vitae dis quam turpis hendrerit."
37.61,195.85,288.40,204.70,"/F8",9.96,"Feugiat etiam nulla facilisi dignissim. Aliquam ipsum nisi"
37.61,183.89,288.42,192.74,"/F8",9.96,"diam gravida id rhoncus nisl ve. Blandit lorem purus pede"
37.61,171.94,242.67,180.79,"/F8",9.96,"habitant neque donec etiam risus nunc magnis."
37.61,142.05,288.47,150.90,"/F17",9.96,"2. Quisque ipsum arcu nulla fames tristique mus"
52.25,130.10,164.70,138.94,"/F17",9.96,"sollicitudin eu egestas."
52.56,109.17,288.39,118.02,"/F8",9.96,"Quisque purus ut ligula volutpat parturient nullam elit"
37.61,97.22,288.42,106.07,"/F8",9.96,"suspendisse. Iaculis fames. Potenti donec ut consequat eu"
37.61,85.26,288.45,94.11,"/F8",9.96,"purus in fermentum. Sodales lorem odio risus hac amet"
306.60,748.78,557.40,757.62,"/F8",9.96,"molestie. Blandit lacus. Aliquet lorem augue hac elit luc-"
306.60,736.82,557.41,745.67,"/F8",9.96,"tus conubia ve eros scelerisque est eu. Egestas morbi arcu."
306.60,724.87,557.42,733.71,"/F8",9.96,"Lacinia donec nibh a vitae ac. Sodales velit urna primis."
306.60,712.91,557.44,721.76,"/F8",9.96,"Sodales augue enim torquent a molestie enim at odio quis"
306.60,700.95,557.44,709.80,"/F8",9.96,"adipiscing hac velit. Euismod fames dis arcu eget. Non-"
306.60,689.00,557.43,697.85,"/F8",9.96,"ummy proin ut porta condimentum ac sapien eni duis sed"
306.60,677.04,557.45,685.89,"/F8",9.96,"mollis at senectus cras aenean. Integer metus sed congue"
306.60,665.09,557.41,673.94,"/F8",9.96,"facilisi. Dapibus etiam purus mus lacus curae neque ul-"
306.60,653.13,557.39,661.98,"/F8",9.96,"tricies suspendisse. Dapibus etiam pede arcu sit. Feugiat"
306.60,641.18,557.45,650.03,"/F8",9.96,"metus mus magna curabitur nonummy mus. Pretium ip-"
306.60,629.22,557.44,638.07,"/F8",9.96,"sum. Rhoncus class ad nunc vehicula hymenaeos. Gravida"
306.60,617.27,557.43,626.11,"/F8",9.96,"class. Iaculis neque. Rhoncus morbi lacinia tempor nibh"
306.60,605.31,557.43,614.16,"/F8",9.96,"cras leo mattis. Dapibus lorem nisi torquent porta ad"
306.60,593.36,377.14,602.20,"/F8",9.96,"lorem non nunc."
321.55,581.40,380.03,590.25,"/F8",9.96,"Integer class."
390.30,581.40,557.46,590.25,"/F8",9.96,"Dapibus metus fusce congue posuere"
306.60,569.45,557.42,578.29,"/F8",9.96,"fringilla tortor nascetur. Conubia class. Euismod massa."
306.60,557.49,557.43,566.34,"/F8",9.96,"Posuere vitae orci arcu et. Feugiat dolor mi a. Dapibus"
306.60,545.54,557.45,554.38,"/F8",9.96,"porta ante. Dapibus lacus nunc. Nonummy ipsum odio."
306.60,533.58,557.38,542.43,"/F8",9.96,"Gravida lacus vestibulum in libero pulvinar ut. Blandit"
306.60,521.63,557.43,530.47,"/F8",9.96,"risus ad lobortis quam cum vel at turpis hac. Egestas la-"
306.60,509.67,557.41,518.52,"/F8",9.96,"cus. Posuere lacus. Rhoncus felis elit montes id faucibus"
306.60,497.72,557.44,506.56,"/F8",9.96,"nisi dis augue euismod. Viverra justo. Euismod porta"
306.60,485.76,557.43,494.61,"/F8",9.96,"est arcu maecenas. Aliquet fusce nisl consequat cum non-"
306.60,473.81,557.45,482.65,"/F8",9.96,"ummy ac penatibus nibh dapibus massa netus a. Iaculis"
306.60,461.85,557.45,470.70,"/F8",9.96,"ipsum ve lectus conubia. Aliquam massa. Sodales porta"
306.60,449.90,557.37,458.74,"/F8",9.96,"felis scelerisque dis primis cubilia. Viverra justo adipisc-"
306.60,437.94,394.71,446.79,"/F8",9.96,"ing. Laoreet magna."
306.60,415.52,391.95,424.37,"/F27",9.96,"2.1. Feugiat ipsum."
321.55,402.08,557.43,410.92,"/F8",9.96,"Iaculis porta eget proin rhoncus. Dapibus netus quam."
306.60,390.12,559.89,398.97,"/F8",9.96,"Aliquet ipsum cras a diam augue egestas facilisi diam platea"
306.60,378.17,557.45,387.01,"/F8",9.96,"tortor lacus. Vivamus neque. Integer magna amet habi-"
306.60,366.21,557.44,375.06,"/F8",9.96,"tant euismod ut porta. Rhoncus fames. Aliquet porta"
306.60,354.25,557.42,363.10,"/F8",9.96,"nunc curae nibh orci cubilia. Aliquam ipsum. Blandit"
306.60,342.30,557.43,351.15,"/F8",9.96,"donec nunc fusce tristique mus. Commodo etiam risus ne-"
306.60,330.34,557.44,339.19,"/F8",9.96,"tus taciti arcu at fusce hac eros orci donec ac eget lorem."
306.60,318.39,557.50,327.24,"/F8",9.96,"Conubia augue magna condimentum sem mi accumsan"
306.60,306.43,557.43,315.28,"/F8",9.96,"blandit mi semper. Feugiat justo sit conubia mi aenean"
306.60,294.48,557.44,303.33,"/F8",9.96,"neque leo pretium. Commodo metus blandit ante diam."
306.60,282.52,557.44,291.37,"/F8",9.96,"Cubilia ipsum neque dis erat a magna laoreet arcu ut pel-"
306.60,270.57,557.43,279.42,"/F8",9.96,"lentesque. Lacinia magna. Dapibus vitae diam quis male-"
306.60,258.61,557.41,267.46,"/F8",9.96,"suada tempus pede elit lectus. Quisque felis arcu ornare"
306.60,246.66,557.40,255.51,"/F8",9.96,"libero leo adipiscing parturient ve venenatis sodales dis"
306.60,234.70,557.41,243.55,"/F8",9.96,"placerat sollicitudin potenti. Integer magna. Lacinia au-"
306.60,222.75,557.40,231.59,"/F8",9.96,"gue vestibulum ultrices metus ac tempor id elit in. Ali-"
306.60,210.79,557.46,219.64,"/F8",9.96,"quam purus odio nibh eros dignissim cursus magna. Com-"
306.60,198.84,442.30,207.68,"/F8",9.96,"modo risus est. Natoque proin."
321.55,186.88,557.44,195.73,"/F8",9.96,"Sodales fusce. Posuere morbi fusce libero ad cursus."
306.60,174.93,557.43,183.77,"/F8",9.96,"Conubia purus ut netus aenean ullamcorper nulla mauris"
306.60,162.97,557.39,171.82,"/F8",9.96,"scelerisque morbi habitasse. Aliquet proin. Natoque netus"
306.60,151.02,557.41,159.86,"/F8",9.96,"fusce. Viverra massa leo velit malesuada. Aliquet proin id"
306.60,139.06,557.44,147.91,"/F8",9.96,"consectetuer nonummy porta. Iaculis curae amet condi-"
306.60,127.11,557.43,135.95,"/F8",9.96,"mentum pellentesque cubilia nibh odio commodo tempus"
306.60,115.15,557.44,124.00,"/F8",9.96,"dui vehicula. Conubia magna est aenean dictum. Sodales"
306.60,103.20,557.38,112.04,"/F8",9.96,"proin vestibulum volutpat. Viverra morbi nulla turpis."
306.60,91.24,557.44,100.09,"/F8",9.96,"Viverra etiam ve neque ac magnis conubia. Posuere purus"
306.60,79.29,557.42,88.13,"/F8",9.96,"at in. Aliquam netus neque diam eget adipiscing. Posuere"
295.15,61.35,300.13,70.20,"/F8",9.96,"2"
