52.56,748.78,292.56,757.62,"/F8",9.96,"Rhoncus augue felis dapibus egestas quis. Sodales massa"
37.61,736.82,288.44,745.67,"/F8",9.96,"donec dapibus sodales nascetur justo metus nunc amet dui"
37.61,724.87,288.44,733.71,"/F8",9.96,"risus tortor. Vivamus lacus id netus fermentum cras na-"
37.61,712.91,288.48,721.76,"/F8",9.96,"toque a montes eget quis rhoncus. Conubia magna amet"
37.61,700.96,288.43,709.80,"/F8",9.96,"class donec viverra dis. Integer porta eros auctor libero."
37.61,689.00,288.44,697.85,"/F8",9.96,"Natoque fames. Euismod ipsum vel diam cubilia luctus"
37.61,677.04,288.46,685.89,"/F8",9.96,"cras. Sodales vitae quam accumsan. Gravida metus erat"
37.61,665.09,288.40,673.94,"/F8",9.96,"phasellus eleifend ut suspendisse in montes lobortis odio."
37.61,653.13,288.45,661.98,"/F8",9.96,"Egestas magna vitae vel nibh a cras vitae dignissim cur-"
37.61,641.18,288.43,650.03,"/F8",9.96,"abitur. Iaculis fusce. Feugiat ipsum lorem gravida. Conu-"
37.61,629.22,288.43,638.07,"/F8",9.96,"bia risus egestas ad auctor ultricies feugiat enim ac nulla"
37.61,617.27,288.43,626.11,"/F8",9.96,"neque urna dapibus. Iaculis risus vivamus nisi gravida"
37.61,605.31,288.45,614.16,"/F8",9.96,"nam at fames risus erat id metus. Cubilia proin amet at"
37.61,593.36,288.39,602.20,"/F8",9.96,"dui auctor taciti felis orci ipsum aptent lectus. Quisque"
37.61,581.40,288.45,590.25,"/F8",9.96,"ipsum. Pretium massa erat nam feugiat praesent mauris"
37.61,569.45,288.47,578.29,"/F8",9.96,"commodo aliquet mauris ve justo porta. Laoreet lorem"
37.61,557.49,288.40,566.34,"/F8",9.96,"fusce primis et dui eu felis penatibus. Sodales proin viva-"
37.61,545.54,288.43,554.38,"/F8",9.96,"mus cubilia lectus cum taciti. Iaculis magna lorem laoreet"
37.61,533.58,288.44,542.43,"/F8",9.96,"tellus vitae gravida eros sociosqu adipiscing. Nonummy"
37.61,521.63,288.49,530.47,"/F8",9.96,"fames cras commodo et hac ve euismod. Nonummy risus"
37.61,509.67,177.61,518.52,"/F8",9.96,"at magnis non diam fermentum."
37.61,487.26,120.18,496.10,"/F27",9.96,"1.2. Aliquet lorem."
52.56,473.81,290.38,482.65,"/F8",9.96,"Aliquet dolor eros ultricies ve ornare sit parturient proin"
37.61,461.85,288.43,470.70,"/F8",9.96,"eros aliquam. Euismod lorem parturient pede netus urna"
37.61,449.90,288.41,458.74,"/F8",9.96,"ad eni consequat mus pellentesque mattis eu taciti tin-"
37.61,437.94,288.42,446.79,"/F8",9.96,"cidunt. Vivamus nulla pede felis cubilia tempor cras. Na-"
37.61,425.99,288.47,434.83,"/F8",9.96,"toque lacus. Egestas lorem. Lacinia justo dui quam a"
37.61,414.03,288.41,422.88,"/F8",9.96,"netus dapibus magnis. Dapibus felis ac sollicitudin tor-"
37.61,402.08,288.40,410.92,"/F8",9.96,"tor ad ante in nisi curabitur pede nisl blandit. Cubilia"
37.61,390.12,288.42,398.97,"/F8",9.96,"morbi. Sodales justo urna lacus fringilla rhoncus per. Eu-"
37.61,378.17,288.42,387.01,"/F8",9.96,"ismod nulla risus nisi maecenas tempus taciti consequat."
37.61,366.21,288.42,375.06,"/F8",9.96,"Dapibus ipsum cras. Quisque neque ut taciti purus nam"
37.61,354.26,288.42,363.10,"/F8",9.96,"nunc adipiscing nostra interdum fermentum id. Gravida"
37.61,342.30,288.39,351.15,"/F8",9.96,"etiam eros dictumst quisque dictumst orci. Blandit neque"
37.61,330.34,288.42,339.19,"/F8",9.96,"nam nisi adipiscing hendrerit suspendisse nam dictum fa-"
37.61,318.39,288.40,327.24,"/F8",9.96,"cilisi. Blandit purus ve id in nunc felis donec euismod et"
37.61,306.43,288.42,315.28,"/F8",9.96,"eu eros et neque ve. Cubilia augue est sagittis porttitor"
37.61,294.48,288.41,303.33,"/F8",9.96,"dolor mi et lorem odio nibh venenatis ultricies proin cur-"
37.61,282.52,288.38,291.37,"/F8",9.96,"abitur. Euismod massa quis imperdiet sollicitudin vestibu-"
37.61,270.57,288.42,279.42,"/F8",9.96,"lum pede magnis suscipit fringilla congue. Potenti donec"
37.61,258.61,288.41,267.46,"/F8",9.96,"nam. Cubilia neque erat. Dapibus felis enim duis pede eu-"
37.61,246.66,288.46,255.51,"/F8",9.96,"ismod at ad erat. Iaculis neque. Nonummy curae natoque"
37.61,234.70,195.97,243.55,"/F8",9.96,"purus elit molestie eni nisl et ipsum."
52.56,222.75,288.43,231.60,"/F8",9.96,"Lacinia donec nisl dis et cubilia nunc parturient mus"
37.61,210.79,288.42,219.64,"/F8",9.96,"lacus tristique egestas est tempus ve. Iaculis morbi cum"
37.61,198.84,288.40,207.68,"/F8",9.96,"vestibulum. Vivamus etiam nulla scelerisque dis duis par-"
37.61,186.88,288.38,195.73,"/F8",9.96,"turient. Laoreet proin nisi sit penatibus tellus a dictumst"
37.61,174.93,288.46,183.77,"/F8",9.96,"diam. Egestas curae eget felis odio dis. Laoreet class ad"
37.61,162.97,288.46,171.82,"/F8",9.96,"vehicula eleifend risus. Nonummy augue nunc. Commodo"
37.61,151.02,288.45,159.86,"/F8",9.96,"massa proin arcu a arcu ut pellentesque nullam. Laoreet"
37.61,139.06,288.43,147.91,"/F8",9.96,"neque ad cursus sodales urna porttitor congue porttitor"
37.61,127.11,288.41,135.95,"/F8",9.96,"vestibulum laoreet. Posuere class ut purus facilisis augue"
37.61,115.15,288.38,124.00,"/F8",9.96,"tristique curabitur parturient eros. Conubia netus quis po-"
37.61,103.20,288.42,112.04,"/F8",9.96,"tenti et cursus pulvinar habitasse eros nunc massa eu. Cu-"
37.61,91.24,288.42,100.09,"/F8",9.96,"bilia nulla purus auctor tempus sed. Iaculis fusce ve augue"
37.61,79.29,288.42,88.13,"/F8",9.96,"dignissim ullamcorper class fermentum vivamus. Cubilia"
306.60,748.78,557.42,757.62,"/F8",9.96,"lacus justo integer cras ve amet ligula velit egestas diam"
306.60,736.82,557.42,745.67,"/F8",9.96,"cum nibh consectetuer. Aliquam nulla hac eros adipiscing"
306.60,724.87,557.40,733.71,"/F8",9.96,"mattis. Blandit lorem. Potenti netus ac rutrum pellen-"
306.60,712.91,557.41,721.76,"/F8",9.96,"tesque sed risus sed. Lacinia lacus leo mattis quam pellen-"
306.60,700.95,557.38,709.80,"/F8",9.96,"tesque adipiscing. Sodales neque velit faucibus mus iaculis"
306.60,689.00,557.44,697.85,"/F8",9.96,"eget ultrices adipiscing montes. Aliquam magna sodales"
306.60,677.04,557.41,685.89,"/F8",9.96,"tincidunt nisi ligula ac mauris et semper. Laoreet netus"
306.60,665.09,503.46,673.94,"/F8",9.96,"quis egestas at praesent orci. Conubia donec."
306.60,635.20,557.53,644.05,"/F17",9.96,"2. Integer purus justo quisque blandit sapien etiam"
321.24,623.25,436.20,632.09,"/F17",9.96,"vestibulum pede dolor."
321.55,602.32,557.43,611.17,"/F8",9.96,"Posuere fusce. Laoreet felis eni diam a arcu velit metus"
306.60,590.37,557.37,599.22,"/F8",9.96,"lectus eget et elit lobortis nullam. Aliquet vitae. Dapibus"
306.60,578.41,557.43,587.26,"/F8",9.96,"dolor. Laoreet ipsum mi platea et cras integer in ve tem-"
306.60,566.46,557.37,575.31,"/F8",9.96,"pus pellentesque fringilla proin. Potenti nulla nec. Laoreet"
306.60,554.50,557.45,563.35,"/F8",9.96,"magna in bibendum. Potenti magna. Posuere morbi quam"
306.60,542.55,557.40,551.39,"/F8",9.96,"elit netus. Feugiat donec nulla quam mauris integer euis-"
306.60,530.59,557.44,539.44,"/F8",9.96,"mod. Aliquam curae. Egestas neque. Viverra metus morbi"
306.60,518.64,557.40,527.48,"/F8",9.96,"lobortis curae enim dui cras dictum dignissim eleifend auc-"
306.60,506.68,557.45,515.53,"/F8",9.96,"tor. Natoque massa arcu. Posuere justo. Cubilia class"
306.60,494.73,557.39,503.57,"/F8",9.96,"adipiscing integer. Integer proin erat sit dictum id. Feu-"
306.60,482.77,557.40,491.62,"/F8",9.96,"giat felis per adipiscing platea lacus phasellus. Potenti"
306.60,470.82,557.44,479.66,"/F8",9.96,"porta eget. Nonummy justo ut malesuada. Iaculis velit"
306.60,458.86,557.42,467.71,"/F8",9.96,"eget placerat nulla amet. Vivamus vitae eni faucibus con-"
306.60,446.91,381.99,455.75,"/F8",9.96,"sectetuer egestas."
321.55,434.95,557.44,443.80,"/F8",9.96,"Nonummy neque egestas pretium erat. Sodales risus mi"
306.60,423.00,557.40,431.84,"/F8",9.96,"a magnis ridiculus aenean quis elit nisi nullam imperdiet"
306.60,411.04,557.45,419.89,"/F8",9.96,"sodales pellentesque. Commodo vitae at ipsum ad nisi"
306.60,399.09,557.38,407.93,"/F8",9.96,"luctus blandit nonummy tristique eleifend eros sociis id"
306.60,387.13,557.43,395.98,"/F8",9.96,"consequat curae. Euismod purus cubilia lacus. Posuere"
306.60,375.18,557.38,384.02,"/F8",9.96,"justo pede viverra cursus nulla taciti. Euismod velit eros"
306.60,363.22,557.40,372.07,"/F8",9.96,"quis nunc et est nunc pede justo. Cubilia lorem per aptent"
306.60,351.27,557.44,360.11,"/F8",9.96,"cursus. Aliquam augue cras est sociis erat lorem incep-"
306.60,339.31,557.43,348.16,"/F8",9.96,"tos purus natoque malesuada nisl suspendisse ad. Iaculis"
306.60,327.36,557.45,336.20,"/F8",9.96,"proin at nisl fusce. Commodo risus arcu neque montes"
306.60,315.40,557.40,324.25,"/F8",9.96,"id duis nibh. Cubilia massa vel habitant pellentesque na-"
306.60,303.45,557.42,312.29,"/F8",9.96,"toque curabitur nunc per a litora. Conubia ipsum eu cur-"
306.60,291.49,557.39,300.34,"/F8",9.96,"sus ac litora dictumst ridiculus libero sociosqu. Gravida"
306.60,279.53,557.41,288.38,"/F8",9.96,"etiam in. Rhoncus purus est vitae nulla porta elit senec-"
306.60,267.58,557.42,276.43,"/F8",9.96,"tus. Integer ipsum erat est per at urna torquent proin"
306.60,255.62,557.43,264.47,"/F8",9.96,"ut. Euismod felis at aenean habitasse mi pede molestie"
306.60,243.67,557.43,252.52,"/F8",9.96,"magna. Posuere proin ve lorem mattis. Blandit felis ve"
306.60,231.71,557.41,240.56,"/F8",9.96,"vulputate. Cubilia ipsum quis cum eget tempus mi nisi"
306.60,219.76,557.44,228.61,"/F8",9.96,"fusce. Aliquam ipsum. Dapibus augue nunc sodales in ae-"
306.60,207.80,557.40,216.65,"/F8",9.96,"nean suscipit imperdiet. Integer fames quis tempus sapien"
306.60,195.85,338.11,204.70,"/F8",9.96,"cubilia."
321.55,183.89,557.49,192.74,"/F8",9.96,"Integer augue arcu posuere. Commodo purus lacus"
306.60,171.94,557.43,180.79,"/F8",9.96,"nibh arcu odio phasellus montes sociosqu suscipit ad ul-"
306.60,159.98,557.45,168.83,"/F8",9.96,"lamcorper odio enim elit id. Viverra netus. Commodo"
306.60,148.03,560.08,156.88,"/F8",9.96,"velit elit leo litora a vestibulum non class vestibulum laoreet"
306.60,136.07,557.43,144.92,"/F8",9.96,"nec ve egestas ante metus. Nonummy curae velit. Viverra"
306.60,124.12,557.43,132.96,"/F8",9.96,"vitae eget pretium lacus eget a donec id phasellus curae"
306.60,112.16,557.43,121.01,"/F8",9.96,"penatibus. Sodales fames ad etiam dui nostra duis erat."
306.60,100.21,557.41,109.05,"/F8",9.96,"Rhoncus curae nisi massa blandit turpis hendrerit hac pede"
306.60,88.25,557.42,97.10,"/F8",9.96,"mus sem. Aliquam neque vitae a mollis fringilla nulla id"
295.15,61.35,300.13,70.20,"/F8",9.96,"2"
