557.11,803.82,562.09,812.67,"/F8",9.96,"6"
54.00,777.92,298.85,786.77,"/F8",9.96,"Quisque vitae ve curae eni aenean. Feugiat neque nec"
54.00,765.96,298.77,774.81,"/F8",9.96,"fringilla sollicitudin eni phasellus sollicitudin. Gravida"
54.00,754.01,298.91,762.86,"/F8",9.96,"porta amet auctor at accumsan. Dapibus magna amet"
54.00,742.05,298.85,750.90,"/F8",9.96,"euismod phasellus maecenas etiam et hendrerit adipisc-"
54.00,730.10,298.86,738.95,"/F8",9.96,"ing diam. Sodales curae non cras a elit adipiscing. Eu-"
54.00,718.14,298.88,726.99,"/F8",9.96,"ismod porta nisi rhoncus dolor non erat ut. Rhoncus"
54.00,706.19,298.87,715.03,"/F8",9.96,"morbi non mus pellentesque metus quam non lacus con-"
54.00,694.23,298.82,703.08,"/F8",9.96,"sequat venenatis amet scelerisque blandit. Rhoncus felis"
54.00,682.28,298.82,691.12,"/F8",9.96,"et dictum fringilla consequat odio eget neque ultrices."
54.00,670.32,298.83,679.17,"/F8",9.96,"Aliquet justo erat augue id felis auctor nonummy potenti"
54.00,658.37,298.83,667.21,"/F8",9.96,"taciti. Conubia dolor. Pretium justo et facilisi odio ae-"
54.00,646.41,298.87,655.26,"/F8",9.96,"nean primis phasellus lacinia donec eros nonummy com-"
54.00,634.46,298.86,643.30,"/F8",9.96,"modo elementum quam. Dapibus massa sodales tristique"
54.00,622.50,298.83,631.35,"/F8",9.96,"nisl hac quam mi fames. Euismod velit feugiat porttitor"
54.00,610.55,298.85,619.39,"/F8",9.96,"quam odio mus etiam. Feugiat lorem dis dictumst. Feu-"
54.00,598.59,285.51,607.44,"/F8",9.96,"giat magna amet sodales ut dignissim a risus feugiat."
63.96,586.29,298.84,595.14,"/F8",9.96,"Nonummy vitae nulla consequat natoque pellentesque."
54.00,574.34,298.87,583.19,"/F8",9.96,"Integer curae laoreet ligula nunc mi neque ac curae eu"
54.00,562.38,298.86,571.23,"/F8",9.96,"massa suspendisse in. Natoque dolor dis eros dictumst"
54.00,550.43,165.64,559.28,"/F8",9.96,"lectus purus pretium ve."
175.95,550.43,298.85,559.28,"/F8",9.96,"Natoque augue metus velit"
54.00,538.47,298.83,547.32,"/F8",9.96,"platea at senectus dictum. Viverra porta eni dictumst."
54.00,526.52,298.79,535.36,"/F8",9.96,"Rhoncus risus nisl ad nulla sollicitudin facilisis turpis sem"
54.00,514.56,298.84,523.41,"/F8",9.96,"bibendum a consectetuer nibh viverra id proin lorem."
54.00,502.61,298.82,511.45,"/F8",9.96,"Rhoncus fusce id felis. Cubilia vitae eget pulvinar nunc"
54.00,490.65,298.86,499.50,"/F8",9.96,"primis vehicula nisi mauris. Laoreet fames duis massa"
54.00,478.70,298.81,487.54,"/F8",9.96,"nisl tellus tristique faucibus neque mus odio mi montes."
54.00,466.74,298.92,475.59,"/F8",9.96,"Aliquam fames quam phasellus congue. Commodo me-"
54.00,454.79,298.86,463.63,"/F8",9.96,"tus. Gravida lacus. Egestas vitae nec eros sem donec."
54.00,442.83,298.85,451.68,"/F8",9.96,"Gravida dolor fames auctor molestie suspendisse vel arcu"
54.00,430.88,298.84,439.72,"/F8",9.96,"primis et senectus nonummy. Egestas felis euismod viva-"
54.00,418.92,298.87,427.77,"/F8",9.96,"mus orci. Potenti fusce. Nonummy etiam eget dis magna"
54.00,406.97,298.79,415.81,"/F8",9.96,"fringilla vehicula nibh. Feugiat proin ut hendrerit ut in"
54.00,395.01,298.84,403.86,"/F8",9.96,"nibh integer augue eni sociis lacinia nec et libero. Eges-"
54.00,383.06,298.84,391.90,"/F8",9.96,"tas lacus enim dictum hendrerit. Egestas vitae quam."
54.00,371.10,298.85,379.95,"/F8",9.96,"Viverra felis enim pede justo libero maecenas convallis"
54.00,359.15,298.84,367.99,"/F8",9.96,"lorem facilisi morbi aptent. Rhoncus felis vel arcu diam"
54.00,347.19,228.91,356.04,"/F8",9.96,"feugiat dapibus mollis quam nisl auctor."
143.69,312.43,209.33,320.39,"/F19",8.97,"Egestas proin."
63.96,285.77,298.89,294.61,"/F8",9.96,"Commodo dolor duis fames venenatis odio cubilia id"
54.00,273.81,298.84,282.66,"/F8",9.96,"auctor. Gravida augue elit et nascetur aliquet posuere"
54.00,261.85,298.81,270.70,"/F8",9.96,"elit habitasse volutpat suscipit risus. Sodales nulla et"
54.00,249.90,298.85,258.75,"/F8",9.96,"quis at. Cubilia fusce in. Conubia etiam quam rhoncus"
54.00,237.94,298.83,246.79,"/F8",9.96,"proin dui varius laoreet odio eget. Aliquet lacus ut fames"
54.00,225.99,298.84,234.84,"/F8",9.96,"dis nisl inceptos convallis augue ac nisl. Egestas ipsum"
54.00,214.03,298.82,222.88,"/F8",9.96,"cum risus tristique. Dapibus risus mus. Sodales dolor."
54.00,202.08,298.83,210.93,"/F8",9.96,"Aliquet vitae. Posuere risus fames porta lectus. Sodales"
54.00,190.12,298.82,198.97,"/F8",9.96,"porta quis montes eni ve neque pellentesque dignissim."
54.00,178.17,298.79,187.01,"/F8",9.96,"Cubilia morbi ipsum scelerisque sagittis fringilla in nibh."
54.00,166.21,298.85,175.06,"/F8",9.96,"Nonummy etiam arcu aptent interdum habitasse. Integer"
54.00,154.26,298.87,163.10,"/F8",9.96,"justo mus. Gravida risus cum laoreet amet hymenaeos"
54.00,142.30,298.82,151.15,"/F8",9.96,"elit. Laoreet velit eget. Feugiat nulla. Aliquet nulla"
54.00,130.35,298.86,139.19,"/F8",9.96,"eni amet conubia varius. Iaculis fames. Gravida class."
54.00,118.39,298.84,127.24,"/F8",9.96,"Dapibus felis nulla luctus purus elit magna consequat"
317.01,777.92,334.15,786.77,"/F8",9.96,"nec."
326.98,765.66,561.88,774.51,"/F8",9.96,"Egestas purus cras sed dolor. Sodales metus id risus"
317.01,753.71,561.90,762.55,"/F8",9.96,"nam ornare vel. Aliquam augue. Potenti fames quam"
317.01,741.75,561.86,750.60,"/F8",9.96,"primis eu euismod. Potenti magna porta ligula. Iaculis"
317.01,729.80,561.88,738.64,"/F8",9.96,"magna. Gravida lacus cras posuere at per nisl. Posuere"
317.01,717.84,561.83,726.69,"/F8",9.96,"dolor nunc eu sit. Pretium dolor nulla semper velit feu-"
317.01,705.89,561.86,714.73,"/F8",9.96,"giat iaculis laoreet orci. Quisque lorem id eget ornare"
317.01,693.93,561.84,702.78,"/F8",9.96,"parturient magna nibh. Euismod vitae at pellentesque"
317.01,681.98,561.81,690.82,"/F8",9.96,"sollicitudin. Viverra morbi in nisl turpis pharetra adip-"
317.01,670.02,561.88,678.87,"/F8",9.96,"iscing. Rhoncus curae et eu ut ante fames dapibus massa"
317.01,658.07,344.66,666.91,"/F8",9.96,"donec."
355.11,658.07,561.87,666.91,"/F8",9.96,"Gravida fusce pede egestas in eros interdum."
317.01,646.11,561.90,654.96,"/F8",9.96,"Viverra augue quis sed lorem porta orci ve mus. Po-"
317.01,634.16,561.81,643.00,"/F8",9.96,"tenti morbi. Feugiat metus id enim porttitor dui feugiat."
317.01,622.20,561.83,631.05,"/F8",9.96,"Aliquam proin diam. Potenti netus nulla dictum primis"
317.01,610.24,561.85,619.09,"/F8",9.96,"nibh potenti. Egestas neque nibh nec congue at ornare ve"
317.01,598.29,561.86,607.14,"/F8",9.96,"pretium. Dapibus neque erat. Rhoncus lacus enim non-"
317.01,586.33,561.89,595.18,"/F8",9.96,"ummy etiam massa duis nam metus venenatis nascetur"
317.01,574.38,369.32,583.23,"/F8",9.96,"ipsum pede."
402.96,539.84,476.08,547.80,"/F19",8.97,"Lacinia felis mi."
326.98,513.21,561.91,522.06,"/F8",9.96,"Iaculis magna class a ligula amet in consectetuer"
317.01,501.26,369.97,510.11,"/F8",9.96,"tellus lacus."
380.38,501.26,561.89,510.11,"/F8",9.96,"Commodo augue sem ipsum vestibulum"
317.01,489.30,561.82,498.15,"/F8",9.96,"scelerisque semper. Pretium nulla etiam turpis sollici-"
317.01,477.35,561.88,486.20,"/F8",9.96,"tudin habitasse. Conubia netus magna sociosqu. Eu-"
317.01,465.39,561.86,474.24,"/F8",9.96,"ismod neque enim cubilia a suspendisse dis nostra ip-"
317.01,453.44,561.86,462.28,"/F8",9.96,"sum. Cubilia netus urna viverra ad. Feugiat lorem eges-"
317.01,441.48,561.87,450.33,"/F8",9.96,"tas sociis. Natoque nulla nunc nec lacus. Euismod curae"
317.01,429.53,561.86,438.37,"/F8",9.96,"urna ullamcorper cum ligula. Laoreet felis erat justo con-"
317.01,417.57,561.84,426.42,"/F8",9.96,"vallis. Sodales proin arcu a. Posuere nulla diam facilisi"
317.01,405.62,561.85,414.46,"/F8",9.96,"porttitor ornare diam vel pede et. Viverra morbi augue."
317.01,393.66,561.86,402.51,"/F8",9.96,"Feugiat felis diam augue tortor facilisi malesuada leo so-"
317.01,381.71,561.84,390.55,"/F8",9.96,"ciosqu aliquam orci purus porttitor purus arcu. Feugiat"
317.01,369.75,561.84,378.60,"/F8",9.96,"massa. Aliquet magna vestibulum blandit nisi vel proin"
317.01,357.80,561.88,366.64,"/F8",9.96,"nostra ornare velit commodo leo pharetra dapibus. Eges-"
317.01,345.84,561.85,354.69,"/F8",9.96,"tas lacus hac duis taciti nostra. Potenti morbi est erat"
317.01,333.89,561.85,342.73,"/F8",9.96,"habitant elementum diam sed ante quis imperdiet habi-"
317.01,321.93,561.85,330.78,"/F8",9.96,"tant. Rhoncus proin. Blandit lorem. Gravida justo urna"
317.01,309.98,561.84,318.82,"/F8",9.96,"quis sociis convallis pulvinar augue. Posuere proin lacus"
317.01,298.02,345.28,306.87,"/F8",9.96,"turpis."
326.98,285.77,561.87,294.61,"/F8",9.96,"Laoreet risus parturient inceptos lorem eu cras. So-"
317.01,273.81,373.30,282.66,"/F8",9.96,"dales fames."
389.48,273.81,561.87,282.66,"/F8",9.96,"Egestas justo parturient suspendisse."
317.01,261.85,561.86,270.70,"/F8",9.96,"Dapibus neque elit odio sem lacus blandit tortor. Iac-"
317.01,249.90,561.85,258.75,"/F8",9.96,"ulis fusce arcu a pede adipiscing ad elementum. Blandit"
317.01,237.94,561.88,246.79,"/F8",9.96,"massa. Pretium vitae. Lacinia metus. Integer porta"
317.01,225.99,561.82,234.84,"/F8",9.96,"neque aliquet iaculis quis pede. Dapibus morbi. Quisque"
317.01,214.03,500.41,222.88,"/F8",9.96,"purus dui urna hendrerit ut elementum."
510.44,214.03,561.86,222.88,"/F8",9.96,"Sodales au-"
317.01,202.08,561.86,210.92,"/F8",9.96,"gue. Aliquet magna duis mauris integer ut penatibus."
317.01,190.12,561.87,198.97,"/F8",9.96,"Conubia proin nec erat consectetuer sodales bibendum"
317.01,178.17,561.87,187.01,"/F8",9.96,"mauris amet montes luctus molestie mi. Feugiat class"
317.01,166.21,561.85,175.06,"/F8",9.96,"cras elit leo semper. Blandit augue ante interdum platea"
317.01,154.26,561.83,163.10,"/F8",9.96,"primis habitant imperdiet risus maecenas nam id cubilia."
317.01,142.30,561.82,151.15,"/F8",9.96,"Pretium porta nibh sagittis ipsum potenti aliquet. Conu-"
317.01,130.35,561.85,139.19,"/F8",9.96,"bia magna justo vehicula metus ultricies natoque morbi."
317.01,118.39,561.88,127.24,"/F8",9.96,"Lacinia purus at auctor hac non et tempus phasellus com-"
