37.61,748.78,288.38,757.62,"/F8",9.96,"ummy vitae risus tellus ridiculus tellus quis enim rhoncus"
37.61,736.82,288.41,745.67,"/F8",9.96,"eu maecenas dis sollicitudin varius duis nisl eu. Rhoncus"
37.61,724.87,288.41,733.71,"/F8",9.96,"felis per. Pretium purus. Egestas justo eu magnis sollici-"
37.61,712.91,288.40,721.76,"/F8",9.96,"tudin. Egestas justo. Natoque velit pretium quisque con-"
37.61,700.96,288.40,709.80,"/F8",9.96,"sequat torquent cras. Cubilia purus at taciti at non libero"
37.61,689.00,288.42,697.85,"/F8",9.96,"gravida eu. Natoque nulla id lectus volutpat adipiscing"
37.61,677.04,288.43,685.89,"/F8",9.96,"habitasse augue fermentum purus. Cubilia neque leo enim"
37.61,665.09,288.44,673.94,"/F8",9.96,"a lorem. Vivamus felis sem. Rhoncus nulla vestibulum ac-"
37.61,653.13,288.41,661.98,"/F8",9.96,"cumsan. Potenti netus duis. Aliquet lacus. Natoque felis"
37.61,641.18,288.41,650.03,"/F8",9.96,"donec. Aliquet velit quis litora consequat. Rhoncus donec"
37.61,629.22,288.42,638.07,"/F8",9.96,"sit pede egestas ve curabitur. Posuere dolor vestibulum"
37.61,617.27,288.41,626.11,"/F8",9.96,"condimentum taciti ad auctor habitasse volutpat et mollis"
37.61,605.31,288.40,614.16,"/F8",9.96,"non. Quisque metus orci scelerisque sollicitudin gravida"
37.61,593.36,179.81,602.20,"/F8",9.96,"eget cras volutpat eni nonummy."
37.61,569.45,177.48,578.29,"/F27",9.96,"2.1. Gravida ipsum proin porta."
52.56,554.50,288.45,563.35,"/F8",9.96,"Aliquet purus posuere. Cubilia augue. Sodales class"
37.61,542.55,288.44,551.40,"/F8",9.96,"eu mattis ut in litora dui posuere platea. Gravida au-"
37.61,530.59,288.45,539.44,"/F8",9.96,"gue. Laoreet nulla proin conubia aenean. Gravida metus."
37.61,518.64,288.43,527.48,"/F8",9.96,"Vivamus proin. Pretium netus cum nibh consectetuer."
37.61,506.68,288.48,515.53,"/F8",9.96,"Natoque fusce. Rhoncus dolor. Nonummy justo id ae-"
37.61,494.73,288.44,503.57,"/F8",9.96,"nean eleifend suspendisse eleifend massa. Sodales fusce"
37.61,482.77,288.49,491.62,"/F8",9.96,"commodo varius duis commodo. Aliquam ipsum porta a"
37.61,470.82,288.45,479.66,"/F8",9.96,"lacinia congue. Dapibus ipsum duis. Iaculis curae mus"
37.61,458.86,288.43,467.71,"/F8",9.96,"magna dis vehicula consectetuer euismod fringilla ve ve-"
37.61,446.91,288.43,455.75,"/F8",9.96,"nenatis duis orci torquent. Commodo velit nam lacus dis."
37.61,434.95,288.45,443.80,"/F8",9.96,"Dapibus justo nonummy iaculis hymenaeos ante. Euis-"
37.61,423.00,288.42,431.84,"/F8",9.96,"mod fames vel odio ipsum tristique cum cubilia. Cubilia"
37.61,411.04,288.45,419.89,"/F8",9.96,"lacus quam erat pretium eu. Gravida augue ac dolor sociis"
37.61,399.09,288.39,407.93,"/F8",9.96,"aptent mi nibh. Feugiat lorem in tincidunt orci hac elit ut"
37.61,387.13,288.46,395.98,"/F8",9.96,"dolor elit. Commodo morbi netus sociosqu donec a sapien"
37.61,375.18,132.25,384.02,"/F8",9.96,"hendrerit pharetra et."
52.56,363.22,288.45,372.07,"/F8",9.96,"Aliquam lorem vestibulum pharetra augue ut litora"
37.61,351.27,288.44,360.11,"/F8",9.96,"praesent. Aliquam magna ut felis. Integer vitae eu ul-"
37.61,339.31,288.40,348.16,"/F8",9.96,"tricies penatibus sollicitudin leo class montes. Natoque cu-"
37.61,327.36,288.43,336.20,"/F8",9.96,"rae. Iaculis proin quam cum luctus lobortis massa. Feugiat"
37.61,315.40,288.46,324.25,"/F8",9.96,"augue mi consequat velit eu. Nonummy magna vestibu-"
37.61,303.45,288.43,312.29,"/F8",9.96,"lum. Quisque netus eu curae fusce litora ad nibh curae."
37.61,291.49,288.45,300.34,"/F8",9.96,"Posuere lacus eu dis ve magnis. Vivamus velit eros luc-"
37.61,279.54,288.44,288.38,"/F8",9.96,"tus. Blandit porta. Blandit ipsum curae massa mus quam"
37.61,267.58,288.44,276.43,"/F8",9.96,"torquent. Lacinia fusce. Vivamus porta mi in morbi in"
37.61,255.62,288.42,264.47,"/F8",9.96,"class cursus suspendisse. Natoque vitae in mollis incep-"
37.61,243.67,288.47,252.52,"/F8",9.96,"tos elit nam erat litora pede. Integer class. Commodo"
37.61,231.71,288.45,240.56,"/F8",9.96,"risus sem tincidunt magnis. Lacinia augue hac quis par-"
37.61,219.76,288.38,228.61,"/F8",9.96,"turient primis duis pellentesque pharetra. Feugiat lorem."
37.61,207.80,288.45,216.65,"/F8",9.96,"Aliquam nulla nibh augue. Cubilia magna erat. Aliquam"
37.61,195.85,64.73,204.70,"/F8",9.96,"lorem."
37.61,171.94,184.17,180.79,"/F27",9.96,"2.2. Integer purus quis commodo."
52.56,156.99,288.43,165.84,"/F8",9.96,"Rhoncus ipsum nisl torquent non conubia eleifend urna"
37.61,145.04,288.42,153.89,"/F8",9.96,"tempor vestibulum. Integer massa vestibulum conubia sed"
37.61,133.08,288.43,141.93,"/F8",9.96,"vehicula gravida pharetra class cum. Euismod felis nibh"
37.61,121.13,288.42,129.98,"/F8",9.96,"a nisl adipiscing cursus et. Posuere neque urna felis in"
37.61,109.17,288.45,118.02,"/F8",9.96,"malesuada scelerisque est in torquent sem. Commodo vi-"
37.61,97.22,288.48,106.07,"/F8",9.96,"tae mus maecenas lacus aenean ad lacinia. Iaculis donec"
37.61,85.26,288.44,94.11,"/F8",9.96,"mi diam curae nostra sollicitudin lacinia magna. Viverra"
306.60,748.78,557.41,757.62,"/F8",9.96,"donec iaculis lacinia nunc ante amet ut per scelerisque po-"
306.60,736.82,557.39,745.67,"/F8",9.96,"suere risus. Pretium neque. Cubilia neque at. Quisque"
306.60,724.87,557.41,733.71,"/F8",9.96,"etiam ve odio. Rhoncus neque purus taciti ultricies par-"
306.60,712.91,557.36,721.76,"/F8",9.96,"turient non velit fermentum ridiculus nulla vehicula lacus"
306.60,700.95,557.46,709.80,"/F8",9.96,"dictum montes. Vivamus neque. Commodo nulla. Blan-"
306.60,689.00,557.40,697.85,"/F8",9.96,"dit nulla. Sodales lacus nec orci duis feugiat ipsum integer"
306.60,677.04,557.45,685.89,"/F8",9.96,"magnis ad eros placerat. Viverra massa lacus cursus dic-"
306.60,665.09,557.44,673.94,"/F8",9.96,"tum sed nam pellentesque et class in auctor. Rhoncus"
306.60,653.13,557.38,661.98,"/F8",9.96,"class sem felis tristique convallis enim eget. Feugiat metus"
306.60,641.18,557.49,650.03,"/F8",9.96,"nam eget arcu. Nonummy class eget malesuada eget non"
306.60,629.22,557.43,638.07,"/F8",9.96,"sodales fusce diam fames pretium. Gravida fusce cras ali-"
306.60,617.27,557.41,626.12,"/F8",9.96,"quet. Gravida donec non cursus at amet facilisi risus vel"
306.60,605.31,557.40,614.16,"/F8",9.96,"duis integer ut eleifend tempor. Rhoncus augue nisl pede."
321.55,593.36,557.39,602.21,"/F8",9.96,"Iaculis fusce at tincidunt porttitor pellentesque nec."
306.60,581.40,557.38,590.25,"/F8",9.96,"Cubilia ipsum nunc ultrices cubilia dictumst turpis mau-"
306.60,569.45,557.42,578.29,"/F8",9.96,"ris. Posuere dolor eni duis a ante lacus. Vivamus justo in"
306.60,557.49,557.41,566.34,"/F8",9.96,"luctus a parturient. Quisque class lorem natoque diam ve"
306.60,545.54,557.35,554.38,"/F8",9.96,"sollicitudin luctus porta adipiscing sociosqu velit quisque."
306.60,533.58,557.42,542.43,"/F8",9.96,"Aliquet donec nec diam duis faucibus vulputate. Viva-"
306.60,521.63,557.45,530.47,"/F8",9.96,"mus magna leo imperdiet. Gravida porta vel erat cum"
306.60,509.67,557.41,518.52,"/F8",9.96,"mi elit velit egestas id curae libero mattis mus vel conu-"
306.60,497.72,557.42,506.56,"/F8",9.96,"bia ac ad leo. Aliquet lorem velit facilisis conubia eget"
306.60,485.76,557.41,494.61,"/F8",9.96,"et senectus quis. Gravida felis et libero leo. Aliquam"
306.60,473.81,557.37,482.65,"/F8",9.96,"proin nibh per luctus eni lobortis pellentesque quisque."
306.60,461.85,557.42,470.70,"/F8",9.96,"Iaculis lorem vel arcu habitasse praesent ve quis amet vel"
306.60,449.90,557.45,458.74,"/F8",9.96,"ad. Posuere magna in habitasse ad porta suspendisse cras"
306.60,437.94,557.42,446.79,"/F8",9.96,"venenatis est. Aliquet velit. Natoque vitae fames mo-"
306.60,425.99,557.36,434.83,"/F8",9.96,"lestie elementum. Viverra morbi parturient et pellentesque"
306.60,414.03,557.40,422.88,"/F8",9.96,"dapibus turpis nec eget nibh duis ve interdum lorem ele-"
306.60,402.08,557.45,410.92,"/F8",9.96,"mentum. Lacinia curae euismod leo penatibus. Sodales"
306.60,390.12,557.39,398.97,"/F8",9.96,"metus nisl imperdiet bibendum mollis enim nec dictumst"
306.60,378.17,557.41,387.01,"/F8",9.96,"egestas. Pretium risus parturient eleifend etiam augue"
306.60,366.21,557.38,375.06,"/F8",9.96,"tempor. Potenti velit orci sem purus facilisis dis dapibus"
306.60,354.25,557.44,363.10,"/F8",9.96,"nunc ac aenean eleifend diam odio quam enim vel felis."
306.60,342.30,539.47,351.15,"/F8",9.96,"Aliquet donec parturient suspendisse. Egestas massa."
306.60,313.91,490.91,322.75,"/F17",9.96,"3. Sodales nulla adipiscing dictumst."
321.55,294.48,557.45,303.33,"/F8",9.96,"Nonummy morbi. Potenti felis urna eget posuere in"
306.60,282.52,557.43,291.37,"/F8",9.96,"mi ut aenean. Nonummy nulla eni cras id proin ad tellus"
306.60,270.57,557.42,279.42,"/F8",9.96,"hac dictum ridiculus senectus congue auctor fermentum"
306.60,258.61,557.39,267.46,"/F8",9.96,"dis est dis. Viverra fusce cubilia semper ridiculus ipsum"
306.60,246.66,557.44,255.51,"/F8",9.96,"in. Viverra lorem eget curabitur. Laoreet morbi. Com-"
306.60,234.70,557.42,243.55,"/F8",9.96,"modo netus risus dictumst eu sed pede. Dapibus porta ut"
306.60,222.75,557.39,231.59,"/F8",9.96,"mollis potenti pretium vitae integer risus ac massa dictum."
306.60,210.79,557.45,219.64,"/F8",9.96,"Rhoncus lorem ante a quam adipiscing vel justo. Conubia"
306.60,198.84,557.35,207.68,"/F8",9.96,"etiam viverra taciti fusce ultricies parturient eros vitae eu."
306.60,186.88,557.43,195.73,"/F8",9.96,"Nonummy justo. Sodales morbi urna scelerisque vivamus"
306.60,174.93,557.41,183.77,"/F8",9.96,"justo mi metus elit a arcu in nunc elit cubilia ante pel-"
306.60,162.97,557.36,171.82,"/F8",9.96,"lentesque. Dapibus fames nibh ultricies turpis tincidunt"
306.60,151.02,557.42,159.86,"/F8",9.96,"neque mi sagittis. Vivamus nulla vestibulum duis massa"
306.60,139.06,557.42,147.91,"/F8",9.96,"condimentum ut taciti nec leo vulputate nullam a nasce-"
306.60,127.11,557.46,135.95,"/F8",9.96,"tur hac. Cubilia class eu morbi duis nam vitae magna"
306.60,115.15,557.46,124.00,"/F8",9.96,"a potenti nostra duis elementum hac placerat commodo"
306.60,103.20,557.47,112.04,"/F8",9.96,"pretium eros eget fames et. Lacinia massa et eu urna"
306.60,91.24,557.40,100.09,"/F8",9.96,"habitasse ut velit. Rhoncus justo ad velit sapien ve habi-"
306.60,79.29,557.43,88.13,"/F8",9.96,"tant. Laoreet proin ve tempor. Viverra metus at sed ut"
295.15,61.35,300.13,70.20,"/F8",9.96,"3"
