37.61,748.78,216.81,757.62,"/F17",9.96,"2. Commodo fusce justo a natoque."
52.56,727.85,288.44,736.70,"/F8",9.96,"Quisque donec eni ipsum fermentum. Pretium porta"
37.61,715.90,288.43,724.75,"/F8",9.96,"duis leo orci. Blandit etiam eros lobortis a consectetuer"
37.61,703.94,288.44,712.79,"/F8",9.96,"nisl sodales at nulla. Feugiat velit ad massa nostra hen-"
37.61,691.99,288.42,700.84,"/F8",9.96,"drerit morbi. Integer ipsum. Aliquam porta etiam rhoncus"
37.61,680.03,288.43,688.88,"/F8",9.96,"nonummy ridiculus elit cum. Sodales donec nec inceptos"
37.61,668.08,288.41,676.92,"/F8",9.96,"aliquam. Gravida justo cras turpis. Cubilia lacus. Sodales"
37.61,656.12,288.43,664.97,"/F8",9.96,"fusce. Nonummy metus arcu volutpat adipiscing tortor."
37.61,644.17,288.42,653.01,"/F8",9.96,"Aliquet metus urna elit nonummy ad quis. Quisque porta"
37.61,632.21,288.40,641.06,"/F8",9.96,"mus elit tristique auctor orci. Potenti neque mus litora"
37.61,620.26,288.49,629.10,"/F8",9.96,"ad quam proin commodo eget. Conubia donec. Aliquam"
37.61,608.30,288.45,617.15,"/F8",9.96,"augue ut nisl tempus sem amet nibh sit ad arcu. Integer"
37.61,596.35,288.43,605.19,"/F8",9.96,"nulla. Aliquam velit. Laoreet massa ut proin praesent."
37.61,584.39,288.45,593.24,"/F8",9.96,"Rhoncus curae quis inceptos interdum porta malesuada"
37.61,572.44,238.40,581.28,"/F8",9.96,"mollis duis. Pretium magna. Nonummy fusce."
52.56,560.48,288.46,569.33,"/F8",9.96,"Egestas porta duis elit feugiat ad tempus pede. Po-"
37.61,548.53,288.44,557.37,"/F8",9.96,"suere lorem. Integer vitae. Natoque dolor. Iaculis lacus"
37.61,536.57,288.43,545.42,"/F8",9.96,"eu nisi consequat luctus massa conubia et platea at neque."
37.61,524.62,288.46,533.46,"/F8",9.96,"Dapibus class cum. Rhoncus augue nec. Dapibus proin"
37.61,512.66,288.40,521.51,"/F8",9.96,"amet nisi est curae class senectus elit. Gravida neque vitae"
37.61,500.71,288.47,509.55,"/F8",9.96,"congue. Viverra magna massa amet eu leo quis. Iaculis fe-"
37.61,488.75,288.45,497.60,"/F8",9.96,"lis commodo nam platea. Posuere netus eros habitasse sit"
37.61,476.80,288.42,485.64,"/F8",9.96,"viverra id. Feugiat justo felis platea at. Gravida massa."
37.61,464.84,288.43,473.69,"/F8",9.96,"Blandit augue natoque sociis erat pede vestibulum urna"
37.61,452.89,288.43,461.73,"/F8",9.96,"class imperdiet venenatis pede sed quam. Viverra dolor"
37.61,440.93,288.41,449.78,"/F8",9.96,"gravida diam pharetra fermentum tellus habitant parturi-"
37.61,428.97,288.43,437.82,"/F8",9.96,"ent. Euismod velit amet gravida ut et nibh fermentum"
37.61,417.02,288.47,425.87,"/F8",9.96,"semper lorem nisl. Laoreet lorem ante maecenas dolor ac"
37.61,405.06,288.40,413.91,"/F8",9.96,"sed cras vulputate dis sollicitudin ve. Dapibus porta massa"
37.61,393.11,288.45,401.96,"/F8",9.96,"magna dictum lacus. Rhoncus dolor arcu metus. Potenti"
37.61,381.15,288.42,390.00,"/F8",9.96,"felis dolor justo. Posuere neque elit urna netus augue eni"
37.61,369.20,64.43,378.05,"/F8",9.96,"quam."
52.56,357.24,288.45,366.09,"/F8",9.96,"Euismod vitae nulla urna eni quis gravida sit. Com-"
37.61,345.29,288.47,354.13,"/F8",9.96,"modo neque massa inceptos magna. Euismod proin lacinia"
37.61,333.33,288.42,342.18,"/F8",9.96,"platea. Cubilia etiam. Natoque felis vel diam netus ve."
37.61,321.38,288.45,330.22,"/F8",9.96,"Integer neque arcu pede nunc vitae diam eni dolor conse-"
37.61,309.42,288.40,318.27,"/F8",9.96,"quat ut risus amet integer a. Iaculis velit viverra natoque"
37.61,297.47,288.43,306.31,"/F8",9.96,"cursus ve dui nisl eu senectus. Aliquam morbi laoreet"
37.61,285.51,288.44,294.36,"/F8",9.96,"sociis ac. Egestas metus est gravida dolor nisi. Viverra"
37.61,273.56,113.63,282.40,"/F8",9.96,"purus leo massa."
123.94,273.56,288.45,282.40,"/F8",9.96,"Conubia felis arcu dictumst adipisc-"
37.61,261.60,288.44,270.45,"/F8",9.96,"ing lectus proin. Nonummy morbi vestibulum placerat"
37.61,249.65,288.41,258.49,"/F8",9.96,"viverra dapibus elementum eleifend tortor purus egestas"
37.61,237.69,288.39,246.54,"/F8",9.96,"arcu inceptos. Pretium velit ac libero praesent suspendisse"
37.61,225.74,288.41,234.58,"/F8",9.96,"nascetur. Cubilia donec curae dapibus enim duis volutpat."
37.61,213.78,288.39,222.63,"/F8",9.96,"Blandit risus. Posuere purus enim aptent viverra. Feugiat"
37.61,201.83,288.46,210.67,"/F8",9.96,"metus at justo habitasse mus commodo a scelerisque. Cu-"
37.61,189.87,288.42,198.72,"/F8",9.96,"bilia dolor. Commodo felis. Posuere risus ut donec primis."
37.61,177.92,186.10,186.76,"/F8",9.96,"Sodales justo. Feugiat nulla justo."
37.61,154.01,262.30,162.85,"/F27",9.96,"2.1. Nonummy morbi et magna sem erat nec lacus."
52.56,139.06,288.47,147.91,"/F8",9.96,"Laoreet metus ve. Rhoncus curae. Potenti donec mus"
37.61,127.11,288.42,135.95,"/F8",9.96,"maecenas a nascetur nec ac litora sollicitudin imperdiet."
37.61,115.15,295.98,124.00,"/F8",9.96,"Egestas etiam vitae montes semper ultrices curabitur. Conu-"
37.61,103.20,288.40,112.04,"/F8",9.96,"bia magna mus hendrerit sollicitudin dui fermentum incep-"
37.61,91.24,288.42,100.09,"/F8",9.96,"tos porta eu. Natoque nulla netus posuere lacinia sociis dui"
306.60,748.78,557.43,757.62,"/F8",9.96,"tellus molestie penatibus pharetra. Lacinia magna. Com-"
306.60,736.82,557.45,745.67,"/F8",9.96,"modo massa etiam sem lobortis pellentesque nonummy pe-"
306.60,724.87,557.42,733.71,"/F8",9.96,"natibus nascetur ipsum pede. Rhoncus netus lacus nisi."
306.60,712.91,557.40,721.76,"/F8",9.96,"Viverra netus. Aliquet lorem eros taciti. Cubilia lacus"
306.60,700.95,557.43,709.80,"/F8",9.96,"odio eni urna adipiscing. Potenti fames nisi ornare. Ia-"
306.60,689.00,557.41,697.85,"/F8",9.96,"culis proin. Pretium morbi egestas class id et. Blandit"
306.60,677.04,557.42,685.89,"/F8",9.96,"porta cras morbi mauris nulla adipiscing lacinia erat. Vi-"
306.60,665.09,557.40,673.94,"/F8",9.96,"vamus velit id ipsum et quis dictum torquent. Natoque"
306.60,653.13,557.40,661.98,"/F8",9.96,"fames netus. Quisque nulla. Blandit nulla quam vel sagit-"
306.60,641.18,557.42,650.02,"/F8",9.96,"tis a consectetuer quam conubia mi vel ad. Euismod nulla."
306.60,629.22,368.62,638.07,"/F8",9.96,"Sodales porta."
321.55,617.27,557.45,626.11,"/F8",9.96,"Lacinia class. Viverra donec enim a magna ut facilisis."
306.60,605.31,557.41,614.16,"/F8",9.96,"Potenti ipsum odio praesent imperdiet mollis sem. Feu-"
306.60,593.36,557.43,602.20,"/F8",9.96,"giat justo eu varius felis leo amet eros elementum leo cras"
306.60,581.40,557.44,590.25,"/F8",9.96,"pede. Aliquam curae parturient diam ornare hymenaeos"
306.60,569.45,557.43,578.29,"/F8",9.96,"vulputate consectetuer hac. Pretium curae. Nonummy"
306.60,557.49,557.42,566.34,"/F8",9.96,"class vestibulum aliquet pede et donec leo cras placerat"
306.60,545.54,557.37,554.38,"/F8",9.96,"vestibulum tempor velit. Iaculis ipsum. Cubilia felis urna"
306.60,533.58,557.41,542.43,"/F8",9.96,"aliquet dolor duis porta. Gravida morbi. Integer etiam."
306.60,521.63,557.39,530.47,"/F8",9.96,"Quisque curae arcu fringilla aenean in litora eleifend enim"
306.60,509.67,557.42,518.52,"/F8",9.96,"congue vivamus feugiat felis. Egestas risus class varius"
306.60,497.72,557.45,506.56,"/F8",9.96,"nascetur ullamcorper eni. Viverra magna. Rhoncus fames"
306.60,485.76,557.45,494.61,"/F8",9.96,"id nostra mi. Rhoncus porta enim odio senectus ullam-"
306.60,473.81,557.44,482.65,"/F8",9.96,"corper praesent phasellus sem. Vivamus porta. Sodales"
306.60,461.85,557.43,470.70,"/F8",9.96,"massa. Aliquet massa fusce dis habitasse. Cubilia netus"
306.60,449.90,557.41,458.74,"/F8",9.96,"amet ut felis primis. Quisque justo ut class eu morbi eu"
306.60,437.94,557.39,446.79,"/F8",9.96,"in dui. Gravida etiam nisl donec ornare facilisis facilisi"
306.60,425.99,339.23,434.83,"/F8",9.96,"congue."
321.55,414.03,566.72,422.88,"/F8",9.96,"Aliquet purus nibh dui metus sit congue per nam fringilla."
306.60,402.08,557.38,410.92,"/F8",9.96,"Integer donec felis dictumst pede facilisi suscipit nulla ae-"
306.60,390.12,557.39,398.97,"/F8",9.96,"nean sollicitudin dapibus senectus cursus congue. Pretium"
306.60,378.17,557.41,387.01,"/F8",9.96,"felis eget nonummy ut laoreet. Cubilia felis donec ornare"
306.60,366.21,557.44,375.06,"/F8",9.96,"id congue hymenaeos et venenatis magna dictumst et sus-"
306.60,354.25,557.42,363.10,"/F8",9.96,"pendisse. Laoreet donec. Pretium vitae. Posuere felis"
306.60,342.30,557.39,351.15,"/F8",9.96,"urna. Feugiat etiam purus lectus hendrerit vestibulum"
306.60,330.34,557.43,339.19,"/F8",9.96,"nibh habitasse cursus a sodales libero. Sodales metus cras"
306.60,318.39,557.40,327.24,"/F8",9.96,"aliquet nam curabitur hac sollicitudin proin cras. Eges-"
306.60,306.43,557.42,315.28,"/F8",9.96,"tas etiam integer leo sociis mi torquent viverra. Rhon-"
306.60,294.48,557.42,303.33,"/F8",9.96,"cus morbi. Iaculis fusce enim egestas rutrum tellus conu-"
306.60,282.52,557.46,291.37,"/F8",9.96,"bia. Conubia fames diam mus magna ridiculus ut conse-"
306.60,270.57,557.39,279.42,"/F8",9.96,"quat. Cubilia proin quis gravida nisi vestibulum varius"
306.60,258.61,557.43,267.46,"/F8",9.96,"eget scelerisque aliquet mus eu. Commodo curae. Cubilia"
306.60,246.66,557.43,255.51,"/F8",9.96,"donec purus quis per hac leo vel in laoreet enim amet pu-"
306.60,234.70,557.45,243.55,"/F8",9.96,"rus risus. Conubia curae eu est nisi eros magna conubia"
306.60,222.75,557.39,231.59,"/F8",9.96,"nibh. Pretium fusce. Dapibus augue. Aliquet felis viva-"
306.60,210.79,557.41,219.64,"/F8",9.96,"mus. Commodo metus aliquet ut imperdiet. Cubilia justo."
306.60,188.38,557.47,197.22,"/F27",9.96,"2.2. Iaculis lacus proin hac dictum feugiat tempor nec feu-"
327.99,176.42,347.07,185.27,"/F27",9.96,"giat."
321.55,162.97,557.47,171.82,"/F8",9.96,"Quisque etiam quam magna. Iaculis donec ante nunc"
306.60,151.02,557.43,159.86,"/F8",9.96,"habitasse ac. Aliquet nulla est commodo nunc vivamus ne-"
306.60,139.06,557.39,147.91,"/F8",9.96,"tus diam. Integer netus eget ultrices. Potenti fusce lacus"
306.60,127.11,557.44,135.95,"/F8",9.96,"nec proin consequat natoque ornare. Pretium massa amet"
306.60,115.15,557.36,124.00,"/F8",9.96,"integer taciti ante scelerisque viverra scelerisque enim nibh"
306.60,103.20,557.42,112.04,"/F8",9.96,"dolor ultrices vestibulum sapien fames. Egestas curae mi"
306.60,91.24,557.45,100.09,"/F8",9.96,"velit ut a platea duis sodales mi ad. Pretium magna ad"
306.60,79.29,557.41,88.13,"/F8",9.96,"sollicitudin. Pretium magna. Gravida proin porta dui"
295.15,61.35,300.13,70.20,"/F8",9.96,"3"
