37.61,748.78,288.38,757.62,"/F8",9.96,"bilia velit dapibus mauris elit potenti. Aliquet etiam diam"
37.61,736.82,132.51,745.67,"/F8",9.96,"nisl nunc vestibulum."
140.23,736.82,288.41,745.67,"/F8",9.96,"Laoreet fusce etiam duis pretium"
37.61,724.87,58.07,733.71,"/F8",9.96,"eget."
52.56,712.91,288.45,721.76,"/F8",9.96,"Vivamus porta feugiat justo sem. Aliquet ipsum justo"
37.61,700.96,288.44,709.80,"/F8",9.96,"aenean eu. Commodo lorem mi primis inceptos velit felis"
37.61,689.00,288.43,697.85,"/F8",9.96,"nunc lacinia at augue luctus platea. Quisque curae odio fe-"
37.61,677.04,288.42,685.89,"/F8",9.96,"lis class aenean. Euismod lacus felis cursus. Euismod risus"
37.61,665.09,288.37,673.94,"/F8",9.96,"et felis scelerisque sagittis hendrerit ac ridiculus a vulpu-"
37.61,653.13,57.51,661.98,"/F8",9.96,"tate."
65.99,653.13,245.02,661.98,"/F8",9.96,"Aliquam neque aliquet duis a morbi et."
253.50,653.13,288.43,661.98,"/F8",9.96,"Gravida"
37.61,641.18,201.18,650.03,"/F8",9.96,"morbi id etiam in morbi scelerisque."
209.58,641.18,288.41,650.03,"/F8",9.96,"Iaculis class velit."
37.61,629.22,218.49,638.07,"/F8",9.96,"Natoque netus vivamus bibendum proin."
225.57,629.22,288.42,638.07,"/F8",9.96,"Dapibus risus."
37.61,617.27,288.41,626.11,"/F8",9.96,"Blandit massa dui ante vitae libero felis nonummy velit in"
37.61,605.31,288.42,614.16,"/F8",9.96,"litora. Nonummy justo duis et orci torquent non quisque"
37.61,593.36,288.42,602.20,"/F8",9.96,"eu habitant. Aliquam risus arcu leo consequat orci lacinia"
37.61,581.40,288.46,590.25,"/F8",9.96,"et dapibus. Vivamus justo. Nonummy porta ante montes"
37.61,569.45,109.41,578.29,"/F8",9.96,"primis dis enim."
116.86,569.45,187.65,578.29,"/F8",9.96,"Gravida magna."
195.09,569.45,288.45,578.29,"/F8",9.96,"Integer morbi metus."
37.61,557.49,288.40,566.34,"/F8",9.96,"Vivamus porta vestibulum pulvinar justo lacinia blandit."
37.61,545.54,288.41,554.38,"/F8",9.96,"Dapibus augue enim laoreet netus vestibulum ullamcorper."
37.61,533.58,220.93,542.43,"/F8",9.96,"Lacinia massa ve taciti mi. Dapibus risus."
37.61,511.17,150.82,520.01,"/F27",9.96,"1.2. Cubilia vitae nulla a."
52.56,497.72,176.22,506.56,"/F8",9.96,"Feugiat ipsum ante congue."
184.95,497.72,251.76,506.56,"/F8",9.96,"Gravida lorem."
260.49,497.72,288.46,506.56,"/F8",9.96,"Iaculis"
37.61,485.76,152.07,494.61,"/F8",9.96,"curae nec mollis placerat."
160.27,485.76,288.44,494.61,"/F8",9.96,"Lacinia risus ad dolor turpis"
37.61,473.81,212.95,482.65,"/F8",9.96,"curae sociosqu mi metus ad dignissim."
222.54,473.81,288.44,482.65,"/F8",9.96,"Aliquet ipsum."
37.61,461.85,142.52,470.70,"/F8",9.96,"Viverra neque et fames."
148.62,461.85,288.46,470.70,"/F8",9.96,"Conubia fames eros porta proin"
37.61,449.90,206.70,458.74,"/F8",9.96,"suscipit eget fermentum sociis aenean."
213.13,449.90,288.42,458.74,"/F8",9.96,"Iaculis netus orci"
37.61,437.94,171.41,446.79,"/F8",9.96,"nonummy proin duis aliquam."
179.05,437.94,244.59,446.79,"/F8",9.96,"Aliquam fusce."
252.23,437.94,288.45,446.79,"/F8",9.96,"Conubia"
37.61,425.99,156.02,434.83,"/F8",9.96,"morbi sed cras est sodales."
162.53,425.99,288.48,434.83,"/F8",9.96,"Sodales fames quam hac ali-"
37.61,414.03,288.42,422.88,"/F8",9.96,"quet amet. Feugiat curae justo sagittis per. Egestas etiam"
37.61,402.08,108.27,410.92,"/F8",9.96,"id a nisi massa."
116.28,402.08,288.44,410.92,"/F8",9.96,"Blandit proin pretium arcu sociis con-"
37.61,390.12,223.39,398.97,"/F8",9.96,"vallis vestibulum vel fusce ligula in netus."
230.20,390.12,288.40,398.97,"/F8",9.96,"Laoreet nulla"
37.61,378.17,288.45,387.01,"/F8",9.96,"nam pede netus penatibus libero cum platea quam condi-"
37.61,366.21,288.38,375.06,"/F8",9.96,"mentum consectetuer potenti. Quisque etiam dis ultricies."
37.61,354.26,288.41,363.10,"/F8",9.96,"Aliquet fusce proin. Blandit porta nunc leo nunc ve nibh"
37.61,342.30,288.42,351.15,"/F8",9.96,"nunc proin in. Cubilia fusce donec libero tempor duis el-"
37.61,330.34,288.44,339.19,"/F8",9.96,"ementum tellus. Blandit massa urna blandit quam at au-"
37.61,318.39,288.46,327.24,"/F8",9.96,"gue. Quisque porta sit leo ad elementum a. Lacinia magna"
37.61,306.43,54.50,315.28,"/F8",9.96,"per."
52.56,294.48,288.48,303.33,"/F8",9.96,"Nonummy fames nec eros aenean erat mi nisl convallis"
37.61,282.52,288.44,291.37,"/F8",9.96,"nascetur cursus. Blandit purus. Sodales ipsum odio com-"
37.61,270.57,288.41,279.42,"/F8",9.96,"modo et ac per primis pretium nisi magna cubilia tincidunt"
37.61,258.61,288.42,267.46,"/F8",9.96,"quis. Vivamus fusce felis proin facilisi ipsum porta magna."
37.61,246.66,288.43,255.51,"/F8",9.96,"Integer justo non nunc enim quis fames ultrices orci dic-"
37.61,234.70,107.49,243.55,"/F8",9.96,"tum malesuada."
114.01,234.70,200.26,243.55,"/F8",9.96,"Aliquet donec ante."
206.77,234.70,288.44,243.55,"/F8",9.96,"Cubilia purus par-"
37.61,222.75,186.86,231.60,"/F8",9.96,"turient ultrices egestas bibendum."
192.71,222.75,288.40,231.60,"/F8",9.96,"Dapibus fusce id arcu"
37.61,210.79,288.42,219.64,"/F8",9.96,"ultricies. Aliquam lorem mi mattis sem nisi a orci ad porta"
37.61,198.84,288.44,207.68,"/F8",9.96,"amet integer metus amet ve. Iaculis ipsum netus cras. So-"
37.61,186.88,288.41,195.73,"/F8",9.96,"dales proin morbi scelerisque mi platea bibendum vestibu-"
37.61,174.93,125.50,183.77,"/F8",9.96,"lum tortor et pede."
134.55,174.93,288.42,183.77,"/F8",9.96,"Egestas fusce vitae cubilia viverra"
37.61,162.97,58.07,171.82,"/F8",9.96,"eget."
66.28,162.97,288.42,171.82,"/F8",9.96,"Feugiat justo cubilia bibendum justo netus lorem"
37.61,151.02,52.59,159.86,"/F8",9.96,"est."
60.29,151.02,124.97,159.86,"/F8",9.96,"Conubia vitae."
132.68,151.02,288.44,159.86,"/F8",9.96,"Sodales dolor ve dui at luctus sem"
37.61,139.06,288.41,147.91,"/F8",9.96,"tempus quisque arcu bibendum integer rutrum duis mi."
37.61,127.11,101.75,135.95,"/F8",9.96,"Vivamus risus."
108.09,127.11,166.35,135.95,"/F8",9.96,"Cubilia risus."
172.69,127.11,288.45,135.95,"/F8",9.96,"Rhoncus magna eni neque"
37.61,115.15,87.96,124.00,"/F8",9.96,"vestibulum."
94.90,115.15,288.40,124.00,"/F8",9.96,"Viverra risus laoreet tempus phasellus risus"
37.61,103.20,184.82,112.04,"/F8",9.96,"massa suspendisse nascetur ante."
192.81,103.20,288.44,112.04,"/F8",9.96,"Natoque proin iaculis"
37.61,91.24,288.43,100.09,"/F8",9.96,"nonummy dictum penatibus molestie ve nullam praesent"
37.61,79.29,288.42,88.13,"/F8",9.96,"pede. Aliquet lorem parturient ac pellentesque commodo"
306.60,748.78,438.75,757.62,"/F8",9.96,"nostra mus turpis vitae lacus."
445.46,748.78,557.42,757.62,"/F8",9.96,"Lacinia donec nisl lacinia"
306.60,736.82,557.42,745.67,"/F8",9.96,"mollis quam eros ipsum penatibus magna mi facilisis inte-"
306.60,724.87,363.33,733.71,"/F8",9.96,"ger libero ve."
306.60,700.95,411.06,709.80,"/F27",9.96,"1.3. Integer nulla nunc."
321.55,686.01,566.64,694.86,"/F8",9.96,"Feugiat etiam ante metus pharetra sem sollicitudin primis"
306.60,674.06,557.41,682.90,"/F8",9.96,"nunc quam quisque semper. Iaculis neque. Quisque fames"
306.60,662.10,557.46,670.95,"/F8",9.96,"urna a donec mi platea nibh eget eni gravida pharetra"
306.60,650.15,557.40,658.99,"/F8",9.96,"eu. Egestas vitae pede amet eu vulputate viverra nullam."
306.60,638.19,557.42,647.04,"/F8",9.96,"Pretium massa morbi aptent ve ac curabitur scelerisque"
306.60,626.23,557.37,635.08,"/F8",9.96,"phasellus nunc sollicitudin tempus tellus duis. Iaculis me-"
306.60,614.28,557.39,623.13,"/F8",9.96,"tus lacus tincidunt semper tempor lorem fringilla potenti"
306.60,602.32,557.42,611.17,"/F8",9.96,"consectetuer semper at etiam eu. Lacinia morbi fusce nisl"
306.60,590.37,557.38,599.22,"/F8",9.96,"aliquet eu ad auctor at. Quisque velit nunc quisque. Ali-"
306.60,578.41,557.38,587.26,"/F8",9.96,"quet magna. Aliquet nulla quis erat natoque nisl vulputate"
306.60,566.46,408.32,575.31,"/F8",9.96,"urna condimentum sit."
417.16,566.46,557.42,575.31,"/F8",9.96,"Nonummy vitae est vestibulum"
306.60,554.50,366.19,563.35,"/F8",9.96,"platea metus."
373.40,554.50,437.68,563.35,"/F8",9.96,"Rhoncus class."
444.88,554.50,518.05,563.35,"/F8",9.96,"Vivamus magna."
525.26,554.50,557.46,563.35,"/F8",9.96,"Feugiat"
306.60,542.55,379.77,551.39,"/F8",9.96,"proin parturient."
385.37,542.55,557.42,551.39,"/F8",9.96,"Integer neque est amet erat curae sem-"
306.60,530.59,520.01,539.44,"/F8",9.96,"per class adipiscing sagittis potenti rhoncus nisl."
525.74,530.59,557.38,539.44,"/F8",9.96,"Potenti"
306.60,518.64,557.42,527.48,"/F8",9.96,"donec risus porta pharetra nam cras ad fames tincidunt in-"
306.60,506.68,557.40,515.53,"/F8",9.96,"ceptos. Dapibus risus in netus eu. Posuere fusce quisque"
306.60,494.73,441.57,503.57,"/F8",9.96,"sed inceptos lacus ac etiam id."
447.57,494.73,515.57,503.57,"/F8",9.96,"Conubia neque."
521.58,494.73,557.43,503.57,"/F8",9.96,"Dapibus"
306.60,482.77,557.40,491.62,"/F8",9.96,"porta nibh laoreet libero leo eros. Gravida proin adipiscing"
306.60,470.82,491.25,479.66,"/F8",9.96,"condimentum rutrum in neque proin cras."
496.88,470.82,557.41,479.66,"/F8",9.96,"Blandit etiam"
306.60,458.86,434.80,467.71,"/F8",9.96,"nibh scelerisque consectetuer."
321.55,446.91,439.26,455.75,"/F8",9.96,"Nonummy lacus at ipsum."
447.36,446.91,557.50,455.75,"/F8",9.96,"Commodo donec dui ne-"
306.60,434.95,437.49,443.80,"/F8",9.96,"tus ridiculus eget mus etiam."
445.60,434.95,511.24,443.80,"/F8",9.96,"Aliquam nulla."
519.35,434.95,557.42,443.80,"/F8",9.96,"Euismod"
306.60,423.00,557.36,431.84,"/F8",9.96,"neque enim inceptos vestibulum mattis est ve sollicitudin."
306.60,411.04,557.44,419.89,"/F8",9.96,"Commodo nulla cras a nisl lorem. Quisque risus. Rhoncus"
306.60,399.09,557.41,407.93,"/F8",9.96,"vitae dolor facilisis. Nonummy fusce justo purus est ante"
306.60,387.13,394.22,395.98,"/F8",9.96,"nullam conubia elit."
400.69,387.13,557.42,395.98,"/F8",9.96,"Natoque curae cras vitae lorem elit"
306.60,375.18,336.62,384.02,"/F8",9.96,"dui ut."
343.22,375.18,404.83,384.02,"/F8",9.96,"Integer lorem."
411.42,375.18,557.42,384.02,"/F8",9.96,"Aliquam justo nibh habitasse ac."
306.60,363.22,371.01,372.07,"/F8",9.96,"Egestas purus."
378.56,363.22,438.26,372.07,"/F8",9.96,"Integer dolor."
445.81,363.22,557.44,372.07,"/F8",9.96,"Laoreet massa parturient"
306.60,351.27,557.43,360.11,"/F8",9.96,"quis rutrum purus feugiat ac. Egestas nulla cras maecenas"
306.60,339.31,536.12,348.16,"/F8",9.96,"urna nisi dui iaculis ac urna orci aliquet turpis nec."
542.61,339.31,557.40,348.16,"/F8",9.96,"Po-"
306.60,327.36,557.42,336.20,"/F8",9.96,"tenti neque et morbi duis mus at natoque eros inceptos."
306.60,315.40,367.39,324.25,"/F8",9.96,"Iaculis ipsum."
373.87,315.40,557.43,324.25,"/F8",9.96,"Conubia fames in arcu litora sodales quis"
306.60,303.45,557.40,312.29,"/F8",9.96,"at pellentesque. Euismod etiam nam quis viverra eu at ve-"
306.60,291.49,382.71,300.34,"/F8",9.96,"nenatis ipsum at."
388.34,291.49,557.41,300.34,"/F8",9.96,"Feugiat lacus sem eleifend phasellus a."
306.60,279.53,557.39,288.38,"/F8",9.96,"Rhoncus proin risus dictumst ultricies metus a urna ipsum."
306.60,267.58,557.44,276.43,"/F8",9.96,"Nonummy velit ac platea posuere ad nostra consectetuer"
306.60,255.62,349.83,264.47,"/F8",9.96,"dignissim."
306.60,225.74,393.85,234.58,"/F17",9.96,"2. Cubilia morbi."
321.55,204.82,557.44,213.66,"/F8",9.96,"Lacinia proin lorem nam nunc amet ultricies sollici-"
306.60,192.86,522.46,201.71,"/F8",9.96,"tudin vestibulum erat morbi habitasse senectus."
531.14,192.86,557.41,201.71,"/F8",9.96,"Conu-"
306.60,180.90,557.41,189.75,"/F8",9.96,"bia massa dis vestibulum parturient id penatibus quam"
306.60,168.95,421.94,177.80,"/F8",9.96,"orci vestibulum venenatis."
429.17,168.95,557.42,177.80,"/F8",9.96,"Egestas netus ac aptent nos-"
306.60,156.99,557.42,165.84,"/F8",9.96,"tra enim ve. Gravida lacus donec nunc pharetra phasellus"
306.60,145.04,526.51,153.89,"/F8",9.96,"magna dapibus laoreet lectus diam feugiat proin."
534.22,145.04,557.44,153.89,"/F8",9.96,"Viva-"
306.60,133.08,557.46,141.93,"/F8",9.96,"mus curae massa montes ut. Aliquam augue est. Conubia"
306.60,121.13,557.42,129.98,"/F8",9.96,"purus ac pede ac nascetur dapibus. Viverra neque dis non-"
306.60,109.17,557.42,118.02,"/F8",9.96,"ummy metus. Vivamus curae nisi in felis porttitor massa a"
306.60,97.22,557.39,106.07,"/F8",9.96,"viverra ve. Potenti nulla nam pharetra. Blandit proin odio"
306.60,85.26,557.43,94.11,"/F8",9.96,"per sodales quam vel lorem adipiscing inceptos. Natoque"
295.15,61.35,300.13,70.20,"/F8",9.96,"2"
