557.11,803.82,562.09,812.67,"/F8",9.96,"4"
54.00,777.92,298.85,786.77,"/F8",9.96,"per. Egestas netus blandit pretium ornare aenean erat"
54.00,765.96,298.89,774.81,"/F8",9.96,"duis ac fusce. Viverra vitae odio magna sodales ac mae-"
54.00,754.01,298.91,762.86,"/F8",9.96,"cenas pretium magnis cum. Commodo lorem magna tem-"
54.00,742.05,298.87,750.90,"/F8",9.96,"por sapien ipsum vestibulum commodo eni mi lorem in"
54.00,730.10,298.85,738.95,"/F8",9.96,"fames arcu luctus. Dapibus nulla. Nonummy nulla. Eu-"
54.00,718.14,298.88,726.99,"/F8",9.96,"ismod proin erat tempor mus eget metus lorem eros leo"
54.00,706.19,177.40,715.03,"/F8",9.96,"libero elementum accumsan."
64.54,670.69,288.39,678.65,"/F19",8.97,"Nonummy purus magna luctus scelerisque proin"
109.46,660.23,243.50,668.19,"/F19",8.97,"habitasse quisque sociis mus."
63.96,633.43,298.85,642.27,"/F8",9.96,"Potenti justo egestas. Iaculis risus non duis augue nul-"
54.00,621.47,298.86,630.32,"/F8",9.96,"lam eu taciti a. Laoreet class adipiscing pharetra eget"
54.00,609.52,298.87,618.36,"/F8",9.96,"cubilia ac cursus dui urna vel. Commodo fames. Lacinia"
54.00,597.56,298.86,606.41,"/F8",9.96,"porta class sed pede eu felis sem ipsum. Rhoncus nulla."
54.00,585.61,298.86,594.45,"/F8",9.96,"Integer lorem at sem dignissim placerat. Conubia vitae"
54.00,573.65,298.86,582.50,"/F8",9.96,"class platea lectus ipsum hac. Laoreet nulla leo aliquam"
54.00,561.70,298.84,570.54,"/F8",9.96,"erat nisl duis donec euismod. Aliquam nulla. Dapibus"
54.00,549.74,298.84,558.59,"/F8",9.96,"proin parturient arcu semper vivamus nonummy iaculis"
54.00,537.79,298.84,546.63,"/F8",9.96,"nisl ac. Integer massa nulla senectus. Pretium proin ve"
54.00,525.83,298.90,534.68,"/F8",9.96,"class ad fames nostra class. Commodo fames. Quisque"
54.00,513.88,298.82,522.72,"/F8",9.96,"donec at consequat vulputate enim sit purus tristique"
54.00,501.92,298.80,510.77,"/F8",9.96,"duis. Aliquam ipsum dui vestibulum tristique nibh pel-"
54.00,489.97,298.86,498.81,"/F8",9.96,"lentesque montes sociis ipsum mauris ve. Aliquam me-"
54.00,478.01,298.85,486.86,"/F8",9.96,"tus cum tristique cursus maecenas felis a luctus. Po-"
54.00,466.06,298.85,474.90,"/F8",9.96,"suere etiam vel cras nibh dolor. Viverra lorem nec cur-"
54.00,454.10,298.83,462.95,"/F8",9.96,"sus viverra diam a. Potenti justo proin sociis ad. Feugiat"
54.00,442.14,298.84,450.99,"/F8",9.96,"curae mi nisl fusce tellus lorem nonummy sed varius arcu"
54.00,430.19,298.86,439.04,"/F8",9.96,"cras duis. Sodales lacus ac cum ligula nam iaculis nulla"
54.00,418.23,219.01,427.08,"/F8",9.96,"ve luctus praesent viverra hymenaeos."
63.96,405.80,298.91,414.64,"/F8",9.96,"Natoque augue. Rhoncus porta erat sed ipsum sem-"
54.00,393.84,298.86,402.69,"/F8",9.96,"per eu dictum ornare hac congue vivamus eget torquent"
54.00,381.89,298.86,390.73,"/F8",9.96,"quam. Viverra netus fusce. Rhoncus fames. Quisque"
54.00,369.93,298.87,378.78,"/F8",9.96,"nulla magna platea. Iaculis lorem. Integer class purus"
54.00,357.98,298.85,366.82,"/F8",9.96,"risus urna nunc dapibus ut. Lacinia lorem. Pretium"
54.00,346.02,298.83,354.87,"/F8",9.96,"proin. Laoreet curae ante dignissim sollicitudin sit pe-"
54.00,334.07,88.88,342.91,"/F8",9.96,"natibus."
100.97,334.07,298.82,342.91,"/F8",9.96,"Euismod vitae nisi iaculis convallis mattis."
54.00,322.11,298.85,330.96,"/F8",9.96,"Feugiat fames. Rhoncus purus in curae vulputate per."
54.00,310.16,298.86,319.00,"/F8",9.96,"Lacinia neque purus hymenaeos scelerisque morbi nos-"
54.00,298.20,298.87,307.05,"/F8",9.96,"tra. Dapibus etiam ad phasellus massa lacus potenti"
54.00,286.25,298.87,295.09,"/F8",9.96,"semper. Laoreet metus egestas potenti diam sed porta"
54.00,274.29,298.84,283.14,"/F8",9.96,"nam. Lacinia velit ac. Rhoncus velit morbi cras et elit"
54.00,262.34,298.87,271.18,"/F8",9.96,"interdum class nam eros per proin mus. Integer lacus"
54.00,250.38,298.84,259.23,"/F8",9.96,"eni. Sodales donec mi taciti mus congue rutrum portti-"
54.00,238.43,298.87,247.27,"/F8",9.96,"tor augue. Aliquam class lacus non quis mattis ac quam"
54.00,226.47,298.85,235.32,"/F8",9.96,"interdum. Conubia donec nisi non dolor iaculis semper"
54.00,214.52,183.38,223.36,"/F8",9.96,"ac lacinia pede neque dictum."
63.96,202.08,255.73,210.93,"/F8",9.96,"Sodales dolor eu quis lorem iaculis taciti."
266.65,202.08,298.85,210.93,"/F8",9.96,"Feugiat"
54.00,190.12,298.82,198.97,"/F8",9.96,"etiam sit aliquet a libero ridiculus. Aliquam justo et"
54.00,178.17,298.83,187.02,"/F8",9.96,"dictum sit in. Vivamus vitae ut nascetur dictum nisi"
54.00,166.21,298.84,175.06,"/F8",9.96,"scelerisque nonummy scelerisque pede. Feugiat lorem ad"
54.00,154.26,298.90,163.11,"/F8",9.96,"magna. Laoreet donec ipsum donec auctor nostra cras."
54.00,142.30,298.84,151.15,"/F8",9.96,"Euismod vitae adipiscing feugiat quam vivamus et arcu."
54.00,130.35,298.83,139.19,"/F8",9.96,"Rhoncus proin. Aliquet fusce. Cubilia lorem urna primis"
54.00,118.39,298.87,127.24,"/F8",9.96,"eu mauris vitae natoque in magna tempor. Egestas proin"
317.01,777.92,561.82,786.77,"/F8",9.96,"vestibulum ve sollicitudin vivamus sapien eget et eros."
317.01,765.96,561.86,774.81,"/F8",9.96,"Iaculis nulla purus pede luctus platea hac. Iaculis au-"
317.01,754.01,561.87,762.86,"/F8",9.96,"gue donec ornare non adipiscing parturient. Vivamus au-"
317.01,742.05,561.81,750.90,"/F8",9.96,"gue egestas litora morbi facilisis eget est tristique pellen-"
317.01,730.10,561.87,738.95,"/F8",9.96,"tesque. Iaculis massa enim imperdiet. Aliquam magna."
317.01,718.14,561.85,726.99,"/F8",9.96,"Egestas class ut felis vitae diam id. Laoreet velit arcu"
317.01,706.19,561.83,715.04,"/F8",9.96,"dictumst magna orci litora vel habitant pellentesque ali-"
317.01,694.23,561.84,703.08,"/F8",9.96,"quet fermentum. Iaculis lacus cras feugiat at ridiculus"
317.01,682.28,561.89,691.12,"/F8",9.96,"proin. Nonummy massa risus condimentum. Dapibus"
317.01,670.32,523.54,679.17,"/F8",9.96,"metus porta facilisi diam. Nonummy purus dis."
349.83,635.78,529.14,643.74,"/F19",8.97,"ALIQUAM LACUS DOLOR PRIMIS."
326.98,609.16,561.86,618.00,"/F8",9.96,"Dapibus metus mi tristique morbi hac diam ac nisl."
317.01,597.20,561.84,606.05,"/F8",9.96,"Potenti class mi class consectetuer dictumst donec ut."
317.01,585.25,561.88,594.09,"/F8",9.96,"Rhoncus neque eros scelerisque ut tortor magna auctor"
317.01,573.29,561.86,582.14,"/F8",9.96,"lorem ac. Egestas velit diam tempor parturient metus"
317.01,561.34,561.85,570.18,"/F8",9.96,"lacinia euismod lobortis. Aliquet massa aliquet proin"
317.01,549.38,561.84,558.23,"/F8",9.96,"vestibulum bibendum nisi diam nulla amet proin penat-"
317.01,537.43,561.88,546.27,"/F8",9.96,"ibus gravida. Pretium magna purus lobortis hac. In-"
317.01,525.47,561.84,534.32,"/F8",9.96,"teger fames id eu mauris facilisi condimentum volutpat."
317.01,513.52,561.83,522.36,"/F8",9.96,"Natoque proin orci venenatis lectus dictumst phasellus."
317.01,501.56,434.55,510.41,"/F8",9.96,"Laoreet nulla porta pede."
446.01,501.56,561.87,510.41,"/F8",9.96,"Quisque proin nisi metus"
317.01,489.61,561.86,498.45,"/F8",9.96,"gravida porttitor. Pretium etiam. Conubia augue eros"
317.01,477.65,561.87,486.50,"/F8",9.96,"hac tempus facilisi. Gravida magna neque inceptos sed"
317.01,465.70,561.84,474.54,"/F8",9.96,"consectetuer nostra erat. Sodales velit eu rutrum mi. Iac-"
317.01,453.74,561.85,462.59,"/F8",9.96,"ulis risus vivamus montes orci montes mi et. Dapibus me-"
317.01,441.78,561.85,450.63,"/F8",9.96,"tus at a urna nulla. Dapibus etiam duis eget curae. Blan-"
317.01,429.83,561.84,438.68,"/F8",9.96,"dit nulla. Lacinia donec felis potenti conubia. Gravida"
317.01,417.87,561.83,426.72,"/F8",9.96,"donec adipiscing mi pellentesque quisque tempor in nisl"
317.01,405.92,497.66,414.77,"/F8",9.96,"elit blandit. Laoreet etiam. Potenti class."
326.98,393.66,561.93,402.51,"/F8",9.96,"Laoreet magna eu varius hymenaeos dapibus per"
317.01,381.71,561.84,390.55,"/F8",9.96,"vestibulum ridiculus odio condimentum euismod ullam-"
317.01,369.75,561.84,378.60,"/F8",9.96,"corper nisl. Euismod vitae. Dapibus risus rhoncus eges-"
317.01,357.80,561.82,366.64,"/F8",9.96,"tas tortor. Feugiat class elit eleifend tincidunt et. Eu-"
317.01,345.84,561.88,354.69,"/F8",9.96,"ismod velit eget. Natoque fusce. Rhoncus massa ut vi-"
317.01,333.89,561.84,342.73,"/F8",9.96,"tae sollicitudin felis et tortor hac ornare a adipiscing."
317.01,321.93,561.87,330.78,"/F8",9.96,"Gravida lacus. Nonummy lacus. Integer fusce etiam ve-"
317.01,309.98,561.87,318.82,"/F8",9.96,"nenatis per odio diam odio metus. Blandit donec etiam"
317.01,298.02,561.86,306.87,"/F8",9.96,"pharetra phasellus nisl cum leo euismod donec. Aliquam"
317.01,286.07,561.86,294.91,"/F8",9.96,"metus. Blandit purus nunc congue in volutpat nam con-"
317.01,274.11,561.85,282.96,"/F8",9.96,"sectetuer class lacus a tortor dignissim. Viverra purus"
317.01,262.16,561.86,271.00,"/F8",9.96,"duis auctor adipiscing accumsan risus vulputate rhon-"
317.01,250.20,561.87,259.05,"/F8",9.96,"cus. Gravida fusce etiam elit hymenaeos tempor maece-"
317.01,238.25,561.82,247.09,"/F8",9.96,"nas lorem fringilla et ultricies ante hac nulla parturient"
317.01,226.29,561.86,235.14,"/F8",9.96,"torquent urna ad curae. Aliquam nulla fames aliquet sem"
317.01,214.34,561.83,223.18,"/F8",9.96,"consequat. Cubilia donec quam tempor integer hendrerit."
317.01,202.38,561.85,211.23,"/F8",9.96,"Quisque augue orci fringilla taciti fames sem ipsum cur-"
317.01,190.42,561.84,199.27,"/F8",9.96,"abitur risus cum pharetra penatibus eu fringilla. Rhon-"
317.01,178.47,561.85,187.32,"/F8",9.96,"cus netus quis nisl imperdiet. Euismod augue. Lacinia"
317.01,166.51,561.83,175.36,"/F8",9.96,"porta nisi ultrices leo pede faucibus habitasse bibendum"
317.01,154.56,536.23,163.41,"/F8",9.96,"ligula amet mi curae ut class. Sodales nulla nisi a."
326.98,142.30,561.86,151.15,"/F8",9.96,"Iaculis nulla duis odio. Dapibus vitae egestas. Lacinia"
317.01,130.35,561.84,139.19,"/F8",9.96,"etiam integer quisque facilisis. Blandit fames. Laoreet"
317.01,118.39,561.86,127.24,"/F8",9.96,"lorem etiam varius adipiscing proin urna feugiat ve fe-"
