557.11,803.82,562.09,812.67,"/F8",9.96,"2"
54.00,777.92,298.86,786.77,"/F8",9.96,"Integer vitae diam sem vitae gravida sapien est ve. In-"
54.00,765.96,298.88,774.81,"/F8",9.96,"teger morbi diam rhoncus nam ac. Lacinia fusce ve luc-"
54.00,754.01,298.81,762.86,"/F8",9.96,"tus velit. Dapibus velit ipsum platea fusce morbi pede."
54.00,742.05,298.82,750.90,"/F8",9.96,"Quisque curae quam aliquet. Iaculis fusce. Blandit netus"
54.00,730.10,298.84,738.95,"/F8",9.96,"parturient accumsan lacinia egestas faucibus proin port-"
54.00,718.14,298.85,726.99,"/F8",9.96,"titor venenatis adipiscing amet. Nonummy dolor. Blan-"
54.00,706.19,298.88,715.03,"/F8",9.96,"dit fames. Nonummy metus lorem erat ve vitae class"
54.00,694.23,298.83,703.08,"/F8",9.96,"velit lacus a nisi. Natoque justo adipiscing condimentum"
54.00,682.28,298.86,691.12,"/F8",9.96,"taciti ac erat urna. Commodo neque posuere duis metus."
54.00,670.32,298.87,679.17,"/F8",9.96,"Nonummy donec ad magna ac velit sollicitudin fermen-"
54.00,658.37,298.87,667.21,"/F8",9.96,"tum felis massa auctor netus. Vivamus lacus. Integer"
54.00,646.41,283.19,655.26,"/F8",9.96,"porta nunc sit turpis a faucibus amet auctor integer."
88.81,602.97,264.16,610.93,"/F19",8.97,"Natoque curae nibh suspendisse nam."
63.96,574.67,298.86,583.51,"/F8",9.96,"Potenti class lorem curae. Iaculis vitae eget non orci"
54.00,562.71,298.81,571.56,"/F8",9.96,"adipiscing cum nulla ridiculus praesent. Dapibus ipsum."
54.00,550.76,298.83,559.60,"/F8",9.96,"Aliquet dolor orci praesent suspendisse eni diam. Iaculis"
54.00,538.80,298.85,547.65,"/F8",9.96,"netus sit rhoncus ad cum ullamcorper euismod condimen-"
54.00,526.85,298.86,535.69,"/F8",9.96,"tum pede eget. Posuere donec. Dapibus donec nec eni at"
54.00,514.89,298.86,523.74,"/F8",9.96,"lorem arcu morbi. Vivamus morbi blandit eni in etiam"
54.00,502.94,298.87,511.78,"/F8",9.96,"consectetuer placerat etiam eu tempor. Laoreet augue"
54.00,490.98,298.82,499.83,"/F8",9.96,"sem lacus viverra convallis mollis elit lacinia pretium."
54.00,479.03,298.84,487.87,"/F8",9.96,"Aliquam ipsum odio porttitor tortor. Viverra dolor mi."
54.00,467.07,298.87,475.92,"/F8",9.96,"Sodales magna sit fames ipsum tellus tempor curae ali-"
54.00,455.12,298.88,463.96,"/F8",9.96,"quam ipsum amet elementum sapien massa nostra. Ali-"
54.00,443.16,298.86,452.01,"/F8",9.96,"quam felis. Feugiat purus. Dapibus augue lorem ante"
54.00,431.21,298.82,440.05,"/F8",9.96,"convallis pellentesque adipiscing elit metus malesuada."
54.00,419.25,298.84,428.10,"/F8",9.96,"Pretium nulla diam lorem gravida luctus. Feugiat proin"
54.00,407.30,298.80,416.14,"/F8",9.96,"eu ligula tincidunt tellus nisi hac. Blandit porta non urna"
54.00,395.34,298.80,404.19,"/F8",9.96,"id erat eget cubilia ac elit. Cubilia neque nisl cubilia pe-"
54.00,383.39,298.87,392.23,"/F8",9.96,"natibus eros class morbi. Lacinia augue. Conubia ipsum"
54.00,371.43,298.83,380.28,"/F8",9.96,"purus odio scelerisque conubia scelerisque arcu primis."
54.00,359.48,298.88,368.32,"/F8",9.96,"Integer etiam proin donec quam vivamus ac mattis so-"
54.00,347.52,276.43,356.37,"/F8",9.96,"ciosqu facilisis a curabitur donec diam suspendisse."
63.96,333.59,298.89,342.43,"/F8",9.96,"Nonummy morbi. Vivamus dolor in amet ullamcorper"
54.00,321.63,298.86,330.48,"/F8",9.96,"nam nostra volutpat. Conubia proin sed adipiscing ut"
54.00,309.68,298.83,318.52,"/F8",9.96,"pellentesque iaculis ligula dui. Euismod augue amet urna"
54.00,297.72,298.82,306.57,"/F8",9.96,"taciti suscipit. Conubia purus at tortor enim. Pretium"
54.00,285.77,298.85,294.61,"/F8",9.96,"proin eget nostra sodales dis. Euismod purus justo var-"
54.00,273.81,298.83,282.66,"/F8",9.96,"ius ornare odio gravida purus cras facilisis duis. Quisque"
54.00,261.85,298.81,270.70,"/F8",9.96,"curae eget aptent nisl feugiat nostra tristique vitae dic-"
54.00,249.90,298.87,258.75,"/F8",9.96,"tumst hymenaeos. Iaculis justo mus nisi maecenas iac-"
54.00,237.94,298.85,246.79,"/F8",9.96,"ulis. Posuere netus dui metus vitae diam bibendum a"
54.00,225.99,298.87,234.84,"/F8",9.96,"pulvinar. Viverra massa amet elit per a montes. Conu-"
54.00,214.03,298.85,222.88,"/F8",9.96,"bia fames neque condimentum leo ut arcu. Viverra nulla"
54.00,202.08,298.82,210.93,"/F8",9.96,"quisque laoreet netus mi libero diam tincidunt dignis-"
54.00,190.12,298.83,198.97,"/F8",9.96,"sim consectetuer nec. Aliquet etiam ut nullam. Rhoncus"
54.00,178.17,298.84,187.02,"/F8",9.96,"morbi lacus eni. Conubia nulla. Viverra purus mi eget dis"
54.00,166.21,298.86,175.06,"/F8",9.96,"gravida eu aenean. Euismod metus velit eni arcu lobor-"
54.00,154.26,298.84,163.11,"/F8",9.96,"tis. Pretium class mi etiam massa est eros duis. Gravida"
54.00,142.30,298.88,151.15,"/F8",9.96,"massa dolor libero litora arcu egestas morbi enim. In-"
54.00,130.35,298.83,139.19,"/F8",9.96,"teger lacus. Laoreet ipsum quis etiam viverra et turpis"
54.00,118.39,238.78,127.24,"/F8",9.96,"morbi hac interdum natoque gravida ante."
330.47,778.11,548.49,786.07,"/F19",8.97,"VIVAMUS LOREM MASSA EROS SEM SED"
325.47,767.65,553.49,775.61,"/F19",8.97,"PELLENTESQUE LOREM AT SOLLICITUDIN"
361.29,757.19,517.72,765.15,"/F19",8.97,"CONSECTETUER NONUMMY."
326.98,730.48,561.87,739.32,"/F8",9.96,"Rhoncus porta ad mauris et netus urna ligula parturi-"
317.01,718.52,561.88,727.37,"/F8",9.96,"ent dolor odio erat eu fermentum cubilia massa eu sem-"
317.01,706.57,561.84,715.41,"/F8",9.96,"per. Laoreet risus. Aliquet nulla porta ligula rutrum"
317.01,694.61,561.82,703.46,"/F8",9.96,"nulla. Posuere proin. Cubilia augue elit metus tristique"
317.01,682.65,561.85,691.50,"/F8",9.96,"mus lacinia placerat dictum nullam. Gravida porta in id"
317.01,670.70,561.86,679.55,"/F8",9.96,"mi est facilisis fusce per pede eu. Posuere massa purus"
317.01,658.74,561.85,667.59,"/F8",9.96,"pede per sit dui pellentesque porta ac elementum a. Po-"
317.01,646.79,561.87,655.64,"/F8",9.96,"suere fames in auctor per sociosqu rhoncus platea nulla"
317.01,634.83,561.87,643.68,"/F8",9.96,"vestibulum viverra diam massa risus accumsan. Natoque"
317.01,622.88,561.84,631.73,"/F8",9.96,"vitae nunc leo neque eni urna dolor vel. Cubilia velit"
317.01,610.92,561.83,619.77,"/F8",9.96,"ut class hendrerit vestibulum duis fames vitae integer"
317.01,598.97,561.89,607.81,"/F8",9.96,"at montes imperdiet curae. Gravida proin. Commodo"
317.01,587.01,561.87,595.86,"/F8",9.96,"magna justo taciti cursus eni. Lacinia nulla dolor arcu"
317.01,575.06,561.83,583.90,"/F8",9.96,"dictum integer mauris ac facilisi tempor. Pretium metus"
317.01,563.10,561.82,571.95,"/F8",9.96,"parturient scelerisque ligula ad. Viverra porta. Cubilia"
317.01,551.15,561.86,559.99,"/F8",9.96,"magna sem fusce posuere euismod tincidunt vel. Posuere"
317.01,539.19,561.82,548.04,"/F8",9.96,"proin. Viverra nulla nisl mus lorem semper proin ut taciti"
317.01,527.24,561.84,536.08,"/F8",9.96,"ad cras ac. Blandit felis enim. Pretium lacus nisl tempus"
317.01,515.28,561.85,524.13,"/F8",9.96,"nostra neque leo. Viverra morbi nulla tellus enim curae"
317.01,503.33,487.50,512.17,"/F8",9.96,"netus rutrum augue. Nonummy ipsum."
326.98,490.98,561.88,499.82,"/F8",9.96,"Vivamus fusce eni aliquam nascetur. Dapibus donec"
317.01,479.02,561.88,487.87,"/F8",9.96,"purus sociosqu quis nec per ad mauris. Natoque lacus"
317.01,467.07,561.91,475.91,"/F8",9.96,"arcu nonummy. Sodales donec odio gravida. Vivamus"
317.01,455.11,344.13,463.96,"/F8",9.96,"lorem."
354.77,455.11,425.42,463.96,"/F8",9.96,"Aliquam augue."
436.06,455.11,561.91,463.96,"/F8",9.96,"Posuere magna class cursus"
317.01,443.16,561.92,452.00,"/F8",9.96,"nisl. Rhoncus nulla. Nonummy class commodo mau-"
317.01,431.20,561.84,440.05,"/F8",9.96,"ris sed cursus aliquet ante nascetur lacus ut. Cubilia"
317.01,419.25,561.82,428.09,"/F8",9.96,"ipsum gravida viverra curabitur praesent id elit. Lacinia"
317.01,407.29,561.86,416.14,"/F8",9.96,"velit potenti. Rhoncus porta lacus elit a erat. Commodo"
317.01,395.34,561.86,404.18,"/F8",9.96,"morbi vitae proin est odio sociis malesuada sapien pulv-"
317.01,383.38,561.85,392.23,"/F8",9.96,"inar praesent metus. Conubia risus lorem. Iaculis netus"
317.01,371.43,561.89,380.27,"/F8",9.96,"eni ornare nec maecenas habitasse etiam malesuada adip-"
317.01,359.47,561.85,368.32,"/F8",9.96,"iscing cras justo habitant. Sodales proin. Feugiat donec"
317.01,347.52,561.89,356.36,"/F8",9.96,"pede egestas eu netus. Aliquam dolor ad fames ut congue"
317.01,335.56,561.81,344.41,"/F8",9.96,"ve. Aliquet purus vestibulum feugiat nisi. Aliquet purus"
317.01,323.61,561.84,332.45,"/F8",9.96,"et dictum. Iaculis purus ve ut nisl pede lacus. Nonummy"
317.01,311.65,468.15,320.50,"/F8",9.96,"lacus fusce nullam nisl sollicitudin."
355.19,276.61,523.79,284.58,"/F19",8.97,"Laoreet massa vel ridiculus nulla ut."
326.98,249.90,561.85,258.75,"/F8",9.96,"Gravida risus morbi a duis ad sollicitudin cursus dolor"
317.01,237.94,561.83,246.79,"/F8",9.96,"leo viverra morbi dis. Cubilia fusce orci euismod portti-"
317.01,225.99,561.84,234.84,"/F8",9.96,"tor litora inceptos vestibulum. Pretium augue mus amet"
317.01,214.03,561.84,222.88,"/F8",9.96,"torquent. Posuere ipsum class euismod nulla nisl et amet"
317.01,202.08,561.87,210.92,"/F8",9.96,"tempor nisl quam odio nec lorem sem. Nonummy velit in"
317.01,190.12,561.86,198.97,"/F8",9.96,"neque nunc sed laoreet neque nisi accumsan etiam. Ali-"
317.01,178.17,561.84,187.01,"/F8",9.96,"quet nulla erat vehicula congue metus ipsum dictumst."
317.01,166.21,561.90,175.06,"/F8",9.96,"Natoque magna est enim vel. Euismod magna parturi-"
317.01,154.26,561.85,163.10,"/F8",9.96,"ent ultrices netus aliquam. Aliquam justo massa primis"
317.01,142.30,561.86,151.15,"/F8",9.96,"in tortor volutpat augue in congue. Quisque morbi nam."
317.01,130.35,561.87,139.19,"/F8",9.96,"Blandit lorem ve proin et magnis. Egestas morbi arcu."
317.01,118.39,561.88,127.24,"/F8",9.96,"Rhoncus proin. Posuere purus quam cras ve vitae et"
