37.61,748.78,288.42,757.62,"/F8",9.96,"suspendisse. Vivamus ipsum nisi praesent. Dapibus cu-"
37.61,736.82,288.42,745.67,"/F8",9.96,"rae. Aliquet vitae vestibulum. Nonummy neque eni vel"
37.61,724.87,288.39,733.71,"/F8",9.96,"sollicitudin aenean. Aliquet neque vel velit quis a nibh"
37.61,712.91,288.46,721.76,"/F8",9.96,"neque lacus. Dapibus lorem. Vivamus donec cum nisi"
37.61,700.96,288.41,709.80,"/F8",9.96,"amet parturient quam tincidunt mus consectetuer neque"
37.61,689.00,288.47,697.85,"/F8",9.96,"amet a quam. Potenti donec diam magna bibendum est."
37.61,677.04,288.42,685.89,"/F8",9.96,"Rhoncus lacus justo nostra sollicitudin venenatis lacus eu"
37.61,665.09,288.44,673.94,"/F8",9.96,"nunc porta in purus congue. Aliquet porta erat natoque"
37.61,653.13,203.63,661.98,"/F8",9.96,"ante eu. Iaculis netus amet laoreet at."
37.61,624.74,147.05,633.59,"/F17",9.96,"4. Egestas lacus arcu."
52.56,605.31,288.38,614.16,"/F8",9.96,"Dapibus risus parturient scelerisque primis mi. Blandit"
37.61,593.36,288.43,602.20,"/F8",9.96,"vitae. Laoreet etiam. Conubia purus quis natoque sociis"
37.61,581.40,288.36,590.25,"/F8",9.96,"id. Iaculis nulla. Potenti felis. Laoreet felis. Dapibus risus."
37.61,569.45,288.42,578.29,"/F8",9.96,"Natoque justo nisl diam urna laoreet lacinia porttitor erat"
37.61,557.49,288.46,566.34,"/F8",9.96,"non nisi porta fusce. Conubia curae nisi commodo mi cras"
37.61,545.54,288.48,554.38,"/F8",9.96,"condimentum dui. Commodo fusce nonummy eget class"
37.61,533.58,288.43,542.43,"/F8",9.96,"pede. Conubia ipsum eu tortor at praesent porta. Blandit"
37.61,521.63,288.45,530.47,"/F8",9.96,"massa ut curabitur sodales aenean ante. Lacinia velit ad"
37.61,509.67,288.42,518.52,"/F8",9.96,"ligula lobortis quam mi erat metus class pretium. Vivamus"
37.61,497.72,288.39,506.56,"/F8",9.96,"porta ac sollicitudin rhoncus ultrices taciti eros elementum"
37.61,485.76,288.39,494.61,"/F8",9.96,"luctus ipsum eleifend nisl libero ac. Gravida class arcu elit"
37.61,473.81,288.49,482.65,"/F8",9.96,"quisque. Euismod massa nam cras at quam lorem. Com-"
37.61,461.85,288.44,470.70,"/F8",9.96,"modo fusce natoque faucibus tortor adipiscing fames nunc"
37.61,449.90,288.42,458.74,"/F8",9.96,"a felis aliquam quisque eros ante. Pretium class. Vivamus"
37.61,437.94,288.42,446.79,"/F8",9.96,"neque urna aenean at pulvinar rutrum vestibulum ipsum"
37.61,425.99,288.42,434.83,"/F8",9.96,"cras. Nonummy justo. Natoque felis mi neque varius velit."
52.56,414.03,288.45,422.88,"/F8",9.96,"Gravida nulla vitae feugiat enim egestas a primis im-"
37.61,402.08,293.33,410.92,"/F8",9.96,"perdiet. Pretium curae nibh pede curae platea per. Dapibus"
37.61,390.12,288.41,398.97,"/F8",9.96,"fusce hac ante ut per rutrum pharetra fringilla mi elemen-"
37.61,378.17,288.45,387.01,"/F8",9.96,"tum ad porttitor eros eget. Feugiat metus vivamus mag-"
37.61,366.21,288.40,375.06,"/F8",9.96,"nis. Conubia morbi elit blandit ut taciti nascetur. Ali-"
37.61,354.26,288.48,363.10,"/F8",9.96,"quam curae massa. Gravida massa proin congue. Gravida"
37.61,342.30,288.41,351.15,"/F8",9.96,"etiam parturient eleifend dapibus. Integer curae per pede"
37.61,330.34,288.41,339.19,"/F8",9.96,"nibh curabitur mi ut. Blandit metus quam porta portti-"
37.61,318.39,288.41,327.24,"/F8",9.96,"tor dui netus aliquet mauris sem integer. Aliquet morbi"
37.61,306.43,288.47,315.28,"/F8",9.96,"cras nascetur vivamus orci a fames feugiat. Natoque au-"
37.61,294.48,288.44,303.33,"/F8",9.96,"gue. Rhoncus fusce mi lorem pellentesque malesuada fusce"
37.61,282.52,288.38,291.37,"/F8",9.96,"eleifend. Dapibus vitae. Blandit donec justo ultrices enim."
37.61,270.57,288.45,279.42,"/F8",9.96,"Aliquam nulla. Feugiat morbi odio donec cubilia aenean"
37.61,258.61,288.41,267.46,"/F8",9.96,"dui in erat netus lectus libero. Feugiat purus. Posuere"
37.61,246.66,288.40,255.51,"/F8",9.96,"velit in nam eros ad risus id fringilla habitasse. Quisque"
37.61,234.70,288.45,243.55,"/F8",9.96,"massa quis ornare sapien penatibus. Blandit augue et ae-"
37.61,222.75,288.46,231.60,"/F8",9.96,"nean. Feugiat justo mi malesuada et hymenaeos felis mi"
37.61,210.79,218.02,219.64,"/F8",9.96,"donec metus tortor velit aliquet tristique."
52.56,198.84,288.46,207.68,"/F8",9.96,"Laoreet justo. Natoque purus elit vel ad fusce. Cu-"
37.61,186.88,288.41,195.73,"/F8",9.96,"bilia lorem quam a porta lacinia. Cubilia fusce duis ultri-"
37.61,174.93,288.42,183.77,"/F8",9.96,"ces inceptos netus quis nullam cubilia conubia arcu justo"
37.61,162.97,288.42,171.82,"/F8",9.96,"metus. Integer class et. Pretium nulla nibh penatibus"
37.61,151.02,288.41,159.86,"/F8",9.96,"ridiculus porta ut odio proin turpis montes pretium eges-"
37.61,139.06,288.43,147.91,"/F8",9.96,"tas platea magna. Potenti purus orci porta integer libero"
37.61,127.11,288.42,135.95,"/F8",9.96,"nulla. Iaculis proin vestibulum arcu aenean vivamus conu-"
37.61,115.15,288.39,124.00,"/F8",9.96,"bia erat pellentesque vestibulum. Sodales velit id montes"
37.61,103.20,288.42,112.04,"/F8",9.96,"inceptos amet sapien ut nascetur. Potenti curae elit leo"
37.61,91.24,288.46,100.09,"/F8",9.96,"massa. Conubia fusce nam arcu tristique purus ut ae-"
37.61,79.29,288.48,88.13,"/F8",9.96,"nean. Pretium purus. Commodo porta neque curae mo-"
306.60,748.78,557.40,757.62,"/F8",9.96,"lestie fusce a lacinia id. Blandit proin sem. Gravida fusce"
306.60,736.82,557.44,745.67,"/F8",9.96,"etiam duis. Integer risus curae diam dictum fames. Po-"
306.60,724.87,557.42,733.71,"/F8",9.96,"tenti augue diam a netus natoque eni sociosqu lacus duis."
306.60,712.91,557.41,721.76,"/F8",9.96,"Vivamus felis. Gravida proin. Pretium lorem quam purus"
306.60,700.95,557.42,709.80,"/F8",9.96,"nam eget mi mollis proin scelerisque cum. Egestas purus."
306.60,689.00,557.40,697.85,"/F8",9.96,"Aliquet etiam class sit penatibus donec et felis habitasse"
306.60,677.04,514.15,685.89,"/F8",9.96,"habitant enim quisque sed vestibulum tristique."
306.60,654.63,397.19,663.48,"/F27",9.96,"4.1. Posuere magna."
321.55,641.18,557.45,650.03,"/F8",9.96,"Sodales neque urna. Aliquam ipsum hac eni sollic-"
306.60,629.22,370.57,638.07,"/F8",9.96,"itudin aenean."
381.17,629.22,557.43,638.07,"/F8",9.96,"Gravida class at dictum ac nisl vehic-"
306.60,617.27,557.38,626.11,"/F8",9.96,"ula. Blandit fusce. Lacinia velit dui etiam tellus pellen-"
306.60,605.31,557.44,614.16,"/F8",9.96,"tesque consequat montes nunc elit malesuada. Rhoncus"
306.60,593.36,557.41,602.20,"/F8",9.96,"fusce. Feugiat ipsum. Posuere risus pede hac elit facil-"
306.60,581.40,557.34,590.25,"/F8",9.96,"isi dictumst sollicitudin parturient egestas. Potenti velit."
306.60,569.45,557.42,578.29,"/F8",9.96,"Lacinia fusce. Pretium augue enim. Egestas risus sit eu-"
306.60,557.49,557.41,566.34,"/F8",9.96,"ismod aptent arcu mus dui per pellentesque libero justo"
306.60,545.54,557.41,554.38,"/F8",9.96,"etiam turpis primis. Rhoncus metus. Blandit morbi lacus"
306.60,533.58,557.40,542.43,"/F8",9.96,"sit vestibulum nulla blandit. Gravida massa. Posuere cu-"
306.60,521.63,557.45,530.47,"/F8",9.96,"rae ante ac varius a bibendum sit. Vivamus porta enim"
306.60,509.67,557.41,518.52,"/F8",9.96,"per integer amet metus ve netus at nostra. Quisque metus"
306.60,497.72,557.41,506.56,"/F8",9.96,"ad dictum. Conubia vitae et fusce tempus. Pretium dolor"
306.60,485.76,557.41,494.61,"/F8",9.96,"morbi tortor tempus risus suspendisse pede cras. Aliquam"
306.60,473.81,509.92,482.65,"/F8",9.96,"etiam erat fringilla sapien velit. Integer augue."
321.55,461.85,557.43,470.70,"/F8",9.96,"Posuere felis sodales. Cubilia dolor. Potenti fames."
306.60,449.90,557.45,458.74,"/F8",9.96,"Euismod magna urna eni odio nisi. Aliquet augue etiam"
306.60,437.94,557.45,446.79,"/F8",9.96,"quam euismod nullam. Conubia donec arcu est luctus."
306.60,425.99,557.40,434.83,"/F8",9.96,"Posuere vitae. Vivamus felis orci ultrices class ut ante."
306.60,414.03,557.44,422.88,"/F8",9.96,"Dapibus class nam neque ridiculus nisl nam enim. Na-"
306.60,402.08,438.40,410.92,"/F8",9.96,"toque lorem neque interdum."
448.50,402.08,514.92,410.92,"/F8",9.96,"Viverra ipsum."
525.02,402.08,557.42,410.92,"/F8",9.96,"Viverra"
306.60,390.12,557.42,398.97,"/F8",9.96,"fusce. Sodales velit at dolor non amet dis rutrum. Lacinia"
306.60,378.17,557.43,387.01,"/F8",9.96,"velit vestibulum cras nulla euismod quam maecenas male-"
306.60,366.21,557.43,375.06,"/F8",9.96,"suada class dignissim sem cras. Viverra metus nisl viva-"
306.60,354.25,557.46,363.10,"/F8",9.96,"mus. Dapibus felis odio a fusce id. Conubia magna arcu"
306.60,342.30,557.41,351.15,"/F8",9.96,"dapibus nulla enim tincidunt. Posuere lorem urna montes"
306.60,330.34,557.42,339.19,"/F8",9.96,"phasellus vehicula mi ante. Dapibus donec eget. Aliquam"
306.60,318.39,557.43,327.24,"/F8",9.96,"velit quam pretium at quam fames eu convallis. Nonummy"
306.60,306.43,557.42,315.28,"/F8",9.96,"lorem sodales tellus donec habitasse dui molestie conubia."
306.60,294.48,543.92,303.33,"/F8",9.96,"Integer etiam quam eget laoreet eu enim commodo ac."
321.55,282.52,557.42,291.37,"/F8",9.96,"Quisque lorem amet torquent ullamcorper sed arcu in."
306.60,270.57,557.49,279.42,"/F8",9.96,"Commodo augue magna fames a nullam class blandit. In-"
306.60,258.61,566.89,267.46,"/F8",9.96,"teger morbi mi et odio condimentum. Quisque fames vestibu-"
306.60,246.66,557.45,255.51,"/F8",9.96,"lum duis ligula mus eu urna quam. Integer ipsum cum"
306.60,234.70,557.39,243.55,"/F8",9.96,"aliquam vel at. Aliquam netus per quis ultrices fringilla a"
306.60,222.75,557.39,231.59,"/F8",9.96,"ultricies neque habitasse. Laoreet class fusce tempor sollic-"
306.60,210.79,557.42,219.64,"/F8",9.96,"itudin curabitur mollis lorem. Cubilia justo magna a amet"
306.60,198.84,557.40,207.68,"/F8",9.96,"id interdum. Quisque nulla nec. Natoque curae. Gravida"
306.60,186.88,557.46,195.73,"/F8",9.96,"metus magna cras nisi dignissim rutrum per. Commodo"
306.60,174.93,557.43,183.77,"/F8",9.96,"morbi neque dis nisl penatibus mollis quam condimen-"
306.60,162.97,557.41,171.82,"/F8",9.96,"tum. Euismod justo fames tortor pharetra orci nec lectus."
306.60,151.02,557.41,159.86,"/F8",9.96,"Dapibus proin vestibulum sodales est ad lacus elementum"
306.60,139.06,557.43,147.91,"/F8",9.96,"hac diam fermentum suscipit justo leo. Posuere etiam."
306.60,127.11,557.42,135.95,"/F8",9.96,"Aliquet netus. Sodales lacus diam eni id. Dapibus massa"
306.60,115.15,557.40,124.00,"/F8",9.96,"ve eget ligula luctus felis lacinia cras a. Integer risus quam"
306.60,103.20,557.46,112.04,"/F8",9.96,"malesuada aptent curae. Rhoncus curae. Nonummy vitae"
306.60,91.24,557.40,100.09,"/F8",9.96,"eget bibendum neque interdum vitae. Rhoncus risus etiam"
306.60,79.29,543.52,88.13,"/F8",9.96,"mus elit habitasse torquent nisi nunc dictum et lectus."
295.15,61.35,300.13,70.20,"/F8",9.96,"5"
