557.11,803.82,562.09,812.67,"/F8",9.96,"4"
128.90,778.11,224.10,786.07,"/F19",8.97,"CONUBIA NULLA."
63.96,751.76,129.55,760.60,"/F8",9.96,"Conubia nulla."
139.98,751.76,201.87,760.60,"/F8",9.96,"Lacinia dolor."
212.30,751.76,298.89,760.60,"/F8",9.96,"Vivamus fusce cras"
54.00,739.80,298.85,748.65,"/F8",9.96,"penatibus est pellentesque dolor eget volutpat a con-"
54.00,727.85,298.86,736.69,"/F8",9.96,"sectetuer duis. Nonummy lorem. Natoque morbi. Blan-"
54.00,715.89,298.82,724.74,"/F8",9.96,"dit class erat. Dapibus vitae at sapien placerat suscipit"
54.00,703.94,298.86,712.78,"/F8",9.96,"donec aptent. Gravida dolor urna praesent ad ullamcor-"
54.00,691.98,298.86,700.83,"/F8",9.96,"per eget. Pretium lorem ad aenean consequat in mattis"
54.00,680.03,298.82,688.87,"/F8",9.96,"pellentesque. Natoque justo felis lectus interdum con-"
54.00,668.07,298.85,676.92,"/F8",9.96,"vallis. Potenti morbi amet condimentum. Sodales pu-"
54.00,656.12,298.81,664.96,"/F8",9.96,"rus diam habitant neque cubilia cum habitant tristique."
54.00,644.16,298.85,653.01,"/F8",9.96,"Feugiat massa arcu mollis potenti at varius cubilia ia-"
54.00,632.21,298.79,641.05,"/F8",9.96,"culis. Pretium velit elit imperdiet tortor nascetur cras"
54.00,620.25,298.85,629.10,"/F8",9.96,"arcu adipiscing. Lacinia massa ve velit litora et facil-"
54.00,608.30,298.84,617.14,"/F8",9.96,"isi nunc dapibus in elit id. Commodo vitae dui nullam"
54.00,596.34,298.85,605.19,"/F8",9.96,"bibendum penatibus. Vivamus porta. Pretium lacus ac"
54.00,584.38,298.80,593.23,"/F8",9.96,"etiam aptent velit placerat sed id curabitur. Posuere risus"
54.00,572.43,298.81,581.28,"/F8",9.96,"vel eget taciti bibendum tincidunt. Euismod morbi justo"
54.00,560.47,298.82,569.32,"/F8",9.96,"sagittis lorem amet natoque urna id velit sagittis ac risus"
54.00,548.52,298.86,557.37,"/F8",9.96,"ad justo ad. Potenti dolor duis mi etiam nibh tempus"
54.00,536.56,226.68,545.41,"/F8",9.96,"sagittis parturient luctus. Lacinia class."
63.96,524.57,298.90,533.42,"/F8",9.96,"Laoreet massa ut platea porta. Egestas ipsum at ae-"
54.00,512.62,298.87,521.47,"/F8",9.96,"nean bibendum. Vivamus etiam cum odio rutrum dic-"
54.00,500.66,298.83,509.51,"/F8",9.96,"tum. Potenti risus quis pretium natoque sapien ornare"
54.00,488.71,298.83,497.56,"/F8",9.96,"netus. Blandit massa. Feugiat proin nisi lacus facilisi"
54.00,476.75,298.85,485.60,"/F8",9.96,"sem id suscipit pharetra. Aliquam magna duis volutpat"
54.00,464.80,298.81,473.64,"/F8",9.96,"suscipit potenti consectetuer elementum litora ve eu id"
54.00,452.84,298.86,461.69,"/F8",9.96,"eros metus neque sed. Aliquet curae amet lacus tempor"
54.00,440.89,298.82,449.73,"/F8",9.96,"class suscipit habitasse. Integer fusce neque elit proin"
54.00,428.93,298.87,437.78,"/F8",9.96,"nascetur etiam. Posuere metus gravida posuere quam"
54.00,416.98,298.84,425.82,"/F8",9.96,"volutpat ullamcorper sed tempor libero. Feugiat lacus"
54.00,405.02,298.86,413.87,"/F8",9.96,"urna ornare gravida nec erat at ipsum ornare. Quisque"
54.00,393.07,298.87,401.91,"/F8",9.96,"class nonummy placerat class et nullam. Euismod vi-"
54.00,381.11,298.81,389.96,"/F8",9.96,"tae ve taciti elit justo nascetur venenatis habitant morbi"
54.00,369.16,298.84,378.00,"/F8",9.96,"nibh a amet et lobortis aenean. Viverra purus. Quisque"
54.00,357.20,298.80,366.05,"/F8",9.96,"fusce est facilisi a sollicitudin diam nulla mollis et. Blan-"
54.00,345.25,298.86,354.09,"/F8",9.96,"dit dolor. Gravida porta pede. Nonummy risus nam eget"
54.00,333.29,298.80,342.14,"/F8",9.96,"fermentum taciti tincidunt per vivamus auctor vitae cras."
54.00,321.34,298.83,330.18,"/F8",9.96,"Sodales netus. Lacinia justo vel nisl nulla felis a arcu la-"
54.00,309.38,298.83,318.23,"/F8",9.96,"cus. Aliquet porta in ac et amet dui litora. Iaculis morbi"
54.00,297.43,116.66,306.27,"/F8",9.96,"cras phasellus."
139.85,264.30,213.19,272.26,"/F19",8.97,"Natoque morbi."
63.96,237.94,298.89,246.79,"/F8",9.96,"Aliquet lorem fusce quisque nam at augue mauris"
54.00,225.99,298.85,234.84,"/F8",9.96,"condimentum dolor cursus turpis hac urna pede nulla."
54.00,214.03,254.81,222.88,"/F8",9.96,"Aliquam fusce posuere viverra consectetuer."
266.36,214.03,298.84,222.88,"/F8",9.96,"Blandit"
54.00,202.08,298.84,210.93,"/F8",9.96,"lorem et netus quis augue. Dapibus fusce leo nisi habi-"
54.00,190.12,298.82,198.97,"/F8",9.96,"tant fusce fames semper sollicitudin. Viverra porta nisi"
54.00,178.17,298.79,187.02,"/F8",9.96,"in consectetuer. Blandit felis blandit dui eu ipsum sociis."
54.00,166.21,298.84,175.06,"/F8",9.96,"Conubia dolor massa ullamcorper ultrices felis id nullam"
54.00,154.26,298.85,163.11,"/F8",9.96,"id. Aliquet curae. Aliquam ipsum. Conubia etiam cu-"
54.00,142.30,298.87,151.15,"/F8",9.96,"rae nam eget nec nullam elementum hac erat lobortis a."
54.00,130.35,298.88,139.20,"/F8",9.96,"Viverra purus. Conubia curae. Commodo proin risus"
54.00,118.39,298.85,127.24,"/F8",9.96,"molestie dis duis at nascetur montes. Dapibus augue sed"
317.01,777.92,561.84,786.77,"/F8",9.96,"platea pulvinar neque ac habitasse. Potenti donec. Ali-"
317.01,765.96,561.82,774.81,"/F8",9.96,"quet justo ve porta mattis eu velit ullamcorper interdum"
317.01,754.01,561.87,762.86,"/F8",9.96,"convallis a magna blandit. Iaculis porta amet lectus cu-"
317.01,742.05,561.83,750.90,"/F8",9.96,"rae turpis. Conubia ipsum porta taciti fringilla nulla."
317.01,730.10,561.91,738.94,"/F8",9.96,"Viverra fames augue vivamus eget ante aenean commodo"
317.01,718.14,561.82,726.99,"/F8",9.96,"pretium fermentum senectus. Quisque vitae quis mollis"
317.01,706.19,561.84,715.03,"/F8",9.96,"amet pellentesque parturient elit elementum ac magna."
317.01,694.23,540.51,703.08,"/F8",9.96,"Vivamus metus. Aliquam vitae hac tincidunt nunc."
326.98,681.98,561.85,690.82,"/F8",9.96,"Aliquet porta ante nam enim sollicitudin quisque mae-"
317.01,670.02,561.88,678.87,"/F8",9.96,"cenas congue varius eleifend. Aliquam risus mus nam"
317.01,658.07,561.88,666.91,"/F8",9.96,"conubia. Quisque donec. Posuere ipsum quam a nisi"
317.01,646.11,561.81,654.96,"/F8",9.96,"felis ve curae in. Feugiat velit vitae convallis inceptos."
317.01,634.16,561.88,643.00,"/F8",9.96,"Integer risus. Viverra porta. Laoreet lorem pede mol-"
317.01,622.20,561.85,631.05,"/F8",9.96,"lis. Vivamus class purus lacinia dapibus tortor id ante"
317.01,610.24,561.87,619.09,"/F8",9.96,"condimentum conubia ullamcorper nisl duis arcu. Iac-"
317.01,598.29,561.86,607.14,"/F8",9.96,"ulis neque non urna. Feugiat morbi at a orci adipiscing"
317.01,586.33,561.89,595.18,"/F8",9.96,"ac torquent mus nisi magna. Nonummy etiam porta tel-"
317.01,574.38,561.84,583.23,"/F8",9.96,"lus hendrerit egestas tortor dui. Egestas vitae per nec"
317.01,562.42,561.83,571.27,"/F8",9.96,"sollicitudin sociis ac lacus aptent ve in. Posuere nulla so-"
317.01,550.47,561.85,559.32,"/F8",9.96,"dales commodo hendrerit molestie purus tincidunt cras"
317.01,538.51,561.90,547.36,"/F8",9.96,"tempor fermentum ac netus. Commodo augue adipisc-"
317.01,526.56,561.83,535.41,"/F8",9.96,"ing dictumst nunc. Potenti justo nec quis ut neque hen-"
317.01,514.60,561.83,523.45,"/F8",9.96,"drerit ante dui sollicitudin nulla erat eget eu. Rhoncus"
317.01,502.65,561.82,511.50,"/F8",9.96,"lorem nunc duis dis enim. Sodales netus at nisi tincidunt"
317.01,490.69,561.82,499.54,"/F8",9.96,"dictum. Quisque felis nisi integer ut. Conubia purus."
317.01,478.74,534.18,487.59,"/F8",9.96,"Laoreet proin ve eu aenean egestas. Integer lacus."
407.53,444.20,471.52,452.16,"/F19",8.97,"Quisque velit."
326.98,417.57,561.86,426.42,"/F8",9.96,"Iaculis lacus eros leo vitae nec arcu. Dapibus neque in"
317.01,405.62,561.90,414.46,"/F8",9.96,"sapien. Commodo nulla augue ullamcorper urna aenean"
317.01,393.66,561.85,402.51,"/F8",9.96,"vel. Viverra justo mus cras consectetuer ve pretium mi"
317.01,381.71,561.86,390.55,"/F8",9.96,"lectus natoque rhoncus urna. Laoreet netus lacus. Ali-"
317.01,369.75,561.82,378.60,"/F8",9.96,"quet neque. Aliquet morbi per odio volutpat vestibulum"
317.01,357.80,561.84,366.64,"/F8",9.96,"aptent purus habitant at primis. Dapibus fusce vitae"
317.01,345.84,561.82,354.69,"/F8",9.96,"elit eu habitasse. Iaculis vitae odio a ante in sollicitudin"
317.01,333.89,561.82,342.73,"/F8",9.96,"blandit. Gravida risus nibh phasellus velit eros eni etiam"
317.01,321.93,561.84,330.78,"/F8",9.96,"cubilia sagittis massa pellentesque. Conubia neque cras."
317.01,309.98,561.85,318.82,"/F8",9.96,"Gravida vitae. Dapibus neque. Dapibus donec rhoncus"
317.01,298.02,561.85,306.87,"/F8",9.96,"eget justo ad ornare pellentesque dis purus ipsum rhon-"
317.01,286.07,561.87,294.91,"/F8",9.96,"cus. Nonummy etiam purus dui nunc. Gravida dolor nec"
317.01,274.11,561.86,282.96,"/F8",9.96,"pede augue tempus. Quisque augue. Pretium etiam eros"
317.01,262.16,561.91,271.00,"/F8",9.96,"mollis. Commodo fames. Dapibus massa nam quis urna"
317.01,250.20,561.83,259.05,"/F8",9.96,"vel. Pretium ipsum eget tellus sociosqu amet sem aptent."
317.01,238.25,470.12,247.09,"/F8",9.96,"Potenti fusce velit augue hendrerit."
326.98,225.99,561.85,234.84,"/F8",9.96,"Aliquam etiam ad ut ultricies parturient nibh. Com-"
317.01,214.03,561.90,222.88,"/F8",9.96,"modo purus at justo magnis. Blandit augue pede cum"
317.01,202.08,561.83,210.92,"/F8",9.96,"quis urna ad nisi felis gravida torquent dolor. Pretium"
317.01,190.12,561.86,198.97,"/F8",9.96,"justo et tincidunt quam nec a dictum. Laoreet curae."
317.01,178.17,561.84,187.01,"/F8",9.96,"Blandit proin id augue dis sagittis laoreet congue id diam."
317.01,166.21,561.85,175.06,"/F8",9.96,"Dapibus nulla diam amet. Feugiat netus adipiscing plac-"
317.01,154.26,561.83,163.10,"/F8",9.96,"erat lacus consectetuer etiam duis orci tincidunt mattis"
317.01,142.30,561.87,151.15,"/F8",9.96,"augue lacinia nibh. Vivamus lacus. Blandit donec erat"
317.01,130.35,561.82,139.19,"/F8",9.96,"sem potenti orci bibendum id ullamcorper nisl vulputate"
317.01,118.39,561.90,127.24,"/F8",9.96,"fames morbi. Laoreet nulla magna bibendum phasel-"
