557.11,803.82,562.09,812.67,"/F8",9.96,"3"
54.00,777.92,298.89,786.77,"/F8",9.96,"teger class lacus tortor cum commodo neque eu sapien"
54.00,765.96,298.87,774.81,"/F8",9.96,"eget quis class. Conubia ipsum. Conubia neque nisi"
54.00,754.01,298.83,762.86,"/F8",9.96,"enim tristique cursus. Integer justo nibh a ante proin"
54.00,742.05,298.87,750.90,"/F8",9.96,"quisque feugiat urna mauris in ac odio class fames amet"
54.00,730.10,68.92,738.95,"/F8",9.96,"leo."
79.57,730.10,298.84,738.95,"/F8",9.96,"Dapibus fusce sed bibendum porta ut tincidunt"
54.00,718.14,298.88,726.99,"/F8",9.96,"quisque congue nec. Rhoncus magna nam. Gravida vitae"
54.00,706.19,298.81,715.03,"/F8",9.96,"odio luctus vestibulum consectetuer euismod purus fusce."
54.00,694.23,298.87,703.08,"/F8",9.96,"Commodo nulla eni platea. Integer lorem ut ante sapien"
54.00,682.28,298.82,691.12,"/F8",9.96,"tempus molestie mi condimentum ut mollis facilisis lacus"
54.00,670.32,298.88,679.17,"/F8",9.96,"a nibh. Commodo massa dolor mollis dolor elit aptent."
54.00,658.37,298.93,667.21,"/F8",9.96,"Nonummy magna massa quam eleifend massa mi cras"
54.00,646.41,298.87,655.26,"/F8",9.96,"maecenas euismod rhoncus. Sodales nulla nisi diam dis"
54.00,634.46,298.85,643.30,"/F8",9.96,"felis phasellus nam cras leo. Viverra porta etiam netus"
54.00,622.50,298.84,631.35,"/F8",9.96,"euismod. Rhoncus curae velit ornare. Pretium lorem est"
54.00,610.55,296.32,619.39,"/F8",9.96,"nibh nisi rhoncus. Nonummy felis. Pretium lacus diam."
101.73,558.42,251.24,566.38,"/F19",8.97,"CUBILIA PURUS AT CURAE."
63.96,528.48,298.84,537.33,"/F8",9.96,"Quisque felis eu lorem sociosqu ridiculus augue metus"
54.00,516.53,298.84,525.37,"/F8",9.96,"sit quam. Pretium risus. Sodales neque. Potenti do-"
54.00,504.57,298.83,513.42,"/F8",9.96,"lor. Nonummy ipsum. Potenti morbi duis facilisi incep-"
54.00,492.62,298.85,501.46,"/F8",9.96,"tos massa pulvinar curae. Quisque purus mi per aenean."
54.00,480.66,298.85,489.51,"/F8",9.96,"Commodo donec purus ultrices adipiscing turpis pulv-"
54.00,468.71,298.82,477.55,"/F8",9.96,"inar pede nostra. Euismod nulla eni taciti ac elit tempus"
54.00,456.75,298.86,465.60,"/F8",9.96,"nullam in. Potenti porta diam. Quisque magna. Ali-"
54.00,444.80,298.87,453.64,"/F8",9.96,"quam nulla in luctus magna nonummy venenatis enim"
54.00,432.84,298.85,441.69,"/F8",9.96,"cum potenti. Aliquet justo. Natoque neque orci dui"
54.00,420.89,298.82,429.73,"/F8",9.96,"ad duis porttitor hendrerit consectetuer. Laoreet nulla"
54.00,408.93,298.84,417.78,"/F8",9.96,"sed donec parturient nisi. Gravida netus ac dolor nunc"
54.00,396.98,298.86,405.82,"/F8",9.96,"senectus sed. Laoreet lorem ut nibh neque primis nam"
54.00,385.02,298.83,393.87,"/F8",9.96,"rutrum. Dapibus porta. Iaculis lacus et taciti eni ut"
54.00,373.07,298.85,381.91,"/F8",9.96,"lacus et porta in amet suspendisse. Posuere proin dis"
54.00,361.11,298.83,369.96,"/F8",9.96,"diam nisi mus pede vestibulum phasellus elit duis. So-"
54.00,349.16,298.85,358.00,"/F8",9.96,"dales morbi. Natoque nulla ante tempor potenti gravida"
54.00,337.20,117.72,346.05,"/F8",9.96,"venenatis cras."
63.96,321.63,298.83,330.48,"/F8",9.96,"Laoreet felis eu duis suspendisse pretium suspendisse."
54.00,309.68,298.80,318.52,"/F8",9.96,"Viverra felis adipiscing vehicula integer varius et dapibus."
54.00,297.72,298.88,306.57,"/F8",9.96,"Natoque augue mi porta mi habitasse quam. Blandit la-"
54.00,285.77,298.84,294.61,"/F8",9.96,"cus odio dolor quisque habitant. Quisque vitae amet."
54.00,273.81,298.82,282.66,"/F8",9.96,"Euismod vitae. Lacinia fusce. Quisque risus nec potenti"
54.00,261.85,298.81,270.70,"/F8",9.96,"neque leo sagittis a placerat sit consectetuer vitae nulla."
54.00,249.90,298.84,258.75,"/F8",9.96,"Vivamus vitae ut eget nibh netus suspendisse mi varius"
54.00,237.94,298.83,246.79,"/F8",9.96,"fermentum etiam laoreet. Potenti morbi nibh dui at ne-"
54.00,225.99,298.82,234.84,"/F8",9.96,"tus turpis semper lobortis massa ridiculus. Integer risus"
54.00,214.03,298.85,222.88,"/F8",9.96,"sit proin. Viverra ipsum fames semper ultrices conse-"
54.00,202.08,298.84,210.93,"/F8",9.96,"quat a ultricies lacus hac nisl. Cubilia massa. Potenti"
54.00,190.12,298.87,198.97,"/F8",9.96,"risus leo arcu erat euismod posuere. Gravida dolor ad"
54.00,178.17,298.83,187.02,"/F8",9.96,"nibh faucibus porttitor urna. Posuere risus eget at eget"
54.00,166.21,298.85,175.06,"/F8",9.96,"platea fames magna. Blandit velit. Gravida proin dui"
54.00,154.26,298.86,163.11,"/F8",9.96,"dolor sed quam nulla congue scelerisque. Rhoncus vitae"
54.00,142.30,298.85,151.15,"/F8",9.96,"metus eget tortor cum parturient augue dapibus. Ali-"
54.00,130.35,298.85,139.19,"/F8",9.96,"quam risus. Lacinia augue. Egestas ipsum pede nisl felis"
54.00,118.39,132.31,127.24,"/F8",9.96,"aenean justo eget."
377.45,778.11,501.56,786.07,"/F19",8.97,"Rhoncus augue nisi at elit."
326.98,747.88,561.85,756.73,"/F8",9.96,"Nonummy fusce ipsum urna fringilla at tellus habitasse"
317.01,735.93,561.84,744.77,"/F8",9.96,"sed facilisi. Sodales metus nibh donec tristique. Non-"
317.01,723.97,403.55,732.82,"/F8",9.96,"ummy fusce donec."
413.69,723.97,561.90,732.82,"/F8",9.96,"Integer morbi mus nisi ac amet."
317.01,712.02,561.87,720.86,"/F8",9.96,"Commodo curae eni neque venenatis suspendisse nulla."
317.01,700.06,561.89,708.91,"/F8",9.96,"Integer porta hac magna. Posuere augue. Conubia velit"
317.01,688.11,561.86,696.95,"/F8",9.96,"erat elementum maecenas amet. Laoreet nulla parturient"
317.01,676.15,561.83,685.00,"/F8",9.96,"erat varius penatibus turpis senectus ipsum elementum"
317.01,664.20,561.83,673.04,"/F8",9.96,"placerat. Egestas felis ante elit eni cursus auctor fames ve"
317.01,652.24,561.81,661.09,"/F8",9.96,"ridiculus. Egestas vitae ut etiam imperdiet scelerisque."
317.01,640.28,561.87,649.13,"/F8",9.96,"Iaculis porta quam ve venenatis fermentum felis a auc-"
317.01,628.33,561.86,637.18,"/F8",9.96,"tor. Laoreet etiam in erat placerat ut. Integer donec."
317.01,616.37,561.87,625.22,"/F8",9.96,"Euismod fusce. Euismod morbi eni eget erat. Euismod"
317.01,604.42,561.88,613.27,"/F8",9.96,"massa eni adipiscing vestibulum at. Aliquam magna."
317.01,592.46,561.88,601.31,"/F8",9.96,"Cubilia lorem adipiscing accumsan. Feugiat magna nunc"
317.01,580.51,561.87,589.35,"/F8",9.96,"sociosqu netus in maecenas dui. Blandit massa in mauris"
317.01,568.55,561.88,577.40,"/F8",9.96,"sagittis diam senectus a accumsan. Viverra ipsum ante"
317.01,556.60,481.64,565.44,"/F8",9.96,"purus conubia at ligula etiam nisl vel."
326.98,540.73,561.90,549.58,"/F8",9.96,"Commodo proin leo arcu dictumst scelerisque hac"
317.01,528.78,561.83,537.62,"/F8",9.96,"libero tortor netus suspendisse pulvinar. Viverra lacus"
317.01,516.82,561.84,525.67,"/F8",9.96,"sit. Feugiat porta. Gravida purus urna viverra nibh."
317.01,504.87,561.89,513.71,"/F8",9.96,"Feugiat neque mi. Egestas dolor hac curae odio nibh"
317.01,492.91,561.84,501.76,"/F8",9.96,"nunc dictumst adipiscing. Pretium fames iaculis id mag-"
317.01,480.96,561.82,489.80,"/F8",9.96,"nis nibh eros. Feugiat nulla vestibulum iaculis cras senec-"
317.01,469.00,561.84,477.85,"/F8",9.96,"tus vestibulum congue eu lobortis gravida donec vestibu-"
317.01,457.05,561.92,465.89,"/F8",9.96,"lum. Commodo purus nec. Nonummy donec est porta"
317.01,445.09,561.88,453.94,"/F8",9.96,"justo cum amet et pharetra ante. Euismod fusce par-"
317.01,433.14,561.85,441.98,"/F8",9.96,"turient dictumst. Integer proin magna facilisi ac class"
317.01,421.18,561.84,430.03,"/F8",9.96,"et pede porttitor semper volutpat. Aliquam justo nibh"
317.01,409.23,561.82,418.07,"/F8",9.96,"sapien vulputate at velit nam. Cubilia lorem nisi nisl."
317.01,397.27,561.85,406.12,"/F8",9.96,"Iaculis class et fringilla elementum quam posuere tin-"
317.01,385.32,561.82,394.16,"/F8",9.96,"cidunt litora. Natoque ipsum nibh taciti fringilla risus"
317.01,373.36,561.86,382.21,"/F8",9.96,"a eros fames curae aptent. Pretium morbi quis mollis et"
317.01,361.41,561.89,370.25,"/F8",9.96,"diam. Integer netus ac dictum commodo. Cubilia massa"
317.01,349.45,561.88,358.30,"/F8",9.96,"quis ullamcorper mus. Conubia donec est nunc conse-"
317.01,337.50,561.88,346.34,"/F8",9.96,"quat vel nonummy pede a eros ut curae quam. Aliquet"
317.01,325.54,548.71,334.39,"/F8",9.96,"curae quam amet augue ridiculus eni. Laoreet donec."
326.98,309.68,561.87,318.52,"/F8",9.96,"Feugiat augue arcu bibendum feugiat velit. Posuere"
317.01,297.72,561.83,306.57,"/F8",9.96,"dolor eni orci quam. Aliquet nulla neque porttitor condi-"
317.01,285.76,561.88,294.61,"/F8",9.96,"mentum nec mi molestie enim tortor. Natoque lacus."
317.01,273.81,561.83,282.66,"/F8",9.96,"Quisque fusce lorem class suscipit vestibulum lectus ac-"
317.01,261.85,561.86,270.70,"/F8",9.96,"cumsan hendrerit platea nulla suspendisse. Lacinia au-"
317.01,249.90,561.87,258.75,"/F8",9.96,"gue hac nibh lobortis gravida. Euismod nulla id ornare"
317.01,237.94,561.87,246.79,"/F8",9.96,"accumsan ante dictum. Lacinia augue nibh nisi molestie"
317.01,225.99,561.86,234.84,"/F8",9.96,"ac ullamcorper ut varius mus id. Gravida velit. Iac-"
317.01,214.03,561.88,222.88,"/F8",9.96,"ulis proin morbi. Laoreet massa urna euismod dolor eget"
317.01,202.08,561.86,210.93,"/F8",9.96,"laoreet aptent et magna. Cubilia ipsum aliquet euis-"
317.01,190.12,561.87,198.97,"/F8",9.96,"mod neque nisl. Quisque porta. Vivamus fusce id eu"
317.01,178.17,561.86,187.02,"/F8",9.96,"lorem dictum ad interdum urna orci. Sodales class orci"
317.01,166.21,561.88,175.06,"/F8",9.96,"accumsan. Egestas ipsum risus nostra ad curae sollici-"
317.01,154.26,561.86,163.11,"/F8",9.96,"tudin nulla ve diam massa id ridiculus a convallis massa"
317.01,142.30,561.87,151.15,"/F8",9.96,"ad. Commodo purus urna leo tempus ultricies curae nisi"
317.01,130.35,561.85,139.19,"/F8",9.96,"ultricies sollicitudin. Nonummy neque odio congue cras"
317.01,118.39,561.81,127.24,"/F8",9.96,"consectetuer parturient nibh dolor diam dictumst in. Ali-"
