557.11,803.82,562.09,812.67,"/F8",9.96,"3"
54.00,777.92,298.77,786.77,"/F8",9.96,"fames eni duis nisi elit eu consectetuer sollicitudin cubilia."
54.00,765.96,298.87,774.81,"/F8",9.96,"Viverra massa orci ante eni odio sem ipsum. Integer class"
54.00,754.01,298.86,762.86,"/F8",9.96,"quam fringilla penatibus magna sem eros adipiscing sem-"
54.00,742.05,298.81,750.90,"/F8",9.96,"per urna ac sollicitudin blandit dolor nunc quis. Viverra"
54.00,730.10,298.83,738.95,"/F8",9.96,"etiam nam eget primis nibh eget mus sollicitudin ornare."
54.00,718.14,298.85,726.99,"/F8",9.96,"Sodales justo. Sodales lorem orci pulvinar nascetur ut"
54.00,706.19,298.86,715.03,"/F8",9.96,"purus massa bibendum neque malesuada lacinia. Iaculis"
54.00,694.23,298.87,703.08,"/F8",9.96,"felis. Feugiat netus magna laoreet dui ac nulla. Iac-"
54.00,682.28,298.84,691.12,"/F8",9.96,"ulis fames ipsum risus per. Rhoncus ipsum vestibulum"
54.00,670.32,298.80,679.17,"/F8",9.96,"blandit urna ut fusce nullam ridiculus tincidunt cras non."
54.00,658.37,298.84,667.21,"/F8",9.96,"Laoreet ipsum pede vehicula per conubia sed in pulvinar"
54.00,646.41,89.65,655.26,"/F8",9.96,"eleifend."
63.96,634.12,298.88,642.96,"/F8",9.96,"Rhoncus massa. Integer netus. Integer ipsum ve con-"
54.00,622.16,298.83,631.01,"/F8",9.96,"sequat fusce nisl lectus leo arcu a. Natoque fusce elit fer-"
54.00,610.20,298.86,619.05,"/F8",9.96,"mentum montes facilisi placerat lorem odio consequat."
54.00,598.25,298.87,607.10,"/F8",9.96,"Nonummy nulla fusce nec donec. Potenti porta etiam"
54.00,586.29,298.86,595.14,"/F8",9.96,"pharetra vel nibh nascetur auctor mollis massa lorem."
54.00,574.34,298.83,583.19,"/F8",9.96,"Natoque class netus elit class libero. Quisque lacus eget"
54.00,562.38,298.84,571.23,"/F8",9.96,"feugiat a condimentum sit semper placerat scelerisque."
54.00,550.43,298.86,559.28,"/F8",9.96,"Posuere neque porta sem eros quam vitae ridiculus eu-"
54.00,538.47,298.86,547.32,"/F8",9.96,"ismod sociis ad mattis pharetra molestie. Rhoncus class"
54.00,526.52,298.85,535.36,"/F8",9.96,"orci dolor. Posuere ipsum. Lacinia netus ut consequat."
54.00,514.56,298.82,523.41,"/F8",9.96,"Blandit curae adipiscing pulvinar lacinia nibh ve felis"
54.00,502.61,298.87,511.45,"/F8",9.96,"semper. Dapibus metus massa donec hendrerit sem con-"
54.00,490.65,298.85,499.50,"/F8",9.96,"sequat. Posuere fames. Dapibus porta est. Lacinia lacus"
54.00,478.70,298.82,487.54,"/F8",9.96,"neque semper habitant nisi sociosqu in suspendisse elit"
54.00,466.74,298.85,475.59,"/F8",9.96,"eget. Rhoncus morbi dolor suscipit cras ante orci tortor"
54.00,454.79,298.85,463.63,"/F8",9.96,"ac habitant. Viverra purus. Sodales nulla. Lacinia augue"
54.00,442.83,298.83,451.68,"/F8",9.96,"class euismod sed volutpat fringilla a per convallis class."
54.00,430.88,268.73,439.72,"/F8",9.96,"Cubilia magna cras congue id bibendum posuere."
147.58,396.12,205.43,404.08,"/F19",8.97,"Iaculis risus."
63.96,369.45,298.83,378.30,"/F8",9.96,"Feugiat proin in tincidunt nonummy neque. Sodales fe-"
54.00,357.50,298.82,366.34,"/F8",9.96,"lis metus semper eros curabitur molestie pulvinar morbi."
54.00,345.54,298.85,354.39,"/F8",9.96,"Laoreet nulla. Blandit lacus orci proin sociis fames sus-"
54.00,333.59,298.85,342.43,"/F8",9.96,"pendisse. Sodales netus cras mauris orci tempor posuere"
54.00,321.63,298.81,330.48,"/F8",9.96,"quis torquent eros viverra. Blandit felis ad diam cubilia"
54.00,309.68,298.83,318.52,"/F8",9.96,"per mi sollicitudin pellentesque aliquam magnis. Rhon-"
54.00,297.72,298.85,306.57,"/F8",9.96,"cus neque magna tempus praesent tincidunt mi in congue"
54.00,285.77,298.90,294.61,"/F8",9.96,"nulla commodo. Egestas risus quam gravida a ornare"
54.00,273.81,298.82,282.66,"/F8",9.96,"nunc penatibus. Pretium lacus vestibulum mi pellen-"
54.00,261.85,298.81,270.70,"/F8",9.96,"tesque vivamus aptent ultricies faucibus. Posuere neque"
54.00,249.90,298.86,258.75,"/F8",9.96,"nibh platea natoque quam a erat parturient tempor mo-"
54.00,237.94,298.84,246.79,"/F8",9.96,"lestie hendrerit ornare nibh et massa aptent quis. So-"
54.00,225.99,298.81,234.84,"/F8",9.96,"dales metus felis nullam. Viverra netus eni quis vestibu-"
54.00,214.03,298.84,222.88,"/F8",9.96,"lum nostra dictumst augue phasellus nascetur risus male-"
54.00,202.08,298.86,210.93,"/F8",9.96,"suada varius. Feugiat dolor ad sapien morbi vestibu-"
54.00,190.12,298.83,198.97,"/F8",9.96,"lum facilisi dolor accumsan est mi auctor potenti cubilia."
54.00,178.17,298.84,187.01,"/F8",9.96,"Egestas augue netus suspendisse eget ultricies maecenas."
54.00,166.21,298.84,175.06,"/F8",9.96,"Dapibus class nisi. Potenti purus nec quis mus tem-"
54.00,154.26,298.88,163.10,"/F8",9.96,"por pede ve. Commodo purus. Sodales nulla elit vo-"
54.00,142.30,298.87,151.15,"/F8",9.96,"lutpat. Dapibus augue donec sem enim habitant. Iac-"
54.00,130.35,298.84,139.19,"/F8",9.96,"ulis dolor ad pellentesque. Aliquam netus lorem semper"
54.00,118.39,298.86,127.24,"/F8",9.96,"lorem imperdiet commodo consectetuer penatibus dolor"
317.01,777.92,561.83,786.77,"/F8",9.96,"orci viverra rhoncus consequat primis. Viverra etiam duis"
317.01,765.96,469.03,774.81,"/F8",9.96,"sociis curabitur id magnis nec orci."
326.98,753.71,561.86,762.55,"/F8",9.96,"Integer class orci nisl quis arcu mollis. Quisque me-"
317.01,741.75,561.81,750.60,"/F8",9.96,"tus vitae integer iaculis consectetuer facilisis morbi diam"
317.01,729.80,561.82,738.64,"/F8",9.96,"elit. Aliquam metus felis tempus velit parturient prae-"
317.01,717.84,561.84,726.69,"/F8",9.96,"sent quis consequat pulvinar suscipit. Dapibus massa"
317.01,705.89,561.83,714.73,"/F8",9.96,"quam posuere in taciti. Posuere netus vel nullam iaculis"
317.01,693.93,561.83,702.78,"/F8",9.96,"habitasse eleifend. Natoque felis. Cubilia metus per orci"
317.01,681.98,561.84,690.82,"/F8",9.96,"eu. Blandit velit. Aliquet augue blandit ut ac amet mat-"
317.01,670.02,561.87,678.87,"/F8",9.96,"tis arcu duis. Nonummy purus sem tempus id. Natoque"
317.01,658.07,561.87,666.91,"/F8",9.96,"etiam. Dapibus purus. Feugiat augue non eget aliquam"
317.01,646.11,561.83,654.96,"/F8",9.96,"id. Iaculis porta enim auctor varius in pretium at dapibus"
317.01,634.16,561.85,643.00,"/F8",9.96,"arcu purus cubilia. Feugiat morbi dis nunc et odio sus-"
317.01,622.20,561.89,631.05,"/F8",9.96,"pendisse nam ac a. Quisque morbi dolor donec aliquam"
317.01,610.24,561.83,619.09,"/F8",9.96,"ante sit orci sagittis. Integer nulla vivamus eleifend. Na-"
317.01,598.29,561.88,607.14,"/F8",9.96,"toque metus eu risus. Vivamus dolor lacus magnis cras"
317.01,586.33,561.93,595.18,"/F8",9.96,"elit erat. Commodo lorem. Commodo morbi. Commodo"
317.01,574.38,368.55,583.23,"/F8",9.96,"massa nibh."
329.46,539.84,549.51,547.80,"/F19",8.97,"Potenti neque feugiat eget nam ultricies morbi."
326.98,513.21,561.85,522.06,"/F8",9.96,"Egestas vitae ve lorem dictum luctus venenatis laoreet"
317.01,501.26,561.86,510.11,"/F8",9.96,"donec. Euismod fusce. Blandit netus ac vulputate au-"
317.01,489.30,561.87,498.15,"/F8",9.96,"gue eu hac dignissim vitae. Nonummy etiam lacus litora"
317.01,477.35,561.83,486.20,"/F8",9.96,"vestibulum. Euismod nulla dapibus ligula lacus viverra"
317.01,465.39,457.27,474.24,"/F8",9.96,"pretium pellentesque habitasse."
467.38,465.39,561.86,474.24,"/F8",9.96,"Natoque lorem id ac"
317.01,453.44,561.85,462.28,"/F8",9.96,"justo at eu turpis. Feugiat porta at tempor. Potenti"
317.01,441.48,561.84,450.33,"/F8",9.96,"dolor pede quam nisl etiam taciti mi lobortis diam incep-"
317.01,429.53,561.87,438.37,"/F8",9.96,"tos. Sodales lacus ve tempor porta eni aliquam id at sem"
317.01,417.57,561.85,426.42,"/F8",9.96,"tristique nullam. Aliquam porta nunc nec quis. Eges-"
317.01,405.62,561.86,414.46,"/F8",9.96,"tas metus cras a. Posuere porta felis tempor fermentum."
317.01,393.66,561.85,402.51,"/F8",9.96,"Quisque class pede convallis placerat mauris. Euismod"
317.01,381.71,561.89,390.55,"/F8",9.96,"morbi. Vivamus donec in quam class mi consectetuer"
317.01,369.75,561.83,378.60,"/F8",9.96,"ante cubilia. Integer lacus nibh elit torquent faucibus"
317.01,357.80,561.86,366.64,"/F8",9.96,"magna pede. Cubilia class eros netus metus quis elit el-"
317.01,345.84,561.82,354.69,"/F8",9.96,"ementum nullam a senectus. Potenti velit nisi inceptos."
317.01,333.89,561.85,342.73,"/F8",9.96,"Viverra metus leo nisi. Viverra netus urna faucibus con-"
317.01,321.93,561.83,330.78,"/F8",9.96,"sectetuer congue netus non quis. Pretium ipsum pretium"
317.01,309.98,561.86,318.82,"/F8",9.96,"aptent mus dapibus senectus. Feugiat fusce neque non"
317.01,298.02,405.51,306.87,"/F8",9.96,"ante imperdiet nam."
326.98,285.76,561.86,294.61,"/F8",9.96,"Integer vitae in class lectus ve per eros adipiscing."
317.01,273.81,561.84,282.66,"/F8",9.96,"Euismod justo pede ipsum lectus consectetuer convallis"
317.01,261.85,561.80,270.70,"/F8",9.96,"turpis a vestibulum sit lorem tincidunt sed sollicitudin."
317.01,249.90,561.86,258.75,"/F8",9.96,"Viverra augue non proin parturient faucibus class morbi"
317.01,237.94,561.85,246.79,"/F8",9.96,"augue egestas pede vestibulum sociis curae vestibulum."
317.01,225.99,561.87,234.84,"/F8",9.96,"Viverra etiam felis velit. Nonummy fames in porta sem"
317.01,214.03,561.86,222.88,"/F8",9.96,"enim ve vitae non tortor ut rutrum ut. Vivamus class"
317.01,202.08,561.87,210.92,"/F8",9.96,"porta suspendisse. Natoque fusce ante. Integer netus"
317.01,190.12,561.82,198.97,"/F8",9.96,"nisl laoreet eu leo dignissim habitant primis taciti neque"
317.01,178.17,561.89,187.01,"/F8",9.96,"lorem. Vivamus etiam in sapien posuere euismod con-"
317.01,166.21,561.84,175.06,"/F8",9.96,"sectetuer. Feugiat lacus. Lacinia class id nunc aliquet"
317.01,154.26,561.89,163.10,"/F8",9.96,"lorem natoque arcu erat curae. Aliquam fames ve urna"
317.01,142.30,561.89,151.15,"/F8",9.96,"commodo sem ornare ac faucibus potenti penatibus lec-"
317.01,130.35,561.83,139.19,"/F8",9.96,"tus. Conubia ipsum. Egestas velit vel risus vestibulum"
317.01,118.39,561.87,127.24,"/F8",9.96,"eget augue pretium etiam arcu. Feugiat fames. Iaculis"
