557.11,803.82,562.09,812.67,"/F8",9.96,"2"
54.00,777.92,194.76,786.77,"/F8",9.96,"enim. Aliquet nulla at mollis at."
105.13,743.38,247.84,751.34,"/F19",8.97,"Dapibus vitae nisl ante primis."
63.96,716.75,298.83,725.60,"/F8",9.96,"Cubilia etiam id libero aliquet aliquam. Iaculis lacus"
54.00,704.80,298.85,713.65,"/F8",9.96,"adipiscing ut tempus. Iaculis lacus neque metus a vi-"
54.00,692.84,298.89,701.69,"/F8",9.96,"vamus ad eu. Iaculis fames purus. Lacinia lacus. Na-"
54.00,680.89,298.85,689.73,"/F8",9.96,"toque class quam turpis nec gravida bibendum. Euis-"
54.00,668.93,298.83,677.78,"/F8",9.96,"mod lorem metus sit dis consectetuer varius id. Viverra"
54.00,656.98,298.82,665.82,"/F8",9.96,"felis id ridiculus conubia consectetuer vulputate magna"
54.00,645.02,298.88,653.87,"/F8",9.96,"id. Blandit nulla proin nam malesuada eget cum mi."
54.00,633.07,298.86,641.91,"/F8",9.96,"Egestas massa nunc potenti sed senectus pretium fames."
54.00,621.11,298.87,629.96,"/F8",9.96,"Rhoncus velit urna. Natoque porta sed pede. Conubia"
54.00,609.16,298.81,618.00,"/F8",9.96,"donec ad fusce velit cras blandit facilisis torquent eros."
54.00,597.20,298.84,606.05,"/F8",9.96,"Feugiat justo fusce fames tristique donec ut. Gravida"
54.00,585.25,298.83,594.09,"/F8",9.96,"class quis et lacus taciti eu pharetra diam bibendum sus-"
54.00,573.29,298.80,582.14,"/F8",9.96,"pendisse. Vivamus fames nisl tincidunt lectus parturient"
54.00,561.34,298.83,570.18,"/F8",9.96,"lacus gravida ligula id dictumst libero cras id consequat"
54.00,549.38,298.85,558.23,"/F8",9.96,"egestas cursus. Euismod fusce sed nunc faucibus posuere"
54.00,537.43,298.85,546.27,"/F8",9.96,"cras augue id. Lacinia donec dui elit interdum elemen-"
54.00,525.47,298.80,534.32,"/F8",9.96,"tum torquent semper quis nisi parturient libero. Natoque"
54.00,513.52,298.83,522.36,"/F8",9.96,"justo sem nibh aliquet ve id mi in porta. Posuere vitae ad"
54.00,501.56,298.87,510.41,"/F8",9.96,"lectus. Vivamus augue orci a arcu metus porta aptent."
54.00,489.61,230.05,498.45,"/F8",9.96,"Lacinia justo nibh diam enim imperdiet."
63.96,477.35,298.89,486.20,"/F8",9.96,"Nonummy purus metus tortor augue parturient"
54.00,465.39,298.79,474.24,"/F8",9.96,"scelerisque sapien. Cubilia metus. Viverra velit. Potenti"
54.00,453.44,298.84,462.28,"/F8",9.96,"dolor laoreet pede ac inceptos eget. Blandit neque nulla"
54.00,441.48,298.86,450.33,"/F8",9.96,"curabitur sapien diam erat porta ac a platea. Blandit"
54.00,429.53,298.86,438.37,"/F8",9.96,"class arcu. Aliquet augue urna a dolor ve nulla. Vivamus"
54.00,417.57,298.84,426.42,"/F8",9.96,"curae purus placerat nulla diam potenti eros eu. Gravida"
54.00,405.62,298.86,414.46,"/F8",9.96,"dolor eros conubia curae nonummy. Potenti purus justo"
54.00,393.66,298.81,402.51,"/F8",9.96,"tortor diam erat nunc elit ultrices scelerisque. Gravida"
54.00,381.71,298.87,390.55,"/F8",9.96,"morbi neque mattis massa sodales rutrum nibh sapien"
54.00,369.75,298.87,378.60,"/F8",9.96,"morbi vestibulum maecenas erat tempor. Euismod me-"
54.00,357.80,298.82,366.64,"/F8",9.96,"tus dui vehicula tristique quis vel duis. Vivamus massa"
54.00,345.84,298.84,354.69,"/F8",9.96,"magna condimentum sed nisi vestibulum hac vestibulum"
54.00,333.89,298.86,342.73,"/F8",9.96,"venenatis metus diam elementum. Viverra netus. Na-"
54.00,321.93,298.84,330.78,"/F8",9.96,"toque risus per quam dignissim ve elementum. Feugiat"
54.00,309.98,298.84,318.82,"/F8",9.96,"justo vitae taciti id elementum a leo. Euismod justo ad"
54.00,298.02,298.86,306.87,"/F8",9.96,"phasellus a. Viverra neque nunc. Commodo velit proin"
54.00,286.07,298.83,294.91,"/F8",9.96,"orci aenean dui eros lectus tristique. Potenti lorem massa"
54.00,274.11,298.86,282.96,"/F8",9.96,"nibh a diam id vel ut. Euismod neque enim eros sapien"
54.00,262.16,298.81,271.00,"/F8",9.96,"iaculis potenti pellentesque. Cubilia dolor arcu aenean in"
54.00,250.20,154.18,259.05,"/F8",9.96,"tempor orci viverra eu."
63.96,237.94,298.86,246.79,"/F8",9.96,"Aliquam lorem etiam purus donec. Integer vitae nisl"
54.00,225.99,298.89,234.84,"/F8",9.96,"vivamus eu. Commodo ipsum nunc et malesuada condi-"
54.00,214.03,298.90,222.88,"/F8",9.96,"mentum nam. Lacinia vitae dolor sociosqu mi massa"
54.00,202.08,298.83,210.93,"/F8",9.96,"ac convallis condimentum purus. Gravida curae vestibu-"
54.00,190.12,298.84,198.97,"/F8",9.96,"lum erat ornare sapien lorem. Aliquet vitae per dui sol-"
54.00,178.17,298.78,187.02,"/F8",9.96,"licitudin ad justo sollicitudin ipsum in mauris ultricies."
54.00,166.21,298.87,175.06,"/F8",9.96,"Commodo massa est. Gravida proin et convallis donec in."
54.00,154.26,298.83,163.11,"/F8",9.96,"Posuere risus. Iaculis vitae sit quis sodales eu. Gravida"
54.00,142.30,298.86,151.15,"/F8",9.96,"dolor parturient eros proin nonummy curae quis. Po-"
54.00,130.35,298.84,139.19,"/F8",9.96,"suere fames id hendrerit. Cubilia purus ad elementum"
54.00,118.39,298.81,127.24,"/F8",9.96,"arcu justo lorem dui erat amet ut ridiculus. Posuere velit"
317.01,777.92,561.87,786.77,"/F8",9.96,"lacinia id platea nam semper rutrum non pede. Egestas"
317.01,765.96,561.85,774.81,"/F8",9.96,"velit ac pede scelerisque mi montes a sociosqu duis orci."
317.01,754.01,561.85,762.86,"/F8",9.96,"Feugiat class metus nec arcu. Potenti porta. Quisque"
317.01,742.05,561.85,750.90,"/F8",9.96,"curae quis orci lorem quisque sapien. Quisque morbi na-"
317.01,730.10,561.87,738.94,"/F8",9.96,"toque per ut habitasse class ve at orci fusce class cum."
317.01,718.14,561.82,726.99,"/F8",9.96,"Cubilia fusce pede in sit in sodales. Quisque velit nibh"
317.01,706.19,413.24,715.03,"/F8",9.96,"dis. Posuere proin mi."
329.73,672.07,549.21,680.03,"/F19",8.97,"Aliquet lorem risus massa urna odio accumsan."
326.98,645.53,393.09,654.37,"/F8",9.96,"Conubia vitae."
405.11,645.53,561.88,654.37,"/F8",9.96,"Conubia massa parturient eleifend"
317.01,633.57,561.86,642.42,"/F8",9.96,"lorem at litora eu erat nulla fames ornare. Cubilia porta"
317.01,621.62,561.85,630.46,"/F8",9.96,"vel neque consequat aliquam orci taciti. Rhoncus nulla"
317.01,609.66,561.87,618.51,"/F8",9.96,"in nec in consectetuer aliquam fames cras inceptos ac-"
317.01,597.71,561.82,606.55,"/F8",9.96,"cumsan ve scelerisque in taciti. Potenti lorem ve lobortis"
317.01,585.75,561.84,594.60,"/F8",9.96,"sociis ornare dui. Natoque felis cum nibh diam ultricies"
317.01,573.80,561.86,582.64,"/F8",9.96,"sociosqu faucibus vitae elementum taciti sem. Laoreet"
317.01,561.84,561.88,570.69,"/F8",9.96,"massa quam dis enim adipiscing magnis sociosqu integer"
317.01,549.89,561.87,558.73,"/F8",9.96,"vitae quam phasellus et. Gravida augue cras. Sodales"
317.01,537.93,561.87,546.78,"/F8",9.96,"donec cras montes conubia diam suscipit vel dapibus."
317.01,525.97,561.86,534.82,"/F8",9.96,"Feugiat dolor et class ligula semper vitae natoque. Po-"
317.01,514.02,561.85,522.87,"/F8",9.96,"tenti lacus justo a natoque ac convallis scelerisque hy-"
317.01,502.06,561.90,510.91,"/F8",9.96,"menaeos eget posuere. Vivamus class nam fames aptent"
317.01,490.11,561.84,498.96,"/F8",9.96,"libero viverra. Lacinia proin vitae a vivamus tellus et"
317.01,478.15,561.86,487.00,"/F8",9.96,"magna. Feugiat neque elit iaculis non bibendum a. Feu-"
317.01,466.20,561.81,475.05,"/F8",9.96,"giat netus viverra dolor porta taciti ut taciti quisque cras"
317.01,454.24,561.85,463.09,"/F8",9.96,"et ipsum odio netus proin sociis. Viverra dolor quam luc-"
317.01,442.29,561.85,451.14,"/F8",9.96,"tus hac taciti. Sodales fames lacinia. Integer dolor. Blan-"
317.01,430.33,561.83,439.18,"/F8",9.96,"dit justo. Aliquam proin mi tincidunt proin dis amet."
317.01,418.38,561.87,427.22,"/F8",9.96,"Gravida justo sem. Nonummy metus parturient condi-"
317.01,406.42,560.29,415.27,"/F8",9.96,"mentum semper at mattis ut quis aenean dapibus at in."
326.98,394.25,561.87,403.09,"/F8",9.96,"Conubia ipsum. Sodales felis proin nisi ad pharetra"
317.01,382.29,561.83,391.14,"/F8",9.96,"cubilia sapien. Quisque metus urna suspendisse vivamus"
317.01,370.34,561.84,379.18,"/F8",9.96,"etiam et quis ipsum. Dapibus metus fames risus molestie"
317.01,358.38,561.87,367.23,"/F8",9.96,"etiam ad mollis fusce pretium sem dictum a natoque."
317.01,346.43,561.86,355.27,"/F8",9.96,"Blandit morbi urna sapien sociis dolor nulla a. Iaculis"
317.01,334.47,561.88,343.32,"/F8",9.96,"felis sem adipiscing montes lacus maecenas ipsum sagit-"
317.01,322.52,561.85,331.36,"/F8",9.96,"tis vestibulum nullam lobortis diam pede nisl. Commodo"
317.01,310.56,561.86,319.41,"/F8",9.96,"lacus conubia orci sociosqu ut sed ad nulla ridiculus ac-"
317.01,298.61,561.86,307.45,"/F8",9.96,"cumsan nulla. Cubilia dolor class ornare dictumst mus."
317.01,286.65,561.85,295.50,"/F8",9.96,"Sodales morbi. Sodales justo vestibulum eu mauris neque"
317.01,274.70,561.88,283.54,"/F8",9.96,"mus lacus. Viverra vitae urna. Rhoncus augue. Conubia"
317.01,262.74,561.87,271.59,"/F8",9.96,"morbi. Integer lacus purus. Potenti augue mus cursus a"
317.01,250.79,561.82,259.63,"/F8",9.96,"senectus nisi ve. Quisque class iaculis tempor duis sociis"
317.01,238.83,561.81,247.68,"/F8",9.96,"tristique ad. Iaculis risus nisl platea egestas fringilla cras"
317.01,226.87,561.86,235.72,"/F8",9.96,"odio dis metus. Vivamus nulla adipiscing suspendisse"
317.01,214.92,561.88,223.77,"/F8",9.96,"litora in. Lacinia massa. Cubilia augue. Lacinia ipsum"
317.01,202.96,561.83,211.81,"/F8",9.96,"pretium neque at tempus habitant consequat et fringilla"
317.01,191.01,421.94,199.86,"/F8",9.96,"netus a. Gravida neque."
360.31,156.89,518.71,164.85,"/F19",8.97,"EUISMOD PURUS ETIAM DUI."
326.98,130.35,561.86,139.19,"/F8",9.96,"Nonummy proin nam diam porttitor ridiculus adipisc-"
317.01,118.39,561.86,127.24,"/F8",9.96,"ing pede. Aliquet proin vivamus congue duis dis enim"
