37.61,748.78,288.46,757.62,"/F8",9.96,"Dapibus purus in erat eni morbi. Commodo metus nunc"
37.61,736.82,288.45,745.67,"/F8",9.96,"aliquam at. Aliquam vitae. Dapibus proin cum proin"
37.61,724.87,288.40,733.71,"/F8",9.96,"habitasse mi turpis facilisis lacus orci velit eget sapien."
37.61,712.91,288.42,721.76,"/F8",9.96,"Viverra augue proin. Quisque purus elit ac vitae eu vi-"
37.61,700.96,288.46,709.80,"/F8",9.96,"tae lectus molestie class. Commodo morbi et ve. Conubia"
37.61,689.00,288.41,697.85,"/F8",9.96,"ipsum elit. Potenti massa vestibulum quisque nunc arcu"
37.61,677.04,222.04,685.89,"/F8",9.96,"venenatis est integer a scelerisque dui nisi."
52.56,665.09,288.44,673.94,"/F8",9.96,"Iaculis purus ante rutrum laoreet egestas tempor urna."
37.61,653.13,288.41,661.98,"/F8",9.96,"Pretium porta. Iaculis etiam. Integer morbi. Iaculis nulla"
37.61,641.18,288.43,650.03,"/F8",9.96,"ante a massa feugiat id congue faucibus nisl nisi nascetur."
37.61,629.22,288.45,638.07,"/F8",9.96,"Conubia justo. Quisque vitae hac augue nunc. Natoque"
37.61,617.27,288.43,626.11,"/F8",9.96,"felis. Aliquet vitae odio nam a mattis curae suspendisse"
37.61,605.31,288.38,614.16,"/F8",9.96,"lobortis duis tortor vestibulum vehicula. Dapibus purus eu"
37.61,593.36,288.38,602.20,"/F8",9.96,"tristique pretium dis eu netus felis. Blandit morbi ante eu"
37.61,581.40,288.40,590.25,"/F8",9.96,"consectetuer. Aliquet proin at mattis consequat. Cubilia"
37.61,569.45,288.48,578.29,"/F8",9.96,"magna. Euismod fames nisi leo. Feugiat augue ac male-"
37.61,557.49,288.43,566.34,"/F8",9.96,"suada iaculis lectus. Laoreet etiam class per habitasse con-"
37.61,545.54,288.37,554.38,"/F8",9.96,"sectetuer parturient odio turpis urna ac sollicitudin tortor"
37.61,533.58,288.41,542.43,"/F8",9.96,"curae scelerisque sagittis. Posuere lorem. Dapibus nulla"
37.61,521.63,288.44,530.47,"/F8",9.96,"lacus rhoncus. Commodo fusce. Iaculis velit mi. Aliquam"
37.61,509.67,288.43,518.52,"/F8",9.96,"lorem. Conubia ipsum orci vehicula risus sem nulla nisi"
37.61,497.72,69.11,506.56,"/F8",9.96,"cubilia."
37.61,475.30,168.48,484.15,"/F27",9.96,"1.2. Conubia risus justo nibh."
52.56,461.85,288.48,470.70,"/F8",9.96,"Commodo lacus hac penatibus natoque eni dictumst"
37.61,449.90,255.99,458.74,"/F8",9.96,"sollicitudin euismod tincidunt arcu dis faucibus."
266.09,449.90,288.39,458.74,"/F8",9.96,"Euis-"
37.61,437.94,288.44,446.79,"/F8",9.96,"mod fames. Euismod lorem odio laoreet ut vitae curabitur"
37.61,425.99,288.47,434.83,"/F8",9.96,"quam pede ad. Aliquam magna dis morbi. Viverra fusce"
37.61,414.03,288.43,422.88,"/F8",9.96,"nibh cubilia aliquet. Gravida curae arcu rhoncus quam"
37.61,402.08,288.41,410.92,"/F8",9.96,"vivamus imperdiet nascetur duis erat porta. Aliquet ne-"
37.61,390.12,288.42,398.97,"/F8",9.96,"tus est. Laoreet porta duis odio id bibendum cubilia etiam"
37.61,378.17,288.44,387.01,"/F8",9.96,"neque. Pretium augue duis a nibh magna tincidunt maece-"
37.61,366.21,288.42,375.06,"/F8",9.96,"nas at donec dis nulla phasellus ultrices aptent. Vivamus"
37.61,354.26,288.38,363.10,"/F8",9.96,"velit sit nibh parturient consequat scelerisque dignissim"
37.61,342.30,288.38,351.15,"/F8",9.96,"duis. Viverra justo quis blandit nibh in pellentesque sol-"
37.61,330.34,288.40,339.19,"/F8",9.96,"licitudin iaculis mollis vel. Dapibus etiam porta montes"
37.61,318.39,288.46,327.24,"/F8",9.96,"urna at magna ut tempus vehicula. Vivamus dolor. Ali-"
37.61,306.43,288.44,315.28,"/F8",9.96,"quam class. Sodales justo proin fermentum curae mattis"
37.61,294.48,288.43,303.33,"/F8",9.96,"congue lacus. Integer class lacus vehicula. Viverra vitae"
37.61,282.52,288.42,291.37,"/F8",9.96,"duis elit congue ut habitasse. Egestas neque mi nisl quis"
37.61,270.57,288.42,279.41,"/F8",9.96,"sed eu venenatis. Potenti lacus curae neque sapien ante fa-"
37.61,258.61,288.44,267.46,"/F8",9.96,"cilisis ut massa ut fusce fringilla. Commodo porta ipsum"
37.61,246.66,288.44,255.51,"/F8",9.96,"taciti massa neque. Aliquet massa cum dictum a sagittis"
37.61,234.70,288.42,243.55,"/F8",9.96,"duis volutpat nunc vel a tempus class duis luctus euismod"
37.61,222.75,288.45,231.60,"/F8",9.96,"eros a. Natoque nulla cras luctus nec lobortis egestas mol-"
37.61,210.79,68.11,219.64,"/F8",9.96,"lis nisi."
52.56,198.84,288.45,207.68,"/F8",9.96,"Feugiat netus felis aenean arcu. Aliquam nulla. Po-"
37.61,186.88,288.41,195.73,"/F8",9.96,"suere porta et fames ve porttitor fusce tristique. Viva-"
37.61,174.93,288.43,183.77,"/F8",9.96,"mus lorem. Rhoncus curae quis vivamus varius sit nisi."
37.61,162.97,288.37,171.82,"/F8",9.96,"Pretium velit vel nibh erat. Aliquet velit ve metus id ip-"
37.61,151.02,288.43,159.86,"/F8",9.96,"sum pellentesque porta ut arcu cum. Integer porta duis"
37.61,139.06,288.43,147.91,"/F8",9.96,"elementum. Vivamus lacus ad praesent viverra. Pretium"
37.61,127.11,288.42,135.95,"/F8",9.96,"neque. Integer ipsum in. Viverra risus. Viverra curae id"
37.61,115.15,288.46,124.00,"/F8",9.96,"libero rhoncus. Laoreet curae morbi magnis eget gravida"
37.61,103.20,288.45,112.04,"/F8",9.96,"aptent etiam nibh eget nonummy. Posuere justo proin"
37.61,91.24,288.44,100.09,"/F8",9.96,"tellus in lacus nostra aenean velit magnis mi. Vivamus"
37.61,79.29,288.44,88.13,"/F8",9.96,"vitae eget sit. Cubilia curae duis a metus ad litora ac."
306.60,748.78,557.40,757.62,"/F8",9.96,"Iaculis vitae mi proin ad pellentesque. Integer metus ali-"
306.60,736.82,557.44,745.67,"/F8",9.96,"quet dictum. Dapibus porta fames natoque ornare cras"
306.60,724.87,557.46,733.71,"/F8",9.96,"suspendisse euismod. Commodo porta ve at eros penati-"
306.60,712.91,557.42,721.76,"/F8",9.96,"bus ad arcu dictum. Egestas netus pretium cum vestibu-"
306.60,700.95,557.40,709.80,"/F8",9.96,"lum adipiscing ac dignissim gravida consectetuer curabitur"
306.60,689.00,425.61,697.85,"/F8",9.96,"lorem dis nibh quis feugiat."
321.55,677.04,557.44,685.89,"/F8",9.96,"Quisque metus cum quam malesuada sollicitudin sem"
306.60,665.09,557.40,673.94,"/F8",9.96,"porttitor dictum congue blandit potenti. Viverra metus"
306.60,653.13,557.58,661.98,"/F8",9.96,"eget nonummy potenti. Laoreet augue mi etiam scelerisque"
306.60,641.18,557.41,650.02,"/F8",9.96,"dictumst potenti. Gravida class in eget. Conubia purus"
306.60,629.22,557.40,638.07,"/F8",9.96,"hac pede. Quisque velit orci nisl. Gravida proin neque"
306.60,617.27,557.38,626.11,"/F8",9.96,"scelerisque vehicula blandit sodales. Viverra justo adipisc-"
306.60,605.31,557.43,614.16,"/F8",9.96,"ing urna sapien rhoncus viverra. Aliquet dolor commodo."
306.60,593.36,557.45,602.20,"/F8",9.96,"Aliquet massa ad curae aptent condimentum class hen-"
306.60,581.40,557.39,590.25,"/F8",9.96,"drerit sagittis interdum class etiam. Potenti augue ante."
306.60,569.45,557.43,578.29,"/F8",9.96,"Integer nulla dis. Viverra justo at. Euismod morbi id"
306.60,557.49,386.59,566.34,"/F8",9.96,"habitasse gravida."
396.69,557.49,557.42,566.34,"/F8",9.96,"Dapibus morbi nisi platea pretium."
306.60,545.54,557.40,554.38,"/F8",9.96,"Potenti purus. Conubia ipsum feugiat integer porttitor"
306.60,533.58,557.40,542.43,"/F8",9.96,"nostra netus. Cubilia justo at in cras nibh cubilia elit"
306.60,521.63,557.40,530.47,"/F8",9.96,"nec nulla fermentum parturient. Aliquam neque risus im-"
306.60,509.67,557.38,518.52,"/F8",9.96,"perdiet. Viverra ipsum eni quis. Sodales risus urna potenti"
306.60,497.72,557.40,506.56,"/F8",9.96,"cras pede viverra id. Aliquam ipsum nisi eni phasellus con-"
306.60,485.76,464.05,494.61,"/F8",9.96,"sectetuer est fermentum taciti nunc."
306.60,457.37,488.60,466.21,"/F17",9.96,"2. Aliquam curae netus ante a velit."
321.55,437.94,557.44,446.79,"/F8",9.96,"Egestas morbi lacus porta rutrum ac pulvinar elit so-"
306.60,425.98,557.47,434.83,"/F8",9.96,"ciosqu orci sodales. Laoreet vitae nunc nam congue a"
306.60,414.03,342.08,422.88,"/F8",9.96,"suscipit."
352.51,414.03,481.35,422.88,"/F8",9.96,"Posuere lorem ad nisi vitae."
491.78,414.03,557.41,422.88,"/F8",9.96,"Viverra neque."
306.60,402.08,557.39,410.92,"/F8",9.96,"Feugiat curae eros inceptos nascetur sollicitudin vestibu-"
306.60,390.12,557.40,398.97,"/F8",9.96,"lum dapibus eros praesent tincidunt senectus neque sus-"
306.60,378.17,557.39,387.01,"/F8",9.96,"cipit vitae litora nulla primis. Lacinia dolor. Pretium"
306.60,366.21,557.42,375.06,"/F8",9.96,"neque. Posuere massa hac phasellus consectetuer vestibu-"
306.60,354.25,557.46,363.10,"/F8",9.96,"lum. Gravida risus curae accumsan nisl nec sodales a"
306.60,342.30,557.46,351.15,"/F8",9.96,"condimentum. Vivamus risus erat nec magna fames habi-"
306.60,330.34,557.43,339.19,"/F8",9.96,"tant. Euismod lacus justo cras. Blandit augue cras at ip-"
306.60,318.39,557.43,327.24,"/F8",9.96,"sum curabitur nibh ullamcorper eni ad. Laoreet purus ad"
306.60,306.43,557.40,315.28,"/F8",9.96,"turpis porta. Conubia lorem ve fames taciti pellentesque"
306.60,294.48,557.41,303.32,"/F8",9.96,"vulputate porta consequat. Lacinia lacus eros posuere tin-"
306.60,282.52,557.37,291.37,"/F8",9.96,"cidunt dis erat cras parturient luctus felis. Conubia vitae"
306.60,270.57,557.40,279.41,"/F8",9.96,"proin nisl erat. Integer netus id amet dictumst. Cubilia"
306.60,258.61,557.43,267.46,"/F8",9.96,"lacus in ac magnis dolor aliquam vel. Aliquet metus ante"
306.60,246.66,557.42,255.50,"/F8",9.96,"scelerisque posuere dui habitant. Aliquam dolor donec"
306.60,234.70,557.40,243.55,"/F8",9.96,"etiam eleifend in vitae ad montes id ante nisi pretium el-"
306.60,222.75,557.40,231.59,"/F8",9.96,"ementum urna iaculis luctus. Natoque vitae ve. Quisque"
306.60,210.79,557.36,219.64,"/F8",9.96,"porta enim eni purus vulputate quis vulputate et tincidunt"
306.60,198.84,426.85,207.68,"/F8",9.96,"iaculis turpis orci egestas a."
321.55,186.88,557.45,195.73,"/F8",9.96,"Dapibus porta fusce inceptos mi risus ornare. Non-"
306.60,174.93,557.77,183.77,"/F8",9.96,"ummy etiam enim in pellentesque sodales risus justo ornare"
306.60,162.97,557.44,171.82,"/F8",9.96,"justo per nibh mi curae ad. Gravida donec. Integer la-"
306.60,151.02,557.45,159.86,"/F8",9.96,"cus hac urna fames et sit eu fermentum. Posuere lorem"
306.60,139.06,557.40,147.91,"/F8",9.96,"ut tristique eros sollicitudin. Commodo purus dui morbi"
306.60,127.11,557.43,135.95,"/F8",9.96,"duis. Natoque porta nisl risus ipsum. Euismod porta ac"
306.60,115.15,557.39,124.00,"/F8",9.96,"mus erat nisl velit cursus eu montes vulputate nec. Sodales"
306.60,103.20,557.43,112.04,"/F8",9.96,"morbi class aptent donec. Gravida augue at tortor eu ante"
306.60,91.24,557.41,100.09,"/F8",9.96,"condimentum iaculis. Feugiat ipsum netus posuere cursus"
306.60,79.29,557.42,88.13,"/F8",9.96,"at suscipit nunc. Nonummy velit. Egestas massa. Feugiat"
295.15,61.35,300.13,70.20,"/F8",9.96,"2"
