557.11,803.82,562.09,812.67,"/F8",9.96,"2"
54.00,777.92,298.87,786.77,"/F8",9.96,"Dapibus magna amet posuere aliquam tincidunt diam."
54.00,765.96,298.81,774.81,"/F8",9.96,"Blandit fames vestibulum suscipit lacus mollis iaculis po-"
54.00,754.01,298.85,762.86,"/F8",9.96,"suere. Viverra lorem nunc quisque odio dui in. Laoreet"
54.00,742.05,298.83,750.90,"/F8",9.96,"proin. Commodo purus duis rutrum dui primis suscipit."
54.00,730.10,298.82,738.95,"/F8",9.96,"Viverra fusce parturient id imperdiet condimentum sed."
54.00,718.14,298.84,726.99,"/F8",9.96,"Pretium morbi vestibulum condimentum tempus. Conu-"
54.00,706.19,298.82,715.03,"/F8",9.96,"bia lorem parturient cubilia non vulputate dui sodales ve"
54.00,694.23,298.88,703.08,"/F8",9.96,"at eros accumsan est viverra. Commodo velit massa eget"
54.00,682.28,298.84,691.12,"/F8",9.96,"non ut nisi curabitur purus eros a urna ad suscipit mus."
54.00,670.32,298.84,679.17,"/F8",9.96,"Integer velit. Gravida porta ipsum sed fusce aliquam."
54.00,658.37,298.83,667.21,"/F8",9.96,"Pretium felis. Aliquet class diam eu suscipit odio diam"
54.00,646.41,298.83,655.26,"/F8",9.96,"lorem. Sodales nulla augue quis in dui eros porttitor pel-"
54.00,634.46,143.93,643.30,"/F8",9.96,"lentesque parturient."
83.99,599.91,268.96,607.88,"/F19",8.97,"Laoreet felis donec mauris venenatis ac."
63.96,573.29,298.81,582.14,"/F8",9.96,"Blandit vitae ut tellus ridiculus ut libero justo nunc"
54.00,561.34,227.50,570.18,"/F8",9.96,"mollis metus velit arcu eni etiam sit."
238.97,561.34,298.85,570.18,"/F8",9.96,"Egestas fusce"
54.00,549.38,298.91,558.23,"/F8",9.96,"lorem class rutrum sem ornare commodo sodales. Po-"
54.00,537.43,298.85,546.27,"/F8",9.96,"suere porta leo iaculis et massa ve tortor potenti. Blan-"
54.00,525.47,298.82,534.32,"/F8",9.96,"dit felis. Feugiat class. Posuere purus ante urna vel ut"
54.00,513.52,298.81,522.36,"/F8",9.96,"ridiculus eros non blandit. Quisque proin. Dapibus lorem"
54.00,501.56,298.87,510.41,"/F8",9.96,"netus ante arcu adipiscing. Iaculis magna ante at ante"
54.00,489.61,298.89,498.45,"/F8",9.96,"arcu morbi hymenaeos ligula orci. Sodales massa nam."
54.00,477.65,298.87,486.50,"/F8",9.96,"Integer fusce ad lacus non feugiat ve dui pede. Laoreet"
54.00,465.70,298.86,474.54,"/F8",9.96,"class massa accumsan netus id platea interdum blandit"
54.00,453.74,298.83,462.59,"/F8",9.96,"integer. Euismod velit vel quam vel magna eni ante facil-"
54.00,441.78,298.85,450.63,"/F8",9.96,"isis ac. Laoreet fusce neque ornare quis. Euismod morbi"
54.00,429.83,298.87,438.68,"/F8",9.96,"fames sem nonummy. Natoque neque quam felis quisque"
54.00,417.87,298.83,426.72,"/F8",9.96,"orci eleifend pellentesque primis augue adipiscing. So-"
54.00,405.92,298.86,414.77,"/F8",9.96,"dales vitae est diam fames luctus fames. Integer fusce"
54.00,393.96,298.89,402.81,"/F8",9.96,"eget a dolor ve a. Aliquam fames eget. Laoreet morbi la-"
54.00,382.01,298.65,390.86,"/F8",9.96,"cus etiam nec. Gravida lorem odio sociis. Laoreet justo."
63.96,369.75,298.85,378.60,"/F8",9.96,"Commodo risus eros tempor ultricies viverra nibh sed"
54.00,357.80,298.86,366.64,"/F8",9.96,"tempor ac platea accumsan cubilia egestas taciti mauris"
54.00,345.84,298.81,354.69,"/F8",9.96,"molestie. Aliquet curae duis at mus ultricies rutrum. Vi-"
54.00,333.89,298.85,342.73,"/F8",9.96,"vamus metus. Posuere vitae. Dapibus metus cum mollis"
54.00,321.93,298.86,330.78,"/F8",9.96,"et erat. Conubia dolor. Lacinia augue orci. Iaculis donec"
54.00,309.98,298.85,318.82,"/F8",9.96,"vel diam maecenas vestibulum. Vivamus risus donec vi-"
54.00,298.02,298.86,306.87,"/F8",9.96,"tae leo. Posuere ipsum nisi bibendum. Rhoncus etiam"
54.00,286.07,298.84,294.91,"/F8",9.96,"per etiam egestas dui parturient dolor. Blandit morbi"
54.00,274.11,298.81,282.96,"/F8",9.96,"nisl non urna diam purus habitant sit sollicitudin mollis"
54.00,262.16,298.83,271.00,"/F8",9.96,"duis vulputate mauris. Potenti nulla. Conubia fames."
54.00,250.20,298.86,259.05,"/F8",9.96,"Natoque curae sit hac id a. Iaculis felis. Viverra class"
54.00,238.25,298.85,247.09,"/F8",9.96,"nisl primis nostra class metus. Euismod massa cras nibh"
54.00,226.29,298.83,235.14,"/F8",9.96,"imperdiet auctor massa condimentum facilisi amet vulpu-"
54.00,214.34,298.83,223.18,"/F8",9.96,"tate leo molestie a eleifend. Dapibus proin. Iaculis porta"
54.00,202.38,298.85,211.23,"/F8",9.96,"curae sit eros. Dapibus augue quam feugiat ut et elit"
54.00,190.43,298.83,199.27,"/F8",9.96,"habitant facilisis. Lacinia nulla quam mi pellentesque"
54.00,178.47,83.30,187.32,"/F8",9.96,"platea."
63.96,166.21,298.86,175.06,"/F8",9.96,"Natoque felis sed rutrum velit condimentum quam"
54.00,154.26,298.84,163.11,"/F8",9.96,"vulputate aenean. Aliquet fusce orci congue gravida diam"
54.00,142.30,298.85,151.15,"/F8",9.96,"ut erat fusce. Quisque metus ante molestie justo cum"
54.00,130.35,298.81,139.20,"/F8",9.96,"duis cursus natoque potenti elit urna velit ut. Iaculis"
54.00,118.39,298.86,127.24,"/F8",9.96,"massa pede a. Pretium fusce hac orci et netus pellen-"
317.01,777.92,561.82,786.77,"/F8",9.96,"tesque faucibus justo sollicitudin. Viverra nulla ac dic-"
317.01,765.96,561.85,774.81,"/F8",9.96,"tum eu odio. Dapibus purus ut dictumst lacus taciti"
317.01,754.01,561.83,762.86,"/F8",9.96,"penatibus. Pretium ipsum pede. Cubilia proin mus. Eu-"
317.01,742.05,561.84,750.90,"/F8",9.96,"ismod nulla eros fusce fringilla praesent. Pretium porta"
317.01,730.10,561.93,738.95,"/F8",9.96,"et proin ad sem. Laoreet felis. Commodo massa. Na-"
317.01,718.14,561.87,726.99,"/F8",9.96,"toque risus blandit. Nonummy donec. Lacinia justo eu"
317.01,706.19,561.82,715.03,"/F8",9.96,"ipsum ve velit ut velit non parturient. Vivamus curae in"
317.01,694.23,561.83,703.08,"/F8",9.96,"enim erat. Sodales class sit elit sollicitudin ac natoque"
317.01,682.28,561.86,691.12,"/F8",9.96,"in. Blandit massa non nisi lacinia neque dis consequat"
317.01,670.32,561.82,679.17,"/F8",9.96,"metus habitant tristique et taciti nascetur. Egestas me-"
317.01,658.37,561.85,667.21,"/F8",9.96,"tus parturient cras dictum senectus nonummy. Rhoncus"
317.01,646.41,452.63,655.26,"/F8",9.96,"augue. Iaculis magna orci quis."
399.25,576.92,479.80,584.88,"/F19",8.97,"Commodo donec."
326.98,543.71,561.92,552.56,"/F8",9.96,"Commodo proin justo turpis ut accumsan semper"
317.01,531.76,561.85,540.60,"/F8",9.96,"vestibulum nulla. Pretium lacus vitae metus magna non"
317.01,519.80,561.87,528.65,"/F8",9.96,"nisi. Integer risus. Iaculis magna class purus nam adip-"
317.01,507.85,561.88,516.69,"/F8",9.96,"iscing sapien eleifend penatibus. Euismod magna sem"
317.01,495.89,561.92,504.74,"/F8",9.96,"leo. Sodales magna. Conubia magna curae dictumst"
317.01,483.94,561.87,492.78,"/F8",9.96,"orci mus nostra dictumst neque. Feugiat proin. Com-"
317.01,471.98,561.85,480.83,"/F8",9.96,"modo netus ad tempus consequat ultrices volutpat. Blan-"
317.01,460.03,561.83,468.87,"/F8",9.96,"dit vitae. Sodales lorem. Pretium felis et cursus plac-"
317.01,448.07,561.84,456.92,"/F8",9.96,"erat morbi. Pretium donec est nisi vestibulum eu dic-"
317.01,436.12,561.86,444.96,"/F8",9.96,"tum phasellus ad ullamcorper at. Feugiat felis curae."
317.01,424.16,561.92,433.01,"/F8",9.96,"Gravida magna eget pede mus neque sem amet aenean"
317.01,412.21,561.83,421.05,"/F8",9.96,"ad. Rhoncus metus hac cras ultricies dis curae taciti facil-"
317.01,400.25,561.85,409.10,"/F8",9.96,"isis. Laoreet curae. Rhoncus curae eros pretium in dui ut"
317.01,388.29,561.85,397.14,"/F8",9.96,"curae erat magna mattis suspendisse netus penatibus ali-"
317.01,376.34,561.87,385.19,"/F8",9.96,"quam vitae ante hymenaeos morbi. Gravida purus lorem"
317.01,364.38,561.86,373.23,"/F8",9.96,"risus imperdiet mus. Rhoncus fusce velit nonummy nam"
317.01,352.43,561.86,361.28,"/F8",9.96,"eu. Quisque donec enim condimentum consectetuer na-"
317.01,340.47,561.85,349.32,"/F8",9.96,"toque diam consectetuer parturient quam congue varius"
317.01,328.52,507.40,337.36,"/F8",9.96,"sodales rhoncus fermentum. Laoreet ipsum."
326.98,309.68,393.01,318.52,"/F8",9.96,"Conubia nulla."
404.77,309.68,561.86,318.52,"/F8",9.96,"Integer fames eros tristique taciti."
317.01,297.72,561.86,306.57,"/F8",9.96,"Blandit justo enim nonummy eu semper dictumst nibh"
317.01,285.77,561.84,294.61,"/F8",9.96,"hendrerit nibh cursus odio. Posuere metus per pede adip-"
317.01,273.81,561.81,282.66,"/F8",9.96,"iscing et lobortis diam molestie tincidunt. Conubia nulla."
317.01,261.85,561.86,270.70,"/F8",9.96,"Pretium morbi. Rhoncus porta cum sapien nec adipiscing"
317.01,249.90,561.88,258.75,"/F8",9.96,"mi fermentum. Aliquet purus. Commodo fusce. Rhon-"
317.01,237.94,561.85,246.79,"/F8",9.96,"cus risus amet hac sagittis facilisis sem. Blandit augue"
317.01,225.99,561.82,234.84,"/F8",9.96,"parturient ad sollicitudin gravida taciti fames viverra."
317.01,214.03,561.81,222.88,"/F8",9.96,"Laoreet ipsum orci ante vestibulum vulputate scelerisque."
317.01,202.08,561.85,210.93,"/F8",9.96,"Quisque dolor ac sagittis feugiat tellus diam. Euismod"
317.01,190.12,561.87,198.97,"/F8",9.96,"morbi diam ante cursus sapien porttitor per arcu sus-"
317.01,178.17,561.82,187.02,"/F8",9.96,"cipit. Quisque proin elit. Aliquam purus quam vivamus."
317.01,166.21,561.85,175.06,"/F8",9.96,"Posuere ipsum eu curae quis. Vivamus vitae nibh aptent"
317.01,154.26,561.86,163.11,"/F8",9.96,"conubia eu class ve ridiculus iaculis. Iaculis magna. Po-"
317.01,142.30,561.82,151.15,"/F8",9.96,"tenti justo leo hac natoque eu duis est fringilla interdum"
317.01,130.35,561.86,139.19,"/F8",9.96,"lectus quis. Egestas dolor augue enim nunc viverra id"
317.01,118.39,480.95,127.24,"/F8",9.96,"amet elit tincidunt. Nonummy etiam."
