557.11,803.82,562.09,812.67,"/F8",9.96,"3"
90.89,778.11,262.07,786.07,"/F19",8.97,"VIVERRA NULLA QUAM METUS"
58.68,767.65,294.25,775.61,"/F19",8.97,"ULLAMCORPER NISI ELEMENTUM LEO NISI"
157.17,757.19,195.87,765.15,"/F19",8.97,"LACUS."
63.96,730.48,298.87,739.32,"/F8",9.96,"Integer fames cras potenti enim a orci parturient"
54.00,718.52,298.91,727.37,"/F8",9.96,"amet. Nonummy justo nunc mus habitasse commodo"
54.00,706.57,298.84,715.41,"/F8",9.96,"proin at litora id justo lacus mauris. Aliquam felis ve"
54.00,694.61,298.83,703.46,"/F8",9.96,"porta varius mi duis. Pretium neque lacus vulputate"
54.00,682.66,298.83,691.50,"/F8",9.96,"laoreet rutrum ac vitae. Pretium proin leo proin neque"
54.00,670.70,298.85,679.55,"/F8",9.96,"semper suspendisse proin fermentum. Egestas risus ac"
54.00,658.74,298.85,667.59,"/F8",9.96,"torquent lacinia. Iaculis massa nunc habitant dolor mol-"
54.00,646.79,298.83,655.64,"/F8",9.96,"lis vulputate bibendum duis sit at. Nonummy curae odio."
54.00,634.83,298.87,643.68,"/F8",9.96,"Gravida class mi venenatis proin et aenean. Vivamus"
54.00,622.88,298.83,631.73,"/F8",9.96,"nulla ve phasellus a sed tincidunt montes. Feugiat dolor"
54.00,610.92,298.87,619.77,"/F8",9.96,"eros natoque ac nam porttitor fusce. Conubia porta. Po-"
54.00,598.97,298.83,607.81,"/F8",9.96,"suere fames egestas molestie purus. Feugiat nulla in. Ali-"
54.00,587.01,298.86,595.86,"/F8",9.96,"quet fusce lorem massa nec odio velit dictum. Natoque"
54.00,575.06,298.86,583.90,"/F8",9.96,"ipsum dui class iaculis nam ut. Vivamus lacus nisl com-"
54.00,563.10,298.87,571.95,"/F8",9.96,"modo in curae. Laoreet class ipsum elementum ridicu-"
54.00,551.15,298.83,559.99,"/F8",9.96,"lus. Viverra donec pretium id curae pellentesque senec-"
54.00,539.19,298.90,548.04,"/F8",9.96,"tus class fames auctor mauris commodo egestas enim mi"
54.00,527.24,298.87,536.08,"/F8",9.96,"ante. Pretium neque. Integer class magna posuere mi."
54.00,515.28,298.84,524.13,"/F8",9.96,"Vivamus fusce augue nisi quam pretium lacus erat facilisi"
54.00,503.33,71.69,512.17,"/F8",9.96,"hac."
63.96,490.98,298.82,499.82,"/F8",9.96,"Iaculis morbi quis feugiat eros sagittis non sollicitudin"
54.00,479.02,298.82,487.87,"/F8",9.96,"litora nunc ad sollicitudin. Gravida fusce vel amet enim"
54.00,467.07,298.83,475.91,"/F8",9.96,"eu amet curabitur libero phasellus. Lacinia ipsum in ne-"
54.00,455.11,298.84,463.96,"/F8",9.96,"tus sem lorem est aliquet congue. Pretium ipsum risus"
54.00,443.16,298.82,452.00,"/F8",9.96,"ornare. Cubilia risus mi aenean ultricies torquent dic-"
54.00,431.20,298.84,440.05,"/F8",9.96,"tumst purus vehicula vestibulum. Egestas magna sodales"
54.00,419.25,298.83,428.09,"/F8",9.96,"hac parturient semper dis dictumst aliquet fames viva-"
54.00,407.29,298.87,416.14,"/F8",9.96,"mus. Sodales lacus dis habitasse. Natoque risus cum"
54.00,395.34,298.86,404.18,"/F8",9.96,"mauris senectus integer netus. Sodales magna per nunc"
54.00,383.38,298.82,392.23,"/F8",9.96,"eget vel elit. Sodales ipsum felis integer convallis cum"
54.00,371.43,298.85,380.27,"/F8",9.96,"odio eu sem. Cubilia felis adipiscing pulvinar. Com-"
54.00,359.47,298.84,368.32,"/F8",9.96,"modo felis. Dapibus felis. Potenti donec vitae sodales"
54.00,347.52,298.79,356.36,"/F8",9.96,"dis ac neque sollicitudin imperdiet tellus netus consequat"
54.00,335.56,298.84,344.41,"/F8",9.96,"potenti augue vestibulum. Laoreet risus eni mauris in"
54.00,323.61,298.87,332.45,"/F8",9.96,"luctus eni auctor conubia. Egestas magna sem habitant"
54.00,311.65,298.83,320.50,"/F8",9.96,"tristique. Feugiat curae in ve hac at nullam id sociis."
54.00,299.70,298.85,308.54,"/F8",9.96,"Potenti vitae nunc cras fames rhoncus. Lacinia risus at"
54.00,287.74,298.85,296.59,"/F8",9.96,"phasellus a curae iaculis litora tempor ante montes ad eu"
54.00,275.79,298.86,284.63,"/F8",9.96,"urna. Iaculis augue et aenean aliquet mi. Dapibus massa"
54.00,263.83,298.80,272.68,"/F8",9.96,"metus urna praesent phasellus nisl eni volutpat imperdiet"
54.00,251.87,226.58,260.72,"/F8",9.96,"eu hymenaeos parturient. Potenti class."
135.58,216.84,217.46,224.80,"/F19",8.97,"Nonummy morbi."
63.96,190.12,298.84,198.97,"/F8",9.96,"Sodales felis eu. Commodo felis id sollicitudin tempus"
54.00,178.17,298.83,187.02,"/F8",9.96,"platea ac ornare dictumst feugiat. Aliquet porta blandit"
54.00,166.21,298.85,175.06,"/F8",9.96,"magnis sit eget pede class convallis erat non felis fer-"
54.00,154.26,298.83,163.11,"/F8",9.96,"mentum. Integer felis. Lacinia justo nunc dui. Pretium"
54.00,142.30,298.83,151.15,"/F8",9.96,"justo risus ligula eros cras vulputate in nullam ad proin"
54.00,130.35,298.87,139.19,"/F8",9.96,"ut. Posuere dolor diam ipsum augue sem pede parturi-"
54.00,118.39,298.83,127.24,"/F8",9.96,"ent penatibus class quam mollis. Potenti porta. Iaculis"
317.01,777.92,561.86,786.77,"/F8",9.96,"magna et libero aliquam dictum id erat ve diam. Gravida"
317.01,765.96,561.88,774.81,"/F8",9.96,"porta duis hac. Euismod neque netus ullamcorper ac"
317.01,754.01,561.87,762.86,"/F8",9.96,"tempus ve accumsan tempor quis sociis id at erat. Conu-"
317.01,742.05,561.86,750.90,"/F8",9.96,"bia magna non egestas ut imperdiet scelerisque. Natoque"
317.01,730.10,561.81,738.94,"/F8",9.96,"metus nibh odio velit. Dapibus netus ut ridiculus risus"
317.01,718.14,561.82,726.99,"/F8",9.96,"facilisis. Integer felis morbi cum pretium eget. Aliquet"
317.01,706.19,561.86,715.03,"/F8",9.96,"lorem metus sem rutrum cum quis vestibulum. Egestas"
317.01,694.23,561.91,703.08,"/F8",9.96,"augue. Laoreet class. Commodo porta. Blandit massa eu"
317.01,682.28,561.88,691.12,"/F8",9.96,"ornare faucibus elementum. Pretium massa diam male-"
317.01,670.32,561.83,679.17,"/F8",9.96,"suada ultricies. Dapibus curae sed proin curabitur sit"
317.01,658.37,496.93,667.21,"/F8",9.96,"enim dignissim aptent suscipit imperdiet."
326.98,646.11,561.88,654.96,"/F8",9.96,"Posuere netus urna condimentum dis tempor eros id"
317.01,634.16,561.92,643.00,"/F8",9.96,"pede. Commodo donec. Vivamus magna eni montes id"
317.01,622.20,561.87,631.05,"/F8",9.96,"bibendum. Iaculis morbi at enim hymenaeos dictumst"
317.01,610.25,561.86,619.09,"/F8",9.96,"velit diam dui morbi tempus fusce massa lectus. Ali-"
317.01,598.29,561.85,607.14,"/F8",9.96,"quam lorem eni. Blandit risus. Viverra purus at ligula"
317.01,586.34,561.89,595.18,"/F8",9.96,"id cras ve mus eu a. Sodales augue. Lacinia risus quis"
317.01,574.38,561.87,583.23,"/F8",9.96,"a justo id dignissim proin ut etiam condimentum. Com-"
317.01,562.42,561.90,571.27,"/F8",9.96,"modo justo mus mollis ad purus convallis commodo per"
317.01,550.47,561.88,559.32,"/F8",9.96,"ac donec turpis. Feugiat ipsum. Nonummy netus eget"
317.01,538.51,561.86,547.36,"/F8",9.96,"mus amet vestibulum cum parturient adipiscing ve mo-"
317.01,526.56,561.87,535.41,"/F8",9.96,"lestie nec aliquam mi quam id nunc arcu. Sodales pu-"
317.01,514.60,561.89,523.45,"/F8",9.96,"rus. Nonummy massa dis hac mus. Pretium nulla par-"
317.01,502.65,561.81,511.50,"/F8",9.96,"turient. Blandit felis ipsum auctor ante scelerisque viva-"
317.01,490.69,561.86,499.54,"/F8",9.96,"mus justo. Sodales netus ad est erat. Rhoncus risus dis"
317.01,478.74,561.86,487.59,"/F8",9.96,"quam. Rhoncus lacus duis tellus. Aliquam lorem mi pel-"
317.01,466.78,561.84,475.63,"/F8",9.96,"lentesque. Quisque ipsum. Pretium metus cras nullam"
317.01,454.83,497.57,463.67,"/F8",9.96,"sociis faucibus ullamcorper praesent eget."
395.32,420.29,483.72,428.25,"/F19",8.97,"Lacinia vitae enim."
326.98,393.66,561.82,402.51,"/F8",9.96,"Blandit lorem proin aptent dis nisi nisl fringilla duis."
317.01,381.71,561.87,390.55,"/F8",9.96,"Viverra porta nunc diam malesuada tempus parturient"
317.01,369.75,561.82,378.60,"/F8",9.96,"consectetuer laoreet. Feugiat velit. Gravida proin nibh"
317.01,357.80,561.85,366.64,"/F8",9.96,"eget egestas neque porta nullam pellentesque quisque"
317.01,345.84,561.84,354.69,"/F8",9.96,"nulla sed venenatis. Viverra risus class est eros pellen-"
317.01,333.89,561.85,342.73,"/F8",9.96,"tesque ac quisque diam vehicula potenti. Laoreet metus"
317.01,321.93,561.86,330.78,"/F8",9.96,"non dis. Aliquet felis nunc nec arcu et hac eu. Rhoncus"
317.01,309.98,561.85,318.82,"/F8",9.96,"curae eget. Iaculis proin adipiscing sodales. Pretium do-"
317.01,298.02,561.87,306.87,"/F8",9.96,"lor nisi ac quam morbi neque ante eu augue rutrum conse-"
317.01,286.07,561.88,294.91,"/F8",9.96,"quat mi erat. Rhoncus class. Aliquet magna nam sapien"
317.01,274.11,561.89,282.96,"/F8",9.96,"nam adipiscing massa egestas pretium. Euismod dolor"
317.01,262.16,561.87,271.00,"/F8",9.96,"ante mi pharetra eni egestas nam mi. Dapibus risus."
317.01,250.20,561.85,259.05,"/F8",9.96,"Pretium neque ante nulla justo dictum ut curae purus"
317.01,238.25,561.88,247.09,"/F8",9.96,"ornare. Natoque nulla. Posuere morbi. Natoque netus"
317.01,226.29,561.88,235.14,"/F8",9.96,"per volutpat lorem eu. Commodo donec vitae volutpat"
317.01,214.34,561.85,223.18,"/F8",9.96,"pede mauris ut senectus laoreet rutrum dui adipiscing"
317.01,202.38,561.85,211.23,"/F8",9.96,"elementum scelerisque. Viverra augue curae elit ornare"
317.01,190.42,561.85,199.27,"/F8",9.96,"ridiculus lacus. Aliquam dolor dui diam. Vivamus purus"
317.01,178.47,382.92,187.32,"/F8",9.96,"sem iaculis eni."
326.98,166.21,561.86,175.06,"/F8",9.96,"Aliquam magna velit turpis ante. Cubilia risus lacus"
317.01,154.26,561.90,163.10,"/F8",9.96,"fusce eget cum porta congue sed nonummy nec id fusce"
317.01,142.30,561.84,151.15,"/F8",9.96,"hendrerit. Aliquet vitae et magnis ve mi hac cras. Viva-"
317.01,130.35,561.86,139.19,"/F8",9.96,"mus lorem justo pharetra sem consectetuer libero eget."
317.01,118.39,561.85,127.24,"/F8",9.96,"Cubilia lacus. Pretium morbi proin nascetur elit. Na-"
