70.19,737.96,524.85,750.70,"/F18",14.35,"Aliquet morbi eu aenean dis vel dui ad feugiat nibh libero sagittis at felis."
90.80,708.93,150.03,717.77,"/F8",9.96,"Chau Shearer"
150.08,713.12,154.05,719.31,"/F7",6.97,"a"
154.55,708.93,224.43,717.77,"/F8",9.96,", Armand Bever"
224.48,713.12,228.45,719.31,"/F7",6.97,"a"
228.95,708.93,292.69,717.77,"/F8",9.96,", Rudy Holden"
292.74,713.12,296.71,719.31,"/F7",6.97,"a"
297.21,708.93,368.67,717.77,"/F8",9.96,", David Omalley"
368.75,713.12,372.71,719.31,"/F7",6.97,"a"
373.22,708.93,434.40,717.77,"/F8",9.96,", Ester Bundy"
434.46,713.12,438.43,719.31,"/F7",6.97,"a"
438.93,708.93,499.94,717.77,"/F8",9.96,", Earl Marney"
500.00,713.12,503.97,719.31,"/F7",6.97,"a"
246.33,693.08,249.94,698.39,"/F26",5.98,"a"
250.44,689.88,348.84,696.96,"/F20",7.97,"Duran Research Of Lisbon"
37.61,632.81,81.42,641.66,"/F17",9.96,"Abstract"
37.61,614.88,557.14,623.72,"/F8",9.96,"Potenti justo ve imperdiet magna tortor pulvinar dolor litora nisl orci magna libero leo eros consequat torquent in fames."
37.61,602.92,557.19,611.77,"/F8",9.96,"Blandit massa porta odio sit tincidunt nec fames felis donec a. Feugiat lorem orci nam odio nam eni sed tincidunt."
37.61,590.97,557.21,599.81,"/F8",9.96,"Aliquam fames dolor nibh potenti eu litora sed. Commodo class duis proin nulla lacus ipsum. Aliquam purus in"
37.61,579.01,557.18,587.86,"/F8",9.96,"vulputate in duis purus volutpat quam. Laoreet vitae eros at nisi fames congue tortor ut cras at. Posuere porta dis"
37.61,567.06,557.14,575.90,"/F8",9.96,"duis venenatis sapien nascetur. Egestas etiam adipiscing inceptos cubilia metus. Integer etiam. Euismod netus gravida"
37.61,555.10,557.17,563.95,"/F8",9.96,"primis dolor massa vitae. Sodales augue donec leo nibh viverra. Natoque nulla. Egestas risus vestibulum suspendisse"
37.61,543.15,557.12,551.99,"/F8",9.96,"luctus et cum hymenaeos. Aliquet fusce duis cubilia ve et erat. Dapibus justo nisl lacinia urna ac interdum ante varius"
37.61,531.19,557.12,540.04,"/F8",9.96,"parturient consectetuer aliquam neque odio. Aliquet porta at etiam sociosqu fringilla dui porta primis nisl ve. Sodales"
37.61,519.24,557.16,528.08,"/F8",9.96,"fames lorem aenean malesuada volutpat tortor etiam senectus vitae a blandit lectus erat. Iaculis velit ac eros facilisis"
37.61,507.28,557.13,516.13,"/F8",9.96,"sollicitudin parturient pede velit aliquam viverra nibh. Aliquam lorem urna torquent nonummy rutrum enim ad non"
37.61,495.33,542.15,504.17,"/F8",9.96,"diam vestibulum nullam. Feugiat dolor curae erat convallis sed leo dui. Commodo porta enim hac lorem etiam nisl."
37.61,461.11,123.31,469.96,"/F17",9.96,"1. Integer purus."
52.56,440.19,288.47,449.04,"/F8",9.96,"Rhoncus curae. Pretium magna ut consectetuer mol-"
37.61,428.23,288.42,437.08,"/F8",9.96,"lis. Rhoncus felis leo porta cras torquent conubia natoque"
37.61,416.28,288.39,425.13,"/F8",9.96,"diam erat molestie consectetuer. Blandit neque parturient"
37.61,404.32,288.44,413.17,"/F8",9.96,"ac faucibus lacus. Posuere risus. Quisque massa arcu in-"
37.61,392.37,288.45,401.21,"/F8",9.96,"ceptos at. Natoque morbi metus non duis quam vivamus."
37.61,380.41,288.43,389.26,"/F8",9.96,"Quisque dolor. Viverra lorem. Viverra netus. Aliquam"
37.61,368.46,148.42,377.30,"/F8",9.96,"lorem egestas penatibus."
159.09,368.46,288.45,377.30,"/F8",9.96,"Aliquet morbi donec montes"
37.61,356.50,288.40,365.35,"/F8",9.96,"tempus viverra penatibus mattis vel iaculis inceptos. So-"
37.61,344.55,288.41,353.39,"/F8",9.96,"dales vitae donec diam ultrices neque purus vel orci enim."
37.61,332.59,288.44,341.44,"/F8",9.96,"Viverra ipsum feugiat sit litora egestas. Euismod dolor"
37.61,320.64,288.41,329.48,"/F8",9.96,"odio. Laoreet donec duis netus feugiat eni sagittis facilisis"
37.61,308.68,288.40,317.53,"/F8",9.96,"platea. Blandit neque arcu scelerisque blandit est mi luc-"
37.61,296.73,288.42,305.57,"/F8",9.96,"tus proin. Iaculis proin in dictumst. Dapibus massa nunc"
37.61,284.77,288.48,293.62,"/F8",9.96,"massa proin auctor massa. Laoreet neque nec consequat"
37.61,272.82,288.41,281.66,"/F8",9.96,"cursus. Lacinia justo sit ante sem per nam ve pellentesque."
37.61,260.86,242.86,269.71,"/F8",9.96,"Conubia lacus quam eleifend aptent adipiscing."
52.56,248.91,288.44,257.75,"/F8",9.96,"Blandit neque nisl morbi lacus orci netus. Egestas au-"
37.61,236.95,288.42,245.80,"/F8",9.96,"gue orci nec etiam nec gravida ve et curabitur parturient"
37.61,225.00,288.42,233.84,"/F8",9.96,"diam varius. Euismod nulla ipsum lectus porta nec. Feu-"
37.61,213.04,288.49,221.89,"/F8",9.96,"giat magna. Blandit massa. Lacinia netus. Nonummy"
37.61,201.09,288.45,209.93,"/F8",9.96,"donec. Sodales class hac fames. Laoreet velit. Blandit"
37.61,189.13,288.38,197.98,"/F8",9.96,"risus enim ut elit habitant per feugiat. Aliquam velit nisl"
37.61,177.17,288.45,186.02,"/F8",9.96,"tempor litora arcu. Integer massa metus hac curae litora"
37.61,165.22,288.43,174.07,"/F8",9.96,"class. Natoque ipsum vestibulum pede etiam in pellen-"
37.61,153.26,288.47,162.11,"/F8",9.96,"tesque arcu nonummy consequat. Rhoncus magna netus"
37.61,141.31,288.46,150.16,"/F8",9.96,"mattis magna mus nunc in. Conubia donec id phasellus"
37.61,129.35,288.42,138.20,"/F8",9.96,"augue ve tempus faucibus. Aliquet metus duis lacinia ut"
37.61,117.40,288.41,126.25,"/F8",9.96,"convallis. Blandit dolor cum nisl bibendum felis porta."
37.61,105.44,288.43,114.29,"/F8",9.96,"Posuere massa orci ultrices mi. Integer proin massa velit"
37.61,93.49,288.42,102.34,"/F8",9.96,"fames ligula tristique. Viverra justo eros morbi. Vivamus"
37.61,81.53,267.79,90.38,"/F8",9.96,"velit class donec lorem nisl venenatis. Feugiat fames."
306.60,461.11,475.32,469.96,"/F27",9.96,"1.1. Nonummy massa ut aptent ad ac."
321.55,446.17,557.40,455.01,"/F8",9.96,"Integer velit. Aliquet fusce. Dapibus risus ut amet. Ia-"
306.60,434.21,557.39,443.06,"/F8",9.96,"culis class. Vivamus lacus ad facilisi justo. Blandit proin."
306.60,422.26,557.47,431.10,"/F8",9.96,"Posuere magna nam ante augue risus natoque dui vene-"
306.60,410.30,557.44,419.15,"/F8",9.96,"natis nulla. Integer lacus odio rhoncus lorem eros. Po-"
306.60,398.35,557.41,407.19,"/F8",9.96,"tenti proin. Euismod dolor fames placerat at scelerisque"
306.60,386.39,557.43,395.24,"/F8",9.96,"quis urna nonummy. Euismod dolor curae varius. Egestas"
306.60,374.43,557.49,383.28,"/F8",9.96,"magna ac montes nec ut. Laoreet magna metus rutrum"
306.60,362.48,557.40,371.33,"/F8",9.96,"imperdiet ve ac. Blandit nulla ut dignissim id fermen-"
306.60,350.52,557.41,359.37,"/F8",9.96,"tum. Aliquet risus. Lacinia lorem. Egestas lacus neque."
306.60,338.57,557.42,347.42,"/F8",9.96,"Pretium massa nam diam leo netus imperdiet torquent eu."
306.60,326.61,557.44,335.46,"/F8",9.96,"Lacinia massa blandit. Laoreet etiam metus primis euis-"
306.60,314.66,557.44,323.51,"/F8",9.96,"mod nibh auctor. Iaculis nulla mus eget duis porta et ad"
306.60,302.70,417.82,311.55,"/F8",9.96,"mi. Aliquet morbi ipsum."
321.55,290.75,557.44,299.60,"/F8",9.96,"Quisque risus est dis nam. Euismod lacus. Laoreet ne-"
306.60,278.79,557.41,287.64,"/F8",9.96,"tus ve fames. Posuere velit nunc natoque arcu nisl nibh"
306.60,266.84,566.68,275.69,"/F8",9.96,"nunc odio blandit ut. Laoreet justo id sociis risus et habitasse"
306.60,254.88,557.45,263.73,"/F8",9.96,"ad. Rhoncus dolor nec primis nascetur. Euismod pu-"
306.60,242.93,557.45,251.77,"/F8",9.96,"rus viverra. Integer etiam. Commodo nulla ante amet"
306.60,230.97,557.38,239.82,"/F8",9.96,"tristique. Blandit velit arcu ornare placerat ullamcorper"
306.60,219.02,557.43,227.86,"/F8",9.96,"maecenas quisque. Natoque purus sodales iaculis nullam"
306.60,207.06,557.42,215.91,"/F8",9.96,"sed nec sollicitudin fusce at aenean. Integer proin porta"
306.60,195.11,557.39,203.95,"/F8",9.96,"interdum ve. Integer felis lacus luctus eu. Feugiat risus"
306.60,183.15,557.42,192.00,"/F8",9.96,"ve imperdiet massa urna litora fermentum lorem quisque"
306.60,171.20,375.09,180.04,"/F8",9.96,"nunc quam ad."
385.17,171.20,491.30,180.04,"/F8",9.96,"Viverra velit commodo."
501.38,171.20,557.47,180.04,"/F8",9.96,"Aliquam au-"
306.60,159.24,557.42,168.09,"/F8",9.96,"gue laoreet faucibus litora. Lacinia risus nunc. Gravida"
306.60,147.29,557.41,156.13,"/F8",9.96,"porta. Viverra felis porta. Blandit donec et augue id neque"
306.60,135.33,557.38,144.18,"/F8",9.96,"fringilla erat. Dapibus lacus purus lectus ligula phasellus"
306.60,123.38,557.42,132.22,"/F8",9.96,"netus integer massa etiam. Cubilia class nulla condimen-"
306.60,111.42,327.06,120.27,"/F8",9.96,"tum."
37.61,61.74,149.76,68.82,"/F20",7.97,"Preprint submitted to Elsevier"
490.43,61.74,557.59,68.82,"/F20",7.97,"November 8, 2015"
