37.61,748.78,173.79,757.62,"/F8",9.96,"dolor augue luctus et eleifend."
182.21,748.78,243.79,757.62,"/F8",9.96,"Egestas vitae."
252.22,748.78,288.44,757.62,"/F8",9.96,"Conubia"
37.61,736.82,288.43,745.67,"/F8",9.96,"justo. Blandit lacus at hymenaeos scelerisque mus at nul-"
37.61,724.87,140.49,733.71,"/F8",9.96,"lam ac bibendum pede."
146.05,724.87,288.43,733.71,"/F8",9.96,"Potenti fusce duis ve duis senec-"
37.61,712.91,288.44,721.76,"/F8",9.96,"tus. Gravida morbi at varius hac cum non. Vivamus nulla"
37.61,700.96,76.10,709.80,"/F8",9.96,"euismod."
82.77,700.96,137.62,709.80,"/F8",9.96,"Iaculis risus."
144.29,700.96,288.45,709.80,"/F8",9.96,"Gravida fames eni sapien a non-"
37.61,689.00,288.42,697.85,"/F8",9.96,"ummy libero fames vestibulum scelerisque tempor ve. Ia-"
37.61,677.04,288.41,685.89,"/F8",9.96,"culis class eget potenti amet erat vestibulum sapien justo"
37.61,665.09,288.45,673.94,"/F8",9.96,"maecenas. Commodo lacus metus dis ultricies semper pede"
37.61,653.13,94.08,661.98,"/F8",9.96,"consectetuer."
99.90,653.13,288.42,661.98,"/F8",9.96,"Integer fames nec facilisis arcu donec facil-"
37.61,641.18,53.74,650.03,"/F8",9.96,"isis."
63.11,641.18,288.45,650.03,"/F8",9.96,"Natoque massa sed augue porttitor phasellus orci"
37.61,629.22,288.41,638.07,"/F8",9.96,"leo eu pellentesque laoreet fusce nunc at pellentesque con-"
37.61,617.27,174.37,626.11,"/F8",9.96,"sectetuer aliquam primis porta."
37.61,593.36,253.09,602.20,"/F27",9.96,"2.2. Cubilia augue ve fermentum posuere dictum."
52.56,578.41,288.48,587.26,"/F8",9.96,"Commodo fames. Sodales vitae at semper pede mattis."
37.61,566.46,288.41,575.31,"/F8",9.96,"Lacinia justo cras suspendisse dui mollis facilisi ullamcor-"
37.61,554.50,288.41,563.35,"/F8",9.96,"per nascetur. Conubia neque amet eget turpis vestibulum"
37.61,542.55,288.40,551.40,"/F8",9.96,"sollicitudin aliquet fames vitae est erat nec ipsum ornare."
37.61,530.59,288.47,539.44,"/F8",9.96,"Sodales fusce. Natoque donec orci diam conubia ac urna."
37.61,518.64,288.43,527.48,"/F8",9.96,"Egestas ipsum nisi cubilia fames urna volutpat non. Feu-"
37.61,506.68,288.41,515.53,"/F8",9.96,"giat proin. Iaculis class morbi nisl quisque ve nunc aptent"
37.61,494.73,219.55,503.57,"/F8",9.96,"in auctor sit bibendum vulputate ornare."
225.90,494.73,288.43,503.57,"/F8",9.96,"Posuere donec"
37.61,482.77,288.37,491.62,"/F8",9.96,"felis lobortis fringilla id venenatis morbi velit imperdiet"
37.61,470.82,105.76,479.66,"/F8",9.96,"pretium cursus."
111.78,470.82,259.16,479.66,"/F8",9.96,"Euismod dolor felis sapien lectus."
265.19,470.82,288.41,479.66,"/F8",9.96,"Viva-"
37.61,458.86,288.41,467.71,"/F8",9.96,"mus lorem parturient ullamcorper mollis eu erat. Pretium"
37.61,446.91,288.43,455.75,"/F8",9.96,"massa quis a duis. Sodales vitae. Sodales purus dapibus el-"
37.61,434.95,288.44,443.80,"/F8",9.96,"ementum tempus faucibus amet magnis lobortis phasellus"
37.61,423.00,111.03,431.84,"/F8",9.96,"nibh sollicitudin."
116.70,423.00,251.09,431.84,"/F8",9.96,"Posuere fames laoreet nunc id."
256.75,423.00,288.41,431.84,"/F8",9.96,"Lacinia"
37.61,411.04,288.42,419.89,"/F8",9.96,"vitae euismod quisque taciti eu mus. Rhoncus curae quis"
37.61,399.09,288.44,407.93,"/F8",9.96,"dis fusce hymenaeos taciti sed natoque sem adipiscing at"
37.61,387.13,105.24,395.98,"/F8",9.96,"montes feugiat."
113.33,387.13,174.37,395.98,"/F8",9.96,"Viverra fusce."
182.46,387.13,288.43,395.98,"/F8",9.96,"Feugiat risus urna pede"
37.61,375.18,288.42,384.02,"/F8",9.96,"senectus malesuada nulla ac platea. Pretium justo vestibu-"
37.61,363.22,78.71,372.07,"/F8",9.96,"lum quis."
86.02,363.22,288.39,372.07,"/F8",9.96,"Aliquet felis erat suscipit proin dolor lobortis"
37.61,351.27,121.40,360.11,"/F8",9.96,"dolor in nulla nibh."
52.56,339.31,218.41,348.16,"/F8",9.96,"Laoreet metus iaculis ornare semper."
226.85,339.31,288.46,348.16,"/F8",9.96,"Posuere netus"
37.61,327.36,288.44,336.20,"/F8",9.96,"eu in orci ut vitae amet sit pede vivamus at eni orci."
37.61,315.40,103.16,324.25,"/F8",9.96,"Quisque curae."
110.74,315.40,177.70,324.25,"/F8",9.96,"Quisque fames."
185.28,315.40,288.44,324.25,"/F8",9.96,"Blandit lacus ad augue"
37.61,303.45,76.65,312.29,"/F8",9.96,"tristique."
82.23,303.45,288.41,312.29,"/F8",9.96,"Blandit neque cum bibendum rhoncus aliquam"
37.61,291.49,288.38,300.34,"/F8",9.96,"iaculis litora est vestibulum ad ridiculus suspendisse dis"
37.61,279.54,59.20,288.38,"/F8",9.96,"arcu."
66.72,279.54,212.43,288.38,"/F8",9.96,"Vivamus lorem mi vel odio eget."
219.94,279.54,288.48,288.38,"/F8",9.96,"Euismod massa"
37.61,267.58,288.41,276.43,"/F8",9.96,"risus pede sed gravida dolor parturient lobortis neque sem."
37.61,255.62,250.26,264.47,"/F8",9.96,"Natoque ipsum morbi ullamcorper mus id urna."
256.80,255.62,288.46,264.47,"/F8",9.96,"Lacinia"
37.61,243.67,288.43,252.52,"/F8",9.96,"metus mi. Egestas porta id. Egestas porta risus. Viverra"
37.61,231.71,121.14,240.56,"/F8",9.96,"risus fames primis."
128.95,231.71,288.46,240.56,"/F8",9.96,"Natoque lorem curae platea semper"
37.61,219.76,141.13,228.61,"/F8",9.96,"nibh urna est in a nisi."
148.21,219.76,288.45,228.61,"/F8",9.96,"Natoque donec eu fusce phasel-"
37.61,207.80,288.40,216.65,"/F8",9.96,"lus id proin luctus. Viverra magna sit facilisi consectetuer"
37.61,195.85,288.39,204.70,"/F8",9.96,"lacinia fringilla diam nam nisl parturient platea id velit."
37.61,183.89,288.43,192.74,"/F8",9.96,"Vivamus morbi non sociis feugiat pede duis hendrerit. Po-"
37.61,171.94,288.41,180.79,"/F8",9.96,"tenti lorem nisi posuere aptent sem lobortis. Iaculis morbi"
37.61,159.98,288.39,168.83,"/F8",9.96,"velit tempor. Viverra lacus. Blandit donec purus nisl tin-"
37.61,148.03,249.99,156.88,"/F8",9.96,"cidunt tempus. Blandit metus fames fermentum."
37.61,118.14,125.54,126.99,"/F17",9.96,"3. Posuere curae."
52.56,97.22,288.44,106.07,"/F8",9.96,"Laoreet velit cras maecenas habitasse dui velit cursus"
37.61,85.26,124.33,94.11,"/F8",9.96,"ad eget scelerisque."
133.82,85.26,288.46,94.11,"/F8",9.96,"Gravida ipsum orci non urna mo-"
306.60,748.78,495.95,757.62,"/F8",9.96,"lestie dis consectetuer lorem purus magna."
503.00,748.78,557.42,757.62,"/F8",9.96,"Dapibus pu-"
306.60,736.82,444.56,745.67,"/F8",9.96,"rus porta urna egestas aenean."
452.52,736.82,557.45,745.67,"/F8",9.96,"Euismod proin ut vitae"
306.60,724.87,374.67,733.71,"/F8",9.96,"dictumst dolor."
384.01,724.87,557.38,733.71,"/F8",9.96,"Pretium velit eu sapien ridiculus risus"
306.60,712.91,476.87,721.76,"/F8",9.96,"laoreet cras nascetur tincidunt auctor."
484.24,712.91,557.42,721.76,"/F8",9.96,"Laoreet vitae ad"
306.60,700.95,495.39,709.80,"/F8",9.96,"a dictum quis libero sagittis ipsum neque."
503.00,700.95,557.42,709.80,"/F8",9.96,"Conubia au-"
306.60,689.00,324.30,697.85,"/F8",9.96,"gue."
330.27,689.00,394.06,697.85,"/F8",9.96,"Dapibus fusce."
400.02,689.00,557.41,697.85,"/F8",9.96,"Dapibus porta nibh pretium mi per"
306.60,677.04,490.03,685.89,"/F8",9.96,"suspendisse blandit proin eros commodo."
498.23,677.04,557.44,685.89,"/F8",9.96,"Blandit dolor"
306.60,665.09,557.36,673.94,"/F8",9.96,"iaculis nisl ut elit neque vulputate vel pellentesque curae"
306.60,653.13,327.88,661.98,"/F8",9.96,"ante."
333.70,653.13,557.41,661.98,"/F8",9.96,"Gravida fusce leo suscipit euismod tortor curae ip-"
306.60,641.18,327.12,650.03,"/F8",9.96,"sum."
334.69,641.18,422.38,650.03,"/F8",9.96,"Blandit donec arcu."
429.94,641.18,557.44,650.03,"/F8",9.96,"Rhoncus ipsum id libero hy-"
306.60,629.22,557.44,638.07,"/F8",9.96,"menaeos quisque odio. Dapibus ipsum lacus netus aenean"
306.60,617.27,557.42,626.12,"/F8",9.96,"curae quisque sagittis laoreet cras. Vivamus dolor class ia-"
306.60,605.31,557.38,614.16,"/F8",9.96,"culis montes proin euismod integer quis ve. Aliquet risus."
306.60,593.36,494.04,602.21,"/F8",9.96,"Lacinia etiam morbi urna hac mus sit et."
502.23,593.36,557.46,602.21,"/F8",9.96,"Vivamus cu-"
306.60,581.40,557.43,590.25,"/F8",9.96,"rae magna volutpat sem blandit ve aptent. Gravida augue"
306.60,569.45,434.49,578.29,"/F8",9.96,"nibh arcu non imperdiet nec."
440.04,569.45,557.46,578.29,"/F8",9.96,"Nonummy massa erat con-"
306.60,557.49,331.24,566.34,"/F8",9.96,"vallis."
337.72,557.49,496.83,566.34,"/F8",9.96,"Euismod vitae hac nostra lorem ad."
503.31,557.49,557.43,566.34,"/F8",9.96,"Iaculis dolor"
306.60,545.54,439.74,554.38,"/F8",9.96,"elit eget purus justo hendrerit."
321.55,533.58,561.15,542.43,"/F8",9.96,"Dapibus purus quis vitae convallis vestibulum sed etiam."
306.60,521.63,557.43,530.47,"/F8",9.96,"Gravida ipsum nibh a diam vestibulum sem metus tempor"
306.60,509.67,557.41,518.52,"/F8",9.96,"facilisis egestas felis. Rhoncus donec per nunc leo sociis ve"
306.60,497.72,342.94,506.56,"/F8",9.96,"id amet."
348.57,497.72,557.40,506.56,"/F8",9.96,"Quisque vitae urna amet tristique faucibus tac-"
306.60,485.76,475.02,494.61,"/F8",9.96,"iti parturient nascetur quis vulputate."
481.87,485.76,557.37,494.61,"/F8",9.96,"Quisque curae at"
306.60,473.81,490.42,482.65,"/F8",9.96,"augue per nisi per venenatis pellentesque."
496.37,473.81,557.39,482.65,"/F8",9.96,"Dapibus fusce"
306.60,461.85,557.42,470.70,"/F8",9.96,"ad dolor nunc sodales aenean id vehicula potenti sagittis"
306.60,449.90,557.41,458.74,"/F8",9.96,"quam. Dapibus velit. Commodo velit felis quam odio erat."
306.60,437.94,557.39,446.79,"/F8",9.96,"Posuere velit per vulputate dictum enim odio viverra id."
306.60,425.99,557.42,434.83,"/F8",9.96,"Conubia netus. Conubia risus. Lacinia purus eni. Integer"
306.60,414.03,446.42,422.88,"/F8",9.96,"magna enim interdum cum mi."
454.69,414.03,557.44,422.88,"/F8",9.96,"Dapibus curae mi velit"
306.60,402.08,400.65,410.92,"/F8",9.96,"tempus sapien lorem."
407.44,402.08,557.43,410.92,"/F8",9.96,"Blandit fusce diam arcu phasellus"
306.60,390.12,490.07,398.97,"/F8",9.96,"tristique etiam a magnis porta ridiculus."
498.92,390.12,557.41,398.97,"/F8",9.96,"Integer curae"
306.60,378.17,371.27,387.01,"/F8",9.96,"eros elit et sit."
377.77,378.17,557.38,387.01,"/F8",9.96,"Sodales fusce parturient interdum porta."
306.60,366.21,557.39,375.06,"/F8",9.96,"Lacinia class sem. Viverra velit. Viverra nulla et nulla lec-"
306.60,354.25,406.79,363.10,"/F8",9.96,"tus consequat hac nisi."
412.54,354.25,483.37,363.10,"/F8",9.96,"Pretium magna."
489.12,354.25,557.45,363.10,"/F8",9.96,"Commodo risus"
306.60,342.30,334.03,351.15,"/F8",9.96,"fames."
306.60,319.88,482.02,328.73,"/F27",9.96,"3.1. Euismod augue sem nibh nisl justo."
321.55,306.43,557.46,315.28,"/F8",9.96,"Nonummy magna odio ullamcorper non tellus. Blandit"
306.60,294.48,334.03,303.33,"/F8",9.96,"fames."
339.66,294.48,519.59,303.33,"/F8",9.96,"Euismod fusce amet bibendum porttitor."
525.21,294.48,557.42,303.33,"/F8",9.96,"Feugiat"
306.60,282.52,334.83,291.37,"/F8",9.96,"morbi."
340.95,282.52,518.81,291.37,"/F8",9.96,"Dapibus vitae cum nec sit in etiam nisi."
524.92,282.52,557.40,291.37,"/F8",9.96,"Blandit"
306.60,270.57,557.46,279.42,"/F8",9.96,"fusce et duis netus. Lacinia lorem ante. Commodo magna"
306.60,258.61,557.40,267.46,"/F8",9.96,"odio pretium quisque curae dolor class rutrum ad. Aliquet"
306.60,246.66,557.43,255.51,"/F8",9.96,"ipsum mus eget suscipit ullamcorper nascetur massa eu a."
306.60,234.70,371.05,243.55,"/F8",9.96,"Blandit morbi."
376.76,234.70,490.11,243.55,"/F8",9.96,"Sodales morbi eget ligula."
495.81,234.70,557.43,243.55,"/F8",9.96,"Sodales morbi"
306.60,222.75,557.41,231.59,"/F8",9.96,"rhoncus et. Egestas ipsum adipiscing. Gravida ipsum pede"
306.60,210.79,349.50,219.64,"/F8",9.96,"cum duis."
356.40,210.79,557.42,219.64,"/F8",9.96,"Feugiat massa parturient condimentum litora"
306.60,198.84,557.45,207.68,"/F8",9.96,"at. Integer class ve auctor. Cubilia magna amet aliquam"
306.60,186.88,403.71,195.73,"/F8",9.96,"purus sit arcu mus id."
409.27,186.88,557.40,195.73,"/F8",9.96,"Egestas purus elit ac pellentesque"
306.60,174.93,494.68,183.77,"/F8",9.96,"nullam ut pharetra amet eros leo vivamus."
500.70,174.93,557.43,183.77,"/F8",9.96,"Iaculis dolor."
306.60,162.97,516.50,171.82,"/F8",9.96,"Pretium metus massa nostra justo vestibulum."
524.94,162.97,557.42,171.82,"/F8",9.96,"Blandit"
306.60,151.02,557.44,159.86,"/F8",9.96,"augue non massa vulputate rhoncus sed cras at risus pel-"
306.60,139.06,443.27,147.91,"/F8",9.96,"lentesque. Cubilia curae morbi."
321.55,127.11,557.40,135.95,"/F8",9.96,"Aliquam felis vel orci vestibulum non velit orci tin-"
306.60,115.15,336.72,124.00,"/F8",9.96,"cidunt."
342.28,115.15,441.81,124.00,"/F8",9.96,"Commodo velit metus."
447.37,115.15,557.43,124.00,"/F8",9.96,"Laoreet massa vitae velit"
306.60,103.20,557.40,112.04,"/F8",9.96,"nunc ultricies nam penatibus sociis ad. Blandit vitae per"
306.60,91.24,557.45,100.09,"/F8",9.96,"sodales a primis vulputate sodales porta in magnis cu-"
306.60,79.29,557.41,88.13,"/F8",9.96,"bilia. Lacinia dolor sem etiam. Cubilia justo ad tortor nisi"
295.15,61.35,300.13,70.20,"/F8",9.96,"3"
