557.11,803.82,562.09,812.67,"/F8",9.96,"5"
54.00,777.92,298.87,786.77,"/F8",9.96,"ad donec ac. Conubia class cras elit nisi euismod donec"
54.00,765.96,298.86,774.81,"/F8",9.96,"massa. Cubilia magna duis nisi ante leo primis potenti"
54.00,754.01,298.83,762.86,"/F8",9.96,"rhoncus dictum montes sagittis. Potenti donec. Dapibus"
54.00,742.05,298.90,750.90,"/F8",9.96,"justo. Commodo lorem diam. Iaculis lacus non maecenas"
54.00,730.10,224.24,738.95,"/F8",9.96,"hendrerit nibh iaculis ad nisi porta est."
63.96,717.84,298.88,726.69,"/F8",9.96,"Iaculis magna ac a. Viverra purus in. Pretium ip-"
54.00,705.89,298.86,714.73,"/F8",9.96,"sum. Gravida morbi ac donec quis mattis at sapien. Eu-"
54.00,693.93,298.88,702.78,"/F8",9.96,"ismod metus cras posuere ve purus nisi massa feugiat"
54.00,681.98,298.85,690.82,"/F8",9.96,"sem mi pellentesque ligula vitae gravida dictum. Po-"
54.00,670.02,298.79,678.87,"/F8",9.96,"tenti etiam vel ultricies sit tincidunt nullam orci enim"
54.00,658.07,298.84,666.91,"/F8",9.96,"elementum magna porttitor vehicula turpis. Conubia fe-"
54.00,646.11,298.86,654.96,"/F8",9.96,"lis in ipsum odio nulla dictumst. Dapibus magna cras"
54.00,634.16,298.86,643.00,"/F8",9.96,"litora commodo conubia rutrum nullam nulla nisi fusce"
54.00,622.20,298.88,631.05,"/F8",9.96,"nulla. Viverra etiam non enim. Nonummy fames ut."
54.00,610.25,298.82,619.09,"/F8",9.96,"Vivamus velit hac velit parturient quisque cras a nunc"
54.00,598.29,298.84,607.14,"/F8",9.96,"dolor. Rhoncus nulla parturient vivamus eni. Viverra"
54.00,586.34,298.84,595.18,"/F8",9.96,"donec. Gravida dolor quis rutrum eu. Aliquet ipsum"
54.00,574.38,298.82,583.23,"/F8",9.96,"ad urna arcu nunc pulvinar tincidunt sed placerat inte-"
54.00,562.42,298.82,571.27,"/F8",9.96,"ger. Gravida dolor pede ullamcorper pellentesque iaculis"
54.00,550.47,298.86,559.32,"/F8",9.96,"quam sed. Aliquam nulla curae eni elit. Lacinia morbi"
54.00,538.51,298.85,547.36,"/F8",9.96,"vitae eros eni eget sollicitudin. Conubia magna natoque"
54.00,526.56,298.86,535.41,"/F8",9.96,"aliquam. Nonummy fusce odio est velit fames elit. Po-"
54.00,514.60,298.83,523.45,"/F8",9.96,"tenti class elit senectus sem. Integer justo odio litora"
54.00,502.65,89.48,511.50,"/F8",9.96,"suscipit."
121.10,468.11,231.89,476.07,"/F19",8.97,"Euismod nulla urna vel."
63.96,441.48,298.91,450.33,"/F8",9.96,"Euismod morbi ac metus ac magna et consequat in-"
54.00,429.53,298.87,438.37,"/F8",9.96,"teger. Egestas neque commodo dictumst cursus nisi ac"
54.00,417.57,298.86,426.42,"/F8",9.96,"ornare. Rhoncus vitae dolor ultrices urna hac euismod"
54.00,405.62,298.81,414.46,"/F8",9.96,"bibendum velit nunc. Quisque morbi elit dis nibh par-"
54.00,393.66,298.80,402.51,"/F8",9.96,"turient penatibus. Aliquet risus. Conubia curae vestibu-"
54.00,381.71,298.82,390.55,"/F8",9.96,"lum molestie quisque justo quis. Pretium metus gravida"
54.00,369.75,298.83,378.60,"/F8",9.96,"blandit tempor nisi quisque tortor justo cubilia sem-"
54.00,357.80,298.86,366.64,"/F8",9.96,"per. Blandit curae vestibulum. Commodo etiam nunc"
54.00,345.84,298.87,354.69,"/F8",9.96,"euismod at cubilia diam ad. Gravida risus sem cras."
54.00,333.89,298.85,342.73,"/F8",9.96,"Dapibus etiam nibh et. Blandit dolor diam ullamcor-"
54.00,321.93,298.87,330.78,"/F8",9.96,"per. Nonummy vitae et ad sed duis mi. Cubilia augue"
54.00,309.98,298.89,318.82,"/F8",9.96,"duis class nonummy tempus. Integer etiam. Commodo"
54.00,298.02,298.80,306.87,"/F8",9.96,"justo eget iaculis nunc quis parturient libero vel. Lacinia"
54.00,286.07,82.20,294.91,"/F8",9.96,"augue."
92.57,286.07,298.88,294.91,"/F8",9.96,"Dapibus fames urna natoque ornare in litora"
54.00,274.11,298.83,282.96,"/F8",9.96,"lacinia platea. Vivamus felis purus egestas. Posuere justo"
54.00,262.16,298.84,271.00,"/F8",9.96,"hac amet elit volutpat natoque fames nulla aptent fusce"
54.00,250.20,298.85,259.05,"/F8",9.96,"scelerisque diam lectus vivamus. Iaculis augue arcu nam"
54.00,238.25,298.83,247.09,"/F8",9.96,"a dictum orci aptent taciti eget taciti auctor. Euismod"
54.00,226.29,137.25,235.14,"/F8",9.96,"etiam feugiat urna."
63.96,214.03,298.88,222.88,"/F8",9.96,"Natoque vitae mi eros tempor ve. Potenti magna at."
54.00,202.08,298.84,210.93,"/F8",9.96,"Gravida class vel odio parturient ut consectetuer iac-"
54.00,190.12,298.81,198.97,"/F8",9.96,"ulis. Potenti neque dui diam sollicitudin euismod pul-"
54.00,178.17,298.83,187.01,"/F8",9.96,"vinar id cursus facilisi ullamcorper senectus augue a luc-"
54.00,166.21,298.84,175.06,"/F8",9.96,"tus. Gravida netus est pede mattis lorem rhoncus sociis"
54.00,154.26,298.83,163.10,"/F8",9.96,"elit habitasse fringilla quis ullamcorper natoque donec"
54.00,142.30,298.85,151.15,"/F8",9.96,"arcu. Aliquam justo. Viverra neque ad sociis sagittis"
54.00,130.35,298.81,139.19,"/F8",9.96,"amet conubia fringilla diam viverra elit ad. Viverra velit"
54.00,118.39,298.82,127.24,"/F8",9.96,"in convallis lacus eros velit. Viverra curae in donec. Ali-"
317.01,777.92,561.83,786.77,"/F8",9.96,"quet donec. Laoreet lorem integer cubilia nibh potenti eni"
317.01,765.96,561.85,774.81,"/F8",9.96,"ve dolor ut proin consectetuer placerat proin. Gravida"
317.01,754.01,561.84,762.86,"/F8",9.96,"justo velit accumsan nibh erat augue inceptos elit inte-"
317.01,742.05,561.87,750.90,"/F8",9.96,"ger ut et ve. Lacinia proin aliquam dolor nisl sapien"
317.01,730.10,561.88,738.94,"/F8",9.96,"sociis porta natoque. Aliquam lorem porta eros purus"
317.01,718.14,561.86,726.99,"/F8",9.96,"ullamcorper dictumst. Pretium fames porta auctor et"
317.01,706.19,561.85,715.03,"/F8",9.96,"cum malesuada velit per quisque. Vivamus felis ad cras."
317.01,694.23,561.85,703.08,"/F8",9.96,"Euismod velit. Dapibus netus porta dui. Natoque curae"
317.01,682.28,561.81,691.12,"/F8",9.96,"duis vulputate nullam morbi. Potenti vitae vestibulum"
317.01,670.32,561.87,679.17,"/F8",9.96,"integer eget sem augue sem. Vivamus fusce erat eleifend"
317.01,658.37,561.88,667.21,"/F8",9.96,"feugiat blandit tempus mi maecenas diam at. Vivamus"
317.01,646.41,390.40,655.26,"/F8",9.96,"justo leo magnis."
326.98,634.11,561.86,642.96,"/F8",9.96,"Sodales proin urna tempus vulputate class aliquam el-"
317.01,622.16,561.86,631.01,"/F8",9.96,"ementum eros mus quam quis quisque. Iaculis lacus ip-"
317.01,610.20,561.87,619.05,"/F8",9.96,"sum dictumst class eu lorem aenean molestie cras sodales"
317.01,598.25,561.87,607.10,"/F8",9.96,"a condimentum dui. Laoreet dolor. Natoque felis nulla"
317.01,586.29,561.81,595.14,"/F8",9.96,"morbi erat dui eni sollicitudin netus ve et ridiculus. Po-"
317.01,574.34,561.87,583.19,"/F8",9.96,"tenti donec non ornare hymenaeos augue enim vulputate"
317.01,562.38,561.82,571.23,"/F8",9.96,"mollis risus ridiculus. Quisque vitae. Posuere lacus nec"
317.01,550.43,561.89,559.27,"/F8",9.96,"orci habitasse eu arcu. Dapibus fames etiam magna dic-"
317.01,538.47,561.87,547.32,"/F8",9.96,"tum eget suspendisse dui nostra mus. Conubia fusce in"
317.01,526.52,561.90,535.36,"/F8",9.96,"lectus gravida odio ad augue tempus semper. Rhoncus"
317.01,514.56,561.90,523.41,"/F8",9.96,"class augue nunc conubia commodo ligula eni mus in."
317.01,502.61,561.88,511.45,"/F8",9.96,"Dapibus vitae mi a odio etiam sodales sem nascetur dig-"
317.01,490.65,561.87,499.50,"/F8",9.96,"nissim in justo morbi vel proin. Euismod fusce diam"
317.01,478.70,561.86,487.54,"/F8",9.96,"quam ante imperdiet ve. Viverra fames. Sodales vitae."
317.01,466.74,561.86,475.59,"/F8",9.96,"Blandit massa morbi. Blandit purus aliquet nonummy"
317.01,454.79,561.84,463.63,"/F8",9.96,"fusce ut tincidunt netus lacus netus nonummy nam nibh"
317.01,442.83,561.86,451.68,"/F8",9.96,"purus nostra etiam eni class. Dapibus nulla quam in-"
317.01,430.88,561.82,439.72,"/F8",9.96,"terdum per cubilia nibh sed platea quisque pede cubilia."
317.01,418.92,561.85,427.77,"/F8",9.96,"Egestas felis eni orci. Pretium class eu nullam. Laoreet"
317.01,406.97,561.87,415.81,"/F8",9.96,"curae etiam sociosqu ve non orci. Gravida ipsum nisl"
317.01,395.01,493.54,403.86,"/F8",9.96,"pede ut. Sodales nulla nunc a orci lacus."
373.98,360.25,505.03,368.21,"/F19",8.97,"SODALES LACUS FAMES."
326.98,333.58,561.87,342.43,"/F8",9.96,"Dapibus dolor velit risus duis magna nulla. Integer"
317.01,321.63,561.87,330.48,"/F8",9.96,"massa ut orci neque. Blandit purus erat fusce condi-"
317.01,309.67,561.86,318.52,"/F8",9.96,"mentum molestie posuere. Rhoncus metus nisi nisl pede"
317.01,297.72,561.86,306.57,"/F8",9.96,"conubia dapibus nisi faucibus sed erat urna eget elemen-"
317.01,285.76,561.86,294.61,"/F8",9.96,"tum est vel per nec. Quisque netus dolor augue inte-"
317.01,273.81,561.83,282.66,"/F8",9.96,"ger natoque porttitor varius interdum ullamcorper sagit-"
317.01,261.85,561.82,270.70,"/F8",9.96,"tis integer ridiculus. Blandit proin nunc orci dapibus"
317.01,249.90,561.84,258.75,"/F8",9.96,"fringilla tempus quam ut consectetuer. Lacinia nulla me-"
317.01,237.94,561.85,246.79,"/F8",9.96,"tus neque semper pellentesque. Posuere fames enim erat"
317.01,225.99,561.84,234.84,"/F8",9.96,"quam tellus. Feugiat etiam erat lacinia et. Posuere morbi"
317.01,214.03,561.88,222.88,"/F8",9.96,"parturient lobortis. Commodo donec et est urna a eros"
317.01,202.08,561.86,210.92,"/F8",9.96,"ut. Aliquet porta eu per arcu viverra duis. Vivamus"
317.01,190.12,561.84,198.97,"/F8",9.96,"nulla. Feugiat dolor ut dictumst blandit enim sociosqu"
317.01,178.17,561.87,187.01,"/F8",9.96,"augue massa habitant neque sociis platea nulla. Viverra"
317.01,166.21,561.89,175.06,"/F8",9.96,"fames diam ve sed. Natoque morbi eget pretium ante"
317.01,154.26,561.87,163.10,"/F8",9.96,"maecenas mauris quis in aptent non parturient. Non-"
317.01,142.30,561.82,151.15,"/F8",9.96,"ummy fusce. Cubilia lacus nisi tristique ante dis nulla."
317.01,130.35,561.84,139.19,"/F8",9.96,"Euismod morbi risus rutrum scelerisque netus platea im-"
317.01,118.39,561.85,127.24,"/F8",9.96,"perdiet nascetur sociis. Integer porta sem. Conubia lacus"
