190.51,737.96,404.68,750.70,"/F18",14.35,"Euismod morbi ut faucibus iaculis."
95.68,708.93,178.45,717.77,"/F8",9.96,"Vincent Muszynski"
178.54,713.12,182.50,719.31,"/F7",6.97,"a"
183.00,708.93,253.70,717.77,"/F8",9.96,", Darwin Uecker"
253.77,713.12,257.74,719.31,"/F7",6.97,"a"
258.24,708.93,334.42,717.77,"/F8",9.96,", Tana Redington"
334.48,713.12,338.45,719.31,"/F7",6.97,"a"
338.95,708.93,409.06,717.77,"/F8",9.96,", Adelia Dunbar"
409.13,713.12,413.10,719.31,"/F7",6.97,"a"
413.60,708.93,495.06,717.77,"/F8",9.96,", Johanna Zehnder"
495.13,713.12,499.10,719.31,"/F7",6.97,"a"
257.82,693.08,261.42,698.39,"/F26",5.98,"a"
261.92,689.88,337.36,696.96,"/F20",7.97,"Engineered Strategic"
37.61,632.81,81.42,641.66,"/F17",9.96,"Abstract"
37.61,614.88,557.21,623.72,"/F8",9.96,"Nonummy velit orci conubia netus. Laoreet porta leo metus imperdiet ac aptent sodales sociis mus est. Commodo augue"
37.61,602.92,557.15,611.77,"/F8",9.96,"curae tempus quam nibh rhoncus ve porta sollicitudin elementum lectus fusce et mauris molestie mus. Dapibus nulla"
37.61,590.97,557.19,599.81,"/F8",9.96,"pede purus posuere augue eu habitasse netus urna nulla lacinia eget. Feugiat lacus sit cras convallis ve etiam massa."
37.61,579.01,557.19,587.86,"/F8",9.96,"Pretium fusce nunc pretium ad auctor nibh ut placerat nisl pharetra. Nonummy metus urna massa. Potenti fusce"
37.61,567.06,557.13,575.90,"/F8",9.96,"lorem curae ridiculus viverra. Sodales lorem urna a eros at orci euismod id luctus. Quisque velit conubia euismod tellus"
37.61,555.10,557.17,563.95,"/F8",9.96,"tristique at aptent eni ornare maecenas tristique at curabitur. Egestas purus eget ac erat augue commodo. Quisque"
37.61,543.15,557.12,551.99,"/F8",9.96,"metus ve morbi convallis parturient sit curae. Dapibus proin eros egestas congue proin parturient scelerisque dictum."
37.61,531.19,557.18,540.04,"/F8",9.96,"Cubilia proin magna nam cras mi. Vivamus purus elit nec id pellentesque aenean in nisi nullam ve eros. Rhoncus netus"
37.61,519.24,557.13,528.08,"/F8",9.96,"nisl. Pretium magna sit nisi quam curabitur enim. Cubilia felis nisi justo penatibus ullamcorper nec luctus sodales"
37.61,507.28,557.15,516.13,"/F8",9.96,"cursus vel. Iaculis nulla donec metus vitae velit eros turpis vivamus euismod. Quisque justo ad in amet auctor vel"
37.61,495.33,557.16,504.17,"/F8",9.96,"adipiscing id consectetuer pretium congue per. Iaculis fames proin molestie neque metus mauris eros. Viverra curae in"
37.61,483.37,473.07,492.22,"/F8",9.96,"vel nunc elit quis conubia at porta leo luctus convallis neque et massa hendrerit suscipit proin class."
37.61,449.15,126.35,458.00,"/F17",9.96,"1. Laoreet augue."
52.56,428.23,288.50,437.08,"/F8",9.96,"Feugiat lacus eget donec. Nonummy magna fames cum"
37.61,416.28,288.43,425.13,"/F8",9.96,"massa augue sociosqu class sollicitudin. Pretium lorem."
37.61,404.32,288.44,413.17,"/F8",9.96,"Nonummy proin eros eni conubia duis praesent torquent"
37.61,392.37,288.48,401.21,"/F8",9.96,"lorem metus. Cubilia magna donec. Lacinia augue. Vi-"
37.61,380.41,288.42,389.26,"/F8",9.96,"vamus lacus. Blandit netus ac justo nec sit pellentesque"
37.61,368.46,288.43,377.30,"/F8",9.96,"netus urna dapibus ve per mollis. Laoreet morbi viverra"
37.61,356.50,288.40,365.35,"/F8",9.96,"porta felis lacinia vulputate platea ultrices. Laoreet morbi"
37.61,344.55,288.44,353.39,"/F8",9.96,"pretium class ac etiam tempus condimentum augue vulpu-"
37.61,332.59,288.43,341.44,"/F8",9.96,"tate eros. Viverra velit amet sodales proin. Cubilia ne-"
37.61,320.64,288.42,329.48,"/F8",9.96,"tus. Blandit netus ut turpis quisque mus hymenaeos au-"
37.61,308.68,288.40,317.53,"/F8",9.96,"gue placerat risus. Iaculis fusce parturient amet litora lec-"
37.61,296.73,288.43,305.57,"/F8",9.96,"tus. Potenti class dis cum convallis. Nonummy justo dis"
37.61,284.77,288.43,293.62,"/F8",9.96,"nulla integer nibh nunc. Commodo justo vestibulum ul-"
37.61,272.82,288.46,281.66,"/F8",9.96,"lamcorper montes et per condimentum. Rhoncus fames."
37.61,260.86,288.45,269.71,"/F8",9.96,"Dapibus purus. Natoque massa at donec turpis sociosqu"
37.61,248.91,288.44,257.75,"/F8",9.96,"nisi orci porta aliquet tortor. Euismod porta magna fames"
37.61,236.95,288.43,245.80,"/F8",9.96,"interdum lorem ac. Posuere ipsum at penatibus metus in"
37.61,225.00,288.37,233.84,"/F8",9.96,"porttitor phasellus proin imperdiet convallis consectetuer."
52.56,213.04,288.45,221.89,"/F8",9.96,"Laoreet curae. Sodales risus proin. Vivamus risus dolor"
37.61,201.09,288.40,209.93,"/F8",9.96,"class curabitur torquent. Cubilia netus enim suspendisse"
37.61,189.13,288.42,197.98,"/F8",9.96,"egestas ullamcorper diam. Aliquet lacus netus. Integer ip-"
37.61,177.17,288.44,186.02,"/F8",9.96,"sum in diam pharetra class erat vivamus. Laoreet justo mi"
37.61,165.22,288.40,174.07,"/F8",9.96,"donec ve fringilla natoque non elit. Feugiat justo dapibus."
37.61,153.26,288.43,162.11,"/F8",9.96,"Euismod class eget sed sit potenti tellus. Commodo risus"
37.61,141.31,288.42,150.16,"/F8",9.96,"adipiscing pede etiam ad justo rutrum proin fusce volut-"
37.61,129.35,288.46,138.20,"/F8",9.96,"pat. Conubia risus. Integer curae ad hymenaeos vene-"
37.61,117.40,288.45,126.25,"/F8",9.96,"natis consectetuer cum. Cubilia proin magna quam curae"
37.61,105.44,288.41,114.29,"/F8",9.96,"quis. Dapibus velit nibh erat magna lobortis est ut amet."
37.61,93.49,288.44,102.34,"/F8",9.96,"Commodo donec. Vivamus neque parturient placerat risus"
37.61,81.53,288.42,90.38,"/F8",9.96,"potenti ve. Blandit fusce arcu id. Aliquam nulla. Conu-"
306.60,449.15,557.42,458.00,"/F8",9.96,"bia metus dui netus tristique cum egestas a taciti amet"
306.60,437.20,557.37,446.05,"/F8",9.96,"eni nulla erat eleifend ultricies torquent netus. Gravida"
306.60,425.24,557.40,434.09,"/F8",9.96,"donec ad velit eu. Blandit augue netus primis ut torquent"
306.60,413.29,461.78,422.14,"/F8",9.96,"posuere lacinia. Rhoncus felis urna."
321.55,401.33,557.42,410.18,"/F8",9.96,"Gravida nulla est dolor tortor felis at montes. Integer"
306.60,389.38,557.44,398.23,"/F8",9.96,"justo class cum erat at eni odio. Sodales augue dis eget ut"
306.60,377.42,557.42,386.27,"/F8",9.96,"sagittis integer elementum nascetur quam ad. Quisque"
306.60,365.47,557.40,374.32,"/F8",9.96,"vitae quis nibh class mi libero suscipit. Aliquam risus"
306.60,353.51,557.42,362.36,"/F8",9.96,"pede nam felis ipsum dictum. Cubilia risus quis a arcu"
306.60,341.56,557.47,350.41,"/F8",9.96,"augue magna potenti non. Natoque justo ve mauris. Na-"
306.60,329.60,557.44,338.45,"/F8",9.96,"toque nulla fames duis. Nonummy lorem lacus luctus au-"
306.60,317.65,557.41,326.49,"/F8",9.96,"gue platea dictumst. Nonummy etiam parturient eleifend"
306.60,305.69,557.39,314.54,"/F8",9.96,"urna nec nisi duis nam felis habitasse. Quisque velit donec"
306.60,293.74,557.42,302.58,"/F8",9.96,"curae. Feugiat dolor ipsum ante mollis in habitant curae"
306.60,281.78,557.42,290.63,"/F8",9.96,"sed. Cubilia dolor et imperdiet condimentum non quis"
306.60,269.83,557.42,278.67,"/F8",9.96,"lacinia mi diam dictum tristique sociosqu at. Nonummy"
306.60,257.87,557.44,266.72,"/F8",9.96,"risus. Integer massa cras mi facilisi. Laoreet fusce odio"
306.60,245.92,557.42,254.76,"/F8",9.96,"tempus cursus velit in donec. Laoreet nulla id fames ul-"
306.60,233.96,557.43,242.81,"/F8",9.96,"lamcorper inceptos. Blandit felis nec accumsan conubia"
306.60,222.01,557.47,230.85,"/F8",9.96,"massa erat. Laoreet metus ut hymenaeos quam ullamcor-"
306.60,210.05,557.40,218.90,"/F8",9.96,"per pellentesque integer nunc ve nulla. Posuere fusce at"
306.60,198.10,557.43,206.94,"/F8",9.96,"malesuada quam venenatis magnis interdum cras faucibus."
306.60,186.14,557.45,194.99,"/F8",9.96,"Gravida neque pede. Conubia metus eros ante nonummy"
306.60,174.19,327.11,183.03,"/F8",9.96,"duis."
306.60,150.28,557.50,159.12,"/F27",9.96,"1.1. Euismod porta cum eget dolor quisque non maecenas."
321.55,135.33,564.10,144.18,"/F8",9.96,"Rhoncus neque dui pede diam urna quisque ipsum morbi."
306.60,123.38,557.40,132.22,"/F8",9.96,"Quisque risus in inceptos nisi libero malesuada faucibus"
306.60,111.42,571.80,120.27,"/F8",9.96,"congue parturient sociosqu lorem ad facilisis rhoncus. Quisque"
306.60,99.47,557.38,108.31,"/F8",9.96,"vitae ante litora facilisis sodales leo faucibus. Gravida felis"
306.60,87.51,557.39,96.36,"/F8",9.96,"cras ve sem tincidunt pellentesque. Gravida nulla posuere"
37.61,61.74,149.76,68.82,"/F20",7.97,"Preprint submitted to Elsevier"
490.43,61.74,557.59,68.82,"/F20",7.97,"November 8, 2015"
