37.61,748.78,288.44,757.62,"/F8",9.96,"ad odio curae blandit eros pharetra parturient. Egestas"
37.61,736.82,69.14,745.67,"/F8",9.96,"magna."
52.56,724.87,288.41,733.71,"/F8",9.96,"Posuere netus parturient natoque vel id pellentesque"
37.61,712.91,308.54,721.76,"/F8",9.96,"sollicitudin integer. Natoque massa fusce vehicula in scelerisque"
37.61,700.96,288.42,709.80,"/F8",9.96,"urna amet sed volutpat blandit euismod quis eget dignis-"
37.61,689.00,288.41,697.85,"/F8",9.96,"sim. Aliquam purus nam leo eu nisl nibh aliquet velit et"
37.61,677.04,288.40,685.89,"/F8",9.96,"lectus justo. Dapibus felis nibh eros fusce orci erat sodales"
37.61,665.09,288.40,673.94,"/F8",9.96,"justo et. Egestas morbi blandit litora risus dignissim adip-"
37.61,653.13,288.44,661.98,"/F8",9.96,"iscing non vitae posuere dolor enim. Vivamus dolor felis"
37.61,641.18,288.45,650.03,"/F8",9.96,"nam hac consectetuer ut. Cubilia risus justo cum. Po-"
37.61,629.22,288.43,638.07,"/F8",9.96,"tenti justo eget egestas venenatis semper. Aliquam porta"
37.61,617.27,288.50,626.11,"/F8",9.96,"urna curae natoque. Commodo class amet sem dis non-"
37.61,605.31,288.45,614.16,"/F8",9.96,"ummy nunc. Laoreet massa. Iaculis lacus adipiscing nunc"
37.61,593.36,288.38,602.20,"/F8",9.96,"tincidunt cursus imperdiet vitae accumsan velit. Cubilia"
37.61,581.40,288.43,590.25,"/F8",9.96,"nulla. Potenti ipsum eni inceptos egestas quisque massa"
37.61,569.45,288.40,578.29,"/F8",9.96,"netus nisi turpis adipiscing. Rhoncus risus nibh enim eget"
37.61,557.49,288.39,566.34,"/F8",9.96,"luctus dignissim pulvinar proin. Aliquet morbi. Feugiat"
37.61,545.54,288.42,554.38,"/F8",9.96,"justo sed enim vivamus quis turpis sed libero. Feugiat"
37.61,533.58,288.43,542.43,"/F8",9.96,"purus duis habitasse sit dapibus et pulvinar amet. Com-"
37.61,521.63,288.44,530.47,"/F8",9.96,"modo porta blandit primis porta proin ullamcorper odio"
37.61,509.67,288.43,518.52,"/F8",9.96,"porttitor mi. Vivamus morbi enim eros dolor curabitur"
37.61,497.72,288.46,506.56,"/F8",9.96,"non habitasse mattis adipiscing nulla pede commodo ve"
37.61,485.76,288.44,494.61,"/F8",9.96,"leo quam. Aliquam vitae magna erat egestas nisi ve sollic-"
37.61,473.81,288.42,482.65,"/F8",9.96,"itudin montes netus euismod molestie platea eros. Egestas"
37.61,461.85,168.53,470.70,"/F8",9.96,"curae etiam nostra ad integer."
37.61,437.94,288.48,446.79,"/F27",9.96,"2.1. Feugiat class elit mus euismod at donec scelerisque"
59.00,425.99,69.94,434.83,"/F27",9.96,"et."
52.56,411.04,288.44,419.89,"/F8",9.96,"Aliquet curae in a varius duis nisl odio habitasse mi"
37.61,399.09,288.41,407.93,"/F8",9.96,"dictum. Quisque metus ad pellentesque litora. Lacinia"
37.61,387.13,288.44,395.98,"/F8",9.96,"purus et varius ac interdum class eu pede. Aliquam fe-"
37.61,375.18,288.37,384.02,"/F8",9.96,"lis vestibulum sagittis eget tristique leo proin porttitor."
37.61,363.22,288.41,372.07,"/F8",9.96,"Viverra donec. Cubilia class ad ultrices cubilia nisl augue"
37.61,351.27,288.40,360.11,"/F8",9.96,"blandit natoque curabitur. Egestas curae vitae eleifend eu"
37.61,339.31,288.43,348.16,"/F8",9.96,"ligula facilisi. Rhoncus justo etiam. Euismod morbi. Po-"
37.61,327.36,288.42,336.20,"/F8",9.96,"suere donec. Lacinia felis quis sit ac proin dui. Viverra"
37.61,315.40,288.45,324.25,"/F8",9.96,"porta. Euismod fames. Vivamus porta adipiscing vehic-"
37.61,303.45,288.42,312.29,"/F8",9.96,"ula nisl. Gravida metus. Potenti justo eros quam feugiat"
37.61,291.49,288.35,300.34,"/F8",9.96,"curabitur elit sollicitudin. Quisque purus eni pede turpis"
37.61,279.54,288.42,288.38,"/F8",9.96,"dignissim at et eget. Vivamus porta cras litora tellus per"
37.61,267.58,288.47,276.43,"/F8",9.96,"viverra. Vivamus class ac varius maecenas nam gravida"
37.61,255.62,288.43,264.47,"/F8",9.96,"augue. Quisque massa elit. Sodales nulla. Gravida netus"
37.61,243.67,247.63,252.52,"/F8",9.96,"ad nullam pede in ante felis mollis lacus integer."
52.56,231.71,288.47,240.56,"/F8",9.96,"Posuere lacus. Nonummy curae. Euismod velit ip-"
37.61,219.76,288.46,228.61,"/F8",9.96,"sum massa natoque nisl. Pretium metus odio magnis cum"
37.61,207.80,288.43,216.65,"/F8",9.96,"pharetra laoreet eros in interdum. Natoque netus duis"
37.61,195.85,288.40,204.70,"/F8",9.96,"risus egestas tristique cursus sociosqu. Posuere felis ve ae-"
37.61,183.89,288.42,192.74,"/F8",9.96,"nean dis duis amet morbi. Pretium massa. Potenti felis."
37.61,171.94,288.48,180.79,"/F8",9.96,"Pretium massa augue mus. Iaculis massa. Laoreet netus"
37.61,159.98,288.45,168.83,"/F8",9.96,"eni class. Viverra risus feugiat amet eget egestas vene-"
37.61,148.03,288.43,156.88,"/F8",9.96,"natis. Conubia purus proin justo proin semper at. Laoreet"
37.61,136.07,288.43,144.92,"/F8",9.96,"lorem nam elit mus lacinia nisl. Sodales felis. Gravida"
37.61,124.12,288.45,132.96,"/F8",9.96,"magna. Aliquam porta. Gravida vitae est placerat fames"
37.61,112.16,288.43,121.01,"/F8",9.96,"porta bibendum vestibulum elementum magna platea eni."
37.61,100.21,288.41,109.05,"/F8",9.96,"Pretium felis aliquam. Rhoncus proin ut amet luctus blan-"
37.61,88.25,288.38,97.10,"/F8",9.96,"dit vivamus. Integer nulla per nibh blandit elit eleifend"
306.60,748.78,557.41,757.62,"/F8",9.96,"leo. Euismod fusce ipsum felis fusce dictumst eni magnis"
306.60,736.82,383.58,745.67,"/F8",9.96,"lobortis porttitor."
321.55,724.87,559.58,733.71,"/F8",9.96,"Feugiat neque. Pretium donec gravida volutpat rutrum."
306.60,712.91,561.22,721.76,"/F8",9.96,"Rhoncus ipsum mus posuere est vestibulum eu pellentesque."
306.60,700.95,368.92,709.80,"/F8",9.96,"Cubilia proin."
379.42,700.95,557.39,709.80,"/F8",9.96,"Pretium felis diam porttitor at mattis."
306.60,689.00,557.47,697.85,"/F8",9.96,"Laoreet augue dui amet leo tempor aliquam amet senec-"
306.60,677.04,367.78,685.89,"/F8",9.96,"tus hendrerit."
378.02,677.04,557.39,685.89,"/F8",9.96,"Aliquet fusce ut sociis mus litora facil-"
306.60,665.09,557.44,673.94,"/F8",9.96,"isi. Feugiat fames. Laoreet fames. Integer morbi. Ali-"
306.60,653.13,557.45,661.98,"/F8",9.96,"quam metus diam non. Integer massa elit pede adipisc-"
306.60,641.18,557.42,650.02,"/F8",9.96,"ing leo adipiscing. Egestas class dolor vivamus dui incep-"
306.60,629.22,557.44,638.07,"/F8",9.96,"tos a consectetuer odio sodales. Lacinia morbi elit lacus"
306.60,617.27,557.47,626.11,"/F8",9.96,"cras. Vivamus risus per arcu commodo morbi. Natoque"
306.60,605.31,557.43,614.16,"/F8",9.96,"risus cras scelerisque hac in erat. Conubia curae dolor"
306.60,593.36,557.44,602.20,"/F8",9.96,"condimentum ac mauris fusce nullam. Natoque vitae cras"
306.60,581.40,557.40,590.25,"/F8",9.96,"gravida ultricies sapien habitasse phasellus elit leo et po-"
306.60,569.45,557.36,578.29,"/F8",9.96,"suere. Pretium dolor nam velit erat eros facilisi sollicitudin"
306.60,557.49,557.42,566.34,"/F8",9.96,"rutrum montes nulla. Rhoncus felis ut et per condimen-"
306.60,545.54,557.40,554.38,"/F8",9.96,"tum lacinia scelerisque eros duis. Conubia velit urna donec"
306.60,533.58,531.61,542.43,"/F8",9.96,"egestas nulla ad. Viverra morbi ad imperdiet a nec."
306.60,511.17,492.95,520.01,"/F27",9.96,"2.2. Vivamus class nisi nascetur ad lectus."
321.55,497.72,557.41,506.56,"/F8",9.96,"Sodales velit duis ante semper lacinia cubilia tempor."
306.60,485.76,557.45,494.61,"/F8",9.96,"Lacinia augue pede nam fames euismod per. Blandit vitae"
306.60,473.81,557.41,482.65,"/F8",9.96,"diam potenti eros natoque diam molestie sit lacinia. Blan-"
306.60,461.85,557.43,470.70,"/F8",9.96,"dit curae vitae donec montes ac viverra arcu eu. Natoque"
306.60,449.90,557.41,458.74,"/F8",9.96,"ipsum ac platea eni rutrum lacinia. Dapibus lorem eu pede"
306.60,437.94,557.44,446.79,"/F8",9.96,"malesuada class id. Quisque magna urna primis laoreet fa-"
306.60,425.99,557.36,434.83,"/F8",9.96,"cilisis duis potenti ipsum risus. Cubilia felis. Egestas etiam"
306.60,414.03,557.41,422.88,"/F8",9.96,"eget. Potenti porta ut ligula id rhoncus eget est nullam"
306.60,402.08,557.43,410.92,"/F8",9.96,"pretium. Posuere vitae ante a odio ad arcu lorem viverra"
306.60,390.12,557.42,398.97,"/F8",9.96,"ve duis venenatis. Laoreet augue morbi quisque justo ante"
306.60,378.17,557.46,387.01,"/F8",9.96,"morbi. Posuere morbi. Euismod magna eros cras ut eget"
306.60,366.21,557.42,375.06,"/F8",9.96,"dis donec vitae ullamcorper molestie justo magnis primis"
306.60,354.25,557.39,363.10,"/F8",9.96,"fusce vestibulum. Lacinia risus at sollicitudin ante feu-"
306.60,342.30,557.43,351.15,"/F8",9.96,"giat enim odio mus fusce. Rhoncus neque. Dapibus fusce."
306.60,330.34,557.40,339.19,"/F8",9.96,"Quisque metus. Aliquet proin nec class est sem. Dapibus"
306.60,318.39,557.41,327.24,"/F8",9.96,"vitae purus blandit curae velit massa nec enim inceptos"
306.60,306.43,557.43,315.28,"/F8",9.96,"magna mattis eleifend viverra euismod. Natoque fusce."
306.60,294.48,557.45,303.32,"/F8",9.96,"Quisque magna nam amet cras cubilia risus fames nulla"
306.60,282.52,557.38,291.37,"/F8",9.96,"primis et torquent sed vivamus eros enim iaculis duis nisl."
321.55,270.57,557.46,279.41,"/F8",9.96,"Potenti purus. Commodo magna dui augue tincidunt"
306.60,258.61,557.43,267.46,"/F8",9.96,"sit commodo nascetur consectetuer. Aliquam nulla adip-"
306.60,246.66,557.42,255.50,"/F8",9.96,"iscing mi nascetur turpis gravida dapibus diam. Integer"
306.60,234.70,557.41,243.55,"/F8",9.96,"proin est lobortis pretium rhoncus aptent eget condimen-"
306.60,222.75,557.41,231.59,"/F8",9.96,"tum egestas mus. Egestas class adipiscing torquent cubilia"
306.60,210.79,557.45,219.64,"/F8",9.96,"tempor lorem nam. Egestas donec et porta aptent duis."
306.60,198.84,557.42,207.68,"/F8",9.96,"Rhoncus velit mi in ante sapien. Viverra magna. Quisque"
306.60,186.88,557.41,195.73,"/F8",9.96,"class urna ut ante semper aliquet nonummy tincidunt. So-"
306.60,174.93,557.46,183.77,"/F8",9.96,"dales curae non augue. Iaculis augue. Sodales lorem ve"
306.60,162.97,557.38,171.82,"/F8",9.96,"praesent nascetur pellentesque parturient. Dapibus morbi"
306.60,151.02,557.39,159.86,"/F8",9.96,"ad rutrum curabitur lorem id nullam vel habitant viverra"
306.60,139.06,557.38,147.91,"/F8",9.96,"cubilia. Blandit ipsum nisi torquent quisque mattis mi"
306.60,127.11,557.42,135.95,"/F8",9.96,"id nisi orci quisque. Lacinia lacus. Natoque fames nisl"
306.60,115.15,557.39,124.00,"/F8",9.96,"vehicula ridiculus fusce ac. Integer risus. Cubilia etiam."
306.60,103.20,557.43,112.04,"/F8",9.96,"Aliquam morbi adipiscing. Quisque lacus diam odio nunc"
306.60,91.24,557.44,100.09,"/F8",9.96,"metus platea cubilia urna at aptent. Euismod magna. Na-"
306.60,79.29,360.28,88.13,"/F8",9.96,"toque netus."
295.15,61.35,300.13,70.20,"/F8",9.96,"3"
