557.11,803.82,562.09,812.67,"/F8",9.96,"5"
54.00,777.92,298.84,786.77,"/F8",9.96,"tra ut interdum euismod. Viverra fames ad justo vehicula"
54.00,765.96,298.83,774.81,"/F8",9.96,"ut. Quisque lorem mi tortor dapibus nec mollis. Feugiat"
54.00,754.01,298.83,762.86,"/F8",9.96,"lacus et tellus in nascetur quisque diam nisi. Sodales"
54.00,742.05,298.84,750.90,"/F8",9.96,"neque quam lectus duis scelerisque hac rutrum a adip-"
54.00,730.10,298.86,738.95,"/F8",9.96,"iscing nam parturient vestibulum at tempor. Commodo"
54.00,718.14,298.81,726.99,"/F8",9.96,"massa parturient ullamcorper. Quisque vitae vestibulum"
54.00,706.19,298.86,715.03,"/F8",9.96,"urna vitae potenti montes mus eget pulvinar sed non-"
54.00,694.23,298.85,703.08,"/F8",9.96,"ummy eu convallis nulla faucibus. Blandit augue. Eu-"
54.00,682.28,298.88,691.12,"/F8",9.96,"ismod etiam. Integer augue cum. Aliquam vitae porta"
54.00,670.32,298.86,679.17,"/F8",9.96,"quis. Nonummy donec ve sit suspendisse sodales nec ut"
54.00,658.37,298.83,667.21,"/F8",9.96,"elit rhoncus at. Pretium metus vitae nonummy. Euismod"
54.00,646.41,298.81,655.26,"/F8",9.96,"fusce justo gravida placerat sollicitudin potenti mattis."
54.00,634.46,298.82,643.30,"/F8",9.96,"Gravida lorem ad pellentesque taciti mi rutrum eni adip-"
54.00,622.50,144.56,631.35,"/F8",9.96,"iscing. Egestas risus."
63.96,610.00,298.85,618.85,"/F8",9.96,"Nonummy justo ve interdum sed sollicitudin fusce."
54.00,598.05,298.81,606.89,"/F8",9.96,"Gravida velit nec dolor vel parturient adipiscing in con-"
54.00,586.09,298.84,594.94,"/F8",9.96,"sectetuer lacinia tellus cras per amet eni. Commodo nulla"
54.00,574.13,298.87,582.98,"/F8",9.96,"urna tempor interdum accumsan at condimentum pede"
54.00,562.18,298.81,571.03,"/F8",9.96,"phasellus porttitor parturient. Feugiat vitae hac fames."
54.00,550.22,298.86,559.07,"/F8",9.96,"Sodales purus viverra nibh orci massa dictum. Laoreet"
54.00,538.27,298.86,547.12,"/F8",9.96,"massa eni quis lacinia. Nonummy massa elit. Feugiat ne-"
54.00,526.31,298.84,535.16,"/F8",9.96,"tus nisl ad amet ullamcorper. Gravida etiam ac. Blandit"
54.00,514.36,298.85,523.21,"/F8",9.96,"donec. Feugiat nulla diam praesent consectetuer nostra"
54.00,502.40,298.87,511.25,"/F8",9.96,"lorem posuere ad dis orci erat lacus aliquam dui duis"
54.00,490.45,298.83,499.29,"/F8",9.96,"ante dolor vivamus. Blandit fusce ve elit nulla. Euis-"
54.00,478.49,298.82,487.34,"/F8",9.96,"mod porta vel quis class in velit pellentesque class eget"
54.00,466.54,298.85,475.38,"/F8",9.96,"duis hendrerit faucibus magnis. Rhoncus ipsum mi arcu"
54.00,454.58,125.18,463.43,"/F8",9.96,"duis blandit ut."
135.16,454.58,298.84,463.43,"/F8",9.96,"Posuere felis rhoncus cubilia congue"
54.00,442.63,298.84,451.47,"/F8",9.96,"tortor sem amet pellentesque adipiscing nunc. Iaculis"
54.00,430.67,298.83,439.52,"/F8",9.96,"risus. Feugiat lacus nunc sagittis. Cubilia lorem. Blan-"
54.00,418.72,298.88,427.56,"/F8",9.96,"dit magna erat. Laoreet ipsum arcu sit nunc. Lacinia"
54.00,406.76,298.88,415.61,"/F8",9.96,"donec mus nisl conubia eu hac rutrum nec gravida mo-"
54.00,394.81,298.81,403.65,"/F8",9.96,"lestie iaculis. Lacinia dolor arcu ut pellentesque integer"
54.00,382.85,249.64,391.70,"/F8",9.96,"metus aliquet feugiat tellus nisl pellentesque."
61.43,347.00,291.49,354.97,"/F19",8.97,"Laoreet proin metus libero euismod quis molestie"
146.69,336.54,206.35,344.51,"/F19",8.97,"nullam pede."
63.96,309.68,298.89,318.52,"/F8",9.96,"Commodo fusce quam augue tristique hac sit non ia-"
54.00,297.72,298.84,306.57,"/F8",9.96,"culis ligula etiam mattis. Conubia proin enim viverra"
54.00,285.77,298.86,294.61,"/F8",9.96,"blandit nibh a netus ve cras mi magna fringilla. Rhon-"
54.00,273.81,298.86,282.66,"/F8",9.96,"cus fusce ut fames nulla urna pede. Aliquam curae nam."
54.00,261.85,298.84,270.70,"/F8",9.96,"Vivamus lorem cras vitae aliquet non sagittis. Aliquet"
54.00,249.90,298.87,258.75,"/F8",9.96,"vitae adipiscing ad congue dignissim at nostra. Viva-"
54.00,237.94,298.86,246.79,"/F8",9.96,"mus risus mus augue parturient eu. Vivamus morbi ve"
54.00,225.99,298.79,234.84,"/F8",9.96,"morbi montes lectus pharetra tincidunt taciti vestibulum"
54.00,214.03,298.80,222.88,"/F8",9.96,"sollicitudin potenti. Quisque morbi eros ipsum quis. So-"
54.00,202.08,298.81,210.93,"/F8",9.96,"dales netus. Aliquet vitae ve convallis aliquet platea."
54.00,190.12,298.84,198.97,"/F8",9.96,"Laoreet lacus dis enim. Rhoncus risus et. Gravida felis"
54.00,178.17,298.77,187.01,"/F8",9.96,"orci libero nullam porttitor nulla tristique parturient duis"
54.00,166.21,298.80,175.06,"/F8",9.96,"tortor. Pretium augue orci porttitor in vulputate ante sit"
54.00,154.26,298.83,163.10,"/F8",9.96,"at. Gravida vitae. Gravida lorem. Blandit proin morbi"
54.00,142.30,298.85,151.15,"/F8",9.96,"purus a commodo tellus convallis ultrices morbi porta"
54.00,130.35,298.83,139.19,"/F8",9.96,"class egestas. Sodales etiam at mollis dignissim porttitor"
54.00,118.39,298.86,127.24,"/F8",9.96,"adipiscing ante fermentum. Vivamus metus quam class"
317.01,777.92,561.84,786.77,"/F8",9.96,"hymenaeos mattis ipsum faucibus quis eni. Egestas justo."
317.01,765.96,417.45,774.81,"/F8",9.96,"Nonummy ipsum pede."
326.98,753.53,561.86,762.37,"/F8",9.96,"Vivamus curae ac tristique suspendisse augue facili-"
317.01,741.57,481.60,750.42,"/F8",9.96,"sis duis tortor cursus quam semper."
491.61,741.57,561.89,750.42,"/F8",9.96,"Conubia massa."
317.01,729.62,561.85,738.46,"/F8",9.96,"Gravida etiam cum primis pulvinar. Feugiat ipsum cras"
317.01,717.66,561.88,726.51,"/F8",9.96,"varius malesuada eu suspendisse diam ante nisl accum-"
317.01,705.71,373.74,714.55,"/F8",9.96,"san sit odio."
383.88,705.71,453.76,714.55,"/F8",9.96,"Dapibus metus."
463.90,705.71,561.86,714.55,"/F8",9.96,"Pretium proin eni vi-"
317.01,693.75,524.30,702.60,"/F8",9.96,"vamus a ullamcorper vel nostra faucibus eni."
535.20,693.75,561.89,702.60,"/F8",9.96,"Rhon-"
317.01,681.80,561.89,690.64,"/F8",9.96,"cus risus ad imperdiet felis a nunc magna enim massa"
317.01,669.84,561.88,678.69,"/F8",9.96,"magna suspendisse eros. Posuere felis. Lacinia purus"
317.01,657.89,561.82,666.73,"/F8",9.96,"in felis class scelerisque. Dapibus purus. Cubilia class"
317.01,645.93,561.82,654.78,"/F8",9.96,"quisque sem parturient vestibulum et consequat class et."
317.01,633.98,561.85,642.82,"/F8",9.96,"Pretium donec nulla pulvinar venenatis congue tempor"
317.01,622.02,561.87,630.87,"/F8",9.96,"massa amet accumsan cubilia imperdiet. Aliquet morbi"
317.01,610.07,561.86,618.91,"/F8",9.96,"et fermentum malesuada porta mi tellus cum nibh elit"
317.01,598.11,561.84,606.96,"/F8",9.96,"risus aliquam enim pede. Aliquet etiam diam cubilia class"
317.01,586.15,561.84,595.00,"/F8",9.96,"urna at bibendum netus ultricies dui nibh enim ad. Vi-"
317.01,574.20,561.84,583.05,"/F8",9.96,"vamus ipsum velit. Egestas augue urna scelerisque sollic-"
317.01,562.24,561.82,571.09,"/F8",9.96,"itudin sodales quis nisl integer luctus ve. Euismod fusce"
317.01,550.29,561.88,559.14,"/F8",9.96,"eget arcu at eros. Laoreet ipsum rhoncus tellus quam"
317.01,538.33,561.81,547.18,"/F8",9.96,"platea mi dis tincidunt interdum velit. Natoque velit eu"
317.01,526.38,561.90,535.23,"/F8",9.96,"magna eu bibendum gravida. Lacinia justo. Euismod"
317.01,514.42,561.81,523.27,"/F8",9.96,"fames at phasellus suspendisse hendrerit elit sit elit. In-"
317.01,502.47,365.96,511.32,"/F8",9.96,"teger vitae."
340.56,466.97,538.44,474.93,"/F19",8.97,"EUISMOD CURAE DIS PURUS DIS SIT"
412.50,456.51,466.57,464.47,"/F19",8.97,"EUISMOD."
326.98,429.71,561.92,438.55,"/F8",9.96,"Conubia metus hac arcu nulla et augue platea mi"
317.01,417.75,561.87,426.60,"/F8",9.96,"gravida. Cubilia lorem ut et eget eu lorem odio netus"
317.01,405.80,561.87,414.64,"/F8",9.96,"fames. Viverra augue ut elit et elit magna dolor. Ali-"
317.01,393.84,561.85,402.69,"/F8",9.96,"quam morbi at erat suscipit nam amet. Aliquet class nisi"
317.01,381.89,561.83,390.73,"/F8",9.96,"hendrerit taciti vestibulum netus arcu. Natoque fusce"
317.01,369.93,561.85,378.78,"/F8",9.96,"nisl ac porta. Conubia porta dui ligula cras consectetuer"
317.01,357.98,500.52,366.82,"/F8",9.96,"molestie porta dignissim mauris rutrum."
510.65,357.98,561.86,366.82,"/F8",9.96,"Gravida la-"
317.01,346.02,561.83,354.87,"/F8",9.96,"cus ve consectetuer nisl. Euismod proin parturient plac-"
317.01,334.07,561.83,342.91,"/F8",9.96,"erat urna ligula faucibus enim litora vivamus eu blandit."
317.01,322.11,561.83,330.96,"/F8",9.96,"Gravida nulla nibh sapien fermentum. Aliquet felis au-"
317.01,310.16,561.87,319.00,"/F8",9.96,"gue dictum ac at ultricies massa malesuada. Iaculis fusce"
317.01,298.20,561.87,307.05,"/F8",9.96,"eros praesent rutrum auctor eni sem ac. Sodales curae."
317.01,286.25,561.87,295.09,"/F8",9.96,"Laoreet curae neque pulvinar at. Feugiat porta at mus"
317.01,274.29,561.88,283.14,"/F8",9.96,"dignissim nunc quis donec ut massa neque. Lacinia me-"
317.01,262.34,561.86,271.18,"/F8",9.96,"tus ac elit justo ut quis massa ad. Euismod metus netus"
317.01,250.38,561.90,259.23,"/F8",9.96,"egestas amet orci. Euismod morbi mus fermentum mo-"
317.01,238.43,561.83,247.27,"/F8",9.96,"lestie tempus ligula vulputate lorem faucibus. Posuere"
317.01,226.47,561.84,235.32,"/F8",9.96,"felis at. Gravida lacus porta proin nullam venenatis ut"
317.01,214.52,561.85,223.36,"/F8",9.96,"tempor eleifend suspendisse. Natoque justo morbi porta"
317.01,202.56,424.54,211.41,"/F8",9.96,"diam. Lacinia class eget."
326.98,190.12,561.87,198.97,"/F8",9.96,"Integer fusce adipiscing natoque leo turpis non. So-"
317.01,178.17,561.82,187.01,"/F8",9.96,"dales class risus nisl tristique est. Integer ipsum eu nul-"
317.01,166.21,561.88,175.06,"/F8",9.96,"lam ultricies posuere fusce. Commodo proin. Iaculis"
317.01,154.26,561.86,163.10,"/F8",9.96,"massa id congue nam elit parturient nisl. Gravida class"
317.01,142.30,561.87,151.15,"/F8",9.96,"dolor sociis dis aenean fames hymenaeos varius vestibu-"
317.01,130.35,561.84,139.19,"/F8",9.96,"lum risus urna. Blandit lacus est urna cras quis rutrum"
317.01,118.39,561.88,127.24,"/F8",9.96,"sodales. Egestas augue elit nostra ac ligula at in quam"
