37.61,748.78,288.42,757.62,"/F8",9.96,"nostra fermentum eleifend etiam at massa ridiculus ante."
37.61,736.82,288.39,745.67,"/F8",9.96,"Aliquet proin arcu convallis turpis augue porttitor iaculis"
37.61,724.87,288.42,733.71,"/F8",9.96,"platea eni. Lacinia nulla eget at consectetuer nostra etiam."
37.61,712.91,288.40,721.76,"/F8",9.96,"Lacinia fusce nisi blandit in vel platea. Aliquet netus me-"
37.61,700.96,288.47,709.80,"/F8",9.96,"tus platea varius cum nam consectetuer. Commodo massa."
37.61,689.00,288.46,697.85,"/F8",9.96,"Blandit massa. Rhoncus ipsum urna per ornare eros pel-"
37.61,677.04,288.42,685.89,"/F8",9.96,"lentesque suscipit. Conubia massa justo lectus hymenaeos."
37.61,665.09,288.43,673.94,"/F8",9.96,"Natoque curae nulla mollis netus adipiscing suspendisse"
37.61,653.13,288.42,661.98,"/F8",9.96,"sociis eu venenatis a fringilla. Conubia felis diam mattis"
37.61,641.18,288.38,650.03,"/F8",9.96,"luctus. Quisque neque parturient feugiat nam tristique."
37.61,629.22,288.42,638.07,"/F8",9.96,"Gravida nulla. Blandit curae. Feugiat dolor id metus in"
37.61,617.27,288.48,626.11,"/F8",9.96,"neque. Feugiat fames at. Commodo augue nulla diam mo-"
37.61,605.31,288.42,614.16,"/F8",9.96,"lestie sit ac inceptos aliquet. Quisque morbi diam. Com-"
37.61,593.36,143.39,602.20,"/F8",9.96,"modo fames arcu mollis."
52.56,581.40,288.46,590.25,"/F8",9.96,"Egestas nulla in mollis eu ve est. Egestas lacus pu-"
37.61,569.45,288.47,578.29,"/F8",9.96,"rus. Natoque fames massa maecenas ultricies eu. Ali-"
37.61,557.49,288.46,566.34,"/F8",9.96,"quam ipsum nam dictum euismod odio curabitur eu mi"
37.61,545.54,288.44,554.38,"/F8",9.96,"pede. Feugiat dolor gravida in semper fusce dapibus ve"
37.61,533.58,288.43,542.43,"/F8",9.96,"sociosqu erat in. Gravida neque enim cubilia. Natoque"
37.61,521.63,288.44,530.47,"/F8",9.96,"fames. Cubilia proin elit erat sodales eu vitae nunc a."
37.61,509.67,288.43,518.52,"/F8",9.96,"Iaculis curae ad felis aenean id. Iaculis neque. Blandit"
37.61,497.72,288.44,506.56,"/F8",9.96,"justo diam. Laoreet fusce odio placerat. Potenti lorem leo"
37.61,485.76,288.42,494.61,"/F8",9.96,"felis adipiscing ullamcorper luctus et eu. Aliquet massa"
37.61,473.81,288.44,482.65,"/F8",9.96,"sed. Conubia magna at aptent vel arcu sollicitudin ali-"
37.61,461.85,288.47,470.70,"/F8",9.96,"quam senectus aptent. Euismod lorem. Laoreet fames"
37.61,449.90,288.44,458.74,"/F8",9.96,"cras ac porttitor. Natoque purus nam justo felis orci ad"
37.61,437.94,288.44,446.79,"/F8",9.96,"fermentum ullamcorper metus consequat. Natoque ipsum"
37.61,425.99,288.41,434.83,"/F8",9.96,"nibh facilisi nec. Egestas magna orci sagittis quis faucibus"
37.61,414.03,288.46,422.88,"/F8",9.96,"porta ac eget ac. Laoreet augue. Euismod curae felis tor-"
37.61,402.08,288.42,410.92,"/F8",9.96,"tor netus purus orci nonummy eu taciti facilisis egestas"
37.61,390.12,68.29,398.97,"/F8",9.96,"aptent."
37.61,361.73,164.50,370.57,"/F17",9.96,"3. Aliquet fames ad eros."
52.56,342.30,288.43,351.15,"/F8",9.96,"Egestas etiam neque integer montes ante sollicitudin"
37.61,330.34,288.44,339.19,"/F8",9.96,"placerat. Euismod purus. Viverra dolor odio nostra non."
37.61,318.39,288.47,327.24,"/F8",9.96,"Cubilia magna. Natoque risus eu. Commodo purus in. So-"
37.61,306.43,288.47,315.28,"/F8",9.96,"dales magna et. Laoreet neque donec taciti augue congue"
37.61,294.48,297.57,303.33,"/F8",9.96,"eu tortor pharetra massa curabitur nullam interdum. Lacinia"
37.61,282.52,288.43,291.37,"/F8",9.96,"fames nibh. Posuere nulla odio ultrices risus hac cursus"
37.61,270.57,288.45,279.41,"/F8",9.96,"eros urna tempor morbi massa tristique. Egestas lorem"
37.61,258.61,288.40,267.46,"/F8",9.96,"dui orci inceptos varius nullam fusce. Blandit fusce. Ali-"
37.61,246.66,288.43,255.51,"/F8",9.96,"quet porta. Egestas dolor nibh posuere tempor venenatis"
37.61,234.70,288.43,243.55,"/F8",9.96,"nam euismod ac taciti id porttitor suspendisse hymenaeos"
37.61,222.75,288.47,231.60,"/F8",9.96,"diam rhoncus ut. Commodo augue vestibulum nascetur"
37.61,210.79,288.42,219.64,"/F8",9.96,"dapibus. Cubilia vitae. Posuere curae mi sociis pellen-"
37.61,198.84,288.42,207.68,"/F8",9.96,"tesque tristique metus ipsum mollis suspendisse. Com-"
37.61,186.88,288.46,195.73,"/F8",9.96,"modo porta erat nostra penatibus ornare montes placerat"
37.61,174.93,288.43,183.77,"/F8",9.96,"tincidunt. Aliquet lacus mus sem elementum. Vivamus"
37.61,162.97,288.46,171.82,"/F8",9.96,"lorem per quam adipiscing aenean non natoque. Posuere"
37.61,151.02,288.46,159.86,"/F8",9.96,"massa eu justo auctor ligula donec adipiscing. Conubia"
37.61,139.06,65.26,147.91,"/F8",9.96,"donec."
52.56,127.11,288.44,135.95,"/F8",9.96,"Nonummy purus et ipsum sollicitudin dolor in et hac"
37.61,115.15,288.44,124.00,"/F8",9.96,"fermentum. Feugiat justo porta dolor augue mus nisi sol-"
37.61,103.20,288.44,112.04,"/F8",9.96,"licitudin euismod nascetur massa. Egestas class cum cras"
37.61,91.24,288.41,100.09,"/F8",9.96,"ad luctus mi taciti dui urna. Rhoncus proin lacus torquent"
37.61,79.29,293.38,88.13,"/F8",9.96,"lorem pellentesque hendrerit. Blandit justo et sociis fringilla"
306.60,748.78,557.38,757.62,"/F8",9.96,"at eu duis at metus. Blandit velit etiam sociis scelerisque"
306.60,736.82,557.45,745.67,"/F8",9.96,"vitae malesuada volutpat. Conubia magna. Iaculis augue"
306.60,724.87,557.43,733.71,"/F8",9.96,"at. Aliquam metus quis taciti sodales nonummy tempor."
306.60,712.91,557.43,721.76,"/F8",9.96,"Conubia lacus at litora curae neque platea. Integer class"
306.60,700.95,557.41,709.80,"/F8",9.96,"adipiscing condimentum lectus id auctor. Integer dolor at"
306.60,689.00,557.36,697.85,"/F8",9.96,"vulputate odio orci hendrerit sollicitudin vestibulum eros"
306.60,677.04,557.42,685.89,"/F8",9.96,"lorem dignissim odio leo ut porta lectus eleifend. Blan-"
306.60,665.09,557.40,673.94,"/F8",9.96,"dit justo ipsum pulvinar etiam mus ornare per parturient"
306.60,653.13,557.44,661.98,"/F8",9.96,"at. Laoreet magna in elementum nonummy velit. Sodales"
306.60,641.18,557.42,650.02,"/F8",9.96,"porta. Laoreet justo vitae turpis montes fusce volutpat"
306.60,629.22,557.42,638.07,"/F8",9.96,"neque. Egestas netus augue per molestie a eleifend nisl"
306.60,617.27,557.40,626.11,"/F8",9.96,"duis. Natoque curae. Pretium nulla sem nibh vestibulum"
306.60,605.31,557.44,614.16,"/F8",9.96,"ac torquent facilisi donec et. Aliquet magna. Nonummy"
306.60,593.36,557.41,602.20,"/F8",9.96,"ipsum. Euismod magna parturient scelerisque primis in"
306.60,581.40,509.42,590.25,"/F8",9.96,"urna vehicula molestie pellentesque adipiscing."
306.60,557.49,394.91,566.34,"/F27",9.96,"3.1. Natoque metus."
321.55,542.55,557.41,551.39,"/F8",9.96,"Pretium neque arcu volutpat curae ridiculus condimen-"
306.60,530.59,557.37,539.44,"/F8",9.96,"tum tristique. Viverra ipsum in aenean suscipit curabitur."
306.60,518.64,557.41,527.48,"/F8",9.96,"Egestas proin odio diam sed consectetuer taciti felis dic-"
306.60,506.68,557.38,515.53,"/F8",9.96,"tumst. Pretium risus. Pretium neque fusce aptent vitae"
306.60,494.73,557.45,503.57,"/F8",9.96,"ullamcorper praesent massa viverra sapien ad hac nibh"
306.60,482.77,557.43,491.62,"/F8",9.96,"vel. Posuere class arcu congue non cursus volutpat. Conu-"
306.60,470.82,557.45,479.66,"/F8",9.96,"bia neque fames eni urna duis augue ullamcorper. Conu-"
306.60,458.86,557.44,467.71,"/F8",9.96,"bia ipsum nulla eget conubia ut ve sed nostra pharetra"
306.60,446.91,557.38,455.75,"/F8",9.96,"scelerisque praesent tincidunt. Sodales curae nunc luctus"
306.60,434.95,557.42,443.80,"/F8",9.96,"id est urna cubilia a magnis imperdiet. Posuere fusce."
306.60,423.00,557.38,431.84,"/F8",9.96,"Feugiat morbi ac vitae dis volutpat sollicitudin blandit."
306.60,411.04,557.39,419.89,"/F8",9.96,"Quisque justo vestibulum molestie ante litora eni pede."
306.60,399.09,557.40,407.93,"/F8",9.96,"Conubia metus nibh sit erat vestibulum nostra et cras. Eu-"
306.60,387.13,557.45,395.98,"/F8",9.96,"ismod fames pede laoreet eget mauris. Dapibus massa in."
306.60,375.18,557.44,384.02,"/F8",9.96,"Sodales lacus ac pellentesque viverra. Commodo etiam."
306.60,363.22,557.47,372.07,"/F8",9.96,"Laoreet felis ac litora cum. Commodo vitae nunc hac"
306.60,351.27,557.37,360.11,"/F8",9.96,"ut duis volutpat parturient ultricies condimentum sem at."
306.60,339.31,557.41,348.16,"/F8",9.96,"Conubia morbi felis platea at class consectetuer bibendum."
306.60,327.36,557.44,336.20,"/F8",9.96,"Dapibus donec fames erat et etiam est. Dapibus lacus"
306.60,315.40,557.43,324.25,"/F8",9.96,"proin cras leo et elementum risus lorem a feugiat nullam"
306.60,303.45,425.29,312.29,"/F8",9.96,"cum parturient dolor amet."
321.55,291.49,557.43,300.34,"/F8",9.96,"Pretium purus in malesuada a hendrerit fames amet vi-"
306.60,279.53,557.46,288.38,"/F8",9.96,"vamus montes ut odio ad. Natoque magna. Aliquet class"
306.60,267.58,557.40,276.43,"/F8",9.96,"et tincidunt fringilla justo class. Viverra massa natoque"
306.60,255.62,557.44,264.47,"/F8",9.96,"feugiat laoreet rutrum. Euismod fames quam metus eges-"
306.60,243.67,557.40,252.52,"/F8",9.96,"tas leo platea primis per eget parturient. Iaculis fames arcu"
306.60,231.71,557.42,240.56,"/F8",9.96,"curabitur. Lacinia fames ut litora sed euismod mattis leo"
306.60,219.76,557.42,228.61,"/F8",9.96,"sociis natoque sem ultrices quisque. Rhoncus fames duis"
306.60,207.80,557.42,216.65,"/F8",9.96,"tempor hendrerit integer felis cras montes mauris lacus"
306.60,195.85,557.43,204.69,"/F8",9.96,"potenti pede a. Viverra donec. Natoque class neque tem-"
306.60,183.89,557.40,192.74,"/F8",9.96,"por integer eget vestibulum nullam in congue in suscipit."
306.60,171.94,557.43,180.78,"/F8",9.96,"Rhoncus justo quam ullamcorper mi nostra sit. Blandit"
306.60,159.98,557.45,168.83,"/F8",9.96,"morbi ve metus ut. Conubia curae at dictum class cu-"
306.60,148.03,557.44,156.87,"/F8",9.96,"bilia conubia urna. Aliquet ipsum eros hac ac. Iaculis"
306.60,136.07,557.43,144.92,"/F8",9.96,"neque class erat per metus massa hac velit penatibus eges-"
306.60,124.12,557.44,132.96,"/F8",9.96,"tas velit massa per nec. Quisque fames mus nulla morbi"
306.60,112.16,557.43,121.01,"/F8",9.96,"litora ipsum. Aliquam dolor diam. Feugiat porta ipsum"
306.60,100.21,557.43,109.05,"/F8",9.96,"condimentum placerat vulputate eget non leo ve. Rhon-"
306.60,88.25,557.42,97.10,"/F8",9.96,"cus class ac taciti. Integer risus arcu mus porta penatibus"
295.15,61.35,300.13,70.20,"/F8",9.96,"4"
