557.11,803.82,562.09,812.67,"/F8",9.96,"2"
54.00,777.92,298.87,786.77,"/F8",9.96,"morbi mi netus eu penatibus a massa natoque bibendum"
54.00,765.96,298.90,774.81,"/F8",9.96,"arcu. Commodo purus hac cras fames platea netus orci"
54.00,754.01,282.36,762.86,"/F8",9.96,"dui nulla purus justo libero. Iaculis justo eget proin."
107.33,719.89,245.66,727.85,"/F19",8.97,"Iaculis augue erat aliquam at."
63.96,693.35,298.88,702.20,"/F8",9.96,"Vivamus augue risus inceptos eu nullam ut. Laoreet"
54.00,681.39,298.83,690.24,"/F8",9.96,"vitae ante justo. Natoque metus et per tristique ali-"
54.00,669.44,298.83,678.28,"/F8",9.96,"quam sollicitudin ultricies. Posuere magna risus sodales"
54.00,657.48,298.84,666.33,"/F8",9.96,"ac. Dapibus fusce diam taciti aliquam vivamus sollici-"
54.00,645.53,298.81,654.37,"/F8",9.96,"tudin tristique risus vel. Blandit magna natoque aptent"
54.00,633.57,298.81,642.42,"/F8",9.96,"tristique praesent sociis adipiscing consectetuer laoreet"
54.00,621.62,298.88,630.46,"/F8",9.96,"fames leo diam dolor. Dapibus fames eu porttitor a."
54.00,609.66,298.88,618.51,"/F8",9.96,"Viverra metus et molestie tempor odio aenean ut nam"
54.00,597.71,298.85,606.55,"/F8",9.96,"mattis. Feugiat donec netus iaculis aliquet odio cum"
54.00,585.75,298.81,594.60,"/F8",9.96,"sit aliquam. Iaculis vitae curae netus turpis felis tin-"
54.00,573.80,298.81,582.64,"/F8",9.96,"cidunt urna consectetuer sociis sapien velit scelerisque"
54.00,561.84,298.87,570.69,"/F8",9.96,"ad. Commodo proin ut mollis felis non ante adipiscing"
54.00,549.89,298.83,558.73,"/F8",9.96,"sed fusce. Nonummy nulla et sollicitudin consectetuer"
54.00,537.93,298.86,546.78,"/F8",9.96,"natoque tempus congue nam. Pretium netus id taciti"
54.00,525.98,298.84,534.82,"/F8",9.96,"torquent egestas. Cubilia lorem est urna fames vitae mol-"
54.00,514.02,298.86,522.87,"/F8",9.96,"lis arcu orci. Conubia nulla leo hymenaeos taciti diam"
54.00,502.07,298.82,510.91,"/F8",9.96,"class posuere cubilia libero vel. Potenti lacus cum elit"
54.00,490.11,298.87,498.96,"/F8",9.96,"odio nunc. Rhoncus morbi nisi. Sodales massa. Viverra"
54.00,478.15,298.83,487.00,"/F8",9.96,"fusce pede velit rutrum adipiscing fusce diam gravida tac-"
54.00,466.20,298.86,475.05,"/F8",9.96,"iti urna ad nisl ullamcorper. Commodo etiam nulla vel"
54.00,454.24,298.87,463.09,"/F8",9.96,"orci euismod donec elit morbi tempor. Nonummy lacus"
54.00,442.29,298.84,451.14,"/F8",9.96,"ad porttitor nulla enim pretium. Nonummy etiam ac nisl"
54.00,430.33,162.92,439.18,"/F8",9.96,"nostra amet fusce massa."
63.96,418.16,298.88,427.00,"/F8",9.96,"Dapibus vitae hac amet enim nec lobortis posuere"
54.00,406.20,298.84,415.05,"/F8",9.96,"bibendum ornare cursus. Potenti class nisl posuere in"
54.00,394.25,298.85,403.09,"/F8",9.96,"tortor molestie. Egestas dolor ante ad arcu faucibus est"
54.00,382.29,298.87,391.14,"/F8",9.96,"auctor potenti malesuada suscipit. Commodo ipsum au-"
54.00,370.34,298.81,379.18,"/F8",9.96,"gue velit nisl curae scelerisque nec orci. Gravida proin."
54.00,358.38,298.86,367.23,"/F8",9.96,"Commodo netus. Integer risus. Dapibus netus. Vivamus"
54.00,346.43,298.89,355.27,"/F8",9.96,"massa mi. Egestas justo ad in non ad. Natoque nulla mi"
54.00,334.47,298.83,343.32,"/F8",9.96,"varius ve molestie. Egestas class ac consectetuer quisque"
54.00,322.52,298.87,331.36,"/F8",9.96,"maecenas. Posuere metus quis non. Rhoncus nulla quam"
54.00,310.56,298.86,319.41,"/F8",9.96,"sem orci molestie. Iaculis massa fusce netus. Cubilia"
54.00,298.61,298.86,307.45,"/F8",9.96,"neque ipsum urna feugiat dolor. Natoque neque purus"
54.00,286.65,298.89,295.50,"/F8",9.96,"commodo euismod velit massa ligula mauris. Posuere"
54.00,274.70,298.88,283.54,"/F8",9.96,"purus posuere vivamus. Potenti massa per quam. Na-"
54.00,262.74,298.87,271.59,"/F8",9.96,"toque augue elit posuere donec sed augue montes purus"
54.00,250.79,298.80,259.63,"/F8",9.96,"vestibulum lacinia nibh. Blandit nulla orci vulputate et"
54.00,238.83,244.66,247.68,"/F8",9.96,"massa bibendum dolor et. Cubilia curae ut."
111.33,204.71,241.66,212.67,"/F19",8.97,"DAPIBUS VELIT DONEC."
63.96,178.17,212.19,187.02,"/F8",9.96,"Iaculis nulla dis quam nascetur."
224.16,178.17,298.90,187.02,"/F8",9.96,"Commodo lorem"
54.00,166.21,298.79,175.06,"/F8",9.96,"eros quis erat faucibus ultricies ante quis nunc tincidunt."
54.00,154.26,298.88,163.11,"/F8",9.96,"Conubia morbi quis vehicula malesuada augue nonummy"
54.00,142.30,298.86,151.15,"/F8",9.96,"sem pharetra a habitant per. Viverra ipsum etiam mol-"
54.00,130.35,298.82,139.19,"/F8",9.96,"lis adipiscing metus vivamus. Quisque donec ut dictum"
54.00,118.39,298.83,127.24,"/F8",9.96,"etiam. Sodales purus id metus. Viverra nulla nibh morbi"
317.01,777.92,561.84,786.77,"/F8",9.96,"porttitor. Aliquet justo. Lacinia etiam cras elementum"
317.01,765.96,561.87,774.81,"/F8",9.96,"tempor hymenaeos. Quisque lorem. Sodales fusce eu con-"
317.01,754.01,561.83,762.86,"/F8",9.96,"vallis velit eget. Lacinia fusce parturient aliquam enim"
317.01,742.05,561.87,750.90,"/F8",9.96,"sociosqu. Conubia etiam at cursus sociosqu hendrerit"
317.01,730.10,561.85,738.95,"/F8",9.96,"tempor purus litora odio. Aliquam etiam nibh viverra"
317.01,718.14,561.88,726.99,"/F8",9.96,"montes etiam. Feugiat fames in class suspendisse so-"
317.01,706.19,561.83,715.03,"/F8",9.96,"ciosqu nulla non. Sodales velit nec taciti consequat adip-"
317.01,694.23,561.87,703.08,"/F8",9.96,"iscing posuere pede cras magnis feugiat. Feugiat justo"
317.01,682.28,561.84,691.12,"/F8",9.96,"orci tempus taciti vivamus laoreet nostra luctus odio. Ia-"
317.01,670.32,561.82,679.17,"/F8",9.96,"culis class et dictum penatibus id hendrerit ve porta mi."
317.01,658.37,561.85,667.21,"/F8",9.96,"Quisque morbi amet lacinia fusce amet dis nibh adipisc-"
317.01,646.41,561.83,655.26,"/F8",9.96,"ing semper. Dapibus velit gravida nullam felis vestibu-"
317.01,634.46,561.86,643.30,"/F8",9.96,"lum condimentum tellus ut accumsan lorem. Blandit do-"
317.01,622.50,561.88,631.35,"/F8",9.96,"lor augue semper ve. Nonummy fames risus facilisi augue"
317.01,610.55,385.85,619.39,"/F8",9.96,"id ad odio velit."
326.98,598.25,561.90,607.10,"/F8",9.96,"Conubia massa ut risus semper varius donec netus"
317.01,586.29,561.87,595.14,"/F8",9.96,"gravida viverra varius metus duis diam amet nam. Eges-"
317.01,574.34,561.87,583.19,"/F8",9.96,"tas neque. Posuere risus ipsum erat. Euismod donec."
317.01,562.38,561.85,571.23,"/F8",9.96,"Quisque augue at sociis vel quisque dis ornare vivamus"
317.01,550.43,561.86,559.27,"/F8",9.96,"laoreet egestas nibh. Quisque proin sit quam ante cum"
317.01,538.47,561.84,547.32,"/F8",9.96,"purus nullam. Pretium netus. Aliquam lorem velit nec"
317.01,526.52,561.85,535.36,"/F8",9.96,"nisl amet eget platea non taciti ut enim metus potenti"
317.01,514.56,561.87,523.41,"/F8",9.96,"aptent nec. Egestas curae pede aenean cum elit pellen-"
317.01,502.61,561.81,511.45,"/F8",9.96,"tesque facilisi lorem. Potenti neque. Cubilia risus quis"
317.01,490.65,561.87,499.50,"/F8",9.96,"condimentum iaculis ullamcorper nunc. Commodo risus"
317.01,478.70,561.86,487.54,"/F8",9.96,"id auctor pulvinar lacinia pretium cras eget. Rhoncus"
317.01,466.74,561.82,475.59,"/F8",9.96,"donec nisi platea. Pretium velit. Pretium purus eni ante"
317.01,454.79,561.85,463.63,"/F8",9.96,"nascetur justo duis sociosqu imperdiet magnis a parturi-"
317.01,442.83,561.82,451.68,"/F8",9.96,"ent sem parturient litora. Potenti justo. Quisque morbi"
317.01,430.88,561.87,439.72,"/F8",9.96,"massa senectus. Blandit morbi eget imperdiet accumsan"
317.01,418.92,561.87,427.77,"/F8",9.96,"ac condimentum amet habitasse. Viverra lacus. Posuere"
317.01,406.97,561.83,415.81,"/F8",9.96,"nulla ut eleifend conubia ligula. Iaculis class ut rutrum"
317.01,395.01,561.82,403.86,"/F8",9.96,"donec tristique vel. Potenti dolor ante posuere penatibus"
317.01,383.06,467.66,391.90,"/F8",9.96,"sed consectetuer magnis mi tortor."
406.20,348.29,472.87,356.26,"/F19",8.97,"Laoreet porta."
326.98,321.63,561.89,330.48,"/F8",9.96,"Iaculis ipsum. Natoque lacus. Aliquam etiam fames"
317.01,309.68,515.07,318.52,"/F8",9.96,"duis libero tristique felis dictumst class ve."
525.60,309.68,561.82,318.52,"/F8",9.96,"Conubia"
317.01,297.72,561.84,306.57,"/F8",9.96,"donec mi at ipsum taciti viverra. Viverra nulla natoque"
317.01,285.76,423.85,294.61,"/F8",9.96,"tempus eget quis nulla."
434.38,285.76,561.85,294.61,"/F8",9.96,"Potenti etiam eros inceptos."
317.01,273.81,561.84,282.66,"/F8",9.96,"Blandit ipsum fusce mollis litora. Cubilia purus mi at"
317.01,261.85,561.85,270.70,"/F8",9.96,"rutrum habitant condimentum leo nullam dolor quisque"
317.01,249.90,561.84,258.75,"/F8",9.96,"metus. Dapibus fames at duis volutpat tortor libero vi-"
317.01,237.94,561.90,246.79,"/F8",9.96,"vamus nibh dui class consequat. Nonummy dolor massa"
317.01,225.99,383.33,234.84,"/F8",9.96,"leo vehicula a."
394.34,225.99,518.47,234.84,"/F8",9.96,"Euismod fames vestibulum."
529.48,225.99,561.87,234.84,"/F8",9.96,"Viverra"
317.01,214.03,561.85,222.88,"/F8",9.96,"fames velit arcu iaculis. Nonummy velit. Blandit au-"
317.01,202.08,561.86,210.92,"/F8",9.96,"gue. Potenti purus cum erat ad volutpat viverra aenean"
317.01,190.12,561.84,198.97,"/F8",9.96,"et habitant amet ante praesent taciti rutrum. Cubilia"
317.01,178.17,561.86,187.01,"/F8",9.96,"vitae lorem posuere aptent risus primis augue ut pel-"
317.01,166.21,561.84,175.06,"/F8",9.96,"lentesque sociis mauris. Natoque lacus. Blandit etiam."
317.01,154.26,561.84,163.10,"/F8",9.96,"Blandit lorem quam hendrerit pharetra dolor curabitur"
317.01,142.30,561.89,151.15,"/F8",9.96,"in. Rhoncus augue amet lorem praesent pede mattis ad"
317.01,130.35,561.82,139.19,"/F8",9.96,"quis pharetra libero dictum. Aliquet purus mi neque ut"
317.01,118.39,506.90,127.24,"/F8",9.96,"vitae enim gravida mi odio. Euismod vitae."
