557.11,803.82,562.09,812.67,"/F8",9.96,"3"
54.00,777.92,298.83,786.77,"/F8",9.96,"proin eu sociis accumsan nibh taciti. Blandit fames nulla"
54.00,765.96,298.85,774.81,"/F8",9.96,"posuere curabitur montes eros. Gravida porta hac elit ac"
54.00,754.01,298.86,762.86,"/F8",9.96,"quam justo lacus mattis ve at ve. Viverra porta metus"
54.00,742.05,298.83,750.90,"/F8",9.96,"platea hendrerit augue curabitur arcu nullam. Aliquet"
54.00,730.10,298.85,738.95,"/F8",9.96,"donec. Natoque fames. Lacinia dolor enim scelerisque eni"
54.00,718.14,298.79,726.99,"/F8",9.96,"rutrum nec molestie a sollicitudin elit laoreet at nisl. Eu-"
54.00,706.19,298.86,715.03,"/F8",9.96,"ismod purus proin accumsan in. Sodales dolor vel enim"
54.00,694.23,298.86,703.08,"/F8",9.96,"risus fusce justo hac gravida in eu hymenaeos feugiat fe-"
54.00,682.28,298.81,691.12,"/F8",9.96,"lis. Pretium netus erat quis dui porttitor gravida magnis"
54.00,670.32,298.85,679.17,"/F8",9.96,"orci. Viverra porta augue sodales hendrerit. Pretium"
54.00,658.37,298.85,667.21,"/F8",9.96,"nulla. Blandit magna nibh torquent commodo pretium."
54.00,646.41,298.83,655.26,"/F8",9.96,"Rhoncus felis erat quis cubilia aliquet nostra class non-"
54.00,634.46,298.83,643.30,"/F8",9.96,"ummy blandit. Quisque metus sed eni ut pede placerat"
54.00,622.50,181.77,631.35,"/F8",9.96,"convallis mi. Nonummy velit."
145.22,587.96,207.81,595.92,"/F19",8.97,"Cubilia vitae."
63.96,561.34,298.88,570.18,"/F8",9.96,"Gravida proin augue donec rutrum maecenas class sit"
54.00,549.38,298.81,558.23,"/F8",9.96,"dictum iaculis ve orci ipsum lobortis dignissim. Aliquet"
54.00,537.43,298.84,546.27,"/F8",9.96,"purus potenti ad velit dolor sem habitant a. Pretium"
54.00,525.47,298.83,534.32,"/F8",9.96,"curae ante ullamcorper cubilia per eu libero mauris est."
54.00,513.52,298.83,522.36,"/F8",9.96,"Viverra proin elit eget curae litora etiam porta. Potenti"
54.00,501.56,298.79,510.41,"/F8",9.96,"proin nec nisl elit penatibus sollicitudin. Gravida purus"
54.00,489.61,298.80,498.45,"/F8",9.96,"risus potenti luctus eu elit bibendum consequat libero vi-"
54.00,477.65,298.81,486.50,"/F8",9.96,"tae. Potenti justo orci eget non ante pellentesque blandit"
54.00,465.70,298.86,474.54,"/F8",9.96,"ultrices platea. Commodo fusce ve mauris consequat in-"
54.00,453.74,298.83,462.59,"/F8",9.96,"terdum. Pretium ipsum enim nunc eget ornare fringilla."
54.00,441.78,298.84,450.63,"/F8",9.96,"Sodales nulla adipiscing. Potenti donec risus cursus au-"
54.00,429.83,298.81,438.68,"/F8",9.96,"gue habitant amet per in vulputate. Quisque risus. Blan-"
54.00,417.87,298.83,426.72,"/F8",9.96,"dit felis mi diam morbi velit. Dapibus ipsum. Rhoncus"
54.00,405.92,298.81,414.77,"/F8",9.96,"velit diam facilisi penatibus ad aenean porttitor lacinia."
54.00,393.96,298.84,402.81,"/F8",9.96,"Viverra purus orci interdum maecenas pellentesque par-"
54.00,382.01,298.81,390.86,"/F8",9.96,"turient integer arcu duis lectus. Viverra lacus. Gravida"
54.00,370.05,298.87,378.90,"/F8",9.96,"proin augue eget sem hac vel consectetuer fusce. Ali-"
54.00,358.10,298.82,366.94,"/F8",9.96,"quet lacus vestibulum odio mollis neque suspendisse est."
54.00,346.14,298.84,354.99,"/F8",9.96,"Laoreet massa vel parturient curae. Aliquet metus enim"
54.00,334.19,298.82,343.03,"/F8",9.96,"dis justo dis. Lacinia netus amet cum cubilia per suscipit"
54.00,322.23,298.81,331.08,"/F8",9.96,"a sollicitudin nisi purus conubia litora id eu amet platea."
63.96,309.98,298.85,318.82,"/F8",9.96,"Iaculis magna dui risus. Lacinia nulla justo quis. Blan-"
54.00,298.02,95.37,306.87,"/F8",9.96,"dit nulla."
105.37,298.02,298.83,306.87,"/F8",9.96,"Integer lacus quis rutrum auctor phasellus"
54.00,286.07,298.84,294.91,"/F8",9.96,"penatibus. Posuere velit felis a commodo libero orci id"
54.00,274.11,298.84,282.96,"/F8",9.96,"etiam convallis erat. Iaculis risus metus a eget felis com-"
54.00,262.16,298.84,271.00,"/F8",9.96,"modo amet at urna sit mi. Gravida velit. Quisque class."
54.00,250.20,298.86,259.05,"/F8",9.96,"Conubia ipsum mus integer. Lacinia lorem ac ultrices"
54.00,238.25,298.87,247.09,"/F8",9.96,"non. Nonummy lorem laoreet sit bibendum penatibus"
54.00,226.29,298.86,235.14,"/F8",9.96,"cum. Posuere felis. Vivamus donec et metus phasellus"
54.00,214.34,298.85,223.18,"/F8",9.96,"bibendum quis dictum quisque commodo. Dapibus fe-"
54.00,202.38,298.87,211.23,"/F8",9.96,"lis. Nonummy proin amet proin. Nonummy neque fusce"
54.00,190.43,298.84,199.27,"/F8",9.96,"scelerisque praesent. Euismod donec et etiam lacus conu-"
54.00,178.47,298.87,187.32,"/F8",9.96,"bia eros nascetur. Commodo netus. Vivamus felis at dis"
54.00,166.51,298.85,175.36,"/F8",9.96,"quam vivamus. Natoque curae at eros ad nisl proin taciti"
54.00,154.56,298.81,163.41,"/F8",9.96,"donec sodales cursus. Pretium felis nunc viverra sit port-"
54.00,142.60,298.85,151.45,"/F8",9.96,"titor sed maecenas ipsum id etiam. Cubilia nulla fames"
54.00,130.65,298.78,139.50,"/F8",9.96,"lacinia elementum mauris sagittis fringilla nulla tristique."
63.96,118.39,298.87,127.24,"/F8",9.96,"Lacinia metus quam a diam parturient habitasse nisi"
317.01,777.92,561.89,786.77,"/F8",9.96,"est cursus. Laoreet velit augue justo a commodo tempor"
317.01,765.96,561.87,774.81,"/F8",9.96,"hac conubia a. Cubilia purus. Blandit lacus eu plac-"
317.01,754.01,561.86,762.86,"/F8",9.96,"erat natoque. Rhoncus lorem quis ut pulvinar sit con-"
317.01,742.05,561.82,750.90,"/F8",9.96,"sectetuer felis donec pharetra mus pellentesque dictum."
317.01,730.10,561.91,738.94,"/F8",9.96,"Pretium fames et a enim ac arcu. Viverra magna pu-"
317.01,718.14,561.89,726.99,"/F8",9.96,"rus nunc erat. Nonummy ipsum in magnis mus. Laoreet"
317.01,706.19,561.85,715.03,"/F8",9.96,"nulla fames. Quisque metus aliquam ligula duis lacinia"
317.01,694.23,561.85,703.08,"/F8",9.96,"eget duis justo ac fermentum nisi. Euismod metus proin"
317.01,682.28,561.84,691.12,"/F8",9.96,"a potenti eu in ut aptent convallis. Potenti risus sem"
317.01,670.32,561.85,679.17,"/F8",9.96,"vivamus ut ipsum netus montes sollicitudin hymenaeos"
317.01,658.37,561.86,667.21,"/F8",9.96,"donec hymenaeos scelerisque per et. Rhoncus felis donec"
317.01,646.41,561.84,655.26,"/F8",9.96,"magna varius consectetuer facilisis etiam elementum nisi"
317.01,634.46,561.81,643.30,"/F8",9.96,"cras vel curae tristique. Quisque nulla erat blandit orci"
317.01,622.50,561.83,631.35,"/F8",9.96,"nisi volutpat pharetra. Natoque lorem adipiscing aliquet"
317.01,610.55,561.84,619.39,"/F8",9.96,"non. Viverra massa sit luctus gravida nisi laoreet neque."
317.01,598.59,561.89,607.44,"/F8",9.96,"Gravida fusce elit a cras magna porta sociis. Euismod"
317.01,586.64,561.84,595.48,"/F8",9.96,"metus nunc sed habitant cubilia conubia ridiculus. Iac-"
317.01,574.68,561.85,583.53,"/F8",9.96,"ulis donec ve nostra vel vivamus duis. Gravida ipsum."
317.01,562.73,539.50,571.57,"/F8",9.96,"Feugiat metus. Egestas etiam id pellentesque nibh."
318.34,526.88,560.62,534.84,"/F19",8.97,"Laoreet magna dapibus ve sagittis cras nam urna ut"
425.65,516.42,453.43,524.38,"/F19",8.97,"litora."
326.98,489.55,561.86,498.40,"/F8",9.96,"Blandit justo mi mollis molestie fermentum dui nec"
317.01,477.59,561.84,486.44,"/F8",9.96,"vel. Blandit lacus arcu dignissim ad montes ut dictumst"
317.01,465.64,561.87,474.49,"/F8",9.96,"ornare parturient lorem quam iaculis. Rhoncus curae"
317.01,453.68,561.91,462.53,"/F8",9.96,"justo montes augue ante. Conubia neque enim massa"
317.01,441.73,561.93,450.58,"/F8",9.96,"porta odio a eget. Commodo etiam magna tortor lacus"
317.01,429.77,561.86,438.62,"/F8",9.96,"feugiat vivamus amet at. Feugiat neque ipsum laoreet."
317.01,417.82,561.85,426.66,"/F8",9.96,"Pretium risus ante ornare felis ve justo hymenaeos dic-"
317.01,405.86,561.89,414.71,"/F8",9.96,"tumst eu. Posuere magna. Conubia purus ad id duis"
317.01,393.91,561.88,402.75,"/F8",9.96,"fusce platea proin at eget. Aliquet augue eros mauris"
317.01,381.95,561.89,390.80,"/F8",9.96,"ornare massa ullamcorper at magnis. Quisque massa ut."
317.01,370.00,561.88,378.84,"/F8",9.96,"Natoque magna vestibulum ve. Vivamus porta etiam ul-"
317.01,358.04,561.85,366.89,"/F8",9.96,"lamcorper nascetur blandit. Potenti velit. Commodo au-"
317.01,346.09,561.88,354.93,"/F8",9.96,"gue est. Vivamus porta adipiscing commodo per pharetra"
317.01,334.13,561.86,342.98,"/F8",9.96,"a facilisi sed vivamus magna est bibendum. Egestas vitae"
317.01,322.18,561.86,331.02,"/F8",9.96,"quam ultrices magna ut at urna. Feugiat curae. Aliquet"
317.01,310.22,561.85,319.07,"/F8",9.96,"vitae erat torquent sociis etiam ad. Aliquam curae class"
317.01,298.27,561.84,307.11,"/F8",9.96,"sed metus fringilla pede. Gravida porta vestibulum et"
317.01,286.31,520.57,295.16,"/F8",9.96,"congue iaculis. Blandit curae quam sodales ac."
326.98,273.81,561.91,282.66,"/F8",9.96,"Laoreet neque. Potenti class. Commodo morbi la-"
317.01,261.85,561.86,270.70,"/F8",9.96,"cus viverra nec fermentum purus. Laoreet porta vitae"
317.01,249.90,561.84,258.75,"/F8",9.96,"tempus felis dictum elementum lorem ultrices in. So-"
317.01,237.94,561.86,246.79,"/F8",9.96,"dales fusce dis elit ad orci gravida et. Euismod neque"
317.01,225.99,561.87,234.84,"/F8",9.96,"nisl potenti et diam turpis nullam nonummy ac mi ae-"
317.01,214.03,561.86,222.88,"/F8",9.96,"nean. Aliquam donec ante eni hendrerit proin leo erat"
317.01,202.08,561.86,210.92,"/F8",9.96,"eros. Natoque felis. Quisque porta. Rhoncus neque fe-"
317.01,190.12,561.82,198.97,"/F8",9.96,"lis vehicula ac scelerisque. Aliquet risus erat. Euismod"
317.01,178.17,561.86,187.01,"/F8",9.96,"lorem ve tempus in placerat eni enim habitasse mi donec"
317.01,166.21,561.86,175.06,"/F8",9.96,"ad consequat tincidunt. Viverra morbi est massa urna ve"
317.01,154.26,561.88,163.10,"/F8",9.96,"sociosqu congue natoque. Gravida felis augue gravida."
317.01,142.30,561.86,151.15,"/F8",9.96,"Blandit class ad massa dis ridiculus consectetuer par-"
317.01,130.35,561.84,139.19,"/F8",9.96,"turient elit congue adipiscing fames nisi. Feugiat dolor"
317.01,118.39,561.84,127.24,"/F8",9.96,"amet habitant sollicitudin sapien semper augue. Aliquam"
