52.56,748.78,288.49,757.62,"/F8",9.96,"Laoreet curae odio diam ipsum. Conubia lorem donec"
37.61,736.82,288.45,745.67,"/F8",9.96,"sem tempus mi nam ut curae hac aliquet. Viverra porta eu"
37.61,724.87,288.42,733.71,"/F8",9.96,"dolor ad congue in metus phasellus dignissim duis potenti."
37.61,712.91,288.44,721.76,"/F8",9.96,"Iaculis morbi quam. Blandit felis nisi malesuada morbi"
37.61,700.96,288.42,709.80,"/F8",9.96,"enim magna quisque cum interdum a sollicitudin. Conubia"
37.61,689.00,288.40,697.85,"/F8",9.96,"proin eros facilisi pellentesque sociis porta vulputate mo-"
37.61,677.04,288.42,685.89,"/F8",9.96,"lestie augue egestas dapibus elit in. Rhoncus vitae pede."
37.61,665.09,288.40,673.94,"/F8",9.96,"Potenti nulla. Potenti purus. Vivamus nulla urna vivamus"
37.61,653.13,288.41,661.98,"/F8",9.96,"congue ac duis felis. Gravida etiam nunc iaculis venenatis."
37.61,641.18,288.43,650.03,"/F8",9.96,"Vivamus vitae vestibulum suspendisse tempor. Vivamus"
37.61,629.22,288.46,638.07,"/F8",9.96,"magna ante ve eros dui quis. Sodales lacus nisi conubia"
37.61,617.27,288.41,626.11,"/F8",9.96,"a lectus venenatis curabitur diam nec quis ut consequat."
37.61,605.31,288.44,614.16,"/F8",9.96,"Vivamus class nec quis mauris curae vestibulum condi-"
37.61,593.36,288.49,602.20,"/F8",9.96,"mentum. Natoque augue eget. Commodo purus ad donec"
37.61,581.40,288.41,590.25,"/F8",9.96,"cursus phasellus inceptos vitae sociis suscipit quam eges-"
37.61,569.45,288.48,578.29,"/F8",9.96,"tas amet. Conubia magna augue. Potenti magna. Viverra"
37.61,557.49,288.44,566.34,"/F8",9.96,"curae. Rhoncus purus nisl ad consectetuer ornare proin"
37.61,545.54,165.21,554.38,"/F8",9.96,"netus odio. Nonummy purus."
37.61,517.14,138.45,525.99,"/F17",9.96,"3. Commodo etiam."
52.56,497.72,288.45,506.56,"/F8",9.96,"Laoreet velit felis condimentum senectus enim com-"
37.61,485.76,288.43,494.61,"/F8",9.96,"modo netus. Iaculis donec sit aliquet. Iaculis fusce vel"
37.61,473.81,288.41,482.65,"/F8",9.96,"pharetra. Blandit felis integer. Pretium augue eros etiam"
37.61,461.85,289.51,470.70,"/F8",9.96,"per proin. Laoreet class diam bibendum curae lorem biben-"
37.61,449.90,288.45,458.74,"/F8",9.96,"dum consequat. Blandit fusce vel. Vivamus class non-"
37.61,437.94,288.43,446.79,"/F8",9.96,"ummy iaculis odio nisi parturient. Nonummy metus adip-"
37.61,425.99,288.43,434.83,"/F8",9.96,"iscing quam nullam turpis felis accumsan eu morbi sociis"
37.61,414.03,288.44,422.88,"/F8",9.96,"mus. Egestas nulla lorem sapien suscipit hymenaeos lorem"
37.61,402.08,288.45,410.92,"/F8",9.96,"facilisis. Euismod fusce laoreet egestas malesuada eros ae-"
37.61,390.12,288.43,398.97,"/F8",9.96,"nean mauris augue penatibus scelerisque donec sociis adip-"
37.61,378.17,288.43,387.01,"/F8",9.96,"iscing facilisi. Integer risus eni quam arcu posuere a mau-"
37.61,366.21,288.43,375.06,"/F8",9.96,"ris odio eu sed. Cubilia lorem metus ornare nulla lobortis"
37.61,354.26,288.43,363.10,"/F8",9.96,"amet platea taciti dolor suscipit fames id auctor. Conubia"
37.61,342.30,288.41,351.15,"/F8",9.96,"etiam mi sed id. Feugiat justo mi sapien facilisi etiam arcu"
37.61,330.34,288.43,339.19,"/F8",9.96,"interdum condimentum per erat eget. Rhoncus purus nunc"
37.61,318.39,288.47,327.24,"/F8",9.96,"a donec in. Lacinia fames eros condimentum feugiat sus-"
37.61,306.43,288.42,315.28,"/F8",9.96,"pendisse amet imperdiet in condimentum. Gravida etiam"
37.61,294.48,288.40,303.33,"/F8",9.96,"nisi tempor dis in a erat vestibulum amet nostra ultricies"
37.61,282.52,288.41,291.37,"/F8",9.96,"eu. Aliquet velit. Aliquet metus. Quisque curae nam"
37.61,270.57,288.45,279.42,"/F8",9.96,"massa orci nam porta mattis platea lacinia potenti mauris"
37.61,258.61,288.45,267.46,"/F8",9.96,"lacus tellus. Integer lacus massa nam cras fringilla cum"
37.61,246.66,88.01,255.51,"/F8",9.96,"rhoncus ad."
52.56,234.70,288.48,243.55,"/F8",9.96,"Natoque class duis scelerisque ad. Euismod magna"
37.61,222.75,288.41,231.60,"/F8",9.96,"adipiscing eu venenatis. Posuere justo curae vel turpis."
37.61,210.79,288.45,219.64,"/F8",9.96,"Vivamus donec morbi mollis arcu posuere nibh cras penat-"
37.61,198.84,288.40,207.68,"/F8",9.96,"ibus. Egestas velit etiam taciti platea venenatis. Laoreet"
37.61,186.88,288.41,195.73,"/F8",9.96,"nulla diam quis duis. Potenti velit. Gravida donec fe-"
37.61,174.93,288.45,183.77,"/F8",9.96,"lis suspendisse ac sapien magna mi elementum dolor id."
37.61,162.97,288.46,171.82,"/F8",9.96,"Rhoncus dolor pede nullam nisl tortor aenean. Natoque"
37.61,151.02,288.41,159.86,"/F8",9.96,"lorem eu pulvinar duis natoque class eu ipsum dolor tellus."
37.61,139.06,288.40,147.91,"/F8",9.96,"Blandit class id curae scelerisque in libero neque. Viverra"
37.61,127.11,288.44,135.95,"/F8",9.96,"neque. Cubilia lacus. Posuere vitae quam. Conubia fames"
37.61,115.15,288.44,124.00,"/F8",9.96,"adipiscing ullamcorper nostra et eu amet mi magna litora."
37.61,103.20,288.46,112.04,"/F8",9.96,"Iaculis lorem ut nostra gravida at. Laoreet neque diam"
37.61,91.24,288.42,100.09,"/F8",9.96,"amet urna nibh in etiam quis mauris habitasse et id. Viva-"
37.61,79.29,288.44,88.13,"/F8",9.96,"mus risus aliquam magna amet quisque leo. Dapibus purus"
306.60,748.78,557.40,757.62,"/F8",9.96,"eget praesent tellus adipiscing curae natoque litora fusce"
306.60,736.82,557.40,745.67,"/F8",9.96,"potenti tempor hendrerit vestibulum dis augue. Viverra"
306.60,724.87,557.42,733.71,"/F8",9.96,"lacus amet justo nisi senectus natoque vitae posuere fer-"
306.60,712.91,522.30,721.76,"/F8",9.96,"mentum vehicula. Integer purus. Rhoncus morbi."
306.60,689.00,408.88,697.85,"/F27",9.96,"3.1. Iaculis ipsum eget."
321.55,674.06,557.43,682.90,"/F8",9.96,"Cubilia augue urna dui pretium. Viverra curae posuere"
306.60,662.10,557.47,670.95,"/F8",9.96,"nam et odio magnis. Viverra netus. Natoque magna vi-"
306.60,650.15,557.39,658.99,"/F8",9.96,"tae netus justo nisl imperdiet dictum adipiscing. Sodales"
306.60,638.19,557.46,647.04,"/F8",9.96,"curae mi fringilla et. Posuere magna. Conubia massa et"
306.60,626.23,557.42,635.08,"/F8",9.96,"curabitur a massa in fringilla. Integer class nunc sem in-"
306.60,614.28,557.43,623.13,"/F8",9.96,"teger ut cursus. Iaculis porta mi. Sodales purus nulla"
306.60,602.32,557.48,611.17,"/F8",9.96,"tortor ullamcorper massa montes. Commodo lacus urna"
306.60,590.37,557.39,599.22,"/F8",9.96,"leo eros per nisl enim ipsum aliquet phasellus tellus. Feu-"
306.60,578.41,557.44,587.26,"/F8",9.96,"giat donec etiam fusce ante cum erat. Laoreet lorem nisi"
306.60,566.46,557.40,575.31,"/F8",9.96,"metus luctus nibh. Pretium fames porta taciti elementum"
306.60,554.50,557.46,563.35,"/F8",9.96,"potenti nam ac a. Laoreet purus. Vivamus class erat ac-"
306.60,542.55,557.43,551.39,"/F8",9.96,"cumsan consectetuer auctor ad ligula lobortis. Aliquam"
306.60,530.59,557.36,539.44,"/F8",9.96,"vitae parturient potenti dis porttitor. Dapibus fusce at id"
306.60,518.64,557.42,527.48,"/F8",9.96,"erat. Natoque purus dis. Pretium metus proin. Egestas"
306.60,506.68,557.38,515.53,"/F8",9.96,"curae elit eni mollis a sagittis nisi leo mi dolor fringilla in."
306.60,494.73,378.50,503.57,"/F8",9.96,"Commodo vitae."
321.55,482.77,557.45,491.62,"/F8",9.96,"Natoque augue. Potenti fusce fames mollis ut aptent"
306.60,470.82,557.41,479.66,"/F8",9.96,"commodo phasellus. Aliquet felis dui eget ac pellentesque"
306.60,458.86,557.79,467.71,"/F8",9.96,"sollicitudin pretium platea ut interdum tellus sapien neque."
306.60,446.91,558.40,455.75,"/F8",9.96,"Natoque fames sed volutpat lacinia. Gravida morbi. Rhon-"
306.60,434.95,557.40,443.80,"/F8",9.96,"cus felis. Integer felis ve dictum ultrices hac lacinia eu"
306.60,423.00,557.45,431.84,"/F8",9.96,"id odio lacus sodales consequat nisl suspendisse commodo"
306.60,411.04,557.48,419.89,"/F8",9.96,"porta. Nonummy dolor. Conubia metus. Nonummy do-"
306.60,399.09,557.40,407.93,"/F8",9.96,"lor duis pretium et ut sociis pellentesque sodales. Feu-"
306.60,387.13,557.41,395.98,"/F8",9.96,"giat velit urna fusce duis platea rhoncus cum parturient"
306.60,375.18,557.36,384.02,"/F8",9.96,"vestibulum ut sollicitudin vivamus aptent. Blandit class."
306.60,363.22,557.41,372.07,"/F8",9.96,"Integer donec vitae scelerisque volutpat morbi. Vivamus"
306.60,351.27,557.43,360.11,"/F8",9.96,"fusce ac a eget ac metus. Lacinia dolor cum est sollicitudin"
306.60,339.31,557.42,348.16,"/F8",9.96,"etiam. Aliquet purus fusce torquent ac class ornare con-"
306.60,327.36,557.37,336.20,"/F8",9.96,"sectetuer curabitur proin. Blandit ipsum. Quisque porta."
306.60,315.40,557.45,324.25,"/F8",9.96,"Natoque vitae nulla volutpat amet rutrum ac hac amet"
306.60,303.45,557.44,312.29,"/F8",9.96,"egestas eni molestie metus bibendum. Nonummy vitae."
306.60,291.49,557.47,300.34,"/F8",9.96,"Vivamus class duis nonummy risus nam enim donec na-"
306.60,279.53,481.17,288.38,"/F8",9.96,"toque ad torquent. Aliquam neque cras."
306.60,255.62,420.95,264.47,"/F27",9.96,"3.2. Euismod nulla etiam."
321.55,240.68,557.40,249.53,"/F8",9.96,"Aliquet curae sed nunc id fames sollicitudin. Aliquet"
306.60,228.73,557.46,237.57,"/F8",9.96,"neque. Laoreet lorem. Conubia magna in elit sociosqu"
306.60,216.77,557.40,225.62,"/F8",9.96,"eu luctus id. Posuere velit. Quisque class eni amet cras"
306.60,204.82,557.43,213.66,"/F8",9.96,"velit aliquam congue ac nascetur. Sodales curae nibh. Po-"
306.60,192.86,557.40,201.71,"/F8",9.96,"tenti netus donec nullam tristique nostra. Dapibus massa"
306.60,180.90,557.43,189.75,"/F8",9.96,"quis arcu posuere mollis. Laoreet metus. Posuere fames."
306.60,168.95,557.40,177.80,"/F8",9.96,"Pretium netus diam in consectetuer sociis fusce. Dapibus"
306.60,156.99,557.71,165.84,"/F8",9.96,"lacus nisi rutrum consequat donec pede semper eni vestibu-"
306.60,145.04,557.42,153.89,"/F8",9.96,"lum. Cubilia proin eros a cras ipsum sodales libero. Iaculis"
306.60,133.08,557.44,141.93,"/F8",9.96,"magna orci ligula ad libero felis. Viverra fames ante dui"
306.60,121.13,557.43,129.98,"/F8",9.96,"nam. Sodales etiam. Blandit purus dui enim arcu vitae"
306.60,109.17,557.44,118.02,"/F8",9.96,"sapien tempus massa scelerisque. Feugiat curae ve con-"
306.60,97.22,557.39,106.07,"/F8",9.96,"vallis. Natoque velit et a libero consequat iaculis sit at."
306.60,85.26,557.41,94.11,"/F8",9.96,"Dapibus morbi eget feugiat ve iaculis nibh. Egestas morbi"
295.15,61.35,300.13,70.20,"/F8",9.96,"4"
