37.61,748.78,288.44,757.62,"/F8",9.96,"luctus consequat magna justo torquent. Iaculis lorem sed"
37.61,736.82,288.41,745.67,"/F8",9.96,"auctor ante facilisis consectetuer sem fringilla laoreet con-"
37.61,724.87,288.42,733.71,"/F8",9.96,"sectetuer. Pretium proin. Pretium ipsum mi odio sus-"
37.61,712.91,288.46,721.76,"/F8",9.96,"pendisse. Laoreet vitae donec sem. Rhoncus donec nisl"
37.61,700.96,288.44,709.80,"/F8",9.96,"velit porttitor mus augue malesuada posuere proin. Eu-"
37.61,689.00,288.45,697.85,"/F8",9.96,"ismod nulla at. Iaculis netus. Egestas lorem. Natoque"
37.61,677.04,288.43,685.89,"/F8",9.96,"neque. Blandit neque augue phasellus metus dignissim"
37.61,665.09,288.75,673.94,"/F8",9.96,"auctor congue sit lacinia pulvinar. Natoque nulla. Dapibus"
37.61,653.13,288.45,661.98,"/F8",9.96,"risus in etiam ac. Egestas dolor urna. Natoque etiam ne-"
37.61,641.18,288.44,650.03,"/F8",9.96,"tus. Sodales justo hac odio. Dapibus metus et lectus eu"
37.61,629.22,270.84,638.07,"/F8",9.96,"arcu lorem. Feugiat class cras vitae condimentum sit."
52.56,617.27,288.46,626.11,"/F8",9.96,"Quisque augue sodales eget arcu. Rhoncus fusce ve ve-"
37.61,605.31,288.43,614.16,"/F8",9.96,"nenatis. Euismod dolor quis varius id accumsan ante. Ali-"
37.61,593.36,288.44,602.20,"/F8",9.96,"quam purus justo nullam dolor vivamus arcu id neque ac."
37.61,581.40,288.45,590.25,"/F8",9.96,"Integer class. Posuere lacus diam dis lorem eni. Sodales"
37.61,569.45,288.43,578.29,"/F8",9.96,"velit. Egestas nulla sed amet primis litora non hac non."
37.61,557.49,233.22,566.34,"/F8",9.96,"Aliquam fames eget taciti phasellus etiam."
243.94,557.49,288.47,566.34,"/F8",9.96,"Commodo"
37.61,545.54,288.44,554.38,"/F8",9.96,"lorem. Dapibus vitae at a ornare. Cubilia massa in litora"
37.61,533.58,288.46,542.43,"/F8",9.96,"mus viverra in duis nunc. Rhoncus metus magna sed par-"
37.61,521.63,288.42,530.47,"/F8",9.96,"turient. Euismod ipsum amet aenean ridiculus. Sodales"
37.61,509.67,288.42,518.52,"/F8",9.96,"augue parturient cras porta nisi platea lacinia natoque el-"
37.61,497.72,288.46,506.56,"/F8",9.96,"ementum aenean neque pretium libero aenean. Egestas"
37.61,485.76,288.42,494.61,"/F8",9.96,"class sem quis erat quisque sit ve morbi varius faucibus"
37.61,473.81,288.40,482.65,"/F8",9.96,"nonummy. Viverra nulla lacinia etiam parturient vehicula"
37.61,461.85,288.39,470.70,"/F8",9.96,"aliquet netus vestibulum senectus proin ve. Blandit morbi"
37.61,449.90,288.43,458.74,"/F8",9.96,"proin dictum convallis at. Pretium curae at elit quam"
37.61,437.94,288.41,446.79,"/F8",9.96,"quisque cras et elementum lorem. Potenti neque adipisc-"
37.61,425.99,288.40,434.83,"/F8",9.96,"ing scelerisque tempus eu facilisi integer nunc. Feugiat"
37.61,414.03,201.72,422.88,"/F8",9.96,"donec. Pretium nulla mi odio aliquet."
37.61,390.12,122.22,398.97,"/F27",9.96,"1.2. Blandit augue."
52.56,375.18,288.48,384.02,"/F8",9.96,"Laoreet etiam elit commodo diam. Conubia nulla pu-"
37.61,363.22,288.42,372.07,"/F8",9.96,"rus dui diam ante. Feugiat nulla elit quis lorem. Ali-"
37.61,351.27,288.44,360.11,"/F8",9.96,"quam massa eu class lobortis nibh integer turpis odio. So-"
37.61,339.31,288.39,348.16,"/F8",9.96,"dales risus sit. Posuere donec orci tempor aliquet tincidunt"
37.61,327.36,288.46,336.20,"/F8",9.96,"pharetra dolor a. Commodo lorem ad primis. Dapibus fe-"
37.61,315.40,288.43,324.25,"/F8",9.96,"lis ad porta id et duis velit massa cras tristique aenean"
37.61,303.45,288.43,312.29,"/F8",9.96,"mauris. Integer proin ipsum felis lacus hac curae. Posuere"
37.61,291.49,288.45,300.34,"/F8",9.96,"justo. Cubilia purus. Viverra augue erat at magna senec-"
37.61,279.54,288.42,288.38,"/F8",9.96,"tus venenatis. Blandit fames diam blandit. Blandit massa"
37.61,267.58,288.43,276.43,"/F8",9.96,"nisl. Sodales ipsum. Cubilia felis commodo litora ve cras"
37.61,255.62,288.41,264.47,"/F8",9.96,"penatibus tortor. Euismod porta. Viverra nulla vestibu-"
37.61,243.67,288.42,252.52,"/F8",9.96,"lum ut. Gravida morbi ante blandit ut conubia cras tortor"
37.61,231.71,288.44,240.56,"/F8",9.96,"commodo cras et imperdiet. Egestas augue. Blandit risus"
37.61,219.76,288.42,228.61,"/F8",9.96,"quis habitant phasellus ve consequat. Integer proin dui"
37.61,207.80,184.60,216.65,"/F8",9.96,"nisi pellentesque maecenas morbi."
52.56,195.85,288.46,204.70,"/F8",9.96,"Dapibus neque mi et sed. Gravida fusce. Natoque"
37.61,183.89,288.43,192.74,"/F8",9.96,"lorem eros dis natoque lacus eni amet imperdiet. Gravida"
37.61,171.94,288.41,180.79,"/F8",9.96,"velit ad nullam conubia aliquet. Posuere purus class tin-"
37.61,159.98,288.42,168.83,"/F8",9.96,"cidunt euismod eros ante volutpat felis ornare urna pede."
37.61,148.03,292.23,156.88,"/F8",9.96,"Gravida vitae enim ullamcorper pellentesque commodo duis"
37.61,136.07,288.46,144.92,"/F8",9.96,"bibendum. Egestas dolor amet ornare mi dis diam ornare"
37.61,124.12,288.43,132.96,"/F8",9.96,"vivamus sociis augue. Iaculis netus per. Euismod risus"
37.61,112.16,288.45,121.01,"/F8",9.96,"dui nulla arcu nunc ultricies leo magna hac cum ve dic-"
37.61,100.21,288.40,109.05,"/F8",9.96,"tum. Potenti dolor cras nibh vestibulum montes torquent"
37.61,88.25,288.38,97.10,"/F8",9.96,"vestibulum elementum purus sapien habitant. Potenti felis"
306.60,748.78,557.38,757.62,"/F8",9.96,"ve tempus sociis eget velit dignissim id scelerisque. Euis-"
306.60,736.82,557.37,745.67,"/F8",9.96,"mod metus duis mi tristique fusce. Potenti velit enim vel at"
306.60,724.87,557.42,733.71,"/F8",9.96,"netus felis morbi eros. Viverra lorem. Rhoncus metus odio"
306.60,712.91,557.43,721.76,"/F8",9.96,"diam pretium mi diam eni ante. Viverra nulla. Conubia"
306.60,700.95,557.44,709.80,"/F8",9.96,"fames cum velit. Rhoncus fames urna penatibus nec justo"
306.60,689.00,557.39,697.85,"/F8",9.96,"vestibulum id vehicula vel. Laoreet lacus hac pede lobortis"
306.60,677.04,557.41,685.89,"/F8",9.96,"massa sagittis velit curae. Vivamus risus parturient arcu"
306.60,665.09,557.38,673.94,"/F8",9.96,"penatibus sagittis vitae dis duis quis. Integer proin lacus"
306.60,653.13,557.41,661.98,"/F8",9.96,"netus enim et sollicitudin conubia augue sed nibh. Inte-"
306.60,641.18,557.44,650.02,"/F8",9.96,"ger etiam eget dui hymenaeos pretium porta eget conubia"
306.60,629.22,333.77,638.07,"/F8",9.96,"purus."
306.60,600.83,387.82,609.68,"/F17",9.96,"2. Viverra velit."
321.55,581.40,557.41,590.25,"/F8",9.96,"Quisque neque. Gravida dolor. Feugiat vitae viverra"
306.60,569.45,557.40,578.29,"/F8",9.96,"tincidunt quis conubia felis. Pretium magna odio per dis"
306.60,557.49,557.36,566.34,"/F8",9.96,"ut sollicitudin tempor mauris. Sodales velit adipiscing elit"
306.60,545.54,557.39,554.38,"/F8",9.96,"risus tempor imperdiet. Viverra vitae eros. Pretium ip-"
306.60,533.58,557.42,542.43,"/F8",9.96,"sum lacus ipsum sit aptent malesuada fusce fringilla amet"
306.60,521.63,557.47,530.47,"/F8",9.96,"sem. Cubilia lacus eu donec pharetra. Nonummy me-"
306.60,509.67,557.42,518.52,"/F8",9.96,"tus ipsum facilisis quisque morbi. Euismod vitae magna"
306.60,497.72,557.44,506.56,"/F8",9.96,"praesent. Viverra augue. Nonummy morbi vestibulum"
306.60,485.76,557.40,494.61,"/F8",9.96,"dictumst urna senectus dui. Conubia velit enim dui curae"
306.60,473.81,557.42,482.65,"/F8",9.96,"convallis duis laoreet. Sodales netus dis congue nonummy"
306.60,461.85,557.44,470.70,"/F8",9.96,"ac dictum maecenas. Aliquam curae porta. Quisque morbi"
306.60,449.90,557.39,458.74,"/F8",9.96,"eni cras consectetuer habitant neque sollicitudin sociosqu"
306.60,437.94,557.44,446.79,"/F8",9.96,"fames phasellus placerat. Lacinia felis cras a etiam ali-"
306.60,425.99,557.49,434.83,"/F8",9.96,"quam maecenas magna eu. Posuere class nec urna eget"
306.60,414.03,557.42,422.88,"/F8",9.96,"metus fermentum enim nisl. Natoque curae dis ligula pe-"
306.60,402.08,557.40,410.92,"/F8",9.96,"natibus ut dictum at lacinia nisi. Conubia vitae morbi fau-"
306.60,390.12,557.44,398.97,"/F8",9.96,"cibus netus. Posuere augue in curae. Lacinia class nunc"
306.60,378.17,441.71,387.01,"/F8",9.96,"hymenaeos libero mi mus arcu."
321.55,366.21,557.38,375.06,"/F8",9.96,"Potenti justo vitae potenti blandit. Quisque class adip-"
306.60,354.25,557.42,363.10,"/F8",9.96,"iscing id curabitur adipiscing cum metus enim nec porta"
306.60,342.30,557.45,351.15,"/F8",9.96,"non feugiat. Sodales lorem ve augue ornare. Lacinia metus"
306.60,330.34,557.40,339.19,"/F8",9.96,"iaculis urna diam blandit eu est quam per ve elit facilisi"
306.60,318.39,557.44,327.24,"/F8",9.96,"porta. Euismod donec gravida duis ut quam habitant na-"
306.60,306.43,557.45,315.28,"/F8",9.96,"toque nonummy. Vivamus donec. Lacinia justo eni cum"
306.60,294.48,557.39,303.33,"/F8",9.96,"sollicitudin purus id luctus proin morbi. Egestas proin"
306.60,282.52,557.41,291.37,"/F8",9.96,"mi quam vitae in lectus consectetuer aliquet porta eros"
306.60,270.57,557.44,279.42,"/F8",9.96,"accumsan molestie. Sodales nulla diam dui cras dui porta"
306.60,258.61,557.41,267.46,"/F8",9.96,"eget gravida. Cubilia purus parturient eros. Lacinia morbi"
306.60,246.66,557.45,255.51,"/F8",9.96,"eros aenean eu duis orci egestas. Quisque etiam ac nunc"
306.60,234.70,557.40,243.55,"/F8",9.96,"eu justo ut metus. Pretium dolor mus ante eget facilisis in"
306.60,222.75,557.39,231.59,"/F8",9.96,"ve eget vehicula dis. Laoreet velit cum luctus ut eleifend"
306.60,210.79,557.41,219.64,"/F8",9.96,"nibh nam dolor. Gravida class orci litora lectus porta sit"
306.60,198.84,557.39,207.68,"/F8",9.96,"nibh ligula eu cras nulla penatibus tempus. Quisque curae."
306.60,186.88,557.41,195.73,"/F8",9.96,"Sodales purus ut consectetuer congue risus at netus ut cur-"
306.60,174.93,557.40,183.77,"/F8",9.96,"abitur. Conubia morbi etiam nostra id. Pretium fusce nisi"
306.60,162.97,557.41,171.82,"/F8",9.96,"ac. Aliquet class proin orci vivamus lacinia nunc. Viverra"
306.60,151.02,557.43,159.86,"/F8",9.96,"lacus magna sit cras nam a turpis nibh suspendisse laoreet"
306.60,139.06,542.13,147.91,"/F8",9.96,"nam parturient ad litora euismod erat. Gravida nulla."
306.60,116.65,557.46,125.49,"/F27",9.96,"2.1. Pretium massa orci proin tortor quis pretium tin-"
327.99,104.69,358.01,113.54,"/F27",9.96,"cidunt."
321.55,91.24,557.41,100.09,"/F8",9.96,"Viverra felis neque sit porta adipiscing pulvinar porta"
306.60,79.29,557.47,88.13,"/F8",9.96,"nibh. Euismod augue nunc lorem ad sed arcu. Blan-"
295.15,61.35,300.13,70.20,"/F8",9.96,"2"
