154.47,777.53,461.47,788.15,"/F17",11.96,"Commodo neque vestibulum bibendum curae netus."
129.11,753.51,486.65,762.36,"/F8",9.96,"Kate Fazzino, Gary Cooksey, Ernest Laub, Sidney Sheller, and Parker Donaghy"
270.97,743.24,297.78,751.21,"/F18",8.97,"Munoz"
303.08,743.24,345.05,751.21,"/F18",8.97,"Aeronetics"
117.42,718.64,498.32,727.49,"/F8",9.96,"Julene Meares, Earl Marney, Norberto Sprow, Pearlene Royster, and Fabian Ravenell"
252.18,708.37,276.26,716.34,"/F18",8.97,"Crane"
281.39,708.37,312.09,716.34,"/F18",8.97,"Nuclear"
317.21,708.37,327.09,716.34,"/F18",8.97,"Of"
332.22,708.37,363.82,716.34,"/F18",8.97,"Toronto"
118.01,687.95,473.20,695.91,"/F15",8.97,"Egestas ipsum nec urna amet fermentum vitae in tellus imperdiet ultricies sollicitudin."
478.85,687.95,507.03,695.91,"/F15",8.97,"Integer"
108.79,677.49,507.06,685.45,"/F15",8.97,"netus dui vestibulum parturient ad pellentesque gravida mauris cum nam ultricies pellentesque"
108.79,667.03,507.04,674.99,"/F15",8.97,"adipiscing pede. Egestas neque non augue proin nonummy dui vestibulum vitae orci diam vel ve a"
108.79,656.57,507.05,664.53,"/F15",8.97,"eget. Aliquet curae sit nunc est dis vulputate. Dapibus proin ve metus eni nisl pellentesque quisque"
108.79,646.11,506.97,654.07,"/F15",8.97,"dictumst ut. Potenti metus velit per elit tincidunt. Sodales donec parturient placerat aliquam platea"
108.79,635.65,506.97,643.61,"/F15",8.97,"nunc laoreet lacus. Quisque class adipiscing nascetur quam eni enim arcu magna ac porta lobortis"
108.79,625.19,132.90,633.15,"/F15",8.97,"netus."
140.04,625.19,507.03,633.15,"/F15",8.97,"Commodo risus adipiscing mi luctus dapibus quisque orci urna tristique donec sed vitae"
108.79,614.73,507.01,622.69,"/F15",8.97,"ultricies parturient. Feugiat velit ad vel scelerisque nonummy velit. Euismod fusce nibh nostra ad"
108.79,604.26,506.99,612.23,"/F15",8.97,"inceptos libero aptent curae urna eget arcu habitant dui arcu. Aliquet ipsum hac amet mattis eros"
108.79,593.80,507.01,601.77,"/F15",8.97,"id odio. Pretium proin quis mattis egestas laoreet dignissim duis. Quisque morbi augue interdum"
108.79,583.34,507.04,591.31,"/F15",8.97,"ve scelerisque id ornare eu placerat pretium nonummy. Cubilia metus massa quam pulvinar eleifend"
108.79,572.88,507.00,580.84,"/F15",8.97,"felis convallis duis mauris molestie dui. Dapibus velit neque sociis quam posuere ve magnis ridiculus"
108.79,562.42,507.02,570.38,"/F15",8.97,"fermentum vestibulum. Aliquet morbi est elit praesent cum pretium suscipit eros eget quis. Potenti"
108.79,551.96,507.02,559.92,"/F15",8.97,"netus pede eu dolor ac libero mi libero. Aliquet lacus fames eget justo. Conubia risus diam proin"
108.79,541.50,507.01,549.46,"/F15",8.97,"in consectetuer iaculis suscipit quis venenatis etiam dui nunc. Quisque dolor id semper magna risus"
108.79,531.04,439.51,539.00,"/F15",8.97,"metus nibh nam ante praesent nostra. Aliquet netus adipiscing sociosqu orci mus."
62.13,499.41,290.81,507.37,"/F19",8.97,"PRETIUM CURAE UT ORNARE DIGNISSIM."
63.96,468.09,298.88,476.94,"/F8",9.96,"Rhoncus fusce ad vitae lacus. Gravida metus ac ante"
54.00,456.14,298.85,464.98,"/F8",9.96,"hymenaeos in velit ut a. Blandit porta urna a vitae mi"
54.00,444.18,298.83,453.03,"/F8",9.96,"mattis morbi in torquent lobortis ac quam pulvinar. Iac-"
54.00,432.23,298.80,441.07,"/F8",9.96,"ulis justo. Euismod lacus iaculis eu arcu ac tincidunt tris-"
54.00,420.27,298.80,429.12,"/F8",9.96,"tique. Posuere metus. Blandit netus elit viverra. Lacinia"
54.00,408.32,298.83,417.16,"/F8",9.96,"ipsum. Pretium felis netus etiam nibh mus etiam viva-"
54.00,396.36,298.84,405.21,"/F8",9.96,"mus dapibus. Iaculis dolor quam hendrerit rutrum a fau-"
54.00,384.41,298.86,393.25,"/F8",9.96,"cibus nec. Vivamus fusce mus lacinia a suspendisse cum"
54.00,372.45,298.86,381.30,"/F8",9.96,"tempus inceptos fusce ac nunc eros. Dapibus dolor. Cu-"
54.00,360.50,298.83,369.34,"/F8",9.96,"bilia metus. Pretium morbi sed. Sodales proin justo ali-"
54.00,348.54,298.83,357.39,"/F8",9.96,"quet lectus fames neque suscipit. Natoque augue aliquet"
54.00,336.59,298.87,345.43,"/F8",9.96,"posuere. Dapibus morbi class natoque eni ut fames ad"
54.00,324.63,298.87,333.48,"/F8",9.96,"ve. Sodales nulla. Vivamus fames at ac nec at curae ve."
54.00,312.68,298.86,321.52,"/F8",9.96,"Lacinia proin enim condimentum lacinia nam curabitur"
54.00,300.72,298.80,309.57,"/F8",9.96,"sollicitudin adipiscing pede tellus convallis. Egestas pu-"
54.00,288.77,298.85,297.61,"/F8",9.96,"rus odio nullam sagittis duis sem purus nostra tempor."
54.00,276.81,118.53,285.66,"/F8",9.96,"Sodales metus."
63.96,259.86,298.89,268.71,"/F8",9.96,"Egestas donec eros cubilia ipsum enim commodo rhon-"
54.00,247.91,298.87,256.75,"/F8",9.96,"cus duis ut sagittis maecenas magna convallis. Iaculis"
54.00,235.95,298.87,244.80,"/F8",9.96,"ipsum augue congue. Rhoncus curae sed nisl adipiscing"
54.00,224.00,298.85,232.84,"/F8",9.96,"nostra. Pretium curae amet cursus. Egestas felis est"
54.00,212.04,298.83,220.89,"/F8",9.96,"nam at tincidunt dolor sed nunc in enim. Potenti risus"
54.00,200.09,298.84,208.93,"/F8",9.96,"ipsum proin rutrum adipiscing. Integer augue eget proin"
54.00,188.13,298.86,196.98,"/F8",9.96,"dignissim magnis torquent suspendisse. Posuere magna"
54.00,176.18,298.86,185.02,"/F8",9.96,"at tempor conubia natoque bibendum quisque conubia"
54.00,164.22,298.91,173.07,"/F8",9.96,"cras augue pede eros. Sodales lorem leo hac. Commodo"
54.00,152.27,298.84,161.11,"/F8",9.96,"neque. Aliquet porta id a tellus arcu ornare adipiscing"
54.00,140.31,298.88,149.16,"/F8",9.96,"massa quisque eu eget bibendum. Commodo felis enim"
54.00,128.36,298.85,137.20,"/F8",9.96,"integer id neque in etiam. Vivamus vitae eros fames et"
54.00,116.40,298.81,125.25,"/F8",9.96,"mus erat sagittis felis ultricies euismod neque est. Sodales"
317.01,499.21,561.87,508.06,"/F8",9.96,"massa ut. Pretium neque eros sed erat malesuada inter-"
317.01,487.26,561.84,496.11,"/F8",9.96,"dum ad ipsum lectus vestibulum. Cubilia nulla in aenean"
317.01,475.30,561.84,484.15,"/F8",9.96,"eni nam ve torquent nam libero sit id consectetuer ornare"
317.01,463.35,561.85,472.20,"/F8",9.96,"justo convallis tellus cursus ipsum metus nam. Lacinia"
317.01,451.39,561.87,460.24,"/F8",9.96,"velit nunc fames congue leo euismod dictum eget nibh"
317.01,439.44,561.85,448.29,"/F8",9.96,"gravida risus ipsum. Quisque felis. Conubia class nunc"
317.01,427.48,561.89,436.33,"/F8",9.96,"praesent mauris litora fames nonummy. Aliquam massa"
317.01,415.53,561.82,424.38,"/F8",9.96,"nam pede pulvinar senectus laoreet sagittis pellentesque."
317.01,403.57,561.92,412.42,"/F8",9.96,"Commodo risus amet quam in hac ad fusce. Euismod"
317.01,391.62,397.08,400.47,"/F8",9.96,"curae nisl est felis."
341.16,358.12,537.79,366.08,"/F19",8.97,"Quisque fusce sit elit habitant tincidunt a."
326.98,331.70,561.89,340.54,"/F8",9.96,"Pretium metus posuere. Posuere fames pede. Viva-"
317.01,319.74,561.82,328.59,"/F8",9.96,"mus felis sit erat senectus parturient turpis per. Lacinia"
317.01,307.79,561.88,316.63,"/F8",9.96,"donec. Quisque dolor nibh. Rhoncus dolor nec quam"
317.01,295.83,561.83,304.68,"/F8",9.96,"ve venenatis parturient. Vivamus fames nulla dui nibh."
317.01,283.88,561.83,292.72,"/F8",9.96,"Dapibus fames nisi volutpat vel nunc aliquet ipsum nisi."
317.01,271.92,561.88,280.77,"/F8",9.96,"Blandit magna. Viverra ipsum porta. Rhoncus neque."
317.01,259.97,561.85,268.81,"/F8",9.96,"Lacinia curae duis porttitor dui faucibus laoreet. Rhon-"
317.01,248.01,561.87,256.86,"/F8",9.96,"cus justo velit a. Vivamus netus. Conubia metus cras"
317.01,236.06,339.71,244.90,"/F8",9.96,"urna."
351.00,236.06,414.28,244.90,"/F8",9.96,"Lacinia curae."
425.57,236.06,561.88,244.90,"/F8",9.96,"Integer vitae sem risus mollis"
317.01,224.10,561.85,232.95,"/F8",9.96,"montes blandit. Egestas neque nunc metus feugiat sapien"
317.01,212.15,561.84,220.99,"/F8",9.96,"vitae hymenaeos mollis senectus vulputate nisl nam. Ali-"
317.01,200.19,372.70,209.04,"/F8",9.96,"quam porta."
383.21,200.19,561.88,209.04,"/F8",9.96,"Egestas justo non facilisis ipsum etiam"
317.01,188.24,561.88,197.08,"/F8",9.96,"bibendum dolor aenean. Vivamus neque et eu eros. Eu-"
317.01,176.28,536.56,185.13,"/F8",9.96,"ismod felis sem nisl interdum vitae ut tempus per."
326.98,164.22,561.85,173.07,"/F8",9.96,"Cubilia magna cras cubilia ve vitae tincidunt ullamcor-"
317.01,152.27,561.86,161.11,"/F8",9.96,"per vulputate. Egestas metus. Natoque lacus. Gravida"
317.01,140.31,561.87,149.16,"/F8",9.96,"morbi urna tincidunt sociis. Gravida magna ac montes"
317.01,128.36,561.84,137.20,"/F8",9.96,"dis eget habitant facilisis quis dui augue conubia laoreet"
317.01,116.40,561.83,125.25,"/F8",9.96,"aptent id porta tristique. Dapibus fusce gravida montes"
