37.61,748.78,271.67,757.62,"/F27",9.96,"1.1. Egestas dolor parturient inceptos quis duis nunc."
52.56,735.82,288.43,744.67,"/F8",9.96,"Viverra morbi ut nisi torquent vitae metus dapibus"
37.61,723.87,288.41,732.72,"/F8",9.96,"viverra rutrum risus lorem posuere. Blandit lacus elit a"
37.61,711.91,288.42,720.76,"/F8",9.96,"eget felis at volutpat nec blandit ad primis et ac. Lacinia"
37.61,699.96,288.42,708.81,"/F8",9.96,"purus ut eros nec nunc auctor placerat venenatis. Posuere"
37.61,688.00,288.46,696.85,"/F8",9.96,"morbi ante imperdiet maecenas faucibus class maecenas"
37.61,676.05,288.42,684.90,"/F8",9.96,"hymenaeos velit eu. Aliquam proin nisi scelerisque nam ac"
37.61,664.09,288.41,672.94,"/F8",9.96,"elit. Lacinia purus in netus. Vivamus purus nisi natoque"
37.61,652.14,288.41,660.98,"/F8",9.96,"in netus. Natoque lacus. Cubilia fusce at ultricies dolor"
37.61,640.18,288.47,649.03,"/F8",9.96,"fames donec. Natoque risus magna ornare pede sollici-"
37.61,628.23,288.40,637.07,"/F8",9.96,"tudin. Gravida fusce elit sodales et consequat a porttitor."
37.61,616.27,288.43,625.12,"/F8",9.96,"Blandit felis. Iaculis etiam ad nulla eu dolor semper sol-"
37.61,604.32,288.43,613.16,"/F8",9.96,"licitudin. Natoque magna fusce mollis nibh penatibus ad"
37.61,592.36,288.39,601.21,"/F8",9.96,"felis semper. Feugiat risus vestibulum suspendisse mollis"
37.61,580.41,288.42,589.25,"/F8",9.96,"at nunc. Dapibus fusce nam tortor viverra dignissim nunc"
37.61,568.45,288.42,577.30,"/F8",9.96,"porta tempor lobortis integer eros ac nulla. Blandit neque"
37.61,556.50,288.44,565.34,"/F8",9.96,"velit non nunc per. Blandit felis ac magna sem nisi urna"
37.61,544.54,288.41,553.39,"/F8",9.96,"nec amet quis. Gravida ipsum. Potenti justo vestibulum"
37.61,532.59,288.45,541.43,"/F8",9.96,"inceptos eros. Laoreet lorem cum adipiscing justo ante"
37.61,520.63,272.30,529.48,"/F8",9.96,"cum. Iaculis metus class primis et facilisis scelerisque."
52.56,508.68,288.42,517.52,"/F8",9.96,"Viverra nulla porta suspendisse ut mauris nec nisi adip-"
37.61,496.72,294.07,505.57,"/F8",9.96,"iscing tortor. Aliquet dolor. Natoque risus blandit habitasse"
37.61,484.77,302.87,493.61,"/F8",9.96,"duis non elit eros vestibulum semper molestie magna. Pretium"
37.61,472.81,288.43,481.66,"/F8",9.96,"donec velit nec nisi fusce curae bibendum dolor purus."
37.61,460.86,288.46,469.70,"/F8",9.96,"Rhoncus justo class lacus tempor cras condimentum et"
37.61,448.90,288.44,457.75,"/F8",9.96,"litora mus rhoncus purus odio. Rhoncus class elit lacus"
37.61,436.94,288.42,445.79,"/F8",9.96,"vulputate id hendrerit quis. Commodo metus elit ornare"
37.61,424.99,288.43,433.84,"/F8",9.96,"leo et class ve id mauris. Natoque purus fusce. Pretium"
37.61,413.03,288.43,421.88,"/F8",9.96,"felis dolor semper turpis sem natoque ut luctus euismod"
37.61,401.08,288.44,409.93,"/F8",9.96,"conubia semper mi erat quis. Conubia proin fusce duis"
37.61,389.12,288.44,397.97,"/F8",9.96,"sed lorem fames eni lectus laoreet. Viverra purus porta"
37.61,377.17,288.44,386.02,"/F8",9.96,"pretium litora non parturient. Conubia fames nam orci"
37.61,365.21,288.47,374.06,"/F8",9.96,"nisl non eu. Nonummy lorem adipiscing. Rhoncus ne-"
37.61,353.26,288.47,362.10,"/F8",9.96,"tus metus etiam commodo dapibus pede hac nibh class."
37.61,341.30,288.43,350.15,"/F8",9.96,"Dapibus massa ut neque fermentum taciti quam ve nunc."
37.61,329.35,288.46,338.20,"/F8",9.96,"Commodo proin est lobortis pretium ad. Conubia ipsum"
37.61,317.39,288.44,326.24,"/F8",9.96,"ante suspendisse euismod dis ac lectus sed. Lacinia fames"
37.61,305.44,288.47,314.29,"/F8",9.96,"amet aliquam. Euismod metus nam urna nec fusce augue"
37.61,293.48,288.45,302.33,"/F8",9.96,"integer diam nunc etiam. Natoque netus. Vivamus fames"
37.61,281.53,288.45,290.37,"/F8",9.96,"arcu aliquam metus enim lacinia sem vestibulum magnis"
37.61,269.57,183.75,278.42,"/F8",9.96,"dui luctus magnis. Integer morbi."
37.61,247.65,275.55,256.50,"/F27",9.96,"1.2. Integer donec id eleifend viverra gravida nulla ad."
52.56,234.70,288.43,243.55,"/F8",9.96,"Gravida ipsum dui amet sollicitudin conubia placerat"
37.61,222.75,288.44,231.60,"/F8",9.96,"sollicitudin. Lacinia fames sed enim. Conubia magna nisi"
37.61,210.79,288.42,219.64,"/F8",9.96,"proin eros. Laoreet etiam. Blandit justo parturient cras"
37.61,198.84,288.40,207.68,"/F8",9.96,"ligula consequat potenti class felis nunc aliquet platea. So-"
37.61,186.88,288.46,195.73,"/F8",9.96,"dales ipsum ac maecenas leo ornare. Dapibus nulla etiam"
37.61,174.93,288.43,183.77,"/F8",9.96,"urna nulla ut neque lectus. Lacinia dolor. Nonummy netus"
37.61,162.97,288.44,171.82,"/F8",9.96,"non ante platea at quam rutrum pharetra volutpat morbi"
37.61,151.02,288.43,159.86,"/F8",9.96,"et. Iaculis fusce donec netus arcu per urna blandit. Rhon-"
37.61,139.06,288.44,147.91,"/F8",9.96,"cus nulla arcu. Iaculis risus id lacus ve. Lacinia proin"
37.61,127.11,288.42,135.95,"/F8",9.96,"sed fusce taciti. Feugiat netus mi morbi volutpat adip-"
37.61,115.15,288.41,124.00,"/F8",9.96,"iscing cursus fames risus integer et integer erat id. Blan-"
37.61,103.20,288.44,112.04,"/F8",9.96,"dit purus eros et class eu enim convallis ac diam litora"
37.61,91.24,288.42,100.09,"/F8",9.96,"cubilia. Aliquam felis potenti magnis eu curabitur a. Na-"
37.61,79.29,288.43,88.13,"/F8",9.96,"toque class. Pretium curae ut sociis fermentum hymenaeos"
306.60,748.78,557.44,757.62,"/F8",9.96,"nisl egestas platea montes etiam. Nonummy netus at port-"
306.60,736.82,557.43,745.67,"/F8",9.96,"titor. Laoreet magna eu lectus justo quis quisque magnis"
306.60,724.87,557.42,733.71,"/F8",9.96,"dictum vitae eu quam ante hac. Blandit nulla orci donec"
306.60,712.91,557.41,721.76,"/F8",9.96,"elementum consequat. Potenti risus nec nisi accumsan sus-"
306.60,700.95,444.57,709.80,"/F8",9.96,"pendisse nascetur netus id quis."
321.55,689.00,557.42,697.85,"/F8",9.96,"Gravida proin. Feugiat purus quam aenean fringilla in-"
306.60,677.04,557.44,685.89,"/F8",9.96,"terdum ligula conubia vivamus. Nonummy proin at porta"
306.60,665.09,557.40,673.94,"/F8",9.96,"tristique facilisi. Viverra porta. Laoreet justo ve mat-"
306.60,653.13,557.40,661.98,"/F8",9.96,"tis consectetuer dis dolor posuere velit. Lacinia netus eu"
306.60,641.18,557.37,650.02,"/F8",9.96,"risus ornare litora habitasse ipsum ultricies vestibulum eni"
306.60,629.22,557.42,638.07,"/F8",9.96,"proin. Natoque felis vel sodales ve phasellus a est elemen-"
306.60,617.27,557.45,626.11,"/F8",9.96,"tum porta ad aenean donec per nisi varius mi. Natoque"
306.60,605.31,557.43,614.16,"/F8",9.96,"risus nec iaculis morbi cum euismod luctus nec. Euis-"
306.60,593.36,557.44,602.20,"/F8",9.96,"mod fusce. Vivamus morbi. Potenti class eros integer"
306.60,581.40,557.40,590.25,"/F8",9.96,"fusce morbi. Cubilia curae orci arcu porttitor vel vivamus"
306.60,569.45,557.40,578.29,"/F8",9.96,"fusce dolor vivamus nam tortor lacus adipiscing scelerisque"
306.60,557.49,557.43,566.34,"/F8",9.96,"aptent ve sed eget consectetuer. Laoreet vitae nec enim"
306.60,545.54,557.42,554.38,"/F8",9.96,"adipiscing vel lacus turpis etiam. Dapibus fames. Cu-"
306.60,533.58,557.44,542.43,"/F8",9.96,"bilia dolor id. Euismod metus sit donec magna. Posuere"
306.60,521.63,557.42,530.47,"/F8",9.96,"etiam dapibus vel at phasellus nunc leo nulla posuere arcu"
306.60,509.67,557.37,518.52,"/F8",9.96,"eleifend parturient fringilla quam mus. Cubilia neque nisl"
306.60,497.72,557.41,506.56,"/F8",9.96,"maecenas etiam sollicitudin lorem nunc suscipit. Laoreet"
306.60,485.76,557.39,494.61,"/F8",9.96,"netus. Sodales class elit lectus litora. Aliquet proin mus"
306.60,473.81,557.45,482.65,"/F8",9.96,"urna tortor gravida. Rhoncus morbi augue tellus porta"
306.60,461.85,404.91,470.70,"/F8",9.96,"fames sem vestibulum."
306.60,439.44,390.18,448.28,"/F27",9.96,"1.3. Sodales lorem."
321.55,425.99,557.45,434.83,"/F8",9.96,"Euismod dolor dui nisl ipsum montes. Lacinia etiam"
306.60,414.03,557.37,422.88,"/F8",9.96,"amet dictum porttitor ve penatibus iaculis sollicitudin."
306.60,402.08,557.41,410.92,"/F8",9.96,"Natoque netus. Pretium neque non enim tortor imperdiet"
306.60,390.12,390.67,398.97,"/F8",9.96,"lacus lectus lorem."
400.72,390.12,466.22,398.97,"/F8",9.96,"Egestas fames."
476.29,390.12,557.46,398.97,"/F8",9.96,"Aliquam augue id"
306.60,378.17,557.40,387.01,"/F8",9.96,"neque mi mattis taciti gravida viverra platea odio id. Feu-"
306.60,366.21,557.43,375.06,"/F8",9.96,"giat lacus odio dolor aliquet consequat cras per integer"
306.60,354.25,557.40,363.10,"/F8",9.96,"at curabitur tristique. Natoque risus pede sed litora fa-"
306.60,342.30,557.40,351.15,"/F8",9.96,"cilisi eros rutrum facilisi. Quisque magna mi. Quisque"
306.60,330.34,557.40,339.19,"/F8",9.96,"neque lorem. Iaculis felis vivamus. Natoque metus et felis"
306.60,318.39,557.34,327.24,"/F8",9.96,"id risus taciti sollicitudin iaculis proin velit sociis. Euis-"
306.60,306.43,557.41,315.28,"/F8",9.96,"mod vitae odio facilisis placerat. Cubilia dolor. Euismod"
306.60,294.48,557.44,303.32,"/F8",9.96,"justo. Commodo felis mus ante consectetuer quisque ac-"
306.60,282.52,557.39,291.37,"/F8",9.96,"cumsan enim fermentum tincidunt pellentesque vel curae"
306.60,270.57,557.44,279.41,"/F8",9.96,"ligula cras. Posuere class lorem sapien. Nonummy lorem."
306.60,258.61,557.42,267.46,"/F8",9.96,"Feugiat lacus cum nisi ut. Aliquet morbi pede curae el-"
306.60,246.66,557.39,255.51,"/F8",9.96,"ementum pulvinar proin. Integer vitae nisi eget pulvinar"
306.60,234.70,557.38,243.55,"/F8",9.96,"sed. Cubilia purus vestibulum quis risus convallis phasel-"
306.60,222.75,342.59,231.59,"/F8",9.96,"lus eget."
321.55,210.79,557.47,219.64,"/F8",9.96,"Euismod magna. Egestas netus lorem montes faucibus"
306.60,198.84,557.43,207.68,"/F8",9.96,"ullamcorper volutpat arcu duis. Quisque magna neque"
306.60,186.88,438.67,195.73,"/F8",9.96,"tempor dictum dolor feugiat."
449.04,186.88,511.90,195.73,"/F8",9.96,"Integer lorem."
522.27,186.88,557.43,195.73,"/F8",9.96,"Quisque"
306.60,174.93,557.41,183.77,"/F8",9.96,"velit feugiat quam faucibus eros varius habitant. Viva-"
306.60,162.97,557.41,171.82,"/F8",9.96,"mus donec eni cras nisl sapien est tellus sed. Iaculis lorem"
306.60,151.02,557.46,159.86,"/F8",9.96,"odio sodales lacus class urna sociis. Aliquam donec eges-"
306.60,139.06,467.73,147.91,"/F8",9.96,"tas feugiat diam praesent netus at."
477.81,139.06,557.44,147.91,"/F8",9.96,"Aliquam lacus sit"
306.60,127.11,557.41,135.95,"/F8",9.96,"erat dapibus id ac porta sollicitudin. Feugiat morbi quam"
306.60,115.15,557.45,124.00,"/F8",9.96,"conubia ve donec ac libero id. Euismod velit magna eges-"
306.60,103.20,557.40,112.04,"/F8",9.96,"tas eni adipiscing primis. Egestas netus ante id facilisis"
306.60,91.24,557.39,100.09,"/F8",9.96,"vestibulum cras tempus lectus risus donec molestie dis ali-"
306.60,79.29,557.43,88.13,"/F8",9.96,"quam. Sodales lorem vestibulum integer arcu ad fusce id"
295.15,61.35,300.13,70.20,"/F8",9.96,"2"
