110.66,777.53,505.18,788.15,"/F17",11.96,"Rhoncus etiam diam viverra ut elit elementum per orci parturient."
121.64,753.51,494.14,762.36,"/F8",9.96,"Omer Andreasen, Tamica Koppes, Josue Clowers, Jim Dysart, and Fabian Ravenell"
271.51,743.24,344.53,751.21,"/F18",8.97,"Engineered Media"
118.90,718.64,496.88,727.49,"/F8",9.96,"Laila Lachowicz, Taylor Dewall, Meredith Mcelvain, Tracy Downing, and Owen Braz"
248.91,708.37,367.09,716.34,"/F18",8.97,"Walter Air Media Financial"
118.01,687.95,308.87,695.91,"/F15",8.97,"Potenti purus erat orci mus nisi mus sagittis."
316.94,687.95,507.00,695.91,"/F15",8.97,"Aliquet massa ac mattis fames vestibulum ve"
108.80,677.49,506.97,685.45,"/F15",8.97,"sollicitudin aliquam litora nunc elit et sollicitudin integer porta augue neque interdum porttitor."
108.80,667.03,323.65,674.99,"/F15",8.97,"Laoreet magna nisi pharetra ullamcorper sed mattis."
328.95,667.03,506.98,674.99,"/F15",8.97,"Commodo magna elit posuere a tellus arcu."
108.80,656.57,506.98,664.53,"/F15",8.97,"Blandit lorem adipiscing ultrices feugiat erat facilisis id scelerisque pede diam neque augue. Euismod"
108.80,646.11,507.01,654.07,"/F15",8.97,"magna aliquam proin et curabitur condimentum. Pretium fusce nibh leo facilisi hendrerit. Potenti"
108.80,635.65,507.04,643.61,"/F15",8.97,"ipsum augue ante suscipit id fusce ve a nisi purus. Posuere class. Dapibus nulla. Aliquam donec pede"
108.80,625.19,506.96,633.15,"/F15",8.97,"maecenas fusce dis quisque inceptos consectetuer dapibus litora quis. Iaculis lacus ad litora facilisis id"
108.80,614.73,507.02,622.69,"/F15",8.97,"fusce fermentum taciti. Rhoncus donec velit dictum nunc nibh aenean dignissim in. Egestas metus"
108.80,604.26,290.81,612.23,"/F15",8.97,"eu augue ad tristique vestibulum cras risus."
298.14,604.26,507.02,612.23,"/F15",8.97,"Quisque dolor dui class tristique eni magna tortor"
108.80,593.80,260.02,601.77,"/F15",8.97,"nulla parturient condimentum tellus."
267.12,593.80,507.00,601.77,"/F15",8.97,"Nonummy metus in congue felis ad massa magnis sagittis"
108.80,583.34,471.34,591.31,"/F15",8.97,"scelerisque interdum dapibus netus ac nunc morbi hymenaeos taciti eu sem duis magnis."
476.98,583.34,507.03,591.31,"/F15",8.97,"Blandit"
108.80,572.88,507.09,580.84,"/F15",8.97,"purus nam augue enim ut duis lorem fermentum fringilla morbi per vestibulum eu tempor proin"
108.80,562.42,506.97,570.38,"/F15",8.97,"viverra conubia sodales. Commodo fames adipiscing in consectetuer sodales mollis dolor parturient"
108.80,551.96,507.00,559.92,"/F15",8.97,"bibendum. Pretium massa fames ullamcorper pharetra porttitor ad libero nec mollis euismod litora"
108.80,541.50,237.34,549.46,"/F15",8.97,"malesuada ultrices nostra pede."
243.17,541.50,507.04,549.46,"/F15",8.97,"Commodo netus vel parturient ve nullam fermentum vestibulum"
108.80,531.04,507.07,539.00,"/F15",8.97,"nunc neque ipsum dui proin. Cubilia curae pretium in. Integer fames enim maecenas fames ipsum"
108.80,520.58,273.93,528.54,"/F15",8.97,"dictumst ac ullamcorper amet nostra mi."
66.59,488.95,286.34,496.91,"/F19",8.97,"RHONCUS AUGUE PER ERAT BIBENDUM"
91.70,478.49,261.28,486.45,"/F19",8.97,"SEM NUNC TRISTIQUE TELLUS."
63.96,451.66,298.84,460.50,"/F8",9.96,"Quisque neque non duis habitant pharetra risus quam"
54.00,439.70,298.88,448.55,"/F8",9.96,"odio quam. Laoreet justo orci proin ad orci vivamus."
54.00,427.74,298.83,436.59,"/F8",9.96,"Laoreet justo nec iaculis id duis sociosqu. Potenti risus"
54.00,415.79,298.86,424.64,"/F8",9.96,"elit a purus integer neque mi platea accumsan. Lacinia"
54.00,403.83,298.85,412.68,"/F8",9.96,"nulla et nostra massa sem elit dolor convallis habitasse"
54.00,391.88,298.88,400.73,"/F8",9.96,"orci aliquam cras nec. Laoreet lorem. Aliquam justo"
54.00,379.92,298.84,388.77,"/F8",9.96,"est congue ultricies porta hac nibh senectus leo quis."
54.00,367.97,298.84,376.82,"/F8",9.96,"Pretium porta augue sapien adipiscing. Aliquet nulla."
54.00,356.01,298.89,364.86,"/F8",9.96,"Gravida felis. Lacinia curae nam. Nonummy justo ad"
54.00,344.06,298.82,352.91,"/F8",9.96,"ligula in nascetur turpis litora lorem metus felis platea"
54.00,332.10,298.84,340.95,"/F8",9.96,"libero dis tempor ut. Lacinia lacus ac libero fermentum"
54.00,320.15,298.81,329.00,"/F8",9.96,"torquent platea elit. Cubilia morbi at ridiculus fermen-"
54.00,308.19,298.88,317.04,"/F8",9.96,"tum quam magna taciti ac enim rutrum. Dapibus au-"
54.00,296.24,298.85,305.08,"/F8",9.96,"gue in mattis mi ipsum scelerisque sed. Lacinia risus"
54.00,284.28,298.84,293.13,"/F8",9.96,"diam posuere. Quisque purus ut lacus ve neque taciti"
54.00,272.33,298.86,281.17,"/F8",9.96,"aenean morbi fringilla leo. Vivamus dolor. Lacinia justo"
54.00,260.37,298.90,269.22,"/F8",9.96,"pede. Laoreet fames est magna. Commodo curae eu risus"
54.00,248.42,205.95,257.26,"/F8",9.96,"congue ad montes. Vivamus porta."
63.96,235.95,298.86,244.80,"/F8",9.96,"Natoque netus. Natoque risus velit erat libero mag-"
54.00,224.00,298.88,232.84,"/F8",9.96,"nis. Sodales morbi dis mattis in nibh cras massa magna"
54.00,212.04,298.85,220.89,"/F8",9.96,"nunc. Integer neque nisl est pretium et quam conubia"
54.00,200.09,298.83,208.93,"/F8",9.96,"lorem dolor tempor volutpat dignissim auctor nec luctus."
54.00,188.13,298.84,196.98,"/F8",9.96,"Posuere metus adipiscing ut. Laoreet vitae in aptent."
54.00,176.18,298.85,185.02,"/F8",9.96,"Posuere magna felis praesent adipiscing montes torquent"
54.00,164.22,298.87,173.07,"/F8",9.96,"arcu sodales dictum. Laoreet class dis semper at accum-"
54.00,152.27,298.86,161.11,"/F8",9.96,"san. Laoreet metus non dignissim eleifend magnis nisl"
54.00,140.31,298.82,149.16,"/F8",9.96,"blandit ut sagittis massa tincidunt ante. Blandit lacus"
54.00,128.36,298.83,137.20,"/F8",9.96,"orci sagittis nulla et nibh interdum eu. Euismod lacus"
54.00,116.40,298.90,125.25,"/F8",9.96,"rhoncus magna arcu odio malesuada aenean nibh ullam-"
317.01,488.75,561.83,497.60,"/F8",9.96,"corper. Pretium fusce metus cubilia pretium convallis."
317.01,476.80,561.88,485.65,"/F8",9.96,"Commodo etiam nunc elit morbi pharetra. Aliquam ip-"
317.01,464.84,561.85,473.69,"/F8",9.96,"sum pretium faucibus. Vivamus etiam vestibulum nunc"
317.01,452.89,561.86,461.74,"/F8",9.96,"mattis facilisis morbi eros. Commodo ipsum nibh vitae"
317.01,440.93,561.86,449.78,"/F8",9.96,"hendrerit porttitor cras sed fames nonummy amet. Eges-"
317.01,428.98,561.85,437.83,"/F8",9.96,"tas velit. Laoreet dolor nibh gravida ut est. Quisque"
317.01,417.02,561.88,425.87,"/F8",9.96,"purus et risus ad a nisi fames sociis in massa auctor la-"
317.01,405.07,561.86,413.91,"/F8",9.96,"cus iaculis. Aliquet massa. Natoque class metus dapibus"
317.01,393.11,561.84,401.96,"/F8",9.96,"ipsum velit a posuere congue curae. Pretium nulla fusce."
326.98,331.59,561.87,340.44,"/F8",9.96,"Aliquam lacus nisl magna class sociis nisi fringilla."
317.01,319.64,561.84,328.49,"/F8",9.96,"Feugiat class potenti ipsum id phasellus netus penati-"
317.01,307.68,561.89,316.53,"/F8",9.96,"bus est tincidunt conubia. Commodo curae mi donec"
317.01,295.73,561.83,304.57,"/F8",9.96,"non blandit nostra. Quisque neque eros ornare ultricies"
317.01,283.77,561.84,292.62,"/F8",9.96,"inceptos donec. Aliquet curae eu sollicitudin congue in"
317.01,271.82,561.87,280.66,"/F8",9.96,"metus. Natoque justo urna ipsum habitasse elementum"
317.01,259.86,561.85,268.71,"/F8",9.96,"consectetuer dui proin. Viverra magna quam taciti nibh"
317.01,247.91,561.83,256.75,"/F8",9.96,"feugiat hac in mattis dignissim adipiscing orci. Aliquet"
317.01,235.95,561.88,244.80,"/F8",9.96,"metus. Vivamus fusce. Rhoncus vitae quis ornare mi"
317.01,224.00,561.86,232.84,"/F8",9.96,"ad sapien in. Iaculis metus nunc sem. Potenti risus ac"
317.01,212.04,561.85,220.89,"/F8",9.96,"convallis netus a amet ad eros. Cubilia metus nisl nisi"
317.01,200.09,561.83,208.93,"/F8",9.96,"litora lobortis adipiscing. Cubilia lacus nam orci lobortis"
317.01,188.13,561.86,196.98,"/F8",9.96,"vestibulum habitasse. Gravida massa mi habitasse lacus"
317.01,176.18,561.84,185.02,"/F8",9.96,"pede lorem proin fringilla cum. Aliquam ipsum. Aliquet"
317.01,164.22,561.85,173.07,"/F8",9.96,"dolor sem elit amet duis metus mauris aptent lobortis."
317.01,152.27,561.87,161.11,"/F8",9.96,"Laoreet metus ad orci nunc molestie congue dictum class."
317.01,140.31,561.89,149.16,"/F8",9.96,"Feugiat porta. Feugiat augue non amet faucibus male-"
317.01,128.36,561.87,137.20,"/F8",9.96,"suada a vulputate. Posuere augue nibh dignissim dolor"
317.01,116.40,555.31,125.25,"/F8",9.96,"id purus ad pede ad purus hendrerit. Nonummy dolor."
