52.56,748.78,288.45,757.62,"/F8",9.96,"Vivamus dolor erat condimentum natoque mus vestibu-"
37.61,736.82,248.32,745.67,"/F8",9.96,"lum eu porttitor vestibulum commodo nibh et."
256.03,736.82,288.44,745.67,"/F8",9.96,"Sodales"
37.61,724.87,288.46,733.71,"/F8",9.96,"neque fusce leo fusce mollis ve varius eu maecenas cum"
37.61,712.91,69.95,721.76,"/F8",9.96,"feugiat."
78.38,712.91,288.47,721.76,"/F8",9.96,"Gravida magna adipiscing eget magnis eu cur-"
37.61,700.96,143.79,709.80,"/F8",9.96,"sus habitant consequat."
153.82,700.96,217.66,709.80,"/F8",9.96,"Dapibus risus."
227.68,700.96,288.46,709.80,"/F8",9.96,"Commodo la-"
37.61,689.00,261.61,697.85,"/F8",9.96,"cus quis gravida ve dis ante sollicitudin suscipit."
272.09,689.00,288.41,697.85,"/F8",9.96,"Iac-"
37.61,677.04,288.41,685.89,"/F8",9.96,"ulis fusce orci mi porttitor ad dolor scelerisque. Euismod"
37.61,665.09,288.46,673.94,"/F8",9.96,"vitae orci diam amet mus libero dignissim mus orci so-"
37.61,653.13,288.46,661.98,"/F8",9.96,"ciosqu. Laoreet dolor risus sem diam conubia sapien. Po-"
37.61,641.18,288.39,650.03,"/F8",9.96,"suere felis iaculis nisl ut placerat sapien libero porta conse-"
37.61,629.22,288.48,638.07,"/F8",9.96,"quat. Rhoncus curae diam nam nunc erat magna. Integer"
37.61,617.27,84.72,626.11,"/F8",9.96,"etiam orci."
91.03,617.27,288.40,626.11,"/F8",9.96,"Iaculis velit pede vehicula vestibulum ornare"
37.61,605.31,288.42,614.16,"/F8",9.96,"ut sapien. Posuere netus nisi eu tempus consectetuer eges-"
37.61,593.36,288.40,602.20,"/F8",9.96,"tas. Viverra justo. Potenti netus cubilia pretium rhoncus"
37.61,581.40,288.46,590.25,"/F8",9.96,"convallis nunc venenatis diam commodo neque class. Non-"
37.61,569.45,288.42,578.29,"/F8",9.96,"ummy risus purus dignissim cursus accumsan class facilisis"
37.61,557.49,82.72,566.34,"/F8",9.96,"penatibus."
89.53,557.49,288.42,566.34,"/F8",9.96,"Rhoncus lacus enim suspendisse pellentesque"
37.61,545.54,288.42,554.38,"/F8",9.96,"euismod nisl. Viverra neque. Pretium justo mus odio vi-"
37.61,533.58,97.29,542.43,"/F8",9.96,"tae eni netus."
103.26,533.58,288.45,542.43,"/F8",9.96,"Commodo etiam eni placerat aliquet class"
37.61,521.63,288.41,530.47,"/F8",9.96,"adipiscing ac habitant sociis. Blandit ipsum justo posuere"
37.61,509.67,288.39,518.52,"/F8",9.96,"habitant turpis eget. Potenti proin id sociosqu pretium in"
37.61,497.72,68.29,506.56,"/F8",9.96,"aptent."
52.56,485.76,211.71,494.61,"/F8",9.96,"Blandit vitae adipiscing scelerisque."
219.90,485.76,288.42,494.61,"/F8",9.96,"Natoque purus."
37.61,473.81,96.72,482.65,"/F8",9.96,"Integer dolor."
102.48,473.81,288.45,482.65,"/F8",9.96,"Aliquam massa hac habitant potenti fusce"
37.61,461.85,103.34,470.70,"/F8",9.96,"etiam vel orci."
113.43,461.85,288.46,470.70,"/F8",9.96,"Nonummy metus sed eros lacus volut-"
37.61,449.90,76.37,458.74,"/F8",9.96,"pat eros."
84.00,449.90,219.79,458.74,"/F8",9.96,"Integer proin nisi ullamcorper."
227.42,449.90,288.42,458.74,"/F8",9.96,"Feugiat purus"
37.61,437.94,208.86,446.79,"/F8",9.96,"est quam vestibulum montes eleifend."
219.07,437.94,288.43,446.79,"/F8",9.96,"Euismod ipsum"
37.61,425.99,288.39,434.83,"/F8",9.96,"nibh ornare vestibulum velit feugiat fusce ut. Sodales vi-"
37.61,414.03,288.42,422.88,"/F8",9.96,"tae amet euismod ut at tincidunt ullamcorper sit platea"
37.61,402.08,110.12,410.92,"/F8",9.96,"pretium sodales."
118.53,402.08,218.59,410.92,"/F8",9.96,"Dapibus massa metus."
226.99,402.08,288.45,410.92,"/F8",9.96,"Natoque risus"
37.61,390.12,288.42,398.97,"/F8",9.96,"eu. Pretium lorem etiam duis. Feugiat risus ante mi amet"
37.61,378.17,288.43,387.01,"/F8",9.96,"donec ut imperdiet massa ve risus imperdiet amet. Conu-"
37.61,366.21,288.46,375.06,"/F8",9.96,"bia curae orci nascetur a pharetra erat sem montes rhon-"
37.61,354.26,161.96,363.10,"/F8",9.96,"cus iaculis maecenas auctor."
168.31,354.26,288.44,363.10,"/F8",9.96,"Integer dolor quam ultrices"
37.61,342.30,288.45,351.15,"/F8",9.96,"cum consectetuer primis odio. Conubia fames in ac enim"
37.61,330.34,183.26,339.19,"/F8",9.96,"ve malesuada integer montes mi."
190.23,330.34,288.45,339.19,"/F8",9.96,"Egestas nulla dui duis"
37.61,318.39,288.44,327.24,"/F8",9.96,"magna nonummy habitasse primis ultrices. Egestas purus"
37.61,306.43,288.39,315.28,"/F8",9.96,"nec eros tempus fringilla quisque pellentesque vulputate"
37.61,294.48,288.40,303.33,"/F8",9.96,"tellus cum parturient consequat metus placerat eu vitae."
37.61,282.52,288.38,291.37,"/F8",9.96,"Viverra dolor eu taciti sollicitudin hymenaeos tortor tellus."
37.61,270.57,288.43,279.42,"/F8",9.96,"Dapibus purus in sapien augue dapibus. Cubilia lorem id"
37.61,258.61,288.46,267.46,"/F8",9.96,"duis netus odio conubia duis ad. Sodales lorem mus massa"
37.61,246.66,61.10,255.51,"/F8",9.96,"nunc."
37.61,224.24,231.30,233.09,"/F27",9.96,"1.2. Quisque risus adipiscing in sollicitudin."
52.56,210.79,288.43,219.64,"/F8",9.96,"Vivamus risus. Iaculis vitae. Viverra magna et fringilla"
37.61,198.84,288.46,207.68,"/F8",9.96,"mi magnis. Dapibus lorem dolor fusce molestie nam con-"
37.61,186.88,113.15,195.73,"/F8",9.96,"sectetuer aenean."
120.00,186.88,288.44,195.73,"/F8",9.96,"Integer donec nibh ornare primis con-"
37.61,174.93,261.46,183.77,"/F8",9.96,"sequat conubia cursus risus tempor dapibus lectus."
267.13,174.93,288.43,183.77,"/F8",9.96,"Non-"
37.61,162.97,248.86,171.82,"/F8",9.96,"ummy porta cras vehicula nostra aliquam nam."
255.67,162.97,288.47,171.82,"/F8",9.96,"Laoreet"
37.61,151.02,288.46,159.86,"/F8",9.96,"massa nisl non ad dapibus quam ut arcu eleifend tempor"
37.61,139.06,288.43,147.91,"/F8",9.96,"parturient. Viverra donec class dui. Commodo proin nulla"
37.61,127.11,288.43,135.95,"/F8",9.96,"urna integer at nostra eu praesent mollis magnis est. Blan-"
37.61,115.15,216.18,124.00,"/F8",9.96,"dit metus purus dis facilisis nec quisque."
221.95,115.15,288.42,124.00,"/F8",9.96,"Rhoncus augue"
37.61,103.20,235.84,112.04,"/F8",9.96,"urna velit viverra consequat luctus inceptos."
243.62,103.20,288.42,112.04,"/F8",9.96,"Nonummy"
37.61,91.24,130.68,100.09,"/F8",9.96,"metus vestibulum at."
136.90,91.24,288.39,100.09,"/F8",9.96,"Dapibus nulla eros enim velit tris-"
37.61,79.29,288.42,88.13,"/F8",9.96,"tique adipiscing blandit nunc eu eget condimentum eges-"
306.60,748.78,441.59,757.62,"/F8",9.96,"tas massa curae taciti dictum."
448.82,748.78,557.43,757.62,"/F8",9.96,"Posuere curae adipiscing"
306.60,736.82,444.43,745.67,"/F8",9.96,"ullamcorper montes ve semper."
451.28,736.82,557.44,745.67,"/F8",9.96,"Egestas morbi ve ipsum"
306.60,724.87,503.03,733.71,"/F8",9.96,"dignissim in vulputate netus lobortis massa."
509.98,724.87,557.41,733.71,"/F8",9.96,"Feugiat la-"
306.60,712.91,454.19,721.76,"/F8",9.96,"cus viverra vulputate eu enim in."
460.53,712.91,557.40,721.76,"/F8",9.96,"Potenti etiam posuere"
306.60,700.95,557.41,709.80,"/F8",9.96,"orci consectetuer torquent risus eu porta mollis ac ut. Ia-"
306.60,689.00,557.41,697.85,"/F8",9.96,"culis curae. Iaculis dolor metus per eget adipiscing sapien"
306.60,677.04,376.45,685.89,"/F8",9.96,"volutpat massa."
384.39,677.04,511.43,685.89,"/F8",9.96,"Vivamus fusce nisl ligula at."
519.37,677.04,557.44,685.89,"/F8",9.96,"Euismod"
306.60,665.09,557.43,673.94,"/F8",9.96,"fames donec nonummy id praesent sit eros vulputate eget"
306.60,653.13,490.82,661.98,"/F8",9.96,"sit euismod vehicula duis. Pretium metus."
321.55,641.18,557.40,650.02,"/F8",9.96,"Quisque curae adipiscing vehicula nunc mattis vestibu-"
306.60,629.22,557.40,638.07,"/F8",9.96,"lum. Gravida etiam eni nibh senectus justo felis enim ip-"
306.60,617.27,327.12,626.11,"/F8",9.96,"sum."
334.30,617.27,401.52,626.11,"/F8",9.96,"Pretium fames."
408.69,617.27,557.48,626.11,"/F8",9.96,"Commodo class sem neque morbi"
306.60,605.31,391.88,614.16,"/F8",9.96,"varius pellentesque."
398.02,605.31,557.41,614.16,"/F8",9.96,"Vivamus class sem urna ve netus ut"
306.60,593.36,557.40,602.20,"/F8",9.96,"ligula facilisi habitant pretium ante. Lacinia donec mi urna"
306.60,581.40,557.42,590.25,"/F8",9.96,"ligula. Gravida magna erat tortor morbi habitant duis ve-"
306.60,569.45,374.21,578.29,"/F8",9.96,"hicula proin in."
380.50,569.45,447.62,578.29,"/F8",9.96,"Pretium donec."
453.91,569.45,518.65,578.29,"/F8",9.96,"Posuere lorem."
524.93,569.45,557.41,578.29,"/F8",9.96,"Blandit"
306.60,557.49,557.43,566.34,"/F8",9.96,"justo nonummy pede nunc dapibus ad nisl mollis elemen-"
306.60,545.54,327.06,554.38,"/F8",9.96,"tum."
335.22,545.54,445.27,554.38,"/F8",9.96,"Posuere felis vestibulum."
453.43,545.54,557.42,554.38,"/F8",9.96,"Lacinia vitae odio arcu"
306.60,533.58,557.45,542.43,"/F8",9.96,"donec lacus non enim maecenas dolor at a diam felis. Euis-"
306.60,521.63,557.39,530.47,"/F8",9.96,"mod justo. Potenti risus mi neque faucibus in suspendisse."
306.60,509.67,513.63,518.52,"/F8",9.96,"Dapibus proin enim potenti congue orci tellus."
520.36,509.67,557.41,518.52,"/F8",9.96,"Aliquam"
306.60,497.72,557.42,506.56,"/F8",9.96,"curae nibh morbi neque euismod cras orci phasellus in id"
306.60,485.76,366.68,494.61,"/F8",9.96,"diam ultrices."
373.62,485.76,557.40,494.61,"/F8",9.96,"Natoque curae nisl litora penatibus pulv-"
306.60,473.81,557.40,482.65,"/F8",9.96,"inar justo et curae class a tellus. Pretium augue nisi per a."
306.60,461.85,557.42,470.70,"/F8",9.96,"Gravida massa. Rhoncus augue netus torquent purus velit"
306.60,449.90,557.41,458.74,"/F8",9.96,"fusce sodales. Blandit ipsum hac quam vestibulum primis"
306.60,437.94,377.84,446.79,"/F8",9.96,"netus dignissim."
386.48,437.94,557.41,446.79,"/F8",9.96,"Blandit felis eget ipsum condimentum"
306.60,425.99,396.25,434.83,"/F8",9.96,"nec ligula accumsan."
306.60,396.10,494.74,404.94,"/F17",9.96,"2. Rhoncus morbi cras faucibus arcu."
321.55,375.18,557.45,384.02,"/F8",9.96,"Aliquam neque in a duis class quisque commodo risus."
306.60,363.22,557.39,372.07,"/F8",9.96,"Cubilia neque eni parturient varius sociosqu vestibulum"
306.60,351.27,489.56,360.11,"/F8",9.96,"montes duis orci dolor porttitor ve nisl."
499.63,351.27,557.42,360.11,"/F8",9.96,"Integer dolor"
306.60,339.31,557.42,348.16,"/F8",9.96,"urna potenti tempor nibh ad urna sociis elit mi fusce. Na-"
306.60,327.36,557.43,336.20,"/F8",9.96,"toque morbi enim nullam ve platea a adipiscing. Rhoncus"
306.60,315.40,557.40,324.25,"/F8",9.96,"porta ad sed nibh nisl enim vitae vulputate vestibulum"
306.60,303.45,557.40,312.29,"/F8",9.96,"elit donec aliquam semper pede elit. Sodales velit enim ac"
306.60,291.49,557.42,300.34,"/F8",9.96,"venenatis metus dapibus rhoncus dignissim eget. Rhoncus"
306.60,279.53,557.44,288.38,"/F8",9.96,"purus pede aliquam odio augue libero. Posuere lacus amet"
306.60,267.58,557.39,276.43,"/F8",9.96,"sociis ad suscipit mus in. Laoreet fusce parturient. Feugiat"
306.60,255.62,557.44,264.47,"/F8",9.96,"fusce. Potenti porta ad sociis mi eu ac diam curae et. Cu-"
306.60,243.67,557.41,252.52,"/F8",9.96,"bilia fusce dolor nonummy platea libero consequat eleifend"
306.60,231.71,328.14,240.56,"/F8",9.96,"velit."
334.65,231.71,557.43,240.56,"/F8",9.96,"Aliquam magna arcu in habitant odio laoreet nec."
306.60,219.76,557.41,228.61,"/F8",9.96,"Sodales purus ut morbi id ligula aenean. Iaculis proin nisi"
306.60,207.80,557.48,216.65,"/F8",9.96,"sem interdum malesuada a dis. Commodo ipsum eros ia-"
306.60,195.85,423.86,204.70,"/F8",9.96,"culis a scelerisque nam eu."
430.04,195.85,557.46,204.70,"/F8",9.96,"Commodo justo morbi lorem"
306.60,183.89,453.36,192.74,"/F8",9.96,"odio hac pede commodo nisl sit."
461.66,183.89,527.87,192.74,"/F8",9.96,"Laoreet ipsum."
536.18,183.89,557.48,192.74,"/F8",9.96,"Non-"
306.60,171.94,456.29,180.79,"/F8",9.96,"ummy neque nunc mus curabitur."
462.79,171.94,557.42,180.79,"/F8",9.96,"Iaculis etiam pretium"
306.60,159.98,500.95,168.83,"/F8",9.96,"tellus. Sodales purus. Iaculis porta id quam."
321.55,148.03,557.44,156.87,"/F8",9.96,"Egestas lorem cras. Conubia dolor mi auctor tristique"
306.60,136.07,557.40,144.92,"/F8",9.96,"in mi nibh in nisi. Posuere neque ut justo id eu erat porta"
306.60,124.12,557.39,132.96,"/F8",9.96,"mattis lacus dui eros vestibulum at consectetuer quisque."
306.60,112.16,557.46,121.01,"/F8",9.96,"Aliquam dolor cras lorem tempus proin commodo. Integer"
306.60,100.21,557.46,109.05,"/F8",9.96,"netus massa arcu hac arcu purus conubia. Aliquet magna"
306.60,88.25,321.52,97.10,"/F8",9.96,"vel."
330.52,88.25,408.86,97.10,"/F8",9.96,"Integer ipsum ut."
417.87,88.25,557.45,97.10,"/F8",9.96,"Pretium magna eu diam lorem"
295.15,61.35,300.13,70.20,"/F8",9.96,"2"
